,CASE_ENQUIRY_ID,OPEN_DT,TARGET_DT,CLOSED_DT,OnTime_Status,CASE_STATUS,CLOSURE_REASON,CASE_TITLE,SUBJECT,REASON,TYPE,QUEUE,Department,SubmittedPhoto,ClosedPhoto,Location,fire_district,pwd_district,city_council_district,police_district,neighborhood,neighborhood_services_district,ward,precinct,land_usage,LOCATION_STREET_NAME,LOCATION_ZIPCODE,Property_Type,Property_ID,LATITUDE,LONGITUDE,Source,Geocoded_Location
470274,101001241928,01/04/2015 01:42:03 PM,,01/05/2015 02:34:34 PM,ONTIME,Closed,Case Closed Case Noted Dirty water due to water main  shut down @ 135 Commonwealth Ave and let back on 1/4/15,General Request,Boston Water & Sewer Commission,Administrative & General Requests,BWSC General Request,BWSC_All Cases,BWSC,,,123 Commonwealth Ave  Boston  MA  02116,4.0,1C,8.0,D4,Back Bay,14.0,Ward 5,507.0,A,123 Commonwealth Ave,2116.0,Address,37124.0,42.3525,-71.0775,Constituent Call,"(42.3525, -71.0775)"
471860,101001244208,01/08/2015 12:33:29 PM,,01/08/2015 02:43:59 PM,ONTIME,Closed,Case Closed Case Resolved LEAK DETECTION FOUND NO LEAK  TOOK SAMPLE  CAME BACK GROUNDWATER. HYDRANTS OK,General Request,Boston Water & Sewer Commission,Administrative & General Requests,BWSC General Request,BWSC_All Cases,BWSC,,,INTERSECTION of Harleston St & Parker Hill Ave  Mission Hill  MA,9.0,10A,8.0,B2,Mission Hill,14.0,Ward 10,1005.0,,INTERSECTION Harleston St & Parker Hill Ave,,Intersection,5640.0,42.3288,-71.1023,Constituent Call,"(42.3288, -71.1023)"
472598,101001245258,01/10/2015 09:23:35 AM,,01/12/2015 02:04:37 PM,ONTIME,Closed,Case Closed Case Resolved SHUT OFF SERVICE FROM S/W 1/10,General Request,Boston Water & Sewer Commission,Administrative & General Requests,BWSC General Request,BWSC_All Cases,BWSC,,,22 Edson St  Dorchester  MA  02124,8.0,07,4.0,B3,Dorchester,9.0,Ward 17,1708.0,RL,22 Edson St,2124.0,Address,51333.0,42.2869,-71.0776,Constituent Call,"(42.2869, -71.0776)"
472701,101001245423,01/11/2015 09:10:48 AM,,01/22/2015 12:10:02 PM,ONTIME,Closed,Case Closed Case Resolved Replaced hydrant 1/16,General Request,Boston Water & Sewer Commission,Administrative & General Requests,BWSC General Request,BWSC_All Cases,BWSC,,,18 Prairie St  Mattapan  MA  02126,8.0,07,5.0,B3,Greater Mattapan,9.0,Ward 18,1803.0,R1,18 Prairie St,2126.0,Address,112476.0,42.281,-71.0988,Constituent Call,"(42.281, -71.0988)"
473717,101001246939,01/14/2015 07:37:52 AM,,01/15/2015 11:52:51 AM,ONTIME,Closed,Case Closed Case Resolved Crew here on 1/14/15  Boston Fire had water off inside basement on arrival.,General Request,Boston Water & Sewer Commission,Administrative & General Requests,BWSC General Request,BWSC_All Cases,BWSC,,,INTERSECTION of O'Neil Pl & Winship St  Brighton  MA,11.0,04,9.0,D14,Allston / Brighton,15.0,Ward 22,2203.0,,INTERSECTION O'Neil Pl & Winship St,,Intersection,7680.0,42.347,-71.1519,Constituent Call,"(42.347, -71.1519)"
473897,101001247205,01/14/2015 11:54:08 AM,,01/16/2015 11:13:01 AM,ONTIME,Closed,Case Closed Case Resolved LUTO(LEAKING FIRE PIPE)  FOR 26 WORCESTER ST OWNER NOTIFIED AND PROPERTY POSTED 1/16,General Request,Boston Water & Sewer Commission,Administrative & General Requests,BWSC General Request,BWSC_All Cases,BWSC,,,INTERSECTION of Washington St & W Springfield St  Roxbury  MA,4.0,1C,2.0,D4,South End,6.0,Ward 8,802.0,,INTERSECTION Washington St & W Springfield St,,Intersection,6047.0,42.337,-71.0763,Constituent Call,"(42.337, -71.0763)"
474938,101001248743,01/16/2015 03:05:18 PM,,01/22/2015 12:10:40 PM,ONTIME,Closed,Case Closed Case Resolved This was a leak on fire pipe @ 26 Worcester St @ West Springfield. Owners contractor repaired 1/20/15,General Request,Boston Water & Sewer Commission,Administrative & General Requests,BWSC General Request,BWSC_All Cases,BWSC,,,100 W Springfield St  Roxbury  MA  02118,4.0,1C,7.0,D4,South End,6.0,Ward 9,902.0,R3,100 W Springfield St,2118.0,Address,129908.0,42.3375,-71.0772,Constituent Call,"(42.3375, -71.0772)"
475147,101001249046,01/17/2015 06:41:02 PM,,01/27/2015 11:29:43 AM,ONTIME,Closed,Case Closed Case Resolved Dug and found leak is up to owner 1/22 sent notice to owner,General Request,Boston Water & Sewer Commission,Administrative & General Requests,BWSC General Request,BWSC_All Cases,BWSC,,,199 Beech St  Roslindale  MA  02131,12.0,06,5.0,E5,Roslindale,10.0,Ward 20,2008.0,R1,199 Beech St,2131.0,Address,13149.0,42.2818,-71.1429,Constituent Call,"(42.2818, -71.1429)"
475192,101001249110,01/18/2015 09:48:38 AM,,01/27/2015 11:30:13 AM,ONTIME,Closed,Case Closed Case Resolved Dug and repaired leak 1/21,General Request,Boston Water & Sewer Commission,Administrative & General Requests,BWSC General Request,BWSC_All Cases,BWSC,,,413 E Eighth St  South Boston  MA  02127,6.0,05,2.0,C6,South Boston / South Boston Waterfront,5.0,Ward 7,703.0,CM,413 E Eighth St,2127.0,Address,52141.0,42.3312,-71.0445,Constituent Call,"(42.3312, -71.0445)"
475204,101001249128,01/18/2015 11:33:43 AM,,01/20/2015 11:33:46 AM,ONTIME,Closed,Case Closed Case Resolved BWSC lines down and running  crew spoke with owner  internal issue 1/18/15,General Request,Boston Water & Sewer Commission,Administrative & General Requests,BWSC General Request,BWSC_All Cases,BWSC,,,61 I St  South Boston  MA  02127,6.0,05,2.0,C6,South Boston / South Boston Waterfront,5.0,Ward 6,605.0,R3,61 I St,2127.0,Address,77899.0,42.3361,-71.0401,Constituent Call,"(42.3361, -71.0401)"
477738,101001252851,01/23/2015 04:06:09 PM,,01/27/2015 01:44:46 PM,ONTIME,Closed,Case Closed Case Resolved Crew jetted past connection  BWSC lines are down and running  internal lateral issue 1/23/15,General Request,Boston Water & Sewer Commission,Administrative & General Requests,BWSC General Request,BWSC_All Cases,BWSC,,,149 Webster St  East Boston  MA  02128,1.0,09,1.0,A7,East Boston,1.0,Ward 1,101.0,R3,149 Webster St,2128.0,Address,146776.0,42.3659,-71.0355,Constituent Call,"(42.3659, -71.0355)"
478303,101001253739,01/25/2015 09:10:00 PM,,01/27/2015 11:19:13 AM,ONTIME,Closed,Case Closed Case Noted Crew investigated found no leak  listened on control no noise  called customer no answer  no one at property  1/26,General Request,Boston Water & Sewer Commission,Administrative & General Requests,BWSC General Request,BWSC_All Cases,BWSC,,,114 Fairmount St  Dorchester  MA  02124,8.0,07,3.0,B3,Dorchester,7.0,Ward 17,1712.0,R1,114 Fairmount St,2124.0,Address,55764.0,42.2801,-71.076,Constituent Call,"(42.2801, -71.076)"
478835,101001254820,01/27/2015 10:51:41 AM,,01/28/2015 10:20:20 AM,ONTIME,Closed,Case Closed Case Resolved Shut off inside at valve 1/28.,General Request,Boston Water & Sewer Commission,Administrative & General Requests,BWSC General Request,BWSC_All Cases,BWSC,,,224 Almont St  Mattapan  MA  02126,8.0,07,5.0,B3,Greater Mattapan,9.0,Ward 18,1803.0,R3,224 Almont St,2126.0,Address,2786.0,42.2804,-71.0984,Constituent Call,"(42.2804, -71.0984)"
479195,101001255239,01/27/2015 02:56:15 PM,,01/28/2015 10:21:31 AM,ONTIME,Closed,Case Closed Case Resolved REPLACED MISSING COVER 1/27,General Request,Boston Water & Sewer Commission,Administrative & General Requests,BWSC General Request,BWSC_All Cases,BWSC,,,160 Orange St  Roslindale  MA  02131,12.0,06,5.0,E5,Roslindale,10.0,Ward 20,2009.0,R1,160 Orange St,2131.0,Address,105366.0,42.2805,-71.1398,Constituent Call,"(42.2805, -71.1398)"
480126,101001256282,01/27/2015 08:38:28 PM,,01/28/2015 12:50:32 PM,ONTIME,Closed,Case Closed Case Noted Leak was on second floor bathroom   customer  shut off at meter and called plumber 1/27,General Request,Boston Water & Sewer Commission,Administrative & General Requests,BWSC General Request,BWSC_All Cases,BWSC,,,38 Pratt St  Allston  MA  02134,11.0,04,9.0,D14,Allston / Brighton,15.0,Ward 21,2104.0,R3,38 Pratt St,2134.0,Address,295123.0,42.3553,-71.128,Constituent Call,"(42.3553, -71.128)"
480531,101001256726,01/28/2015 07:01:07 AM,,01/28/2015 10:19:01 AM,ONTIME,Closed,Case Closed Case Resolved Shut off inside at valve 1/28,General Request,Boston Water & Sewer Commission,Administrative & General Requests,BWSC General Request,BWSC_All Cases,BWSC,,,224 Almont St  Mattapan  MA  02126,8.0,07,5.0,B3,Greater Mattapan,9.0,Ward 18,1803.0,R3,224 Almont St,2126.0,Address,177138.0,42.2804,-71.0984,Constituent Call,"(42.2804, -71.0984)"
484389,101001261613,01/29/2015 11:55:38 AM,,01/30/2015 01:08:04 PM,ONTIME,Closed,Case Closed Case Noted BWSC line down & running 1/29 Met owner on site stated plumber snaked out to private contractor?s trench where lateral appears to be broken. Contractor notified and will dig.,General Request,Boston Water & Sewer Commission,Administrative & General Requests,BWSC General Request,BWSC_All Cases,BWSC,,,148 Webster St  East Boston  MA  02128,1.0,09,1.0,A7,East Boston,1.0,Ward 1,101.0,R3,148 Webster St,2128.0,Address,333428.0,42.3662,-71.0355,Constituent Call,"(42.3662, -71.0355)"
492686,101001273559,02/04/2015 09:27:00 AM,,05/11/2015 05:07:32 PM,ONTIME,Closed,Case Closed. Closed date : 2015-05-11 17:07:32.837 Case Noted Snow removal completed,General Request,Boston Water & Sewer Commission,Administrative & General Requests,BWSC General Request,BWSC_All Cases,BWSC,,,15 Greenwood St  Dorchester  MA  02121,7.0,03,4.0,B3,Greater Mattapan,8.0,Ward 14,1406.0,R3,15 Greenwood St,2121.0,Address,66971.0,42.3016,-71.0798,Constituent Call,"(42.3016, -71.0798)"
495060,101001277214,02/05/2015 09:10:47 AM,,02/27/2015 02:47:32 PM,ONTIME,Closed,Case Closed Case Noted WE CHECKED THE INTERSECTION & DIDN'T FIND ANY FLOODS.  NO PROBLEM FOUND. 2/25,General Request,Boston Water & Sewer Commission,Administrative & General Requests,BWSC General Request,BWSC_All Cases,BWSC,,,INTERSECTION of Atlantic Ave & Seaport Blvd  Boston  MA,6.0,1C,1.0,A1,Downtown / Financial District,3.0,Ward 3,306.0,,INTERSECTION Atlantic Ave & Seaport Blvd,,Intersection,740.0,42.3547,-71.0515,Constituent Call,"(42.3547, -71.0515)"
498407,101001282422,02/08/2015 01:31:15 PM,,10/13/2015 11:00:26 AM,ONTIME,Closed,Case Closed. Closed date : 2015-10-13 11:00:26.193 Case Resolved Thank you for your request. We apologize for the time that it has taken to respond to this case. If this issue persists  please resubmit your case or call 311 to speak to an agent.,General Request,Boston Water & Sewer Commission,Administrative & General Requests,BWSC General Request,INFO_Reallocation From Dept,INFO,,,56 Humphreys St  Dorchester  MA  02125,7.0,03,7.0,B2,Dorchester,13.0,Ward 7,710.0,R2,56 Humphreys St,2125.0,Address,76089.0,42.3187,-71.0674,Constituent Call,"(42.3187, -71.0674)"
507219,101001294916,02/14/2015 12:51:22 PM,,02/17/2015 09:21:52 AM,ONTIME,Closed,Case Closed Case Resolved SHUT OFF FROM INSIDE 2/14,General Request,Boston Water & Sewer Commission,Administrative & General Requests,BWSC General Request,BWSC_All Cases,BWSC,,,241 Walnut Ave  Roxbury  MA  02119,9.0,10B,7.0,B2,Roxbury,13.0,Ward 11,1103.0,A,241 Walnut Ave,2119.0,Address,141915.0,42.3186,-71.0913,Constituent Call,"(42.3186, -71.0913)"
508120,101001296077,02/15/2015 02:57:55 PM,,02/17/2015 09:18:34 AM,ONTIME,Closed,Case Closed Case Resolved SEWER LINE D/R ON ARRIVAL NO ODOR FOUND  CALLER CAME OUT AND SHOWED US AN AREA OF MELTING SNOW AT 11ECB45 NO SEWER PROBLEMS HERE. 2/15,General Request,Boston Water & Sewer Commission,Administrative & General Requests,BWSC General Request,BWSC_All Cases,BWSC,,,92 Newburg St  Roslindale  MA  02131,12.0,06,5.0,E5,Roslindale,10.0,Ward 20,2008.0,R1,92 Newburg St,2131.0,Address,101306.0,42.2837,-71.1407,Constituent Call,"(42.2837, -71.1407)"
509282,101001297411,02/16/2015 09:32:56 AM,,02/17/2015 09:22:32 AM,ONTIME,Closed,Case Closed Case Resolved NO WATER  PIPE FROZEN INSIDE  OWNER WILL THAW 2/16,General Request,Boston Water & Sewer Commission,Administrative & General Requests,BWSC General Request,BWSC_All Cases,BWSC,,,911 E Second St  South Boston  MA  02127,6.0,05,2.0,C6,South Boston / South Boston Waterfront,5.0,Ward 6,609.0,R2,911 E Second St,2127.0,Address,308403.0,42.3373,-71.0268,Constituent Call,"(42.3373, -71.0268)"
510235,101001298572,02/16/2015 02:33:15 PM,,09/30/2015 12:16:46 PM,ONTIME,Closed,Case Closed. Closed date : 2015-09-30 12:16:46.77 Case Resolved Thank you for your request. We apologize for the time that it has taken to respond to this case.  If this issue persists  please resubmit your case or call 311 to speak to an agent.,General Request,Boston Water & Sewer Commission,Administrative & General Requests,BWSC General Request,INFO_Reallocation From Dept,INFO,,,79 Dale St  Roxbury  MA  02119,7.0,10B,7.0,B2,Roxbury,13.0,Ward 12,1203.0,R3,79 Dale St,2119.0,Address,221831.0,42.3218,-71.0865,Constituent Call,"(42.3218, -71.0865)"
511523,101001300260,02/17/2015 08:55:00 AM,,08/25/2015 10:35:12 AM,ONTIME,Closed,Case Closed. Closed date : 2015-08-25 10:35:12.14 Case Noted THIS IS AN OLD REQ  CALLED CUSTOMER LEFT MESSAGE. PER STAR SYSTEM WATER IS ON AND SHOWING CONSUMPTION,General Request,Boston Water & Sewer Commission,Administrative & General Requests,BWSC General Request,BWSC_All Cases,BWSC,,,410 W Second St  South Boston  MA  02127,6.0,05,2.0,C6,South Boston / South Boston Waterfront,5.0,Ward 6,604.0,R1,410 W Second St,2127.0,Address,124723.0,42.3375,-71.0449,Constituent Call,"(42.3375, -71.0449)"
511838,101001300722,02/17/2015 10:42:01 AM,,02/18/2015 09:14:37 AM,ONTIME,Closed,Case Closed Case Noted CHANGED WATER METER  INSIDE CONTROL IS FROZEN  PIPE ON INSIDE IS FROZEN. 2/17,General Request,Boston Water & Sewer Commission,Administrative & General Requests,BWSC General Request,BWSC_All Cases,BWSC,,,80 Hamilton St  Dorchester  MA  02125,7.0,03,3.0,C11,Dorchester,8.0,Ward 15,1503.0,E,80 Hamilton St,2125.0,Address,68489.0,42.308,-71.0691,Constituent Call,"(42.308, -71.0691)"
515122,101001305437,02/18/2015 08:33:44 PM,,02/24/2015 01:34:40 PM,ONTIME,Closed,Case Closed Case Resolved DUG & THAWED 2/19 WATER RESTORED,General Request,Boston Water & Sewer Commission,Administrative & General Requests,BWSC General Request,BWSC_All Cases,BWSC,,,172-174 Franklin St  Allston  MA  02134,11.0,04,9.0,D14,Allston / Brighton,15.0,Ward 22,2202.0,R2,172-174 Franklin St,2134.0,Address,60620.0,42.3618,-71.1311,Constituent Call,"(42.3618, -71.1311)"
515176,101001305536,02/18/2015 10:17:46 PM,,02/19/2015 11:08:46 AM,ONTIME,Closed,Case Closed Case Resolved SHUT OFF @ SIDEWALK 2/18,General Request,Boston Water & Sewer Commission,Administrative & General Requests,BWSC General Request,BWSC_All Cases,BWSC,,,155-163 Border St  East Boston  MA  02128,1.0,09,1.0,A7,East Boston,1.0,01,104.0,,155-163 Border St,2128.0,Address,343959.0,42.3738,-71.0403,Constituent Call,"(42.3738, -71.0403)"
519500,101001311974,02/23/2015 10:15:59 AM,,02/24/2015 08:32:16 AM,ONTIME,Closed,Case Closed Case Resolved CLEARED SNOW OFF CB STILL SOME WATER DUE TO LAY OF THE LAND 2/23,General Request,Boston Water & Sewer Commission,Administrative & General Requests,BWSC General Request,BWSC_All Cases,BWSC,,,60 E Springfield St  Roxbury  MA  02118,4.0,1C,2.0,D4,Roxbury,6.0,08,802.0,RC,60 E Springfield St,2118.0,Address,129907.0,42.3357,-71.0745,Constituent Call,"(42.3357, -71.0745)"
522221,101001315972,02/25/2015 12:17:00 PM,,05/13/2015 09:49:22 AM,ONTIME,Closed,Case Closed. Closed date : 2015-05-13 09:49:22.087 Case Noted Customer called Customer Service Dept  they advised her to have a plumber check inside pipes 2/25/15,General Request,Boston Water & Sewer Commission,Administrative & General Requests,BWSC General Request,BWSC_All Cases,BWSC,,,14 Crestway Rd  East Boston  MA  02128,1.0,09,1.0,A7,East Boston,1.0,Ward 1,113.0,R1,14 Crestway Rd,2128.0,Address,44392.0,42.3925,-71.0057,Constituent Call,"(42.3925, -71.0057)"
523432,101001317673,02/26/2015 12:03:55 PM,,02/27/2015 11:55:48 AM,ONTIME,Closed,Case Closed Case Resolved JETTED LINE 150' PAST CONNECTION  D/R ON ARRIVAL & DEPARTURE 2/26,General Request,Boston Water & Sewer Commission,Administrative & General Requests,BWSC General Request,BWSC_All Cases,BWSC,,,387 Faneuil St  Brighton  MA  02135,11.0,04,9.0,D14,Allston / Brighton,15.0,Ward 22,2207.0,R1,387 Faneuil St,2135.0,Address,56285.0,42.3518,-71.1665,Constituent Call,"(42.3518, -71.1665)"
523789,101001318200,02/26/2015 04:43:27 PM,,03/19/2015 02:42:01 PM,ONTIME,Closed,Case Closed Case Resolved LOCATED AND SHOVELED OUT CB  ALL SET 3/17,General Request,Boston Water & Sewer Commission,Administrative & General Requests,BWSC General Request,BWSC_All Cases,BWSC,,,70-72 Northampton St  Roxbury  MA  02118,7.0,10B,7.0,D4,Roxbury,13.0,Ward 8,803.0,CM,70-72 Northampton St,2118.0,Address,103740.0,42.3347,-71.0764,Constituent Call,"(42.3347, -71.0764)"
525116,101001320245,02/28/2015 07:27:01 PM,,03/02/2015 11:45:55 AM,ONTIME,Closed,Case Closed Case Noted SEWAGE WAS COMING OUT OF PRIVATE MH BELONGING TO 52 ELIOT ST ON TO BROADWAY ST ALL BWSC LINES ARE D/R ON ARRIVAL AND DEPARTURE . JETTED 3  SECTIONS   . INTERNAL PROBLEM APPROX.1000 GALLON PRIVATE  SSO. PLUMBER ARRIVED AND FREED INTERNAL BLOCKAGE .(STOPPED OVERFLOW FROM PRIV MH ) . WE  USED 2 GALLONS OF BLEACH  AND FLUSHED S/W GUTTER AND CATCH BASIN. ALL SET. 2/28,General Request,Boston Water & Sewer Commission,Administrative & General Requests,BWSC General Request,BWSC_All Cases,BWSC,,,1 Charles St S  Boston  MA  02116,4.0,1C,2.0,A1,Downtown / Financial District,6.0,Ward 5,501.0,CM,1 Charles St S,2116.0,Address,29331.0,42.3515,-71.0674,Constituent Call,"(42.3515, -71.0674)"
525483,101001320832,03/02/2015 07:38:26 AM,,03/02/2015 10:45:01 AM,ONTIME,Closed,Case Closed Case Resolved CREW S/O INSIDE- BROKEN SPIGOT,General Request,Boston Water & Sewer Commission,Administrative & General Requests,BWSC General Request,BWSC_All Cases,BWSC,,,240 Washington St  Brighton  MA  02135,11.0,04,9.0,D14,Allston / Brighton,15.0,Ward 22,2203.0,R2,240 Washington St,2135.0,Address,143495.0,42.3475,-71.1494,Constituent Call,"(42.3475, -71.1494)"
525591,101001320986,03/02/2015 09:34:09 AM,,03/04/2015 02:45:47 PM,ONTIME,Closed,Case Closed Case Resolved DUG S/W AND STEAMED S/P FROM S/W TO MAIN FREED LINE. WATER ON 3/2,General Request,Boston Water & Sewer Commission,Administrative & General Requests,BWSC General Request,BWSC_All Cases,BWSC,,,46 Cerdan Ave  Roslindale  MA  02132,9.0,06,6.0,E5,West Roxbury,12.0,Ward 20,2006.0,R1,46 Cerdan Ave,2132.0,Address,28509.0,42.2912,-71.1424,Constituent Call,"(42.2912, -71.1424)"
533534,101001332879,03/13/2015 04:45:18 PM,,03/16/2015 03:36:33 PM,ONTIME,Closed,Case Closed Case Resolved CLEAN CB AND RETRIEVED KEYS GAVE BACK TO CUSTOMER . 3/14,General Request,Boston Water & Sewer Commission,Administrative & General Requests,BWSC General Request,BWSC_All Cases,BWSC,,,971 Commonwealth Ave  Boston  MA  02215,11.0,04,8.0,D14,Allston / Brighton,14.0,Ward 21,2102.0,C,971 Commonwealth Ave,2215.0,Address,217849.0,42.352,-71.1196,Constituent Call,"(42.352, -71.1196)"
533723,101001333189,03/14/2015 03:36:35 PM,,03/16/2015 03:37:03 PM,ONTIME,Closed,Case Closed Case Resolved CHECKED LINE BWSC DOWN & RUNNING ON ARRIVAL & DEPARTURE  PREMISE LNE STOPPED ON ARRIVAL  PLUMBER ON SITE FREED PREMISE LINE D/R ON DEPARTURE 3/14,General Request,Boston Water & Sewer Commission,Administrative & General Requests,BWSC General Request,BWSC_All Cases,BWSC,,,186 Bennington St  East Boston  MA  02128,1.0,09,1.0,A7,East Boston,1.0,Ward 1,106.0,R3,186 Bennington St,2128.0,Address,187375.0,42.3775,-71.0323,Constituent Call,"(42.3775, -71.0323)"
538707,101001340092,03/23/2015 05:04:18 PM,,03/24/2015 10:46:58 AM,ONTIME,Closed,Case Closed Case Resolved BWSC LINE STOPPED 3/23 JETTED AND FREED LINE. PREMISES & BWSC LINES FREE UPON DEPARTURE.,General Request,Boston Water & Sewer Commission,Administrative & General Requests,BWSC General Request,BWSC_All Cases,BWSC,,,14 William Jackson Ave  Brighton  MA  02135,11.0,04,9.0,D14,Allston / Brighton,15.0,Ward 22,2209.0,R1,14 William Jackson Ave,2135.0,Address,149852.0,42.3446,-71.154,Constituent Call,"(42.3446, -71.154)"
539070,101001340588,03/24/2015 11:31:31 AM,,03/26/2015 07:45:02 PM,ONTIME,Closed,Case Closed Case Invalid no eform,General Request,Boston Water & Sewer Commission,Administrative & General Requests,BWSC General Request,INFO_Reallocation From Dept,INFO,,,361 Newbury St  Boston  MA  02115,4.0,1C,8.0,D4,Back Bay,14.0,Ward 5,509.0,C,361 Newbury St,2115.0,Address,155806.0,42.3484,-71.0877,Constituent Call,"(42.3484, -71.0877)"
540119,101001341990,03/25/2015 03:13:44 PM,,04/03/2015 11:11:59 AM,ONTIME,Closed,Case Closed Case Resolved FLUSHED OUT METER 3/31,General Request,Boston Water & Sewer Commission,Administrative & General Requests,BWSC General Request,BWSC_All Cases,BWSC,,,14 Abbot St  Dorchester  MA  02124,7.0,03,4.0,B3,Greater Mattapan,8.0,Ward 14,1407.0,R2,14 Abbot St,2124.0,Address,63.0,42.2973,-71.0859,Constituent Call,"(42.2973, -71.0859)"
543708,101001347055,04/01/2015 02:29:00 PM,,07/28/2015 02:04:26 PM,ONTIME,Closed,Case Closed. Closed date : 2015-07-28 14:04:26.62 Case Resolved LEAK DETECTION INVESTIGATED FOUND NO LEAK OR WATER IN STREET 7/27,General Request,Boston Water & Sewer Commission,Administrative & General Requests,BWSC General Request,BWSC_All Cases,BWSC,,,249 Humboldt Ave  Dorchester  MA  02121,9.0,10B,7.0,B2,Roxbury,13.0,Ward 12,1209.0,A,249 Humboldt Ave,2121.0,Address,76000.0,42.3114,-71.0912,Constituent Call,"(42.3114, -71.0912)"
544600,101001348313,04/02/2015 06:27:42 PM,,04/06/2015 04:11:01 PM,ONTIME,Closed,Case Closed Case Resolved Repaired leaking joint on main 4/4,General Request,Boston Water & Sewer Commission,Administrative & General Requests,BWSC General Request,BWSC_All Cases,BWSC,,,2 Amory St  Roxbury  MA  02119,9.0,10B,6.0,E13,Jamaica Plain,11.0,Ward 11,1104.0,CL,2 Amory St,2119.0,Address,3283.0,42.3204,-71.0996,Constituent Call,"(42.3204, -71.0996)"
546028,101001350286,04/06/2015 02:05:41 PM,,04/07/2015 10:39:10 AM,ONTIME,Closed,Case Closed Case Noted Called Mr. Kelly and apologized for property being posted in error.  Problem resolved.,General Request,Boston Water & Sewer Commission,Administrative & General Requests,BWSC General Request,BWSC_All Cases,BWSC,,,672 Tremont St  Roxbury  MA  02118,4.0,1C,2.0,D4,South End,6.0,Ward 9,901.0,A,672 Tremont St,2118.0,Address,137887.0,42.3413,-71.0761,Constituent Call,"(42.3413, -71.0761)"
546226,101001350555,04/06/2015 09:36:55 PM,,04/13/2015 10:54:26 AM,ONTIME,Closed,Case Closed Case Resolved CREW FOUND NO ODOR ON ARRIVAL  NO ANSWER AT DOOR 4/7 CALLED CUSTOMER 4/13 LEFT MESSAGE TO CALL OFFICE IF ODOR STILL PRESENT.,General Request,Boston Water & Sewer Commission,Administrative & General Requests,BWSC General Request,BWSC_All Cases,BWSC,,,121 Havre St  East Boston  MA  02128,1.0,09,1.0,A7,East Boston,1.0,Ward 1,104.0,R2,121 Havre St,2128.0,Address,71390.0,42.3728,-71.0381,Constituent Call,"(42.3728, -71.0381)"
546856,101001351414,04/07/2015 06:42:34 PM,,04/08/2015 11:50:54 AM,ONTIME,Closed,Case Closed Case Resolved RETRIEVED KEYS WITH MAGNET AND RETURNED TO CUSTOMER 4/7,General Request,Boston Water & Sewer Commission,Administrative & General Requests,BWSC General Request,BWSC_All Cases,BWSC,,,INTERSECTION of Washington St & Martin Luther King Jr Blvd  Roxbury  MA,9.0,10B,7.0,B2,Roxbury,13.0,Ward 11,1102.0,,INTERSECTION Washington St & Martin Luther King Jr Blvd,,Intersection,6029.0,42.3215,-71.0921,Constituent Call,"(42.3215, -71.0921)"
546909,101001351487,04/08/2015 12:02:54 AM,,04/08/2015 02:17:41 PM,ONTIME,Closed,Case Closed Case Noted Water comming out of sewar - gate is broken according to call into BWSC at 12AM. Will be fixed today.,General Request,Boston Water & Sewer Commission,Administrative & General Requests,BWSC General Request,BWSC_All Cases,BWSC,,,INTERSECTION of Hanover St & Parmenter St  Boston  MA,3.0,1B,1.0,A1,Downtown / Financial District,3.0,Ward 3,303.0,,INTERSECTION Hanover St & Parmenter St,,Intersection,5613.0,42.3636,-71.0546,Constituent Call,"(42.3636, -71.0546)"
548443,101001353505,04/10/2015 10:40:19 AM,,05/08/2015 02:19:17 PM,ONTIME,Closed,Case Closed. Closed date : 2015-05-08 14:19:17.517 Case Noted CREW CHECKED BWSC  LINES DOWN & RUNNING  JETTED PAST CONNECTION. MET WITH PLUMBER AND PROPERTY MANAGER ON SITE. PLUMBER TO DYE TEST VARIOUS PARTS OF THE BUILDING (ONE AT A TIME) TO TRY AND FIND SOURCE 4/13,General Request,Boston Water & Sewer Commission,Administrative & General Requests,BWSC General Request,BWSC_All Cases,BWSC,,,55 Court St  Boston  MA  02108,3.0,1B,1.0,A1,Downtown / Financial District,3.0,Ward 3,306.0,C,55 Court St,2108.0,Address,156226.0,42.3592,-71.0589,Constituent Call,"(42.3592, -71.0589)"
548633,101001353740,04/10/2015 03:01:56 PM,,04/13/2015 02:56:03 PM,ONTIME,Closed,Case Closed Case Resolved Found no evidence of paint in drain 4/13,General Request,Boston Water & Sewer Commission,Administrative & General Requests,BWSC General Request,BWSC_All Cases,BWSC,,,640 Tremont St  Roxbury  MA  02118,4.0,1C,2.0,D4,South End,6.0,Ward 9,901.0,CM,640 Tremont St,2118.0,Address,170459.0,42.3419,-71.0748,Constituent Call,"(42.3419, -71.0748)"
549889,101001355546,04/14/2015 07:21:00 AM,,05/12/2015 11:09:19 AM,ONTIME,Closed,Case Closed. Closed date : 2015-05-12 11:09:19.67 Case Resolved repaired 4/28,General Request,Boston Water & Sewer Commission,Administrative & General Requests,BWSC General Request,BWSC_All Cases,BWSC,,,1-13 Union St  Boston  MA  02109,3.0,1B,1.0,A1,Boston,3.0,03,306.0,C,1-13 Union St,2109.0,Address,155717.0,42.3607,-71.0566,Constituent Call,"(42.3607, -71.0566)"
552510,101001359259,04/17/2015 05:34:56 PM,,04/21/2015 02:34:20 PM,ONTIME,Closed,Case Closed Case Noted Crew found BWSC line down & running. Jetted past owners connection manhole to manhole  internal problem  no SSO customer will call plumber 4/17,General Request,Boston Water & Sewer Commission,Administrative & General Requests,BWSC General Request,BWSC_All Cases,BWSC,,,67 Ceylon St  Dorchester  MA  02121,7.0,03,4.0,B2,Roxbury,13.0,Ward 14,1401.0,R2,67 Ceylon St,2121.0,Address,28548.0,42.3109,-71.0729,Constituent Call,"(42.3109, -71.0729)"
552599,101001359387,04/18/2015 07:11:35 AM,,04/21/2015 02:34:59 PM,ONTIME,Closed,Case Closed Case Resolved Called and spoke to Steve Vorenberg   plumber fixed leak water back on,General Request,Boston Water & Sewer Commission,Administrative & General Requests,BWSC General Request,BWSC_All Cases,BWSC,,,17 Harvest St  Dorchester  MA  02125,6.0,03,2.0,C6,Dorchester,5.0,Ward 7,708.0,CD,17 Harvest St,2125.0,Address,71014.0,42.323,-71.0578,Constituent Call,"(42.323, -71.0578)"
553640,101001360861,04/21/2015 02:05:58 PM,,04/23/2015 11:26:34 AM,ONTIME,Closed,Case Closed Case Noted BWSC contractor did repairs to this location  the sink hole has been fixed.  Inspected by Supervisor in District 5 Gerry Verisotosky.,General Request,Boston Water & Sewer Commission,Administrative & General Requests,BWSC General Request,INFO_Reallocation From Dept,INFO,,,404 W First St  South Boston  MA  02127,6.0,05,2.0,C6,South Boston / South Boston Waterfront,5.0,06,604.0,CM,404 W First St,2127.0,Address,58460.0,42.3377,-71.0435,Constituent Call,"(42.3377, -71.0435)"
553845,101001361175,04/22/2015 07:22:00 AM,,05/12/2015 01:37:52 PM,ONTIME,Closed,Case Closed. Closed date : 2015-05-12 13:37:52.417 Case Resolved RETRIEVED KEYS AND CLEANED CB. RETURNED KEYS TO OWNER 4/22,General Request,Boston Water & Sewer Commission,Administrative & General Requests,BWSC General Request,BWSC_All Cases,BWSC,,,3 Adamson St  Allston  MA  02134,11.0,04,9.0,D14,Allston / Brighton,15.0,Ward 22,2202.0,R1,3 Adamson St,2134.0,Address,1045.0,42.3584,-71.1367,Constituent Call,"(42.3584, -71.1367)"
555444,101001363347,04/24/2015 03:01:20 PM,,04/30/2015 02:20:57 PM,ONTIME,Closed,Case Closed Case Resolved Service relayed  leak repaired  4/27,General Request,Boston Water & Sewer Commission,Administrative & General Requests,BWSC General Request,BWSC_All Cases,BWSC,,,374 Congress St  Boston  MA  02210,6.0,05,2.0,C6,Boston,5.0,06,601.0,,374 Congress St,2210.0,Address,353287.0,42.3594,-71.0587,Constituent Call,"(0, 0)"
555971,101001364179,04/27/2015 06:59:36 AM,,05/07/2015 10:37:01 AM,ONTIME,Closed,Case Closed. Closed date : 2015-05-07 10:37:01.08 Case Resolved,General Request,Boston Water & Sewer Commission,Administrative & General Requests,BWSC General Request,BWSC_All Cases,BWSC,,,972 Bennington St  East Boston  MA  02128,1.0,09,1.0,A7,East Boston,1.0,Ward 1,113.0,R3,972 Bennington St,2128.0,Address,14961.0,42.3865,-71.0081,Constituent Call,"(42.3865, -71.0081)"
556592,101001364990,04/27/2015 06:25:00 PM,,05/06/2015 09:00:40 AM,ONTIME,Closed,Case Closed. Closed date : 2015-05-06 09:00:40.273 Case Resolved Main shut down for contractor and let back on 5/5,General Request,Boston Water & Sewer Commission,Administrative & General Requests,BWSC General Request,BWSC_All Cases,BWSC,,,210-216 Lincoln St  Boston  MA  02111,4.0,1C,2.0,A1,Downtown / Financial District,4.0,Ward 3,308.0,CC,210-216 Lincoln St,2111.0,Address,86103.0,42.3501,-71.0586,Constituent Call,"(42.3501, -71.0586)"
556716,101001365178,04/28/2015 08:37:00 AM,,05/13/2015 12:47:56 PM,ONTIME,Closed,Case Closed. Closed date : 2015-05-13 12:47:56.75 Case Noted CALLED CUSTOMER SHE SAID ODOR IS GONE THIS IS FROM WEEKS AGO.,General Request,Boston Water & Sewer Commission,Administrative & General Requests,BWSC General Request,BWSC_All Cases,BWSC,,,INTERSECTION of Linwood St & River St  Hyde Park  MA,12.0,08,5.0,E18,Hyde Park,10.0,Ward 18,1812.0,,INTERSECTION Linwood St & River St,,Intersection,6893.0,42.2555,-71.1264,Constituent Call,"(42.2555, -71.1264)"
557869,101001366750,04/29/2015 04:02:01 PM,,04/30/2015 09:57:36 AM,ONTIME,Closed,Case Closed Case Resolved BWSC line down & running  Customer had lateral inspection and was approved for program 4/29,General Request,Boston Water & Sewer Commission,Administrative & General Requests,BWSC General Request,BWSC_All Cases,BWSC,,,67 Ceylon St  Dorchester  MA  02121,7.0,03,4.0,B2,Roxbury,13.0,Ward 14,1401.0,R2,67 Ceylon St,2121.0,Address,28548.0,42.3109,-71.0729,Constituent Call,"(42.3109, -71.0729)"
559479,101001369218,05/04/2015 09:04:00 AM,,05/06/2015 12:59:09 PM,ONTIME,Closed,Case Closed. Closed date : 2015-05-06 12:59:09.08 Case Noted FOUND  LEAK ON FIRE PIPE FOR 379 MARLBOROUGH ST  SPOKE TO OWNER HE WOULD LIKE BWSC TO S/O F/P & HE WIL GET SOMEONE TO REPAIR  SPOKE TO MR THEODORE 617-201-3471 5/5,General Request,Boston Water & Sewer Commission,Administrative & General Requests,BWSC General Request,BWSC_All Cases,BWSC,,,381 Marlborough St  Boston  MA  02115,4.0,1C,8.0,D4,Back Bay,14.0,Ward 5,509.0,CM,381 Marlborough St,2115.0,Address,91140.0,42.3507,-71.0876,Constituent Call,"(42.3507, -71.0876)"
561854,101001372699,05/07/2015 02:09:00 PM,,05/07/2015 03:36:49 PM,ONTIME,Closed,Case Closed. Closed date : 2015-05-07 15:36:49.713 Case Noted Notified construction they will send inspector to investigate  contractor working here. 5/7,General Request,Boston Water & Sewer Commission,Administrative & General Requests,BWSC General Request,BWSC_All Cases,BWSC,,,426-428 Hanover St  Boston  MA  02113,3.0,1B,1.0,A1,Downtown / Financial District,3.0,Ward 3,301.0,CM,426-428 Hanover St,2113.0,Address,69149.0,42.3666,-71.0529,Constituent Call,"(42.3666, -71.0529)"
562954,101001374433,05/11/2015 09:35:00 AM,,05/22/2015 08:18:27 AM,ONTIME,Closed,Case Closed. Closed date : 2015-05-22 08:18:27.29 Duplicate of Existing Case case entered in ISD for inspection 1381594,General Request,Boston Water & Sewer Commission,Administrative & General Requests,BWSC General Request,ISD_Administrative,ISD,,,108 Richmond St  Boston  MA  02109,3.0,1B,1.0,A1,Downtown / Financial District,3.0,Ward 3,301.0,A,108 Richmond St,2109.0,Address,298333.0,42.3629,-71.0539,Constituent Call,"(42.3629, -71.0539)"
563059,101001374602,05/11/2015 11:13:00 AM,,05/11/2015 01:00:23 PM,ONTIME,Closed,Case Closed. Closed date : 2015-05-11 13:00:23.817 Case Noted SPOKE TO CUSTOMER EXPLAINED BWSC DOES NOT DO CLEANUP INSIDE BASEMENT. EXPLAINED OPTION OF FILING A CLAIM.,General Request,Boston Water & Sewer Commission,Administrative & General Requests,BWSC General Request,INFO_Reallocation From Dept,INFO,,,15 Catawba St  Roxbury  MA  02119,9.0,10B,7.0,B2,Roxbury,13.0,Ward 12,1205.0,R1,15 Catawba St,2119.0,Address,26420.0,42.32,-71.0833,Constituent Call,"(42.32, -71.0833)"
565097,101001377525,05/14/2015 12:05:00 PM,,05/14/2015 01:17:16 PM,ONTIME,Closed,Case Closed. Closed date : 2015-05-14 13:17:16.313 Case Noted BWSC takes customer complaints very seriously  I have forwarded your complaint to the individuals supervisor.,General Request,Boston Water & Sewer Commission,Administrative & General Requests,BWSC General Request,BWSC_All Cases,BWSC,,,81 Cass St  West Roxbury  MA  02132,12.0,06,6.0,E5,West Roxbury,12.0,Ward 20,2005.0,R2,81 Cass St,2132.0,Address,202353.0,42.2747,-71.162,Constituent Call,"(42.2747, -71.162)"
565696,101001378367,05/15/2015 12:08:00 PM,,07/28/2015 02:05:43 PM,ONTIME,Closed,Case Closed. Closed date : 2015-07-28 14:05:43.67 Case Resolved The contractor has been on site for weeks redoing the sidewalks and the bricks are staying that were there when we started the project.,General Request,Boston Water & Sewer Commission,Administrative & General Requests,BWSC General Request,BWSC_All Cases,BWSC,,,728 Bennington St  East Boston  MA  02128,1.0,09,1.0,A7,East Boston,1.0,Ward 1,113.0,RC,728 Bennington St,2128.0,Address,187775.0,42.3852,-71.0119,Constituent Call,"(42.3852, -71.0119)"
565798,101001378517,05/15/2015 02:25:00 PM,,05/15/2015 04:26:50 PM,ONTIME,Closed,Case Closed. Closed date : 2015-05-15 16:26:50.847 Case Noted The brick will be placed back by Umbro and Sons Construction  this is part of our contract. The brick that was damaged or misplaced by our construction work will be replaced.  Cicconi and Son?s Construction who is replacing the sidewalks is not doing this work just the concrete sidewalks. This may have been the confusion.,General Request,Boston Water & Sewer Commission,Administrative & General Requests,BWSC General Request,BWSC_All Cases,BWSC,,,732 Bennington St  East Boston  MA  02128,1.0,09,1.0,A7,East Boston,1.0,Ward 1,113.0,R3,732 Bennington St,2128.0,Address,14917.0,42.3852,-71.0118,Constituent Call,"(42.3852, -71.0118)"
568338,101001382261,05/21/2015 09:37:00 AM,,05/27/2015 10:38:24 AM,ONTIME,Closed,Case Closed. Closed date : 2015-05-27 10:38:24.593 Case Resolved Bwsc line down & running  jetted past owners connection. No back up at property 5/21,General Request,Boston Water & Sewer Commission,Administrative & General Requests,BWSC General Request,BWSC_All Cases,BWSC,,,22 Banton St  Dorchester  MA  02124,8.0,07,3.0,C11,Dorchester,8.0,Ward 16,1603.0,R3,22 Banton St,2124.0,Address,8130.0,42.2886,-71.0647,Constituent Call,"(42.2886, -71.0647)"
569516,101001394068,05/24/2015 10:17:00 PM,,05/28/2015 10:16:56 AM,ONTIME,Closed,Case Closed. Closed date : 2015-05-28 10:16:56.177 Case Noted MONITORED CLEAN HARBOR'S PUMPING OUT WATER FROM BASEMENT INTO OUR SEWER LINE. THEY USED A VACTOR TRUCK TO VACUUM OIL OFF THE TOP OF THE WATER. THERE WAS ATLEAST 1.5 FT OF WATER STILL IN THE BASEMENT WHEN CREW DEPARTED  THEY ARE CONTINUING TO PUMP. 5/25/15,General Request,Boston Water & Sewer Commission,Administrative & General Requests,BWSC General Request,BWSC_All Cases,BWSC,,,230 Congress St  Boston  MA  02110,6.0,1C,1.0,A1,Downtown / Financial District,3.0,Ward 3,306.0,C,230 Congress St,2110.0,Address,218232.0,42.3545,-71.0542,Constituent Call,"(42.3545, -71.0542)"
569523,101001394080,05/24/2015 11:54:00 PM,,05/27/2015 10:58:25 AM,ONTIME,Closed,Case Closed. Closed date : 2015-05-27 10:58:25.587 Case Resolved RETRIEVED KEYS 5/25,General Request,Boston Water & Sewer Commission,Administrative & General Requests,BWSC General Request,BWSC_All Cases,BWSC,,,INTERSECTION of Hanover St & Parmenter St  Boston  MA,3.0,1B,1.0,A1,Downtown / Financial District,3.0,Ward 3,303.0,,INTERSECTION Hanover St & Parmenter St,,Intersection,5613.0,42.3636,-71.0546,Constituent Call,"(42.3636, -71.0546)"
571505,101001396886,05/28/2015 11:50:39 AM,,05/28/2015 11:51:23 AM,ONTIME,Closed,Case Closed. Closed date : 2015-05-28 11:51:23.457 Case Invalid,General Request,Boston Water & Sewer Commission,Administrative & General Requests,BWSC General Request,BWSC_All Cases,BWSC,,,26 Woodbine St  Roxbury  MA  02119,9.0,10B,7.0,B2,Roxbury,13.0,Ward 12,1204.0,R1,26 Woodbine St,2119.0,Address,151392.0,42.3193,-71.0798,Constituent Call,"(42.3193, -71.0798)"
572432,101001398213,05/29/2015 01:32:00 PM,,06/02/2015 11:15:15 AM,ONTIME,Closed,Case Closed. Closed date : 2015-06-02 11:15:15.537 Case Noted Patched 5/30,General Request,Boston Water & Sewer Commission,Administrative & General Requests,BWSC General Request,BWSC_All Cases,BWSC,,,99 Harrison Ave  Boston  MA  02111,4.0,1C,2.0,A1,Downtown / Financial District,4.0,03,308.0,C,99 Harrison Ave,2111.0,Address,70098.0,42.3508,-71.0616,Constituent Call,"(42.3508, -71.0616)"
572677,101001398602,05/30/2015 06:50:00 AM,,06/04/2015 02:59:36 PM,ONTIME,Closed,Case Closed. Closed date : 2015-06-04 14:59:36.89 Case Noted FOUND IRRIGATION SYSTEM LEAKING OPPOSITE 749 DORCHESTER AVE.  LEAK DETECTION SPOKE TO BUILDING'S PLUMBER FROM 750 DORCHESTER AVE  STATED WILL HAVE IRRIGATION SYSTEM REPAIRED.,General Request,Boston Water & Sewer Commission,Administrative & General Requests,BWSC General Request,BWSC_All Cases,BWSC,,,INTERSECTION of Dorchester Ave & Howell St  Dorchester  MA,6.0,03,2.0,C6,Dorchester,5.0,Ward 7,708.0,,INTERSECTION Dorchester Ave & Howell St,,Intersection,4180.0,42.3248,-71.0569,Constituent Call,"(42.3248, -71.0569)"
573685,101001400007,06/01/2015 03:43:00 PM,,06/02/2015 01:30:16 PM,ONTIME,Closed,Case Closed. Closed date : 2015-06-02 13:30:16.193 Case Resolved Repaired leak on main 6/1,General Request,Boston Water & Sewer Commission,Administrative & General Requests,BWSC General Request,BWSC_All Cases,BWSC,,,39 Mount Pleasant Ave  Roxbury  MA  02119,7.0,10B,7.0,B2,Roxbury,13.0,Ward 8,804.0,A,39 Mount Pleasant Ave,2119.0,Address,98404.0,42.327,-71.0797,Constituent Call,"(42.327, -71.0797)"
574067,101001400565,06/02/2015 11:15:09 AM,,06/02/2015 11:21:40 AM,ONTIME,Closed,Case Closed. Closed date : 2015-06-02 11:21:40.89 Case Invalid DCR property not BWSC.,General Request,Boston Water & Sewer Commission,Administrative & General Requests,BWSC General Request,BWSC_All Cases,BWSC,,,170 Morton St  Jamaica Plain  MA  02130,9.0,02,7.0,B2,Jamaica Plain,13.0,12,1207.0,E,170 Morton St,2130.0,Address,341854.0,42.2995,-71.1018,Constituent Call,"(42.2995, -71.1018)"
574968,101001401953,06/03/2015 05:45:00 PM,,06/04/2015 01:50:13 PM,ONTIME,Closed,Case Closed. Closed date : 2015-06-04 13:50:13.293 Case Resolved Shut off leaking hydrant 5/29,General Request,Boston Water & Sewer Commission,Administrative & General Requests,BWSC General Request,BWSC_All Cases,BWSC,,,931 Bennington St  East Boston  MA  02128,1.0,09,1.0,A7,East Boston,1.0,Ward 1,112.0,C,931 Bennington St,2128.0,Address,14943.0,42.3857,-71.0088,Constituent Call,"(42.3857, -71.0088)"
575283,101001402435,06/04/2015 11:24:00 AM,,06/04/2015 01:52:07 PM,ONTIME,Closed,Case Closed. Closed date : 2015-06-04 13:52:07.553 Case Noted Fire pipe leak to owner @ # 1221 Dorchester Av-owner has been notified,General Request,Boston Water & Sewer Commission,Administrative & General Requests,BWSC General Request,BWSC_All Cases,BWSC,,,1203-1211 Dorchester Ave  Dorchester  MA  02125,7.0,03,3.0,C11,Dorchester,8.0,15,1504.0,,1203-1211 Dorchester Ave,2125.0,Address,355568.0,42.3594,-71.0587,Constituent Call,"(0, 0)"
575788,101001403123,06/05/2015 09:12:00 AM,,07/24/2015 04:37:33 PM,ONTIME,Closed,Case Closed. Closed date : 2015-07-24 16:37:33.453 Case Resolved BWSC reports the hydrant was replaced on 7/18/15. Thank you.,General Request,Boston Water & Sewer Commission,Administrative & General Requests,BWSC General Request,BWSC_All Cases,BWSC,,,951 Bennington St  East Boston  MA  02128,1.0,09,1.0,A7,East Boston,1.0,Ward 1,112.0,C,951 Bennington St,2128.0,Address,14946.0,42.3859,-71.0083,Constituent Call,"(42.3859, -71.0083)"
577341,101001405510,06/09/2015 09:52:00 AM,,06/12/2015 09:36:41 AM,ONTIME,Closed,Case Closed. Closed date : 2015-06-12 09:36:41.387 Case Resolved Contractor relaid 6/11,General Request,Boston Water & Sewer Commission,Administrative & General Requests,BWSC General Request,BWSC_All Cases,BWSC,,,17 Weld Hill St  Jamaica Plain  MA  02130,12.0,02,6.0,E13,Jamaica Plain,10.0,Ward 19,1907.0,R2,17 Weld Hill St,2130.0,Address,147226.0,42.2985,-71.1136,Constituent Call,"(42.2985, -71.1136)"
581245,101001411416,06/17/2015 11:10:00 AM,,06/18/2015 09:59:36 AM,ONTIME,Closed,Case Closed. Closed date : 2015-06-18 09:59:36.803 Case Noted Called customer gave operations tel# to call to schedule appointment to investigate. 6/17,General Request,Boston Water & Sewer Commission,Administrative & General Requests,BWSC General Request,BWSC_All Cases,BWSC,,,223 W Canton St  Boston  MA  02116,4.0,1C,2.0,D4,South End,6.0,Ward 4,402.0,CM,223 W Canton St,2116.0,Address,25723.0,42.3455,-71.0772,Constituent Call,"(42.3455, -71.0772)"
581375,101001411583,06/17/2015 12:50:00 PM,,06/18/2015 10:00:15 AM,ONTIME,Closed,Case Closed. Closed date : 2015-06-18 10:00:15.733 Case Resolved ALL LINES D/R FOUND ODOR IN CB50 AND CB86 WE DISINFECTED THEM 6/17,General Request,Boston Water & Sewer Commission,Administrative & General Requests,BWSC General Request,BWSC_All Cases,BWSC,,,INTERSECTION of Brimmer St & Chestnut St  Boston  MA,3.0,1B,8.0,A1,Beacon Hill,14.0,Ward 5,505.0,,INTERSECTION Brimmer St & Chestnut St,,Intersection,1960.0,42.3566,-71.0717,Constituent Call,"(42.3566, -71.0717)"
582828,101001413766,06/20/2015 09:22:00 AM,,06/23/2015 02:39:42 PM,ONTIME,Closed,Case Closed. Closed date : 2015-06-23 14:39:42.73 Case Resolved Repaired leak 6/22,General Request,Boston Water & Sewer Commission,Administrative & General Requests,BWSC General Request,BWSC_All Cases,BWSC,,,48-50 Tuttle St  Dorchester  MA  02125,7.0,03,3.0,C11,Dorchester,7.0,Ward 13,1310.0,R2,48-50 Tuttle St,2125.0,Address,138732.0,42.3137,-71.0537,Constituent Call,"(42.3137, -71.0537)"
583586,101001414835,06/22/2015 01:01:00 PM,,,ONTIME,Open,,General Request,Boston Water & Sewer Commission,Administrative & General Requests,BWSC General Request,INFO01_GenericeFormforOtherServiceRequestTypes,INFO,,,1 Wise St  Jamaica Plain  MA  02130,9.0,10A,6.0,E13,Jamaica Plain,11.0,Ward 10,1007.0,A,1 Wise St,2130.0,Address,151079.0,42.3225,-71.1016,Constituent Call,"(42.3225, -71.1016)"
583835,101001415227,06/22/2015 08:48:00 PM,,06/23/2015 10:20:27 AM,ONTIME,Closed,Case Closed. Closed date : 2015-06-23 10:20:27.987 Case Resolved PATCHED MH 6/22,General Request,Boston Water & Sewer Commission,Administrative & General Requests,BWSC General Request,BWSC_All Cases,BWSC,,,60 William Cardinal O'Connell Way  Boston  MA  02114,3.0,1B,8.0,A1,Back Bay,3.0,Ward 3,305.0,E,60 William Cardinal O'Connell Way,2114.0,Address,151131.0,42.3627,-71.0658,Constituent Call,"(42.3627, -71.0658)"
584122,101001415599,06/23/2015 10:28:00 AM,,06/23/2015 10:34:21 AM,ONTIME,Closed,Case Closed. Closed date : 2015-06-23 10:34:21.76 Case Invalid,General Request,Boston Water & Sewer Commission,Administrative & General Requests,BWSC General Request,BWSC_All Cases,BWSC,,,912-914 Dorchester Ave  Dorchester  MA  02125,7.0,03,3.0,C11,Dorchester,7.0,Ward 13,1307.0,RC,912-914 Dorchester Ave,2125.0,Address,48771.0,42.3198,-71.0565,Constituent Call,"(42.3198, -71.0565)"
590406,101001424640,07/07/2015 02:00:00 PM,,08/03/2015 02:54:27 PM,ONTIME,Closed,Case Closed. Closed date : 2015-08-03 14:54:27.583 Case Resolved CALLED LEFT MESSAGE FOR CUSTOMER TO CALL OPERATION TO SCHEDULE APPOINTMENT TO INVESTIGATE LOW PRESSURE  GAVE TEL#.,General Request,Boston Water & Sewer Commission,Administrative & General Requests,BWSC General Request,BWSC_All Cases,BWSC,,,79 Euston Rd  Brighton  MA  02135,11.0,04,9.0,D14,Allston / Brighton,15.0,Ward 21,2111.0,R3,79 Euston Rd,2135.0,Address,54653.0,42.3436,-71.1454,Constituent Call,"(42.3436, -71.1454)"
591185,101001425702,07/08/2015 07:32:00 PM,,07/09/2015 09:20:40 AM,ONTIME,Closed,Case Closed. Closed date : 2015-07-09 09:20:40.757 Case Resolved This is a Leak up to owner  leak on fire pipe for 85-87 Kilby St. Owner is aware and contractor is going to repair.,General Request,Boston Water & Sewer Commission,Administrative & General Requests,BWSC General Request,BWSC_All Cases,BWSC,,,INTERSECTION of Batterymarch St & Milk St  Boston  MA,3.0,1C,1.0,A1,Downtown / Financial District,3.0,Ward 3,306.0,,INTERSECTION Batterymarch St & Milk St,,Intersection,1021.0,42.3577,-71.0544,Constituent Call,"(42.3577, -71.0544)"
591909,101001426661,07/10/2015 09:29:00 AM,,07/10/2015 02:34:37 PM,ONTIME,Closed,Case Closed. Closed date : 2015-07-10 14:34:37.25 Case Resolved BWSC is Flushing bypass,General Request,Boston Water & Sewer Commission,Administrative & General Requests,BWSC General Request,BWSC_All Cases,BWSC,,,INTERSECTION of Eutaw St & Marion St  East Boston  MA,1.0,09,1.0,A7,East Boston,1.0,Ward 1,107.0,,INTERSECTION Eutaw St & Marion St,,Intersection,4673.0,42.3791,-71.0379,Constituent Call,"(42.3791, -71.0379)"
592359,101001427273,07/11/2015 04:51:00 AM,07/11/2015 04:51:52 AM,08/11/2015 12:05:12 PM,OVERDUE,Closed,Case Closed. Closed date : 2015-08-11 12:05:12.897 Case Resolved Case Closed. Fixing Technical Issue Original Closed date : 2015-07-14 15:55:34.433 Case Resolved Contractor working here  area on bypass  they are aware of the packing leak on gate,General Request,Boston Water & Sewer Commission,Administrative & General Requests,BWSC General Request,BWSC_All Cases,BWSC,,,INTERSECTION of Columbia Rd & Dorchester Ave  Dorchester  MA,7.0,03,2.0,C11,Dorchester,5.0,Ward 7,709.0,,INTERSECTION Columbia Rd & Dorchester Ave,,Intersection,3244.0,42.3206,-71.0568,Constituent Call,"(42.3206, -71.0568)"
597780,101001434527,07/21/2015 07:48:00 PM,,08/03/2015 09:41:02 AM,ONTIME,Closed,Case Closed. Closed date : 2015-08-03 09:41:02.373 Case Noted The contractor encountered a delay and the work took longer than anticipated.   We apologize for any inconvenience this may have caused.,General Request,Boston Water & Sewer Commission,Administrative & General Requests,BWSC General Request,BWSC_All Cases,BWSC,,,INTERSECTION of D St & W Third St  South Boston  MA,6.0,05,2.0,C6,South Boston / South Boston Waterfront,5.0,Ward 6,601.0,,INTERSECTION D St & W Third St,,Intersection,3811.0,42.3396,-71.0499,Constituent Call,"(42.3396, -71.0499)"
597801,101001434559,07/21/2015 09:22:00 PM,,,ONTIME,Open,,General Request,Boston Water & Sewer Commission,Administrative & General Requests,BWSC General Request,INFO01_GenericeFormforOtherServiceRequestTypes,INFO,,,560 Boylston St  Boston  MA  02116,4.0,1C,2.0,D4,Boston,6.0,04,402.0,,560 Boylston St,2116.0,Address,342031.0,42.3594,-71.0587,Constituent Call,"(0, 0)"
598213,101001435259,07/23/2015 01:36:00 PM,,07/29/2015 08:50:02 AM,ONTIME,Closed,Case Closed. Closed date : 2015-07-29 08:50:02.67 Case Resolved CLEANED & DISINFECTED 3 CB'S 7/27,General Request,Boston Water & Sewer Commission,Administrative & General Requests,BWSC General Request,BWSC_All Cases,BWSC,,,INTERSECTION of Columbia Rd & Cushing Ave  Dorchester  MA,7.0,03,7.0,B2,Dorchester,13.0,Ward 13,1305.0,,INTERSECTION Columbia Rd & Cushing Ave,,Intersection,3232.0,42.3167,-71.0655,Constituent Call,"(42.3167, -71.0655)"
598677,101001435914,07/24/2015 09:11:00 AM,,08/21/2015 03:55:23 PM,ONTIME,Closed,Case Closed. Closed date : 2015-08-21 15:55:23.773 Case Noted Spoke to caller explained mark out procedure. He will fax sketch & m/o request.,General Request,Boston Water & Sewer Commission,Administrative & General Requests,BWSC General Request,BWSC_All Cases,BWSC,,,1271 Dorchester Ave  Dorchester  MA  02122,7.0,03,3.0,C11,Dorchester,8.0,Ward 15,1504.0,C,1271 Dorchester Ave,2122.0,Address,164449.0,42.3074,-71.0588,Constituent Call,"(42.3074, -71.0588)"
599269,101001436681,07/25/2015 07:00:00 PM,,08/04/2015 09:07:40 AM,ONTIME,Closed,Case Closed. Closed date : 2015-08-04 09:07:40.553 Case Noted THE FIRE PIPE CONNECTION OUTSIDE THE BUIDLING IS LEAKING THIS IS THE OWNER'S RESPONSIBILITY NOT BWSC 7/27,General Request,Boston Water & Sewer Commission,Administrative & General Requests,BWSC General Request,BWSC_All Cases,BWSC,,,180 Lincoln St  Boston  MA  02111,4.0,1C,2.0,A1,Downtown / Financial District,4.0,Ward 3,308.0,C,180 Lincoln St,2111.0,Address,264655.0,42.3505,-71.0584,Constituent Call,"(42.3505, -71.0584)"
599592,101001437168,07/27/2015 09:26:00 AM,,07/29/2015 03:20:50 PM,ONTIME,Closed,Case Closed. Closed date : 2015-07-29 15:20:50.633 Case Noted Parking signs and times are controlled by contract.  BWSC works with neighborhood to ensure ample notice on parking restrictions,General Request,Boston Water & Sewer Commission,Administrative & General Requests,BWSC General Request,BWSC_All Cases,BWSC,,,317-319 W Third St  South Boston  MA  02127,6.0,05,2.0,C6,South Boston / South Boston Waterfront,5.0,Ward 6,604.0,A,317-319 W Third St,2127.0,Address,135407.0,42.3371,-71.0464,Constituent Call,"(42.3371, -71.0464)"
600983,101001438981,07/29/2015 07:11:00 AM,,07/29/2015 02:06:20 PM,ONTIME,Closed,Case Closed. Closed date : 2015-07-29 14:06:20.263 Case Noted Investigated   spoke to Manager  of Mike & Patty luncheonette to discontinue dumping any wastewater into CB. He will notify employees. 7/29.,General Request,Boston Water & Sewer Commission,Administrative & General Requests,BWSC General Request,BWSC_All Cases,BWSC,,,INTERSECTION of Church St & Fayette St  Boston  MA,4.0,1C,2.0,A1,Back Bay,6.0,Ward 5,501.0,,INTERSECTION Church St & Fayette St,,Intersection,3012.0,42.3486,-71.0679,Constituent Call,"(42.3486, -71.0679)"
601670,101001499870,07/30/2015 08:26:00 AM,,07/30/2015 10:15:31 AM,ONTIME,Closed,Case Closed. Closed date : 2015-07-30 10:15:31.73 Case Resolved Work has been postponed notified inspector to take signs down.,General Request,Boston Water & Sewer Commission,Administrative & General Requests,BWSC General Request,BWSC_All Cases,BWSC,,,INTERSECTION of Ashley St & Breed St  East Boston  MA,1.0,09,1.0,A7,East Boston,1.0,Ward 1,113.0,,INTERSECTION Ashley St & Breed St,,Intersection,651.0,42.3882,-71.0065,Constituent Call,"(42.3882, -71.0065)"
601806,101001500059,07/30/2015 11:07:00 AM,,07/30/2015 12:08:17 PM,ONTIME,Closed,Case Closed. Closed date : 2015-07-30 12:08:17.84 Case Resolved Old request from June  Good pressure to meter  internal 6/24.,General Request,Boston Water & Sewer Commission,Administrative & General Requests,BWSC General Request,BWSC_All Cases,BWSC,,,14 Trull St  Dorchester  MA  02125,7.0,03,3.0,C11,Dorchester,8.0,Ward 15,1504.0,CD,14 Trull St,2125.0,Address,138448.0,42.3122,-71.0657,Constituent Call,"(42.3122, -71.0657)"
601997,101001500324,07/30/2015 02:54:00 PM,,07/31/2015 11:11:29 AM,ONTIME,Closed,Case Closed. Closed date : 2015-07-31 11:11:29.693 Case Resolved This is a Leak to owner Issue.  Residents responsible and owner notified.,General Request,Boston Water & Sewer Commission,Administrative & General Requests,BWSC General Request,BWSC_All Cases,BWSC,,,1 Liberty Sq  Boston  MA  02109,3.0,1C,1.0,A1,Boston,3.0,03,306.0,,1 Liberty Sq,2109.0,Address,352703.0,42.3594,-71.0587,Constituent Call,"(0, 0)"
603839,101001502854,08/04/2015 09:59:00 AM,,08/04/2015 02:47:26 PM,ONTIME,Closed,Case Closed. Closed date : 2015-08-04 14:47:26.367 Case Noted NO FLOOD ON ARRIVAL  Catch Basin?S TAKING WATER 8/4,General Request,Boston Water & Sewer Commission,Administrative & General Requests,BWSC General Request,BWSC_All Cases,BWSC,,,15 Frankfort St  East Boston  MA  02128,1.0,09,1.0,A7,East Boston,1.0,Ward 1,102.0,R3,15 Frankfort St,2128.0,Address,60503.0,42.3692,-71.0356,Constituent Call,"(42.3692, -71.0356)"
604351,101001503531,08/04/2015 06:47:00 PM,,08/05/2015 09:45:43 AM,ONTIME,Closed,Case Closed. Closed date : 2015-08-05 09:45:43.787 Case Noted CLEANED 3 CATCH BASIN'S RELIEVED of  FLOODING ON 8/4.,General Request,Boston Water & Sewer Commission,Administrative & General Requests,BWSC General Request,BWSC_All Cases,BWSC,,,1144 Commonwealth Ave  Allston  MA  02134,,04,9.0,D14,Allston / Brighton,14.0,Ward 21,2103.0,A,1144 Commonwealth Ave,2134.0,Address,161093.0,42.3503,-71.1266,Constituent Call,"(42.3503, -71.1266)"
604661,101001503942,08/05/2015 10:21:00 AM,,08/05/2015 03:30:00 PM,ONTIME,Closed,Case Closed. Closed date : 2015-08-05 15:30:00.827 Case Noted BWSC LINE WORKING   DYE TESTED PROP AND  DYE SHOWED Man Hole on  8/5,General Request,Boston Water & Sewer Commission,Administrative & General Requests,BWSC General Request,BWSC_All Cases,BWSC,,,801 Massachusetts Ave  Roxbury  MA  02119,7.0,10B,7.0,D4,Roxbury,13.0,08,803.0,,801 Massachusetts Ave,2119.0,Address,352161.0,42.3594,-71.0587,Constituent Call,"(0, 0)"
604918,101001504273,08/05/2015 02:32:00 PM,,08/06/2015 09:25:23 AM,ONTIME,Closed,Case Closed. Closed date : 2015-08-06 09:25:23.373 Case Resolved PICKED UP BARRICADES 8/5,General Request,Boston Water & Sewer Commission,Administrative & General Requests,BWSC General Request,BWSC_All Cases,BWSC,,,12 Leamington Rd  Brighton  MA  02135,11.0,04,9.0,D14,Allston / Brighton,15.0,Ward 21,2113.0,R1,12 Leamington Rd,2135.0,Address,84733.0,42.3421,-71.1494,Constituent Call,"(42.3421, -71.1494)"
605069,101001504478,08/05/2015 06:27:00 PM,,08/06/2015 09:26:13 AM,ONTIME,Closed,Case Closed. Closed date : 2015-08-06 09:26:13.95 Case Resolved RETRIEVED KEYS 8/5,General Request,Boston Water & Sewer Commission,Administrative & General Requests,BWSC General Request,BWSC_All Cases,BWSC,,,650 American Legion Hwy  Roslindale  MA  02131,12.0,02,5.0,E18,Roslindale,10.0,Ward 18,1807.0,C,650 American Legion Hwy,2131.0,Address,156846.0,42.284,-71.1109,Constituent Call,"(42.284, -71.1109)"
606174,101001505956,08/07/2015 02:23:00 PM,,08/10/2015 11:02:30 AM,ONTIME,Closed,Case Closed. Closed date : 2015-08-10 11:02:30.963 Case Resolved STOPPED PACKING LEAK  OKAY HERE NOW 8/7,General Request,Boston Water & Sewer Commission,Administrative & General Requests,BWSC General Request,BWSC_All Cases,BWSC,,,INTERSECTION of Itasca St & Messinger St  Mattapan  MA,8.0,07,5.0,B3,Greater Mattapan,9.0,Ward 18,1803.0,,INTERSECTION Itasca St & Messinger St,,Intersection,6520.0,42.2745,-71.1014,Constituent Call,"(42.2745, -71.1014)"
606407,101001516289,08/08/2015 07:34:00 AM,,08/12/2015 09:44:37 AM,ONTIME,Closed,Case Closed. Closed date : 2015-08-12 09:44:37.267 Case Resolved Dug and repaired leak 8/10,General Request,Boston Water & Sewer Commission,Administrative & General Requests,BWSC General Request,BWSC_All Cases,BWSC,,,850 Dorchester Ave  Dorchester  MA  02125,6.0,03,2.0,C6,Dorchester,5.0,Ward 7,708.0,RC,850 Dorchester Ave,2125.0,Address,48756.0,42.3218,-71.0565,Constituent Call,"(42.3218, -71.0565)"
607736,101001518151,08/11/2015 12:08:00 PM,,08/13/2015 02:17:50 PM,ONTIME,Closed,Case Closed. Closed date : 2015-08-13 14:17:50.32 Case Noted ON ARRIVAL LOCATED FLOOD FOUND CB WITH CONSTRUCTION FABRIC  POKED HOLES IN FABRIC REILEVED FLOOD CHECKED DRAIN LINE is ok now   8/11.,General Request,Boston Water & Sewer Commission,Administrative & General Requests,BWSC General Request,BWSC_All Cases,BWSC,,,INTERSECTION of Blue Hill Ave & Seaver St  Jamaica Plain  MA,9.0,03,7.0,B2,Greater Mattapan,13.0,Ward 12,1207.0,,INTERSECTION Blue Hill Ave & Seaver St,,Intersection,1562.0,42.3052,-71.0848,Constituent Call,"(42.3052, -71.0848)"
608098,101001518657,08/11/2015 05:40:00 PM,,08/12/2015 11:57:42 AM,ONTIME,Closed,Case Closed. Closed date : 2015-08-12 11:57:42.06 Case Resolved THIS IS A LEAK UP TO OWNER. FIRE PIPE GATE LEAKING  OWNER HAS BEEN NOTIFIED,General Request,Boston Water & Sewer Commission,Administrative & General Requests,BWSC General Request,BWSC_All Cases,BWSC,,,INTERSECTION of Elm Hill Ave & Howland St  Dorchester  MA,9.0,10B,7.0,B2,Roxbury,13.0,Ward 12,1202.0,,INTERSECTION Elm Hill Ave & Howland St,,Intersection,4535.0,42.3124,-71.0852,Constituent Call,"(42.3124, -71.0852)"
608114,101001518674,08/11/2015 05:57:00 PM,,08/12/2015 11:59:24 AM,ONTIME,Closed,Case Closed. Closed date : 2015-08-12 11:59:24.34 Case Noted NO NOISE ON S/P  S/W HAS ALREADY BEEN DUG AND REPAIRED BY BWSC 8/11,General Request,Boston Water & Sewer Commission,Administrative & General Requests,BWSC General Request,BWSC_All Cases,BWSC,,,72 Leyden St  East Boston  MA  02128,1.0,09,1.0,A7,East Boston,1.0,Ward 1,113.0,R2,72 Leyden St,2128.0,Address,85840.0,42.3898,-71.0095,Constituent Call,"(42.3898, -71.0095)"
608651,101001519334,08/12/2015 11:44:00 AM,,08/18/2015 01:51:34 PM,ONTIME,Closed,Case Closed. Closed date : 2015-08-18 13:51:34.923 Case Noted DISINFECTED 12 Catch Basin 'S ON SUMMER ST BETWEEN WASHINGTON ST AND DEVONSHIRE ST NO ODOR DETECTED ON ARRIVAL 8/13,General Request,Boston Water & Sewer Commission,Administrative & General Requests,BWSC General Request,BWSC_All Cases,BWSC,,,INTERSECTION of Washington St & Summer St  Boston  MA,3.0,1C,2.0,A1,Downtown / Financial District,4.0,Ward 3,308.0,,INTERSECTION Washington St & Summer St,,Intersection,6075.0,42.3555,-71.0605,Constituent Call,"(42.3555, -71.0605)"
608653,101001519336,08/12/2015 11:45:00 AM,,08/24/2015 12:46:58 PM,ONTIME,Closed,Case Closed. Closed date : 2015-08-24 12:46:58.83 Case Resolved   REPLACED 2 MISSING  COVERS AND PATCHED MADE SAFE 8/12,General Request,Boston Water & Sewer Commission,Administrative & General Requests,BWSC General Request,BWSC_All Cases,BWSC,,,INTERSECTION of Arch St & Summer St  Boston  MA,3.0,1C,1.0,A1,Downtown / Financial District,3.0,Ward 3,306.0,,INTERSECTION Arch St & Summer St,,Intersection,533.0,42.3544,-71.0591,Constituent Call,"(42.3544, -71.0591)"
608757,101001519463,08/12/2015 01:19:00 PM,,08/24/2015 03:11:17 PM,ONTIME,Closed,Case Closed. Closed date : 2015-08-24 15:11:17.84 Case Noted Investigated not a sewer related issue  no SSO  dye tested houses nearby no dye appeared  premises nearby and BWSC lines are reported down and running  Also investigated and found this is not a water related issue  ran leak detection  nothing found.  Chris Sayers investigated and it does not appear to be anything more than a standing puddle at this time.,General Request,Boston Water & Sewer Commission,Administrative & General Requests,BWSC General Request,BWSC_All Cases,BWSC,,,74-76 Salem St  Boston  MA  02113,3.0,1B,1.0,A1,Boston,3.0,03,303.0,RC,74-76 Salem St,2113.0,Address,341424.0,42.3594,-71.0587,Constituent Call,"(0, 0)"
609459,101001520342,08/13/2015 11:48:00 AM,,08/13/2015 02:23:37 PM,ONTIME,Closed,Case Closed. Closed date : 2015-08-13 14:23:37.36 Case Noted THIS IS A FIRE PIPE GATE LEAK  UP TO OWNER. OWNER HAS BEEN NOTIFIED TO REPAIR ASAP,General Request,Boston Water & Sewer Commission,Administrative & General Requests,BWSC General Request,BWSC_All Cases,BWSC,,,INTERSECTION of Elm Hill Ave & Howland St  Dorchester  MA,9.0,10B,7.0,B2,Roxbury,13.0,Ward 12,1202.0,,INTERSECTION Elm Hill Ave & Howland St,,Intersection,4535.0,42.3124,-71.0852,Constituent Call,"(42.3124, -71.0852)"
609479,101001520362,08/13/2015 12:06:00 PM,,08/28/2015 03:10:54 PM,ONTIME,Closed,Case Closed. Closed date : 2015-08-28 15:10:54.387 Case Noted This customer has a leak on her property  BWSC to repair under the LUTO program on 9/2/15 and sidewalk will be restored at a later date to concrete.,General Request,Boston Water & Sewer Commission,Administrative & General Requests,BWSC General Request,BWSC_All Cases,BWSC,,,3 Puritan Ave  Dorchester  MA  02121,7.0,03,3.0,C11,Dorchester,8.0,Ward 15,1501.0,R1,3 Puritan Ave,2121.0,Address,113584.0,42.3075,-71.0718,Constituent Call,"(42.3075, -71.0718)"
609503,101001520391,08/13/2015 12:25:00 PM,,08/18/2015 02:07:14 PM,ONTIME,Closed,Case Closed. Closed date : 2015-08-18 14:07:14.227 Case Resolved NO HOLES OR MISSING COVERS FOUND IN AREA 8/14,General Request,Boston Water & Sewer Commission,Administrative & General Requests,BWSC General Request,BWSC_All Cases,BWSC,,,INTERSECTION of Charles St & Chestnut St  Boston  MA,3.0,1B,8.0,A1,Beacon Hill,14.0,Ward 5,511.0,,INTERSECTION Charles St & Chestnut St,,Intersection,2788.0,42.357,-71.0699,Constituent Call,"(42.357, -71.0699)"
610070,101001521114,08/14/2015 09:31:00 AM,,08/18/2015 04:08:29 PM,ONTIME,Closed,Case Closed. Closed date : 2015-08-18 16:08:29.737 Case Resolved CLEANED UP STREET & SIDEWALK 8/13,General Request,Boston Water & Sewer Commission,Administrative & General Requests,BWSC General Request,BWSC_All Cases,BWSC,,,135 Cottage St  East Boston  MA  02128,1.0,09,1.0,A7,East Boston,1.0,Ward 1,102.0,R3,135 Cottage St,2128.0,Address,43348.0,42.369,-71.0337,Constituent Call,"(42.369, -71.0337)"
610568,101001521725,08/14/2015 04:56:00 PM,,08/18/2015 04:07:47 PM,ONTIME,Closed,Case Closed. Closed date : 2015-08-18 16:07:47.5 Case Noted FOUND A LOOSE GRATE COVER  TOOK OFF COVER CLEANED IT AND PUT ROPE TAR AROUND IT OK ON DEPARTURE 8/14,General Request,Boston Water & Sewer Commission,Administrative & General Requests,BWSC General Request,BWSC_All Cases,BWSC,,,920 Adams St  Dorchester  MA  02124,8.0,07,3.0,C11,Dorchester,7.0,16,1611.0,E,920 Adams St,2124.0,Address,1009.0,42.2788,-71.0551,Constituent Call,"(42.2788, -71.0551)"
610650,101001521830,08/14/2015 08:51:00 PM,,08/18/2015 04:05:29 PM,ONTIME,Closed,Case Closed. Closed date : 2015-08-18 16:05:29.53 Case Noted BWSC & PREMISE LINES DOWN & RUNNING ON ARRIVAL & DEPATURE  JETTED 250FT PAST CONNECTION NO SEWER BACK  ADVISED CUSTOMER TO ADDRESS PIPE ISSUES INSIDE THE BASEMENT 8/14,General Request,Boston Water & Sewer Commission,Administrative & General Requests,BWSC General Request,BWSC_All Cases,BWSC,,,130 Chandler St  Boston  MA  02116,4.0,1C,2.0,D4,South End,6.0,Ward 4,401.0,A,130 Chandler St,2116.0,Address,28683.0,42.3459,-71.0743,Constituent Call,"(42.3459, -71.0743)"
611434,101001522881,08/17/2015 11:27:00 AM,,08/18/2015 01:46:03 PM,ONTIME,Closed,Case Closed. Closed date : 2015-08-18 13:46:03.287 Case Noted Spoke to George Mendoza the property he is referring to is ?130 Salem St?. He has been receiving letters and shut off notices due to Reader device installation. He has scheduled appointment for 8/21. Comments in BESS for this account confirm appointment. Anita spoke to customer 8/17 noted appointment for 8/21 in comments and updated customer complaint info.,General Request,Boston Water & Sewer Commission,Administrative & General Requests,BWSC General Request,BWSC_All Cases,BWSC,,,143 Richmond St  Boston  MA  02113,3.0,1B,1.0,A1,Downtown / Financial District,3.0,Ward 3,303.0,RC,143 Richmond St,2113.0,Address,156019.0,42.3634,-71.0543,Constituent Call,"(42.3634, -71.0543)"
614658,101001527000,08/21/2015 09:43:00 AM,,08/28/2015 08:59:28 AM,ONTIME,Closed,Case Closed. Closed date : 2015-08-28 08:59:28.03 Case Resolved CLEANED & DISINFECTED Catch Basin  8/22,General Request,Boston Water & Sewer Commission,Administrative & General Requests,BWSC General Request,BWSC_All Cases,BWSC,,,5 Sanderson Pl  Brighton  MA  02135,11.0,04,9.0,D14,Allston / Brighton,15.0,Ward 22,2212.0,R1,5 Sanderson Pl,2135.0,Address,122265.0,42.355,-71.1516,Constituent Call,"(42.355, -71.1516)"
615070,101001527510,08/21/2015 03:23:00 PM,,09/28/2015 01:13:15 PM,ONTIME,Closed,Case Closed. Closed date : 2015-09-28 13:13:15.84 Case Resolved WE CLEARED DEBRIS OFF THE C/B COVER AND FLUSHED  C/B TAKES WATER NOW 9/24,General Request,Boston Water & Sewer Commission,Administrative & General Requests,BWSC General Request,BWSC_All Cases,BWSC,,,9 Crossman St  Mattapan  MA  02126,8.0,07,4.0,B3,Greater Mattapan,9.0,Ward 18,1802.0,R1,9 Crossman St,2126.0,Address,44554.0,42.2739,-71.0913,Constituent Call,"(42.2739, -71.0913)"
615174,101001527644,08/21/2015 06:19:00 PM,,08/26/2015 10:36:51 AM,ONTIME,Closed,Case Closed. Closed date : 2015-08-26 10:36:51.03 Case Noted THERE ARE NO BARRICADES OR TRIPOD IN THE AREA 8/22,General Request,Boston Water & Sewer Commission,Administrative & General Requests,BWSC General Request,BWSC_All Cases,BWSC,,,INTERSECTION of W Boundary Rd & Washington St  Hyde Park  MA,12.0,06,6.0,E5,West Roxbury,12.0,Ward 20,2005.0,,INTERSECTION W Boundary Rd & Washington St,,Intersection,1684.0,42.2676,-71.1502,Constituent Call,"(42.2676, -71.1502)"
615890,101001528647,08/24/2015 10:21:00 AM,,08/25/2015 10:34:06 AM,ONTIME,Closed,Case Closed. Closed date : 2015-08-25 10:34:06.213 Case Resolved LEAK REPAIRED 8/24,General Request,Boston Water & Sewer Commission,Administrative & General Requests,BWSC General Request,BWSC_All Cases,BWSC,,,69 Cedarcrest Rd  West Roxbury  MA  02132,12.0,06,6.0,E5,West Roxbury,10.0,Ward 20,2003.0,R1,69 Cedarcrest Rd,2132.0,Address,27173.0,42.2641,-71.1471,Constituent Call,"(42.2641, -71.1471)"
616160,101001529003,08/24/2015 02:20:00 PM,,08/28/2015 08:59:56 AM,ONTIME,Closed,"Case Closed. Closed date : 2015-08-28 08:59:56.433 Case Resolved REPAIRED LEAK ON 4""INCH SERVICE 8/26",General Request,Boston Water & Sewer Commission,Administrative & General Requests,BWSC General Request,BWSC_All Cases,BWSC,,,171 Forest Hills St  Jamaica Plain  MA  02130,9.0,02,6.0,E13,Jamaica Plain,11.0,Ward 11,1107.0,CM,171 Forest Hills St,2130.0,Address,59375.0,42.3064,-71.103,Constituent Call,"(42.3064, -71.103)"
616435,101001529358,08/24/2015 11:23:00 PM,,08/25/2015 10:41:33 AM,ONTIME,Closed,Case Closed. Closed date : 2015-08-25 10:41:33.773 Case Noted Umbro Corp responded he called BWSC back and stated that there was not a leak on the by-pass.  However there is a packing leak on one of the valves that is down 8/24,General Request,Boston Water & Sewer Commission,Administrative & General Requests,BWSC General Request,BWSC_All Cases,BWSC,,,52 Intervale St  Dorchester  MA  02121,7.0,03,4.0,B2,Roxbury,13.0,Ward 14,1401.0,R3,52 Intervale St,2121.0,Address,78762.0,42.3114,-71.0791,Constituent Call,"(42.3114, -71.0791)"
617152,101001530296,08/25/2015 05:36:00 PM,,08/26/2015 09:08:42 AM,ONTIME,Closed,Case Closed. Closed date : 2015-08-26 09:08:42.08 Case Noted Contractor had main down  main was let back on 8/24.,General Request,Boston Water & Sewer Commission,Administrative & General Requests,BWSC General Request,BWSC_All Cases,BWSC,,,422 Hanover St  Boston  MA  02113,3.0,1B,1.0,A1,Downtown / Financial District,3.0,Ward 3,301.0,CD,422 Hanover St,2113.0,Address,69146.0,42.3665,-71.0529,Constituent Call,"(42.3665, -71.0529)"
617792,101001541096,08/26/2015 12:55:42 PM,,08/26/2015 12:59:11 PM,ONTIME,Closed,Case Closed. Closed date : 2015-08-26 12:59:11.143 Case Invalid opened in error,General Request,Boston Water & Sewer Commission,Administrative & General Requests,BWSC General Request,BWSC_All Cases,BWSC,,,9 W Broadway  South Boston  MA  02127,6.0,05,2.0,C6,South Boston / South Boston Waterfront,5.0,Ward 6,601.0,CM,9 W Broadway,2127.0,Address,21578.0,42.3425,-71.0569,Constituent Call,"(42.3425, -71.0569)"
617796,101001541104,08/26/2015 12:57:00 PM,,,ONTIME,Open,,General Request,Boston Water & Sewer Commission,Administrative & General Requests,BWSC General Request,BWSC_All Cases,BWSC,,,9 W Broadway  South Boston  MA  02127,6.0,05,2.0,C6,South Boston / South Boston Waterfront,5.0,Ward 6,601.0,CM,9 W Broadway,2127.0,Address,21578.0,42.3425,-71.0569,Constituent Call,"(42.3425, -71.0569)"
618602,101001542212,08/27/2015 02:05:00 PM,,08/28/2015 02:46:05 PM,ONTIME,Closed,Case Closed. Closed date : 2015-08-28 14:46:05.203 Case Resolved Crew investigated on 8/28/15 found no evidence of illegal dumping.,General Request,Boston Water & Sewer Commission,Administrative & General Requests,BWSC General Request,BWSC_All Cases,BWSC,,,37 Charlotte St  Dorchester  MA  02121,7.0,03,4.0,B3,Greater Mattapan,8.0,Ward 14,1407.0,R1,37 Charlotte St,2121.0,Address,29882.0,42.2991,-71.0848,Constituent Call,"(42.2991, -71.0848)"
619066,101001542851,08/28/2015 09:14:00 AM,,08/31/2015 03:02:09 PM,ONTIME,Closed,Case Closed. Closed date : 2015-08-31 15:02:09.177 Case Noted CALLED SPOKE TO CALLER EXPLAINED COPPER IN STREET  SHE WILL HAVE SOMEONE CHECK TO SEE IF HER PIPE INSIDE IS LEAD. IF SO  I EXPLAINED LEAD REMOVAL PROGRAM TO CUSTOMER. 8/31,General Request,Boston Water & Sewer Commission,Administrative & General Requests,BWSC General Request,BWSC_All Cases,BWSC,,,867 E Broadway  South Boston  MA  02127,6.0,05,2.0,C6,South Boston / South Boston Waterfront,5.0,Ward 6,608.0,R1,867 E Broadway,2127.0,Address,21277.0,42.3356,-71.0295,Constituent Call,"(42.3356, -71.0295)"
621268,101001546009,09/01/2015 08:06:00 AM,,,ONTIME,Open,,General Request,Boston Water & Sewer Commission,Administrative & General Requests,BWSC General Request,BWSC_All Cases,BWSC,,,1 City Hall Plz  Boston  MA  02108,3.0,1B,1.0,A1,Downtown / Financial District,3.0,03,306.0,E,1 City Hall Plz,2108.0,Address,32856.0,42.3604,-71.0583,Constituent Call,"(42.3604, -71.0583)"
621477,101001546326,09/01/2015 10:11:00 AM,,09/10/2015 01:00:40 PM,ONTIME,Closed,Case Closed. Closed date : 2015-09-10 13:00:40.623 Duplicate of Existing Case case entered in ISD for insepction 1572431,General Request,Boston Water & Sewer Commission,Administrative & General Requests,BWSC General Request,ISD_Administrative,ISD,,,15 Frankfort St  East Boston  MA  02128,1.0,09,1.0,A7,East Boston,1.0,Ward 1,102.0,R3,15 Frankfort St,2128.0,Address,60503.0,42.3692,-71.0356,Constituent Call,"(42.3692, -71.0356)"
622028,101001547085,09/01/2015 05:58:00 PM,,09/03/2015 09:50:56 AM,ONTIME,Closed,Case Closed. Closed date : 2015-09-03 09:50:56.51 Case Noted THE IRRIGATION SYSTEM IN THE BOSTON COMMON WAS LEAKING COULD NOT LOCATE CONTROL PARK & RECREATION DEPT SENT PLUMBER TO SHUT IT OFF & STOP LEAK. 9/1,General Request,Boston Water & Sewer Commission,Administrative & General Requests,BWSC General Request,PARK_Maintenance_Trades,PARK,,,INTERSECTION of Beacon St & Park St  Boston  MA,3.0,1B,8.0,A1,Beacon Hill,14.0,Ward 5,503.0,,INTERSECTION Beacon St & Park St,,Intersection,1110.0,42.3577,-71.0632,Constituent Call,"(42.3577, -71.0632)"
622360,101001547527,09/02/2015 09:08:00 AM,,09/03/2015 03:32:03 PM,ONTIME,Closed,Case Closed. Closed date : 2015-09-03 15:32:03.047 Case Noted NO ODOR FOUND  CHECKED ALL LINES & DISINFECTED CATCH BASIN 'S IN AREA 9/2.,General Request,Boston Water & Sewer Commission,Administrative & General Requests,BWSC General Request,BWSC_All Cases,BWSC,,,40 Hereford St  Boston  MA  02115,4.0,1C,8.0,D4,Back Bay,14.0,Ward 5,509.0,CM,40 Hereford St,2115.0,Address,73002.0,42.3494,-71.0858,Constituent Call,"(42.3494, -71.0858)"
622930,101001548297,09/02/2015 03:36:00 PM,,,ONTIME,Open,,General Request,Boston Water & Sewer Commission,Administrative & General Requests,BWSC General Request,BWSC_All Cases,BWSC,,,194 Bremen St  East Boston  MA  02128,1.0,09,1.0,A7,East Boston,1.0,Ward 1,105.0,R3,194 Bremen St,2128.0,Address,19806.0,42.3732,-71.0341,Constituent Call,"(42.3732, -71.0341)"
623098,101001548531,09/02/2015 08:26:00 PM,,09/03/2015 09:48:23 AM,ONTIME,Closed,Case Closed. Closed date : 2015-09-03 09:48:23.617 Case Noted I spoke to inspector M. Rivers that contractor works for Boston Public School blocking Salem  N. Bennet St  Tileston and Wiggins on School renovation and do some digging on Wiggins and Tileston.  BWSC?s contractor have completed the water main installation and only paving today.,General Request,Boston Water & Sewer Commission,Administrative & General Requests,BWSC General Request,BWSC_All Cases,BWSC,,,19 Tileston St  Mattapan  MA  02126,8.0,08,5.0,E18,Hyde Park,9.0,Ward 18,1805.0,R2,19 Tileston St,2126.0,Address,136035.0,42.2645,-71.1055,Constituent Call,"(42.2645, -71.1055)"
623106,101001548549,09/02/2015 09:19:00 PM,,09/03/2015 09:50:13 AM,ONTIME,Closed,Case Closed. Closed date : 2015-09-03 09:50:13.74 Case Noted SEWER LINE DOWN & RUNNING  OWNER HAS A PRIVATE LATERAL BROKEN.OWNER TO APPROVED FOR LATERAL PROGRAM 7/14. OWNER'S ENGINEER SUBMITTED GSA APPLICATION TO ENG CUST.SERVICE TO RUN NEW LATERAL OUT FRONT OF HOUSE TO NEPSONSET AVE. CURRENT LATERAL RUNS THROUGH BACKYARDS TO ADAMS ST. CALLED OWNER LEFT MESSAGE REGARDING THIS  ALSO NOTIFIED ISD 9/3,General Request,Boston Water & Sewer Commission,Administrative & General Requests,BWSC General Request,BWSC_All Cases,BWSC,,,19-21 Neponset Ave  Dorchester  MA  02122,7.0,07,3.0,C11,Dorchester,7.0,Ward 16,1602.0,R2,19-21 Neponset Ave,2122.0,Address,100792.0,42.2966,-71.0559,Constituent Call,"(42.2966, -71.0559)"
623196,101001548664,09/03/2015 07:30:00 AM,,,ONTIME,Open,,General Request,Boston Water & Sewer Commission,Administrative & General Requests,BWSC General Request,INFO01_GenericeFormforOtherServiceRequestTypes,INFO,,,INTERSECTION of Boylston St & Lamartine St  Jamaica Plain  MA,9.0,02,6.0,E13,Jamaica Plain,11.0,Ward 19,1904.0,,INTERSECTION Boylston St & Lamartine St,,Intersection,1797.0,42.317,-71.1049,Constituent Call,"(42.317, -71.1049)"
623406,101001548964,09/03/2015 09:56:00 AM,,11/27/2015 01:01:18 PM,ONTIME,Closed,Case Closed. Closed date : 2015-11-27 13:01:18.537 Case Noted contractor works for Boston Public School blocking Salem  N. Bennet St  Tileston and Wiggins on School renovation and do some digging on Wiggins and Tileston.  BWSC?s contractor have completed the water main installation and only paving.,General Request,Boston Water & Sewer Commission,Administrative & General Requests,BWSC General Request,BWSC_All Cases,BWSC,,,21 N Bennet St  Boston  MA  02113,3.0,1B,1.0,A1,Downtown / Financial District,3.0,Ward 3,303.0,CM,21 N Bennet St,2113.0,Address,14348.0,42.3653,-71.054,Constituent Call,"(42.3653, -71.054)"
623487,101001549077,09/03/2015 10:49:00 AM,,09/03/2015 03:36:00 PM,ONTIME,Closed,Case Closed. Closed date : 2015-09-03 15:36:00.08 Case Noted Called customer twice customer disconnected call. BWSC operations dept  has not been to property. Per BESS high consumption letter sent 8/31. This would indicate internal leak in property. Individual has a severe leak and it needs to  be fixed.,General Request,Boston Water & Sewer Commission,Administrative & General Requests,BWSC General Request,BWSC_All Cases,BWSC,,,103 Geneva Ave  Dorchester  MA  02121,7.0,03,4.0,B2,Roxbury,13.0,Ward 14,1403.0,R3,103 Geneva Ave,2121.0,Address,63257.0,42.3064,-71.0792,Constituent Call,"(42.3064, -71.0792)"
624420,101001570396,09/04/2015 01:42:00 PM,,09/08/2015 10:37:28 AM,ONTIME,Closed,Case Closed. Closed date : 2015-09-08 10:37:28.89 Case Noted There is no sewage coming out here. There is a leaking cleanout pipe (rain water discharge). Owner has been notified to repair.,General Request,Boston Water & Sewer Commission,Administrative & General Requests,BWSC General Request,BWSC_All Cases,BWSC,,,INTERSECTION of Salem St & Stillman St  Boston  MA,3.0,1B,1.0,A1,Downtown / Financial District,3.0,Ward 3,303.0,,INTERSECTION Salem St & Stillman St,,Intersection,8265.0,42.3636,-71.0559,Constituent Call,"(42.3636, -71.0559)"
624959,101001571129,09/06/2015 09:06:00 AM,,09/08/2015 10:42:21 AM,ONTIME,Closed,Case Closed. Closed date : 2015-09-08 10:42:21.527 Case Noted OWNERS CLEANOUT STILL LEAKING FROM REAR OF BLD DISINFECTED & WASHED DOWN AREA WITH HYDRANT. OWNER HAS BEEN NOTIFIED TO REPAIR. 9/6,General Request,Boston Water & Sewer Commission,Administrative & General Requests,BWSC General Request,BWSC_All Cases,BWSC,,,INTERSECTION of Salem St & Stillman St  Boston  MA,3.0,1B,1.0,A1,Downtown / Financial District,3.0,Ward 3,303.0,,INTERSECTION Salem St & Stillman St,,Intersection,8265.0,42.3636,-71.0559,Constituent Call,"(42.3636, -71.0559)"
625907,101001572477,09/08/2015 01:28:00 PM,,09/09/2015 09:30:09 AM,ONTIME,Closed,Case Closed. Closed date : 2015-09-09 09:30:09.557 Case Noted Feeney Bros on site pulled service  water to be restored once repairs made  9/8/2015.,General Request,Boston Water & Sewer Commission,Administrative & General Requests,BWSC General Request,BWSC_All Cases,BWSC,,,166 Endicott St  Boston  MA  02113,3.0,1B,1.0,A1,Downtown / Financial District,3.0,Ward 3,304.0,R4,166 Endicott St,2113.0,Address,53826.0,42.3656,-71.0576,Constituent Call,"(42.3656, -71.0576)"
627125,101001574262,09/09/2015 08:19:00 PM,,09/10/2015 10:55:44 AM,ONTIME,Closed,Case Closed. Closed date : 2015-09-10 10:55:44.383 Case Resolved Clean and disinfected all catch basin's on 9/9.,General Request,Boston Water & Sewer Commission,Administrative & General Requests,BWSC General Request,BWSC_All Cases,BWSC,,,40 W Third St  South Boston  MA  02127,6.0,05,2.0,C6,South Boston,5.0,06,601.0,,40 W Third St,2127.0,Address,352675.0,42.3594,-71.0587,Constituent Call,"(0, 0)"
627321,101001574551,09/10/2015 09:05:00 AM,,,ONTIME,Open,,General Request,Boston Water & Sewer Commission,Administrative & General Requests,BWSC General Request,INFO01_GenericeFormforOtherServiceRequestTypes,INFO,,,INTERSECTION of Devonshire St & State St  Boston  MA,3.0,1C,1.0,A1,Downtown / Financial District,3.0,Ward 3,306.0,,INTERSECTION Devonshire St & State St,,Intersection,4060.0,42.3588,-71.057,Constituent Call,"(42.3588, -71.057)"
629128,101001577157,09/13/2015 02:52:00 PM,,09/14/2015 10:41:51 AM,ONTIME,Closed,Case Closed. Closed date : 2015-09-14 10:41:51.513 Case Resolved BWSC LINE WAS STOPPED JETTED  AND FREED LINE  DOWN & RUNNING UPON DEPARTURE 9/13,General Request,Boston Water & Sewer Commission,Administrative & General Requests,BWSC General Request,BWSC_All Cases,BWSC,,,71 Kingsdale St  Dorchester  MA  02124,8.0,03,4.0,B3,Greater Mattapan,8.0,14,1407.0,A,71 Kingsdale St,2124.0,Address,81964.0,42.2949,-71.0828,Constituent Call,"(42.2949, -71.0828)"
629238,101001577306,09/14/2015 06:35:00 AM,,09/14/2015 10:41:09 AM,ONTIME,Closed,Case Closed. Closed date : 2015-09-14 10:41:09.07 Case Resolved There was a hose leaking  it has been fixed.,General Request,Boston Water & Sewer Commission,Administrative & General Requests,BWSC General Request,BWSC_All Cases,BWSC,,,225 Marion St  East Boston  MA  02128,1.0,09,1.0,A7,East Boston,1.0,Ward 1,105.0,R3,225 Marion St,2128.0,Address,90021.0,42.3748,-71.0341,Constituent Call,"(42.3748, -71.0341)"
630077,101001578439,09/15/2015 06:57:00 AM,,09/15/2015 08:40:14 AM,ONTIME,Closed,Case Closed. Closed date : 2015-09-15 08:40:14.02 Case Noted BWSC dye tested properties at F St & W Fourth St with colored dye. Dye showed on sidewalk from 403 W Fourth St. SSO reported 9/14/15,General Request,Boston Water & Sewer Commission,Administrative & General Requests,BWSC General Request,BWSC_All Cases,BWSC,,,INTERSECTION of F St & W Fourth St  South Boston  MA,6.0,05,2.0,C6,South Boston / South Boston Waterfront,5.0,Ward 6,603.0,,INTERSECTION F St & W Fourth St,,Intersection,4728.0,42.3361,-71.0486,Constituent Call,"(42.3361, -71.0486)"
630420,101001578931,09/15/2015 11:04:00 AM,,09/17/2015 08:22:03 AM,ONTIME,Closed,Case Closed. Closed date : 2015-09-17 08:22:03.6 Case Resolved SEWER LINE D/R ON ARRIVAL   FLUSHED AND DISINFECTED Catch Basin's on 9/15.,General Request,Boston Water & Sewer Commission,Administrative & General Requests,BWSC General Request,BWSC_All Cases,BWSC,,,18 Converse St  Brighton  MA  02135,11.0,04,9.0,D14,Allston / Brighton,15.0,Ward 22,2211.0,R1,18 Converse St,2135.0,Address,42274.0,42.3567,-71.1558,Constituent Call,"(42.3567, -71.1558)"
631169,101001579961,09/16/2015 09:20:00 AM,,09/17/2015 02:04:44 PM,ONTIME,Closed,Case Closed. Closed date : 2015-09-17 14:04:44.627 Case Resolved Flushed and disinfected catch basin  basin has a hood 9/17,General Request,Boston Water & Sewer Commission,Administrative & General Requests,BWSC General Request,BWSC_All Cases,BWSC,,,39-39 Savin Hill Ave  Dorchester  MA  02125,7.0,03,3.0,C11,Dorchester,8.0,Ward 15,1504.0,C,39-39 Savin Hill Ave,2125.0,Address,156088.0,42.3128,-71.0574,Constituent Call,"(42.3128, -71.0574)"
631244,101001580108,09/16/2015 10:31:00 AM,,09/16/2015 12:04:54 PM,ONTIME,Closed,Case Closed. Closed date : 2015-09-16 12:04:54.533 Case Noted This customer was shutoff for non payment he has been asked several times to provide a doctors note.  He Should contact Customer service directly (617)989-7000.,General Request,Boston Water & Sewer Commission,Administrative & General Requests,BWSC General Request,BWSC_All Cases,BWSC,,,429 W Fourth St  South Boston  MA  02127,6.0,05,2.0,C6,South Boston / South Boston Waterfront,5.0,Ward 7,704.0,R1,429 W Fourth St,2127.0,Address,60297.0,42.3356,-71.0481,Constituent Call,"(42.3356, -71.0481)"
631585,101001580657,09/16/2015 04:29:42 PM,,09/16/2015 04:30:35 PM,ONTIME,Closed,Case Closed. Closed date : 2015-09-16 16:30:35.543 Case Invalid Incorrect form,General Request,Boston Water & Sewer Commission,Administrative & General Requests,BWSC General Request,BWSC_All Cases,BWSC,,,10 Salutation St  Boston  MA  02109,3.0,1B,1.0,A1,Downtown / Financial District,3.0,Ward 3,301.0,E,10 Salutation St,2109.0,Address,122074.0,42.3661,-71.0525,Constituent Call,"(42.3661, -71.0525)"
631646,101001580732,09/16/2015 05:47:00 PM,,09/28/2015 01:11:47 PM,ONTIME,Closed,Case Closed. Closed date : 2015-09-28 13:11:47.067 Case Resolved CLEANED AND DISINFECTED C/B 9/24,General Request,Boston Water & Sewer Commission,Administrative & General Requests,BWSC General Request,BWSC_All Cases,BWSC,,,INTERSECTION of Dwight St & Taylor St  Roxbury  MA,4.0,1C,2.0,D4,South End,4.0,Ward 3,307.0,,INTERSECTION Dwight St & Taylor St,,Intersection,4344.0,42.3441,-71.0683,Constituent Call,"(42.3441, -71.0683)"
632167,101001581476,09/17/2015 01:33:00 PM,,09/17/2015 07:54:23 PM,ONTIME,Closed,Case Closed. Closed date : 2015-09-17 19:54:23.403 Case Noted FORWARDED TO CONSTRUCTION,General Request,Boston Water & Sewer Commission,Administrative & General Requests,BWSC General Request,BWSC_All Cases,BWSC,,,INTERSECTION of Court Sq & Franklin Ave  Boston  MA,3.0,1C,1.0,A1,Downtown / Financial District,3.0,Ward 3,306.0,,INTERSECTION Court Sq & Franklin Ave,,Intersection,3606.0,42.359,-71.0586,Constituent Call,"(42.359, -71.0586)"
632910,101001582594,09/18/2015 03:13:00 PM,,09/21/2015 09:19:20 AM,ONTIME,Closed,Case Closed. Closed date : 2015-09-21 09:19:20.91 Case Noted   CALLED TO GO TO 22 FISHER AV BY BPD SERGEANT STATED UNKNOWN VEHICLE CAME IN CONTACT WITH OVERHEAD WIRES THAT LANDED ON Catch Basin 237-18H Catch Basin  OK ON ARRIVAL AREA SECURE 9/18,General Request,Boston Water & Sewer Commission,Administrative & General Requests,BWSC General Request,BWSC_All Cases,BWSC,,,22 Fisher Ave  Mission Hill  MA  02120,9.0,10A,8.0,B2,Mission Hill,14.0,Ward 10,1005.0,R4,22 Fisher Ave,2120.0,Address,58576.0,42.3272,-71.1008,Constituent Call,"(42.3272, -71.1008)"
633265,101001583092,09/19/2015 03:34:00 PM,,09/21/2015 01:25:33 PM,ONTIME,Closed,Case Closed. Closed date : 2015-09-21 13:25:33.357 Case Resolved REMOVED DAMAGED BARRICADE 9/20,General Request,Boston Water & Sewer Commission,Administrative & General Requests,BWSC General Request,BWSC_All Cases,BWSC,,,INTERSECTION of W Boundary Rd & Washington St  Hyde Park  MA,12.0,06,6.0,E5,West Roxbury,12.0,Ward 20,2005.0,,INTERSECTION W Boundary Rd & Washington St,,Intersection,1684.0,42.2676,-71.1502,Constituent Call,"(42.2676, -71.1502)"
635523,101001586345,09/23/2015 02:29:00 PM,,09/24/2015 03:55:18 PM,ONTIME,Closed,Case Closed. Closed date : 2015-09-24 15:55:18.64 Case Resolved FLUSHED Catch Basin'S IN AREA  ALL TAKING WATER 9/23,General Request,Boston Water & Sewer Commission,Administrative & General Requests,BWSC General Request,BWSC_All Cases,BWSC,,,INTERSECTION of Washington St & Whipple Ave  Roslindale  MA,12.0,02,5.0,E5,Roslindale,10.0,Ward 19,1911.0,,INTERSECTION Washington St & Whipple Ave,,Intersection,6002.0,42.2918,-71.1225,Constituent Call,"(42.2918, -71.1225)"
635539,101001586368,09/23/2015 02:41:00 PM,,09/24/2015 09:12:31 AM,ONTIME,Closed,Case Closed. Closed date : 2015-09-24 09:12:31.403 Case Noted Customer needs to contact customer service at (617)989-7000 to schedule a inspection.,General Request,Boston Water & Sewer Commission,Administrative & General Requests,BWSC General Request,BWSC_All Cases,BWSC,,,103 Geneva Ave  Dorchester  MA  02121,7.0,03,4.0,B2,Roxbury,13.0,Ward 14,1403.0,R3,103 Geneva Ave,2121.0,Address,63257.0,42.3064,-71.0792,Constituent Call,"(42.3064, -71.0792)"
635556,101001586387,09/23/2015 02:56:00 PM,,09/24/2015 03:55:58 PM,ONTIME,Closed,Case Closed. Closed date : 2015-09-24 15:55:58.933 Case Resolved NO LEAK OR WATER IN CONTROL  NO NOISE ON CONTROL  WENT INSIDE CHECKED METER  & LISTENED ON PIPE NO WATER ENTERING 9/23.,General Request,Boston Water & Sewer Commission,Administrative & General Requests,BWSC General Request,BWSC_All Cases,BWSC,,,103 Geneva Ave  Dorchester  MA  02121,7.0,03,4.0,B2,Roxbury,13.0,Ward 14,1403.0,R3,103 Geneva Ave,2121.0,Address,63257.0,42.3064,-71.0792,Constituent Call,"(42.3064, -71.0792)"
636174,101001597254,09/24/2015 02:03:00 PM,,09/24/2015 03:42:18 PM,ONTIME,Closed,Case Closed. Closed date : 2015-09-24 15:42:18.6 Case Noted Flushed and disinfected Catch Basin  9/24,General Request,Boston Water & Sewer Commission,Administrative & General Requests,BWSC General Request,BWSC_All Cases,BWSC,,,4011-4019 Washington St  Roslindale  MA  02131,12.0,02,5.0,E5,Roslindale,10.0,Ward 19,1911.0,RC,4011-4019 Washington St,2131.0,Address,145064.0,42.2923,-71.1222,Employee Generated,"(42.2923, -71.1222)"
636646,101001597971,09/25/2015 10:56:00 AM,,09/25/2015 04:29:59 PM,ONTIME,Closed,Case Closed. Closed date : 2015-09-25 16:29:59.867 Case Resolved Crew lowered sidewalk top 9/25,General Request,Boston Water & Sewer Commission,Administrative & General Requests,BWSC General Request,BWSC_All Cases,BWSC,,,153 Ruthven St  Dorchester  MA  02121,9.0,10B,7.0,B2,Roxbury,13.0,Ward 12,1209.0,R3,153 Ruthven St,2121.0,Address,119987.0,42.3118,-71.0886,Constituent Call,"(42.3118, -71.0886)"
637064,101001598533,09/26/2015 08:21:00 AM,,09/28/2015 01:28:29 PM,ONTIME,Closed,Case Closed. Closed date : 2015-09-28 13:28:29.877 Case Resolved SHUT OFF AND LET BACK ON 9/26,General Request,Boston Water & Sewer Commission,Administrative & General Requests,BWSC General Request,INFO_Reallocation From Dept,INFO,,,23-25 Houghton St  Dorchester  MA  02122,8.0,07,3.0,C11,Dorchester,7.0,Ward 16,1605.0,R2,23-25 Houghton St,2122.0,Address,75426.0,42.2955,-71.0527,Constituent Call,"(42.2955, -71.0527)"
638035,101001599911,09/28/2015 03:20:00 PM,,09/29/2015 01:44:49 PM,ONTIME,Closed,Case Closed. Closed date : 2015-09-29 13:44:49.647 Case Noted I talked with Chris Pacella who spoke with this person today about the car situation.  We never blocked his driveway  we put a road open to a butters only sign up.  I will put a sign up tomorrow saying open to businesses  to help the situation.,General Request,Boston Water & Sewer Commission,Administrative & General Requests,BWSC General Request,BWSC_All Cases,BWSC,,,404 Bremen St  East Boston  MA  02128,1.0,09,1.0,A7,East Boston,1.0,Ward 1,110.0,C,404 Bremen St,2128.0,Address,19878.0,42.3787,-71.0277,Constituent Call,"(42.3787, -71.0277)"
638695,101001600839,09/29/2015 03:00:00 PM,,09/29/2015 04:31:46 PM,ONTIME,Closed,Case Closed. Closed date : 2015-09-29 16:31:46.36 Case Noted Main was shut down to repair leak  main back on. BWSC manager spoke to caller 9/29,General Request,Boston Water & Sewer Commission,Administrative & General Requests,BWSC General Request,BWSC_All Cases,BWSC,,,169 Moss Hill Rd  Jamaica Plain  MA  02130,9.0,02,6.0,E13,Jamaica Plain,11.0,Ward 19,1902.0,R1,169 Moss Hill Rd,2130.0,Address,97955.0,42.3066,-71.1271,Constituent Call,"(42.3066, -71.1271)"
638981,101001601203,09/30/2015 07:37:00 AM,,10/01/2015 02:13:16 PM,ONTIME,Closed,Case Closed. Closed date : 2015-10-01 14:13:16.66 Case Noted Called spoke to caller flooding in yard subsided  she is all set 10/1,General Request,Boston Water & Sewer Commission,Administrative & General Requests,BWSC General Request,BWSC_All Cases,BWSC,,,7 Myopia Rd  Hyde Park  MA  02136,12.0,08,5.0,E18,Roslindale,10.0,Ward 18,1812.0,R1,7 Myopia Rd,2136.0,Address,99624.0,42.2639,-71.1274,Constituent Call,"(42.2639, -71.1274)"
639135,101001601436,09/30/2015 10:13:00 AM,,09/30/2015 04:09:19 PM,ONTIME,Closed,Case Closed. Closed date : 2015-09-30 16:09:19.28 Case Resolved Cleared debris off catch basins relieved flood 9/30,General Request,Boston Water & Sewer Commission,Administrative & General Requests,BWSC General Request,BWSC_All Cases,BWSC,,,49 Valley Rd  Dorchester  MA  02124,8.0,07,3.0,C11,Dorchester,7.0,Ward 17,1704.0,R1,49 Valley Rd,2124.0,Address,139749.0,42.2775,-71.0689,Constituent Call,"(42.2775, -71.0689)"
639693,101001602218,09/30/2015 10:29:00 PM,,10/01/2015 09:25:25 AM,ONTIME,Closed,Case Closed. Closed date : 2015-10-01 09:25:25.803 Case Resolved Crew retrieved keys 9/30,General Request,Boston Water & Sewer Commission,Administrative & General Requests,BWSC General Request,BWSC_All Cases,BWSC,,,122 Dacia St  Dorchester  MA  02125,7.0,03,7.0,B2,Dorchester,13.0,13,1301.0,E,122 Dacia St,2125.0,Address,45562.0,42.3182,-71.0764,Constituent Call,"(42.3182, -71.0764)"
640822,101001603977,10/03/2015 08:34:00 AM,,10/03/2015 07:02:17 PM,ONTIME,Closed,Case Closed. Closed date : 2015-10-03 19:02:17.69 Case Noted BHA has a broken main at 40 Annunciation Rd. 300 Ruggles is piped from this main. This main shut down at 4:00am by BWSC as a courtesy.,General Request,Boston Water & Sewer Commission,Administrative & General Requests,BWSC General Request,BWSC_All Cases,BWSC,,,300 Ruggles St  Mission Hill  MA  02120,9.0,10A,7.0,B2,Mission Hill,13.0,04,409.0,E,300 Ruggles St,2120.0,Address,302200.0,42.3364,-71.0928,Constituent Call,"(42.3364, -71.0928)"
640882,101001604061,10/03/2015 11:47:00 AM,,10/03/2015 07:04:13 PM,ONTIME,Closed,Case Closed. Closed date : 2015-10-03 19:04:13.827 Case Noted Met with caller. Pumped down catch basin and found nothing. Caller admits hes not sure where he lost his item.    Sullivan  BWSC,General Request,Boston Water & Sewer Commission,Administrative & General Requests,BWSC General Request,BWSC_All Cases,BWSC,,,267 Old Colony Ave  South Boston  MA  02127,6.0,05,2.0,C6,South Boston / South Boston Waterfront,5.0,Ward 7,706.0,C,267 Old Colony Ave,2127.0,Address,105084.0,42.331,-71.0532,Constituent Call,"(42.331, -71.0532)"
641479,101001604918,10/05/2015 10:50:00 AM,,10/05/2015 12:14:02 PM,ONTIME,Closed,Case Closed. Closed date : 2015-10-05 12:14:02.903 Case Noted FORWARD TO CUSTOMER SERVICE TO DISCUSS HIGH BILL  USAGE LOOKS TO BEBACK TO  NORMAL SINCE LAST WEEK. PREVIOUS CONSUMPTION APPEARS SPORACTIC (PATTERN OF TOILET LEAK)  please call customer service (617) 989-7000.,General Request,Boston Water & Sewer Commission,Administrative & General Requests,BWSC General Request,BWSC_All Cases,BWSC,,,230 Metropolitan Ave  Roslindale  MA  02131,12.0,06,5.0,E5,Roslindale,10.0,Ward 18,1809.0,R2,230 Metropolitan Ave,2131.0,Address,94843.0,42.2769,-71.1265,Constituent Call,"(42.2769, -71.1265)"
641963,101001605620,10/06/2015 07:52:00 AM,,10/07/2015 09:54:10 AM,ONTIME,Closed,Case Closed. Closed date : 2015-10-07 09:54:10.59 Case Resolved Construction working here shut down main  repaired gate  let main back on 10/6,General Request,Boston Water & Sewer Commission,Administrative & General Requests,BWSC General Request,BWSC_All Cases,BWSC,,,INTERSECTION of Brooks St & Paris St  East Boston  MA,1.0,09,1.0,A7,East Boston,1.0,Ward 1,105.0,,INTERSECTION Brooks St & Paris St,,Intersection,2108.0,42.3764,-71.033,Constituent Call,"(42.3764, -71.033)"
643221,101001607573,10/07/2015 06:51:00 PM,,11/27/2015 12:56:54 PM,ONTIME,Closed,Case Closed. Closed date : 2015-11-27 12:56:54.583 Case Resolved Called owner she stated everything is okay and problem is resolved 10/8,General Request,Boston Water & Sewer Commission,Administrative & General Requests,BWSC General Request,BWSC_All Cases,BWSC,,,32 Anderson St  Boston  MA  02114,3.0,1B,8.0,A1,Beacon Hill,14.0,Ward 5,504.0,CD,32 Anderson St,2114.0,Address,3522.0,42.36,-71.0676,Constituent Call,"(42.36, -71.0676)"
643549,101001608082,10/08/2015 11:46:00 AM,,10/13/2015 01:00:31 PM,ONTIME,Closed,Case Closed. Closed date : 2015-10-13 13:00:31.37 Case Resolved LOWER Side Walk  TOP TO GRADE on 10/9.,General Request,Boston Water & Sewer Commission,Administrative & General Requests,BWSC General Request,BWSC_All Cases,BWSC,,,98 Princeton St  East Boston  MA  02128,1.0,09,1.0,A7,East Boston,1.0,Ward 1,107.0,R2,98 Princeton St,2128.0,Address,113368.0,42.3777,-71.0361,Constituent Call,"(42.3777, -71.0361)"
643763,101001608438,10/08/2015 05:23:00 PM,,10/09/2015 10:40:15 AM,ONTIME,Closed,Case Closed. Closed date : 2015-10-09 10:40:15.333 Case Noted Called customer and left a voicemail. 10/7/2015,General Request,Boston Water & Sewer Commission,Administrative & General Requests,BWSC General Request,BWSC_All Cases,BWSC,,,30 Martinwood Rd  Jamaica Plain  MA  02130,12.0,02,6.0,E13,Jamaica Plain,11.0,Ward 19,1902.0,R1,30 Martinwood Rd,2130.0,Address,91773.0,42.3001,-71.1162,Constituent Call,"(42.3001, -71.1162)"
644191,101001609120,10/09/2015 02:05:00 PM,,10/09/2015 03:28:52 PM,ONTIME,Closed,Case Closed. Closed date : 2015-10-09 15:28:52.11 Case Noted Ms. Civitarese and Webb      Thank you for contacting the Boston Water and Sewer Commission about your concern.  This is to confirm that a staff person spoke to Joyce today and an appointment will be scheduled on Tuesday to resolve the matter.     We also receive your service request today from the Mayor?s Boston 311 service (request # 101001609120) about the same concern.    If you have any further questions  do not hesitate to contact the Boston Water and Sewer Commission.      Jeanne E. Richardson  Boston Water and Sewer Commission  980 Harrison Avenue  Boston  MA 02110  617-989-7000,General Request,Boston Water & Sewer Commission,Administrative & General Requests,BWSC General Request,BWSC_All Cases,BWSC,,,5277-5291 Washington St  West Roxbury  MA  02132,12.0,06,6.0,E5,West Roxbury,12.0,Ward 20,2015.0,CM,5277-5291 Washington St,2132.0,Address,145697.0,42.2593,-71.1599,Constituent Call,"(42.2593, -71.1599)"
644230,101001609198,10/09/2015 02:58:00 PM,,10/14/2015 07:58:43 AM,ONTIME,Closed,Case Closed. Closed date : 2015-10-14 07:58:43.797 Case Resolved NOT BWSC  PRIVATE SEWER LATERAL REPAIR ?JRF CORP,General Request,Boston Water & Sewer Commission,Administrative & General Requests,BWSC General Request,BWSC_All Cases,BWSC,,,65 Strathmore Rd  Brighton  MA  02135,11.0,04,9.0,D14,Allston / Brighton,15.0,Ward 21,2114.0,CM,65 Strathmore Rd,2135.0,Address,131440.0,42.3386,-71.1486,Constituent Call,"(42.3386, -71.1486)"
644770,101001609969,10/12/2015 06:00:00 AM,,10/13/2015 01:09:45 PM,ONTIME,Closed,Case Closed. Closed date : 2015-10-13 13:09:45.817 Case Noted FED CORP ROAD PLATE WAS DISLODGED FROM TRENCH  PUT CONES AROUND TRENCH AND ASSISTED FED CORP WITH A NEW PLATE AND COLD PATCHED 10/12,General Request,Boston Water & Sewer Commission,Administrative & General Requests,BWSC General Request,BWSC_All Cases,BWSC,,,INTERSECTION of Eustis St & Hampden St  Roxbury  MA,7.0,10B,7.0,B2,Roxbury,13.0,Ward 8,803.0,,INTERSECTION Eustis St & Hampden St,,Intersection,4668.0,42.327,-71.0752,Constituent Call,"(42.327, -71.0752)"
646068,101001611855,10/14/2015 12:15:19 PM,,10/16/2015 09:57:21 AM,ONTIME,Closed,Case Closed. Closed date : 2015-10-16 09:57:21.387 Case Resolved LOWERED Side walk on 10/14,General Request,Boston Water & Sewer Commission,Administrative & General Requests,BWSC General Request,BWSC_All Cases,BWSC,,,88 Pembroke St  Roxbury  MA  02118,4.0,1C,2.0,D4,South End,6.0,Ward 4,403.0,CM,88 Pembroke St,2118.0,Address,109086.0,42.342,-71.0765,Constituent Call,"(42.342, -71.0765)"
646849,101001612973,10/15/2015 01:19:00 PM,,10/19/2015 10:44:21 AM,ONTIME,Closed,Case Closed. Closed date : 2015-10-19 10:44:21.12 Case Resolved CLEANED ON DISINFECTED ON 10/16.,General Request,Boston Water & Sewer Commission,Administrative & General Requests,BWSC General Request,BWSC_All Cases,BWSC,,,INTERSECTION of Warren St & Soley St  Charlestown  MA,3.0,1A,1.0,A15,Charlestown,2.0,Ward 2,201.0,,INTERSECTION Warren St & Soley St,,Intersection,5918.0,42.3738,-71.0619,Constituent Call,"(42.3738, -71.0619)"
647917,101001614477,10/17/2015 05:02:53 PM,,10/19/2015 10:37:37 AM,ONTIME,Closed,Case Closed. Closed date : 2015-10-19 10:37:37.007 Case Resolved Stopped packing leak on valve 10/17,General Request,Boston Water & Sewer Commission,Administrative & General Requests,BWSC General Request,BWSC_All Cases,BWSC,,,INTERSECTION of Bennington St & Saratoga St  East Boston  MA,1.0,09,1.0,A7,East Boston,1.0,Ward 1,112.0,,INTERSECTION Bennington St & Saratoga St,,Intersection,1333.0,42.3866,-71.0067,Constituent Call,"(42.3866, -71.0067)"
649570,101001616740,10/21/2015 08:47:00 AM,,10/21/2015 11:27:43 AM,ONTIME,Closed,Case Closed. Closed date : 2015-10-21 11:27:43.063 Case Noted Notified manager to contact contractor (National Water Main ) to move vehicle  10/21,General Request,Boston Water & Sewer Commission,Administrative & General Requests,BWSC General Request,BWSC_All Cases,BWSC,,,INTERSECTION of Ruggles St & Whittier St  Mission Hill  MA,9.0,10B,7.0,B2,Roxbury,13.0,Ward 9,904.0,,INTERSECTION Ruggles St & Whittier St,,Intersection,8206.0,42.3345,-71.0895,Constituent Call,"(42.3345, -71.0895)"
651687,101001619824,10/25/2015 09:02:00 AM,,10/29/2015 05:05:36 PM,ONTIME,Closed,Case Closed. Closed date : 2015-10-29 17:05:36.483 Case Resolved Flushed hydrant until clear 10/25,General Request,Boston Water & Sewer Commission,Administrative & General Requests,BWSC General Request,BWSC_All Cases,BWSC,,,97 Bartlett St  Charlestown  MA  02129,3.0,1A,1.0,A15,Charlestown,2.0,Ward 2,206.0,CM,97 Bartlett St,2129.0,Address,8504.0,42.3791,-71.0655,Constituent Call,"(42.3791, -71.0655)"
651754,101001619913,10/25/2015 02:46:00 PM,,10/30/2015 10:44:36 AM,ONTIME,Closed,Case Closed. Closed date : 2015-10-30 10:44:36.84 Case Resolved BWSC conducting internal investigation,General Request,Boston Water & Sewer Commission,Administrative & General Requests,BWSC General Request,BWSC_All Cases,BWSC,,,97 Bartlett St  Charlestown  MA  02129,3.0,1A,1.0,A15,Charlestown,2.0,Ward 2,206.0,CM,97 Bartlett St,2129.0,Address,8504.0,42.3791,-71.0655,Constituent Call,"(42.3791, -71.0655)"
652235,101001620651,10/26/2015 02:36:00 PM,,,ONTIME,Open,,General Request,Boston Water & Sewer Commission,Administrative & General Requests,BWSC General Request,BWSC_All Cases,BWSC,,,26 Greenwich St  Dorchester  MA  02122,7.0,03,3.0,C11,Dorchester,8.0,Ward 15,1506.0,R1,26 Greenwich St,2122.0,Address,165808.0,42.3037,-71.0583,Constituent Call,"(42.3037, -71.0583)"
653452,101001622415,10/28/2015 10:28:00 AM,,10/30/2015 10:47:39 AM,ONTIME,Closed,Case Closed. Closed date : 2015-10-30 10:47:39.787 Case Resolved LOWERED TO GRADE 10/28,General Request,Boston Water & Sewer Commission,Administrative & General Requests,BWSC General Request,BWSC_All Cases,BWSC,,,90 Whitford St  Roslindale  MA  02131,12.0,06,5.0,E5,Roslindale,10.0,Ward 18,1809.0,R1,90 Whitford St,2131.0,Address,149379.0,42.2791,-71.1264,Constituent Call,"(42.2791, -71.1264)"
653852,101001622968,10/29/2015 06:16:00 AM,,11/02/2015 09:07:13 AM,ONTIME,Closed,Case Closed. Closed date : 2015-11-02 09:07:13.94 Case Noted RELIEVED FLOOD IN STREET  CB TAKING WATER 10/29,General Request,Boston Water & Sewer Commission,Administrative & General Requests,BWSC General Request,BWSC_All Cases,BWSC,,,INTERSECTION of Washington St & Walton St  Dorchester  MA,8.0,07,4.0,C11,Dorchester,9.0,Ward 17,1708.0,,INTERSECTION Washington St & Walton St,,Intersection,6115.0,42.2872,-71.0712,Constituent Call,"(42.2872, -71.0712)"
654724,101001624297,10/30/2015 01:21:00 PM,,11/02/2015 09:06:38 AM,ONTIME,Closed,Case Closed. Closed date : 2015-11-02 09:06:38.333 Case Noted BWSC lines were down and running  internal issue 10/30,General Request,Boston Water & Sewer Commission,Administrative & General Requests,BWSC General Request,BWSC_All Cases,BWSC,,,84 Lagrange St  West Roxbury  MA  02132,12.0,06,6.0,E5,West Roxbury,12.0,Ward 20,2010.0,R2,84 Lagrange St,2132.0,Address,82926.0,42.2751,-71.1462,Constituent Call,"(42.2751, -71.1462)"
655357,101001625160,11/01/2015 02:28:00 PM,,11/02/2015 09:05:42 AM,ONTIME,Closed,Case Closed. Closed date : 2015-11-02 09:05:42.92 Case Resolved Water was shut off @ the sidewalk 11/1  broken pipe on 2nd floor,General Request,Boston Water & Sewer Commission,Administrative & General Requests,BWSC General Request,BWSC_All Cases,BWSC,,,1123 Saratoga St  East Boston  MA  02128,1.0,09,1.0,A7,East Boston,1.0,Ward 1,112.0,R2,1123 Saratoga St,2128.0,Address,305662.0,42.3846,-71.0014,Constituent Call,"(42.3846, -71.0014)"
655498,101001625355,11/02/2015 08:17:00 AM,,11/05/2015 08:28:28 AM,ONTIME,Closed,Case Closed. Closed date : 2015-11-05 08:28:28.35 Case Resolved CLEANED AND DISINFECTED 2 Catch basin's 11/3,General Request,Boston Water & Sewer Commission,Administrative & General Requests,BWSC General Request,BWSC_All Cases,BWSC,,,INTERSECTION of George St & Langdon St  Roxbury  MA,7.0,03,7.0,B2,Roxbury,13.0,Ward 8,0805,,INTERSECTION George St & Langdon St,,Intersection,5270.0,42.3246,-71.0717,Constituent Call,"(42.3246, -71.0717)"
656689,101001627101,11/03/2015 04:15:00 PM,,11/05/2015 08:29:00 AM,ONTIME,Closed,Case Closed. Closed date : 2015-11-05 08:29:00.18 Case Resolved RETRIEVED PHONE GAVE TO OWNER 11/3,General Request,Boston Water & Sewer Commission,Administrative & General Requests,BWSC General Request,BWSC_All Cases,BWSC,,,695 Hyde Park Ave  Roslindale  MA  02131,12.0,08,5.0,E18,Roslindale,10.0,Ward 18,1808,R2,695 Hyde Park Ave,2131.0,Address,77511.0,42.2766,-71.1199,Constituent Call,"(42.2766, -71.1199)"
660291,101001632394,11/10/2015 02:09:00 PM,,11/17/2015 02:22:15 PM,ONTIME,Closed,Case Closed. Closed date : 2015-11-17 14:22:15.037 Case Noted HYD HAD METER ON IT  BEING USED BY GIOSIO 11/12,General Request,Boston Water & Sewer Commission,Administrative & General Requests,BWSC General Request,BWSC_All Cases,BWSC,,,191 Park Dr  Boston  MA  02215,4.0,10A,8.0,D4,Fenway / Kenmore / Audubon Circle / Longwood,14.0,Ward 21,2101,A,191 Park Dr,2215.0,Address,106777.0,42.3411,-71.0999,Constituent Call,"(42.3411, -71.0999)"
660576,101001632803,11/11/2015 07:33:00 AM,,11/12/2015 09:15:48 AM,ONTIME,Closed,Case Closed. Closed date : 2015-11-12 09:15:48.793 Case Noted RETRIEVED KEYS FROM  CB 11/11,General Request,Boston Water & Sewer Commission,Administrative & General Requests,BWSC General Request,BWSC_All Cases,BWSC,,,51 Chappie St  Charlestown  MA  02129,3.0,1A,1.0,A15,Charlestown,2.0,Ward 2,0207,R2,51 Chappie St,2129.0,Address,29009.0,42.3834,-71.0683,Constituent Call,"(42.3834, -71.0683)"
662272,101001635119,11/15/2015 08:24:00 AM,,11/16/2015 11:57:50 AM,ONTIME,Closed,Case Closed. Closed date : 2015-11-16 11:57:50.47 Case Noted Internal sewer problem  BWSC lines down and running 11/15/15.  Repairs needed by homeowner.,General Request,Boston Water & Sewer Commission,Administrative & General Requests,BWSC General Request,BWSC_All Cases,BWSC,,,209 Berkeley St  Boston  MA  02116,4.0,1C,2.0,D4,Back Bay,6.0,Ward 5,0501,C,209 Berkeley St,2116.0,Address,155858.0,42.3507,-71.0725,Constituent Call,"(42.3507, -71.0725)"
669262,101001655238,11/30/2015 06:47:00 PM,,12/01/2015 09:19:05 AM,ONTIME,Closed,Case Closed. Closed date : 2015-12-01 09:19:05.213 Case Noted THIS IS A LEAK UP TO OWNER.  OWNER NEEDS  TO HAVE LEAK REPAIRED  SENT NOTICE ON 11/19,General Request,Boston Water & Sewer Commission,Administrative & General Requests,BWSC General Request,BWSC_All Cases,BWSC,,,38 Cleveland St  Hyde Park  MA  02136,12.0,08,5.0,E18,Hyde Park,10.0,Ward 18,1812,R2,38 Cleveland St,2136.0,Address,33863.0,42.2552,-71.1311,Constituent Call,"(42.2552, -71.1311)"
670299,101001656847,12/02/2015 01:39:00 PM,,12/02/2015 03:58:33 PM,ONTIME,Closed,Case Closed. Closed date : 2015-12-02 15:58:33.437 Case Resolved SEWER LINE DOWN & RUNNING ON ARRIVAL & DEPARTURE.  NO SEWERAGE COMING OUT OF ANY MANHOLES.  JETTED SEWER LINE & DISINFECTED. 12/2,General Request,Boston Water & Sewer Commission,Administrative & General Requests,BWSC General Request,BWSC_All Cases,BWSC,,,33 Lithgow St  Dorchester  MA  02124,8.0,07,4.0,C11,Dorchester,8.0,Ward 17,1706,R3,33 Lithgow St,2124.0,Address,86758.0,42.2897,-71.0698,Constituent Call,"(42.2897, -71.0698)"
670353,101001656932,12/02/2015 02:47:00 PM,,12/04/2015 05:36:33 PM,ONTIME,Closed,Case Closed. Closed date : 2015-12-04 17:36:33.897 Case Resolved REPAIRED LEAK ON SERVICE PIPE 12/3,General Request,Boston Water & Sewer Commission,Administrative & General Requests,BWSC General Request,BWSC_All Cases,BWSC,,,87 Burt St  Dorchester  MA  02124,8.0,07,4.0,C11,Dorchester,8.0,Ward 17,1709,R2,87 Burt St,2124.0,Address,24146.0,42.2838,-71.0711,Constituent Call,"(42.2838, -71.0711)"
671816,101001659131,12/06/2015 10:22:00 AM,,12/07/2015 09:17:57 AM,ONTIME,Closed,Case Closed. Closed date : 2015-12-07 09:17:57.137 Case Noted CHECKED ALL OF COTTAGE RD & SPRING RD FOUND NO SEWAGE IN THE STREET OR ODOR . ALSO THESE STREETS ARE PRIVATE.  12/6,General Request,Boston Water & Sewer Commission,Administrative & General Requests,BWSC General Request,BWSC_All Cases,BWSC,,,227 Cottage Rd  West Roxbury  MA  02132,12.0,06,6.0,E5,West Roxbury,12.0,Ward 20,2015.0,R1,227 Cottage Rd,2132.0,Address,43306.0,42.2624,-71.1595,Constituent Call,"(42.2624, -71.1595)"
677607,101001677591,12/17/2015 12:41:00 PM,,,ONTIME,Open,,General Request,Boston Water & Sewer Commission,Administrative & General Requests,BWSC General Request,BWSC_All Cases,BWSC,,,109 Hazleton St  Mattapan  MA  02126,8.0,07,4.0,B3,Greater Mattapan,9.0,14,1408.0,R2,109 Hazleton St,2126.0,Address,72235.0,42.2819,-71.097,Constituent Call,"(42.2819, -71.097)"
678523,101001678935,12/20/2015 06:11:00 AM,,12/22/2015 10:20:09 AM,ONTIME,Closed,Case Closed. Closed date : 2015-12-22 10:20:09.053 Case Resolved STOPPED PACKING LEAK 12/21,General Request,Boston Water & Sewer Commission,Administrative & General Requests,BWSC General Request,BWSC_All Cases,BWSC,,,INTERSECTION of Deaconess Rd & Pilgrim Rd  Boston  MA,4.0,10A,8.0,B2,Fenway / Kenmore / Audubon Circle / Longwood,14.0,Ward 4,410.0,,INTERSECTION Deaconess Rd & Pilgrim Rd,,Intersection,3956.0,42.3385,-71.1093,Constituent Call,"(42.3385, -71.1093)"
678697,101001679198,12/21/2015 08:10:28 AM,,12/21/2015 08:18:13 AM,ONTIME,Closed,Case Closed. Closed date : 2015-12-21 08:18:13.893 Case Invalid misunderstood caller,General Request,Boston Water & Sewer Commission,Administrative & General Requests,BWSC General Request,BWSC_All Cases,BWSC,,,17 Ramsey St  Dorchester  MA  02125,7.0,03,7.0,B2,Dorchester,13.0,07,710.0,R4,17 Ramsey St,2125.0,Address,114545.0,42.318,-71.0646,Constituent Call,"(42.318, -71.0646)"
679022,101001679720,12/21/2015 02:37:00 PM,,12/21/2015 03:31:03 PM,ONTIME,Closed,Case Closed. Closed date : 2015-12-21 15:31:03.743 Case Noted BWSC line down & running. Customer has a broken sewer lateral pipe. Customer was approved for lateral program 12/19.,General Request,Boston Water & Sewer Commission,Administrative & General Requests,BWSC General Request,BWSC_All Cases,BWSC,,,19 Converse St  Brighton  MA  02135,11.0,04,9.0,D14,Allston / Brighton,15.0,Ward 22,2211.0,R1,19 Converse St,2135.0,Address,218416.0,42.3564,-71.1556,Constituent Call,"(42.3564, -71.1556)"
680826,101001682455,12/28/2015 07:46:15 AM,,12/28/2015 07:46:59 AM,ONTIME,Closed,Case Closed. Closed date : 2015-12-28 07:46:59.62 Case Invalid mistake,General Request,Boston Water & Sewer Commission,Administrative & General Requests,BWSC General Request,BWSC_All Cases,BWSC,,,972 Bennington St  East Boston  MA  02128,1.0,09,1.0,A7,East Boston,1.0,Ward 1,113.0,R3,972 Bennington St,2128.0,Address,14961.0,42.3865,-71.0081,Constituent Call,"(42.3865, -71.0081)"
681002,101001682751,12/28/2015 11:02:00 AM,,12/31/2015 09:51:56 AM,ONTIME,Closed,Case Closed. Closed date : 2015-12-31 09:51:56.19 Case Referred to External Agency BWSC -- Crew stopped packing leak on gate 12/28/15,General Request,Boston Water & Sewer Commission,Administrative & General Requests,BWSC General Request,BWSC_All Cases,BWSC,,,440 Commercial St  Boston  MA  02113,3.0,1B,1.0,A1,Boston,3.0,03,302.0,,440 Commercial St,2113.0,Address,354494.0,42.3594,-71.0587,Constituent Call,"(0, 0)"
681544,101001683655,12/29/2015 12:04:00 PM,,01/12/2016 01:37:56 PM,ONTIME,Closed,Case Closed. Closed date : 2016-01-12 13:37:56.41 Duplicate of Existing Case case entered in ISD for inspecion 1691313,General Request,Boston Water & Sewer Commission,Administrative & General Requests,BWSC General Request,ISD_Administrative,ISD,,,30 Iroquois St  Mission Hill  MA  02120,9.0,10A,8.0,B2,Mission Hill,14.0,Ward 10,1005.0,A,30 Iroquois St,2120.0,Address,166586.0,42.3299,-71.1042,Constituent Call,"(42.3299, -71.1042)"
681758,101001684025,12/29/2015 06:23:00 PM,,12/31/2015 10:39:32 AM,ONTIME,Closed,Case Closed. Closed date : 2015-12-31 10:39:32.62 Case Referred to External Agency BWSC -- Shutoff water @ the sidewalk @ owners request 12/29,General Request,Boston Water & Sewer Commission,Administrative & General Requests,BWSC General Request,BWSC_All Cases,BWSC,,,796 E Sixth St  South Boston  MA  02127,6.0,05,2.0,C6,South Boston / South Boston Waterfront,5.0,Ward 6,609.0,R2,796 E Sixth St,2127.0,Address,127882.0,42.3334,-71.0284,Constituent Call,"(42.3334, -71.0284)"
682080,101001684667,12/30/2015 11:40:00 AM,,12/31/2015 11:50:54 AM,ONTIME,Closed,Case Closed. Closed date : 2015-12-31 11:50:54.747 Case Referred to External Agency Crew retrieved keys 12/30,General Request,Boston Water & Sewer Commission,Administrative & General Requests,BWSC General Request,BWSC_All Cases,BWSC,,,INTERSECTION of Huntington Ave & Shepherd Ave  Boston  MA,9.0,10A,8.0,B2,Mission Hill,14.0,Ward 10,1004.0,,INTERSECTION Huntington Ave & Shepherd Ave,,Intersection,6421.0,42.3333,-71.1091,Constituent Call,"(42.3333, -71.1091)"
682153,101001684817,12/30/2015 01:17:00 PM,,01/04/2016 10:51:15 AM,ONTIME,Closed,Case Closed. Closed date : 2016-01-04 10:51:15.873 Case Resolved Retrieved keys returned to owner 12/30,General Request,Boston Water & Sewer Commission,Administrative & General Requests,BWSC General Request,BWSC_All Cases,BWSC,,,19 Elm St  Charlestown  MA  02129,3.0,1A,1.0,A15,Charlestown,2.0,Ward 2,205.0,CM,19 Elm St,2129.0,Address,53056.0,42.3773,-71.0636,Constituent Call,"(42.3773, -71.0636)"
682349,101001685223,12/30/2015 09:26:00 PM,,12/31/2015 11:48:40 AM,ONTIME,Closed,Case Closed. Closed date : 2015-12-31 11:48:40.69 Case Referred to External Agency BWSC -- Jetted and freed a stopped sewer 12/30,General Request,Boston Water & Sewer Commission,Administrative & General Requests,BWSC General Request,BWSC_All Cases,BWSC,,,9 Cedrus Ave  Roslindale  MA  02131,12.0,06,5.0,E5,Roslindale,10.0,Ward 20,2009.0,R2,9 Cedrus Ave,2131.0,Address,27240.0,42.2792,-71.1367,Constituent Call,"(42.2792, -71.1367)"
