,CASE_ENQUIRY_ID,OPEN_DT,TARGET_DT,CLOSED_DT,OnTime_Status,CASE_STATUS,CLOSURE_REASON,CASE_TITLE,SUBJECT,REASON,TYPE,QUEUE,Department,SubmittedPhoto,ClosedPhoto,Location,fire_district,pwd_district,city_council_district,police_district,neighborhood,neighborhood_services_district,ward,precinct,land_usage,LOCATION_STREET_NAME,LOCATION_ZIPCODE,Property_Type,Property_ID,LATITUDE,LONGITUDE,Source,Geocoded_Location
469897,101001241379,01/02/2015 02:05:56 PM,,01/06/2015 06:52:59 AM,ONTIME,Closed,Case Closed Case Resolved fix bench,Equipment Repair,Parks & Recreation Department,Park Maintenance & Safety,Equipment Repair,PARK_Maintenance_Trades,PARK,,,40 Cornwall St  Jamaica Plain  MA  02130,9.0,02,6.0,E13,Jamaica Plain,11.0,11,1106.0,,40 Cornwall St,2130.0,Address,342402.0,42.3594,-71.0587,Employee Generated,"(0, 0)"
469918,101001241412,01/02/2015 02:46:34 PM,,01/02/2015 02:48:39 PM,ONTIME,Closed,Case Closed Case Resolved done,Equipment Repair,Parks & Recreation Department,Park Maintenance & Safety,Equipment Repair,PARK_Maintenance_Trades,PARK,,,,,,,,,,,,,,,,,42.3594,-71.0587,Employee Generated,"(0, 0)"
470232,101001241863,01/04/2015 05:15:18 AM,,01/04/2015 05:25:33 AM,ONTIME,Closed,Case Closed Case Invalid Lagan froze,Equipment Repair,Parks & Recreation Department,Park Maintenance & Safety,Equipment Repair,PARK_Maintenance_Trades,PARK,,,55 Beacon St  Boston  MA  02108,3.0,1B,8.0,A1,Beacon Hill,14.0,Ward 5,503.0,E,55 Beacon St,2108.0,Address,11985.0,42.3567,-71.0682,Constituent Call,"(42.3567, -71.0682)"
470233,101001241864,01/04/2015 05:26:28 AM,,02/26/2015 09:01:35 AM,ONTIME,Closed,Case Closed Case Resolved per michele this is all set,Fence: Boston Common Equipment Repair,Parks & Recreation Department,Park Maintenance & Safety,Equipment Repair,PARK_Park Improvement Requests,PARK,,,55 Beacon St  Boston  MA  02108,3.0,1B,8.0,A1,Beacon Hill,14.0,Ward 5,503.0,E,55 Beacon St,2108.0,Address,11985.0,42.3567,-71.0682,Constituent Call,"(42.3567, -71.0682)"
470375,101001242068,01/05/2015 08:17:11 AM,,01/07/2015 06:18:17 AM,ONTIME,Closed,Case Closed Case Resolved repair benchs,Equipment Repair: Hemenway Playground,Parks & Recreation Department,Park Maintenance & Safety,Equipment Repair,PARK_Maintenance_Trades,PARK,,,540 Adams St  Dorchester  MA  02122,8.0,07,3.0,C11,Dorchester,7.0,16,1607.0,,540 Adams St,2122.0,Address,342475.0,42.3594,-71.0587,City Worker App,"(0, 0)"
470569,101001242359,01/05/2015 11:32:37 AM,,01/06/2015 02:14:19 PM,ONTIME,Closed,Case Closed Case Resolved remove graffiti,Equipment Repair,Parks & Recreation Department,Park Maintenance & Safety,Equipment Repair,PARK_Maintenance_Trades,PARK,,,2P Prescott St  East Boston  MA  02128,1.0,09,1.0,A7,East Boston,1.0,01,109.0,,2P Prescott St,2128.0,Address,350865.0,42.3594,-71.0587,Constituent Call,"(0, 0)"
470570,101001242361,01/05/2015 11:34:51 AM,,01/06/2015 02:13:35 PM,ONTIME,Closed,Case Closed Case Resolved remove graffiti,Equipment Repair,Parks & Recreation Department,Park Maintenance & Safety,Equipment Repair,PARK_Maintenance_Trades,PARK,,,33 Sumner St  East Boston  MA  02128,1.0,09,1.0,A7,East Boston,1.0,1,103.0,,33 Sumner St,2128.0,Address,342511.0,42.3594,-71.0587,Constituent Call,"(0, 0)"
471021,101001242999,01/06/2015 10:53:59 AM,,04/03/2015 10:56:44 AM,ONTIME,Closed,Case Closed Case Resolved done 4-2-15,Equipment Repair,Parks & Recreation Department,Park Maintenance & Safety,Equipment Repair,PARK_Maintenance_Trades,PARK,,,100 Park Dr  Boston  MA  02215,4.0,10A,8.0,D4,Boston,14.0,05,502.0,,100 Park Dr,2215.0,Address,343938.0,42.3404,-71.0986,Employee Generated,"(42.3404, -71.0986)"
473004,101001245854,01/12/2015 10:07:28 AM,,01/26/2015 09:50:58 AM,ONTIME,Closed,Case Closed Case Resolved done 1-23-14,Equipment Repair,Parks & Recreation Department,Park Maintenance & Safety,Equipment Repair,PARK_Maintenance_Trades,PARK,,,139 Tremont St  Boston  MA  02108,3.0,1C,8.0,A1,Beacon Hill,14.0,05,503.0,E,139 Tremont St,2108.0,Address,341542.0,42.3554,-71.0638,Constituent Call,"(42.3554, -71.0638)"
473024,101001245880,01/12/2015 10:21:37 AM,,01/26/2015 09:52:13 AM,ONTIME,Closed,Case Closed Case Resolved done 1-23-15,Equipment Repair,Parks & Recreation Department,Park Maintenance & Safety,Equipment Repair,PARK_Maintenance_Trades,PARK,,,139 Tremont St  Boston  MA  02108,3.0,1C,8.0,A1,Beacon Hill,14.0,05,503.0,E,139 Tremont St,2108.0,Address,341542.0,42.3554,-71.0638,Constituent Call,"(42.3554, -71.0638)"
473923,101001247240,01/14/2015 12:24:15 PM,,01/20/2015 06:09:56 AM,ONTIME,Closed,Case Closed Case Resolved remove carts,Equipment Repair,Parks & Recreation Department,Park Maintenance & Safety,Equipment Repair,PARK_Maintenance_Trades,PARK,,,1535 Washington St  Roxbury  MA  02118,4.0,1C,2.0,D4,Roxbury,6.0,09,901.0,E,1535 Washington St,2118.0,Address,341541.0,42.3397,-71.0736,Employee Generated,"(42.3397, -71.0736)"
473926,101001247243,01/14/2015 12:27:26 PM,,01/20/2015 06:09:08 AM,ONTIME,Closed,Case Closed Case Resolved remove bike frame,Equipment Repair,Parks & Recreation Department,Park Maintenance & Safety,Equipment Repair,PARK_Maintenance_Trades,PARK,,,110 Atlantic Ave  Boston  MA  02110,3.0,1B,1.0,A1,Boston,3.0,3,301.0,,110 Atlantic Ave,2110.0,Address,161702.0,42.361,-71.0522,Employee Generated,"(42.361, -71.0522)"
474467,101001248036,01/15/2015 03:26:21 PM,,01/27/2015 11:05:37 AM,ONTIME,Closed,Case Closed Case Resolved new knob install,Equipment Repair,Parks & Recreation Department,Park Maintenance & Safety,Equipment Repair,PARK_Maintenance_Trades,PARK,,,28 Fairview Ave  Hyde Park  MA  02136,12.0,08,5.0,E18,Hyde Park,10.0,18,1819.0,,28 Fairview Ave,2136.0,Address,342364.0,42.3594,-71.0587,Employee Generated,"(0, 0)"
474472,101001248042,01/15/2015 03:30:50 PM,,01/23/2015 06:02:00 AM,ONTIME,Closed,Case Closed Case Resolved replace handle,Equipment Repair,Parks & Recreation Department,Park Maintenance & Safety,Equipment Repair,PARK_Maintenance_Trades,PARK,,,28 Fairview Ave  Hyde Park  MA  02136,12.0,08,5.0,E18,Hyde Park,10.0,18,1819.0,,28 Fairview Ave,2136.0,Address,342364.0,42.3594,-71.0587,Employee Generated,"(0, 0)"
474585,101001248207,01/16/2015 06:53:17 AM,,02/26/2015 02:46:23 PM,ONTIME,Closed,Case Closed Case Noted Thank you for your note. This job has already been contracted out and will be done as soon as the weather will allow.,Misc.: Ronan Park Equipment Repair,Parks & Recreation Department,Park Maintenance & Safety,Equipment Repair,PARK_Park Improvement Requests,PARK,,,INTERSECTION of Homes Ave & Mount Ida Rd  Dorchester  MA,7.0,03,3.0,C11,Dorchester,8.0,Ward 15,1509.0,,INTERSECTION Homes Ave & Mount Ida Rd,,Intersection,6343.0,42.3042,-71.0639,Constituent Call,"(42.3042, -71.0639)"
475387,101001249376,01/19/2015 02:06:31 PM,,01/23/2015 05:56:47 AM,ONTIME,Closed,Case Closed Case Resolved fix gate,Equipment Repair,Parks & Recreation Department,Park Maintenance & Safety,Equipment Repair,PARK_Maintenance_Trades,PARK,,,775 E First St  South Boston  MA  02127,6.0,05,2.0,C6,South Boston / South Boston Waterfront,5.0,06,607.0,,775 E First St,2127.0,Address,342025.0,42.3594,-71.0587,Constituent Call,"(0, 0)"
475981,101001250026,01/20/2015 09:13:40 AM,,04/03/2015 10:21:38 AM,ONTIME,Closed,Case Closed Case Resolved DONE 4-2-15,Equipment Repair,Parks & Recreation Department,Park Maintenance & Safety,Equipment Repair,PARK_Maintenance_Trades,PARK,,,135 Prince St  Boston  MA  02113,3.0,1B,1.0,A1,Boston,3.0,3,303.0,,135 Prince St,2113.0,Address,342060.0,42.3594,-71.0587,Employee Generated,"(0, 0)"
476813,101001251339,01/21/2015 03:13:06 PM,,09/22/2015 03:40:34 PM,ONTIME,Closed,Case Closed. Closed date : 2015-09-22 15:40:34.31 Case Resolved done 9-21-15,Equipment Repair,Parks & Recreation Department,Park Maintenance & Safety,Equipment Repair,PARK_Maintenance_Trades,PARK,,,91 Ames St  Dorchester  MA  02124,8.0,07,4.0,B3,Greater Mattapan,9.0,14,1410.0,,91 Ames St,2124.0,Address,350427.0,42.3594,-71.0587,Constituent Call,"(0, 0)"
477208,101001251953,01/22/2015 01:26:16 PM,,01/23/2015 12:42:14 PM,ONTIME,Closed,Case Closed Case Resolved water off water&sewer,Equipment Repair,Parks & Recreation Department,Park Maintenance & Safety,Equipment Repair,PARK_Maintenance_Trades,PARK,,,500 Gallivan Blvd  Dorchester  MA  02124,8.0,07,3.0,C11,Dorchester,7.0,Ward 16,1611.0,E,500 Gallivan Blvd,2124.0,Address,62335.0,42.283,-71.0563,Constituent Call,"(42.283, -71.0563)"
477577,101001252560,01/23/2015 11:25:44 AM,,03/02/2015 01:09:49 PM,ONTIME,Closed,Case Closed Case Resolved new key del,Equipment Repair,Parks & Recreation Department,Park Maintenance & Safety,Equipment Repair,PARK_Maintenance_Trades,PARK,,,192 Webster St  East Boston  MA  02128,1.0,09,1.0,A7,East Boston,1.0,1,101.0,,192 Webster St,2128.0,Address,342012.0,42.3594,-71.0587,Constituent Call,"(0, 0)"
477578,101001252563,01/23/2015 11:26:46 AM,,03/26/2015 10:59:06 AM,ONTIME,Closed,Case Closed Case Resolved Graffiti was removed.,Equipment Repair,Parks & Recreation Department,Park Maintenance & Safety,Equipment Repair,PARK_Maintenance_Trades,PARK,,,40 Cornwall St  Jamaica Plain  MA  02130,9.0,02,6.0,E13,Jamaica Plain,11.0,11,1106.0,,40 Cornwall St,2130.0,Address,342402.0,42.3594,-71.0587,Constituent Call,"(0, 0)"
493814,101001275230,02/04/2015 02:53:00 PM,,04/09/2015 03:00:29 PM,ONTIME,Closed,Case Closed Case Resolved done 4-7-15,Equipment Repair,Parks & Recreation Department,Park Maintenance & Safety,Equipment Repair,PARK_Maintenance_Trades,PARK,,,139 Tremont St  Boston  MA  02108,3.0,1C,8.0,A1,Beacon Hill,14.0,05,503.0,E,139 Tremont St,2108.0,Address,341542.0,42.3554,-71.0638,Employee Generated,"(42.3554, -71.0638)"
495382,101001277675,02/05/2015 11:10:50 AM,,03/13/2015 10:43:55 AM,ONTIME,Closed,Case Closed Case Resolved done 3-5-15,Equipment Repair,Parks & Recreation Department,Park Maintenance & Safety,Equipment Repair,PARK_Maintenance_Trades,PARK,,,160 Norfolk Ave  Roxbury  MA  02119,7.0,03,7.0,B2,Roxbury,13.0,08,806.0,,160 Norfolk Ave,2119.0,Address,342027.0,42.3594,-71.0587,Employee Generated,"(0, 0)"
496834,101001279928,02/06/2015 10:54:03 AM,,02/09/2015 06:08:48 AM,ONTIME,Closed,Case Closed Case Resolved bleed sys,Equipment Repair,Parks & Recreation Department,Park Maintenance & Safety,Equipment Repair,PARK_Maintenance_Trades,PARK,,,139 Tremont St  Boston  MA  02108,3.0,1C,8.0,A1,Beacon Hill,14.0,05,503.0,E,139 Tremont St,2108.0,Address,341542.0,42.3554,-71.0638,Employee Generated,"(42.3554, -71.0638)"
503215,101001288930,02/11/2015 03:36:42 PM,,05/07/2015 06:39:27 AM,ONTIME,Closed,Case Closed. Closed date : 2015-05-07 06:39:27.253 Case Resolved remove graffiti,Equipment Repair,Parks & Recreation Department,Park Maintenance & Safety,Equipment Repair,PARK_Maintenance_Trades,PARK,,,470 Adams St  Dorchester  MA  02122,8.0,07,3.0,C11,Dorchester,7.0,16,1605.0,E,470 Adams St,2122.0,Address,172405.0,42.2935,-71.0568,Employee Generated,"(42.2935, -71.0568)"
504756,101001291290,02/12/2015 01:03:13 PM,,04/08/2015 11:51:02 AM,ONTIME,Closed,Case Closed Case Noted transportation dept issue,Equipment Repair,Parks & Recreation Department,Park Maintenance & Safety,Equipment Repair,PARK_Maintenance_Trades,PARK,,,29 Harvard St  Charlestown  MA  02129,3.0,1A,1.0,A15,Charlestown,2.0,2,201.0,,29 Harvard St,2129.0,Address,342468.0,42.3594,-71.0587,Constituent Call,"(0, 0)"
512086,101001301074,02/17/2015 12:03:13 PM,02/24/2015 12:02:56 PM,06/12/2015 04:51:57 AM,OVERDUE,Closed,Case Closed. Closed date : 2015-06-12 04:51:57.78 Case Resolved,Equipment Repair,Parks & Recreation Department,Park Maintenance & Safety,Equipment Repair,PARK_Maintenance_Trades,PARK,,,,,,,,,,,,,,,,,42.3594,-71.0587,Constituent Call,"(0, 0)"
517121,101001308413,02/20/2015 10:51:28 AM,02/27/2015 10:51:27 AM,02/24/2015 06:48:28 AM,ONTIME,Closed,Case Closed Case Resolved install weather striping,Equipment Repair,Parks & Recreation Department,Park Maintenance & Safety,Equipment Repair,PARK_Maintenance_Trades,PARK,,,139 Tremont St  Boston  MA  02108,3.0,1C,8.0,A1,Beacon Hill,14.0,05,503.0,E,139 Tremont St,2108.0,Address,341542.0,42.3554,-71.0638,Employee Generated,"(42.3554, -71.0638)"
528259,101001324970,03/05/2015 11:57:45 AM,03/12/2015 11:57:44 AM,,OVERDUE,Open,,Equipment Repair: Boston Common,Parks & Recreation Department,Park Maintenance & Safety,Equipment Repair,PARK_Park Improvement Requests,PARK,,,,,,,,,,,,,,,,,42.3594,-71.0587,Self Service,"(0, 0)"
529463,101001326790,03/07/2015 03:46:53 PM,03/16/2015 08:30:00 AM,06/09/2015 10:23:38 AM,OVERDUE,Closed,Case Closed. Closed date : 2015-06-09 10:23:38.473 Case Resolved,Equipment Repair,Parks & Recreation Department,Park Maintenance & Safety,Equipment Repair,PARK_Park Improvement Requests,PARK,,,INTERSECTION of Adams St & Winthrop St  Charlestown  MA,3.0,1A,1.0,A15,Charlestown,2.0,Ward 2,203.0,,INTERSECTION Adams St & Winthrop St,,Intersection,55.0,42.3748,-71.0602,Constituent Call,"(42.3748, -71.0602)"
530987,101001329180,03/10/2015 01:36:30 PM,03/17/2015 01:36:29 PM,03/10/2015 01:37:46 PM,ONTIME,Closed,Case Closed Case Invalid,Equipment Repair,Parks & Recreation Department,Park Maintenance & Safety,Equipment Repair,PARK_Maintenance_Trades,PARK,,,,,,,,,,,,,,,,,42.3594,-71.0587,Employee Generated,"(0, 0)"
530988,101001329182,03/10/2015 01:38:13 PM,03/17/2015 01:38:12 PM,05/19/2015 06:22:12 AM,OVERDUE,Closed,Case Closed. Closed date : 2015-05-19 06:22:12.717 Case Resolved replace pipe,Equipment Repair,Parks & Recreation Department,Park Maintenance & Safety,Equipment Repair,PARK_Maintenance_Trades,PARK,,,,,,,,,,,,,,,,,42.3594,-71.0587,Employee Generated,"(0, 0)"
530990,101001329184,03/10/2015 01:40:16 PM,03/17/2015 01:40:15 PM,11/25/2015 10:17:07 AM,OVERDUE,Closed,Case Closed. Closed date : 2015-11-25 10:17:07.377 Case Resolved done 11-20-15,Equipment Repair,Parks & Recreation Department,Park Maintenance & Safety,Equipment Repair,PARK_Maintenance_Trades,PARK,,,,,,,,,,,,,,,,,42.3594,-71.0587,Employee Generated,"(0, 0)"
531709,101001330345,03/11/2015 02:10:52 PM,03/18/2015 02:10:51 PM,03/23/2015 06:15:32 AM,OVERDUE,Closed,Case Closed Case Resolved install new flag,Equipment Repair,Parks & Recreation Department,Park Maintenance & Safety,Equipment Repair,PARK_Maintenance_Trades,PARK,,,45 Bunker Hill St  Charlestown  MA  02129,3.0,1A,1.0,A15,Charlestown,2.0,02,202.0,,45 Bunker Hill St,2129.0,Address,342474.0,42.3594,-71.0587,Employee Generated,"(0, 0)"
532143,101001331008,03/12/2015 09:53:28 AM,03/19/2015 09:53:27 AM,03/23/2015 06:13:12 AM,OVERDUE,Closed,Case Closed Case Resolved install new flag,Equipment Repair,Parks & Recreation Department,Park Maintenance & Safety,Equipment Repair,PARK_Maintenance_Trades,PARK,,,49 Vine St  Charlestown  MA  02129,3.0,1A,1.0,A15,Charlestown,2.0,Ward 2,202.0,E,49 Vine St,2129.0,Address,140718.0,42.3772,-71.0568,Constituent Call,"(42.3772, -71.0568)"
532156,101001331027,03/12/2015 10:08:03 AM,03/19/2015 10:08:02 AM,03/23/2015 11:47:51 AM,OVERDUE,Closed,Case Closed Case Resolved replace flag,Equipment Repair,Parks & Recreation Department,Park Maintenance & Safety,Equipment Repair,PARK_Maintenance_Trades,PARK,,,529-543 Commercial St  Boston  MA  02109,3.0,1B,1.0,A1,Boston,3.0,3,302.0,E,529-543 Commercial St,2109.0,Address,36790.0,42.3688,-71.0562,Employee Generated,"(42.3688, -71.0562)"
533206,101001332423,03/13/2015 10:46:13 AM,03/20/2015 10:46:11 AM,03/13/2015 10:49:18 AM,ONTIME,Closed,Case Closed Case Resolved,Equipment Repair,Parks & Recreation Department,Park Maintenance & Safety,Equipment Repair,PARK_Maintenance_Trades,PARK,,,,,,,,,,,,,,,,,42.3594,-71.0587,Employee Generated,"(0, 0)"
533340,101001332612,03/13/2015 01:10:37 PM,03/20/2015 01:10:35 PM,03/13/2015 01:12:07 PM,ONTIME,Closed,Case Closed Case Resolved,Equipment Repair,Parks & Recreation Department,Park Maintenance & Safety,Equipment Repair,PARK_Maintenance_Trades,PARK,,,,,,,,,,,,,,,,,42.3594,-71.0587,Employee Generated,"(0, 0)"
533343,101001332616,03/13/2015 01:13:52 PM,03/20/2015 01:13:51 PM,03/13/2015 04:40:57 PM,ONTIME,Closed,Case Closed Case Resolved  done,Equipment Repair,Parks & Recreation Department,Park Maintenance & Safety,Equipment Repair,PARK_Maintenance_Trades,PARK,,,,,,,,,,,,,,,,,42.3594,-71.0587,Employee Generated,"(0, 0)"
533452,101001332762,03/13/2015 02:58:17 PM,03/20/2015 02:58:17 PM,07/15/2015 09:54:28 AM,OVERDUE,Closed,Case Closed. Closed date : 2015-07-15 09:54:28.363 Case Resolved,Equipment Repair,Parks & Recreation Department,Park Maintenance & Safety,Equipment Repair,PARK_Maintenance_Trades,PARK,,,1 Brigham St  East Boston  MA  02128,1.0,09,1.0,A7,East Boston,1.0,Ward 1,101.0,R2,1 Brigham St,2128.0,Address,20053.0,42.3652,-71.0347,Constituent Call,"(42.3652, -71.0347)"
534138,101001333846,03/16/2015 09:51:24 AM,03/23/2015 09:51:24 AM,03/23/2015 06:18:44 AM,ONTIME,Closed,Case Closed Case Resolved remove bench will replace when parts come in,Equipment Repair: Codman Square Branch Library,Parks & Recreation Department,Park Maintenance & Safety,Equipment Repair,PARK_Maintenance_Trades,PARK,https://cityworker.cityofboston.gov:8443/attachments/report/5506dfd8d052dab9f2a88b8f/photo/Report.jpg,,690 Washington St  Dorchester  MA  02124,8.0,07,4.0,C11,Dorchester,8.0,17,1709.0,C,690 Washington St,2124.0,Address,171207.0,42.2875,-71.0709,City Worker App,"(42.2875, -71.0709)"
534185,101001333917,03/16/2015 10:48:25 AM,03/23/2015 10:48:23 AM,,OVERDUE,Open,,Equipment Repair,Parks & Recreation Department,Park Maintenance & Safety,Equipment Repair,PARK_Park Improvement Requests,PARK,,,192 Webster St  East Boston  MA  02128,1.0,09,1.0,A7,East Boston,1.0,1,101.0,,192 Webster St,2128.0,Address,342012.0,42.3594,-71.0587,Constituent Call,"(0, 0)"
534249,101001334008,03/16/2015 11:57:28 AM,03/23/2015 11:57:27 AM,03/26/2015 11:01:45 AM,OVERDUE,Closed,Case Closed Case Noted Benches were removed.,Equipment Repair,Parks & Recreation Department,Park Maintenance & Safety,Equipment Repair,PARK_Maintenance_Trades,PARK,,,330 Perkins St  Jamaica Plain  MA  02130,9.0,02,6.0,E13,Jamaica Plain,11.0,19,1903.0,,330 Perkins St,2130.0,Address,347229.0,42.3594,-71.0587,Employee Generated,"(0, 0)"
534400,101001334204,03/16/2015 02:44:12 PM,03/23/2015 02:44:10 PM,03/23/2015 06:21:41 AM,ONTIME,Closed,Case Closed Case Resolved replace valve,Equipment Repair,Parks & Recreation Department,Park Maintenance & Safety,Equipment Repair,PARK_Maintenance_Trades,PARK,,,139 Tremont St  Boston  MA  02108,3.0,1C,8.0,A1,Beacon Hill,14.0,05,503.0,E,139 Tremont St,2108.0,Address,341542.0,42.3554,-71.0638,Employee Generated,"(42.3554, -71.0638)"
535056,101001335157,03/17/2015 01:59:22 PM,03/24/2015 01:59:20 PM,03/17/2015 04:46:48 PM,ONTIME,Closed,Case Closed Case Resolved,Equipment Repair,Parks & Recreation Department,Park Maintenance & Safety,Equipment Repair,PARK_Maintenance_Trades,PARK,,,139 Tremont St  Boston  MA  02108,3.0,1C,8.0,A1,Beacon Hill,14.0,05,503.0,E,139 Tremont St,2108.0,Address,341542.0,42.3554,-71.0638,Employee Generated,"(42.3554, -71.0638)"
535059,101001335161,03/17/2015 02:01:01 PM,03/24/2015 02:01:00 PM,03/26/2015 11:00:58 AM,OVERDUE,Closed,Case Closed Case Resolved Graffiti was removed.,Equipment Repair,Parks & Recreation Department,Park Maintenance & Safety,Equipment Repair,PARK_Maintenance_Trades,PARK,,,139 Tremont St  Boston  MA  02108,3.0,1C,8.0,A1,Beacon Hill,14.0,05,503.0,E,139 Tremont St,2108.0,Address,341542.0,42.3554,-71.0638,Employee Generated,"(42.3554, -71.0638)"
535069,101001335177,03/17/2015 02:13:09 PM,03/24/2015 02:13:05 PM,,OVERDUE,Open,,Equipment Repair,Parks & Recreation Department,Park Maintenance & Safety,Equipment Repair,PARK_Maintenance_Trades,PARK,,,23 Everett St  Dorchester  MA  02122,7.0,07,3.0,C11,Dorchester,7.0,16,1602.0,E,23 Everett St,2122.0,Address,341627.0,42.3008,-71.0524,Employee Generated,"(42.3008, -71.0524)"
535073,101001335182,03/17/2015 02:17:13 PM,03/24/2015 02:17:11 PM,04/30/2015 02:39:15 PM,OVERDUE,Closed,Case Closed Case Resolved done,Equipment Repair,Parks & Recreation Department,Park Maintenance & Safety,Equipment Repair,PARK_Maintenance_Trades,PARK,,,340 Neponset Ave  Dorchester  MA  02122,8.0,07,3.0,C11,Dorchester,7.0,16,1610.0,,340 Neponset Ave,2122.0,Address,342452.0,42.3594,-71.0587,Employee Generated,"(0, 0)"
535081,101001335190,03/17/2015 02:23:25 PM,03/24/2015 02:23:23 PM,03/31/2015 10:28:24 AM,OVERDUE,Closed,Case Closed Case Resolved done 3-26-14,Equipment Repair,Parks & Recreation Department,Park Maintenance & Safety,Equipment Repair,PARK_Maintenance_Trades,PARK,,,470 Adams St  Dorchester  MA  02122,8.0,07,3.0,C11,Dorchester,7.0,16,1605.0,E,470 Adams St,2122.0,Address,172405.0,42.2935,-71.0568,Employee Generated,"(42.2935, -71.0568)"
535089,101001335201,03/17/2015 02:30:13 PM,03/24/2015 02:30:11 PM,03/23/2015 06:09:55 AM,ONTIME,Closed,Case Closed Case Resolved remove graffiti,Equipment Repair,Parks & Recreation Department,Park Maintenance & Safety,Equipment Repair,PARK_Maintenance_Trades,PARK,,,92 Mount Ida Rd  Dorchester  MA  02122,7.0,03,3.0,C11,Dorchester,8.0,15,1509.0,,92 Mount Ida Rd,2122.0,Address,342620.0,42.3594,-71.0587,Employee Generated,"(0, 0)"
535773,101001336069,03/18/2015 10:13:33 AM,03/25/2015 10:13:33 AM,01/05/2016 03:54:15 PM,OVERDUE,Closed,Case Closed. Closed date : 2016-01-05 15:54:15.313 Case Resolved,Equipment Repair: McLaughlin Playground,Parks & Recreation Department,Park Maintenance & Safety,Equipment Repair,PARK_Park Improvement Requests,PARK,,,,,,,,,,,,,,,,,42.3594,-71.0587,Self Service,"(0, 0)"
537324,101001338199,03/20/2015 11:03:36 AM,03/27/2015 11:03:35 AM,08/11/2015 11:08:04 AM,OVERDUE,Closed,Case Closed. Closed date : 2015-08-11 11:08:04.267 Case Resolved,Equipment Repair,Parks & Recreation Department,Park Maintenance & Safety,Equipment Repair,PARK_Maintenance_Trades,PARK,,,139 Tremont St  Boston  MA  02108,3.0,1C,8.0,A1,Beacon Hill,14.0,05,503.0,E,139 Tremont St,2108.0,Address,341542.0,42.3554,-71.0638,Employee Generated,"(42.3554, -71.0638)"
537331,101001338212,03/20/2015 11:12:50 AM,03/27/2015 11:12:49 AM,04/03/2015 10:58:00 AM,OVERDUE,Closed,Case Closed Case Resolved done,Equipment Repair,Parks & Recreation Department,Park Maintenance & Safety,Equipment Repair,PARK_Maintenance_Trades,PARK,,,70 Park Dr  Boston  MA  02215,4.0,10A,8.0,D4,Fenway / Kenmore / Audubon Circle / Longwood,14.0,05,502.0,E,70 Park Dr,2215.0,Address,342000.0,42.3594,-71.0587,Employee Generated,"(0, 0)"
538261,101001339515,03/23/2015 09:53:17 AM,03/30/2015 09:53:13 AM,03/26/2015 01:26:56 PM,ONTIME,Closed,Case Closed Case Resolved remove bench,Equipment Repair,Parks & Recreation Department,Park Maintenance & Safety,Equipment Repair,PARK_Maintenance_Trades,PARK,,,2180 Dorchester Ave  Dorchester  MA  02124,8.0,07,3.0,C11,Dorchester,7.0,16,1611.0,,2180 Dorchester Ave,2124.0,Address,342074.0,42.3594,-71.0587,Employee Generated,"(0, 0)"
538588,101001339953,03/23/2015 03:07:03 PM,03/30/2015 03:07:00 PM,03/26/2015 11:03:05 AM,ONTIME,Closed,Case Closed Case Noted Bench was removed.,Equipment Repair,Parks & Recreation Department,Park Maintenance & Safety,Equipment Repair,PARK_Maintenance_Trades,PARK,,,1535 Washington St  Roxbury  MA  02118,4.0,1C,2.0,D4,Roxbury,6.0,09,901.0,E,1535 Washington St,2118.0,Address,341541.0,42.3397,-71.0736,Constituent Call,"(42.3397, -71.0736)"
538813,101001340240,03/24/2015 07:31:42 AM,03/31/2015 08:30:00 AM,03/26/2015 11:03:40 AM,ONTIME,Closed,Case Closed Case Resolved Graffiti was removed.,Equipment Repair,Parks & Recreation Department,Park Maintenance & Safety,Equipment Repair,PARK_Maintenance_Trades,PARK,,,139 Tremont St  Boston  MA  02108,3.0,1C,8.0,A1,Beacon Hill,14.0,05,503.0,E,139 Tremont St,2108.0,Address,341542.0,42.3554,-71.0638,Constituent Call,"(42.3554, -71.0638)"
538890,101001340362,03/24/2015 09:05:04 AM,03/31/2015 09:05:02 AM,03/26/2015 01:26:02 PM,ONTIME,Closed,Case Closed Case Resolved remove graffiti,Equipment Repair,Parks & Recreation Department,Park Maintenance & Safety,Equipment Repair,PARK_Maintenance_Trades,PARK,,,160 Norfolk Ave  Roxbury  MA  02119,7.0,03,7.0,B2,Roxbury,13.0,08,806.0,,160 Norfolk Ave,2119.0,Address,342027.0,42.3594,-71.0587,Employee Generated,"(0, 0)"
539658,101001341388,03/25/2015 09:29:01 AM,04/01/2015 09:28:46 AM,04/24/2015 06:26:04 AM,OVERDUE,Closed,Case Closed Case Resolved remove goal post,Equipment Repair,Parks & Recreation Department,Park Maintenance & Safety,Equipment Repair,PARK_Maintenance_Trades,PARK,,,,,,,,,,,,,,,,,42.3594,-71.0587,Employee Generated,"(0, 0)"
539665,101001341397,03/25/2015 09:33:36 AM,04/01/2015 09:33:32 AM,04/27/2015 01:55:58 PM,OVERDUE,Closed,Case Closed Case Resolved net off field,Equipment Repair,Parks & Recreation Department,Park Maintenance & Safety,Equipment Repair,PARK_Maintenance_Trades,PARK,,,25 Glendon St  East Boston  MA  02128,1.0,09,1.0,A7,East Boston,1.0,1,109.0,E,25 Glendon St,2128.0,Address,341999.0,42.3594,-71.0587,Employee Generated,"(0, 0)"
539848,101001341615,03/25/2015 11:41:50 AM,04/01/2015 11:41:48 AM,03/25/2015 11:44:20 AM,ONTIME,Closed,Case Closed Case Invalid,Equipment Repair,Parks & Recreation Department,Park Maintenance & Safety,Equipment Repair,PARK_Maintenance_Trades,PARK,,,41 Medford St  Charlestown  MA  02129,3.0,1A,1.0,A15,Charlestown,2.0,2,202.0,E,41 Medford St,2129.0,Address,93748.0,42.3793,-71.0537,Employee Generated,"(42.3793, -71.0537)"
539850,101001341617,03/25/2015 11:42:49 AM,04/01/2015 11:42:44 AM,03/25/2015 11:44:06 AM,ONTIME,Closed,Case Closed Case Invalid,Equipment Repair,Parks & Recreation Department,Park Maintenance & Safety,Equipment Repair,PARK_Maintenance_Trades,PARK,,,41 Medford St  Charlestown  MA  02129,3.0,1A,1.0,A15,Charlestown,2.0,2,202.0,E,41 Medford St,2129.0,Address,93748.0,42.3793,-71.0537,Employee Generated,"(42.3793, -71.0537)"
539906,101001341677,03/25/2015 12:11:18 PM,04/01/2015 12:11:17 PM,04/30/2015 02:28:17 PM,OVERDUE,Closed,Case Closed Case Resolved done,Equipment Repair,Parks & Recreation Department,Park Maintenance & Safety,Equipment Repair,PARK_Maintenance_Trades,PARK,,,260 Highland St  Roxbury  MA  02119,9.0,10B,7.0,B2,Roxbury,13.0,11,1101.0,E,260 Highland St,2119.0,Address,73748.0,42.3228,-71.0962,Employee Generated,"(42.3228, -71.0962)"
540173,101001342079,03/25/2015 04:34:10 PM,04/01/2015 04:34:08 PM,04/03/2015 10:54:40 AM,OVERDUE,Closed,Case Closed Case Resolved done 4-1-15,Equipment Repair,Parks & Recreation Department,Park Maintenance & Safety,Equipment Repair,PARK_Maintenance_Trades,PARK,,,70 Park Dr  Boston  MA  02215,4.0,10A,8.0,D4,Fenway / Kenmore / Audubon Circle / Longwood,14.0,05,502.0,E,70 Park Dr,2215.0,Address,342000.0,42.3594,-71.0587,Employee Generated,"(0, 0)"
540554,101001342632,03/26/2015 11:59:21 AM,04/02/2015 11:59:19 AM,04/14/2015 01:53:35 PM,OVERDUE,Closed,Case Closed Case Resolved,Equipment Repair,Parks & Recreation Department,Park Maintenance & Safety,Equipment Repair,PARK_Maintenance_Trades,PARK,,,27 Rutland Sq  Roxbury  MA  02118,4.0,1C,7.0,D4,South End,6.0,Ward 4,404.0,R1,27 Rutland Sq,2118.0,Address,120062.0,42.3418,-71.0779,Constituent Call,"(42.3418, -71.0779)"
540577,101001342665,03/26/2015 12:32:35 PM,04/02/2015 12:32:35 PM,04/14/2015 01:53:00 PM,OVERDUE,Closed,Case Closed Case Resolved done,Equipment Repair,Parks & Recreation Department,Park Maintenance & Safety,Equipment Repair,PARK_Maintenance_Trades,PARK,,,28 Rutland Sq  Roxbury  MA  02118,4.0,1C,7.0,D4,South End,6.0,Ward 4,404.0,R4,28 Rutland Sq,2118.0,Address,120063.0,42.3417,-71.0783,Constituent Call,"(42.3417, -71.0783)"
541393,101001343814,03/27/2015 03:33:08 PM,04/03/2015 03:33:08 PM,,OVERDUE,Open,,Equipment Repair: --Not in list--,Parks & Recreation Department,Park Maintenance & Safety,Equipment Repair,PARK_Maintenance_Trades,PARK,,,,,,,,,,,,,,,,,42.3594,-71.0587,Self Service,"(0, 0)"
542183,101001344963,03/30/2015 01:14:08 PM,04/06/2015 01:13:07 PM,04/02/2015 01:14:46 PM,ONTIME,Closed,Case Closed Case Resolved remove graffiti,Equipment Repair,Parks & Recreation Department,Park Maintenance & Safety,Equipment Repair,PARK_Maintenance_Trades,PARK,,,136 Erie St  Dorchester  MA  02121,7.0,03,4.0,B3,Greater Mattapan,8.0,Ward 14,1406.0,R2,136 Erie St,2121.0,Address,54186.0,42.3012,-71.0829,Constituent Call,"(42.3012, -71.0829)"
542224,101001345027,03/30/2015 02:00:51 PM,04/06/2015 02:00:46 PM,04/06/2015 02:53:50 PM,OVERDUE,Closed,Case Closed Case Resolved done 4-1-15,Equipment Repair,Parks & Recreation Department,Park Maintenance & Safety,Equipment Repair,PARK_Maintenance_Trades,PARK,,,18 Bowdoin Ave  Dorchester  MA  02121,7.0,03,4.0,C11,Dorchester,8.0,14,1404.0,,18 Bowdoin Ave,2121.0,Address,342537.0,42.3594,-71.0587,Constituent Call,"(0, 0)"
542244,101001345057,03/30/2015 02:21:04 PM,04/06/2015 02:21:03 PM,04/03/2015 06:42:18 AM,ONTIME,Closed,Case Closed Case Resolved new tolet installed,Equipment Repair: Charlestown Naval Shipyard Park,Parks & Recreation Department,Park Maintenance & Safety,Equipment Repair,PARK_Maintenance_Trades,PARK,,,,,,,,,,,,,,,,,42.3594,-71.0587,Self Service,"(0, 0)"
542264,101001345079,03/30/2015 02:44:00 PM,04/06/2015 02:44:27 PM,,OVERDUE,Open,,Equipment Repair,Parks & Recreation Department,Park Maintenance & Safety,Equipment Repair,INFO01_GenericeFormforOtherServiceRequestTypes,INFO,,,370 Hanover St  Boston  MA  02113,3.0,1B,1.0,A1,Downtown / Financial District,3.0,03,301.0,,370 Hanover St,2113.0,Address,342568.0,42.3594,-71.0587,Employee Generated,"(0, 0)"
542304,101001345130,03/30/2015 03:26:39 PM,04/06/2015 03:26:26 PM,04/02/2015 02:35:12 PM,ONTIME,Closed,Case Closed Case Resolved we have plaque,Equipment Repair,Parks & Recreation Department,Park Maintenance & Safety,Equipment Repair,PARK_Maintenance_Trades,PARK,,,775 E First St  South Boston  MA  02127,6.0,05,2.0,C6,South Boston / South Boston Waterfront,5.0,06,607.0,,775 E First St,2127.0,Address,342025.0,42.3594,-71.0587,Employee Generated,"(0, 0)"
542726,101001345713,03/31/2015 10:31:59 AM,04/07/2015 10:31:57 AM,04/02/2015 02:33:29 PM,ONTIME,Closed,Case Closed Case Resolved,Equipment Repair,Parks & Recreation Department,Park Maintenance & Safety,Equipment Repair,PARK_Maintenance_Trades,PARK,,,910 South St  Roslindale  MA  02131,9.0,06,5.0,E5,Roslindale,10.0,20,2004.0,,910 South St,2131.0,Address,342367.0,42.3594,-71.0587,Employee Generated,"(0, 0)"
542843,101001345876,03/31/2015 12:34:33 PM,04/07/2015 12:34:31 PM,04/11/2015 10:09:14 AM,OVERDUE,Closed,Case Closed Case Resolved fence reinstalled,Equipment Repair,Parks & Recreation Department,Park Maintenance & Safety,Equipment Repair,PARK_Maintenance_Trades,PARK,,,50 Charlesgate East   Boston  MA  02215,4.0,10A,8.0,D4,Boston,14.0,05,510.0,CD,50 Charlesgate East,2215.0,Address,29698.0,42.3473,-71.0913,Employee Generated,"(42.3473, -71.0913)"
542857,101001345891,03/31/2015 12:45:43 PM,04/07/2015 12:45:43 PM,,OVERDUE,Open,,Equipment Repair: ODay Playground,Parks & Recreation Department,Park Maintenance & Safety,Equipment Repair,PARK_Park Improvement Requests,PARK,,,,,,,,,,,,,,,,,42.3594,-71.0587,Self Service,"(0, 0)"
542890,101001345927,03/31/2015 01:15:09 PM,04/07/2015 01:15:09 PM,01/05/2016 02:48:11 PM,OVERDUE,Closed,Case Closed. Closed date : 2016-01-05 14:48:11.047 Duplicate of Existing Case,Equipment Repair: ODay Playground,Parks & Recreation Department,Park Maintenance & Safety,Equipment Repair,PARK_Park Improvement Requests,PARK,,,,,,,,,,,,,,,,,42.3594,-71.0587,Self Service,"(0, 0)"
542904,101001345949,03/31/2015 01:29:19 PM,04/07/2015 01:29:19 PM,,OVERDUE,Open,,Equipment Repair: ODay Playground,Parks & Recreation Department,Park Maintenance & Safety,Equipment Repair,PARK_Park Improvement Requests,PARK,,,,,,,,,,,,,,,,,42.3594,-71.0587,Self Service,"(0, 0)"
543003,101001346086,03/31/2015 02:55:16 PM,04/07/2015 02:55:16 PM,04/01/2015 07:29:56 AM,ONTIME,Closed,Case Closed Case Noted No location.,Equipment Repair: --Not in list--,Parks & Recreation Department,Park Maintenance & Safety,Equipment Repair,PARK_Maintenance_Trades,PARK,,,,,,,,,,,,,,,,,42.3594,-71.0587,Self Service,"(0, 0)"
543233,101001346432,04/01/2015 08:15:32 AM,04/08/2015 08:30:00 AM,04/02/2015 02:05:38 PM,ONTIME,Closed,Case Closed Case Resolved Soccer nets were install.,Equipment Repair,Parks & Recreation Department,Park Maintenance & Safety,Equipment Repair,PARK_Maintenance_Trades,PARK,,,,,,,,,,,,,,,,,42.3594,-71.0587,Constituent Call,"(0, 0)"
543384,101001346637,04/01/2015 09:55:44 AM,04/08/2015 09:55:43 AM,05/07/2015 09:53:34 AM,OVERDUE,Closed,Case Closed. Closed date : 2015-05-07 09:53:34.477 Case Resolved Signs were installed.,Equipment Repair,Parks & Recreation Department,Park Maintenance & Safety,Equipment Repair,PARK_Maintenance_Trades,PARK,,,86 Boardman St  East Boston  MA  02128,1.0,09,1.0,A7,East Boston,1.0,01,111.0,E,86 Boardman St,2128.0,Address,158227.0,42.3889,-71.0108,Employee Generated,"(42.3889, -71.0108)"
544138,101001347657,04/02/2015 10:30:31 AM,04/09/2015 10:30:29 AM,,OVERDUE,Open,,Equipment Repair,Parks & Recreation Department,Park Maintenance & Safety,Equipment Repair,PARK_Park Improvement Requests,PARK,,,10 Eden St  Charlestown  MA  02129,3.0,1A,1.0,A15,Charlestown,2.0,02,206.0,,10 Eden St,2129.0,Address,342116.0,42.3594,-71.0587,Constituent Call,"(0, 0)"
544142,101001347661,04/02/2015 10:32:54 AM,04/09/2015 10:32:53 AM,,OVERDUE,Open,,Equipment Repair,Parks & Recreation Department,Park Maintenance & Safety,Equipment Repair,PARK_Park Improvement Requests,PARK,,,10 Eden St  Charlestown  MA  02129,3.0,1A,1.0,A15,Charlestown,2.0,02,206.0,,10 Eden St,2129.0,Address,342116.0,42.3594,-71.0587,Constituent Call,"(0, 0)"
544166,101001347697,04/02/2015 11:04:46 AM,04/09/2015 11:04:45 AM,04/14/2015 12:12:13 PM,OVERDUE,Closed,Case Closed Case Resolved,Equipment Repair,Parks & Recreation Department,Park Maintenance & Safety,Equipment Repair,PARK_Maintenance_Trades,PARK,,,80 Humboldt Ave  Dorchester  MA  02121,9.0,10B,7.0,B2,Dorchester,13.0,12,1202.0,,80 Humboldt Ave,2121.0,Address,342506.0,42.3594,-71.0587,Employee Generated,"(0, 0)"
544226,101001347777,04/02/2015 12:06:46 PM,04/09/2015 12:06:44 PM,04/06/2015 02:50:19 PM,ONTIME,Closed,Case Closed Case Resolved done,Equipment Repair,Parks & Recreation Department,Park Maintenance & Safety,Equipment Repair,PARK_Maintenance_Trades,PARK,,,,,,,,,,,,,,,,,42.3594,-71.0587,Constituent Call,"(0, 0)"
544230,101001347781,04/02/2015 12:09:39 PM,04/09/2015 12:09:37 PM,04/08/2015 04:45:10 PM,ONTIME,Closed,Case Closed Case Noted no signs like this request,Equipment Repair,Parks & Recreation Department,Park Maintenance & Safety,Equipment Repair,PARK_Maintenance_Trades,PARK,,,,,,,,,,,,,,,,,42.3594,-71.0587,Constituent Call,"(0, 0)"
544284,101001347868,04/02/2015 12:55:49 PM,04/09/2015 12:55:47 PM,04/09/2015 02:31:05 PM,OVERDUE,Closed,Case Closed Case Resolved done  4-7-15,Equipment Repair,Parks & Recreation Department,Park Maintenance & Safety,Equipment Repair,PARK_Maintenance_Trades,PARK,,,50 Union St  Boston  MA  02108,3.0,1B,1.0,A1,Boston,3.0,3,306.0,,50 Union St,2108.0,Address,342040.0,42.3594,-71.0587,Employee Generated,"(0, 0)"
544425,101001348056,04/02/2015 02:10:49 PM,04/09/2015 02:10:49 PM,,OVERDUE,Open,,Equipment Repair: --Not in list--,Parks & Recreation Department,Park Maintenance & Safety,Equipment Repair,INFO01_GenericeFormforOtherServiceRequestTypes,INFO,,,,,,,,,,,,,,,,,42.3594,-71.0587,Self Service,"(0, 0)"
544502,101001348168,04/02/2015 03:38:43 PM,04/09/2015 03:38:41 PM,04/08/2015 11:49:38 AM,ONTIME,Closed,Case Closed Case Resolved done 4-7-15,Equipment Repair,Parks & Recreation Department,Park Maintenance & Safety,Equipment Repair,PARK_Maintenance_Trades,PARK,,,330 Perkins St  Jamaica Plain  MA  02130,9.0,02,6.0,E13,Jamaica Plain,11.0,19,1903.0,,330 Perkins St,2130.0,Address,347229.0,42.3594,-71.0587,Constituent Call,"(0, 0)"
544506,101001348172,04/02/2015 03:41:06 PM,04/09/2015 03:41:05 PM,04/08/2015 11:48:54 AM,ONTIME,Closed,Case Closed Case Resolved done 4-7-15,Equipment Repair,Parks & Recreation Department,Park Maintenance & Safety,Equipment Repair,PARK_Maintenance_Trades,PARK,,,350 Jamaicaway   Jamaica Plain  MA  02130,9.0,02,6.0,E13,Jamaica Plain,11.0,19,1903.0,E,350 Jamaicaway,2130.0,Address,79479.0,42.3199,-71.1167,Constituent Call,"(42.3199, -71.1167)"
544542,101001348225,04/02/2015 04:24:25 PM,04/09/2015 04:24:22 PM,04/03/2015 07:36:15 AM,ONTIME,Closed,Case Closed Case Noted Water will be turned on City wide around 4/15/15.,Equipment Repair,Parks & Recreation Department,Park Maintenance & Safety,Equipment Repair,PARK_Maintenance_Trades,PARK,,,75 Alford St  Charlestown  MA  02129,3.0,1A,1.0,A15,Charlestown,2.0,02,,,75 Alford St,2129.0,Address,342631.0,42.3594,-71.0587,Employee Generated,"(0, 0)"
544584,101001348289,04/02/2015 05:36:33 PM,04/10/2015 08:30:00 AM,04/24/2015 06:29:27 AM,OVERDUE,Closed,Case Closed Case Resolved repair swing chain,Equipment Repair,Parks & Recreation Department,Park Maintenance & Safety,Equipment Repair,PARK_Maintenance_Trades,PARK,,,INTERSECTION of Dorchester Ave & Harbor View St  Dorchester  MA,7.0,03,3.0,C11,Dorchester,7.0,Ward 13,1308.0,,INTERSECTION Dorchester Ave & Harbor View St,,Intersection,4190.0,42.3176,-71.0567,Constituent Call,"(42.3176, -71.0567)"
544781,101001348567,04/03/2015 09:25:04 AM,04/10/2015 09:25:04 AM,04/17/2015 11:11:35 AM,OVERDUE,Closed,Case Closed Case Resolved done,Equipment Repair,Parks & Recreation Department,Park Maintenance & Safety,Equipment Repair,PARK_Maintenance_Trades,PARK,,,85-91 W Newton St  Roxbury  MA  02118,4.0,1C,2.0,D4,South End,6.0,Ward 9,901.0,RC,85-91 W Newton St,2118.0,Address,171618.0,42.341,-71.0758,Constituent Call,"(42.341, -71.0758)"
544817,101001348613,04/03/2015 09:56:42 AM,04/10/2015 09:56:41 AM,04/08/2015 04:41:27 PM,ONTIME,Closed,Case Closed Case Resolved done 4-7-15,Equipment Repair,Parks & Recreation Department,Park Maintenance & Safety,Equipment Repair,PARK_Maintenance_Trades,PARK,,,35 Fenway   Boston  MA  02215,4.0,10A,8.0,D4,Fenway / Kenmore / Audubon Circle / Longwood,14.0,04,407.0,E,35 Fenway,2215.0,Address,342001.0,42.3594,-71.0587,Employee Generated,"(0, 0)"
545006,101001348892,04/03/2015 02:29:52 PM,04/10/2015 02:29:52 PM,10/22/2015 10:44:21 AM,OVERDUE,Closed,Case Closed. Closed date : 2015-10-22 10:44:21.14 Case Noted trades division reports the company that supplies the parts for the slide play equipment has gone out of business  parts will be ordered from another company at a later time,Equipment Repair,Parks & Recreation Department,Park Maintenance & Safety,Equipment Repair,PARK_Maintenance_Trades,PARK,,,775 E First St  South Boston  MA  02127,6.0,05,2.0,C6,South Boston / South Boston Waterfront,5.0,06,607.0,,775 E First St,2127.0,Address,342025.0,42.3594,-71.0587,Constituent Call,"(0, 0)"
545206,101001349153,04/03/2015 10:17:57 PM,04/13/2015 08:30:00 AM,04/09/2015 02:20:45 PM,ONTIME,Closed,Case Closed Case Resolved done 4-8-15,Equipment Repair: Hynes Playground,Parks & Recreation Department,Park Maintenance & Safety,Equipment Repair,PARK_Maintenance_Trades,PARK,,,,,,,,,,,,,,,,,42.3594,-71.0587,Self Service,"(0, 0)"
545315,101001349304,04/04/2015 01:26:38 PM,04/13/2015 08:30:00 AM,04/10/2015 06:15:45 AM,ONTIME,Closed,Case Closed Case Resolved install lock,Equipment Repair,Parks & Recreation Department,Park Maintenance & Safety,Equipment Repair,PARK_Maintenance_Trades,PARK,,,5275 Washington St  West Roxbury  MA  02132,12.0,06,6.0,E5,West Roxbury,12.0,20,2015.0,E,5275 Washington St,2132.0,Address,341136.0,42.26,-71.1596,Constituent Call,"(42.26, -71.1596)"
545654,101001349778,04/06/2015 08:21:20 AM,04/13/2015 08:30:00 AM,04/06/2015 10:17:45 AM,ONTIME,Closed,Case Closed Case Noted Water will be turned on City wide starting 4/15/15.,Equipment Repair: --Not in list--,Parks & Recreation Department,Park Maintenance & Safety,Equipment Repair,PARK_Maintenance_Trades,PARK,,,,,,,,,,,,,,,,,42.3594,-71.0587,Self Service,"(0, 0)"
545813,101001350000,04/06/2015 10:24:04 AM,04/13/2015 10:24:03 AM,04/08/2015 11:58:41 AM,ONTIME,Closed,Case Closed Case Resolved done 4-7-15,Equipment Repair,Parks & Recreation Department,Park Maintenance & Safety,Equipment Repair,PARK_Maintenance_Trades,PARK,,,,,,,,,,,,,,,,,42.3594,-71.0587,Employee Generated,"(0, 0)"
545814,101001350001,04/06/2015 10:24:19 AM,04/13/2015 10:24:17 AM,04/14/2015 06:17:29 AM,OVERDUE,Closed,Case Closed Case Resolved replace chain on swing,Equipment Repair,Parks & Recreation Department,Park Maintenance & Safety,Equipment Repair,PARK_Maintenance_Trades,PARK,,,50 Orchard Park St  Roxbury  MA  02119,7.0,10B,7.0,B2,Roxbury,13.0,8,803.0,,50 Orchard Park St,2119.0,Address,342557.0,42.3594,-71.0587,Employee Generated,"(0, 0)"
545837,101001350033,04/06/2015 10:43:25 AM,04/13/2015 10:43:24 AM,04/08/2015 04:42:06 PM,ONTIME,Closed,Case Closed Case Resolved done 4-7-15,Equipment Repair,Parks & Recreation Department,Park Maintenance & Safety,Equipment Repair,PARK_Maintenance_Trades,PARK,,,50 Orchard Park St  Roxbury  MA  02119,7.0,10B,7.0,B2,Roxbury,13.0,8,803.0,,50 Orchard Park St,2119.0,Address,342557.0,42.3594,-71.0587,Employee Generated,"(0, 0)"
545843,101001350039,04/06/2015 10:48:30 AM,04/13/2015 10:48:29 AM,04/14/2015 06:19:03 AM,OVERDUE,Closed,Case Closed Case Resolved replace hook on gate,Equipment Repair,Parks & Recreation Department,Park Maintenance & Safety,Equipment Repair,PARK_Maintenance_Trades,PARK,,,72 Dale St  Roxbury  MA  02119,9.0,10B,7.0,B2,Roxbury,13.0,12,1203.0,R3,72 Dale St,2119.0,Address,45756.0,42.3214,-71.0864,Employee Generated,"(42.3214, -71.0864)"
545851,101001350048,04/06/2015 10:52:51 AM,04/13/2015 10:52:48 AM,04/08/2015 10:47:30 AM,ONTIME,Closed,Case Closed Case Resolved remove big belly,Equipment Repair,Parks & Recreation Department,Park Maintenance & Safety,Equipment Repair,PARK_Maintenance_Trades,PARK,,,110 Atlantic Ave  Boston  MA  02110,3.0,1B,1.0,A1,Boston,3.0,3,301.0,,110 Atlantic Ave,2110.0,Address,161702.0,42.361,-71.0522,Employee Generated,"(42.361, -71.0522)"
545855,101001350052,04/06/2015 10:56:49 AM,04/13/2015 10:56:48 AM,04/24/2015 06:30:55 AM,OVERDUE,Closed,Case Closed Case Resolved replace wood & paint,Equipment Repair,Parks & Recreation Department,Park Maintenance & Safety,Equipment Repair,PARK_Maintenance_Trades,PARK,,,139 Tremont St  Boston  MA  02108,3.0,1C,8.0,A1,Beacon Hill,14.0,05,503.0,E,139 Tremont St,2108.0,Address,341542.0,42.3554,-71.0638,Employee Generated,"(42.3554, -71.0638)"
545877,101001350080,04/06/2015 11:21:08 AM,04/13/2015 11:21:06 AM,04/09/2015 03:02:00 PM,ONTIME,Closed,Case Closed Case Resolved done,Equipment Repair,Parks & Recreation Department,Park Maintenance & Safety,Equipment Repair,PARK_Maintenance_Trades,PARK,,,275 Geneva Ave  Dorchester  MA  02121,7.0,03,4.0,C11,Dorchester,8.0,14,1404.0,,275 Geneva Ave,2121.0,Address,342455.0,42.3594,-71.0587,Constituent Call,"(0, 0)"
545906,101001350119,04/06/2015 11:40:00 AM,04/13/2015 11:40:10 AM,11/06/2015 10:33:08 AM,OVERDUE,Closed,Case Closed. Closed date : 2015-11-06 10:33:08.523 Case Resolved done 4-15,Equipment Repair,Parks & Recreation Department,Park Maintenance & Safety,Equipment Repair,PARK_Park Improvement Requests,PARK,,,,,,,,,,,,,,,,,42.3594,-71.0587,Employee Generated,"(0, 0)"
545960,101001350190,04/06/2015 12:33:04 PM,04/13/2015 12:33:03 PM,04/14/2015 01:54:21 PM,OVERDUE,Closed,Case Closed Case Resolved,Equipment Repair,Parks & Recreation Department,Park Maintenance & Safety,Equipment Repair,PARK_Maintenance_Trades,PARK,,,139 Tremont St  Boston  MA  02108,3.0,1C,8.0,A1,Beacon Hill,14.0,05,503.0,E,139 Tremont St,2108.0,Address,341542.0,42.3554,-71.0638,Employee Generated,"(42.3554, -71.0638)"
546367,101001350748,04/07/2015 09:26:55 AM,04/14/2015 09:26:55 AM,11/06/2015 10:27:57 AM,OVERDUE,Closed,Case Closed. Closed date : 2015-11-06 10:27:57.66 Case Resolved done 11-5-15,Equipment Repair: Roberts Playground,Parks & Recreation Department,Park Maintenance & Safety,Equipment Repair,PARK_Maintenance_Trades,PARK,https://cityworker.cityofboston.gov:8443/attachments/report/5523db1a70b47681496b82b9/photo/Report.jpg,,56 Dunbar Ave  Dorchester  MA  02124,8.0,07,4.0,B3,Dorchester,9.0,17,1708.0,,56 Dunbar Ave,2124.0,Address,342601.0,42.3594,-71.0587,City Worker App,"(0, 0)"
546390,101001350776,04/07/2015 09:49:46 AM,04/14/2015 09:49:45 AM,04/07/2015 09:51:47 AM,ONTIME,Closed,Case Closed Case Resolved done 4-6-15,Equipment Repair,Parks & Recreation Department,Park Maintenance & Safety,Equipment Repair,PARK_Maintenance_Trades,PARK,,,,,,,,,,,,,,,,,42.3594,-71.0587,Employee Generated,"(0, 0)"
546481,101001350904,04/07/2015 11:28:39 AM,04/14/2015 11:28:38 AM,04/07/2015 11:30:46 AM,ONTIME,Closed,Case Closed Case Resolved done,Equipment Repair,Parks & Recreation Department,Park Maintenance & Safety,Equipment Repair,PARK_Maintenance_Trades,PARK,,,,,,,,,,,,,,,,,42.3594,-71.0587,Employee Generated,"(0, 0)"
546486,101001350912,04/07/2015 11:33:06 AM,04/14/2015 11:33:04 AM,04/07/2015 02:36:30 PM,ONTIME,Closed,Case Closed Case Resolved done,Equipment Repair,Parks & Recreation Department,Park Maintenance & Safety,Equipment Repair,PARK_Maintenance_Trades,PARK,,,,,,,,,,,,,,,,,42.3594,-71.0587,Employee Generated,"(0, 0)"
547246,101001351884,04/08/2015 10:21:14 AM,04/15/2015 10:21:12 AM,04/13/2015 07:35:49 AM,ONTIME,Closed,Case Closed Case Resolved no graffiti found,Equipment Repair,Parks & Recreation Department,Park Maintenance & Safety,Equipment Repair,PARK_Maintenance_Trades,PARK,,,92 Mount Ida Rd  Dorchester  MA  02122,7.0,03,3.0,C11,Dorchester,8.0,15,1509.0,,92 Mount Ida Rd,2122.0,Address,342620.0,42.3594,-71.0587,Employee Generated,"(0, 0)"
547454,101001352158,04/08/2015 01:41:04 PM,04/15/2015 01:41:04 PM,04/09/2015 12:26:56 PM,ONTIME,Closed,Case Closed Case Resolved,Ground Maintenance: McLaughlin Playground,Parks & Recreation Department,Park Maintenance & Safety,Equipment Repair,PARK_Maintenance_Region 3,PARK,,,,,,,,,,,,,,,,,42.3594,-71.0587,Self Service,"(0, 0)"
547598,101001352352,04/08/2015 04:36:39 PM,04/15/2015 04:36:36 PM,04/14/2015 06:11:42 AM,ONTIME,Closed,Case Closed Case Resolved remove graffiti,Equipment Repair,Parks & Recreation Department,Park Maintenance & Safety,Equipment Repair,PARK_Maintenance_Trades,PARK,,,,,,,,,,,,,,,,,42.3594,-71.0587,Employee Generated,"(0, 0)"
547600,101001352354,04/08/2015 04:39:27 PM,04/15/2015 04:39:26 PM,04/14/2015 06:10:53 AM,ONTIME,Closed,Case Closed Case Resolved remove graffiti,Equipment Repair,Parks & Recreation Department,Park Maintenance & Safety,Equipment Repair,PARK_Maintenance_Trades,PARK,,,,,,,,,,,,,,,,,42.3594,-71.0587,Employee Generated,"(0, 0)"
547714,101001352493,04/09/2015 07:38:52 AM,04/16/2015 08:30:00 AM,,OVERDUE,Open,,Equipment Repair: Hardiman Playground,Parks & Recreation Department,Park Maintenance & Safety,Equipment Repair,PARK_Maintenance_Trades,PARK,,,,,,,,,,,,,,,,,42.3594,-71.0587,Self Service,"(0, 0)"
547715,101001352494,04/09/2015 07:41:21 AM,04/16/2015 08:30:00 AM,10/15/2015 11:04:47 AM,OVERDUE,Closed,Case Closed. Closed date : 2015-10-15 11:04:47.823 Case Resolved done 10-14-15,Equipment Repair: Hardiman Playground,Parks & Recreation Department,Park Maintenance & Safety,Equipment Repair,PARK_Maintenance_Trades,PARK,,,,,,,,,,,,,,,,,42.3594,-71.0587,Self Service,"(0, 0)"
547918,101001352753,04/09/2015 10:15:19 AM,04/16/2015 10:15:18 AM,04/17/2015 11:14:54 AM,OVERDUE,Closed,Case Closed Case Resolved done 4-13-15,Equipment Repair,Parks & Recreation Department,Park Maintenance & Safety,Equipment Repair,PARK_Maintenance_Trades,PARK,,,45 Bunker Hill St  Charlestown  MA  02129,3.0,1A,1.0,A15,Charlestown,2.0,02,202.0,,45 Bunker Hill St,2129.0,Address,342474.0,42.3594,-71.0587,Employee Generated,"(0, 0)"
547939,101001352778,04/09/2015 10:34:31 AM,04/16/2015 10:34:28 AM,01/12/2016 01:58:43 PM,OVERDUE,Closed,Case Closed. Closed date : 2016-01-12 13:58:43.8 Case Resolved fence repaired on 1-11-16,Equipment Repair,Parks & Recreation Department,Park Maintenance & Safety,Equipment Repair,PARK_Maintenance_Trades,PARK,,,20 Williams St  Jamaica Plain  MA  02130,9.0,02,6.0,E13,Jamaica Plain,11.0,11,1107.0,,20 Williams St,2130.0,Address,342335.0,42.3075,-71.1077,Constituent Call,"(42.3075, -71.1077)"
547981,101001352835,04/09/2015 11:18:58 AM,04/16/2015 11:18:57 AM,01/11/2016 11:55:52 AM,OVERDUE,Closed,Case Closed. Closed date : 2016-01-11 11:55:52.31 Case Resolved,Equipment Repair,Parks & Recreation Department,Park Maintenance & Safety,Equipment Repair,PARK_Park Improvement Requests,PARK,,,105 Ceylon St  Dorchester  MA  02121,7.0,03,4.0,B2,Dorchester,13.0,14,1401.0,,105 Ceylon St,2121.0,Address,342021.0,42.3594,-71.0587,Constituent Call,"(0, 0)"
548052,101001352939,04/09/2015 12:54:39 PM,04/16/2015 12:54:38 PM,,OVERDUE,Open,,Equipment Repair,Parks & Recreation Department,Park Maintenance & Safety,Equipment Repair,PARK_Maintenance_Trades,PARK,,,86 Boardman St  East Boston  MA  02128,1.0,09,1.0,A7,East Boston,1.0,01,111.0,E,86 Boardman St,2128.0,Address,158227.0,42.3889,-71.0108,Constituent Call,"(42.3889, -71.0108)"
548068,101001352959,04/09/2015 01:09:34 PM,04/16/2015 01:09:33 PM,04/11/2015 09:59:45 AM,ONTIME,Closed,Case Closed Case Resolved heat fixed,Equipment Repair,Parks & Recreation Department,Park Maintenance & Safety,Equipment Repair,PARK_Maintenance_Trades,PARK,,,139 Tremont St  Boston  MA  02108,3.0,1C,8.0,A1,Beacon Hill,14.0,05,503.0,E,139 Tremont St,2108.0,Address,341542.0,42.3554,-71.0638,Employee Generated,"(42.3554, -71.0638)"
548137,101001353063,04/09/2015 03:06:29 PM,04/16/2015 03:06:27 PM,04/14/2015 06:09:00 AM,ONTIME,Closed,Case Closed Case Resolved temove graffiti,Equipment Repair,Parks & Recreation Department,Park Maintenance & Safety,Equipment Repair,PARK_Maintenance_Trades,PARK,,,340 Neponset Ave  Dorchester  MA  02122,8.0,07,3.0,C11,Dorchester,7.0,16,1610.0,,340 Neponset Ave,2122.0,Address,342452.0,42.3594,-71.0587,Employee Generated,"(0, 0)"
548672,101001353788,04/10/2015 04:08:15 PM,04/17/2015 04:08:13 PM,04/10/2015 04:10:49 PM,ONTIME,Closed,Case Closed Case Resolved done 4-8-15,Equipment Repair,Parks & Recreation Department,Park Maintenance & Safety,Equipment Repair,PARK_Maintenance_Trades,PARK,,,,,,,,,,,,,,,,,42.3594,-71.0587,Employee Generated,"(0, 0)"
548674,101001353791,04/10/2015 04:11:53 PM,04/17/2015 04:11:52 PM,04/10/2015 04:14:12 PM,ONTIME,Closed,Case Closed Case Resolved done 4-8-15,Equipment Repair,Parks & Recreation Department,Park Maintenance & Safety,Equipment Repair,PARK_Maintenance_Trades,PARK,,,,,,,,,,,,,,,,,42.3594,-71.0587,Employee Generated,"(0, 0)"
548680,101001353800,04/10/2015 04:22:58 PM,04/17/2015 04:22:57 PM,04/10/2015 04:25:30 PM,ONTIME,Closed,Case Closed Case Resolved done 4-8-15,Equipment Repair,Parks & Recreation Department,Park Maintenance & Safety,Equipment Repair,PARK_Maintenance_Trades,PARK,,,,,,,,,,,,,,,,,42.3594,-71.0587,Employee Generated,"(0, 0)"
548863,101001354058,04/11/2015 12:39:55 PM,04/21/2015 08:30:00 AM,08/04/2015 06:07:16 AM,OVERDUE,Closed,Case Closed. Closed date : 2015-08-04 06:07:16.06 Case Resolved school of art to maint,Equipment Repair,Parks & Recreation Department,Park Maintenance & Safety,Equipment Repair,PARK_Maintenance_Trades,PARK,,,1 Evans Way  Boston  MA  02115,4.0,10A,8.0,B2,Fenway / Kenmore / Audubon Circle / Longwood,14.0,04,410.0,,1 Evans Way,2115.0,Address,343330.0,42.3594,-71.0587,Constituent Call,"(0, 0)"
548889,101001354092,04/11/2015 02:29:58 PM,04/21/2015 08:30:00 AM,04/30/2015 02:01:54 PM,OVERDUE,Closed,Case Closed Case Resolved done,Equipment Repair: Pagel Playground,Parks & Recreation Department,Park Maintenance & Safety,Equipment Repair,PARK_Maintenance_Trades,PARK,,,,,,,,,,,,,,,,,42.3594,-71.0587,Self Service,"(0, 0)"
548954,101001354212,04/11/2015 10:56:08 PM,04/21/2015 08:30:00 AM,04/24/2015 06:36:55 AM,OVERDUE,Closed,Case Closed Case Resolved soccer goal have no bottom cross bar,Equipment Repair: Pagel Playground,Parks & Recreation Department,Park Maintenance & Safety,Equipment Repair,PARK_Maintenance_Trades,PARK,,,,,,,,,,,,,,,,,42.3594,-71.0587,Self Service,"(0, 0)"
549082,101001354409,04/12/2015 04:02:00 PM,04/21/2015 08:30:00 AM,04/29/2015 02:20:45 PM,OVERDUE,Closed,Case Closed Case Resolved Repairs made,Equipment Repair: Ronan Park,Parks & Recreation Department,Park Maintenance & Safety,Equipment Repair,PARK_Park Improvement Requests,PARK,,,,,,,,,,,,,,,,,42.3594,-71.0587,Self Service,"(0, 0)"
549115,101001354464,04/12/2015 06:14:31 PM,04/21/2015 08:30:00 AM,04/30/2015 11:51:04 AM,OVERDUE,Closed,Case Closed Case Resolved done 4-28-15,Equipment Repair:,Parks & Recreation Department,Park Maintenance & Safety,Equipment Repair,PARK_Maintenance_Trades,PARK,,,,,,,,,,,,,,,,,42.3594,-71.0587,Self Service,"(0, 0)"
549306,101001354746,04/13/2015 09:49:00 AM,04/21/2015 09:49:48 AM,,OVERDUE,Open,,Equipment Repair,Parks & Recreation Department,Park Maintenance & Safety,Equipment Repair,PARK_Park Improvement Requests,PARK,,,775 E First St  South Boston  MA  02127,6.0,05,2.0,C6,South Boston / South Boston Waterfront,5.0,06,607.0,,775 E First St,2127.0,Address,342025.0,42.3594,-71.0587,Constituent Call,"(0, 0)"
549315,101001354754,04/13/2015 09:58:41 AM,04/21/2015 09:58:40 AM,04/15/2015 06:11:12 AM,ONTIME,Closed,Case Closed Case Resolved power wash bleachers,Equipment Repair,Parks & Recreation Department,Park Maintenance & Safety,Equipment Repair,PARK_Maintenance_Trades,PARK,,,1917 Washington St  Roxbury  MA  02118,4.0,10B,7.0,D4,Roxbury,13.0,09,903.0,CM,1917 Washington St,2118.0,Address,171084.0,42.3338,-71.0808,Employee Generated,"(42.3338, -71.0808)"
549352,101001354808,04/13/2015 10:34:23 AM,04/21/2015 10:34:22 AM,,OVERDUE,Open,,Equipment Repair,Parks & Recreation Department,Park Maintenance & Safety,Equipment Repair,PARK_Maintenance_Trades,PARK,,,86 Boardman St  East Boston  MA  02128,1.0,09,1.0,A7,East Boston,1.0,01,111.0,E,86 Boardman St,2128.0,Address,158227.0,42.3889,-71.0108,Employee Generated,"(42.3889, -71.0108)"
549425,101001354897,04/13/2015 11:30:44 AM,04/21/2015 11:29:59 AM,04/15/2015 06:09:18 AM,ONTIME,Closed,Case Closed Case Resolved install new flag,Equipment Repair,Parks & Recreation Department,Park Maintenance & Safety,Equipment Repair,PARK_Maintenance_Trades,PARK,,,29 Harvard St  Charlestown  MA  02129,3.0,1A,1.0,A15,Charlestown,2.0,2,201.0,,29 Harvard St,2129.0,Address,342468.0,42.3594,-71.0587,Employee Generated,"(0, 0)"
549434,101001354906,04/13/2015 11:37:08 AM,04/21/2015 11:37:07 AM,04/15/2015 06:07:56 AM,ONTIME,Closed,Case Closed Case Resolved install new handle,Equipment Repair,Parks & Recreation Department,Park Maintenance & Safety,Equipment Repair,PARK_Maintenance_Trades,PARK,,,139 Tremont St  Boston  MA  02108,3.0,1C,8.0,A1,Beacon Hill,14.0,05,503.0,E,139 Tremont St,2108.0,Address,341542.0,42.3554,-71.0638,Employee Generated,"(42.3554, -71.0638)"
549500,101001354999,04/13/2015 12:27:51 PM,04/21/2015 12:27:50 PM,04/14/2015 07:52:31 AM,ONTIME,Closed,Case Closed Case Resolved clean fountain,Equipment Repair,Parks & Recreation Department,Park Maintenance & Safety,Equipment Repair,PARK_Maintenance_Trades,PARK,,,,,,,,,,,,,,,,,42.3594,-71.0587,Employee Generated,"(0, 0)"
549653,101001355219,04/13/2015 03:12:25 PM,04/21/2015 03:12:23 PM,04/15/2015 06:05:39 AM,ONTIME,Closed,Case Closed Case Resolved remove graffiti,Equipment Repair,Parks & Recreation Department,Park Maintenance & Safety,Equipment Repair,PARK_Maintenance_Trades,PARK,,,775 E First St  South Boston  MA  02127,6.0,05,2.0,C6,South Boston / South Boston Waterfront,5.0,06,607.0,,775 E First St,2127.0,Address,342025.0,42.3594,-71.0587,Employee Generated,"(0, 0)"
550107,101001355866,04/14/2015 10:36:15 AM,04/22/2015 10:36:12 AM,06/15/2015 02:49:52 PM,OVERDUE,Closed,Case Closed. Closed date : 2015-06-15 14:49:52.61 Case Resolved,Equipment Repair,Parks & Recreation Department,Park Maintenance & Safety,Equipment Repair,PARK_Maintenance_Trades,PARK,,,,,,,,,,,,,,,,,42.3594,-71.0587,Employee Generated,"(0, 0)"
550204,101001355991,04/14/2015 11:38:16 AM,04/22/2015 11:38:14 AM,,OVERDUE,Open,,Equipment Repair,Parks & Recreation Department,Park Maintenance & Safety,Equipment Repair,PARK_Maintenance_Trades,PARK,,,1005 Columbia Rd  South Boston  MA  02127,6.0,05,2.0,C6,South Boston,5.0,7,707.0,,1005 Columbia Rd,2127.0,Address,163529.0,42.3272,-71.0504,Employee Generated,"(42.3272, -71.0504)"
550278,101001356083,04/14/2015 01:01:17 PM,04/22/2015 01:01:17 PM,05/07/2015 06:06:10 AM,OVERDUE,Closed,Case Closed. Closed date : 2015-05-07 06:06:10.3 Case Resolved remove locks,Equipment Repair: McLaughlin Playground,Parks & Recreation Department,Park Maintenance & Safety,Equipment Repair,PARK_Maintenance_Trades,PARK,,,,,,,,,,,,,,,,,42.3594,-71.0587,Self Service,"(0, 0)"
550307,101001356124,04/14/2015 01:26:15 PM,04/22/2015 01:26:14 PM,,OVERDUE,Open,,Equipment Repair,Parks & Recreation Department,Park Maintenance & Safety,Equipment Repair,PARK_Maintenance_Trades,PARK,,,517 Commercial St  Boston  MA  02109,3.0,1B,1.0,A1,Boston,3.0,3,302.0,E,517 Commercial St,2109.0,Address,341654.0,42.3682,-71.0543,Employee Generated,"(42.3682, -71.0543)"
550311,101001356129,04/14/2015 01:29:27 PM,04/22/2015 01:29:26 PM,04/17/2015 11:16:02 AM,ONTIME,Closed,Case Closed Case Resolved done 4-15-15,Equipment Repair,Parks & Recreation Department,Park Maintenance & Safety,Equipment Repair,PARK_Maintenance_Trades,PARK,,,517 Commercial St  Boston  MA  02109,3.0,1B,1.0,A1,Boston,3.0,3,302.0,E,517 Commercial St,2109.0,Address,341654.0,42.3682,-71.0543,Employee Generated,"(42.3682, -71.0543)"
550341,101001356176,04/14/2015 01:54:47 PM,04/22/2015 01:54:45 PM,04/23/2015 01:06:30 PM,OVERDUE,Closed,Case Closed Case Resolved done 4-16-15,Equipment Repair,Parks & Recreation Department,Park Maintenance & Safety,Equipment Repair,PARK_Maintenance_Trades,PARK,,,58 Wachusett St  Jamaica Plain  MA  02130,12.0,02,6.0,E13,Jamaica Plain,10.0,19,1907.0,,58 Wachusett St,2130.0,Address,342566.0,42.3594,-71.0587,Employee Generated,"(0, 0)"
550347,101001356188,04/14/2015 02:01:42 PM,04/22/2015 02:01:41 PM,05/27/2015 11:14:42 AM,OVERDUE,Closed,Case Closed. Closed date : 2015-05-27 11:14:42.61 Case Noted No info.,Equipment Repair,Parks & Recreation Department,Park Maintenance & Safety,Equipment Repair,PARK_Maintenance_Trades,PARK,,,960 Dorchester Ave  Dorchester  MA  02125,7.0,03,3.0,C11,Dorchester,7.0,13,1307.0,,960 Dorchester Ave,2125.0,Address,342630.0,42.3594,-71.0587,Employee Generated,"(0, 0)"
550348,101001356189,04/14/2015 02:01:43 PM,04/22/2015 02:01:41 PM,04/17/2015 11:16:52 AM,ONTIME,Closed,Case Closed Case Resolved done 4-15-15,Equipment Repair,Parks & Recreation Department,Park Maintenance & Safety,Equipment Repair,PARK_Maintenance_Trades,PARK,,,930 Blue Hill Ave  Dorchester  MA  02124,8.0,07,4.0,B3,Dorchester,9.0,14,1410.0,,930 Blue Hill Ave,2124.0,Address,162200.0,42.2923,-71.0846,Employee Generated,"(42.2923, -71.0846)"
550357,101001356198,04/14/2015 02:04:56 PM,04/22/2015 02:04:54 PM,05/07/2015 09:54:47 AM,OVERDUE,Closed,Case Closed. Closed date : 2015-05-07 09:54:47.343 Case Resolved Exposed wires were covered.,Equipment Repair,Parks & Recreation Department,Park Maintenance & Safety,Equipment Repair,PARK_Maintenance_Trades,PARK,,,340 Neponset Ave  Dorchester  MA  02122,8.0,07,3.0,C11,Dorchester,7.0,16,1610.0,,340 Neponset Ave,2122.0,Address,342452.0,42.3594,-71.0587,Employee Generated,"(0, 0)"
550386,101001356233,04/14/2015 02:30:02 PM,04/22/2015 02:30:01 PM,05/07/2015 06:08:05 AM,OVERDUE,Closed,Case Closed. Closed date : 2015-05-07 06:08:05.217 Case Resolved replace rims,Equipment Repair,Parks & Recreation Department,Park Maintenance & Safety,Equipment Repair,PARK_Maintenance_Trades,PARK,,,260 Highland St  Roxbury  MA  02119,9.0,10B,7.0,B2,Roxbury,13.0,11,1101.0,E,260 Highland St,2119.0,Address,73748.0,42.3228,-71.0962,Constituent Call,"(42.3228, -71.0962)"
550874,101001356915,04/15/2015 10:39:28 AM,04/23/2015 10:39:26 AM,04/22/2015 02:57:02 PM,ONTIME,Closed,Case Closed Case Invalid,Equipment Repair,Parks & Recreation Department,Park Maintenance & Safety,Equipment Repair,PARK_Maintenance_Trades,PARK,,,45 Prince St  Boston  MA  02113,3.0,1B,1.0,A1,Boston,3.0,3,303.0,,45 Prince St,2113.0,Address,342574.0,42.3594,-71.0587,Employee Generated,"(0, 0)"
550875,101001356916,04/15/2015 10:39:52 AM,04/23/2015 10:39:48 AM,04/30/2015 02:07:45 PM,OVERDUE,Closed,Case Closed Case Resolved done,Equipment Repair,Parks & Recreation Department,Park Maintenance & Safety,Equipment Repair,PARK_Maintenance_Trades,PARK,,,45 Prince St  Boston  MA  02113,3.0,1B,1.0,A1,Boston,3.0,3,303.0,,45 Prince St,2113.0,Address,342574.0,42.3594,-71.0587,Employee Generated,"(0, 0)"
550883,101001356925,04/15/2015 10:44:53 AM,04/23/2015 10:44:52 AM,04/16/2015 06:20:01 AM,ONTIME,Closed,Case Closed Case Resolved remove graffiti,Equipment Repair,Parks & Recreation Department,Park Maintenance & Safety,Equipment Repair,PARK_Maintenance_Trades,PARK,,,25 Pierpont Rd  Jamaica Plain  MA  02130,9.0,02,7.0,B2,Greater Mattapan,13.0,12,1207.0,,25 Pierpont Rd,2130.0,Address,342449.0,42.3594,-71.0587,Employee Generated,"(0, 0)"
550989,101001357048,04/15/2015 12:37:23 PM,04/23/2015 12:37:21 PM,04/17/2015 06:05:24 AM,ONTIME,Closed,Case Closed Case Resolved remove graffiti,Equipment Repair,Parks & Recreation Department,Park Maintenance & Safety,Equipment Repair,PARK_Maintenance_Trades,PARK,,,621 Dudley St  Dorchester  MA  02125,7.0,03,7.0,B2,Dorchester,13.0,13,1302.0,,621 Dudley St,2125.0,Address,342460.0,42.3594,-71.0587,Employee Generated,"(0, 0)"
551000,101001357059,04/15/2015 12:46:07 PM,04/23/2015 12:45:57 PM,04/30/2015 02:26:28 PM,OVERDUE,Closed,Case Closed Case Resolved done,Equipment Repair,Parks & Recreation Department,Park Maintenance & Safety,Equipment Repair,PARK_Maintenance_Trades,PARK,,,,,,,,,,,,,,,,,42.3594,-71.0587,Employee Generated,"(0, 0)"
551108,101001357199,04/15/2015 02:42:20 PM,04/23/2015 02:42:19 PM,04/30/2015 11:49:10 AM,OVERDUE,Closed,Case Closed Case Resolved done 4-28-15,Equipment Repair,Parks & Recreation Department,Park Maintenance & Safety,Equipment Repair,PARK_Maintenance_Trades,PARK,,,21 Danube St  Dorchester  MA  02125,7.0,03,7.0,B2,Dorchester,13.0,13,1301.0,,21 Danube St,2125.0,Address,342690.0,42.3594,-71.0587,Employee Generated,"(0, 0)"
551186,101001357314,04/15/2015 03:59:48 PM,04/23/2015 03:59:47 PM,04/30/2015 11:50:06 AM,OVERDUE,Closed,Case Closed Case Noted chains sprayed done 4-27-15,Equipment Repair,Parks & Recreation Department,Park Maintenance & Safety,Equipment Repair,PARK_Maintenance_Trades,PARK,,,960 Dorchester Ave  Dorchester  MA  02125,7.0,03,3.0,C11,Dorchester,7.0,13,1307.0,,960 Dorchester Ave,2125.0,Address,342630.0,42.3594,-71.0587,Constituent Call,"(0, 0)"
551203,101001357332,04/15/2015 04:14:54 PM,04/23/2015 04:14:42 PM,07/15/2015 09:59:00 AM,OVERDUE,Closed,Case Closed. Closed date : 2015-07-15 09:59:00.853 Case Resolved,Equipment Repair,Parks & Recreation Department,Park Maintenance & Safety,Equipment Repair,PARK_Maintenance_Trades,PARK,,,,,,,,,,,,,,,,,42.3594,-71.0587,Employee Generated,"(0, 0)"
551557,101001357850,04/16/2015 10:18:01 AM,04/24/2015 10:17:59 AM,05/07/2015 06:09:52 AM,OVERDUE,Closed,Case Closed. Closed date : 2015-05-07 06:09:52.137 Case Resolved remove sign,Equipment Repair,Parks & Recreation Department,Park Maintenance & Safety,Equipment Repair,PARK_Maintenance_Trades,PARK,,,25 Pierpont Rd  Jamaica Plain  MA  02130,9.0,02,7.0,B2,Greater Mattapan,13.0,12,1207.0,,25 Pierpont Rd,2130.0,Address,342449.0,42.3594,-71.0587,Employee Generated,"(0, 0)"
551565,101001357860,04/16/2015 10:21:58 AM,04/24/2015 10:21:56 AM,04/18/2015 09:58:20 AM,ONTIME,Closed,Case Closed Case Resolved remove graffiti,Equipment Repair,Parks & Recreation Department,Park Maintenance & Safety,Equipment Repair,PARK_Maintenance_Trades,PARK,,,25 Pierpont Rd  Jamaica Plain  MA  02130,9.0,02,7.0,B2,Greater Mattapan,13.0,12,1207.0,,25 Pierpont Rd,2130.0,Address,342449.0,42.3594,-71.0587,Employee Generated,"(0, 0)"
551827,101001358242,04/16/2015 02:59:17 PM,04/24/2015 02:59:14 PM,04/16/2015 03:41:20 PM,ONTIME,Closed,Case Closed Case Invalid,Equipment Repair,Parks & Recreation Department,Park Maintenance & Safety,Equipment Repair,PARK_Maintenance_Trades,PARK,,,25 Pierpont Rd  Jamaica Plain  MA  02130,9.0,02,7.0,B2,Greater Mattapan,13.0,12,1207.0,,25 Pierpont Rd,2130.0,Address,342449.0,42.3594,-71.0587,Employee Generated,"(0, 0)"
551828,101001358243,04/16/2015 02:59:41 PM,04/24/2015 02:59:39 PM,04/18/2015 09:35:55 AM,ONTIME,Closed,Case Closed Case Resolved remove graffiti,Equipment Repair,Parks & Recreation Department,Park Maintenance & Safety,Equipment Repair,PARK_Maintenance_Trades,PARK,,,25 Pierpont Rd  Jamaica Plain  MA  02130,9.0,02,7.0,B2,Greater Mattapan,13.0,12,1207.0,,25 Pierpont Rd,2130.0,Address,342449.0,42.3594,-71.0587,Employee Generated,"(0, 0)"
551877,101001358332,04/16/2015 03:56:55 PM,04/24/2015 03:56:54 PM,01/05/2016 02:29:10 PM,OVERDUE,Closed,Case Closed. Closed date : 2016-01-05 14:29:10.93 Case Resolved repairs made,Equipment Repair: --Not in list--,Parks & Recreation Department,Park Maintenance & Safety,Equipment Repair,PARK_Park Improvement Requests,PARK,,,,,,,,,,,,,,,,,42.3594,-71.0587,Self Service,"(0, 0)"
552014,101001358522,04/17/2015 06:41:17 AM,04/27/2015 08:30:00 AM,12/30/2015 04:37:59 PM,OVERDUE,Closed,Case Closed. Closed date : 2015-12-30 16:37:59.107 Case Resolved repairs made,Equipment Repair: --Not in list--,Parks & Recreation Department,Park Maintenance & Safety,Equipment Repair,PARK_Park Improvement Requests,PARK,,,,,,,,,,,,,,,,,42.3594,-71.0587,Self Service,"(0, 0)"
552168,101001358756,04/17/2015 10:23:56 AM,04/27/2015 10:23:56 AM,04/23/2015 10:34:03 AM,ONTIME,Closed,Case Closed Case Noted new bolt installed  done 4-17-15,Equipment Repair: Billings Field,Parks & Recreation Department,Park Maintenance & Safety,Equipment Repair,PARK_Maintenance_Trades,PARK,,,,,,,,,,,,,,,,,42.3594,-71.0587,Self Service,"(0, 0)"
552810,101001359704,04/19/2015 10:11:50 AM,04/28/2015 08:30:00 AM,04/21/2015 08:17:46 AM,ONTIME,Closed,Case Closed Duplicate of Existing Case Same as #1358522,Equipment Repair,Parks & Recreation Department,Park Maintenance & Safety,Equipment Repair,PARK_Maintenance_Trades,PARK,,,143 Porter St  East Boston  MA  02128,1.0,09,1.0,A7,East Boston,1.0,01,105.0,,143 Porter St,2128.0,Address,344495.0,42.3594,-71.0587,Constituent Call,"(0, 0)"
553027,101001360017,04/20/2015 11:12:00 AM,04/28/2015 08:30:00 AM,07/15/2015 09:55:03 AM,OVERDUE,Closed,Case Closed. Closed date : 2015-07-15 09:55:03.327 Case Resolved,Equipment Repair: --------------------,Parks & Recreation Department,Park Maintenance & Safety,Equipment Repair,PARK_Maintenance_Trades,PARK,,,,,,,,,,,,,,,,,42.3594,-71.0587,Self Service,"(0, 0)"
553105,101001360107,04/20/2015 02:49:34 PM,04/28/2015 08:30:00 AM,05/08/2015 06:22:35 PM,OVERDUE,Closed,Case Closed. Closed date : 2015-05-08 18:22:35.303 Case Resolved repair swing,Equipment Repair: Roberts Playground,Parks & Recreation Department,Park Maintenance & Safety,Equipment Repair,PARK_Maintenance_Trades,PARK,https://cityworker.cityofboston.gov:8443/attachments/report/55354a3c70b47681496c10ce/photo/Report.jpg,,56 Dunbar Ave  Dorchester  MA  02124,8.0,07,4.0,B3,Dorchester,9.0,17,1708.0,,56 Dunbar Ave,2124.0,Address,342601.0,42.3594,-71.0587,City Worker App,"(0, 0)"
553332,101001360466,04/21/2015 09:58:27 AM,04/28/2015 09:58:25 AM,04/23/2015 10:32:23 AM,ONTIME,Closed,Case Closed Case Resolved done 4-21-15,Equipment Repair,Parks & Recreation Department,Park Maintenance & Safety,Equipment Repair,PARK_Maintenance_Trades,PARK,,,139 Tremont St  Boston  MA  02108,3.0,1C,8.0,A1,Beacon Hill,14.0,05,503.0,E,139 Tremont St,2108.0,Address,341542.0,42.3554,-71.0638,Employee Generated,"(42.3554, -71.0638)"
553348,101001360487,04/21/2015 10:06:45 AM,04/28/2015 10:06:44 AM,04/27/2015 10:52:25 AM,ONTIME,Closed,Case Closed Case Resolved rope replaced  done 4-24-15,Equipment Repair,Parks & Recreation Department,Park Maintenance & Safety,Equipment Repair,PARK_Maintenance_Trades,PARK,,,70 Park Dr  Boston  MA  02215,4.0,10A,8.0,D4,Fenway / Kenmore / Audubon Circle / Longwood,14.0,05,502.0,E,70 Park Dr,2215.0,Address,342000.0,42.3594,-71.0587,Employee Generated,"(0, 0)"
553368,101001360510,04/21/2015 10:20:34 AM,04/28/2015 10:20:33 AM,04/27/2015 01:52:09 PM,ONTIME,Closed,Case Closed Case Resolved fixed swing,Equipment Repair,Parks & Recreation Department,Park Maintenance & Safety,Equipment Repair,PARK_Maintenance_Trades,PARK,,,,,,,,,,,,,,,,,42.3594,-71.0587,Constituent Call,"(0, 0)"
553374,101001360517,04/21/2015 10:23:09 AM,04/28/2015 10:23:05 AM,04/27/2015 01:51:09 PM,ONTIME,Closed,Case Closed Case Resolved wall hit by car reallocate to d&c,Equipment Repair,Parks & Recreation Department,Park Maintenance & Safety,Equipment Repair,PARK_Maintenance_Trades,PARK,,,,,,,,,,,,,,,,,42.3594,-71.0587,Constituent Call,"(0, 0)"
553378,101001360521,04/21/2015 10:27:12 AM,04/28/2015 10:27:10 AM,04/23/2015 10:31:43 AM,ONTIME,Closed,Case Closed Case Resolved done 4-22-15,Equipment Repair,Parks & Recreation Department,Park Maintenance & Safety,Equipment Repair,PARK_Maintenance_Trades,PARK,,,60 Smith St  Mission Hill  MA  02120,9.0,10A,8.0,B2,Mission Hill,14.0,10,1002.0,,60 Smith St,2120.0,Address,342526.0,42.3594,-71.0587,Employee Generated,"(0, 0)"
553386,101001360530,04/21/2015 10:33:16 AM,04/28/2015 10:33:14 AM,05/01/2015 02:39:16 PM,OVERDUE,Closed,Case Closed Case Resolved done 4-30-15,Equipment Repair,Parks & Recreation Department,Park Maintenance & Safety,Equipment Repair,PARK_Maintenance_Trades,PARK,,,25 Pierpont Rd  Jamaica Plain  MA  02130,9.0,02,7.0,B2,Greater Mattapan,13.0,12,1207.0,,25 Pierpont Rd,2130.0,Address,342449.0,42.3594,-71.0587,Employee Generated,"(0, 0)"
553425,101001360585,04/21/2015 10:59:44 AM,04/28/2015 10:59:43 AM,04/27/2015 01:44:00 PM,ONTIME,Closed,Case Closed Case Resolved jim rice field done,Equipment Repair,Parks & Recreation Department,Park Maintenance & Safety,Equipment Repair,PARK_Maintenance_Trades,PARK,,,1917 Washington St  Roxbury  MA  02118,4.0,10B,7.0,D4,Roxbury,13.0,09,903.0,CM,1917 Washington St,2118.0,Address,171084.0,42.3338,-71.0808,Constituent Call,"(42.3338, -71.0808)"
553436,101001360596,04/21/2015 11:05:34 AM,04/28/2015 11:05:33 AM,04/27/2015 01:45:35 PM,ONTIME,Closed,Case Closed Case Resolved covered with clay,Equipment Repair,Parks & Recreation Department,Park Maintenance & Safety,Equipment Repair,PARK_Maintenance_Trades,PARK,,,1917 Washington St  Roxbury  MA  02118,4.0,10B,7.0,D4,Roxbury,13.0,09,903.0,CM,1917 Washington St,2118.0,Address,171084.0,42.3338,-71.0808,Constituent Call,"(42.3338, -71.0808)"
553456,101001360624,04/21/2015 11:29:12 AM,04/28/2015 11:29:10 AM,05/26/2015 03:20:56 PM,OVERDUE,Closed,Case Closed. Closed date : 2015-05-26 15:20:56.117 Case Resolved done,Equipment Repair,Parks & Recreation Department,Park Maintenance & Safety,Equipment Repair,PARK_Maintenance_Trades,PARK,,,40 Downer Ave  Dorchester  MA  02125,7.0,03,3.0,C11,Dorchester,7.0,13,1306.0,,40 Downer Ave,2125.0,Address,342086.0,42.3594,-71.0587,Constituent Call,"(0, 0)"
553459,101001360629,04/21/2015 11:31:57 AM,04/28/2015 11:31:55 AM,04/30/2015 11:44:00 AM,OVERDUE,Closed,Case Closed Case Resolved done 4-28-15,Equipment Repair,Parks & Recreation Department,Park Maintenance & Safety,Equipment Repair,PARK_Maintenance_Trades,PARK,,,40 Downer Ave  Dorchester  MA  02125,7.0,03,3.0,C11,Dorchester,7.0,13,1306.0,,40 Downer Ave,2125.0,Address,342086.0,42.3594,-71.0587,Constituent Call,"(0, 0)"
553483,101001360662,04/21/2015 11:53:14 AM,04/28/2015 11:53:11 AM,04/30/2015 11:45:58 AM,OVERDUE,Closed,Case Closed Case Resolved done 4-27-15,Equipment Repair,Parks & Recreation Department,Park Maintenance & Safety,Equipment Repair,PARK_Maintenance_Trades,PARK,,,139 Tremont St  Boston  MA  02108,3.0,1C,8.0,A1,Beacon Hill,14.0,05,503.0,E,139 Tremont St,2108.0,Address,341542.0,42.3554,-71.0638,Employee Generated,"(42.3554, -71.0638)"
553552,101001360757,04/21/2015 12:59:00 PM,04/28/2015 12:59:19 PM,12/30/2015 04:37:26 PM,OVERDUE,Closed,Case Closed. Closed date : 2015-12-30 16:37:26.22 Case Resolved repairs underway,Equipment Repair,Parks & Recreation Department,Park Maintenance & Safety,Equipment Repair,PARK_Park Improvement Requests,PARK,,,143 Porter St  East Boston  MA  02128,1.0,09,1.0,A7,East Boston,1.0,01,105.0,,143 Porter St,2128.0,Address,344495.0,42.3594,-71.0587,Constituent Call,"(0, 0)"
553563,101001360768,04/21/2015 01:07:18 PM,04/28/2015 01:06:57 PM,05/07/2015 10:12:31 AM,OVERDUE,Closed,Case Closed. Closed date : 2015-05-07 10:12:31.747 Case Resolved Swing was repaired.,Equipment Repair,Parks & Recreation Department,Park Maintenance & Safety,Equipment Repair,PARK_Maintenance_Trades,PARK,,,127-129 Howard Ave  Dorchester  MA  02125,7.0,03,7.0,B2,Roxbury,13.0,13,1301.0,E,127-129 Howard Ave,2125.0,Address,75500.0,42.3159,-71.0757,Employee Generated,"(42.3159, -71.0757)"
553655,101001360881,04/21/2015 02:34:03 PM,04/28/2015 02:34:02 PM,04/22/2015 02:56:38 PM,ONTIME,Closed,Case Closed Case Invalid,Equipment Repair,Parks & Recreation Department,Park Maintenance & Safety,Equipment Repair,PARK_Maintenance_Trades,PARK,,,1005 Columbia Rd  South Boston  MA  02127,6.0,05,2.0,C6,South Boston,5.0,7,707.0,,1005 Columbia Rd,2127.0,Address,163529.0,42.3272,-71.0504,Employee Generated,"(42.3272, -71.0504)"
553891,101001361230,04/22/2015 09:38:01 AM,04/29/2015 09:38:00 AM,04/30/2015 02:08:26 PM,OVERDUE,Closed,Case Closed Case Resolved done 4-27-15,Equipment Repair,Parks & Recreation Department,Park Maintenance & Safety,Equipment Repair,PARK_Maintenance_Trades,PARK,,,155 Seaver St  Jamaica Plain  MA  02130,9.0,02,7.0,B2,Greater Mattapan,13.0,12,1207.0,,155 Seaver St,2130.0,Address,342005.0,42.3594,-71.0587,Constituent Call,"(0, 0)"
553911,101001361254,04/22/2015 09:54:00 AM,04/29/2015 09:54:23 AM,12/30/2015 04:34:58 PM,OVERDUE,Closed,Case Closed. Closed date : 2015-12-30 16:34:58.483 Case Noted internal memo,Equipment Repair,Parks & Recreation Department,Park Maintenance & Safety,Equipment Repair,PARK_Park Improvement Requests,PARK,,,1005 Columbia Rd  South Boston  MA  02127,6.0,05,2.0,C6,South Boston,5.0,7,707.0,,1005 Columbia Rd,2127.0,Address,163529.0,42.3272,-71.0504,Employee Generated,"(42.3272, -71.0504)"
553974,101001361344,04/22/2015 11:41:02 AM,04/29/2015 11:41:00 AM,04/30/2015 04:35:46 PM,OVERDUE,Closed,Case Closed Case Resolved,Equipment Repair,Parks & Recreation Department,Park Maintenance & Safety,Equipment Repair,PARK_Maintenance_Trades,PARK,,,,,,,,,,,,,,,,,42.3594,-71.0587,Employee Generated,"(0, 0)"
553975,101001361345,04/22/2015 11:41:29 AM,04/29/2015 11:41:28 AM,05/05/2015 10:17:33 AM,OVERDUE,Closed,Case Closed. Closed date : 2015-05-05 10:17:33.29 Case Invalid,Equipment Repair,Parks & Recreation Department,Park Maintenance & Safety,Equipment Repair,PARK_Maintenance_Trades,PARK,,,,,,,,,,,,,,,,,42.3594,-71.0587,Employee Generated,"(0, 0)"
554020,101001361402,04/22/2015 12:36:12 PM,04/29/2015 12:36:12 PM,04/30/2015 11:54:50 AM,OVERDUE,Closed,Case Closed Case Resolved done 4-27-15,Equipment Repair,Parks & Recreation Department,Park Maintenance & Safety,Equipment Repair,PARK_Maintenance_Trades,PARK,,,INTERSECTION of W Newton St & Shawmut Ave  Roxbury  MA,4.0,1C,2.0,D4,South End,6.0,Ward 9,901.0,,INTERSECTION W Newton St & Shawmut Ave,,Intersection,7579.0,42.3397,-71.0746,Constituent Call,"(42.3397, -71.0746)"
554073,101001361484,04/22/2015 01:20:00 PM,04/29/2015 01:20:29 PM,,OVERDUE,Open,,Equipment Repair,Parks & Recreation Department,Park Maintenance & Safety,Equipment Repair,INFO01_GenericeFormforOtherServiceRequestTypes,INFO,,,30 Denny St  Dorchester  MA  02125,7.0,03,3.0,C11,Dorchester,7.0,13,1310.0,,30 Denny St,2125.0,Address,342516.0,42.3594,-71.0587,Constituent Call,"(0, 0)"
554200,101001361662,04/22/2015 02:58:12 PM,04/29/2015 02:58:10 PM,05/26/2015 03:19:19 PM,OVERDUE,Closed,Case Closed. Closed date : 2015-05-26 15:19:19.31 Case Resolved,Equipment Repair,Parks & Recreation Department,Park Maintenance & Safety,Equipment Repair,PARK_Maintenance_Trades,PARK,,,210 W Third St  South Boston  MA  02127,6.0,05,2.0,C6,South Boston,5.0,6,603.0,E,210 W Third St,2127.0,Address,341625.0,42.3393,-71.0491,Employee Generated,"(42.3393, -71.0491)"
554255,101001361724,04/22/2015 03:42:12 PM,04/29/2015 03:42:08 PM,05/14/2015 10:28:31 AM,OVERDUE,Closed,Case Closed. Closed date : 2015-05-14 10:28:31.037 Case Resolved DONE,Equipment Repair,Parks & Recreation Department,Park Maintenance & Safety,Equipment Repair,PARK_Maintenance_Trades,PARK,,,20 Park Dr  Boston  MA  02215,4.0,10A,8.0,D4,Boston,14.0,5,502.0,,20 Park Dr,2215.0,Address,343961.0,42.3594,-71.0587,Employee Generated,"(0, 0)"
554274,101001361754,04/22/2015 03:48:27 PM,04/29/2015 03:48:26 PM,04/27/2015 11:35:23 AM,ONTIME,Closed,Case Closed Case Resolved done 4-24-15,Equipment Repair,Parks & Recreation Department,Park Maintenance & Safety,Equipment Repair,PARK_Maintenance_Trades,PARK,,,70 Park Dr  Boston  MA  02215,4.0,10A,8.0,D4,Fenway / Kenmore / Audubon Circle / Longwood,14.0,05,502.0,E,70 Park Dr,2215.0,Address,342000.0,42.3594,-71.0587,Employee Generated,"(0, 0)"
554280,101001361769,04/22/2015 03:53:15 PM,04/29/2015 03:53:13 PM,05/14/2015 10:25:31 AM,OVERDUE,Closed,Case Closed. Closed date : 2015-05-14 10:25:31.073 Case Resolved done,Equipment Repair,Parks & Recreation Department,Park Maintenance & Safety,Equipment Repair,PARK_Maintenance_Trades,PARK,,,70 Park Dr  Boston  MA  02215,4.0,10A,8.0,D4,Fenway / Kenmore / Audubon Circle / Longwood,14.0,05,502.0,E,70 Park Dr,2215.0,Address,342000.0,42.3594,-71.0587,Employee Generated,"(0, 0)"
554354,101001361865,04/22/2015 06:32:19 PM,04/30/2015 08:30:00 AM,05/01/2015 02:40:03 PM,OVERDUE,Closed,Case Closed Case Resolved done 4-30-15,Equipment Repair,Parks & Recreation Department,Park Maintenance & Safety,Equipment Repair,PARK_Maintenance_Trades,PARK,,,345 Walnut Ave  Roxbury  MA  02119,9.0,10B,7.0,E13,Roxbury,13.0,11,1103.0,,345 Walnut Ave,2119.0,Address,342534.0,42.3594,-71.0587,Constituent Call,"(0, 0)"
554545,101001362116,04/23/2015 09:25:03 AM,04/30/2015 09:24:53 AM,04/23/2015 09:37:01 AM,ONTIME,Closed,Case Closed Case Invalid,Equipment Repair,Parks & Recreation Department,Park Maintenance & Safety,Equipment Repair,PARK_Maintenance_Trades,PARK,,,,,,,,,,,,,,,,,42.3594,-71.0587,Constituent Call,"(0, 0)"
554550,101001362122,04/23/2015 09:28:52 AM,04/30/2015 09:28:48 AM,04/23/2015 02:27:54 PM,ONTIME,Closed,Case Closed Case Resolved wire put in pole temp cover over opening,Equipment Repair,Parks & Recreation Department,Park Maintenance & Safety,Equipment Repair,PARK_Maintenance_Trades,PARK,,,,,,,,,,,,,,,,,42.3594,-71.0587,Constituent Call,"(0, 0)"
554555,101001362128,04/23/2015 09:39:27 AM,04/30/2015 09:39:27 AM,10/15/2015 07:55:16 AM,OVERDUE,Closed,Case Closed. Closed date : 2015-10-15 07:55:16.18 Case Resolved The work was completed.,Equipment Repair: --Not in list--,Parks & Recreation Department,Park Maintenance & Safety,Equipment Repair,PARK_Maintenance_Trades,PARK,,,,,,,,,,,,,,,,,42.3594,-71.0587,Self Service,"(0, 0)"
554572,101001362151,04/23/2015 09:53:04 AM,04/30/2015 09:53:01 AM,04/27/2015 07:44:03 AM,ONTIME,Closed,Case Closed Case Resolved remove bench,Equipment Repair,Parks & Recreation Department,Park Maintenance & Safety,Equipment Repair,PARK_Maintenance_Trades,PARK,,,,,,,,,,,,,,,,,42.3594,-71.0587,Constituent Call,"(0, 0)"
554647,101001362234,04/23/2015 10:36:08 AM,04/30/2015 10:36:08 AM,,OVERDUE,Open,,Equipment Repair,Parks & Recreation Department,Park Maintenance & Safety,Equipment Repair,INFO01_GenericeFormforOtherServiceRequestTypes,INFO,,,24 Beacon St  Boston  MA  02133,3.0,1B,8.0,A1,Boston,14.0,05,503.0,E,24 Beacon St,2133.0,Address,10388.0,42.3583,-71.0637,Constituent Call,"(42.3583, -71.0637)"
554648,101001362235,04/23/2015 10:36:10 AM,04/30/2015 10:36:08 AM,01/12/2016 11:58:39 AM,OVERDUE,Closed,Case Closed. Closed date : 2016-01-12 11:58:39.77 Case Resolved fence repaired on 1-8-16,Equipment Repair,Parks & Recreation Department,Park Maintenance & Safety,Equipment Repair,PARK_Maintenance_Trades,PARK,,,58 Wachusett St  Jamaica Plain  MA  02130,12.0,02,6.0,E13,Jamaica Plain,10.0,19,1907.0,,58 Wachusett St,2130.0,Address,342566.0,42.3594,-71.0587,Employee Generated,"(0, 0)"
554731,101001362330,04/23/2015 11:20:00 AM,04/30/2015 11:19:59 AM,05/26/2015 03:18:06 PM,OVERDUE,Closed,Case Closed. Closed date : 2015-05-26 15:18:06.643 Case Resolved done,Equipment Repair,Parks & Recreation Department,Park Maintenance & Safety,Equipment Repair,PARK_Park Improvement Requests,PARK,,,25 Glendon St  East Boston  MA  02128,1.0,09,1.0,A7,East Boston,1.0,1,109.0,E,25 Glendon St,2128.0,Address,341999.0,42.3594,-71.0587,Employee Generated,"(0, 0)"
554747,101001362351,04/23/2015 11:31:01 AM,04/30/2015 11:31:01 AM,05/06/2015 10:46:07 AM,OVERDUE,Closed,Case Closed. Closed date : 2015-05-06 10:46:07.397 Case Noted bath room not parks dept,Equipment Repair,Parks & Recreation Department,Park Maintenance & Safety,Equipment Repair,INFO01_GenericeFormforOtherServiceRequestTypes,INFO,,,517 Commercial St  Boston  MA  02109,3.0,1B,1.0,A1,Boston,3.0,3,302.0,E,517 Commercial St,2109.0,Address,341654.0,42.3682,-71.0543,Constituent Call,"(42.3682, -71.0543)"
554874,101001362525,04/23/2015 01:18:41 PM,04/30/2015 01:18:40 PM,04/27/2015 07:34:02 AM,ONTIME,Closed,Case Closed Case Resolved remove graffiti,Equipment Repair,Parks & Recreation Department,Park Maintenance & Safety,Equipment Repair,PARK_Maintenance_Trades,PARK,,,70 Park Dr  Boston  MA  02215,4.0,10A,8.0,D4,Fenway / Kenmore / Audubon Circle / Longwood,14.0,05,502.0,E,70 Park Dr,2215.0,Address,342000.0,42.3594,-71.0587,Employee Generated,"(0, 0)"
554896,101001362548,04/23/2015 01:31:42 PM,04/30/2015 01:31:41 PM,04/23/2015 01:34:17 PM,ONTIME,Closed,Case Closed Case Resolved,Equipment Repair,Parks & Recreation Department,Park Maintenance & Safety,Equipment Repair,PARK_Maintenance_Trades,PARK,,,,,,,,,,,,,,,,,42.3594,-71.0587,Employee Generated,"(0, 0)"
554913,101001362572,04/23/2015 01:58:29 PM,04/30/2015 01:58:28 PM,04/23/2015 02:01:46 PM,ONTIME,Closed,Case Closed Case Resolved done,Equipment Repair,Parks & Recreation Department,Park Maintenance & Safety,Equipment Repair,PARK_Maintenance_Trades,PARK,,,,,,,,,,,,,,,,,42.3594,-71.0587,Employee Generated,"(0, 0)"
554927,101001362590,04/23/2015 02:13:40 PM,04/30/2015 02:13:38 PM,04/23/2015 02:17:17 PM,ONTIME,Closed,Case Closed Case Resolved done,Equipment Repair,Parks & Recreation Department,Park Maintenance & Safety,Equipment Repair,PARK_Maintenance_Trades,PARK,,,,,,,,,,,,,,,,,42.3594,-71.0587,Employee Generated,"(0, 0)"
554933,101001362599,04/23/2015 02:31:37 PM,04/30/2015 02:31:29 PM,04/23/2015 02:41:09 PM,ONTIME,Closed,Case Closed Case Resolved,Equipment Repair,Parks & Recreation Department,Park Maintenance & Safety,Equipment Repair,PARK_Maintenance_Trades,PARK,,,,,,,,,,,,,,,,,42.3594,-71.0587,Employee Generated,"(0, 0)"
554976,101001362656,04/23/2015 03:35:35 PM,04/30/2015 03:35:33 PM,05/13/2015 11:29:46 AM,OVERDUE,Closed,Case Closed. Closed date : 2015-05-13 11:29:46.247 Case Resolved done 5-8-14,Equipment Repair,Parks & Recreation Department,Park Maintenance & Safety,Equipment Repair,PARK_Maintenance_Trades,PARK,,,1005 Columbia Rd  South Boston  MA  02127,6.0,05,2.0,C6,South Boston,5.0,7,707.0,,1005 Columbia Rd,2127.0,Address,163529.0,42.3272,-71.0504,Employee Generated,"(42.3272, -71.0504)"
555003,101001362694,04/23/2015 04:27:29 PM,04/30/2015 04:27:27 PM,04/30/2015 01:56:34 PM,ONTIME,Closed,Case Closed Case Resolved done,Equipment Repair,Parks & Recreation Department,Park Maintenance & Safety,Equipment Repair,PARK_Maintenance_Trades,PARK,,,,,,,,,,,,,,,,,42.3594,-71.0587,Constituent Call,"(0, 0)"
555204,101001363032,04/24/2015 09:51:21 AM,05/01/2015 09:51:19 AM,04/30/2015 12:08:28 PM,ONTIME,Closed,Case Closed Case Resolved done,Equipment Repair,Parks & Recreation Department,Park Maintenance & Safety,Equipment Repair,PARK_Maintenance_Trades,PARK,,,,,,,,,,,,,,,,,42.3594,-71.0587,Employee Generated,"(0, 0)"
555207,101001363036,04/24/2015 09:56:44 AM,05/01/2015 09:56:41 AM,04/30/2015 01:49:52 PM,ONTIME,Closed,Case Closed Case Resolved,Equipment Repair,Parks & Recreation Department,Park Maintenance & Safety,Equipment Repair,PARK_Maintenance_Trades,PARK,,,,,,,,,,,,,,,,,42.3594,-71.0587,Employee Generated,"(0, 0)"
555290,101001363136,04/24/2015 11:37:33 AM,05/01/2015 11:37:32 AM,04/27/2015 10:50:07 AM,ONTIME,Closed,Case Closed Case Resolved done 4-25-15,Equipment Repair,Parks & Recreation Department,Park Maintenance & Safety,Equipment Repair,PARK_Maintenance_Trades,PARK,,,192 Webster St  East Boston  MA  02128,1.0,09,1.0,A7,East Boston,1.0,1,101.0,,192 Webster St,2128.0,Address,342012.0,42.3594,-71.0587,Employee Generated,"(0, 0)"
555322,101001363188,04/24/2015 12:21:41 PM,05/01/2015 12:21:40 PM,04/27/2015 01:35:27 PM,ONTIME,Closed,Case Closed Case Resolved paint over graffiti,Equipment Repair,Parks & Recreation Department,Park Maintenance & Safety,Equipment Repair,PARK_Maintenance_Trades,PARK,,,440 Park Dr  Boston  MA  02215,4.0,10A,8.0,D4,Fenway / Kenmore / Audubon Circle / Longwood,14.0,04,410.0,,440 Park Dr,2215.0,Address,342051.0,42.3449,-71.1045,Employee Generated,"(42.3449, -71.1045)"
555328,101001363195,04/24/2015 12:25:40 PM,05/01/2015 12:25:36 PM,05/06/2015 07:46:24 AM,OVERDUE,Closed,Case Closed. Closed date : 2015-05-06 07:46:24.383 Case Resolved remove graffiti,Equipment Repair,Parks & Recreation Department,Park Maintenance & Safety,Equipment Repair,PARK_Maintenance_Trades,PARK,,,,,,,,,,,,,,,,,42.3594,-71.0587,Employee Generated,"(0, 0)"
555348,101001363220,04/24/2015 12:56:31 PM,05/01/2015 12:55:56 PM,05/14/2015 11:27:44 AM,OVERDUE,Closed,Case Closed. Closed date : 2015-05-14 11:27:44.88 Case Resolved DONE,Equipment Repair,Parks & Recreation Department,Park Maintenance & Safety,Equipment Repair,PARK_Maintenance_Trades,PARK,,,550 Norfolk St  Mattapan  MA  02126,8.0,07,4.0,B3,Greater Mattapan,9.0,18,1802.0,,550 Norfolk St,2126.0,Address,342029.0,42.3594,-71.0587,Employee Generated,"(0, 0)"
555398,101001363285,04/24/2015 02:04:17 PM,05/01/2015 02:04:16 PM,05/01/2015 02:38:40 PM,OVERDUE,Closed,Case Closed Case Resolved done 4-30-15,Equipment Repair,Parks & Recreation Department,Park Maintenance & Safety,Equipment Repair,PARK_Maintenance_Trades,PARK,,,517 Commercial St  Boston  MA  02109,3.0,1B,1.0,A1,Boston,3.0,3,302.0,E,517 Commercial St,2109.0,Address,341654.0,42.3682,-71.0543,Employee Generated,"(42.3682, -71.0543)"
555401,101001363290,04/24/2015 02:14:54 PM,05/01/2015 02:14:52 PM,04/24/2015 02:17:04 PM,ONTIME,Closed,Case Closed Case Resolved,Equipment Repair,Parks & Recreation Department,Park Maintenance & Safety,Equipment Repair,PARK_Maintenance_Trades,PARK,,,517 Commercial St  Boston  MA  02109,3.0,1B,1.0,A1,Boston,3.0,3,302.0,E,517 Commercial St,2109.0,Address,341654.0,42.3682,-71.0543,Employee Generated,"(42.3682, -71.0543)"
555405,101001363295,04/24/2015 02:21:18 PM,05/01/2015 02:21:16 PM,04/24/2015 02:23:27 PM,ONTIME,Closed,Case Closed Case Resolved done 4-15-15,Equipment Repair,Parks & Recreation Department,Park Maintenance & Safety,Equipment Repair,PARK_Maintenance_Trades,PARK,,,517 Commercial St  Boston  MA  02109,3.0,1B,1.0,A1,Boston,3.0,3,302.0,E,517 Commercial St,2109.0,Address,341654.0,42.3682,-71.0543,Employee Generated,"(42.3682, -71.0543)"
555408,101001363298,04/24/2015 02:23:55 PM,05/01/2015 02:23:53 PM,04/24/2015 02:26:42 PM,ONTIME,Closed,Case Closed Case Resolved done,Equipment Repair,Parks & Recreation Department,Park Maintenance & Safety,Equipment Repair,PARK_Maintenance_Trades,PARK,,,517 Commercial St  Boston  MA  02109,3.0,1B,1.0,A1,Boston,3.0,3,302.0,E,517 Commercial St,2109.0,Address,341654.0,42.3682,-71.0543,Employee Generated,"(42.3682, -71.0543)"
555416,101001363307,04/24/2015 02:30:37 PM,05/01/2015 02:30:36 PM,04/24/2015 02:32:44 PM,ONTIME,Closed,Case Closed Case Resolved,Equipment Repair,Parks & Recreation Department,Park Maintenance & Safety,Equipment Repair,PARK_Maintenance_Trades,PARK,,,517 Commercial St  Boston  MA  02109,3.0,1B,1.0,A1,Boston,3.0,3,302.0,E,517 Commercial St,2109.0,Address,341654.0,42.3682,-71.0543,Employee Generated,"(42.3682, -71.0543)"
555421,101001363313,04/24/2015 02:33:24 PM,05/01/2015 02:33:22 PM,04/24/2015 02:37:33 PM,ONTIME,Closed,Case Closed Case Resolved,Equipment Repair,Parks & Recreation Department,Park Maintenance & Safety,Equipment Repair,PARK_Maintenance_Trades,PARK,,,517 Commercial St  Boston  MA  02109,3.0,1B,1.0,A1,Boston,3.0,3,302.0,E,517 Commercial St,2109.0,Address,341654.0,42.3682,-71.0543,Employee Generated,"(42.3682, -71.0543)"
555581,101001363505,04/24/2015 04:12:38 PM,05/01/2015 04:12:38 PM,05/07/2015 06:24:50 AM,OVERDUE,Closed,Case Closed. Closed date : 2015-05-07 06:24:50.207 Case Resolved repair rope on pole,Equipment Repair,Parks & Recreation Department,Park Maintenance & Safety,Equipment Repair,PARK_Maintenance_Trades,PARK,,,30 Rogers Park Ave  Brighton  MA  02135,11.0,04,9.0,D14,Brighton,15.0,22,2210.0,,30 Rogers Park Ave,2135.0,Address,342618.0,42.3594,-71.0587,Constituent Call,"(0, 0)"
555712,101001363705,04/25/2015 02:14:34 PM,05/04/2015 08:30:00 AM,06/19/2015 06:35:02 AM,OVERDUE,Closed,Case Closed. Closed date : 2015-06-19 06:35:02.433 Case Resolved fix pin on fence,Equipment Repair,Parks & Recreation Department,Park Maintenance & Safety,Equipment Repair,PARK_Maintenance_Trades,PARK,,,4 Lamson St  East Boston  MA  02128,1.0,09,1.0,A7,East Boston,1.0,Ward 1,101.0,R3,4 Lamson St,2128.0,Address,262617.0,42.3654,-71.0332,Constituent Call,"(42.3654, -71.0332)"
555906,101001364091,04/26/2015 04:40:43 PM,05/04/2015 08:30:00 AM,04/30/2015 02:43:23 PM,ONTIME,Closed,Case Closed Case Noted the pillar at winthrop square will be reset by a contractor 4-30-15,Equipment Repair,Parks & Recreation Department,Park Maintenance & Safety,Equipment Repair,PARK_Maintenance_Trades,PARK,,,20 Devens St  Charlestown  MA  02129,3.0,1A,1.0,A15,Charlestown,2.0,Ward 2,201.0,EA,20 Devens St,2129.0,Address,47498.0,42.3733,-71.0638,Constituent Call,"(42.3733, -71.0638)"
556093,101001364350,04/27/2015 09:47:26 AM,05/04/2015 09:47:26 AM,05/13/2015 11:30:29 AM,OVERDUE,Closed,Case Closed. Closed date : 2015-05-13 11:30:29.487 Case Resolved done 5-6-15,Equipment Repair: Walnut Park,Parks & Recreation Department,Park Maintenance & Safety,Equipment Repair,PARK_Maintenance_Trades,PARK,,,,,,,,,,,,,,,,,42.3594,-71.0587,Self Service,"(0, 0)"
556127,101001364394,04/27/2015 10:10:26 AM,05/04/2015 10:10:26 AM,08/11/2015 11:45:20 AM,OVERDUE,Closed,Case Closed. Closed date : 2015-08-11 11:45:20.473 Case Noted plumbers report fountain is not broken water is on,Equipment Repair: Walnut Park,Parks & Recreation Department,Park Maintenance & Safety,Equipment Repair,PARK_Maintenance_Trades,PARK,,,,,,,,,,,,,,,,,42.3594,-71.0587,Self Service,"(0, 0)"
556133,101001364401,04/27/2015 10:16:13 AM,05/04/2015 10:16:12 AM,04/30/2015 11:42:26 AM,ONTIME,Closed,Case Closed Case Resolved done 4-28-15,Equipment Repair,Parks & Recreation Department,Park Maintenance & Safety,Equipment Repair,PARK_Maintenance_Trades,PARK,,,540 Adams St  Dorchester  MA  02122,8.0,07,3.0,C11,Dorchester,7.0,16,1607.0,,540 Adams St,2122.0,Address,342475.0,42.3594,-71.0587,Employee Generated,"(0, 0)"
556151,101001364428,04/27/2015 10:31:26 AM,05/04/2015 10:31:24 AM,04/30/2015 02:35:14 PM,ONTIME,Closed,Case Closed Case Resolved done 4-29-14,Equipment Repair,Parks & Recreation Department,Park Maintenance & Safety,Equipment Repair,PARK_Maintenance_Trades,PARK,,,1 Jewish War Veterans Dr  Jamaica Plain  MA  02130,9.0,02,7.0,B2,Greater Mattapan,13.0,12,1207.0,E,1 Jewish War Veterans Dr,2130.0,Address,163434.0,42.301,-71.0886,Employee Generated,"(42.301, -71.0886)"
556163,101001364439,04/27/2015 10:37:25 AM,05/04/2015 10:37:23 AM,04/30/2015 02:32:52 PM,ONTIME,Closed,Case Closed Case Resolved done,Equipment Repair,Parks & Recreation Department,Park Maintenance & Safety,Equipment Repair,PARK_Maintenance_Trades,PARK,,,155 Seaver St  Jamaica Plain  MA  02130,9.0,02,7.0,B2,Greater Mattapan,13.0,12,1207.0,,155 Seaver St,2130.0,Address,342005.0,42.3594,-71.0587,Employee Generated,"(0, 0)"
556169,101001364450,04/27/2015 10:40:56 AM,05/04/2015 10:40:55 AM,04/30/2015 02:33:37 PM,ONTIME,Closed,Case Closed Case Resolved done,Equipment Repair,Parks & Recreation Department,Park Maintenance & Safety,Equipment Repair,PARK_Maintenance_Trades,PARK,,,155 Seaver St  Jamaica Plain  MA  02130,9.0,02,7.0,B2,Greater Mattapan,13.0,12,1207.0,,155 Seaver St,2130.0,Address,342005.0,42.3594,-71.0587,Employee Generated,"(0, 0)"
556204,101001364503,04/27/2015 11:22:42 AM,05/04/2015 11:22:42 AM,05/27/2015 11:35:35 AM,OVERDUE,Closed,Case Closed. Closed date : 2015-05-27 11:35:35.123 Case Resolved Irrigation was repaired.,Equipment Repair,Parks & Recreation Department,Park Maintenance & Safety,Equipment Repair,PARK_Maintenance_Trades,PARK,,,,,,,,,,,,,,,,,42.3594,-71.0587,Employee Generated,"(0, 0)"
556385,101001364711,04/27/2015 01:31:22 PM,05/04/2015 01:31:21 PM,,OVERDUE,Open,,Equipment Repair,Parks & Recreation Department,Park Maintenance & Safety,Equipment Repair,PARK_Maintenance_Trades,PARK,,,39 Terminal St  Charlestown  MA  02129,3.0,1A,1.0,A15,Charlestown,2.0,2,202.0,,39 Terminal St,2129.0,Address,344482.0,42.3816,-71.0599,Employee Generated,"(42.3816, -71.0599)"
556519,101001364881,04/27/2015 03:51:03 PM,05/04/2015 03:51:02 PM,04/27/2015 03:52:13 PM,ONTIME,Closed,Case Closed Case Resolved,Equipment Repair,Parks & Recreation Department,Park Maintenance & Safety,Equipment Repair,PARK_Maintenance_Trades,PARK,,,,,,,,,,,,,,,,,42.3594,-71.0587,Employee Generated,"(0, 0)"
556522,101001364884,04/27/2015 03:52:48 PM,05/04/2015 03:52:46 PM,04/27/2015 03:56:00 PM,ONTIME,Closed,Case Closed Case Resolved,Equipment Repair,Parks & Recreation Department,Park Maintenance & Safety,Equipment Repair,PARK_Maintenance_Trades,PARK,,,,,,,,,,,,,,,,,42.3594,-71.0587,Employee Generated,"(0, 0)"
556760,101001365230,04/28/2015 09:14:54 AM,05/05/2015 09:14:53 AM,05/01/2015 02:45:13 PM,ONTIME,Closed,Case Closed Case Resolved done 4-30-15,Equipment Repair,Parks & Recreation Department,Park Maintenance & Safety,Equipment Repair,PARK_Maintenance_Trades,PARK,,,80 Humboldt Ave  Dorchester  MA  02121,9.0,10B,7.0,B2,Dorchester,13.0,12,1202.0,,80 Humboldt Ave,2121.0,Address,342506.0,42.3594,-71.0587,Employee Generated,"(0, 0)"
556766,101001365239,04/28/2015 09:24:40 AM,05/05/2015 09:24:38 AM,04/30/2015 02:45:43 PM,ONTIME,Closed,Case Closed Case Resolved,Equipment Repair,Parks & Recreation Department,Park Maintenance & Safety,Equipment Repair,PARK_Maintenance_Trades,PARK,,,75 Alford St  Charlestown  MA  02129,3.0,1A,1.0,A15,Charlestown,2.0,02,,,75 Alford St,2129.0,Address,342631.0,42.3594,-71.0587,Employee Generated,"(0, 0)"
556780,101001365256,04/28/2015 09:39:47 AM,05/05/2015 09:39:45 AM,04/30/2015 11:46:47 AM,ONTIME,Closed,Case Closed Case Resolved done 4-28-15,Equipment Repair,Parks & Recreation Department,Park Maintenance & Safety,Equipment Repair,PARK_Maintenance_Trades,PARK,,,75 Alford St  Charlestown  MA  02129,3.0,1A,1.0,A15,Charlestown,2.0,02,,,75 Alford St,2129.0,Address,342631.0,42.3594,-71.0587,Employee Generated,"(0, 0)"
556829,101001365315,04/28/2015 10:17:37 AM,05/05/2015 10:17:36 AM,04/30/2015 02:35:52 PM,ONTIME,Closed,Case Closed Case Resolved done 4-29-15,Equipment Repair,Parks & Recreation Department,Park Maintenance & Safety,Equipment Repair,PARK_Maintenance_Trades,PARK,,,55 Malcolm X Blvd  Mission Hill  MA  02120,9.0,10B,7.0,B2,Mission Hill,13.0,09,905.0,E,55 Malcolm X Blvd,2120.0,Address,88754.0,42.3316,-71.0895,Employee Generated,"(42.3316, -71.0895)"
556847,101001365336,04/28/2015 10:33:25 AM,05/05/2015 10:33:16 AM,05/14/2015 11:17:37 AM,OVERDUE,Closed,Case Closed. Closed date : 2015-05-14 11:17:37.35 Case Resolved,Equipment Repair,Parks & Recreation Department,Park Maintenance & Safety,Equipment Repair,PARK_Maintenance_Trades,PARK,,,,,,,,,,,,,,,,,42.3594,-71.0587,Constituent Call,"(0, 0)"
556849,101001365339,04/28/2015 10:35:16 AM,05/05/2015 10:35:15 AM,05/13/2015 06:09:01 AM,OVERDUE,Closed,Case Closed. Closed date : 2015-05-13 06:09:01.233 Case Resolved paint benchs,Equipment Repair,Parks & Recreation Department,Park Maintenance & Safety,Equipment Repair,PARK_Maintenance_Trades,PARK,,,,,,,,,,,,,,,,,42.3594,-71.0587,Constituent Call,"(0, 0)"
556901,101001365402,04/28/2015 11:16:40 AM,05/05/2015 11:16:39 AM,05/05/2015 10:17:04 AM,ONTIME,Closed,Case Closed. Closed date : 2015-05-05 10:17:04.82 Case Invalid,Equipment Repair,Parks & Recreation Department,Park Maintenance & Safety,Equipment Repair,PARK_Maintenance_Trades,PARK,,,56 Dunbar Ave  Dorchester  MA  02124,8.0,07,4.0,B3,Dorchester,9.0,17,1708.0,,56 Dunbar Ave,2124.0,Address,342601.0,42.3594,-71.0587,Employee Generated,"(0, 0)"
556903,101001365404,04/28/2015 11:17:21 AM,05/05/2015 11:17:20 AM,05/01/2015 03:12:16 PM,ONTIME,Closed,Case Closed Case Resolved done 4-30-15,Equipment Repair,Parks & Recreation Department,Park Maintenance & Safety,Equipment Repair,PARK_Maintenance_Trades,PARK,,,56 Dunbar Ave  Dorchester  MA  02124,8.0,07,4.0,B3,Dorchester,9.0,17,1708.0,,56 Dunbar Ave,2124.0,Address,342601.0,42.3594,-71.0587,Employee Generated,"(0, 0)"
556909,101001365410,04/28/2015 11:22:12 AM,05/05/2015 11:22:10 AM,04/30/2015 02:37:14 PM,ONTIME,Closed,Case Closed Case Resolved done,Equipment Repair,Parks & Recreation Department,Park Maintenance & Safety,Equipment Repair,PARK_Maintenance_Trades,PARK,,,70 Park Dr  Boston  MA  02215,4.0,10A,8.0,D4,Fenway / Kenmore / Audubon Circle / Longwood,14.0,05,502.0,E,70 Park Dr,2215.0,Address,342000.0,42.3594,-71.0587,Employee Generated,"(0, 0)"
556915,101001365417,04/28/2015 11:33:04 AM,05/05/2015 11:33:03 AM,04/30/2015 02:25:53 PM,ONTIME,Closed,Case Closed Case Resolved DONE,Equipment Repair,Parks & Recreation Department,Park Maintenance & Safety,Equipment Repair,PARK_Maintenance_Trades,PARK,,,70 Park Dr  Boston  MA  02215,4.0,10A,8.0,D4,Fenway / Kenmore / Audubon Circle / Longwood,14.0,05,502.0,E,70 Park Dr,2215.0,Address,342000.0,42.3594,-71.0587,Employee Generated,"(0, 0)"
557049,101001365597,04/28/2015 01:57:05 PM,05/05/2015 01:57:04 PM,04/30/2015 02:36:29 PM,ONTIME,Closed,Case Closed Case Resolved done,Equipment Repair,Parks & Recreation Department,Park Maintenance & Safety,Equipment Repair,PARK_Maintenance_Trades,PARK,,,6 Holborn St  Dorchester  MA  02121,9.0,10B,7.0,B2,Dorchester,13.0,12,1206.0,E,6 Holborn St,2121.0,Address,341994.0,42.3594,-71.0587,Employee Generated,"(0, 0)"
557053,101001365604,04/28/2015 02:00:59 PM,05/05/2015 02:00:55 PM,,OVERDUE,Open,,Equipment Repair,Parks & Recreation Department,Park Maintenance & Safety,Equipment Repair,PARK_Maintenance_Trades,PARK,,,5 Monsignor Reynolds Way  Roxbury  MA  02118,4.0,1C,2.0,D4,Roxbury,6.0,8,801.0,,5 Monsignor Reynolds Way,2118.0,Address,342528.0,42.3594,-71.0587,Employee Generated,"(0, 0)"
557055,101001365607,04/28/2015 02:04:48 PM,05/05/2015 02:04:46 PM,04/30/2015 02:34:20 PM,ONTIME,Closed,Case Closed Case Resolved done,Equipment Repair,Parks & Recreation Department,Park Maintenance & Safety,Equipment Repair,PARK_Maintenance_Trades,PARK,,,230 Shawmut Ave  Roxbury  MA  02118,4.0,1C,2.0,D4,Roxbury,4.0,3,307.0,,230 Shawmut Ave,2118.0,Address,342571.0,42.3594,-71.0587,Employee Generated,"(0, 0)"
557059,101001365614,04/28/2015 02:10:06 PM,05/05/2015 02:10:04 PM,06/19/2015 06:37:31 AM,OVERDUE,Closed,Case Closed. Closed date : 2015-06-19 06:37:31.53 Case Resolved install alu benchers,Equipment Repair,Parks & Recreation Department,Park Maintenance & Safety,Equipment Repair,PARK_Maintenance_Trades,PARK,,,230 Shawmut Ave  Roxbury  MA  02118,4.0,1C,2.0,D4,Roxbury,4.0,3,307.0,,230 Shawmut Ave,2118.0,Address,342571.0,42.3594,-71.0587,Employee Generated,"(0, 0)"
557157,101001365734,04/28/2015 03:12:05 PM,05/05/2015 03:12:04 PM,04/28/2015 03:14:08 PM,ONTIME,Closed,Case Closed Case Resolved done 4-21-15,Equipment Repair,Parks & Recreation Department,Park Maintenance & Safety,Equipment Repair,PARK_Maintenance_Trades,PARK,,,230 Shawmut Ave  Roxbury  MA  02118,4.0,1C,2.0,D4,Roxbury,4.0,3,307.0,,230 Shawmut Ave,2118.0,Address,342571.0,42.3594,-71.0587,Employee Generated,"(0, 0)"
557165,101001365742,04/28/2015 03:14:45 PM,05/05/2015 03:14:41 PM,04/28/2015 03:16:21 PM,ONTIME,Closed,Case Closed Case Resolved,Equipment Repair,Parks & Recreation Department,Park Maintenance & Safety,Equipment Repair,PARK_Maintenance_Trades,PARK,,,230 Shawmut Ave  Roxbury  MA  02118,4.0,1C,2.0,D4,Roxbury,4.0,3,307.0,,230 Shawmut Ave,2118.0,Address,342571.0,42.3594,-71.0587,Employee Generated,"(0, 0)"
557171,101001365751,04/28/2015 03:19:28 PM,05/05/2015 03:19:26 PM,04/28/2015 03:20:46 PM,ONTIME,Closed,Case Closed Case Resolved done,Equipment Repair,Parks & Recreation Department,Park Maintenance & Safety,Equipment Repair,PARK_Maintenance_Trades,PARK,,,230 Shawmut Ave  Roxbury  MA  02118,4.0,1C,2.0,D4,Roxbury,4.0,3,307.0,,230 Shawmut Ave,2118.0,Address,342571.0,42.3594,-71.0587,Employee Generated,"(0, 0)"
557179,101001365761,04/28/2015 03:23:27 PM,05/05/2015 03:23:25 PM,05/29/2015 06:49:19 AM,OVERDUE,Closed,Case Closed. Closed date : 2015-05-29 06:49:19.707 Case Resolved water on,Equipment Repair,Parks & Recreation Department,Park Maintenance & Safety,Equipment Repair,PARK_Maintenance_Trades,PARK,,,230 Shawmut Ave  Roxbury  MA  02118,4.0,1C,2.0,D4,Roxbury,4.0,3,307.0,,230 Shawmut Ave,2118.0,Address,342571.0,42.3594,-71.0587,Employee Generated,"(0, 0)"
557186,101001365768,04/28/2015 03:26:50 PM,05/05/2015 03:26:43 PM,04/28/2015 03:28:51 PM,ONTIME,Closed,Case Closed Case Resolved done 4-27-15,Equipment Repair,Parks & Recreation Department,Park Maintenance & Safety,Equipment Repair,PARK_Maintenance_Trades,PARK,,,230 Shawmut Ave  Roxbury  MA  02118,4.0,1C,2.0,D4,Roxbury,4.0,3,307.0,,230 Shawmut Ave,2118.0,Address,342571.0,42.3594,-71.0587,Employee Generated,"(0, 0)"
557189,101001365771,04/28/2015 03:29:19 PM,05/05/2015 03:29:18 PM,04/28/2015 03:32:30 PM,ONTIME,Closed,Case Closed Case Resolved done,Equipment Repair,Parks & Recreation Department,Park Maintenance & Safety,Equipment Repair,PARK_Maintenance_Trades,PARK,,,230 Shawmut Ave  Roxbury  MA  02118,4.0,1C,2.0,D4,Roxbury,4.0,3,307.0,,230 Shawmut Ave,2118.0,Address,342571.0,42.3594,-71.0587,Employee Generated,"(0, 0)"
557191,101001365773,04/28/2015 03:32:49 PM,05/05/2015 03:32:47 PM,04/28/2015 03:34:20 PM,ONTIME,Closed,Case Closed Case Resolved done,Equipment Repair,Parks & Recreation Department,Park Maintenance & Safety,Equipment Repair,PARK_Maintenance_Trades,PARK,,,230 Shawmut Ave  Roxbury  MA  02118,4.0,1C,2.0,D4,Roxbury,4.0,3,307.0,,230 Shawmut Ave,2118.0,Address,342571.0,42.3594,-71.0587,Employee Generated,"(0, 0)"
557199,101001365784,04/28/2015 03:35:56 PM,05/05/2015 03:35:55 PM,04/28/2015 03:38:51 PM,ONTIME,Closed,Case Closed Case Resolved done,Equipment Repair,Parks & Recreation Department,Park Maintenance & Safety,Equipment Repair,PARK_Maintenance_Trades,PARK,,,230 Shawmut Ave  Roxbury  MA  02118,4.0,1C,2.0,D4,Roxbury,4.0,3,307.0,,230 Shawmut Ave,2118.0,Address,342571.0,42.3594,-71.0587,Employee Generated,"(0, 0)"
557220,101001365818,04/28/2015 04:15:49 PM,05/05/2015 04:15:49 PM,05/08/2015 12:15:49 PM,OVERDUE,Closed,Case Closed. Closed date : 2015-05-08 12:15:49.717 Case Resolved,Equipment Repair,Parks & Recreation Department,Park Maintenance & Safety,Equipment Repair,PARK_Maintenance_Trades,PARK,,,300 Condor St  East Boston  MA  02128,1.0,09,1.0,A7,East Boston,1.0,01,109.0,E,300 Condor St,2128.0,Address,42041.0,42.383,-71.0295,Constituent Call,"(42.383, -71.0295)"
557224,101001365824,04/28/2015 04:26:59 PM,05/05/2015 04:26:57 PM,04/28/2015 04:29:03 PM,ONTIME,Closed,Case Closed Case Resolved done,Equipment Repair,Parks & Recreation Department,Park Maintenance & Safety,Equipment Repair,PARK_Maintenance_Trades,PARK,,,230 Shawmut Ave  Roxbury  MA  02118,4.0,1C,2.0,D4,Roxbury,4.0,3,307.0,,230 Shawmut Ave,2118.0,Address,342571.0,42.3594,-71.0587,Employee Generated,"(0, 0)"
557226,101001365826,04/28/2015 04:29:26 PM,05/05/2015 04:29:25 PM,04/28/2015 04:31:03 PM,ONTIME,Closed,Case Closed Case Resolved,Equipment Repair,Parks & Recreation Department,Park Maintenance & Safety,Equipment Repair,PARK_Maintenance_Trades,PARK,,,230 Shawmut Ave  Roxbury  MA  02118,4.0,1C,2.0,D4,Roxbury,4.0,3,307.0,,230 Shawmut Ave,2118.0,Address,342571.0,42.3594,-71.0587,Employee Generated,"(0, 0)"
557229,101001365830,04/28/2015 04:34:31 PM,05/05/2015 04:34:20 PM,04/28/2015 04:36:06 PM,ONTIME,Closed,Case Closed Case Resolved done 4-13-15,Equipment Repair,Parks & Recreation Department,Park Maintenance & Safety,Equipment Repair,PARK_Maintenance_Trades,PARK,,,230 Shawmut Ave  Roxbury  MA  02118,4.0,1C,2.0,D4,Roxbury,4.0,3,307.0,,230 Shawmut Ave,2118.0,Address,342571.0,42.3594,-71.0587,Employee Generated,"(0, 0)"
557231,101001365832,04/28/2015 04:39:04 PM,05/05/2015 04:39:03 PM,04/28/2015 04:40:55 PM,ONTIME,Closed,Case Closed Case Resolved done,Equipment Repair,Parks & Recreation Department,Park Maintenance & Safety,Equipment Repair,PARK_Maintenance_Trades,PARK,,,230 Shawmut Ave  Roxbury  MA  02118,4.0,1C,2.0,D4,Roxbury,4.0,3,307.0,,230 Shawmut Ave,2118.0,Address,342571.0,42.3594,-71.0587,Employee Generated,"(0, 0)"
557235,101001365838,04/28/2015 04:43:43 PM,05/05/2015 04:43:41 PM,04/28/2015 04:45:10 PM,ONTIME,Closed,Case Closed Case Resolved done,Equipment Repair,Parks & Recreation Department,Park Maintenance & Safety,Equipment Repair,PARK_Maintenance_Trades,PARK,,,230 Shawmut Ave  Roxbury  MA  02118,4.0,1C,2.0,D4,Roxbury,4.0,3,307.0,,230 Shawmut Ave,2118.0,Address,342571.0,42.3594,-71.0587,Employee Generated,"(0, 0)"
557473,101001366157,04/29/2015 08:46:13 AM,05/06/2015 08:46:11 AM,05/01/2015 02:51:53 PM,ONTIME,Closed,Case Closed Case Resolved done,Equipment Repair,Parks & Recreation Department,Park Maintenance & Safety,Equipment Repair,PARK_Maintenance_Trades,PARK,,,25 Stonehill Rd  Hyde Park  MA  02136,12.0,08,5.0,E18,Hyde Park,10.0,18,1819.0,,25 Stonehill Rd,2136.0,Address,342657.0,42.3594,-71.0587,Employee Generated,"(0, 0)"
557561,101001366267,04/29/2015 09:47:01 AM,05/06/2015 09:47:01 AM,05/01/2015 12:25:50 PM,ONTIME,Closed,Case Closed Case Resolved fix benchs,Equipment Repair: Evans Way Park,Parks & Recreation Department,Park Maintenance & Safety,Equipment Repair,PARK_Maintenance_Trades,PARK,,,,,,,,,,,,,,,,,42.3594,-71.0587,Self Service,"(0, 0)"
557562,101001366268,04/29/2015 09:47:26 AM,05/06/2015 09:47:24 AM,05/13/2015 06:49:50 AM,OVERDUE,Closed,Case Closed. Closed date : 2015-05-13 06:49:50.33 Case Resolved paint benchs,Equipment Repair,Parks & Recreation Department,Park Maintenance & Safety,Equipment Repair,PARK_Maintenance_Trades,PARK,,,260 Clarendon St  Boston  MA  02116,4.0,1C,8.0,D4,Boston,14.0,05,507.0,,260 Clarendon St,2116.0,Address,342026.0,42.3594,-71.0587,Constituent Call,"(0, 0)"
557580,101001366295,04/29/2015 10:04:18 AM,05/06/2015 10:04:15 AM,04/30/2015 01:59:23 PM,ONTIME,Closed,Case Closed Case Resolved done,Equipment Repair,Parks & Recreation Department,Park Maintenance & Safety,Equipment Repair,PARK_Maintenance_Trades,PARK,,,,,,,,,,,,,,,,,42.3594,-71.0587,Constituent Call,"(0, 0)"
557630,101001366374,04/29/2015 10:48:21 AM,05/06/2015 10:48:20 AM,05/06/2015 06:16:17 AM,ONTIME,Closed,Case Closed. Closed date : 2015-05-06 06:16:17.44 Case Resolved repair fence,Equipment Repair,Parks & Recreation Department,Park Maintenance & Safety,Equipment Repair,PARK_Maintenance_Trades,PARK,,,34 Union St  Charlestown  MA  02129,3.0,1A,1.0,A15,Charlestown,2.0,2,201.0,,34 Union St,2129.0,Address,344014.0,42.3594,-71.0587,Employee Generated,"(0, 0)"
557674,101001366437,04/29/2015 11:27:55 AM,05/06/2015 11:27:52 AM,,OVERDUE,Open,,Equipment Repair,Parks & Recreation Department,Park Maintenance & Safety,Equipment Repair,PARK_Park Improvement Requests,PARK,,,139 Tremont St  Boston  MA  02108,3.0,1C,8.0,A1,Beacon Hill,14.0,05,503.0,E,139 Tremont St,2108.0,Address,341542.0,42.3554,-71.0638,Constituent Call,"(42.3554, -71.0638)"
557850,101001366725,04/29/2015 03:47:44 PM,05/06/2015 03:47:41 PM,05/13/2015 06:15:44 AM,OVERDUE,Closed,Case Closed. Closed date : 2015-05-13 06:15:44.503 Case Resolved repair swing,Equipment Repair,Parks & Recreation Department,Park Maintenance & Safety,Equipment Repair,PARK_Maintenance_Trades,PARK,,,,,,,,,,,,,,,,,42.3594,-71.0587,Employee Generated,"(0, 0)"
557889,101001366775,04/29/2015 04:28:45 PM,05/06/2015 04:28:43 PM,05/13/2015 06:17:41 AM,OVERDUE,Closed,Case Closed. Closed date : 2015-05-13 06:17:41.147 Case Resolved water table fixed,Equipment Repair,Parks & Recreation Department,Park Maintenance & Safety,Equipment Repair,PARK_Maintenance_Trades,PARK,,,,,,,,,,,,,,,,,42.3594,-71.0587,Constituent Call,"(0, 0)"
557893,101001366780,04/29/2015 04:37:15 PM,05/06/2015 04:37:10 PM,05/13/2015 06:18:28 AM,OVERDUE,Closed,Case Closed. Closed date : 2015-05-13 06:18:28.24 Case Resolved pipe fixed,Equipment Repair,Parks & Recreation Department,Park Maintenance & Safety,Equipment Repair,PARK_Maintenance_Trades,PARK,,,,,,,,,,,,,,,,,42.3594,-71.0587,Constituent Call,"(0, 0)"
558032,101001366982,04/30/2015 08:17:42 AM,05/07/2015 08:30:00 AM,06/29/2015 06:29:34 AM,OVERDUE,Closed,Case Closed. Closed date : 2015-06-29 06:29:34.787 Case Resolved paint bench and tables,Equipment Repair,Parks & Recreation Department,Park Maintenance & Safety,Equipment Repair,PARK_Maintenance_Trades,PARK,,,INTERSECTION of Jeffries St & Sumner St  East Boston  MA,1.0,09,1.0,A7,East Boston,1.0,Ward 1,101.0,,INTERSECTION Jeffries St & Sumner St,,Intersection,6548.0,42.3646,-71.0298,Constituent Call,"(42.3646, -71.0298)"
558077,101001367047,04/30/2015 09:21:23 AM,05/07/2015 09:21:21 AM,05/01/2015 12:20:53 PM,ONTIME,Closed,Case Closed Case Resolved paint all benches,Equipment Repair,Parks & Recreation Department,Park Maintenance & Safety,Equipment Repair,PARK_Maintenance_Trades,PARK,,,30 Rogers Park Ave  Brighton  MA  02135,11.0,04,9.0,D14,Brighton,15.0,22,2210.0,,30 Rogers Park Ave,2135.0,Address,342618.0,42.3594,-71.0587,Constituent Call,"(0, 0)"
558086,101001367057,04/30/2015 09:25:04 AM,05/07/2015 09:25:00 AM,05/05/2015 06:27:24 AM,ONTIME,Closed,Case Closed. Closed date : 2015-05-05 06:27:24.077 Case Resolved drinking fountain not worked in years,Equipment Repair,Parks & Recreation Department,Park Maintenance & Safety,Equipment Repair,PARK_Maintenance_Trades,PARK,,,,,,,,,,,,,,,,,42.3594,-71.0587,Constituent Call,"(0, 0)"
558090,101001367063,04/30/2015 09:28:47 AM,05/07/2015 09:28:46 AM,05/05/2015 06:25:09 AM,ONTIME,Closed,Case Closed. Closed date : 2015-05-05 06:25:09.517 Case Resolved paint sewer covers,Equipment Repair,Parks & Recreation Department,Park Maintenance & Safety,Equipment Repair,PARK_Maintenance_Trades,PARK,,,,,,,,,,,,,,,,,42.3594,-71.0587,Constituent Call,"(0, 0)"
558108,101001367084,04/30/2015 09:43:06 AM,05/07/2015 09:43:03 AM,05/08/2015 12:13:20 PM,OVERDUE,Closed,Case Closed. Closed date : 2015-05-08 12:13:20.56 Case Resolved done,Equipment Repair,Parks & Recreation Department,Park Maintenance & Safety,Equipment Repair,PARK_Maintenance_Trades,PARK,,,210 W Third St  South Boston  MA  02127,6.0,05,2.0,C6,South Boston,5.0,6,603.0,E,210 W Third St,2127.0,Address,341625.0,42.3393,-71.0491,Constituent Call,"(42.3393, -71.0491)"
558116,101001367094,04/30/2015 09:49:31 AM,05/07/2015 09:49:30 AM,06/17/2015 06:16:45 AM,OVERDUE,Closed,Case Closed. Closed date : 2015-06-17 06:16:45.183 Case Resolved no swing in park,Equipment Repair,Parks & Recreation Department,Park Maintenance & Safety,Equipment Repair,PARK_Maintenance_Trades,PARK,,,130 B St  South Boston  MA  02127,6.0,05,2.0,C6,South Boston,5.0,06,601.0,,130 B St,2127.0,Address,342379.0,42.3594,-71.0587,Constituent Call,"(0, 0)"
558123,101001367101,04/30/2015 09:51:55 AM,05/07/2015 09:51:54 AM,05/13/2015 11:28:02 AM,OVERDUE,Closed,Case Closed. Closed date : 2015-05-13 11:28:02.117 Case Resolved done,Equipment Repair,Parks & Recreation Department,Park Maintenance & Safety,Equipment Repair,PARK_Maintenance_Trades,PARK,,,,,,,,,,,,,,,,,42.3594,-71.0587,Employee Generated,"(0, 0)"
558124,101001367102,04/30/2015 09:52:07 AM,05/07/2015 09:52:05 AM,05/05/2015 06:21:44 AM,ONTIME,Closed,Case Closed. Closed date : 2015-05-05 06:21:44.117 Case Resolved paint benchs,Equipment Repair,Parks & Recreation Department,Park Maintenance & Safety,Equipment Repair,PARK_Maintenance_Trades,PARK,,,130 B St  South Boston  MA  02127,6.0,05,2.0,C6,South Boston,5.0,06,601.0,,130 B St,2127.0,Address,342379.0,42.3594,-71.0587,Constituent Call,"(0, 0)"
558138,101001367122,04/30/2015 10:02:41 AM,05/07/2015 10:02:39 AM,05/05/2015 06:20:44 AM,ONTIME,Closed,Case Closed. Closed date : 2015-05-05 06:20:44.293 Case Resolved remove graffiti,Equipment Repair,Parks & Recreation Department,Park Maintenance & Safety,Equipment Repair,PARK_Maintenance_Trades,PARK,,,180 W Fifth St  South Boston  MA  02127,6.0,05,2.0,C6,South Boston,5.0,6,603.0,,180 W Fifth St,2127.0,Address,342659.0,42.3594,-71.0587,Employee Generated,"(0, 0)"
558142,101001367127,04/30/2015 10:08:41 AM,05/07/2015 10:08:40 AM,05/05/2015 06:19:46 AM,ONTIME,Closed,Case Closed. Closed date : 2015-05-05 06:19:46.08 Case Resolved power wash park,Equipment Repair,Parks & Recreation Department,Park Maintenance & Safety,Equipment Repair,PARK_Maintenance_Trades,PARK,,,23 Everett St  Dorchester  MA  02122,7.0,07,3.0,C11,Dorchester,7.0,16,1602.0,E,23 Everett St,2122.0,Address,341627.0,42.3008,-71.0524,Employee Generated,"(42.3008, -71.0524)"
558145,101001367130,04/30/2015 10:12:11 AM,05/07/2015 10:12:09 AM,05/05/2015 06:18:36 AM,ONTIME,Closed,Case Closed. Closed date : 2015-05-05 06:18:36.577 Case Resolved paint box,Equipment Repair,Parks & Recreation Department,Park Maintenance & Safety,Equipment Repair,PARK_Maintenance_Trades,PARK,,,70 Park Dr  Boston  MA  02215,4.0,10A,8.0,D4,Fenway / Kenmore / Audubon Circle / Longwood,14.0,05,502.0,E,70 Park Dr,2215.0,Address,342000.0,42.3594,-71.0587,Employee Generated,"(0, 0)"
558151,101001367136,04/30/2015 10:16:59 AM,05/07/2015 10:16:58 AM,05/21/2015 06:16:20 AM,OVERDUE,Closed,Case Closed. Closed date : 2015-05-21 06:16:20.827 Case Resolved repair fence,Equipment Repair,Parks & Recreation Department,Park Maintenance & Safety,Equipment Repair,PARK_Maintenance_Trades,PARK,,,40 Downer Ave  Dorchester  MA  02125,7.0,03,3.0,C11,Dorchester,7.0,13,1306.0,,40 Downer Ave,2125.0,Address,342086.0,42.3594,-71.0587,Employee Generated,"(0, 0)"
558154,101001367139,04/30/2015 10:19:56 AM,05/07/2015 10:19:55 AM,05/05/2015 06:17:46 AM,ONTIME,Closed,Case Closed. Closed date : 2015-05-05 06:17:46.93 Case Resolved remove graffiti,Equipment Repair,Parks & Recreation Department,Park Maintenance & Safety,Equipment Repair,PARK_Maintenance_Trades,PARK,,,40 Downer Ave  Dorchester  MA  02125,7.0,03,3.0,C11,Dorchester,7.0,13,1306.0,,40 Downer Ave,2125.0,Address,342086.0,42.3594,-71.0587,Employee Generated,"(0, 0)"
558180,101001367174,04/30/2015 10:49:55 AM,05/07/2015 10:49:49 AM,05/08/2015 12:11:42 PM,OVERDUE,Closed,Case Closed. Closed date : 2015-05-08 12:11:42.493 Case Resolved done,Equipment Repair,Parks & Recreation Department,Park Maintenance & Safety,Equipment Repair,PARK_Maintenance_Trades,PARK,,,260 Clarendon St  Boston  MA  02116,4.0,1C,8.0,D4,Boston,14.0,05,507.0,,260 Clarendon St,2116.0,Address,342026.0,42.3594,-71.0587,Employee Generated,"(0, 0)"
558223,101001367238,04/30/2015 11:47:48 AM,05/07/2015 11:47:46 AM,05/04/2015 02:54:44 PM,ONTIME,Closed,Case Closed. Closed date : 2015-05-04 14:54:44.043 Case Resolved fix ladder,Equipment Repair,Parks & Recreation Department,Park Maintenance & Safety,Equipment Repair,PARK_Maintenance_Trades,PARK,,,,,,,,,,,,,,,,,42.3594,-71.0587,Constituent Call,"(0, 0)"
558263,101001367302,04/30/2015 12:46:31 PM,05/07/2015 12:46:23 PM,05/01/2015 12:14:20 PM,ONTIME,Closed,Case Closed Case Resolved cut out pipe and bolts,Equipment Repair,Parks & Recreation Department,Park Maintenance & Safety,Equipment Repair,PARK_Maintenance_Trades,PARK,,,,,,,,,,,,,,,,,42.3594,-71.0587,Employee Generated,"(0, 0)"
558302,101001367352,04/30/2015 01:16:20 PM,05/07/2015 01:16:19 PM,,OVERDUE,Open,,Equipment Repair,Parks & Recreation Department,Park Maintenance & Safety,Equipment Repair,PARK_Maintenance_Trades,PARK,,,,,,,,,,,,,,,,,42.3594,-71.0587,Employee Generated,"(0, 0)"
558308,101001367360,04/30/2015 01:20:48 PM,05/07/2015 01:20:41 PM,05/05/2015 06:14:15 AM,ONTIME,Closed,Case Closed. Closed date : 2015-05-05 06:14:15.467 Case Resolved repair bench,Equipment Repair,Parks & Recreation Department,Park Maintenance & Safety,Equipment Repair,PARK_Maintenance_Trades,PARK,,,,,,,,,,,,,,,,,42.3594,-71.0587,Employee Generated,"(0, 0)"
558320,101001367375,04/30/2015 01:30:17 PM,05/07/2015 01:30:16 PM,05/14/2015 11:00:57 AM,OVERDUE,Closed,Case Closed. Closed date : 2015-05-14 11:00:57.613 Case Resolved,Equipment Repair,Parks & Recreation Department,Park Maintenance & Safety,Equipment Repair,PARK_Maintenance_Trades,PARK,,,75 Alford St  Charlestown  MA  02129,3.0,1A,1.0,A15,Charlestown,2.0,02,,,75 Alford St,2129.0,Address,342631.0,42.3594,-71.0587,Employee Generated,"(0, 0)"
558326,101001367382,04/30/2015 01:33:17 PM,05/07/2015 01:33:15 PM,05/13/2015 06:23:40 AM,OVERDUE,Closed,Case Closed. Closed date : 2015-05-13 06:23:40.543 Case Resolved tie back fence,Equipment Repair,Parks & Recreation Department,Park Maintenance & Safety,Equipment Repair,PARK_Maintenance_Trades,PARK,,,58 Wachusett St  Jamaica Plain  MA  02130,12.0,02,6.0,E13,Jamaica Plain,10.0,19,1907.0,,58 Wachusett St,2130.0,Address,342566.0,42.3594,-71.0587,Employee Generated,"(0, 0)"
558333,101001367395,04/30/2015 01:39:19 PM,05/07/2015 01:39:19 PM,05/14/2015 10:27:49 AM,OVERDUE,Closed,Case Closed. Closed date : 2015-05-14 10:27:49.27 Case Resolved DONE,Equipment Repair: Evans Way Park,Parks & Recreation Department,Park Maintenance & Safety,Equipment Repair,PARK_Maintenance_Trades,PARK,,,,,,,,,,,,,,,,,42.3594,-71.0587,Self Service,"(0, 0)"
558415,101001367531,04/30/2015 04:02:04 PM,05/07/2015 04:02:03 PM,05/13/2015 06:24:45 AM,OVERDUE,Closed,Case Closed. Closed date : 2015-05-13 06:24:45.923 Case Resolved repair swing,Equipment Repair,Parks & Recreation Department,Park Maintenance & Safety,Equipment Repair,PARK_Maintenance_Trades,PARK,,,2180 Dorchester Ave  Dorchester  MA  02124,8.0,07,3.0,C11,Dorchester,7.0,16,1611.0,,2180 Dorchester Ave,2124.0,Address,342074.0,42.3594,-71.0587,Employee Generated,"(0, 0)"
558436,101001367560,04/30/2015 04:25:38 PM,05/07/2015 04:25:36 PM,05/20/2015 02:59:55 PM,OVERDUE,Closed,Case Closed. Closed date : 2015-05-20 14:59:55.22 Case Resolved,Equipment Repair,Parks & Recreation Department,Park Maintenance & Safety,Equipment Repair,PARK_Maintenance_Trades,PARK,,,127-129 Howard Ave  Dorchester  MA  02125,7.0,03,7.0,B2,Roxbury,13.0,13,1301.0,E,127-129 Howard Ave,2125.0,Address,75500.0,42.3159,-71.0757,Constituent Call,"(42.3159, -71.0757)"
558586,101001367772,05/01/2015 07:29:49 AM,05/08/2015 08:30:00 AM,05/21/2015 06:17:46 AM,OVERDUE,Closed,Case Closed. Closed date : 2015-05-21 06:17:46.04 Case Resolved new net installed,Equipment Repair,Parks & Recreation Department,Park Maintenance & Safety,Equipment Repair,PARK_Maintenance_Trades,PARK,,,85 Allston St  Allston  MA  02134,11.0,04,9.0,D14,Allston,15.0,21,2106.0,,85 Allston St,2134.0,Address,342014.0,42.3594,-71.0587,Employee Generated,"(0, 0)"
558704,101001367927,05/01/2015 09:42:47 AM,05/08/2015 09:42:46 AM,05/02/2015 03:07:49 PM,ONTIME,Closed,Case Closed. Closed date : 2015-05-02 15:07:49.587 Case Resolved graffiti removed,Equipment Repair,Parks & Recreation Department,Park Maintenance & Safety,Equipment Repair,PARK_Maintenance_Trades,PARK,,,410 Washington St  Dorchester  MA  02124,7.0,03,4.0,C11,Dorchester,9.0,17,1701.0,,410 Washington St,2124.0,Address,342034.0,42.3594,-71.0587,Employee Generated,"(0, 0)"
558749,101001367996,05/01/2015 10:32:30 AM,05/08/2015 10:32:29 AM,05/05/2015 10:05:48 AM,ONTIME,Closed,Case Closed. Closed date : 2015-05-05 10:05:48.38 Case Resolved done 5-4-15,Equipment Repair,Parks & Recreation Department,Park Maintenance & Safety,Equipment Repair,PARK_Maintenance_Trades,PARK,,,70 Park Dr  Boston  MA  02215,4.0,10A,8.0,D4,Fenway / Kenmore / Audubon Circle / Longwood,14.0,05,502.0,E,70 Park Dr,2215.0,Address,342000.0,42.3594,-71.0587,Employee Generated,"(0, 0)"
558784,101001368045,05/01/2015 11:07:17 AM,05/08/2015 11:07:15 AM,05/04/2015 02:50:05 PM,ONTIME,Closed,Case Closed. Closed date : 2015-05-04 14:50:05.553 Case Resolved install signs,Equipment Repair,Parks & Recreation Department,Park Maintenance & Safety,Equipment Repair,PARK_Maintenance_Trades,PARK,,,2180 Dorchester Ave  Dorchester  MA  02124,8.0,07,3.0,C11,Dorchester,7.0,16,1611.0,,2180 Dorchester Ave,2124.0,Address,342074.0,42.3594,-71.0587,Constituent Call,"(0, 0)"
558875,101001368179,05/01/2015 01:24:24 PM,05/08/2015 01:24:23 PM,05/02/2015 03:06:22 PM,ONTIME,Closed,Case Closed. Closed date : 2015-05-02 15:06:22.907 Case Resolved no leak found,Equipment Repair,Parks & Recreation Department,Park Maintenance & Safety,Equipment Repair,PARK_Maintenance_Trades,PARK,,,,,,,,,,,,,,,,,42.3594,-71.0587,Employee Generated,"(0, 0)"
558885,101001368193,05/01/2015 01:37:42 PM,05/08/2015 01:37:42 PM,,OVERDUE,Open,,Equipment Repair: Hemenway Playground,Parks & Recreation Department,Park Maintenance & Safety,Equipment Repair,PARK_Park Improvement Requests,PARK,,,,,,,,,,,,,,,,,42.3594,-71.0587,Self Service,"(0, 0)"
558995,101001368367,05/01/2015 04:12:31 PM,05/08/2015 04:12:29 PM,05/01/2015 04:15:02 PM,ONTIME,Closed,Case Closed Case Resolved done,Equipment Repair,Parks & Recreation Department,Park Maintenance & Safety,Equipment Repair,PARK_Maintenance_Trades,PARK,,,,,,,,,,,,,,,,,42.3594,-71.0587,Employee Generated,"(0, 0)"
558996,101001368368,05/01/2015 04:15:47 PM,05/08/2015 04:15:46 PM,05/01/2015 04:18:35 PM,ONTIME,Closed,Case Closed Case Resolved done,Equipment Repair,Parks & Recreation Department,Park Maintenance & Safety,Equipment Repair,PARK_Maintenance_Trades,PARK,,,,,,,,,,,,,,,,,42.3594,-71.0587,Employee Generated,"(0, 0)"
558998,101001368371,05/01/2015 04:19:35 PM,05/08/2015 04:19:35 PM,05/01/2015 04:21:50 PM,ONTIME,Closed,Case Closed Case Resolved done,Equipment Repair,Parks & Recreation Department,Park Maintenance & Safety,Equipment Repair,PARK_Maintenance_Trades,PARK,,,,,,,,,,,,,,,,,42.3594,-71.0587,Employee Generated,"(0, 0)"
559194,101001368772,05/02/2015 09:01:00 PM,05/11/2015 08:30:00 AM,05/27/2015 11:26:17 AM,OVERDUE,Closed,Case Closed. Closed date : 2015-05-27 11:26:17.51 Case Noted Water was turned off.,Equipment Repair: Back Bay Fens,Parks & Recreation Department,Park Maintenance & Safety,Equipment Repair,PARK_Maintenance_Trades,PARK,,,,,,,,,,,,,,,,,42.3594,-71.0587,Self Service,"(0, 0)"
559508,101001369259,05/04/2015 09:29:00 AM,05/11/2015 09:29:31 AM,05/13/2015 07:16:06 AM,OVERDUE,Closed,Case Closed. Closed date : 2015-05-13 07:16:06.8 Case Resolved swing fixed,Equipment Repair: McConnell Park,Parks & Recreation Department,Park Maintenance & Safety,Equipment Repair,PARK_Maintenance_Trades,PARK,,,,,,,,,,,,,,,,,42.3594,-71.0587,Self Service,"(0, 0)"
559603,101001369390,05/04/2015 10:53:00 AM,05/11/2015 10:53:12 AM,11/06/2015 10:16:09 AM,OVERDUE,Closed,Case Closed. Closed date : 2015-11-06 10:16:09.693 Case Resolved done,Equipment Repair,Parks & Recreation Department,Park Maintenance & Safety,Equipment Repair,PARK_Maintenance_Trades,PARK,,,529-543 Commercial St  Boston  MA  02109,3.0,1B,1.0,A1,Boston,3.0,3,302.0,E,529-543 Commercial St,2109.0,Address,36790.0,42.3688,-71.0562,Employee Generated,"(42.3688, -71.0562)"
559794,101001369651,05/04/2015 01:45:00 PM,05/11/2015 01:45:06 PM,05/13/2015 10:38:46 AM,OVERDUE,Closed,Case Closed. Closed date : 2015-05-13 10:38:46.353 Case Resolved done,Equipment Repair,Parks & Recreation Department,Park Maintenance & Safety,Equipment Repair,PARK_Maintenance_Region 5,PARK,,,61 Quincy St  Dorchester  MA  02121,9.0,10B,7.0,B2,Roxbury,13.0,Ward 12,1206.0,R2,61 Quincy St,2121.0,Address,114134.0,42.3149,-71.08,Constituent Call,"(42.3149, -71.08)"
559859,101001369763,05/04/2015 03:17:00 PM,05/11/2015 03:17:14 PM,05/06/2015 06:00:54 AM,ONTIME,Closed,Case Closed. Closed date : 2015-05-06 06:00:54.323 Case Resolved slide block off with plywood,Equipment Repair,Parks & Recreation Department,Park Maintenance & Safety,Equipment Repair,PARK_Maintenance_Trades,PARK,,,775 E First St  South Boston  MA  02127,6.0,05,2.0,C6,South Boston / South Boston Waterfront,5.0,06,607.0,,775 E First St,2127.0,Address,342025.0,42.3594,-71.0587,Employee Generated,"(0, 0)"
559957,101001369906,05/04/2015 05:52:00 PM,05/12/2015 08:30:00 AM,,OVERDUE,Open,,Equipment Repair: --Not in list--,Parks & Recreation Department,Park Maintenance & Safety,Equipment Repair,INFO01_GenericeFormforOtherServiceRequestTypes,INFO,,,,,,,,,,,,,,,,,42.3594,-71.0587,Self Service,"(0, 0)"
560188,101001370261,05/05/2015 09:44:00 AM,05/12/2015 09:44:43 AM,05/13/2015 06:42:19 AM,OVERDUE,Closed,Case Closed. Closed date : 2015-05-13 06:42:19.49 Case Resolved replace swing,Equipment Repair,Parks & Recreation Department,Park Maintenance & Safety,Equipment Repair,PARK_Maintenance_Trades,PARK,,,930 Blue Hill Ave  Dorchester  MA  02124,8.0,07,4.0,B3,Dorchester,9.0,14,1410.0,,930 Blue Hill Ave,2124.0,Address,162200.0,42.2923,-71.0846,Employee Generated,"(42.2923, -71.0846)"
560565,101001370744,05/05/2015 02:53:00 PM,05/12/2015 02:53:25 PM,,OVERDUE,Open,,Equipment Repair,Parks & Recreation Department,Park Maintenance & Safety,Equipment Repair,PARK_Park Improvement Requests,PARK,,,45 Lambert Ave  Roxbury  MA  02119,7.0,10B,7.0,B2,Roxbury,13.0,9,905.0,,45 Lambert Ave,2119.0,Address,342504.0,42.3594,-71.0587,Constituent Call,"(0, 0)"
560634,101001370843,05/05/2015 04:14:07 PM,05/12/2015 04:14:37 PM,05/06/2015 10:52:11 AM,ONTIME,Closed,Case Closed Case Resolved,Equipment Repair,Parks & Recreation Department,Park Maintenance & Safety,Equipment Repair,PARK_Maintenance_Trades,PARK,,,369 Lagrange St  West Roxbury  MA  02132,12.0,06,6.0,E5,West Roxbury,12.0,20,2014.0,E,369 Lagrange St,2132.0,Address,166825.0,42.2803,-71.1569,Employee Generated,"(42.2803, -71.1569)"
560638,101001370847,05/05/2015 04:17:00 PM,05/12/2015 04:17:10 PM,05/08/2015 12:14:09 PM,ONTIME,Closed,Case Closed. Closed date : 2015-05-08 12:14:09.03 Case Resolved,Equipment Repair,Parks & Recreation Department,Park Maintenance & Safety,Equipment Repair,PARK_Maintenance_Trades,PARK,,,369 Lagrange St  West Roxbury  MA  02132,12.0,06,6.0,E5,West Roxbury,12.0,20,2014.0,E,369 Lagrange St,2132.0,Address,166825.0,42.2803,-71.1569,Employee Generated,"(42.2803, -71.1569)"
560688,101001370922,05/05/2015 05:38:00 PM,05/13/2015 08:30:00 AM,05/06/2015 08:08:46 AM,ONTIME,Closed,Case Closed. Closed date : 2015-05-06 08:08:46.347 Duplicate of Existing Case Same as #1370921,Equipment Repair,Parks & Recreation Department,Park Maintenance & Safety,Equipment Repair,PARK_Maintenance_Trades,PARK,,,INTERSECTION of Fairland St & Moreland St  Roxbury  MA,7.0,10B,7.0,B2,Roxbury,13.0,Ward 8,807.0,,INTERSECTION Fairland St & Moreland St,,Intersection,4747.0,42.3241,-71.0796,Constituent Call,"(42.3241, -71.0796)"
560846,101001371150,05/06/2015 08:21:03 AM,05/13/2015 08:30:00 AM,05/06/2015 08:28:32 AM,ONTIME,Closed,Case Closed. Closed date : 2015-05-06 08:28:32.343 Case Invalid Wrong eform  see case #1371160,Equipment Repair,Parks & Recreation Department,Park Maintenance & Safety,Equipment Repair,PARK_Maintenance_Trades,PARK,,,INTERSECTION of Rossmore Rd & Stedman St  Jamaica Plain  MA,9.0,02,6.0,E13,Jamaica Plain,11.0,Ward 11,1108.0,,INTERSECTION Rossmore Rd & Stedman St,,Intersection,8177.0,42.3046,-71.1069,Constituent Call,"(42.3046, -71.1069)"
560861,101001371173,05/06/2015 08:36:00 AM,05/13/2015 08:36:48 AM,05/19/2015 11:48:40 AM,OVERDUE,Closed,Case Closed. Closed date : 2015-05-19 11:48:40.34 Case Resolved,Equipment Repair,Parks & Recreation Department,Park Maintenance & Safety,Equipment Repair,PARK_Maintenance_Trades,PARK,,,92 Mount Ida Rd  Dorchester  MA  02122,7.0,03,3.0,C11,Dorchester,8.0,15,1509.0,,92 Mount Ida Rd,2122.0,Address,342620.0,42.3594,-71.0587,Employee Generated,"(0, 0)"
560931,101001371268,05/06/2015 09:38:00 AM,05/13/2015 09:38:28 AM,05/27/2015 11:07:41 AM,OVERDUE,Closed,Case Closed. Closed date : 2015-05-27 11:07:41.823 Case Resolved Irrigation was repaired.,Equipment Repair,Parks & Recreation Department,Park Maintenance & Safety,Equipment Repair,PARK_Maintenance_Trades,PARK,,,21 Phillips St  Boston  MA  02114,3.0,1B,8.0,A1,Boston,14.0,5,504.0,,21 Phillips St,2114.0,Address,342572.0,42.3594,-71.0587,Constituent Call,"(0, 0)"
560979,101001371334,05/06/2015 10:31:00 AM,05/13/2015 10:31:18 AM,05/06/2015 10:32:35 AM,ONTIME,Closed,Case Closed. Closed date : 2015-05-06 10:32:35.54 Case Resolved,Equipment Repair,Parks & Recreation Department,Park Maintenance & Safety,Equipment Repair,PARK_Maintenance_Trades,PARK,,,,,,,,,,,,,,,,,42.3594,-71.0587,Employee Generated,"(0, 0)"
560983,101001371340,05/06/2015 10:34:08 AM,05/13/2015 10:34:18 AM,05/07/2015 12:01:00 PM,ONTIME,Closed,Case Closed. Closed date : 2015-05-07 12:01:00.487 Case Invalid,Equipment Repair,Parks & Recreation Department,Park Maintenance & Safety,Equipment Repair,PARK_Maintenance_Trades,PARK,,,,,,,,,,,,,,,,,42.3594,-71.0587,Employee Generated,"(0, 0)"
560986,101001371342,05/06/2015 10:35:00 AM,05/13/2015 10:35:20 AM,05/06/2015 10:39:50 AM,ONTIME,Closed,Case Closed. Closed date : 2015-05-06 10:39:50.683 Case Resolved done,Equipment Repair,Parks & Recreation Department,Park Maintenance & Safety,Equipment Repair,PARK_Maintenance_Trades,PARK,,,,,,,,,,,,,,,,,42.3594,-71.0587,Employee Generated,"(0, 0)"
560988,101001371350,05/06/2015 10:40:00 AM,05/13/2015 10:40:25 AM,05/06/2015 10:42:07 AM,ONTIME,Closed,Case Closed. Closed date : 2015-05-06 10:42:07.11 Case Resolved done 4-28-15,Equipment Repair,Parks & Recreation Department,Park Maintenance & Safety,Equipment Repair,PARK_Maintenance_Trades,PARK,,,,,,,,,,,,,,,,,42.3594,-71.0587,Employee Generated,"(0, 0)"
560996,101001371358,05/06/2015 10:43:00 AM,05/13/2015 10:43:12 AM,05/06/2015 10:44:40 AM,ONTIME,Closed,Case Closed. Closed date : 2015-05-06 10:44:40.98 Case Resolved,Equipment Repair,Parks & Recreation Department,Park Maintenance & Safety,Equipment Repair,PARK_Maintenance_Trades,PARK,,,,,,,,,,,,,,,,,42.3594,-71.0587,Employee Generated,"(0, 0)"
561030,101001371409,05/06/2015 11:15:00 AM,05/13/2015 11:15:36 AM,10/13/2015 06:32:21 AM,OVERDUE,Closed,Case Closed. Closed date : 2015-10-13 06:32:21.383 Case Resolved,Equipment Repair,Parks & Recreation Department,Park Maintenance & Safety,Equipment Repair,PARK_Maintenance_Trades,PARK,,,110 Atlantic Ave  Boston  MA  02110,3.0,1B,1.0,A1,Boston,3.0,3,301.0,,110 Atlantic Ave,2110.0,Address,161702.0,42.361,-71.0522,Employee Generated,"(42.361, -71.0522)"
561041,101001371425,05/06/2015 11:22:00 AM,05/13/2015 11:22:43 AM,05/08/2015 12:14:47 PM,ONTIME,Closed,Case Closed. Closed date : 2015-05-08 12:14:47.347 Case Resolved,Equipment Repair,Parks & Recreation Department,Park Maintenance & Safety,Equipment Repair,PARK_Maintenance_Trades,PARK,,,369 Lagrange St  West Roxbury  MA  02132,12.0,06,6.0,E5,West Roxbury,12.0,20,2014.0,E,369 Lagrange St,2132.0,Address,166825.0,42.2803,-71.1569,Constituent Call,"(42.2803, -71.1569)"
561090,101001371497,05/06/2015 12:28:00 PM,05/13/2015 12:28:23 PM,05/27/2015 11:36:30 AM,OVERDUE,Closed,Case Closed. Closed date : 2015-05-27 11:36:30.7 Case Resolved Irrigation heads were re-adjusted.,Equipment Repair: Worcester Square,Parks & Recreation Department,Park Maintenance & Safety,Equipment Repair,PARK_Maintenance_Trades,PARK,,,,,,,,,,,,,,,,,42.3594,-71.0587,Self Service,"(0, 0)"
561109,101001371530,05/06/2015 12:49:00 PM,05/13/2015 12:49:32 PM,05/08/2015 12:05:16 PM,ONTIME,Closed,Case Closed. Closed date : 2015-05-08 12:05:16.403 Case Resolved done 5-7-15,Equipment Repair,Parks & Recreation Department,Park Maintenance & Safety,Equipment Repair,PARK_Maintenance_Trades,PARK,,,260 West St  Hyde Park  MA  02136,12.0,08,5.0,E18,Hyde Park,10.0,18,1812.0,,260 West St,2136.0,Address,342456.0,42.3594,-71.0587,Employee Generated,"(0, 0)"
561115,101001371538,05/06/2015 12:54:00 PM,05/13/2015 12:54:13 PM,05/08/2015 06:17:53 PM,ONTIME,Closed,Case Closed. Closed date : 2015-05-08 18:17:53.32 Case Resolved fix swing,Equipment Repair,Parks & Recreation Department,Park Maintenance & Safety,Equipment Repair,PARK_Maintenance_Trades,PARK,,,30 Denny St  Dorchester  MA  02125,7.0,03,3.0,C11,Dorchester,7.0,13,1310.0,,30 Denny St,2125.0,Address,342516.0,42.3594,-71.0587,Employee Generated,"(0, 0)"
561203,101001371681,05/06/2015 02:22:00 PM,05/13/2015 02:22:31 PM,05/13/2015 07:01:17 AM,ONTIME,Closed,Case Closed. Closed date : 2015-05-13 07:01:17.407 Case Resolved remove graffiti,Equipment Repair,Parks & Recreation Department,Park Maintenance & Safety,Equipment Repair,PARK_Maintenance_Trades,PARK,,,1 Jewish War Veterans Dr  Jamaica Plain  MA  02130,9.0,02,7.0,B2,Greater Mattapan,13.0,12,1207.0,E,1 Jewish War Veterans Dr,2130.0,Address,163434.0,42.301,-71.0886,Employee Generated,"(42.301, -71.0886)"
561219,101001371708,05/06/2015 02:46:00 PM,05/13/2015 02:47:13 PM,05/26/2015 03:24:21 PM,OVERDUE,Closed,Case Closed. Closed date : 2015-05-26 15:24:21.65 Case Resolved done,Equipment Repair,Parks & Recreation Department,Park Maintenance & Safety,Equipment Repair,PARK_Maintenance_Trades,PARK,,,330 Perkins St  Jamaica Plain  MA  02130,9.0,02,6.0,E13,Jamaica Plain,11.0,19,1903.0,,330 Perkins St,2130.0,Address,347229.0,42.3594,-71.0587,Employee Generated,"(0, 0)"
561496,101001372128,05/07/2015 08:09:00 AM,05/14/2015 08:30:00 AM,,OVERDUE,Open,,Equipment Repair,Parks & Recreation Department,Park Maintenance & Safety,Equipment Repair,PARK_Maintenance_Trades,PARK,,,41 Medford St  Charlestown  MA  02129,3.0,1A,1.0,A15,Charlestown,2.0,2,202.0,E,41 Medford St,2129.0,Address,93748.0,42.3793,-71.0537,Employee Generated,"(42.3793, -71.0537)"
561500,101001372135,05/07/2015 08:12:00 AM,05/14/2015 08:30:00 AM,12/30/2015 04:16:17 PM,OVERDUE,Closed,Case Closed. Closed date : 2015-12-30 16:16:17.763 Case Resolved repairs made,Equipment Repair,Parks & Recreation Department,Park Maintenance & Safety,Equipment Repair,PARK_Park Improvement Requests,PARK,,,39 Terminal St  Charlestown  MA  02129,3.0,1A,1.0,A15,Charlestown,2.0,2,202.0,,39 Terminal St,2129.0,Address,344482.0,42.3816,-71.0599,Employee Generated,"(42.3816, -71.0599)"
561637,101001372366,05/07/2015 10:29:00 AM,05/14/2015 10:30:07 AM,05/13/2015 07:10:16 AM,ONTIME,Closed,Case Closed. Closed date : 2015-05-13 07:10:16.453 Case Resolved fix bench remove barrel,Equipment Repair,Parks & Recreation Department,Park Maintenance & Safety,Equipment Repair,PARK_Maintenance_Trades,PARK,,,139 Tremont St  Boston  MA  02108,3.0,1C,8.0,A1,Beacon Hill,14.0,05,503.0,E,139 Tremont St,2108.0,Address,341542.0,42.3554,-71.0638,Constituent Call,"(42.3554, -71.0638)"
561649,101001372373,05/07/2015 10:35:00 AM,05/14/2015 10:35:55 AM,05/20/2015 06:28:29 AM,OVERDUE,Closed,Case Closed. Closed date : 2015-05-20 06:28:29.873 Case Resolved install new net,Equipment Repair,Parks & Recreation Department,Park Maintenance & Safety,Equipment Repair,PARK_Maintenance_Trades,PARK,,,139 Tremont St  Boston  MA  02108,3.0,1C,8.0,A1,Beacon Hill,14.0,05,503.0,E,139 Tremont St,2108.0,Address,341542.0,42.3554,-71.0638,Constituent Call,"(42.3554, -71.0638)"
562313,101001373405,05/08/2015 11:57:00 AM,05/15/2015 11:57:20 AM,05/13/2015 01:57:44 PM,ONTIME,Closed,Case Closed. Closed date : 2015-05-13 13:57:44.763 Case Resolved done,Equipment Repair,Parks & Recreation Department,Park Maintenance & Safety,Equipment Repair,PARK_Maintenance_Trades,PARK,,,960 Dorchester Ave  Dorchester  MA  02125,7.0,03,3.0,C11,Dorchester,7.0,13,1307.0,,960 Dorchester Ave,2125.0,Address,342630.0,42.3594,-71.0587,Employee Generated,"(0, 0)"
562316,101001373408,05/08/2015 11:59:00 AM,05/15/2015 11:59:43 AM,05/13/2015 07:07:07 AM,ONTIME,Closed,Case Closed. Closed date : 2015-05-13 07:07:07.877 Case Resolved power wash and paint pk,Equipment Repair,Parks & Recreation Department,Park Maintenance & Safety,Equipment Repair,PARK_Maintenance_Trades,PARK,,,960 Dorchester Ave  Dorchester  MA  02125,7.0,03,3.0,C11,Dorchester,7.0,13,1307.0,,960 Dorchester Ave,2125.0,Address,342630.0,42.3594,-71.0587,Employee Generated,"(0, 0)"
562346,101001373446,05/08/2015 12:50:00 PM,05/15/2015 12:50:03 PM,05/14/2015 01:17:45 PM,ONTIME,Closed,Case Closed. Closed date : 2015-05-14 13:17:45.417 Case Resolved done,Equipment Repair: --Not in list--,Parks & Recreation Department,Park Maintenance & Safety,Equipment Repair,PARK_Maintenance_Trades,PARK,,,,,,,,,,,,,,,,,42.3594,-71.0587,Self Service,"(0, 0)"
562385,101001373524,05/08/2015 02:14:00 PM,05/15/2015 02:17:58 PM,05/08/2015 02:20:12 PM,ONTIME,Closed,Case Closed. Closed date : 2015-05-08 14:20:12.23 Case Resolved,Equipment Repair,Parks & Recreation Department,Park Maintenance & Safety,Equipment Repair,PARK_Maintenance_Trades,PARK,,,960 Dorchester Ave  Dorchester  MA  02125,7.0,03,3.0,C11,Dorchester,7.0,13,1307.0,,960 Dorchester Ave,2125.0,Address,342630.0,42.3594,-71.0587,Employee Generated,"(0, 0)"
562389,101001373527,05/08/2015 02:20:00 PM,05/15/2015 02:20:38 PM,05/08/2015 02:23:50 PM,ONTIME,Closed,Case Closed. Closed date : 2015-05-08 14:23:50.84 Case Resolved,Equipment Repair,Parks & Recreation Department,Park Maintenance & Safety,Equipment Repair,PARK_Maintenance_Trades,PARK,,,960 Dorchester Ave  Dorchester  MA  02125,7.0,03,3.0,C11,Dorchester,7.0,13,1307.0,,960 Dorchester Ave,2125.0,Address,342630.0,42.3594,-71.0587,Employee Generated,"(0, 0)"
562392,101001373532,05/08/2015 02:24:12 PM,05/15/2015 02:24:20 PM,05/08/2015 02:35:16 PM,ONTIME,Closed,Case Closed. Closed date : 2015-05-08 14:35:16.44 Case Resolved done,Equipment Repair,Parks & Recreation Department,Park Maintenance & Safety,Equipment Repair,PARK_Maintenance_Trades,PARK,,,960 Dorchester Ave  Dorchester  MA  02125,7.0,03,3.0,C11,Dorchester,7.0,13,1307.0,,960 Dorchester Ave,2125.0,Address,342630.0,42.3594,-71.0587,Employee Generated,"(0, 0)"
562398,101001373540,05/08/2015 02:39:00 PM,05/15/2015 02:39:49 PM,05/08/2015 02:41:25 PM,ONTIME,Closed,Case Closed. Closed date : 2015-05-08 14:41:25.257 Case Resolved done,Equipment Repair,Parks & Recreation Department,Park Maintenance & Safety,Equipment Repair,PARK_Maintenance_Trades,PARK,,,960 Dorchester Ave  Dorchester  MA  02125,7.0,03,3.0,C11,Dorchester,7.0,13,1307.0,,960 Dorchester Ave,2125.0,Address,342630.0,42.3594,-71.0587,Employee Generated,"(0, 0)"
562400,101001373544,05/08/2015 02:42:00 PM,05/15/2015 02:43:12 PM,05/08/2015 02:45:55 PM,ONTIME,Closed,Case Closed. Closed date : 2015-05-08 14:45:55.893 Case Resolved,Equipment Repair,Parks & Recreation Department,Park Maintenance & Safety,Equipment Repair,PARK_Maintenance_Trades,PARK,,,960 Dorchester Ave  Dorchester  MA  02125,7.0,03,3.0,C11,Dorchester,7.0,13,1307.0,,960 Dorchester Ave,2125.0,Address,342630.0,42.3594,-71.0587,Employee Generated,"(0, 0)"
562420,101001373571,05/08/2015 03:21:30 PM,05/15/2015 03:21:30 PM,05/08/2015 03:22:20 PM,ONTIME,Closed,Case Closed. Closed date : 2015-05-08 15:22:20.66 Case Invalid Opened in error.,Equipment Repair,Parks & Recreation Department,Park Maintenance & Safety,Equipment Repair,PARK_Maintenance_Trades,PARK,,,399 Chelsea St  East Boston  MA  02128,1.0,09,1.0,A7,East Boston,1.0,Ward 1,110.0,RC,399 Chelsea St,2128.0,Address,30543.0,42.3796,-71.0272,Constituent Call,"(42.3796, -71.0272)"
562423,101001373578,05/08/2015 03:25:00 PM,05/15/2015 03:26:02 PM,05/08/2015 03:28:20 PM,ONTIME,Closed,Case Closed Case Resolved,Equipment Repair,Parks & Recreation Department,Park Maintenance & Safety,Equipment Repair,PARK_Maintenance_Trades,PARK,,,960 Dorchester Ave  Dorchester  MA  02125,7.0,03,3.0,C11,Dorchester,7.0,13,1307.0,,960 Dorchester Ave,2125.0,Address,342630.0,42.3594,-71.0587,Employee Generated,"(0, 0)"
562424,101001373582,05/08/2015 03:29:00 PM,05/15/2015 03:29:29 PM,05/08/2015 03:31:18 PM,ONTIME,Closed,Case Closed. Closed date : 2015-05-08 15:31:18.827 Case Resolved,Equipment Repair,Parks & Recreation Department,Park Maintenance & Safety,Equipment Repair,PARK_Maintenance_Trades,PARK,,,960 Dorchester Ave  Dorchester  MA  02125,7.0,03,3.0,C11,Dorchester,7.0,13,1307.0,,960 Dorchester Ave,2125.0,Address,342630.0,42.3594,-71.0587,Employee Generated,"(0, 0)"
562426,101001373585,05/08/2015 03:32:00 PM,05/15/2015 03:32:12 PM,05/08/2015 03:34:10 PM,ONTIME,Closed,Case Closed. Closed date : 2015-05-08 15:34:10.43 Case Resolved,Equipment Repair,Parks & Recreation Department,Park Maintenance & Safety,Equipment Repair,PARK_Maintenance_Trades,PARK,,,960 Dorchester Ave  Dorchester  MA  02125,7.0,03,3.0,C11,Dorchester,7.0,13,1307.0,,960 Dorchester Ave,2125.0,Address,342630.0,42.3594,-71.0587,Employee Generated,"(0, 0)"
562433,101001373592,05/08/2015 03:34:00 PM,05/15/2015 03:35:07 PM,05/08/2015 03:36:12 PM,ONTIME,Closed,Case Closed. Closed date : 2015-05-08 15:36:12.73 Case Resolved done 4-24-15,Equipment Repair,Parks & Recreation Department,Park Maintenance & Safety,Equipment Repair,PARK_Maintenance_Trades,PARK,,,960 Dorchester Ave  Dorchester  MA  02125,7.0,03,3.0,C11,Dorchester,7.0,13,1307.0,,960 Dorchester Ave,2125.0,Address,342630.0,42.3594,-71.0587,Employee Generated,"(0, 0)"
562434,101001373594,05/08/2015 03:37:00 PM,05/15/2015 03:37:37 PM,05/08/2015 03:39:49 PM,ONTIME,Closed,Case Closed. Closed date : 2015-05-08 15:39:49.94 Case Resolved,Equipment Repair,Parks & Recreation Department,Park Maintenance & Safety,Equipment Repair,PARK_Maintenance_Trades,PARK,,,960 Dorchester Ave  Dorchester  MA  02125,7.0,03,3.0,C11,Dorchester,7.0,13,1307.0,,960 Dorchester Ave,2125.0,Address,342630.0,42.3594,-71.0587,Employee Generated,"(0, 0)"
562437,101001373599,05/08/2015 03:41:40 PM,05/15/2015 03:41:49 PM,05/08/2015 03:43:46 PM,ONTIME,Closed,Case Closed. Closed date : 2015-05-08 15:43:46.083 Case Resolved done,Equipment Repair,Parks & Recreation Department,Park Maintenance & Safety,Equipment Repair,PARK_Maintenance_Trades,PARK,,,960 Dorchester Ave  Dorchester  MA  02125,7.0,03,3.0,C11,Dorchester,7.0,13,1307.0,,960 Dorchester Ave,2125.0,Address,342630.0,42.3594,-71.0587,Employee Generated,"(0, 0)"
562439,101001373602,05/08/2015 03:44:00 PM,05/15/2015 03:44:32 PM,05/08/2015 03:46:18 PM,ONTIME,Closed,Case Closed. Closed date : 2015-05-08 15:46:18.487 Case Resolved,Equipment Repair,Parks & Recreation Department,Park Maintenance & Safety,Equipment Repair,PARK_Maintenance_Trades,PARK,,,960 Dorchester Ave  Dorchester  MA  02125,7.0,03,3.0,C11,Dorchester,7.0,13,1307.0,,960 Dorchester Ave,2125.0,Address,342630.0,42.3594,-71.0587,Employee Generated,"(0, 0)"
562443,101001373606,05/08/2015 03:48:00 PM,05/15/2015 03:48:40 PM,05/08/2015 03:50:15 PM,ONTIME,Closed,Case Closed. Closed date : 2015-05-08 15:50:15.717 Case Resolved done,Equipment Repair,Parks & Recreation Department,Park Maintenance & Safety,Equipment Repair,PARK_Maintenance_Trades,PARK,,,960 Dorchester Ave  Dorchester  MA  02125,7.0,03,3.0,C11,Dorchester,7.0,13,1307.0,,960 Dorchester Ave,2125.0,Address,342630.0,42.3594,-71.0587,Employee Generated,"(0, 0)"
562445,101001373610,05/08/2015 03:51:00 PM,05/15/2015 03:51:52 PM,05/08/2015 03:53:54 PM,ONTIME,Closed,Case Closed. Closed date : 2015-05-08 15:53:54.57 Case Resolved done,Equipment Repair,Parks & Recreation Department,Park Maintenance & Safety,Equipment Repair,PARK_Maintenance_Trades,PARK,,,960 Dorchester Ave  Dorchester  MA  02125,7.0,03,3.0,C11,Dorchester,7.0,13,1307.0,,960 Dorchester Ave,2125.0,Address,342630.0,42.3594,-71.0587,Employee Generated,"(0, 0)"
562449,101001373613,05/08/2015 03:54:00 PM,05/15/2015 03:54:40 PM,05/08/2015 03:56:24 PM,ONTIME,Closed,Case Closed. Closed date : 2015-05-08 15:56:24.47 Case Resolved,Equipment Repair,Parks & Recreation Department,Park Maintenance & Safety,Equipment Repair,PARK_Maintenance_Trades,PARK,,,960 Dorchester Ave  Dorchester  MA  02125,7.0,03,3.0,C11,Dorchester,7.0,13,1307.0,,960 Dorchester Ave,2125.0,Address,342630.0,42.3594,-71.0587,Employee Generated,"(0, 0)"
562451,101001373617,05/08/2015 04:00:00 PM,05/15/2015 04:00:55 PM,05/08/2015 04:02:37 PM,ONTIME,Closed,Case Closed. Closed date : 2015-05-08 16:02:37.293 Case Resolved,Equipment Repair,Parks & Recreation Department,Park Maintenance & Safety,Equipment Repair,PARK_Maintenance_Trades,PARK,,,960 Dorchester Ave  Dorchester  MA  02125,7.0,03,3.0,C11,Dorchester,7.0,13,1307.0,,960 Dorchester Ave,2125.0,Address,342630.0,42.3594,-71.0587,Employee Generated,"(0, 0)"
562457,101001373623,05/08/2015 04:06:00 PM,05/15/2015 04:06:23 PM,05/08/2015 04:13:01 PM,ONTIME,Closed,Case Closed. Closed date : 2015-05-08 16:13:01.623 Case Resolved,Equipment Repair,Parks & Recreation Department,Park Maintenance & Safety,Equipment Repair,PARK_Maintenance_Trades,PARK,,,960 Dorchester Ave  Dorchester  MA  02125,7.0,03,3.0,C11,Dorchester,7.0,13,1307.0,,960 Dorchester Ave,2125.0,Address,342630.0,42.3594,-71.0587,Employee Generated,"(0, 0)"
562459,101001373626,05/08/2015 04:13:00 PM,05/15/2015 04:13:51 PM,05/08/2015 04:15:55 PM,ONTIME,Closed,Case Closed. Closed date : 2015-05-08 16:15:55.9 Case Resolved,Equipment Repair,Parks & Recreation Department,Park Maintenance & Safety,Equipment Repair,PARK_Maintenance_Trades,PARK,,,960 Dorchester Ave  Dorchester  MA  02125,7.0,03,3.0,C11,Dorchester,7.0,13,1307.0,,960 Dorchester Ave,2125.0,Address,342630.0,42.3594,-71.0587,Employee Generated,"(0, 0)"
562641,101001373894,05/09/2015 03:39:00 PM,05/18/2015 08:30:00 AM,05/13/2015 10:01:29 AM,ONTIME,Closed,Case Closed. Closed date : 2015-05-13 10:01:29.083 Case Resolved done,Equipment Repair,Parks & Recreation Department,Park Maintenance & Safety,Equipment Repair,PARK_Maintenance_Trades,PARK,,,369 Lagrange St  West Roxbury  MA  02132,12.0,06,6.0,E5,West Roxbury,12.0,20,2014.0,E,369 Lagrange St,2132.0,Address,166825.0,42.2803,-71.1569,Constituent Call,"(42.2803, -71.1569)"
562886,101001374315,05/11/2015 08:23:00 AM,05/18/2015 08:30:00 AM,10/22/2015 11:14:21 AM,OVERDUE,Closed,Case Closed. Closed date : 2015-10-22 11:14:21.357 Case Noted trades division reports the company that supplies the parts has gone out of business  play equipment slide will be repaired at a later time,Equipment Repair,Parks & Recreation Department,Park Maintenance & Safety,Equipment Repair,PARK_Maintenance_Trades,PARK,,,INTERSECTION of Guild St & Millmont St  Roxbury  MA,7.0,10B,7.0,B2,Roxbury,13.0,Ward 9,905.0,,INTERSECTION Guild St & Millmont St,,Intersection,5519.0,42.3273,-71.0901,Constituent Call,"(42.3273, -71.0901)"
562927,101001374386,05/11/2015 09:04:00 AM,05/18/2015 09:04:31 AM,05/15/2015 03:29:12 PM,ONTIME,Closed,Case Closed. Closed date : 2015-05-15 15:29:12.96 Case Resolved the crew searched all over for this and could not find it,Ground Maintenance: McConnell Park  Savin HIll Beach,Parks & Recreation Department,Park Maintenance & Safety,Equipment Repair,PARK_Maintenance_Region 2,PARK,,,30 Denny St  Dorchester  MA  02125,7.0,03,3.0,C11,Dorchester,7.0,13,1310.0,,30 Denny St,2125.0,Address,342516.0,42.3594,-71.0587,Constituent Call,"(0, 0)"
563169,101001374753,05/11/2015 01:07:00 PM,05/18/2015 01:07:31 PM,10/23/2015 01:27:39 PM,OVERDUE,Closed,Case Closed. Closed date : 2015-10-23 13:27:39.193 Duplicate of Existing Case,Equipment Repair,Parks & Recreation Department,Park Maintenance & Safety,Equipment Repair,PARK_Maintenance_Trades,PARK,,,930 Blue Hill Ave  Dorchester  MA  02124,8.0,07,4.0,B3,Dorchester,9.0,14,1410.0,,930 Blue Hill Ave,2124.0,Address,162200.0,42.2923,-71.0846,Employee Generated,"(42.2923, -71.0846)"
563172,101001374757,05/11/2015 01:09:07 PM,05/18/2015 01:09:27 PM,05/11/2015 01:10:09 PM,ONTIME,Closed,Case Closed. Closed date : 2015-05-11 13:10:09.077 Case Invalid,Equipment Repair,Parks & Recreation Department,Park Maintenance & Safety,Equipment Repair,PARK_Maintenance_Trades,PARK,,,930 Blue Hill Ave  Dorchester  MA  02124,8.0,07,4.0,B3,Dorchester,9.0,14,1410.0,,930 Blue Hill Ave,2124.0,Address,162200.0,42.2923,-71.0846,Employee Generated,"(42.2923, -71.0846)"
563308,101001374962,05/11/2015 03:48:00 PM,05/18/2015 03:48:06 PM,05/14/2015 11:02:37 AM,ONTIME,Closed,Case Closed. Closed date : 2015-05-14 11:02:37.897 Case Resolved,Equipment Repair,Parks & Recreation Department,Park Maintenance & Safety,Equipment Repair,PARK_Maintenance_Lighting Electrical,PARK,,,INTERSECTION of Salem St & Stillman St  Boston  MA,3.0,1B,1.0,A1,Downtown / Financial District,3.0,Ward 3,303.0,,INTERSECTION Salem St & Stillman St,,Intersection,8265.0,42.3636,-71.0559,Constituent Call,"(42.3636, -71.0559)"
563659,101001375468,05/12/2015 10:13:00 AM,05/19/2015 10:13:46 AM,05/14/2015 11:46:07 AM,ONTIME,Closed,Case Closed. Closed date : 2015-05-14 11:46:07.507 Case Resolved DONE 5-13-14,Equipment Repair,Parks & Recreation Department,Park Maintenance & Safety,Equipment Repair,PARK_Maintenance_Trades,PARK,,,1005 Washington St  Dorchester  MA  02124,8.0,07,3.0,B3,Dorchester,7.0,17,1704.0,,1005 Washington St,2124.0,Address,342680.0,42.3594,-71.0587,Constituent Call,"(0, 0)"
563680,101001375495,05/12/2015 10:27:00 AM,05/19/2015 10:27:29 AM,12/30/2015 04:07:56 PM,OVERDUE,Closed,Case Closed. Closed date : 2015-12-30 16:07:56.523 Case Resolved,Equipment Repair,Parks & Recreation Department,Park Maintenance & Safety,Equipment Repair,PARK_Park Improvement Requests,PARK,,,1005 Washington St  Dorchester  MA  02124,8.0,07,3.0,B3,Dorchester,7.0,17,1704.0,,1005 Washington St,2124.0,Address,342680.0,42.3594,-71.0587,Constituent Call,"(0, 0)"
563710,101001375541,05/12/2015 10:58:00 AM,05/19/2015 10:59:40 AM,05/14/2015 12:15:25 PM,ONTIME,Closed,Case Closed. Closed date : 2015-05-14 12:15:25.703 Case Resolved,Equipment Repair,Parks & Recreation Department,Park Maintenance & Safety,Equipment Repair,PARK_Maintenance_Trades,PARK,,,1005 Washington St  Dorchester  MA  02124,8.0,07,3.0,B3,Dorchester,7.0,17,1704.0,,1005 Washington St,2124.0,Address,342680.0,42.3594,-71.0587,Constituent Call,"(0, 0)"
563717,101001375551,05/12/2015 11:06:00 AM,05/19/2015 11:06:30 AM,05/14/2015 12:17:10 PM,ONTIME,Closed,Case Closed. Closed date : 2015-05-14 12:17:10.613 Case Resolved done,Equipment Repair,Parks & Recreation Department,Park Maintenance & Safety,Equipment Repair,PARK_Maintenance_Trades,PARK,,,1005 Washington St  Dorchester  MA  02124,8.0,07,3.0,B3,Dorchester,7.0,17,1704.0,,1005 Washington St,2124.0,Address,342680.0,42.3594,-71.0587,Employee Generated,"(0, 0)"
563761,101001375627,05/12/2015 11:56:00 AM,05/19/2015 11:56:28 AM,05/26/2015 03:20:02 PM,OVERDUE,Closed,Case Closed. Closed date : 2015-05-26 15:20:02.67 Case Resolved,Equipment Repair,Parks & Recreation Department,Park Maintenance & Safety,Equipment Repair,PARK_Maintenance_Trades,PARK,,,INTERSECTION of Martin Luther King Jr Blvd & Walnut Ave  Roxbury  MA,9.0,10B,7.0,B2,Roxbury,13.0,Ward 12,1205.0,,INTERSECTION Martin Luther King Jr Blvd & Walnut Ave,,Intersection,7119.0,42.32,-71.0886,Constituent Call,"(42.32, -71.0886)"
563938,101001375885,05/12/2015 03:14:00 PM,05/19/2015 03:14:53 PM,05/15/2015 02:46:21 PM,ONTIME,Closed,Case Closed. Closed date : 2015-05-15 14:46:21.64 Case Resolved done,Equipment Repair,Parks & Recreation Department,Park Maintenance & Safety,Equipment Repair,PARK_Maintenance_Trades,PARK,,,INTERSECTION of Playstead Rd & Springdale St  Dorchester  MA,7.0,03,3.0,C11,Dorchester,7.0,Ward 13,1310.0,,INTERSECTION Playstead Rd & Springdale St,,Intersection,7901.0,42.3092,-71.0519,Constituent Call,"(42.3092, -71.0519)"
563997,101001375969,05/12/2015 04:46:00 PM,05/19/2015 04:46:50 PM,05/14/2015 11:48:39 AM,ONTIME,Closed,Case Closed. Closed date : 2015-05-14 11:48:39.96 Case Resolved DONE,Equipment Repair,Parks & Recreation Department,Park Maintenance & Safety,Equipment Repair,PARK_Maintenance_Trades,PARK,,,INTERSECTION of Atlantic Ave & Cross St  Boston  MA,3.0,1B,1.0,A1,Downtown / Financial District,3.0,Ward 3,301.0,,INTERSECTION Atlantic Ave & Cross St,,Intersection,735.0,42.361,-71.0526,Constituent Call,"(42.361, -71.0526)"
564069,101001376075,05/12/2015 07:54:00 PM,05/20/2015 08:30:00 AM,05/14/2015 11:47:35 AM,ONTIME,Closed,Case Closed. Closed date : 2015-05-14 11:47:35.927 Case Noted WATER SHUT OFF,Equipment Repair,Parks & Recreation Department,Park Maintenance & Safety,Equipment Repair,PARK_Maintenance_Trades,PARK,,,INTERSECTION of Fleet St & Milton St  Hyde Park  MA,12.0,08,5.0,E18,Hyde Park,10.0,Ward 18,1820.0,,INTERSECTION Fleet St & Milton St,,Intersection,4949.0,42.2387,-71.1349,Constituent Call,"(42.2387, -71.1349)"
564387,101001376522,05/13/2015 11:07:00 AM,05/20/2015 11:07:43 AM,05/15/2015 02:50:01 PM,ONTIME,Closed,Case Closed. Closed date : 2015-05-15 14:50:01.893 Case Resolved,Equipment Repair,Parks & Recreation Department,Park Maintenance & Safety,Equipment Repair,PARK_Maintenance_Trades,PARK,,,260 Highland St  Roxbury  MA  02119,9.0,10B,7.0,B2,Roxbury,13.0,11,1101.0,E,260 Highland St,2119.0,Address,73748.0,42.3228,-71.0962,Employee Generated,"(42.3228, -71.0962)"
564393,101001376530,05/13/2015 11:11:00 AM,05/20/2015 11:11:37 AM,05/18/2015 04:40:17 PM,ONTIME,Closed,Case Closed. Closed date : 2015-05-18 16:40:17.41 Case Resolved,Equipment Repair,Parks & Recreation Department,Park Maintenance & Safety,Equipment Repair,PARK_Maintenance_Trades,PARK,,,21 Danube St  Dorchester  MA  02125,7.0,03,7.0,B2,Dorchester,13.0,13,1301.0,,21 Danube St,2125.0,Address,342690.0,42.3594,-71.0587,Employee Generated,"(0, 0)"
564483,101001376661,05/13/2015 12:52:00 PM,05/20/2015 12:52:23 PM,,OVERDUE,Open,,Equipment Repair,Parks & Recreation Department,Park Maintenance & Safety,Equipment Repair,PARK_Maintenance_Trades,PARK,,,50 Myrtle St  Boston  MA  02114,3.0,1B,8.0,A1,Boston,14.0,5,503.0,,50 Myrtle St,2114.0,Address,342540.0,42.3594,-71.0587,Employee Generated,"(0, 0)"
564492,101001376675,05/13/2015 01:02:00 PM,05/20/2015 01:02:42 PM,05/21/2015 06:54:32 AM,OVERDUE,Closed,Case Closed. Closed date : 2015-05-21 06:54:32.62 Case Resolved chains painted,Equipment Repair,Parks & Recreation Department,Park Maintenance & Safety,Equipment Repair,PARK_Maintenance_Trades,PARK,,,50 Myrtle St  Boston  MA  02114,3.0,1B,8.0,A1,Boston,14.0,5,503.0,,50 Myrtle St,2114.0,Address,342540.0,42.3594,-71.0587,Employee Generated,"(0, 0)"
564775,101001377081,05/13/2015 11:22:00 PM,05/21/2015 08:30:00 AM,05/19/2015 10:31:46 AM,ONTIME,Closed,Case Closed. Closed date : 2015-05-19 10:31:46.587 Case Resolved,Equipment Repair: Ronan Park,Parks & Recreation Department,Park Maintenance & Safety,Equipment Repair,PARK_Maintenance_Trades,PARK,,,,,,,,,,,,,,,,,42.3594,-71.0587,Self Service,"(0, 0)"
564868,101001377207,05/14/2015 08:12:00 AM,05/21/2015 08:30:00 AM,05/27/2015 11:05:19 AM,OVERDUE,Closed,Case Closed. Closed date : 2015-05-27 11:05:19.257 Case Resolved Swing was repaired.,Equipment Repair,Parks & Recreation Department,Park Maintenance & Safety,Equipment Repair,PARK_Maintenance_Trades,PARK,,,35 Portsmouth St  Brighton  MA  02135,11.0,04,9.0,D14,Brighton,15.0,22,2205.0,,35 Portsmouth St,2135.0,Address,344497.0,42.3594,-71.0587,Employee Generated,"(0, 0)"
564882,101001377227,05/14/2015 08:26:00 AM,05/21/2015 08:30:00 AM,05/15/2015 02:38:33 PM,ONTIME,Closed,Case Closed. Closed date : 2015-05-15 14:38:33.01 Case Resolved done 5-14-15,Equipment Repair,Parks & Recreation Department,Park Maintenance & Safety,Equipment Repair,PARK_Maintenance_Trades,PARK,,,110 Atlantic Ave  Boston  MA  02110,3.0,1B,1.0,A1,Boston,3.0,3,301.0,,110 Atlantic Ave,2110.0,Address,161702.0,42.361,-71.0522,Employee Generated,"(42.361, -71.0522)"
565041,101001377453,05/14/2015 11:05:00 AM,05/21/2015 11:05:36 AM,05/22/2015 06:11:08 AM,OVERDUE,Closed,Case Closed. Closed date : 2015-05-22 06:11:08.98 Case Resolved drinking fountain clean,Equipment Repair,Parks & Recreation Department,Park Maintenance & Safety,Equipment Repair,PARK_Maintenance_Trades,PARK,,,150 Martin Luther King Jr Blvd  Roxbury  MA  02119,9.0,10B,7.0,B2,Roxbury,13.0,12,1203.0,,150 Martin Luther King Jr Blvd,2119.0,Address,342513.0,42.3594,-71.0587,Constituent Call,"(0, 0)"
565218,101001377685,05/14/2015 02:29:00 PM,05/21/2015 02:29:51 PM,05/18/2015 04:37:31 PM,ONTIME,Closed,Case Closed. Closed date : 2015-05-18 16:37:31.87 Case Resolved done,Equipment Repair,Parks & Recreation Department,Park Maintenance & Safety,Equipment Repair,PARK_Maintenance_Trades,PARK,,,75 W Newton St  Roxbury  MA  02118,4.0,1C,2.0,D4,Roxbury,6.0,9,901.0,E,75 W Newton St,2118.0,Address,102644.0,42.3407,-71.0753,Employee Generated,"(42.3407, -71.0753)"
565225,101001377695,05/14/2015 02:38:00 PM,05/21/2015 02:38:53 PM,10/22/2015 11:06:13 AM,OVERDUE,Closed,Case Closed. Closed date : 2015-10-22 11:06:13.547 Case Noted company that supplies parts are out of business,Equipment Repair,Parks & Recreation Department,Park Maintenance & Safety,Equipment Repair,PARK_Maintenance_Trades,PARK,,,127-129 Howard Ave  Dorchester  MA  02125,7.0,03,7.0,B2,Roxbury,13.0,13,1301.0,E,127-129 Howard Ave,2125.0,Address,75500.0,42.3159,-71.0757,Employee Generated,"(42.3159, -71.0757)"
565228,101001377703,05/14/2015 02:54:00 PM,05/21/2015 02:57:43 PM,05/18/2015 04:38:05 PM,ONTIME,Closed,Case Closed. Closed date : 2015-05-18 16:38:05.367 Case Resolved done,Equipment Repair,Parks & Recreation Department,Park Maintenance & Safety,Equipment Repair,PARK_Maintenance_Trades,PARK,,,,,,,,,,,,,,,,,42.3594,-71.0587,Employee Generated,"(0, 0)"
565273,101001377754,05/14/2015 03:46:00 PM,05/21/2015 03:46:28 PM,06/05/2015 02:49:50 PM,OVERDUE,Closed,Case Closed. Closed date : 2015-06-05 14:49:50.227 Case Resolved done,Equipment Repair,Parks & Recreation Department,Park Maintenance & Safety,Equipment Repair,PARK_Maintenance_Trades,PARK,,,345 Walnut Ave  Roxbury  MA  02119,9.0,10B,7.0,E13,Roxbury,13.0,11,1103.0,,345 Walnut Ave,2119.0,Address,342534.0,42.3594,-71.0587,Constituent Call,"(0, 0)"
565288,101001377776,05/14/2015 04:06:27 PM,05/21/2015 04:06:47 PM,05/14/2015 04:15:57 PM,ONTIME,Closed,Case Closed. Closed date : 2015-05-14 16:15:57.003 Case Resolved,Equipment Repair,Parks & Recreation Department,Park Maintenance & Safety,Equipment Repair,PARK_Maintenance_Trades,PARK,,,,,,,,,,,,,,,,,42.3594,-71.0587,Employee Generated,"(0, 0)"
565519,101001378102,05/15/2015 09:07:00 AM,05/22/2015 09:07:35 AM,05/18/2015 04:41:13 PM,ONTIME,Closed,Case Closed. Closed date : 2015-05-18 16:41:13.42 Case Resolved,Equipment Repair,Parks & Recreation Department,Park Maintenance & Safety,Equipment Repair,PARK_Maintenance_Trades,PARK,,,21 Phillips St  Boston  MA  02114,3.0,1B,8.0,A1,Boston,14.0,5,504.0,,21 Phillips St,2114.0,Address,342572.0,42.3594,-71.0587,Employee Generated,"(0, 0)"
565587,101001378205,05/15/2015 10:14:00 AM,05/22/2015 10:14:48 AM,06/01/2015 07:28:58 AM,OVERDUE,Closed,Case Closed. Closed date : 2015-06-01 07:28:58.39 Case Resolved install new hoop,Equipment Repair,Parks & Recreation Department,Park Maintenance & Safety,Equipment Repair,PARK_Maintenance_Trades,PARK,,,380  Faneuil St  Brighton  MA  02135,11.0,04,9.0,D14,Brighton,15.0,22,2207.0,,380  Faneuil St,2135.0,Address,342467.0,42.3594,-71.0587,Employee Generated,"(0, 0)"
565595,101001378218,05/15/2015 10:23:00 AM,05/22/2015 10:23:28 AM,05/20/2015 03:09:20 PM,ONTIME,Closed,Case Closed. Closed date : 2015-05-20 15:09:20.693 Case Resolved,Equipment Repair,Parks & Recreation Department,Park Maintenance & Safety,Equipment Repair,PARK_Maintenance_Trades,PARK,,,1511 Commonwealth Ave  Brighton  MA  02135,11.0,04,9.0,D14,Brighton,15.0,21,2109.0,,1511 Commonwealth Ave,2135.0,Address,342377.0,42.3594,-71.0587,Employee Generated,"(0, 0)"
565603,101001378254,05/15/2015 10:35:00 AM,05/22/2015 10:55:20 AM,05/27/2015 11:06:03 AM,OVERDUE,Closed,Case Closed. Closed date : 2015-05-27 11:06:03.367 Case Resolved Gate was repaired.,Equipment Repair,Parks & Recreation Department,Park Maintenance & Safety,Equipment Repair,PARK_Maintenance_Trades,PARK,,,1511 Commonwealth Ave  Brighton  MA  02135,11.0,04,9.0,D14,Brighton,15.0,21,2109.0,,1511 Commonwealth Ave,2135.0,Address,342377.0,42.3594,-71.0587,Employee Generated,"(0, 0)"
565661,101001378316,05/15/2015 11:34:00 AM,05/22/2015 11:34:41 AM,05/27/2015 11:21:02 AM,OVERDUE,Closed,Case Closed. Closed date : 2015-05-27 11:21:02.967 Case Resolved Signs were installed.,Equipment Repair,Parks & Recreation Department,Park Maintenance & Safety,Equipment Repair,PARK_Maintenance_Trades,PARK,,,10 Brigham St  East Boston  MA  02128,1.0,09,1.0,A7,East Boston,1.0,1,101.0,E,10 Brigham St,2128.0,Address,341453.0,42.3594,-71.0587,Employee Generated,"(0, 0)"
565672,101001378331,05/15/2015 11:46:00 AM,05/22/2015 11:46:16 AM,05/20/2015 03:12:22 PM,ONTIME,Closed,Case Closed. Closed date : 2015-05-20 15:12:22.637 Case Resolved,Equipment Repair,Parks & Recreation Department,Park Maintenance & Safety,Equipment Repair,PARK_Maintenance_Trades,PARK,,,125 Erie St  Dorchester  MA  02121,7.0,03,4.0,B3,Dorchester,13.0,14,1403.0,,125 Erie St,2121.0,Address,342356.0,42.3594,-71.0587,Employee Generated,"(0, 0)"
565699,101001378374,05/15/2015 12:10:00 PM,05/22/2015 12:10:17 PM,06/01/2015 07:30:34 AM,OVERDUE,Closed,Case Closed. Closed date : 2015-06-01 07:30:34.39 Case Resolved paint drinking fountain,Equipment Repair,Parks & Recreation Department,Park Maintenance & Safety,Equipment Repair,PARK_Maintenance_Trades,PARK,,,4 Charles St  Boston  MA  02108,3.0,1C,8.0,A1,Boston,14.0,5,503.0,,4 Charles St,2108.0,Address,342578.0,42.3594,-71.0587,Employee Generated,"(0, 0)"
565716,101001378406,05/15/2015 12:34:00 PM,05/22/2015 12:34:50 PM,,OVERDUE,Open,,Equipment Repair: --Not in list--,Parks & Recreation Department,Park Maintenance & Safety,Equipment Repair,PARK_Park Improvement Requests,PARK,,,,,,,,,,,,,,,,,42.3594,-71.0587,Self Service,"(0, 0)"
565730,101001378434,05/15/2015 01:01:00 PM,05/22/2015 01:01:25 PM,,OVERDUE,Open,,Equipment Repair,Parks & Recreation Department,Park Maintenance & Safety,Equipment Repair,PARK_Maintenance_Trades,PARK,,,10 Ringgold St  Roxbury  MA  02118,4.0,1C,2.0,D4,Roxbury,4.0,3,307.0,,10 Ringgold St,2118.0,Address,342013.0,42.3594,-71.0587,Employee Generated,"(0, 0)"
565737,101001378443,05/15/2015 01:05:06 PM,05/22/2015 01:08:55 PM,05/15/2015 01:36:53 PM,ONTIME,Closed,Case Closed Case Resolved,Equipment Repair,Parks & Recreation Department,Park Maintenance & Safety,Equipment Repair,PARK_Maintenance_Trades,PARK,,,55 Malcolm X Blvd  Mission Hill  MA  02120,9.0,10B,7.0,B2,Mission Hill,13.0,09,905.0,E,55 Malcolm X Blvd,2120.0,Address,88754.0,42.3316,-71.0895,Employee Generated,"(42.3316, -71.0895)"
565761,101001378468,05/15/2015 01:39:00 PM,05/22/2015 01:39:56 PM,07/09/2015 04:11:57 PM,OVERDUE,Closed,Case Closed. Closed date : 2015-07-09 16:11:57.903 Case Resolved,Equipment Repair,Parks & Recreation Department,Park Maintenance & Safety,Equipment Repair,PARK_Maintenance_Trades,PARK,,,55 Malcolm X Blvd  Mission Hill  MA  02120,9.0,10B,7.0,B2,Mission Hill,13.0,09,905.0,E,55 Malcolm X Blvd,2120.0,Address,88754.0,42.3316,-71.0895,Employee Generated,"(42.3316, -71.0895)"
565782,101001378498,05/15/2015 02:06:00 PM,05/22/2015 02:07:06 PM,05/27/2015 11:32:17 AM,OVERDUE,Closed,Case Closed. Closed date : 2015-05-27 11:32:17.39 Case Noted New basketball rim was installed.,Equipment Repair,Parks & Recreation Department,Park Maintenance & Safety,Equipment Repair,PARK_Maintenance_Trades,PARK,,,239 Parker Hill Ave  Mission Hill  MA  02120,9.0,10A,8.0,B2,Mission Hill,14.0,10,1005.0,,239 Parker Hill Ave,2120.0,Address,342517.0,42.3594,-71.0587,Employee Generated,"(0, 0)"
566484,101001379512,05/18/2015 09:38:56 AM,05/26/2015 09:38:56 AM,,OVERDUE,Open,,Equipment Repair: Buckley Playground,Parks & Recreation Department,Park Maintenance & Safety,Equipment Repair,PARK_Maintenance_Trades,PARK,,,,,,,,,,,,,,,,,42.3594,-71.0587,Self Service,"(0, 0)"
566525,101001379571,05/18/2015 10:16:00 AM,05/26/2015 10:16:41 AM,05/27/2015 11:09:53 AM,OVERDUE,Closed,Case Closed. Closed date : 2015-05-27 11:09:53.823 Case Resolved Barrels were powerwashed.,Equipment Repair,Parks & Recreation Department,Park Maintenance & Safety,Equipment Repair,PARK_Maintenance_Trades,PARK,,,139 Tremont St  Boston  MA  02108,3.0,1C,8.0,A1,Beacon Hill,14.0,05,503.0,E,139 Tremont St,2108.0,Address,341542.0,42.3554,-71.0638,Employee Generated,"(42.3554, -71.0638)"
566532,101001379584,05/18/2015 10:21:00 AM,05/26/2015 10:21:52 AM,05/26/2015 03:29:15 PM,OVERDUE,Closed,Case Closed. Closed date : 2015-05-26 15:29:15.727 Case Resolved done,Equipment Repair,Parks & Recreation Department,Park Maintenance & Safety,Equipment Repair,PARK_Maintenance_Trades,PARK,,,58 Wachusett St  Jamaica Plain  MA  02130,12.0,02,6.0,E13,Jamaica Plain,10.0,19,1907.0,,58 Wachusett St,2130.0,Address,342566.0,42.3594,-71.0587,Employee Generated,"(0, 0)"
566581,101001379660,05/18/2015 11:06:00 AM,05/26/2015 11:06:37 AM,05/26/2015 03:27:52 PM,OVERDUE,Closed,Case Closed. Closed date : 2015-05-26 15:27:52.567 Case Resolved,Equipment Repair,Parks & Recreation Department,Park Maintenance & Safety,Equipment Repair,PARK_Maintenance_Trades,PARK,,,85 Harold St  Roxbury  MA  02119,9.0,10B,7.0,B2,Roxbury,13.0,12,1208.0,E,85 Harold St,2119.0,Address,341993.0,42.3594,-71.0587,Employee Generated,"(0, 0)"
566587,101001379667,05/18/2015 11:10:00 AM,05/26/2015 11:10:34 AM,05/26/2015 03:28:21 PM,OVERDUE,Closed,Case Closed. Closed date : 2015-05-26 15:28:21.56 Case Resolved,Equipment Repair,Parks & Recreation Department,Park Maintenance & Safety,Equipment Repair,PARK_Maintenance_Trades,PARK,,,70 Park Dr  Boston  MA  02215,4.0,10A,8.0,D4,Fenway / Kenmore / Audubon Circle / Longwood,14.0,05,502.0,E,70 Park Dr,2215.0,Address,342000.0,42.3594,-71.0587,Employee Generated,"(0, 0)"
566677,101001379790,05/18/2015 12:36:00 PM,05/26/2015 12:36:22 PM,05/27/2015 11:22:53 AM,OVERDUE,Closed,Case Closed. Closed date : 2015-05-27 11:22:53.09 Case Resolved Big belly barrel was repaired.,Equipment Repair,Parks & Recreation Department,Park Maintenance & Safety,Equipment Repair,PARK_Maintenance_Trades,PARK,,,25 Glendon St  East Boston  MA  02128,1.0,09,1.0,A7,East Boston,1.0,1,109.0,E,25 Glendon St,2128.0,Address,341999.0,42.3594,-71.0587,Employee Generated,"(0, 0)"
566679,101001379794,05/18/2015 12:39:00 PM,05/26/2015 12:39:33 PM,05/21/2015 07:01:45 AM,ONTIME,Closed,Case Closed. Closed date : 2015-05-21 07:01:45.777 Case Resolved tolet fixed,Equipment Repair,Parks & Recreation Department,Park Maintenance & Safety,Equipment Repair,PARK_Maintenance_Trades,PARK,,,1 Jewish War Veterans Dr  Jamaica Plain  MA  02130,9.0,02,7.0,B2,Greater Mattapan,13.0,12,1207.0,E,1 Jewish War Veterans Dr,2130.0,Address,163434.0,42.301,-71.0886,Employee Generated,"(42.301, -71.0886)"
566709,101001379834,05/18/2015 01:03:00 PM,05/26/2015 01:04:01 PM,06/01/2015 06:29:49 AM,OVERDUE,Closed,Case Closed. Closed date : 2015-06-01 06:29:49.477 Case Resolved install new nets,Equipment Repair,Parks & Recreation Department,Park Maintenance & Safety,Equipment Repair,PARK_Maintenance_Trades,PARK,,,105 Ceylon St  Dorchester  MA  02121,7.0,03,4.0,B2,Dorchester,13.0,14,1401.0,,105 Ceylon St,2121.0,Address,342021.0,42.3594,-71.0587,Employee Generated,"(0, 0)"
566861,101001380063,05/18/2015 04:10:00 PM,05/26/2015 04:10:40 PM,05/27/2015 11:31:29 AM,OVERDUE,Closed,Case Closed. Closed date : 2015-05-27 11:31:29.343 Case Resolved Basketball rim was repaired.,Equipment Repair,Parks & Recreation Department,Park Maintenance & Safety,Equipment Repair,PARK_Maintenance_Trades,PARK,,,930 Blue Hill Ave  Dorchester  MA  02124,8.0,07,4.0,B3,Dorchester,9.0,14,1410.0,,930 Blue Hill Ave,2124.0,Address,162200.0,42.2923,-71.0846,Employee Generated,"(42.2923, -71.0846)"
566919,101001380145,05/18/2015 06:56:00 PM,05/27/2015 08:30:00 AM,05/21/2015 07:05:52 AM,ONTIME,Closed,Case Closed. Closed date : 2015-05-21 07:05:52.467 Case Resolved not parks dept bathroom,Equipment Repair,Parks & Recreation Department,Park Maintenance & Safety,Equipment Repair,PARK_Maintenance_Trades,PARK,,,529-543 Commercial St  Boston  MA  02109,3.0,1B,1.0,A1,Boston,3.0,3,302.0,E,529-543 Commercial St,2109.0,Address,36790.0,42.3688,-71.0562,Constituent Call,"(42.3688, -71.0562)"
567237,101001380607,05/19/2015 10:57:00 AM,05/27/2015 10:58:21 AM,05/27/2015 11:34:29 AM,OVERDUE,Closed,Case Closed. Closed date : 2015-05-27 11:34:29.263 Case Noted Graffiti was repaired.,Equipment Repair,Parks & Recreation Department,Park Maintenance & Safety,Equipment Repair,PARK_Maintenance_Trades,PARK,,,320 Walnut Ave  Dorchester  MA  02121,9.0,10B,7.0,B2,Dorchester,13.0,12,1208.0,,320 Walnut Ave,2121.0,Address,342035.0,42.3594,-71.0587,Employee Generated,"(0, 0)"
567238,101001380606,05/19/2015 10:57:00 AM,05/27/2015 10:57:38 AM,05/26/2015 03:14:34 PM,ONTIME,Closed,Case Closed. Closed date : 2015-05-26 15:14:34.01 Case Resolved done,Equipment Repair,Parks & Recreation Department,Park Maintenance & Safety,Equipment Repair,PARK_Maintenance_Trades,PARK,,,60 Smith St  Mission Hill  MA  02120,9.0,10A,8.0,B2,Mission Hill,14.0,10,1002.0,,60 Smith St,2120.0,Address,342526.0,42.3594,-71.0587,Employee Generated,"(0, 0)"
567355,101001380759,05/19/2015 01:32:00 PM,05/27/2015 01:32:11 PM,05/21/2015 07:06:52 AM,ONTIME,Closed,Case Closed. Closed date : 2015-05-21 07:06:52.29 Case Resolved remove graffiti,Equipment Repair,Parks & Recreation Department,Park Maintenance & Safety,Equipment Repair,PARK_Maintenance_Trades,PARK,,,25 Ripley Rd  Dorchester  MA  02121,7.0,03,4.0,B3,Dorchester,8.0,14,1402.0,E,25 Ripley Rd,2121.0,Address,341620.0,42.2993,-71.076,Constituent Call,"(42.2993, -71.076)"
567361,101001380768,05/19/2015 01:42:00 PM,05/27/2015 01:42:50 PM,05/27/2015 11:10:21 AM,ONTIME,Closed,Case Closed. Closed date : 2015-05-27 11:10:21.19 Case Resolved Drinking fountains were repaired.,Equipment Repair,Parks & Recreation Department,Park Maintenance & Safety,Equipment Repair,PARK_Maintenance_Trades,PARK,,,139 Tremont St  Boston  MA  02108,3.0,1C,8.0,A1,Beacon Hill,14.0,05,503.0,E,139 Tremont St,2108.0,Address,341542.0,42.3554,-71.0638,Employee Generated,"(42.3554, -71.0638)"
567371,101001380785,05/19/2015 02:04:00 PM,05/27/2015 02:04:55 PM,05/20/2015 08:40:20 AM,ONTIME,Closed,Case Closed. Closed date : 2015-05-20 08:40:20.767 Case Noted Contractor was notified by Superintendant.,Equipment Repair,Parks & Recreation Department,Park Maintenance & Safety,Equipment Repair,PARK_Maintenance_Trades,PARK,,,110 Atlantic Ave  Boston  MA  02110,3.0,1B,1.0,A1,Boston,3.0,3,301.0,,110 Atlantic Ave,2110.0,Address,161702.0,42.361,-71.0522,Constituent Call,"(42.361, -71.0522)"
567396,101001380820,05/19/2015 02:36:00 PM,05/27/2015 02:36:19 PM,06/19/2015 10:18:57 AM,OVERDUE,Closed,Case Closed. Closed date : 2015-06-19 10:18:57.277 Case Resolved Bleachers cleaned best we could June 19  2015. Bleachers need to be replaced. There was no mold that is moss.,Equipment Repair,Parks & Recreation Department,Park Maintenance & Safety,Equipment Repair,PARK_Maintenance_Region 4,PARK,,,379-381 Chestnut Hill Ave  Brighton  MA  02135,11.0,04,9.0,D14,Brighton,15.0,21,2116.0,,379-381 Chestnut Hill Ave,2135.0,Address,342018.0,42.3594,-71.0587,Constituent Call,"(0, 0)"
567622,101001381187,05/20/2015 06:59:00 AM,05/28/2015 08:30:00 AM,05/28/2015 06:16:14 AM,ONTIME,Closed,Case Closed. Closed date : 2015-05-28 06:16:14.32 Case Resolved paint court,Equipment Repair,Parks & Recreation Department,Park Maintenance & Safety,Equipment Repair,PARK_Maintenance_Trades,PARK,,,160 Florence St  Roslindale  MA  02131,12.0,02,5.0,E5,Roslindale,10.0,19,1913.0,E,160 Florence St,2131.0,Address,155813.0,42.2882,-71.1223,Employee Generated,"(42.2882, -71.1223)"
568090,101001381874,05/20/2015 04:12:00 PM,05/28/2015 04:12:48 PM,06/05/2015 02:14:04 PM,OVERDUE,Closed,Case Closed. Closed date : 2015-06-05 14:14:04.947 Case Resolved done 6-1-15,Equipment Repair,Parks & Recreation Department,Park Maintenance & Safety,Equipment Repair,PARK_Maintenance_Trades,PARK,,,38 Mendum St  Roslindale  MA  02131,9.0,06,5.0,E5,Roslindale,10.0,Ward 20,2004.0,R1,38 Mendum St,2131.0,Address,94202.0,42.292,-71.1296,Employee Generated,"(42.292, -71.1296)"
568114,101001381903,05/20/2015 04:51:00 PM,05/28/2015 04:51:35 PM,05/26/2015 03:25:02 PM,ONTIME,Closed,Case Closed. Closed date : 2015-05-26 15:25:02.48 Case Resolved,Equipment Repair,Parks & Recreation Department,Park Maintenance & Safety,Equipment Repair,PARK_Maintenance_Trades,PARK,,,38 Mendum St  Roslindale  MA  02131,9.0,06,5.0,E5,Roslindale,10.0,Ward 20,2004.0,R1,38 Mendum St,2131.0,Address,94202.0,42.292,-71.1296,Employee Generated,"(42.292, -71.1296)"
568154,101001381968,05/20/2015 06:59:00 PM,05/29/2015 08:30:00 AM,05/21/2015 07:14:13 AM,ONTIME,Closed,Case Closed. Closed date : 2015-05-21 07:14:13.913 Case Resolved bathroom not parks dept,Equipment Repair,Parks & Recreation Department,Park Maintenance & Safety,Equipment Repair,PARK_Maintenance_Trades,PARK,,,529-543 Commercial St  Boston  MA  02109,3.0,1B,1.0,A1,Boston,3.0,3,302.0,E,529-543 Commercial St,2109.0,Address,36790.0,42.3688,-71.0562,Constituent Call,"(42.3688, -71.0562)"
568319,101001382232,05/21/2015 09:18:00 AM,05/29/2015 09:18:32 AM,,OVERDUE,Open,,Equipment Repair,Parks & Recreation Department,Park Maintenance & Safety,Equipment Repair,PARK_Maintenance_Trades,PARK,,,195 Commonwealth Ave  Boston  MA  02116,4.0,1C,8.0,D4,Back Bay,14.0,Ward 5,508.0,A,195 Commonwealth Ave,2116.0,Address,216103.0,42.3516,-71.0807,Constituent Call,"(42.3516, -71.0807)"
568371,101001382308,05/21/2015 10:10:00 AM,05/29/2015 10:10:28 AM,06/01/2015 01:03:14 PM,OVERDUE,Closed,Case Closed. Closed date : 2015-06-01 13:03:14.547 Case Resolved weld gate,Equipment Repair: Commonwealth Ave.,Parks & Recreation Department,Park Maintenance & Safety,Equipment Repair,PARK_Maintenance_Trades,PARK,,,,,,,,,,,,,,,,,42.3594,-71.0587,Self Service,"(0, 0)"
568762,101001382944,05/22/2015 08:22:00 AM,06/01/2015 08:30:00 AM,06/01/2015 01:04:48 PM,OVERDUE,Closed,Case Closed. Closed date : 2015-06-01 13:04:48.073 Case Resolved remove plywood sign,Equipment Repair: Shubow Park,Parks & Recreation Department,Park Maintenance & Safety,Equipment Repair,PARK_Maintenance_Trades,PARK,,,,,,,,,,,,,,,,,42.3594,-71.0587,Self Service,"(0, 0)"
568819,101001383027,05/22/2015 09:10:52 AM,06/01/2015 09:10:52 AM,06/30/2015 06:16:53 AM,OVERDUE,Closed,Case Closed. Closed date : 2015-06-30 06:16:53.25 Case Resolved fix tire swing,Equipment Repair: --Not in list--,Parks & Recreation Department,Park Maintenance & Safety,Equipment Repair,PARK_Maintenance_Trades,PARK,,,,,,,,,,,,,,,,,42.3594,-71.0587,Self Service,"(0, 0)"
569386,101001393877,05/24/2015 08:49:00 AM,06/02/2015 08:30:00 AM,06/22/2015 01:50:15 PM,OVERDUE,Closed,Case Closed. Closed date : 2015-06-22 13:50:15.36 Case Resolved Hello:  This back in service.  Thank you  Camille,Equipment Repair,Parks & Recreation Department,Park Maintenance & Safety,Equipment Repair,INFO01_GenericeFormforOtherServiceRequestTypes,INFO,,,INTERSECTION of Charter St & Commercial St  Boston  MA,3.0,1B,1.0,A1,Downtown / Financial District,3.0,Ward 3,302.0,,INTERSECTION Charter St & Commercial St,,Intersection,2826.0,42.3682,-71.0567,Constituent Call,"(42.3682, -71.0567)"
569641,101001394261,05/25/2015 04:26:00 PM,06/02/2015 08:30:00 AM,06/05/2015 01:58:27 PM,OVERDUE,Closed,Case Closed. Closed date : 2015-06-05 13:58:27.277 Case Noted plumbers report nothing broken sprinkler working ok,Equipment Repair: McGann Playground,Parks & Recreation Department,Park Maintenance & Safety,Equipment Repair,PARK_Maintenance_Trades,PARK,,,,,,,,,,,,,,,,,42.3594,-71.0587,Self Service,"(0, 0)"
570035,101001394865,05/26/2015 12:39:00 PM,06/02/2015 12:39:41 PM,06/25/2015 10:03:08 AM,OVERDUE,Closed,Case Closed. Closed date : 2015-06-25 10:03:08.2 Case Resolved,Equipment Repair,Parks & Recreation Department,Park Maintenance & Safety,Equipment Repair,PARK_Maintenance_Trades,PARK,,,,,,,,,,,,,,,,,42.3594,-71.0587,Employee Generated,"(0, 0)"
570074,101001394915,05/26/2015 01:18:00 PM,06/02/2015 01:18:25 PM,06/05/2015 02:41:29 PM,OVERDUE,Closed,Case Closed. Closed date : 2015-06-05 14:41:29.78 Case Resolved done,Equipment Repair,Parks & Recreation Department,Park Maintenance & Safety,Equipment Repair,PARK_Maintenance_Trades,PARK,,,80 Union St  Brighton  MA  02135,11.0,04,9.0,D14,Brighton,15.0,21,2111.0,,80 Union St,2135.0,Address,342498.0,42.3594,-71.0587,Employee Generated,"(0, 0)"
570094,101001394940,05/26/2015 01:27:00 PM,06/02/2015 01:27:19 PM,06/01/2015 02:23:29 PM,ONTIME,Closed,Case Closed. Closed date : 2015-06-01 14:23:29.547 Case Resolved done,Equipment Repair,Parks & Recreation Department,Park Maintenance & Safety,Equipment Repair,PARK_Maintenance_Trades,PARK,,,138 Moreland St  Roxbury  MA  02119,7.0,03,7.0,B2,Roxbury,13.0,8,805.0,,138 Moreland St,2119.0,Address,342061.0,42.3594,-71.0587,Employee Generated,"(0, 0)"
570101,101001394951,05/26/2015 01:30:00 PM,06/02/2015 01:30:28 PM,06/11/2015 02:44:42 PM,OVERDUE,Closed,Case Closed. Closed date : 2015-06-11 14:44:42.373 Case Resolved remove fence,Equipment Repair,Parks & Recreation Department,Park Maintenance & Safety,Equipment Repair,PARK_Maintenance_Trades,PARK,,,55 Malcolm X Blvd  Mission Hill  MA  02120,9.0,10B,7.0,B2,Mission Hill,13.0,09,905.0,E,55 Malcolm X Blvd,2120.0,Address,88754.0,42.3316,-71.0895,Employee Generated,"(42.3316, -71.0895)"
570108,101001394962,05/26/2015 01:43:00 PM,06/02/2015 01:44:04 PM,06/01/2015 02:36:07 PM,ONTIME,Closed,Case Closed. Closed date : 2015-06-01 14:36:07.893 Case Resolved done,Equipment Repair,Parks & Recreation Department,Park Maintenance & Safety,Equipment Repair,PARK_Maintenance_Trades,PARK,,,81-87 Intervale St  Dorchester  MA  02121,7.0,03,4.0,B2,Roxbury,13.0,14,1401.0,,81-87 Intervale St,2121.0,Address,342024.0,42.3594,-71.0587,Employee Generated,"(0, 0)"
570112,101001394973,05/26/2015 01:52:00 PM,06/02/2015 01:53:09 PM,11/06/2015 10:43:08 AM,OVERDUE,Closed,Case Closed. Closed date : 2015-11-06 10:43:08.737 Case Resolved done 11-5-15,Equipment Repair,Parks & Recreation Department,Park Maintenance & Safety,Equipment Repair,PARK_Maintenance_Trades,PARK,,,56 Dunbar Ave  Dorchester  MA  02124,8.0,07,4.0,B3,Dorchester,9.0,17,1708.0,,56 Dunbar Ave,2124.0,Address,342601.0,42.3594,-71.0587,Employee Generated,"(0, 0)"
570179,101001395056,05/26/2015 03:03:00 PM,06/02/2015 03:03:52 PM,06/15/2015 02:16:42 PM,OVERDUE,Closed,Case Closed. Closed date : 2015-06-15 14:16:42.063 Case Resolved,Equipment Repair,Parks & Recreation Department,Park Maintenance & Safety,Equipment Repair,PARK_Maintenance_Trades,PARK,,,,,,,,,,,,,,,,,42.3594,-71.0587,Constituent Call,"(0, 0)"
570242,101001395146,05/26/2015 03:35:00 PM,06/02/2015 03:36:01 PM,06/01/2015 01:10:50 PM,ONTIME,Closed,Case Closed. Closed date : 2015-06-01 13:10:50.227 Case Resolved no sink hole found,Equipment Repair,Parks & Recreation Department,Park Maintenance & Safety,Equipment Repair,PARK_Maintenance_Trades,PARK,,,,,,,,,,,,,,,,,42.3594,-71.0587,Constituent Call,"(0, 0)"
570262,101001395157,05/26/2015 03:39:00 PM,06/02/2015 03:39:15 PM,06/01/2015 01:11:39 PM,ONTIME,Closed,Case Closed. Closed date : 2015-06-01 13:11:39.813 Case Resolved replace hoop,Equipment Repair,Parks & Recreation Department,Park Maintenance & Safety,Equipment Repair,PARK_Maintenance_Trades,PARK,,,239 Parker Hill Ave  Mission Hill  MA  02120,9.0,10A,8.0,B2,Mission Hill,14.0,10,1005.0,,239 Parker Hill Ave,2120.0,Address,342517.0,42.3594,-71.0587,Employee Generated,"(0, 0)"
570264,101001395165,05/26/2015 03:42:00 PM,06/02/2015 03:42:50 PM,06/01/2015 01:13:04 PM,ONTIME,Closed,Case Closed. Closed date : 2015-06-01 13:13:04.593 Case Resolved remove graffiti,Equipment Repair,Parks & Recreation Department,Park Maintenance & Safety,Equipment Repair,PARK_Maintenance_Trades,PARK,,,239 Parker Hill Ave  Mission Hill  MA  02120,9.0,10A,8.0,B2,Mission Hill,14.0,10,1005.0,,239 Parker Hill Ave,2120.0,Address,342517.0,42.3594,-71.0587,Employee Generated,"(0, 0)"
570267,101001395170,05/26/2015 03:45:00 PM,06/02/2015 03:45:30 PM,06/22/2015 04:14:14 PM,OVERDUE,Closed,Case Closed. Closed date : 2015-06-22 16:14:14.29 Case Resolved,Equipment Repair,Parks & Recreation Department,Park Maintenance & Safety,Equipment Repair,PARK_Maintenance_Trades,PARK,,,14 Jeffries St  East Boston  MA  02128,1.0,09,1.0,A7,East Boston,1.0,01,101.0,,14 Jeffries St,2128.0,Address,344483.0,42.3594,-71.0587,Employee Generated,"(0, 0)"
570274,101001395178,05/26/2015 03:50:00 PM,06/02/2015 03:50:37 PM,06/22/2015 04:26:37 PM,OVERDUE,Closed,Case Closed. Closed date : 2015-06-22 16:26:37.387 Case Resolved,Equipment Repair,Parks & Recreation Department,Park Maintenance & Safety,Equipment Repair,PARK_Maintenance_Trades,PARK,,,544P Massachusetts Ave  Roxbury  MA  02118,7.0,1C,7.0,D4,Roxbury,13.0,9,903.0,,544P Massachusetts Ave,2118.0,Address,342023.0,42.3594,-71.0587,Employee Generated,"(0, 0)"
570280,101001395188,05/26/2015 03:55:00 PM,06/02/2015 03:56:06 PM,06/11/2015 02:46:12 PM,OVERDUE,Closed,Case Closed. Closed date : 2015-06-11 14:46:12.663 Case Resolved fixed,Equipment Repair,Parks & Recreation Department,Park Maintenance & Safety,Equipment Repair,PARK_Maintenance_Trades,PARK,,,370 Hanover St  Boston  MA  02113,3.0,1B,1.0,A1,Downtown / Financial District,3.0,03,301.0,,370 Hanover St,2113.0,Address,342568.0,42.3594,-71.0587,Employee Generated,"(0, 0)"
570542,101001395507,05/27/2015 07:57:00 AM,06/03/2015 08:30:00 AM,06/01/2015 02:38:19 PM,ONTIME,Closed,Case Closed. Closed date : 2015-06-01 14:38:19.15 Case Resolved done,Equipment Repair,Parks & Recreation Department,Park Maintenance & Safety,Equipment Repair,PARK_Maintenance_Trades,PARK,,,557 Massachusetts Ave  Roxbury  MA  02118,7.0,10B,7.0,D4,Roxbury,13.0,Ward 9,903.0,CM,557 Massachusetts Ave,2118.0,Address,92393.0,42.3377,-71.0793,Constituent Call,"(42.3377, -71.0793)"
570668,101001395719,05/27/2015 10:33:00 AM,06/03/2015 10:33:48 AM,07/15/2015 10:00:30 AM,OVERDUE,Closed,Case Closed. Closed date : 2015-07-15 10:00:30.067 Case Resolved,Equipment Repair,Parks & Recreation Department,Park Maintenance & Safety,Equipment Repair,PARK_Maintenance_Trades,PARK,,,72 Dale St  Roxbury  MA  02119,9.0,10B,7.0,B2,Roxbury,13.0,12,1203.0,R3,72 Dale St,2119.0,Address,45756.0,42.3214,-71.0864,Employee Generated,"(42.3214, -71.0864)"
570676,101001395729,05/27/2015 10:37:00 AM,06/03/2015 10:39:18 AM,06/11/2015 02:47:22 PM,OVERDUE,Closed,Case Closed. Closed date : 2015-06-11 14:47:22.173 Case Resolved remove graffiti,Equipment Repair,Parks & Recreation Department,Park Maintenance & Safety,Equipment Repair,PARK_Maintenance_Trades,PARK,,,221 Roxbury St  Roxbury  MA  02119,7.0,10B,7.0,B2,Roxbury,13.0,9,905.0,,221 Roxbury St,2119.0,Address,342482.0,42.3594,-71.0587,Employee Generated,"(0, 0)"
570754,101001395843,05/27/2015 11:35:00 AM,06/03/2015 11:35:58 AM,07/31/2015 02:39:46 PM,OVERDUE,Closed,Case Closed. Closed date : 2015-07-31 14:39:46.213 Case Resolved done,Equipment Repair,Parks & Recreation Department,Park Maintenance & Safety,Equipment Repair,PARK_Maintenance_Trades,PARK,,,,,,,,,,,,,,,,,42.3594,-71.0587,Employee Generated,"(0, 0)"
570761,101001395846,05/27/2015 11:37:00 AM,06/03/2015 11:37:24 AM,06/11/2015 02:48:30 PM,OVERDUE,Closed,Case Closed. Closed date : 2015-06-11 14:48:30.18 Case Resolved not parks dept bathroom,Equipment Repair,Parks & Recreation Department,Park Maintenance & Safety,Equipment Repair,PARK_Maintenance_Trades,PARK,,,540 Commercial St  Boston  MA  02113,3.0,1B,1.0,A1,Boston,3.0,03,302.0,CM,540 Commercial St,2113.0,Address,163702.0,42.3681,-71.0561,Constituent Call,"(42.3681, -71.0561)"
570797,101001395893,05/27/2015 12:01:00 PM,06/03/2015 12:01:45 PM,06/11/2015 02:49:31 PM,OVERDUE,Closed,Case Closed. Closed date : 2015-06-11 14:49:31.12 Case Resolved leak fixed,Equipment Repair,Parks & Recreation Department,Park Maintenance & Safety,Equipment Repair,PARK_Maintenance_Trades,PARK,,,,,,,,,,,,,,,,,42.3594,-71.0587,Employee Generated,"(0, 0)"
570828,101001395930,05/27/2015 12:26:00 PM,06/03/2015 12:26:50 PM,06/22/2015 04:21:47 PM,OVERDUE,Closed,Case Closed. Closed date : 2015-06-22 16:21:47.453 Case Resolved,Equipment Repair,Parks & Recreation Department,Park Maintenance & Safety,Equipment Repair,PARK_Maintenance_Trades,PARK,,,,,,,,,,,,,,,,,42.3594,-71.0587,Constituent Call,"(0, 0)"
570962,101001396108,05/27/2015 03:01:00 PM,06/03/2015 03:01:59 PM,05/27/2015 03:07:42 PM,ONTIME,Closed,Case Closed. Closed date : 2015-05-27 15:07:42.277 Case Resolved,Equipment Repair,Parks & Recreation Department,Park Maintenance & Safety,Equipment Repair,PARK_Maintenance_Trades,PARK,,,,,,,,,,,,,,,,,42.3594,-71.0587,Employee Generated,"(0, 0)"
570967,101001396117,05/27/2015 03:08:00 PM,06/03/2015 03:09:01 PM,05/27/2015 03:10:38 PM,ONTIME,Closed,Case Closed. Closed date : 2015-05-27 15:10:38.243 Case Resolved done,Equipment Repair,Parks & Recreation Department,Park Maintenance & Safety,Equipment Repair,PARK_Maintenance_Trades,PARK,,,,,,,,,,,,,,,,,42.3594,-71.0587,Employee Generated,"(0, 0)"
570971,101001396122,05/27/2015 03:11:00 PM,06/03/2015 03:11:43 PM,05/27/2015 03:13:24 PM,ONTIME,Closed,Case Closed. Closed date : 2015-05-27 15:13:24.933 Case Resolved,Equipment Repair,Parks & Recreation Department,Park Maintenance & Safety,Equipment Repair,PARK_Maintenance_Trades,PARK,,,,,,,,,,,,,,,,,42.3594,-71.0587,Employee Generated,"(0, 0)"
570975,101001396130,05/27/2015 03:14:00 PM,06/03/2015 03:14:50 PM,05/27/2015 03:16:30 PM,ONTIME,Closed,Case Closed. Closed date : 2015-05-27 15:16:30.77 Case Resolved,Equipment Repair,Parks & Recreation Department,Park Maintenance & Safety,Equipment Repair,PARK_Maintenance_Trades,PARK,,,,,,,,,,,,,,,,,42.3594,-71.0587,Employee Generated,"(0, 0)"
571078,101001396290,05/27/2015 06:11:00 PM,06/04/2015 08:30:00 AM,06/15/2015 02:40:12 PM,OVERDUE,Closed,Case Closed. Closed date : 2015-06-15 14:40:12.28 Case Resolved done 6-9-15,Equipment Repair,Parks & Recreation Department,Park Maintenance & Safety,Equipment Repair,PARK_Maintenance_Trades,PARK,,,621 Dudley St  Dorchester  MA  02125,7.0,03,7.0,B2,Dorchester,13.0,13,1302.0,,621 Dudley St,2125.0,Address,342460.0,42.3594,-71.0587,Constituent Call,"(0, 0)"
571104,101001396333,05/27/2015 07:19:00 PM,06/04/2015 08:30:00 AM,06/11/2015 02:52:25 PM,OVERDUE,Closed,Case Closed. Closed date : 2015-06-11 14:52:25.293 Case Resolved fountain fixed,Equipment Repair,Parks & Recreation Department,Park Maintenance & Safety,Equipment Repair,PARK_Maintenance_Trades,PARK,,,2P Brewer St  Jamaica Plain  MA  02130,9.0,02,6.0,E13,Jamaica Plain,11.0,19,1908.0,E,2P Brewer St,2130.0,Address,341464.0,42.3594,-71.0587,Constituent Call,"(0, 0)"
571220,101001396490,05/28/2015 07:43:20 AM,06/04/2015 08:30:00 AM,06/09/2015 12:50:30 PM,OVERDUE,Closed,Case Closed. Closed date : 2015-06-09 12:50:30.603 Case Invalid Case made in error. Service request for Landmarks Commission. Please reference case#: 1396496.,Equipment Repair,Parks & Recreation Department,Park Maintenance & Safety,Equipment Repair,PARK_Maintenance_Trades,PARK,,,INTERSECTION of Atlantic St & Thomas Park  South Boston  MA,6.0,05,2.0,C6,South Boston / South Boston Waterfront,5.0,Ward 7,703.0,,INTERSECTION Atlantic St & Thomas Park,,Intersection,748.0,42.3336,-71.0462,Constituent Call,"(42.3336, -71.0462)"
571362,101001396701,05/28/2015 09:44:00 AM,06/04/2015 09:44:30 AM,08/04/2015 06:11:10 AM,OVERDUE,Closed,Case Closed. Closed date : 2015-08-04 06:11:10.24 Case Resolved remove bench &install bench,Equipment Repair,Parks & Recreation Department,Park Maintenance & Safety,Equipment Repair,PARK_Maintenance_Trades,PARK,,,143 Porter St  East Boston  MA  02128,1.0,09,1.0,A7,East Boston,1.0,01,105.0,,143 Porter St,2128.0,Address,344495.0,42.3594,-71.0587,Constituent Call,"(0, 0)"
571365,101001396709,05/28/2015 09:46:00 AM,06/04/2015 09:46:36 AM,07/15/2015 09:55:29 AM,OVERDUE,Closed,Case Closed. Closed date : 2015-07-15 09:55:29.4 Case Resolved,Equipment Repair,Parks & Recreation Department,Park Maintenance & Safety,Equipment Repair,PARK_Maintenance_Trades,PARK,,,,,,,,,,,,,,,,,42.3594,-71.0587,Constituent Call,"(0, 0)"
571391,101001396741,05/28/2015 10:04:00 AM,06/04/2015 10:04:28 AM,06/05/2015 02:16:06 PM,OVERDUE,Closed,Case Closed. Closed date : 2015-06-05 14:16:06.027 Case Resolved done 6-1-15,Equipment Repair,Parks & Recreation Department,Park Maintenance & Safety,Equipment Repair,PARK_Maintenance_Trades,PARK,,,95 Myrtlebank Ave  Dorchester  MA  02124,8.0,07,3.0,C11,Dorchester,7.0,16,1612.0,,95 Myrtlebank Ave,2124.0,Address,342515.0,42.3594,-71.0587,Employee Generated,"(0, 0)"
571611,101001397083,05/28/2015 01:50:00 PM,06/04/2015 01:50:23 PM,09/02/2015 11:59:39 AM,OVERDUE,Closed,Case Closed. Closed date : 2015-09-02 11:59:39.197 Case Resolved,Equipment Repair,Parks & Recreation Department,Park Maintenance & Safety,Equipment Repair,PARK_Maintenance_Trades,PARK,,,50 Orchard Park St  Roxbury  MA  02119,7.0,10B,7.0,B2,Roxbury,13.0,8,803.0,,50 Orchard Park St,2119.0,Address,342557.0,42.3594,-71.0587,Employee Generated,"(0, 0)"
572279,101001397973,05/29/2015 10:31:47 AM,06/05/2015 10:31:47 AM,05/29/2015 10:59:20 AM,ONTIME,Closed,Case Closed. Closed date : 2015-05-29 10:59:20.44 Case Invalid No info  no eform.,Equipment Repair,Parks & Recreation Department,Park Maintenance & Safety,Equipment Repair,PARK_Maintenance_Trades,PARK,,,INTERSECTION of Dale St & Poplar St  Roslindale  MA,12.0,08,5.0,E5,Roslindale,10.0,Ward 18,1810.0,,INTERSECTION Dale St & Poplar St,,Intersection,3835.0,42.2742,-71.1283,Constituent Call,"(42.2742, -71.1283)"
572301,101001398016,05/29/2015 11:03:00 AM,06/05/2015 11:03:15 AM,07/15/2015 10:01:10 AM,OVERDUE,Closed,Case Closed. Closed date : 2015-07-15 10:01:10.07 Case Resolved,Equipment Repair,Parks & Recreation Department,Park Maintenance & Safety,Equipment Repair,PARK_Maintenance_Trades,PARK,,,INTERSECTION of Martin Luther King Jr Blvd & Walnut Ave  Roxbury  MA,9.0,10B,7.0,B2,Roxbury,13.0,Ward 12,1205.0,,INTERSECTION Martin Luther King Jr Blvd & Walnut Ave,,Intersection,7119.0,42.32,-71.0886,Constituent Call,"(42.32, -71.0886)"
572390,101001398149,05/29/2015 12:31:00 PM,06/05/2015 12:31:41 PM,06/24/2015 10:05:39 AM,OVERDUE,Closed,Case Closed. Closed date : 2015-06-24 10:05:39.163 Case Resolved,Equipment Repair,Parks & Recreation Department,Park Maintenance & Safety,Equipment Repair,PARK_Maintenance_Trades,PARK,,,540 Adams St  Dorchester  MA  02122,8.0,07,3.0,C11,Dorchester,7.0,16,1607.0,,540 Adams St,2122.0,Address,342475.0,42.3594,-71.0587,Employee Generated,"(0, 0)"
572394,101001398155,05/29/2015 12:35:00 PM,06/05/2015 12:35:18 PM,07/15/2015 09:58:15 AM,OVERDUE,Closed,Case Closed. Closed date : 2015-07-15 09:58:15.797 Case Resolved,Equipment Repair,Parks & Recreation Department,Park Maintenance & Safety,Equipment Repair,PARK_Maintenance_Trades,PARK,,,930 Blue Hill Ave  Dorchester  MA  02124,8.0,07,4.0,B3,Dorchester,9.0,14,1410.0,,930 Blue Hill Ave,2124.0,Address,162200.0,42.2923,-71.0846,Employee Generated,"(42.2923, -71.0846)"
572660,101001398580,05/29/2015 11:41:00 PM,06/08/2015 08:30:00 AM,06/01/2015 10:59:24 AM,ONTIME,Closed,Case Closed. Closed date : 2015-06-01 10:59:24.683 Case Referred to External Agency Bunker Hill Monument - National Park Service site.,Equipment Repair,Parks & Recreation Department,Park Maintenance & Safety,Equipment Repair,INFO_Reallocation From Dept,INFO,,,INTERSECTION of High St & Monument Sq  Charlestown  MA,3.0,1A,1.0,A15,Charlestown,2.0,Ward 2,203.0,,INTERSECTION High St & Monument Sq,,Intersection,5911.0,42.376,-71.0619,Constituent Call,"(42.376, -71.0619)"
572784,101001398736,05/30/2015 10:59:00 AM,06/08/2015 08:30:00 AM,06/02/2015 12:38:21 PM,ONTIME,Closed,Case Closed. Closed date : 2015-06-02 12:38:21.153 Case Resolved water turn on,Equipment Repair,Parks & Recreation Department,Park Maintenance & Safety,Equipment Repair,PARK_Maintenance_Trades,PARK,,,365 Hyde Park Ave  Roslindale  MA  02131,12.0,02,6.0,E18,Roslindale,10.0,19,1912.0,E,365 Hyde Park Ave,2131.0,Address,77313.0,42.289,-71.1188,Constituent Call,"(42.289, -71.1188)"
573206,101001399346,05/31/2015 10:10:00 PM,06/08/2015 08:30:00 AM,06/30/2015 12:49:22 PM,OVERDUE,Closed,Case Closed. Closed date : 2015-06-30 12:49:22.943 Case Resolved grind off sharp edge,Equipment Repair,Parks & Recreation Department,Park Maintenance & Safety,Equipment Repair,PARK_Maintenance_Trades,PARK,,,210 W Third St  South Boston  MA  02127,6.0,05,2.0,C6,South Boston,5.0,6,603.0,E,210 W Third St,2127.0,Address,341625.0,42.3393,-71.0491,Constituent Call,"(42.3393, -71.0491)"
573564,101001399850,06/01/2015 01:45:58 PM,06/08/2015 01:46:19 PM,06/03/2015 02:08:28 PM,ONTIME,Closed,Case Closed. Closed date : 2015-06-03 14:08:28.223 Case Resolved,Equipment Repair,Parks & Recreation Department,Park Maintenance & Safety,Equipment Repair,PARK_Maintenance_Trades,PARK,,,70 Park Dr  Boston  MA  02215,4.0,10A,8.0,D4,Fenway / Kenmore / Audubon Circle / Longwood,14.0,05,502.0,E,70 Park Dr,2215.0,Address,342000.0,42.3594,-71.0587,Employee Generated,"(0, 0)"
573624,101001399929,06/01/2015 02:46:00 PM,06/08/2015 02:46:49 PM,06/14/2015 03:43:57 PM,OVERDUE,Closed,Case Closed. Closed date : 2015-06-14 15:43:57.17 Case Resolved remove graffiti,Equipment Repair,Parks & Recreation Department,Park Maintenance & Safety,Equipment Repair,PARK_Maintenance_Trades,PARK,,,410 Washington St  Dorchester  MA  02124,7.0,03,4.0,C11,Dorchester,9.0,17,1701.0,,410 Washington St,2124.0,Address,342034.0,42.3594,-71.0587,Employee Generated,"(0, 0)"
573666,101001399977,06/01/2015 03:15:00 PM,06/08/2015 03:16:11 PM,06/22/2015 04:14:42 PM,OVERDUE,Closed,Case Closed. Closed date : 2015-06-22 16:14:42.79 Case Resolved done,Equipment Repair,Parks & Recreation Department,Park Maintenance & Safety,Equipment Repair,PARK_Maintenance_Trades,PARK,,,192 Webster St  East Boston  MA  02128,1.0,09,1.0,A7,East Boston,1.0,1,101.0,,192 Webster St,2128.0,Address,342012.0,42.3594,-71.0587,Employee Generated,"(0, 0)"
573668,101001399981,06/01/2015 03:19:00 PM,06/08/2015 03:19:53 PM,06/03/2015 12:49:12 PM,ONTIME,Closed,Case Closed. Closed date : 2015-06-03 12:49:12.007 Case Resolved wash down sidewalk,Equipment Repair,Parks & Recreation Department,Park Maintenance & Safety,Equipment Repair,PARK_Maintenance_Trades,PARK,,,46 Bogandale Rd  West Roxbury  MA  02132,12.0,06,6.0,E5,West Roxbury,12.0,Ward 20,2005.0,R1,46 Bogandale Rd,2132.0,Address,16739.0,42.2755,-71.1582,Employee Generated,"(42.2755, -71.1582)"
573778,101001400136,06/01/2015 08:22:00 PM,06/09/2015 08:30:00 AM,06/02/2015 09:46:19 AM,ONTIME,Closed,Case Closed. Closed date : 2015-06-02 09:46:19.533 Duplicate of Existing Case,Equipment Repair: --Not in list--,Parks & Recreation Department,Park Maintenance & Safety,Equipment Repair,PARK_Maintenance_Trades,PARK,,,,,,,,,,,,,,,,,42.3594,-71.0587,Self Service,"(0, 0)"
573783,101001400144,06/01/2015 08:32:09 PM,06/09/2015 08:30:00 AM,06/03/2015 02:38:39 PM,ONTIME,Closed,Case Closed. Closed date : 2015-06-03 14:38:39.017 Case Resolved done,Equipment Repair: --Not in list--,Parks & Recreation Department,Park Maintenance & Safety,Equipment Repair,PARK_Maintenance_Trades,PARK,,,,,,,,,,,,,,,,,42.3594,-71.0587,Self Service,"(0, 0)"
573788,101001400155,06/01/2015 09:51:19 PM,06/09/2015 08:30:00 AM,06/03/2015 02:37:41 PM,ONTIME,Closed,Case Closed. Closed date : 2015-06-03 14:37:41.003 Case Resolved replace wood,Equipment Repair: --Not in list--,Parks & Recreation Department,Park Maintenance & Safety,Equipment Repair,PARK_Maintenance_Trades,PARK,,,,,,,,,,,,,,,,,42.3594,-71.0587,Self Service,"(0, 0)"
573956,101001400412,06/02/2015 09:36:00 AM,06/09/2015 09:36:36 AM,06/04/2015 08:33:45 AM,ONTIME,Closed,Case Closed. Closed date : 2015-06-04 08:33:45.1 Case Resolved power wash tables,Equipment Repair,Parks & Recreation Department,Park Maintenance & Safety,Equipment Repair,PARK_Maintenance_Trades,PARK,,,58 Wachusett St  Jamaica Plain  MA  02130,12.0,02,6.0,E13,Jamaica Plain,10.0,19,1907.0,,58 Wachusett St,2130.0,Address,342566.0,42.3594,-71.0587,Employee Generated,"(0, 0)"
574016,101001400482,06/02/2015 10:23:00 AM,06/09/2015 10:24:07 AM,06/02/2015 10:26:53 AM,ONTIME,Closed,Case Closed. Closed date : 2015-06-02 10:26:53.563 Case Resolved,Equipment Repair,Parks & Recreation Department,Park Maintenance & Safety,Equipment Repair,PARK_Maintenance_Trades,PARK,,,,,,,,,,,,,,,,,42.3594,-71.0587,Employee Generated,"(0, 0)"
574019,101001400487,06/02/2015 10:29:00 AM,06/09/2015 10:29:51 AM,06/02/2015 10:33:32 AM,ONTIME,Closed,Case Closed. Closed date : 2015-06-02 10:33:32.52 Case Resolved,Equipment Repair,Parks & Recreation Department,Park Maintenance & Safety,Equipment Repair,PARK_Maintenance_Trades,PARK,,,,,,,,,,,,,,,,,42.3594,-71.0587,Employee Generated,"(0, 0)"
574031,101001400507,06/02/2015 10:43:00 AM,06/09/2015 10:43:54 AM,06/02/2015 10:49:11 AM,ONTIME,Closed,Case Closed. Closed date : 2015-06-02 10:49:11.243 Case Resolved,Equipment Repair,Parks & Recreation Department,Park Maintenance & Safety,Equipment Repair,PARK_Maintenance_Trades,PARK,,,,,,,,,,,,,,,,,42.3594,-71.0587,Employee Generated,"(0, 0)"
574041,101001400522,06/02/2015 10:51:00 AM,06/09/2015 10:51:10 AM,06/02/2015 11:01:50 AM,ONTIME,Closed,Case Closed. Closed date : 2015-06-02 11:01:50.797 Case Resolved,Equipment Repair,Parks & Recreation Department,Park Maintenance & Safety,Equipment Repair,PARK_Maintenance_Trades,PARK,,,,,,,,,,,,,,,,,42.3594,-71.0587,Employee Generated,"(0, 0)"
574069,101001400572,06/02/2015 11:22:00 AM,06/09/2015 11:22:20 AM,06/02/2015 11:24:25 AM,ONTIME,Closed,Case Closed. Closed date : 2015-06-02 11:24:25.377 Case Resolved DONE,Equipment Repair,Parks & Recreation Department,Park Maintenance & Safety,Equipment Repair,PARK_Maintenance_Trades,PARK,,,,,,,,,,,,,,,,,42.3594,-71.0587,Employee Generated,"(0, 0)"
574075,101001400581,06/02/2015 11:25:00 AM,06/09/2015 11:26:08 AM,06/30/2015 12:54:11 PM,OVERDUE,Closed,Case Closed. Closed date : 2015-06-30 12:54:11.56 Case Resolved fountain fixed,Equipment Repair,Parks & Recreation Department,Park Maintenance & Safety,Equipment Repair,PARK_Maintenance_Trades,PARK,,,139 Tremont St  Boston  MA  02108,3.0,1C,8.0,A1,Beacon Hill,14.0,05,503.0,E,139 Tremont St,2108.0,Address,341542.0,42.3554,-71.0638,Employee Generated,"(42.3554, -71.0638)"
574083,101001400595,06/02/2015 11:32:00 AM,06/09/2015 11:32:30 AM,06/02/2015 11:35:59 AM,ONTIME,Closed,Case Closed. Closed date : 2015-06-02 11:35:59.813 Case Resolved,Equipment Repair,Parks & Recreation Department,Park Maintenance & Safety,Equipment Repair,PARK_Maintenance_Trades,PARK,,,,,,,,,,,,,,,,,42.3594,-71.0587,Employee Generated,"(0, 0)"
574101,101001400618,06/02/2015 11:50:00 AM,06/09/2015 11:50:19 AM,06/04/2015 08:32:38 AM,ONTIME,Closed,Case Closed. Closed date : 2015-06-04 08:32:38.463 Case Resolved remove graffiti,Equipment Repair,Parks & Recreation Department,Park Maintenance & Safety,Equipment Repair,PARK_Maintenance_Trades,PARK,,,275 Geneva Ave  Dorchester  MA  02121,7.0,03,4.0,C11,Dorchester,8.0,14,1404.0,,275 Geneva Ave,2121.0,Address,342455.0,42.3594,-71.0587,Constituent Call,"(0, 0)"
574104,101001400625,06/02/2015 11:52:00 AM,06/09/2015 11:53:05 AM,08/03/2015 05:40:54 AM,OVERDUE,Closed,Case Closed. Closed date : 2015-08-03 05:40:54.64 Case Resolved did what we could reach,Equipment Repair,Parks & Recreation Department,Park Maintenance & Safety,Equipment Repair,PARK_Maintenance_Trades,PARK,,,22 Nira Ave  Jamaica Plain  MA  02130,9.0,10A,8.0,E13,Jamaica Plain,11.0,10,1008.0,,22 Nira Ave,2130.0,Address,342553.0,42.3594,-71.0587,Constituent Call,"(0, 0)"
574179,101001400736,06/02/2015 01:41:00 PM,06/09/2015 01:41:49 PM,06/02/2015 01:46:42 PM,ONTIME,Closed,Case Closed. Closed date : 2015-06-02 13:46:42.14 Case Resolved,Equipment Repair,Parks & Recreation Department,Park Maintenance & Safety,Equipment Repair,PARK_Maintenance_Trades,PARK,,,,,,,,,,,,,,,,,42.3594,-71.0587,Employee Generated,"(0, 0)"
574182,101001400741,06/02/2015 01:47:00 PM,06/09/2015 01:47:54 PM,06/02/2015 01:53:13 PM,ONTIME,Closed,Case Closed. Closed date : 2015-06-02 13:53:13.073 Case Resolved,Equipment Repair,Parks & Recreation Department,Park Maintenance & Safety,Equipment Repair,PARK_Maintenance_Trades,PARK,,,,,,,,,,,,,,,,,42.3594,-71.0587,Employee Generated,"(0, 0)"
574194,101001400759,06/02/2015 02:00:00 PM,06/09/2015 02:00:47 PM,06/02/2015 02:05:15 PM,ONTIME,Closed,Case Closed. Closed date : 2015-06-02 14:05:15.453 Case Resolved,Equipment Repair,Parks & Recreation Department,Park Maintenance & Safety,Equipment Repair,PARK_Maintenance_Trades,PARK,,,,,,,,,,,,,,,,,42.3594,-71.0587,Employee Generated,"(0, 0)"
574200,101001400774,06/02/2015 02:11:00 PM,06/09/2015 02:11:31 PM,06/02/2015 02:13:37 PM,ONTIME,Closed,Case Closed. Closed date : 2015-06-02 14:13:37.17 Case Resolved,Equipment Repair,Parks & Recreation Department,Park Maintenance & Safety,Equipment Repair,PARK_Maintenance_Trades,PARK,,,,,,,,,,,,,,,,,42.3594,-71.0587,Employee Generated,"(0, 0)"
574206,101001400780,06/02/2015 02:14:00 PM,06/09/2015 02:14:55 PM,06/02/2015 02:16:31 PM,ONTIME,Closed,Case Closed Case Resolved,Equipment Repair,Parks & Recreation Department,Park Maintenance & Safety,Equipment Repair,PARK_Maintenance_Trades,PARK,,,,,,,,,,,,,,,,,42.3594,-71.0587,Employee Generated,"(0, 0)"
574250,101001400849,06/02/2015 03:05:00 PM,06/09/2015 03:05:55 PM,06/30/2015 12:55:58 PM,OVERDUE,Closed,Case Closed. Closed date : 2015-06-30 12:55:58.193 Case Resolved fountain clean,Equipment Repair,Parks & Recreation Department,Park Maintenance & Safety,Equipment Repair,PARK_Maintenance_Trades,PARK,,,557 Massachusetts Ave  Roxbury  MA  02118,7.0,10B,7.0,D4,Roxbury,13.0,Ward 9,903.0,CM,557 Massachusetts Ave,2118.0,Address,92393.0,42.3377,-71.0793,Constituent Call,"(42.3377, -71.0793)"
574291,101001400921,06/02/2015 04:11:00 PM,06/09/2015 04:11:20 PM,06/02/2015 04:13:02 PM,ONTIME,Closed,Case Closed. Closed date : 2015-06-02 16:13:02.863 Case Resolved,Equipment Repair,Parks & Recreation Department,Park Maintenance & Safety,Equipment Repair,PARK_Maintenance_Trades,PARK,,,,,,,,,,,,,,,,,42.3594,-71.0587,Employee Generated,"(0, 0)"
574295,101001400926,06/02/2015 04:14:00 PM,06/09/2015 04:15:00 PM,06/02/2015 04:17:03 PM,ONTIME,Closed,Case Closed. Closed date : 2015-06-02 16:17:03.547 Case Resolved,Equipment Repair,Parks & Recreation Department,Park Maintenance & Safety,Equipment Repair,PARK_Maintenance_Trades,PARK,,,,,,,,,,,,,,,,,42.3594,-71.0587,Employee Generated,"(0, 0)"
574304,101001400936,06/02/2015 04:27:00 PM,06/09/2015 04:27:56 PM,06/02/2015 04:31:41 PM,ONTIME,Closed,Case Closed. Closed date : 2015-06-02 16:31:41.283 Case Resolved,Equipment Repair,Parks & Recreation Department,Park Maintenance & Safety,Equipment Repair,PARK_Maintenance_Trades,PARK,,,,,,,,,,,,,,,,,42.3594,-71.0587,Employee Generated,"(0, 0)"
574987,101001401983,06/03/2015 06:37:00 PM,06/11/2015 08:30:00 AM,06/24/2015 04:04:17 PM,OVERDUE,Closed,Case Closed. Closed date : 2015-06-24 16:04:17.08 Case Resolved done 6-22-15,Equipment Repair,Parks & Recreation Department,Park Maintenance & Safety,Equipment Repair,PARK_Maintenance_Trades,PARK,,,348-350 Hyde Park Ave  Roslindale  MA  02131,12.0,02,6.0,E18,Jamaica Plain,10.0,Ward 19,1912.0,,348-350 Hyde Park Ave,2131.0,Address,155506.0,42.2891,-71.118,Constituent Call,"(42.2891, -71.118)"
575131,101001402195,06/04/2015 08:38:00 AM,06/11/2015 08:38:38 AM,12/23/2015 10:20:31 AM,OVERDUE,Closed,Case Closed. Closed date : 2015-12-23 10:20:31.283 Case Resolved repairs made,Equipment Repair,Parks & Recreation Department,Park Maintenance & Safety,Equipment Repair,PARK_Park Improvement Requests,PARK,,,365 Hyde Park Ave  Roslindale  MA  02131,12.0,02,6.0,E18,Roslindale,10.0,19,1912.0,E,365 Hyde Park Ave,2131.0,Address,77313.0,42.289,-71.1188,Constituent Call,"(42.289, -71.1188)"
575216,101001402333,06/04/2015 10:05:00 AM,06/11/2015 10:07:45 AM,06/24/2015 04:10:20 PM,OVERDUE,Closed,Case Closed. Closed date : 2015-06-24 16:10:20.62 Case Resolved,Equipment Repair,Parks & Recreation Department,Park Maintenance & Safety,Equipment Repair,PARK_Maintenance_Trades,PARK,,,75 W Rutland Sq  Roxbury  MA  02118,4.0,1C,7.0,D4,Roxbury,6.0,4,404.0,,75 W Rutland Sq,2118.0,Address,342665.0,42.3594,-71.0587,Employee Generated,"(0, 0)"
575218,101001402336,06/04/2015 10:11:00 AM,06/11/2015 10:11:29 AM,06/30/2015 12:57:22 PM,OVERDUE,Closed,Case Closed. Closed date : 2015-06-30 12:57:22.4 Case Resolved repair fence,Equipment Repair,Parks & Recreation Department,Park Maintenance & Safety,Equipment Repair,PARK_Maintenance_Trades,PARK,,,39 Terminal St  Charlestown  MA  02129,3.0,1A,1.0,A15,Charlestown,2.0,2,202.0,,39 Terminal St,2129.0,Address,344482.0,42.3816,-71.0599,Employee Generated,"(42.3816, -71.0599)"
575226,101001402352,06/04/2015 10:17:00 AM,06/11/2015 10:19:57 AM,06/04/2015 10:22:24 AM,ONTIME,Closed,Case Closed. Closed date : 2015-06-04 10:22:24.917 Case Invalid,Equipment Repair,Parks & Recreation Department,Park Maintenance & Safety,Equipment Repair,PARK_Maintenance_Trades,PARK,,,39 Terminal St  Charlestown  MA  02129,3.0,1A,1.0,A15,Charlestown,2.0,2,202.0,,39 Terminal St,2129.0,Address,344482.0,42.3816,-71.0599,Employee Generated,"(42.3816, -71.0599)"
575340,101001402519,06/04/2015 12:33:00 PM,06/11/2015 12:33:28 PM,06/09/2015 04:55:47 AM,ONTIME,Closed,Case Closed. Closed date : 2015-06-09 04:55:47.273 Case Resolved replace flag,Equipment Repair,Parks & Recreation Department,Park Maintenance & Safety,Equipment Repair,PARK_Maintenance_Trades,PARK,,,92 Mount Ida Rd  Dorchester  MA  02122,7.0,03,3.0,C11,Dorchester,8.0,15,1509.0,,92 Mount Ida Rd,2122.0,Address,342620.0,42.3594,-71.0587,Employee Generated,"(0, 0)"
575418,101001402623,06/04/2015 02:04:00 PM,06/11/2015 02:04:34 PM,06/15/2015 03:05:36 PM,OVERDUE,Closed,Case Closed. Closed date : 2015-06-15 15:05:36.92 Case Resolved,Equipment Repair,Parks & Recreation Department,Park Maintenance & Safety,Equipment Repair,PARK_Maintenance_Trades,PARK,,,550 Norfolk St  Mattapan  MA  02126,8.0,07,4.0,B3,Greater Mattapan,9.0,18,1802.0,,550 Norfolk St,2126.0,Address,342029.0,42.3594,-71.0587,Employee Generated,"(0, 0)"
575462,101001402675,06/04/2015 02:49:00 PM,06/11/2015 02:49:16 PM,06/30/2015 12:59:27 PM,OVERDUE,Closed,Case Closed. Closed date : 2015-06-30 12:59:27.517 Case Resolved new sign installed,Equipment Repair: Fr. Jack Roussin Play Area,Parks & Recreation Department,Park Maintenance & Safety,Equipment Repair,PARK_Maintenance_Trades,PARK,,,,,,,,,,,,,,,,,42.3594,-71.0587,Self Service,"(0, 0)"
575698,101001402977,06/04/2015 09:27:00 PM,06/12/2015 08:30:00 AM,,OVERDUE,Open,,Equipment Repair,Parks & Recreation Department,Park Maintenance & Safety,Equipment Repair,PARK_Maintenance_Lighting Electrical,PARK,,,235 Western Ave  Allston  MA  02134,11.0,04,9.0,D14,Allston,15.0,22,2201.0,,235 Western Ave,2134.0,Address,342636.0,42.3594,-71.0587,Constituent Call,"(0, 0)"
575972,101001403397,06/05/2015 12:22:00 PM,06/12/2015 12:22:11 PM,07/06/2015 12:44:36 PM,OVERDUE,Closed,Case Closed. Closed date : 2015-07-06 12:44:36.573 Case Resolved repair fence,Equipment Repair,Parks & Recreation Department,Park Maintenance & Safety,Equipment Repair,PARK_Maintenance_Trades,PARK,,,,,,,,,,,,,,,,,42.3594,-71.0587,Constituent Call,"(0, 0)"
576059,101001403521,06/05/2015 02:50:00 PM,06/12/2015 02:50:40 PM,06/05/2015 02:52:55 PM,ONTIME,Closed,Case Closed. Closed date : 2015-06-05 14:52:55.287 Case Resolved done,Equipment Repair,Parks & Recreation Department,Park Maintenance & Safety,Equipment Repair,PARK_Maintenance_Trades,PARK,,,,,,,,,,,,,,,,,42.3594,-71.0587,Employee Generated,"(0, 0)"
576063,101001403529,06/05/2015 02:53:00 PM,06/12/2015 02:53:27 PM,06/05/2015 02:55:02 PM,ONTIME,Closed,Case Closed. Closed date : 2015-06-05 14:55:02.713 Case Resolved done,Equipment Repair,Parks & Recreation Department,Park Maintenance & Safety,Equipment Repair,PARK_Maintenance_Trades,PARK,,,,,,,,,,,,,,,,,42.3594,-71.0587,Employee Generated,"(0, 0)"
576066,101001403533,06/05/2015 02:56:00 PM,06/12/2015 02:56:13 PM,06/05/2015 03:01:02 PM,ONTIME,Closed,Case Closed. Closed date : 2015-06-05 15:01:02.1 Case Resolved,Equipment Repair,Parks & Recreation Department,Park Maintenance & Safety,Equipment Repair,PARK_Maintenance_Trades,PARK,,,,,,,,,,,,,,,,,42.3594,-71.0587,Employee Generated,"(0, 0)"
576070,101001403543,06/05/2015 03:01:00 PM,06/12/2015 03:01:38 PM,06/05/2015 03:03:07 PM,ONTIME,Closed,Case Closed. Closed date : 2015-06-05 15:03:07.163 Case Resolved done 5-25-15,Equipment Repair,Parks & Recreation Department,Park Maintenance & Safety,Equipment Repair,PARK_Maintenance_Trades,PARK,,,,,,,,,,,,,,,,,42.3594,-71.0587,Employee Generated,"(0, 0)"
576078,101001403554,06/05/2015 03:05:00 PM,06/12/2015 03:05:47 PM,06/05/2015 03:08:46 PM,ONTIME,Closed,Case Closed. Closed date : 2015-06-05 15:08:46.36 Case Resolved done,Equipment Repair,Parks & Recreation Department,Park Maintenance & Safety,Equipment Repair,PARK_Maintenance_Trades,PARK,,,,,,,,,,,,,,,,,42.3594,-71.0587,Employee Generated,"(0, 0)"
576082,101001403559,06/05/2015 03:10:00 PM,06/12/2015 03:10:21 PM,06/05/2015 03:18:53 PM,ONTIME,Closed,Case Closed. Closed date : 2015-06-05 15:18:53.557 Case Resolved done,Equipment Repair,Parks & Recreation Department,Park Maintenance & Safety,Equipment Repair,PARK_Maintenance_Trades,PARK,,,,,,,,,,,,,,,,,42.3594,-71.0587,Employee Generated,"(0, 0)"
576092,101001403572,06/05/2015 03:19:00 PM,06/12/2015 03:19:32 PM,06/05/2015 03:21:19 PM,ONTIME,Closed,Case Closed. Closed date : 2015-06-05 15:21:19.333 Case Resolved done,Equipment Repair,Parks & Recreation Department,Park Maintenance & Safety,Equipment Repair,PARK_Maintenance_Trades,PARK,,,,,,,,,,,,,,,,,42.3594,-71.0587,Employee Generated,"(0, 0)"
576094,101001403575,06/05/2015 03:22:00 PM,06/12/2015 03:22:34 PM,06/05/2015 03:24:18 PM,ONTIME,Closed,Case Closed. Closed date : 2015-06-05 15:24:18.773 Case Resolved done,Equipment Repair,Parks & Recreation Department,Park Maintenance & Safety,Equipment Repair,PARK_Maintenance_Trades,PARK,,,,,,,,,,,,,,,,,42.3594,-71.0587,Employee Generated,"(0, 0)"
576096,101001403580,06/05/2015 03:24:00 PM,06/12/2015 03:25:01 PM,06/05/2015 03:26:28 PM,ONTIME,Closed,Case Closed. Closed date : 2015-06-05 15:26:28.973 Case Resolved done,Equipment Repair,Parks & Recreation Department,Park Maintenance & Safety,Equipment Repair,PARK_Maintenance_Trades,PARK,,,,,,,,,,,,,,,,,42.3594,-71.0587,Employee Generated,"(0, 0)"
576098,101001403583,06/05/2015 03:26:00 PM,06/12/2015 03:26:58 PM,06/05/2015 03:29:52 PM,ONTIME,Closed,Case Closed. Closed date : 2015-06-05 15:29:52.77 Case Resolved done,Equipment Repair,Parks & Recreation Department,Park Maintenance & Safety,Equipment Repair,PARK_Maintenance_Trades,PARK,,,,,,,,,,,,,,,,,42.3594,-71.0587,Employee Generated,"(0, 0)"
576654,101001404478,06/08/2015 09:38:00 AM,06/15/2015 09:38:59 AM,06/11/2015 01:31:05 PM,ONTIME,Closed,Case Closed. Closed date : 2015-06-11 13:31:05.507 Case Resolved fountain on,Equipment Repair,Parks & Recreation Department,Park Maintenance & Safety,Equipment Repair,PARK_Maintenance_Trades,PARK,,,40 Almont St  Mattapan  MA  02126,8.0,07,5.0,B3,Mattapan,9.0,18,1803.0,E,40 Almont St,2126.0,Address,341524.0,42.2741,-71.0969,Employee Generated,"(42.2741, -71.0969)"
576664,101001404488,06/08/2015 09:46:00 AM,06/15/2015 09:46:38 AM,06/15/2015 01:49:40 PM,OVERDUE,Closed,Case Closed. Closed date : 2015-06-15 13:49:40.777 Case Resolved done,Equipment Repair,Parks & Recreation Department,Park Maintenance & Safety,Equipment Repair,PARK_Maintenance_Trades,PARK,,,,,,,,,,,,,,,,,42.3594,-71.0587,Employee Generated,"(0, 0)"
577381,101001405564,06/09/2015 10:19:00 AM,06/16/2015 10:19:21 AM,06/15/2015 12:57:56 PM,ONTIME,Closed,Case Closed. Closed date : 2015-06-15 12:57:56.443 Case Resolved done 6-10-15,Equipment Repair,Parks & Recreation Department,Park Maintenance & Safety,Equipment Repair,PARK_Maintenance_Trades,PARK,,,430 Sumner St  East Boston  MA  02128,1.0,09,1.0,A7,East Boston,1.0,1,101.0,,430 Sumner St,2128.0,Address,342658.0,42.3594,-71.0587,Employee Generated,"(0, 0)"
577387,101001405579,06/09/2015 10:26:00 AM,06/16/2015 10:27:32 AM,06/11/2015 01:35:28 PM,ONTIME,Closed,Case Closed. Closed date : 2015-06-11 13:35:28.267 Case Resolved remove.graffiti,Equipment Repair,Parks & Recreation Department,Park Maintenance & Safety,Equipment Repair,PARK_Maintenance_Trades,PARK,,,1005 Columbia Rd  South Boston  MA  02127,6.0,05,2.0,C6,South Boston,5.0,7,707.0,,1005 Columbia Rd,2127.0,Address,163529.0,42.3272,-71.0504,Employee Generated,"(42.3272, -71.0504)"
577471,101001405682,06/09/2015 11:36:53 AM,06/16/2015 11:37:13 AM,09/02/2015 12:03:10 PM,OVERDUE,Closed,Case Closed. Closed date : 2015-09-02 12:03:10.467 Case Noted welders report can not find fence 8-31-15,Equipment Repair:,Parks & Recreation Department,Park Maintenance & Safety,Equipment Repair,PARK_Maintenance_Trades,PARK,,,,,,,,,,,,,,,,,42.3594,-71.0587,Self Service,"(0, 0)"
577480,101001405695,06/09/2015 11:46:00 AM,06/16/2015 11:47:15 AM,06/11/2015 06:06:25 AM,ONTIME,Closed,Case Closed. Closed date : 2015-06-11 06:06:25.073 Case Resolved low water,Equipment Repair,Parks & Recreation Department,Park Maintenance & Safety,Equipment Repair,PARK_Maintenance_Trades,PARK,,,370 Hanover St  Boston  MA  02113,3.0,1B,1.0,A1,Downtown / Financial District,3.0,03,301.0,,370 Hanover St,2113.0,Address,342568.0,42.3594,-71.0587,Employee Generated,"(0, 0)"
577481,101001405694,06/09/2015 11:46:13 AM,06/16/2015 11:46:25 AM,06/11/2015 06:07:43 AM,ONTIME,Closed,Case Closed. Closed date : 2015-06-11 06:07:43.17 Case Resolved low water,Equipment Repair,Parks & Recreation Department,Park Maintenance & Safety,Equipment Repair,PARK_Maintenance_Trades,PARK,,,370 Hanover St  Boston  MA  02113,3.0,1B,1.0,A1,Downtown / Financial District,3.0,03,301.0,,370 Hanover St,2113.0,Address,342568.0,42.3594,-71.0587,Employee Generated,"(0, 0)"
577623,101001405871,06/09/2015 01:40:00 PM,06/16/2015 01:40:36 PM,06/15/2015 01:00:58 PM,ONTIME,Closed,Case Closed. Closed date : 2015-06-15 13:00:58.333 Case Resolved,Equipment Repair,Parks & Recreation Department,Park Maintenance & Safety,Equipment Repair,PARK_Maintenance_Trades,PARK,,,192 Webster St  East Boston  MA  02128,1.0,09,1.0,A7,East Boston,1.0,1,101.0,,192 Webster St,2128.0,Address,342012.0,42.3594,-71.0587,Constituent Call,"(0, 0)"
577655,101001405945,06/09/2015 02:32:00 PM,06/16/2015 02:32:47 PM,06/30/2015 01:17:11 PM,OVERDUE,Closed,Case Closed. Closed date : 2015-06-30 13:17:11.187 Case Resolved paint benches new wood will be installedin august,Equipment Repair,Parks & Recreation Department,Park Maintenance & Safety,Equipment Repair,PARK_Maintenance_Trades,PARK,,,,,,,,,,,,,,,,,42.3594,-71.0587,Constituent Call,"(0, 0)"
577669,101001405950,06/09/2015 02:52:00 PM,06/16/2015 02:52:48 PM,06/30/2015 01:06:55 PM,OVERDUE,Closed,Case Closed. Closed date : 2015-06-30 13:06:55.19 Case Resolved replace spray head,Equipment Repair,Parks & Recreation Department,Park Maintenance & Safety,Equipment Repair,PARK_Maintenance_Trades,PARK,,,,,,,,,,,,,,,,,42.3594,-71.0587,Constituent Call,"(0, 0)"
577671,101001405954,06/09/2015 02:53:00 PM,06/16/2015 02:54:42 PM,06/30/2015 01:05:37 PM,OVERDUE,Closed,Case Closed. Closed date : 2015-06-30 13:05:37.97 Case Resolved paint ballard,Equipment Repair,Parks & Recreation Department,Park Maintenance & Safety,Equipment Repair,PARK_Maintenance_Trades,PARK,,,,,,,,,,,,,,,,,42.3594,-71.0587,Constituent Call,"(0, 0)"
577672,101001405951,06/09/2015 02:53:00 PM,06/16/2015 02:53:46 PM,08/14/2015 02:53:59 PM,OVERDUE,Closed,Case Closed. Closed date : 2015-08-14 14:53:59.447 Case Resolved,Equipment Repair,Parks & Recreation Department,Park Maintenance & Safety,Equipment Repair,PARK_Maintenance_Trades,PARK,,,92 Mount Ida Rd  Dorchester  MA  02122,7.0,03,3.0,C11,Dorchester,8.0,15,1509.0,,92 Mount Ida Rd,2122.0,Address,342620.0,42.3594,-71.0587,Employee Generated,"(0, 0)"
577674,101001405957,06/09/2015 02:55:00 PM,06/16/2015 02:55:59 PM,,OVERDUE,Open,,Equipment Repair,Parks & Recreation Department,Park Maintenance & Safety,Equipment Repair,PARK_Park Improvement Requests,PARK,,,,,,,,,,,,,,,,,42.3594,-71.0587,Constituent Call,"(0, 0)"
577676,101001405958,06/09/2015 02:56:00 PM,06/16/2015 02:56:57 PM,06/30/2015 01:18:14 PM,OVERDUE,Closed,Case Closed. Closed date : 2015-06-30 13:18:14.687 Case Resolved paint tables,Equipment Repair,Parks & Recreation Department,Park Maintenance & Safety,Equipment Repair,PARK_Maintenance_Trades,PARK,,,,,,,,,,,,,,,,,42.3594,-71.0587,Constituent Call,"(0, 0)"
578050,101001406518,06/10/2015 10:21:00 AM,06/17/2015 10:21:25 AM,06/11/2015 01:39:09 PM,ONTIME,Closed,Case Closed. Closed date : 2015-06-11 13:39:09.267 Case Resolved fountain fixed,Equipment Repair,Parks & Recreation Department,Park Maintenance & Safety,Equipment Repair,PARK_Maintenance_Trades,PARK,,,30 Mount Pleasant Ave  Roxbury  MA  02119,7.0,10B,7.0,B2,Roxbury,13.0,8,803.0,E,30 Mount Pleasant Ave,2119.0,Address,98401.0,42.327,-71.0792,Employee Generated,"(42.327, -71.0792)"
578055,101001406525,06/10/2015 10:29:00 AM,06/17/2015 10:29:45 AM,07/23/2015 04:05:09 PM,OVERDUE,Closed,Case Closed. Closed date : 2015-07-23 16:05:09.13 Case Resolved,Equipment Repair,Parks & Recreation Department,Park Maintenance & Safety,Equipment Repair,PARK_Maintenance_Trades,PARK,,,39 Terminal St  Charlestown  MA  02129,3.0,1A,1.0,A15,Charlestown,2.0,2,202.0,,39 Terminal St,2129.0,Address,344482.0,42.3816,-71.0599,Employee Generated,"(42.3816, -71.0599)"
578066,101001406537,06/10/2015 10:39:00 AM,06/17/2015 10:39:46 AM,06/12/2015 04:49:14 AM,ONTIME,Closed,Case Closed. Closed date : 2015-06-12 04:49:14.933 Case Resolved fix swing,Equipment Repair,Parks & Recreation Department,Park Maintenance & Safety,Equipment Repair,PARK_Maintenance_Trades,PARK,,,59 Waumbeck St  Dorchester  MA  02121,9.0,10B,7.0,B2,Dorchester,13.0,12,1202.0,,59 Waumbeck St,2121.0,Address,342666.0,42.3594,-71.0587,Employee Generated,"(0, 0)"
578171,101001406677,06/10/2015 12:51:00 PM,06/17/2015 12:51:27 PM,06/12/2015 06:19:33 AM,ONTIME,Closed,Case Closed. Closed date : 2015-06-12 06:19:33.64 Case Resolved repair 2 swing,Equipment Repair,Parks & Recreation Department,Park Maintenance & Safety,Equipment Repair,PARK_Maintenance_Trades,PARK,,,56 Dunbar Ave  Dorchester  MA  02124,8.0,07,4.0,B3,Dorchester,9.0,17,1708.0,,56 Dunbar Ave,2124.0,Address,342601.0,42.3594,-71.0587,Constituent Call,"(0, 0)"
578245,101001406777,06/10/2015 02:26:00 PM,06/17/2015 02:27:08 PM,06/30/2015 01:19:25 PM,OVERDUE,Closed,Case Closed. Closed date : 2015-06-30 13:19:25.07 Case Resolved tie up fence,Equipment Repair,Parks & Recreation Department,Park Maintenance & Safety,Equipment Repair,PARK_Maintenance_Trades,PARK,,,39 Terminal St  Charlestown  MA  02129,3.0,1A,1.0,A15,Charlestown,2.0,2,202.0,,39 Terminal St,2129.0,Address,344482.0,42.3816,-71.0599,Employee Generated,"(42.3816, -71.0599)"
578248,101001406787,06/10/2015 02:36:00 PM,06/17/2015 02:36:37 PM,09/25/2015 09:13:55 AM,OVERDUE,Closed,Case Closed. Closed date : 2015-09-25 09:13:55.043 Case Resolved Swing gate was repaired.,Equipment Repair,Parks & Recreation Department,Park Maintenance & Safety,Equipment Repair,PARK_Maintenance_Trades,PARK,,,39 Terminal St  Charlestown  MA  02129,3.0,1A,1.0,A15,Charlestown,2.0,2,202.0,,39 Terminal St,2129.0,Address,344482.0,42.3816,-71.0599,Employee Generated,"(42.3816, -71.0599)"
578285,101001406841,06/10/2015 03:30:00 PM,06/17/2015 03:30:35 PM,06/24/2015 01:32:40 PM,OVERDUE,Closed,Case Closed. Closed date : 2015-06-24 13:32:40.313 Case Resolved,Equipment Repair,Parks & Recreation Department,Park Maintenance & Safety,Equipment Repair,PARK_Maintenance_Trades,PARK,,,,,,,,,,,,,,,,,42.3594,-71.0587,Constituent Call,"(0, 0)"
578297,101001406875,06/10/2015 04:06:00 PM,06/17/2015 04:07:07 PM,07/06/2015 12:46:33 PM,OVERDUE,Closed,Case Closed. Closed date : 2015-07-06 12:46:33.94 Case Resolved install hasp,Equipment Repair,Parks & Recreation Department,Park Maintenance & Safety,Equipment Repair,PARK_Maintenance_Trades,PARK,,,,,,,,,,,,,,,,,42.3594,-71.0587,Constituent Call,"(0, 0)"
578564,101001407312,06/11/2015 09:37:00 AM,06/18/2015 09:37:44 AM,,OVERDUE,Open,,Equipment Repair,Parks & Recreation Department,Park Maintenance & Safety,Equipment Repair,PARK_Park Improvement Requests,PARK,,,160 Norfolk Ave  Roxbury  MA  02119,7.0,03,7.0,B2,Roxbury,13.0,08,806.0,,160 Norfolk Ave,2119.0,Address,342027.0,42.3594,-71.0587,Constituent Call,"(0, 0)"
578575,101001407324,06/11/2015 09:45:00 AM,06/18/2015 09:45:54 AM,06/24/2015 11:52:11 AM,OVERDUE,Closed,Case Closed. Closed date : 2015-06-24 11:52:11.437 Case Resolved done,Equipment Repair,Parks & Recreation Department,Park Maintenance & Safety,Equipment Repair,PARK_Maintenance_Trades,PARK,,,,,,,,,,,,,,,,,42.3594,-71.0587,Constituent Call,"(0, 0)"
578576,101001407323,06/11/2015 09:45:00 AM,06/18/2015 09:45:48 AM,06/11/2015 01:27:28 PM,ONTIME,Closed,Case Closed. Closed date : 2015-06-11 13:27:28.283 Case Resolved water on,Equipment Repair,Parks & Recreation Department,Park Maintenance & Safety,Equipment Repair,PARK_Maintenance_Trades,PARK,,,INTERSECTION of Hanson St & Ringgold St  Roxbury  MA,4.0,1C,2.0,D4,South End,4.0,Ward 3,307.0,,INTERSECTION Hanson St & Ringgold St,,Intersection,5622.0,42.3433,-71.0696,Constituent Call,"(42.3433, -71.0696)"
578578,101001407328,06/11/2015 09:47:00 AM,06/18/2015 09:47:29 AM,06/17/2015 09:39:12 AM,ONTIME,Closed,Case Closed. Closed date : 2015-06-17 09:39:12.52 Case Resolved,Equipment Repair,Parks & Recreation Department,Park Maintenance & Safety,Equipment Repair,PARK_Maintenance_Trades,PARK,,,,,,,,,,,,,,,,,42.3594,-71.0587,Constituent Call,"(0, 0)"
578582,101001407335,06/11/2015 09:50:00 AM,06/18/2015 09:50:51 AM,08/03/2015 05:44:57 AM,OVERDUE,Closed,Case Closed. Closed date : 2015-08-03 05:44:57.867 Case Resolved fill in holes,Equipment Repair,Parks & Recreation Department,Park Maintenance & Safety,Equipment Repair,PARK_Maintenance_Trades,PARK,,,,,,,,,,,,,,,,,42.3594,-71.0587,Constituent Call,"(0, 0)"
578638,101001407406,06/11/2015 10:37:00 AM,06/18/2015 10:37:46 AM,06/24/2015 03:59:05 PM,OVERDUE,Closed,Case Closed. Closed date : 2015-06-24 15:59:05.53 Case Resolved,Equipment Repair,Parks & Recreation Department,Park Maintenance & Safety,Equipment Repair,PARK_Maintenance_Trades,PARK,,,,,,,,,,,,,,,,,42.3594,-71.0587,Employee Generated,"(0, 0)"
578727,101001407580,06/11/2015 11:46:07 AM,06/18/2015 11:46:06 AM,10/09/2015 08:21:16 AM,OVERDUE,Closed,Case Closed. Closed date : 2015-10-09 08:21:16.817 Case Noted No location.,Equipment Repair:,Parks & Recreation Department,Park Maintenance & Safety,Equipment Repair,PARK_Maintenance_Trades,PARK,,,,,,,,,,,,,,,,,42.3594,-71.0587,Self Service,"(0, 0)"
578742,101001407606,06/11/2015 12:06:25 PM,06/18/2015 12:06:24 PM,06/30/2015 01:21:17 PM,OVERDUE,Closed,Case Closed. Closed date : 2015-06-30 13:21:17.223 Case Resolved reface court,Equipment Repair:,Parks & Recreation Department,Park Maintenance & Safety,Equipment Repair,PARK_Maintenance_Trades,PARK,,,,,,,,,,,,,,,,,42.3594,-71.0587,Self Service,"(0, 0)"
578796,101001407696,06/11/2015 01:27:00 PM,06/18/2015 01:27:12 PM,06/15/2015 01:50:25 PM,ONTIME,Closed,Case Closed. Closed date : 2015-06-15 13:50:25.603 Case Resolved done,Equipment Repair,Parks & Recreation Department,Park Maintenance & Safety,Equipment Repair,PARK_Maintenance_Trades,PARK,,,139 Tremont St  Boston  MA  02108,3.0,1C,8.0,A1,Beacon Hill,14.0,05,503.0,E,139 Tremont St,2108.0,Address,341542.0,42.3554,-71.0638,Employee Generated,"(42.3554, -71.0638)"
578803,101001407704,06/11/2015 01:39:00 PM,06/18/2015 01:39:54 PM,,OVERDUE,Open,,Equipment Repair,Parks & Recreation Department,Park Maintenance & Safety,Equipment Repair,PARK_Park Improvement Requests,PARK,,,,,,,,,,,,,,,,,42.3594,-71.0587,Employee Generated,"(0, 0)"
578839,101001407751,06/11/2015 02:13:00 PM,06/18/2015 02:13:28 PM,07/15/2015 09:59:43 AM,OVERDUE,Closed,Case Closed. Closed date : 2015-07-15 09:59:43.5 Case Resolved,Equipment Repair,Parks & Recreation Department,Park Maintenance & Safety,Equipment Repair,PARK_Maintenance_Trades,PARK,,,239 Parker Hill Ave  Mission Hill  MA  02120,9.0,10A,8.0,B2,Mission Hill,14.0,10,1005.0,,239 Parker Hill Ave,2120.0,Address,342517.0,42.3594,-71.0587,Constituent Call,"(0, 0)"
578953,101001407904,06/11/2015 04:57:00 PM,06/18/2015 04:57:30 PM,,OVERDUE,Open,,Equipment Repair,Parks & Recreation Department,Park Maintenance & Safety,Equipment Repair,PARK_Maintenance_Trades,PARK,,,INTERSECTION of Webster St & Seaver St  East Boston  MA,1.0,09,1.0,A7,East Boston,1.0,Ward 1,101.0,,INTERSECTION Webster St & Seaver St,,Intersection,6161.0,42.3655,-71.0341,Constituent Call,"(42.3655, -71.0341)"
579106,101001408135,06/12/2015 08:29:00 AM,06/19/2015 08:30:00 AM,06/24/2015 01:21:57 PM,OVERDUE,Closed,Case Closed. Closed date : 2015-06-24 13:21:57.18 Case Resolved hop replaced  6-16-15,Equipment Repair,Parks & Recreation Department,Park Maintenance & Safety,Equipment Repair,PARK_Maintenance_Trades,PARK,,,,,,,,,,,,,,,,,42.3594,-71.0587,Employee Generated,"(0, 0)"
579120,101001408159,06/12/2015 08:47:00 AM,06/19/2015 08:47:44 AM,06/17/2015 09:37:46 AM,ONTIME,Closed,Case Closed. Closed date : 2015-06-17 09:37:46.997 Case Resolved,Equipment Repair,Parks & Recreation Department,Park Maintenance & Safety,Equipment Repair,PARK_Maintenance_Trades,PARK,,,10 Eden St  Charlestown  MA  02129,3.0,1A,1.0,A15,Charlestown,2.0,02,206.0,,10 Eden St,2129.0,Address,342116.0,42.3594,-71.0587,Constituent Call,"(0, 0)"
579257,101001408346,06/12/2015 10:47:00 AM,06/19/2015 10:47:39 AM,07/06/2015 12:51:31 PM,OVERDUE,Closed,Case Closed. Closed date : 2015-07-06 12:51:31.573 Case Resolved install new button,Equipment Repair: Ringgold Park,Parks & Recreation Department,Park Maintenance & Safety,Equipment Repair,PARK_Maintenance_Trades,PARK,,,,,,,,,,,,,,,,,42.3594,-71.0587,Self Service,"(0, 0)"
579333,101001408469,06/12/2015 12:19:00 PM,06/19/2015 12:19:42 PM,06/24/2015 01:25:03 PM,OVERDUE,Closed,Case Closed. Closed date : 2015-06-24 13:25:03.517 Case Resolved,Equipment Repair,Parks & Recreation Department,Park Maintenance & Safety,Equipment Repair,PARK_Maintenance_Trades,PARK,,,,,,,,,,,,,,,,,42.3594,-71.0587,Constituent Call,"(0, 0)"
579774,101001409148,06/13/2015 09:27:00 PM,06/22/2015 08:30:00 AM,07/14/2015 04:54:18 PM,OVERDUE,Closed,Case Closed. Closed date : 2015-07-14 16:54:18.78 Case Resolved,Equipment Repair: El Parquesito,Parks & Recreation Department,Park Maintenance & Safety,Equipment Repair,PARK_Maintenance_Trades,PARK,,,,,,,,,,,,,,,,,42.3594,-71.0587,Self Service,"(0, 0)"
579789,101001409176,06/14/2015 12:20:00 AM,06/22/2015 08:30:00 AM,06/18/2015 06:28:29 AM,ONTIME,Closed,Case Closed. Closed date : 2015-06-18 06:28:29.89 Case Resolved adj head,Equipment Repair,Parks & Recreation Department,Park Maintenance & Safety,Equipment Repair,PARK_Maintenance_Trades,PARK,,,INTERSECTION of Commonwealth Ave & Exeter St  Boston  MA,4.0,1C,8.0,D4,Back Bay,14.0,Ward 5,507.0,,INTERSECTION Commonwealth Ave & Exeter St,,Intersection,3396.0,42.3511,-71.0803,Constituent Call,"(42.3511, -71.0803)"
579796,101001409186,06/14/2015 05:38:00 AM,06/22/2015 08:30:00 AM,10/21/2015 04:50:10 PM,OVERDUE,Closed,Case Closed. Closed date : 2015-10-21 16:50:10.373 Case Resolved,Equipment Repair,Parks & Recreation Department,Park Maintenance & Safety,Equipment Repair,PARK_Maintenance_Trades,PARK,,,640-644 Huntington Ave  Mission Hill  MA  02120,9.0,10A,8.0,B2,Mission Hill,13.0,10,1001.0,E,640-644 Huntington Ave,2120.0,Address,76395.0,42.3359,-71.0996,Constituent Call,"(42.3359, -71.0996)"
579922,101001409382,06/14/2015 08:03:00 PM,06/22/2015 08:30:00 AM,07/16/2015 03:55:54 PM,OVERDUE,Closed,Case Closed. Closed date : 2015-07-16 15:55:54.82 Case Resolved,Equipment Repair,Parks & Recreation Department,Park Maintenance & Safety,Equipment Repair,PARK_Administration,PARK,,,92 Mount Ida Rd  Dorchester  MA  02122,7.0,03,3.0,C11,Dorchester,8.0,15,1509.0,,92 Mount Ida Rd,2122.0,Address,342620.0,42.3594,-71.0587,Constituent Call,"(0, 0)"
579941,101001409414,06/14/2015 10:54:00 PM,06/22/2015 08:30:00 AM,07/09/2015 04:45:23 AM,OVERDUE,Closed,Case Closed. Closed date : 2015-07-09 04:45:23.973 Case Resolved spray fixed,Equipment Repair,Parks & Recreation Department,Park Maintenance & Safety,Equipment Repair,PARK_Maintenance_Trades,PARK,,,INTERSECTION of Chiswick Rd & Commonwealth Ave  Brighton  MA,11.0,04,9.0,D14,Allston / Brighton,15.0,Ward 21,2113.0,,INTERSECTION Chiswick Rd & Commonwealth Ave,,Intersection,2992.0,42.3403,-71.1511,Constituent Call,"(42.3403, -71.1511)"
580091,101001409623,06/15/2015 09:43:00 AM,06/22/2015 09:44:02 AM,06/17/2015 06:10:49 AM,ONTIME,Closed,Case Closed. Closed date : 2015-06-17 06:10:49.907 Case Resolved fix swing,Equipment Repair,Parks & Recreation Department,Park Maintenance & Safety,Equipment Repair,PARK_Maintenance_Trades,PARK,,,56 Dunbar Ave  Dorchester  MA  02124,8.0,07,4.0,B3,Dorchester,9.0,17,1708.0,,56 Dunbar Ave,2124.0,Address,342601.0,42.3594,-71.0587,Employee Generated,"(0, 0)"
580184,101001409754,06/15/2015 11:22:00 AM,06/22/2015 11:22:27 AM,06/19/2015 06:20:11 AM,ONTIME,Closed,Case Closed. Closed date : 2015-06-19 06:20:11.19 Case Resolved wash court,Equipment Repair,Parks & Recreation Department,Park Maintenance & Safety,Equipment Repair,PARK_Maintenance_Trades,PARK,,,930 Blue Hill Ave  Dorchester  MA  02124,8.0,07,4.0,B3,Dorchester,9.0,14,1410.0,,930 Blue Hill Ave,2124.0,Address,162200.0,42.2923,-71.0846,Employee Generated,"(42.2923, -71.0846)"
580188,101001409759,06/15/2015 11:25:00 AM,06/22/2015 11:25:23 AM,06/18/2015 04:54:37 AM,ONTIME,Closed,Case Closed. Closed date : 2015-06-18 04:54:37.11 Case Resolved paint benchs,Equipment Repair,Parks & Recreation Department,Park Maintenance & Safety,Equipment Repair,PARK_Maintenance_Trades,PARK,,,1 Jewish War Veterans Dr  Jamaica Plain  MA  02130,9.0,02,7.0,B2,Greater Mattapan,13.0,12,1207.0,E,1 Jewish War Veterans Dr,2130.0,Address,163434.0,42.301,-71.0886,Employee Generated,"(42.301, -71.0886)"
580190,101001409761,06/15/2015 11:28:00 AM,06/22/2015 11:28:53 AM,06/18/2015 04:53:39 AM,ONTIME,Closed,Case Closed. Closed date : 2015-06-18 04:53:39.703 Case Resolved remove stickers,Equipment Repair,Parks & Recreation Department,Park Maintenance & Safety,Equipment Repair,PARK_Maintenance_Trades,PARK,,,330 Perkins St  Jamaica Plain  MA  02130,9.0,02,6.0,E13,Jamaica Plain,11.0,19,1903.0,,330 Perkins St,2130.0,Address,347229.0,42.3594,-71.0587,Employee Generated,"(0, 0)"
580336,101001409984,06/15/2015 03:27:00 PM,06/22/2015 03:27:49 PM,06/15/2015 03:29:22 PM,ONTIME,Closed,Case Closed. Closed date : 2015-06-15 15:29:22.79 Case Resolved done,Equipment Repair,Parks & Recreation Department,Park Maintenance & Safety,Equipment Repair,PARK_Maintenance_Trades,PARK,,,,,,,,,,,,,,,,,42.3594,-71.0587,Employee Generated,"(0, 0)"
580338,101001409987,06/15/2015 03:29:00 PM,06/22/2015 03:29:53 PM,06/15/2015 03:32:02 PM,ONTIME,Closed,Case Closed. Closed date : 2015-06-15 15:32:02.99 Case Resolved,Equipment Repair,Parks & Recreation Department,Park Maintenance & Safety,Equipment Repair,PARK_Maintenance_Trades,PARK,,,,,,,,,,,,,,,,,42.3594,-71.0587,Employee Generated,"(0, 0)"
580342,101001409992,06/15/2015 03:33:00 PM,06/22/2015 03:33:22 PM,06/15/2015 03:35:58 PM,ONTIME,Closed,Case Closed. Closed date : 2015-06-15 15:35:58.44 Case Resolved done 6-12-15,Equipment Repair,Parks & Recreation Department,Park Maintenance & Safety,Equipment Repair,PARK_Maintenance_Trades,PARK,,,,,,,,,,,,,,,,,42.3594,-71.0587,Employee Generated,"(0, 0)"
580346,101001409996,06/15/2015 03:38:00 PM,06/22/2015 03:38:15 PM,06/15/2015 03:40:02 PM,ONTIME,Closed,Case Closed. Closed date : 2015-06-15 15:40:02.397 Case Resolved done 6-7-15,Equipment Repair,Parks & Recreation Department,Park Maintenance & Safety,Equipment Repair,PARK_Maintenance_Trades,PARK,,,,,,,,,,,,,,,,,42.3594,-71.0587,Employee Generated,"(0, 0)"
580347,101001409998,06/15/2015 03:40:00 PM,06/22/2015 03:40:52 PM,06/15/2015 03:42:25 PM,ONTIME,Closed,Case Closed. Closed date : 2015-06-15 15:42:25.29 Case Resolved done,Equipment Repair,Parks & Recreation Department,Park Maintenance & Safety,Equipment Repair,PARK_Maintenance_Trades,PARK,,,,,,,,,,,,,,,,,42.3594,-71.0587,Employee Generated,"(0, 0)"
580381,101001410048,06/15/2015 04:42:00 PM,06/22/2015 04:42:21 PM,06/18/2015 04:52:27 AM,ONTIME,Closed,Case Closed. Closed date : 2015-06-18 04:52:27.923 Case Resolved wash down court,Equipment Repair,Parks & Recreation Department,Park Maintenance & Safety,Equipment Repair,PARK_Maintenance_Trades,PARK,,,150 Readville St  Hyde Park  MA  02136,12.0,08,5.0,E18,Hyde Park,10.0,18,1820.0,,150 Readville St,2136.0,Address,342480.0,42.3594,-71.0587,Employee Generated,"(0, 0)"
580384,101001410053,06/15/2015 04:52:17 PM,06/22/2015 04:52:17 PM,06/15/2015 04:53:40 PM,ONTIME,Closed,Case Closed. Closed date : 2015-06-15 16:53:40.05 Case Invalid,Equipment Repair,Parks & Recreation Department,Park Maintenance & Safety,Equipment Repair,PARK_Maintenance_Trades,PARK,,,INTERSECTION of Green St & Lamartine St  Jamaica Plain  MA,9.0,02,6.0,E13,Jamaica Plain,11.0,Ward 19,1906.0,,INTERSECTION Green St & Lamartine St,,Intersection,5435.0,42.3112,-71.1088,Constituent Call,"(42.3112, -71.1088)"
580844,101001410749,06/16/2015 01:38:00 PM,06/23/2015 01:38:19 PM,06/24/2015 10:07:23 AM,OVERDUE,Closed,Case Closed. Closed date : 2015-06-24 10:07:23.147 Case Resolved,Equipment Repair,Parks & Recreation Department,Park Maintenance & Safety,Equipment Repair,PARK_Maintenance_Trades,PARK,,,65 Quincy St  Dorchester  MA  02121,9.0,10B,7.0,B2,Dorchester,13.0,12,1206.0,,65 Quincy St,2121.0,Address,342581.0,42.3594,-71.0587,Employee Generated,"(0, 0)"
580855,101001410775,06/16/2015 02:01:00 PM,06/23/2015 02:01:26 PM,07/09/2015 04:17:45 AM,OVERDUE,Closed,Case Closed. Closed date : 2015-07-09 04:17:45.37 Case Resolved remove. graffiti,Equipment Repair,Parks & Recreation Department,Park Maintenance & Safety,Equipment Repair,PARK_Maintenance_Trades,PARK,,,58 Wachusett St  Jamaica Plain  MA  02130,12.0,02,6.0,E13,Jamaica Plain,10.0,19,1907.0,,58 Wachusett St,2130.0,Address,342566.0,42.3594,-71.0587,Employee Generated,"(0, 0)"
580960,101001410928,06/16/2015 09:51:53 PM,06/24/2015 08:30:00 AM,06/18/2015 04:48:47 AM,ONTIME,Closed,Case Closed. Closed date : 2015-06-18 04:48:47.007 Case Resolved tire swing fixed,Equipment Repair: Clarendon St. Totlot,Parks & Recreation Department,Park Maintenance & Safety,Equipment Repair,PARK_Maintenance_Trades,PARK,,,,,,,,,,,,,,,,,42.3594,-71.0587,Self Service,"(0, 0)"
581161,101001411273,06/17/2015 09:40:00 AM,06/24/2015 09:41:08 AM,06/24/2015 03:56:55 PM,OVERDUE,Closed,Case Closed. Closed date : 2015-06-24 15:56:55.473 Case Resolved,Equipment Repair,Parks & Recreation Department,Park Maintenance & Safety,Equipment Repair,PARK_Maintenance_Trades,PARK,,,1 Jewish War Veterans Dr  Jamaica Plain  MA  02130,9.0,02,7.0,B2,Greater Mattapan,13.0,12,1207.0,E,1 Jewish War Veterans Dr,2130.0,Address,163434.0,42.301,-71.0886,Employee Generated,"(42.301, -71.0886)"
581163,101001411280,06/17/2015 09:44:00 AM,06/24/2015 09:45:03 AM,06/19/2015 06:17:08 AM,ONTIME,Closed,Case Closed. Closed date : 2015-06-19 06:17:08.45 Case Resolved remove pole,Equipment Repair,Parks & Recreation Department,Park Maintenance & Safety,Equipment Repair,PARK_Maintenance_Trades,PARK,,,35 Fenway   Boston  MA  02215,4.0,10A,8.0,D4,Fenway / Kenmore / Audubon Circle / Longwood,14.0,04,407.0,E,35 Fenway,2215.0,Address,342001.0,42.3594,-71.0587,Employee Generated,"(0, 0)"
581301,101001411492,06/17/2015 12:00:00 PM,06/24/2015 12:00:17 PM,06/30/2015 01:28:02 PM,OVERDUE,Closed,Case Closed. Closed date : 2015-06-30 13:28:02.033 Case Resolved fix swing,Equipment Repair,Parks & Recreation Department,Park Maintenance & Safety,Equipment Repair,PARK_Maintenance_Trades,PARK,,,6 Holborn St  Dorchester  MA  02121,9.0,10B,7.0,B2,Dorchester,13.0,12,1206.0,E,6 Holborn St,2121.0,Address,341994.0,42.3594,-71.0587,Employee Generated,"(0, 0)"
581519,101001411771,06/17/2015 03:00:34 PM,06/24/2015 03:00:40 PM,07/09/2015 04:18:37 AM,OVERDUE,Closed,Case Closed. Closed date : 2015-07-09 04:18:37.433 Case Resolved spray is on,Equipment Repair: Shubow Park,Parks & Recreation Department,Park Maintenance & Safety,Equipment Repair,PARK_Maintenance_Trades,PARK,,,,,,,,,,,,,,,,,42.3594,-71.0587,Self Service,"(0, 0)"
581647,101001411966,06/17/2015 06:57:00 PM,06/25/2015 08:30:00 AM,06/24/2015 04:05:05 PM,ONTIME,Closed,Case Closed. Closed date : 2015-06-24 16:05:05.777 Case Noted plumbers reports main water line needs replacement out for last six years,Equipment Repair,Parks & Recreation Department,Park Maintenance & Safety,Equipment Repair,PARK_Administration,PARK,,,INTERSECTION of Faneuil St & Goodenough St  Brighton  MA,11.0,04,9.0,D14,Allston / Brighton,15.0,Ward 22,2212.0,,INTERSECTION Faneuil St & Goodenough St,,Intersection,4793.0,42.3557,-71.1543,Constituent Call,"(42.3557, -71.1543)"
581834,101001412261,06/18/2015 09:32:00 AM,06/25/2015 09:32:01 AM,06/30/2015 01:29:10 PM,OVERDUE,Closed,Case Closed. Closed date : 2015-06-30 13:29:10.26 Case Resolved,Equipment Repair: --Not in list--,Parks & Recreation Department,Park Maintenance & Safety,Equipment Repair,PARK_Maintenance_Trades,PARK,,,,,,,,,,,,,,,,,42.3594,-71.0587,Self Service,"(0, 0)"
581934,101001412417,06/18/2015 11:15:00 AM,06/25/2015 11:16:03 AM,06/20/2015 06:44:11 PM,ONTIME,Closed,Case Closed. Closed date : 2015-06-20 18:44:11.26 Case Resolved remove graffiti,Equipment Repair,Parks & Recreation Department,Park Maintenance & Safety,Equipment Repair,PARK_Maintenance_Trades,PARK,,,60 Smith St  Mission Hill  MA  02120,9.0,10A,8.0,B2,Mission Hill,14.0,10,1002.0,,60 Smith St,2120.0,Address,342526.0,42.3594,-71.0587,Employee Generated,"(0, 0)"
581945,101001412430,06/18/2015 11:24:00 AM,06/25/2015 11:24:51 AM,06/21/2015 08:46:15 AM,ONTIME,Closed,Case Closed. Closed date : 2015-06-21 08:46:15.343 Case Resolved paint ovet graffiti,Equipment Repair,Parks & Recreation Department,Park Maintenance & Safety,Equipment Repair,PARK_Maintenance_Trades,PARK,,,52 South St  Jamaica Plain  MA  02130,9.0,02,6.0,E13,Jamaica Plain,11.0,19,1906.0,E,52 South St,2130.0,Address,169805.0,42.3079,-71.1153,Employee Generated,"(42.3079, -71.1153)"
582022,101001412546,06/18/2015 01:00:00 PM,06/25/2015 01:00:19 PM,07/09/2015 04:20:36 AM,OVERDUE,Closed,Case Closed. Closed date : 2015-07-09 04:20:36.383 Case Resolved clean drain of sand,Equipment Repair,Parks & Recreation Department,Park Maintenance & Safety,Equipment Repair,PARK_Maintenance_Trades,PARK,,,75 W Rutland Sq  Roxbury  MA  02118,4.0,1C,7.0,D4,Roxbury,6.0,4,404.0,,75 W Rutland Sq,2118.0,Address,342665.0,42.3594,-71.0587,Employee Generated,"(0, 0)"
582097,101001412646,06/18/2015 02:23:00 PM,06/25/2015 02:23:36 PM,06/30/2015 01:31:27 PM,OVERDUE,Closed,Case Closed. Closed date : 2015-06-30 13:31:27.09 Case Resolved grind down post,Equipment Repair,Parks & Recreation Department,Park Maintenance & Safety,Equipment Repair,PARK_Maintenance_Trades,PARK,,,210 W Third St  South Boston  MA  02127,6.0,05,2.0,C6,South Boston,5.0,6,603.0,E,210 W Third St,2127.0,Address,341625.0,42.3393,-71.0491,Employee Generated,"(42.3393, -71.0491)"
582128,101001412683,06/18/2015 02:48:00 PM,06/25/2015 02:48:35 PM,06/26/2015 02:37:50 PM,OVERDUE,Closed,Case Closed. Closed date : 2015-06-26 14:37:50.8 Case Resolved,Equipment Repair,Parks & Recreation Department,Park Maintenance & Safety,Equipment Repair,PARK_Maintenance_Trades,PARK,,,,,,,,,,,,,,,,,42.3594,-71.0587,Employee Generated,"(0, 0)"
582417,101001413138,06/19/2015 09:28:00 AM,06/26/2015 09:29:03 AM,06/30/2015 12:51:16 PM,OVERDUE,Closed,Case Closed. Closed date : 2015-06-30 12:51:16.793 Case Resolved,Equipment Repair,Parks & Recreation Department,Park Maintenance & Safety,Equipment Repair,PARK_Maintenance_Trades,PARK,,,1005 Columbia Rd  South Boston  MA  02127,6.0,05,2.0,C6,South Boston,5.0,7,707.0,,1005 Columbia Rd,2127.0,Address,163529.0,42.3272,-71.0504,Employee Generated,"(42.3272, -71.0504)"
582594,101001413442,06/19/2015 01:45:00 PM,06/26/2015 01:46:49 PM,06/30/2015 01:20:32 PM,OVERDUE,Closed,Case Closed. Closed date : 2015-06-30 13:20:32.443 Case Resolved done,Equipment Repair,Parks & Recreation Department,Park Maintenance & Safety,Equipment Repair,PARK_Maintenance_Trades,PARK,,,70 Park Dr  Boston  MA  02215,4.0,10A,8.0,D4,Fenway / Kenmore / Audubon Circle / Longwood,14.0,05,502.0,E,70 Park Dr,2215.0,Address,342000.0,42.3594,-71.0587,Employee Generated,"(0, 0)"
583028,101001414007,06/20/2015 04:22:00 PM,06/29/2015 08:30:00 AM,06/22/2015 08:38:56 AM,ONTIME,Closed,Case Closed. Closed date : 2015-06-22 08:38:56.07 Case Resolved barrel emptied and stood upright,Equipment Repair,Parks & Recreation Department,Park Maintenance & Safety,Equipment Repair,PARK_Maintenance_Region 1,PARK,,,135 Prince St  Boston  MA  02113,3.0,1B,1.0,A1,Boston,3.0,3,303.0,,135 Prince St,2113.0,Address,342060.0,42.3594,-71.0587,Constituent Call,"(0, 0)"
583085,101001414093,06/21/2015 08:01:00 AM,06/29/2015 08:30:00 AM,07/09/2015 04:28:30 AM,OVERDUE,Closed,Case Closed. Closed date : 2015-07-09 04:28:30.947 Case Resolved replace hatdware,Equipment Repair: --Not in list--,Parks & Recreation Department,Park Maintenance & Safety,Equipment Repair,PARK_Maintenance_Trades,PARK,,,,,,,,,,,,,,,,,42.3594,-71.0587,Self Service,"(0, 0)"
583136,101001414164,06/21/2015 01:50:00 PM,06/29/2015 08:30:00 AM,06/30/2015 01:51:06 PM,OVERDUE,Closed,Case Closed. Closed date : 2015-06-30 13:51:06.723 Case Resolved replace coller,Equipment Repair,Parks & Recreation Department,Park Maintenance & Safety,Equipment Repair,PARK_Maintenance_Trades,PARK,,,1005 Washington St  Dorchester  MA  02124,8.0,07,3.0,B3,Dorchester,7.0,17,1704.0,,1005 Washington St,2124.0,Address,342680.0,42.3594,-71.0587,Constituent Call,"(0, 0)"
583144,101001414180,06/21/2015 03:09:00 PM,06/29/2015 08:30:00 AM,07/09/2015 04:30:19 AM,OVERDUE,Closed,Case Closed. Closed date : 2015-07-09 04:30:19.03 Case Resolved fix button clean drain of sand,Equipment Repair,Parks & Recreation Department,Park Maintenance & Safety,Equipment Repair,PARK_Maintenance_Trades,PARK,,,2P Brewer St  Jamaica Plain  MA  02130,9.0,02,6.0,E13,Jamaica Plain,11.0,19,1908.0,E,2P Brewer St,2130.0,Address,341464.0,42.3594,-71.0587,Constituent Call,"(0, 0)"
583158,101001414196,06/21/2015 03:39:00 PM,06/29/2015 08:30:00 AM,06/24/2015 04:09:47 PM,ONTIME,Closed,Case Closed. Closed date : 2015-06-24 16:09:47.623 Case Resolved,Equipment Repair,Parks & Recreation Department,Park Maintenance & Safety,Equipment Repair,PARK_Maintenance_Trades,PARK,,,INTERSECTION of Hanson St & Ringgold St  Roxbury  MA,4.0,1C,2.0,D4,South End,4.0,Ward 3,307.0,,INTERSECTION Hanson St & Ringgold St,,Intersection,5622.0,42.3433,-71.0696,Constituent Call,"(42.3433, -71.0696)"
583338,101001414484,06/22/2015 09:11:00 AM,06/29/2015 09:12:39 AM,06/26/2015 02:40:23 PM,ONTIME,Closed,Case Closed. Closed date : 2015-06-26 14:40:23.36 Case Resolved done,Equipment Repair,Parks & Recreation Department,Park Maintenance & Safety,Equipment Repair,PARK_Maintenance_Trades,PARK,,,,,,,,,,,,,,,,,42.3594,-71.0587,Employee Generated,"(0, 0)"
583441,101001414625,06/22/2015 10:42:00 AM,06/29/2015 10:42:00 AM,,OVERDUE,Open,,Equipment Repair,Parks & Recreation Department,Park Maintenance & Safety,Equipment Repair,PARK_Maintenance_Trades,PARK,,,25 Stonehill Rd  Hyde Park  MA  02136,12.0,08,5.0,E18,Hyde Park,10.0,18,1819.0,,25 Stonehill Rd,2136.0,Address,342657.0,42.3594,-71.0587,Constituent Call,"(0, 0)"
583480,101001414675,06/22/2015 11:04:00 AM,06/29/2015 11:04:43 AM,06/30/2015 01:21:26 PM,OVERDUE,Closed,Case Closed. Closed date : 2015-06-30 13:21:26.917 Case Resolved,Equipment Repair,Parks & Recreation Department,Park Maintenance & Safety,Equipment Repair,PARK_Maintenance_Trades,PARK,,,,,,,,,,,,,,,,,42.3594,-71.0587,Constituent Call,"(0, 0)"
583509,101001414719,06/22/2015 11:29:00 AM,06/29/2015 11:29:35 AM,09/25/2015 09:15:39 AM,OVERDUE,Closed,Case Closed. Closed date : 2015-09-25 09:15:39.817 Case Resolved Light covers were secured.,Equipment Repair,Parks & Recreation Department,Park Maintenance & Safety,Equipment Repair,PARK_Maintenance_Trades,PARK,,,,,,,,,,,,,,,,,42.3594,-71.0587,Constituent Call,"(0, 0)"
583511,101001414721,06/22/2015 11:31:00 AM,06/29/2015 11:32:02 AM,06/30/2015 12:39:07 PM,OVERDUE,Closed,Case Closed. Closed date : 2015-06-30 12:39:07.37 Case Resolved done,Equipment Repair,Parks & Recreation Department,Park Maintenance & Safety,Equipment Repair,PARK_Maintenance_Trades,PARK,,,127-129 Howard Ave  Dorchester  MA  02125,7.0,03,7.0,B2,Roxbury,13.0,13,1301.0,E,127-129 Howard Ave,2125.0,Address,75500.0,42.3159,-71.0757,Employee Generated,"(42.3159, -71.0757)"
583519,101001414733,06/22/2015 11:40:00 AM,06/29/2015 11:41:00 AM,06/30/2015 01:45:52 PM,OVERDUE,Closed,Case Closed. Closed date : 2015-06-30 13:45:52.84 Case Resolved repair benchs,Equipment Repair,Parks & Recreation Department,Park Maintenance & Safety,Equipment Repair,PARK_Maintenance_Trades,PARK,,,127-129 Howard Ave  Dorchester  MA  02125,7.0,03,7.0,B2,Roxbury,13.0,13,1301.0,E,127-129 Howard Ave,2125.0,Address,75500.0,42.3159,-71.0757,Employee Generated,"(42.3159, -71.0757)"
583557,101001414787,06/22/2015 12:18:00 PM,06/29/2015 12:18:54 PM,06/24/2015 04:00:47 PM,ONTIME,Closed,Case Closed. Closed date : 2015-06-24 16:00:47.86 Case Resolved done 6-22-15,Equipment Repair,Parks & Recreation Department,Park Maintenance & Safety,Equipment Repair,PARK_Maintenance_Trades,PARK,,,,,,,,,,,,,,,,,42.3594,-71.0587,Employee Generated,"(0, 0)"
583574,101001414820,06/22/2015 12:42:00 PM,06/29/2015 12:42:01 PM,,OVERDUE,Open,,Equipment Repair,Parks & Recreation Department,Park Maintenance & Safety,Equipment Repair,PARK_Maintenance_Trades,PARK,,,150 Readville St  Hyde Park  MA  02136,12.0,08,5.0,E18,Hyde Park,10.0,18,1820.0,,150 Readville St,2136.0,Address,342480.0,42.3594,-71.0587,Constituent Call,"(0, 0)"
584035,101001415491,06/23/2015 09:10:00 AM,06/30/2015 09:10:29 AM,,OVERDUE,Open,,Equipment Repair:,Parks & Recreation Department,Park Maintenance & Safety,Equipment Repair,PARK_Maintenance_Trades,PARK,,,,,,,,,,,,,,,,,42.3594,-71.0587,Self Service,"(0, 0)"
584063,101001415526,06/23/2015 09:28:58 AM,06/30/2015 09:28:58 AM,07/09/2015 04:33:31 AM,OVERDUE,Closed,Case Closed. Closed date : 2015-07-09 04:33:31.51 Case Resolved replace chain,Equipment Repair: McConnell Park,Parks & Recreation Department,Park Maintenance & Safety,Equipment Repair,PARK_Maintenance_Trades,PARK,https://cityworker.cityofboston.gov:8443/attachments/report/55895f29d0528e43ce387a48/photo/Report.jpg,,30 Denny St  Dorchester  MA  02125,7.0,03,3.0,C11,Dorchester,7.0,13,1310.0,,30 Denny St,2125.0,Address,342516.0,42.3594,-71.0587,City Worker App,"(0, 0)"
584307,101001415853,06/23/2015 02:35:00 PM,06/30/2015 02:35:14 PM,,OVERDUE,Open,,Equipment Repair,Parks & Recreation Department,Park Maintenance & Safety,Equipment Repair,PARK_Maintenance_Trades,PARK,,,60 Forbes St  Jamaica Plain  MA  02130,9.0,02,6.0,E13,Jamaica Plain,11.0,10,1009.0,,60 Forbes St,2130.0,Address,342420.0,42.3594,-71.0587,Constituent Call,"(0, 0)"
584381,101001415958,06/23/2015 04:09:00 PM,06/30/2015 04:09:31 PM,,OVERDUE,Open,,Equipment Repair: McConnell Park,Parks & Recreation Department,Park Maintenance & Safety,Equipment Repair,PARK_Park Improvement Requests,PARK,,,,,,,,,,,,,,,,,42.3594,-71.0587,Self Service,"(0, 0)"
584741,101001416477,06/24/2015 11:15:00 AM,07/01/2015 11:15:18 AM,06/26/2015 02:04:33 PM,ONTIME,Closed,Case Closed. Closed date : 2015-06-26 14:04:33.43 Case Noted not parks dept property,Equipment Repair,Parks & Recreation Department,Park Maintenance & Safety,Equipment Repair,PARK_Maintenance_Trades,PARK,,,INTERSECTION of Beacon St & Chestnut Hill Ave  Brighton  MA,11.0,04,9.0,D14,Allston / Brighton,15.0,Ward 21,2116.0,,INTERSECTION Beacon St & Chestnut Hill Ave,,Intersection,1079.0,42.3359,-71.1509,Constituent Call,"(42.3359, -71.1509)"
584752,101001416497,06/24/2015 11:28:00 AM,07/01/2015 11:28:28 AM,06/25/2015 12:42:52 PM,ONTIME,Closed,Case Closed. Closed date : 2015-06-25 12:42:52.9 Case Resolved raise flag,Equipment Repair,Parks & Recreation Department,Park Maintenance & Safety,Equipment Repair,PARK_Maintenance_Trades,PARK,,,230 Shawmut Ave  Roxbury  MA  02118,4.0,1C,2.0,D4,Roxbury,4.0,3,307.0,,230 Shawmut Ave,2118.0,Address,342571.0,42.3594,-71.0587,Employee Generated,"(0, 0)"
584840,101001416628,06/24/2015 01:23:00 PM,07/01/2015 01:23:08 PM,07/13/2015 11:06:28 AM,OVERDUE,Closed,Case Closed. Closed date : 2015-07-13 11:06:28.7 Case Resolved Rims replaced.,Ground Maintenance: Malcolm X Park  Malcom X Park,Parks & Recreation Department,Park Maintenance & Safety,Equipment Repair,PARK_Maintenance_Region 5,PARK,,,150 Martin Luther King Jr Blvd  Roxbury  MA  02119,9.0,10B,7.0,B2,Roxbury,13.0,12,1203.0,,150 Martin Luther King Jr Blvd,2119.0,Address,342513.0,42.3594,-71.0587,Constituent Call,"(0, 0)"
584854,101001416645,06/24/2015 01:42:00 PM,07/01/2015 01:42:06 PM,10/09/2015 01:57:23 PM,OVERDUE,Closed,Case Closed. Closed date : 2015-10-09 13:57:23.69 Case Resolved,Equipment Repair: --Not in list--,Parks & Recreation Department,Park Maintenance & Safety,Equipment Repair,PARK_Maintenance_Trades,PARK,,,,,,,,,,,,,,,,,42.3594,-71.0587,Self Service,"(0, 0)"
584855,101001416646,06/24/2015 01:42:24 PM,07/01/2015 01:42:39 PM,06/24/2015 01:53:52 PM,ONTIME,Closed,Case Closed. Closed date : 2015-06-24 13:53:52.1 Case Invalid,Equipment Repair,Parks & Recreation Department,Park Maintenance & Safety,Equipment Repair,PARK_Maintenance_Trades,PARK,,,56 Dunbar Ave  Dorchester  MA  02124,8.0,07,4.0,B3,Dorchester,9.0,17,1708.0,,56 Dunbar Ave,2124.0,Address,342601.0,42.3594,-71.0587,Employee Generated,"(0, 0)"
584856,101001416647,06/24/2015 01:43:00 PM,07/01/2015 01:44:04 PM,11/06/2015 10:35:30 AM,OVERDUE,Closed,Case Closed. Closed date : 2015-11-06 10:35:30.243 Case Resolved done 11-5-15,Equipment Repair,Parks & Recreation Department,Park Maintenance & Safety,Equipment Repair,PARK_Maintenance_Trades,PARK,,,56 Dunbar Ave  Dorchester  MA  02124,8.0,07,4.0,B3,Dorchester,9.0,17,1708.0,,56 Dunbar Ave,2124.0,Address,342601.0,42.3594,-71.0587,Employee Generated,"(0, 0)"
584866,101001416661,06/24/2015 02:02:00 PM,07/01/2015 02:02:59 PM,09/08/2015 10:05:37 AM,OVERDUE,Closed,Case Closed. Closed date : 2015-09-08 10:05:37.48 Case Resolved done 9-2-15,Equipment Repair,Parks & Recreation Department,Park Maintenance & Safety,Equipment Repair,PARK_Maintenance_Trades,PARK,,,340 Neponset Ave  Dorchester  MA  02122,8.0,07,3.0,C11,Dorchester,7.0,16,1610.0,,340 Neponset Ave,2122.0,Address,342452.0,42.3594,-71.0587,Employee Generated,"(0, 0)"
584870,101001416668,06/24/2015 02:09:00 PM,07/01/2015 02:10:35 PM,07/02/2015 02:48:24 PM,OVERDUE,Closed,Case Closed. Closed date : 2015-07-02 14:48:24.323 Case Resolved,Equipment Repair,Parks & Recreation Department,Park Maintenance & Safety,Equipment Repair,PARK_Maintenance_Trades,PARK,,,930 Blue Hill Ave  Dorchester  MA  02124,8.0,07,4.0,B3,Dorchester,9.0,14,1410.0,,930 Blue Hill Ave,2124.0,Address,162200.0,42.2923,-71.0846,Employee Generated,"(42.2923, -71.0846)"
584872,101001416673,06/24/2015 02:13:00 PM,07/01/2015 02:14:08 PM,06/30/2015 12:39:33 PM,ONTIME,Closed,Case Closed. Closed date : 2015-06-30 12:39:33.777 Case Resolved done,Equipment Repair,Parks & Recreation Department,Park Maintenance & Safety,Equipment Repair,PARK_Maintenance_Trades,PARK,,,550 Norfolk St  Mattapan  MA  02126,8.0,07,4.0,B3,Greater Mattapan,9.0,18,1802.0,,550 Norfolk St,2126.0,Address,342029.0,42.3594,-71.0587,Employee Generated,"(0, 0)"
584879,101001416682,06/24/2015 02:21:00 PM,07/01/2015 02:21:48 PM,06/30/2015 12:39:58 PM,ONTIME,Closed,Case Closed. Closed date : 2015-06-30 12:39:58.533 Case Resolved done 6=25-15,Equipment Repair,Parks & Recreation Department,Park Maintenance & Safety,Equipment Repair,PARK_Maintenance_Trades,PARK,,,930 Blue Hill Ave  Dorchester  MA  02124,8.0,07,4.0,B3,Dorchester,9.0,14,1410.0,,930 Blue Hill Ave,2124.0,Address,162200.0,42.2923,-71.0846,Employee Generated,"(42.2923, -71.0846)"
584883,101001416689,06/24/2015 02:25:00 PM,07/01/2015 02:25:48 PM,07/09/2015 04:41:20 AM,OVERDUE,Closed,Case Closed. Closed date : 2015-07-09 04:41:20.3 Case Resolved recement caps,Equipment Repair,Parks & Recreation Department,Park Maintenance & Safety,Equipment Repair,PARK_Maintenance_Trades,PARK,,,540 Adams St  Dorchester  MA  02122,8.0,07,3.0,C11,Dorchester,7.0,16,1607.0,,540 Adams St,2122.0,Address,342475.0,42.3594,-71.0587,Employee Generated,"(0, 0)"
585031,101001416899,06/24/2015 08:18:00 PM,07/02/2015 08:30:00 AM,07/02/2015 02:58:29 PM,OVERDUE,Closed,Case Closed. Closed date : 2015-07-02 14:58:29.273 Case Resolved,Equipment Repair: Dorchester Park,Parks & Recreation Department,Park Maintenance & Safety,Equipment Repair,PARK_Maintenance_Trades,PARK,,,,,,,,,,,,,,,,,42.3594,-71.0587,Self Service,"(0, 0)"
585173,101001417139,06/25/2015 09:45:00 AM,07/02/2015 09:45:41 AM,07/02/2015 02:57:13 PM,OVERDUE,Closed,Case Closed. Closed date : 2015-07-02 14:57:13.9 Case Resolved done 6-29-15,Equipment Repair,Parks & Recreation Department,Park Maintenance & Safety,Equipment Repair,PARK_Maintenance_Trades,PARK,,,,,,,,,,,,,,,,,42.3594,-71.0587,Employee Generated,"(0, 0)"
585205,101001417184,06/25/2015 10:19:00 AM,07/02/2015 10:19:45 AM,06/30/2015 06:06:27 AM,ONTIME,Closed,Case Closed. Closed date : 2015-06-30 06:06:27.357 Case Resolved repair swing,Equipment Repair,Parks & Recreation Department,Park Maintenance & Safety,Equipment Repair,PARK_Maintenance_Trades,PARK,,,27 Elmhurst St  Dorchester  MA  02124,8.0,07,4.0,B3,Dorchester,9.0,17,1705.0,E,27 Elmhurst St,2124.0,Address,53327.0,42.2893,-71.0764,Employee Generated,"(42.2893, -71.0764)"
585265,101001417276,06/25/2015 11:42:00 AM,07/02/2015 11:42:25 AM,,OVERDUE,Open,,Equipment Repair:,Parks & Recreation Department,Park Maintenance & Safety,Equipment Repair,INFO01_GenericeFormforOtherServiceRequestTypes,INFO,,,,,,,,,,,,,,,,,42.3594,-71.0587,Self Service,"(0, 0)"
585306,101001417333,06/25/2015 12:50:00 PM,07/02/2015 12:50:16 PM,,OVERDUE,Open,,Equipment Repair,Parks & Recreation Department,Park Maintenance & Safety,Equipment Repair,PARK_Park Improvement Requests,PARK,,,1-19 Church St  Dorchester  MA  02122,7.0,03,3.0,C11,Dorchester,8.0,15,1504.0,E,1-19 Church St,2122.0,Address,341523.0,42.3081,-71.0632,Constituent Call,"(42.3081, -71.0632)"
585323,101001417360,06/25/2015 01:12:48 PM,07/02/2015 01:12:57 PM,06/29/2015 06:24:37 AM,ONTIME,Closed,Case Closed. Closed date : 2015-06-29 06:24:37.187 Case Resolved,Equipment Repair,Parks & Recreation Department,Park Maintenance & Safety,Equipment Repair,PARK_Maintenance_Trades,PARK,,,125 Erie St  Dorchester  MA  02121,7.0,03,4.0,B3,Dorchester,13.0,14,1403.0,,125 Erie St,2121.0,Address,342356.0,42.3594,-71.0587,Employee Generated,"(0, 0)"
585325,101001417361,06/25/2015 01:13:00 PM,07/02/2015 01:13:41 PM,06/29/2015 06:24:09 AM,ONTIME,Closed,Case Closed. Closed date : 2015-06-29 06:24:09.79 Case Resolved remove swing,Equipment Repair,Parks & Recreation Department,Park Maintenance & Safety,Equipment Repair,PARK_Maintenance_Trades,PARK,,,125 Erie St  Dorchester  MA  02121,7.0,03,4.0,B3,Dorchester,13.0,14,1403.0,,125 Erie St,2121.0,Address,342356.0,42.3594,-71.0587,Employee Generated,"(0, 0)"
586178,101001418677,06/27/2015 02:43:00 PM,07/06/2015 08:30:00 AM,07/09/2015 04:39:06 AM,OVERDUE,Closed,Case Closed. Closed date : 2015-07-09 04:39:06.74 Case Resolved water was off,Equipment Repair,Parks & Recreation Department,Park Maintenance & Safety,Equipment Repair,PARK_Maintenance_Trades,PARK,,,75 W Rutland Sq  Roxbury  MA  02118,4.0,1C,7.0,D4,Roxbury,6.0,4,404.0,,75 W Rutland Sq,2118.0,Address,342665.0,42.3594,-71.0587,Constituent Call,"(0, 0)"
586184,101001418686,06/27/2015 03:07:00 PM,07/06/2015 08:30:00 AM,07/06/2015 12:41:33 PM,OVERDUE,Closed,Case Closed. Closed date : 2015-07-06 12:41:33.04 Case Resolved replace button,Equipment Repair: Ringgold Park,Parks & Recreation Department,Park Maintenance & Safety,Equipment Repair,PARK_Maintenance_Trades,PARK,,,,,,,,,,,,,,,,,42.3594,-71.0587,Self Service,"(0, 0)"
586369,101001418954,06/28/2015 04:39:00 PM,07/06/2015 08:30:00 AM,09/28/2015 08:58:48 AM,OVERDUE,Closed,Case Closed. Closed date : 2015-09-28 08:58:48.1 Case Resolved Spray fountain was repaired.,Equipment Repair,Parks & Recreation Department,Park Maintenance & Safety,Equipment Repair,INFO_Reallocation From Dept,INFO,,,INTERSECTION of Green St & Lamartine St  Jamaica Plain  MA,9.0,02,6.0,E13,Jamaica Plain,11.0,Ward 19,1906.0,,INTERSECTION Green St & Lamartine St,,Intersection,5435.0,42.3112,-71.1088,Constituent Call,"(42.3112, -71.1088)"
586672,101001419370,06/29/2015 10:47:00 AM,07/06/2015 10:47:07 AM,08/26/2015 01:35:18 PM,OVERDUE,Closed,Case Closed. Closed date : 2015-08-26 13:35:18.13 Case Resolved done 8-14-15,Equipment Repair,Parks & Recreation Department,Park Maintenance & Safety,Equipment Repair,PARK_Maintenance_Trades,PARK,,,150 Readville St  Hyde Park  MA  02136,12.0,08,5.0,E18,Hyde Park,10.0,18,1820.0,,150 Readville St,2136.0,Address,342480.0,42.3594,-71.0587,Employee Generated,"(0, 0)"
586823,101001419578,06/29/2015 01:10:00 PM,07/06/2015 01:10:21 PM,,OVERDUE,Open,,Equipment Repair,Parks & Recreation Department,Park Maintenance & Safety,Equipment Repair,PARK_Maintenance_Trades,PARK,,,1 Jewish War Veterans Dr  Jamaica Plain  MA  02130,9.0,02,7.0,B2,Greater Mattapan,13.0,12,1207.0,E,1 Jewish War Veterans Dr,2130.0,Address,163434.0,42.301,-71.0886,Employee Generated,"(42.301, -71.0886)"
586841,101001419602,06/29/2015 01:25:00 PM,07/06/2015 01:25:55 PM,07/09/2015 03:31:48 PM,OVERDUE,Closed,Case Closed. Closed date : 2015-07-09 15:31:48.87 Case Noted parks crew did not find any bike,Equipment Repair,Parks & Recreation Department,Park Maintenance & Safety,Equipment Repair,PARK_Maintenance_Trades,PARK,,,1 Jewish War Veterans Dr  Jamaica Plain  MA  02130,9.0,02,7.0,B2,Greater Mattapan,13.0,12,1207.0,E,1 Jewish War Veterans Dr,2130.0,Address,163434.0,42.301,-71.0886,Employee Generated,"(42.301, -71.0886)"
586929,101001419733,06/29/2015 02:56:00 PM,07/06/2015 02:57:04 PM,07/02/2015 03:01:17 PM,ONTIME,Closed,Case Closed. Closed date : 2015-07-02 15:01:17.54 Case Resolved done,Equipment Repair,Parks & Recreation Department,Park Maintenance & Safety,Equipment Repair,PARK_Maintenance_Trades,PARK,,,92 Mount Ida Rd  Dorchester  MA  02122,7.0,03,3.0,C11,Dorchester,8.0,15,1509.0,,92 Mount Ida Rd,2122.0,Address,342620.0,42.3594,-71.0587,Employee Generated,"(0, 0)"
587042,101001419892,06/29/2015 05:51:00 PM,07/07/2015 08:30:00 AM,09/25/2015 09:17:45 AM,OVERDUE,Closed,Case Closed. Closed date : 2015-09-25 09:17:45.83 Case Resolved Drinking fountain was repaired.,Equipment Repair,Parks & Recreation Department,Park Maintenance & Safety,Equipment Repair,PARK_Maintenance_Trades,PARK,,,INTERSECTION of Columbus Ave & W Newton St  Roxbury  MA,4.0,1C,2.0,D4,South End,6.0,Ward 4,404.0,,INTERSECTION Columbus Ave & W Newton St,,Intersection,3296.0,42.3432,-71.0785,Constituent Call,"(42.3432, -71.0785)"
587276,101001420241,06/30/2015 09:58:00 AM,07/07/2015 09:58:58 AM,06/30/2015 12:47:48 PM,ONTIME,Closed,Case Closed. Closed date : 2015-06-30 12:47:48.747 Case Resolved remove red paint,Equipment Repair,Parks & Recreation Department,Park Maintenance & Safety,Equipment Repair,PARK_Maintenance_Trades,PARK,,,110 Atlantic Ave  Boston  MA  02110,3.0,1B,1.0,A1,Boston,3.0,3,301.0,,110 Atlantic Ave,2110.0,Address,161702.0,42.361,-71.0522,Employee Generated,"(42.361, -71.0522)"
587427,101001420432,06/30/2015 11:49:00 AM,07/07/2015 11:49:48 AM,07/15/2015 09:51:24 AM,OVERDUE,Closed,Case Closed. Closed date : 2015-07-15 09:51:24.347 Case Resolved,Equipment Repair,Parks & Recreation Department,Park Maintenance & Safety,Equipment Repair,PARK_Maintenance_Trades,PARK,,,1 Phipps St  Charlestown  MA  02129,3.0,1A,1.0,A15,Charlestown,2.0,Ward 2,206.0,RC,1 Phipps St,2129.0,Address,293598.0,42.377,-71.0668,Employee Generated,"(42.377, -71.0668)"
587441,101001420449,06/30/2015 11:59:00 AM,07/07/2015 11:59:21 AM,07/14/2015 04:55:58 PM,OVERDUE,Closed,Case Closed. Closed date : 2015-07-14 16:55:58.417 Case Resolved,Equipment Repair,Parks & Recreation Department,Park Maintenance & Safety,Equipment Repair,PARK_Maintenance_Trades,PARK,,,21 Penniman Rd  Allston  MA  02134,11.0,04,9.0,D14,Allston,15.0,22,2202.0,,21 Penniman Rd,2134.0,Address,342569.0,42.3594,-71.0587,Employee Generated,"(0, 0)"
587550,101001420589,06/30/2015 01:42:00 PM,07/07/2015 01:42:50 PM,07/05/2015 05:39:03 PM,ONTIME,Closed,Case Closed. Closed date : 2015-07-05 17:39:03.53 Case Resolved no lock found,Equipment Repair,Parks & Recreation Department,Park Maintenance & Safety,Equipment Repair,PARK_Maintenance_Trades,PARK,,,23 Delle Ave  Mission Hill  MA  02120,9.0,10A,8.0,B2,Mission Hill,14.0,10,1002.0,,23 Delle Ave,2120.0,Address,342457.0,42.3594,-71.0587,Employee Generated,"(0, 0)"
587590,101001420652,06/30/2015 02:30:00 PM,07/07/2015 02:31:43 PM,11/06/2015 10:43:48 AM,OVERDUE,Closed,Case Closed. Closed date : 2015-11-06 10:43:48.073 Case Resolved done 11-5-15,Equipment Repair,Parks & Recreation Department,Park Maintenance & Safety,Equipment Repair,PARK_Maintenance_Trades,PARK,,,160 Florence St  Roslindale  MA  02131,12.0,02,5.0,E5,Roslindale,10.0,19,1913.0,E,160 Florence St,2131.0,Address,155813.0,42.2882,-71.1223,Employee Generated,"(42.2882, -71.1223)"
587594,101001420659,06/30/2015 02:34:00 PM,07/07/2015 02:35:00 PM,07/09/2015 04:01:36 PM,OVERDUE,Closed,Case Closed. Closed date : 2015-07-09 16:01:36.753 Case Resolved done 7-21-15,Equipment Repair,Parks & Recreation Department,Park Maintenance & Safety,Equipment Repair,PARK_Maintenance_Trades,PARK,,,40 Cornwall St  Jamaica Plain  MA  02130,9.0,02,6.0,E13,Jamaica Plain,11.0,11,1106.0,,40 Cornwall St,2130.0,Address,342402.0,42.3594,-71.0587,Employee Generated,"(0, 0)"
587804,101001420951,06/30/2015 11:54:00 PM,07/08/2015 08:30:00 AM,07/06/2015 12:39:15 PM,ONTIME,Closed,Case Closed. Closed date : 2015-07-06 12:39:15.237 Case Resolved repair dog fountain,Equipment Repair,Parks & Recreation Department,Park Maintenance & Safety,Equipment Repair,PARK_Maintenance_Trades,PARK,,,INTERSECTION of Marie St & Mount Ida Rd  Dorchester  MA,7.0,03,3.0,C11,Dorchester,8.0,Ward 15,1507.0,,INTERSECTION Marie St & Mount Ida Rd,,Intersection,7084.0,42.3054,-71.0646,Constituent Call,"(42.3054, -71.0646)"
588173,101001421447,07/01/2015 01:40:00 PM,07/08/2015 01:40:39 PM,07/09/2015 04:11:20 PM,OVERDUE,Closed,Case Closed. Closed date : 2015-07-09 16:11:20.553 Case Resolved,Equipment Repair,Parks & Recreation Department,Park Maintenance & Safety,Equipment Repair,PARK_Maintenance_Trades,PARK,,,10 Mozart St  Jamaica Plain  MA  02130,9.0,10A,6.0,E13,Jamaica Plain,11.0,10,1007.0,E,10 Mozart St,2130.0,Address,341941.0,42.3224,-71.1045,Employee Generated,"(42.3224, -71.1045)"
588181,101001421456,07/01/2015 01:46:00 PM,07/08/2015 01:46:52 PM,07/14/2015 04:48:35 PM,OVERDUE,Closed,Case Closed. Closed date : 2015-07-14 16:48:35.14 Case Resolved,Equipment Repair,Parks & Recreation Department,Park Maintenance & Safety,Equipment Repair,PARK_Maintenance_Trades,PARK,,,,,,,,,,,,,,,,,42.3594,-71.0587,Employee Generated,"(0, 0)"
588200,101001421482,07/01/2015 02:12:00 PM,07/08/2015 02:12:37 PM,,OVERDUE,Open,,Equipment Repair,Parks & Recreation Department,Park Maintenance & Safety,Equipment Repair,PARK_Maintenance_Trades,PARK,,,,,,,,,,,,,,,,,42.3594,-71.0587,Constituent Call,"(0, 0)"
588204,101001421485,07/01/2015 02:13:00 PM,07/08/2015 02:13:57 PM,07/05/2015 05:36:25 PM,ONTIME,Closed,Case Closed. Closed date : 2015-07-05 17:36:25.78 Case Resolved done,Equipment Repair,Parks & Recreation Department,Park Maintenance & Safety,Equipment Repair,PARK_Maintenance_Trades,PARK,,,,,,,,,,,,,,,,,42.3594,-71.0587,Constituent Call,"(0, 0)"
588207,101001421487,07/01/2015 02:17:00 PM,07/08/2015 02:17:19 PM,10/09/2015 07:55:53 AM,OVERDUE,Closed,Case Closed. Closed date : 2015-10-09 07:55:53.63 Case Resolved Bollard was repaired.,Equipment Repair,Parks & Recreation Department,Park Maintenance & Safety,Equipment Repair,PARK_Maintenance_Trades,PARK,,,,,,,,,,,,,,,,,42.3594,-71.0587,Constituent Call,"(0, 0)"
588321,101001421666,07/01/2015 04:27:09 PM,07/08/2015 04:27:18 PM,07/01/2015 04:28:14 PM,ONTIME,Closed,Case Closed. Closed date : 2015-07-01 16:28:14.1 Case Invalid,Equipment Repair,Parks & Recreation Department,Park Maintenance & Safety,Equipment Repair,PARK_Maintenance_Trades,PARK,,,,,,,,,,,,,,,,,42.3594,-71.0587,Employee Generated,"(0, 0)"
588323,101001421669,07/01/2015 04:29:00 PM,07/08/2015 04:29:27 PM,07/31/2015 04:47:03 AM,OVERDUE,Closed,Case Closed. Closed date : 2015-07-31 04:47:03.98 Case Resolved replace button,Equipment Repair,Parks & Recreation Department,Park Maintenance & Safety,Equipment Repair,PARK_Maintenance_Trades,PARK,,,,,,,,,,,,,,,,,42.3594,-71.0587,Constituent Call,"(0, 0)"
588540,101001421972,07/02/2015 09:18:00 AM,07/09/2015 09:18:35 AM,07/31/2015 06:10:34 AM,OVERDUE,Closed,Case Closed. Closed date : 2015-07-31 06:10:34.103 Case Resolved fix leak,Equipment Repair,Parks & Recreation Department,Park Maintenance & Safety,Equipment Repair,PARK_Maintenance_Trades,PARK,,,125 Arborway  Jamaica Plain  MA  02130,9.0,02,6.0,E13,Jamaica Plain,11.0,19,1902.0,E,125 Arborway,2130.0,Address,341526.0,42.3012,-71.1228,Constituent Call,"(42.3012, -71.1228)"
588661,101001422134,07/02/2015 11:16:00 AM,07/09/2015 11:16:36 AM,,OVERDUE,Open,,Park Improvement: Hemenway Playground,Parks & Recreation Department,Park Maintenance & Safety,Equipment Repair,PARK_Park Improvement Requests,PARK,,,,,,,,,,,,,,,,,42.3594,-71.0587,Self Service,"(0, 0)"
588819,101001422341,07/02/2015 03:03:00 PM,07/09/2015 03:03:56 PM,07/02/2015 03:06:00 PM,ONTIME,Closed,Case Closed. Closed date : 2015-07-02 15:06:00.527 Case Resolved done,Equipment Repair,Parks & Recreation Department,Park Maintenance & Safety,Equipment Repair,PARK_Maintenance_Trades,PARK,,,,,,,,,,,,,,,,,42.3594,-71.0587,Employee Generated,"(0, 0)"
588866,101001422397,07/02/2015 04:20:00 PM,07/09/2015 04:20:26 PM,07/06/2015 12:34:47 PM,ONTIME,Closed,Case Closed. Closed date : 2015-07-06 12:34:47.867 Case Resolved replace rim,Equipment Repair,Parks & Recreation Department,Park Maintenance & Safety,Equipment Repair,PARK_Maintenance_Trades,PARK,,,72 Dale St  Roxbury  MA  02119,9.0,10B,7.0,B2,Roxbury,13.0,12,1203.0,R3,72 Dale St,2119.0,Address,45756.0,42.3214,-71.0864,Employee Generated,"(42.3214, -71.0864)"
588880,101001422418,07/02/2015 05:00:41 PM,07/10/2015 08:30:00 AM,07/31/2015 06:12:00 AM,OVERDUE,Closed,Case Closed. Closed date : 2015-07-31 06:12:00.547 Case Resolved no new fountain at this time,Equipment Repair: --Not in list--,Parks & Recreation Department,Park Maintenance & Safety,Equipment Repair,PARK_Maintenance_Trades,PARK,,,,,,,,,,,,,,,,,42.3594,-71.0587,Self Service,"(0, 0)"
588968,101001422560,07/03/2015 09:18:00 AM,07/10/2015 09:18:57 AM,07/06/2015 02:38:50 PM,ONTIME,Closed,Case Closed. Closed date : 2015-07-06 14:38:50.927 Case Noted removed by parks crew,Equipment Repair,Parks & Recreation Department,Park Maintenance & Safety,Equipment Repair,PARK_Maintenance_Trades,PARK,,,6 Edgerly Rd  Boston  MA  02115,4.0,10A,7.0,D4,Boston,14.0,4,405.0,,6 Edgerly Rd,2115.0,Address,342115.0,42.3594,-71.0587,Constituent Call,"(0, 0)"
589057,101001422704,07/03/2015 01:41:00 PM,07/10/2015 01:41:20 PM,11/04/2015 10:53:35 AM,OVERDUE,Closed,Case Closed. Closed date : 2015-11-04 10:53:35.74 Case Resolved done 10-26-15,Equipment Repair,Parks & Recreation Department,Park Maintenance & Safety,Equipment Repair,PARK_Maintenance_Trades,PARK,,,145 Westminster St  Hyde Park  MA  02136,12.0,08,5.0,E18,Hyde Park,10.0,18,1815.0,,145 Westminster St,2136.0,Address,342623.0,42.3594,-71.0587,Constituent Call,"(0, 0)"
589144,101001422833,07/03/2015 11:31:50 PM,07/13/2015 08:30:00 AM,10/09/2015 07:56:38 AM,OVERDUE,Closed,Case Closed. Closed date : 2015-10-09 07:56:38.15 Case Noted No info  no location.,Equipment Repair: --Not in list--,Parks & Recreation Department,Park Maintenance & Safety,Equipment Repair,PARK_Maintenance_Trades,PARK,,,,,,,,,,,,,,,,,42.3594,-71.0587,Self Service,"(0, 0)"
589189,101001422890,07/04/2015 11:54:00 AM,07/13/2015 08:30:00 AM,,OVERDUE,Open,,Equipment Repair: East Boston Greenway,Parks & Recreation Department,Park Maintenance & Safety,Equipment Repair,INFO01_GenericeFormforOtherServiceRequestTypes,INFO,,,,,,,,,,,,,,,,,42.3594,-71.0587,Self Service,"(0, 0)"
589297,101001423082,07/05/2015 11:59:00 AM,07/13/2015 08:30:00 AM,07/29/2015 11:39:18 AM,OVERDUE,Closed,Case Closed. Closed date : 2015-07-29 11:39:18.83 Case Resolved v.i c sunscreen refilled,Equipment Repair,Parks & Recreation Department,Park Maintenance & Safety,Equipment Repair,PARK_Maintenance_Region 1,PARK,,,139 Tremont St  Boston  MA  02108,3.0,1C,8.0,A1,Beacon Hill,14.0,05,503.0,E,139 Tremont St,2108.0,Address,341542.0,42.3554,-71.0638,Constituent Call,"(42.3554, -71.0638)"
589329,101001423134,07/05/2015 04:02:21 PM,07/13/2015 08:30:00 AM,07/31/2015 06:14:34 AM,OVERDUE,Closed,Case Closed. Closed date : 2015-07-31 06:14:34.51 Case Resolved no fountain at this time,Equipment Repair: --Not in list--,Parks & Recreation Department,Park Maintenance & Safety,Equipment Repair,PARK_Maintenance_Trades,PARK,,,,,,,,,,,,,,,,,42.3594,-71.0587,Self Service,"(0, 0)"
589403,101001423246,07/06/2015 02:36:48 AM,07/13/2015 08:30:00 AM,07/31/2015 06:19:22 AM,OVERDUE,Closed,Case Closed. Closed date : 2015-07-31 06:19:22.683 Case Resolved no park name?,Equipment Repair: --Not in list--,Parks & Recreation Department,Park Maintenance & Safety,Equipment Repair,PARK_Maintenance_Trades,PARK,,,,,,,,,,,,,,,,,42.3594,-71.0587,Self Service,"(0, 0)"
589707,101001423673,07/06/2015 12:42:00 PM,07/13/2015 12:42:48 PM,07/31/2015 06:16:15 AM,OVERDUE,Closed,Case Closed. Closed date : 2015-07-31 06:16:15.507 Case Resolved Case has been classified as a long term repair. Please refer to case #101001500591.,Equipment Repair,Parks & Recreation Department,Park Maintenance & Safety,Equipment Repair,PARK_Maintenance_Trades,PARK,,,50 Myrtle St  Boston  MA  02114,3.0,1B,8.0,A1,Boston,14.0,5,503.0,,50 Myrtle St,2114.0,Address,342540.0,42.3594,-71.0587,Constituent Call,"(0, 0)"
589767,101001423749,07/06/2015 01:31:00 PM,07/13/2015 01:32:00 PM,10/09/2015 10:44:32 AM,OVERDUE,Closed,Case Closed. Closed date : 2015-10-09 10:44:32.003 Case Resolved done 9-3-15,Equipment Repair,Parks & Recreation Department,Park Maintenance & Safety,Equipment Repair,PARK_Maintenance_Trades,PARK,,,2180 Dorchester Ave  Dorchester  MA  02124,8.0,07,3.0,C11,Dorchester,7.0,16,1611.0,,2180 Dorchester Ave,2124.0,Address,342074.0,42.3594,-71.0587,Employee Generated,"(0, 0)"
589771,101001423752,07/06/2015 01:35:00 PM,07/13/2015 01:35:17 PM,07/09/2015 04:17:39 PM,ONTIME,Closed,Case Closed. Closed date : 2015-07-09 16:17:39.03 Case Resolved,Equipment Repair,Parks & Recreation Department,Park Maintenance & Safety,Equipment Repair,PARK_Maintenance_Trades,PARK,,,550 Norfolk St  Mattapan  MA  02126,8.0,07,4.0,B3,Greater Mattapan,9.0,18,1802.0,,550 Norfolk St,2126.0,Address,342029.0,42.3594,-71.0587,Employee Generated,"(0, 0)"
589784,101001423771,07/06/2015 01:46:00 PM,07/13/2015 01:46:54 PM,07/23/2015 04:11:21 PM,OVERDUE,Closed,Case Closed. Closed date : 2015-07-23 16:11:21.413 Case Resolved,Equipment Repair,Parks & Recreation Department,Park Maintenance & Safety,Equipment Repair,PARK_Maintenance_Trades,PARK,,,349 Bunker Hill St  Charlestown  MA  02129,3.0,1A,1.0,A15,Charlestown,2.0,2,207.0,E,349 Bunker Hill St,2129.0,Address,23598.0,42.3824,-71.0678,Employee Generated,"(42.3824, -71.0678)"
589922,101001423945,07/06/2015 03:59:00 PM,07/13/2015 03:59:44 PM,07/09/2015 04:16:42 PM,ONTIME,Closed,Case Closed. Closed date : 2015-07-09 16:16:42.173 Case Resolved,Equipment Repair,Parks & Recreation Department,Park Maintenance & Safety,Equipment Repair,PARK_Maintenance_Trades,PARK,,,92 Mount Ida Rd  Dorchester  MA  02122,7.0,03,3.0,C11,Dorchester,8.0,15,1509.0,,92 Mount Ida Rd,2122.0,Address,342620.0,42.3594,-71.0587,Employee Generated,"(0, 0)"
589925,101001423949,07/06/2015 04:02:00 PM,07/13/2015 04:02:58 PM,07/09/2015 04:10:28 AM,ONTIME,Closed,Case Closed. Closed date : 2015-07-09 04:10:28.427 Case Resolved not parks dept clock,Equipment Repair,Parks & Recreation Department,Park Maintenance & Safety,Equipment Repair,PARK_Maintenance_Trades,PARK,,,INTERSECTION of Beacon St & Chestnut Hill Ave  Brighton  MA,11.0,04,9.0,D14,Allston / Brighton,15.0,Ward 21,2116.0,,INTERSECTION Beacon St & Chestnut Hill Ave,,Intersection,1079.0,42.3359,-71.1509,Constituent Call,"(42.3359, -71.1509)"
589973,101001424010,07/06/2015 05:46:16 PM,07/14/2015 08:30:00 AM,10/06/2015 06:23:25 AM,OVERDUE,Closed,Case Closed. Closed date : 2015-10-06 06:23:25.227 Case Resolved paint over graffiti,Equipment Repair:,Parks & Recreation Department,Park Maintenance & Safety,Equipment Repair,PARK_Maintenance_Trades,PARK,,,,,,,,,,,,,,,,,42.3594,-71.0587,Self Service,"(0, 0)"
589979,101001424020,07/06/2015 05:58:00 PM,07/14/2015 08:30:00 AM,07/31/2015 02:31:51 PM,OVERDUE,Closed,Case Closed. Closed date : 2015-07-31 14:31:51.027 Case Noted trades division can not reach graffiiti on rock,Equipment Repair:,Parks & Recreation Department,Park Maintenance & Safety,Equipment Repair,PARK_Maintenance_Trades,PARK,,,,,,,,,,,,,,,,,42.3594,-71.0587,Self Service,"(0, 0)"
590022,101001424089,07/06/2015 08:42:00 PM,07/14/2015 08:30:00 AM,07/15/2015 10:10:54 AM,OVERDUE,Closed,Case Closed. Closed date : 2015-07-15 10:10:54.813 Case Resolved,Equipment Repair,Parks & Recreation Department,Park Maintenance & Safety,Equipment Repair,PARK_Maintenance_Trades,PARK,,,INTERSECTION of Humboldt Ave & Townsend St  Boston  MA,9.0,10B,7.0,B2,Roxbury,13.0,Ward 12,1202.0,,INTERSECTION Humboldt Ave & Townsend St,,Intersection,6403.0,42.3171,-71.0865,Constituent Call,"(42.3171, -71.0865)"
590101,101001424201,07/07/2015 08:33:53 AM,07/14/2015 08:33:53 AM,07/31/2015 06:21:33 AM,OVERDUE,Closed,Case Closed. Closed date : 2015-07-31 06:21:33.113 Case Resolved install new sign,Equipment Repair: Hemenway Playground,Parks & Recreation Department,Park Maintenance & Safety,Equipment Repair,PARK_Maintenance_Trades,PARK,https://cityworker.cityofboston.gov:8443/attachments/report/559bc74ed0528e43ce38f2fe/photo/Report.jpg,,540 Adams St  Dorchester  MA  02122,8.0,07,3.0,C11,Dorchester,7.0,16,1607.0,,540 Adams St,2122.0,Address,342475.0,42.3594,-71.0587,City Worker App,"(0, 0)"
590241,101001424396,07/07/2015 10:31:00 AM,07/14/2015 10:31:25 AM,07/07/2015 10:34:54 AM,ONTIME,Closed,Case Closed. Closed date : 2015-07-07 10:34:54.74 Case Invalid DCR park. new case created to DCR,Equipment Repair,Parks & Recreation Department,Park Maintenance & Safety,Equipment Repair,PARK_Maintenance_Trades,PARK,,,INTERSECTION of Granite Ave & Hill Top St  Dorchester  MA,8.0,07,3.0,C11,Dorchester,7.0,Ward 16,1612.0,,INTERSECTION Granite Ave & Hill Top St,,Intersection,5416.0,42.2789,-71.0542,Constituent Call,"(42.2789, -71.0542)"
590263,101001424432,07/07/2015 11:00:00 AM,07/14/2015 11:00:20 AM,07/14/2015 04:50:50 PM,OVERDUE,Closed,Case Closed. Closed date : 2015-07-14 16:50:50.983 Case Resolved done,Equipment Repair,Parks & Recreation Department,Park Maintenance & Safety,Equipment Repair,PARK_Maintenance_Trades,PARK,,,92 Mount Ida Rd  Dorchester  MA  02122,7.0,03,3.0,C11,Dorchester,8.0,15,1509.0,,92 Mount Ida Rd,2122.0,Address,342620.0,42.3594,-71.0587,Constituent Call,"(0, 0)"
590265,101001424439,07/07/2015 11:03:00 AM,07/14/2015 11:03:15 AM,07/14/2015 04:52:25 PM,OVERDUE,Closed,Case Closed. Closed date : 2015-07-14 16:52:25.403 Case Resolved,Equipment Repair,Parks & Recreation Department,Park Maintenance & Safety,Equipment Repair,PARK_Maintenance_Trades,PARK,,,92 Mount Ida Rd  Dorchester  MA  02122,7.0,03,3.0,C11,Dorchester,8.0,15,1509.0,,92 Mount Ida Rd,2122.0,Address,342620.0,42.3594,-71.0587,Constituent Call,"(0, 0)"
590311,101001424506,07/07/2015 11:52:00 AM,07/14/2015 11:52:13 AM,07/09/2015 04:07:28 AM,ONTIME,Closed,Case Closed. Closed date : 2015-07-09 04:07:28.77 Case Resolved new nets install,Equipment Repair,Parks & Recreation Department,Park Maintenance & Safety,Equipment Repair,PARK_Maintenance_Trades,PARK,,,143 Porter St  East Boston  MA  02128,1.0,09,1.0,A7,East Boston,1.0,01,105.0,,143 Porter St,2128.0,Address,344495.0,42.3594,-71.0587,Constituent Call,"(0, 0)"
590378,101001424602,07/07/2015 01:19:00 PM,07/14/2015 01:19:16 PM,07/14/2015 04:49:24 PM,OVERDUE,Closed,Case Closed. Closed date : 2015-07-14 16:49:24.103 Case Resolved done,Equipment Repair,Parks & Recreation Department,Park Maintenance & Safety,Equipment Repair,PARK_Maintenance_Trades,PARK,,,1497 Tremont St  Mission Hill  MA  02120,9.0,10A,8.0,B2,Mission Hill,14.0,10,1002.0,E,1497 Tremont St,2120.0,Address,136855.0,42.3325,-71.0991,Constituent Call,"(42.3325, -71.0991)"
590400,101001424633,07/07/2015 01:51:00 PM,07/14/2015 01:51:28 PM,07/09/2015 04:19:09 PM,ONTIME,Closed,Case Closed. Closed date : 2015-07-09 16:19:09.76 Case Resolved,Equipment Repair,Parks & Recreation Department,Park Maintenance & Safety,Equipment Repair,PARK_Maintenance_Trades,PARK,,,2180 Dorchester Ave  Dorchester  MA  02124,8.0,07,3.0,C11,Dorchester,7.0,16,1611.0,,2180 Dorchester Ave,2124.0,Address,342074.0,42.3594,-71.0587,Employee Generated,"(0, 0)"
590472,101001424722,07/07/2015 03:13:00 PM,07/14/2015 03:13:49 PM,07/09/2015 04:17:12 PM,ONTIME,Closed,Case Closed. Closed date : 2015-07-09 16:17:12.74 Case Resolved,Equipment Repair,Parks & Recreation Department,Park Maintenance & Safety,Equipment Repair,PARK_Maintenance_Trades,PARK,,,1 Jewish War Veterans Dr  Jamaica Plain  MA  02130,9.0,02,7.0,B2,Greater Mattapan,13.0,12,1207.0,E,1 Jewish War Veterans Dr,2130.0,Address,163434.0,42.301,-71.0886,Employee Generated,"(42.301, -71.0886)"
590517,101001424782,07/07/2015 04:08:00 PM,07/14/2015 04:08:02 PM,07/14/2015 04:49:00 PM,OVERDUE,Closed,Case Closed. Closed date : 2015-07-14 16:49:00.623 Case Resolved,Equipment Repair,Parks & Recreation Department,Park Maintenance & Safety,Equipment Repair,PARK_Maintenance_Trades,PARK,,,60 Smith St  Mission Hill  MA  02120,9.0,10A,8.0,B2,Mission Hill,14.0,10,1002.0,,60 Smith St,2120.0,Address,342526.0,42.3594,-71.0587,Constituent Call,"(0, 0)"
590586,101001424880,07/07/2015 06:52:00 PM,07/15/2015 08:30:00 AM,07/23/2015 03:25:26 PM,OVERDUE,Closed,Case Closed. Closed date : 2015-07-23 15:25:26.483 Case Resolved,Equipment Repair,Parks & Recreation Department,Park Maintenance & Safety,Equipment Repair,PARK_Maintenance_Trades,PARK,,,21 Stanley St  Dorchester  MA  02125,7.0,03,3.0,C11,Dorchester,8.0,15,1501.0,,21 Stanley St,2125.0,Address,344013.0,42.3594,-71.0587,Constituent Call,"(0, 0)"
590778,101001425145,07/08/2015 09:40:00 AM,07/15/2015 09:40:49 AM,07/23/2015 03:22:46 PM,OVERDUE,Closed,Case Closed. Closed date : 2015-07-23 15:22:46.207 Case Resolved done,Equipment Repair,Parks & Recreation Department,Park Maintenance & Safety,Equipment Repair,PARK_Maintenance_Trades,PARK,,,529-543 Commercial St  Boston  MA  02109,3.0,1B,1.0,A1,Boston,3.0,3,302.0,E,529-543 Commercial St,2109.0,Address,36790.0,42.3688,-71.0562,Employee Generated,"(42.3688, -71.0562)"
590785,101001425152,07/08/2015 09:45:00 AM,07/15/2015 09:45:09 AM,,OVERDUE,Open,,Equipment Repair,Parks & Recreation Department,Park Maintenance & Safety,Equipment Repair,PARK_Maintenance_Trades,PARK,,,517 Commercial St  Boston  MA  02109,3.0,1B,1.0,A1,Boston,3.0,3,302.0,E,517 Commercial St,2109.0,Address,341654.0,42.3682,-71.0543,Employee Generated,"(42.3682, -71.0543)"
590792,101001425161,07/08/2015 09:51:00 AM,07/15/2015 09:52:00 AM,07/31/2015 06:22:19 AM,OVERDUE,Closed,Case Closed. Closed date : 2015-07-31 06:22:19.117 Case Resolved remove graffiti,Equipment Repair,Parks & Recreation Department,Park Maintenance & Safety,Equipment Repair,PARK_Maintenance_Trades,PARK,,,40 Dell Ave  Hyde Park  MA  02136,12.0,08,5.0,E18,Hyde Park,10.0,18,1813.0,,40 Dell Ave,2136.0,Address,344008.0,42.3594,-71.0587,Employee Generated,"(0, 0)"
590796,101001425167,07/08/2015 09:54:00 AM,07/15/2015 09:54:53 AM,07/23/2015 03:32:43 PM,OVERDUE,Closed,Case Closed. Closed date : 2015-07-23 15:32:43.21 Case Resolved,Equipment Repair,Parks & Recreation Department,Park Maintenance & Safety,Equipment Repair,PARK_Maintenance_Trades,PARK,,,300 Condor St  East Boston  MA  02128,1.0,09,1.0,A7,East Boston,1.0,01,109.0,E,300 Condor St,2128.0,Address,42041.0,42.383,-71.0295,Employee Generated,"(42.383, -71.0295)"
590863,101001425259,07/08/2015 10:58:00 AM,07/15/2015 10:59:03 AM,,OVERDUE,Open,,Equipment Repair: Clifford Playground,Parks & Recreation Department,Park Maintenance & Safety,Equipment Repair,PARK_Park Improvement Requests,PARK,,,,,,,,,,,,,,,,,42.3594,-71.0587,Self Service,"(0, 0)"
590901,101001425304,07/08/2015 11:33:00 AM,07/15/2015 11:33:44 AM,07/14/2015 04:51:42 PM,ONTIME,Closed,Case Closed. Closed date : 2015-07-14 16:51:42.27 Case Resolved,Equipment Repair: Ronan Park,Parks & Recreation Department,Park Maintenance & Safety,Equipment Repair,PARK_Maintenance_Trades,PARK,,,,,,,,,,,,,,,,,42.3594,-71.0587,Self Service,"(0, 0)"
590922,101001425328,07/08/2015 11:54:00 AM,07/15/2015 11:54:28 AM,07/31/2015 06:24:35 AM,OVERDUE,Closed,Case Closed. Closed date : 2015-07-31 06:24:35.797 Case Resolved install bench,Equipment Repair,Parks & Recreation Department,Park Maintenance & Safety,Equipment Repair,PARK_Maintenance_Trades,PARK,,,,,,,,,,,,,,,,,42.3594,-71.0587,Employee Generated,"(0, 0)"
590972,101001425390,07/08/2015 12:38:00 PM,07/15/2015 12:39:07 PM,07/29/2015 06:36:25 AM,OVERDUE,Closed,Case Closed. Closed date : 2015-07-29 06:36:25.807 Case Resolved replace button,Equipment Repair,Parks & Recreation Department,Park Maintenance & Safety,Equipment Repair,PARK_Maintenance_Trades,PARK,,,21 Stanley St  Dorchester  MA  02125,7.0,03,3.0,C11,Dorchester,8.0,15,1501.0,,21 Stanley St,2125.0,Address,344013.0,42.3594,-71.0587,Employee Generated,"(0, 0)"
591014,101001425457,07/08/2015 01:37:00 PM,07/15/2015 01:37:55 PM,07/15/2015 10:09:59 AM,ONTIME,Closed,Case Closed. Closed date : 2015-07-15 10:09:59.903 Case Resolved,Equipment Repair,Parks & Recreation Department,Park Maintenance & Safety,Equipment Repair,PARK_Maintenance_Trades,PARK,,,330 Perkins St  Jamaica Plain  MA  02130,9.0,02,6.0,E13,Jamaica Plain,11.0,19,1903.0,,330 Perkins St,2130.0,Address,347229.0,42.3594,-71.0587,Constituent Call,"(0, 0)"
591117,101001425612,07/08/2015 04:06:09 PM,07/15/2015 04:06:09 PM,08/04/2015 05:54:59 AM,OVERDUE,Closed,Case Closed. Closed date : 2015-08-04 05:54:59.19 Case Resolved pipe fixed,Equipment Repair: Mission Hill Playground,Parks & Recreation Department,Park Maintenance & Safety,Equipment Repair,PARK_Maintenance_Trades,PARK,,,,,,,,,,,,,,,,,42.3594,-71.0587,Self Service,"(0, 0)"
591120,101001425617,07/08/2015 04:11:00 PM,07/15/2015 04:11:45 PM,07/15/2015 10:11:14 AM,ONTIME,Closed,Case Closed. Closed date : 2015-07-15 10:11:14.11 Case Resolved,Equipment Repair,Parks & Recreation Department,Park Maintenance & Safety,Equipment Repair,PARK_Maintenance_Trades,PARK,,,92 Mount Ida Rd  Dorchester  MA  02122,7.0,03,3.0,C11,Dorchester,8.0,15,1509.0,,92 Mount Ida Rd,2122.0,Address,342620.0,42.3594,-71.0587,Employee Generated,"(0, 0)"
591127,101001425622,07/08/2015 04:19:00 PM,07/15/2015 04:19:11 PM,07/16/2015 03:48:22 PM,OVERDUE,Closed,Case Closed. Closed date : 2015-07-16 15:48:22.863 Case Resolved,Equipment Repair,Parks & Recreation Department,Park Maintenance & Safety,Equipment Repair,PARK_Maintenance_Trades,PARK,,,30 Denny St  Dorchester  MA  02125,7.0,03,3.0,C11,Dorchester,7.0,13,1310.0,,30 Denny St,2125.0,Address,342516.0,42.3594,-71.0587,Employee Generated,"(0, 0)"
591128,101001425625,07/08/2015 04:22:00 PM,07/15/2015 04:22:46 PM,07/15/2015 10:15:22 AM,ONTIME,Closed,Case Closed. Closed date : 2015-07-15 10:15:22.417 Case Resolved,Equipment Repair,Parks & Recreation Department,Park Maintenance & Safety,Equipment Repair,PARK_Maintenance_Trades,PARK,,,1 Jewish War Veterans Dr  Jamaica Plain  MA  02130,9.0,02,7.0,B2,Greater Mattapan,13.0,12,1207.0,E,1 Jewish War Veterans Dr,2130.0,Address,163434.0,42.301,-71.0886,Employee Generated,"(42.301, -71.0886)"
591170,101001425679,07/08/2015 06:17:00 PM,07/16/2015 08:30:00 AM,,OVERDUE,Open,,Equipment Repair,Parks & Recreation Department,Park Maintenance & Safety,Equipment Repair,INFO01_GenericeFormforOtherServiceRequestTypes,INFO,,,920 Truman Pkwy  Hyde Park  MA  02136,12.0,08,5.0,E18,Hyde Park,10.0,18,1817.0,,920 Truman Pkwy,2136.0,Address,352901.0,42.3594,-71.0587,Constituent Call,"(0, 0)"
591234,101001425768,07/09/2015 01:34:14 AM,07/16/2015 08:30:00 AM,07/31/2015 06:30:30 AM,OVERDUE,Closed,Case Closed. Closed date : 2015-07-31 06:30:30.843 Case Resolved replace button,Equipment Repair,Parks & Recreation Department,Park Maintenance & Safety,Equipment Repair,PARK_Maintenance_Trades,PARK,,,INTERSECTION of D St & W Third St  South Boston  MA,6.0,05,2.0,C6,South Boston / South Boston Waterfront,5.0,Ward 6,601.0,,INTERSECTION D St & W Third St,,Intersection,3811.0,42.3396,-71.0499,Constituent Call,"(42.3396, -71.0499)"
591272,101001425821,07/09/2015 08:28:53 AM,07/16/2015 08:30:00 AM,07/10/2015 02:59:41 PM,ONTIME,Closed,Case Closed. Closed date : 2015-07-10 14:59:41.97 Case Resolved,Equipment Repair: --Not in list--,Parks & Recreation Department,Park Maintenance & Safety,Equipment Repair,PARK_Maintenance_Trades,PARK,,,,,,,,,,,,,,,,,42.3594,-71.0587,Self Service,"(0, 0)"
591579,101001426192,07/09/2015 01:37:00 PM,07/16/2015 01:37:44 PM,07/23/2015 03:28:40 PM,OVERDUE,Closed,Case Closed. Closed date : 2015-07-23 15:28:40.563 Case Resolved,Equipment Repair,Parks & Recreation Department,Park Maintenance & Safety,Equipment Repair,PARK_Maintenance_Trades,PARK,,,26 Pontiac St  Mission Hill  MA  02120,9.0,10A,8.0,B2,Mission Hill,14.0,10,1002.0,,26 Pontiac St,2120.0,Address,172343.0,42.3319,-71.1009,Constituent Call,"(42.3319, -71.1009)"
591613,101001426238,07/09/2015 02:17:00 PM,07/16/2015 02:17:51 PM,07/16/2015 03:58:05 PM,OVERDUE,Closed,Case Closed. Closed date : 2015-07-16 15:58:05.0 Case Resolved,Equipment Repair,Parks & Recreation Department,Park Maintenance & Safety,Equipment Repair,PARK_Maintenance_Trades,PARK,,,85 Allston St  Allston  MA  02134,11.0,04,9.0,D14,Allston,15.0,21,2106.0,,85 Allston St,2134.0,Address,342014.0,42.3594,-71.0587,Employee Generated,"(0, 0)"
591623,101001426243,07/09/2015 02:19:00 PM,07/16/2015 02:19:32 PM,10/15/2015 10:38:17 AM,OVERDUE,Closed,Case Closed. Closed date : 2015-10-15 10:38:17.303 Case Resolved done 10-13-15,Equipment Repair,Parks & Recreation Department,Park Maintenance & Safety,Equipment Repair,PARK_Maintenance_Trades,PARK,,,85 Allston St  Allston  MA  02134,11.0,04,9.0,D14,Allston,15.0,21,2106.0,,85 Allston St,2134.0,Address,342014.0,42.3594,-71.0587,Employee Generated,"(0, 0)"
591655,101001426288,07/09/2015 03:00:00 PM,07/16/2015 03:00:36 PM,07/23/2015 03:28:17 PM,OVERDUE,Closed,Case Closed. Closed date : 2015-07-23 15:28:17.673 Case Resolved,Equipment Repair: Mission Hill Playground,Parks & Recreation Department,Park Maintenance & Safety,Equipment Repair,PARK_Maintenance_Trades,PARK,,,,,,,,,,,,,,,,,42.3594,-71.0587,Self Service,"(0, 0)"
591737,101001426401,07/09/2015 04:56:00 PM,07/16/2015 04:56:26 PM,07/14/2015 04:51:18 PM,ONTIME,Closed,Case Closed. Closed date : 2015-07-14 16:51:18.983 Case Resolved,Equipment Repair,Parks & Recreation Department,Park Maintenance & Safety,Equipment Repair,PARK_Maintenance_Trades,PARK,,,92 Mount Ida Rd  Dorchester  MA  02122,7.0,03,3.0,C11,Dorchester,8.0,15,1509.0,,92 Mount Ida Rd,2122.0,Address,342620.0,42.3594,-71.0587,Employee Generated,"(0, 0)"
591971,101001426748,07/10/2015 10:35:00 AM,07/17/2015 10:35:35 AM,09/25/2015 09:19:46 AM,OVERDUE,Closed,Case Closed. Closed date : 2015-09-25 09:19:46.883 Case Resolved Swing and drinking fountain were repaired.,Equipment Repair: Buckley Playground,Parks & Recreation Department,Park Maintenance & Safety,Equipment Repair,PARK_Maintenance_Trades,PARK,,,,,,,,,,,,,,,,,42.3594,-71.0587,Self Service,"(0, 0)"
592021,101001426814,07/10/2015 11:19:00 AM,07/17/2015 11:19:35 AM,07/10/2015 02:13:38 PM,ONTIME,Closed,Case Closed. Closed date : 2015-07-10 14:13:38.013 Case Resolved,Equipment Repair,Parks & Recreation Department,Park Maintenance & Safety,Equipment Repair,PARK_Maintenance_Trades,PARK,,,210 W Third St  South Boston  MA  02127,6.0,05,2.0,C6,South Boston,5.0,6,603.0,E,210 W Third St,2127.0,Address,341625.0,42.3393,-71.0491,Constituent Call,"(42.3393, -71.0491)"
592028,101001426822,07/10/2015 11:25:00 AM,07/17/2015 11:26:06 AM,07/16/2015 03:57:35 PM,ONTIME,Closed,Case Closed. Closed date : 2015-07-16 15:57:35.473 Case Resolved,Equipment Repair,Parks & Recreation Department,Park Maintenance & Safety,Equipment Repair,PARK_Maintenance_Trades,PARK,,,210 W Third St  South Boston  MA  02127,6.0,05,2.0,C6,South Boston,5.0,6,603.0,E,210 W Third St,2127.0,Address,341625.0,42.3393,-71.0491,Employee Generated,"(42.3393, -71.0491)"
592073,101001426885,07/10/2015 12:34:00 PM,07/17/2015 12:34:40 PM,07/10/2015 02:10:24 PM,ONTIME,Closed,Case Closed. Closed date : 2015-07-10 14:10:24.33 Duplicate of Existing Case,Equipment Repair,Parks & Recreation Department,Park Maintenance & Safety,Equipment Repair,PARK_Maintenance_Trades,PARK,,,INTERSECTION of D St & W Third St  South Boston  MA,6.0,05,2.0,C6,South Boston / South Boston Waterfront,5.0,Ward 6,601.0,,INTERSECTION D St & W Third St,,Intersection,3811.0,42.3396,-71.0499,Constituent Call,"(42.3396, -71.0499)"
592151,101001426980,07/10/2015 01:57:00 PM,07/17/2015 01:57:54 PM,07/23/2015 03:24:22 PM,OVERDUE,Closed,Case Closed. Closed date : 2015-07-23 15:24:22.84 Case Resolved,Equipment Repair,Parks & Recreation Department,Park Maintenance & Safety,Equipment Repair,PARK_Maintenance_Trades,PARK,,,,,,,,,,,,,,,,,42.3594,-71.0587,Constituent Call,"(0, 0)"
592262,101001427131,07/10/2015 04:01:00 PM,07/17/2015 04:02:05 PM,07/17/2015 10:19:29 AM,ONTIME,Closed,Case Closed. Closed date : 2015-07-17 10:19:29.34 Case Resolved power wash tot lot,Equipment Repair,Parks & Recreation Department,Park Maintenance & Safety,Equipment Repair,PARK_Maintenance_Trades,PARK,,,6 Holborn St  Dorchester  MA  02121,9.0,10B,7.0,B2,Dorchester,13.0,12,1206.0,E,6 Holborn St,2121.0,Address,341994.0,42.3594,-71.0587,Employee Generated,"(0, 0)"
592297,101001427172,07/10/2015 05:22:20 PM,07/20/2015 08:30:00 AM,07/17/2015 10:22:52 AM,ONTIME,Closed,Case Closed. Closed date : 2015-07-17 10:22:52.9 Case Resolved install new valve & button,Equipment Repair:,Parks & Recreation Department,Park Maintenance & Safety,Equipment Repair,PARK_Maintenance_Trades,PARK,,,,,,,,,,,,,,,,,42.3594,-71.0587,Self Service,"(0, 0)"
592318,101001427210,07/10/2015 07:20:00 PM,07/20/2015 08:30:00 AM,07/14/2015 11:17:38 AM,ONTIME,Closed,Case Closed. Closed date : 2015-07-14 11:17:38.023 Case Noted Porter pottie company has been notified.,Equipment Repair,Parks & Recreation Department,Park Maintenance & Safety,Equipment Repair,PARK_Maintenance_Trades,PARK,,,INTERSECTION of Orleans St & Porter St  East Boston  MA,1.0,09,1.0,A7,East Boston,1.0,Ward 1,105.0,,INTERSECTION Orleans St & Porter St,,Intersection,7743.0,42.3719,-71.0339,Constituent Call,"(42.3719, -71.0339)"
592336,101001427238,07/10/2015 09:44:13 PM,07/20/2015 08:30:00 AM,07/23/2015 03:59:30 PM,OVERDUE,Closed,Case Closed. Closed date : 2015-07-23 15:59:30.18 Case Resolved done,Equipment Repair:,Parks & Recreation Department,Park Maintenance & Safety,Equipment Repair,PARK_Maintenance_Trades,PARK,,,,,,,,,,,,,,,,,42.3594,-71.0587,Self Service,"(0, 0)"
592437,101001427400,07/11/2015 02:23:20 PM,07/20/2015 08:30:00 AM,07/23/2015 03:57:49 PM,OVERDUE,Closed,Case Closed. Closed date : 2015-07-23 15:57:49.56 Case Resolved,Equipment Repair:,Parks & Recreation Department,Park Maintenance & Safety,Equipment Repair,PARK_Maintenance_Trades,PARK,,,,,,,,,,,,,,,,,42.3594,-71.0587,Self Service,"(0, 0)"
592498,101001427499,07/11/2015 08:17:00 PM,07/20/2015 08:30:00 AM,,OVERDUE,Open,,Equipment Repair,Parks & Recreation Department,Park Maintenance & Safety,Equipment Repair,PARK_Maintenance_Trades,PARK,,,10 Mozart St  Jamaica Plain  MA  02130,9.0,10A,6.0,E13,Jamaica Plain,11.0,10,1007.0,E,10 Mozart St,2130.0,Address,341941.0,42.3224,-71.1045,Constituent Call,"(42.3224, -71.1045)"
592517,101001427526,07/11/2015 10:36:00 PM,07/20/2015 08:30:00 AM,07/16/2015 03:12:06 PM,ONTIME,Closed,Case Closed. Closed date : 2015-07-16 15:12:06.997 Case Resolved done,Equipment Repair: Walker Playground,Parks & Recreation Department,Park Maintenance & Safety,Equipment Repair,PARK_Maintenance_Trades,PARK,,,,,,,,,,,,,,,,,42.3594,-71.0587,Self Service,"(0, 0)"
592613,101001427670,07/12/2015 12:50:00 PM,07/20/2015 08:30:00 AM,10/15/2015 10:41:19 AM,OVERDUE,Closed,Case Closed. Closed date : 2015-10-15 10:41:19.953 Case Resolved done 10-14-15,Equipment Repair: Ringer Playground,Parks & Recreation Department,Park Maintenance & Safety,Equipment Repair,PARK_Maintenance_Trades,PARK,,,,,,,,,,,,,,,,,42.3594,-71.0587,Self Service,"(0, 0)"
592625,101001427689,07/12/2015 02:23:00 PM,07/20/2015 08:30:00 AM,08/03/2015 11:56:02 AM,OVERDUE,Closed,Case Closed. Closed date : 2015-08-03 11:56:02.16 Case Noted not park dept park & under construction,Equipment Repair,Parks & Recreation Department,Park Maintenance & Safety,Equipment Repair,PARK_Maintenance_Trades,PARK,,,INTERSECTION of Border St & Sumner St  East Boston  MA,1.0,09,1.0,A7,East Boston,1.0,Ward 1,103.0,,INTERSECTION Border St & Sumner St,,Intersection,1644.0,42.3704,-71.0432,Constituent Call,"(42.3704, -71.0432)"
592946,101001428138,07/13/2015 11:31:00 AM,07/20/2015 11:31:16 AM,08/03/2015 01:32:09 PM,OVERDUE,Closed,Case Closed. Closed date : 2015-08-03 13:32:09.673 Case Noted water is on at sweeney park,Equipment Repair:,Parks & Recreation Department,Park Maintenance & Safety,Equipment Repair,PARK_Maintenance_Trades,PARK,,,,,,,,,,,,,,,,,42.3594,-71.0587,Self Service,"(0, 0)"
592989,101001428191,07/13/2015 12:09:00 PM,07/20/2015 12:09:41 PM,07/24/2015 11:02:24 AM,OVERDUE,Closed,Case Closed. Closed date : 2015-07-24 11:02:24.23 Case Noted contractor notified,Equipment Repair:,Parks & Recreation Department,Park Maintenance & Safety,Equipment Repair,PARK_Maintenance_Trades,PARK,,,,,,,,,,,,,,,,,42.3594,-71.0587,Self Service,"(0, 0)"
593011,101001428218,07/13/2015 12:34:00 PM,07/20/2015 12:34:41 PM,07/23/2015 03:15:48 PM,OVERDUE,Closed,Case Closed. Closed date : 2015-07-23 15:15:48.043 Case Resolved,Equipment Repair,Parks & Recreation Department,Park Maintenance & Safety,Equipment Repair,PARK_Maintenance_Trades,PARK,,,,,,,,,,,,,,,,,42.3594,-71.0587,Employee Generated,"(0, 0)"
593052,101001428271,07/13/2015 01:24:53 PM,07/20/2015 01:24:53 PM,08/04/2015 05:58:35 AM,OVERDUE,Closed,Case Closed. Closed date : 2015-08-04 05:58:35.933 Case Resolved fountain fixed,Equipment Repair: Shubow Park,Parks & Recreation Department,Park Maintenance & Safety,Equipment Repair,PARK_Maintenance_Trades,PARK,,,,,,,,,,,,,,,,,42.3594,-71.0587,Self Service,"(0, 0)"
593077,101001428303,07/13/2015 01:53:00 PM,07/20/2015 01:54:01 PM,08/11/2015 11:26:36 AM,OVERDUE,Closed,Case Closed. Closed date : 2015-08-11 11:26:36.667 Case Resolved,Equipment Repair,Parks & Recreation Department,Park Maintenance & Safety,Equipment Repair,PARK_Maintenance_Trades,PARK,,,529-543 Commercial St  Boston  MA  02109,3.0,1B,1.0,A1,Boston,3.0,3,302.0,E,529-543 Commercial St,2109.0,Address,36790.0,42.3688,-71.0562,Employee Generated,"(42.3688, -71.0562)"
593121,101001428358,07/13/2015 02:54:00 PM,07/20/2015 02:54:29 PM,07/23/2015 03:26:12 PM,OVERDUE,Closed,Case Closed. Closed date : 2015-07-23 15:26:12.22 Case Resolved,Equipment Repair,Parks & Recreation Department,Park Maintenance & Safety,Equipment Repair,PARK_Maintenance_Trades,PARK,,,,,,,,,,,,,,,,,42.3594,-71.0587,Employee Generated,"(0, 0)"
593124,101001428361,07/13/2015 02:55:00 PM,07/20/2015 02:55:56 PM,07/23/2015 03:31:30 PM,OVERDUE,Closed,Case Closed. Closed date : 2015-07-23 15:31:30.54 Case Resolved,Equipment Repair,Parks & Recreation Department,Park Maintenance & Safety,Equipment Repair,PARK_Maintenance_Trades,PARK,,,,,,,,,,,,,,,,,42.3594,-71.0587,Employee Generated,"(0, 0)"
593255,101001428556,07/13/2015 07:19:00 PM,07/21/2015 08:30:00 AM,07/15/2015 03:44:37 PM,ONTIME,Closed,Case Closed. Closed date : 2015-07-15 15:44:37.377 Duplicate of Existing Case,Equipment Repair,Parks & Recreation Department,Park Maintenance & Safety,Equipment Repair,PARK_Maintenance_Trades,PARK,,,INTERSECTION of Hanson St & Ringgold St  Roxbury  MA,4.0,1C,2.0,D4,South End,4.0,Ward 3,307.0,,INTERSECTION Hanson St & Ringgold St,,Intersection,5622.0,42.3433,-71.0696,Constituent Call,"(42.3433, -71.0696)"
593351,101001428696,07/14/2015 07:46:00 AM,07/21/2015 08:30:00 AM,07/15/2015 04:05:08 PM,ONTIME,Closed,Case Closed. Closed date : 2015-07-15 16:05:08.773 Duplicate of Existing Case,Equipment Repair,Parks & Recreation Department,Park Maintenance & Safety,Equipment Repair,PARK_Maintenance_Trades,PARK,,,INTERSECTION of Chiswick Rd & Commonwealth Ave  Brighton  MA,11.0,04,9.0,D14,Allston / Brighton,15.0,Ward 21,2113.0,,INTERSECTION Chiswick Rd & Commonwealth Ave,,Intersection,2992.0,42.3403,-71.1511,Constituent Call,"(42.3403, -71.1511)"
593412,101001428787,07/14/2015 08:41:00 AM,07/21/2015 08:41:23 AM,08/04/2015 06:01:40 AM,OVERDUE,Closed,Case Closed. Closed date : 2015-08-04 06:01:40.213 Case Resolved new button install,Equipment Repair,Parks & Recreation Department,Park Maintenance & Safety,Equipment Repair,PARK_Maintenance_Trades,PARK,,,,,,,,,,,,,,,,,42.3594,-71.0587,Constituent Call,"(0, 0)"
593727,101001429172,07/14/2015 12:46:00 PM,07/21/2015 12:46:44 PM,07/16/2015 03:12:43 PM,ONTIME,Closed,Case Closed. Closed date : 2015-07-16 15:12:43.357 Case Resolved,Equipment Repair,Parks & Recreation Department,Park Maintenance & Safety,Equipment Repair,PARK_Maintenance_Trades,PARK,,,,,,,,,,,,,,,,,42.3594,-71.0587,Employee Generated,"(0, 0)"
593958,101001429464,07/14/2015 05:25:00 PM,07/22/2015 08:30:00 AM,08/03/2015 01:20:06 PM,OVERDUE,Closed,Case Closed. Closed date : 2015-08-03 13:20:06.493 Case Noted broken swing  belongs to state dcr park,Equipment Repair,Parks & Recreation Department,Park Maintenance & Safety,Equipment Repair,PARK_Maintenance_Trades,PARK,,,INTERSECTION of Green St & Lamartine St  Jamaica Plain  MA,9.0,02,6.0,E13,Jamaica Plain,11.0,Ward 19,1906.0,,INTERSECTION Green St & Lamartine St,,Intersection,5435.0,42.3112,-71.1088,Constituent Call,"(42.3112, -71.1088)"
594204,101001429789,07/15/2015 09:24:00 AM,07/22/2015 09:24:45 AM,09/11/2015 08:18:36 AM,OVERDUE,Closed,Case Closed. Closed date : 2015-09-11 08:18:36.837 Duplicate of Existing Case Sama as #1413939,Equipment Repair:,Parks & Recreation Department,Park Maintenance & Safety,Equipment Repair,PARK_Park Improvement Requests,PARK,,,,,,,,,,,,,,,,,42.3594,-71.0587,Self Service,"(0, 0)"
594286,101001429887,07/15/2015 10:24:00 AM,07/22/2015 10:24:30 AM,08/13/2015 01:07:13 PM,OVERDUE,Closed,Case Closed. Closed date : 2015-08-13 13:07:13.44 Case Noted This is not a City owned fountain. The fountain is private maintained.,Equipment Repair,Parks & Recreation Department,Park Maintenance & Safety,Equipment Repair,INFO_Reallocation From Dept,INFO,,,INTERSECTION of Central St & India St  Boston  MA,3.0,1C,1.0,A1,Downtown / Financial District,3.0,Ward 3,306.0,,INTERSECTION Central St & India St,,Intersection,2601.0,42.3588,-71.0538,Constituent Call,"(42.3588, -71.0538)"
594292,101001429896,07/15/2015 10:28:00 AM,07/22/2015 10:31:21 AM,10/09/2015 10:47:30 AM,OVERDUE,Closed,Case Closed. Closed date : 2015-10-09 10:47:30.163 Case Resolved done 9-24-15,Equipment Repair,Parks & Recreation Department,Park Maintenance & Safety,Equipment Repair,PARK_Maintenance_Trades,PARK,,,1005 Washington St  Dorchester  MA  02124,8.0,07,3.0,B3,Dorchester,7.0,17,1704.0,,1005 Washington St,2124.0,Address,342680.0,42.3594,-71.0587,Employee Generated,"(0, 0)"
594333,101001429964,07/15/2015 10:52:00 AM,07/22/2015 11:01:43 AM,07/23/2015 03:35:20 PM,OVERDUE,Closed,Case Closed. Closed date : 2015-07-23 15:35:20.95 Case Resolved,Equipment Repair,Parks & Recreation Department,Park Maintenance & Safety,Equipment Repair,PARK_Maintenance_Trades,PARK,,,,,,,,,,,,,,,,,42.3594,-71.0587,Employee Generated,"(0, 0)"
594588,101001430288,07/15/2015 03:56:00 PM,07/22/2015 03:56:28 PM,07/23/2015 03:35:46 PM,OVERDUE,Closed,Case Closed. Closed date : 2015-07-23 15:35:46.653 Case Resolved,Equipment Repair,Parks & Recreation Department,Park Maintenance & Safety,Equipment Repair,PARK_Maintenance_Trades,PARK,,,75 W Rutland Sq  Roxbury  MA  02118,4.0,1C,7.0,D4,Roxbury,6.0,4,404.0,,75 W Rutland Sq,2118.0,Address,342665.0,42.3594,-71.0587,Employee Generated,"(0, 0)"
594589,101001430287,07/15/2015 03:56:00 PM,07/22/2015 03:56:12 PM,,OVERDUE,Open,,Equipment Repair,Parks & Recreation Department,Park Maintenance & Safety,Equipment Repair,INFO01_GenericeFormforOtherServiceRequestTypes,INFO,,,1 Liberty Sq  Boston  MA  02109,3.0,1C,1.0,A1,Boston,3.0,03,306.0,,1 Liberty Sq,2109.0,Address,352703.0,42.3594,-71.0587,Constituent Call,"(0, 0)"
594611,101001430321,07/15/2015 04:59:00 PM,07/22/2015 04:59:04 PM,07/23/2015 04:25:59 PM,OVERDUE,Closed,Case Closed. Closed date : 2015-07-23 16:25:59.707 Case Resolved done,Equipment Repair,Parks & Recreation Department,Park Maintenance & Safety,Equipment Repair,PARK_Maintenance_Trades,PARK,,,20 Wainwright St  Dorchester  MA  02124,8.0,07,3.0,C11,Dorchester,8.0,16,1603.0,,20 Wainwright St,2124.0,Address,342037.0,42.3594,-71.0587,Constituent Call,"(0, 0)"
594852,101001430659,07/16/2015 09:24:00 AM,07/23/2015 09:24:03 AM,08/04/2015 06:03:41 AM,OVERDUE,Closed,Case Closed. Closed date : 2015-08-04 06:03:41.78 Case Resolved fixed,Equipment Repair,Parks & Recreation Department,Park Maintenance & Safety,Equipment Repair,PARK_Maintenance_Trades,PARK,,,10 Ringgold St  Roxbury  MA  02118,4.0,1C,2.0,D4,Roxbury,4.0,3,307.0,,10 Ringgold St,2118.0,Address,342013.0,42.3594,-71.0587,Constituent Call,"(0, 0)"
594933,101001430759,07/16/2015 10:31:00 AM,07/23/2015 10:31:16 AM,07/17/2015 12:51:28 PM,ONTIME,Closed,Case Closed. Closed date : 2015-07-17 12:51:28.43 Case Resolved water on,Equipment Repair,Parks & Recreation Department,Park Maintenance & Safety,Equipment Repair,PARK_Maintenance_Trades,PARK,,,40 Almont St  Mattapan  MA  02126,8.0,07,5.0,B3,Mattapan,9.0,18,1803.0,E,40 Almont St,2126.0,Address,341524.0,42.2741,-71.0969,Constituent Call,"(42.2741, -71.0969)"
595102,101001430957,07/16/2015 12:20:34 PM,07/23/2015 12:21:39 PM,07/20/2015 08:33:46 AM,ONTIME,Closed,Case Closed. Closed date : 2015-07-20 08:33:46.697 Duplicate of Existing Case Same as #1431010,Equipment Repair,Parks & Recreation Department,Park Maintenance & Safety,Equipment Repair,PARK_Maintenance_Trades,PARK,,,20 Wainwright St  Dorchester  MA  02124,8.0,07,3.0,C11,Dorchester,8.0,16,1603.0,,20 Wainwright St,2124.0,Address,342037.0,42.3594,-71.0587,Constituent Call,"(0, 0)"
595110,101001430969,07/16/2015 12:26:09 PM,07/23/2015 12:26:21 PM,07/20/2015 08:34:23 AM,ONTIME,Closed,Case Closed. Closed date : 2015-07-20 08:34:23.743 Duplicate of Existing Case Same as #1431010.,Equipment Repair,Parks & Recreation Department,Park Maintenance & Safety,Equipment Repair,PARK_Maintenance_Trades,PARK,,,20 Wainwright St  Dorchester  MA  02124,8.0,07,3.0,C11,Dorchester,8.0,16,1603.0,,20 Wainwright St,2124.0,Address,342037.0,42.3594,-71.0587,Constituent Call,"(0, 0)"
595137,101001431010,07/16/2015 01:09:00 PM,07/23/2015 01:09:44 PM,07/20/2015 08:31:29 AM,ONTIME,Closed,Case Closed. Closed date : 2015-07-20 08:31:29.413 Case Resolved Signs were installed.,Equipment Repair,Parks & Recreation Department,Park Maintenance & Safety,Equipment Repair,PARK_Maintenance_Trades,PARK,,,20 Wainwright St  Dorchester  MA  02124,8.0,07,3.0,C11,Dorchester,8.0,16,1603.0,,20 Wainwright St,2124.0,Address,342037.0,42.3594,-71.0587,Constituent Call,"(0, 0)"
595144,101001431019,07/16/2015 01:18:00 PM,07/23/2015 01:18:26 PM,07/17/2015 12:52:36 PM,ONTIME,Closed,Case Closed. Closed date : 2015-07-17 12:52:36.48 Case Resolved lnstall signs,Equipment Repair,Parks & Recreation Department,Park Maintenance & Safety,Equipment Repair,PARK_Maintenance_Trades,PARK,,,20 Wainwright St  Dorchester  MA  02124,8.0,07,3.0,C11,Dorchester,8.0,16,1603.0,,20 Wainwright St,2124.0,Address,342037.0,42.3594,-71.0587,Constituent Call,"(0, 0)"
595506,101001431519,07/17/2015 08:50:00 AM,07/24/2015 08:50:27 AM,07/23/2015 03:55:09 PM,ONTIME,Closed,Case Closed. Closed date : 2015-07-23 15:55:09.577 Case Resolved,Equipment Repair,Parks & Recreation Department,Park Maintenance & Safety,Equipment Repair,PARK_Maintenance_Trades,PARK,,,INTERSECTION of Ellington St & Erie St  Dorchester  MA,7.0,03,4.0,B3,Greater Mattapan,13.0,Ward 14,1403.0,,INTERSECTION Ellington St & Erie St,,Intersection,4501.0,42.3014,-71.0829,Constituent Call,"(42.3014, -71.0829)"
595766,101001431818,07/17/2015 10:30:00 AM,07/24/2015 10:31:14 AM,08/31/2015 02:52:39 PM,OVERDUE,Closed,Case Closed. Closed date : 2015-08-31 14:52:39.13 Case Noted park under construction,Equipment Repair,Parks & Recreation Department,Park Maintenance & Safety,Equipment Repair,PARK_Maintenance_Trades,PARK,,,80 Humboldt Ave  Dorchester  MA  02121,9.0,10B,7.0,B2,Dorchester,13.0,12,1202.0,,80 Humboldt Ave,2121.0,Address,342506.0,42.3594,-71.0587,Employee Generated,"(0, 0)"
595836,101001431907,07/17/2015 11:35:00 AM,07/24/2015 11:36:05 AM,07/20/2015 04:43:07 AM,ONTIME,Closed,Case Closed. Closed date : 2015-07-20 04:43:07.103 Case Resolved remove graffiti,Equipment Repair,Parks & Recreation Department,Park Maintenance & Safety,Equipment Repair,PARK_Maintenance_Trades,PARK,,,160 Norfolk Ave  Roxbury  MA  02119,7.0,03,7.0,B2,Roxbury,13.0,08,806.0,,160 Norfolk Ave,2119.0,Address,342027.0,42.3594,-71.0587,Employee Generated,"(0, 0)"
595840,101001431913,07/17/2015 11:41:00 AM,07/24/2015 11:41:37 AM,07/20/2015 06:18:07 AM,ONTIME,Closed,Case Closed. Closed date : 2015-07-20 06:18:07.217 Case Resolved turn up water,Equipment Repair,Parks & Recreation Department,Park Maintenance & Safety,Equipment Repair,PARK_Maintenance_Trades,PARK,,,80 Humboldt Ave  Dorchester  MA  02121,9.0,10B,7.0,B2,Dorchester,13.0,12,1202.0,,80 Humboldt Ave,2121.0,Address,342506.0,42.3594,-71.0587,Employee Generated,"(0, 0)"
596052,101001432200,07/17/2015 04:04:00 PM,07/24/2015 04:04:35 PM,08/11/2015 12:56:10 PM,OVERDUE,Closed,Case Closed. Closed date : 2015-08-11 12:56:10.383 Case Noted plumbers repaired  pipe,Equipment Repair,Parks & Recreation Department,Park Maintenance & Safety,Equipment Repair,PARK_Maintenance_Trades,PARK,,,210 Parker Hill Ave  Mission Hill  MA  02120,9.0,10A,8.0,B2,Mission Hill,14.0,Ward 10,1005.0,CM,210 Parker Hill Ave,2120.0,Address,107963.0,42.3291,-71.1028,Constituent Call,"(42.3291, -71.1028)"
596220,101001432439,07/18/2015 01:23:00 PM,07/27/2015 08:30:00 AM,10/06/2015 06:31:15 AM,OVERDUE,Closed,Case Closed. Closed date : 2015-10-06 06:31:15.48 Case Resolved replace button,Equipment Repair,Parks & Recreation Department,Park Maintenance & Safety,Equipment Repair,PARK_Maintenance_Trades,PARK,,,15 Evans St  Dorchester  MA  02124,8.0,07,4.0,B3,Dorchester,9.0,17,1707.0,,15 Evans St,2124.0,Address,344492.0,42.3594,-71.0587,Constituent Call,"(0, 0)"
596298,101001432560,07/19/2015 06:26:00 AM,07/27/2015 08:30:00 AM,07/23/2015 04:27:57 PM,ONTIME,Closed,Case Closed. Closed date : 2015-07-23 16:27:57.673 Case Resolved done,Equipment Repair,Parks & Recreation Department,Park Maintenance & Safety,Equipment Repair,PARK_Maintenance_Trades,PARK,,,INTERSECTION of Humboldt Ave & Townsend St  Boston  MA,9.0,10B,7.0,B2,Roxbury,13.0,Ward 12,1202.0,,INTERSECTION Humboldt Ave & Townsend St,,Intersection,6403.0,42.3171,-71.0865,Constituent Call,"(42.3171, -71.0865)"
596483,101001432835,07/20/2015 08:38:00 AM,07/27/2015 08:38:20 AM,07/31/2015 02:08:31 PM,OVERDUE,Closed,Case Closed. Closed date : 2015-07-31 14:08:31.743 Case Resolved,Equipment Repair,Parks & Recreation Department,Park Maintenance & Safety,Equipment Repair,PARK_Maintenance_Trades,PARK,,,40 Downer Ave  Dorchester  MA  02125,7.0,03,3.0,C11,Dorchester,7.0,13,1306.0,,40 Downer Ave,2125.0,Address,342086.0,42.3594,-71.0587,Constituent Call,"(0, 0)"
596525,101001432891,07/20/2015 09:20:00 AM,07/27/2015 09:20:45 AM,07/23/2015 04:28:23 PM,ONTIME,Closed,Case Closed. Closed date : 2015-07-23 16:28:23.103 Case Resolved,Equipment Repair,Parks & Recreation Department,Park Maintenance & Safety,Equipment Repair,PARK_Maintenance_Trades,PARK,,,,,,,,,,,,,,,,,42.3594,-71.0587,Employee Generated,"(0, 0)"
596534,101001432903,07/20/2015 09:24:00 AM,07/27/2015 09:24:13 AM,,OVERDUE,Open,,Equipment Repair,Parks & Recreation Department,Park Maintenance & Safety,Equipment Repair,PARK_Maintenance_Trades,PARK,,,,,,,,,,,,,,,,,42.3594,-71.0587,Employee Generated,"(0, 0)"
596543,101001432913,07/20/2015 09:31:00 AM,07/27/2015 09:31:48 AM,10/22/2015 11:36:31 AM,OVERDUE,Closed,Case Closed. Closed date : 2015-10-22 11:36:31.12 Case Noted parts are on order,Equipment Repair,Parks & Recreation Department,Park Maintenance & Safety,Equipment Repair,PARK_Maintenance_Trades,PARK,,,,,,,,,,,,,,,,,42.3594,-71.0587,Employee Generated,"(0, 0)"
596546,101001432920,07/20/2015 09:36:00 AM,07/27/2015 09:37:05 AM,07/23/2015 03:54:36 PM,ONTIME,Closed,Case Closed. Closed date : 2015-07-23 15:54:36.79 Case Resolved,Equipment Repair,Parks & Recreation Department,Park Maintenance & Safety,Equipment Repair,PARK_Maintenance_Trades,PARK,,,,,,,,,,,,,,,,,42.3594,-71.0587,Employee Generated,"(0, 0)"
596559,101001432933,07/20/2015 09:43:00 AM,07/27/2015 09:44:05 AM,08/18/2015 06:28:06 AM,OVERDUE,Closed,Case Closed. Closed date : 2015-08-18 06:28:06.98 Case Resolved drinking fountain fixed,Equipment Repair,Parks & Recreation Department,Park Maintenance & Safety,Equipment Repair,PARK_Maintenance_Trades,PARK,,,,,,,,,,,,,,,,,42.3594,-71.0587,Employee Generated,"(0, 0)"
596738,101001433156,07/20/2015 11:49:00 AM,07/27/2015 11:50:00 AM,08/04/2015 06:20:11 AM,OVERDUE,Closed,Case Closed. Closed date : 2015-08-04 06:20:11.42 Case Resolved repair swings,Equipment Repair,Parks & Recreation Department,Park Maintenance & Safety,Equipment Repair,PARK_Maintenance_Trades,PARK,,,349 Bunker Hill St  Charlestown  MA  02129,3.0,1A,1.0,A15,Charlestown,2.0,2,207.0,E,349 Bunker Hill St,2129.0,Address,23598.0,42.3824,-71.0678,Employee Generated,"(42.3824, -71.0678)"
596954,101001433436,07/20/2015 03:39:00 PM,07/27/2015 03:39:28 PM,07/23/2015 04:10:22 PM,ONTIME,Closed,Case Closed. Closed date : 2015-07-23 16:10:22.323 Case Resolved,Equipment Repair,Parks & Recreation Department,Park Maintenance & Safety,Equipment Repair,PARK_Maintenance_Trades,PARK,,,50 Myrtle St  Boston  MA  02114,3.0,1B,8.0,A1,Boston,14.0,5,503.0,,50 Myrtle St,2114.0,Address,342540.0,42.3594,-71.0587,Constituent Call,"(0, 0)"
596959,101001433444,07/20/2015 03:43:00 PM,07/27/2015 03:43:36 PM,07/23/2015 04:04:46 PM,ONTIME,Closed,Case Closed. Closed date : 2015-07-23 16:04:46.303 Case Resolved,Equipment Repair: Doherty Playground,Parks & Recreation Department,Park Maintenance & Safety,Equipment Repair,PARK_Maintenance_Trades,PARK,,,,,,,,,,,,,,,,,42.3594,-71.0587,Self Service,"(0, 0)"
597035,101001433546,07/20/2015 05:46:00 PM,07/28/2015 08:30:00 AM,07/23/2015 04:08:48 PM,ONTIME,Closed,Case Closed. Closed date : 2015-07-23 16:08:48.953 Case Resolved done,Equipment Repair,Parks & Recreation Department,Park Maintenance & Safety,Equipment Repair,PARK_Maintenance_Trades,PARK,,,INTERSECTION of Independence Dr & VFW Pkwy  West Roxbury  MA,12.0,06,6.0,E5,West Roxbury,12.0,Ward 20,2020.0,,INTERSECTION Independence Dr & VFW Pkwy,,Intersection,6491.0,42.2955,-71.1576,Constituent Call,"(42.2955, -71.1576)"
597234,101001433823,07/21/2015 09:11:00 AM,07/28/2015 09:11:19 AM,07/23/2015 04:10:46 PM,ONTIME,Closed,Case Closed. Closed date : 2015-07-23 16:10:46.23 Case Resolved,Equipment Repair: Penniman Rd. CG,Parks & Recreation Department,Park Maintenance & Safety,Equipment Repair,PARK_Maintenance_Trades,PARK,,,,,,,,,,,,,,,,,42.3594,-71.0587,Self Service,"(0, 0)"
597287,101001433880,07/21/2015 09:42:00 AM,07/28/2015 09:42:02 AM,07/23/2015 03:07:48 PM,ONTIME,Closed,Case Closed. Closed date : 2015-07-23 15:07:48.863 Case Resolved,Equipment Repair: Rogers Park,Parks & Recreation Department,Park Maintenance & Safety,Equipment Repair,PARK_Maintenance_Trades,PARK,,,,,,,,,,,,,,,,,42.3594,-71.0587,Self Service,"(0, 0)"
597325,101001433932,07/21/2015 10:03:00 AM,07/28/2015 10:03:55 AM,07/31/2015 02:06:42 PM,OVERDUE,Closed,Case Closed. Closed date : 2015-07-31 14:06:42.977 Case Resolved,Equipment Repair,Parks & Recreation Department,Park Maintenance & Safety,Equipment Repair,PARK_Maintenance_Trades,PARK,,,10 Mozart St  Jamaica Plain  MA  02130,9.0,10A,6.0,E13,Jamaica Plain,11.0,10,1007.0,E,10 Mozart St,2130.0,Address,341941.0,42.3224,-71.1045,Employee Generated,"(42.3224, -71.1045)"
597430,101001434058,07/21/2015 11:18:00 AM,07/28/2015 11:18:38 AM,07/23/2015 03:54:00 PM,ONTIME,Closed,Case Closed. Closed date : 2015-07-23 15:54:00.723 Case Resolved,Equipment Repair,Parks & Recreation Department,Park Maintenance & Safety,Equipment Repair,PARK_Maintenance_Trades,PARK,,,,,,,,,,,,,,,,,42.3594,-71.0587,Employee Generated,"(0, 0)"
597648,101001434340,07/21/2015 03:24:00 PM,07/28/2015 03:24:31 PM,10/09/2015 10:48:26 AM,OVERDUE,Closed,Case Closed. Closed date : 2015-10-09 10:48:26.553 Case Resolved done,Equipment Repair,Parks & Recreation Department,Park Maintenance & Safety,Equipment Repair,PARK_Maintenance_Trades,PARK,,,1005 Washington St  Dorchester  MA  02124,8.0,07,3.0,B3,Dorchester,7.0,17,1704.0,,1005 Washington St,2124.0,Address,342680.0,42.3594,-71.0587,Employee Generated,"(0, 0)"
597655,101001434352,07/21/2015 03:30:00 PM,07/28/2015 03:31:35 PM,07/23/2015 04:27:28 PM,ONTIME,Closed,Case Closed. Closed date : 2015-07-23 16:27:28.77 Case Resolved,Equipment Repair,Parks & Recreation Department,Park Maintenance & Safety,Equipment Repair,PARK_Maintenance_Trades,PARK,,,330 Seaver St  Dorchester  MA  02121,7.0,03,4.0,B2,Dorchester,13.0,14,1403.0,,330 Seaver St,2121.0,Address,342579.0,42.3594,-71.0587,Employee Generated,"(0, 0)"
597673,101001434375,07/21/2015 03:47:00 PM,07/28/2015 03:47:38 PM,07/31/2015 02:09:40 PM,OVERDUE,Closed,Case Closed. Closed date : 2015-07-31 14:09:40.383 Case Resolved,Equipment Repair,Parks & Recreation Department,Park Maintenance & Safety,Equipment Repair,PARK_Maintenance_Trades,PARK,,,25 Pierpont Rd  Jamaica Plain  MA  02130,9.0,02,7.0,B2,Greater Mattapan,13.0,12,1207.0,,25 Pierpont Rd,2130.0,Address,342449.0,42.3594,-71.0587,Employee Generated,"(0, 0)"
597680,101001434387,07/21/2015 03:57:00 PM,07/28/2015 03:57:29 PM,09/25/2015 09:21:16 AM,OVERDUE,Closed,Case Closed. Closed date : 2015-09-25 09:21:16.817 Case Resolved Fence was repaired.,Equipment Repair,Parks & Recreation Department,Park Maintenance & Safety,Equipment Repair,PARK_Maintenance_Trades,PARK,,,365 Hyde Park Ave  Roslindale  MA  02131,12.0,02,6.0,E18,Roslindale,10.0,19,1912.0,E,365 Hyde Park Ave,2131.0,Address,77313.0,42.289,-71.1188,Constituent Call,"(42.289, -71.1188)"
597747,101001434473,07/21/2015 06:08:00 PM,07/29/2015 08:30:00 AM,08/26/2015 01:14:01 PM,OVERDUE,Closed,Case Closed. Closed date : 2015-08-26 13:14:01.723 Case Resolved done 8-14-15,Equipment Repair,Parks & Recreation Department,Park Maintenance & Safety,Equipment Repair,PARK_Maintenance_Trades,PARK,,,56 Ayles Rd  Hyde Park  MA  02136,12.0,08,5.0,E18,Hyde Park,10.0,Ward 18,1815.0,R1,56 Ayles Rd,2136.0,Address,7312.0,42.2651,-71.112,Constituent Call,"(42.2651, -71.112)"
597788,101001434537,07/21/2015 08:11:00 PM,07/29/2015 08:30:00 AM,08/03/2015 11:51:53 AM,OVERDUE,Closed,Case Closed. Closed date : 2015-08-03 11:51:53.357 Case Resolved,Equipment Repair: Ronan Park,Parks & Recreation Department,Park Maintenance & Safety,Equipment Repair,PARK_Maintenance_Trades,PARK,,,,,,,,,,,,,,,,,42.3594,-71.0587,Self Service,"(0, 0)"
597968,101001434857,07/23/2015 10:58:00 AM,07/30/2015 10:58:50 AM,07/31/2015 02:07:56 PM,OVERDUE,Closed,Case Closed. Closed date : 2015-07-31 14:07:56.103 Case Resolved,Equipment Repair,Parks & Recreation Department,Park Maintenance & Safety,Equipment Repair,PARK_Maintenance_Trades,PARK,,,,,,,,,,,,,,,,,42.3594,-71.0587,Employee Generated,"(0, 0)"
598114,101001435113,07/23/2015 12:15:00 PM,07/30/2015 12:15:58 PM,07/31/2015 02:12:04 PM,OVERDUE,Closed,Case Closed. Closed date : 2015-07-31 14:12:04.313 Case Resolved,Equipment Repair,Parks & Recreation Department,Park Maintenance & Safety,Equipment Repair,PARK_Maintenance_Trades,PARK,,,,,,,,,,,,,,,,,42.3594,-71.0587,Employee Generated,"(0, 0)"
598143,101001435156,07/23/2015 12:33:00 PM,07/30/2015 12:33:58 PM,07/23/2015 12:37:49 PM,ONTIME,Closed,Case Closed. Closed date : 2015-07-23 12:37:49.427 Case Resolved Work was completed  pressure was turned down  there was no flooding.,Equipment Repair,Parks & Recreation Department,Park Maintenance & Safety,Equipment Repair,PARK_Maintenance_Trades,PARK,,,,,,,,,,,,,,,,,42.3594,-71.0587,Employee Generated,"(0, 0)"
598161,101001435184,07/23/2015 12:49:00 PM,07/30/2015 12:49:51 PM,,OVERDUE,Open,,Equipment Repair: Charlestown Naval Shipyard Park,Parks & Recreation Department,Park Maintenance & Safety,Equipment Repair,INFO01_GenericeFormforOtherServiceRequestTypes,INFO,,,,,,,,,,,,,,,,,42.3594,-71.0587,Self Service,"(0, 0)"
598176,101001435210,07/23/2015 01:06:00 PM,07/30/2015 01:06:35 PM,08/11/2015 11:48:33 AM,OVERDUE,Closed,Case Closed. Closed date : 2015-08-11 11:48:33.583 Case Resolved,Equipment Repair,Parks & Recreation Department,Park Maintenance & Safety,Equipment Repair,PARK_Maintenance_Trades,PARK,,,1545 Dorchester Ave  Dorchester  MA  02124,8.0,07,3.0,C11,Dorchester,7.0,16,1601.0,,1545 Dorchester Ave,2124.0,Address,342065.0,42.3594,-71.0587,Employee Generated,"(0, 0)"
598463,101001435613,07/23/2015 05:23:00 PM,07/31/2015 08:30:00 AM,12/10/2015 11:39:52 AM,OVERDUE,Closed,Case Closed. Closed date : 2015-12-10 11:39:52.11 Case Resolved courts lights are off city wide,,Parks & Recreation Department,Park Maintenance & Safety,Equipment Repair,PARK_Maintenance_Lighting Electrical,PARK,,,59 Almont St  Mattapan  MA  02126,8.0,07,5.0,B3,Greater Mattapan,9.0,Ward 18,1803.0,R1,59 Almont St,2126.0,Address,2809.0,42.2764,-71.097,Constituent Call,"(42.2764, -71.097)"
598467,101001435617,07/23/2015 05:26:00 PM,07/31/2015 08:30:00 AM,09/25/2015 09:27:43 AM,OVERDUE,Closed,Case Closed. Closed date : 2015-09-25 09:27:43.917 Case Resolved Drinking fountain was repaired.,Equipment Repair,Parks & Recreation Department,Park Maintenance & Safety,Equipment Repair,PARK_Maintenance_Trades,PARK,,,59 Almont St  Mattapan  MA  02126,8.0,07,5.0,B3,Greater Mattapan,9.0,Ward 18,1803.0,R1,59 Almont St,2126.0,Address,2809.0,42.2764,-71.097,Constituent Call,"(42.2764, -71.097)"
598476,101001435628,07/23/2015 05:37:00 PM,07/31/2015 08:30:00 AM,07/28/2015 12:50:07 PM,ONTIME,Closed,Case Closed. Closed date : 2015-07-28 12:50:07.713 Case Noted Porta Pottie company has been notified.,Equipment Repair,Parks & Recreation Department,Park Maintenance & Safety,Equipment Repair,PARK_Maintenance_Ground Maintenance,PARK,,,1005 Columbia Rd  South Boston  MA  02127,6.0,05,2.0,C6,South Boston,5.0,7,707.0,,1005 Columbia Rd,2127.0,Address,163529.0,42.3272,-71.0504,Constituent Call,"(42.3272, -71.0504)"
598671,101001435906,07/24/2015 09:03:00 AM,07/31/2015 09:03:26 AM,10/06/2015 06:36:08 AM,OVERDUE,Closed,Case Closed. Closed date : 2015-10-06 06:36:08.997 Case Resolved replace chain,Equipment Repair,Parks & Recreation Department,Park Maintenance & Safety,Equipment Repair,PARK_Maintenance_Trades,PARK,,,115 Paris St  East Boston  MA  02128,1.0,09,1.0,A7,East Boston,1.0,1,104.0,,115 Paris St,2128.0,Address,340867.0,42.3721,-71.037,Constituent Call,"(42.3721, -71.037)"
598756,101001436017,07/24/2015 10:35:00 AM,07/31/2015 10:35:38 AM,07/24/2015 10:37:39 AM,ONTIME,Closed,Case Closed. Closed date : 2015-07-24 10:37:39.0 Case Resolved,Equipment Repair,Parks & Recreation Department,Park Maintenance & Safety,Equipment Repair,PARK_Maintenance_Trades,PARK,,,,,,,,,,,,,,,,,42.3594,-71.0587,Employee Generated,"(0, 0)"
598769,101001436033,07/24/2015 10:47:00 AM,07/31/2015 10:47:45 AM,09/10/2015 06:24:41 AM,OVERDUE,Closed,Case Closed. Closed date : 2015-09-10 06:24:41.053 Case Resolved found no post,Equipment Repair,Parks & Recreation Department,Park Maintenance & Safety,Equipment Repair,PARK_Maintenance_Trades,PARK,,,139 Tremont St  Boston  MA  02108,3.0,1C,8.0,A1,Beacon Hill,14.0,05,503.0,E,139 Tremont St,2108.0,Address,341542.0,42.3554,-71.0638,Constituent Call,"(42.3554, -71.0638)"
598917,101001436225,07/24/2015 01:26:00 PM,07/31/2015 01:26:32 PM,08/11/2015 11:52:27 AM,OVERDUE,Closed,Case Closed. Closed date : 2015-08-11 11:52:27.6 Case Resolved,Equipment Repair,Parks & Recreation Department,Park Maintenance & Safety,Equipment Repair,PARK_Maintenance_Trades,PARK,,,160 Florence St  Roslindale  MA  02131,12.0,02,5.0,E5,Roslindale,10.0,19,1913.0,E,160 Florence St,2131.0,Address,155813.0,42.2882,-71.1223,Employee Generated,"(42.2882, -71.1223)"
599060,101001436386,07/24/2015 04:32:00 PM,07/31/2015 04:32:29 PM,07/31/2015 02:28:39 PM,ONTIME,Closed,Case Closed. Closed date : 2015-07-31 14:28:39.07 Case Resolved,Equipment Repair,Parks & Recreation Department,Park Maintenance & Safety,Equipment Repair,PARK_Maintenance_Trades,PARK,,,20 Wainwright St  Dorchester  MA  02124,8.0,07,3.0,C11,Dorchester,8.0,16,1603.0,,20 Wainwright St,2124.0,Address,342037.0,42.3594,-71.0587,Employee Generated,"(0, 0)"
599086,101001436419,07/24/2015 05:56:00 PM,08/03/2015 08:30:00 AM,09/10/2015 06:25:25 AM,OVERDUE,Closed,Case Closed. Closed date : 2015-09-10 06:25:25.587 Case Resolved weld covers,Equipment Repair,Parks & Recreation Department,Park Maintenance & Safety,Equipment Repair,PARK_Maintenance_Trades,PARK,,,INTERSECTION of Centre St & Mozart St  Jamaica Plain  MA,9.0,10A,6.0,E13,Jamaica Plain,11.0,Ward 10,1006.0,,INTERSECTION Centre St & Mozart St,,Intersection,2699.0,42.3227,-71.1049,Constituent Call,"(42.3227, -71.1049)"
599243,101001436643,07/25/2015 03:52:00 PM,08/03/2015 08:30:00 AM,09/25/2015 09:28:42 AM,OVERDUE,Closed,Case Closed. Closed date : 2015-09-25 09:28:42.643 Case Resolved Slide was repaired.,Equipment Repair,Parks & Recreation Department,Park Maintenance & Safety,Equipment Repair,PARK_Maintenance_Trades,PARK,,,139 Tremont St  Boston  MA  02108,3.0,1C,8.0,A1,Beacon Hill,14.0,05,503.0,E,139 Tremont St,2108.0,Address,341542.0,42.3554,-71.0638,Constituent Call,"(42.3554, -71.0638)"
599267,101001436677,07/25/2015 06:38:00 PM,08/03/2015 08:30:00 AM,09/10/2015 10:42:40 AM,OVERDUE,Closed,Case Closed. Closed date : 2015-09-10 10:42:40.903 Case Resolved,Equipment Repair,Parks & Recreation Department,Park Maintenance & Safety,Equipment Repair,PARK_Maintenance_Region 3,PARK,,,22 Spalding St  Jamaica Plain  MA  02130,9.0,02,6.0,E13,Jamaica Plain,11.0,Ward 11,1110.0,R3,22 Spalding St,2130.0,Address,129240.0,42.3038,-71.1134,Constituent Call,"(42.3038, -71.1134)"
599685,101001437296,07/27/2015 10:29:00 AM,08/03/2015 10:30:20 AM,08/11/2015 01:28:54 PM,OVERDUE,Closed,Case Closed. Closed date : 2015-08-11 13:28:54.777 Case Noted no park sign found,Equipment Repair,Parks & Recreation Department,Park Maintenance & Safety,Equipment Repair,PARK_Maintenance_Trades,PARK,,,,,,,,,,,,,,,,,42.3594,-71.0587,Employee Generated,"(0, 0)"
599701,101001437320,07/27/2015 10:37:00 AM,08/03/2015 10:37:53 AM,08/31/2015 02:53:31 PM,OVERDUE,Closed,Case Closed. Closed date : 2015-08-31 14:53:31.703 Case Resolved done 8-26-15,Equipment Repair,Parks & Recreation Department,Park Maintenance & Safety,Equipment Repair,PARK_Maintenance_Trades,PARK,,,143 Porter St  East Boston  MA  02128,1.0,09,1.0,A7,East Boston,1.0,01,105.0,,143 Porter St,2128.0,Address,344495.0,42.3594,-71.0587,Employee Generated,"(0, 0)"
599709,101001437327,07/27/2015 10:41:00 AM,08/03/2015 10:41:49 AM,09/25/2015 09:30:54 AM,OVERDUE,Closed,Case Closed. Closed date : 2015-09-25 09:30:54.947 Case Resolved Spray feature off for the season.,Equipment Repair,Parks & Recreation Department,Park Maintenance & Safety,Equipment Repair,PARK_Maintenance_Trades,PARK,,,80 Union St  Brighton  MA  02135,11.0,04,9.0,D14,Brighton,15.0,21,2111.0,,80 Union St,2135.0,Address,342498.0,42.3594,-71.0587,Employee Generated,"(0, 0)"
599715,101001437342,07/27/2015 10:46:00 AM,08/03/2015 10:47:45 AM,08/03/2015 01:10:32 PM,OVERDUE,Closed,Case Closed. Closed date : 2015-08-03 13:10:32.793 Case Resolved,Equipment Repair,Parks & Recreation Department,Park Maintenance & Safety,Equipment Repair,PARK_Maintenance_Trades,PARK,,,239 Parker Hill Ave  Mission Hill  MA  02120,9.0,10A,8.0,B2,Mission Hill,14.0,10,1005.0,,239 Parker Hill Ave,2120.0,Address,342517.0,42.3594,-71.0587,Employee Generated,"(0, 0)"
599731,101001437355,07/27/2015 10:52:00 AM,08/03/2015 10:52:40 AM,07/31/2015 02:42:31 PM,ONTIME,Closed,Case Closed. Closed date : 2015-07-31 14:42:31.943 Case Resolved,Equipment Repair,Parks & Recreation Department,Park Maintenance & Safety,Equipment Repair,PARK_Maintenance_Trades,PARK,,,239 Parker Hill Ave  Mission Hill  MA  02120,9.0,10A,8.0,B2,Mission Hill,14.0,10,1005.0,,239 Parker Hill Ave,2120.0,Address,342517.0,42.3594,-71.0587,Employee Generated,"(0, 0)"
599740,101001437361,07/27/2015 10:55:00 AM,08/03/2015 10:55:22 AM,07/31/2015 02:36:39 PM,ONTIME,Closed,Case Closed. Closed date : 2015-07-31 14:36:39.707 Case Resolved,Equipment Repair,Parks & Recreation Department,Park Maintenance & Safety,Equipment Repair,PARK_Maintenance_Trades,PARK,,,239 Parker Hill Ave  Mission Hill  MA  02120,9.0,10A,8.0,B2,Mission Hill,14.0,10,1005.0,,239 Parker Hill Ave,2120.0,Address,342517.0,42.3594,-71.0587,Employee Generated,"(0, 0)"
599748,101001437371,07/27/2015 11:00:00 AM,08/03/2015 11:01:02 AM,08/17/2015 08:11:18 AM,OVERDUE,Closed,Case Closed. Closed date : 2015-08-17 08:11:18.263 Case Resolved install new chain,Equipment Repair,Parks & Recreation Department,Park Maintenance & Safety,Equipment Repair,PARK_Maintenance_Trades,PARK,,,60 Smith St  Mission Hill  MA  02120,9.0,10A,8.0,B2,Mission Hill,14.0,10,1002.0,,60 Smith St,2120.0,Address,342526.0,42.3594,-71.0587,Employee Generated,"(0, 0)"
600375,101001438181,07/28/2015 09:25:00 AM,08/04/2015 09:25:24 AM,08/03/2015 11:49:26 AM,ONTIME,Closed,Case Closed. Closed date : 2015-08-03 11:49:26.803 Case Resolved,Equipment Repair,Parks & Recreation Department,Park Maintenance & Safety,Equipment Repair,PARK_Maintenance_Trades,PARK,,,52 South St  Jamaica Plain  MA  02130,9.0,02,6.0,E13,Jamaica Plain,11.0,19,1906.0,E,52 South St,2130.0,Address,169805.0,42.3079,-71.1153,Employee Generated,"(42.3079, -71.1153)"
601131,101001439173,07/29/2015 09:46:00 AM,08/05/2015 09:46:18 AM,08/14/2015 02:55:19 PM,OVERDUE,Closed,Case Closed. Closed date : 2015-08-14 14:55:19.16 Case Resolved done,Equipment Repair,Parks & Recreation Department,Park Maintenance & Safety,Equipment Repair,PARK_Maintenance_Trades,PARK,,,,,,,,,,,,,,,,,42.3594,-71.0587,Employee Generated,"(0, 0)"
601132,101001439174,07/29/2015 09:46:00 AM,08/05/2015 09:46:25 AM,08/11/2015 01:30:34 PM,OVERDUE,Closed,Case Closed. Closed date : 2015-08-11 13:30:34.9 Case Resolved,Equipment Repair,Parks & Recreation Department,Park Maintenance & Safety,Equipment Repair,PARK_Maintenance_Trades,PARK,,,25 Ripley Rd  Dorchester  MA  02121,7.0,03,4.0,B3,Dorchester,8.0,14,1402.0,E,25 Ripley Rd,2121.0,Address,341620.0,42.2993,-71.076,Employee Generated,"(42.2993, -71.076)"
601220,101001439292,07/29/2015 11:11:00 AM,08/05/2015 11:11:38 AM,08/17/2015 08:09:43 AM,OVERDUE,Closed,Case Closed. Closed date : 2015-08-17 08:09:43.74 Case Resolved done,Equipment Repair,Parks & Recreation Department,Park Maintenance & Safety,Equipment Repair,PARK_Maintenance_Trades,PARK,,,930 Blue Hill Ave  Dorchester  MA  02124,8.0,07,4.0,B3,Dorchester,9.0,14,1410.0,,930 Blue Hill Ave,2124.0,Address,162200.0,42.2923,-71.0846,Employee Generated,"(42.2923, -71.0846)"
601398,101001439505,07/29/2015 02:01:00 PM,08/05/2015 02:01:52 PM,08/17/2015 08:09:18 AM,OVERDUE,Closed,Case Closed. Closed date : 2015-08-17 08:09:18.203 Case Resolved done,Equipment Repair,Parks & Recreation Department,Park Maintenance & Safety,Equipment Repair,PARK_Maintenance_Trades,PARK,,,139 Tremont St  Boston  MA  02108,3.0,1C,8.0,A1,Beacon Hill,14.0,05,503.0,E,139 Tremont St,2108.0,Address,341542.0,42.3554,-71.0638,Employee Generated,"(42.3554, -71.0638)"
601412,101001439521,07/29/2015 02:13:00 PM,08/05/2015 02:13:20 PM,07/31/2015 04:38:59 AM,ONTIME,Closed,Case Closed. Closed date : 2015-07-31 04:38:59.58 Case Resolved water on,Equipment Repair,Parks & Recreation Department,Park Maintenance & Safety,Equipment Repair,PARK_Maintenance_Trades,PARK,,,60 Smith St  Mission Hill  MA  02120,9.0,10A,8.0,B2,Mission Hill,14.0,10,1002.0,,60 Smith St,2120.0,Address,342526.0,42.3594,-71.0587,Employee Generated,"(0, 0)"
601459,101001439595,07/29/2015 03:20:00 PM,08/05/2015 03:20:06 PM,07/31/2015 04:41:46 AM,ONTIME,Closed,Case Closed. Closed date : 2015-07-31 04:41:46.293 Case Resolved water on,Equipment Repair,Parks & Recreation Department,Park Maintenance & Safety,Equipment Repair,PARK_Maintenance_Trades,PARK,,,60 Smith St  Mission Hill  MA  02120,9.0,10A,8.0,B2,Mission Hill,14.0,10,1002.0,,60 Smith St,2120.0,Address,342526.0,42.3594,-71.0587,Constituent Call,"(0, 0)"
601509,101001439662,07/29/2015 04:39:00 PM,08/05/2015 04:39:56 PM,07/31/2015 06:06:38 AM,ONTIME,Closed,Case Closed. Closed date : 2015-07-31 06:06:38.53 Case Resolved,Equipment Repair,Parks & Recreation Department,Park Maintenance & Safety,Equipment Repair,PARK_Maintenance_Trades,PARK,,,40 Smith St  Mission Hill  MA  02120,9.0,10A,8.0,B2,Mission Hill,14.0,10,1002.0,E,40 Smith St,2120.0,Address,128191.0,42.333,-71.0983,Constituent Call,"(42.333, -71.0983)"
601559,101001439721,07/29/2015 06:24:00 PM,08/06/2015 08:30:00 AM,07/31/2015 04:37:08 AM,ONTIME,Closed,Case Closed. Closed date : 2015-07-31 04:37:08.517 Case Resolved,Equipment Repair,Parks & Recreation Department,Park Maintenance & Safety,Equipment Repair,PARK_Maintenance_Trades,PARK,,,INTERSECTION of Atlantic Ave & Richmond St  Boston  MA,3.0,1B,1.0,A1,Downtown / Financial District,3.0,Ward 3,301.0,,INTERSECTION Atlantic Ave & Richmond St,,Intersection,736.0,42.3617,-71.052,Constituent Call,"(42.3617, -71.052)"
601798,101001500050,07/30/2015 10:55:30 AM,08/06/2015 10:55:30 AM,07/30/2015 12:57:32 PM,ONTIME,Closed,Case Closed. Closed date : 2015-07-30 12:57:32.74 Case Noted BWSC had to shut of the water because a pipe had broken in the street.,Equipment Repair: Mission Hill Playground,Parks & Recreation Department,Park Maintenance & Safety,Equipment Repair,PARK_Maintenance_Trades,PARK,,,,,,,,,,,,,,,,,42.3594,-71.0587,Self Service,"(0, 0)"
601907,101001500196,07/30/2015 01:01:00 PM,08/06/2015 01:01:54 PM,08/03/2015 01:40:27 PM,ONTIME,Closed,Case Closed. Closed date : 2015-08-03 13:40:27.187 Case Resolved,Equipment Repair,Parks & Recreation Department,Park Maintenance & Safety,Equipment Repair,PARK_Maintenance_Trades,PARK,,,,,,,,,,,,,,,,,42.3594,-71.0587,Employee Generated,"(0, 0)"
601951,101001500267,07/30/2015 02:10:00 PM,08/06/2015 02:10:56 PM,08/11/2015 01:17:36 PM,OVERDUE,Closed,Case Closed. Closed date : 2015-08-11 13:17:36.833 Case Resolved,Equipment Repair,Parks & Recreation Department,Park Maintenance & Safety,Equipment Repair,PARK_Maintenance_Trades,PARK,,,,,,,,,,,,,,,,,42.3594,-71.0587,Employee Generated,"(0, 0)"
601980,101001500302,07/30/2015 02:44:00 PM,08/06/2015 02:44:33 PM,09/22/2015 03:06:45 PM,OVERDUE,Closed,Case Closed. Closed date : 2015-09-22 15:06:45.23 Case Resolved,Equipment Repair,Parks & Recreation Department,Park Maintenance & Safety,Equipment Repair,PARK_Maintenance_Trades,PARK,,,,,,,,,,,,,,,,,42.3594,-71.0587,Employee Generated,"(0, 0)"
602351,101001500811,07/31/2015 10:46:00 AM,08/07/2015 10:46:23 AM,08/26/2015 11:39:37 AM,OVERDUE,Closed,Case Closed. Closed date : 2015-08-26 11:39:37.34 Case Noted plumbers report water is on,Equipment Repair,Parks & Recreation Department,Park Maintenance & Safety,Equipment Repair,PARK_Maintenance_Trades,PARK,,,33 Sumner St  East Boston  MA  02128,1.0,09,1.0,A7,East Boston,1.0,1,103.0,,33 Sumner St,2128.0,Address,342511.0,42.3594,-71.0587,Employee Generated,"(0, 0)"
602354,101001500813,07/31/2015 10:48:00 AM,08/07/2015 10:48:48 AM,09/25/2015 09:36:19 AM,OVERDUE,Closed,Case Closed. Closed date : 2015-09-25 09:36:19.073 Case Resolved Sprinklers were repaired.,Equipment Repair,Parks & Recreation Department,Park Maintenance & Safety,Equipment Repair,PARK_Maintenance_Trades,PARK,,,56 Dunbar Ave  Dorchester  MA  02124,8.0,07,4.0,B3,Dorchester,9.0,17,1708.0,,56 Dunbar Ave,2124.0,Address,342601.0,42.3594,-71.0587,Employee Generated,"(0, 0)"
602367,101001500826,07/31/2015 11:02:05 AM,08/07/2015 11:02:14 AM,07/31/2015 11:03:59 AM,ONTIME,Closed,Case Closed. Closed date : 2015-07-31 11:03:59.723 Case Invalid,Equipment Repair,Parks & Recreation Department,Park Maintenance & Safety,Equipment Repair,PARK_Maintenance_Trades,PARK,,,221 Roxbury St  Roxbury  MA  02119,7.0,10B,7.0,B2,Roxbury,13.0,9,905.0,,221 Roxbury St,2119.0,Address,342482.0,42.3594,-71.0587,Employee Generated,"(0, 0)"
602560,101001501067,07/31/2015 02:52:00 PM,08/07/2015 02:52:52 PM,07/31/2015 02:55:29 PM,ONTIME,Closed,Case Closed. Closed date : 2015-07-31 14:55:29.68 Case Resolved,Equipment Repair,Parks & Recreation Department,Park Maintenance & Safety,Equipment Repair,PARK_Maintenance_Trades,PARK,,,,,,,,,,,,,,,,,42.3594,-71.0587,Employee Generated,"(0, 0)"
602563,101001501071,07/31/2015 02:56:00 PM,08/07/2015 02:57:03 PM,07/31/2015 02:58:39 PM,ONTIME,Closed,Case Closed. Closed date : 2015-07-31 14:58:39.397 Case Resolved,Equipment Repair,Parks & Recreation Department,Park Maintenance & Safety,Equipment Repair,PARK_Maintenance_Trades,PARK,,,,,,,,,,,,,,,,,42.3594,-71.0587,Employee Generated,"(0, 0)"
602564,101001501075,07/31/2015 03:01:00 PM,08/07/2015 03:02:15 PM,07/31/2015 03:04:02 PM,ONTIME,Closed,Case Closed. Closed date : 2015-07-31 15:04:02.35 Case Resolved,Equipment Repair,Parks & Recreation Department,Park Maintenance & Safety,Equipment Repair,PARK_Maintenance_Trades,PARK,,,,,,,,,,,,,,,,,42.3594,-71.0587,Employee Generated,"(0, 0)"
602572,101001501082,07/31/2015 03:07:00 PM,08/07/2015 03:08:06 PM,07/31/2015 03:22:35 PM,ONTIME,Closed,Case Closed Case Resolved,Equipment Repair,Parks & Recreation Department,Park Maintenance & Safety,Equipment Repair,PARK_Maintenance_Trades,PARK,,,,,,,,,,,,,,,,,42.3594,-71.0587,Employee Generated,"(0, 0)"
602586,101001501099,07/31/2015 03:23:00 PM,08/07/2015 03:23:16 PM,07/31/2015 03:25:17 PM,ONTIME,Closed,Case Closed. Closed date : 2015-07-31 15:25:17.297 Case Resolved,Equipment Repair,Parks & Recreation Department,Park Maintenance & Safety,Equipment Repair,PARK_Maintenance_Trades,PARK,,,,,,,,,,,,,,,,,42.3594,-71.0587,Employee Generated,"(0, 0)"
602588,101001501101,07/31/2015 03:25:00 PM,08/07/2015 03:25:45 PM,07/31/2015 03:28:13 PM,ONTIME,Closed,Case Closed. Closed date : 2015-07-31 15:28:13.22 Case Resolved,Equipment Repair,Parks & Recreation Department,Park Maintenance & Safety,Equipment Repair,PARK_Maintenance_Trades,PARK,,,,,,,,,,,,,,,,,42.3594,-71.0587,Employee Generated,"(0, 0)"
602847,101001501478,08/01/2015 01:13:00 PM,08/10/2015 08:30:00 AM,09/28/2015 09:00:35 AM,OVERDUE,Closed,Case Closed. Closed date : 2015-09-28 09:00:35.07 Case Resolved Sprinklers were repaired  now they are off for the season.,Equipment Repair,Parks & Recreation Department,Park Maintenance & Safety,Equipment Repair,PARK_Maintenance_Trades,PARK,,,10 Mozart St  Jamaica Plain  MA  02130,9.0,10A,6.0,E13,Jamaica Plain,11.0,10,1007.0,E,10 Mozart St,2130.0,Address,341941.0,42.3224,-71.1045,Constituent Call,"(42.3224, -71.1045)"
603306,101001502130,08/03/2015 11:20:00 AM,08/10/2015 11:20:59 AM,12/14/2015 03:19:55 PM,OVERDUE,Closed,Case Closed. Closed date : 2015-12-14 15:19:55.343 Case Noted note to franny,Equipment Repair,Parks & Recreation Department,Park Maintenance & Safety,Equipment Repair,PARK_Park Improvement Requests,PARK,,,1 Jewish War Veterans Dr  Jamaica Plain  MA  02130,9.0,02,7.0,B2,Greater Mattapan,13.0,12,1207.0,E,1 Jewish War Veterans Dr,2130.0,Address,163434.0,42.301,-71.0886,Employee Generated,"(42.301, -71.0886)"
603310,101001502136,08/03/2015 11:26:00 AM,08/10/2015 11:26:21 AM,08/11/2015 04:37:28 AM,OVERDUE,Closed,Case Closed. Closed date : 2015-08-11 04:37:28.41 Case Resolved paint bench,Equipment Repair,Parks & Recreation Department,Park Maintenance & Safety,Equipment Repair,PARK_Maintenance_Trades,PARK,,,1 Jewish War Veterans Dr  Jamaica Plain  MA  02130,9.0,02,7.0,B2,Greater Mattapan,13.0,12,1207.0,E,1 Jewish War Veterans Dr,2130.0,Address,163434.0,42.301,-71.0886,Employee Generated,"(42.301, -71.0886)"
603315,101001502143,08/03/2015 11:30:00 AM,08/10/2015 11:30:52 AM,08/11/2015 01:31:01 PM,OVERDUE,Closed,Case Closed. Closed date : 2015-08-11 13:31:01.977 Case Resolved,Equipment Repair,Parks & Recreation Department,Park Maintenance & Safety,Equipment Repair,PARK_Maintenance_Trades,PARK,,,529-543 Commercial St  Boston  MA  02109,3.0,1B,1.0,A1,Boston,3.0,3,302.0,E,529-543 Commercial St,2109.0,Address,36790.0,42.3688,-71.0562,Employee Generated,"(42.3688, -71.0562)"
603343,101001502172,08/03/2015 11:45:00 AM,08/10/2015 11:46:09 AM,08/11/2015 04:36:42 AM,OVERDUE,Closed,Case Closed. Closed date : 2015-08-11 04:36:42.687 Case Resolved done,Equipment Repair,Parks & Recreation Department,Park Maintenance & Safety,Equipment Repair,PARK_Maintenance_Trades,PARK,,,1 Jewish War Veterans Dr  Jamaica Plain  MA  02130,9.0,02,7.0,B2,Greater Mattapan,13.0,12,1207.0,E,1 Jewish War Veterans Dr,2130.0,Address,163434.0,42.301,-71.0886,Employee Generated,"(42.301, -71.0886)"
603526,101001502407,08/03/2015 03:26:00 PM,08/10/2015 03:26:52 PM,08/11/2015 12:59:16 PM,OVERDUE,Closed,Case Closed. Closed date : 2015-08-11 12:59:16.033 Case Resolved,Equipment Repair,Parks & Recreation Department,Park Maintenance & Safety,Equipment Repair,PARK_Maintenance_Trades,PARK,,,60 Smith St  Mission Hill  MA  02120,9.0,10A,8.0,B2,Mission Hill,14.0,10,1002.0,,60 Smith St,2120.0,Address,342526.0,42.3594,-71.0587,Employee Generated,"(0, 0)"
603808,101001502817,08/04/2015 09:39:00 AM,08/11/2015 09:39:59 AM,08/11/2015 11:03:44 AM,OVERDUE,Closed,Case Closed. Closed date : 2015-08-11 11:03:44.223 Case Resolved,Equipment Repair,Parks & Recreation Department,Park Maintenance & Safety,Equipment Repair,PARK_Maintenance_Trades,PARK,,,,,,,,,,,,,,,,,42.3594,-71.0587,Employee Generated,"(0, 0)"
603896,101001502928,08/04/2015 10:52:14 AM,08/11/2015 10:52:25 AM,08/05/2015 01:24:30 PM,ONTIME,Closed,Case Closed. Closed date : 2015-08-05 13:24:30.447 Case Invalid,Equipment Repair,Parks & Recreation Department,Park Maintenance & Safety,Equipment Repair,PARK_Maintenance_Trades,PARK,,,39 Terminal St  Charlestown  MA  02129,3.0,1A,1.0,A15,Charlestown,2.0,2,202.0,,39 Terminal St,2129.0,Address,344482.0,42.3816,-71.0599,Employee Generated,"(42.3816, -71.0599)"
603898,101001502931,08/04/2015 10:54:00 AM,08/11/2015 10:54:36 AM,10/28/2015 09:41:53 AM,OVERDUE,Closed,Case Closed. Closed date : 2015-10-28 09:41:53.827 Case Resolved done 10-23-15,Equipment Repair,Parks & Recreation Department,Park Maintenance & Safety,Equipment Repair,PARK_Maintenance_Trades,PARK,,,39 Terminal St  Charlestown  MA  02129,3.0,1A,1.0,A15,Charlestown,2.0,2,202.0,,39 Terminal St,2129.0,Address,344482.0,42.3816,-71.0599,Employee Generated,"(42.3816, -71.0599)"
603958,101001503012,08/04/2015 12:00:00 PM,08/11/2015 12:00:37 PM,08/11/2015 11:37:23 AM,ONTIME,Closed,Case Closed. Closed date : 2015-08-11 11:37:23.483 Case Resolved,Equipment Repair,Parks & Recreation Department,Park Maintenance & Safety,Equipment Repair,PARK_Maintenance_Trades,PARK,,,135 Prince St  Boston  MA  02113,3.0,1B,1.0,A1,Boston,3.0,3,303.0,,135 Prince St,2113.0,Address,342060.0,42.3594,-71.0587,Employee Generated,"(0, 0)"
603962,101001503020,08/04/2015 12:09:00 PM,08/11/2015 12:09:16 PM,08/11/2015 11:42:47 AM,ONTIME,Closed,Case Closed. Closed date : 2015-08-11 11:42:47.53 Case Resolved,Equipment Repair,Parks & Recreation Department,Park Maintenance & Safety,Equipment Repair,PARK_Maintenance_Trades,PARK,,,25 Penniman Rd  Allston  MA  02134,11.0,04,9.0,D14,Allston,15.0,22,2202.0,,25 Penniman Rd,2134.0,Address,342570.0,42.3594,-71.0587,Employee Generated,"(0, 0)"
604048,101001503136,08/04/2015 01:56:00 PM,08/11/2015 01:57:01 PM,08/11/2015 04:39:01 AM,ONTIME,Closed,Case Closed. Closed date : 2015-08-11 04:39:01.743 Case Resolved done,Equipment Repair,Parks & Recreation Department,Park Maintenance & Safety,Equipment Repair,PARK_Maintenance_Trades,PARK,,,50 Orchard Park St  Roxbury  MA  02119,7.0,10B,7.0,B2,Roxbury,13.0,8,803.0,,50 Orchard Park St,2119.0,Address,342557.0,42.3594,-71.0587,Constituent Call,"(0, 0)"
604061,101001503154,08/04/2015 02:09:00 PM,08/11/2015 02:09:56 PM,09/22/2015 03:09:26 PM,OVERDUE,Closed,Case Closed. Closed date : 2015-09-22 15:09:26.033 Case Resolved done,Equipment Repair,Parks & Recreation Department,Park Maintenance & Safety,Equipment Repair,PARK_Maintenance_Trades,PARK,,,50 Orchard Park St  Roxbury  MA  02119,7.0,10B,7.0,B2,Roxbury,13.0,8,803.0,,50 Orchard Park St,2119.0,Address,342557.0,42.3594,-71.0587,Constituent Call,"(0, 0)"
604138,101001503249,08/04/2015 03:16:00 PM,08/11/2015 03:16:32 PM,09/25/2015 09:41:06 AM,OVERDUE,Closed,Case Closed. Closed date : 2015-09-25 09:41:06.803 Case Resolved Graffiti was removed.,Equipment Repair,Parks & Recreation Department,Park Maintenance & Safety,Equipment Repair,PARK_Maintenance_Trades,PARK,,,70 Park Dr  Boston  MA  02215,4.0,10A,8.0,D4,Fenway / Kenmore / Audubon Circle / Longwood,14.0,05,502.0,E,70 Park Dr,2215.0,Address,342000.0,42.3594,-71.0587,Employee Generated,"(0, 0)"
604327,101001503494,08/04/2015 06:13:00 PM,08/12/2015 08:30:00 AM,08/11/2015 11:28:28 AM,ONTIME,Closed,Case Closed. Closed date : 2015-08-11 11:28:28.183 Case Noted not parks dept fence construction contractor,Equipment Repair,Parks & Recreation Department,Park Maintenance & Safety,Equipment Repair,PARK_Maintenance_Trades,PARK,,,160 Florence St  Roslindale  MA  02131,12.0,02,5.0,E5,Roslindale,10.0,19,1913.0,E,160 Florence St,2131.0,Address,155813.0,42.2882,-71.1223,Constituent Call,"(42.2882, -71.1223)"
604335,101001503508,08/04/2015 06:24:00 PM,08/12/2015 08:30:00 AM,09/25/2015 09:41:40 AM,OVERDUE,Closed,Case Closed. Closed date : 2015-09-25 09:41:40.22 Case Resolved Irrigation was repaired.,Equipment Repair,Parks & Recreation Department,Park Maintenance & Safety,Equipment Repair,PARK_Maintenance_Trades,PARK,,,115 Paris St  East Boston  MA  02128,1.0,09,1.0,A7,East Boston,1.0,1,104.0,,115 Paris St,2128.0,Address,340867.0,42.3721,-71.037,Constituent Call,"(42.3721, -71.037)"
604622,101001503888,08/05/2015 09:47:00 AM,08/12/2015 09:47:14 AM,09/25/2015 09:42:28 AM,OVERDUE,Closed,Case Closed. Closed date : 2015-09-25 09:42:28.433 Case Resolved Hockey net was replaced.,Equipment Repair,Parks & Recreation Department,Park Maintenance & Safety,Equipment Repair,PARK_Maintenance_Trades,PARK,,,,,,,,,,,,,,,,,42.3594,-71.0587,Employee Generated,"(0, 0)"
604648,101001503916,08/05/2015 10:08:00 AM,08/12/2015 10:08:23 AM,08/11/2015 11:15:54 AM,ONTIME,Closed,Case Closed. Closed date : 2015-08-11 11:15:54.33 Case Resolved,Equipment Repair,Parks & Recreation Department,Park Maintenance & Safety,Equipment Repair,PARK_Maintenance_Trades,PARK,,,,,,,,,,,,,,,,,42.3594,-71.0587,Employee Generated,"(0, 0)"
604728,101001504032,08/05/2015 11:10:19 AM,08/12/2015 11:10:36 AM,08/05/2015 11:11:12 AM,ONTIME,Closed,Case Closed. Closed date : 2015-08-05 11:11:12.963 Case Invalid,Equipment Repair,Parks & Recreation Department,Park Maintenance & Safety,Equipment Repair,PARK_Maintenance_Trades,PARK,,,71 Russell St  Charlestown  MA  02129,3.0,1A,1.0,A15,Charlestown,2.0,Ward 2,205.0,R2,71 Russell St,2129.0,Address,119710.0,42.3801,-71.067,Employee Generated,"(42.3801, -71.067)"
604837,101001504176,08/05/2015 01:16:00 PM,08/12/2015 01:16:48 PM,09/25/2015 09:43:31 AM,OVERDUE,Closed,Case Closed. Closed date : 2015-09-25 09:43:31.633 Case Resolved Sprinklers were repaired.,Equipment Repair,Parks & Recreation Department,Park Maintenance & Safety,Equipment Repair,PARK_Maintenance_Trades,PARK,,,60 Smith St  Mission Hill  MA  02120,9.0,10A,8.0,B2,Mission Hill,14.0,10,1002.0,,60 Smith St,2120.0,Address,342526.0,42.3594,-71.0587,Constituent Call,"(0, 0)"
604937,101001504297,08/05/2015 02:53:00 PM,08/12/2015 02:54:00 PM,08/31/2015 02:52:11 PM,OVERDUE,Closed,Case Closed. Closed date : 2015-08-31 14:52:11.703 Case Resolved,Equipment Repair,Parks & Recreation Department,Park Maintenance & Safety,Equipment Repair,PARK_Maintenance_Trades,PARK,,,20 Wainwright St  Dorchester  MA  02124,8.0,07,3.0,C11,Dorchester,8.0,16,1603.0,,20 Wainwright St,2124.0,Address,342037.0,42.3594,-71.0587,Employee Generated,"(0, 0)"
604948,101001504312,08/05/2015 03:06:00 PM,08/12/2015 03:06:34 PM,08/05/2015 03:13:37 PM,ONTIME,Closed,Case Closed. Closed date : 2015-08-05 15:13:37.36 Case Invalid Opened in error. Please refer to case id # 1504323.,Equipment Repair,Parks & Recreation Department,Park Maintenance & Safety,Equipment Repair,PARK_Maintenance_Trades,PARK,,,43 Bow St  Hyde Park  MA  02136,12.0,08,5.0,E18,Hyde Park,10.0,18,1817.0,,43 Bow St,2136.0,Address,342699.0,42.3594,-71.0587,Constituent Call,"(0, 0)"
605064,101001504470,08/05/2015 06:14:00 PM,08/13/2015 08:30:00 AM,10/09/2015 10:43:11 AM,OVERDUE,Closed,Case Closed. Closed date : 2015-10-09 10:43:11.67 Case Resolved done 10-7-15,Equipment Repair,Parks & Recreation Department,Park Maintenance & Safety,Equipment Repair,PARK_Maintenance_Trades,PARK,,,220 Porter St  East Boston  MA  02128,1.0,09,1.0,A7,East Boston,1.0,01,105.0,CM,220 Porter St,2128.0,Address,168866.0,42.3712,-71.0298,Constituent Call,"(42.3712, -71.0298)"
605269,101001504741,08/06/2015 09:20:00 AM,08/13/2015 09:20:57 AM,08/11/2015 10:59:57 AM,ONTIME,Closed,Case Closed. Closed date : 2015-08-11 10:59:57.68 Case Resolved,Equipment Repair,Parks & Recreation Department,Park Maintenance & Safety,Equipment Repair,PARK_Maintenance_Trades,PARK,,,,,,,,,,,,,,,,,42.3594,-71.0587,Employee Generated,"(0, 0)"
605518,101001505067,08/06/2015 01:54:00 PM,08/13/2015 01:56:33 PM,08/11/2015 10:58:23 AM,ONTIME,Closed,Case Closed. Closed date : 2015-08-11 10:58:23.83 Case Resolved,Equipment Repair,Parks & Recreation Department,Park Maintenance & Safety,Equipment Repair,PARK_Maintenance_Trades,PARK,,,20 Williams St  Jamaica Plain  MA  02130,9.0,02,6.0,E13,Jamaica Plain,11.0,11,1107.0,,20 Williams St,2130.0,Address,342335.0,42.3075,-71.1077,Employee Generated,"(42.3075, -71.1077)"
605580,101001505137,08/06/2015 03:06:00 PM,08/13/2015 03:06:13 PM,08/26/2015 11:48:07 AM,OVERDUE,Closed,Case Closed. Closed date : 2015-08-26 11:48:07.85 Case Resolved,Equipment Repair,Parks & Recreation Department,Park Maintenance & Safety,Equipment Repair,PARK_Maintenance_Trades,PARK,,,,,,,,,,,,,,,,,42.3594,-71.0587,Employee Generated,"(0, 0)"
605921,101001505616,08/07/2015 10:11:00 AM,08/14/2015 10:11:35 AM,08/14/2015 02:46:41 PM,OVERDUE,Closed,Case Closed. Closed date : 2015-08-14 14:46:41.63 Case Resolved,Equipment Repair,Parks & Recreation Department,Park Maintenance & Safety,Equipment Repair,PARK_Maintenance_Trades,PARK,,,,,,,,,,,,,,,,,42.3594,-71.0587,Constituent Call,"(0, 0)"
605967,101001505684,08/07/2015 11:01:00 AM,08/14/2015 11:01:56 AM,08/14/2015 02:48:02 PM,OVERDUE,Closed,Case Closed. Closed date : 2015-08-14 14:48:02.45 Case Noted gate repaired,Equipment Repair,Parks & Recreation Department,Park Maintenance & Safety,Equipment Repair,PARK_Maintenance_Trades,PARK,,,369 Lagrange St  West Roxbury  MA  02132,12.0,06,6.0,E5,West Roxbury,12.0,20,2014.0,E,369 Lagrange St,2132.0,Address,166825.0,42.2803,-71.1569,Constituent Call,"(42.2803, -71.1569)"
605984,101001505708,08/07/2015 11:21:00 AM,08/14/2015 11:21:13 AM,10/15/2015 10:37:17 AM,OVERDUE,Closed,Case Closed. Closed date : 2015-10-15 10:37:17.643 Case Resolved done 8-17-15,Equipment Repair,Parks & Recreation Department,Park Maintenance & Safety,Equipment Repair,PARK_Maintenance_Trades,PARK,,,160 Norfolk Ave  Roxbury  MA  02119,7.0,03,7.0,B2,Roxbury,13.0,08,806.0,,160 Norfolk Ave,2119.0,Address,342027.0,42.3594,-71.0587,Employee Generated,"(0, 0)"
605990,101001505718,08/07/2015 11:24:00 AM,08/14/2015 11:24:58 AM,08/11/2015 04:28:36 AM,ONTIME,Closed,Case Closed. Closed date : 2015-08-11 04:28:36.41 Case Resolved repair swing,Equipment Repair,Parks & Recreation Department,Park Maintenance & Safety,Equipment Repair,PARK_Maintenance_Trades,PARK,,,160 Norfolk Ave  Roxbury  MA  02119,7.0,03,7.0,B2,Roxbury,13.0,08,806.0,,160 Norfolk Ave,2119.0,Address,342027.0,42.3594,-71.0587,Employee Generated,"(0, 0)"
605995,101001505720,08/07/2015 11:27:00 AM,08/14/2015 11:27:11 AM,08/11/2015 06:11:04 AM,ONTIME,Closed,Case Closed. Closed date : 2015-08-11 06:11:04.787 Case Resolved paint bench,Equipment Repair,Parks & Recreation Department,Park Maintenance & Safety,Equipment Repair,PARK_Maintenance_Trades,PARK,,,621 Dudley St  Dorchester  MA  02125,7.0,03,7.0,B2,Dorchester,13.0,13,1302.0,,621 Dudley St,2125.0,Address,342460.0,42.3594,-71.0587,Employee Generated,"(0, 0)"
606254,101001506072,08/07/2015 03:53:00 PM,08/14/2015 03:53:07 PM,09/02/2015 12:05:46 PM,OVERDUE,Closed,Case Closed. Closed date : 2015-09-02 12:05:46.883 Case Resolved done 8-31-15,Equipment Repair,Parks & Recreation Department,Park Maintenance & Safety,Equipment Repair,PARK_Maintenance_Trades,PARK,,,365 Hyde Park Ave  Roslindale  MA  02131,12.0,02,6.0,E18,Roslindale,10.0,19,1912.0,E,365 Hyde Park Ave,2131.0,Address,77313.0,42.289,-71.1188,Employee Generated,"(42.289, -71.1188)"
606429,101001516318,08/08/2015 09:45:00 AM,08/17/2015 08:30:00 AM,09/28/2015 08:42:20 AM,OVERDUE,Closed,Case Closed. Closed date : 2015-09-28 08:42:20.277 Case Resolved Sprinklers were shut off.,Equipment Repair,Parks & Recreation Department,Park Maintenance & Safety,Equipment Repair,PARK_Maintenance_Trades,PARK,,,INTERSECTION of Chiswick Rd & Commonwealth Ave  Brighton  MA,11.0,04,9.0,D14,Allston / Brighton,15.0,Ward 21,2113.0,,INTERSECTION Chiswick Rd & Commonwealth Ave,,Intersection,2992.0,42.3403,-71.1511,Constituent Call,"(42.3403, -71.1511)"
606485,101001516401,08/08/2015 02:03:00 PM,08/17/2015 08:30:00 AM,09/28/2015 12:39:26 PM,OVERDUE,Closed,Case Closed. Closed date : 2015-09-28 12:39:26.953 Case Noted We reoved and made it safe.,Equipment Repair,Parks & Recreation Department,Park Maintenance & Safety,Equipment Repair,PARK_Maintenance_Trades,PARK,,,81-87 Intervale St  Dorchester  MA  02121,7.0,03,4.0,B2,Roxbury,13.0,14,1401.0,,81-87 Intervale St,2121.0,Address,342024.0,42.3594,-71.0587,Constituent Call,"(0, 0)"
606882,101001516999,08/10/2015 10:35:00 AM,08/17/2015 10:35:13 AM,08/18/2015 05:54:55 AM,OVERDUE,Closed,Case Closed. Closed date : 2015-08-18 05:54:55.253 Case Resolved remove sand,Equipment Repair,Parks & Recreation Department,Park Maintenance & Safety,Equipment Repair,PARK_Maintenance_Trades,PARK,,,,,,,,,,,,,,,,,42.3594,-71.0587,Employee Generated,"(0, 0)"
607035,101001517219,08/10/2015 01:10:00 PM,08/17/2015 01:10:50 PM,08/18/2015 05:55:39 AM,OVERDUE,Closed,Case Closed. Closed date : 2015-08-18 05:55:39.177 Case Resolved remove graffiti,Equipment Repair,Parks & Recreation Department,Park Maintenance & Safety,Equipment Repair,PARK_Maintenance_Trades,PARK,https://mayors24.cityofboston.gov/media/boston/report/photos/55c8db186963fe2d4ed25da7/photo_20150810_130706.jpg,,95 Tremont St  Boston  MA  02108,3.0,1B,1.0,A1,Boston,3.0,3,306.0,,95 Tremont St,2108.0,Address,342459.0,42.3594,-71.0587,Citizens Connect App,"(0, 0)"
607047,101001517244,08/10/2015 01:29:00 PM,08/17/2015 01:29:47 PM,08/14/2015 09:27:07 AM,ONTIME,Closed,Case Closed. Closed date : 2015-08-14 09:27:07.937 Case Resolved,Equipment Repair,Parks & Recreation Department,Park Maintenance & Safety,Equipment Repair,PARK_Maintenance_Trades,PARK,,,,,,,,,,,,,,,,,42.3594,-71.0587,Employee Generated,"(0, 0)"
607084,101001517295,08/10/2015 02:10:00 PM,08/17/2015 02:11:12 PM,09/22/2015 10:16:07 AM,OVERDUE,Closed,Case Closed. Closed date : 2015-09-22 10:16:07.83 Case Resolved done 9-17-15,Equipment Repair,Parks & Recreation Department,Park Maintenance & Safety,Equipment Repair,PARK_Maintenance_Trades,PARK,,,81-87 Intervale St  Dorchester  MA  02121,7.0,03,4.0,B2,Roxbury,13.0,14,1401.0,,81-87 Intervale St,2121.0,Address,342024.0,42.3594,-71.0587,Employee Generated,"(0, 0)"
607092,101001517299,08/10/2015 02:14:00 PM,08/17/2015 02:14:52 PM,08/18/2015 05:57:00 AM,OVERDUE,Closed,Case Closed. Closed date : 2015-08-18 05:57:00.247 Case Resolved remove graffiti,Equipment Repair,Parks & Recreation Department,Park Maintenance & Safety,Equipment Repair,PARK_Maintenance_Trades,PARK,,,81-87 Intervale St  Dorchester  MA  02121,7.0,03,4.0,B2,Roxbury,13.0,14,1401.0,,81-87 Intervale St,2121.0,Address,342024.0,42.3594,-71.0587,Employee Generated,"(0, 0)"
607095,101001517303,08/10/2015 02:17:00 PM,08/17/2015 02:17:37 PM,08/14/2015 02:53:30 PM,ONTIME,Closed,Case Closed. Closed date : 2015-08-14 14:53:30.853 Case Resolved,Equipment Repair,Parks & Recreation Department,Park Maintenance & Safety,Equipment Repair,PARK_Maintenance_Trades,PARK,,,81-87 Intervale St  Dorchester  MA  02121,7.0,03,4.0,B2,Roxbury,13.0,14,1401.0,,81-87 Intervale St,2121.0,Address,342024.0,42.3594,-71.0587,Employee Generated,"(0, 0)"
607108,101001517325,08/10/2015 02:34:00 PM,08/17/2015 02:34:48 PM,10/21/2015 03:09:23 PM,OVERDUE,Closed,Case Closed. Closed date : 2015-10-21 15:09:23.063 Case Noted waiting for parts,Equipment Repair,Parks & Recreation Department,Park Maintenance & Safety,Equipment Repair,PARK_Maintenance_Trades,PARK,,,,,,,,,,,,,,,,,42.3594,-71.0587,Employee Generated,"(0, 0)"
607248,101001517522,08/10/2015 05:33:00 PM,08/18/2015 08:30:00 AM,08/18/2015 05:57:46 AM,ONTIME,Closed,Case Closed. Closed date : 2015-08-18 05:57:46.8 Case Resolved no leak found,Equipment Repair,Parks & Recreation Department,Park Maintenance & Safety,Equipment Repair,PARK_Maintenance_Trades,PARK,https://mayors24.cityofboston.gov/media/boston/report/photos/55c918bb6963fe2d4ed2608b/report.jpg,,75 W Rutland Sq  Roxbury  MA  02118,4.0,1C,7.0,D4,Roxbury,6.0,4,404.0,,75 W Rutland Sq,2118.0,Address,342665.0,42.3594,-71.0587,Citizens Connect App,"(0, 0)"
607292,101001517574,08/10/2015 06:31:17 PM,08/18/2015 08:30:00 AM,08/17/2015 05:48:18 AM,ONTIME,Closed,Case Closed. Closed date : 2015-08-17 05:48:18.363 Case Resolved new toy order,Equipment Repair,Parks & Recreation Department,Park Maintenance & Safety,Equipment Repair,PARK_Maintenance_Trades,PARK,https://mayors24.cityofboston.gov/media/boston/report/photos/55c926356963fe2d4ed26194/report.jpg,,75 W Rutland Sq  Roxbury  MA  02118,4.0,1C,7.0,D4,Roxbury,6.0,4,404.0,,75 W Rutland Sq,2118.0,Address,342665.0,42.3594,-71.0587,Citizens Connect App,"(0, 0)"
607451,101001517781,08/11/2015 07:57:00 AM,08/18/2015 08:30:00 AM,08/17/2015 05:49:13 AM,ONTIME,Closed,Case Closed. Closed date : 2015-08-17 05:49:13.78 Case Resolved parts order,Equipment Repair,Parks & Recreation Department,Park Maintenance & Safety,Equipment Repair,PARK_Maintenance_Trades,PARK,https://mayors24.cityofboston.gov/media/boston/report/photos/55c9e3496963fe2d4ed26905/report.jpg,,75 W Rutland Sq  Roxbury  MA  02118,4.0,1C,7.0,D4,Roxbury,6.0,4,404.0,,75 W Rutland Sq,2118.0,Address,342665.0,42.3594,-71.0587,Citizens Connect App,"(0, 0)"
607621,101001517995,08/11/2015 09:54:00 AM,08/18/2015 09:54:40 AM,09/15/2015 11:15:02 AM,OVERDUE,Closed,Case Closed. Closed date : 2015-09-15 11:15:02.527 Case Noted plumbers report spray feature needs new button,Equipment Repair: Joyce Playground,Parks & Recreation Department,Park Maintenance & Safety,Equipment Repair,PARK_Maintenance_Trades,PARK,,,,,,,,,,,,,,,,,42.3594,-71.0587,Self Service,"(0, 0)"
607655,101001518040,08/11/2015 10:38:00 AM,08/18/2015 10:38:08 AM,08/12/2015 05:43:57 AM,ONTIME,Closed,Case Closed. Closed date : 2015-08-12 05:43:57.367 Case Resolved no irrigation in park,Equipment Repair,Parks & Recreation Department,Park Maintenance & Safety,Equipment Repair,PARK_Maintenance_Trades,PARK,,,130 B St  South Boston  MA  02127,6.0,05,2.0,C6,South Boston,5.0,06,601.0,,130 B St,2127.0,Address,342379.0,42.3594,-71.0587,Constituent Call,"(0, 0)"
607700,101001518102,08/11/2015 11:22:00 AM,08/18/2015 11:22:24 AM,08/12/2015 09:29:29 AM,ONTIME,Closed,Case Closed. Closed date : 2015-08-12 09:29:29.853 Duplicate of Existing Case Duplicate of Case #101001505684 created on 8/7/15. Case sent to Boston Parks Department and repairs have been requested. If you have any questions or concerns  please contact us at 311.,Equipment Repair,Parks & Recreation Department,Park Maintenance & Safety,Equipment Repair,INFO_Reallocation From Dept,INFO,,,64 Lagrange St  West Roxbury  MA  02132,12.0,06,6.0,E5,West Roxbury,12.0,Ward 20,2010.0,R3,64 Lagrange St,2132.0,Address,82856.0,42.2746,-71.1455,Citizens Connect App,"(42.2746, -71.1455)"
607714,101001518118,08/11/2015 11:36:00 AM,08/18/2015 11:36:03 AM,,OVERDUE,Open,,Equipment Repair,Parks & Recreation Department,Park Maintenance & Safety,Equipment Repair,INFO01_GenericeFormforOtherServiceRequestTypes,INFO,,,650 Columbus Ave  Roxbury  MA  02118,9.0,10B,7.0,D4,Roxbury,13.0,Ward 9,904.0,CM,650 Columbus Ave,2118.0,Address,36066.0,42.3388,-71.0835,Constituent Call,"(42.3388, -71.0835)"
607750,101001518179,08/11/2015 12:44:00 PM,08/18/2015 12:44:41 PM,,OVERDUE,Open,,Equipment Repair,Parks & Recreation Department,Park Maintenance & Safety,Equipment Repair,INFO01_GenericeFormforOtherServiceRequestTypes,INFO,,,1889 William J Day Blvd  South Boston  MA  02127,6.0,05,2.0,C6,South Boston / South Boston Waterfront,5.0,Ward 6,609.0,E,1889 William J Day Blvd,2127.0,Address,149851.0,42.3336,-71.0245,Citizens Connect App,"(42.3336, -71.0245)"
607871,101001518343,08/11/2015 02:45:00 PM,08/18/2015 02:45:34 PM,09/24/2015 03:48:25 PM,OVERDUE,Closed,Case Closed. Closed date : 2015-09-24 15:48:25.463 Case Resolved trades reports there is no rubber at copley sq,Equipment Repair,Parks & Recreation Department,Park Maintenance & Safety,Equipment Repair,PARK_Park Improvement Requests,PARK,,,560 Boylston St  Boston  MA  02116,4.0,1C,2.0,D4,Boston,6.0,04,402.0,,560 Boylston St,2116.0,Address,342031.0,42.3594,-71.0587,Citizens Connect App,"(0, 0)"
607888,101001518366,08/11/2015 02:55:00 PM,08/18/2015 02:55:55 PM,08/12/2015 01:48:59 PM,ONTIME,Closed,Case Closed. Closed date : 2015-08-12 13:48:59.733 Case Resolved The Park department currently has no plans to plant any trees and shrubs at this park.,Equipment Repair,Parks & Recreation Department,Park Maintenance & Safety,Equipment Repair,PARK_Maintenance_Horticulture,PARK,,,95 Lake Shore Rd  Brighton  MA  02135,11.0,04,9.0,D14,Brighton,15.0,22,2208.0,,95 Lake Shore Rd,2135.0,Address,342451.0,42.3594,-71.0587,Citizens Connect App,"(0, 0)"
608014,101001518539,08/11/2015 04:21:00 PM,08/18/2015 04:21:18 PM,,OVERDUE,Open,,Equipment Repair,Parks & Recreation Department,Park Maintenance & Safety,Equipment Repair,INFO01_GenericeFormforOtherServiceRequestTypes,INFO,,,45 Bunker Hill St  Charlestown  MA  02129,3.0,1A,1.0,A15,Charlestown,2.0,02,202.0,,45 Bunker Hill St,2129.0,Address,342474.0,42.3594,-71.0587,Citizens Connect App,"(0, 0)"
608030,101001518562,08/11/2015 04:32:00 PM,08/18/2015 04:32:18 PM,,OVERDUE,Open,,Equipment Repair,Parks & Recreation Department,Park Maintenance & Safety,Equipment Repair,PARK_Park Improvement Requests,PARK,,,300 Gardner St  West Roxbury  MA  02132,12.0,06,6.0,E5,West Roxbury,12.0,20,2017.0,,300 Gardner St,2132.0,Address,342525.0,42.3594,-71.0587,Constituent Call,"(0, 0)"
608068,101001518613,08/11/2015 05:09:00 PM,08/19/2015 08:30:00 AM,08/14/2015 02:44:08 PM,ONTIME,Closed,Case Closed. Closed date : 2015-08-14 14:44:08.78 Case Resolved,Equipment Repair,Parks & Recreation Department,Park Maintenance & Safety,Equipment Repair,PARK_Maintenance_Trades,PARK,https://mayors24.cityofboston.gov/media/boston/report/photos/55ca64a06963fe2d4ed28338/report.jpg,,85 Allston St  Allston  MA  02134,11.0,04,9.0,D14,Allston,15.0,21,2106.0,,85 Allston St,2134.0,Address,342014.0,42.3594,-71.0587,Citizens Connect App,"(0, 0)"
608071,101001518615,08/11/2015 05:10:00 PM,08/19/2015 08:30:00 AM,08/14/2015 02:43:24 PM,ONTIME,Closed,Case Closed. Closed date : 2015-08-14 14:43:24.557 Case Resolved,Equipment Repair,Parks & Recreation Department,Park Maintenance & Safety,Equipment Repair,PARK_Maintenance_Trades,PARK,https://mayors24.cityofboston.gov/media/boston/report/photos/55ca64bb6963fe2d4ed28348/report.jpg,,85 Allston St  Allston  MA  02134,11.0,04,9.0,D14,Allston,15.0,21,2106.0,,85 Allston St,2134.0,Address,342014.0,42.3594,-71.0587,Citizens Connect App,"(0, 0)"
608132,101001518698,08/11/2015 06:21:00 PM,08/19/2015 08:30:00 AM,08/14/2015 02:45:02 PM,ONTIME,Closed,Case Closed. Closed date : 2015-08-14 14:45:02.38 Case Resolved,Equipment Repair,Parks & Recreation Department,Park Maintenance & Safety,Equipment Repair,PARK_Maintenance_Trades,PARK,https://mayors24.cityofboston.gov/media/boston/report/photos/55ca757f6963fe2d4ed286f6/photo_20150811_182014.jpg,,74 Faneuil St  Brighton  MA  02135,11.0,04,9.0,D14,Brighton,15.0,22,2212.0,E,74 Faneuil St,2135.0,Address,56305.0,42.3548,-71.153,Citizens Connect App,"(42.3548, -71.153)"
608140,101001518708,08/11/2015 06:27:00 PM,08/19/2015 08:30:00 AM,08/17/2015 05:51:05 AM,ONTIME,Closed,Case Closed. Closed date : 2015-08-17 05:51:05.103 Case Resolved remove graffiti,Equipment Repair,Parks & Recreation Department,Park Maintenance & Safety,Equipment Repair,PARK_Maintenance_Trades,PARK,https://mayors24.cityofboston.gov/media/boston/report/photos/55ca76dc6963fe2d4ed28780/report.jpg,,92 Mount Ida Rd  Dorchester  MA  02122,7.0,03,3.0,C11,Dorchester,8.0,15,1509.0,,92 Mount Ida Rd,2122.0,Address,342620.0,42.3594,-71.0587,Citizens Connect App,"(0, 0)"
608166,101001518735,08/11/2015 06:42:35 PM,08/19/2015 08:30:00 AM,08/14/2015 05:47:59 AM,ONTIME,Closed,Case Closed. Closed date : 2015-08-14 05:47:59.65 Case Resolved not city park,Equipment Repair: --Not in list--,Parks & Recreation Department,Park Maintenance & Safety,Equipment Repair,PARK_Maintenance_Trades,PARK,,,,,,,,,,,,,,,,,42.3594,-71.0587,Self Service,"(0, 0)"
608291,101001518889,08/12/2015 02:16:00 AM,08/19/2015 08:30:00 AM,08/18/2015 06:02:37 AM,ONTIME,Closed,Case Closed. Closed date : 2015-08-18 06:02:37.08 Case Resolved wash down walk way,Equipment Repair,Parks & Recreation Department,Park Maintenance & Safety,Equipment Repair,PARK_Maintenance_Trades,PARK,https://mayors24.cityofboston.gov/media/boston/report/photos/55cae4a96963fe2d4ed2935c/photo_20150812_021437.jpg,,115 Paris St  East Boston  MA  02128,1.0,09,1.0,A7,East Boston,1.0,1,104.0,,115 Paris St,2128.0,Address,340867.0,42.3721,-71.037,Citizens Connect App,"(42.3721, -71.037)"
608310,101001518913,08/12/2015 06:50:00 AM,08/19/2015 08:30:00 AM,08/14/2015 05:40:37 AM,ONTIME,Closed,Case Closed. Closed date : 2015-08-14 05:40:37.297 Case Resolved move fence to deer pk,Equipment Repair,Parks & Recreation Department,Park Maintenance & Safety,Equipment Repair,PARK_Maintenance_Trades,PARK,,,INTERSECTION of Beacon St & Charles St  Boston  MA,3.0,1B,8.0,A1,Beacon Hill,14.0,Ward 5,503.0,,INTERSECTION Beacon St & Charles St,,Intersection,1106.0,42.3562,-71.0694,Constituent Call,"(42.3562, -71.0694)"
608321,101001518928,08/12/2015 07:20:00 AM,08/19/2015 08:30:00 AM,,OVERDUE,Open,,Equipment Repair,Parks & Recreation Department,Park Maintenance & Safety,Equipment Repair,INFO01_GenericeFormforOtherServiceRequestTypes,INFO,,,INTERSECTION of Brainard St & Reservation Rd  Hyde Park  MA,12.0,08,5.0,E18,Hyde Park,10.0,Ward 18,1819.0,,INTERSECTION Brainard St & Reservation Rd,,Intersection,1855.0,42.2543,-71.134,Citizens Connect App,"(42.2543, -71.134)"
608361,101001518979,08/12/2015 08:13:00 AM,08/19/2015 08:30:00 AM,09/11/2015 11:41:23 AM,OVERDUE,Closed,Case Closed. Closed date : 2015-09-11 11:41:23.143 Case Resolved done,Equipment Repair,Parks & Recreation Department,Park Maintenance & Safety,Equipment Repair,PARK_Maintenance_Trades,PARK,https://mayors24.cityofboston.gov/media/boston/report/photos/55cb38826963fe2d4ed29717/report.jpg,,544P Massachusetts Ave  Roxbury  MA  02118,7.0,1C,7.0,D4,Roxbury,13.0,9,903.0,,544P Massachusetts Ave,2118.0,Address,342023.0,42.3594,-71.0587,Citizens Connect App,"(0, 0)"
608406,101001519032,08/12/2015 08:45:48 AM,08/19/2015 08:45:48 AM,08/17/2015 05:53:30 AM,ONTIME,Closed,Case Closed. Closed date : 2015-08-17 05:53:30.543 Case Resolved install new cables,Equipment Repair: Ryan Play Area,Parks & Recreation Department,Park Maintenance & Safety,Equipment Repair,PARK_Maintenance_Trades,PARK,https://cityworker.cityofboston.gov:8443/attachments/report/55cb4008d05214099916453a/photo/Report.jpg,,960 Dorchester Ave  Dorchester  MA  02125,7.0,03,3.0,C11,Dorchester,7.0,13,1307.0,,960 Dorchester Ave,2125.0,Address,342630.0,42.3594,-71.0587,City Worker App,"(0, 0)"
608434,101001519063,08/12/2015 09:13:00 AM,08/19/2015 09:13:03 AM,09/02/2015 10:10:36 AM,OVERDUE,Closed,Case Closed. Closed date : 2015-09-02 10:10:36.917 Case Resolved done,Equipment Repair,Parks & Recreation Department,Park Maintenance & Safety,Equipment Repair,PARK_Maintenance_Trades,PARK,,,75 W Rutland Sq  Roxbury  MA  02118,4.0,1C,7.0,D4,Roxbury,6.0,4,404.0,,75 W Rutland Sq,2118.0,Address,342665.0,42.3594,-71.0587,Constituent Call,"(0, 0)"
608461,101001519103,08/12/2015 09:36:00 AM,08/19/2015 09:36:45 AM,08/26/2015 11:41:34 AM,OVERDUE,Closed,Case Closed. Closed date : 2015-08-26 11:41:34.78 Case Resolved done 8-14-15,Equipment Repair,Parks & Recreation Department,Park Maintenance & Safety,Equipment Repair,PARK_Maintenance_Trades,PARK,,,560 Boylston St  Boston  MA  02116,4.0,1C,2.0,D4,Boston,6.0,04,402.0,,560 Boylston St,2116.0,Address,342031.0,42.3594,-71.0587,Employee Generated,"(0, 0)"
608486,101001519129,08/12/2015 09:51:00 AM,08/19/2015 09:51:38 AM,08/17/2015 05:54:30 AM,ONTIME,Closed,Case Closed. Closed date : 2015-08-17 05:54:30.987 Case Resolved parts order,Equipment Repair,Parks & Recreation Department,Park Maintenance & Safety,Equipment Repair,PARK_Maintenance_Trades,PARK,,,75 W Rutland Sq  Roxbury  MA  02118,4.0,1C,7.0,D4,Roxbury,6.0,4,404.0,,75 W Rutland Sq,2118.0,Address,342665.0,42.3594,-71.0587,Constituent Call,"(0, 0)"
608489,101001519133,08/12/2015 09:53:00 AM,08/19/2015 09:53:17 AM,08/26/2015 11:44:19 AM,OVERDUE,Closed,Case Closed. Closed date : 2015-08-26 11:44:19.85 Case Resolved done 8-17-15,Equipment Repair,Parks & Recreation Department,Park Maintenance & Safety,Equipment Repair,PARK_Maintenance_Trades,PARK,,,139 Tremont St  Boston  MA  02108,3.0,1C,8.0,A1,Beacon Hill,14.0,05,503.0,E,139 Tremont St,2108.0,Address,341542.0,42.3554,-71.0638,Employee Generated,"(42.3554, -71.0638)"
608615,101001519282,08/12/2015 11:20:00 AM,08/19/2015 11:20:55 AM,09/25/2015 09:45:27 AM,OVERDUE,Closed,Case Closed. Closed date : 2015-09-25 09:45:27.597 Case Resolved Graffiti was removed.,Equipment Repair,Parks & Recreation Department,Park Maintenance & Safety,Equipment Repair,PARK_Maintenance_Trades,PARK,https://mayors24.cityofboston.gov/media/boston/report/photos/55cb645e6963fe2d4ed29d0e/report.jpg,,85 Hobart St  Brighton  MA  02135,11.0,04,9.0,D14,Brighton,15.0,22,2211.0,,85 Hobart St,2135.0,Address,342478.0,42.3594,-71.0587,Citizens Connect App,"(0, 0)"
608659,101001519344,08/12/2015 11:48:00 AM,08/19/2015 11:48:29 AM,,OVERDUE,Open,,Equipment Repair,Parks & Recreation Department,Park Maintenance & Safety,Equipment Repair,PARK_Maintenance_Trades,PARK,,,76 Goodenough St  Brighton  MA  02135,11.0,04,9.0,D14,Allston / Brighton,15.0,Ward 22,2212.0,R2,76 Goodenough St,2135.0,Address,65252.0,42.3548,-71.1542,Constituent Call,"(42.3548, -71.1542)"
608665,101001519350,08/12/2015 11:54:00 AM,08/19/2015 11:54:17 AM,,OVERDUE,Open,,Equipment Repair,Parks & Recreation Department,Park Maintenance & Safety,Equipment Repair,INFO01_GenericeFormforOtherServiceRequestTypes,INFO,,,INTERSECTION of Call St & Williams St  Jamaica Plain  MA,9.0,02,6.0,E13,Jamaica Plain,11.0,Ward 11,1109.0,,INTERSECTION Call St & Williams St,,Intersection,2305.0,42.3078,-71.1099,Constituent Call,"(42.3078, -71.1099)"
608746,101001519452,08/12/2015 01:09:00 PM,08/19/2015 01:09:52 PM,09/22/2015 03:48:18 PM,OVERDUE,Closed,Case Closed. Closed date : 2015-09-22 15:48:18.9 Case Resolved trades reports no broken equipment 9-22-15,Equipment Repair,Parks & Recreation Department,Park Maintenance & Safety,Equipment Repair,PARK_Maintenance_Trades,PARK,,,21 Phillips St  Boston  MA  02114,3.0,1B,8.0,A1,Boston,14.0,5,504.0,,21 Phillips St,2114.0,Address,342572.0,42.3594,-71.0587,Citizens Connect App,"(0, 0)"
608780,101001519492,08/12/2015 01:42:00 PM,08/19/2015 01:42:39 PM,09/25/2015 09:46:26 AM,OVERDUE,Closed,Case Closed. Closed date : 2015-09-25 09:46:26.403 Case Noted No play equipment at this location.,Equipment Repair,Parks & Recreation Department,Park Maintenance & Safety,Equipment Repair,PARK_Maintenance_Trades,PARK,,,421-425 Dudley St  Roxbury  MA  02119,7.0,03,7.0,B2,Roxbury,13.0,8,805.0,,421-425 Dudley St,2119.0,Address,342089.0,42.3594,-71.0587,Citizens Connect App,"(0, 0)"
608781,101001519490,08/12/2015 01:42:00 PM,08/19/2015 01:42:16 PM,,OVERDUE,Open,,Equipment Repair,Parks & Recreation Department,Park Maintenance & Safety,Equipment Repair,PARK_Maintenance_Trades,PARK,,,160 Westminster St  Hyde Park  MA  02136,12.0,08,5.0,E18,Hyde Park,10.0,Ward 18,1808.0,R1,160 Westminster St,2136.0,Address,148566.0,42.2655,-71.1132,Constituent Call,"(42.2655, -71.1132)"
608858,101001519584,08/12/2015 02:57:00 PM,08/19/2015 02:57:23 PM,08/14/2015 02:47:11 PM,ONTIME,Closed,Case Closed. Closed date : 2015-08-14 14:47:11.617 Case Resolved,Equipment Repair,Parks & Recreation Department,Park Maintenance & Safety,Equipment Repair,PARK_Maintenance_Trades,PARK,,,139 Tremont St  Boston  MA  02108,3.0,1C,8.0,A1,Beacon Hill,14.0,05,503.0,E,139 Tremont St,2108.0,Address,341542.0,42.3554,-71.0638,Employee Generated,"(42.3554, -71.0638)"
608898,101001519641,08/12/2015 03:47:00 PM,08/19/2015 03:47:40 PM,08/14/2015 05:38:02 AM,ONTIME,Closed,Case Closed. Closed date : 2015-08-14 05:38:02.723 Case Resolved paint box,Equipment Repair,Parks & Recreation Department,Park Maintenance & Safety,Equipment Repair,PARK_Maintenance_Trades,PARK,https://mayors24.cityofboston.gov/media/boston/report/photos/55cba2e36963fe2d4ed2a406/report.jpg,,139 Tremont St  Boston  MA  02108,3.0,1C,8.0,A1,Beacon Hill,14.0,05,503.0,E,139 Tremont St,2108.0,Address,341542.0,42.3554,-71.0638,Citizens Connect App,"(42.3554, -71.0638)"
608899,101001519643,08/12/2015 03:49:00 PM,08/19/2015 03:49:27 PM,,OVERDUE,Open,,Equipment Repair: --Not in list--,Parks & Recreation Department,Park Maintenance & Safety,Equipment Repair,PARK_Park Improvement Requests,PARK,,,,,,,,,,,,,,,,,42.3594,-71.0587,Self Service,"(0, 0)"
608907,101001519653,08/12/2015 04:05:18 PM,08/19/2015 04:05:18 PM,08/18/2015 06:09:14 AM,ONTIME,Closed,Case Closed. Closed date : 2015-08-18 06:09:14.277 Case Resolved remove graffiti,Equipment Repair,Parks & Recreation Department,Park Maintenance & Safety,Equipment Repair,PARK_Maintenance_Trades,PARK,https://mayors24.cityofboston.gov/media/boston/report/photos/55cba7086963fe2d4ed2a44d/report.jpg,,125 Boylston St  Boston  MA  02108,3.0,1C,8.0,A1,Boston,14.0,5,503.0,,125 Boylston St,2108.0,Address,342020.0,42.3594,-71.0587,Citizens Connect App,"(0, 0)"
608941,101001519701,08/12/2015 04:45:00 PM,08/19/2015 04:45:31 PM,10/09/2015 01:49:15 PM,OVERDUE,Closed,Case Closed. Closed date : 2015-10-09 13:49:15.503 Case Resolved remove graffiti,Equipment Repair,Parks & Recreation Department,Park Maintenance & Safety,Equipment Repair,PARK_Maintenance_Trades,PARK,https://mayors24.cityofboston.gov/media/boston/report/photos/55cbb0766963fe2d4ed2a525/report.jpg,,4 Charles St  Boston  MA  02108,3.0,1C,8.0,A1,Boston,14.0,5,503.0,,4 Charles St,2108.0,Address,342578.0,42.3594,-71.0587,Citizens Connect App,"(0, 0)"
609000,101001519768,08/12/2015 05:59:03 PM,08/20/2015 08:30:00 AM,08/18/2015 06:11:34 AM,ONTIME,Closed,Case Closed. Closed date : 2015-08-18 06:11:34.937 Case Resolved remove spring toy parts ordered,Equipment Repair,Parks & Recreation Department,Park Maintenance & Safety,Equipment Repair,PARK_Maintenance_Trades,PARK,https://mayors24.cityofboston.gov/media/boston/report/photos/55cbc1b06963fe2d4ed2a6fb/report.jpg,,75 W Rutland Sq  Roxbury  MA  02118,4.0,1C,7.0,D4,Roxbury,6.0,4,404.0,,75 W Rutland Sq,2118.0,Address,342665.0,42.3594,-71.0587,Citizens Connect App,"(0, 0)"
609035,101001519813,08/12/2015 06:55:00 PM,08/20/2015 08:30:00 AM,,OVERDUE,Open,,Equipment Repair,Parks & Recreation Department,Park Maintenance & Safety,Equipment Repair,PARK_Park Improvement Requests,PARK,https://mayors24.cityofboston.gov/media/boston/report/photos/55cbcef66963fe2d4ed2a830/photo_20150812_185512.jpg,,95 Tremont St  Boston  MA  02108,3.0,1B,1.0,A1,Boston,3.0,3,306.0,,95 Tremont St,2108.0,Address,342459.0,42.3594,-71.0587,Citizens Connect App,"(0, 0)"
609060,101001519845,08/12/2015 07:28:45 PM,08/20/2015 08:30:00 AM,08/18/2015 06:14:33 AM,ONTIME,Closed,Case Closed. Closed date : 2015-08-18 06:14:33.53 Case Resolved remove toy new parts ordered,Equipment Repair,Parks & Recreation Department,Park Maintenance & Safety,Equipment Repair,PARK_Maintenance_Trades,PARK,https://mayors24.cityofboston.gov/media/boston/report/photos/55cbd6b66963fe2d4ed2a919/report.jpg,,75 W Rutland Sq  Roxbury  MA  02118,4.0,1C,7.0,D4,Roxbury,6.0,4,404.0,,75 W Rutland Sq,2118.0,Address,342665.0,42.3594,-71.0587,Citizens Connect App,"(0, 0)"
609106,101001519901,08/12/2015 09:25:26 PM,08/20/2015 08:30:00 AM,08/14/2015 05:35:51 AM,ONTIME,Closed,Case Closed. Closed date : 2015-08-14 05:35:51.667 Case Resolved remove dirt under rubber,Equipment Repair,Parks & Recreation Department,Park Maintenance & Safety,Equipment Repair,PARK_Maintenance_Trades,PARK,https://mayors24.cityofboston.gov/media/boston/report/photos/55cbf20f6963fe2d4ed2ab44/report.jpg,,560 Boylston St  Boston  MA  02116,4.0,1C,2.0,D4,Boston,6.0,04,402.0,,560 Boylston St,2116.0,Address,342031.0,42.3594,-71.0587,Citizens Connect App,"(0, 0)"
609299,101001520156,08/13/2015 09:19:00 AM,08/20/2015 09:19:36 AM,09/11/2015 02:08:29 PM,OVERDUE,Closed,Case Closed. Closed date : 2015-09-11 14:08:29.317 Case Resolved,Equipment Repair,Parks & Recreation Department,Park Maintenance & Safety,Equipment Repair,PARK_Maintenance_Trades,PARK,,,4 Charles St  Boston  MA  02108,3.0,1C,8.0,A1,Boston,14.0,5,503.0,,4 Charles St,2108.0,Address,342578.0,42.3594,-71.0587,Citizens Connect App,"(0, 0)"
609432,101001520307,08/13/2015 11:21:56 AM,08/20/2015 11:21:56 AM,08/18/2015 06:15:38 AM,ONTIME,Closed,Case Closed. Closed date : 2015-08-18 06:15:38.15 Case Resolved paint over graffiti,Equipment Repair,Parks & Recreation Department,Park Maintenance & Safety,Equipment Repair,PARK_Maintenance_Trades,PARK,https://mayors24.cityofboston.gov/media/boston/report/photos/55ccb6216963fe2d4ed2b3b7/report.jpg,,144 Marginal St  East Boston  MA  02128,1.0,09,1.0,A7,East Boston,1.0,01,101.0,,144 Marginal St,2128.0,Address,344150.0,42.3594,-71.0587,Citizens Connect App,"(0, 0)"
609438,101001520316,08/13/2015 11:26:38 AM,08/20/2015 11:28:56 AM,08/14/2015 02:20:23 PM,ONTIME,Closed,Case Closed Duplicate of Existing Case  Duplicate of case # 1520324,Equipment Repair,Parks & Recreation Department,Park Maintenance & Safety,Equipment Repair,PARK_Maintenance_Trades,PARK,,,544P Massachusetts Ave  Roxbury  MA  02118,7.0,1C,7.0,D4,Roxbury,13.0,9,903.0,,544P Massachusetts Ave,2118.0,Address,342023.0,42.3594,-71.0587,Employee Generated,"(0, 0)"
609442,101001520324,08/13/2015 11:32:00 AM,08/20/2015 11:32:20 AM,08/18/2015 06:16:44 AM,ONTIME,Closed,Case Closed. Closed date : 2015-08-18 06:16:44.04 Case Resolved repair all benchs,Equipment Repair,Parks & Recreation Department,Park Maintenance & Safety,Equipment Repair,PARK_Maintenance_Trades,PARK,,,544P Massachusetts Ave  Roxbury  MA  02118,7.0,1C,7.0,D4,Roxbury,13.0,9,903.0,,544P Massachusetts Ave,2118.0,Address,342023.0,42.3594,-71.0587,Employee Generated,"(0, 0)"
609467,101001520352,08/13/2015 11:57:00 AM,08/20/2015 11:58:00 AM,08/26/2015 11:46:48 AM,OVERDUE,Closed,Case Closed. Closed date : 2015-08-26 11:46:48.857 Case Resolved,Equipment Repair,Parks & Recreation Department,Park Maintenance & Safety,Equipment Repair,PARK_Maintenance_Trades,PARK,,,1 Jewish War Veterans Dr  Jamaica Plain  MA  02130,9.0,02,7.0,B2,Greater Mattapan,13.0,12,1207.0,E,1 Jewish War Veterans Dr,2130.0,Address,163434.0,42.301,-71.0886,Employee Generated,"(42.301, -71.0886)"
609483,101001520367,08/13/2015 12:10:00 PM,08/20/2015 12:11:04 PM,,OVERDUE,Open,,Equipment Repair,Parks & Recreation Department,Park Maintenance & Safety,Equipment Repair,PARK_Maintenance_Trades,PARK,,,75 Alford St  Charlestown  MA  02129,3.0,1A,1.0,A15,Charlestown,2.0,02,,,75 Alford St,2129.0,Address,342631.0,42.3594,-71.0587,Employee Generated,"(0, 0)"
609488,101001520373,08/13/2015 12:15:00 PM,08/20/2015 12:15:35 PM,08/31/2015 02:40:23 PM,OVERDUE,Closed,Case Closed. Closed date : 2015-08-31 14:40:23.8 Case Resolved done,Equipment Repair,Parks & Recreation Department,Park Maintenance & Safety,Equipment Repair,PARK_Maintenance_Trades,PARK,,,139 Tremont St  Boston  MA  02108,3.0,1C,8.0,A1,Beacon Hill,14.0,05,503.0,E,139 Tremont St,2108.0,Address,341542.0,42.3554,-71.0638,Employee Generated,"(42.3554, -71.0638)"
609632,101001520543,08/13/2015 02:21:00 PM,08/20/2015 02:22:00 PM,08/18/2015 06:20:31 AM,ONTIME,Closed,Case Closed. Closed date : 2015-08-18 06:20:31.437 Case Resolved install bench,Equipment Repair,Parks & Recreation Department,Park Maintenance & Safety,Equipment Repair,PARK_Maintenance_Trades,PARK,,,,,,,,,,,,,,,,,42.3594,-71.0587,Employee Generated,"(0, 0)"
609639,101001520553,08/13/2015 02:43:00 PM,08/20/2015 02:43:35 PM,01/11/2016 12:23:25 PM,OVERDUE,Closed,Case Closed. Closed date : 2016-01-11 12:23:25.277 Case Resolved,Equipment Repair,Parks & Recreation Department,Park Maintenance & Safety,Equipment Repair,PARK_Park Improvement Requests,PARK,,,239 Parker Hill Ave  Mission Hill  MA  02120,9.0,10A,8.0,B2,Mission Hill,14.0,10,1005.0,,239 Parker Hill Ave,2120.0,Address,342517.0,42.3594,-71.0587,Employee Generated,"(0, 0)"
609885,101001520866,08/13/2015 08:24:00 PM,08/21/2015 08:30:00 AM,08/18/2015 06:21:28 AM,ONTIME,Closed,Case Closed. Closed date : 2015-08-18 06:21:28.733 Case Resolved,Equipment Repair,Parks & Recreation Department,Park Maintenance & Safety,Equipment Repair,PARK_Maintenance_Trades,PARK,,,365 Hyde Park Ave  Roslindale  MA  02131,12.0,02,6.0,E18,Roslindale,10.0,19,1912.0,E,365 Hyde Park Ave,2131.0,Address,77313.0,42.289,-71.1188,Citizens Connect App,"(42.289, -71.1188)"
610190,101001521267,08/14/2015 11:21:00 AM,08/21/2015 11:21:56 AM,08/27/2015 11:04:47 AM,OVERDUE,Closed,Case Closed. Closed date : 2015-08-27 11:04:47.213 Case Resolved done 8-26-15,Equipment Repair,Parks & Recreation Department,Park Maintenance & Safety,Equipment Repair,PARK_Maintenance_Trades,PARK,,,86 Boardman St  East Boston  MA  02128,1.0,09,1.0,A7,East Boston,1.0,01,111.0,E,86 Boardman St,2128.0,Address,158227.0,42.3889,-71.0108,Employee Generated,"(42.3889, -71.0108)"
610494,101001521626,08/14/2015 02:59:00 PM,08/21/2015 02:59:24 PM,08/26/2015 11:32:34 AM,OVERDUE,Closed,Case Closed. Closed date : 2015-08-26 11:32:34.82 Case Resolved done 8-18-15,Equipment Repair,Parks & Recreation Department,Park Maintenance & Safety,Equipment Repair,PARK_Maintenance_Trades,PARK,,,INTERSECTION of Evans Way & Louis Prang St  Boston  MA,4.0,10A,8.0,B2,Fenway / Kenmore / Audubon Circle / Longwood,14.0,Ward 4,410.0,,INTERSECTION Evans Way & Louis Prang St,,Intersection,4684.0,42.3385,-71.0973,Constituent Call,"(42.3385, -71.0973)"
610551,101001521699,08/14/2015 04:16:00 PM,08/21/2015 04:16:18 PM,08/18/2015 06:23:09 AM,ONTIME,Closed,Case Closed. Closed date : 2015-08-18 06:23:09.207 Case Resolved spray working,Equipment Repair,Parks & Recreation Department,Park Maintenance & Safety,Equipment Repair,PARK_Maintenance_Trades,PARK,,,92 Mount Ida Rd  Dorchester  MA  02122,7.0,03,3.0,C11,Dorchester,8.0,15,1509.0,,92 Mount Ida Rd,2122.0,Address,342620.0,42.3594,-71.0587,Constituent Call,"(0, 0)"
610797,101001522026,08/15/2015 02:02:50 PM,08/24/2015 08:30:00 AM,08/19/2015 10:24:33 AM,ONTIME,Closed,Case Closed. Closed date : 2015-08-19 10:24:33.823 Case Resolved There is no bathroom facility at Putman Square.,Equipment Repair,Parks & Recreation Department,Park Maintenance & Safety,Equipment Repair,PARK_Maintenance_Trades,PARK,https://mayors24.cityofboston.gov/media/boston/report/photos/55cf7ec304858b6818a10449/report.jpg,,70 Putnam St  East Boston  MA  02128,1.0,09,1.0,A7,East Boston,1.0,01,109.0,,70 Putnam St,2128.0,Address,342580.0,42.3594,-71.0587,Citizens Connect App,"(0, 0)"
610958,101001522236,08/16/2015 09:26:00 AM,08/24/2015 08:30:00 AM,09/22/2015 03:42:23 PM,OVERDUE,Closed,Case Closed. Closed date : 2015-09-22 15:42:23.977 Case Noted school property not parks dept issue,Equipment Repair,Parks & Recreation Department,Park Maintenance & Safety,Equipment Repair,PARK_Maintenance_Trades,PARK,https://mayors24.cityofboston.gov/media/boston/report/photos/55d08f9304858b6818a10b7a/report.jpg,,45 Bunker Hill St  Charlestown  MA  02129,3.0,1A,1.0,A15,Charlestown,2.0,02,202.0,,45 Bunker Hill St,2129.0,Address,342474.0,42.3594,-71.0587,Citizens Connect App,"(0, 0)"
610976,101001522258,08/16/2015 10:15:00 AM,08/24/2015 08:30:00 AM,09/15/2015 10:39:22 AM,OVERDUE,Closed,Case Closed. Closed date : 2015-09-15 10:39:22.56 Case Resolved done 9-9-15,Equipment Repair,Parks & Recreation Department,Park Maintenance & Safety,Equipment Repair,PARK_Maintenance_Trades,PARK,,,775 E First St  South Boston  MA  02127,6.0,05,2.0,C6,South Boston / South Boston Waterfront,5.0,06,607.0,,775 E First St,2127.0,Address,342025.0,42.3594,-71.0587,Citizens Connect App,"(0, 0)"
610985,101001522270,08/16/2015 11:02:00 AM,08/24/2015 08:30:00 AM,,OVERDUE,Open,,Equipment Repair,Parks & Recreation Department,Park Maintenance & Safety,Equipment Repair,INFO01_GenericeFormforOtherServiceRequestTypes,INFO,https://mayors24.cityofboston.gov/media/boston/report/photos/55d0a5e904858b6818a10cd1/photo_20150816_110110.jpg,,144 Marginal St  East Boston  MA  02128,1.0,09,1.0,A7,East Boston,1.0,01,101.0,,144 Marginal St,2128.0,Address,344150.0,42.3594,-71.0587,Citizens Connect App,"(0, 0)"
611182,101001522548,08/17/2015 08:05:00 AM,08/24/2015 08:30:00 AM,10/09/2015 10:56:30 AM,OVERDUE,Closed,Case Closed. Closed date : 2015-10-09 10:56:30.11 Case Resolved done 9-22-15,Equipment Repair,Parks & Recreation Department,Park Maintenance & Safety,Equipment Repair,PARK_Maintenance_Trades,PARK,,,60 Forbes St  Jamaica Plain  MA  02130,9.0,02,6.0,E13,Jamaica Plain,11.0,10,1009.0,,60 Forbes St,2130.0,Address,342420.0,42.3594,-71.0587,Citizens Connect App,"(0, 0)"
611333,101001522757,08/17/2015 10:00:00 AM,08/24/2015 10:00:59 AM,08/26/2015 01:51:13 PM,OVERDUE,Closed,Case Closed. Closed date : 2015-08-26 13:51:13.107 Case Resolved done,Equipment Repair,Parks & Recreation Department,Park Maintenance & Safety,Equipment Repair,PARK_Maintenance_Trades,PARK,,,139 Tremont St  Boston  MA  02108,3.0,1C,8.0,A1,Beacon Hill,14.0,05,503.0,E,139 Tremont St,2108.0,Address,341542.0,42.3554,-71.0638,Employee Generated,"(42.3554, -71.0638)"
611364,101001522799,08/17/2015 10:32:00 AM,08/24/2015 10:32:48 AM,12/10/2015 05:03:39 PM,OVERDUE,Closed,Case Closed. Closed date : 2015-12-10 17:03:39.73 Case Resolved,Equipment Repair,Parks & Recreation Department,Park Maintenance & Safety,Equipment Repair,PARK_Park Improvement Requests,PARK,,,110 Atlantic Ave  Boston  MA  02110,3.0,1B,1.0,A1,Boston,3.0,3,301.0,,110 Atlantic Ave,2110.0,Address,161702.0,42.361,-71.0522,Constituent Call,"(42.361, -71.0522)"
611366,101001522803,08/17/2015 10:35:00 AM,08/24/2015 10:36:02 AM,08/26/2015 11:31:29 AM,OVERDUE,Closed,Case Closed. Closed date : 2015-08-26 11:31:29.85 Case Resolved done 8-18-15,Equipment Repair,Parks & Recreation Department,Park Maintenance & Safety,Equipment Repair,PARK_Maintenance_Trades,PARK,,,139 Tremont St  Boston  MA  02108,3.0,1C,8.0,A1,Beacon Hill,14.0,05,503.0,E,139 Tremont St,2108.0,Address,341542.0,42.3554,-71.0638,Employee Generated,"(42.3554, -71.0638)"
611682,101001523182,08/17/2015 01:43:00 PM,08/24/2015 01:43:37 PM,08/26/2015 01:44:28 PM,OVERDUE,Closed,Case Closed. Closed date : 2015-08-26 13:44:28.773 Case Resolved done 8-19-15,Equipment Repair,Parks & Recreation Department,Park Maintenance & Safety,Equipment Repair,PARK_Maintenance_Trades,PARK,,,,,,,,,,,,,,,,,42.3594,-71.0587,Employee Generated,"(0, 0)"
611869,101001523451,08/17/2015 04:57:00 PM,08/24/2015 04:57:37 PM,09/22/2015 03:43:19 PM,OVERDUE,Closed,Case Closed. Closed date : 2015-09-22 15:43:19.187 Case Noted play equipment not broken 9-22-15,Equipment Repair,Parks & Recreation Department,Park Maintenance & Safety,Equipment Repair,PARK_Maintenance_Trades,PARK,https://mayors24.cityofboston.gov/media/boston/report/photos/55d24ac104858b6818a12141/report.jpg,,960 Dorchester Ave  Dorchester  MA  02125,7.0,03,3.0,C11,Dorchester,7.0,13,1307.0,,960 Dorchester Ave,2125.0,Address,342630.0,42.3594,-71.0587,Citizens Connect App,"(0, 0)"
611870,101001523452,08/17/2015 04:58:00 PM,08/24/2015 04:58:18 PM,10/22/2015 10:49:36 AM,OVERDUE,Closed,Case Closed. Closed date : 2015-10-22 10:49:36.9 Case Noted company that supplies the parts has gone out of business  rapairs and parts will come at a later time,Equipment Repair,Parks & Recreation Department,Park Maintenance & Safety,Equipment Repair,PARK_Maintenance_Trades,PARK,,,775 E First St  South Boston  MA  02127,6.0,05,2.0,C6,South Boston / South Boston Waterfront,5.0,06,607.0,,775 E First St,2127.0,Address,342025.0,42.3594,-71.0587,Constituent Call,"(0, 0)"
611924,101001523522,08/17/2015 06:46:00 PM,08/25/2015 08:30:00 AM,,OVERDUE,Open,,Equipment Repair,Parks & Recreation Department,Park Maintenance & Safety,Equipment Repair,PARK_Park Improvement Requests,PARK,https://mayors24.cityofboston.gov/media/boston/report/photos/55d2643d04858b6818a1237c/report.jpg,,20P Child St  Jamaica Plain  MA  02130,9.0,02,6.0,E13,Jamaica Plain,11.0,11,1109.0,,20P Child St,2130.0,Address,342539.0,42.3594,-71.0587,Citizens Connect App,"(0, 0)"
611941,101001523541,08/17/2015 07:14:00 PM,08/25/2015 08:30:00 AM,,OVERDUE,Open,,Equipment Repair,Parks & Recreation Department,Park Maintenance & Safety,Equipment Repair,PARK_Park Improvement Requests,PARK,https://mayors24.cityofboston.gov/media/boston/report/photos/55d26afd04858b6818a1240a/report.jpg,,45 Lambert Ave  Roxbury  MA  02119,7.0,10B,7.0,B2,Roxbury,13.0,9,905.0,,45 Lambert Ave,2119.0,Address,342504.0,42.3594,-71.0587,Citizens Connect App,"(0, 0)"
611951,101001523552,08/17/2015 07:34:00 PM,08/25/2015 08:30:00 AM,09/15/2015 11:16:56 AM,OVERDUE,Closed,Case Closed. Closed date : 2015-09-15 11:16:56.413 Case Resolved,Equipment Repair,Parks & Recreation Department,Park Maintenance & Safety,Equipment Repair,PARK_Maintenance_Trades,PARK,https://mayors24.cityofboston.gov/media/boston/report/photos/55d26f7f04858b6818a12467/photo_20150817_193402.jpg,,1825 Commonwealth Ave  Brighton  MA  02135,11.0,04,9.0,D14,Brighton,15.0,21,2115.0,,1825 Commonwealth Ave,2135.0,Address,342635.0,42.3594,-71.0587,Citizens Connect App,"(0, 0)"
611954,101001523556,08/17/2015 07:39:00 PM,08/25/2015 08:30:00 AM,12/02/2015 11:25:48 AM,OVERDUE,Closed,Case Closed. Closed date : 2015-12-02 11:25:48.187 Case Resolved turf repairs made for large field and sport court is entirely new,Equipment Repair,Parks & Recreation Department,Park Maintenance & Safety,Equipment Repair,PARK_Park Improvement Requests,PARK,https://mayors24.cityofboston.gov/media/boston/report/photos/55d270ce04858b6818a12484/photo_20150817_194001.jpg,,365 Hyde Park Ave  Roslindale  MA  02131,12.0,02,6.0,E18,Roslindale,10.0,19,1912.0,E,365 Hyde Park Ave,2131.0,Address,77313.0,42.289,-71.1188,Citizens Connect App,"(42.289, -71.1188)"
612095,101001523745,08/18/2015 08:23:00 AM,08/25/2015 08:30:00 AM,10/16/2015 06:22:54 AM,OVERDUE,Closed,Case Closed. Closed date : 2015-10-16 06:22:54.527 Case Resolved off for season,Equipment Repair,Parks & Recreation Department,Park Maintenance & Safety,Equipment Repair,PARK_Maintenance_Trades,PARK,,,92 Mount Ida Rd  Dorchester  MA  02122,7.0,03,3.0,C11,Dorchester,8.0,15,1509.0,,92 Mount Ida Rd,2122.0,Address,342620.0,42.3594,-71.0587,Constituent Call,"(0, 0)"
612480,101001524233,08/18/2015 12:55:00 PM,08/25/2015 12:55:54 PM,08/31/2015 07:38:19 AM,OVERDUE,Closed,Case Closed. Closed date : 2015-08-31 07:38:19.073 Case Resolved no we dont this area does not belong to parks dept,Equipment Repair,Parks & Recreation Department,Park Maintenance & Safety,Equipment Repair,PARK_Maintenance_Region 1,PARK,,,25 Phipps St  Charlestown  MA  02129,3.0,1A,1.0,A15,Charlestown,2.0,02,206.0,E,25 Phipps St,2129.0,Address,110161.0,42.3594,-71.0587,Citizens Connect App,"(0, 0)"
612632,101001524407,08/18/2015 02:23:00 PM,08/25/2015 02:23:34 PM,08/27/2015 10:59:19 AM,OVERDUE,Closed,Case Closed. Closed date : 2015-08-27 10:59:19.837 Case Resolved done 8-19-15,Equipment Repair,Parks & Recreation Department,Park Maintenance & Safety,Equipment Repair,PARK_Maintenance_Trades,PARK,,,300 Park Dr  Boston  MA  02215,4.0,10A,8.0,D4,Fenway / Kenmore / Audubon Circle / Longwood,14.0,04,410.0,E,300 Park Dr,2215.0,Address,342002.0,42.3594,-71.0587,Employee Generated,"(0, 0)"
612652,101001524436,08/18/2015 02:42:00 PM,08/25/2015 02:42:13 PM,09/09/2015 10:49:57 AM,OVERDUE,Closed,Case Closed. Closed date : 2015-09-09 10:49:57.897 Duplicate of Existing Case Same as #1523745.,Equipment Repair,Parks & Recreation Department,Park Maintenance & Safety,Equipment Repair,PARK_Maintenance_Trades,PARK,,,92 Mount Ida Rd  Dorchester  MA  02122,7.0,03,3.0,C11,Dorchester,8.0,15,1509.0,,92 Mount Ida Rd,2122.0,Address,342620.0,42.3594,-71.0587,Constituent Call,"(0, 0)"
613041,101001524919,08/19/2015 09:20:00 AM,08/26/2015 09:20:49 AM,09/25/2015 09:50:15 AM,OVERDUE,Closed,Case Closed. Closed date : 2015-09-25 09:50:15.91 Case Resolved Area was powerwashed.,Equipment Repair,Parks & Recreation Department,Park Maintenance & Safety,Equipment Repair,PARK_Maintenance_Trades,PARK,,,,,,,,,,,,,,,,,42.3594,-71.0587,Constituent Call,"(0, 0)"
613073,101001524968,08/19/2015 09:46:00 AM,08/26/2015 09:46:52 AM,08/31/2015 12:33:05 PM,OVERDUE,Closed,Case Closed. Closed date : 2015-08-31 12:33:05.547 Case Resolved Completed all overflowing trash barrels were removed from ringgold park.,Ground Maintenance: Ringgold Park  Mount Pleasant Play Area,Parks & Recreation Department,Park Maintenance & Safety,Equipment Repair,PARK_Maintenance_Region 5,PARK,,,30 Mount Pleasant Ave  Roxbury  MA  02119,7.0,10B,7.0,B2,Roxbury,13.0,8,803.0,E,30 Mount Pleasant Ave,2119.0,Address,98401.0,42.327,-71.0792,Employee Generated,"(42.327, -71.0792)"
613316,101001525299,08/19/2015 01:01:00 PM,08/26/2015 01:01:24 PM,10/15/2015 10:42:04 AM,OVERDUE,Closed,Case Closed. Closed date : 2015-10-15 10:42:04.06 Case Resolved done 9-8-15,Equipment Repair,Parks & Recreation Department,Park Maintenance & Safety,Equipment Repair,PARK_Maintenance_Trades,PARK,,,260 Highland St  Roxbury  MA  02119,9.0,10B,7.0,B2,Roxbury,13.0,11,1101.0,E,260 Highland St,2119.0,Address,73748.0,42.3228,-71.0962,Employee Generated,"(42.3228, -71.0962)"
613385,101001525390,08/19/2015 02:04:00 PM,08/26/2015 02:04:25 PM,09/28/2015 12:37:02 PM,OVERDUE,Closed,Case Closed. Closed date : 2015-09-28 12:37:02.01 Case Noted This under cotract. Work order was sent to contractor.,Equipment Repair,Parks & Recreation Department,Park Maintenance & Safety,Equipment Repair,PARK_Maintenance_Trades,PARK,,,33 Sumner St  East Boston  MA  02128,1.0,09,1.0,A7,East Boston,1.0,1,103.0,,33 Sumner St,2128.0,Address,342511.0,42.3594,-71.0587,Constituent Call,"(0, 0)"
613558,101001525615,08/19/2015 05:48:00 PM,08/27/2015 08:30:00 AM,09/09/2015 11:28:35 AM,OVERDUE,Closed,Case Closed. Closed date : 2015-09-09 11:28:35.637 Case Resolved job done on 9/14/15,Equipment Repair,Parks & Recreation Department,Park Maintenance & Safety,Equipment Repair,PARK_Park Improvement Requests,PARK,,,365 Hyde Park Ave  Roslindale  MA  02131,12.0,02,6.0,E18,Roslindale,10.0,19,1912.0,E,365 Hyde Park Ave,2131.0,Address,77313.0,42.289,-71.1188,Constituent Call,"(42.289, -71.1188)"
613605,101001525691,08/19/2015 07:38:00 PM,08/27/2015 08:30:00 AM,10/19/2015 02:08:21 PM,OVERDUE,Closed,Case Closed. Closed date : 2015-10-19 14:08:21.037 Case Resolved done 9-15-15,Equipment Repair,Parks & Recreation Department,Park Maintenance & Safety,Equipment Repair,PARK_Maintenance_Trades,PARK,https://mayors24.cityofboston.gov/media/boston/report/photos/55d5137f04858b6818a14aa0/report.jpg,,75 W Rutland Sq  Roxbury  MA  02118,4.0,1C,7.0,D4,Roxbury,6.0,4,404.0,,75 W Rutland Sq,2118.0,Address,342665.0,42.3594,-71.0587,Citizens Connect App,"(0, 0)"
613634,101001525734,08/19/2015 08:53:00 PM,08/27/2015 08:30:00 AM,09/24/2015 02:07:29 PM,OVERDUE,Closed,Case Closed. Closed date : 2015-09-24 14:07:29.297 Case Resolved done 9-25-15,Equipment Repair,Parks & Recreation Department,Park Maintenance & Safety,Equipment Repair,PARK_Maintenance_Trades,PARK,https://mayors24.cityofboston.gov/media/boston/report/photos/55d5250504858b6818a14c58/report.jpg,,10 Stillman St  Boston  MA  02113,3.0,1B,1.0,A1,Boston,3.0,3,303.0,,10 Stillman St,2113.0,Address,342055.0,42.3594,-71.0587,Citizens Connect App,"(0, 0)"
613642,101001525745,08/19/2015 09:08:00 PM,08/27/2015 08:30:00 AM,10/20/2015 11:44:09 AM,OVERDUE,Closed,Case Closed. Closed date : 2015-10-20 11:44:09.437 Case Resolved done,Equipment Repair,Parks & Recreation Department,Park Maintenance & Safety,Equipment Repair,PARK_Maintenance_Trades,PARK,https://mayors24.cityofboston.gov/media/boston/report/photos/55d5289704858b6818a14cb8/report.jpg,,135 Prince St  Boston  MA  02113,3.0,1B,1.0,A1,Boston,3.0,3,303.0,,135 Prince St,2113.0,Address,342060.0,42.3594,-71.0587,Citizens Connect App,"(0, 0)"
613686,101001525810,08/20/2015 06:00:00 AM,08/27/2015 08:30:00 AM,10/15/2015 10:32:35 AM,OVERDUE,Closed,Case Closed. Closed date : 2015-10-15 10:32:35.4 Case Resolved done 10-13-15,Equipment Repair,Parks & Recreation Department,Park Maintenance & Safety,Equipment Repair,PARK_Maintenance_Trades,PARK,https://mayors24.cityofboston.gov/media/boston/report/photos/55d5a53c04858b6818a1506a/photo_20150820_055849.jpg,,85 Allston St  Allston  MA  02134,11.0,04,9.0,D14,Allston,15.0,21,2106.0,,85 Allston St,2134.0,Address,342014.0,42.3594,-71.0587,Citizens Connect App,"(0, 0)"
613869,101001526046,08/20/2015 10:00:00 AM,08/27/2015 10:07:11 AM,08/26/2015 01:10:51 PM,ONTIME,Closed,Case Closed. Closed date : 2015-08-26 13:10:51.007 Case Resolved done 8-25-15,Equipment Repair,Parks & Recreation Department,Park Maintenance & Safety,Equipment Repair,PARK_Maintenance_Trades,PARK,,,21 Phillips St  Boston  MA  02114,3.0,1B,8.0,A1,Boston,14.0,5,504.0,,21 Phillips St,2114.0,Address,342572.0,42.3594,-71.0587,Employee Generated,"(0, 0)"
614064,101001526283,08/20/2015 12:46:00 PM,08/27/2015 12:46:16 PM,08/26/2015 01:13:05 PM,ONTIME,Closed,Case Closed. Closed date : 2015-08-26 13:13:05.793 Case Resolved done 8-25-15,Equipment Repair,Parks & Recreation Department,Park Maintenance & Safety,Equipment Repair,PARK_Maintenance_Trades,PARK,,,,,,,,,,,,,,,,,42.3594,-71.0587,Constituent Call,"(0, 0)"
614086,101001526308,08/20/2015 01:24:00 PM,08/27/2015 01:24:12 PM,08/26/2015 01:07:54 PM,ONTIME,Closed,Case Closed. Closed date : 2015-08-26 13:07:54.127 Case Resolved done 8-25-15,Equipment Repair,Parks & Recreation Department,Park Maintenance & Safety,Equipment Repair,PARK_Maintenance_Trades,PARK,,,,,,,,,,,,,,,,,42.3594,-71.0587,Constituent Call,"(0, 0)"
614087,101001526310,08/20/2015 01:24:00 PM,08/27/2015 01:24:52 PM,08/27/2015 11:09:36 AM,ONTIME,Closed,Case Closed. Closed date : 2015-08-27 11:09:36.953 Case Resolved done 8-26-15,Equipment Repair,Parks & Recreation Department,Park Maintenance & Safety,Equipment Repair,PARK_Maintenance_Trades,PARK,,,,,,,,,,,,,,,,,42.3594,-71.0587,Employee Generated,"(0, 0)"
614102,101001526328,08/20/2015 01:50:00 PM,08/27/2015 01:53:30 PM,09/02/2015 10:35:42 AM,OVERDUE,Closed,Case Closed. Closed date : 2015-09-02 10:35:42.347 Case Noted library will get their own plumber for repairs,Equipment Repair,Parks & Recreation Department,Park Maintenance & Safety,Equipment Repair,PARK_Maintenance_Trades,PARK,,,685 Tremont St  Roxbury  MA  02118,4.0,1C,7.0,D4,Roxbury,6.0,04,404.0,,685 Tremont St,2118.0,Address,342641.0,42.3594,-71.0587,Constituent Call,"(0, 0)"
614204,101001526441,08/20/2015 02:28:00 PM,08/27/2015 02:29:30 PM,08/26/2015 10:53:29 AM,ONTIME,Closed,Case Closed. Closed date : 2015-08-26 10:53:29.497 Case Resolved done 8-26-15,Equipment Repair,Parks & Recreation Department,Park Maintenance & Safety,Equipment Repair,PARK_Maintenance_Trades,PARK,,,685 Tremont St  Roxbury  MA  02118,4.0,1C,7.0,D4,Roxbury,6.0,04,404.0,,685 Tremont St,2118.0,Address,342641.0,42.3594,-71.0587,Constituent Call,"(0, 0)"
614312,101001526548,08/20/2015 03:03:00 PM,08/27/2015 03:03:12 PM,09/24/2015 02:01:22 PM,OVERDUE,Closed,Case Closed. Closed date : 2015-09-24 14:01:22.5 Case Resolved,Equipment Repair,Parks & Recreation Department,Park Maintenance & Safety,Equipment Repair,PARK_Maintenance_Trades,PARK,https://mayors24.cityofboston.gov/media/boston/report/photos/55d6246b04859ee566e43bc9/photo_20150820_150011.jpg,,74 Faneuil St  Brighton  MA  02135,11.0,04,9.0,D14,Brighton,15.0,22,2212.0,E,74 Faneuil St,2135.0,Address,56305.0,42.3548,-71.153,Citizens Connect App,"(42.3548, -71.153)"
614350,101001526607,08/20/2015 04:07:00 PM,08/27/2015 04:07:47 PM,09/02/2015 10:27:44 AM,OVERDUE,Closed,Case Closed. Closed date : 2015-09-02 10:27:44.78 Case Resolved done,Equipment Repair,Parks & Recreation Department,Park Maintenance & Safety,Equipment Repair,PARK_Maintenance_Trades,PARK,,,139 Tremont St  Boston  MA  02108,3.0,1C,8.0,A1,Beacon Hill,14.0,05,503.0,E,139 Tremont St,2108.0,Address,341542.0,42.3554,-71.0638,Constituent Call,"(42.3554, -71.0638)"
614364,101001526624,08/20/2015 04:29:00 PM,08/27/2015 04:29:20 PM,09/15/2015 11:09:41 AM,OVERDUE,Closed,Case Closed. Closed date : 2015-09-15 11:09:41.883 Case Noted plumbers report water fountain needs new button  turned off until next season,Equipment Repair,Parks & Recreation Department,Park Maintenance & Safety,Equipment Repair,PARK_Maintenance_Trades,PARK,,,1825 Commonwealth Ave  Brighton  MA  02135,11.0,04,9.0,D14,Brighton,15.0,21,2115.0,,1825 Commonwealth Ave,2135.0,Address,342635.0,42.3594,-71.0587,Citizens Connect App,"(0, 0)"
614452,101001526736,08/20/2015 08:42:00 PM,08/28/2015 08:30:00 AM,09/25/2015 09:57:32 AM,OVERDUE,Closed,Case Closed. Closed date : 2015-09-25 09:57:32.85 Case Resolved Tennis nets were adjusted.,Equipment Repair: --Not in list--,Parks & Recreation Department,Park Maintenance & Safety,Equipment Repair,PARK_Maintenance_Trades,PARK,,,,,,,,,,,,,,,,,42.3594,-71.0587,Self Service,"(0, 0)"
614685,101001527032,08/21/2015 10:05:00 AM,08/28/2015 10:05:18 AM,08/26/2015 01:08:56 PM,ONTIME,Closed,Case Closed. Closed date : 2015-08-26 13:08:56.187 Case Resolved done 8-25-15,Equipment Repair,Parks & Recreation Department,Park Maintenance & Safety,Equipment Repair,PARK_Maintenance_Trades,PARK,,,155 Seaver St  Jamaica Plain  MA  02130,9.0,02,7.0,B2,Greater Mattapan,13.0,12,1207.0,,155 Seaver St,2130.0,Address,342005.0,42.3594,-71.0587,Employee Generated,"(0, 0)"
614702,101001527052,08/21/2015 10:17:00 AM,08/28/2015 10:17:52 AM,09/02/2015 11:40:46 AM,OVERDUE,Closed,Case Closed. Closed date : 2015-09-02 11:40:46.183 Case Resolved done 8-28-15,Equipment Repair,Parks & Recreation Department,Park Maintenance & Safety,Equipment Repair,PARK_Maintenance_Trades,PARK,,,1 Jewish War Veterans Dr  Jamaica Plain  MA  02130,9.0,02,7.0,B2,Greater Mattapan,13.0,12,1207.0,E,1 Jewish War Veterans Dr,2130.0,Address,163434.0,42.301,-71.0886,Employee Generated,"(42.301, -71.0886)"
614768,101001527131,08/21/2015 10:59:37 AM,08/28/2015 10:59:56 AM,08/21/2015 11:02:51 AM,ONTIME,Closed,Case Closed Case Invalid,Equipment Repair,Parks & Recreation Department,Park Maintenance & Safety,Equipment Repair,PARK_Maintenance_Trades,PARK,,,,,,,,,,,,,,,,,42.3594,-71.0587,Employee Generated,"(0, 0)"
614854,101001527240,08/21/2015 12:03:00 PM,08/28/2015 12:03:59 PM,,OVERDUE,Open,,Equipment Repair,Parks & Recreation Department,Park Maintenance & Safety,Equipment Repair,INFO01_GenericeFormforOtherServiceRequestTypes,INFO,https://mayors24.cityofboston.gov/media/boston/report/photos/55d74be4048573f2ccf640f2/report.jpg,,110 Atlantic Ave  Boston  MA  02110,3.0,1B,1.0,A1,Boston,3.0,3,301.0,,110 Atlantic Ave,2110.0,Address,161702.0,42.361,-71.0522,Citizens Connect App,"(42.361, -71.0522)"
614856,101001527243,08/21/2015 12:06:00 PM,08/28/2015 12:06:12 PM,09/08/2015 10:16:28 AM,OVERDUE,Closed,Case Closed. Closed date : 2015-09-08 10:16:28.483 Case Resolved done 8-31-15,Equipment Repair,Parks & Recreation Department,Park Maintenance & Safety,Equipment Repair,PARK_Maintenance_Trades,PARK,,,139 Tremont St  Boston  MA  02108,3.0,1C,8.0,A1,Beacon Hill,14.0,05,503.0,E,139 Tremont St,2108.0,Address,341542.0,42.3554,-71.0638,Constituent Call,"(42.3554, -71.0638)"
614866,101001527256,08/21/2015 12:19:00 PM,08/28/2015 12:19:43 PM,,OVERDUE,Open,,Equipment Repair,Parks & Recreation Department,Park Maintenance & Safety,Equipment Repair,PARK_Maintenance_Trades,PARK,https://mayors24.cityofboston.gov/media/boston/report/photos/55d74f9a048573f2ccf64123/report.jpg,,39 Saint James St  Roxbury  MA  02119,7.0,10B,7.0,B2,Roxbury,13.0,12,1201.0,,39 Saint James St,2119.0,Address,342654.0,42.3594,-71.0587,Citizens Connect App,"(0, 0)"
614872,101001527267,08/21/2015 12:25:00 PM,08/28/2015 12:25:37 PM,11/05/2015 01:36:48 PM,OVERDUE,Closed,Case Closed Case Resolved  The following case has been managed by the Boston Transportation Department. The location has been made safe.,Equipment Repair,Parks & Recreation Department,Park Maintenance & Safety,Equipment Repair,BTDT_Administration,BTDT,https://mayors24.cityofboston.gov/media/boston/report/photos/55d750f9048573f2ccf6415c/report.jpg,,130 Peterborough St  Boston  MA  02215,4.0,10A,8.0,D4,Boston,14.0,21,2101.0,,130 Peterborough St,2215.0,Address,342583.0,42.3594,-71.0587,Citizens Connect App,"(0, 0)"
615281,101001527787,08/22/2015 08:49:00 AM,08/31/2015 08:30:00 AM,08/26/2015 01:50:10 PM,ONTIME,Closed,Case Closed. Closed date : 2015-08-26 13:50:10.173 Case Resolved,Equipment Repair,Parks & Recreation Department,Park Maintenance & Safety,Equipment Repair,PARK_Maintenance_Trades,PARK,,,56 Dunbar Ave  Dorchester  MA  02124,8.0,07,4.0,B3,Dorchester,9.0,17,1708.0,,56 Dunbar Ave,2124.0,Address,342601.0,42.3594,-71.0587,Citizens Connect App,"(0, 0)"
615291,101001527801,08/22/2015 09:08:00 AM,08/31/2015 08:30:00 AM,10/15/2015 11:05:49 AM,OVERDUE,Closed,Case Closed. Closed date : 2015-10-15 11:05:49.0 Case Resolved done 10-14-15,Equipment Repair,Parks & Recreation Department,Park Maintenance & Safety,Equipment Repair,PARK_Maintenance_Trades,PARK,https://mayors24.cityofboston.gov/media/boston/report/photos/55d87467048573f2ccf64b50/report.jpg,,380  Faneuil St  Brighton  MA  02135,11.0,04,9.0,D14,Brighton,15.0,22,2207.0,,380  Faneuil St,2135.0,Address,342467.0,42.3594,-71.0587,Citizens Connect App,"(0, 0)"
615302,101001527817,08/22/2015 10:10:01 AM,08/31/2015 08:30:00 AM,08/22/2015 10:15:19 AM,ONTIME,Closed,Case Closed. Closed date : 2015-08-22 10:15:19.67 Duplicate of Existing Case,Equipment Repair,Parks & Recreation Department,Park Maintenance & Safety,Equipment Repair,PARK_Maintenance_Trades,PARK,,,345 Walnut Ave  Roxbury  MA  02119,9.0,10B,7.0,E13,Roxbury,13.0,11,1103.0,,345 Walnut Ave,2119.0,Address,342534.0,42.3594,-71.0587,Constituent Call,"(0, 0)"
615303,101001527819,08/22/2015 10:14:00 AM,08/31/2015 08:30:00 AM,08/26/2015 01:49:40 PM,ONTIME,Closed,Case Closed. Closed date : 2015-08-26 13:49:40.653 Case Resolved,Equipment Repair,Parks & Recreation Department,Park Maintenance & Safety,Equipment Repair,PARK_Maintenance_Trades,PARK,,,345 Walnut Ave  Roxbury  MA  02119,9.0,10B,7.0,E13,Roxbury,13.0,11,1103.0,,345 Walnut Ave,2119.0,Address,342534.0,42.3594,-71.0587,Constituent Call,"(0, 0)"
615339,101001527869,08/22/2015 11:41:00 AM,08/31/2015 08:30:00 AM,09/08/2015 10:50:15 AM,OVERDUE,Closed,Case Closed. Closed date : 2015-09-08 10:50:15.097 Case Resolved done 9-1-15,Equipment Repair,Parks & Recreation Department,Park Maintenance & Safety,Equipment Repair,PARK_Maintenance_Trades,PARK,https://mayors24.cityofboston.gov/media/boston/report/photos/55d89838048573f2ccf64e1a/photo_20150822_114023.jpg,,143 Porter St  East Boston  MA  02128,1.0,09,1.0,A7,East Boston,1.0,01,105.0,,143 Porter St,2128.0,Address,344495.0,42.3594,-71.0587,Citizens Connect App,"(0, 0)"
615341,101001527872,08/22/2015 11:49:00 AM,08/31/2015 08:30:00 AM,09/08/2015 10:51:00 AM,OVERDUE,Closed,Case Closed. Closed date : 2015-09-08 10:51:00.497 Case Resolved done 9-1-15,Equipment Repair,Parks & Recreation Department,Park Maintenance & Safety,Equipment Repair,PARK_Maintenance_Trades,PARK,https://mayors24.cityofboston.gov/media/boston/report/photos/55d899e9048573f2ccf64e4b/photo_20150822_114804.jpg,,14 Jeffries St  East Boston  MA  02128,1.0,09,1.0,A7,East Boston,1.0,01,101.0,,14 Jeffries St,2128.0,Address,344483.0,42.3594,-71.0587,Citizens Connect App,"(0, 0)"
615355,101001527894,08/22/2015 12:39:00 PM,08/31/2015 08:30:00 AM,,OVERDUE,Open,,Equipment Repair,Parks & Recreation Department,Park Maintenance & Safety,Equipment Repair,INFO01_GenericeFormforOtherServiceRequestTypes,INFO,https://mayors24.cityofboston.gov/media/boston/report/photos/55d8a5a6048573f2ccf64ef1/report.jpg,,11 Science Park  Boston  MA  02114,3.0,1B,8.0,A1,Boston,3.0,03,,,11 Science Park,2114.0,Address,350499.0,42.3594,-71.0587,Citizens Connect App,"(0, 0)"
615388,101001527938,08/22/2015 02:41:00 PM,08/31/2015 08:30:00 AM,08/26/2015 01:43:44 PM,ONTIME,Closed,Case Closed. Closed date : 2015-08-26 13:43:44.703 Case Resolved done 8-24-15,Equipment Repair,Parks & Recreation Department,Park Maintenance & Safety,Equipment Repair,PARK_Maintenance_Trades,PARK,,,24 Edison Grn  Dorchester  MA  02125,7.0,03,2.0,C11,Dorchester,5.0,7,709.0,,24 Edison Grn,2125.0,Address,342538.0,42.3594,-71.0587,Citizens Connect App,"(0, 0)"
615430,101001527996,08/22/2015 05:13:00 PM,08/31/2015 08:30:00 AM,08/26/2015 01:50:24 PM,ONTIME,Closed,Case Closed. Closed date : 2015-08-26 13:50:24.07 Case Resolved sign removed,Equipment Repair,Parks & Recreation Department,Park Maintenance & Safety,Equipment Repair,PARK_Maintenance_Region 1,PARK,https://mayors24.cityofboston.gov/media/boston/report/photos/55d8e60d048573f2ccf65202/photo_20150822_171118.jpg,,14 Jeffries St  East Boston  MA  02128,1.0,09,1.0,A7,East Boston,1.0,01,101.0,,14 Jeffries St,2128.0,Address,344483.0,42.3594,-71.0587,Citizens Connect App,"(0, 0)"
615449,101001528023,08/22/2015 06:04:00 PM,08/31/2015 08:30:00 AM,08/24/2015 08:00:51 AM,ONTIME,Closed,Case Closed. Closed date : 2015-08-24 08:00:51.3 Case Noted the main water pipe is contaminated can not be turned on yet. BWSC is aware of the problem. The BPRD can not do anything further until the pipe is repaired.,Equipment Repair,Parks & Recreation Department,Park Maintenance & Safety,Equipment Repair,PARK_Maintenance_Trades,PARK,https://mayors24.cityofboston.gov/media/boston/report/photos/55d8f1ef048573f2ccf652e3/report.jpg,,130 Peterborough St  Boston  MA  02215,4.0,10A,8.0,D4,Boston,14.0,21,2101.0,,130 Peterborough St,2215.0,Address,342583.0,42.3594,-71.0587,Citizens Connect App,"(0, 0)"
615474,101001528053,08/22/2015 07:35:00 PM,08/31/2015 08:30:00 AM,09/22/2015 10:26:30 AM,OVERDUE,Closed,Case Closed. Closed date : 2015-09-22 10:26:30.743 Case Resolved done 9-15-15,Equipment Repair,Parks & Recreation Department,Park Maintenance & Safety,Equipment Repair,PARK_Maintenance_Trades,PARK,https://mayors24.cityofboston.gov/media/boston/report/photos/55d90733048573f2ccf653f9/report.jpg,,1535 Washington St  Roxbury  MA  02118,4.0,1C,2.0,D4,Roxbury,6.0,09,901.0,E,1535 Washington St,2118.0,Address,341541.0,42.3397,-71.0736,Citizens Connect App,"(42.3397, -71.0736)"
615478,101001528058,08/22/2015 07:46:00 PM,08/31/2015 08:30:00 AM,08/26/2015 01:43:04 PM,ONTIME,Closed,Case Closed. Closed date : 2015-08-26 13:43:04.503 Case Resolved done 8-24-15,Equipment Repair,Parks & Recreation Department,Park Maintenance & Safety,Equipment Repair,PARK_Maintenance_Trades,PARK,https://mayors24.cityofboston.gov/media/boston/report/photos/55d909d1048573f2ccf65428/report.jpg,,502 VFW Pkwy  West Roxbury  MA  02132,9.0,06,6.0,E5,West Roxbury,12.0,20,2019.0,,502 VFW Pkwy,2132.0,Address,342479.0,42.3594,-71.0587,Citizens Connect App,"(0, 0)"
615524,101001528125,08/23/2015 08:49:00 AM,08/31/2015 08:30:00 AM,,OVERDUE,Open,,Equipment Repair,Parks & Recreation Department,Park Maintenance & Safety,Equipment Repair,PARK_Park Improvement Requests,PARK,https://mayors24.cityofboston.gov/media/boston/report/photos/55d9c1530485b7496cffdc7b/report.jpg,,180 W Fifth St  South Boston  MA  02127,6.0,05,2.0,C6,South Boston,5.0,6,603.0,,180 W Fifth St,2127.0,Address,342659.0,42.3594,-71.0587,Citizens Connect App,"(0, 0)"
615559,101001528175,08/23/2015 11:47:53 AM,08/31/2015 08:30:00 AM,08/24/2015 07:22:28 AM,ONTIME,Closed,Case Closed Duplicate of Existing Case  Duplicate of case # 1528125,Equipment Repair,Parks & Recreation Department,Park Maintenance & Safety,Equipment Repair,PARK_Maintenance_Trades,PARK,,,180 W Fifth St  South Boston  MA  02127,6.0,05,2.0,C6,South Boston,5.0,6,603.0,,180 W Fifth St,2127.0,Address,342659.0,42.3594,-71.0587,Citizens Connect App,"(0, 0)"
615649,101001528301,08/23/2015 06:16:00 PM,08/31/2015 08:30:00 AM,08/24/2015 07:22:17 AM,ONTIME,Closed,Case Closed Duplicate of Existing Case  Duplicate of case # 1528125,Equipment Repair,Parks & Recreation Department,Park Maintenance & Safety,Equipment Repair,PARK_Maintenance_Trades,PARK,,,180 W Fifth St  South Boston  MA  02127,6.0,05,2.0,C6,South Boston,5.0,6,603.0,,180 W Fifth St,2127.0,Address,342659.0,42.3594,-71.0587,Constituent Call,"(0, 0)"
615689,101001528360,08/23/2015 09:57:00 PM,08/31/2015 08:30:00 AM,08/26/2015 01:47:35 PM,ONTIME,Closed,Case Closed. Closed date : 2015-08-26 13:47:35.49 Case Noted plumbers report shut off on 8-24-15 needs button for the shower,Equipment Repair,Parks & Recreation Department,Park Maintenance & Safety,Equipment Repair,PARK_Maintenance_Trades,PARK,,,80 Humboldt Ave  Dorchester  MA  02121,9.0,10B,7.0,B2,Dorchester,13.0,12,1202.0,,80 Humboldt Ave,2121.0,Address,342506.0,42.3594,-71.0587,Constituent Call,"(0, 0)"
615770,101001528484,08/24/2015 08:34:00 AM,08/31/2015 08:34:48 AM,09/15/2015 10:19:50 AM,OVERDUE,Closed,Case Closed. Closed date : 2015-09-15 10:19:50.647 Case Resolved done 8-30-15,Equipment Repair,Parks & Recreation Department,Park Maintenance & Safety,Equipment Repair,PARK_Maintenance_Trades,PARK,https://mayors24.cityofboston.gov/media/boston/report/photos/55db0f640485cd5cc568c3ad/report.jpg,,529-543 Commercial St  Boston  MA  02109,3.0,1B,1.0,A1,Boston,3.0,3,302.0,E,529-543 Commercial St,2109.0,Address,36790.0,42.3688,-71.0562,Citizens Connect App,"(42.3688, -71.0562)"
615835,101001528572,08/24/2015 09:31:00 AM,08/31/2015 09:31:57 AM,08/26/2015 01:12:24 PM,ONTIME,Closed,Case Closed. Closed date : 2015-08-26 13:12:24.09 Case Resolved done 8-25-15,Equipment Repair,Parks & Recreation Department,Park Maintenance & Safety,Equipment Repair,PARK_Maintenance_Trades,PARK,,,,,,,,,,,,,,,,,42.3594,-71.0587,Employee Generated,"(0, 0)"
615839,101001528578,08/24/2015 09:33:00 AM,08/31/2015 09:33:43 AM,09/02/2015 12:15:43 PM,OVERDUE,Closed,Case Closed. Closed date : 2015-09-02 12:15:43.977 Case Noted trades reports no bench found 9-2-15,Equipment Repair,Parks & Recreation Department,Park Maintenance & Safety,Equipment Repair,PARK_Maintenance_Trades,PARK,,,,,,,,,,,,,,,,,42.3594,-71.0587,Constituent Call,"(0, 0)"
616026,101001528826,08/24/2015 12:08:00 PM,08/31/2015 12:08:12 PM,09/22/2015 09:58:41 AM,OVERDUE,Closed,Case Closed. Closed date : 2015-09-22 09:58:41.993 Case Resolved done 9-18-15,Equipment Repair,Parks & Recreation Department,Park Maintenance & Safety,Equipment Repair,PARK_Maintenance_Trades,PARK,,,,,,,,,,,,,,,,,42.3594,-71.0587,Constituent Call,"(0, 0)"
616088,101001528911,08/24/2015 01:15:00 PM,08/31/2015 01:15:23 PM,09/02/2015 12:09:01 PM,OVERDUE,Closed,Case Closed. Closed date : 2015-09-02 12:09:01.32 Case Resolved,Equipment Repair,Parks & Recreation Department,Park Maintenance & Safety,Equipment Repair,PARK_Maintenance_Trades,PARK,,,,,,,,,,,,,,,,,42.3594,-71.0587,Constituent Call,"(0, 0)"
616272,101001529151,08/24/2015 04:04:00 PM,08/31/2015 04:04:21 PM,08/26/2015 11:52:40 AM,ONTIME,Closed,Case Closed. Closed date : 2015-08-26 11:52:40.663 Case Resolved done 8-25-15,Equipment Repair,Parks & Recreation Department,Park Maintenance & Safety,Equipment Repair,PARK_Maintenance_Trades,PARK,,,155 Seaver St  Jamaica Plain  MA  02130,9.0,02,7.0,B2,Greater Mattapan,13.0,12,1207.0,,155 Seaver St,2130.0,Address,342005.0,42.3594,-71.0587,Employee Generated,"(0, 0)"
616345,101001529249,08/24/2015 06:42:00 PM,09/01/2015 08:30:00 AM,09/11/2015 02:12:59 PM,OVERDUE,Closed,Case Closed. Closed date : 2015-09-11 14:12:59.293 Case Resolved,Equipment Repair,Parks & Recreation Department,Park Maintenance & Safety,Equipment Repair,PARK_Maintenance_Trades,PARK,,,59 Waumbeck St  Dorchester  MA  02121,9.0,10B,7.0,B2,Dorchester,13.0,12,1202.0,,59 Waumbeck St,2121.0,Address,342666.0,42.3594,-71.0587,Constituent Call,"(0, 0)"
616352,101001529259,08/24/2015 06:52:00 PM,09/01/2015 08:30:00 AM,08/25/2015 03:34:34 PM,ONTIME,Closed,Case Closed. Closed date : 2015-08-25 15:34:34.53 Case Resolved,Ground Maintenance: Murphy Playground  Arnold Arboretum,Parks & Recreation Department,Park Maintenance & Safety,Equipment Repair,PARK_Maintenance_Region 3,PARK,,,125 Arborway  Jamaica Plain  MA  02130,9.0,02,6.0,E13,Jamaica Plain,11.0,19,1902.0,E,125 Arborway,2130.0,Address,341526.0,42.3012,-71.1228,Citizens Connect App,"(42.3012, -71.1228)"
616358,101001529270,08/24/2015 07:22:51 PM,09/01/2015 08:30:00 AM,09/09/2015 12:35:38 PM,OVERDUE,Closed,Case Closed. Closed date : 2015-09-09 12:35:38.32 Duplicate of Existing Case Same as #1528484.,Equipment Repair,Parks & Recreation Department,Park Maintenance & Safety,Equipment Repair,PARK_Maintenance_Trades,PARK,https://mayors24.cityofboston.gov/media/boston/report/photos/55dba74a0485668337245dde/report.jpg,,529-543 Commercial St  Boston  MA  02109,3.0,1B,1.0,A1,Boston,3.0,3,302.0,E,529-543 Commercial St,2109.0,Address,36790.0,42.3688,-71.0562,Citizens Connect App,"(42.3688, -71.0562)"
616359,101001529271,08/24/2015 07:24:02 PM,09/01/2015 08:30:00 AM,09/09/2015 12:37:15 PM,OVERDUE,Closed,Case Closed. Closed date : 2015-09-09 12:37:15.327 Duplicate of Existing Case Same as #1528484,Equipment Repair,Parks & Recreation Department,Park Maintenance & Safety,Equipment Repair,PARK_Maintenance_Trades,PARK,https://mayors24.cityofboston.gov/media/boston/report/photos/55dba7950485668337245dee/report.jpg,,529-543 Commercial St  Boston  MA  02109,3.0,1B,1.0,A1,Boston,3.0,3,302.0,E,529-543 Commercial St,2109.0,Address,36790.0,42.3688,-71.0562,Citizens Connect App,"(42.3688, -71.0562)"
616360,101001529272,08/24/2015 07:24:58 PM,09/01/2015 08:30:00 AM,09/09/2015 12:38:06 PM,OVERDUE,Closed,Case Closed. Closed date : 2015-09-09 12:38:06.753 Duplicate of Existing Case Same as #1528484,Equipment Repair,Parks & Recreation Department,Park Maintenance & Safety,Equipment Repair,PARK_Maintenance_Trades,PARK,https://mayors24.cityofboston.gov/media/boston/report/photos/55dba7d00485668337245df8/report.jpg,,529-543 Commercial St  Boston  MA  02109,3.0,1B,1.0,A1,Boston,3.0,3,302.0,E,529-543 Commercial St,2109.0,Address,36790.0,42.3688,-71.0562,Citizens Connect App,"(42.3688, -71.0562)"
616362,101001529274,08/24/2015 07:26:15 PM,09/01/2015 08:30:00 AM,09/09/2015 12:39:30 PM,OVERDUE,Closed,Case Closed. Closed date : 2015-09-09 12:39:30.48 Duplicate of Existing Case Same as 1528484.,Equipment Repair,Parks & Recreation Department,Park Maintenance & Safety,Equipment Repair,PARK_Maintenance_Trades,PARK,https://mayors24.cityofboston.gov/media/boston/report/photos/55dba81f0485668337245e1c/report.jpg,,529-543 Commercial St  Boston  MA  02109,3.0,1B,1.0,A1,Boston,3.0,3,302.0,E,529-543 Commercial St,2109.0,Address,36790.0,42.3688,-71.0562,Citizens Connect App,"(42.3688, -71.0562)"
616373,101001529289,08/24/2015 07:56:00 PM,09/01/2015 08:30:00 AM,09/11/2015 09:37:30 AM,OVERDUE,Closed,Case Closed. Closed date : 2015-09-11 09:37:30.343 Case Resolved holes filled up,Ground Maintenance: Boston Common  Central Burying Ground,Parks & Recreation Department,Park Maintenance & Safety,Equipment Repair,PARK_Maintenance_Region 1,PARK,https://mayors24.cityofboston.gov/media/boston/report/photos/55dbaf1f0485668337245e5e/photo_20150824_195514.jpg,,125 Boylston St  Boston  MA  02108,3.0,1C,8.0,A1,Boston,14.0,5,503.0,,125 Boylston St,2108.0,Address,342020.0,42.3594,-71.0587,Citizens Connect App,"(0, 0)"
616477,101001529406,08/25/2015 07:12:00 AM,09/01/2015 08:30:00 AM,09/24/2015 12:11:28 PM,OVERDUE,Closed,Case Closed. Closed date : 2015-09-24 12:11:28.627 Case Resolved,Equipment Repair,Parks & Recreation Department,Park Maintenance & Safety,Equipment Repair,PARK_Maintenance_Trades,PARK,,,75 W Rutland Sq  Roxbury  MA  02118,4.0,1C,7.0,D4,Roxbury,6.0,4,404.0,,75 W Rutland Sq,2118.0,Address,342665.0,42.3594,-71.0587,Citizens Connect App,"(0, 0)"
616739,101001529768,08/25/2015 11:03:00 AM,09/01/2015 11:03:34 AM,10/01/2015 03:10:12 PM,OVERDUE,Closed,Case Closed. Closed date : 2015-10-01 15:10:12.75 Case Resolved done 9-25-15,Equipment Repair,Parks & Recreation Department,Park Maintenance & Safety,Equipment Repair,INFO01_GenericeFormforOtherServiceRequestTypes,INFO,,,INTERSECTION of Warren St & Monastery Path  Boston  MA,11.0,04,9.0,D14,Allston / Brighton,15.0,Ward 21,2109.0,,INTERSECTION Warren St & Monastery Path,,Intersection,5913.0,42.3497,-71.1441,Constituent Call,"(42.3497, -71.1441)"
616757,101001529791,08/25/2015 11:13:00 AM,09/01/2015 11:13:31 AM,08/31/2015 02:39:02 PM,ONTIME,Closed,Case Closed. Closed date : 2015-08-31 14:39:02.59 Case Resolved done 8-28-15,Equipment Repair,Parks & Recreation Department,Park Maintenance & Safety,Equipment Repair,PARK_Maintenance_Trades,PARK,,,529-543 Commercial St  Boston  MA  02109,3.0,1B,1.0,A1,Boston,3.0,3,302.0,E,529-543 Commercial St,2109.0,Address,36790.0,42.3688,-71.0562,Employee Generated,"(42.3688, -71.0562)"
616842,101001529900,08/25/2015 12:25:00 PM,09/01/2015 12:25:43 PM,09/25/2015 09:59:47 AM,OVERDUE,Closed,Case Closed. Closed date : 2015-09-25 09:59:47.22 Case Resolved Spray fountain was adjusted.,Equipment Repair,Parks & Recreation Department,Park Maintenance & Safety,Equipment Repair,PARK_Maintenance_Trades,PARK,,,107-109 Hooker St  Allston  MA  02134,11.0,04,9.0,D14,Allston / Brighton,15.0,Ward 22,2201.0,R3,107-109 Hooker St,2134.0,Address,75161.0,42.3592,-71.1257,Constituent Call,"(42.3592, -71.1257)"
616882,101001529956,08/25/2015 12:57:00 PM,09/01/2015 12:57:48 PM,09/11/2015 10:50:52 AM,OVERDUE,Closed,Case Closed. Closed date : 2015-09-11 10:50:52.203 Case Resolved done 9-10-15,Equipment Repair,Parks & Recreation Department,Park Maintenance & Safety,Equipment Repair,PARK_Maintenance_Trades,PARK,,,410 Washington St  Dorchester  MA  02124,7.0,03,4.0,C11,Dorchester,9.0,17,1701.0,,410 Washington St,2124.0,Address,342034.0,42.3594,-71.0587,Employee Generated,"(0, 0)"
616889,101001529967,08/25/2015 01:04:00 PM,09/01/2015 01:04:44 PM,09/11/2015 11:39:28 AM,OVERDUE,Closed,Case Closed. Closed date : 2015-09-11 11:39:28.273 Case Resolved done 9-10-15,Equipment Repair,Parks & Recreation Department,Park Maintenance & Safety,Equipment Repair,PARK_Maintenance_Trades,PARK,,,1545 Dorchester Ave  Dorchester  MA  02124,8.0,07,3.0,C11,Dorchester,7.0,16,1601.0,,1545 Dorchester Ave,2124.0,Address,342065.0,42.3594,-71.0587,Employee Generated,"(0, 0)"
616967,101001530062,08/25/2015 02:18:00 PM,09/01/2015 02:18:32 PM,10/21/2015 03:07:58 PM,OVERDUE,Closed,Case Closed. Closed date : 2015-10-21 15:07:58.76 Case Noted waiting for parts to come in,Equipment Repair,Parks & Recreation Department,Park Maintenance & Safety,Equipment Repair,PARK_Maintenance_Trades,PARK,https://mayors24.cityofboston.gov/media/boston/report/photos/55dcb1810485668337246c59/report.jpg,,20 Wainwright St  Dorchester  MA  02124,8.0,07,3.0,C11,Dorchester,8.0,16,1603.0,,20 Wainwright St,2124.0,Address,342037.0,42.3594,-71.0587,Citizens Connect App,"(0, 0)"
616988,101001530089,08/25/2015 02:39:00 PM,09/01/2015 02:39:29 PM,09/02/2015 11:41:29 AM,OVERDUE,Closed,Case Closed. Closed date : 2015-09-02 11:41:29.227 Case Resolved done 8-31-15,Equipment Repair,Parks & Recreation Department,Park Maintenance & Safety,Equipment Repair,PARK_Maintenance_Trades,PARK,,,300 Gardner St  West Roxbury  MA  02132,12.0,06,6.0,E5,West Roxbury,12.0,20,2017.0,,300 Gardner St,2132.0,Address,342525.0,42.3594,-71.0587,Employee Generated,"(0, 0)"
617059,101001530182,08/25/2015 03:38:00 PM,09/01/2015 03:39:37 PM,09/02/2015 10:13:39 AM,OVERDUE,Closed,Case Closed. Closed date : 2015-09-02 10:13:39.08 Case Resolved done,Equipment Repair,Parks & Recreation Department,Park Maintenance & Safety,Equipment Repair,PARK_Maintenance_Trades,PARK,,,28 Fairview Ave  Hyde Park  MA  02136,12.0,08,5.0,E18,Hyde Park,10.0,18,1819.0,,28 Fairview Ave,2136.0,Address,342364.0,42.3594,-71.0587,Employee Generated,"(0, 0)"
617063,101001530184,08/25/2015 03:39:00 PM,09/01/2015 03:39:55 PM,08/27/2015 11:32:21 AM,ONTIME,Closed,Case Closed. Closed date : 2015-08-27 11:32:21.307 Case Resolved,Equipment Repair,Parks & Recreation Department,Park Maintenance & Safety,Equipment Repair,PARK_Maintenance_Trades,PARK,,,,,,,,,,,,,,,,,42.3594,-71.0587,Employee Generated,"(0, 0)"
617067,101001530190,08/25/2015 03:42:00 PM,09/01/2015 03:44:15 PM,09/02/2015 10:11:15 AM,OVERDUE,Closed,Case Closed. Closed date : 2015-09-02 10:11:15.4 Case Noted done,Equipment Repair,Parks & Recreation Department,Park Maintenance & Safety,Equipment Repair,PARK_Maintenance_Trades,PARK,,,355 Walk Hill St  Roslindale  MA  02131,12.0,02,5.0,E18,Roslindale,10.0,18,1807.0,,355 Walk Hill St,2131.0,Address,342536.0,42.3594,-71.0587,Employee Generated,"(0, 0)"
617089,101001530218,08/25/2015 04:07:00 PM,09/01/2015 04:07:57 PM,09/11/2015 02:21:49 PM,OVERDUE,Closed,Case Closed. Closed date : 2015-09-11 14:21:49.287 Case Resolved done 9-2-15,Equipment Repair,Parks & Recreation Department,Park Maintenance & Safety,Equipment Repair,PARK_Maintenance_Trades,PARK,,,,,,,,,,,,,,,,,42.3594,-71.0587,Employee Generated,"(0, 0)"
617132,101001530268,08/25/2015 04:46:00 PM,09/01/2015 04:46:59 PM,,OVERDUE,Open,,Equipment Repair,Parks & Recreation Department,Park Maintenance & Safety,Equipment Repair,PARK_Maintenance_Trades,PARK,,,551 Sumner St  East Boston  MA  02128,1.0,09,1.0,A7,East Boston,1.0,Ward 1,101.0,R2,551 Sumner St,2128.0,Address,132520.0,42.3641,-71.0291,Constituent Call,"(42.3641, -71.0291)"
617394,101001530594,08/26/2015 08:25:00 AM,09/02/2015 08:30:00 AM,08/31/2015 10:16:36 AM,ONTIME,Closed,Case Closed. Closed date : 2015-08-31 10:16:36.57 Case Resolved no bike foynd when inspected,Ground Maintenance: Charlestown High Field  Charlestown High School Athletic Fields,Parks & Recreation Department,Park Maintenance & Safety,Equipment Repair,PARK_Maintenance_Region 1,PARK,https://mayors24.cityofboston.gov/media/boston/report/photos/55ddb04f0485668337247823/report.jpg,,39 Terminal St  Charlestown  MA  02129,3.0,1A,1.0,A15,Charlestown,2.0,2,202.0,,39 Terminal St,2129.0,Address,344482.0,42.3816,-71.0599,Citizens Connect App,"(42.3816, -71.0599)"
617473,101001530684,08/26/2015 08:59:00 AM,09/02/2015 08:59:28 AM,12/10/2015 04:55:17 PM,OVERDUE,Closed,Case Closed. Closed date : 2015-12-10 16:55:17.403 Case Invalid no information,Equipment Repair,Parks & Recreation Department,Park Maintenance & Safety,Equipment Repair,PARK_Park Improvement Requests,PARK,https://mayors24.cityofboston.gov/media/boston/report/photos/55ddb8380485668337247925/report.jpg,,230 Shawmut Ave  Roxbury  MA  02118,4.0,1C,2.0,D4,Roxbury,4.0,3,307.0,,230 Shawmut Ave,2118.0,Address,342571.0,42.3594,-71.0587,Citizens Connect App,"(0, 0)"
617637,101001530881,08/26/2015 10:36:00 AM,09/02/2015 10:36:50 AM,,OVERDUE,Open,,Equipment Repair,Parks & Recreation Department,Park Maintenance & Safety,Equipment Repair,BTDT_BostonBikes,BTDT,https://mayors24.cityofboston.gov/media/boston/report/photos/55ddcf0e0485668337247b69/report.jpg,,2P Prescott St  East Boston  MA  02128,1.0,09,1.0,A7,East Boston,1.0,01,109.0,,2P Prescott St,2128.0,Address,350865.0,42.3594,-71.0587,Citizens Connect App,"(0, 0)"
617683,101001530947,08/26/2015 11:04:00 AM,09/02/2015 11:04:56 AM,08/31/2015 01:21:53 PM,ONTIME,Closed,Case Closed. Closed date : 2015-08-31 13:21:53.99 Case Resolved,Equipment Repair,Parks & Recreation Department,Park Maintenance & Safety,Equipment Repair,PARK_Maintenance_Trades,PARK,https://mayors24.cityofboston.gov/media/boston/report/photos/55ddd5a40485668337247c09/report.jpg,,55 Malcolm X Blvd  Mission Hill  MA  02120,9.0,10B,7.0,B2,Mission Hill,13.0,09,905.0,,55 Malcolm X Blvd,2120.0,Address,341145.0,42.332,-71.0884,Citizens Connect App,"(42.332, -71.0884)"
617920,101001541269,08/26/2015 03:08:00 PM,09/02/2015 03:08:38 PM,09/22/2015 02:49:12 PM,OVERDUE,Closed,Case Closed. Closed date : 2015-09-22 14:49:12.693 Case Resolved done,Equipment Repair,Parks & Recreation Department,Park Maintenance & Safety,Equipment Repair,PARK_Maintenance_Trades,PARK,,,,,,,,,,,,,,,,,42.3594,-71.0587,Employee Generated,"(0, 0)"
617930,101001541288,08/26/2015 03:18:00 PM,09/02/2015 03:19:06 PM,08/31/2015 02:49:27 PM,ONTIME,Closed,Case Closed. Closed date : 2015-08-31 14:49:27.347 Case Resolved done,Equipment Repair,Parks & Recreation Department,Park Maintenance & Safety,Equipment Repair,PARK_Maintenance_Trades,PARK,,,70 Putnam St  East Boston  MA  02128,1.0,09,1.0,A7,East Boston,1.0,01,109.0,,70 Putnam St,2128.0,Address,342580.0,42.3594,-71.0587,Employee Generated,"(0, 0)"
617965,101001541354,08/26/2015 04:03:00 PM,09/02/2015 04:03:45 PM,,OVERDUE,Open,,Equipment Repair,Parks & Recreation Department,Park Maintenance & Safety,Equipment Repair,PARK_Park Improvement Requests,PARK,,,4 Charles St  Boston  MA  02108,3.0,1C,8.0,A1,Boston,14.0,5,503.0,,4 Charles St,2108.0,Address,342578.0,42.3594,-71.0587,Citizens Connect App,"(0, 0)"
617995,101001541394,08/26/2015 04:39:00 PM,09/02/2015 04:39:35 PM,08/26/2015 04:41:27 PM,ONTIME,Closed,Case Closed. Closed date : 2015-08-26 16:41:27.06 Case Resolved,Equipment Repair,Parks & Recreation Department,Park Maintenance & Safety,Equipment Repair,PARK_Maintenance_Trades,PARK,,,,,,,,,,,,,,,,,42.3594,-71.0587,Employee Generated,"(0, 0)"
618061,101001541488,08/26/2015 07:07:00 PM,09/03/2015 08:30:00 AM,09/25/2015 10:01:14 AM,OVERDUE,Closed,Case Closed. Closed date : 2015-09-25 10:01:14.133 Case Resolved Sprinkler system was adjusted.,Equipment Repair,Parks & Recreation Department,Park Maintenance & Safety,Equipment Repair,PARK_Maintenance_Trades,PARK,,,120 Hooker St  Allston  MA  02134,11.0,04,9.0,D14,Allston,15.0,22,2201.0,E,120 Hooker St,2134.0,Address,341995.0,42.3594,-71.0587,Constituent Call,"(0, 0)"
618078,101001541508,08/26/2015 07:41:00 PM,09/03/2015 08:30:00 AM,09/08/2015 11:25:07 AM,OVERDUE,Closed,Case Closed. Closed date : 2015-09-08 11:25:07.45 Case Resolved done 9-3-15,Equipment Repair,Parks & Recreation Department,Park Maintenance & Safety,Equipment Repair,PARK_Maintenance_Trades,PARK,,,135 Humboldt Ave  Dorchester  MA  02121,9.0,10B,7.0,B2,Roxbury,13.0,12,1202.0,E,135 Humboldt Ave,2121.0,Address,157886.0,42.3157,-71.0878,Constituent Call,"(42.3157, -71.0878)"
618117,101001541555,08/26/2015 09:24:00 PM,09/03/2015 08:30:00 AM,08/31/2015 02:14:17 PM,ONTIME,Closed,Case Closed. Closed date : 2015-08-31 14:14:17.41 Case Resolved,Equipment Repair,Parks & Recreation Department,Park Maintenance & Safety,Equipment Repair,PARK_Maintenance_Trades,PARK,https://mayors24.cityofboston.gov/media/boston/report/photos/55de66cf0485668337248585/report.jpg,,210 W Third St  South Boston  MA  02127,6.0,05,2.0,C6,South Boston,5.0,6,603.0,E,210 W Third St,2127.0,Address,341625.0,42.3393,-71.0491,Citizens Connect App,"(42.3393, -71.0491)"
618165,101001541610,08/27/2015 06:40:00 AM,09/03/2015 08:30:00 AM,08/27/2015 10:18:42 AM,ONTIME,Closed,Case Closed. Closed date : 2015-08-27 10:18:42.397 Case Noted Contractor needs to put signs up. Fencing should be removed before the weekend.,Equipment Repair,Parks & Recreation Department,Park Maintenance & Safety,Equipment Repair,PARK_Maintenance_Trades,PARK,https://mayors24.cityofboston.gov/media/boston/report/photos/55dee92f048566833724879c/photo_20150827_063801.jpg,,540 Adams St  Dorchester  MA  02122,8.0,07,3.0,C11,Dorchester,7.0,16,1607.0,,540 Adams St,2122.0,Address,342475.0,42.3594,-71.0587,Citizens Connect App,"(0, 0)"
618253,101001541732,08/27/2015 08:30:00 AM,09/03/2015 08:30:47 AM,09/25/2015 10:01:46 AM,OVERDUE,Closed,Case Closed. Closed date : 2015-09-25 10:01:46.017 Case Resolved Sprinkler system was repaired.,Equipment Repair,Parks & Recreation Department,Park Maintenance & Safety,Equipment Repair,PARK_Maintenance_Trades,PARK,https://mayors24.cityofboston.gov/media/boston/report/photos/55df030304856683372489a2/report.jpg,,120 Hooker St  Allston  MA  02134,11.0,04,9.0,D14,Allston,15.0,22,2201.0,E,120 Hooker St,2134.0,Address,341995.0,42.3594,-71.0587,Citizens Connect App,"(0, 0)"
618398,101001541922,08/27/2015 10:37:00 AM,09/03/2015 10:37:27 AM,09/15/2015 10:24:32 AM,OVERDUE,Closed,Case Closed. Closed date : 2015-09-15 10:24:32.223 Case Resolved done 9-14-15,Equipment Repair,Parks & Recreation Department,Park Maintenance & Safety,Equipment Repair,PARK_Maintenance_Trades,PARK,,,,,,,,,,,,,,,,,42.3594,-71.0587,Employee Generated,"(0, 0)"
618503,101001542073,08/27/2015 12:17:13 PM,09/03/2015 12:17:13 PM,08/27/2015 01:21:00 PM,ONTIME,Closed,Case Closed. Closed date : 2015-08-27 13:21:00.137 Case Resolved,Equipment Repair,Parks & Recreation Department,Park Maintenance & Safety,Equipment Repair,PARK_Maintenance_Trades,PARK,,,110 Atlantic Ave  Boston  MA  02110,3.0,1B,1.0,A1,Boston,3.0,3,301.0,,110 Atlantic Ave,2110.0,Address,161702.0,42.361,-71.0522,Citizens Connect App,"(42.361, -71.0522)"
618505,101001542077,08/27/2015 12:19:00 PM,09/03/2015 12:20:01 PM,08/31/2015 02:51:11 PM,ONTIME,Closed,Case Closed. Closed date : 2015-08-31 14:51:11.15 Case Resolved,Equipment Repair,Parks & Recreation Department,Park Maintenance & Safety,Equipment Repair,PARK_Maintenance_Trades,PARK,,,1005 Columbia Rd  South Boston  MA  02127,6.0,05,2.0,C6,South Boston,5.0,7,707.0,,1005 Columbia Rd,2127.0,Address,163529.0,42.3272,-71.0504,Employee Generated,"(42.3272, -71.0504)"
618524,101001542098,08/27/2015 12:34:00 PM,09/03/2015 12:34:44 PM,08/27/2015 01:22:08 PM,ONTIME,Closed,Case Closed. Closed date : 2015-08-27 13:22:08.36 Case Noted This info was sent to the golf course.,Equipment Repair,Parks & Recreation Department,Park Maintenance & Safety,Equipment Repair,PARK_Maintenance_Trades,PARK,,,420 West St  Hyde Park  MA  02136,12.0,06,5.0,E18,Roslindale,10.0,18,1812.0,E,420 West St,2136.0,Address,147986.0,42.2684,-71.1329,Employee Generated,"(42.2684, -71.1329)"
618527,101001542105,08/27/2015 12:37:00 PM,09/03/2015 12:37:45 PM,09/08/2015 10:33:01 AM,OVERDUE,Closed,Case Closed. Closed date : 2015-09-08 10:33:01.133 Case Resolved dpne 8-31-15,Equipment Repair,Parks & Recreation Department,Park Maintenance & Safety,Equipment Repair,PARK_Maintenance_Trades,PARK,,,560 Boylston St  Boston  MA  02116,4.0,1C,2.0,D4,Boston,6.0,04,402.0,,560 Boylston St,2116.0,Address,342031.0,42.3594,-71.0587,Employee Generated,"(0, 0)"
618529,101001542114,08/27/2015 12:41:00 PM,09/03/2015 12:41:57 PM,10/21/2015 03:15:55 PM,OVERDUE,Closed,Case Closed. Closed date : 2015-10-21 15:15:55.203 Case Resolved done,Equipment Repair,Parks & Recreation Department,Park Maintenance & Safety,Equipment Repair,PARK_Maintenance_Trades,PARK,,,560 Boylston St  Boston  MA  02116,4.0,1C,2.0,D4,Boston,6.0,04,402.0,,560 Boylston St,2116.0,Address,342031.0,42.3594,-71.0587,Employee Generated,"(0, 0)"
618531,101001542118,08/27/2015 12:44:00 PM,09/03/2015 12:44:10 PM,08/31/2015 01:49:42 PM,ONTIME,Closed,Case Closed. Closed date : 2015-08-31 13:49:42.957 Case Resolved done 8-28-15,Equipment Repair,Parks & Recreation Department,Park Maintenance & Safety,Equipment Repair,PARK_Maintenance_Trades,PARK,,,,,,,,,,,,,,,,,42.3594,-71.0587,Employee Generated,"(0, 0)"
618533,101001542119,08/27/2015 12:44:00 PM,09/03/2015 12:45:03 PM,09/25/2015 10:02:27 AM,OVERDUE,Closed,Case Closed. Closed date : 2015-09-25 10:02:27.35 Case Resolved Sculptures were powerwashed.,Equipment Repair,Parks & Recreation Department,Park Maintenance & Safety,Equipment Repair,PARK_Maintenance_Trades,PARK,,,560 Boylston St  Boston  MA  02116,4.0,1C,2.0,D4,Boston,6.0,04,402.0,,560 Boylston St,2116.0,Address,342031.0,42.3594,-71.0587,Employee Generated,"(0, 0)"
618572,101001542174,08/27/2015 01:33:00 PM,09/03/2015 01:33:43 PM,09/08/2015 10:14:44 AM,OVERDUE,Closed,Case Closed. Closed date : 2015-09-08 10:14:44.77 Case Resolved done 9-1-15,Equipment Repair,Parks & Recreation Department,Park Maintenance & Safety,Equipment Repair,PARK_Maintenance_Trades,PARK,https://mayors24.cityofboston.gov/media/boston/report/photos/55df4a050485668337248f49/report.jpg,,180R Pond St  Jamaica Plain  MA  02130,9.0,02,6.0,E13,Jamaica Plain,11.0,19,1909.0,,180R Pond St,2130.0,Address,344297.0,42.3128,-71.121,Citizens Connect App,"(42.3128, -71.121)"
618574,101001542176,08/27/2015 01:34:00 PM,09/03/2015 01:34:50 PM,08/27/2015 01:37:16 PM,ONTIME,Closed,Case Closed. Closed date : 2015-08-27 13:37:16.287 Case Resolved,Equipment Repair,Parks & Recreation Department,Park Maintenance & Safety,Equipment Repair,PARK_Maintenance_Trades,PARK,,,,,,,,,,,,,,,,,42.3594,-71.0587,Employee Generated,"(0, 0)"
618593,101001542199,08/27/2015 01:47:00 PM,09/03/2015 01:47:22 PM,09/25/2015 10:03:02 AM,OVERDUE,Closed,Case Closed. Closed date : 2015-09-25 10:03:02.11 Case Resolved Graffiti was removed.,Equipment Repair,Parks & Recreation Department,Park Maintenance & Safety,Equipment Repair,PARK_Maintenance_Trades,PARK,,,,,,,,,,,,,,,,,42.3594,-71.0587,Employee Generated,"(0, 0)"
618813,101001542498,08/27/2015 05:57:00 PM,09/04/2015 08:30:00 AM,09/15/2015 10:22:59 AM,OVERDUE,Closed,Case Closed. Closed date : 2015-09-15 10:22:59.637 Case Noted trades reports graffiti will not come off needs paint  8-28-15,Equipment Repair,Parks & Recreation Department,Park Maintenance & Safety,Equipment Repair,PARK_Maintenance_Trades,PARK,https://mayors24.cityofboston.gov/media/boston/report/photos/55df87db048566833724934a/report.jpg,,210 W Third St  South Boston  MA  02127,6.0,05,2.0,C6,South Boston,5.0,6,603.0,E,210 W Third St,2127.0,Address,341625.0,42.3393,-71.0491,Citizens Connect App,"(42.3393, -71.0491)"
618989,101001542731,08/28/2015 07:54:00 AM,09/04/2015 08:30:00 AM,08/28/2015 08:01:52 AM,ONTIME,Closed,Case Closed. Closed date : 2015-08-28 08:01:52.157 Case Noted New sign will be installed today.,Equipment Repair,Parks & Recreation Department,Park Maintenance & Safety,Equipment Repair,PARK_Maintenance_Trades,PARK,,,39 Saint James St  Roxbury  MA  02119,7.0,10B,7.0,B2,Roxbury,13.0,12,1201.0,,39 Saint James St,2119.0,Address,342654.0,42.3594,-71.0587,Employee Generated,"(0, 0)"
619018,101001542768,08/28/2015 08:17:00 AM,09/04/2015 08:30:00 AM,08/28/2015 11:37:49 AM,ONTIME,Closed,Case Closed. Closed date : 2015-08-28 11:37:49.42 Case Resolved Area was cleaned by Brighton Crew.,Ground Maintenance: Ringer Playground  Ringer Playground,Parks & Recreation Department,Park Maintenance & Safety,Equipment Repair,PARK_Maintenance_Region 4,PARK,,,85 Allston St  Allston  MA  02134,11.0,04,9.0,D14,Allston,15.0,21,2106.0,,85 Allston St,2134.0,Address,342014.0,42.3594,-71.0587,Citizens Connect App,"(0, 0)"
619020,101001542774,08/28/2015 08:19:00 AM,09/04/2015 08:30:00 AM,10/09/2015 11:02:42 AM,OVERDUE,Closed,Case Closed. Closed date : 2015-10-09 11:02:42.063 Case Resolved done 10-1-15,Equipment Repair,Parks & Recreation Department,Park Maintenance & Safety,Equipment Repair,PARK_Maintenance_Trades,PARK,,,25 Penniman Rd  Allston  MA  02134,11.0,04,9.0,D14,Allston,15.0,22,2202.0,,25 Penniman Rd,2134.0,Address,342570.0,42.3594,-71.0587,Citizens Connect App,"(0, 0)"
619024,101001542778,08/28/2015 08:22:00 AM,10/16/2015 09:53:00 AM,10/27/2015 03:02:52 PM,OVERDUE,Closed,Case Closed. Closed date : 2015-10-27 15:02:52.443 Case Resolved repairs complete,Equipment Repair,Parks & Recreation Department,Park Maintenance & Safety,Equipment Repair,PARK_Park Improvement Requests,PARK,,,85 Allston St  Allston  MA  02134,11.0,04,9.0,D14,Allston,15.0,21,2106.0,,85 Allston St,2134.0,Address,342014.0,42.3594,-71.0587,Citizens Connect App,"(0, 0)"
619146,101001542952,08/28/2015 10:07:00 AM,09/04/2015 10:07:47 AM,09/08/2015 11:28:22 AM,OVERDUE,Closed,Case Closed. Closed date : 2015-09-08 11:28:22.64 Case Resolved done 9-3-15,Equipment Repair,Parks & Recreation Department,Park Maintenance & Safety,Equipment Repair,PARK_Maintenance_Trades,PARK,https://mayors24.cityofboston.gov/media/boston/report/photos/55e06b410485668337249df0/report.jpg,,27 Elmhurst St  Dorchester  MA  02124,8.0,07,4.0,B3,Dorchester,9.0,17,1705.0,E,27 Elmhurst St,2124.0,Address,53327.0,42.2893,-71.0764,Citizens Connect App,"(42.2893, -71.0764)"
619257,101001543092,08/28/2015 11:27:00 AM,09/04/2015 11:27:50 AM,10/22/2015 03:35:30 PM,OVERDUE,Closed,Case Closed. Closed date : 2015-10-22 15:35:30.16 Case Noted trades reports waiting on shipment of parts,Equipment Repair,Parks & Recreation Department,Park Maintenance & Safety,Equipment Repair,PARK_Maintenance_Trades,PARK,https://mayors24.cityofboston.gov/media/boston/report/photos/55e07e080485668337249fd4/report.jpg,,6 Edgerly Rd  Boston  MA  02115,4.0,10A,7.0,D4,Boston,14.0,4,405.0,,6 Edgerly Rd,2115.0,Address,342115.0,42.3594,-71.0587,Citizens Connect App,"(0, 0)"
619293,101001543145,08/28/2015 12:05:54 PM,09/04/2015 12:05:54 PM,08/28/2015 12:19:31 PM,ONTIME,Closed,Case Closed. Closed date : 2015-08-28 12:19:31.79 Case Noted There is no Boston Park Dept. facility at this location.,Equipment Repair,Parks & Recreation Department,Park Maintenance & Safety,Equipment Repair,PARK_Maintenance_Trades,PARK,https://mayors24.cityofboston.gov/media/boston/report/photos/55e086f3048566833724a067/report.jpg,,20 Beecher St  Jamaica Plain  MA  02130,9.0,02,6.0,E13,Jamaica Plain,11.0,19,1901.0,E,20 Beecher St,2130.0,Address,341538.0,42.3182,-71.1069,Citizens Connect App,"(42.3182, -71.1069)"
619812,101001543809,08/29/2015 12:16:00 PM,09/08/2015 08:30:00 AM,09/22/2015 10:00:36 AM,OVERDUE,Closed,Case Closed. Closed date : 2015-09-22 10:00:36.597 Case Resolved done 9-16-15,Equipment Repair,Parks & Recreation Department,Park Maintenance & Safety,Equipment Repair,PARK_Maintenance_Trades,PARK,https://mayors24.cityofboston.gov/media/boston/report/photos/55e1daf8048566833724afdf/report.jpg,,INTERSECTION of Chestnut St & Perkins St  Jamaica Plain  MA,9.0,02,6.0,E13,Jamaica Plain,11.0,Ward 19,1903.0,,INTERSECTION Chestnut St & Perkins St,,Intersection,2942.0,42.3214,-71.1196,Citizens Connect App,"(42.3214, -71.1196)"
619875,101001543886,08/29/2015 02:38:00 PM,09/08/2015 08:30:00 AM,09/24/2015 02:38:56 PM,OVERDUE,Closed,Case Closed. Closed date : 2015-09-24 14:38:56.167 Case Resolved done,Equipment Repair,Parks & Recreation Department,Park Maintenance & Safety,Equipment Repair,PARK_Maintenance_Trades,PARK,https://mayors24.cityofboston.gov/media/boston/report/photos/55e1fc45048566833724b1e0/report.jpg,,765  Saratoga St  East Boston  MA  02128,1.0,09,1.0,A7,East Boston,1.0,1,111.0,,765  Saratoga St,2128.0,Address,342038.0,42.3594,-71.0587,Citizens Connect App,"(0, 0)"
619903,101001543924,08/29/2015 03:51:00 PM,09/08/2015 08:30:00 AM,10/22/2015 02:16:34 PM,OVERDUE,Closed,Case Closed. Closed date : 2015-10-22 14:16:34.507 Case Noted trades reports bench repairs is a capital project which will be done at a later time when funding  permits,Equipment Repair,Parks & Recreation Department,Park Maintenance & Safety,Equipment Repair,PARK_Maintenance_Trades,PARK,https://mayors24.cityofboston.gov/media/boston/report/photos/55e20d72048566833724b2ce/report.jpg,,6 Edgerly Rd  Boston  MA  02115,4.0,10A,7.0,D4,Boston,14.0,4,405.0,,6 Edgerly Rd,2115.0,Address,342115.0,42.3594,-71.0587,Citizens Connect App,"(0, 0)"
620023,101001544161,08/30/2015 09:03:00 AM,09/08/2015 08:30:00 AM,09/25/2015 10:04:09 AM,OVERDUE,Closed,Case Closed. Closed date : 2015-09-25 10:04:09.607 Case Resolved Graffiti was removed.,Equipment Repair,Parks & Recreation Department,Park Maintenance & Safety,Equipment Repair,PARK_Maintenance_Trades,PARK,https://mayors24.cityofboston.gov/media/boston/report/photos/55e2ff40048566833724bd5c/report.jpg,,260 West St  Hyde Park  MA  02136,12.0,08,5.0,E18,Hyde Park,10.0,18,1812.0,,260 West St,2136.0,Address,342456.0,42.3594,-71.0587,Citizens Connect App,"(0, 0)"
620061,101001544226,08/30/2015 10:48:00 AM,09/08/2015 08:30:00 AM,09/25/2015 10:05:06 AM,OVERDUE,Closed,Case Closed. Closed date : 2015-09-25 10:05:06.403 Case Resolved Fountain was unclogged.,Equipment Repair,Parks & Recreation Department,Park Maintenance & Safety,Equipment Repair,PARK_Maintenance_Trades,PARK,https://mayors24.cityofboston.gov/media/boston/report/photos/55e317d6048566833724bf26/report.jpg,,210 W Third St  South Boston  MA  02127,6.0,05,2.0,C6,South Boston,5.0,6,603.0,E,210 W Third St,2127.0,Address,341625.0,42.3393,-71.0491,Citizens Connect App,"(42.3393, -71.0491)"
620084,101001544273,08/30/2015 12:22:00 PM,09/08/2015 08:30:00 AM,10/21/2015 03:27:59 PM,OVERDUE,Closed,Case Closed. Closed date : 2015-10-21 15:27:59.693 Case Noted waiting on parts,Equipment Repair,Parks & Recreation Department,Park Maintenance & Safety,Equipment Repair,PARK_Maintenance_Trades,PARK,https://mayors24.cityofboston.gov/media/boston/report/photos/55e32dcd048566833724c0b5/report.jpg,,45 Lambert Ave  Roxbury  MA  02119,7.0,10B,7.0,B2,Roxbury,13.0,9,905.0,,45 Lambert Ave,2119.0,Address,342504.0,42.3594,-71.0587,Citizens Connect App,"(0, 0)"
620136,101001544349,08/30/2015 02:21:00 PM,09/08/2015 08:30:00 AM,09/17/2015 12:35:38 PM,OVERDUE,Closed,Case Closed. Closed date : 2015-09-17 12:35:38.25 Case Resolved light pole is secure,,Parks & Recreation Department,Park Maintenance & Safety,Equipment Repair,PARK_Maintenance_Lighting Electrical,PARK,https://mayors24.cityofboston.gov/media/boston/report/photos/55e349d2048566833724c2b1/photo_20150830_142133.jpg,,1005 Columbia Rd  South Boston  MA  02127,6.0,05,2.0,C6,South Boston,5.0,7,707.0,,1005 Columbia Rd,2127.0,Address,163529.0,42.3272,-71.0504,Citizens Connect App,"(42.3272, -71.0504)"
620138,101001544352,08/30/2015 02:22:00 PM,09/08/2015 08:30:00 AM,09/25/2015 10:05:43 AM,OVERDUE,Closed,Case Closed. Closed date : 2015-09-25 10:05:43.987 Case Resolved New flag was installed.,Equipment Repair,Parks & Recreation Department,Park Maintenance & Safety,Equipment Repair,PARK_Maintenance_Trades,PARK,https://mayors24.cityofboston.gov/media/boston/report/photos/55e34a15048566833724c2bc/photo_20150830_142246.jpg,,1005 Columbia Rd  South Boston  MA  02127,6.0,05,2.0,C6,South Boston,5.0,7,707.0,,1005 Columbia Rd,2127.0,Address,163529.0,42.3272,-71.0504,Citizens Connect App,"(42.3272, -71.0504)"
620139,101001544353,08/30/2015 02:25:00 PM,09/08/2015 08:30:00 AM,10/21/2015 03:17:52 PM,OVERDUE,Closed,Case Closed. Closed date : 2015-10-21 15:17:52.89 Case Resolved,Equipment Repair,Parks & Recreation Department,Park Maintenance & Safety,Equipment Repair,PARK_Maintenance_Trades,PARK,https://mayors24.cityofboston.gov/media/boston/report/photos/55e34a97048566833724c2c7/photo_20150830_142519.jpg,,1005 Columbia Rd  South Boston  MA  02127,6.0,05,2.0,C6,South Boston,5.0,7,707.0,,1005 Columbia Rd,2127.0,Address,163529.0,42.3272,-71.0504,Citizens Connect App,"(42.3272, -71.0504)"
620151,101001544376,08/30/2015 02:58:00 PM,09/08/2015 08:30:00 AM,09/10/2015 01:50:49 AM,OVERDUE,Closed,Case Closed. Closed date : 2015-09-10 01:50:49.077 Case Resolved this is not Byrne Park  and this one also belongs to the DCR.,Ground Maintenance: Byrne Playground  Byrne Playground,Parks & Recreation Department,Park Maintenance & Safety,Equipment Repair,PARK_Maintenance_Region 2,PARK,https://mayors24.cityofboston.gov/media/boston/report/photos/55e35260048566833724c334/report.jpg,,23 Everett St  Dorchester  MA  02122,7.0,07,3.0,C11,Dorchester,7.0,16,1602.0,E,23 Everett St,2122.0,Address,341627.0,42.3008,-71.0524,Citizens Connect App,"(42.3008, -71.0524)"
620157,101001544384,08/30/2015 03:19:00 PM,09/08/2015 08:30:00 AM,,OVERDUE,Open,,Equipment Repair,Parks & Recreation Department,Park Maintenance & Safety,Equipment Repair,INFO01_GenericeFormforOtherServiceRequestTypes,INFO,https://mayors24.cityofboston.gov/media/boston/report/photos/55e3576d048566833724c390/1440961751713.jpg,,23 Everett St  Dorchester  MA  02122,7.0,07,3.0,C11,Dorchester,7.0,16,1602.0,E,23 Everett St,2122.0,Address,341627.0,42.3008,-71.0524,Citizens Connect App,"(42.3008, -71.0524)"
620166,101001544399,08/30/2015 03:57:00 PM,09/08/2015 08:30:00 AM,,OVERDUE,Open,,Equipment Repair,Parks & Recreation Department,Park Maintenance & Safety,Equipment Repair,INFO01_GenericeFormforOtherServiceRequestTypes,INFO,,,75 Turtle Pond Pkwy  Hyde Park  MA  02136,12.0,08,5.0,E18,Hyde Park,10.0,Ward 18,1819.0,R1,75 Turtle Pond Pkwy,2136.0,Address,157050.0,42.2486,-71.139,Constituent Call,"(42.2486, -71.139)"
620167,101001544401,08/30/2015 04:01:00 PM,09/08/2015 08:30:00 AM,10/13/2015 06:10:38 PM,OVERDUE,Closed,Case Closed. Closed date : 2015-10-13 18:10:38.543 Case Resolved Completed,Ground Maintenance: --Not in list--  Walnut Park Play Area,Parks & Recreation Department,Park Maintenance & Safety,Equipment Repair,PARK_Maintenance_Region 5,PARK,,,345 Walnut Ave  Roxbury  MA  02119,9.0,10B,7.0,E13,Roxbury,13.0,11,1103.0,,345 Walnut Ave,2119.0,Address,342534.0,42.3594,-71.0587,Citizens Connect App,"(0, 0)"
620168,101001544400,08/30/2015 04:01:00 PM,09/08/2015 08:30:00 AM,10/09/2015 01:43:11 PM,OVERDUE,Closed,Case Closed. Closed date : 2015-10-09 13:43:11.17 Case Resolved water off for season,Equipment Repair,Parks & Recreation Department,Park Maintenance & Safety,Equipment Repair,PARK_Maintenance_Trades,PARK,,,345 Walnut Ave  Roxbury  MA  02119,9.0,10B,7.0,E13,Roxbury,13.0,11,1103.0,,345 Walnut Ave,2119.0,Address,342534.0,42.3594,-71.0587,Citizens Connect App,"(0, 0)"
620182,101001544430,08/30/2015 04:51:00 PM,09/08/2015 08:30:00 AM,09/25/2015 10:06:29 AM,OVERDUE,Closed,Case Closed. Closed date : 2015-09-25 10:06:29.387 Case Resolved Graffiti was removed.,Equipment Repair,Parks & Recreation Department,Park Maintenance & Safety,Equipment Repair,PARK_Maintenance_Trades,PARK,https://mayors24.cityofboston.gov/media/boston/report/photos/55e36ce9048566833724c552/report.jpg,,230 Shawmut Ave  Roxbury  MA  02118,4.0,1C,2.0,D4,Roxbury,4.0,3,307.0,,230 Shawmut Ave,2118.0,Address,342571.0,42.3594,-71.0587,Citizens Connect App,"(0, 0)"
620185,101001544433,08/30/2015 04:55:00 PM,09/08/2015 08:30:00 AM,10/15/2015 07:55:45 AM,OVERDUE,Closed,Case Closed. Closed date : 2015-10-15 07:55:45.357 Case Noted The Community had a meeting with former Parks Commissioner Antonia Pollak and requested the Parks Dept. not to install another basketball net and rim.,Equipment Repair,Parks & Recreation Department,Park Maintenance & Safety,Equipment Repair,PARK_Maintenance_Trades,PARK,,,40 Downer Ave  Dorchester  MA  02125,7.0,03,3.0,C11,Dorchester,7.0,13,1306.0,,40 Downer Ave,2125.0,Address,342086.0,42.3594,-71.0587,Constituent Call,"(0, 0)"
620213,101001544474,08/30/2015 06:13:00 PM,09/08/2015 08:30:00 AM,10/09/2015 10:47:14 AM,OVERDUE,Closed,Case Closed. Closed date : 2015-10-09 10:47:14.74 Case Resolved remove graffiti,Equipment Repair,Parks & Recreation Department,Park Maintenance & Safety,Equipment Repair,PARK_Maintenance_Trades,PARK,https://mayors24.cityofboston.gov/media/boston/report/photos/55e3803e048566833724c6bb/photo_20150830_181304.jpg,,6 Edgerly Rd  Boston  MA  02115,4.0,10A,7.0,D4,Boston,14.0,4,405.0,,6 Edgerly Rd,2115.0,Address,342115.0,42.3594,-71.0587,Citizens Connect App,"(0, 0)"
620214,101001544478,08/30/2015 06:18:00 PM,09/08/2015 08:30:00 AM,09/25/2015 10:07:29 AM,OVERDUE,Closed,Case Closed. Closed date : 2015-09-25 10:07:29.163 Case Noted Water was turned off for the season.,Equipment Repair,Parks & Recreation Department,Park Maintenance & Safety,Equipment Repair,PARK_Maintenance_Trades,PARK,https://mayors24.cityofboston.gov/media/boston/report/photos/55e38158048566833724c6e7/report.jpg,,92 Mount Ida Rd  Dorchester  MA  02122,7.0,03,3.0,C11,Dorchester,8.0,15,1509.0,,92 Mount Ida Rd,2122.0,Address,342620.0,42.3594,-71.0587,Citizens Connect App,"(0, 0)"
620255,101001544546,08/30/2015 08:51:00 PM,09/08/2015 08:30:00 AM,09/25/2015 10:08:11 AM,OVERDUE,Closed,Case Closed. Closed date : 2015-09-25 10:08:11.207 Case Resolved Splash pad was repaired.,Equipment Repair,Parks & Recreation Department,Park Maintenance & Safety,Equipment Repair,PARK_Maintenance_Trades,PARK,,,380  Faneuil St  Brighton  MA  02135,11.0,04,9.0,D14,Brighton,15.0,22,2207.0,,380  Faneuil St,2135.0,Address,342467.0,42.3594,-71.0587,Citizens Connect App,"(0, 0)"
620276,101001544574,08/30/2015 10:06:00 PM,09/08/2015 08:30:00 AM,09/10/2015 01:44:34 AM,OVERDUE,Closed,Case Closed. Closed date : 2015-09-10 01:44:34.143 Case Noted no HP at 650 HP at 659 all clear,Equipment Repair,Parks & Recreation Department,Park Maintenance & Safety,Equipment Repair,BTDT_Parking Enforcement,BTDT,https://mayors24.cityofboston.gov/media/boston/report/photos/55e3b6c5048566833724ca88/report.jpg,,650 E Fifth St  South Boston  MA  02127,6.0,05,2.0,C6,South Boston,5.0,6,606.0,,650 E Fifth St,2127.0,Address,342667.0,42.3594,-71.0587,Citizens Connect App,"(0, 0)"
620383,101001544740,08/31/2015 08:34:00 AM,09/08/2015 08:34:17 AM,09/25/2015 10:09:53 AM,OVERDUE,Closed,Case Closed. Closed date : 2015-09-25 10:09:53.203 Case Resolved Dog fountain was repaired.,Equipment Repair,Parks & Recreation Department,Park Maintenance & Safety,Equipment Repair,PARK_Maintenance_Trades,PARK,https://mayors24.cityofboston.gov/media/boston/report/photos/55e449e3048566833724d032/report.jpg,,18 Bradford St  Roxbury  MA  02118,4.0,1C,2.0,D4,Roxbury,4.0,3,307.0,E,18 Bradford St,2118.0,Address,341623.0,42.3427,-71.069,Citizens Connect App,"(42.3427, -71.069)"
620482,101001544869,08/31/2015 09:17:00 AM,09/08/2015 09:17:44 AM,09/28/2015 09:02:23 AM,OVERDUE,Closed,Case Closed. Closed date : 2015-09-28 09:02:23.49 Case Resolved Water fountains were repaired.,Equipment Repair,Parks & Recreation Department,Park Maintenance & Safety,Equipment Repair,PARK_Maintenance_Trades,PARK,,,507 Jamaicaway  Jamaica Plain  MA  02130,9.0,02,6.0,E13,Jamaica Plain,11.0,19,1903.0,E,507 Jamaicaway,2130.0,Address,341649.0,42.3594,-71.0587,Constituent Call,"(0, 0)"
620620,101001545054,08/31/2015 11:13:00 AM,09/08/2015 11:13:56 AM,09/11/2015 11:40:47 AM,OVERDUE,Closed,Case Closed. Closed date : 2015-09-11 11:40:47.03 Case Resolved done,Equipment Repair,Parks & Recreation Department,Park Maintenance & Safety,Equipment Repair,PARK_Maintenance_Trades,PARK,,,,,,,,,,,,,,,,,42.3594,-71.0587,Employee Generated,"(0, 0)"
620776,101001545263,08/31/2015 01:28:00 PM,09/08/2015 01:28:55 PM,09/22/2015 10:15:28 AM,OVERDUE,Closed,Case Closed. Closed date : 2015-09-22 10:15:28.113 Case Resolved,Equipment Repair,Parks & Recreation Department,Park Maintenance & Safety,Equipment Repair,PARK_Maintenance_Trades,PARK,,,105 Ceylon St  Dorchester  MA  02121,7.0,03,4.0,B2,Dorchester,13.0,14,1401.0,,105 Ceylon St,2121.0,Address,342021.0,42.3594,-71.0587,Employee Generated,"(0, 0)"
620795,101001545289,08/31/2015 01:41:00 PM,09/08/2015 01:42:03 PM,09/02/2015 12:12:34 PM,ONTIME,Closed,Case Closed. Closed date : 2015-09-02 12:12:34.79 Case Resolved done 9-1-15,Equipment Repair,Parks & Recreation Department,Park Maintenance & Safety,Equipment Repair,PARK_Maintenance_Trades,PARK,,,1917 Washington St  Roxbury  MA  02118,4.0,10B,7.0,D4,Roxbury,13.0,09,903.0,CM,1917 Washington St,2118.0,Address,171084.0,42.3338,-71.0808,Employee Generated,"(42.3338, -71.0808)"
620799,101001545294,08/31/2015 01:46:00 PM,09/08/2015 01:46:25 PM,09/25/2015 10:11:02 AM,OVERDUE,Closed,Case Closed. Closed date : 2015-09-25 10:11:02.13 Case Resolved Graffiti removed from barrels.,Equipment Repair,Parks & Recreation Department,Park Maintenance & Safety,Equipment Repair,PARK_Maintenance_Trades,PARK,https://mayors24.cityofboston.gov/media/boston/report/photos/55e4930d048566833724d766/report.jpg,,6 Edgerly Rd  Boston  MA  02115,4.0,10A,7.0,D4,Boston,14.0,4,405.0,,6 Edgerly Rd,2115.0,Address,342115.0,42.3594,-71.0587,Citizens Connect App,"(0, 0)"
620983,101001545567,08/31/2015 04:47:00 PM,09/08/2015 04:47:36 PM,09/15/2015 11:21:14 AM,OVERDUE,Closed,Case Closed. Closed date : 2015-09-15 11:21:14.7 Case Noted plumbers report water fountain needs new button,Equipment Repair,Parks & Recreation Department,Park Maintenance & Safety,Equipment Repair,PARK_Maintenance_Trades,PARK,https://mayors24.cityofboston.gov/media/boston/report/photos/55e4bd81048566833724db4b/photo_20150831_164744.jpg,,80 Union St  Brighton  MA  02135,11.0,04,9.0,D14,Brighton,15.0,21,2111.0,,80 Union St,2135.0,Address,342498.0,42.3594,-71.0587,Citizens Connect App,"(0, 0)"
621073,101001545698,08/31/2015 06:42:00 PM,09/09/2015 08:30:00 AM,10/09/2015 10:51:30 AM,OVERDUE,Closed,Case Closed. Closed date : 2015-10-09 10:51:30.38 Case Resolved done 10-15-15,Equipment Repair,Parks & Recreation Department,Park Maintenance & Safety,Equipment Repair,PARK_Maintenance_Trades,PARK,https://mayors24.cityofboston.gov/media/boston/report/photos/55e4d854048566833724de34/report.jpg,,40 Downer Ave  Dorchester  MA  02125,7.0,03,3.0,C11,Dorchester,7.0,13,1306.0,,40 Downer Ave,2125.0,Address,342086.0,42.3594,-71.0587,Citizens Connect App,"(0, 0)"
621074,101001545699,08/31/2015 06:44:00 PM,09/09/2015 08:30:00 AM,09/15/2015 10:36:58 AM,OVERDUE,Closed,Case Closed. Closed date : 2015-09-15 10:36:58.177 Case Resolved done 9-9-15,Equipment Repair,Parks & Recreation Department,Park Maintenance & Safety,Equipment Repair,PARK_Maintenance_Trades,PARK,https://mayors24.cityofboston.gov/media/boston/report/photos/55e4d8e3048566833724de42/report.jpg,,40 Downer Ave  Dorchester  MA  02125,7.0,03,3.0,C11,Dorchester,7.0,13,1306.0,,40 Downer Ave,2125.0,Address,342086.0,42.3594,-71.0587,Citizens Connect App,"(0, 0)"
621085,101001545725,08/31/2015 07:16:00 PM,09/09/2015 08:30:00 AM,09/09/2015 01:15:57 PM,OVERDUE,Closed,Case Closed. Closed date : 2015-09-09 13:15:57.943 Case Resolved,Ground Maintenance: Forbes St. Playground  Forbes Street Playground,Parks & Recreation Department,Park Maintenance & Safety,Equipment Repair,PARK_Maintenance_Region 3,PARK,,,60 Forbes St  Jamaica Plain  MA  02130,9.0,02,6.0,E13,Jamaica Plain,11.0,10,1009.0,,60 Forbes St,2130.0,Address,342420.0,42.3594,-71.0587,Citizens Connect App,"(0, 0)"
621553,101001546438,09/01/2015 10:53:00 AM,09/09/2015 10:53:41 AM,01/11/2016 12:28:34 PM,OVERDUE,Closed,Case Closed. Closed date : 2016-01-11 12:28:34.857 Case Resolved,Equipment Repair,Parks & Recreation Department,Park Maintenance & Safety,Equipment Repair,PARK_Park Improvement Requests,PARK,,,143 Porter St  East Boston  MA  02128,1.0,09,1.0,A7,East Boston,1.0,01,105.0,,143 Porter St,2128.0,Address,344495.0,42.3594,-71.0587,Constituent Call,"(0, 0)"
621621,101001546546,09/01/2015 11:54:00 AM,09/09/2015 11:55:06 AM,09/08/2015 10:09:04 AM,ONTIME,Closed,Case Closed. Closed date : 2015-09-08 10:09:04.167 Case Resolved,Equipment Repair,Parks & Recreation Department,Park Maintenance & Safety,Equipment Repair,PARK_Maintenance_Trades,PARK,,,21P Charter St  Boston  MA  02113,3.0,1B,1.0,A1,Boston,3.0,3,301.0,,21P Charter St,2113.0,Address,344006.0,42.3594,-71.0587,Constituent Call,"(0, 0)"
621691,101001546635,09/01/2015 01:06:31 PM,09/09/2015 01:06:31 PM,09/03/2015 01:07:52 PM,ONTIME,Closed,Case Closed. Closed date : 2015-09-03 13:07:52.043 Case Resolved repair gate,Equipment Repair,Parks & Recreation Department,Park Maintenance & Safety,Equipment Repair,PARK_Maintenance_Trades,PARK,https://mayors24.cityofboston.gov/media/boston/report/photos/55e5db32048529bde61681ce/report.jpg,,115 Paris St  East Boston  MA  02128,1.0,09,1.0,A7,East Boston,1.0,1,104.0,,115 Paris St,2128.0,Address,340867.0,42.3721,-71.037,Citizens Connect App,"(42.3721, -71.037)"
621797,101001546784,09/01/2015 02:27:00 PM,09/09/2015 02:27:38 PM,09/09/2015 03:15:12 PM,OVERDUE,Closed,Case Closed. Closed date : 2015-09-09 15:15:12.847 Case Resolved All Parks & Rec. property has been cut and cleaned.,Ground Maintenance: Savin Hill Park  Savin Hill Park,Parks & Recreation Department,Park Maintenance & Safety,Equipment Repair,PARK_Maintenance_Region 2,PARK,,,25 Caspian Way  Dorchester  MA  02125,7.0,03,3.0,C11,Dorchester,7.0,13,1310.0,,25 Caspian Way,2125.0,Address,342632.0,42.3594,-71.0587,Citizens Connect App,"(0, 0)"
621896,101001546904,09/01/2015 03:36:00 PM,09/09/2015 03:36:11 PM,11/13/2015 12:42:29 PM,OVERDUE,Closed,Case Closed. Closed date : 2015-11-13 12:42:29.58 Case Resolved done 11-6-15,Equipment Repair,Parks & Recreation Department,Park Maintenance & Safety,Equipment Repair,PARK_Maintenance_Trades,PARK,,,INTERSECTION of Beacon St & Charles St  Boston  MA,3.0,1B,8.0,A1,Beacon Hill,14.0,Ward 5,503.0,,INTERSECTION Beacon St & Charles St,,Intersection,1106.0,42.3562,-71.0694,Constituent Call,"(42.3562, -71.0694)"
622025,101001547081,09/01/2015 05:49:00 PM,09/10/2015 08:30:00 AM,09/25/2015 12:01:31 PM,OVERDUE,Closed,Case Closed. Closed date : 2015-09-25 12:01:31.787 Case Resolved Swing was repaired.,Equipment Repair,Parks & Recreation Department,Park Maintenance & Safety,Equipment Repair,PARK_Maintenance_Trades,PARK,,,160 Norfolk Ave  Roxbury  MA  02119,7.0,03,7.0,B2,Roxbury,13.0,08,806.0,,160 Norfolk Ave,2119.0,Address,342027.0,42.3594,-71.0587,Constituent Call,"(0, 0)"
622036,101001547094,09/01/2015 06:03:00 PM,09/10/2015 08:30:00 AM,09/06/2015 01:20:02 AM,ONTIME,Closed,Case Closed. Closed date : 2015-09-06 01:20:02.32 Case Invalid The State House is operated by the State  not the City of Boston. Please call 617-725-4000 to report.,Equipment Repair,Parks & Recreation Department,Park Maintenance & Safety,Equipment Repair,INFO_Reallocation From Dept,INFO,,,139 Tremont St  Boston  MA  02108,3.0,1C,8.0,A1,Beacon Hill,14.0,05,503.0,E,139 Tremont St,2108.0,Address,341542.0,42.3554,-71.0638,Constituent Call,"(42.3554, -71.0638)"
622037,101001547096,09/01/2015 06:04:00 PM,09/10/2015 08:30:00 AM,09/25/2015 12:02:05 PM,OVERDUE,Closed,Case Closed. Closed date : 2015-09-25 12:02:05.83 Case Resolved Pipe was repaired.,Equipment Repair,Parks & Recreation Department,Park Maintenance & Safety,Equipment Repair,PARK_Maintenance_Trades,PARK,,,INTERSECTION of Beacon St & Park St  Boston  MA,3.0,1B,8.0,A1,Beacon Hill,14.0,Ward 5,503.0,,INTERSECTION Beacon St & Park St,,Intersection,1110.0,42.3577,-71.0632,Constituent Call,"(42.3577, -71.0632)"
622109,101001547188,09/01/2015 06:46:00 PM,09/10/2015 08:30:00 AM,,OVERDUE,Open,,Equipment Repair,Parks & Recreation Department,Park Maintenance & Safety,Equipment Repair,INFO01_GenericeFormforOtherServiceRequestTypes,INFO,,,INTERSECTION of Amory St & Boylston St  Jamaica Plain  MA,9.0,02,6.0,E13,Jamaica Plain,11.0,Ward 11,1106.0,,INTERSECTION Amory St & Boylston St,,Intersection,415.0,42.3166,-71.1031,Constituent Call,"(42.3166, -71.1031)"
622126,101001547213,09/01/2015 07:07:00 PM,09/10/2015 08:30:00 AM,,OVERDUE,Open,,Equipment Repair,Parks & Recreation Department,Park Maintenance & Safety,Equipment Repair,INFO01_GenericeFormforOtherServiceRequestTypes,INFO,https://mayors24.cityofboston.gov/media/boston/report/photos/55e62fb5048534c068d88328/photo_20150901_190720.jpg,,1880 William J Day Blvd  South Boston  MA  02127,6.0,05,2.0,C6,South Boston,5.0,06,609.0,,1880 William J Day Blvd,2127.0,Address,352016.0,42.3594,-71.0587,Citizens Connect App,"(0, 0)"
622521,101001547719,09/02/2015 10:48:00 AM,09/10/2015 10:48:54 AM,10/16/2015 06:26:37 AM,OVERDUE,Closed,Case Closed. Closed date : 2015-10-16 06:26:37.607 Case Resolved off for season,Equipment Repair,Parks & Recreation Department,Park Maintenance & Safety,Equipment Repair,PARK_Maintenance_Trades,PARK,,,56 Dunbar Ave  Dorchester  MA  02124,8.0,07,4.0,B3,Dorchester,9.0,17,1708.0,,56 Dunbar Ave,2124.0,Address,342601.0,42.3594,-71.0587,Constituent Call,"(0, 0)"
622524,101001547722,09/02/2015 10:50:00 AM,09/10/2015 10:50:55 AM,09/03/2015 01:05:06 PM,ONTIME,Closed,Case Closed. Closed date : 2015-09-03 13:05:06.88 Case Resolved wash down big belly,Equipment Repair,Parks & Recreation Department,Park Maintenance & Safety,Equipment Repair,PARK_Maintenance_Trades,PARK,,,55 Winthrop St  Charlestown  MA  02129,3.0,1A,1.0,A15,Charlestown,2.0,02,203.0,,55 Winthrop St,2129.0,Address,342691.0,42.3594,-71.0587,Employee Generated,"(0, 0)"
622578,101001547811,09/02/2015 10:56:00 AM,09/10/2015 10:56:16 AM,09/25/2015 12:03:13 PM,OVERDUE,Closed,Case Closed. Closed date : 2015-09-25 12:03:13.763 Case Resolved Dog park fountain was repaired.,Equipment Repair,Parks & Recreation Department,Park Maintenance & Safety,Equipment Repair,PARK_Maintenance_Trades,PARK,https://mayors24.cityofboston.gov/media/boston/report/photos/55e6e9db6963c98f05b5459b/report.jpg,,18 Bradford St  Roxbury  MA  02118,4.0,1C,2.0,D4,Roxbury,4.0,3,307.0,E,18 Bradford St,2118.0,Address,341623.0,42.3427,-71.069,Citizens Connect App,"(42.3427, -71.069)"
622587,101001547835,09/02/2015 10:57:00 AM,09/10/2015 10:57:23 AM,09/03/2015 01:01:19 PM,ONTIME,Closed,Case Closed. Closed date : 2015-09-03 13:01:19.197 Case Resolved wash down big belly,Equipment Repair,Parks & Recreation Department,Park Maintenance & Safety,Equipment Repair,PARK_Maintenance_Trades,PARK,,,110 Atlantic Ave  Boston  MA  02110,3.0,1B,1.0,A1,Boston,3.0,3,301.0,,110 Atlantic Ave,2110.0,Address,161702.0,42.361,-71.0522,Employee Generated,"(42.361, -71.0522)"
622590,101001547838,09/02/2015 10:57:00 AM,09/10/2015 10:57:37 AM,09/04/2015 09:13:13 AM,ONTIME,Closed,Case Closed. Closed date : 2015-09-04 09:13:13.753 Case Resolved grass removed from cracks in courts,Equipment Repair,Parks & Recreation Department,Park Maintenance & Safety,Equipment Repair,PARK_Maintenance_Region 1,PARK,,,125 Boylston St  Boston  MA  02108,3.0,1C,8.0,A1,Boston,14.0,5,503.0,,125 Boylston St,2108.0,Address,342020.0,42.3594,-71.0587,Citizens Connect App,"(0, 0)"
622642,101001547904,09/02/2015 11:13:00 AM,09/10/2015 11:13:11 AM,09/15/2015 10:38:43 AM,OVERDUE,Closed,Case Closed. Closed date : 2015-09-15 10:38:43.43 Case Resolved done 9-9-15,Equipment Repair,Parks & Recreation Department,Park Maintenance & Safety,Equipment Repair,PARK_Maintenance_Trades,PARK,,,50 Union St  Boston  MA  02108,3.0,1B,1.0,A1,Boston,3.0,3,306.0,,50 Union St,2108.0,Address,342040.0,42.3594,-71.0587,Employee Generated,"(0, 0)"
622662,101001547933,09/02/2015 11:26:00 AM,09/10/2015 11:26:33 AM,09/11/2015 02:17:18 PM,OVERDUE,Closed,Case Closed. Closed date : 2015-09-11 14:17:18.873 Case Resolved done 9-9-15,Equipment Repair,Parks & Recreation Department,Park Maintenance & Safety,Equipment Repair,PARK_Maintenance_Trades,PARK,,,1545 Dorchester Ave  Dorchester  MA  02124,8.0,07,3.0,C11,Dorchester,7.0,16,1601.0,,1545 Dorchester Ave,2124.0,Address,342065.0,42.3594,-71.0587,Employee Generated,"(0, 0)"
622770,101001548068,09/02/2015 12:52:00 PM,09/10/2015 12:52:40 PM,09/25/2015 12:03:51 PM,OVERDUE,Closed,Case Closed. Closed date : 2015-09-25 12:03:51.613 Case Resolved Drinking fountain was repaired.,Equipment Repair,Parks & Recreation Department,Park Maintenance & Safety,Equipment Repair,PARK_Maintenance_Trades,PARK,,,3 Brewer St  Jamaica Plain  MA  02130,9.0,02,6.0,E13,Jamaica Plain,11.0,Ward 19,1908.0,R2,3 Brewer St,2130.0,Address,19996.0,42.3119,-71.1159,Constituent Call,"(42.3119, -71.1159)"
622844,101001548170,09/02/2015 01:50:00 PM,09/10/2015 01:50:30 PM,10/28/2015 09:47:11 AM,OVERDUE,Closed,Case Closed. Closed date : 2015-10-28 09:47:11.3 Case Resolved done 10-23-15,Equipment Repair,Parks & Recreation Department,Park Maintenance & Safety,Equipment Repair,PARK_Maintenance_Trades,PARK,,,470 Adams St  Dorchester  MA  02122,8.0,07,3.0,C11,Dorchester,7.0,16,1605.0,E,470 Adams St,2122.0,Address,172405.0,42.2935,-71.0568,Employee Generated,"(42.2935, -71.0568)"
622883,101001548228,09/02/2015 02:36:00 PM,09/10/2015 02:36:42 PM,09/15/2015 11:18:39 AM,OVERDUE,Closed,Case Closed. Closed date : 2015-09-15 11:18:39.513 Case Resolved,Equipment Repair,Parks & Recreation Department,Park Maintenance & Safety,Equipment Repair,PARK_Maintenance_Trades,PARK,https://mayors24.cityofboston.gov/media/boston/report/photos/55e741d96963c98f05b54e5c/report.jpg,,74 Faneuil St  Brighton  MA  02135,11.0,04,9.0,D14,Brighton,15.0,22,2212.0,E,74 Faneuil St,2135.0,Address,56305.0,42.3548,-71.153,Citizens Connect App,"(42.3548, -71.153)"
622957,101001548331,09/02/2015 03:59:00 PM,09/10/2015 03:59:44 PM,09/11/2015 02:17:47 PM,OVERDUE,Closed,Case Closed. Closed date : 2015-09-11 14:17:47.823 Case Resolved done 9-9-15,Equipment Repair,Parks & Recreation Department,Park Maintenance & Safety,Equipment Repair,PARK_Maintenance_Trades,PARK,,,,,,,,,,,,,,,,,42.3594,-71.0587,Constituent Call,"(0, 0)"
623082,101001548511,09/02/2015 07:48:00 PM,09/11/2015 08:30:00 AM,09/11/2015 08:15:41 AM,ONTIME,Closed,Case Closed. Closed date : 2015-09-11 08:15:41.23 Duplicate of Existing Case Same as #1412011.,Equipment Repair,Parks & Recreation Department,Park Maintenance & Safety,Equipment Repair,PARK_Maintenance_Trades,PARK,https://mayors24.cityofboston.gov/media/boston/report/photos/55e78ab26963c98f05b553fa/report.jpg,,39 Terminal St  Charlestown  MA  02129,3.0,1A,1.0,A15,Charlestown,2.0,2,202.0,,39 Terminal St,2129.0,Address,344482.0,42.3816,-71.0599,Citizens Connect App,"(42.3816, -71.0599)"
623267,101001548762,09/03/2015 08:31:00 AM,09/11/2015 08:31:26 AM,09/03/2015 12:58:29 PM,ONTIME,Closed,Case Closed. Closed date : 2015-09-03 12:58:29.603 Case Resolved remove graffiti,Equipment Repair,Parks & Recreation Department,Park Maintenance & Safety,Equipment Repair,PARK_Maintenance_Trades,PARK,,,,,,,,,,,,,,,,,42.3594,-71.0587,Employee Generated,"(0, 0)"
623275,101001548779,09/03/2015 08:37:00 AM,09/11/2015 08:37:50 AM,09/10/2015 06:03:42 AM,ONTIME,Closed,Case Closed. Closed date : 2015-09-10 06:03:42.407 Case Resolved remove toy,Equipment Repair,Parks & Recreation Department,Park Maintenance & Safety,Equipment Repair,PARK_Maintenance_Trades,PARK,https://mayors24.cityofboston.gov/media/boston/report/photos/55e83f456963c98f05b55acd/report.jpg,,260 Highland St  Roxbury  MA  02119,9.0,10B,7.0,B2,Roxbury,13.0,11,1101.0,E,260 Highland St,2119.0,Address,73748.0,42.3228,-71.0962,Citizens Connect App,"(42.3228, -71.0962)"
623468,101001549065,09/03/2015 10:43:00 AM,09/11/2015 10:46:32 AM,09/11/2015 10:45:44 AM,ONTIME,Closed,Case Closed. Closed date : 2015-09-11 10:45:44.363 Case Resolved done 9-8-15,Equipment Repair,Parks & Recreation Department,Park Maintenance & Safety,Equipment Repair,PARK_Maintenance_Trades,PARK,,,1545 Dorchester Ave  Dorchester  MA  02124,8.0,07,3.0,C11,Dorchester,7.0,16,1601.0,,1545 Dorchester Ave,2124.0,Address,342065.0,42.3594,-71.0587,Employee Generated,"(0, 0)"
623479,101001549072,09/03/2015 10:47:00 AM,09/11/2015 10:47:57 AM,09/10/2015 06:04:35 AM,ONTIME,Closed,Case Closed. Closed date : 2015-09-10 06:04:35.2 Case Resolved rrpair moon swing,Equipment Repair,Parks & Recreation Department,Park Maintenance & Safety,Equipment Repair,PARK_Maintenance_Trades,PARK,https://mayors24.cityofboston.gov/media/boston/report/photos/55e85dc06963c98f05b55ddf/report.jpg,,6 Edgerly Rd  Boston  MA  02115,4.0,10A,7.0,D4,Boston,14.0,4,405.0,,6 Edgerly Rd,2115.0,Address,342115.0,42.3594,-71.0587,Citizens Connect App,"(0, 0)"
623491,101001549085,09/03/2015 10:52:00 AM,09/11/2015 10:52:31 AM,09/08/2015 11:23:22 AM,ONTIME,Closed,Case Closed. Closed date : 2015-09-08 11:23:22.4 Case Resolved,Equipment Repair,Parks & Recreation Department,Park Maintenance & Safety,Equipment Repair,PARK_Park Improvement Requests,PARK,,,139 Tremont St  Boston  MA  02108,3.0,1C,8.0,A1,Beacon Hill,14.0,05,503.0,E,139 Tremont St,2108.0,Address,341542.0,42.3554,-71.0638,Employee Generated,"(42.3554, -71.0638)"
623529,101001549135,09/03/2015 11:14:00 AM,09/11/2015 11:14:58 AM,12/15/2015 10:07:30 AM,OVERDUE,Closed,Case Closed. Closed date : 2015-12-15 10:07:30.753 Case Resolved done 12-15-15,Equipment Repair,Parks & Recreation Department,Park Maintenance & Safety,Equipment Repair,INFO01_GenericeFormforOtherServiceRequestTypes,INFO,https://mayors24.cityofboston.gov/media/boston/report/photos/55e864166963c98f05b55e7a/report.jpg,,25 Caspian Way  Dorchester  MA  02125,7.0,03,3.0,C11,Dorchester,7.0,13,1310.0,,25 Caspian Way,2125.0,Address,342632.0,42.3594,-71.0587,Citizens Connect App,"(0, 0)"
623968,101001549726,09/03/2015 06:58:00 PM,09/14/2015 08:30:00 AM,09/09/2015 07:40:59 AM,ONTIME,Closed,Case Closed. Closed date : 2015-09-09 07:40:59.03 Case Resolved Graffiti was removed.,Equipment Repair,Parks & Recreation Department,Park Maintenance & Safety,Equipment Repair,PARK_Maintenance_Trades,PARK,https://mayors24.cityofboston.gov/media/boston/report/photos/55e8d0b66963c98f05b56851/report.jpg,,30 Denny St  Dorchester  MA  02125,7.0,03,3.0,C11,Dorchester,7.0,13,1310.0,,30 Denny St,2125.0,Address,342516.0,42.3594,-71.0587,Citizens Connect App,"(0, 0)"
624017,101001569791,09/03/2015 09:14:00 PM,09/14/2015 08:30:00 AM,09/09/2015 07:40:10 AM,ONTIME,Closed,Case Closed. Closed date : 2015-09-09 07:40:10.887 Case Noted Park is under construction.,Equipment Repair,Parks & Recreation Department,Park Maintenance & Safety,Equipment Repair,PARK_Maintenance_Trades,PARK,,,29 Harvard St  Charlestown  MA  02129,3.0,1A,1.0,A15,Charlestown,2.0,2,201.0,,29 Harvard St,2129.0,Address,342468.0,42.3594,-71.0587,Citizens Connect App,"(0, 0)"
624043,101001569829,09/04/2015 06:31:00 AM,09/14/2015 08:30:00 AM,09/08/2015 11:30:19 AM,ONTIME,Closed,Case Closed. Closed date : 2015-09-08 11:30:19.333 Case Noted contractor called for repairs 9-4-15,Equipment Repair,Parks & Recreation Department,Park Maintenance & Safety,Equipment Repair,PARK_Maintenance_Trades,PARK,,,25 Glendon St  East Boston  MA  02128,1.0,09,1.0,A7,East Boston,1.0,1,109.0,E,25 Glendon St,2128.0,Address,341999.0,42.3594,-71.0587,Employee Generated,"(0, 0)"
624072,101001569867,09/04/2015 07:48:00 AM,09/14/2015 08:30:00 AM,,OVERDUE,Open,,Equipment Repair,Parks & Recreation Department,Park Maintenance & Safety,Equipment Repair,PARK_Maintenance_Trades,PARK,,,10 Eden St  Charlestown  MA  02129,3.0,1A,1.0,A15,Charlestown,2.0,02,206.0,,10 Eden St,2129.0,Address,342116.0,42.3594,-71.0587,Employee Generated,"(0, 0)"
624184,101001570029,09/04/2015 09:35:00 AM,09/14/2015 09:35:28 AM,12/08/2015 11:26:58 AM,OVERDUE,Closed,Case Closed. Closed date : 2015-12-08 11:26:58.057 Case Noted,Equipment Repair,Parks & Recreation Department,Park Maintenance & Safety,Equipment Repair,PARK_Park Improvement Requests,PARK,,,55 Winthrop St  Charlestown  MA  02129,3.0,1A,1.0,A15,Charlestown,2.0,02,203.0,,55 Winthrop St,2129.0,Address,342691.0,42.3594,-71.0587,Citizens Connect App,"(0, 0)"
624217,101001570077,09/04/2015 10:01:00 AM,09/14/2015 10:01:31 AM,09/25/2015 12:05:09 PM,OVERDUE,Closed,Case Closed. Closed date : 2015-09-25 12:05:09.413 Case Resolved Fountain was repaired.,Equipment Repair,Parks & Recreation Department,Park Maintenance & Safety,Equipment Repair,PARK_Maintenance_Trades,PARK,,,370 Hanover St  Boston  MA  02113,3.0,1B,1.0,A1,Downtown / Financial District,3.0,03,301.0,,370 Hanover St,2113.0,Address,342568.0,42.3594,-71.0587,Constituent Call,"(0, 0)"
624275,101001570171,09/04/2015 10:57:00 AM,09/14/2015 10:57:27 AM,11/05/2015 05:11:44 AM,OVERDUE,Closed,Case Closed. Closed date : 2015-11-05 05:11:44.653 Case Resolved,Equipment Repair,Parks & Recreation Department,Park Maintenance & Safety,Equipment Repair,PARK_Maintenance_Region 3,PARK,,,INTERSECTION of Boylston St & Fenway  Boston  MA,4.0,10A,8.0,D4,Fenway / Kenmore / Audubon Circle / Longwood,14.0,Ward 4,407.0,,INTERSECTION Boylston St & Fenway,,Intersection,1767.0,42.3465,-71.0908,Constituent Call,"(42.3465, -71.0908)"
624357,101001570316,09/04/2015 12:31:00 PM,09/14/2015 12:31:04 PM,09/11/2015 10:35:52 AM,ONTIME,Closed,Case Closed. Closed date : 2015-09-11 10:35:52.873 Case Resolved done 9-10-15,Equipment Repair,Parks & Recreation Department,Park Maintenance & Safety,Equipment Repair,PARK_Maintenance_Trades,PARK,https://mayors24.cityofboston.gov/media/boston/report/photos/55e9c7726963c98f05b57365/report.jpg,,80 Humboldt Ave  Dorchester  MA  02121,9.0,10B,7.0,B2,Dorchester,13.0,12,1202.0,,80 Humboldt Ave,2121.0,Address,342506.0,42.3594,-71.0587,Citizens Connect App,"(0, 0)"
624377,101001570341,09/04/2015 12:47:00 PM,09/14/2015 12:47:16 PM,,OVERDUE,Open,,Equipment Repair,Parks & Recreation Department,Park Maintenance & Safety,Equipment Repair,PARK_Maintenance_Trades,PARK,,,239 Parker Hill Ave  Mission Hill  MA  02120,9.0,10A,8.0,B2,Mission Hill,14.0,10,1005.0,,239 Parker Hill Ave,2120.0,Address,342517.0,42.3594,-71.0587,Constituent Call,"(0, 0)"
624720,101001570794,09/05/2015 10:21:00 AM,09/15/2015 08:30:00 AM,09/11/2015 02:16:40 PM,ONTIME,Closed,Case Closed. Closed date : 2015-09-11 14:16:40.03 Case Resolved,Equipment Repair,Parks & Recreation Department,Park Maintenance & Safety,Equipment Repair,PARK_Maintenance_Trades,PARK,https://mayors24.cityofboston.gov/media/boston/report/photos/55eafaaf6963c98f05b57fa2/report.jpg,,40 Downer Ave  Dorchester  MA  02125,7.0,03,3.0,C11,Dorchester,7.0,13,1306.0,,40 Downer Ave,2125.0,Address,342086.0,42.3594,-71.0587,Citizens Connect App,"(0, 0)"
624835,101001570942,09/05/2015 04:11:00 PM,09/15/2015 08:30:00 AM,09/25/2015 12:05:51 PM,OVERDUE,Closed,Case Closed. Closed date : 2015-09-25 12:05:51.637 Case Resolved Railing was repaired.,Equipment Repair,Parks & Recreation Department,Park Maintenance & Safety,Equipment Repair,PARK_Maintenance_Trades,PARK,https://mayors24.cityofboston.gov/media/boston/report/photos/55eb4cac6963c98f05b583bb/report.jpg,,4225 Washington St  Roslindale  MA  02131,12.0,06,5.0,E5,Roslindale,10.0,20,2002.0,E,4225 Washington St,2131.0,Address,341521.0,42.2866,-71.1285,Citizens Connect App,"(42.2866, -71.1285)"
624986,101001571164,09/06/2015 10:35:00 AM,09/15/2015 08:30:00 AM,09/10/2015 06:00:08 AM,ONTIME,Closed,Case Closed. Closed date : 2015-09-10 06:00:08.33 Case Resolved install hardware,Equipment Repair,Parks & Recreation Department,Park Maintenance & Safety,Equipment Repair,PARK_Maintenance_Trades,PARK,https://mayors24.cityofboston.gov/media/boston/report/photos/55ec4f6a6963c98f05b58bd9/report.jpg,,40 Cornwall St  Jamaica Plain  MA  02130,9.0,02,6.0,E13,Jamaica Plain,11.0,11,1106.0,,40 Cornwall St,2130.0,Address,342402.0,42.3594,-71.0587,Citizens Connect App,"(0, 0)"
624992,101001571172,09/06/2015 11:01:00 AM,09/15/2015 08:30:00 AM,09/10/2015 05:59:33 AM,ONTIME,Closed,Case Closed. Closed date : 2015-09-10 05:59:33.12 Case Resolved install hardware,Equipment Repair,Parks & Recreation Department,Park Maintenance & Safety,Equipment Repair,PARK_Maintenance_Trades,PARK,https://mayors24.cityofboston.gov/media/boston/report/photos/55ec556b6963c98f05b58c40/report.jpg,,40 Cornwall St  Jamaica Plain  MA  02130,9.0,02,6.0,E13,Jamaica Plain,11.0,11,1106.0,,40 Cornwall St,2130.0,Address,342402.0,42.3594,-71.0587,Citizens Connect App,"(0, 0)"
625104,101001571348,09/06/2015 11:43:00 PM,09/15/2015 08:30:00 AM,10/01/2015 02:21:12 PM,OVERDUE,Closed,Case Closed. Closed date : 2015-10-01 14:21:12.527 Case Resolved done,Equipment Repair,Parks & Recreation Department,Park Maintenance & Safety,Equipment Repair,PARK_Maintenance_Trades,PARK,https://mayors24.cityofboston.gov/media/boston/report/photos/55ed081c6963c98f05b592cb/report.jpg,,507 Jamaicaway  Jamaica Plain  MA  02130,9.0,02,6.0,E13,Jamaica Plain,11.0,19,1903.0,E,507 Jamaicaway,2130.0,Address,341649.0,42.3594,-71.0587,Citizens Connect App,"(0, 0)"
625151,101001571408,09/07/2015 09:25:00 AM,09/15/2015 08:30:00 AM,10/09/2015 10:43:42 AM,OVERDUE,Closed,Case Closed. Closed date : 2015-10-09 10:43:42.38 Case Resolved done,Equipment Repair,Parks & Recreation Department,Park Maintenance & Safety,Equipment Repair,PARK_Maintenance_Trades,PARK,https://mayors24.cityofboston.gov/media/boston/report/photos/55ed906c6963c98f05b594d9/report.jpg,,45 Lambert Ave  Roxbury  MA  02119,7.0,10B,7.0,B2,Roxbury,13.0,9,905.0,,45 Lambert Ave,2119.0,Address,342504.0,42.3594,-71.0587,Citizens Connect App,"(0, 0)"
625214,101001571485,09/07/2015 12:01:00 PM,09/15/2015 08:30:00 AM,09/24/2015 03:49:36 PM,OVERDUE,Closed,Case Closed. Closed date : 2015-09-24 15:49:36.233 Case Resolved trades division reports there is no way to install straps for play equipment,Equipment Repair,Parks & Recreation Department,Park Maintenance & Safety,Equipment Repair,PARK_Maintenance_Trades,PARK,https://mayors24.cityofboston.gov/media/boston/report/photos/55edb50c6963c98f05b5974b/report.jpg,,345 Walnut Ave  Roxbury  MA  02119,9.0,10B,7.0,E13,Roxbury,13.0,11,1103.0,,345 Walnut Ave,2119.0,Address,342534.0,42.3594,-71.0587,Citizens Connect App,"(0, 0)"
625300,101001571593,09/07/2015 04:29:00 PM,09/15/2015 08:30:00 AM,09/11/2015 02:18:32 PM,ONTIME,Closed,Case Closed. Closed date : 2015-09-11 14:18:32.613 Case Noted water faucet belongs to dcr,Equipment Repair,Parks & Recreation Department,Park Maintenance & Safety,Equipment Repair,INFO01_GenericeFormforOtherServiceRequestTypes,INFO,https://mayors24.cityofboston.gov/media/boston/report/photos/55edf3c36963c98f05b59abc/photo_20150907_162938.jpg,,30 Denny St  Dorchester  MA  02125,7.0,03,3.0,C11,Dorchester,7.0,13,1310.0,,30 Denny St,2125.0,Address,342516.0,42.3594,-71.0587,Citizens Connect App,"(0, 0)"
625347,101001571653,09/07/2015 07:07:00 PM,09/15/2015 08:30:00 AM,12/10/2015 08:55:36 AM,OVERDUE,Closed,Case Closed. Closed date : 2015-12-10 08:55:36.63 Case Resolved Soccer nets were repaired.,Equipment Repair,Parks & Recreation Department,Park Maintenance & Safety,Equipment Repair,PARK_Maintenance_Trades,PARK,https://mayors24.cityofboston.gov/media/boston/report/photos/55ee19006963c98f05b59cc5/report.jpg,,145 Westminster St  Hyde Park  MA  02136,12.0,08,5.0,E18,Hyde Park,10.0,18,1815.0,,145 Westminster St,2136.0,Address,342623.0,42.3594,-71.0587,Citizens Connect App,"(0, 0)"
625381,101001571697,09/07/2015 09:00:00 PM,09/15/2015 08:30:00 AM,,OVERDUE,Open,,Equipment Repair,Parks & Recreation Department,Park Maintenance & Safety,Equipment Repair,INFO01_GenericeFormforOtherServiceRequestTypes,INFO,https://mayors24.cityofboston.gov/media/boston/report/photos/55ee33516963c98f05b59e67/photo_20150907_210019.jpg,,29 Harvard St  Charlestown  MA  02129,3.0,1A,1.0,A15,Charlestown,2.0,2,201.0,,29 Harvard St,2129.0,Address,342468.0,42.3594,-71.0587,Citizens Connect App,"(0, 0)"
625458,101001571798,09/08/2015 07:42:00 AM,09/15/2015 08:30:00 AM,09/22/2015 02:41:13 PM,OVERDUE,Closed,Case Closed. Closed date : 2015-09-22 14:41:13.34 Case Resolved,Equipment Repair,Parks & Recreation Department,Park Maintenance & Safety,Equipment Repair,PARK_Maintenance_Trades,PARK,https://mayors24.cityofboston.gov/media/boston/report/photos/55eec9e36963c98f05b5a240/report.jpg,,59 Waumbeck St  Dorchester  MA  02121,9.0,10B,7.0,B2,Dorchester,13.0,12,1202.0,,59 Waumbeck St,2121.0,Address,342666.0,42.3594,-71.0587,Citizens Connect App,"(0, 0)"
625527,101001571908,09/08/2015 08:56:00 AM,09/15/2015 08:56:13 AM,,OVERDUE,Open,,Equipment Repair,Parks & Recreation Department,Park Maintenance & Safety,Equipment Repair,INFO01_GenericeFormforOtherServiceRequestTypes,INFO,https://mayors24.cityofboston.gov/media/boston/report/photos/55eedb226963c98f05b5a453/report.jpg,,544P Massachusetts Ave  Roxbury  MA  02118,7.0,1C,7.0,D4,Roxbury,13.0,9,903.0,,544P Massachusetts Ave,2118.0,Address,342023.0,42.3594,-71.0587,Citizens Connect App,"(0, 0)"
625556,101001571966,09/08/2015 09:20:00 AM,09/15/2015 09:20:37 AM,09/25/2015 12:07:47 PM,OVERDUE,Closed,Case Closed. Closed date : 2015-09-25 12:07:47.857,Equipment Repair:,Parks & Recreation Department,Park Maintenance & Safety,Equipment Repair,PARK_Maintenance_Trades,PARK,,,,,,,,,,,,,,,,,42.3594,-71.0587,Self Service,"(0, 0)"
625571,101001571986,09/08/2015 09:30:00 AM,09/15/2015 09:31:07 AM,09/14/2015 10:05:11 AM,ONTIME,Closed,Case Closed. Closed date : 2015-09-14 10:05:11.89 Case Noted Does not exsist,Equipment Repair,Parks & Recreation Department,Park Maintenance & Safety,Equipment Repair,PARK_Maintenance_Trades,PARK,,,,,,,,,,,,,,,,,42.3594,-71.0587,Employee Generated,"(0, 0)"
625699,101001572165,09/08/2015 10:34:00 AM,09/15/2015 10:34:54 AM,09/11/2015 02:12:10 PM,ONTIME,Closed,Case Closed. Closed date : 2015-09-11 14:12:10.773 Case Resolved,Equipment Repair,Parks & Recreation Department,Park Maintenance & Safety,Equipment Repair,PARK_Maintenance_Trades,PARK,https://mayors24.cityofboston.gov/media/boston/report/photos/55eef2416963c98f05b5a6ac/photo_20150908_103402.jpg,,75 W Rutland Sq  Roxbury  MA  02118,4.0,1C,7.0,D4,Roxbury,6.0,4,404.0,,75 W Rutland Sq,2118.0,Address,342665.0,42.3594,-71.0587,Citizens Connect App,"(0, 0)"
625700,101001572167,09/08/2015 10:35:00 AM,09/15/2015 10:35:37 AM,09/11/2015 09:59:20 AM,ONTIME,Closed,Case Closed. Closed date : 2015-09-11 09:59:20.25 Case Noted Hydrant repaired on 9/10,Equipment Repair,Parks & Recreation Department,Park Maintenance & Safety,Equipment Repair,BWSC_All Cases,BWSC,https://mayors24.cityofboston.gov/media/boston/report/photos/55eef26b6963c98f05b5a6b8/report.jpg,,1545 Dorchester Ave  Dorchester  MA  02124,8.0,07,3.0,C11,Dorchester,7.0,16,1601.0,,1545 Dorchester Ave,2124.0,Address,342065.0,42.3594,-71.0587,Citizens Connect App,"(0, 0)"
625777,101001572272,09/08/2015 11:25:00 AM,09/15/2015 11:25:23 AM,,OVERDUE,Open,,Equipment Repair,Parks & Recreation Department,Park Maintenance & Safety,Equipment Repair,PARK_Park Improvement Requests,PARK,,,,,,,,,,,,,,,,,42.3594,-71.0587,Employee Generated,"(0, 0)"
625781,101001572281,09/08/2015 11:31:00 AM,09/15/2015 11:31:22 AM,,OVERDUE,Open,,Equipment Repair,Parks & Recreation Department,Park Maintenance & Safety,Equipment Repair,INFO01_GenericeFormforOtherServiceRequestTypes,INFO,,,INTERSECTION of James J Storrow Memorial Dr & Harvard Brg  Boston  MA,4.0,1C,8.0,D4,Back Bay,14.0,Ward 5,509.0,,INTERSECTION James J Storrow Memorial Dr & Harvard Brg,,Intersection,6546.0,42.352,-71.09,Citizens Connect App,"(42.352, -71.09)"
625860,101001572402,09/08/2015 12:43:00 PM,09/15/2015 12:43:41 PM,09/11/2015 02:07:45 PM,ONTIME,Closed,Case Closed. Closed date : 2015-09-11 14:07:45.367 Case Resolved done  9-10-15,Equipment Repair,Parks & Recreation Department,Park Maintenance & Safety,Equipment Repair,PARK_Maintenance_Trades,PARK,https://mayors24.cityofboston.gov/media/boston/report/photos/55ef106e6963c98f05b5a8dc/photo_20150908_124318.jpg,,4 Charles St  Boston  MA  02108,3.0,1C,8.0,A1,Boston,14.0,5,503.0,,4 Charles St,2108.0,Address,342578.0,42.3594,-71.0587,Citizens Connect App,"(0, 0)"
626047,101001572704,09/08/2015 03:39:00 PM,09/15/2015 03:39:35 PM,,OVERDUE,Open,,Equipment Repair: --Not in list--,Parks & Recreation Department,Park Maintenance & Safety,Equipment Repair,PARK_Park Improvement Requests,PARK,,,,,,,,,,,,,,,,,42.3594,-71.0587,Self Service,"(0, 0)"
626117,101001572807,09/08/2015 04:56:00 PM,09/15/2015 04:56:09 PM,12/08/2015 11:22:33 AM,OVERDUE,Closed,Case Closed. Closed date : 2015-12-08 11:22:33.533 Case Noted,Equipment Repair,Parks & Recreation Department,Park Maintenance & Safety,Equipment Repair,PARK_Park Improvement Requests,PARK,https://mayors24.cityofboston.gov/media/boston/report/photos/55ef4b9f6963c98f05b5ace3/report.jpg,,130 Peterborough St  Boston  MA  02215,4.0,10A,8.0,D4,Boston,14.0,21,2101.0,,130 Peterborough St,2215.0,Address,342583.0,42.3594,-71.0587,Citizens Connect App,"(0, 0)"
626150,101001572852,09/08/2015 05:36:00 PM,09/16/2015 08:30:00 AM,09/11/2015 10:43:41 AM,ONTIME,Closed,Case Closed. Closed date : 2015-09-11 10:43:41.987 Case Resolved done 9-10-=15,Equipment Repair,Parks & Recreation Department,Park Maintenance & Safety,Equipment Repair,PARK_Maintenance_Trades,PARK,https://mayors24.cityofboston.gov/media/boston/report/photos/55ef54f56963c98f05b5adbf/report.jpg,,421-425 Dudley St  Roxbury  MA  02119,7.0,03,7.0,B2,Roxbury,13.0,8,805.0,,421-425 Dudley St,2119.0,Address,342089.0,42.3594,-71.0587,Citizens Connect App,"(0, 0)"
626325,101001573082,09/09/2015 06:31:00 AM,09/16/2015 08:30:00 AM,,OVERDUE,Open,,Tree In Park: Myrtle Street Play Area; BackBay Beacon Hill,Parks & Recreation Department,Park Maintenance & Safety,Equipment Repair,PARK_Tree in Park,PARK,,,50 Myrtle St  Boston  MA  02114,3.0,1B,8.0,A1,Boston,14.0,5,503.0,,50 Myrtle St,2114.0,Address,342540.0,42.3594,-71.0587,Citizens Connect App,"(0, 0)"
626536,101001573412,09/09/2015 09:50:00 AM,09/16/2015 09:50:29 AM,10/19/2015 01:58:40 PM,OVERDUE,Closed,Case Closed. Closed date : 2015-10-19 13:58:40.343 Case Resolved done,Equipment Repair,Parks & Recreation Department,Park Maintenance & Safety,Equipment Repair,PARK_Maintenance_Trades,PARK,https://mayors24.cityofboston.gov/media/boston/report/photos/55f0391f6963c98f05b5b8db/report.jpg,,40 Cornwall St  Jamaica Plain  MA  02130,9.0,02,6.0,E13,Jamaica Plain,11.0,11,1106.0,,40 Cornwall St,2130.0,Address,342402.0,42.3594,-71.0587,Citizens Connect App,"(0, 0)"
626647,101001573592,09/09/2015 11:12:00 AM,09/16/2015 11:12:35 AM,10/09/2015 10:36:07 AM,OVERDUE,Closed,Case Closed. Closed date : 2015-10-09 10:36:07.96 Case Resolved no shed in park,Equipment Repair,Parks & Recreation Department,Park Maintenance & Safety,Equipment Repair,PARK_Maintenance_Trades,PARK,,,21 Stanley St  Dorchester  MA  02125,7.0,03,3.0,C11,Dorchester,8.0,15,1501.0,,21 Stanley St,2125.0,Address,344013.0,42.3594,-71.0587,Citizens Connect App,"(0, 0)"
626729,101001573710,09/09/2015 12:10:00 PM,09/16/2015 12:10:45 PM,10/09/2015 01:07:57 PM,OVERDUE,Closed,Case Closed. Closed date : 2015-10-09 13:07:57.123 Case Resolved,Ground Maintenance: --Not in list--  Mullen Square,Parks & Recreation Department,Park Maintenance & Safety,Equipment Repair,INFO_Reallocation From Dept,INFO,,,24 Edison Grn  Dorchester  MA  02125,7.0,03,2.0,C11,Dorchester,5.0,7,709.0,,24 Edison Grn,2125.0,Address,342538.0,42.3594,-71.0587,Citizens Connect App,"(0, 0)"
626864,101001573896,09/09/2015 02:11:00 PM,09/16/2015 02:11:43 PM,10/19/2015 02:02:54 PM,OVERDUE,Closed,Case Closed. Closed date : 2015-10-19 14:02:54.343 Case Resolved done 10-15-15,Equipment Repair,Parks & Recreation Department,Park Maintenance & Safety,Equipment Repair,PARK_Maintenance_Trades,PARK,,,1 Jewish War Veterans Dr  Jamaica Plain  MA  02130,9.0,02,7.0,B2,Greater Mattapan,13.0,12,1207.0,E,1 Jewish War Veterans Dr,2130.0,Address,163434.0,42.301,-71.0886,Employee Generated,"(42.301, -71.0886)"
627021,101001574123,09/09/2015 04:44:00 PM,09/16/2015 04:44:38 PM,10/09/2015 10:45:47 AM,OVERDUE,Closed,Case Closed. Closed date : 2015-10-09 10:45:47.55 Case Resolved repair swing,Equipment Repair,Parks & Recreation Department,Park Maintenance & Safety,Equipment Repair,PARK_Maintenance_Trades,PARK,,,300 Gardner St  West Roxbury  MA  02132,12.0,06,6.0,E5,West Roxbury,12.0,20,2017.0,,300 Gardner St,2132.0,Address,342525.0,42.3594,-71.0587,Employee Generated,"(0, 0)"
627129,101001574266,09/09/2015 08:33:00 PM,09/17/2015 08:30:00 AM,09/10/2015 03:42:57 PM,ONTIME,Closed,Case Closed. Closed date : 2015-09-10 15:42:57.393 Case Resolved contractor on site fixing probkems,Ground Maintenance: Christopher Columbus Park  Christopher Columbus Park,Parks & Recreation Department,Park Maintenance & Safety,Equipment Repair,PARK_Maintenance_Region 1,PARK,https://mayors24.cityofboston.gov/media/boston/report/photos/55f0cfd96963c98f05b5c36c/photo_20150909_203108.jpg,,110 Atlantic Ave  Boston  MA  02110,3.0,1B,1.0,A1,Boston,3.0,3,301.0,,110 Atlantic Ave,2110.0,Address,161702.0,42.361,-71.0522,Citizens Connect App,"(42.361, -71.0522)"
627240,101001574418,09/10/2015 07:51:00 AM,09/17/2015 08:30:00 AM,10/14/2015 01:16:54 PM,OVERDUE,Closed,Case Closed. Closed date : 2015-10-14 13:16:54.93 Case Resolved Repaired hit hydrant 9/10/15,Equipment Repair,Parks & Recreation Department,Park Maintenance & Safety,Equipment Repair,BWSC_All Cases,BWSC,https://mayors24.cityofboston.gov/media/boston/report/photos/55f16eb06963c98f05b5ca33/report.jpg,,1545 Dorchester Ave  Dorchester  MA  02124,8.0,07,3.0,C11,Dorchester,7.0,16,1601.0,,1545 Dorchester Ave,2124.0,Address,342065.0,42.3594,-71.0587,Citizens Connect App,"(0, 0)"
627259,101001574441,09/10/2015 08:03:00 AM,09/17/2015 08:30:00 AM,09/15/2015 10:21:14 AM,ONTIME,Closed,Case Closed. Closed date : 2015-09-15 10:21:14.707 Case Resolved done 9-11-15,Equipment Repair,Parks & Recreation Department,Park Maintenance & Safety,Equipment Repair,PARK_Maintenance_Trades,PARK,,,,,,,,,,,,,,,,,42.3594,-71.0587,Employee Generated,"(0, 0)"
627277,101001574473,09/10/2015 08:23:00 AM,09/17/2015 08:30:00 AM,,OVERDUE,Open,,Equipment Repair,Parks & Recreation Department,Park Maintenance & Safety,Equipment Repair,PARK_Maintenance_Trades,PARK,https://mayors24.cityofboston.gov/media/boston/report/photos/55f1763d6963c98f05b5cad5/report.jpg,,20 Glade Ave  Jamaica Plain  MA  02130,9.0,02,6.0,E13,Jamaica Plain,11.0,Ward 11,1107.0,R3,20 Glade Ave,2130.0,Address,63727.0,42.3074,-71.1006,Citizens Connect App,"(42.3074, -71.1006)"
627303,101001574516,09/10/2015 08:46:54 AM,09/17/2015 08:46:55 AM,11/04/2015 05:53:42 AM,OVERDUE,Closed,Case Closed. Closed date : 2015-11-04 05:53:42.697 Case Resolved PAINT OVER GRAFFITI,Equipment Repair,Parks & Recreation Department,Park Maintenance & Safety,Equipment Repair,PARK_Maintenance_Trades,PARK,https://mayors24.cityofboston.gov/media/boston/report/photos/55f17bbf6963c98f05b5cb4d/report.jpg,,230 Shawmut Ave  Roxbury  MA  02118,4.0,1C,2.0,D4,Roxbury,4.0,3,307.0,,230 Shawmut Ave,2118.0,Address,342571.0,42.3594,-71.0587,Citizens Connect App,"(0, 0)"
627342,101001574591,09/10/2015 09:25:00 AM,09/17/2015 09:25:47 AM,10/16/2015 09:08:05 AM,OVERDUE,Closed,Case Closed. Closed date : 2015-10-16 09:08:05.607 Case Resolved area has been sprayed,Ground Maintenance: Cuneo Park  Cuneo Park,Parks & Recreation Department,Park Maintenance & Safety,Equipment Repair,PARK_Maintenance_Region 1,PARK,,,765  Saratoga St  East Boston  MA  02128,1.0,09,1.0,A7,East Boston,1.0,1,111.0,,765  Saratoga St,2128.0,Address,342038.0,42.3594,-71.0587,Citizens Connect App,"(0, 0)"
627351,101001574608,09/10/2015 09:35:00 AM,09/17/2015 09:35:30 AM,09/16/2015 01:13:13 PM,ONTIME,Closed,Case Closed Case Invalid  Please re-submit with a better address. we could not locate rack.,Equipment Repair,Parks & Recreation Department,Park Maintenance & Safety,Equipment Repair,PWDx_Litter Basket Maintenance,PWDx,https://mayors24.cityofboston.gov/media/boston/report/photos/55f1871d6963c98f05b5cc62/photo_20150910_093402.jpg,,135 Kneeland St  Boston  MA  02111,4.0,1C,2.0,A1,Boston,4.0,03,308.0,,135 Kneeland St,2111.0,Address,342559.0,42.3594,-71.0587,Citizens Connect App,"(0, 0)"
627472,101001574776,09/10/2015 10:38:00 AM,09/17/2015 10:39:05 AM,09/22/2015 02:50:33 PM,OVERDUE,Closed,Case Closed. Closed date : 2015-09-22 14:50:33.33 Case Resolved done 9-15-15,Equipment Repair,Parks & Recreation Department,Park Maintenance & Safety,Equipment Repair,PARK_Maintenance_Trades,PARK,,,1 Jewish War Veterans Dr  Jamaica Plain  MA  02130,9.0,02,7.0,B2,Greater Mattapan,13.0,12,1207.0,E,1 Jewish War Veterans Dr,2130.0,Address,163434.0,42.301,-71.0886,Employee Generated,"(42.301, -71.0886)"
627491,101001574795,09/10/2015 10:49:00 AM,09/17/2015 10:49:10 AM,09/15/2015 10:21:57 AM,ONTIME,Closed,Case Closed. Closed date : 2015-09-15 10:21:57.687 Case Resolved done,Equipment Repair,Parks & Recreation Department,Park Maintenance & Safety,Equipment Repair,PARK_Maintenance_Trades,PARK,https://mayors24.cityofboston.gov/media/boston/report/photos/55f198636963c98f05b5cda2/report.jpg,,4 Charles St  Boston  MA  02108,3.0,1C,8.0,A1,Boston,14.0,5,503.0,,4 Charles St,2108.0,Address,342578.0,42.3594,-71.0587,Citizens Connect App,"(0, 0)"
627493,101001574806,09/10/2015 10:50:00 AM,09/17/2015 10:51:15 AM,09/22/2015 09:59:46 AM,OVERDUE,Closed,Case Closed. Closed date : 2015-09-22 09:59:46.793 Case Resolved done 9-16-15,Equipment Repair,Parks & Recreation Department,Park Maintenance & Safety,Equipment Repair,PARK_Maintenance_Trades,PARK,,,260 Clarendon St  Boston  MA  02116,4.0,1C,8.0,D4,Boston,14.0,05,507.0,,260 Clarendon St,2116.0,Address,342026.0,42.3594,-71.0587,Employee Generated,"(0, 0)"
627592,101001574935,09/10/2015 11:52:00 AM,09/17/2015 11:52:25 AM,,OVERDUE,Open,,Equipment Repair,Parks & Recreation Department,Park Maintenance & Safety,Equipment Repair,PARK_Park Improvement Requests,PARK,https://mayors24.cityofboston.gov/media/boston/report/photos/55f1a7356963c98f05b5cea8/report.jpg,,6 Edgerly Rd  Boston  MA  02115,4.0,10A,7.0,D4,Boston,14.0,4,405.0,,6 Edgerly Rd,2115.0,Address,342115.0,42.3594,-71.0587,Citizens Connect App,"(0, 0)"
627696,101001575082,09/10/2015 01:34:00 PM,09/17/2015 01:34:55 PM,09/15/2015 11:17:42 AM,ONTIME,Closed,Case Closed. Closed date : 2015-09-15 11:17:42.31 Case Resolved done,Equipment Repair,Parks & Recreation Department,Park Maintenance & Safety,Equipment Repair,PARK_Maintenance_Trades,PARK,https://mayors24.cityofboston.gov/media/boston/report/photos/55f1bf3f6963c98f05b5d045/report.jpg,,2P Brewer St  Jamaica Plain  MA  02130,9.0,02,6.0,E13,Jamaica Plain,11.0,19,1908.0,E,2P Brewer St,2130.0,Address,341464.0,42.3594,-71.0587,Citizens Connect App,"(0, 0)"
628300,101001576041,09/11/2015 01:03:23 PM,09/18/2015 01:03:23 PM,10/22/2015 10:20:14 AM,OVERDUE,Closed,Case Closed. Closed date : 2015-10-22 10:20:14.533 Case Resolved,Equipment Repair: Reverend Loesch Family Park,Parks & Recreation Department,Park Maintenance & Safety,Equipment Repair,PARK_Maintenance_Trades,PARK,https://cityworker.cityofboston.gov:8443/attachments/report/55f30962d052f8c25f1e809b/photo/Report.jpg,,20 Wainwright St  Dorchester  MA  02124,8.0,07,3.0,C11,Dorchester,8.0,16,1603.0,,20 Wainwright St,2124.0,Address,342037.0,42.3594,-71.0587,City Worker App,"(0, 0)"
628315,101001576062,09/11/2015 01:18:00 PM,09/18/2015 01:18:13 PM,09/22/2015 01:38:40 PM,OVERDUE,Closed,Case Closed. Closed date : 2015-09-22 13:38:40.707 Case Resolved,Equipment Repair,Parks & Recreation Department,Park Maintenance & Safety,Equipment Repair,PARK_Maintenance_Trades,PARK,,,139 Tremont St  Boston  MA  02108,3.0,1C,8.0,A1,Beacon Hill,14.0,05,503.0,E,139 Tremont St,2108.0,Address,341542.0,42.3554,-71.0638,Employee Generated,"(42.3554, -71.0638)"
628343,101001576109,09/11/2015 01:54:00 PM,09/18/2015 01:54:05 PM,12/16/2015 06:22:15 AM,OVERDUE,Closed,Case Closed. Closed date : 2015-12-16 06:22:15.087 Case Resolved fence fix,Equipment Repair,Parks & Recreation Department,Park Maintenance & Safety,Equipment Repair,PARK_Maintenance_Trades,PARK,https://mayors24.cityofboston.gov/media/boston/report/photos/55f315406963ab4b3634f255/report.jpg,,40 Cornwall St  Jamaica Plain  MA  02130,9.0,02,6.0,E13,Jamaica Plain,11.0,11,1106.0,,40 Cornwall St,2130.0,Address,342402.0,42.3594,-71.0587,Citizens Connect App,"(0, 0)"
628350,101001576120,09/11/2015 01:57:00 PM,09/18/2015 01:57:23 PM,09/22/2015 02:37:53 PM,OVERDUE,Closed,Case Closed. Closed date : 2015-09-22 14:37:53.187 Case Resolved done 9-14-15,Equipment Repair,Parks & Recreation Department,Park Maintenance & Safety,Equipment Repair,PARK_Maintenance_Trades,PARK,https://mayors24.cityofboston.gov/media/boston/report/photos/55f316046963ab4b3634f296/report.jpg,,40 Cornwall St  Jamaica Plain  MA  02130,9.0,02,6.0,E13,Jamaica Plain,11.0,11,1106.0,,40 Cornwall St,2130.0,Address,342402.0,42.3594,-71.0587,Citizens Connect App,"(0, 0)"
628618,101001576496,09/11/2015 07:45:00 PM,09/21/2015 08:30:00 AM,,OVERDUE,Open,,Bike rack repair,Parks & Recreation Department,Park Maintenance & Safety,Equipment Repair,BTDT_BostonBikes,BTDT,https://mayors24.cityofboston.gov/media/boston/report/photos/55f3678c6963ab4b3634f7a7/report.jpg,,115 Paris St  East Boston  MA  02128,1.0,09,1.0,A7,East Boston,1.0,1,104.0,,115 Paris St,2128.0,Address,340867.0,42.3721,-71.037,Citizens Connect App,"(42.3721, -71.037)"
628747,101001576658,09/12/2015 10:18:00 AM,09/21/2015 08:30:00 AM,09/22/2015 02:36:45 PM,OVERDUE,Closed,Case Closed. Closed date : 2015-09-22 14:36:45.607 Case Resolved done n9-16-15,Equipment Repair,Parks & Recreation Department,Park Maintenance & Safety,Equipment Repair,PARK_Maintenance_Trades,PARK,https://mayors24.cityofboston.gov/media/boston/report/photos/55f434416963ab4b3634fdd6/photo_20150912_101755.jpg,,235 Western Ave  Allston  MA  02134,11.0,04,9.0,D14,Allston,15.0,22,2201.0,,235 Western Ave,2134.0,Address,342636.0,42.3594,-71.0587,Citizens Connect App,"(0, 0)"
628778,101001576691,09/12/2015 11:02:00 AM,09/21/2015 08:30:00 AM,09/24/2015 02:06:07 PM,OVERDUE,Closed,Case Closed. Closed date : 2015-09-24 14:06:07.247 Case Resolved,Equipment Repair,Parks & Recreation Department,Park Maintenance & Safety,Equipment Repair,PARK_Maintenance_Trades,PARK,https://mayors24.cityofboston.gov/media/boston/report/photos/55f43e916963ab4b3634fed1/report.jpg,,260 Highland St  Roxbury  MA  02119,9.0,10B,7.0,B2,Roxbury,13.0,11,1101.0,E,260 Highland St,2119.0,Address,73748.0,42.3228,-71.0962,Citizens Connect App,"(42.3228, -71.0962)"
628852,101001576791,09/12/2015 02:08:00 PM,09/21/2015 08:30:00 AM,09/14/2015 01:32:39 PM,ONTIME,Closed,Case Closed. Closed date : 2015-09-14 13:32:39.83 Case Resolved bollard locked up,Equipment Repair,Parks & Recreation Department,Park Maintenance & Safety,Equipment Repair,PARK_Maintenance_Region 1,PARK,https://mayors24.cityofboston.gov/media/boston/report/photos/55f46a206963ab4b36350262/report.jpg,,135 Prince St  Boston  MA  02113,3.0,1B,1.0,A1,Boston,3.0,3,303.0,,135 Prince St,2113.0,Address,342060.0,42.3594,-71.0587,Citizens Connect App,"(0, 0)"
628896,101001576845,09/12/2015 04:14:00 PM,09/21/2015 08:30:00 AM,09/24/2015 11:07:47 AM,OVERDUE,Closed,Case Closed. Closed date : 2015-09-24 11:07:47.8 Case Resolved done 9-22-15,Equipment Repair,Parks & Recreation Department,Park Maintenance & Safety,Equipment Repair,PARK_Maintenance_Trades,PARK,https://mayors24.cityofboston.gov/media/boston/report/photos/55f487af6963ab4b363503b8/report.jpg,,502 VFW Pkwy  West Roxbury  MA  02132,9.0,06,6.0,E5,West Roxbury,12.0,20,2019.0,,502 VFW Pkwy,2132.0,Address,342479.0,42.3594,-71.0587,Citizens Connect App,"(0, 0)"
628897,101001576846,09/12/2015 04:14:00 PM,09/21/2015 08:30:00 AM,09/24/2015 11:10:50 AM,OVERDUE,Closed,Case Closed. Closed date : 2015-09-24 11:10:50.54 Case Resolved done 9-22-15,Equipment Repair,Parks & Recreation Department,Park Maintenance & Safety,Equipment Repair,PARK_Maintenance_Trades,PARK,https://mayors24.cityofboston.gov/media/boston/report/photos/55f487af6963ab4b363503b8/report.jpg,,502 VFW Pkwy  West Roxbury  MA  02132,9.0,06,6.0,E5,West Roxbury,12.0,20,2019.0,,502 VFW Pkwy,2132.0,Address,342479.0,42.3594,-71.0587,Citizens Connect App,"(0, 0)"
628917,101001576869,09/12/2015 05:08:00 PM,09/21/2015 08:30:00 AM,09/22/2015 02:42:12 PM,OVERDUE,Closed,Case Closed. Closed date : 2015-09-22 14:42:12.543 Case Resolved done 9-16-15,Equipment Repair,Parks & Recreation Department,Park Maintenance & Safety,Equipment Repair,PARK_Maintenance_Trades,PARK,https://mayors24.cityofboston.gov/media/boston/report/photos/55f494576963ab4b36350449/report.jpg,,75 W Rutland Sq  Roxbury  MA  02118,4.0,1C,7.0,D4,Roxbury,6.0,4,404.0,,75 W Rutland Sq,2118.0,Address,342665.0,42.3594,-71.0587,Citizens Connect App,"(0, 0)"
