,CASE_ENQUIRY_ID,OPEN_DT,TARGET_DT,CLOSED_DT,OnTime_Status,CASE_STATUS,CLOSURE_REASON,CASE_TITLE,SUBJECT,REASON,TYPE,QUEUE,Department,SubmittedPhoto,ClosedPhoto,Location,fire_district,pwd_district,city_council_district,police_district,neighborhood,neighborhood_services_district,ward,precinct,land_usage,LOCATION_STREET_NAME,LOCATION_ZIPCODE,Property_Type,Property_ID,LATITUDE,LONGITUDE,Source,Geocoded_Location
471111,101001243150,01/06/2015 02:07:05 PM,,01/07/2015 10:17:04 AM,ONTIME,Closed,Case Closed Case Invalid Vague  please submit engineering documents outlining the issue and the exact limits.,Highway Maintenance,Public Works Department,Highway Maintenance,Highway Maintenance,PWDx_Highway Construction,PWDx,,,822-840 Tremont St  Roxbury  MA  02118,7.0,10B,7.0,D4,Roxbury,13.0,Ward 9,903.0,E,822-840 Tremont St,2118.0,Address,170483.0,42.3381,-71.0821,Constituent Call,"(42.3381, -71.0821)"
472433,101001245024,01/09/2015 01:52:45 PM,,10/08/2015 04:16:43 PM,ONTIME,Closed,Case Closed. Closed date : 2015-10-08 16:16:43.027 Case Resolved Thank you for your request. We apologize for the time that it has taken to respond to this case. If this issue persists  please resubmit your case or call 311 to speak to an agent.,Highway Maintenance,Public Works Department,Highway Maintenance,Highway Maintenance,INFO_Reallocation From Dept,INFO,,,867 Boylston St  Boston  MA  02116,4.0,1C,8.0,D4,Back Bay,14.0,05,508.0,,867 Boylston St,2116.0,Address,351731.0,42.3594,-71.0587,Constituent Call,"(0, 0)"
473769,101001247019,01/14/2015 08:49:07 AM,,03/05/2015 07:52:42 AM,ONTIME,Closed,Case Closed Case Resolved The Construction Inspection Unit (CIU) Inspector went to the location and found no loose bricks on the sidewalk.,Highway Maintenance,Public Works Department,Highway Maintenance,Highway Maintenance,PWDx_Contractor Complaints,PWDx,,,130 Mount Vernon St  Boston  MA  02108,3.0,1B,8.0,A1,Beacon Hill,14.0,Ward 5,505.0,R1,130 Mount Vernon St,2108.0,Address,98513.0,42.3576,-71.0708,Constituent Call,"(42.3576, -71.0708)"
474607,101001248236,01/16/2015 08:10:01 AM,,01/16/2015 11:49:58 AM,ONTIME,Closed,Case Closed Case Resolved,Highway Maintenance,Public Works Department,Highway Maintenance,Highway Maintenance,BTDT_Traffic Signal_Repair,BTDT,,,INTERSECTION of Blakemore St & Hyde Park Ave  Roslindale  MA,12.0,02,5.0,E18,Roslindale,10.0,Ward 18,1807.0,,INTERSECTION Blakemore St & Hyde Park Ave,,Intersection,1487.0,42.2855,-71.1188,Employee Generated,"(42.2855, -71.1188)"
475374,101001249361,01/19/2015 01:37:52 PM,,06/17/2015 06:16:16 AM,ONTIME,Closed,Case Closed. Closed date : 2015-06-17 06:16:16.83 Case Resolved Closed,Sidewalk Repair/Red Brick/South End,Public Works Department,Highway Maintenance,Highway Maintenance,PWDx_Highway Construction,PWDx,,,INTERSECTION of Columbus Ave & Dartmouth St  Boston  MA,4.0,1C,2.0,D4,South End,6.0,Ward 4,401.0,,INTERSECTION Columbus Ave & Dartmouth St,,Intersection,3300.0,42.3458,-71.0752,Constituent Call,"(42.3458, -71.0752)"
476187,101001250362,01/20/2015 12:55:36 PM,,05/27/2015 11:02:34 AM,ONTIME,Closed,Case Closed. Closed date : 2015-05-27 11:02:34.427 Case Resolved Missing bricks were replaced and additional bricks were reset.,Sidewalk Repair/Red Brick/Downtown,Public Works Department,Highway Maintenance,Highway Maintenance,PWDx_Highway Construction,PWDx,,https://cityworker.cityofboston.gov:8443/attachments/report/54be969cd0520924d7ce63d4/closed_photo/Report.jpg,220-230 Commercial St  Boston  MA  02109,3.0,1B,1.0,A1,Downtown / Financial District,3.0,Ward 3,301.0,CM,220-230 Commercial St,2109.0,Address,163683.0,42.3636,-71.0516,Constituent Call,"(42.3636, -71.0516)"
476262,101001250487,01/20/2015 02:13:05 PM,,01/20/2015 02:13:06 PM,ONTIME,Closed,Case Closed Internal Case,Highway Maintenance,Public Works Department,Highway Maintenance,Highway Maintenance,PWDx_District 10B: Roxbury,PWDx,,,100-102 Seaver St  Dorchester  MA  02121,9.0,10B,7.0,B2,Roxbury,13.0,Ward 12,1207.0,A,100-102 Seaver St,2121.0,Address,124139.0,42.3105,-71.0924,Employee Generated,"(42.3105, -71.0924)"
476265,101001250490,01/20/2015 02:13:46 PM,,01/20/2015 02:13:47 PM,ONTIME,Closed,Case Closed Internal Case,Highway Maintenance,Public Works Department,Highway Maintenance,Highway Maintenance,PWDx_District 10B: Roxbury,PWDx,,,INTERSECTION of Elm Hill Ave & Seaver St  Dorchester  MA,9.0,10B,7.0,B2,Roxbury,13.0,Ward 12,1207.0,,INTERSECTION Elm Hill Ave & Seaver St,,Intersection,4528.0,42.3076,-71.089,Employee Generated,"(42.3076, -71.089)"
476268,101001250493,01/20/2015 02:14:47 PM,,01/20/2015 02:14:48 PM,ONTIME,Closed,Case Closed Internal Case,Highway Maintenance,Public Works Department,Highway Maintenance,Highway Maintenance,PWDx_District 10B: Roxbury,PWDx,,,1-21 Brook Marshall Rd  Mission Hill  MA  02120,9.0,10B,7.0,B2,Mission Hill,13.0,09,904.0,,1-21 Brook Marshall Rd,2120.0,Address,344031.0,42.3594,-71.0587,Employee Generated,"(0, 0)"
476269,101001250494,01/20/2015 02:15:25 PM,,01/20/2015 02:15:27 PM,ONTIME,Closed,Case Closed Internal Case,Highway Maintenance,Public Works Department,Highway Maintenance,Highway Maintenance,PWDx_District 10B: Roxbury,PWDx,,,34-38 Raynor Cir  Mission Hill  MA  02120,7.0,10B,7.0,B2,Roxbury,13.0,Ward 9,904.0,E,34-38 Raynor Cir,2120.0,Address,114855.0,42.3347,-71.0873,Employee Generated,"(42.3347, -71.0873)"
476549,101001250923,01/21/2015 10:06:20 AM,,01/21/2015 02:11:50 PM,ONTIME,Closed,Case Closed Case Noted gutter and sidewalk swept,Highway Maintenance,Public Works Department,Highway Maintenance,Highway Maintenance,PWDx_District 02: Jamaica Plain,PWDx,,,301-303 Forest Hills St  Jamaica Plain  MA  02130,9.0,02,6.0,E13,Jamaica Plain,11.0,Ward 11,1108.0,CM,301-303 Forest Hills St,2130.0,Address,59429.0,42.3023,-71.1051,Employee Generated,"(42.3023, -71.1051)"
479115,101001255148,01/27/2015 02:16:02 PM,,02/17/2015 07:24:17 AM,ONTIME,Closed,Case Closed Case Noted,Highway Maintenance,Public Works Department,Highway Maintenance,Highway Maintenance,PWDx_District 07: South Dorchester,PWDx,,,INTERSECTION of Dorchester Ave & Endicott Ter  Dorchester  MA,8.0,07,3.0,C11,Dorchester,7.0,Ward 16,1604.0,,INTERSECTION Dorchester Ave & Endicott Ter,,Intersection,4136.0,42.294,-71.062,Employee Generated,"(42.294, -71.062)"
479135,101001255170,01/27/2015 02:24:21 PM,,02/17/2015 07:25:26 AM,ONTIME,Closed,Case Closed Case Resolved,Highway Maintenance,Public Works Department,Highway Maintenance,Highway Maintenance,PWDx_District 07: South Dorchester,PWDx,,,INTERSECTION of Druid St & Gallivan Blvd  Dorchester  MA,8.0,07,3.0,B3,Dorchester,7.0,Ward 17,1712.0,,INTERSECTION Druid St & Gallivan Blvd,,Intersection,4247.0,42.2783,-71.0757,Employee Generated,"(42.2783, -71.0757)"
479733,101001255860,01/27/2015 06:05:57 PM,,02/17/2015 07:44:34 AM,ONTIME,Closed,Case Closed Case Resolved  dist 7/ JPimentel,Highway Maintenance,Public Works Department,Highway Maintenance,Highway Maintenance,PWDx_District 07: South Dorchester,PWDx,,,44 Hallowell St  Mattapan  MA  02126,8.0,07,5.0,B3,Greater Mattapan,9.0,Ward 18,1821.0,R1,44 Hallowell St,2126.0,Address,68300.0,42.2724,-71.1003,Employee Generated,"(42.2724, -71.1003)"
479781,101001255911,01/27/2015 06:21:21 PM,,01/27/2015 08:02:48 PM,ONTIME,Closed,Case Closed Duplicate of Existing Case,Highway Maintenance,Public Works Department,Highway Maintenance,Highway Maintenance,PWDx_District 03: North Dorchester,PWDx,,,2 Vesta Rd  Dorchester  MA  02124,7.0,03,4.0,B3,Greater Mattapan,9.0,Ward 14,1409.0,R3,2 Vesta Rd,2124.0,Address,160652.0,42.2967,-71.0869,Constituent Call,"(42.2967, -71.0869)"
480028,101001256178,01/27/2015 07:59:58 PM,,02/17/2015 08:17:50 AM,ONTIME,Closed,Case Closed Case Resolved,Highway Maintenance,Public Works Department,Highway Maintenance,Highway Maintenance,PWDx_District 07: South Dorchester,PWDx,,,INTERSECTION of Floyd St & Lucerne St  Dorchester  MA,8.0,07,4.0,B3,Greater Mattapan,9.0,Ward 14,1410.0,,INTERSECTION Floyd St & Lucerne St,,Intersection,4979.0,42.2889,-71.0875,Employee Generated,"(42.2889, -71.0875)"
480070,101001256224,01/27/2015 08:15:56 PM,,01/28/2015 10:28:52 AM,ONTIME,Closed,Case Closed Case Noted  no e form,Highway Maintenance,Public Works Department,Highway Maintenance,Highway Maintenance,PWDx_Requests for Snow Plowing,PWDx,,,2 Elm St  Dorchester  MA  02122,7.0,07,3.0,C11,Dorchester,7.0,Ward 16,1602.0,R1,2 Elm St,2122.0,Address,53194.0,42.2999,-71.0543,Employee Generated,"(42.2999, -71.0543)"
484510,101001261798,01/29/2015 12:38:49 PM,,01/31/2015 12:16:08 PM,ONTIME,Closed,Case Closed Case Resolved Case Closed,Highway Maintenance,Public Works Department,Highway Maintenance,Highway Maintenance,PWDx_District 02: Jamaica Plain,PWDx,,,20 Weld Hill St  Jamaica Plain  MA  02130,12.0,02,6.0,E13,Jamaica Plain,11.0,Ward 11,1108.0,R3,20 Weld Hill St,2130.0,Address,147229.0,42.2987,-71.1132,Constituent Call,"(42.2987, -71.1132)"
503283,101001289024,02/11/2015 04:07:06 PM,,04/14/2015 09:05:45 AM,ONTIME,Closed,Case Closed Case Resolved,Highway Maintenance,Public Works Department,Highway Maintenance,Highway Maintenance,PWDx_District 10B: Roxbury,PWDx,,,265-273 Roxbury St  Roxbury  MA  02119,7.0,10B,7.0,B2,Roxbury,13.0,Ward 9,905.0,EA,265-273 Roxbury St,2119.0,Address,119173.0,42.3304,-71.0938,Constituent Call,"(42.3304, -71.0938)"
520448,101001313409,02/24/2015 08:14:52 AM,,05/02/2015 08:10:57 PM,ONTIME,Closed,Case Closed. Closed date : 2015-05-02 20:10:57.963 Case Referred to External Agency gave to DCR in Feb,Highway Maintenance,Public Works Department,Highway Maintenance,Highway Maintenance,INFO_Reallocation From Dept,INFO,,,347 River St  Mattapan  MA  02126,8.0,07,4.0,B3,Greater Mattapan,9.0,Ward 18,1804.0,R2,347 River St,2126.0,Address,116585.0,42.2706,-71.0872,Employee Generated,"(42.2706, -71.0872)"
521346,101001314694,02/24/2015 03:06:31 PM,,02/24/2015 03:29:01 PM,ONTIME,Closed,Case Closed Case Invalid Wrong E-form,Highway Maintenance,Public Works Department,Highway Maintenance,Highway Maintenance,PWDx_District 04: Allston/Brighton,PWDx,,,226 Harvard Ave  Allston  MA  02134,11.0,04,9.0,D14,Allston / Brighton,14.0,Ward 21,2103.0,C,226 Harvard Ave,2134.0,Address,70380.0,42.3495,-71.1294,Constituent Call,"(42.3495, -71.1294)"
521588,101001315026,02/24/2015 06:01:06 PM,,04/23/2015 06:48:17 AM,ONTIME,Closed,Case Closed Case Resolved Check out sidewalk there was no issues and the gate opens with no problem,Highway Maintenance,Public Works Department,Highway Maintenance,Highway Maintenance,PWDx_District 1C: Downtown,PWDx,,,2 Fayette St  Boston  MA  02116,4.0,1C,2.0,A1,Boston,6.0,05,501.0,,2 Fayette St,2116.0,Address,352575.0,42.3594,-71.0587,Constituent Call,"(0, 0)"
522230,101001315983,02/25/2015 12:25:34 PM,,02/25/2015 12:25:35 PM,ONTIME,Closed,Case Closed Internal Case,Highway Maintenance,Public Works Department,Highway Maintenance,Highway Maintenance,PWDx_District 10B: Roxbury,PWDx,,,1050 Tremont St  Mission Hill  MA  02120,7.0,10B,7.0,D4,Mission Hill,13.0,09,904.0,EA,1050 Tremont St,2120.0,Address,136797.0,42.3362,-71.0854,Employee Generated,"(42.3362, -71.0854)"
522233,101001315986,02/25/2015 12:26:07 PM,,02/25/2015 12:26:09 PM,ONTIME,Closed,Case Closed Internal Case,Highway Maintenance,Public Works Department,Highway Maintenance,Highway Maintenance,PWDx_District 10A: Roxbury,PWDx,,,364-370 Brookline Ave  Boston  MA  02115,4.0,10A,8.0,B2,Fenway / Kenmore / Audubon Circle / Longwood,14.0,Ward 4,410.0,C,364-370 Brookline Ave,2115.0,Address,22099.0,42.339,-71.1064,Employee Generated,"(42.339, -71.1064)"
522237,101001315990,02/25/2015 12:26:40 PM,,02/25/2015 12:26:42 PM,ONTIME,Closed,Case Closed Internal Case,Highway Maintenance,Public Works Department,Highway Maintenance,Highway Maintenance,PWDx_District 10A: Roxbury,PWDx,,,396-410 Brookline Ave  Boston  MA  02115,4.0,10A,8.0,B2,Fenway / Kenmore / Audubon Circle / Longwood,14.0,Ward 4,410.0,RC,396-410 Brookline Ave,2115.0,Address,22101.0,42.3383,-71.1069,Employee Generated,"(42.3383, -71.1069)"
522238,101001315991,02/25/2015 12:27:11 PM,,02/25/2015 12:27:12 PM,ONTIME,Closed,Case Closed Internal Case,Highway Maintenance,Public Works Department,Highway Maintenance,Highway Maintenance,PWDx_District 10A: Roxbury,PWDx,,,264-274 Brookline Ave  Boston  MA  02115,4.0,10A,8.0,B2,Fenway / Kenmore / Audubon Circle / Longwood,14.0,Ward 4,410.0,E,264-274 Brookline Ave,2115.0,Address,22091.0,42.3411,-71.1024,Employee Generated,"(42.3411, -71.1024)"
522242,101001315995,02/25/2015 12:28:10 PM,,02/25/2015 12:28:12 PM,ONTIME,Closed,Case Closed Internal Case,Highway Maintenance,Public Works Department,Highway Maintenance,Highway Maintenance,PWDx_District 10A: Roxbury,PWDx,,,80 Francis St  Boston  MA  02215,9.0,10A,8.0,B2,Fenway / Kenmore / Audubon Circle / Longwood,14.0,10,1004.0,EA,80 Francis St,2215.0,Address,165405.0,42.3364,-71.109,Employee Generated,"(42.3364, -71.109)"
522249,101001316003,02/25/2015 12:31:07 PM,,02/25/2015 12:31:11 PM,ONTIME,Closed,Case Closed Internal Case,Highway Maintenance,Public Works Department,Highway Maintenance,Highway Maintenance,PWDx_District 06: West Roxbury and Roslindale,PWDx,,,34 Alberta St  West Roxbury  MA  02132,12.0,06,6.0,E5,West Roxbury,12.0,Ward 20,2005.0,R1,34 Alberta St,2132.0,Address,1649.0,42.2808,-71.1596,Employee Generated,"(42.2808, -71.1596)"
522251,101001316005,02/25/2015 12:32:06 PM,,02/25/2015 12:32:07 PM,ONTIME,Closed,Case Closed Internal Case,Highway Maintenance,Public Works Department,Highway Maintenance,Highway Maintenance,PWDx_District 10A: Roxbury,PWDx,,,INTERSECTION of Albert St & Prentiss St  Mission Hill  MA,9.0,10A,7.0,B2,Mission Hill,13.0,Ward 4,409.0,,INTERSECTION Albert St & Prentiss St,,Intersection,225.0,42.3336,-71.0932,Employee Generated,"(42.3336, -71.0932)"
522390,101001316187,02/25/2015 01:58:02 PM,,02/25/2015 01:58:03 PM,ONTIME,Closed,Case Closed Internal Case,Highway Maintenance,Public Works Department,Highway Maintenance,Highway Maintenance,PWDx_District 10B: Roxbury,PWDx,,,171-179A Dudley St  Roxbury  MA  02119,7.0,10B,7.0,B2,Roxbury,13.0,Ward 12,1201.0,RC,171-179A Dudley St,2119.0,Address,49638.0,42.3284,-71.0822,Employee Generated,"(42.3284, -71.0822)"
522392,101001316189,02/25/2015 01:58:43 PM,,02/25/2015 01:58:45 PM,ONTIME,Closed,Case Closed Internal Case,Highway Maintenance,Public Works Department,Highway Maintenance,Highway Maintenance,PWDx_District 10B: Roxbury,PWDx,,,194-196R Dudley St  Roxbury  MA  02119,7.0,10B,7.0,B2,Roxbury,13.0,Ward 8,804.0,C,194-196R Dudley St,2119.0,Address,49643.0,42.3287,-71.0818,Employee Generated,"(42.3287, -71.0818)"
522394,101001316192,02/25/2015 01:59:19 PM,,02/25/2015 01:59:21 PM,ONTIME,Closed,Case Closed Internal Case,Highway Maintenance,Public Works Department,Highway Maintenance,Highway Maintenance,PWDx_District 10B: Roxbury,PWDx,,,213-215 Dudley St  Roxbury  MA  02119,7.0,10B,7.0,B2,Roxbury,13.0,Ward 12,1201.0,E,213-215 Dudley St,2119.0,Address,49649.0,42.3283,-71.081,Employee Generated,"(42.3283, -71.081)"
524082,101001318636,02/27/2015 08:04:55 AM,,02/27/2015 08:04:57 AM,ONTIME,Closed,Case Closed Internal Case,Highway Maintenance,Public Works Department,Highway Maintenance,Highway Maintenance,PWDx_District 10B: Roxbury,PWDx,,,1115 Tremont St  Boston  MA  02115,9.0,10B,7.0,B2,Roxbury,13.0,Ward 9,904.0,C,1115 Tremont St,2115.0,Address,136802.0,42.3356,-71.0877,Employee Generated,"(42.3356, -71.0877)"
524084,101001318638,02/27/2015 08:05:44 AM,,02/27/2015 08:05:46 AM,ONTIME,Closed,Case Closed Internal Case,Highway Maintenance,Public Works Department,Highway Maintenance,Highway Maintenance,PWDx_District 1A: Charlestown,PWDx,,,37 Winthrop St  Charlestown  MA  02129,3.0,1A,1.0,A15,Charlestown,2.0,Ward 2,201.0,R1,37 Winthrop St,2129.0,Address,150937.0,42.3741,-71.0608,Employee Generated,"(42.3741, -71.0608)"
524085,101001318639,02/27/2015 08:06:16 AM,,02/27/2015 08:06:19 AM,ONTIME,Closed,Case Closed Internal Case,Highway Maintenance,Public Works Department,Highway Maintenance,Highway Maintenance,PWDx_District 1A: Charlestown,PWDx,,,36 Winthrop St  Charlestown  MA  02129,3.0,1A,1.0,A15,Charlestown,2.0,Ward 2,203.0,R1,36 Winthrop St,2129.0,Address,150936.0,42.3743,-71.061,Employee Generated,"(42.3743, -71.061)"
524087,101001318641,02/27/2015 08:07:44 AM,,02/27/2015 08:07:45 AM,ONTIME,Closed,Case Closed Internal Case,Highway Maintenance,Public Works Department,Highway Maintenance,Highway Maintenance,PWDx_District 10B: Roxbury,PWDx,,,INTERSECTION of Columbus Ave & New Heath St  Roxbury  MA,9.0,10B,7.0,B2,Roxbury,13.0,Ward 11,1101.0,,INTERSECTION Columbus Ave & New Heath St,,Intersection,3278.0,42.3263,-71.0978,Employee Generated,"(42.3263, -71.0978)"
526770,101001322742,03/03/2015 01:21:22 PM,,04/23/2015 07:09:59 AM,ONTIME,Closed,Case Closed Duplicate of Existing Case Sent to construction for repair,Highway Maintenance,Public Works Department,Highway Maintenance,Highway Maintenance,PWDx_District 1B: North End,PWDx,,,142 Commercial St  Boston  MA  02109,3.0,1B,1.0,A1,Downtown / Financial District,3.0,Ward 3,301.0,CM,142 Commercial St,2109.0,Address,163679.0,42.3623,-71.0526,Constituent Call,"(42.3623, -71.0526)"
526959,101001323010,03/03/2015 04:36:13 PM,,04/22/2015 11:25:18 AM,ONTIME,Closed,Case Closed Case Invalid Sidewalk is fine and gate opens without any problems.,Highway Maintenance,Public Works Department,Highway Maintenance,Highway Maintenance,PWDx_District 1B: North End,PWDx,,,65 Martha Rd  Boston  MA  02114,3.0,1B,8.0,A1,Back Bay,3.0,Ward 3,305.0,A,65 Martha Rd,2114.0,Address,91720.0,42.3656,-71.0656,Constituent Call,"(42.3656, -71.0656)"
527408,101001323687,03/04/2015 10:31:44 AM,,03/04/2015 10:31:45 AM,ONTIME,Closed,Case Closed Internal Case,Highway Maintenance,Public Works Department,Highway Maintenance,Highway Maintenance,PWDx_District 10B: Roxbury,PWDx,,,59 Marcella St  Roxbury  MA  02119,9.0,10B,7.0,B2,Roxbury,13.0,Ward 11,1102.0,R1,59 Marcella St,2119.0,Address,89582.0,42.3229,-71.0952,Employee Generated,"(42.3229, -71.0952)"
527413,101001323692,03/04/2015 10:32:33 AM,,03/04/2015 10:32:35 AM,ONTIME,Closed,Case Closed Internal Case,Highway Maintenance,Public Works Department,Highway Maintenance,Highway Maintenance,PWDx_District 10B: Roxbury,PWDx,,,40 Highland Ave  Roxbury  MA  02119,7.0,10B,7.0,B2,Roxbury,13.0,Ward 9,905.0,E,40 Highland Ave,2119.0,Address,73623.0,42.3293,-71.0933,Employee Generated,"(42.3293, -71.0933)"
527416,101001323696,03/04/2015 10:33:26 AM,,03/04/2015 10:33:27 AM,ONTIME,Closed,Case Closed Internal Case,Highway Maintenance,Public Works Department,Highway Maintenance,Highway Maintenance,PWDx_District 10B: Roxbury,PWDx,,,113 Dale St  Roxbury  MA  02119,7.0,10B,7.0,B2,Roxbury,13.0,Ward 9,905.0,CM,113 Dale St,2119.0,Address,45714.0,42.3226,-71.0884,Employee Generated,"(42.3226, -71.0884)"
527418,101001323698,03/04/2015 10:34:04 AM,,03/04/2015 10:34:06 AM,ONTIME,Closed,Case Closed Internal Case,Highway Maintenance,Public Works Department,Highway Maintenance,Highway Maintenance,PWDx_District 10B: Roxbury,PWDx,,,115 Dale St  Roxbury  MA  02119,7.0,10B,7.0,B2,Roxbury,13.0,Ward 9,905.0,A,115 Dale St,2119.0,Address,45718.0,42.3227,-71.0885,Employee Generated,"(42.3227, -71.0885)"
527439,101001323724,03/04/2015 10:50:16 AM,,03/04/2015 10:50:18 AM,ONTIME,Closed,Case Closed Internal Case,Highway Maintenance,Public Works Department,Highway Maintenance,Highway Maintenance,PWDx_District 08: Hyde Park,PWDx,,,75 Dale St  Hyde Park  MA  02136,12.0,08,5.0,E18,Hyde Park,10.0,Ward 18,1822.0,R1,75 Dale St,2136.0,Address,45693.0,42.2726,-71.1251,Employee Generated,"(42.2726, -71.1251)"
527444,101001323732,03/04/2015 10:53:26 AM,,03/04/2015 10:53:28 AM,ONTIME,Closed,Case Closed Internal Case,Highway Maintenance,Public Works Department,Highway Maintenance,Highway Maintenance,PWDx_District 10B: Roxbury,PWDx,,,0 Centre St  Roxbury  MA  02119,9.0,10B,7.0,B2,Roxbury,13.0,Ward 11,1101.0,E,0 Centre St,2119.0,Address,27374.0,42.3257,-71.097,Employee Generated,"(42.3257, -71.097)"
527900,101001324424,03/05/2015 01:03:46 AM,,03/09/2015 12:29:24 PM,ONTIME,Closed,Case Closed Case Resolved job complete cave in back to level bricks replaced.,Highway Maintenance,Public Works Department,Highway Maintenance,Highway Maintenance,PWDx_District 1C: Downtown,PWDx,,,4 Cazenove St  Boston  MA  02116,4.0,1C,2.0,D4,South End,6.0,Ward 5,501.0,CM,4 Cazenove St,2116.0,Address,26661.0,42.347,-71.0725,Constituent Call,"(42.347, -71.0725)"
527947,101001324492,03/05/2015 07:56:24 AM,,03/25/2015 01:26:09 PM,ONTIME,Closed,Case Closed Case Resolved Done by construction unit,Highway Maintenance,Public Works Department,Highway Maintenance,Highway Maintenance,PWDx_District 1C: Downtown,PWDx,,,4 Cazenove St  Boston  MA  02116,4.0,1C,2.0,D4,South End,6.0,Ward 5,501.0,CM,4 Cazenove St,2116.0,Address,26661.0,42.347,-71.0725,Constituent Call,"(42.347, -71.0725)"
530307,101001328169,03/09/2015 04:14:28 PM,,06/17/2015 06:19:34 AM,ONTIME,Closed,Case Closed. Closed date : 2015-06-17 06:19:34.713 Case Resolved Closed,Sidewalk Repair/Red Brick/South End,Public Works Department,Highway Maintenance,Highway Maintenance,PWDx_Highway Construction,PWDx,,,55 Berkeley St  Boston  MA  02116,4.0,1C,2.0,D4,South End,6.0,Ward 5,501.0,CM,55 Berkeley St,2116.0,Address,156378.0,42.3465,-71.0705,Constituent Call,"(42.3465, -71.0705)"
530678,101001328724,03/10/2015 10:12:42 AM,,04/08/2015 11:43:31 AM,ONTIME,Closed,Case Closed Case Noted sidewalk is safe area still marked for construction,Highway Maintenance,Public Works Department,Highway Maintenance,Highway Maintenance,PWDx_District 1C: Downtown,PWDx,,https://cityworker.cityofboston.gov:8443/attachments/report/54fefbe1d052f7f4fb442aa9/closed_photo/Report.jpg,314 Shawmut Ave  Roxbury  MA  02118,4.0,1C,2.0,D4,South End,4.0,Ward 3,307.0,RC,314 Shawmut Ave,2118.0,Address,126189.0,42.3421,-71.0703,Constituent Call,"(42.3421, -71.0703)"
530914,101001329068,03/10/2015 12:31:26 PM,,04/23/2015 01:49:37 PM,ONTIME,Closed,Case Closed Case Resolved,Highway Maintenance,Public Works Department,Highway Maintenance,Highway Maintenance,PWDx_Highway Construction,PWDx,,,190 Commercial St  Boston  MA  02109,3.0,1B,1.0,A1,Downtown / Financial District,3.0,03,301.0,E,190 Commercial St,2109.0,Address,341700.0,42.3594,-71.0587,Constituent Call,"(0, 0)"
531597,101001330140,03/11/2015 12:04:21 PM,,06/17/2015 06:17:43 AM,ONTIME,Closed,Case Closed. Closed date : 2015-06-17 06:17:43.25 Case Resolved Closed,Sidewalk Repair/Red Brick/Dist 6,Public Works Department,Highway Maintenance,Highway Maintenance,PWDx_Highway Construction,PWDx,,,25-29 Poplar St  Roslindale  MA  02131,12.0,06,5.0,E5,Roslindale,10.0,Ward 20,2002.0,C,25-29 Poplar St,2131.0,Address,111819.0,42.2863,-71.129,Constituent Call,"(42.2863, -71.129)"
531671,101001330282,03/11/2015 01:28:39 PM,,11/11/2015 03:57:32 PM,ONTIME,Closed,Case Closed. Closed date : 2015-11-11 15:57:32.747 Duplicate of Existing Case Duplicate of case 101001180525    If you have any further questions  or feel that this case was closed  or reallocated in error  please do not hesitate to contact me.    Michael Somers  Senior Civil Engineer  Construction Management Division  Boston Public Works  617-635-3831	  Michael.Somers@Boston.gov,Sidewalk Repair/Concrete/Dist 10,Public Works Department,Highway Maintenance,Highway Maintenance,PWDx_Highway Construction,PWDx,,,11 Saint George St  Roxbury  MA  02118,4.0,1C,2.0,D4,South End,6.0,Ward 8,802.0,CM,11 Saint George St,2118.0,Address,121038.0,42.3382,-71.0721,Constituent Call,"(42.3382, -71.0721)"
532410,101001331343,03/12/2015 12:30:28 PM,,04/09/2015 01:04:11 PM,ONTIME,Closed,Case Closed Case Noted Duplicate of a existing case sent to construction for repair,Highway Maintenance,Public Works Department,Highway Maintenance,Highway Maintenance,PWDx_District 1C: Downtown,PWDx,,,INTERSECTION of Columbus Ave & Dartmouth St  Boston  MA,4.0,1C,2.0,D4,South End,6.0,Ward 4,401.0,,INTERSECTION Columbus Ave & Dartmouth St,,Intersection,3300.0,42.3458,-71.0752,Constituent Call,"(42.3458, -71.0752)"
533513,101001332841,03/13/2015 03:45:20 PM,,04/06/2015 11:38:37 AM,ONTIME,Closed,Case Closed Duplicate of Existing Case Duplicate of case 101001235644,Highway Maintenance,Public Works Department,Highway Maintenance,Highway Maintenance,PWDx_Highway Construction,PWDx,,,INTERSECTION of Appleton St & Berkeley St  Boston  MA,4.0,1C,2.0,D4,South End,6.0,Ward 5,501.0,,INTERSECTION Appleton St & Berkeley St,,Intersection,496.0,42.3462,-71.0706,Constituent Call,"(42.3462, -71.0706)"
534350,101001334138,03/16/2015 01:56:39 PM,,08/21/2015 12:16:00 PM,ONTIME,Closed,Case Closed. Closed date : 2015-08-21 12:16:00.607 Case Noted Duplicate of Case #101001146771.    Thank you for bringing this matter to our attention.  Staff from the Boston Public Works Department has reviewed the location and we are of the opinion that the location is a candidate for reconstruction.     Your request and location has been added to the master list of future reconstruction projects. Currently  the wait time for a reconstruction project of this nature can be up to five (5) years.     If you feel that there is an immediate safety concern at this location  please contact 617-635-4500 so that maintenance can be performed to make the location safer until the reconstruction can be started.    In the meantime  you may contact the Public Works Department Engineering Division at 617-635-4968 for information on your request.  Again  we appreciate and thank you for your interest in public safety and the welfare of your community.,Highway Maintenance,Public Works Department,Highway Maintenance,Highway Maintenance,PWDx_Engineering_Design,PWDx,,,265-273 Roxbury St  Roxbury  MA  02119,7.0,10B,7.0,B2,Roxbury,13.0,Ward 9,905.0,EA,265-273 Roxbury St,2119.0,Address,119173.0,42.3304,-71.0938,Constituent Call,"(42.3304, -71.0938)"
534398,101001334199,03/16/2015 02:36:14 PM,,11/21/2015 06:28:30 AM,ONTIME,Closed,Case Closed. Closed date : 2015-11-21 06:28:30.62 Case Resolved Sidewalk repaired 11/2015    If you have any further questions  or feel that this case was closed  or reallocated in error  please do not hesitate to contact me.    Michael Somers  Senior Civil Engineer  Construction Management Division  Boston Public Works  617-635-3831	  Michael.Somers@Boston.gov,Highway Maintenance,Public Works Department,Highway Maintenance,Highway Maintenance,PWDx_Sidewalk Repair,PWDx,,,170 Marion St  East Boston  MA  02128,1.0,09,1.0,A7,East Boston,1.0,Ward 1,106.0,C,170 Marion St,2128.0,Address,89976.0,42.376,-71.0355,Constituent Call,"(42.376, -71.0355)"
534442,101001334286,03/16/2015 03:50:01 PM,,04/09/2015 01:05:10 PM,ONTIME,Closed,Case Closed Case Noted Duplicate of a existing case sent to construction for repair,Highway Maintenance,Public Works Department,Highway Maintenance,Highway Maintenance,PWDx_District 1C: Downtown,PWDx,,,100-128 Dartmouth St  Boston  MA  02116,4.0,1C,2.0,D4,South End,6.0,Ward 4,402.0,RC,100-128 Dartmouth St,2116.0,Address,46301.0,42.3461,-71.0756,Constituent Call,"(42.3461, -71.0756)"
534590,101001334508,03/17/2015 07:18:01 AM,,03/17/2015 07:18:03 AM,ONTIME,Closed,Case Closed Internal Case,Highway Maintenance,Public Works Department,Highway Maintenance,Highway Maintenance,PWDx_District 10B: Roxbury,PWDx,,,10-65 Camden St  Roxbury  MA  02118,7.0,10B,7.0,D4,Roxbury,13.0,Ward 9,903.0,EA,10-65 Camden St,2118.0,Address,25309.0,42.3371,-71.0798,Employee Generated,"(42.3371, -71.0798)"
536786,101001337421,03/19/2015 01:27:26 PM,,03/19/2015 01:27:28 PM,ONTIME,Closed,Case Closed Internal Case,Highway Maintenance,Public Works Department,Highway Maintenance,Highway Maintenance,PWDx_District 10B: Roxbury,PWDx,,,23 Marcella St  Roxbury  MA  02119,9.0,10B,7.0,B2,Roxbury,13.0,Ward 11,1102.0,CD,23 Marcella St,2119.0,Address,89556.0,42.3217,-71.0944,Employee Generated,"(42.3217, -71.0944)"
536787,101001337422,03/19/2015 01:28:48 PM,,03/19/2015 01:28:53 PM,ONTIME,Closed,Case Closed Internal Case,Highway Maintenance,Public Works Department,Highway Maintenance,Highway Maintenance,PWDx_District 10B: Roxbury,PWDx,,,INTERSECTION of Crawford St & Warren St  Dorchester  MA,9.0,10B,7.0,B2,Roxbury,13.0,Ward 12,1202.0,,INTERSECTION Crawford St & Warren St,,Intersection,3643.0,42.3106,-71.0833,Employee Generated,"(42.3106, -71.0833)"
536792,101001337433,03/19/2015 01:38:56 PM,,03/19/2015 01:38:58 PM,ONTIME,Closed,Case Closed Internal Case,Highway Maintenance,Public Works Department,Highway Maintenance,Highway Maintenance,PWDx_District 10B: Roxbury,PWDx,,,INTERSECTION of Ruggles St & Whittier St  Mission Hill  MA,9.0,10B,7.0,B2,Roxbury,13.0,Ward 9,904.0,,INTERSECTION Ruggles St & Whittier St,,Intersection,8206.0,42.3345,-71.0895,Employee Generated,"(42.3345, -71.0895)"
537269,101001338127,03/20/2015 10:20:53 AM,,03/20/2015 10:20:55 AM,ONTIME,Closed,Case Closed Internal Case,Highway Maintenance,Public Works Department,Highway Maintenance,Highway Maintenance,PWDx_District 03: North Dorchester,PWDx,,,INTERSECTION of Half Moon St & Lingard St  Dorchester  MA,7.0,03,7.0,B2,Roxbury,13.0,Ward 13,1304.0,,INTERSECTION Half Moon St & Lingard St,,Intersection,5554.0,42.3169,-71.0717,Employee Generated,"(42.3169, -71.0717)"
537271,101001338129,03/20/2015 10:21:27 AM,,03/20/2015 10:21:28 AM,ONTIME,Closed,Case Closed Internal Case,Highway Maintenance,Public Works Department,Highway Maintenance,Highway Maintenance,PWDx_District 03: North Dorchester,PWDx,,,10 Crescent Ave  Dorchester  MA  02125,7.0,03,3.0,C11,Dorchester,7.0,Ward 13,1307.0,R3,10 Crescent Ave,2125.0,Address,44190.0,42.3189,-71.0562,Employee Generated,"(42.3189, -71.0562)"
537273,101001338131,03/20/2015 10:22:10 AM,,03/20/2015 10:22:12 AM,ONTIME,Closed,Case Closed Internal Case,Highway Maintenance,Public Works Department,Highway Maintenance,Highway Maintenance,PWDx_District 03: North Dorchester,PWDx,,,7 Grant St  Dorchester  MA  02125,7.0,03,3.0,C11,Dorchester,7.0,Ward 13,1307.0,R2,7 Grant St,2125.0,Address,65952.0,42.3186,-71.0554,Employee Generated,"(42.3186, -71.0554)"
537275,101001338133,03/20/2015 10:22:53 AM,,03/20/2015 10:22:55 AM,ONTIME,Closed,Case Closed Internal Case,Highway Maintenance,Public Works Department,Highway Maintenance,Highway Maintenance,PWDx_District 03: North Dorchester,PWDx,,,133-135 Winthrop St  Roxbury  MA  02119,7.0,03,7.0,B2,Roxbury,13.0,08,807.0,,133-135 Winthrop St,2119.0,Address,350881.0,42.3594,-71.0587,Employee Generated,"(0, 0)"
537800,101001338815,03/20/2015 11:09:24 PM,,,ONTIME,Open,,Highway Maintenance,Public Works Department,Highway Maintenance,Highway Maintenance,ISD_Building (INTERNAL),ISD,,,515 Massachusetts Ave  Roxbury  MA  02118,7.0,10B,7.0,D4,Roxbury,13.0,Ward 9,903.0,R3,515 Massachusetts Ave,2118.0,Address,92291.0,42.3389,-71.0803,Constituent Call,"(42.3389, -71.0803)"
538011,101001339135,03/22/2015 11:34:00 AM,,12/04/2015 07:44:14 AM,ONTIME,Closed,Case Closed. Closed date : 2015-12-04 07:44:14.257 Case Noted This is covers an old coal shute and the COB ordinance states that coal shutes are the property owners responsibility.    If you have any further questions  or feel that this case was closed  or reallocated in error  please do not hesitate to contact me.    Michael Somers  Senior Civil Engineer  Construction Management Division  Boston Public Works  617-635-3831		  Michael.Somers@Boston.gov,Highway Maintenance,Public Works Department,Highway Maintenance,Highway Maintenance,PWDx_Highway Construction,PWDx,,,690 Massachusetts Ave  Roxbury  MA  02118,4.0,1C,2.0,D4,South End,6.0,Ward 8,802.0,CM,690 Massachusetts Ave,2118.0,Address,92597.0,42.3355,-71.0753,Constituent Call,"(42.3355, -71.0753)"
538498,101001339822,03/23/2015 01:17:22 PM,,04/07/2015 12:34:33 PM,ONTIME,Closed,Case Closed Case Resolved new cart swapped new cart #0714424280 04/01/2015,Highway Maintenance,Public Works Department,Highway Maintenance,Highway Maintenance,PWDx_Highway Construction,PWDx,,,55 Berkeley St  Boston  MA  02116,4.0,1C,2.0,D4,South End,6.0,Ward 5,501.0,CM,55 Berkeley St,2116.0,Address,156378.0,42.3465,-71.0705,Constituent Call,"(42.3465, -71.0705)"
539836,101001341599,03/25/2015 11:29:38 AM,,,ONTIME,Open,,Highway Maintenance,Public Works Department,Highway Maintenance,Highway Maintenance,INFO01_GenericeFormforOtherServiceRequestTypes,INFO,,,INTERSECTION of Dartmouth St & Buckingham St  Boston  MA,4.0,1C,2.0,D4,Back Bay,6.0,Ward 4,402.0,,INTERSECTION Dartmouth St & Buckingham St,,Intersection,3916.0,42.3476,-71.0761,Constituent Call,"(42.3476, -71.0761)"
540030,101001341838,03/25/2015 01:27:48 PM,,04/08/2015 11:44:29 AM,ONTIME,Closed,Case Closed Case Noted sidewalk is safe area still marked for construction,Highway Maintenance,Public Works Department,Highway Maintenance,Highway Maintenance,PWDx_District 1C: Downtown,PWDx,,https://cityworker.cityofboston.gov:8443/attachments/report/5512f01c70b4bbefef38c058/closed_photo/Report.jpg,314 Shawmut Ave  Roxbury  MA  02118,4.0,1C,2.0,D4,South End,4.0,Ward 3,307.0,RC,314 Shawmut Ave,2118.0,Address,126189.0,42.3421,-71.0703,Constituent Call,"(42.3421, -71.0703)"
540354,101001342349,03/26/2015 09:02:34 AM,03/26/2015 09:02:34 AM,06/15/2015 06:13:15 AM,OVERDUE,Closed,Case Closed. Closed date : 2015-06-15 06:13:15.847 Case Resolved Sidewalk repaired by the Construction Crew.,Highway Maintenance,Public Works Department,Highway Maintenance,Highway Maintenance,PWDx_Highway Construction,PWDx,,,25 Park St  Charlestown  MA  02129,3.0,1A,1.0,A15,Charlestown,2.0,Ward 2,201.0,RC,25 Park St,2129.0,Address,289681.0,42.3726,-71.061,Constituent Call,"(42.3726, -71.061)"
540534,101001342606,03/26/2015 11:44:21 AM,,04/08/2015 12:42:04 PM,ONTIME,Closed,Case Closed Case Noted Sidewalk hadn't caved in and its still safe,Highway Maintenance,Public Works Department,Highway Maintenance,Highway Maintenance,PWDx_District 1C: Downtown,PWDx,,https://cityworker.cityofboston.gov:8443/attachments/report/55142a8470b427db166cf486/closed_photo/Report.jpg,43 Appleton St  Boston  MA  02116,4.0,1C,2.0,D4,South End,6.0,Ward 5,501.0,R2,43 Appleton St,2116.0,Address,4026.0,42.346,-71.072,Constituent Call,"(42.346, -71.072)"
542595,101001345542,03/31/2015 08:50:53 AM,,06/23/2015 05:31:55 AM,ONTIME,Closed,Case Closed. Closed date : 2015-06-23 05:31:55.953 Case Resolved Loose and missing bricks were repaired by the construction crew.,Highway Maintenance,Public Works Department,Highway Maintenance,Highway Maintenance,PWDx_Highway Construction,PWDx,,,20 Somerset St  Boston  MA  02108,3.0,1B,1.0,A1,Downtown / Financial District,3.0,03,306.0,E,20 Somerset St,2108.0,Address,128378.0,42.3597,-71.0618,Constituent Call,"(42.3597, -71.0618)"
542823,101001345853,03/31/2015 12:17:47 PM,,06/08/2015 06:19:49 AM,ONTIME,Closed,Case Closed. Closed date : 2015-06-08 06:19:49.343 Case Noted To be repaired by others,Highway Maintenance,Public Works Department,Highway Maintenance,Highway Maintenance,PWDx_Highway Construction,PWDx,,,275 Tremont St  Boston  MA  02116,4.0,1C,2.0,A1,Boston,6.0,05,501.0,C,275 Tremont St,2116.0,Address,158150.0,42.35,-71.0655,Constituent Call,"(42.35, -71.0655)"
546059,101001350326,04/06/2015 02:35:45 PM,,04/23/2015 06:52:30 AM,ONTIME,Closed,Case Closed Case Noted Sent to construction for repair,Highway Maintenance,Public Works Department,Highway Maintenance,Highway Maintenance,PWDx_District 1B: North End,PWDx,,,71 Myrtle St  Boston  MA  02114,3.0,1B,8.0,A1,Beacon Hill,14.0,Ward 5,504.0,CM,71 Myrtle St,2114.0,Address,99802.0,42.3594,-71.067,Constituent Call,"(42.3594, -71.067)"
546125,101001350419,04/06/2015 03:55:00 PM,,06/26/2015 08:24:01 AM,ONTIME,Closed,Case Closed. Closed date : 2015-06-26 08:24:01.65 Case Noted The City is aware of an issue with the sidewalk and it has been scheduled for repair in the Connect to Historic Boston Program.    If you have any further questions  or feel that this case was closed in error  please do not hesitate to contact me.    Michael Somers  Senior Civil Engineer  Construction Management Division  Boston Public Works  617-635-3831  Michael.Somers@Boston.gov,Sidewalk Repair/Red Brick/Downtown,Public Works Department,Highway Maintenance,Highway Maintenance,PWDx_Sidewalk Repair,PWDx,,,145 Commercial St  Boston  MA  02110,3.0,1B,1.0,A1,Downtown / Financial District,3.0,Ward 3,301.0,EA,145 Commercial St,2110.0,Address,36195.0,42.3624,-71.052,Constituent Call,"(42.3624, -71.052)"
548149,101001353083,04/09/2015 03:22:30 PM,,10/21/2015 08:10:26 AM,ONTIME,Closed,Case Closed. Closed date : 2015-10-21 08:10:26.247 Duplicate of Existing Case Duplicate of case 101000794799    The City is aware of this issue and a new ramp is in the planning phase.    If you have any further questions  or feel that this case was closed  or reallocated in error  please do not hesitate to contact me.    Michael Somers  Senior Civil Engineer  Construction Management Division  Boston Public Works  617-635-3831	  Michael.Somers@Boston.gov,Highway Maintenance,Public Works Department,Highway Maintenance,Highway Maintenance,PWDx_Sidewalk Repair,PWDx,,,160 State St  Boston  MA  02109,3.0,1B,1.0,A1,Downtown / Financial District,3.0,03,306.0,,160 State St,2109.0,Address,351899.0,42.3594,-71.0587,Constituent Call,"(0, 0)"
548477,101001353550,04/10/2015 11:24:15 AM,,04/10/2015 11:24:17 AM,ONTIME,Closed,Case Closed Internal Case,Highway Maintenance,Public Works Department,Highway Maintenance,Highway Maintenance,PWDx_District 06: West Roxbury and Roslindale,PWDx,,,10 Keith St  West Roxbury  MA  02132,12.0,06,6.0,E5,West Roxbury,12.0,Ward 20,2017.0,R1,10 Keith St,2132.0,Address,80768.0,42.2882,-71.1668,Employee Generated,"(42.2882, -71.1668)"
548480,101001353553,04/10/2015 11:25:57 AM,,04/10/2015 11:25:58 AM,ONTIME,Closed,Case Closed Internal Case,Highway Maintenance,Public Works Department,Highway Maintenance,Highway Maintenance,PWDx_District 06: West Roxbury and Roslindale,PWDx,,,33 Anawan Ave  West Roxbury  MA  02132,12.0,06,5.0,E5,Roslindale,10.0,Ward 20,2008.0,CD,33 Anawan Ave,2132.0,Address,3425.0,42.2856,-71.1472,Employee Generated,"(42.2856, -71.1472)"
548482,101001353555,04/10/2015 11:29:30 AM,,04/10/2015 11:30:33 AM,ONTIME,Closed,Case Closed Case Resolved TV and computer monitor have been removed - job complete.,Highway Maintenance,Public Works Department,Highway Maintenance,Highway Maintenance,PWDx_District 06: West Roxbury and Roslindale,PWDx,,,211 Baker St  West Roxbury  MA  02132,12.0,06,6.0,E5,West Roxbury,12.0,Ward 20,2005.0,CD,211 Baker St,2132.0,Address,7667.0,42.2765,-71.1668,Employee Generated,"(42.2765, -71.1668)"
548519,101001353601,04/10/2015 12:28:33 PM,,04/22/2015 11:22:43 AM,ONTIME,Closed,Case Closed Duplicate of Existing Case,Highway Maintenance,Public Works Department,Highway Maintenance,Highway Maintenance,PWDx_District 1B: North End,PWDx,,,INTERSECTION of Commercial St & Richmond St  Boston  MA,3.0,1B,1.0,A1,Downtown / Financial District,3.0,Ward 3,301.0,,INTERSECTION Commercial St & Richmond St,,Intersection,3318.0,42.362,-71.0526,Constituent Call,"(42.362, -71.0526)"
549322,101001354763,04/13/2015 10:04:16 AM,,06/11/2015 02:17:06 PM,ONTIME,Closed,Case Closed. Closed date : 2015-06-11 14:17:06.827 Case Resolved Bricks replaced.,Highway Maintenance,Public Works Department,Highway Maintenance,Highway Maintenance,PWDx_Highway Construction,PWDx,,,59 Warren St  Charlestown  MA  02129,3.0,1A,1.0,A15,Charlestown,2.0,Ward 2,203.0,CM,59 Warren St,2129.0,Address,143168.0,42.374,-71.0619,Constituent Call,"(42.374, -71.0619)"
549591,101001355136,04/13/2015 02:08:52 PM,,06/08/2015 02:14:24 PM,ONTIME,Closed,Case Closed. Closed date : 2015-06-08 14:14:24.123 Case Resolved Bricks replaced,Highway Maintenance,Public Works Department,Highway Maintenance,Highway Maintenance,PWDx_Highway Construction,PWDx,,,300 Commercial St  Boston  MA  02109,3.0,1B,1.0,A1,Downtown / Financial District,3.0,Ward 3,301.0,CM,300 Commercial St,2109.0,Address,36263.0,42.3652,-71.0515,Constituent Call,"(42.3652, -71.0515)"
549622,101001355183,04/13/2015 02:48:22 PM,,,ONTIME,Open,,Highway Maintenance,Public Works Department,Highway Maintenance,Highway Maintenance,PWDx_Sidewalk Repair,PWDx,,,131 Charles St  Boston  MA  02114,3.0,1B,8.0,A1,Beacon Hill,14.0,Ward 5,511.0,RC,131 Charles St,2114.0,Address,29100.0,42.36,-71.0706,Constituent Call,"(42.36, -71.0706)"
550136,101001355904,04/14/2015 10:54:00 AM,,05/27/2015 12:40:48 PM,ONTIME,Closed,Case Closed. Closed date : 2015-05-27 12:40:48.55 Case Resolved Missing bricks were replaced and additional bricks were reset.,Sidewalk Repair/Red Brick/North End,Public Works Department,Highway Maintenance,Highway Maintenance,PWDx_Highway Construction,PWDx,,https://cityworker.cityofboston.gov:8443/attachments/report/552d2a3f70b4685d4efe40e4/closed_photo/Report.jpg,84 Atlantic Ave  Boston  MA  02110,3.0,1B,1.0,A1,Downtown / Financial District,3.0,03,301.0,CM,84 Atlantic Ave,2110.0,Address,6357.0,42.3623,-71.0506,Constituent Call,"(42.3623, -71.0506)"
550863,101001356901,04/15/2015 10:31:01 AM,,04/22/2015 11:23:07 AM,ONTIME,Closed,Case Closed Duplicate of Existing Case,Highway Maintenance,Public Works Department,Highway Maintenance,Highway Maintenance,PWDx_District 1B: North End,PWDx,,,40 New Sudbury St  Boston  MA  02114,3.0,1B,1.0,A1,Boston,3.0,03,306.0,E,40 New Sudbury St,2114.0,Address,101187.0,42.3618,-71.0603,Constituent Call,"(42.3618, -71.0603)"
551015,101001357076,04/15/2015 01:06:12 PM,,04/16/2015 06:48:53 AM,ONTIME,Closed,Case Closed Duplicate of Existing Case Sent to construction unit,Highway Maintenance,Public Works Department,Highway Maintenance,Highway Maintenance,PWDx_District 1C: Downtown,PWDx,,,13-15 Worcester St  Roxbury  MA  02118,4.0,1C,7.0,D4,South End,6.0,Ward 9,902.0,RC,13-15 Worcester St,2118.0,Address,152361.0,42.3379,-71.0759,Constituent Call,"(42.3379, -71.0759)"
551118,101001357215,04/15/2015 02:56:55 PM,,04/15/2015 02:56:56 PM,ONTIME,Closed,Case Closed Internal Case,Highway Maintenance,Public Works Department,Highway Maintenance,Highway Maintenance,PWDx_District 06: West Roxbury and Roslindale,PWDx,,,374 Baker St  West Roxbury  MA  02132,12.0,06,6.0,E5,West Roxbury,12.0,Ward 20,2017.0,R1,374 Baker St,2132.0,Address,7726.0,42.2823,-71.1693,Employee Generated,"(42.2823, -71.1693)"
551121,101001357218,04/15/2015 02:58:26 PM,,04/15/2015 02:58:28 PM,ONTIME,Closed,Case Closed Internal Case,Highway Maintenance,Public Works Department,Highway Maintenance,Highway Maintenance,PWDx_District 1B: North End,PWDx,,,33 Temple St  Boston  MA  02114,3.0,1B,1.0,A1,Beacon Hill,3.0,Ward 3,306.0,E,33 Temple St,2114.0,Address,134156.0,42.3603,-71.0638,Employee Generated,"(42.3603, -71.0638)"
551127,101001357227,04/15/2015 03:02:49 PM,,04/15/2015 03:02:51 PM,ONTIME,Closed,Case Closed Internal Case,Highway Maintenance,Public Works Department,Highway Maintenance,Highway Maintenance,PWDx_District 06: West Roxbury and Roslindale,PWDx,,,140 Grove St  West Roxbury  MA  02132,12.0,06,6.0,E5,West Roxbury,12.0,Ward 20,2005.0,R2,140 Grove St,2132.0,Address,67402.0,42.2646,-71.1579,Employee Generated,"(42.2646, -71.1579)"
551173,101001357300,04/15/2015 03:43:46 PM,,04/16/2015 01:44:27 PM,ONTIME,Closed,Case Closed Case Noted Duplicate of a existing case sent to construction for repairs,Highway Maintenance,Public Works Department,Highway Maintenance,Highway Maintenance,PWDx_District 1C: Downtown,PWDx,,,INTERSECTION of Columbus Ave & Dartmouth St  Boston  MA,4.0,1C,2.0,D4,South End,6.0,Ward 4,401.0,,INTERSECTION Columbus Ave & Dartmouth St,,Intersection,3300.0,42.3458,-71.0752,Constituent Call,"(42.3458, -71.0752)"
551174,101001357301,04/15/2015 03:45:40 PM,,04/16/2015 09:10:27 AM,ONTIME,Closed,Case Closed Case Noted This location will be repaired under the Connect to Historic Boston project this summer.,Highway Maintenance,Public Works Department,Highway Maintenance,Highway Maintenance,PWDx_Highway Construction,PWDx,,,28-32 Atlantic Ave  Boston  MA  02110,3.0,1B,1.0,A1,Downtown / Financial District,3.0,03,301.0,CM,28-32 Atlantic Ave,2110.0,Address,6034.0,42.3633,-71.0503,Constituent Call,"(42.3633, -71.0503)"
551176,101001357303,04/15/2015 03:47:25 PM,,06/08/2015 02:07:40 PM,ONTIME,Closed,Case Closed. Closed date : 2015-06-08 14:07:40.03 Case Resolved Bricks replaced,Highway Maintenance,Public Works Department,Highway Maintenance,Highway Maintenance,PWDx_Highway Construction,PWDx,,,240-242 Tremont St  Boston  MA  02116,4.0,1C,2.0,A1,Downtown / Financial District,4.0,Ward 3,308.0,E,240-242 Tremont St,2116.0,Address,137462.0,42.3509,-71.0647,Constituent Call,"(42.3509, -71.0647)"
551238,101001357381,04/15/2015 05:31:36 PM,,06/08/2015 02:13:45 PM,ONTIME,Closed,Case Closed. Closed date : 2015-06-08 14:13:45.547 Case Resolved Bricks replaced,Highway Maintenance,Public Works Department,Highway Maintenance,Highway Maintenance,PWDx_Highway Construction,PWDx,,,INTERSECTION of Commercial St & Richmond St  Boston  MA,3.0,1B,1.0,A1,Downtown / Financial District,3.0,Ward 3,301.0,,INTERSECTION Commercial St & Richmond St,,Intersection,3318.0,42.362,-71.0526,Constituent Call,"(42.362, -71.0526)"
551772,101001358164,04/16/2015 01:48:53 PM,,04/22/2015 11:24:05 AM,ONTIME,Closed,Case Closed Duplicate of Existing Case,Highway Maintenance,Public Works Department,Highway Maintenance,Highway Maintenance,PWDx_District 1C: Downtown,PWDx,,,INTERSECTION of Columbus Ave & Dartmouth St  Boston  MA,4.0,1C,2.0,D4,South End,6.0,Ward 4,401.0,,INTERSECTION Columbus Ave & Dartmouth St,,Intersection,3300.0,42.3458,-71.0752,Constituent Call,"(42.3458, -71.0752)"
551822,101001358236,04/16/2015 02:54:07 PM,,04/16/2015 02:54:08 PM,ONTIME,Closed,Case Closed Internal Case,Highway Maintenance,Public Works Department,Highway Maintenance,Highway Maintenance,PWDx_District 06: West Roxbury and Roslindale,PWDx,,,91 Laurie Ave  West Roxbury  MA  02132,12.0,06,6.0,E5,West Roxbury,12.0,Ward 20,2016.0,R1,91 Laurie Ave,2132.0,Address,84332.0,42.2718,-71.1677,Employee Generated,"(42.2718, -71.1677)"
551934,101001358403,04/16/2015 04:54:18 PM,,06/08/2015 02:11:06 PM,ONTIME,Closed,Case Closed. Closed date : 2015-06-08 14:11:06.367 Case Noted,Highway Maintenance,Public Works Department,Highway Maintenance,Highway Maintenance,PWDx_Highway Construction,PWDx,,,100-128 Dartmouth St  Boston  MA  02116,4.0,1C,2.0,D4,South End,6.0,Ward 4,402.0,RC,100-128 Dartmouth St,2116.0,Address,46301.0,42.3461,-71.0756,Constituent Call,"(42.3461, -71.0756)"
552863,101001359785,04/19/2015 01:59:29 PM,,09/17/2015 10:46:26 AM,ONTIME,Closed,Case Closed. Closed date : 2015-09-17 10:46:26.94 Duplicate of Existing Case Duplicate of case 101000353793    If you have any further questions  or feel that this case was closed in error  please do not hesitate to contact me.    Michael Somers  Senior Civil Engineer  Construction Management Division  Boston Public Works  617-635-3831  Michael.Somers@Boston.gov,Highway Maintenance,Public Works Department,Highway Maintenance,Highway Maintenance,PWDx_Sidewalk Repair,PWDx,,,INTERSECTION of Columbus Ave & Dartmouth St  Boston  MA,4.0,1C,2.0,D4,South End,6.0,Ward 4,401.0,,INTERSECTION Columbus Ave & Dartmouth St,,Intersection,3300.0,42.3458,-71.0752,Constituent Call,"(42.3458, -71.0752)"
552909,101001359868,04/19/2015 06:56:49 PM,,05/01/2015 02:18:06 PM,ONTIME,Closed,Case Closed Duplicate of Existing Case Duplicate of case 101001355985    If you have any further questions  or feel that this case was closed or reallocated in error  please do not hesitate to contact me.    Michael Somers  Senior Civil Engineer  Construction Management Division  Boston Public Works  617-635-3831  Michael.Somers@Boston.gov,Highway Maintenance,Public Works Department,Highway Maintenance,Highway Maintenance,PWDx_Sidewalk Repair,PWDx,,,2 Atlantic Ave  Boston  MA  02110,3.0,1B,1.0,A1,Boston,3.0,03,301.0,C,2 Atlantic Ave,2110.0,Address,5977.0,42.3639,-71.0503,Constituent Call,"(42.3639, -71.0503)"
553422,101001360573,04/21/2015 10:56:49 AM,,09/10/2015 03:02:53 PM,ONTIME,Closed,Case Closed. Closed date : 2015-09-10 15:02:53.61 Duplicate of Existing Case Duplicate of case 101001355183    If you have any further questions  or feel that this case was closed  or reallocated in error  please do not hesitate to contact me.    Michael Somers  Senior Civil Engineer  Construction Management Division  Boston Public Works  617-635-3831	  Michael.Somers@Boston.gov,Highway Maintenance,Public Works Department,Highway Maintenance,Highway Maintenance,PWDx_Sidewalk Repair,PWDx,,,133-135 Charles St  Boston  MA  02114,3.0,1B,8.0,A1,Beacon Hill,14.0,Ward 5,511.0,RC,133-135 Charles St,2114.0,Address,29104.0,42.3601,-71.0706,Constituent Call,"(42.3601, -71.0706)"
554066,101001361462,04/22/2015 01:15:28 PM,,06/09/2015 12:12:05 PM,ONTIME,Closed,Case Closed. Closed date : 2015-06-09 12:12:05.677 Case Resolved Bricks replaced,Highway Maintenance,Public Works Department,Highway Maintenance,Highway Maintenance,PWDx_Highway Construction,PWDx,,,INTERSECTION of Columbus Ave & Isabella St  Boston  MA,4.0,1C,2.0,D4,Back Bay,6.0,Ward 5,501.0,,INTERSECTION Columbus Ave & Isabella St,,Intersection,3301.0,42.3488,-71.0716,Constituent Call,"(42.3488, -71.0716)"
556473,101001364824,04/27/2015 03:03:16 PM,,04/27/2015 03:03:17 PM,ONTIME,Closed,Case Closed Internal Case,Highway Maintenance,Public Works Department,Highway Maintenance,Highway Maintenance,PWDx_District 03: North Dorchester,PWDx,,,INTERSECTION of Marshfield St & Norfolk Ave  Dorchester  MA,7.0,03,7.0,B2,Roxbury,13.0,Ward 8,806.0,,INTERSECTION Marshfield St & Norfolk Ave,,Intersection,7113.0,42.3235,-71.0677,Employee Generated,"(42.3235, -71.0677)"
556474,101001364826,04/27/2015 03:03:36 PM,,04/27/2015 03:03:38 PM,ONTIME,Closed,Case Closed Internal Case,Highway Maintenance,Public Works Department,Highway Maintenance,Highway Maintenance,PWDx_District 03: North Dorchester,PWDx,,,187 Norfolk Ave  Roxbury  MA  02119,7.0,03,7.0,B2,Roxbury,13.0,08,806.0,C,187 Norfolk Ave,2119.0,Address,168159.0,42.3248,-71.0692,Employee Generated,"(42.3248, -71.0692)"
556476,101001364830,04/27/2015 03:04:21 PM,,04/27/2015 03:04:23 PM,ONTIME,Closed,Case Closed Internal Case,Highway Maintenance,Public Works Department,Highway Maintenance,Highway Maintenance,PWDx_District 03: North Dorchester,PWDx,,,INTERSECTION of Boston St & Mayhew St  Dorchester  MA,6.0,03,2.0,C6,Dorchester,5.0,Ward 7,709.0,,INTERSECTION Boston St & Mayhew St,,Intersection,1659.0,42.322,-71.0612,Employee Generated,"(42.322, -71.0612)"
556477,101001364831,04/27/2015 03:04:48 PM,,04/27/2015 03:04:51 PM,ONTIME,Closed,Case Closed Internal Case,Highway Maintenance,Public Works Department,Highway Maintenance,Highway Maintenance,PWDx_District 03: North Dorchester,PWDx,,,INTERSECTION of Boston St & Harvest St  Dorchester  MA,6.0,03,2.0,C6,Dorchester,5.0,Ward 7,708.0,,INTERSECTION Boston St & Harvest St,,Intersection,1664.0,42.3237,-71.0602,Employee Generated,"(42.3237, -71.0602)"
556480,101001364834,04/27/2015 03:06:00 PM,,04/27/2015 03:06:02 PM,ONTIME,Closed,Case Closed Internal Case,Highway Maintenance,Public Works Department,Highway Maintenance,Highway Maintenance,PWDx_District 03: North Dorchester,PWDx,,,301-311 Columbia Rd  Dorchester  MA  02121,7.0,03,4.0,C11,Roxbury,13.0,Ward 14,1401.0,E,301-311 Columbia Rd,2121.0,Address,35214.0,42.309,-71.0735,Employee Generated,"(42.309, -71.0735)"
556482,101001364836,04/27/2015 03:06:32 PM,,04/27/2015 03:06:34 PM,ONTIME,Closed,Case Closed Internal Case,Highway Maintenance,Public Works Department,Highway Maintenance,Highway Maintenance,PWDx_District 03: North Dorchester,PWDx,,,INTERSECTION of Davidson Ave & Richfield St  Dorchester  MA,7.0,03,4.0,C11,Dorchester,8.0,Ward 15,1502.0,,INTERSECTION Davidson Ave & Richfield St,,Intersection,3931.0,42.3064,-71.0703,Employee Generated,"(42.3064, -71.0703)"
556483,101001364837,04/27/2015 03:06:55 PM,,04/27/2015 03:06:57 PM,ONTIME,Closed,Case Closed Internal Case,Highway Maintenance,Public Works Department,Highway Maintenance,Highway Maintenance,PWDx_District 03: North Dorchester,PWDx,,,65 Richfield St  Dorchester  MA  02121,7.0,03,4.0,C11,Dorchester,8.0,Ward 15,1502.0,R3,65 Richfield St,2121.0,Address,298306.0,42.3061,-71.0704,Employee Generated,"(42.3061, -71.0704)"
556485,101001364839,04/27/2015 03:07:27 PM,,04/27/2015 03:07:29 PM,ONTIME,Closed,Case Closed Internal Case,Highway Maintenance,Public Works Department,Highway Maintenance,Highway Maintenance,PWDx_District 03: North Dorchester,PWDx,,,56A Topliff St  Dorchester  MA  02122,7.0,03,3.0,C11,Dorchester,8.0,Ward 15,1507.0,R3,56A Topliff St,2122.0,Address,136244.0,42.303,-71.0679,Employee Generated,"(42.303, -71.0679)"
556487,101001364841,04/27/2015 03:08:14 PM,,04/27/2015 03:08:16 PM,ONTIME,Closed,Case Closed Internal Case,Highway Maintenance,Public Works Department,Highway Maintenance,Highway Maintenance,PWDx_District 03: North Dorchester,PWDx,,,INTERSECTION of Draper St & Homes Ave  Dorchester  MA,7.0,03,3.0,C11,Dorchester,8.0,Ward 15,1507.0,,INTERSECTION Draper St & Homes Ave,,Intersection,4232.0,42.304,-71.0646,Employee Generated,"(42.304, -71.0646)"
556488,101001364842,04/27/2015 03:08:39 PM,,04/27/2015 03:08:41 PM,ONTIME,Closed,Case Closed Internal Case,Highway Maintenance,Public Works Department,Highway Maintenance,Highway Maintenance,PWDx_District 03: North Dorchester,PWDx,,,INTERSECTION of Columbia Rd & Hamilton St  Dorchester  MA,7.0,03,3.0,C11,Dorchester,8.0,Ward 15,1501.0,,INTERSECTION Columbia Rd & Hamilton St,,Intersection,3225.0,42.3101,-71.0723,Employee Generated,"(42.3101, -71.0723)"
556489,101001364843,04/27/2015 03:09:04 PM,,04/27/2015 03:09:06 PM,ONTIME,Closed,Case Closed Internal Case,Highway Maintenance,Public Works Department,Highway Maintenance,Highway Maintenance,PWDx_District 03: North Dorchester,PWDx,,,349 Columbia Rd  Dorchester  MA  02125,7.0,03,3.0,C11,Dorchester,8.0,Ward 15,1501.0,R3,349 Columbia Rd,2125.0,Address,35226.0,42.3103,-71.0713,Employee Generated,"(42.3103, -71.0713)"
556564,101001364950,04/27/2015 05:03:34 PM,,06/08/2015 02:11:44 PM,ONTIME,Closed,Case Closed. Closed date : 2015-06-08 14:11:44.3 Case Invalid Nothing found,Highway Maintenance,Public Works Department,Highway Maintenance,Highway Maintenance,PWDx_Highway Construction,PWDx,,,109-111 Dartmouth St  Boston  MA  02116,4.0,1C,2.0,D4,South End,6.0,Ward 4,402.0,RC,109-111 Dartmouth St,2116.0,Address,46303.0,42.3465,-71.0753,Constituent Call,"(42.3465, -71.0753)"
557021,101001365565,04/28/2015 01:14:59 PM,,05/18/2015 01:38:49 PM,ONTIME,Closed,Case Closed. Closed date : 2015-05-18 13:38:49.923 Case Resolved Bricks were reset to level.,Highway Maintenance,Public Works Department,Highway Maintenance,Highway Maintenance,PWDx_Highway Construction,PWDx,,https://cityworker.cityofboston.gov:8443/attachments/report/553fc028d052396a5e06e0dd/closed_photo/Report.jpg,9 Milford St  Roxbury  MA  02118,4.0,1C,2.0,D4,South End,4.0,Ward 3,307.0,R4,9 Milford St,2118.0,Address,95415.0,42.3438,-71.0688,Constituent Call,"(42.3438, -71.0688)"
557024,101001365569,04/28/2015 01:17:36 PM,,06/24/2015 05:41:14 AM,ONTIME,Closed,Case Closed. Closed date : 2015-06-24 05:41:14.773 Case Resolved Bricks replaced by the Construction Crew.,Sidewalk Repair/Red Brick/South End,Public Works Department,Highway Maintenance,Highway Maintenance,PWDx_Highway Construction,PWDx,,,32 Hanson St  Roxbury  MA  02118,4.0,1C,2.0,D4,South End,4.0,Ward 3,307.0,R3,32 Hanson St,2118.0,Address,69302.0,42.3438,-71.0706,Constituent Call,"(42.3438, -71.0706)"
557026,101001365571,04/28/2015 01:23:00 PM,,,ONTIME,Open,,Sidewalk Repair/Red Brick/South End,Public Works Department,Highway Maintenance,Highway Maintenance,PWDx_Sidewalk Repair,PWDx,,,INTERSECTION of Bond St & Hanson St  Roxbury  MA,4.0,1C,2.0,D4,South End,4.0,Ward 3,307.0,,INTERSECTION Bond St & Hanson St,,Intersection,1642.0,42.3433,-71.0696,Constituent Call,"(42.3433, -71.0696)"
557027,101001365572,04/28/2015 01:25:00 PM,,01/11/2016 01:18:46 PM,ONTIME,Closed,Case Closed. Closed date : 2016-01-11 13:18:46.057 Duplicate of Existing Case Duplicate of existing case 101000425779    If you have any further questions  or feel that this case was closed in error  please do not hesitate to contact me.    Michael Somers  Senior Civil Engineer  Construction Management Division  Boston Public Works  617-635-3831  Michael.Somers@Boston.gov,Sidewalk Repair/Red Brick/South End,Public Works Department,Highway Maintenance,Highway Maintenance,PWDx_Sidewalk Repair,PWDx,,,16 Milford St  Roxbury  MA  02118,4.0,1C,2.0,D4,South End,4.0,Ward 3,307.0,R1,16 Milford St,2118.0,Address,95329.0,42.344,-71.0698,Constituent Call,"(42.344, -71.0698)"
557028,101001365573,04/28/2015 01:26:00 PM,,09/17/2015 10:54:16 AM,ONTIME,Closed,Case Closed. Closed date : 2015-09-17 10:54:16.39 Duplicate of Existing Case Duplicate of case 101000425779    If you have any further questions  or feel that this case was closed  or reallocated in error  please do not hesitate to contact me.    Michael Somers  Senior Civil Engineer  Construction Management Division  Boston Public Works  617-635-3831	  Michael.Somers@Boston.gov,Sidewalk Repair/Red Brick/South End,Public Works Department,Highway Maintenance,Highway Maintenance,PWDx_Sidewalk Repair,PWDx,,,18 Milford St  Roxbury  MA  02118,4.0,1C,2.0,D4,South End,4.0,Ward 3,307.0,R4,18 Milford St,2118.0,Address,95334.0,42.344,-71.0699,Constituent Call,"(42.344, -71.0699)"
557031,101001365576,04/28/2015 01:28:00 PM,,,ONTIME,Open,,Sidewalk Repair/Red Brick/South End,Public Works Department,Highway Maintenance,Highway Maintenance,PWDx_Sidewalk Repair,PWDx,,,24 Milford St  Roxbury  MA  02118,4.0,1C,2.0,D4,South End,4.0,Ward 3,307.0,CM,24 Milford St,2118.0,Address,95354.0,42.3441,-71.0701,Constituent Call,"(42.3441, -71.0701)"
557032,101001365577,04/28/2015 01:29:08 PM,,05/01/2015 10:46:58 AM,ONTIME,Closed,Case Closed Case Resolved Missing bricks were replaced and additional bricks were reset.,Highway Maintenance,Public Works Department,Highway Maintenance,Highway Maintenance,PWDx_Highway Construction,PWDx,,https://cityworker.cityofboston.gov:8443/attachments/report/553fc371d052396a5e06e1b4/closed_photo/Report.jpg,544 Tremont St  Roxbury  MA  02118,4.0,1C,2.0,D4,South End,4.0,03,307.0,,544 Tremont St,2118.0,Address,351750.0,42.3594,-71.0587,Constituent Call,"(0, 0)"
557033,101001365578,04/28/2015 01:30:35 PM,,04/29/2015 05:08:42 PM,ONTIME,Closed,Case Closed Case Invalid duplicate,Highway Maintenance,Public Works Department,Highway Maintenance,Highway Maintenance,PWDx_Highway Construction,PWDx,,,24 Dwight St  Roxbury  MA  02118,4.0,1C,2.0,D4,South End,4.0,Ward 3,307.0,CM,24 Dwight St,2118.0,Address,50348.0,42.3441,-71.0688,Constituent Call,"(42.3441, -71.0688)"
557034,101001365579,04/28/2015 01:32:21 PM,,04/28/2015 02:14:23 PM,ONTIME,Closed,Case Closed Case Noted Duplicate of a existing case sent to construction for repair,Highway Maintenance,Public Works Department,Highway Maintenance,Highway Maintenance,PWDx_District 1C: Downtown,PWDx,,https://cityworker.cityofboston.gov:8443/attachments/report/553fc438d052396a5e06e1f7/closed_photo/Report.jpg,INTERSECTION of Tremont St & Waltham St  Boston  MA,4.0,1C,2.0,D4,South End,4.0,Ward 3,307.0,,INTERSECTION Tremont St & Waltham St,,Intersection,8550.0,42.344,-71.0715,Constituent Call,"(42.344, -71.0715)"
557037,101001365582,04/28/2015 01:35:58 PM,,04/28/2015 02:02:27 PM,ONTIME,Closed,Case Closed Case Noted Duplicate of a existing case sent to construction for repair,Highway Maintenance,Public Works Department,Highway Maintenance,Highway Maintenance,PWDx_District 1C: Downtown,PWDx,,https://cityworker.cityofboston.gov:8443/attachments/report/553fc50ad052396a5e06e23e/closed_photo/Report.jpg,INTERSECTION of Hanson St & Tremont St  Boston  MA,4.0,1C,2.0,D4,South End,4.0,Ward 3,307.0,,INTERSECTION Hanson St & Tremont St,,Intersection,5621.0,42.3443,-71.0711,Constituent Call,"(42.3443, -71.0711)"
557499,101001366187,04/29/2015 09:04:24 AM,,04/30/2015 09:23:45 AM,ONTIME,Closed,Case Closed Case Resolved Missing bricks were replaced and additional bricks were reset.,Highway Maintenance,Public Works Department,Highway Maintenance,Highway Maintenance,PWDx_Highway Construction,PWDx,,,1295-1299 Boylston St  Boston  MA  02215,4.0,10A,8.0,D4,Fenway / Kenmore / Audubon Circle / Longwood,14.0,Ward 5,502.0,C,1295-1299 Boylston St,2215.0,Address,18079.0,42.3451,-71.0978,Constituent Call,"(42.3451, -71.0978)"
557619,101001366356,04/29/2015 10:32:16 AM,,05/05/2015 01:43:11 PM,ONTIME,Closed,Case Closed. Closed date : 2015-05-05 13:43:11.627 Case Resolved Missing bricks were replaced and additional bricks were reset.,Highway Maintenance,Public Works Department,Highway Maintenance,Highway Maintenance,PWDx_Highway Construction,PWDx,,https://cityworker.cityofboston.gov:8443/attachments/report/5540eb83d052396a5e0708a3/closed_photo/Report.jpg,314-330 W Second St  South Boston  MA  02127,6.0,05,2.0,C6,South Boston / South Boston Waterfront,5.0,06,604.0,CM,314-330 W Second St,2127.0,Address,124672.0,42.339,-71.0473,Constituent Call,"(42.339, -71.0473)"
557778,101001366600,04/29/2015 01:50:59 PM,,04/29/2015 01:51:01 PM,ONTIME,Closed,Case Closed Internal Case,Highway Maintenance,Public Works Department,Highway Maintenance,Highway Maintenance,PWDx_District 06: West Roxbury and Roslindale,PWDx,,,282 Beech St  Roslindale  MA  02131,12.0,06,5.0,E5,Roslindale,10.0,Ward 20,2009.0,R1,282 Beech St,2131.0,Address,13183.0,42.2805,-71.1402,Employee Generated,"(42.2805, -71.1402)"
558255,101001367291,04/30/2015 12:37:26 PM,,05/07/2015 02:24:55 PM,ONTIME,Closed,Case Closed. Closed date : 2015-05-07 14:24:55.803 Case Noted A new case was created because this is not categorized as a sidewalk make safe it was sent down for permanent sidewalk repair refer to new case number 101001372716,Highway Maintenance,Public Works Department,Highway Maintenance,Highway Maintenance,PWDx_District 07: South Dorchester,PWDx,,,6-8 Denvir St  Dorchester  MA  02124,8.0,07,3.0,C11,Dorchester,7.0,Ward 16,1606.0,R3,6-8 Denvir St,2124.0,Address,47441.0,42.2895,-71.0623,Constituent Call,"(42.2895, -71.0623)"
558261,101001367300,04/30/2015 12:45:52 PM,,05/01/2015 02:47:33 PM,ONTIME,Closed,Case Closed Case Resolved bricks replaced.  location made safe,Highway Maintenance,Public Works Department,Highway Maintenance,Highway Maintenance,PWDx_District 03: North Dorchester,PWDx,,https://cityworker.cityofboston.gov:8443/attachments/report/55425c4ed052396a5e0734d2/closed_photo/Report.jpg,745 Dudley St  Dorchester  MA  02125,7.0,03,7.0,B2,Dorchester,13.0,Ward 13,1305.0,C,745 Dudley St,2125.0,Address,157529.0,42.3176,-71.0668,Constituent Call,"(42.3176, -71.0668)"
558696,101001367913,05/01/2015 09:29:57 AM,,05/01/2015 11:56:10 AM,ONTIME,Closed,Case Closed Duplicate of Existing Case,Highway Maintenance,Public Works Department,Highway Maintenance,Highway Maintenance,PWDx_District 10A: Roxbury,PWDx,,,INTERSECTION of Van Ness St & Yawkey Way  Boston  MA,4.0,10A,8.0,D4,Fenway / Kenmore / Audubon Circle / Longwood,14.0,Ward 5,502.0,,INTERSECTION Van Ness St & Yawkey Way,,Intersection,8588.0,42.3454,-71.0982,Constituent Call,"(42.3454, -71.0982)"
558993,101001368365,05/01/2015 04:07:00 PM,,05/15/2015 01:17:33 PM,ONTIME,Closed,Case Closed. Closed date : 2015-05-15 13:17:33.46 Case Resolved Missing bricks were replaced and additional bricks were reset.,Sidewallk Repair/Red Brick/South End,Public Works Department,Highway Maintenance,Highway Maintenance,PWDx_Highway Construction,PWDx,,https://cityworker.cityofboston.gov:8443/attachments/report/5543dd18d05233cdf77fe4d5/closed_photo/Report.jpg,129 Tremont St  Boston  MA  02108,3.0,1C,1.0,A1,Downtown / Financial District,3.0,03,306.0,C,129 Tremont St,2108.0,Address,170408.0,42.3562,-71.0619,Constituent Call,"(42.3562, -71.0619)"
559716,101001369550,05/04/2015 12:20:00 PM,,06/08/2015 02:10:22 PM,ONTIME,Closed,Case Closed. Closed date : 2015-06-08 14:10:22.737 Case Resolved Bricks replaced,Highway Maintenance,Public Works Department,Highway Maintenance,Highway Maintenance,PWDx_Highway Construction,PWDx,,,23 Rutland Sq  Roxbury  MA  02118,4.0,1C,7.0,D4,South End,6.0,Ward 4,404.0,R1,23 Rutland Sq,2118.0,Address,120058.0,42.3417,-71.0778,Constituent Call,"(42.3417, -71.0778)"
559722,101001369557,05/04/2015 12:24:00 PM,,05/11/2015 07:50:14 AM,ONTIME,Closed,Case Closed. Closed date : 2015-05-11 07:50:14.17 Duplicate of Existing Case,Highway Maintenance,Public Works Department,Highway Maintenance,Highway Maintenance,PWDx_Highway Construction,PWDx,,,23 Rutland Sq  Roxbury  MA  02118,4.0,1C,7.0,D4,South End,6.0,Ward 4,404.0,R1,23 Rutland Sq,2118.0,Address,120058.0,42.3417,-71.0778,Constituent Call,"(42.3417, -71.0778)"
559798,101001369661,05/04/2015 01:49:00 PM,,05/27/2015 01:01:44 PM,ONTIME,Closed,Case Closed. Closed date : 2015-05-27 13:01:44.363 Case Resolved Bricks replaced by construction crew.,Highway Maintenance,Public Works Department,Highway Maintenance,Highway Maintenance,PWDx_Sidewalk Repair,PWDx,,,133-135 Charles St  Boston  MA  02114,3.0,1B,8.0,A1,Beacon Hill,14.0,Ward 5,511.0,RC,133-135 Charles St,2114.0,Address,29104.0,42.3601,-71.0706,Constituent Call,"(42.3601, -71.0706)"
560987,101001371346,05/06/2015 10:40:00 AM,,05/15/2015 10:09:01 AM,ONTIME,Closed,Case Closed. Closed date : 2015-05-15 10:09:01.387 Case Resolved Bricks were reset to level.,Highway Maintenance,Public Works Department,Highway Maintenance,Highway Maintenance,PWDx_Highway Construction,PWDx,,https://cityworker.cityofboston.gov:8443/attachments/report/554a27e0d0527bbb35857d23/closed_photo/Report.jpg,220-230 Commercial St  Boston  MA  02109,3.0,1B,1.0,A1,Downtown / Financial District,3.0,Ward 3,301.0,CM,220-230 Commercial St,2109.0,Address,163683.0,42.3636,-71.0516,Constituent Call,"(42.3636, -71.0516)"
561003,101001371368,05/06/2015 10:47:00 AM,,06/24/2015 05:39:55 AM,ONTIME,Closed,Case Closed. Closed date : 2015-06-24 05:39:55.497 Case Resolved Sidewalk fixed and bricks replaced by the Construction Crew.,Sidewalk Repair/Red Brick/South End,Public Works Department,Highway Maintenance,Highway Maintenance,PWDx_Highway Construction,PWDx,,,86 Berkeley St  Boston  MA  02116,4.0,1C,2.0,D4,South End,6.0,Ward 5,501.0,RC,86 Berkeley St,2116.0,Address,15063.0,42.3473,-71.0713,Constituent Call,"(42.3473, -71.0713)"
561893,101001372759,05/07/2015 03:05:00 PM,,,ONTIME,Open,,Highway Maintenance,Public Works Department,Highway Maintenance,Highway Maintenance,INFO01_GenericeFormforOtherServiceRequestTypes,INFO,,,180 Morton St  Jamaica Plain  MA  02130,9.0,02,7.0,B2,Greater Mattapan,13.0,12,1207.0,,180 Morton St,2130.0,Address,158157.0,42.2987,-71.1007,Constituent Call,"(42.2987, -71.1007)"
563735,101001375579,05/12/2015 11:23:00 AM,,05/14/2015 01:37:49 PM,ONTIME,Closed,Case Closed. Closed date : 2015-05-14 13:37:49.547 Case Noted,Highway Maintenance,Public Works Department,Highway Maintenance,Highway Maintenance,PWDx_Highway Construction,PWDx,,,INTERSECTION of Clinton St & North St  Boston  MA,3.0,1B,1.0,A1,Downtown / Financial District,3.0,Ward 3,301.0,,INTERSECTION Clinton St & North St,,Intersection,3148.0,42.3608,-71.0559,Constituent Call,"(42.3608, -71.0559)"
563745,101001375596,05/12/2015 11:36:00 AM,,05/13/2015 07:58:21 AM,ONTIME,Closed,Case Closed. Closed date : 2015-05-13 07:58:21.777 Duplicate of Existing Case,Highway Maintenance,Public Works Department,Highway Maintenance,Highway Maintenance,PWDx_Highway Construction,PWDx,,,INTERSECTION of Clinton St & North St  Boston  MA,3.0,1B,1.0,A1,Downtown / Financial District,3.0,Ward 3,301.0,,INTERSECTION Clinton St & North St,,Intersection,3148.0,42.3608,-71.0559,Constituent Call,"(42.3608, -71.0559)"
564358,101001376487,05/13/2015 10:39:00 AM,,09/17/2015 10:12:22 AM,ONTIME,Closed,Case Closed. Closed date : 2015-09-17 10:12:22.12 Duplicate of Existing Case Duplicate of case 101001068981    If you have any further questions  or feel that this case was closed  or reallocated in error  please do not hesitate to contact me.    Michael Somers  Senior Civil Engineer  Construction Management Division  Boston Public Works  617-635-3831	  Michael.Somers@Boston.gov,Highway Maintenance,Public Works Department,Highway Maintenance,Highway Maintenance,PWDx_Sidewalk Repair,PWDx,,,80 W Concord St  Roxbury  MA  02118,4.0,1C,7.0,D4,South End,6.0,Ward 9,902.0,CM,80 W Concord St,2118.0,Address,41971.0,42.3383,-71.0757,Constituent Call,"(42.3383, -71.0757)"
564460,101001376620,05/13/2015 12:17:00 PM,,05/14/2015 01:39:32 PM,ONTIME,Closed,Case Closed. Closed date : 2015-05-14 13:39:32.627 Case Noted This location is in the City of Brookeline. Not City of Boston jurisdiction.,Highway Maintenance,Public Works Department,Highway Maintenance,Highway Maintenance,INFO_Reallocation From Dept,INFO,,,INTERSECTION of Commonwealth Ave & Saint Marys St  Boston  MA,,10A,8.0,D4,Fenway / Kenmore / Audubon Circle / Longwood,14.0,Ward 21,2102.0,,INTERSECTION Commonwealth Ave & Saint Marys St,,Intersection,3383.0,42.3499,-71.1066,Constituent Call,"(42.3499, -71.1066)"
564677,101001376936,05/13/2015 04:07:00 PM,,11/11/2015 03:57:01 PM,ONTIME,Closed,Case Closed. Closed date : 2015-11-11 15:57:01.99 Duplicate of Existing Case Duplicate of case 101000379983    If you have any further questions  or feel that this case was closed  or reallocated in error  please do not hesitate to contact me.    Michael Somers  Senior Civil Engineer  Construction Management Division  Boston Public Works  617-635-3831	  Michael.Somers@Boston.gov,Sidewalk Repair/Red Brick/South End,Public Works Department,Highway Maintenance,Highway Maintenance,PWDx_Highway Construction,PWDx,,,1-4 Saint George St  Roxbury  MA  02118,4.0,1C,2.0,D4,South End,6.0,08,802.0,,1-4 Saint George St,2118.0,Address,169938.0,42.3386,-71.0716,Constituent Call,"(42.3386, -71.0716)"
564678,101001376937,05/13/2015 04:08:00 PM,,06/24/2015 05:38:09 AM,ONTIME,Closed,Case Closed. Closed date : 2015-06-24 05:38:09.763 Case Resolved Bricks replaced and repaired by the Construction Crew.,Sidewalk Repair/Red Brick/South End,Public Works Department,Highway Maintenance,Highway Maintenance,PWDx_Highway Construction,PWDx,,,66 Waltham St  Roxbury  MA  02118,4.0,1C,2.0,D4,South End,4.0,Ward 3,307.0,CM,66 Waltham St,2118.0,Address,170918.0,42.3426,-71.0703,Constituent Call,"(42.3426, -71.0703)"
565103,101001377532,05/14/2015 12:15:00 PM,,06/23/2015 06:04:54 AM,ONTIME,Closed,Case Closed. Closed date : 2015-06-23 06:04:54.483 Case Noted Pullbox needs to be raised.,Highway Maintenance,Public Works Department,Highway Maintenance,Highway Maintenance,PWDx_Highway Construction,PWDx,,,1 North Sq  Boston  MA  02113,3.0,1B,1.0,A1,Downtown / Financial District,3.0,Ward 3,303.0,RC,1 North Sq,2113.0,Address,168243.0,42.364,-71.0531,Constituent Call,"(42.364, -71.0531)"
566309,101001379254,05/17/2015 07:14:00 PM,05/17/2017 12:00:00 AM,06/01/2015 08:08:04 AM,ONTIME,Closed,Case Closed. Closed date : 2015-06-01 08:08:04.22 Case Resolved Missing bricks were replaced and additional bricks were reset.,Sidewalk Repair/Red Brick/South End,Public Works Department,Highway Maintenance,Highway Maintenance,PWDx_Highway Construction,PWDx,,https://cityworker.cityofboston.gov:8443/attachments/report/555920e9d052e20d443cf613/closed_photo/Report.jpg,118 Pembroke St  Roxbury  MA  02118,4.0,1C,2.0,D4,South End,6.0,Ward 4,403.0,CM,118 Pembroke St,2118.0,Address,109011.0,42.3427,-71.0773,Constituent Call,"(42.3427, -71.0773)"
566816,101001379978,05/18/2015 03:12:45 PM,,05/18/2015 03:12:47 PM,ONTIME,Closed,Case Closed. Closed date : 2015-05-18 15:12:47.69 Internal Case,Highway Maintenance,Public Works Department,Highway Maintenance,Highway Maintenance,PWDx_District 03: North Dorchester,PWDx,,,845-847 Dorchester Ave  Dorchester  MA  02125,6.0,03,2.0,C6,Dorchester,5.0,Ward 7,709.0,RC,845-847 Dorchester Ave,2125.0,Address,48754.0,42.3219,-71.057,Employee Generated,"(42.3219, -71.057)"
566819,101001379982,05/18/2015 03:14:09 PM,,05/18/2015 03:14:11 PM,ONTIME,Closed,Case Closed. Closed date : 2015-05-18 15:14:11.577 Internal Case,Highway Maintenance,Public Works Department,Highway Maintenance,Highway Maintenance,PWDx_District 03: North Dorchester,PWDx,,,INTERSECTION of Boston St & W Howell St  Dorchester  MA,6.0,03,2.0,C6,Dorchester,5.0,Ward 7,708.0,,INTERSECTION Boston St & W Howell St,,Intersection,1666.0,42.3253,-71.0592,Employee Generated,"(42.3253, -71.0592)"
567352,101001380756,05/19/2015 01:29:59 PM,,05/19/2015 01:30:04 PM,ONTIME,Closed,Case Closed. Closed date : 2015-05-19 13:30:04.437 Internal Case,Highway Maintenance,Public Works Department,Highway Maintenance,Highway Maintenance,PWDx_District 03: North Dorchester,PWDx,,,17 Lindsey St  Dorchester  MA  02124,7.0,03,4.0,C11,Dorchester,8.0,Ward 17,1702.0,E,17 Lindsey St,2124.0,Address,86526.0,42.2981,-71.0677,Employee Generated,"(42.2981, -71.0677)"
567425,101001380863,05/19/2015 03:14:00 PM,,06/11/2015 06:22:41 AM,ONTIME,Closed,Case Closed. Closed date : 2015-06-11 06:22:41.477 Case Resolved Bricks replaced,Highway Maintenance,Public Works Department,Highway Maintenance,Highway Maintenance,PWDx_Highway Construction,PWDx,,,66 Beacon St  Boston  MA  02114,3.0,1B,8.0,A1,Beacon Hill,14.0,Ward 5,503.0,RC,66 Beacon St,2114.0,Address,184837.0,42.3564,-71.0693,Constituent Call,"(42.3564, -71.0693)"
568147,101001381959,05/20/2015 06:44:00 PM,,06/23/2015 06:26:58 AM,ONTIME,Closed,Case Closed. Closed date : 2015-06-23 06:26:58.803 Case Resolved Bricks were repaired by the construction crew.,Sidewalk Repair/Red Brick/Downtown,Public Works Department,Highway Maintenance,Highway Maintenance,PWDx_Highway Construction,PWDx,,,35-41 Winter St  Boston  MA  02108,3.0,1C,1.0,A1,Downtown / Financial District,3.0,Ward 3,306.0,C,35-41 Winter St,2108.0,Address,150875.0,42.3561,-71.0616,Constituent Call,"(42.3561, -71.0616)"
568683,101001382823,05/21/2015 07:35:00 PM,,06/23/2015 10:41:45 AM,ONTIME,Closed,Case Closed. Closed date : 2015-06-23 10:41:45.813 Case Noted Project is underway to replace bricks,Highway Maintenance,Public Works Department,Highway Maintenance,Highway Maintenance,PWDx_Sidewalk Repair,PWDx,,,151 Cambridge St  Boston  MA  02114,3.0,1B,8.0,A1,Boston,3.0,3,305.0,E,151 Cambridge St,2114.0,Address,25246.0,42.3615,-71.065,Constituent Call,"(42.3615, -71.065)"
568814,101001383019,05/22/2015 09:06:00 AM,,06/19/2015 02:23:23 PM,ONTIME,Closed,Case Closed. Closed date : 2015-06-19 14:23:23.813 Case Resolved Bricks replaced,Highway Maintenance,Public Works Department,Highway Maintenance,Highway Maintenance,PWDx_Highway Construction,PWDx,,,1 Garden St  Boston  MA  02114,3.0,1B,8.0,A1,Beacon Hill,14.0,Ward 5,504.0,CD,1 Garden St,2114.0,Address,62438.0,42.3609,-71.0671,Constituent Call,"(42.3609, -71.0671)"
568990,101001383290,05/22/2015 12:29:00 PM,,05/22/2015 02:37:29 PM,ONTIME,Closed,Case Closed. Closed date : 2015-05-22 14:37:29.793 Case Noted please refer to crm# 101001393411.,Highway Maintenance,Public Works Department,Highway Maintenance,Highway Maintenance,PWDx_District 1C: Downtown,PWDx,,,143 Appleton St  Boston  MA  02116,4.0,1C,2.0,D4,South End,6.0,Ward 4,401.0,CM,143 Appleton St,2116.0,Address,3917.0,42.3451,-71.0754,Constituent Call,"(42.3451, -71.0754)"
569033,101001393355,05/22/2015 01:37:00 PM,,05/29/2015 05:46:13 AM,ONTIME,Closed,Case Closed. Closed date : 2015-05-29 05:46:13.473 Case Resolved Bricks replaced and sidewalk made safe.,Highway Maintenance,Public Works Department,Highway Maintenance,Highway Maintenance,PWDx_Highway Construction,PWDx,,,16 North Sq  Boston  MA  02113,3.0,1B,1.0,A1,Downtown / Financial District,3.0,Ward 3,303.0,CM,16 North Sq,2113.0,Address,103508.0,42.3636,-71.0534,Constituent Call,"(42.3636, -71.0534)"
570375,101001395308,05/26/2015 06:00:00 PM,,05/27/2015 07:03:46 AM,ONTIME,Closed,Case Closed. Closed date : 2015-05-27 07:03:46.367 Case Resolved Location has been made safe. This sidewalk will be referred for permanent repair. See case #101001395485 for status of the permanent repair.,Highway Maintenance,Public Works Department,Highway Maintenance,Highway Maintenance,PWDx_District 1B: North End,PWDx,,,220 Commercial St  Boston  MA  02109,3.0,1B,1.0,A1,Downtown / Financial District,3.0,Ward 3,301.0,CM,220 Commercial St,2109.0,Address,36232.0,42.3636,-71.0516,Constituent Call,"(42.3636, -71.0516)"
570617,101001395624,05/27/2015 09:17:00 AM,,05/27/2015 12:36:24 PM,ONTIME,Closed,Case Closed. Closed date : 2015-05-27 12:36:24.56 Case Noted Mt Vernon Place is a private way and the responsibility of the abutters.    If you have any further questions  or feel that this case was closed in error  please do not hesitate to contact me.    Michael Somers  Senior Civil Engineer  Construction Management Division  Boston Public Works  617-635-3831  Michael.Somers@Boston.gov,Highway Maintenance,Public Works Department,Highway Maintenance,Highway Maintenance,PWDx_Sidewalk Repair,PWDx,,,8 Mount Vernon Pl  Boston  MA  02108,3.0,1B,8.0,A1,Downtown / Financial District,14.0,Ward 5,503.0,R1,8 Mount Vernon Pl,2108.0,Address,98466.0,42.3578,-71.065,Constituent Call,"(42.3578, -71.065)"
572068,101001397737,05/29/2015 09:31:00 AM,,06/08/2015 02:15:07 PM,ONTIME,Closed,Case Closed. Closed date : 2015-06-08 14:15:07.377 Case Resolved Bricks replaced,Highway Maintenance,Public Works Department,Highway Maintenance,Highway Maintenance,PWDx_Highway Construction,PWDx,,,INTERSECTION of Clinton St & North St  Boston  MA,3.0,1B,1.0,A1,Downtown / Financial District,3.0,Ward 3,301.0,,INTERSECTION Clinton St & North St,,Intersection,3148.0,42.3608,-71.0559,Constituent Call,"(42.3608, -71.0559)"
572437,101001398218,05/29/2015 01:34:00 PM,,06/11/2015 06:20:06 AM,ONTIME,Closed,Case Closed. Closed date : 2015-06-11 06:20:06.367 Case Resolved Bricks replaced,Highway Maintenance,Public Works Department,Highway Maintenance,Highway Maintenance,PWDx_Highway Construction,PWDx,,,41 Irving St  Boston  MA  02114,3.0,1B,8.0,A1,Beacon Hill,14.0,Ward 5,504.0,A,41 Irving St,2114.0,Address,78962.0,42.3599,-71.0665,Constituent Call,"(42.3599, -71.0665)"
574080,101001400591,06/02/2015 11:30:00 AM,,06/12/2015 09:33:17 AM,ONTIME,Closed,Case Closed. Closed date : 2015-06-12 09:33:17.47 Case Resolved Repaired meter box 6/11,Highway Maintenance,Public Works Department,Highway Maintenance,Highway Maintenance,BWSC_All Cases,BWSC,,,31 Grove St  Boston  MA  02114,3.0,1B,8.0,A1,Beacon Hill,14.0,Ward 5,504.0,A,31 Grove St,2114.0,Address,67526.0,42.36,-71.0688,Constituent Call,"(42.36, -71.0688)"
574246,101001400840,06/02/2015 02:58:00 PM,,,ONTIME,Open,,Highway Maintenance,Public Works Department,Highway Maintenance,Highway Maintenance,PWDx_Sidewalk Repair,PWDx,,,150-130 Appleton St  Boston  MA  02116,4.0,1C,2.0,D4,South End,6.0,Ward 4,401.0,CM,150-130 Appleton St,2116.0,Address,3924.0,42.3447,-71.0757,Constituent Call,"(42.3447, -71.0757)"
574662,101001401515,06/03/2015 11:11:00 AM,,06/11/2015 06:21:40 AM,ONTIME,Closed,Case Closed. Closed date : 2015-06-11 06:21:40.827 Case Resolved Bricks replaced,Highway Maintenance,Public Works Department,Highway Maintenance,Highway Maintenance,PWDx_Highway Construction,PWDx,,,INTERSECTION of Bulfinch Pl & New Chardon St  Boston  MA,3.0,1B,1.0,A1,Downtown / Financial District,3.0,Ward 3,306.0,,INTERSECTION Bulfinch Pl & New Chardon St,,Intersection,2166.0,42.3622,-71.0622,Constituent Call,"(42.3622, -71.0622)"
574973,101001401961,06/03/2015 05:55:00 PM,,06/04/2015 08:36:19 AM,ONTIME,Closed,Case Closed. Closed date : 2015-06-04 08:36:19.977 Case Invalid Could not locate a hole on sidewalk need a better location,Highway Maintenance,Public Works Department,Highway Maintenance,Highway Maintenance,PWDx_District 1B: North End,PWDx,,https://cityworker.cityofboston.gov:8443/attachments/report/556f77e6d052e132f6537e41/closed_photo/Report.jpg,1-11 Court St  Boston  MA  02108,3.0,1B,1.0,A1,Downtown / Financial District,3.0,Ward 3,306.0,C,1-11 Court St,2108.0,Address,43806.0,42.359,-71.0579,Constituent Call,"(42.359, -71.0579)"
575099,101001402130,06/04/2015 08:00:00 AM,,11/20/2015 03:13:04 PM,ONTIME,Closed,Case Closed. Closed date : 2015-11-20 15:13:04.407 Case Resolved This location has been inspected and all repairs appear to have been made.    If you have any further questions  or feel that this case was closed in error  please do not hesitate to contact me.    Michael Somers  Senior Civil Engineer  Construction Management Division  Boston Public Works  617-635-3831	  Michael.Somers@Boston.gov,Highway Maintenance,Public Works Department,Highway Maintenance,Highway Maintenance,PWDx_Sidewalk Repair,PWDx,,,664-664R Bennington St  East Boston  MA  02128,1.0,09,1.0,A7,East Boston,1.0,Ward 1,111.0,R2,664-664R Bennington St,2128.0,Address,14860.0,42.3842,-71.0147,Constituent Call,"(42.3842, -71.0147)"
575433,101001402641,06/04/2015 02:15:00 PM,,06/05/2015 03:16:45 PM,ONTIME,Closed,Case Closed. Closed date : 2015-06-05 15:16:45.54 Duplicate of Existing Case made safe  scheduled for repair,Highway Maintenance,Public Works Department,Highway Maintenance,Highway Maintenance,PWDx_District 1B: North End,PWDx,,,40 New Sudbury St  Boston  MA  02114,3.0,1B,1.0,A1,Boston,3.0,03,306.0,E,40 New Sudbury St,2114.0,Address,101187.0,42.3618,-71.0603,Constituent Call,"(42.3618, -71.0603)"
575832,101001403202,06/05/2015 10:02:00 AM,,06/05/2015 01:14:20 PM,ONTIME,Closed,Case Closed. Closed date : 2015-06-05 13:14:20.743 Case Resolved nothing there and driveway has been fixed,Highway Maintenance,Public Works Department,Highway Maintenance,Highway Maintenance,PWDx_District 09: East Boston,PWDx,,https://cityworker.cityofboston.gov:8443/attachments/report/5571ac43d052e132f653aef0/closed_photo/Report.jpg,112 White St  East Boston  MA  02128,1.0,09,1.0,A7,East Boston,1.0,Ward 1,109.0,R3,112 White St,2128.0,Address,149210.0,42.3807,-71.0325,Constituent Call,"(42.3807, -71.0325)"
577386,101001405574,06/09/2015 10:25:00 AM,,,ONTIME,Open,,Highway Maintenance,Public Works Department,Highway Maintenance,Highway Maintenance,PWDx_Sidewalk Repair,PWDx,,,11 Fayette St  Boston  MA  02116,4.0,1C,2.0,A1,Back Bay,6.0,Ward 5,501.0,R2,11 Fayette St,2116.0,Address,56953.0,42.3492,-71.067,Constituent Call,"(42.3492, -71.067)"
577520,101001405744,06/09/2015 12:30:00 PM,,06/24/2015 05:45:23 AM,ONTIME,Closed,Case Closed. Closed date : 2015-06-24 05:45:23.11 Case Resolved Bricks repaired by the Construction Crew.,Highway Maintenance,Public Works Department,Highway Maintenance,Highway Maintenance,PWDx_Highway Construction,PWDx,,,46 Rutland Sq  Roxbury  MA  02118,4.0,1C,7.0,D4,South End,6.0,Ward 4,404.0,CM,46 Rutland Sq,2118.0,Address,120117.0,42.3421,-71.0787,Constituent Call,"(42.3421, -71.0787)"
577769,101001406090,06/09/2015 05:26:00 PM,06/13/2015 01:38:00 PM,06/12/2015 01:43:32 PM,ONTIME,Closed,Case Closed. Closed date : 2015-06-12 13:43:32.04 Case Resolved repaired bricks,Highway Maintenance,Public Works Department,Highway Maintenance,Highway Maintenance,PWDx_District 10A: Roxbury,PWDx,,https://cityworker.cityofboston.gov:8443/attachments/report/55775a69d052e132f6542313/closed_photo/Report.jpg,808-808A Tremont St  Roxbury  MA  02118,7.0,10B,7.0,D4,Roxbury,13.0,Ward 9,903.0,A,808-808A Tremont St,2118.0,Address,138029.0,42.3384,-71.0815,Constituent Call,"(42.3384, -71.0815)"
578231,101001406756,06/10/2015 02:13:00 PM,,08/03/2015 04:10:51 PM,ONTIME,Closed,Case Closed. Closed date : 2015-08-03 16:10:51.133 Case Resolved REPLACED COVER  on 8/3,Highway Maintenance,Public Works Department,Highway Maintenance,Highway Maintenance,BWSC_All Cases,BWSC,,,30 S Walter St  Roslindale  MA  02131,9.0,06,5.0,E5,Roslindale,10.0,Ward 20,2004.0,R2,30 S Walter St,2131.0,Address,142335.0,42.2875,-71.1337,Constituent Call,"(42.2875, -71.1337)"
579521,101001408755,06/12/2015 05:03:00 PM,,06/15/2015 12:42:20 PM,ONTIME,Closed,Case Closed. Closed date : 2015-06-15 12:42:20.533 Duplicate of Existing Case This area is scheduled for brick replacement along the entire sidewalk,Highway Maintenance,Public Works Department,Highway Maintenance,Highway Maintenance,PWDx_District 1B: North End,PWDx,,,40 New Sudbury St  Boston  MA  02114,3.0,1B,1.0,A1,Boston,3.0,03,306.0,E,40 New Sudbury St,2114.0,Address,101187.0,42.3618,-71.0603,Constituent Call,"(42.3618, -71.0603)"
580371,101001410035,06/15/2015 04:25:00 PM,,06/23/2015 05:33:39 AM,ONTIME,Closed,Case Closed. Closed date : 2015-06-23 05:33:39.27 Case Resolved Loose bricks were repaired by the construction crew.,Highway Maintenance,Public Works Department,Highway Maintenance,Highway Maintenance,PWDx_Highway Construction,PWDx,,,286 Roxbury St  Roxbury  MA  02119,7.0,10B,7.0,B2,Roxbury,13.0,Ward 9,905.0,EA,286 Roxbury St,2119.0,Address,169333.0,42.33,-71.0941,Constituent Call,"(42.33, -71.0941)"
581507,101001411754,06/17/2015 02:28:00 PM,,11/30/2015 03:08:00 PM,ONTIME,Closed,Case Closed. Closed date : 2015-11-30 15:08:00.397 Duplicate of Existing Case Duplicate of existing case 101001413499    This location has been inspected and all damages appear to have been made.    If you have any further questions  or feel that this case was closed  or reallocated in error  please do not hesitate to contact me.    Michael Somers  Senior Civil Engineer  Construction Management Division  Boston Public Works  617-635-3831		  Michael.Somers@Boston.gov,Highway Maintenance,Public Works Department,Highway Maintenance,Highway Maintenance,PWDx_Highway Construction,PWDx,,,1854 Dorchester Ave  Dorchester  MA  02124,8.0,07,3.0,C11,Dorchester,7.0,Ward 16,1606.0,I,1854 Dorchester Ave,2124.0,Address,164496.0,42.2876,-71.0635,Constituent Call,"(42.2876, -71.0635)"
581734,101001412099,06/18/2015 07:31:00 AM,,06/26/2015 06:01:21 AM,ONTIME,Closed,Case Closed. Closed date : 2015-06-26 06:01:21.927 Case Resolved Bricks were replaced and repaired by the Construction Crew.,Highway Maintenance,Public Works Department,Highway Maintenance,Highway Maintenance,PWDx_Highway Construction,PWDx,,,145 Commercial St  Boston  MA  02110,3.0,1B,1.0,A1,Downtown / Financial District,3.0,Ward 3,301.0,EA,145 Commercial St,2110.0,Address,36195.0,42.3624,-71.052,Constituent Call,"(42.3624, -71.052)"
582126,101001412682,06/18/2015 02:47:00 PM,,06/24/2015 06:00:59 AM,ONTIME,Closed,Case Closed. Closed date : 2015-06-24 06:00:59.46 Case Resolved Bricks were repaired by the Construction Crew.,Highway Maintenance,Public Works Department,Highway Maintenance,Highway Maintenance,PWDx_Highway Construction,PWDx,,,100 Cambridge St  Boston  MA  02114,3.0,1B,1.0,A1,Downtown / Financial District,3.0,Ward 3,306.0,CC,100 Cambridge St,2114.0,Address,25222.0,42.3606,-71.0621,Constituent Call,"(42.3606, -71.0621)"
582140,101001412702,06/18/2015 02:58:00 PM,,06/24/2015 05:59:29 AM,ONTIME,Closed,Case Closed. Closed date : 2015-06-24 05:59:29.657 Case Resolved Bricks replaced and repaired by the Construction Crew.,Highway Maintenance,Public Works Department,Highway Maintenance,Highway Maintenance,PWDx_Highway Construction,PWDx,,,20-60 North St  Boston  MA  02109,3.0,1B,1.0,A1,Downtown / Financial District,3.0,Ward 3,306.0,C,20-60 North St,2109.0,Address,340746.0,42.3607,-71.0563,Constituent Call,"(42.3607, -71.0563)"
583758,101001415101,06/22/2015 05:18:00 PM,,06/23/2015 10:03:32 AM,ONTIME,Closed,Case Closed. Closed date : 2015-06-23 10:03:32.4 Case Resolved Bricks were replaced and sidewalk was repaired by the Construction Crew.,Highway Maintenance,Public Works Department,Highway Maintenance,Highway Maintenance,PWDx_Highway Construction,PWDx,,,20-60 North St  Boston  MA  02109,3.0,1B,1.0,A1,Downtown / Financial District,3.0,Ward 3,306.0,C,20-60 North St,2109.0,Address,340746.0,42.3607,-71.0563,Constituent Call,"(42.3607, -71.0563)"
584078,101001415544,06/23/2015 09:49:00 AM,,06/25/2015 06:52:49 AM,ONTIME,Closed,Case Closed. Closed date : 2015-06-25 06:52:49.677 Case Resolved Job complete,Highway Maintenance,Public Works Department,Highway Maintenance,Highway Maintenance,PWDx_Highway Construction,PWDx,,,551 Washington St  Brighton  MA  02135,11.0,04,9.0,D14,Allston / Brighton,15.0,Ward 22,2207.0,RC,551 Washington St,2135.0,Address,329941.0,42.3496,-71.1639,Constituent Call,"(42.3496, -71.1639)"
584251,101001415772,06/23/2015 01:05:00 PM,,06/24/2015 12:01:15 PM,ONTIME,Closed,Case Closed. Closed date : 2015-06-24 12:01:15.657 Duplicate of Existing Case,Highway Maintenance,Public Works Department,Highway Maintenance,Highway Maintenance,PWDx_District 1C: Downtown,PWDx,,,855 Boylston St  Boston  MA  02116,4.0,1C,8.0,D4,Back Bay,14.0,Ward 5,508.0,C,855 Boylston St,2116.0,Address,18413.0,42.3488,-71.0831,Constituent Call,"(42.3488, -71.0831)"
584669,101001416359,06/24/2015 09:58:00 AM,,06/30/2015 06:54:57 AM,ONTIME,Closed,Case Closed. Closed date : 2015-06-30 06:54:57.843 Case Noted made safe,Highway Maintenance,Public Works Department,Highway Maintenance,Highway Maintenance,PWDx_District 1C: Downtown,PWDx,,,855 Boylston St  Boston  MA  02116,4.0,1C,8.0,D4,Back Bay,14.0,Ward 5,508.0,C,855 Boylston St,2116.0,Address,18413.0,42.3488,-71.0831,Constituent Call,"(42.3488, -71.0831)"
584783,101001416536,06/24/2015 12:00:00 PM,,06/26/2015 06:15:01 AM,ONTIME,Closed,Case Closed. Closed date : 2015-06-26 06:15:01.71 Case Resolved Bricks replaced by the Construction Crew.,Highway Maintenance,Public Works Department,Highway Maintenance,Highway Maintenance,PWDx_Highway Construction,PWDx,,,600 Commercial St  Boston  MA  02113,3.0,1B,1.0,A1,Downtown / Financial District,3.0,Ward 3,303.0,C,600 Commercial St,2113.0,Address,36814.0,42.3671,-71.0573,Constituent Call,"(42.3671, -71.0573)"
585333,101001417372,06/25/2015 01:26:00 PM,,,ONTIME,Open,,Highway Maintenance,Public Works Department,Highway Maintenance,Highway Maintenance,PWDx_Highway Construction General,PWDx,,,INTERSECTION of Brimmer St & Mount Vernon St  Boston  MA,3.0,1B,8.0,A1,Beacon Hill,14.0,Ward 5,511.0,,INTERSECTION Brimmer St & Mount Vernon St,,Intersection,1956.0,42.3574,-71.072,Constituent Call,"(42.3574, -71.072)"
586227,101001418745,06/27/2015 06:12:00 PM,,06/29/2015 02:10:41 PM,ONTIME,Closed,Case Closed. Closed date : 2015-06-29 14:10:41.16 Case Resolved Bricks replaced,Sidewalk Repair/Red Brick/Downtown,Public Works Department,Highway Maintenance,Highway Maintenance,PWDx_Highway Construction,PWDx,,,22 Clinton St  Boston  MA  02109,3.0,1B,1.0,A1,Boston,3.0,03,301.0,,22 Clinton St,2109.0,Address,354183.0,42.3594,-71.0587,Constituent Call,"(0, 0)"
586973,101001419788,06/29/2015 03:36:00 PM,,06/30/2015 08:47:05 AM,ONTIME,Closed,Case Closed. Closed date : 2015-06-30 08:47:05.097 Case Resolved made safe,Highway Maintenance,Public Works Department,Highway Maintenance,Highway Maintenance,PWDx_District 1A: Charlestown,PWDx,,,47 Harvard St  Charlestown  MA  02129,3.0,1A,1.0,A15,Charlestown,2.0,Ward 2,201.0,CM,47 Harvard St,2129.0,Address,166067.0,42.3732,-71.063,Constituent Call,"(42.3732, -71.063)"
587023,101001419865,06/29/2015 04:55:00 PM,,10/26/2015 04:56:35 PM,ONTIME,Closed,Case Closed. Closed date : 2015-10-26 16:56:35.327 Case Resolved Constituent called back to let us know that case has been resolved.,Highway Maintenance,Public Works Department,Highway Maintenance,Highway Maintenance,PWDx_Sidewalk Repair,PWDx,,,10 Dwight St  Roxbury  MA  02118,4.0,1C,2.0,D4,South End,4.0,Ward 3,307.0,R3,10 Dwight St,2118.0,Address,50322.0,42.344,-71.0683,Constituent Call,"(42.344, -71.0683)"
588600,101001422047,07/02/2015 10:11:00 AM,,07/07/2015 02:11:37 PM,ONTIME,Closed,Case Closed. Closed date : 2015-07-07 14:11:37.693 Case Resolved Case closed,Highway Maintenance,Public Works Department,Highway Maintenance,Highway Maintenance,PWDx_Highway Construction,PWDx,,,INTERSECTION of Berkeley St & Marlborough St  Boston  MA,4.0,1C,8.0,D4,Back Bay,14.0,Ward 5,506.0,,INTERSECTION Berkeley St & Marlborough St,,Intersection,1347.0,42.354,-71.0744,Constituent Call,"(42.354, -71.0744)"
589779,101001423760,07/06/2015 01:39:00 PM,,12/23/2015 10:27:40 AM,ONTIME,Closed,Case Closed. Closed date : 2015-12-23 10:27:40.083 Case Noted The location has been inspected and everything appears okay.    If you have any further questions  or feel that this case was closed  or reallocated in error  please do not hesitate to contact me.    Michael Somers  Senior Civil Engineer  Construction Management Division  Boston Public Works  617-635-3831		  Michael.Somers@Boston.gov,Highway Maintenance,Public Works Department,Highway Maintenance,Highway Maintenance,PWDx_Sidewalk Repair,PWDx,,,70 Waldeck St  Dorchester  MA  02124,7.0,03,4.0,C11,Dorchester,8.0,Ward 17,1702.0,R2,70 Waldeck St,2124.0,Address,141439.0,42.2981,-71.0666,Constituent Call,"(42.2981, -71.0666)"
589970,101001424008,07/06/2015 05:39:00 PM,,,ONTIME,Open,,Highway Maintenance,Public Works Department,Highway Maintenance,Highway Maintenance,INFO01_GenericeFormforOtherServiceRequestTypes,INFO,,,INTERSECTION of Harcourt St & Saint Botolph St  Boston  MA,4.0,1C,2.0,D4,Back Bay,6.0,Ward 4,402.0,,INTERSECTION Harcourt St & Saint Botolph St,,Intersection,5636.0,42.3465,-71.0789,Constituent Call,"(42.3465, -71.0789)"
590173,101001424303,07/07/2015 09:38:00 AM,,07/10/2015 01:58:56 PM,ONTIME,Closed,Case Closed. Closed date : 2015-07-10 13:58:56.93 Case Resolved Resolved.,Highway Maintenance,Public Works Department,Highway Maintenance,Highway Maintenance,PWDx_District 07: South Dorchester,PWDx,,https://cityworker.cityofboston.gov:8443/attachments/report/559bd69bd0526ec12e0d88b0/closed_photo/Report.jpg,31-33 Saint Brendan Rd  Dorchester  MA  02124,8.0,07,3.0,C11,Dorchester,7.0,Ward 16,1612.0,R2,31-33 Saint Brendan Rd,2124.0,Address,120958.0,42.2808,-71.0508,Constituent Call,"(42.2808, -71.0508)"
590395,101001424627,07/07/2015 01:46:00 PM,,07/08/2015 10:44:12 AM,ONTIME,Closed,Case Closed. Closed date : 2015-07-08 10:44:12.807 Case Noted Nothing found.,Highway Maintenance,Public Works Department,Highway Maintenance,Highway Maintenance,PWDx_Highway Construction,PWDx,,,65 Beech Glen St  Roxbury  MA  02119,9.0,10B,7.0,B2,Roxbury,13.0,Ward 11,1101.0,R1,65 Beech Glen St,2119.0,Address,13359.0,42.3239,-71.0942,Constituent Call,"(42.3239, -71.0942)"
590453,101001424696,07/07/2015 02:47:00 PM,,07/08/2015 02:17:12 PM,ONTIME,Closed,Case Closed. Closed date : 2015-07-08 14:17:12.577 Case Resolved Bricks replaced by the Construction Crew.,Highway Maintenance,Public Works Department,Highway Maintenance,Highway Maintenance,PWDx_Highway Construction,PWDx,,,INTERSECTION of Hurds Ln & Winthrop St  Charlestown  MA,3.0,1A,1.0,A15,Charlestown,2.0,Ward 2,201.0,,INTERSECTION Hurds Ln & Winthrop St,,Intersection,6445.0,42.3734,-71.0623,Constituent Call,"(42.3734, -71.0623)"
590991,101001425416,07/08/2015 01:07:00 PM,,07/13/2015 02:30:54 PM,ONTIME,Closed,Case Closed. Closed date : 2015-07-13 14:30:54.803 Case Resolved Bricks were replaced and repaired by the Construction Crew.,Highway Maintenance,Public Works Department,Highway Maintenance,Highway Maintenance,PWDx_Highway Construction,PWDx,,,104 Canal St  Boston  MA  02114,3.0,1B,1.0,A1,Downtown / Financial District,3.0,Ward 3,306.0,C,104 Canal St,2114.0,Address,162866.0,42.3643,-71.0602,Constituent Call,"(42.3643, -71.0602)"
594857,101001430667,07/16/2015 09:31:00 AM,,09/28/2015 07:31:16 AM,ONTIME,Closed,Case Closed. Closed date : 2015-09-28 07:31:16.86 Case Resolved Bricks replaced.    If this case was closed in error  please contact Thomas.hanlon@boston.gov,Highway Maintenance,Public Works Department,Highway Maintenance,Highway Maintenance,PWDx_Highway Construction,PWDx,,,193 Salem St  Boston  MA  02113,3.0,1B,1.0,A1,Boston,3.0,03,302.0,E,193 Salem St,2113.0,Address,121853.0,42.3665,-71.0545,Constituent Call,"(42.3665, -71.0545)"
596008,101001432137,07/17/2015 03:09:00 PM,,07/30/2015 09:14:49 AM,ONTIME,Closed,Case Closed. Closed date : 2015-07-30 09:14:49.517 Case Resolved Dear Constituent     The Boston Public Works Construction Inspection Unit (CIU) Inspector states that as of July 29th the bricks have been replaced.    For any questions or concerns  please contact the number listed below    Sincerely     Mark Cardarelli  Supervisor of Utility Coordination and Compliance  Boston Public Works Department  617-635-4951 Office,Highway Maintenance,Public Works Department,Highway Maintenance,Highway Maintenance,PWDx_Contractor Complaints,PWDx,,,47-49 Saint Joseph St  Jamaica Plain  MA  02130,9.0,02,6.0,E13,Jamaica Plain,11.0,Ward 11,1109.0,R3,47-49 Saint Joseph St,2130.0,Address,121283.0,42.3066,-71.1179,Constituent Call,"(42.3066, -71.1179)"
596028,101001432169,07/17/2015 03:35:00 PM,,07/27/2015 09:07:34 AM,ONTIME,Closed,Case Closed. Closed date : 2015-07-27 09:07:34.043 Case Resolved Dear Constituent     The Public Works Construction Inspection Unit (CIU) has identified  the defective cast iron structure as belonging to Verizon.    Verizon has been notified that they must repair the casting within 3 days..    The location has been entered into the CIU data base that tracks repairs to be made by utility companies or private contractors.    The CIU will monitor the progress of the repair.    If you have any questions or concerns  please don't hesitate on calling me or my staff  at the number listed below.      Sincerely      Mark Cardarelli  Supervisor of Utility Coordination and Compliance  Boston Public Works Department  617-635-4951 Office,Highway Maintenance,Public Works Department,Highway Maintenance,Highway Maintenance,PWDx_Contractor Complaints,PWDx,,,2261 Dorchester Ave  Dorchester  MA  02124,8.0,07,3.0,C11,Dorchester,7.0,17,1713.0,,2261 Dorchester Ave,2124.0,Address,351628.0,42.3594,-71.0587,Constituent Call,"(0, 0)"
596488,101001432840,07/20/2015 08:43:00 AM,,08/12/2015 02:16:22 PM,ONTIME,Closed,Case Closed. Closed date : 2015-08-12 14:16:22.62 Case Resolved Bricks replaced on Freedom Trail.,Highway Maintenance,Public Works Department,Highway Maintenance,Highway Maintenance,PWDx_Highway Construction,PWDx,,,INTERSECTION of N Hudson St & Hull St  Boston  MA,3.0,1B,1.0,A1,Downtown / Financial District,3.0,Ward 3,303.0,,INTERSECTION N Hudson St & Hull St,,Intersection,6390.0,42.3674,-71.057,Constituent Call,"(42.3674, -71.057)"
597184,101001433763,07/21/2015 08:34:00 AM,,07/28/2015 07:30:58 AM,ONTIME,Closed,Case Closed. Closed date : 2015-07-28 07:30:58.79 Case Resolved Location has been made safe. This sidewalk will be referred for permanent repair. See case #101001438050 for status of the permanent repair.,Sidewalk make safe,Public Works Department,Highway Maintenance,Highway Maintenance,PWDx_Sidewalk Repair,PWDx,,,34 S Russell St  Boston  MA  02114,3.0,1B,1.0,A1,Beacon Hill,3.0,Ward 3,306.0,A,34 S Russell St,2114.0,Address,119771.0,42.3602,-71.0658,Constituent Call,"(42.3602, -71.0658)"
597592,101001434265,07/21/2015 02:14:00 PM,,07/24/2015 07:21:32 AM,ONTIME,Closed,Case Closed. Closed date : 2015-07-24 07:21:32.983 Duplicate of Existing Case Duplicate of 285 Tremont St  to be repaired today,Highway Maintenance,Public Works Department,Highway Maintenance,Highway Maintenance,PWDx_Highway Construction,PWDx,,,792 Tremont St  Roxbury  MA  02118,7.0,10B,7.0,D4,Roxbury,13.0,Ward 9,903.0,RC,792 Tremont St,2118.0,Address,138007.0,42.3387,-71.081,Constituent Call,"(42.3387, -71.081)"
598072,101001435035,07/23/2015 11:46:00 AM,,10/02/2015 10:28:40 AM,ONTIME,Closed,Case Closed. Closed date : 2015-10-02 10:28:40.43 Case Resolved Missing bricks were replaced and additional bricks were reset.,Highway Maintenance,Public Works Department,Highway Maintenance,Highway Maintenance,PWDx_Highway Construction,PWDx,,https://cityworker.cityofboston.gov:8443/attachments/report/55b10c83d052553bcf893b2c/closed_photo/Report.jpg,765 Tremont St  Roxbury  MA  02118,4.0,1C,7.0,D4,South End,6.0,Ward 9,902.0,A,765 Tremont St,2118.0,Address,137979.0,42.3398,-71.0799,Constituent Call,"(42.3398, -71.0799)"
598192,101001435231,07/23/2015 01:21:00 PM,,07/26/2015 05:19:36 AM,ONTIME,Closed,Case Closed. Closed date : 2015-07-26 05:19:36.29 Case Resolved 31 Bricks were replaced and jointed  sidewalk was repaired by the Construction Crew.,Highway Maintenance,Public Works Department,Highway Maintenance,Highway Maintenance,PWDx_Highway Construction,PWDx,,https://cityworker.cityofboston.gov:8443/attachments/report/55b12479d05279dccc1aa2fe/closed_photo/Report.jpg,7 Rutland Sq  Roxbury  MA  02118,4.0,1C,7.0,D4,South End,6.0,Ward 4,404.0,R1,7 Rutland Sq,2118.0,Address,120156.0,42.3414,-71.0775,Constituent Call,"(42.3414, -71.0775)"
598357,101001435462,07/23/2015 03:15:00 PM,,09/14/2015 02:55:03 PM,ONTIME,Closed,Case Closed. Closed date : 2015-09-14 14:55:03.037 Duplicate of Existing Case Duplicate of case 101001435459    If you have any further questions  or feel that this case was closed  or reallocated in error  please do not hesitate to contact me.    Michael Somers  Senior Civil Engineer  Construction Management Division  Boston Public Works  617-635-3831	  Michael.Somers@Boston.gov,Highway Maintenance,Public Works Department,Highway Maintenance,Highway Maintenance,PWDx_Highway Construction,PWDx,,,165 Mount Vernon St  Boston  MA  02108,3.0,1B,8.0,A1,Back Bay,14.0,Ward 5,511.0,CM,165 Mount Vernon St,2108.0,Address,98537.0,42.3575,-71.0722,Constituent Call,"(42.3575, -71.0722)"
598879,101001436184,07/24/2015 12:43:00 PM,,12/17/2015 08:09:17 AM,ONTIME,Closed,Case Closed. Closed date : 2015-12-17 08:09:17.68 Case Noted The request is regarding bricks.  There are no bricks at this location    If you have any further questions  or feel that this case was closed  or reallocated in error  please do not hesitate to contact me.    Michael Somers  Senior Civil Engineer  Construction Management Division  Boston Public Works  617-635-3831		  Michael.Somers@Boston.gov,Sidewalk Repair/Concrete/Dist 7,Public Works Department,Highway Maintenance,Highway Maintenance,PWDx_Highway Construction,PWDx,,,30 Wheatland Ave  Dorchester  MA  02124,8.0,07,4.0,B3,Dorchester,9.0,Ward 17,1703.0,R2,30 Wheatland Ave,2124.0,Address,149071.0,42.2934,-71.0733,Constituent Call,"(42.2934, -71.0733)"
599076,101001436405,07/24/2015 05:24:00 PM,,,ONTIME,Open,,Sidewalk Repair/Red Brick/South End,Public Works Department,Highway Maintenance,Highway Maintenance,PWDx_Highway Construction,PWDx,,,710 Boylston St  Boston  MA  02199,4.0,1C,2.0,D4,Boston,6.0,04,402.0,,710 Boylston St,2199.0,Address,355917.0,42.3594,-71.0587,Constituent Call,"(0, 0)"
599650,101001437263,07/27/2015 10:11:00 AM,,07/31/2015 09:55:31 AM,ONTIME,Closed,Case Closed. Closed date : 2015-07-31 09:55:31.33 Case Resolved pole concreted,Highway Maintenance,Public Works Department,Highway Maintenance,Highway Maintenance,PWDx_Highway Construction,PWDx,,https://cityworker.cityofboston.gov:8443/attachments/report/55b63d6dd0529cc6536159c1/closed_photo/Report.jpg,26 Torrey St  Dorchester  MA  02124,8.0,07,4.0,B3,Dorchester,9.0,Ward 17,1708.0,R3,26 Torrey St,2124.0,Address,136289.0,42.2873,-71.0724,Maximo Integration,"(42.2873, -71.0724)"
599662,101001437281,07/27/2015 10:18:00 AM,,07/31/2015 09:35:42 AM,ONTIME,Closed,Case Closed. Closed date : 2015-07-31 09:35:42.69 Case Resolved Base concreted,Highway Maintenance,Public Works Department,Highway Maintenance,Highway Maintenance,PWDx_Highway Construction,PWDx,,https://cityworker.cityofboston.gov:8443/attachments/report/55b63ecbd0529cc653615a89/closed_photo/Report.jpg,449 River St  Mattapan  MA  02126,8.0,07,4.0,B3,Greater Mattapan,9.0,Ward 18,1804.0,R2,449 River St,2126.0,Address,116611.0,42.2689,-71.0922,Maximo Integration,"(42.2689, -71.0922)"
599679,101001437307,07/27/2015 10:25:00 AM,,07/31/2015 09:29:16 AM,ONTIME,Closed,Case Closed. Closed date : 2015-07-31 09:29:16.6 Case Resolved Base concreted,Highway Maintenance,Public Works Department,Highway Maintenance,Highway Maintenance,PWDx_Highway Construction,PWDx,,https://cityworker.cityofboston.gov:8443/attachments/report/55b641b9d0529cc653615b5c/closed_photo/Report.jpg,347 River St  Mattapan  MA  02126,8.0,07,4.0,B3,Greater Mattapan,9.0,Ward 18,1804.0,R2,347 River St,2126.0,Address,116585.0,42.2706,-71.0872,Maximo Integration,"(42.2706, -71.0872)"
599704,101001437324,07/27/2015 10:37:00 AM,,09/30/2015 02:18:03 PM,ONTIME,Closed,Case Closed. Closed date : 2015-09-30 14:18:03.827 Case Resolved Base is cemented. 9/30/15. EP.,Highway Maintenance,Public Works Department,Highway Maintenance,Highway Maintenance,PWDx_Street Light_General Lighting Request,PWDx,,https://cityworker.cityofboston.gov:8443/attachments/report/55b64303d0529cc653615bdc/closed_photo/Report.jpg,284 Park St  Dorchester  MA  02124,8.0,07,4.0,C11,Dorchester,9.0,Ward 17,1703.0,R3,284 Park St,2124.0,Address,107329.0,42.297,-71.0661,Employee Generated,"(42.297, -71.0661)"
600416,101001438251,07/28/2015 10:05:00 AM,,08/13/2015 12:37:10 PM,ONTIME,Closed,Case Closed. Closed date : 2015-08-13 12:37:10.763 Case Resolved Made safe with patch around the light pole.,Highway Maintenance,Public Works Department,Highway Maintenance,Highway Maintenance,INFO_Reallocation From Dept,INFO,,,INTERSECTION of Washington St & Peter Parley Rd  Jamaica Plain  MA,9.0,02,7.0,E13,Jamaica Plain,11.0,Ward 11,1105.0,,INTERSECTION Washington St & Peter Parley Rd,,Intersection,6021.0,42.3114,-71.1026,Employee Generated,"(42.3114, -71.1026)"
600436,101001438262,07/28/2015 10:17:00 AM,,07/31/2015 10:08:18 AM,ONTIME,Closed,Case Closed. Closed date : 2015-07-31 10:08:18.303 Case Resolved Patched around the light pole,Highway Maintenance,Public Works Department,Highway Maintenance,Highway Maintenance,PWDx_District 02: Jamaica Plain,PWDx,,https://cityworker.cityofboston.gov:8443/attachments/report/55b79040d05279dccc1ab507/closed_photo/Report.jpg,INTERSECTION of Aldworth St & Dane St  Jamaica Plain  MA,9.0,02,6.0,E13,Jamaica Plain,11.0,Ward 19,1908.0,,INTERSECTION Aldworth St & Dane St,,Intersection,257.0,42.311,-71.1193,Employee Generated,"(42.311, -71.1193)"
600447,101001438282,07/28/2015 10:29:00 AM,,07/28/2015 01:41:55 PM,ONTIME,Closed,Case Closed. Closed date : 2015-07-28 13:41:55.72 Case Resolved cemented,Highway Maintenance,Public Works Department,Highway Maintenance,Highway Maintenance,PWDx_District 06: West Roxbury and Roslindale,PWDx,,https://cityworker.cityofboston.gov:8443/attachments/report/55b79428d0529cc653618811/closed_photo/Report.jpg,0 Centre St  West Roxbury  MA  02132,12.0,06,6.0,E5,West Roxbury,12.0,Ward 20,2015.0,E,0 Centre St,2132.0,Address,27443.0,42.2647,-71.1628,Employee Generated,"(42.2647, -71.1628)"
600463,101001438300,07/28/2015 10:43:00 AM,,07/29/2015 09:10:40 AM,ONTIME,Closed,Case Closed. Closed date : 2015-07-29 09:10:40.537 Case Resolved asphaulted around light pole,Highway Maintenance,Public Works Department,Highway Maintenance,Highway Maintenance,PWDx_District 08: Hyde Park,PWDx,,https://cityworker.cityofboston.gov:8443/attachments/report/55b79682d0529cc6536188b6/closed_photo/Report.jpg,1631 Hyde Park Ave  Hyde Park  MA  02136,12.0,08,5.0,E18,Hyde Park,10.0,Ward 18,1818.0,I,1631 Hyde Park Ave,2136.0,Address,77190.0,42.2433,-71.1304,Maximo Integration,"(42.2433, -71.1304)"
600472,101001438326,07/28/2015 10:51:00 AM,,07/29/2015 09:18:16 AM,ONTIME,Closed,Case Closed. Closed date : 2015-07-29 09:18:16.62 Case Resolved asphaulted around pole,Highway Maintenance,Public Works Department,Highway Maintenance,Highway Maintenance,PWDx_District 08: Hyde Park,PWDx,,https://cityworker.cityofboston.gov:8443/attachments/report/55b7995ed0529cc6536189a4/closed_photo/Report.jpg,1717-1725 Hyde Park Ave  Hyde Park  MA  02136,12.0,08,5.0,E18,Hyde Park,10.0,Ward 18,1818.0,I,1717-1725 Hyde Park Ave,2136.0,Address,77202.0,42.2405,-71.1315,Employee Generated,"(42.2405, -71.1315)"
600619,101001438490,07/28/2015 12:41:00 PM,,07/29/2015 08:31:43 AM,ONTIME,Closed,Case Closed. Closed date : 2015-07-29 08:31:43.877 Case Resolved Missing brick at this location has been replaced with a new brick by a Highway Patch Team.  Job is complete and safe for pedestrian access.,Highway Maintenance,Public Works Department,Highway Maintenance,Highway Maintenance,PWDx_District 06: West Roxbury and Roslindale,PWDx,,,1834-1838 Centre St  West Roxbury  MA  02132,12.0,06,6.0,E5,West Roxbury,12.0,Ward 20,2018.0,CM,1834-1838 Centre St,2132.0,Address,163085.0,42.2864,-71.1539,Constituent Call,"(42.2864, -71.1539)"
600748,101001438650,07/28/2015 02:17:00 PM,,12/04/2015 07:52:45 AM,ONTIME,Closed,Case Closed. Closed date : 2015-12-04 07:52:45.577 Case Resolved This location has been inspected and all repairs have been made.    If you have any further questions  or feel that this case was closed  or reallocated in error  please do not hesitate to contact me.    Michael Somers  Senior Civil Engineer  Construction Management Division  Boston Public Works  617-635-3831		  Michael.Somers@Boston.gov,Highway Maintenance,Public Works Department,Highway Maintenance,Highway Maintenance,PWDx_Sidewalk Repair,PWDx,,,230 Shawmut Ave  Roxbury  MA  02118,4.0,1C,2.0,D4,Roxbury,4.0,3,307.0,,230 Shawmut Ave,2118.0,Address,342571.0,42.3594,-71.0587,Constituent Call,"(0, 0)"
600984,101001438986,07/29/2015 07:25:00 AM,,08/25/2015 08:10:57 AM,ONTIME,Closed,Case Closed. Closed date : 2015-08-25 08:10:57.167 Case Resolved Concrete placed.,Cement Light Pole Base,Public Works Department,Highway Maintenance,Highway Maintenance,PWDx_Highway Construction,PWDx,,,INTERSECTION of D St & W First St  South Boston  MA,6.0,05,2.0,C6,South Boston / South Boston Waterfront,5.0,Ward 6,601.0,,INTERSECTION D St & W First St,,Intersection,3813.0,42.3407,-71.0486,Employee Generated,"(42.3407, -71.0486)"
600987,101001438987,07/29/2015 07:32:00 AM,,08/04/2015 07:08:09 AM,ONTIME,Closed,Case Closed. Closed date : 2015-08-04 07:08:09.087 Case Resolved Concrete poured around lightpole,Highway Maintenance,Public Works Department,Highway Maintenance,Highway Maintenance,PWDx_Highway Construction,PWDx,,,9-1 Henshaw St  Brighton  MA  02135,11.0,04,9.0,D14,Allston / Brighton,15.0,Ward 22,2203.0,C,9-1 Henshaw St,2135.0,Address,72948.0,42.3495,-71.1497,Employee Generated,"(42.3495, -71.1497)"
600988,101001438990,07/29/2015 07:35:00 AM,,09/18/2015 12:42:42 PM,ONTIME,Closed,Case Closed. Closed date : 2015-09-18 12:42:42.067 Case Resolved Base has been patched and completed.  EP 9-18-15,Cement Light Pole Base,Public Works Department,Highway Maintenance,Highway Maintenance,PWDx_Street Light_Install New Lighting,PWDx,,,0 W First St  South Boston  MA  02127,6.0,05,2.0,C6,South Boston / South Boston Waterfront,5.0,Ward 6,601.0,CL,0 W First St,2127.0,Address,58435.0,42.3429,-71.0512,Employee Generated,"(42.3429, -71.0512)"
600990,101001438991,07/29/2015 07:39:00 AM,,08/07/2015 08:23:40 AM,ONTIME,Closed,Case Closed. Closed date : 2015-08-07 08:23:40.477 Case Resolved pole patched,Cement Light Pole Base,Public Works Department,Highway Maintenance,Highway Maintenance,PWDx_District 05: South Boston,PWDx,,https://cityworker.cityofboston.gov:8443/attachments/report/55b8bc3fd0529cc65361a5fc/closed_photo/Report.jpg,295 W First St  South Boston  MA  02127,6.0,05,2.0,C6,South Boston / South Boston Waterfront,5.0,Ward 6,601.0,C,295 W First St,2127.0,Address,58449.0,42.3398,-71.0477,Employee Generated,"(42.3398, -71.0477)"
600994,101001438997,07/29/2015 07:43:00 AM,,08/25/2015 08:11:25 AM,ONTIME,Closed,Case Closed. Closed date : 2015-08-25 08:11:25.903 Case Resolved Concrete placed.,Cement Light Pole Base,Public Works Department,Highway Maintenance,Highway Maintenance,PWDx_Highway Construction,PWDx,,,INTERSECTION of E St & W First St  South Boston  MA,6.0,05,2.0,C6,South Boston / South Boston Waterfront,5.0,Ward 6,601.0,,INTERSECTION E St & W First St,,Intersection,4363.0,42.3397,-71.0471,Employee Generated,"(42.3397, -71.0471)"
600997,101001439003,07/29/2015 07:46:00 AM,,09/18/2015 12:41:01 PM,ONTIME,Closed,Case Closed. Closed date : 2015-09-18 12:41:01.383 Case Resolved Base has been patched and completed.  EP 9-18-15,Cement Light Pole Base,Public Works Department,Highway Maintenance,Highway Maintenance,PWDx_Street Light_Install New Lighting,PWDx,,,0 W First St  South Boston  MA  02127,6.0,05,2.0,C6,South Boston / South Boston Waterfront,5.0,Ward 6,601.0,C,0 W First St,2127.0,Address,58436.0,42.3416,-71.0492,Employee Generated,"(42.3416, -71.0492)"
601000,101001439006,07/29/2015 07:48:00 AM,,10/01/2015 11:55:47 AM,ONTIME,Closed,Case Closed. Closed date : 2015-10-01 11:55:47.677 Case Resolved Base has been cemented. Could not brick because of the studs n bolts being to high. 10/1/15. EP.,Highway Maintenance,Public Works Department,Highway Maintenance,Highway Maintenance,PWDx_Street Light_General Lighting Request,PWDx,,https://cityworker.cityofboston.gov:8443/attachments/report/55b8beffd0529cc65361a688/closed_photo/Report.jpg,INTERSECTION of Brighton Ave & Islington St  Allston  MA,11.0,04,9.0,D14,Allston / Brighton,15.0,Ward 21,2106.0,,INTERSECTION Brighton Ave & Islington St,,Intersection,1941.0,42.3534,-71.1368,Employee Generated,"(42.3534, -71.1368)"
601005,101001439007,07/29/2015 07:52:00 AM,,07/29/2015 12:29:33 PM,ONTIME,Closed,Case Closed. Closed date : 2015-07-29 12:29:33.627 Case Resolved hole around pole filled in with patch,Highway Maintenance,Public Works Department,Highway Maintenance,Highway Maintenance,PWDx_District 05: South Boston,PWDx,,https://cityworker.cityofboston.gov:8443/attachments/report/55b8bf1dd0529cc65361a68c/closed_photo/Report.jpg,307-313 W First St  South Boston  MA  02127,6.0,05,2.0,C6,South Boston / South Boston Waterfront,5.0,Ward 6,604.0,I,307-313 W First St,2127.0,Address,58451.0,42.3395,-71.047,Employee Generated,"(42.3395, -71.047)"
601008,101001439018,07/29/2015 07:55:00 AM,,08/04/2015 07:10:06 AM,ONTIME,Closed,Case Closed. Closed date : 2015-08-04 07:10:06.66 Case Resolved Concrete poured around lightbase,Highway Maintenance,Public Works Department,Highway Maintenance,Highway Maintenance,PWDx_Highway Construction,PWDx,,,INTERSECTION of Leo M Birmingham Pkwy & Market St  Brighton  MA,11.0,04,9.0,D14,Allston / Brighton,15.0,Ward 22,2205.0,,INTERSECTION Leo M Birmingham Pkwy & Market St,,Intersection,6831.0,42.3589,-71.1474,Employee Generated,"(42.3589, -71.1474)"
601009,101001439012,07/29/2015 07:55:00 AM,,08/25/2015 08:10:28 AM,ONTIME,Closed,Case Closed. Closed date : 2015-08-25 08:10:28.74 Case Resolved Concrete placed.,Cement Light Pole Base,Public Works Department,Highway Maintenance,Highway Maintenance,PWDx_Highway Construction,PWDx,,,333-345 W First St  South Boston  MA  02127,6.0,05,2.0,C6,South Boston,5.0,06,604.0,I,333-345 W First St,2127.0,Address,58454.0,42.3389,-71.0462,Employee Generated,"(42.3389, -71.0462)"
601012,101001439015,07/29/2015 07:58:00 AM,,09/18/2015 12:39:00 PM,ONTIME,Closed,Case Closed. Closed date : 2015-09-18 12:39:00.933 Case Resolved Base has been patched and completed.  EP 9-18-15,Cement Light Pole Base,Public Works Department,Highway Maintenance,Highway Maintenance,PWDx_Street Light_Install New Lighting,PWDx,,,361 W First St  South Boston  MA  02127,6.0,05,2.0,C6,South Boston / South Boston Waterfront,5.0,Ward 6,604.0,C,361 W First St,2127.0,Address,58455.0,42.3385,-71.0454,Employee Generated,"(42.3385, -71.0454)"
601015,101001439022,07/29/2015 08:01:00 AM,,09/18/2015 12:00:20 PM,ONTIME,Closed,Case Closed. Closed date : 2015-09-18 12:00:20.033 Case Resolved Base was patched as I asked. Looks good.  EP 9-18-15,Cement Light Pole Base,Public Works Department,Highway Maintenance,Highway Maintenance,PWDx_Street Light_Install New Lighting,PWDx,,,INTERSECTION of F St & W First St  South Boston  MA,6.0,05,2.0,C6,South Boston / South Boston Waterfront,5.0,Ward 6,604.0,,INTERSECTION F St & W First St,,Intersection,4732.0,42.3387,-71.0455,Employee Generated,"(42.3387, -71.0455)"
601019,101001439031,07/29/2015 08:06:00 AM,,07/29/2015 12:30:42 PM,ONTIME,Closed,Case Closed. Closed date : 2015-07-29 12:30:42.213 Case Resolved filled in with patch,Highway Maintenance,Public Works Department,Highway Maintenance,Highway Maintenance,PWDx_District 05: South Boston,PWDx,,,INTERSECTION of E First St & I St  South Boston  MA,6.0,05,2.0,C6,South Boston / South Boston Waterfront,5.0,Ward 6,604.0,,INTERSECTION E First St & I St,,Intersection,4930.0,42.3381,-71.04,Employee Generated,"(42.3381, -71.04)"
601029,101001439049,07/29/2015 08:15:00 AM,,08/04/2015 06:46:54 AM,ONTIME,Closed,Case Closed. Closed date : 2015-08-04 06:46:54.933 Case Resolved Lightpole base cemented,Highway Maintenance,Public Works Department,Highway Maintenance,Highway Maintenance,PWDx_Highway Construction,PWDx,,,0 Market St  Brighton  MA  02134,11.0,04,9.0,D14,Allston / Brighton,15.0,Ward 22,2212.0,E,0 Market St,2134.0,Address,90170.0,42.3579,-71.1529,Employee Generated,"(42.3579, -71.1529)"
601832,101001500111,07/30/2015 11:33:00 AM,,08/04/2015 06:54:02 AM,ONTIME,Closed,Case Closed. Closed date : 2015-08-04 06:54:02.433 Case Resolved Concrete placed around lightpole,Highway Maintenance,Public Works Department,Highway Maintenance,Highway Maintenance,PWDx_Highway Construction,PWDx,,,112 Shawmut Ave  Roxbury  MA  02118,4.0,1C,2.0,D4,South End,4.0,Ward 3,308.0,C,112 Shawmut Ave,2118.0,Address,156489.0,42.3465,-71.0657,Employee Generated,"(42.3465, -71.0657)"
601842,101001500120,07/30/2015 11:43:00 AM,,08/04/2015 06:52:10 AM,ONTIME,Closed,Case Closed. Closed date : 2015-08-04 06:52:10.45 Case Resolved Cement poured,Highway Maintenance,Public Works Department,Highway Maintenance,Highway Maintenance,PWDx_Highway Construction,PWDx,,,1135 Harrison Ave  Roxbury  MA  02119,7.0,10B,7.0,B2,Roxbury,13.0,Ward 8,804.0,C,1135 Harrison Ave,2119.0,Address,69795.0,42.3302,-71.0823,Employee Generated,"(42.3302, -71.0823)"
601848,101001500130,07/30/2015 11:50:00 AM,,08/25/2015 07:53:17 AM,ONTIME,Closed,Case Closed. Closed date : 2015-08-25 07:53:17.963 Case Resolved Concrete placed.,Highway Maintenance,Public Works Department,Highway Maintenance,Highway Maintenance,PWDx_Highway Construction,PWDx,,,142 Dudley St  Roxbury  MA  02119,7.0,10B,7.0,B2,Roxbury,13.0,Ward 9,905.0,RC,142 Dudley St,2119.0,Address,156950.0,42.3289,-71.0838,Employee Generated,"(42.3289, -71.0838)"
601859,101001500141,07/30/2015 12:04:00 PM,,,ONTIME,Open,,slcb inspection////printted,Public Works Department,Highway Maintenance,Highway Maintenance,PWDx_Sidewalk Repair,PWDx,,,INTERSECTION of E Concord St & Washington St  Roxbury  MA,4.0,1C,2.0,D4,South End,6.0,Ward 8,802.0,,INTERSECTION E Concord St & Washington St,,Intersection,3415.0,42.3379,-71.0749,Constituent Call,"(42.3379, -71.0749)"
602015,101001500350,07/30/2015 03:15:00 PM,,08/17/2015 06:58:07 AM,ONTIME,Closed,Case Closed. Closed date : 2015-08-17 06:58:07.647 Case Resolved Concrete placed around pole,Cement Light Pole Base,Public Works Department,Highway Maintenance,Highway Maintenance,PWDx_Highway Construction,PWDx,,,2 Prescott St  Hyde Park  MA  02136,12.0,08,5.0,E18,Hyde Park,10.0,Ward 18,1820.0,RC,2 Prescott St,2136.0,Address,295282.0,42.2372,-71.1326,Employee Generated,"(42.2372, -71.1326)"
602019,101001500354,07/30/2015 03:20:00 PM,,07/31/2015 08:28:19 AM,ONTIME,Closed,Case Closed. Closed date : 2015-07-31 08:28:19.163 Case Invalid case invalid . spoke to constituent.,Highway Maintenance,Public Works Department,Highway Maintenance,Highway Maintenance,PWDx_District 03: North Dorchester,PWDx,,,4 Wendover St  Dorchester  MA  02125,7.0,03,7.0,B2,Dorchester,13.0,Ward 7,710.0,RC,4 Wendover St,2125.0,Address,147653.0,42.3182,-71.0669,Employee Generated,"(42.3182, -71.0669)"
602022,101001500356,07/30/2015 03:24:00 PM,,08/25/2015 07:39:42 AM,ONTIME,Closed,Case Closed. Closed date : 2015-08-25 07:39:42.273 Case Resolved Concrete placed.,Highway Maintenance,Public Works Department,Highway Maintenance,Highway Maintenance,PWDx_Highway Construction,PWDx,,,805 Parker St  Mission Hill  MA  02120,9.0,10A,8.0,B2,Mission Hill,14.0,Ward 10,1005.0,R2,805 Parker St,2120.0,Address,107875.0,42.3288,-71.0992,Employee Generated,"(42.3288, -71.0992)"
602211,101001500614,07/31/2015 07:41:00 AM,,07/31/2015 08:19:49 AM,ONTIME,Closed,Case Closed. Closed date : 2015-07-31 08:19:49.72 Case Resolved My mistake. Post was already patched.   EP,Highway Maintenance,Public Works Department,Highway Maintenance,Highway Maintenance,PWDx_District 03: North Dorchester,PWDx,,,130 Magazine St  Roxbury  MA  02119,7.0,10B,7.0,B2,Roxbury,13.0,Ward 8,806.0,I,130 Magazine St,2119.0,Address,88169.0,42.328,-71.0687,Employee Generated,"(42.328, -71.0687)"
602213,101001500616,07/31/2015 07:46:00 AM,,08/25/2015 07:46:36 AM,ONTIME,Closed,Case Closed. Closed date : 2015-08-25 07:46:36.93 Case Resolved Concrete placed.,Cement Light Pole Base,Public Works Department,Highway Maintenance,Highway Maintenance,PWDx_Highway Construction,PWDx,,,1508 Hyde Park Ave  Hyde Park  MA  02136,12.0,08,5.0,E18,Hyde Park,10.0,Ward 18,1818.0,R2,1508 Hyde Park Ave,2136.0,Address,257573.0,42.2472,-71.1277,Employee Generated,"(42.2472, -71.1277)"
602214,101001500617,07/31/2015 07:48:00 AM,,08/25/2015 07:47:49 AM,ONTIME,Closed,Case Closed. Closed date : 2015-08-25 07:47:49.843 Case Resolved Concrete placed.,Cement Light Pole Base,Public Works Department,Highway Maintenance,Highway Maintenance,PWDx_Highway Construction,PWDx,,,1345-1351 Hyde Park Ave  Hyde Park  MA  02136,12.0,08,5.0,E18,Hyde Park,10.0,18,1818.0,C,1345-1351 Hyde Park Ave,2136.0,Address,155781.0,42.2533,-71.125,Employee Generated,"(42.2533, -71.125)"
602215,101001500621,07/31/2015 07:51:00 AM,,08/04/2015 11:16:16 AM,ONTIME,Closed,Case Closed. Closed date : 2015-08-04 11:16:16.66 Case Resolved Concrete poured at base of lightpole,Cement Light Pole Base,Public Works Department,Highway Maintenance,Highway Maintenance,PWDx_Highway Construction,PWDx,,,1337 Hyde Park Ave  Hyde Park  MA  02136,12.0,08,5.0,E18,Hyde Park,10.0,Ward 18,1818.0,C,1337 Hyde Park Ave,2136.0,Address,166510.0,42.2533,-71.125,Employee Generated,"(42.2533, -71.125)"
602219,101001500626,07/31/2015 07:56:00 AM,,08/25/2015 07:38:53 AM,ONTIME,Closed,Case Closed. Closed date : 2015-08-25 07:38:53.537 Case Resolved Lightpole base concreted.,Highway Maintenance,Public Works Department,Highway Maintenance,Highway Maintenance,PWDx_Highway Construction,PWDx,,,188 Longwood Ave  Boston  MA  02115,4.0,10A,8.0,B2,Boston,14.0,4,410.0,E,188 Longwood Ave,2115.0,Address,341799.0,42.3594,-71.0587,Employee Generated,"(0, 0)"
602225,101001500636,07/31/2015 08:04:00 AM,,08/14/2015 02:34:34 PM,ONTIME,Closed,Case Closed. Closed date : 2015-08-14 14:34:34.85 Case Resolved Completed. Checked post and base was bricked.  E Podgurski 8-14-15,Highway Maintenance,Public Works Department,Highway Maintenance,Highway Maintenance,PWDx_Street Light_General Lighting Request,PWDx,,,INTERSECTION of Hemenway St & Westland Entrance  Boston  MA,4.0,10A,8.0,D4,Fenway / Kenmore / Audubon Circle / Longwood,14.0,Ward 4,407.0,,INTERSECTION Hemenway St & Westland Entrance,,Intersection,5856.0,42.344,-71.0899,Employee Generated,"(42.344, -71.0899)"
602459,101001500936,07/31/2015 12:59:00 PM,,10/21/2015 07:56:43 AM,ONTIME,Closed,Case Closed. Closed date : 2015-10-21 07:56:43.443 Case Noted This sidewalk is an areaway and the Park Plaza hotel is responsible for bringing the sidewalk including a new ramp into compliance.    If you have any further questions  or feel that this case was closed  or reallocated in error  please do not hesitate to contact me.    Michael Somers  Senior Civil Engineer  Construction Management Division  Boston Public Works  617-635-3831	  Michael.Somers@Boston.gov,Highway Maintenance,Public Works Department,Highway Maintenance,Highway Maintenance,PWDx_Sidewalk Repair,PWDx,,,20 Park Plz  Boston  MA  02116,4.0,1C,2.0,A1,Downtown / Financial District,6.0,Ward 5,501.0,C,20 Park Plz,2116.0,Address,155737.0,42.3513,-71.0689,Constituent Call,"(42.3513, -71.0689)"
602598,101001501113,07/31/2015 03:36:00 PM,,08/06/2015 11:42:47 AM,ONTIME,Closed,Case Closed. Closed date : 2015-08-06 11:42:47.4 Duplicate of Existing Case case entered in ISD for inspection 1504286,Highway Maintenance,Public Works Department,Highway Maintenance,Highway Maintenance,ISD_Administrative,ISD,,,690 Massachusetts Ave  Roxbury  MA  02118,4.0,1C,2.0,D4,South End,6.0,Ward 8,802.0,CM,690 Massachusetts Ave,2118.0,Address,92597.0,42.3355,-71.0753,Constituent Call,"(42.3355, -71.0753)"
603007,101001501695,08/02/2015 01:14:00 PM,08/25/2015 10:00:04 AM,09/28/2015 02:11:23 PM,OVERDUE,Closed,Case Closed. Closed date : 2015-09-28 14:11:23.07 Case Resolved Bricks replaced.,Highway Maintenance,Public Works Department,Highway Maintenance,Highway Maintenance,PWDx_Highway Construction,PWDx,,,15 Union Park St  Roxbury  MA  02118,4.0,1C,2.0,D4,South End,4.0,Ward 3,307.0,E,15 Union Park St,2118.0,Address,139370.0,42.3416,-71.0704,Constituent Call,"(42.3416, -71.0704)"
603513,101001502387,08/03/2015 03:00:00 PM,,08/06/2015 09:13:35 AM,ONTIME,Closed,Case Closed. Closed date : 2015-08-06 09:13:35.657 Case Resolved It was 3 more taken out in the area.,Highway Maintenance,Public Works Department,Highway Maintenance,Highway Maintenance,PWDx_Litter Basket Maintenance,PWDx,,https://cityworker.cityofboston.gov:8443/attachments/report/55bfbaa5d0529bfa9703b00d/closed_photo/Report.jpg,46-50 Cross St  Boston  MA  02113,3.0,1B,1.0,A1,Downtown / Financial District,3.0,Ward 3,303.0,C,46-50 Cross St,2113.0,Address,44511.0,42.3633,-71.0564,Constituent Call,"(42.3633, -71.0564)"
603664,101001502614,08/03/2015 10:45:00 PM,,08/07/2015 08:49:42 AM,ONTIME,Closed,Case Closed. Closed date : 2015-08-07 08:49:42.17 Case Resolved Bricks replaced,Highway Maintenance,Public Works Department,Highway Maintenance,Highway Maintenance,PWDx_Highway Construction,PWDx,,,22 Clinton St  Boston  MA  02109,3.0,1B,1.0,A1,Boston,3.0,03,301.0,,22 Clinton St,2109.0,Address,354183.0,42.3594,-71.0587,Constituent Call,"(0, 0)"
603918,101001502967,08/04/2015 11:15:00 AM,,08/05/2015 06:12:09 AM,ONTIME,Closed,Case Closed. Closed date : 2015-08-05 06:12:09.33 Duplicate of Existing Case This is a duplicate case at this location  we have this exact location on CRM 101001502988  this will be closed when the job is completed.,Highway Maintenance,Public Works Department,Highway Maintenance,Highway Maintenance,PWDx_Highway Construction,PWDx,,,0 Washington St  Dorchester  MA  02121,7.0,03,4.0,B3,Dorchester,8.0,Ward 14,1402.0,RL,0 Washington St,2121.0,Address,145874.0,42.301,-71.0772,Employee Generated,"(42.301, -71.0772)"
603930,101001502988,08/04/2015 11:25:00 AM,,09/30/2015 10:16:58 AM,ONTIME,Closed,Case Closed. Closed date : 2015-09-30 10:16:58.343 Case Resolved Base is cemented. 9/30/25. EP.,Cement Light Pole Base,Public Works Department,Highway Maintenance,Highway Maintenance,PWDx_Street Light_General Lighting Request,PWDx,,https://cityworker.cityofboston.gov:8443/attachments/report/55c0dd4dd0529bfa9703ceaa/closed_photo/Report.jpg,1142 Washington St  Dorchester  MA  02124,8.0,07,3.0,C11,Dorchester,7.0,Ward 17,1713.0,CL,1142 Washington St,2124.0,Address,145938.0,42.2726,-71.069,Employee Generated,"(42.2726, -71.069)"
603954,101001503014,08/04/2015 11:57:00 AM,,,ONTIME,Open,,Highway Maintenance,Public Works Department,Highway Maintenance,Highway Maintenance,PWDx_Street Light_General Lighting Request,PWDx,,,90 Warren Ave  Boston  MA  02116,4.0,1C,2.0,D4,South End,6.0,04,401.0,E,90 Warren Ave,2116.0,Address,143079.0,42.3444,-71.0735,Employee Generated,"(42.3444, -71.0735)"
603998,101001503064,08/04/2015 12:47:00 PM,,08/05/2015 12:03:18 PM,ONTIME,Closed,Case Closed Case Resolved,Highway Maintenance,Public Works Department,Highway Maintenance,Highway Maintenance,PWDx_Empty Litter Basket,PWDx,,,INTERSECTION of Marginal Rd & Shawmut Ave  Boston  MA,4.0,1C,2.0,A1,Downtown / Financial District,4.0,Ward 3,308.0,,INTERSECTION Marginal Rd & Shawmut Ave,,Intersection,7080.0,42.3477,-71.0657,Employee Generated,"(42.3477, -71.0657)"
604001,101001503069,08/04/2015 12:54:00 PM,,08/06/2015 06:08:26 AM,ONTIME,Closed,Case Closed. Closed date : 2015-08-06 06:08:26.817 Case Resolved Bricks replaced,Highway Maintenance,Public Works Department,Highway Maintenance,Highway Maintenance,PWDx_Highway Construction,PWDx,,,539 Tremont St  Boston  MA  02116,4.0,1C,2.0,D4,South End,6.0,05,501.0,,539 Tremont St,2116.0,Address,341142.0,42.3594,-71.0587,Employee Generated,"(0, 0)"
604009,101001503084,08/04/2015 01:05:00 PM,,08/17/2015 06:57:30 AM,ONTIME,Closed,Case Closed. Closed date : 2015-08-17 06:57:30.163 Case Resolved Concrete placed around pole.,Cement Light Pole Base,Public Works Department,Highway Maintenance,Highway Maintenance,PWDx_Highway Construction,PWDx,,,INTERSECTION of Blue Ledge Dr & Washington St  Roslindale  MA,12.0,06,5.0,E5,Roslindale,10.0,Ward 20,2009.0,,INTERSECTION Blue Ledge Dr & Washington St,,Intersection,1609.0,42.2769,-71.1387,Employee Generated,"(42.2769, -71.1387)"
604026,101001503111,08/04/2015 01:20:00 PM,,,ONTIME,Open,,Cement Light Pole Base,Public Works Department,Highway Maintenance,Highway Maintenance,PWDx_Street Light_Install New Lighting,PWDx,,,INTERSECTION of Hyde Park Ave & Margin St  Hyde Park  MA,12.0,08,5.0,E18,Hyde Park,10.0,Ward 18,1818.0,,INTERSECTION Hyde Park Ave & Margin St,,Intersection,6457.0,42.2511,-71.1257,Employee Generated,"(42.2511, -71.1257)"
604033,101001503121,08/04/2015 01:38:00 PM,,08/05/2015 11:06:01 AM,ONTIME,Closed,Case Closed. Closed date : 2015-08-05 11:06:01.49 Case Resolved,Highway Maintenance,Public Works Department,Highway Maintenance,Highway Maintenance,PWDx_District 08: Hyde Park,PWDx,,,0 Hyde Park Ave  Hyde Park  MA  02131,12.0,08,5.0,E18,Roslindale,10.0,Ward 18,1808.0,RL,0 Hyde Park Ave,2131.0,Address,76943.0,42.2758,-71.1194,Employee Generated,"(42.2758, -71.1194)"
604041,101001503129,08/04/2015 01:49:00 PM,,08/10/2015 10:26:25 AM,ONTIME,Closed,Case Closed. Closed date : 2015-08-10 10:26:25.87 Case Resolved Concrete placed around lightpole base across from 39 Ju.iper.,Cement Light Pole Base,Public Works Department,Highway Maintenance,Highway Maintenance,PWDx_Highway Construction,PWDx,,https://cityworker.cityofboston.gov:8443/attachments/report/55c0fc2cd0529bfa9703d517/closed_photo/Report.jpg,38 Juniper St  Roxbury  MA  02119,7.0,10B,7.0,B2,Roxbury,13.0,Ward 9,905.0,R2,38 Juniper St,2119.0,Address,80408.0,42.3257,-71.089,Employee Generated,"(42.3257, -71.089)"
604045,101001503137,08/04/2015 01:54:00 PM,,,ONTIME,Open,,Cement Light Pole Base,Public Works Department,Highway Maintenance,Highway Maintenance,PWDx_Street Light_General Lighting Request,PWDx,,,95 Brookline Ave  Boston  MA  02215,4.0,10A,8.0,D4,Fenway / Kenmore / Audubon Circle / Longwood,14.0,Ward 21,2101.0,E,95 Brookline Ave,2215.0,Address,22110.0,42.3463,-71.0999,Employee Generated,"(42.3463, -71.0999)"
604053,101001503142,08/04/2015 02:00:00 PM,,08/10/2015 09:47:19 AM,ONTIME,Closed,Case Closed. Closed date : 2015-08-10 09:47:19.01 Case Resolved Lightpole base concreted at 37 Tremlett,Highway Maintenance,Public Works Department,Highway Maintenance,Highway Maintenance,PWDx_Highway Construction,PWDx,,https://cityworker.cityofboston.gov:8443/attachments/report/55c0fe62d0529bfa9703d587/closed_photo/Report.jpg,37 Tremlett St  Dorchester  MA  02124,8.0,07,4.0,C11,Dorchester,9.0,Ward 17,1703.0,R1,37 Tremlett St,2124.0,Address,136662.0,42.295,-71.0681,Employee Generated,"(42.295, -71.0681)"
604754,101001504068,08/05/2015 11:39:00 AM,,08/10/2015 11:57:08 AM,ONTIME,Closed,Case Closed. Closed date : 2015-08-10 11:57:08.183 Case Resolved filled in with loom,Highway Maintenance,Public Works Department,Highway Maintenance,Highway Maintenance,PWDx_District 08: Hyde Park,PWDx,,https://cityworker.cityofboston.gov:8443/attachments/report/55c22e81d0529bfa9703fddf/closed_photo/Report.jpg,10 Leighton Rd  Hyde Park  MA  02136,12.0,08,5.0,E18,Hyde Park,10.0,Ward 18,1819.0,R1,10 Leighton Rd,2136.0,Address,84946.0,42.2532,-71.1424,Constituent Call,"(42.2532, -71.1424)"
604770,101001504093,08/05/2015 12:01:00 PM,,08/07/2015 08:49:51 AM,ONTIME,Closed,Case Closed. Closed date : 2015-08-07 08:49:51.987 Case Resolved Dear Constituent      The Boston Public Works Department Construction Inspection Unit (CIU) has identified the loose bricks as being the responsibility of National Grid        National Grid has been notified that the must repair the bricks within 2 weeks    The location has been entered into the CIU data base that tracks repairs to be made by utility companies or private contractors.    The CIU will monitor the progress of the repair.    Mark Cardarelli  Supervisor of Utility Coordination and Compliance  Boston Public Works Department  617-635-4951 Office,Highway Maintenance,Public Works Department,Highway Maintenance,Highway Maintenance,PWDx_Contractor Complaints,PWDx,,,650 Atlantic Ave  Boston  MA  02110,3.0,1B,1.0,A1,Boston,3.0,03,301.0,C,650 Atlantic Ave,2110.0,Address,157899.0,42.3519,-71.0554,Constituent Call,"(42.3519, -71.0554)"
604899,101001504250,08/05/2015 02:15:00 PM,,09/21/2015 11:20:46 AM,ONTIME,Closed,Case Closed. Closed date : 2015-09-21 11:20:46.45 Case Resolved CONTRACTOR BRICKED SIDEWALK 9/18,Highway Maintenance,Public Works Department,Highway Maintenance,Highway Maintenance,BWSC_All Cases,BWSC,,,27 Clinton St  Boston  MA  02109,3.0,1B,1.0,A1,Downtown / Financial District,3.0,03,306.0,,27 Clinton St,2109.0,Address,351855.0,42.3594,-71.0587,Constituent Call,"(0, 0)"
604968,101001504340,08/05/2015 03:27:00 PM,,08/06/2015 12:48:36 PM,ONTIME,Closed,Case Closed. Closed date : 2015-08-06 12:48:36.497 Case Resolved repaired bricks,Highway Maintenance,Public Works Department,Highway Maintenance,Highway Maintenance,PWDx_District 10B: Roxbury,PWDx,,https://cityworker.cityofboston.gov:8443/attachments/report/55c263d1d052e0f32296624b/closed_photo/Report.jpg,243 Northampton St  Roxbury  MA  02118,7.0,10B,7.0,D4,Roxbury,13.0,Ward 9,903.0,R4,243 Northampton St,2118.0,Address,103730.0,42.3388,-71.0808,Constituent Call,"(42.3388, -71.0808)"
605035,101001504433,08/05/2015 04:48:00 PM,,08/12/2015 08:36:20 AM,ONTIME,Closed,Case Closed. Closed date : 2015-08-12 08:36:20.053 Case Resolved Dear Constituent     The Boston Public Works Construction Inspection Unit (CIU) Inspector states the BWSC will restore the bricks by the end of the week weather permitting.    For any questions or concerns  please contact the number listed below    Sincerely     Mark Cardarelli  Supervisor of Utility Coordination and Compliance  Boston Public Works Department  617-635-4951 Office,Highway Maintenance,Public Works Department,Highway Maintenance,Highway Maintenance,PWDx_Contractor Complaints,PWDx,,,136 Mount Vernon St  Boston  MA  02108,3.0,1B,8.0,A1,Beacon Hill,14.0,Ward 5,505.0,R1,136 Mount Vernon St,2108.0,Address,98518.0,42.3575,-71.071,Constituent Call,"(42.3575, -71.071)"
605632,101001505208,08/06/2015 04:28:00 PM,,09/10/2015 03:01:43 PM,ONTIME,Closed,Case Closed. Closed date : 2015-09-10 15:01:43.497 Duplicate of Existing Case Duplicate of case 101001417372    If you have any further questions  or feel that this case was closed  or reallocated in error  please do not hesitate to contact me.    Michael Somers  Senior Civil Engineer  Construction Management Division  Boston Public Works  617-635-3831	  Michael.Somers@Boston.gov,Highway Maintenance,Public Works Department,Highway Maintenance,Highway Maintenance,PWDx_Highway Construction,PWDx,,,INTERSECTION of Brimmer St & Mount Vernon St  Boston  MA,3.0,1B,8.0,A1,Beacon Hill,14.0,Ward 5,511.0,,INTERSECTION Brimmer St & Mount Vernon St,,Intersection,1956.0,42.3574,-71.072,Constituent Call,"(42.3574, -71.072)"
606149,101001505931,08/07/2015 02:09:00 PM,,08/10/2015 12:58:55 PM,ONTIME,Closed,Case Closed. Closed date : 2015-08-10 12:58:55.48 Case Resolved patched,Highway Maintenance,Public Works Department,Highway Maintenance,Highway Maintenance,PWDx_District 06: West Roxbury and Roslindale,PWDx,,https://cityworker.cityofboston.gov:8443/attachments/report/55c4f4c9d052d96a908b408a/closed_photo/Report.jpg,3 Glenhaven Rd  West Roxbury  MA  02132,12.0,06,6.0,E5,West Roxbury,12.0,Ward 20,2016.0,R1,3 Glenhaven Rd,2132.0,Address,64421.0,42.2707,-71.1625,Constituent Call,"(42.2707, -71.1625)"
606432,101001516323,08/08/2015 10:05:00 AM,,08/10/2015 10:50:09 AM,ONTIME,Closed,"Case Closed. Closed date : 2015-08-10 10:50:09.34 Case Resolved This location is in the middle of sidewalk  there is no utilities near this spot. It`s approximately 20` in from Mt. Vernon St. The hole looks like it could of been an old test well that went down 6 to 7 feet and is 4"" in diameter. The Construction Crew filled this hole with gravel every 6 to 8 inches  compacting it all the way up to grade  then 4 bricks were replaced and reset to bring the sidewalk back to it`s original setting.",Highway Maintenance,Public Works Department,Highway Maintenance,Highway Maintenance,PWDx_Highway Construction,PWDx,,,8 Joy St  Boston  MA  02108,3.0,1B,8.0,A1,Beacon Hill,14.0,Ward 5,503.0,A,8 Joy St,2108.0,Address,80198.0,42.3587,-71.0652,Constituent Call,"(42.3587, -71.0652)"
606442,101001516338,08/08/2015 10:51:00 AM,,08/11/2015 07:19:02 AM,ONTIME,Closed,Case Closed. Closed date : 2015-08-11 07:19:02.94 Case Resolved Location has been made safe. This sidewalk will be referred for permanent repair. See case #101001517762 for status of the permanent repair.,Highway Maintenance,Public Works Department,Highway Maintenance,Highway Maintenance,PWDx_District 1B: North End,PWDx,,,INTERSECTION of Atlantic Ave & Richmond St  Boston  MA,3.0,1B,1.0,A1,Downtown / Financial District,3.0,Ward 3,301.0,,INTERSECTION Atlantic Ave & Richmond St,,Intersection,736.0,42.3617,-71.052,Constituent Call,"(42.3617, -71.052)"
607558,101001517932,08/11/2015 09:07:00 AM,,09/18/2015 12:36:19 PM,ONTIME,Closed,Case Closed. Closed date : 2015-09-18 12:36:19.63 Case Resolved Base has been patched.  EP 9-18-15,Highway Maintenance,Public Works Department,Highway Maintenance,Highway Maintenance,PWDx_Street Light_Install New Lighting,PWDx,,,1725 Hyde Park Ave  Hyde Park  MA  02136,12.0,08,5.0,E18,Hyde Park,10.0,Ward 18,1818.0,I,1725 Hyde Park Ave,2136.0,Address,166533.0,42.2404,-71.1318,Employee Generated,"(42.2404, -71.1318)"
607576,101001517951,08/11/2015 09:18:00 AM,,,ONTIME,Open,,Streetlight Bases,Public Works Department,Highway Maintenance,Highway Maintenance,PWDx_Highway Construction General,PWDx,,,3615-3645 Washington St  Jamaica Plain  MA  02130,9.0,02,6.0,E13,Jamaica Plain,11.0,Ward 11,1108.0,I,3615-3645 Washington St,2130.0,Address,144963.0,42.3027,-71.1115,Employee Generated,"(42.3027, -71.1115)"
607591,101001517963,08/11/2015 09:27:00 AM,,08/17/2015 06:56:35 AM,ONTIME,Closed,Case Closed. Closed date : 2015-08-17 06:56:35.053 Case Resolved Concrete placed around base,Cement Light Pole Base,Public Works Department,Highway Maintenance,Highway Maintenance,PWDx_Highway Construction,PWDx,,,51 Samoset St  Dorchester  MA  02124,8.0,07,3.0,C11,Dorchester,8.0,Ward 16,1603.0,R1,51 Samoset St,2124.0,Address,122151.0,42.2904,-71.0648,Employee Generated,"(42.2904, -71.0648)"
607622,101001518002,08/11/2015 09:55:00 AM,,08/11/2015 10:51:09 AM,ONTIME,Closed,Case Closed. Closed date : 2015-08-11 10:51:09.053 Case Resolved has been filled,Highway Maintenance,Public Works Department,Highway Maintenance,Highway Maintenance,PWDx_District 10B: Roxbury,PWDx,,https://cityworker.cityofboston.gov:8443/attachments/report/55ca002fd052094b35920850/closed_photo/Report.jpg,INTERSECTION of Dearborn St & Dudley St  Roxbury  MA,7.0,10B,7.0,B2,Roxbury,13.0,Ward 8,804.0,,INTERSECTION Dearborn St & Dudley St,,Intersection,3961.0,42.3286,-71.0793,Employee Generated,"(42.3286, -71.0793)"
607630,101001518006,08/11/2015 10:02:00 AM,,08/14/2015 02:39:50 PM,ONTIME,Closed,Case Closed. Closed date : 2015-08-14 14:39:50.473 Case Resolved Completed. Checked post and base was cemented.  E Podgurski 8-14-15,Highway Maintenance,Public Works Department,Highway Maintenance,Highway Maintenance,PWDx_Street Light_General Lighting Request,PWDx,,,194 Lexington St  East Boston  MA  02128,1.0,09,1.0,A7,East Boston,1.0,Ward 1,107.0,R3,194 Lexington St,2128.0,Address,263982.0,42.3796,-71.033,Employee Generated,"(42.3796, -71.033)"
607632,101001518009,08/11/2015 10:06:00 AM,,08/13/2015 11:26:33 AM,ONTIME,Closed,Case Closed. Closed date : 2015-08-13 11:26:33.28 Case Resolved all set patched,Highway Maintenance,Public Works Department,Highway Maintenance,Highway Maintenance,PWDx_District 09: East Boston,PWDx,,https://cityworker.cityofboston.gov:8443/attachments/report/55ca01f2d052094b359208bf/closed_photo/Report.jpg,60 Gove St  East Boston  MA  02128,1.0,09,1.0,A7,East Boston,1.0,Ward 1,104.0,R3,60 Gove St,2128.0,Address,65623.0,42.3712,-71.0367,Employee Generated,"(42.3712, -71.0367)"
608444,101001519095,08/12/2015 09:23:00 AM,,10/02/2015 08:47:04 AM,ONTIME,Closed,Case Closed. Closed date : 2015-10-02 08:47:04.22 Case Resolved,Highway Maintenance,Public Works Department,Highway Maintenance,Highway Maintenance,PWDx_Street Light_General Lighting Request,PWDx,,,INTERSECTION of Charter St & Unity St  Boston  MA,3.0,1B,1.0,A1,Downtown / Financial District,3.0,Ward 3,302.0,,INTERSECTION Charter St & Unity St,,Intersection,2835.0,42.3666,-71.0536,Employee Generated,"(42.3666, -71.0536)"
608656,101001519341,08/12/2015 11:47:00 AM,,08/13/2015 10:27:58 AM,ONTIME,Closed,Case Closed. Closed date : 2015-08-13 10:27:58.39 Case Invalid The bricks at 75 High St are safe,Highway Maintenance,Public Works Department,Highway Maintenance,Highway Maintenance,PWDx_District 1C: Downtown,PWDx,,https://cityworker.cityofboston.gov:8443/attachments/report/55cb6acad052094b359258d4/closed_photo/Report.jpg,75 High St  Boston  MA  02110,3.0,1C,1.0,A1,Downtown / Financial District,3.0,Ward 3,306.0,I,75 High St,2110.0,Address,73292.0,42.3539,-71.0551,Constituent Call,"(42.3539, -71.0551)"
608936,101001519692,08/12/2015 04:41:00 PM,,,ONTIME,Open,,Highway Maintenance,Public Works Department,Highway Maintenance,Highway Maintenance,PWDx_Sidewalk Repair,PWDx,,,40 Berkeley St  Boston  MA  02116,4.0,1C,2.0,D4,South End,6.0,Ward 5,501.0,E,40 Berkeley St,2116.0,Address,15025.0,42.3459,-71.0709,Constituent Call,"(42.3459, -71.0709)"
610081,101001521130,08/14/2015 09:45:00 AM,,08/16/2015 10:14:54 AM,ONTIME,Closed,Case Closed. Closed date : 2015-08-16 10:14:54.747 Case Resolved,Highway Maintenance,Public Works Department,Highway Maintenance,Highway Maintenance,PWDx_District 1A: Charlestown,PWDx,,https://cityworker.cityofboston.gov:8443/attachments/report/55cdf206d052094b3592bf68/closed_photo/Report.jpg,29-31 Austin St  Charlestown  MA  02129,3.0,1A,1.0,A15,Charlestown,2.0,Ward 2,201.0,,29-31 Austin St,2129.0,Address,155829.0,42.3749,-71.0671,Employee Generated,"(42.3749, -71.0671)"
610087,101001521133,08/14/2015 09:51:00 AM,,08/25/2015 08:08:29 AM,ONTIME,Closed,Case Closed. Closed date : 2015-08-25 08:08:29.463 Case Resolved Concrete placed.,Highway Maintenance,Public Works Department,Highway Maintenance,Highway Maintenance,PWDx_Highway Construction,PWDx,,,,,,,,,,,,,,,,,42.3594,-71.0587,Employee Generated,"(0, 0)"
610092,101001521141,08/14/2015 09:53:00 AM,,08/17/2015 02:32:27 PM,ONTIME,Closed,Case Closed. Closed date : 2015-08-17 14:32:27.823 Case Invalid Case is affiliated with South End    Across from 111 warren ave in the south end not Charlestown.  I spoke with Edward Podgurski via email regarding matter.    Will forward duplicate case to highway construction,Highway Maintenance,Public Works Department,Highway Maintenance,Highway Maintenance,PWDx_District 1A: Charlestown,PWDx,,,4 Bunker Hill Industrial Park  Charlestown  MA  02129,3.0,1A,1.0,A15,Charlestown,2.0,02,201.0,,4 Bunker Hill Industrial Park,2129.0,Address,352842.0,42.3594,-71.0587,Employee Generated,"(0, 0)"
610115,101001521173,08/14/2015 10:15:00 AM,,09/29/2015 12:37:15 PM,ONTIME,Closed,Case Closed. Closed date : 2015-09-29 12:37:15.367 Case Resolved Bricks replaced,Highway Maintenance,Public Works Department,Highway Maintenance,Highway Maintenance,PWDx_Highway Construction,PWDx,,,427 Commercial St  Boston  MA  02109,3.0,1B,1.0,A1,Boston,3.0,03,302.0,,427 Commercial St,2109.0,Address,342988.0,42.3675,-71.0526,Constituent Call,"(42.3675, -71.0526)"
610507,101001521642,08/14/2015 03:10:00 PM,,08/18/2015 02:13:36 PM,ONTIME,Closed,Case Closed. Closed date : 2015-08-18 14:13:36.05 Case Noted This is not an unsafe tripping hazard. Please see attached photo.,Highway Maintenance,Public Works Department,Highway Maintenance,Highway Maintenance,PWDx_Highway Construction,PWDx,,,107 F St  South Boston  MA  02127,6.0,05,2.0,C6,South Boston / South Boston Waterfront,5.0,Ward 7,704.0,R1,107 F St,2127.0,Address,55356.0,42.3359,-71.0486,Constituent Call,"(42.3359, -71.0486)"
610569,101001521726,08/14/2015 04:59:00 PM,,08/17/2015 07:01:48 AM,ONTIME,Closed,Case Closed. Closed date : 2015-08-17 07:01:48.543 Case Resolved cement slab has been removed,Highway Maintenance,Public Works Department,Highway Maintenance,Highway Maintenance,PWDx_Litter Basket Maintenance,PWDx,,https://cityworker.cityofboston.gov:8443/attachments/report/55ce56f4d052094b3592dba3/closed_photo/Report.jpg,505 Tremont St  Boston  MA  02116,4.0,1C,2.0,D4,Boston,6.0,05,501.0,CM,505 Tremont St,2116.0,Address,137486.0,42.345,-71.0704,Constituent Call,"(42.345, -71.0704)"
611715,101001523224,08/17/2015 02:21:00 PM,,08/19/2015 06:59:26 AM,ONTIME,Closed,Case Closed. Closed date : 2015-08-19 06:59:26.737 Case Resolved Location has been made safe. This sidewalk will be referred for permanent repair. See case #101001524785 for status of the permanent repair.,Highway Maintenance,Public Works Department,Highway Maintenance,Highway Maintenance,PWDx_District 10A: Roxbury,PWDx,,,1855 Washington St  Roxbury  MA  02118,7.0,10B,7.0,D4,Roxbury,13.0,Ward 9,903.0,,1855 Washington St,2118.0,Address,171099.0,42.3355,-71.0787,Constituent Call,"(42.3355, -71.0787)"
612582,101001524349,08/18/2015 01:51:00 PM,,08/18/2015 01:52:25 PM,ONTIME,Closed,Case Closed. Closed date : 2015-08-18 13:52:25.363 Case Invalid,Highway Maintenance,Public Works Department,Highway Maintenance,Highway Maintenance,PWDx_District 1C: Downtown,PWDx,,,150-130 Appleton St  Boston  MA  02116,4.0,1C,2.0,D4,South End,6.0,Ward 4,401.0,CM,150-130 Appleton St,2116.0,Address,3924.0,42.3447,-71.0757,Constituent Call,"(42.3447, -71.0757)"
612587,101001524353,08/18/2015 01:52:00 PM,,09/01/2015 03:54:26 PM,ONTIME,Closed,Case Closed. Closed date : 2015-09-01 15:54:26.12 Duplicate of Existing Case Duplicate of 101001400840    If you have any further questions  or feel that this case was closed in error  please do not hesitate to contact me.    Michael Somers  Senior Civil Engineer  Construction Management Division  Boston Public Works  617-635-3831	  Michael.Somers@Boston.gov,Highway Maintenance,Public Works Department,Highway Maintenance,Highway Maintenance,PWDx_Highway Construction,PWDx,,,150-130 Appleton St  Boston  MA  02116,4.0,1C,2.0,D4,South End,6.0,Ward 4,401.0,CM,150-130 Appleton St,2116.0,Address,3924.0,42.3447,-71.0757,Constituent Call,"(42.3447, -71.0757)"
612648,101001524437,08/18/2015 02:37:00 PM,,08/19/2015 12:22:27 PM,ONTIME,Closed,Case Closed. Closed date : 2015-08-19 12:22:27.737 Case Resolved,Highway Maintenance,Public Works Department,Highway Maintenance,Highway Maintenance,PWDx_District 10A: Roxbury,PWDx,,https://cityworker.cityofboston.gov:8443/attachments/report/55d37d1ad052a1bf700f4969/closed_photo/Report.jpg,4-6 Nira Ave  Jamaica Plain  MA  02130,9.0,10A,8.0,E13,Jamaica Plain,11.0,Ward 10,1008.0,R3,4-6 Nira Ave,2130.0,Address,102921.0,42.3248,-71.1082,Employee Generated,"(42.3248, -71.1082)"
612678,101001524467,08/18/2015 03:00:00 PM,,09/29/2015 12:58:25 PM,ONTIME,Closed,Case Closed. Closed date : 2015-09-29 12:58:25.697 Case Resolved Sidewalk repaired 09/2015    If you have any further questions  or feel that this case was closed  or reallocated in error  please do not hesitate to contact me.    Michael Somers  Senior Civil Engineer  Construction Management Division  Boston Public Works  617-635-3831	  Michael.Somers@Boston.gov,Highway Maintenance,Public Works Department,Highway Maintenance,Highway Maintenance,PWDx_Highway Construction,PWDx,,,1834-1838 Centre St  West Roxbury  MA  02132,12.0,06,6.0,E5,West Roxbury,12.0,Ward 20,2018.0,CM,1834-1838 Centre St,2132.0,Address,163085.0,42.2864,-71.1539,Constituent Call,"(42.2864, -71.1539)"
612759,101001524567,08/18/2015 04:41:00 PM,,08/21/2015 01:04:41 PM,ONTIME,Closed,Case Closed. Closed date : 2015-08-21 13:04:41.57 Duplicate of Existing Case case entered in ISD for inspection 1527182,Highway Maintenance,Public Works Department,Highway Maintenance,Highway Maintenance,ISD_Administrative,ISD,,,107 Pinckney St  Boston  MA  02114,3.0,1B,8.0,A1,Beacon Hill,14.0,Ward 5,504.0,A,107 Pinckney St,2114.0,Address,110342.0,42.3589,-71.0698,Constituent Call,"(42.3589, -71.0698)"
613276,101001525253,08/19/2015 12:38:00 PM,,,ONTIME,Open,,Highway Maintenance,Public Works Department,Highway Maintenance,Highway Maintenance,PWDx_Sidewalk Repair,PWDx,,,26 Trenton St  East Boston  MA  02128,1.0,09,1.0,A7,East Boston,1.0,Ward 1,107.0,R3,26 Trenton St,2128.0,Address,138367.0,42.3783,-71.0383,Constituent Call,"(42.3783, -71.0383)"
613824,101001525981,08/20/2015 09:12:00 AM,,09/18/2015 12:24:46 PM,ONTIME,Closed,Case Closed. Closed date : 2015-09-18 12:24:46.74 Case Resolved Base has been cemented.  EP 9-18-15,Cement Light Pole Base,Public Works Department,Highway Maintenance,Highway Maintenance,PWDx_Street Light_General Lighting Request,PWDx,,,15 Green St  Charlestown  MA  02129,3.0,1A,1.0,A15,Charlestown,2.0,02,201.0,,15 Green St,2129.0,Address,354308.0,42.3594,-71.0587,Employee Generated,"(0, 0)"
614083,101001526306,08/20/2015 01:21:00 PM,,,ONTIME,Open,,Highway Maintenance,Public Works Department,Highway Maintenance,Highway Maintenance,PWDx_Sidewalk Repair,PWDx,,,INTERSECTION of Appleton St & Berkeley St  Boston  MA,4.0,1C,2.0,D4,South End,6.0,Ward 5,501.0,,INTERSECTION Appleton St & Berkeley St,,Intersection,496.0,42.3462,-71.0706,Constituent Call,"(42.3462, -71.0706)"
614559,101001526930,08/21/2015 08:56:00 AM,,09/18/2015 11:56:52 AM,ONTIME,Closed,Case Closed. Closed date : 2015-09-18 11:56:52.51 Case Resolved Bases have been filled and look good.  EP 9-18-15,Highway Maintenance,Public Works Department,Highway Maintenance,Highway Maintenance,PWDx_Street Light_General Lighting Request,PWDx,,,INTERSECTION of Staniford St & William Cardinal O'Connell Way  Boston  MA,3.0,1B,8.0,A1,Back Bay,3.0,Ward 3,305.0,,INTERSECTION Staniford St & William Cardinal O'Connell Way,,Intersection,8434.0,42.3622,-71.0639,Employee Generated,"(42.3622, -71.0639)"
614668,101001527017,08/21/2015 09:50:00 AM,,08/21/2015 02:34:54 PM,ONTIME,Closed,Case Closed. Closed date : 2015-08-21 14:34:54.4 Case Noted Area was made safe with asphalt no evidence of light base being at this location all the light poles are on the opposite side of the street.,Highway Maintenance,Public Works Department,Highway Maintenance,Highway Maintenance,PWDx_District 07: South Dorchester,PWDx,,,5-7 Wenlock Rd  Dorchester  MA  02122,8.0,07,3.0,C11,Dorchester,7.0,Ward 16,1609.0,CM,5-7 Wenlock Rd,2122.0,Address,147756.0,42.2848,-71.0486,Employee Generated,"(42.2848, -71.0486)"
614689,101001527043,08/21/2015 10:07:00 AM,,08/24/2015 11:07:32 AM,ONTIME,Closed,Case Closed. Closed date : 2015-08-24 11:07:32.88 Case Resolved Repaired by Highway Maint Crew (hot top asphalt). Base of light pole. Job is complete,Highway Maintenance,Public Works Department,Highway Maintenance,Highway Maintenance,PWDx_District 06: West Roxbury and Roslindale,PWDx,,https://cityworker.cityofboston.gov:8443/attachments/report/55d731b3d052ea4bf6aaf0cb/closed_photo/Report.jpg,264 Stratford St  West Roxbury  MA  02132,12.0,06,6.0,E5,West Roxbury,12.0,Ward 20,2010.0,R1,264 Stratford St,2132.0,Address,131216.0,42.2785,-71.1435,Employee Generated,"(42.2785, -71.1435)"
614701,101001527055,08/21/2015 10:17:00 AM,,08/26/2015 09:28:35 AM,ONTIME,Closed,Case Closed. Closed date : 2015-08-26 09:28:35.267 Case Resolved Light pole secure my hot patch around base,Highway Maintenance,Public Works Department,Highway Maintenance,Highway Maintenance,PWDx_District 02: Jamaica Plain,PWDx,,https://cityworker.cityofboston.gov:8443/attachments/report/55d733f8d052ea4bf6aaf152/closed_photo/Report.jpg,0 American Legion Hwy  Roslindale  MA  02131,12.0,02,5.0,E18,Roslindale,10.0,Ward 18,1807.0,E,0 American Legion Hwy,2131.0,Address,3082.0,42.2852,-71.1114,Employee Generated,"(42.2852, -71.1114)"
614955,101001527358,08/21/2015 01:00:00 PM,,08/26/2015 06:33:56 AM,ONTIME,Closed,Case Closed. Closed date : 2015-08-26 06:33:56.36 Case Resolved private property  no street exist; belongs to school.,Highway Maintenance,Public Works Department,Highway Maintenance,Highway Maintenance,PWDx_District 1C: Downtown,PWDx,,https://cityworker.cityofboston.gov:8443/attachments/report/55d75994d052ea4bf6aaff71/closed_photo/Report.jpg,6-6H Appleton St  Boston  MA  02116,4.0,1C,2.0,D4,South End,6.0,Ward 5,501.0,E,6-6H Appleton St,2116.0,Address,4075.0,42.3463,-71.0698,Constituent Call,"(42.3463, -71.0698)"
614961,101001527370,08/21/2015 01:05:00 PM,,08/21/2015 01:37:57 PM,ONTIME,Closed,Case Closed. Closed date : 2015-08-21 13:37:57.28 Case Noted The sidewalk was clear of trip hazards at this location,Highway Maintenance,Public Works Department,Highway Maintenance,Highway Maintenance,PWDx_District 1C: Downtown,PWDx,,https://cityworker.cityofboston.gov:8443/attachments/report/55d75ab6d052ea4bf6aaffe0/closed_photo/Report.jpg,INTERSECTION of Appleton St & Dartmouth St  Boston  MA,4.0,1C,2.0,D4,South End,6.0,Ward 4,401.0,,INTERSECTION Appleton St & Dartmouth St,,Intersection,494.0,42.3451,-71.0749,Constituent Call,"(42.3451, -71.0749)"
615035,101001527458,08/21/2015 02:32:00 PM,,,ONTIME,Open,,Highway Maintenance,Public Works Department,Highway Maintenance,Highway Maintenance,PWDx_Sidewalk Repair,PWDx,,,19 Lawrence St  Boston  MA  02116,4.0,1C,2.0,D4,South End,6.0,Ward 5,501.0,R1,19 Lawrence St,2116.0,Address,84607.0,42.3462,-71.0723,Constituent Call,"(42.3462, -71.0723)"
615051,101001527481,08/21/2015 02:44:00 PM,,08/24/2015 09:18:38 AM,ONTIME,Closed,Case Closed. Closed date : 2015-08-24 09:18:38.773 Case Resolved made save by patch crew,Highway Maintenance,Public Works Department,Highway Maintenance,Highway Maintenance,PWDx_District 07: South Dorchester,PWDx,,https://cityworker.cityofboston.gov:8443/attachments/report/55d772e6d052ea4bf6ab06e1/closed_photo/Report.jpg,1008 Washington St  Dorchester  MA  02124,8.0,07,3.0,C11,Dorchester,7.0,Ward 17,1704.0,R2,1008 Washington St,2124.0,Address,145894.0,42.2771,-71.0692,Employee Generated,"(42.2771, -71.0692)"
615056,101001527490,08/21/2015 02:51:00 PM,,09/18/2015 12:21:51 PM,ONTIME,Closed,Case Closed. Closed date : 2015-09-18 12:21:51.283 Case Resolved Base was cemented properly.  EP 9-18-15,Highway Maintenance,Public Works Department,Highway Maintenance,Highway Maintenance,PWDx_Street Light_General Lighting Request,PWDx,,,INTERSECTION of Columbus Ave & Ritchie St  Roxbury  MA,9.0,10B,7.0,E13,Roxbury,13.0,Ward 11,1101.0,,INTERSECTION Columbus Ave & Ritchie St,,Intersection,3273.0,42.3225,-71.0984,Employee Generated,"(42.3225, -71.0984)"
615087,101001527533,08/21/2015 03:41:00 PM,,12/08/2015 12:03:24 PM,ONTIME,Closed,Case Closed. Closed date : 2015-12-08 12:03:24.593 Case Resolved Repaired,Highway Maintenance,Public Works Department,Highway Maintenance,Highway Maintenance,PWDx_Highway Construction,PWDx,,https://cityworker.cityofboston.gov:8443/attachments/report/55d77f72d052ea4bf6ab0b6a/closed_photo/Report.jpg,34 River St  Boston  MA  02108,3.0,1B,8.0,A1,Beacon Hill,14.0,Ward 5,505.0,CM,34 River St,2108.0,Address,116205.0,42.3571,-71.0705,Constituent Call,"(42.3571, -71.0705)"
615126,101001527579,08/21/2015 04:40:00 PM,,12/08/2015 11:47:04 AM,ONTIME,Closed,Case Closed. Closed date : 2015-12-08 11:47:04.147 Case Resolved Done,Highway Maintenance,Public Works Department,Highway Maintenance,Highway Maintenance,PWDx_Highway Construction,PWDx,,https://cityworker.cityofboston.gov:8443/attachments/report/55d791e6d052ea4bf6ab0fd9/closed_photo/Report.jpg,10 W Cedar St  Boston  MA  02108,3.0,1B,8.0,A1,Beacon Hill,14.0,Ward 5,511.0,R1,10 W Cedar St,2108.0,Address,26884.0,42.3576,-71.0695,Constituent Call,"(42.3576, -71.0695)"
616174,101001529031,08/24/2015 02:36:00 PM,,09/18/2015 12:16:35 PM,ONTIME,Closed,Case Closed. Closed date : 2015-09-18 12:16:35.773 Case Resolved Base has been cemented and looks good.  EP 9-18-15,Highway Maintenance,Public Works Department,Highway Maintenance,Highway Maintenance,PWDx_Street Light_General Lighting Request,PWDx,,,288 C St  South Boston  MA  02127,6.0,05,2.0,C6,South Boston,5.0,06,601.0,,288 C St,2127.0,Address,355656.0,42.3594,-71.0587,Employee Generated,"(0, 0)"
616187,101001529042,08/24/2015 02:45:00 PM,,10/08/2015 09:32:52 AM,ONTIME,Closed,Case Closed. Closed date : 2015-10-08 09:32:52.59 Case Resolved Base has been cemented. EP. 10/8/15.,Highway Maintenance,Public Works Department,Highway Maintenance,Highway Maintenance,PWDx_Street Light_General Lighting Request,PWDx,,https://cityworker.cityofboston.gov:8443/attachments/report/55db6747d052ea4bf6ab60b8/closed_photo/Report.jpg,39 Savin Hill Ave  Dorchester  MA  02125,7.0,03,3.0,C11,Dorchester,8.0,15,1504.0,,39 Savin Hill Ave,2125.0,Address,355113.0,42.3594,-71.0587,Employee Generated,"(0, 0)"
616197,101001529053,08/24/2015 02:52:00 PM,,09/28/2015 12:40:48 PM,ONTIME,Closed,Case Closed. Closed date : 2015-09-28 12:40:48.433 Case Resolved Base is cemented. 9/28/15. EP,Highway Maintenance,Public Works Department,Highway Maintenance,Highway Maintenance,PWDx_Street Light_General Lighting Request,PWDx,,https://cityworker.cityofboston.gov:8443/attachments/report/55db68c3d052ea4bf6ab6137/closed_photo/Report.jpg,21 Sargent St  Dorchester  MA  02125,7.0,03,7.0,B2,Roxbury,13.0,Ward 13,1304.0,R3,21 Sargent St,2125.0,Address,306490.0,42.3161,-71.0741,Employee Generated,"(42.3161, -71.0741)"
616198,101001529065,08/24/2015 02:57:00 PM,,09/28/2015 12:26:29 PM,ONTIME,Closed,Case Closed. Closed date : 2015-09-28 12:26:29.953 Case Resolved Base has been cemented. 9/28/15 EP.,Highway Maintenance,Public Works Department,Highway Maintenance,Highway Maintenance,PWDx_Street Light_General Lighting Request,PWDx,,https://cityworker.cityofboston.gov:8443/attachments/report/55db6ba8d052ea4bf6ab6241/closed_photo/Report.jpg,93 Auckland St  Dorchester  MA  02125,7.0,03,3.0,C11,Dorchester,8.0,Ward 15,1506.0,R3,93 Auckland St,2125.0,Address,6547.0,42.3115,-71.0567,Employee Generated,"(42.3115, -71.0567)"
616212,101001529081,08/24/2015 03:08:00 PM,,12/01/2015 09:24:00 AM,ONTIME,Closed,Case Closed. Closed date : 2015-12-01 09:24:00.723 Case Resolved This base has been cemented. EP. 12/1/15.,Streetlight Bases///Printed ep,Public Works Department,Highway Maintenance,Highway Maintenance,PWDx_Street Light_General Lighting Request,PWDx,,https://cityworker.cityofboston.gov:8443/attachments/report/55db6c8ed052ea4bf6ab629e/closed_photo/Report.jpg,58 Westville St  Dorchester  MA  02124,7.0,03,4.0,C11,Dorchester,8.0,Ward 15,1505.0,R1,58 Westville St,2124.0,Address,148949.0,42.3005,-71.07,Employee Generated,"(42.3005, -71.07)"
616245,101001529115,08/24/2015 03:36:00 PM,,09/03/2015 07:29:30 AM,ONTIME,Closed,Case Closed. Closed date : 2015-09-03 07:29:30.74 Case Resolved Location has been made safe. This sidewalk will be referred for permanent repair. See case #101001548663 for status of the permanent repair.,Highway Maintenance,Public Works Department,Highway Maintenance,Highway Maintenance,PWDx_District 1B: North End,PWDx,,,1 Bowdoin Sq  Boston  MA  02114,3.0,1B,1.0,A1,Downtown / Financial District,3.0,Ward 3,306.0,C,1 Bowdoin Sq,2114.0,Address,191679.0,42.3618,-71.0623,Constituent Call,"(42.3618, -71.0623)"
616973,101001530074,08/25/2015 02:27:00 PM,,08/28/2015 11:46:02 AM,ONTIME,Closed,Case Closed. Closed date : 2015-08-28 11:46:02.653 Case Resolved Complete  please close.,Highway Maintenance,Public Works Department,Highway Maintenance,Highway Maintenance,PWDx_Highway Construction,PWDx,,,365 Market St  Brighton  MA  02135,11.0,04,9.0,D14,Allston / Brighton,15.0,Ward 22,2203.0,C,365 Market St,2135.0,Address,90275.0,42.3508,-71.1526,Employee Generated,"(42.3508, -71.1526)"
616994,101001530102,08/25/2015 02:41:00 PM,,09/18/2015 12:14:04 PM,ONTIME,Closed,Case Closed. Closed date : 2015-09-18 12:14:04.687 Case Resolved Base has been filled w cement and looks good.  EP 9-18-15,Highway Maintenance,Public Works Department,Highway Maintenance,Highway Maintenance,PWDx_Street Light_General Lighting Request,PWDx,,,333 Market St  Brighton  MA  02135,11.0,04,9.0,D14,Allston / Brighton,15.0,Ward 22,2212.0,E,333 Market St,2135.0,Address,269053.0,42.3516,-71.1523,Employee Generated,"(42.3516, -71.1523)"
617001,101001530110,08/25/2015 02:46:00 PM,,09/18/2015 11:46:24 AM,ONTIME,Closed,Case Closed. Closed date : 2015-09-18 11:46:24.85 Case Resolved Base has been cemented.  EP 9-18-15,Highway Maintenance,Public Works Department,Highway Maintenance,Highway Maintenance,PWDx_Street Light_General Lighting Request,PWDx,,,INTERSECTION of Brighton Ave & Islington St  Allston  MA,11.0,04,9.0,D14,Allston / Brighton,15.0,Ward 21,2106.0,,INTERSECTION Brighton Ave & Islington St,,Intersection,1941.0,42.3534,-71.1368,Employee Generated,"(42.3534, -71.1368)"
617041,101001530180,08/25/2015 03:25:00 PM,,09/28/2015 11:39:33 AM,ONTIME,Closed,Case Closed. Closed date : 2015-09-28 11:39:33.18 Case Resolved Base and sidewalk cemented. 9/28/15 EP.,Highway Maintenance,Public Works Department,Highway Maintenance,Highway Maintenance,PWDx_Street Light_General Lighting Request,PWDx,,https://cityworker.cityofboston.gov:8443/attachments/report/55dcc44cd052ea4bf6aba336/closed_photo/Report.jpg,12 Thelma Rd  Dorchester  MA  02122,8.0,07,3.0,C11,Dorchester,7.0,Ward 16,1605.0,CD,12 Thelma Rd,2122.0,Address,134708.0,42.2946,-71.0535,Employee Generated,"(42.2946, -71.0535)"
618204,101001541662,08/27/2015 07:46:00 AM,,10/01/2015 12:06:09 PM,ONTIME,Closed,Case Closed. Closed date : 2015-10-01 12:06:09.583 Case Resolved Base is cemented. 10/1/15. EP.,Highway Maintenance,Public Works Department,Highway Maintenance,Highway Maintenance,PWDx_Street Light_General Lighting Request,PWDx,,https://cityworker.cityofboston.gov:8443/attachments/report/55def926d052ea4bf6abee45/closed_photo/Report.jpg,INTERSECTION of Brighton Ave & Cambridge St  Allston  MA,11.0,04,9.0,D14,Allston / Brighton,15.0,Ward 21,2106.0,,INTERSECTION Brighton Ave & Cambridge St,,Intersection,1940.0,42.3535,-71.1376,Employee Generated,"(42.3535, -71.1376)"
618214,101001541670,08/27/2015 07:51:00 AM,,10/01/2015 12:31:43 PM,ONTIME,Closed,Case Closed. Closed date : 2015-10-01 12:31:43.423 Case Resolved Base is cemented. 10/1/15. EP.,Highway Maintenance,Public Works Department,Highway Maintenance,Highway Maintenance,PWDx_Street Light_General Lighting Request,PWDx,,https://cityworker.cityofboston.gov:8443/attachments/report/55defa71d052ea4bf6abeea9/closed_photo/Report.jpg,375-375C Market St  Brighton  MA  02135,11.0,04,9.0,D14,Allston / Brighton,15.0,22,2203.0,,375-375C Market St,2135.0,Address,343438.0,42.3594,-71.0587,Employee Generated,"(0, 0)"
618986,101001542727,08/28/2015 07:47:00 AM,,10/08/2015 11:08:01 AM,ONTIME,Closed,Case Closed. Closed date : 2015-10-08 11:08:01.283 Case Resolved Base has been cemented. EP. 10/8/15.,Highway Maintenance,Public Works Department,Highway Maintenance,Highway Maintenance,PWDx_Street Light_General Lighting Request,PWDx,,https://cityworker.cityofboston.gov:8443/attachments/report/55e04b03d052ea4bf6ac24b5/closed_photo/Report.jpg,INTERSECTION of Staniford St & William Cardinal O'Connell Way  Boston  MA,3.0,1B,8.0,A1,Back Bay,3.0,Ward 3,305.0,,INTERSECTION Staniford St & William Cardinal O'Connell Way,,Intersection,8434.0,42.3622,-71.0639,Employee Generated,"(42.3622, -71.0639)"
618994,101001542744,08/28/2015 07:58:00 AM,,09/24/2015 01:00:38 PM,ONTIME,Closed,Case Closed. Closed date : 2015-09-24 13:00:38.5 Case Resolved Base has been cemented. EP 9/24/15,Highway Maintenance,Public Works Department,Highway Maintenance,Highway Maintenance,PWDx_Street Light_General Lighting Request,PWDx,,https://cityworker.cityofboston.gov:8443/attachments/report/55e04e1cd052ea4bf6ac2555/closed_photo/Report.jpg,INTERSECTION of Staniford St & William Cardinal O'Connell Way  Boston  MA,3.0,1B,8.0,A1,Back Bay,3.0,Ward 3,305.0,,INTERSECTION Staniford St & William Cardinal O'Connell Way,,Intersection,8434.0,42.3622,-71.0639,Employee Generated,"(42.3622, -71.0639)"
619200,101001543017,08/28/2015 10:39:00 AM,,09/18/2015 09:51:43 AM,ONTIME,Closed,Case Closed. Closed date : 2015-09-18 09:51:43.947 Case Noted DUG AND REMOVED HYDRANT   SIDEWALK TO BE RE-BRICKED 9/15,Highway Maintenance,Public Works Department,Highway Maintenance,Highway Maintenance,BWSC_All Cases,BWSC,,,20 Somerset St  Boston  MA  02108,3.0,1B,1.0,A1,Downtown / Financial District,3.0,03,306.0,E,20 Somerset St,2108.0,Address,128378.0,42.3597,-71.0618,Constituent Call,"(42.3597, -71.0618)"
619349,101001543217,08/28/2015 01:34:00 PM,,,ONTIME,Open,,Highway Maintenance,Public Works Department,Highway Maintenance,Highway Maintenance,INFO01_GenericeFormforOtherServiceRequestTypes,INFO,,,15-17 Brimmer St  Boston  MA  02108,3.0,1B,8.0,A1,Back Bay,14.0,Ward 5,511.0,CM,15-17 Brimmer St,2108.0,Address,20225.0,42.3583,-71.072,Constituent Call,"(42.3583, -71.072)"
621715,101001546666,09/01/2015 01:24:00 PM,,,ONTIME,Open,,Highway Maintenance,Public Works Department,Highway Maintenance,Highway Maintenance,INFO01_GenericeFormforOtherServiceRequestTypes,INFO,,,1 Washington Mall  Boston  MA  02108,3.0,1B,1.0,A1,Downtown / Financial District,3.0,Ward 3,306.0,C,1 Washington Mall,2108.0,Address,171349.0,42.3594,-71.058,Constituent Call,"(42.3594, -71.058)"
622010,101001547061,09/01/2015 05:34:00 PM,,09/03/2015 02:14:16 PM,ONTIME,Closed,Case Closed. Closed date : 2015-09-03 14:14:16.843 Case Invalid all the street lights in this area are fine,Highway Maintenance,Public Works Department,Highway Maintenance,Highway Maintenance,PWDx_District 1B: North End,PWDx,,https://cityworker.cityofboston.gov:8443/attachments/report/55e61a40d05220b9f82c3611/closed_photo/Report.jpg,97-99 Mount Vernon St  Boston  MA  02108,3.0,1B,8.0,A1,Beacon Hill,14.0,Ward 5,511.0,CM,97-99 Mount Vernon St,2108.0,Address,98780.0,42.3581,-71.0697,Constituent Call,"(42.3581, -71.0697)"
622656,101001547922,09/02/2015 11:21:00 AM,,09/10/2015 10:26:53 AM,ONTIME,Closed,Case Closed. Closed date : 2015-09-10 10:26:53.02 Case Resolved Location has been made safe. This sidewalk will be referred for permanent repair. See case #101001574748 for status of the permanent repair.,SIDEWALK MAKE SAFE,Public Works Department,Highway Maintenance,Highway Maintenance,PWDx_District 1C: Downtown,PWDx,,,INTERSECTION of Dartmouth St & Marlborough St  Boston  MA,4.0,1C,8.0,D4,Back Bay,14.0,Ward 5,507.0,,INTERSECTION Dartmouth St & Marlborough St,,Intersection,3910.0,42.3529,-71.0787,Constituent Call,"(42.3529, -71.0787)"
623219,101001548700,09/03/2015 07:57:00 AM,,09/08/2015 10:22:22 AM,ONTIME,Closed,Case Closed. Closed date : 2015-09-08 10:22:22.61 Case Noted need better location,Highway Maintenance,Public Works Department,Highway Maintenance,Highway Maintenance,PWDx_District 10A: Roxbury,PWDx,,,0 Walnut Park  Roxbury  MA  02119,9.0,10B,7.0,E13,Roxbury,11.0,Ward 11,1105.0,RL,0 Walnut Park,2119.0,Address,141982.0,42.3154,-71.0966,Employee Generated,"(42.3154, -71.0966)"
623225,101001548702,09/03/2015 08:03:00 AM,,09/03/2015 01:16:05 PM,ONTIME,Closed,Case Closed. Closed date : 2015-09-03 13:16:05.757 Case Resolved patched,Highway Maintenance,Public Works Department,Highway Maintenance,Highway Maintenance,PWDx_District 07: South Dorchester,PWDx,,https://cityworker.cityofboston.gov:8443/attachments/report/55e837b4d05220b9f82c903c/closed_photo/Report.jpg,11 Blanche St  Dorchester  MA  02122,7.0,07,3.0,C11,Dorchester,7.0,Ward 16,1602.0,R2,11 Blanche St,2122.0,Address,15953.0,42.2991,-71.0506,Employee Generated,"(42.2991, -71.0506)"
623227,101001548707,09/03/2015 08:06:00 AM,,09/25/2015 11:14:03 AM,ONTIME,Closed,Case Closed. Closed date : 2015-09-25 11:14:03.437 Case Resolved Base cemented. 9/25/15 EP,Highway Maintenance,Public Works Department,Highway Maintenance,Highway Maintenance,PWDx_Street Light_General Lighting Request,PWDx,,https://cityworker.cityofboston.gov:8443/attachments/report/55e83886d05220b9f82c9089/closed_photo/Report.jpg,2 Roseclair St  Dorchester  MA  02125,6.0,03,2.0,C6,Dorchester,5.0,07,709.0,R3,2 Roseclair St,2125.0,Address,301170.0,42.3212,-71.0612,Employee Generated,"(42.3212, -71.0612)"
623231,101001548716,09/03/2015 08:09:00 AM,,09/30/2015 12:05:46 PM,ONTIME,Closed,Case Closed. Closed date : 2015-09-30 12:05:46.55 Case Resolved Base has been patched. 9/30/15. EP,Highway Maintenance,Public Works Department,Highway Maintenance,Highway Maintenance,PWDx_Street Light_General Lighting Request,PWDx,,https://cityworker.cityofboston.gov:8443/attachments/report/55e83962d05220b9f82c90e2/closed_photo/Report.jpg,19 Parker Hill Ave  Mission Hill  MA  02120,9.0,10A,8.0,B2,Mission Hill,11.0,Ward 10,1008.0,R3,19 Parker Hill Ave,2120.0,Address,107960.0,42.3323,-71.1098,Employee Generated,"(42.3323, -71.1098)"
623239,101001548727,09/03/2015 08:13:00 AM,,09/30/2015 11:53:45 AM,ONTIME,Closed,Case Closed. Closed date : 2015-09-30 11:53:45.36 Case Resolved Base is cemented. 9/30/15. EP,Highway Maintenance,Public Works Department,Highway Maintenance,Highway Maintenance,PWDx_Street Light_General Lighting Request,PWDx,,https://cityworker.cityofboston.gov:8443/attachments/report/55e83a3fd05220b9f82c91a8/closed_photo/Report.jpg,5-23 Turquoise Way  Mission Hill  MA  02120,9.0,10A,8.0,B2,Mission Hill,13.0,10,1001.0,EA,5-23 Turquoise Way,2120.0,Address,341618.0,42.3594,-71.0587,Employee Generated,"(0, 0)"
623251,101001548741,09/03/2015 08:20:00 AM,,09/25/2015 10:52:57 AM,ONTIME,Closed,Case Closed. Closed date : 2015-09-25 10:52:57.67 Case Resolved Base has been cemented. 9/25/15 EP,Highway Maintenance,Public Works Department,Highway Maintenance,Highway Maintenance,PWDx_Street Light_General Lighting Request,PWDx,,https://cityworker.cityofboston.gov:8443/attachments/report/55e83bced05220b9f82c9271/closed_photo/Report.jpg,1170 Massachusetts Ave  Dorchester  MA  02125,6.0,03,2.0,C6,Dorchester,5.0,Ward 7,708.0,I,1170 Massachusetts Ave,2125.0,Address,91944.0,42.3246,-71.0648,Employee Generated,"(42.3246, -71.0648)"
623257,101001548750,09/03/2015 08:24:00 AM,,09/29/2015 12:20:38 PM,ONTIME,Closed,Case Closed. Closed date : 2015-09-29 12:20:38.327 Case Resolved Base is cemented. 9/29/25. EP.,Highway Maintenance,Public Works Department,Highway Maintenance,Highway Maintenance,PWDx_Street Light_General Lighting Request,PWDx,,https://cityworker.cityofboston.gov:8443/attachments/report/55e83cd3d05220b9f82c9317/closed_photo/Report.jpg,INTERSECTION of Dennis St & Dudley St  Roxbury  MA,7.0,03,7.0,B2,Roxbury,13.0,Ward 8,805.0,,INTERSECTION Dennis St & Dudley St,,Intersection,4022.0,42.3238,-71.0739,Employee Generated,"(42.3238, -71.0739)"
623261,101001548757,09/03/2015 08:27:00 AM,,09/28/2015 01:19:46 PM,ONTIME,Closed,Case Closed. Closed date : 2015-09-28 13:19:46.453 Case Resolved Base has been cemented. 9/28/15 EP.,Highway Maintenance,Public Works Department,Highway Maintenance,Highway Maintenance,PWDx_Street Light_General Lighting Request,PWDx,,https://cityworker.cityofboston.gov:8443/attachments/report/55e83d74d05220b9f82c934d/closed_photo/Report.jpg,457 Dudley St  Roxbury  MA  02119,7.0,03,7.0,B2,Roxbury,13.0,Ward 8,805.0,R1,457 Dudley St,2119.0,Address,49751.0,42.3238,-71.0742,Employee Generated,"(42.3238, -71.0742)"
623266,101001548765,09/03/2015 08:31:00 AM,,09/30/2015 12:51:47 PM,ONTIME,Closed,Case Closed. Closed date : 2015-09-30 12:51:47.83 Case Resolved Base is cemented. 9/30/15. EP.,Highway Maintenance,Public Works Department,Highway Maintenance,Highway Maintenance,PWDx_Street Light_General Lighting Request,PWDx,,https://cityworker.cityofboston.gov:8443/attachments/report/55e83e4fd05220b9f82c944b/closed_photo/Report.jpg,1176 Massachusetts Ave  Dorchester  MA  02125,6.0,03,2.0,C6,Dorchester,5.0,Ward 7,708.0,C,1176 Massachusetts Ave,2125.0,Address,91945.0,42.3245,-71.0645,Employee Generated,"(42.3245, -71.0645)"
623273,101001548777,09/03/2015 08:35:00 AM,,09/28/2015 01:32:33 PM,ONTIME,Closed,Case Closed. Closed date : 2015-09-28 13:32:33.243 Case Resolved Base has been cemented. 9/28/15. EP.,Highway Maintenance,Public Works Department,Highway Maintenance,Highway Maintenance,PWDx_Street Light_General Lighting Request,PWDx,,https://cityworker.cityofboston.gov:8443/attachments/report/55e83f71d05220b9f82c953d/closed_photo/Report.jpg,655 Dudley St  Dorchester  MA  02125,7.0,03,7.0,B2,Roxbury,13.0,Ward 13,1302.0,E,655 Dudley St,2125.0,Address,49821.0,42.3189,-71.07,Employee Generated,"(42.3189, -71.07)"
623278,101001548782,09/03/2015 08:39:00 AM,,09/28/2015 01:29:28 PM,ONTIME,Closed,Case Closed. Closed date : 2015-09-28 13:29:28.347 Case Resolved Base has been cemented. 9/28/15. EP,Highway Maintenance,Public Works Department,Highway Maintenance,Highway Maintenance,PWDx_Street Light_General Lighting Request,PWDx,,https://cityworker.cityofboston.gov:8443/attachments/report/55e8401fd05220b9f82c95a8/closed_photo/Report.jpg,644 Dudley St  Dorchester  MA  02125,7.0,03,7.0,B2,Roxbury,13.0,Ward 8,805.0,,644 Dudley St,2125.0,Address,155207.0,42.3194,-71.0703,Employee Generated,"(42.3194, -71.0703)"
623493,101001549087,09/03/2015 10:53:00 AM,,,ONTIME,Open,,Sidewalk Repair/ Make Safe,Public Works Department,Highway Maintenance,Highway Maintenance,PWDx_Sidewalk Repair,PWDx,,,32 N Crescent Cirt  Brighton  MA  02135,11.0,04,9.0,D14,Allston / Brighton,15.0,Ward 22,2210.0,R1,32 N Crescent Cirt,2135.0,Address,44254.0,42.3491,-71.1667,Constituent Call,"(42.3491, -71.1667)"
623801,101001549482,09/03/2015 02:50:00 PM,,10/08/2015 10:18:57 AM,ONTIME,Closed,Case Closed. Closed date : 2015-10-08 10:18:57.86 Case Resolved Base has been cemented. EP. 10/8/15.,Highway Maintenance,Public Works Department,Highway Maintenance,Highway Maintenance,PWDx_Street Light_General Lighting Request,PWDx,,https://cityworker.cityofboston.gov:8443/attachments/report/55e8970ed05220b9f82cbec6/closed_photo/Report.jpg,5 Monmouth St  East Boston  MA  02128,1.0,09,1.0,A7,East Boston,1.0,Ward 1,107.0,R3,5 Monmouth St,2128.0,Address,96403.0,42.3794,-71.0389,Employee Generated,"(42.3794, -71.0389)"
623804,101001549486,09/03/2015 02:55:00 PM,,09/24/2015 12:04:19 PM,ONTIME,Closed,Case Closed. Closed date : 2015-09-24 12:04:19.07 Case Resolved Base has been cemented. EP 9/24/15,Highway Maintenance,Public Works Department,Highway Maintenance,Highway Maintenance,PWDx_Street Light_General Lighting Request,PWDx,,https://cityworker.cityofboston.gov:8443/attachments/report/55e89817d05220b9f82cbf2c/closed_photo/Report.jpg,INTERSECTION of Marginal St & Orleans St  East Boston  MA,1.0,09,1.0,A7,East Boston,1.0,Ward 1,103.0,,INTERSECTION Marginal St & Orleans St,,Intersection,7081.0,42.3667,-71.0391,Employee Generated,"(42.3667, -71.0391)"
623810,101001549493,09/03/2015 02:58:00 PM,,09/24/2015 11:53:08 AM,ONTIME,Closed,Case Closed. Closed date : 2015-09-24 11:53:08.733 Case Resolved Base patched with cement work. EP ~ 9/24/15,Highway Maintenance,Public Works Department,Highway Maintenance,Highway Maintenance,PWDx_Street Light_General Lighting Request,PWDx,,https://cityworker.cityofboston.gov:8443/attachments/report/55e898cbd05220b9f82cbf7f/closed_photo/Report.jpg,195 Putnam St  East Boston  MA  02128,1.0,09,1.0,A7,East Boston,1.0,Ward 1,105.0,R2,195 Putnam St,2128.0,Address,113651.0,42.3767,-71.0303,Employee Generated,"(42.3767, -71.0303)"
624466,101001570463,09/04/2015 02:54:00 PM,,09/25/2015 12:11:07 PM,ONTIME,Closed,Case Closed. Closed date : 2015-09-25 12:11:07.37 Case Resolved Base cemented 9/25/15 EP,Highway Maintenance,Public Works Department,Highway Maintenance,Highway Maintenance,PWDx_Street Light_General Lighting Request,PWDx,,https://cityworker.cityofboston.gov:8443/attachments/report/55e9e9e2d05253c8302f3447/closed_photo/Report.jpg,0 Stanwood St  Dorchester  MA  02121,7.0,03,4.0,B2,Roxbury,13.0,Ward 14,1401.0,E,0 Stanwood St,2121.0,Address,130248.0,42.3072,-71.0773,Employee Generated,"(42.3072, -71.0773)"
624478,101001570472,09/04/2015 03:03:00 PM,,09/08/2015 01:19:23 PM,ONTIME,Closed,Case Closed. Closed date : 2015-09-08 13:19:23.75 Case Resolved location under construction  Will revisit.  base is up to grade,Highway Maintenance,Public Works Department,Highway Maintenance,Highway Maintenance,PWDx_District 1C: Downtown,PWDx,,https://cityworker.cityofboston.gov:8443/attachments/report/55e9ec27d05253c8302f34d8/closed_photo/Report.jpg,0 Berkeley St  Boston  MA  02116,4.0,1C,2.0,D4,South End,6.0,Ward 5,501.0,E,0 Berkeley St,2116.0,Address,15000.0,42.3475,-71.0722,Employee Generated,"(42.3475, -71.0722)"
624481,101001570477,09/04/2015 03:10:00 PM,,09/10/2015 01:26:55 PM,ONTIME,Closed,Case Closed. Closed date : 2015-09-10 13:26:55.173 Case Resolved lightpole patched,Highway Maintenance,Public Works Department,Highway Maintenance,Highway Maintenance,PWDx_District 05: South Boston,PWDx,,https://cityworker.cityofboston.gov:8443/attachments/report/55e9ed7dd05253c8302f350f/closed_photo/Report.jpg,27 Damrell St  South Boston  MA  02127,6.0,05,2.0,C6,South Boston / South Boston Waterfront,5.0,07,705.0,C,27 Damrell St,2127.0,Address,45845.0,42.3329,-71.0558,Employee Generated,"(42.3329, -71.0558)"
625562,101001571984,09/08/2015 09:24:00 AM,,09/18/2015 11:51:09 AM,ONTIME,Closed,Case Closed. Closed date : 2015-09-18 11:51:09.4 Case Resolved Base has been cemented and looks good.  EP. 9-18-15,Highway Maintenance,Public Works Department,Highway Maintenance,Highway Maintenance,PWDx_Street Light_General Lighting Request,PWDx,,,0 Bowdoin St  Dorchester  MA  02121,7.0,03,4.0,C11,Dorchester,8.0,Ward 14,1404.0,RL,0 Bowdoin St,2121.0,Address,17631.0,42.3027,-71.0719,Employee Generated,"(42.3027, -71.0719)"
630358,101001578850,09/15/2015 10:26:00 AM,,09/18/2015 11:55:32 AM,ONTIME,Closed,Case Closed. Closed date : 2015-09-18 11:55:32.52 Case Resolved,Highway Maintenance,Public Works Department,Highway Maintenance,Highway Maintenance,PWDx_District 1B: North End,PWDx,,https://cityworker.cityofboston.gov:8443/attachments/report/55f82b14d05253c83031124e/closed_photo/Report.jpg,INTERSECTION of Branch St & Charles St  Boston  MA,3.0,1B,8.0,A1,Beacon Hill,14.0,Ward 5,503.0,,INTERSECTION Branch St & Charles St,,Intersection,1873.0,42.3567,-71.0697,Constituent Call,"(42.3567, -71.0697)"
630468,101001578998,09/15/2015 11:41:00 AM,,12/16/2015 06:35:12 AM,ONTIME,Closed,Case Closed. Closed date : 2015-12-16 06:35:12.457 Duplicate of Existing Case,Highway Maintenance,Public Works Department,Highway Maintenance,Highway Maintenance,PWDx_Highway Construction,PWDx,,,761-765 Dudley St  Dorchester  MA  02125,7.0,03,7.0,B2,Dorchester,13.0,Ward 13,1305.0,E,761-765 Dudley St,2125.0,Address,49842.0,42.3173,-71.0662,Constituent Call,"(42.3173, -71.0662)"
630642,101001579257,09/15/2015 02:36:00 PM,,09/24/2015 12:49:22 PM,ONTIME,Closed,Case Closed. Closed date : 2015-09-24 12:49:22.76 Case Resolved Post cemented around base. EP 9/24/15,Highway Maintenance,Public Works Department,Highway Maintenance,Highway Maintenance,PWDx_Street Light_General Lighting Request,PWDx,,https://cityworker.cityofboston.gov:8443/attachments/report/55f8663bd05253c830312486/closed_photo/Report.jpg,55 Court St  Boston  MA  02108,3.0,1B,1.0,A1,Downtown / Financial District,3.0,Ward 3,306.0,C,55 Court St,2108.0,Address,156226.0,42.3592,-71.0589,Employee Generated,"(42.3592, -71.0589)"
630648,101001579262,09/15/2015 02:40:00 PM,,09/16/2015 07:50:26 PM,ONTIME,Closed,Case Closed. Closed date : 2015-09-16 19:50:26.453 Case Noted Upon completion of the work at the streetlight  the area will be restored to its original condition. Thank you for the report. ,Highway Maintenance,Public Works Department,Highway Maintenance,Highway Maintenance,INFO01_GenericeFormforOtherServiceRequestTypes,INFO,,,11 Church St  Boston  MA  02116,4.0,1C,2.0,A1,Back Bay,6.0,Ward 5,501.0,R4,11 Church St,2116.0,Address,32625.0,42.3485,-71.0677,Employee Generated,"(42.3485, -71.0677)"
632051,101001581323,09/17/2015 11:32:00 AM,,09/18/2015 02:19:01 PM,ONTIME,Closed,Case Closed. Closed date : 2015-09-18 14:19:01.17 Case Resolved,Highway Maintenance,Public Works Department,Highway Maintenance,Highway Maintenance,PWDx_District 1C: Downtown,PWDx,,https://cityworker.cityofboston.gov:8443/attachments/report/55fadd4dd052ce85e3421d3b/closed_photo/Report.jpg,INTERSECTION of Massachusetts Ave & Saint Germain St  Boston  MA,4.0,1C,8.0,D4,Back Bay,14.0,Ward 4,406.0,,INTERSECTION Massachusetts Ave & Saint Germain St,,Intersection,7138.0,42.3459,-71.0871,Constituent Call,"(42.3459, -71.0871)"
632116,101001581411,09/17/2015 12:33:00 PM,,09/18/2015 11:13:10 AM,ONTIME,Closed,Case Closed. Closed date : 2015-09-18 11:13:10.997 Case Resolved there was only one hole found on sidewalk in front of 255 State st the whole was made safe,Highway Maintenance,Public Works Department,Highway Maintenance,Highway Maintenance,PWDx_District 1C: Downtown,PWDx,,https://cityworker.cityofboston.gov:8443/attachments/report/55faeba2d052ce85e3422219/closed_photo/Report.jpg,227-239 Atlantic Ave  Boston  MA  02110,3.0,1C,1.0,A1,Downtown / Financial District,3.0,Ward 3,306.0,C,227-239 Atlantic Ave,2110.0,Address,161704.0,42.3594,-71.0513,Employee Generated,"(42.3594, -71.0513)"
632211,101001581554,09/17/2015 02:50:00 PM,,,ONTIME,Open,,Highway Maintenance,Public Works Department,Highway Maintenance,Highway Maintenance,INFO01_GenericeFormforOtherServiceRequestTypes,INFO,,,30 Brimmer St  Boston  MA  02108,3.0,1B,8.0,A1,Back Bay,14.0,Ward 5,505.0,E,30 Brimmer St,2108.0,Address,20276.0,42.3577,-71.0716,Constituent Call,"(42.3577, -71.0716)"
632217,101001581566,09/17/2015 02:59:00 PM,,11/19/2015 11:47:06 AM,ONTIME,Closed,Case Closed. Closed date : 2015-11-19 11:47:06.6 Case Resolved Base of pole has been bricked. EP. 11/19/15.,Highway Maintenance//Printed ep,Public Works Department,Highway Maintenance,Highway Maintenance,PWDx_Street Light_General Lighting Request,PWDx,,https://cityworker.cityofboston.gov:8443/attachments/report/55fb0e1dd052ce85e3422d06/closed_photo/Report.jpg,84 Atlantic Ave  Boston  MA  02110,3.0,1B,1.0,A1,Downtown / Financial District,3.0,03,301.0,CM,84 Atlantic Ave,2110.0,Address,6357.0,42.3623,-71.0506,Employee Generated,"(42.3623, -71.0506)"
632226,101001581585,09/17/2015 03:08:00 PM,,10/07/2015 12:23:17 PM,ONTIME,Closed,Case Closed. Closed date : 2015-10-07 12:23:17.033 Case Resolved Base has been bricked. EP. 10/7/15.,Highway Maintenance,Public Works Department,Highway Maintenance,Highway Maintenance,PWDx_Street Light_General Lighting Request,PWDx,,https://cityworker.cityofboston.gov:8443/attachments/report/55fb104ed052ce85e3422e90/closed_photo/Report.jpg,220-230 Commercial St  Boston  MA  02109,3.0,1B,1.0,A1,Downtown / Financial District,3.0,Ward 3,301.0,CM,220-230 Commercial St,2109.0,Address,163683.0,42.3636,-71.0516,Employee Generated,"(42.3636, -71.0516)"
632235,101001581607,09/17/2015 03:18:00 PM,,10/07/2015 12:40:36 PM,ONTIME,Closed,Case Closed. Closed date : 2015-10-07 12:40:36.23 Case Resolved Base has been cemented. EP. 10/7/15.,Highway Maintenance,Public Works Department,Highway Maintenance,Highway Maintenance,PWDx_Street Light_General Lighting Request,PWDx,,https://cityworker.cityofboston.gov:8443/attachments/report/55fb1301d052ce85e34230ef/closed_photo/Report.jpg,0 Summer St  South Boston  MA  02127,6.0,05,2.0,C6,South Boston / South Boston Waterfront,5.0,Ward 6,605.0,CL,0 Summer St,2127.0,Address,131973.0,42.3376,-71.0357,Employee Generated,"(42.3376, -71.0357)"
632555,101001582076,09/18/2015 09:22:00 AM,,09/18/2015 02:12:52 PM,ONTIME,Closed,Case Closed. Closed date : 2015-09-18 14:12:52.623 Case Resolved,Highway Maintenance,Public Works Department,Highway Maintenance,Highway Maintenance,PWDx_District 1C: Downtown,PWDx,,https://cityworker.cityofboston.gov:8443/attachments/report/55fc1067d052ce85e3424dbc/closed_photo/Report.jpg,10-12 Cumberland St  Boston  MA  02115,4.0,1C,7.0,D4,Back Bay,14.0,Ward 4,405.0,CM,10-12 Cumberland St,2115.0,Address,44655.0,42.344,-71.0822,Constituent Call,"(42.344, -71.0822)"
632869,101001582525,09/18/2015 02:29:00 PM,,09/23/2015 08:33:15 AM,ONTIME,Closed,Case Closed. Closed date : 2015-09-23 08:33:15.39 Case Resolved Location has been made safe. This sidewalk will be referred for permanent repair. See case #101001585785 for status of the permanent repair.,Side Walk Repair,Public Works Department,Highway Maintenance,Highway Maintenance,PWDx_District 1C: Downtown,PWDx,,,67-69 Saint Germain St  Boston  MA  02115,4.0,1C,8.0,D4,Back Bay,14.0,Ward 4,406.0,RC,67-69 Saint Germain St,2115.0,Address,169943.0,42.3454,-71.0843,Constituent Call,"(42.3454, -71.0843)"
633654,101001583622,09/21/2015 07:50:00 AM,,09/21/2015 12:57:10 PM,ONTIME,Closed,Case Closed. Closed date : 2015-09-21 12:57:10.55 Case Resolved light poles cemented,Highway Maintenance,Public Works Department,Highway Maintenance,Highway Maintenance,PWDx_District 02: Jamaica Plain,PWDx,,https://cityworker.cityofboston.gov:8443/attachments/report/55fff02bd052ce85e3429850/closed_photo/Report.jpg,500 Amory St  Jamaica Plain  MA  02130,9.0,02,6.0,E13,Jamaica Plain,11.0,11,1107.0,CL,500 Amory St,2130.0,Address,340457.0,42.3095,-71.1075,Employee Generated,"(42.3095, -71.1075)"
633663,101001583634,09/21/2015 07:57:00 AM,,09/30/2015 11:04:53 AM,ONTIME,Closed,Case Closed. Closed date : 2015-09-30 11:04:53.287 Case Resolved Base is cemented. 9/30/15. EP,Highway Maintenance,Public Works Department,Highway Maintenance,Highway Maintenance,PWDx_Street Light_General Lighting Request,PWDx,,https://cityworker.cityofboston.gov:8443/attachments/report/55fff1dad052ce85e34298c2/closed_photo/Report.jpg,431 Dudley St  Roxbury  MA  02119,7.0,03,7.0,B2,Roxbury,13.0,08,805.0,R1,431 Dudley St,2119.0,Address,49737.0,42.3246,-71.0749,Employee Generated,"(42.3246, -71.0749)"
633690,101001583683,09/21/2015 08:17:00 AM,,12/01/2015 09:51:22 AM,ONTIME,Closed,Case Closed. Closed date : 2015-12-01 09:51:22.203 Case Resolved This base has been cemented. EP. 12/1/15.,Streetlight Bases.///Printed ep,Public Works Department,Highway Maintenance,Highway Maintenance,PWDx_Street Light_General Lighting Request,PWDx,,https://cityworker.cityofboston.gov:8443/attachments/report/55fff677d052ce85e3429a79/closed_photo/Report.jpg,372 Park St  Dorchester  MA  02124,8.0,07,4.0,C11,Dorchester,9.0,Ward 17,1703.0,R2,372 Park St,2124.0,Address,107358.0,42.2961,-71.0693,Employee Generated,"(42.2961, -71.0693)"
634570,101001584933,09/22/2015 09:46:00 AM,,09/22/2015 10:45:40 AM,ONTIME,Closed,Case Closed. Closed date : 2015-09-22 10:45:40.463 Case Resolved complete.,Highway Maintenance,Public Works Department,Highway Maintenance,Highway Maintenance,PWDx_District 05: South Boston,PWDx,,https://cityworker.cityofboston.gov:8443/attachments/report/56015d73d052ce85e342e2eb/closed_photo/Report.jpg,INTERSECTION of Fargo St & Summer St  Boston  MA,6.0,05,2.0,C6,South Boston / South Boston Waterfront,5.0,Ward 6,604.0,,INTERSECTION Fargo St & Summer St,,Intersection,4802.0,42.3445,-71.0396,Employee Generated,"(42.3445, -71.0396)"
634573,101001584927,09/22/2015 09:49:00 AM,,12/17/2015 05:47:13 PM,ONTIME,Closed,Case Closed. Closed date : 2015-12-17 17:47:13.903 Case Noted Duplicate of Case #101000136270.    Thank you for bringing this matter to our attention.    Staff from the Boston Public Works Department has reviewed the location and we are of the opinion that the location is a candidate for reconstruction.     Your request and location has been added to the master list of future reconstruction projects. Currently  the wait time for a reconstruction project of this nature can be up to five (5) or more years.    If you feel that there is an immediate safety concern at this location  please contact 617-635-4500 so that maintenance can be performed to make the location safer until the reconstruction can be started.    In the meantime  you may contact the Public Works Department Engineering Division at 617-635-4968 for information on your request.  Again  we appreciate and thank you for your interest in public safety and the welfare of your community.,Highway Maintenance,Public Works Department,Highway Maintenance,Highway Maintenance,PWDx_Engineering_Design,PWDx,,,185 Fulton St  Boston  MA  02109,3.0,1B,1.0,A1,Downtown / Financial District,3.0,Ward 3,301.0,E,185 Fulton St,2109.0,Address,174298.0,42.3632,-71.052,Constituent Call,"(42.3632, -71.052)"
634599,101001584982,09/22/2015 10:01:00 AM,,10/01/2015 11:30:51 AM,ONTIME,Closed,Case Closed. Closed date : 2015-10-01 11:30:51.78 Case Resolved Base is cemented. 10/1/15. EP.,Highway Maintenance,Public Works Department,Highway Maintenance,Highway Maintenance,PWDx_Street Light_General Lighting Request,PWDx,,https://cityworker.cityofboston.gov:8443/attachments/report/5601609dd052ce85e342e4c5/closed_photo/Report.jpg,34 Medfield St  Boston  MA  02215,,10A,8.0,D4,Fenway / Kenmore / Audubon Circle / Longwood,14.0,Ward 21,2101.0,A,34 Medfield St,2215.0,Address,93693.0,42.3451,-71.1061,Employee Generated,"(42.3451, -71.1061)"
634645,101001585019,09/22/2015 10:21:00 AM,,09/30/2015 01:53:28 PM,ONTIME,Closed,Case Closed. Closed date : 2015-09-30 13:53:28.69 Case Resolved Base is cemented. 9/30/15. EP.,Highway Maintenance,Public Works Department,Highway Maintenance,Highway Maintenance,PWDx_Street Light_General Lighting Request,PWDx,,https://cityworker.cityofboston.gov:8443/attachments/report/560164c4d052ce85e342e6d8/closed_photo/Report.jpg,115-117 Freeport St  Dorchester  MA  02122,7.0,03,3.0,C11,Dorchester,8.0,Ward 15,1506.0,C,115-117 Freeport St,2122.0,Address,60861.0,42.3048,-71.0568,Employee Generated,"(42.3048, -71.0568)"
634667,101001585056,09/22/2015 10:37:00 AM,,12/08/2015 09:09:36 AM,ONTIME,Closed,Case Closed. Closed date : 2015-12-08 09:09:36.773 Case Resolved,Highway Maintenance,Public Works Department,Highway Maintenance,Highway Maintenance,PWDx_Highway Construction,PWDx,,,25-29 Charles St  Boston  MA  02114,3.0,1B,8.0,A1,Beacon Hill,14.0,Ward 5,503.0,C,25-29 Charles St,2114.0,Address,29144.0,42.3569,-71.0696,Constituent Call,"(42.3569, -71.0696)"
634902,101001585407,09/22/2015 02:57:00 PM,,09/28/2015 12:04:53 PM,ONTIME,Closed,Case Closed. Closed date : 2015-09-28 12:04:53.27 Case Resolved Base is cemented. 9/28/15 EP.,Highway Maintenance,Public Works Department,Highway Maintenance,Highway Maintenance,PWDx_Street Light_General Lighting Request,PWDx,,https://cityworker.cityofboston.gov:8443/attachments/report/5601a591d05268739158c2fb/closed_photo/Report.jpg,INTERSECTION of Newhall St & Pierce Ave  Dorchester  MA,8.0,07,3.0,C11,Dorchester,7.0,Ward 16,1609.0,,INTERSECTION Newhall St & Pierce Ave,,Intersection,7562.0,42.2878,-71.0507,Employee Generated,"(42.2878, -71.0507)"
634905,101001585417,09/22/2015 03:03:00 PM,,10/08/2015 09:49:05 AM,ONTIME,Closed,Case Closed. Closed date : 2015-10-08 09:49:05.96 Case Resolved Base has been cemented. EP. 10/8/15.,Highway Maintenance,Public Works Department,Highway Maintenance,Highway Maintenance,PWDx_Street Light_General Lighting Request,PWDx,,https://cityworker.cityofboston.gov:8443/attachments/report/5601a70dd05268739158c3c8/closed_photo/Report.jpg,8 Washburn St  Dorchester  MA  02125,6.0,03,2.0,C6,Dorchester,5.0,Ward 7,708.0,RL,8 Washburn St,2125.0,Address,143416.0,42.3253,-71.0573,Employee Generated,"(42.3253, -71.0573)"
635140,101001585754,09/23/2015 08:11:00 AM,,09/29/2015 12:36:56 PM,ONTIME,Closed,Case Closed. Closed date : 2015-09-29 12:36:56.907 Case Resolved Base is cemented. 9/29/15. EP,Highway Maintenance,Public Works Department,Highway Maintenance,Highway Maintenance,PWDx_Street Light_General Lighting Request,PWDx,,https://cityworker.cityofboston.gov:8443/attachments/report/56029879d052bbe9c2e59bb0/closed_photo/Report.jpg,1073 Tremont St  Mission Hill  MA  02120,9.0,10B,7.0,D4,Roxbury,13.0,Ward 9,904.0,E,1073 Tremont St,2120.0,Address,170494.0,42.3362,-71.0868,Employee Generated,"(42.3362, -71.0868)"
635241,101001585910,09/23/2015 09:33:00 AM,,09/24/2015 01:31:55 PM,ONTIME,Closed,Case Closed. Closed date : 2015-09-24 13:31:55.1 Case Resolved Constituent reports she doesn't need sidewalk repair anymore and that her and her neighbors will fix the issue by her property themselves,Highway Maintenance,Public Works Department,Highway Maintenance,Highway Maintenance,PWDx_District 1C: Downtown,PWDx,,,12 Cumberland St  Boston  MA  02115,4.0,1C,7.0,D4,Back Bay,14.0,Ward 4,405.0,CD,12 Cumberland St,2115.0,Address,44657.0,42.344,-71.0822,Constituent Call,"(42.344, -71.0822)"
635548,101001586382,09/23/2015 02:49:00 PM,,09/29/2015 12:05:44 PM,ONTIME,Closed,Case Closed. Closed date : 2015-09-29 12:05:44.45 Case Resolved Base is cemented. 9/29/15. EP,Highway Maintenance,Public Works Department,Highway Maintenance,Highway Maintenance,PWDx_Street Light_General Lighting Request,PWDx,,https://cityworker.cityofboston.gov:8443/attachments/report/5602f515d05241a2857167e6/closed_photo/Report.jpg,24 Alpine St  Roxbury  MA  02119,7.0,10B,7.0,B2,Roxbury,13.0,Ward 12,1201.0,R3,24 Alpine St,2119.0,Address,177271.0,42.3256,-71.0866,Employee Generated,"(42.3256, -71.0866)"
635555,101001586388,09/23/2015 02:55:00 PM,,10/07/2015 11:04:30 AM,ONTIME,Closed,Case Closed. Closed date : 2015-10-07 11:04:30.557 Case Resolved Base is cemented. EP. 10/7/15.,Highway Maintenance,Public Works Department,Highway Maintenance,Highway Maintenance,PWDx_Street Light_General Lighting Request,PWDx,,https://cityworker.cityofboston.gov:8443/attachments/report/5602f6cbd05241a285716877/closed_photo/Report.jpg,INTERSECTION of Chamber St & Constitution Rd  Charlestown  MA,3.0,1A,1.0,A15,Charlestown,2.0,Ward 2,201.0,,INTERSECTION Chamber St & Constitution Rd,,Intersection,2743.0,42.3717,-71.0602,Employee Generated,"(42.3717, -71.0602)"
635559,101001586395,09/23/2015 03:02:00 PM,,10/21/2015 11:42:19 AM,ONTIME,Closed,Case Closed. Closed date : 2015-10-21 11:42:19.893 Case Resolved Base has been cemented. All set. EP. 10/21/15.,Highway Maintenance,Public Works Department,Highway Maintenance,Highway Maintenance,PWDx_Street Light_General Lighting Request,PWDx,,https://cityworker.cityofboston.gov:8443/attachments/report/5602f80cd05241a2857168d8/closed_photo/Report.jpg,25 Brinsley St  Dorchester  MA  02121,7.0,03,4.0,C11,Roxbury,8.0,Ward 14,1404.0,R3,25 Brinsley St,2121.0,Address,20431.0,42.3055,-71.0784,Employee Generated,"(42.3055, -71.0784)"
636280,101001597442,09/24/2015 04:49:00 PM,,09/28/2015 02:21:58 PM,ONTIME,Closed,Case Closed. Closed date : 2015-09-28 14:21:58.917 Case Resolved Bricks replaced.    If this case was closed in error  please contact Thomas.hanlon@boston.gov,Highway Maintenance,Public Works Department,Highway Maintenance,Highway Maintenance,PWDx_Highway Construction,PWDx,,,20 Clinton St  Boston  MA  02109,3.0,1B,1.0,A1,Downtown / Financial District,3.0,Ward 3,301.0,C,20 Clinton St,2109.0,Address,163505.0,42.361,-71.0549,Constituent Call,"(42.361, -71.0549)"
636727,101001598087,09/25/2015 12:35:00 PM,,11/02/2015 02:21:54 PM,ONTIME,Closed,Case Closed. Closed date : 2015-11-02 14:21:54.15 Case Resolved Bricks replaced,Highway Maintenance,Public Works Department,Highway Maintenance,Highway Maintenance,PWDx_Highway Construction,PWDx,,,69 Chestnut St  Boston  MA  02108,3.0,1B,8.0,A1,Beacon Hill,14.0,Ward 5,505.0,R1,69 Chestnut St,2108.0,Address,31461.0,42.357,-71.0707,Constituent Call,"(42.357, -71.0707)"
637531,101001599137,09/28/2015 07:38:00 AM,,10/06/2015 12:53:34 PM,ONTIME,Closed,Case Closed. Closed date : 2015-10-06 12:53:34.98 Case Resolved The base has been cemented. EP. 10/6/15.,Highway Maintenance,Public Works Department,Highway Maintenance,Highway Maintenance,PWDx_Street Light_General Lighting Request,PWDx,,,INTERSECTION of Blue Hill Ave & Southwood St  Roxbury  MA,9.0,03,7.0,B2,Roxbury,13.0,Ward 13,1301.0,,INTERSECTION Blue Hill Ave & Southwood St,,Intersection,1592.0,42.3177,-71.0779,Employee Generated,"(42.3177, -71.0779)"
637537,101001599141,09/28/2015 07:47:00 AM,,09/29/2015 09:33:17 AM,ONTIME,Closed,Case Closed. Closed date : 2015-09-29 09:33:17.95 Case Resolved Light pole base was finished in cement.,Highway Maintenance,Public Works Department,Highway Maintenance,Highway Maintenance,PWDx_Highway Construction,PWDx,,https://cityworker.cityofboston.gov:8443/attachments/report/56092937d052f50f59b7f087/closed_photo/Report.jpg,19-21 Glenway St  Dorchester  MA  02121,7.0,03,4.0,B3,Greater Mattapan,8.0,Ward 14,1406.0,R3,19-21 Glenway St,2121.0,Address,64736.0,42.3012,-71.0846,Employee Generated,"(42.3012, -71.0846)"
637540,101001599150,09/28/2015 07:55:00 AM,,09/29/2015 10:39:22 AM,ONTIME,Closed,Case Closed. Closed date : 2015-09-29 10:39:22.717 Case Resolved Light pole base was finished in cement.,Highway Maintenance,Public Works Department,Highway Maintenance,Highway Maintenance,PWDx_Highway Construction,PWDx,,https://cityworker.cityofboston.gov:8443/attachments/report/56092b88d052f50f59b7f12f/closed_photo/Report.jpg,111 Glenway St  Dorchester  MA  02121,7.0,03,4.0,B3,Greater Mattapan,8.0,Ward 14,1406.0,R3,111 Glenway St,2121.0,Address,64697.0,42.2996,-71.0819,Employee Generated,"(42.2996, -71.0819)"
637546,101001599156,09/28/2015 07:59:00 AM,,10/21/2015 11:53:38 AM,ONTIME,Closed,Case Closed. Closed date : 2015-10-21 11:53:38.68 Case Resolved Base has been cemented. All set. EP. 10/21/15.,Highway Maintenance,Public Works Department,Highway Maintenance,Highway Maintenance,PWDx_Street Light_Install New Lighting,PWDx,,https://cityworker.cityofboston.gov:8443/attachments/report/56092c59d052f50f59b7f17e/closed_photo/Report.jpg,137 Glenway St  Dorchester  MA  02121,7.0,03,4.0,B3,Greater Mattapan,8.0,Ward 14,1402.0,R2,137 Glenway St,2121.0,Address,64708.0,42.2986,-71.0815,Employee Generated,"(42.2986, -71.0815)"
637925,101001599754,09/28/2015 01:52:00 PM,,10/07/2015 06:50:48 AM,ONTIME,Closed,Case Closed. Closed date : 2015-10-07 06:50:48.367 Case Resolved Bricks replaced.    If this case was closed in error  please contact Thomas.hanlon@boston.gov,Highway Maintenance,Public Works Department,Highway Maintenance,Highway Maintenance,PWDx_Highway Construction,PWDx,,,145 Fulton St  Boston  MA  02109,3.0,1B,1.0,A1,Downtown / Financial District,3.0,Ward 3,301.0,R4,145 Fulton St,2109.0,Address,61418.0,42.3628,-71.0525,Constituent Call,"(42.3628, -71.0525)"
638290,101001600243,09/29/2015 07:53:00 AM,,10/06/2015 11:51:41 AM,ONTIME,Closed,Case Closed. Closed date : 2015-10-06 11:51:41.993 Case Resolved Base is cemented. EP. 10/6/15.,Highway Maintenance,Public Works Department,Highway Maintenance,Highway Maintenance,PWDx_Street Light_General Lighting Request,PWDx,,https://cityworker.cityofboston.gov:8443/attachments/report/560a7c79d052f50f59b83980/closed_photo/Report.jpg,0 Mapes St  Dorchester  MA  02122,7.0,07,3.0,C11,Dorchester,7.0,Ward 16,1602.0,E,0 Mapes St,2122.0,Address,89193.0,42.2984,-71.0546,Employee Generated,"(42.2984, -71.0546)"
638298,101001600254,09/29/2015 08:02:00 AM,,10/05/2015 07:45:22 AM,ONTIME,Closed,Case Closed. Closed date : 2015-10-05 07:45:22.21 Case Resolved,Highway Maintenance,Public Works Department,Highway Maintenance,Highway Maintenance,PWDx_Highway Construction,PWDx,,,0 Mapes St  Dorchester  MA  02122,7.0,07,3.0,C11,Dorchester,7.0,Ward 16,1602.0,E,0 Mapes St,2122.0,Address,89193.0,42.2984,-71.0546,Employee Generated,"(42.2984, -71.0546)"
638307,101001600271,09/29/2015 08:11:00 AM,,10/05/2015 07:49:32 AM,ONTIME,Closed,Case Closed. Closed date : 2015-10-05 07:49:32.97 Case Resolved Pole concreted.,Highway Maintenance,Public Works Department,Highway Maintenance,Highway Maintenance,PWDx_Street Light_General Lighting Request,PWDx,,,INTERSECTION of Ipswich St & Charlesgate  Boston  MA,4.0,10A,8.0,D4,Fenway / Kenmore / Audubon Circle / Longwood,14.0,Ward 5,510.0,,INTERSECTION Ipswich St & Charlesgate,,Intersection,6509.0,42.3475,-71.0923,Employee Generated,"(42.3475, -71.0923)"
638782,101001600962,09/29/2015 04:34:00 PM,,10/21/2015 08:59:08 AM,ONTIME,Closed,Case Closed. Closed date : 2015-10-21 08:59:08.09 Duplicate of Existing Case Duplicate of case 101001107313    If you have any further questions  or feel that this case was closed in error  please do not hesitate to contact me.    Michael Somers  Senior Civil Engineer  Construction Management Division  Boston Public Works  617-635-3831,Highway Maintenance,Public Works Department,Highway Maintenance,Highway Maintenance,PWDx_Highway Construction,PWDx,,,20-30 Clinton St  Boston  MA  02109,3.0,1B,1.0,A1,Downtown / Financial District,3.0,Ward 3,301.0,C,20-30 Clinton St,2109.0,Address,34045.0,42.3609,-71.055,Constituent Call,"(42.3609, -71.055)"
638791,101001600972,09/29/2015 04:44:00 PM,,10/05/2015 02:07:34 PM,ONTIME,Closed,Case Closed. Closed date : 2015-10-05 14:07:34.337 Case Resolved Bricks replaced.    If this case was closed in error  please contact Thomas.hanlon@boston.gov,Highway Maintenance,Public Works Department,Highway Maintenance,Highway Maintenance,PWDx_Highway Construction,PWDx,,,65-65 Chatham St  Boston  MA  02109,3.0,1B,1.0,A1,Downtown / Financial District,3.0,Ward 3,306.0,C,65-65 Chatham St,2109.0,Address,157025.0,42.3596,-71.0539,Constituent Call,"(42.3596, -71.0539)"
639455,101001601884,09/30/2015 02:26:00 PM,,10/05/2015 02:09:41 PM,ONTIME,Closed,Case Closed. Closed date : 2015-10-05 14:09:41.19 Case Resolved Bricks replaced.    If this case was closed in error  please contact Thomas.hanlon@boston.gov,Highway Maintenance,Public Works Department,Highway Maintenance,Highway Maintenance,PWDx_Highway Construction,PWDx,,,314 Shawmut Ave  Roxbury  MA  02118,4.0,1C,2.0,D4,South End,4.0,Ward 3,307.0,RC,314 Shawmut Ave,2118.0,Address,126189.0,42.3421,-71.0703,Constituent Call,"(42.3421, -71.0703)"
640304,101001603191,10/02/2015 07:55:00 AM,,10/08/2015 01:58:25 PM,ONTIME,Closed,Case Closed. Closed date : 2015-10-08 13:58:25.04 Case Resolved Bricks replaced  if this case was closed in error  please contact Thomas.hanlon@boston.gov,Highway Maintenance,Public Works Department,Highway Maintenance,Highway Maintenance,PWDx_Highway Construction,PWDx,,,0 Warren St  Charlestown  MA  02129,3.0,1A,1.0,A15,Charlestown,2.0,Ward 2,201.0,RL,0 Warren St,2129.0,Address,143131.0,42.3738,-71.0621,Employee Generated,"(42.3738, -71.0621)"
640309,101001603211,10/02/2015 08:05:00 AM,,10/07/2015 12:17:26 PM,ONTIME,Closed,Case Closed. Closed date : 2015-10-07 12:17:26.57 Case Resolved,Highway Maintenance,Public Works Department,Highway Maintenance,Highway Maintenance,PWDx_District 1A: Charlestown,PWDx,,https://cityworker.cityofboston.gov:8443/attachments/report/560e746bd052f50f59b8e210/closed_photo/Report.jpg,10 Dorrance St  Charlestown  MA  02129,3.0,1A,1.0,A15,Charlestown,2.0,Ward 2,207.0,I,10 Dorrance St,2129.0,Address,49171.0,42.3865,-71.0757,Employee Generated,"(42.3865, -71.0757)"
640705,101001603823,10/02/2015 04:53:00 PM,,12/21/2015 02:24:42 PM,ONTIME,Closed,Case Closed. Closed date : 2015-12-21 14:24:42.04 Case Resolved,Highway Maintenance,Public Works Department,Highway Maintenance,Highway Maintenance,PWDx_Highway Construction,PWDx,,,265-275 Dartmouth St  Boston  MA  02116,4.0,1C,8.0,D4,Back Bay,14.0,Ward 5,507.0,CD,265-275 Dartmouth St,2116.0,Address,46343.0,42.3507,-71.0773,Constituent Call,"(42.3507, -71.0773)"
641307,101001604629,10/05/2015 07:14:00 AM,,10/16/2015 12:06:02 PM,ONTIME,Closed,Case Closed. Closed date : 2015-10-16 12:06:02.76 Case Resolved Base has been cemented. EP. 10/16/15.,Highway Maintenance,Public Works Department,Highway Maintenance,Highway Maintenance,PWDx_Street Light_General Lighting Request,PWDx,,https://cityworker.cityofboston.gov:8443/attachments/report/56125c80d052f50f59b925b4/closed_photo/Report.jpg,110 Bolton St  South Boston  MA  02127,6.0,05,2.0,C6,South Boston / South Boston Waterfront,5.0,Ward 6,601.0,,110 Bolton St,2127.0,Address,172194.0,42.3407,-71.0508,Employee Generated,"(42.3407, -71.0508)"
641310,101001604632,10/05/2015 07:20:00 AM,,10/16/2015 12:53:25 PM,ONTIME,Closed,Case Closed. Closed date : 2015-10-16 12:53:25.953 Case Resolved The base has been cemented. EP. 10/16/15.,Highway Maintenance,Public Works Department,Highway Maintenance,Highway Maintenance,PWDx_Street Light_General Lighting Request,PWDx,,https://cityworker.cityofboston.gov:8443/attachments/report/56125e06d052f50f59b925e8/closed_photo/Report.jpg,636 E First St  South Boston  MA  02127,6.0,05,2.0,C6,South Boston / South Boston Waterfront,5.0,Ward 6,607.0,CL,636 E First St,2127.0,Address,58384.0,42.3385,-71.0344,Employee Generated,"(42.3385, -71.0344)"
641314,101001604638,10/05/2015 07:28:00 AM,,10/16/2015 01:09:30 PM,ONTIME,Closed,Case Closed. Closed date : 2015-10-16 13:09:30.567 Case Resolved The base has been cemented. EP. 10/16/15.,Highway Maintenance,Public Works Department,Highway Maintenance,Highway Maintenance,PWDx_Street Light_General Lighting Request,PWDx,,https://cityworker.cityofboston.gov:8443/attachments/report/56125fe1d052f50f59b9268d/closed_photo/Report.jpg,0 W Eighth St  South Boston  MA  02127,6.0,05,2.0,C6,South Boston / South Boston Waterfront,5.0,Ward 7,705.0,RL,0 W Eighth St,2127.0,Address,52441.0,42.3332,-71.0519,Employee Generated,"(42.3332, -71.0519)"
641550,101001605025,10/05/2015 11:51:00 AM,,10/08/2015 09:38:34 AM,ONTIME,Closed,Case Closed. Closed date : 2015-10-08 09:38:34.76 Case Resolved Bricks replaced.    If this case was closed in error  please contact Thomas.hanlon@boston.gov,Highway Maintenance,Public Works Department,Highway Maintenance,Highway Maintenance,PWDx_Highway Construction,PWDx,,,4 River St  Mattapan  MA  02126,8.0,07,3.0,B3,Mattapan,7.0,17,1714.0,,4 River St,2126.0,Address,355711.0,42.3594,-71.0587,Constituent Call,"(0, 0)"
641942,101001605598,10/06/2015 07:23:00 AM,,10/06/2015 11:50:44 AM,ONTIME,Closed,Case Closed. Closed date : 2015-10-06 11:50:44.393 Case Resolved picture at notes,Highway Maintenance,Public Works Department,Highway Maintenance,Highway Maintenance,PWDx_District 1B: North End,PWDx,,,105 Salem St  Boston  MA  02113,3.0,1B,1.0,A1,Downtown / Financial District,3.0,03,303.0,RC,105 Salem St,2113.0,Address,155752.0,42.364,-71.0555,Employee Generated,"(42.364, -71.0555)"
641948,101001605604,10/06/2015 07:34:00 AM,10/06/2015 08:07:30 AM,10/06/2015 11:59:17 AM,OVERDUE,Closed,Case Closed. Closed date : 2015-10-06 11:59:17.17 Case Resolved,Highway Maintenance,Public Works Department,Highway Maintenance,Highway Maintenance,PWDx_District 1B: North End,PWDx,,https://cityworker.cityofboston.gov:8443/attachments/report/5613b29dd052db688a8791d6/closed_photo/Report.jpg,120 Fulton St  Boston  MA  02109,3.0,1B,1.0,A1,Downtown / Financial District,3.0,Ward 3,301.0,CM,120 Fulton St,2109.0,Address,61326.0,42.3631,-71.0526,Employee Generated,"(42.3631, -71.0526)"
641986,101001605663,10/06/2015 08:17:00 AM,,10/06/2015 12:01:39 PM,ONTIME,Closed,Case Closed. Closed date : 2015-10-06 12:01:39.13 Case Resolved,Highway Maintenance,Public Works Department,Highway Maintenance,Highway Maintenance,PWDx_District 1B: North End,PWDx,,https://cityworker.cityofboston.gov:8443/attachments/report/5613bd00d052db688a8795b2/closed_photo/Report.jpg,INTERSECTION of Charter St & Snow Hill St  Boston  MA,3.0,1B,1.0,A1,Downtown / Financial District,3.0,Ward 3,302.0,,INTERSECTION Charter St & Snow Hill St,,Intersection,2827.0,42.3681,-71.0564,Employee Generated,"(42.3681, -71.0564)"
643020,101001607270,10/07/2015 01:39:00 PM,,10/13/2015 09:41:06 AM,ONTIME,Closed,Case Closed. Closed date : 2015-10-13 09:41:06.787 Case Resolved Base has been cemented. EP 10/13/15.,Highway Maintenance,Public Works Department,Highway Maintenance,Highway Maintenance,PWDx_Street Light_General Lighting Request,PWDx,,https://cityworker.cityofboston.gov:8443/attachments/report/56155ff4d052400d5a7fe4cd/closed_photo/Report.jpg,946 Washington St  Dorchester  MA  02124,8.0,07,3.0,C11,Dorchester,7.0,Ward 17,1704.0,R2,946 Washington St,2124.0,Address,146237.0,42.2794,-71.0696,Employee Generated,"(42.2794, -71.0696)"
643305,101001607686,10/08/2015 07:24:00 AM,12/08/2015 07:39:51 PM,12/08/2015 07:42:54 PM,OVERDUE,Closed,Case Closed. Closed date : 2015-12-08 19:42:54.17 Case Resolved Loose bricks were reset for second time.,Highway Maintenance,Public Works Department,Highway Maintenance,Highway Maintenance,PWDx_Highway Construction,PWDx,,,INTERSECTION of Tremont St & Winter St  Boston  MA,3.0,1C,8.0,A1,Downtown / Financial District,14.0,Ward 5,503.0,,INTERSECTION Tremont St & Winter St,,Intersection,8555.0,42.3563,-71.0623,Constituent Call,"(42.3563, -71.0623)"
644056,101001608894,10/09/2015 11:09:00 AM,,10/10/2015 07:02:51 AM,ONTIME,Closed,Case Closed. Closed date : 2015-10-10 07:02:51.447 Case Noted Sidewalk has specialty bricks.  This sidewalk should be under an LMI.  Spoke with the Building Engineer and stated that this was their responsibility.    If you have any further questions  or feel that this case was closed  or reallocated in error  please do not hesitate to contact me.    Michael Somers  Senior Civil Engineer  Construction Management Division  Boston Public Works  617-635-3831	  Michael.Somers@Boston.gov,Highway Maintenance,Public Works Department,Highway Maintenance,Highway Maintenance,PWDx_Highway Construction,PWDx,,,255 State St  Boston  MA  02110,3.0,1C,1.0,A1,Downtown / Financial District,3.0,Ward 3,306.0,C,255 State St,2110.0,Address,158086.0,42.3594,-71.0511,Constituent Call,"(42.3594, -71.0511)"
644107,101001608990,10/09/2015 12:16:00 PM,,,ONTIME,Open,,Highway Maintenance,Public Works Department,Highway Maintenance,Highway Maintenance,INFO01_GenericeFormforOtherServiceRequestTypes,INFO,,,260-270 Northern Ave  Boston  MA  02210,6.0,05,2.0,C6,Boston,5.0,6,601.0,,260-270 Northern Ave,2210.0,Address,342825.0,42.3594,-71.0587,Constituent Call,"(0, 0)"
645284,101001610711,10/13/2015 11:18:00 AM,,,ONTIME,Open,,Highway Maintenance,Public Works Department,Highway Maintenance,Highway Maintenance,PWDx_Sidewalk Repair,PWDx,,,1135 Morton St  Mattapan  MA  02126,8.0,07,3.0,B3,Dorchester,7.0,Ward 17,1714.0,E,1135 Morton St,2126.0,Address,97656.0,42.2758,-71.0749,Constituent Call,"(42.2758, -71.0749)"
645442,101001610967,10/13/2015 02:16:00 PM,,10/17/2015 12:34:39 PM,ONTIME,Closed,Case Closed. Closed date : 2015-10-17 12:34:39.413 Case Noted This location has been inspected and no damage has been noted.    If you have any further questions  or feel that this case was closed  or reallocated in error  please do not hesitate to contact me.    Michael Somers  Senior Civil Engineer  Construction Management Division  Boston Public Works  617-635-3831	  Michael.Somers@Boston.gov,Highway Maintenance,Public Works Department,Highway Maintenance,Highway Maintenance,PWDx_Sidewalk Repair,PWDx,,,19-21 Gordon Ave  Hyde Park  MA  02136,12.0,08,5.0,E18,Hyde Park,10.0,Ward 18,1812.0,R2,19-21 Gordon Ave,2136.0,Address,65377.0,42.2564,-71.1258,Constituent Call,"(42.2564, -71.1258)"
645773,101001611400,10/14/2015 07:12:00 AM,,10/20/2015 12:43:01 PM,ONTIME,Closed,Case Closed. Closed date : 2015-10-20 12:43:01.563 Case Resolved Base has been cemented. EP. 10/20/15.,Highway Maintenance,Public Works Department,Highway Maintenance,Highway Maintenance,PWDx_Street Light_General Lighting Request,PWDx,,https://cityworker.cityofboston.gov:8443/attachments/report/561e3a32d052ad6c0801a978/closed_photo/Report.jpg,0 Western Ave  Allston  MA  02134,11.0,04,9.0,D14,Allston / Brighton,15.0,Ward 22,2202.0,RL,0 Western Ave,2134.0,Address,148130.0,42.363,-71.1326,Employee Generated,"(42.363, -71.1326)"
646971,101001613148,10/15/2015 03:43:00 PM,,,ONTIME,Open,,Highway Maintenance,Public Works Department,Highway Maintenance,Highway Maintenance,PWDx_Sidewalk Repair,PWDx,,,44 Warren St  Charlestown  MA  02129,3.0,1A,1.0,A15,Charlestown,2.0,02,201.0,,44 Warren St,2129.0,Address,348188.0,42.3594,-71.0587,Constituent Call,"(0, 0)"
647178,101001613418,10/16/2015 07:47:00 AM,,10/27/2015 11:22:32 AM,ONTIME,Closed,Case Closed. Closed date : 2015-10-27 11:22:32.56 Case Resolved Base has been cemented. EP. 10/27/15.,Highway Maintenance,Public Works Department,Highway Maintenance,Highway Maintenance,PWDx_Street Light_General Lighting Request,PWDx,,https://cityworker.cityofboston.gov:8443/attachments/report/5620e464d052ad6c08022223/closed_photo/Report.jpg,1484 Dorchester Ave  Dorchester  MA  02122,7.0,07,3.0,C11,Dorchester,7.0,Ward 16,1601.0,RC,1484 Dorchester Ave,2122.0,Address,155712.0,42.3,-71.06,Employee Generated,"(42.3, -71.06)"
647190,101001613438,10/16/2015 08:14:00 AM,,10/20/2015 10:40:39 AM,ONTIME,Closed,Case Closed. Closed date : 2015-10-20 10:40:39.63 Case Resolved Base has been cemented. EP. 10/20/15.,Highway Maintenance,Public Works Department,Highway Maintenance,Highway Maintenance,PWDx_Street Light_General Lighting Request,PWDx,,https://cityworker.cityofboston.gov:8443/attachments/report/5620eaf6d052ad6c08022498/closed_photo/Report.jpg,422 River St  Mattapan  MA  02126,8.0,07,4.0,B3,Greater Mattapan,9.0,Ward 18,1804.0,R1,422 River St,2126.0,Address,116600.0,42.2693,-71.0908,Employee Generated,"(42.2693, -71.0908)"
647195,101001613444,10/16/2015 08:17:00 AM,,11/16/2015 09:28:20 AM,ONTIME,Closed,Case Closed. Closed date : 2015-11-16 09:28:20.877 Case Resolved Base is cemented. EP. 11/16/15.,Highway Maintenance,Public Works Department,Highway Maintenance,Highway Maintenance,PWDx_Street Light_General Lighting Request,PWDx,,https://cityworker.cityofboston.gov:8443/attachments/report/5620eb6ed052ad6c080224f5/closed_photo/Report.jpg,201 Geneva Ave  Dorchester  MA  02121,7.0,03,4.0,C11,Dorchester,8.0,Ward 14,1404.0,R3,201 Geneva Ave,2121.0,Address,240569.0,42.3045,-71.0733,Employee Generated,"(42.3045, -71.0733)"
647197,101001613451,10/16/2015 08:19:00 AM,,11/16/2015 10:26:33 AM,ONTIME,Closed,Case Closed. Closed date : 2015-11-16 10:26:33.227 Case Resolved Base is cemented. EP. 11/16/15.,Highway Maintenance,Public Works Department,Highway Maintenance,Highway Maintenance,PWDx_Street Light_General Lighting Request,PWDx,,https://cityworker.cityofboston.gov:8443/attachments/report/5620ecccd052ad6c080225ce/closed_photo/Report.jpg,1350-1358 Dorchester Ave  Dorchester  MA  02122,7.0,03,3.0,C11,Dorchester,8.0,Ward 15,1506.0,RC,1350-1358 Dorchester Ave,2122.0,Address,48295.0,42.3045,-71.0589,Employee Generated,"(42.3045, -71.0589)"
648845,101001615708,10/20/2015 07:27:00 AM,,11/02/2015 01:06:36 PM,ONTIME,Closed,Case Closed. Closed date : 2015-11-02 13:06:36.42 Case Resolved Base has been cemented. EP. 11/2/15.,Streetlight Bases.,Public Works Department,Highway Maintenance,Highway Maintenance,PWDx_Street Light_General Lighting Request,PWDx,,https://cityworker.cityofboston.gov:8443/attachments/report/562625ecd052e75846871718/closed_photo/Report.jpg,INTERSECTION of Adams St & Mallet St  Dorchester  MA,8.0,07,3.0,C11,Dorchester,7.0,Ward 16,1607.0,,INTERSECTION Adams St & Mallet St,,Intersection,104.0,42.2907,-71.0566,Employee Generated,"(42.2907, -71.0566)"
648847,101001615711,10/20/2015 07:32:00 AM,,11/19/2015 01:02:54 PM,ONTIME,Closed,Case Closed. Closed date : 2015-11-19 13:02:54.76 Case Resolved Base has been cemented. EP. 11/19/15.,Streetlight Bases.//Printed ep.,Public Works Department,Highway Maintenance,Highway Maintenance,PWDx_Street Light_General Lighting Request,PWDx,,https://cityworker.cityofboston.gov:8443/attachments/report/5626272bd052e7584687179e/closed_photo/Report.jpg,44 Burbank St  Boston  MA  02115,4.0,10A,8.0,D4,Boston,14.0,04,407.0,,44 Burbank St,2115.0,Address,173058.0,42.3442,-71.088,Employee Generated,"(42.3442, -71.088)"
649869,101001617224,10/21/2015 01:34:00 PM,,10/28/2015 02:09:14 PM,ONTIME,Closed,Case Closed. Closed date : 2015-10-28 14:09:14.017 Case Resolved Sinkhole filled,Highway Maintenance,Public Works Department,Highway Maintenance,Highway Maintenance,PWDx_Highway Construction,PWDx,,,37 River St  Boston  MA  02114,3.0,1B,8.0,A1,Beacon Hill,14.0,Ward 5,505.0,RC,37 River St,2114.0,Address,169109.0,42.3572,-71.0702,Twitter,"(42.3572, -71.0702)"
649918,101001617279,10/21/2015 02:07:00 PM,,,ONTIME,Open,,Highway Maintenance,Public Works Department,Highway Maintenance,Highway Maintenance,INFO01_GenericeFormforOtherServiceRequestTypes,INFO,,,285 Columbus Ave  Boston  MA  02116,4.0,1C,2.0,D4,South End,6.0,Ward 4,402.0,RC,285 Columbus Ave,2116.0,Address,35578.0,42.3472,-71.0739,Constituent Call,"(42.3472, -71.0739)"
650670,101001618357,10/22/2015 04:30:00 PM,,10/23/2015 01:39:11 PM,ONTIME,Closed,Case Closed. Closed date : 2015-10-23 13:39:11.653 Duplicate of Existing Case Thank You  we are aware of this issue and will address it.,Highway Maintenance,Public Works Department,Highway Maintenance,Highway Maintenance,PWDx_Highway Construction,PWDx,,,INTERSECTION of Brimmer St & Mount Vernon St  Boston  MA,3.0,1B,8.0,A1,Beacon Hill,14.0,Ward 5,511.0,,INTERSECTION Brimmer St & Mount Vernon St,,Intersection,1956.0,42.3574,-71.072,Twitter,"(42.3574, -71.072)"
650955,101001618785,10/23/2015 09:50:00 AM,,10/23/2015 03:26:27 PM,ONTIME,Closed,Case Closed. Closed date : 2015-10-23 15:26:27.403 Duplicate of Existing Case Duplicate of case 1010004190001    If you have any further questions  or feel that this case was closed  or reallocated in error  please do not hesitate to contact me.    Michael Somers  Senior Civil Engineer  Construction Management Division  Boston Public Works  617-635-3831	  Michael.Somers@Boston.gov,Highway Maintenance,Public Works Department,Highway Maintenance,Highway Maintenance,PWDx_Sidewalk Repair,PWDx,,,143 Appleton St  Boston  MA  02116,4.0,1C,2.0,D4,South End,6.0,Ward 4,401.0,CM,143 Appleton St,2116.0,Address,3917.0,42.3451,-71.0754,Constituent Call,"(42.3451, -71.0754)"
650969,101001618810,10/23/2015 10:08:00 AM,,,ONTIME,Open,,Highway Maintenance,Public Works Department,Highway Maintenance,Highway Maintenance,BWSC_All Cases,BWSC,,,20 Somerset St  Boston  MA  02108,3.0,1B,1.0,A1,Downtown / Financial District,3.0,03,306.0,E,20 Somerset St,2108.0,Address,128378.0,42.3597,-71.0618,Constituent Call,"(42.3597, -71.0618)"
651274,101001619283,10/23/2015 03:15:00 PM,,10/30/2015 10:45:57 AM,ONTIME,Closed,Case Closed. Closed date : 2015-10-30 10:45:57.123 Case Resolved Contractor cemented 10/29,Highway Maintenance,Public Works Department,Highway Maintenance,Highway Maintenance,BWSC_All Cases,BWSC,,,176 Brooks St  East Boston  MA  02128,1.0,09,1.0,A7,East Boston,1.0,Ward 1,107.0,R3,176 Brooks St,2128.0,Address,22458.0,42.3797,-71.0358,Constituent Call,"(42.3797, -71.0358)"
651346,101001619394,10/23/2015 05:06:00 PM,10/28/2015 12:56:03 PM,01/12/2016 06:37:02 AM,OVERDUE,Closed,Case Closed. Closed date : 2016-01-12 06:37:02.577 Case Resolved Bricks replaced.,Sidewalk Repair/Red Brick/Downtown,Public Works Department,Highway Maintenance,Highway Maintenance,PWDx_Highway Construction,PWDx,,,INTERSECTION of Bowdoin St & New Chardon St  Boston  MA,3.0,1B,1.0,A1,Beacon Hill,3.0,Ward 3,306.0,,INTERSECTION Bowdoin St & New Chardon St,,Intersection,1719.0,42.3612,-71.0629,Twitter,"(42.3612, -71.0629)"
651542,101001619636,10/24/2015 12:01:00 PM,,10/24/2015 12:19:28 PM,ONTIME,Closed,Case Closed. Closed date : 2015-10-24 12:19:28.72 Case Noted do not see any Brooks covered by asphalt here or a tripping hazard,Highway Maintenance,Public Works Department,Highway Maintenance,Highway Maintenance,PWDx_District 07: South Dorchester,PWDx,,https://cityworker.cityofboston.gov:8443/attachments/report/562bab9bd0529cc67b9845d5/closed_photo/Report.jpg,INTERSECTION of Dorchester Ave & Gibson St  Dorchester  MA,7.0,07,3.0,C11,Dorchester,7.0,Ward 16,1601.0,,INTERSECTION Dorchester Ave & Gibson St,,Intersection,4140.0,42.2972,-71.061,Constituent Call,"(42.2972, -71.061)"
652243,101001620672,10/26/2015 02:46:00 PM,,11/06/2015 11:18:33 AM,ONTIME,Closed,Case Closed. Closed date : 2015-11-06 11:18:33.67 Case Resolved Base has been properly bricked. EP. 11/6/15.,Streetlight Bases.,Public Works Department,Highway Maintenance,Highway Maintenance,PWDx_Street Light_General Lighting Request,PWDx,,https://cityworker.cityofboston.gov:8443/attachments/report/562e75dbd052e7ee17ea3e4d/closed_photo/Report.jpg,393 D St  Boston  MA  02210,6.0,05,2.0,C6,South Boston / South Boston Waterfront,5.0,Ward 6,601.0,,393 D St,2210.0,Address,160007.0,42.3414,-71.0472,Employee Generated,"(42.3414, -71.0472)"
652885,101001621646,10/27/2015 02:53:00 PM,,11/16/2015 01:57:34 PM,ONTIME,Closed,Case Closed. Closed date : 2015-11-16 13:57:34.387 Case Resolved Base is cemented. EP. 11/16/15.,Streetlight Bases//Printed ep,Public Works Department,Highway Maintenance,Highway Maintenance,PWDx_Street Light_General Lighting Request,PWDx,,https://cityworker.cityofboston.gov:8443/attachments/report/562fc8dad052cda8c395a297/closed_photo/Report.jpg,233 D St  South Boston  MA  02127,6.0,05,2.0,C6,South Boston / South Boston Waterfront,5.0,Ward 6,603.0,CM,233 D St,2127.0,Address,45473.0,42.3383,-71.0512,Employee Generated,"(42.3383, -71.0512)"
653225,101001622061,10/27/2015 08:28:00 PM,,11/05/2015 06:22:38 AM,ONTIME,Closed,Case Closed. Closed date : 2015-11-05 06:22:38.643 Duplicate of Existing Case This s a duplicate of an existing case. Thank You for submitting.,Highway Maintenance,Public Works Department,Highway Maintenance,Highway Maintenance,PWDx_Highway Construction,PWDx,,,1721 Washington St  Roxbury  MA  02118,4.0,1C,7.0,D4,South End,6.0,Ward 9,902.0,CM,1721 Washington St,2118.0,Address,144363.0,42.3371,-71.0766,Constituent Call,"(42.3371, -71.0766)"
653369,101001622272,10/28/2015 09:26:00 AM,,11/02/2015 02:22:37 PM,ONTIME,Closed,Case Closed. Closed date : 2015-11-02 14:22:37.893 Case Resolved Bricks replaced.,Highway Maintenance,Public Works Department,Highway Maintenance,Highway Maintenance,PWDx_Highway Construction,PWDx,,,102-100 Charles St  Boston  MA  02114,3.0,1B,8.0,A1,Back Bay,14.0,Ward 5,511.0,CM,102-100 Charles St,2114.0,Address,29050.0,42.3587,-71.0709,Constituent Call,"(42.3587, -71.0709)"
653671,101001622722,10/28/2015 02:53:00 PM,,11/10/2015 01:01:03 PM,ONTIME,Closed,Case Closed. Closed date : 2015-11-10 13:01:03.017 Case Resolved Base has been cemented. 11/10/15.,Streetlight Bases.,Public Works Department,Highway Maintenance,Highway Maintenance,PWDx_Street Light_General Lighting Request,PWDx,,https://cityworker.cityofboston.gov:8443/attachments/report/56311a9cd052cda8c395f460/closed_photo/Report.jpg,0 Hyde Park Ave  Hyde Park  MA  02136,12.0,08,5.0,E18,Hyde Park,10.0,Ward 18,1818.0,CL,0 Hyde Park Ave,2136.0,Address,76974.0,42.2499,-71.126,Employee Generated,"(42.2499, -71.126)"
653678,101001622730,10/28/2015 03:03:00 PM,,11/06/2015 09:57:32 AM,ONTIME,Closed,Case Closed. Closed date : 2015-11-06 09:57:32.85 Case Resolved Base has been cemented. 11/6/15 EP.,Streetlight Bases.,Public Works Department,Highway Maintenance,Highway Maintenance,PWDx_Street Light_General Lighting Request,PWDx,,https://cityworker.cityofboston.gov:8443/attachments/report/56311caed052cda8c395f5d7/closed_photo/Report.jpg,290 South St  Jamaica Plain  MA  02130,12.0,02,6.0,E13,Jamaica Plain,11.0,Ward 19,1902.0,E,290 South St,2130.0,Address,128810.0,42.3008,-71.1152,Employee Generated,"(42.3008, -71.1152)"
654463,101001623865,10/30/2015 08:01:00 AM,,11/16/2015 01:06:44 PM,ONTIME,Closed,Case Closed. Closed date : 2015-11-16 13:06:44.713 Case Resolved Base is cemented. EP. 11/16/15.,Streetlight Bases.//Printed ep,Public Works Department,Highway Maintenance,Highway Maintenance,PWDx_Street Light_General Lighting Request,PWDx,,https://cityworker.cityofboston.gov:8443/attachments/report/56335cb8d052cda8c3963da8/closed_photo/Report.jpg,42 Granite Ave  Dorchester  MA  02124,8.0,07,3.0,C11,Dorchester,7.0,Ward 16,1612.0,R1,42 Granite Ave,2124.0,Address,65904.0,42.2817,-71.0551,Employee Generated,"(42.2817, -71.0551)"
654467,101001623874,10/30/2015 08:05:00 AM,,10/30/2015 02:22:09 PM,ONTIME,Closed,Case Closed. Closed date : 2015-10-30 14:22:09.1 Case Resolved Completed.,Highway Maintenance,Public Works Department,Highway Maintenance,Highway Maintenance,PWDx_District 05: South Boston,PWDx,,,INTERSECTION of Dorchester Ave & General William H Devine Way  South Boston  MA,6.0,05,2.0,C6,South Boston / South Boston Waterfront,5.0,Ward 7,707.0,,INTERSECTION Dorchester Ave & General William H Devine Way,,Intersection,4175.0,42.3286,-71.0569,Employee Generated,"(42.3286, -71.0569)"
654472,101001623883,10/30/2015 08:11:00 AM,,11/27/2015 10:29:19 AM,ONTIME,Closed,Case Closed. Closed date : 2015-11-27 10:29:19.847 Case Resolved Base had been cemented. EP. 11/27/15.,Streetlight Bases.///Printed ep,Public Works Department,Highway Maintenance,Highway Maintenance,PWDx_Street Light_General Lighting Request,PWDx,,https://cityworker.cityofboston.gov:8443/attachments/report/56335f07d052cda8c3963e6d/closed_photo/Report.jpg,7 Park Ln  Jamaica Plain  MA  02130,9.0,02,7.0,E13,Jamaica Plain,11.0,Ward 11,1105.0,R1,7 Park Ln,2130.0,Address,153865.0,42.3109,-71.0988,Employee Generated,"(42.3109, -71.0988)"
654475,101001623891,10/30/2015 08:14:00 AM,,11/17/2015 01:29:22 PM,ONTIME,Closed,Case Closed. Closed date : 2015-11-17 13:29:22.48 Case Resolved Base is cemented. EP. 11/17/15.,Streetlight Bases.//Printed ep,Public Works Department,Highway Maintenance,Highway Maintenance,PWDx_Street Light_General Lighting Request,PWDx,,https://cityworker.cityofboston.gov:8443/attachments/report/56335fc5d052cda8c3963ebf/closed_photo/Report.jpg,470-476 Blue Hill Ave  Dorchester  MA  02121,7.0,03,4.0,B2,Dorchester,13.0,14,1401.0,,470-476 Blue Hill Ave,2121.0,Address,352062.0,42.3594,-71.0587,Employee Generated,"(0, 0)"
654778,101001624383,10/30/2015 02:42:00 PM,,11/27/2015 11:06:34 AM,ONTIME,Closed,Case Closed. Closed date : 2015-11-27 11:06:34.397 Case Resolved Base has been cemented. EP. 11/27/15.,Streetlight Bases//Printed ep,Public Works Department,Highway Maintenance,Highway Maintenance,PWDx_Street Light_General Lighting Request,PWDx,,https://cityworker.cityofboston.gov:8443/attachments/report/5633ba8ad052cda8c39657a6/closed_photo/Report.jpg,40 Dimock St  Roxbury  MA  02119,9.0,10B,6.0,B2,Roxbury,11.0,Ward 11,1104.0,E,40 Dimock St,2119.0,Address,47801.0,42.3193,-71.097,Employee Generated,"(42.3193, -71.097)"
654788,101001624395,10/30/2015 02:54:00 PM,,11/13/2015 09:57:45 AM,ONTIME,Closed,Case Closed. Closed date : 2015-11-13 09:57:45.483 Case Resolved Base is cemented. EP. 11/13/15.,Streetlight Bases.,Public Works Department,Highway Maintenance,Highway Maintenance,PWDx_Street Light_General Lighting Request,PWDx,,https://cityworker.cityofboston.gov:8443/attachments/report/5633bd64d052cda8c3965812/closed_photo/Report.jpg,0 Norfolk St  Dorchester  MA  02124,8.0,07,4.0,B3,Dorchester,9.0,Ward 17,1705.0,E,0 Norfolk St,2124.0,Address,103155.0,42.2894,-71.0747,Employee Generated,"(42.2894, -71.0747)"
654791,101001624398,10/30/2015 02:58:00 PM,11/21/2017 12:00:00 AM,,ONTIME,Open,,Street Light Pole Painting,Public Works Department,Highway Maintenance,Highway Maintenance,PWDx_Highway Construction General,PWDx,,,0 Norfolk St  Dorchester  MA  02124,8.0,07,4.0,B3,Dorchester,9.0,Ward 17,1705.0,E,0 Norfolk St,2124.0,Address,103155.0,42.2894,-71.0747,Employee Generated,"(42.2894, -71.0747)"
654794,101001624404,10/30/2015 03:06:00 PM,,11/13/2015 09:56:06 AM,ONTIME,Closed,Case Closed. Closed date : 2015-11-13 09:56:06.307 Case Resolved Base is cemented. EP. 11/13/15.,Streetlight Bases.,Public Works Department,Highway Maintenance,Highway Maintenance,PWDx_Street Light_General Lighting Request,PWDx,,https://cityworker.cityofboston.gov:8443/attachments/report/5633c03ed052cda8c396589d/closed_photo/Report.jpg,240 Norfolk St  Dorchester  MA  02124,8.0,07,4.0,B3,Dorchester,9.0,Ward 17,1707.0,R3,240 Norfolk St,2124.0,Address,283670.0,42.2846,-71.0805,Employee Generated,"(42.2846, -71.0805)"
654795,101001624407,10/30/2015 03:08:00 PM,,,ONTIME,Open,Case Closed Case Noted  duplicate case to #1624404,Street Light Pole Painting,Public Works Department,Highway Maintenance,Highway Maintenance,PWDx_Highway Construction General,PWDx,,,240 Norfolk St  Dorchester  MA  02124,8.0,07,4.0,B3,Dorchester,9.0,Ward 17,1707.0,R3,240 Norfolk St,2124.0,Address,283670.0,42.2846,-71.0805,Employee Generated,"(42.2846, -71.0805)"
654799,101001624413,10/30/2015 03:12:00 PM,,11/13/2015 09:52:26 AM,ONTIME,Closed,Case Closed. Closed date : 2015-11-13 09:52:26.523 Case Resolved Base section has been painted. EP. 11/13/15.,Streetlight Bases.,Public Works Department,Highway Maintenance,Highway Maintenance,PWDx_Street Light_General Lighting Request,PWDx,,https://cityworker.cityofboston.gov:8443/attachments/report/5633c1b0d052cda8c3965908/closed_photo/Report.jpg,247 Norfolk St  Dorchester  MA  02124,8.0,07,4.0,B3,Greater Mattapan,9.0,Ward 17,1707.0,R3,247 Norfolk St,2124.0,Address,283673.0,42.2846,-71.0811,Employee Generated,"(42.2846, -71.0811)"
654803,101001624415,10/30/2015 03:15:00 PM,,11/13/2015 09:50:10 AM,ONTIME,Closed,Case Closed. Closed date : 2015-11-13 09:50:10.81 Case Resolved Base has been cemented. EP. 11/13/15.,Streetlight Bases.,Public Works Department,Highway Maintenance,Highway Maintenance,PWDx_Street Light_General Lighting Request,PWDx,,https://cityworker.cityofboston.gov:8443/attachments/report/5633c247d052cda8c396591c/closed_photo/Report.jpg,247 Norfolk St  Dorchester  MA  02124,8.0,07,4.0,B3,Greater Mattapan,9.0,Ward 17,1707.0,R3,247 Norfolk St,2124.0,Address,283673.0,42.2846,-71.0811,Employee Generated,"(42.2846, -71.0811)"
655904,101001625971,11/02/2015 03:10:00 PM,,,ONTIME,Open,,Highway Maintenance//Printed ep,Public Works Department,Highway Maintenance,Highway Maintenance,PWDx_Street Light_General Lighting Request,PWDx,,,40 Dimock St  Roxbury  MA  02119,9.0,10B,6.0,B2,Roxbury,11.0,Ward 11,1104,E,40 Dimock St,2119.0,Address,47801.0,42.3193,-71.097,Employee Generated,"(42.3193, -71.097)"
655908,101001625978,11/02/2015 03:15:00 PM,,11/10/2015 01:29:56 PM,ONTIME,Closed,Case Closed. Closed date : 2015-11-10 13:29:56.047 Case Resolved Base has been cemented. EP. 11/10/15.,Highway Maintenance,Public Works Department,Highway Maintenance,Highway Maintenance,PWDx_Street Light_General Lighting Request,PWDx,,https://cityworker.cityofboston.gov:8443/attachments/report/5637c52bd052cda8c396bddd/closed_photo/Report.jpg,INTERSECTION of Hyde Park Ave & Woodlawn St  Jamaica Plain  MA,12.0,02,6.0,E13,Jamaica Plain,10.0,Ward 19,1907,,INTERSECTION Hyde Park Ave & Woodlawn St,,Intersection,6477.0,42.2995,-71.1139,Employee Generated,"(42.2995, -71.1139)"
655914,101001625986,11/02/2015 03:20:00 PM,,11/02/2015 05:32:05 PM,ONTIME,Closed,Case Closed. Closed date : 2015-11-02 17:32:05.96 Duplicate of Existing Case,Highway Maintenance,Public Works Department,Highway Maintenance,Highway Maintenance,PWDx_District 08: Hyde Park,PWDx,,,871-873 Hyde Park Ave  Roslindale  MA  02131,12.0,08,5.0,E18,Hyde Park,10.0,Ward 18,1808,C,871-873 Hyde Park Ave,2131.0,Address,77672.0,42.2706,-71.1208,Employee Generated,"(42.2706, -71.1208)"
655918,101001625990,11/02/2015 03:22:00 PM,,12/14/2015 02:10:29 PM,ONTIME,Closed,Case Closed. Closed date : 2015-12-14 14:10:29.963 Case Resolved,Paint pole,Public Works Department,Highway Maintenance,Highway Maintenance,PWDx_Highway Construction General,PWDx,,,871-873 Hyde Park Ave  Roslindale  MA  02131,12.0,08,5.0,E18,Hyde Park,10.0,Ward 18,1808,C,871-873 Hyde Park Ave,2131.0,Address,77672.0,42.2706,-71.1208,Employee Generated,"(42.2706, -71.1208)"
656170,101001626305,11/03/2015 07:23:00 AM,,11/10/2015 01:11:53 PM,ONTIME,Closed,Case Closed. Closed date : 2015-11-10 13:11:53.97 Case Resolved Base has been cemented.11/10/15. EP.,Highway Maintenance,Public Works Department,Highway Maintenance,Highway Maintenance,PWDx_Street Light_General Lighting Request,PWDx,,https://cityworker.cityofboston.gov:8443/attachments/report/5638a7efd052cda8c396d159/closed_photo/Report.jpg,848-850 Hyde Park Ave  Hyde Park  MA  02136,12.0,08,5.0,E18,Hyde Park,10.0,Ward 18,1808,R2,848-850 Hyde Park Ave,2136.0,Address,77666.0,42.2713,-71.12,Employee Generated,"(42.2713, -71.12)"
656171,101001626307,11/03/2015 07:26:00 AM,,,ONTIME,Open,,Street Light Pole Painting,Public Works Department,Highway Maintenance,Highway Maintenance,PWDx_Highway Construction General,PWDx,,,848-850 Hyde Park Ave  Hyde Park  MA  02136,12.0,08,5.0,E18,Hyde Park,10.0,Ward 18,1808,R2,848-850 Hyde Park Ave,2136.0,Address,77666.0,42.2713,-71.12,Employee Generated,"(42.2713, -71.12)"
656842,101001627310,11/04/2015 07:20:00 AM,,11/04/2015 07:27:58 AM,ONTIME,Closed,Case Closed. Closed date : 2015-11-04 07:27:58.823 Case Resolved STRIPPED BLVD. POLE AND REPLACED SLIPOVER BASE ARM AND FIXTURE.ALSO RE-SHIMMED TO STRAIGTEN POLE      G.MC CARTHY /H.TYRA / J.FELDER J.HENNESSEY,Highway Maintenance,Public Works Department,Highway Maintenance,Highway Maintenance,PWDx_District 03: North Dorchester,PWDx,,,INTERSECTION of Geneva Ave & Westville St  Dorchester  MA,7.0,03,4.0,C11,Dorchester,8.0,Ward 15,1505,,INTERSECTION Geneva Ave & Westville St,,Intersection,5256.0,42.301,-71.0674,Employee Generated,"(42.301, -71.0674)"
656849,101001627314,11/04/2015 07:32:00 AM,,11/18/2015 12:29:31 PM,ONTIME,Closed,Case Closed. Closed date : 2015-11-18 12:29:31.733 Case Resolved Base has been cemented. EP. 11/18/15.,Highway Maintenance///Printed ep,Public Works Department,Highway Maintenance,Highway Maintenance,PWDx_Street Light_General Lighting Request,PWDx,,https://cityworker.cityofboston.gov:8443/attachments/report/5639fbcbd052cda8c39711f8/closed_photo/Report.jpg,INTERSECTION of Geneva Ave & Westville St  Dorchester  MA,7.0,03,4.0,C11,Dorchester,8.0,Ward 15,1505,,INTERSECTION Geneva Ave & Westville St,,Intersection,5256.0,42.301,-71.0674,Employee Generated,"(42.301, -71.0674)"
656851,101001627316,11/04/2015 07:36:00 AM,,11/18/2015 12:28:02 PM,ONTIME,Closed,Case Closed. Closed date : 2015-11-18 12:28:02.4 Case Resolved Base section painted. EP. 11/18/15.,Highway Maintenance///Printed ep,Public Works Department,Highway Maintenance,Highway Maintenance,PWDx_Street Light_General Lighting Request,PWDx,,https://cityworker.cityofboston.gov:8443/attachments/report/5639fc6bd052cda8c3971246/closed_photo/Report.jpg,INTERSECTION of Geneva Ave & Westville St  Dorchester  MA,7.0,03,4.0,C11,Dorchester,8.0,Ward 15,1505,,INTERSECTION Geneva Ave & Westville St,,Intersection,5256.0,42.301,-71.0674,Employee Generated,"(42.301, -71.0674)"
656853,101001627320,11/04/2015 07:42:00 AM,,11/17/2015 09:23:43 AM,ONTIME,Closed,Case Closed. Closed date : 2015-11-17 09:23:43.553 Case Resolved Base is cemented. EP. 11/17/15.,Highway Maintenance///Printed ep,Public Works Department,Highway Maintenance,Highway Maintenance,PWDx_Street Light_General Lighting Request,PWDx,,https://cityworker.cityofboston.gov:8443/attachments/report/5639fe23d052cda8c39712b2/closed_photo/Report.jpg,INTERSECTION of Amory St & Cornwall St  Jamaica Plain  MA,9.0,02,6.0,E13,Jamaica Plain,11.0,Ward 11,1106,,INTERSECTION Amory St & Cornwall St,,Intersection,411.0,42.3126,-71.1056,Employee Generated,"(42.3126, -71.1056)"
656856,101001627327,11/04/2015 07:49:00 AM,,11/17/2015 01:06:00 PM,ONTIME,Closed,Case Closed. Closed date : 2015-11-17 13:06:00.033 Case Resolved Base is cemented. EP. 11/17/15.,Highway Maintenance///Printed ep,Public Works Department,Highway Maintenance,Highway Maintenance,PWDx_Street Light_General Lighting Request,PWDx,,https://cityworker.cityofboston.gov:8443/attachments/report/563a0021d052cda8c397131e/closed_photo/Report.jpg,INTERSECTION of Weld Hill St & Hyde Park Ave  Jamaica Plain  MA,12.0,02,6.0,E13,Jamaica Plain,10.0,Ward 19,1907,,INTERSECTION Weld Hill St & Hyde Park Ave,,Intersection,6191.0,42.2991,-71.1141,Employee Generated,"(42.2991, -71.1141)"
656859,101001627334,11/04/2015 07:58:00 AM,,11/17/2015 12:58:39 PM,ONTIME,Closed,Case Closed. Closed date : 2015-11-17 12:58:39.553 Case Resolved Base is cemented. EP. 11/17/15.,Highway Maintenance///Printed ep,Public Works Department,Highway Maintenance,Highway Maintenance,PWDx_Street Light_General Lighting Request,PWDx,,https://cityworker.cityofboston.gov:8443/attachments/report/563a01cfd052cda8c39713a2/closed_photo/Report.jpg,160 Hyde Park Ave  Jamaica Plain  MA  02130,12.0,02,6.0,E13,Jamaica Plain,10.0,Ward 19,1907,CM,160 Hyde Park Ave,2130.0,Address,77181.0,42.2955,-71.1163,Employee Generated,"(42.2955, -71.1163)"
656864,101001627340,11/04/2015 08:03:00 AM,,11/06/2015 02:07:13 PM,ONTIME,Closed,Case Closed. Closed date : 2015-11-06 14:07:13.91 Case Resolved Painted,Streetlight Bases,Public Works Department,Highway Maintenance,Highway Maintenance,PWDx_Street Light_General Lighting Request,PWDx,,,160 Hyde Park Ave  Jamaica Plain  MA  02130,12.0,02,6.0,E13,Jamaica Plain,10.0,Ward 19,1907,CM,160 Hyde Park Ave,2130.0,Address,77181.0,42.2955,-71.1163,Employee Generated,"(42.2955, -71.1163)"
657056,101001627628,11/04/2015 11:03:00 AM,,11/06/2015 08:56:23 AM,ONTIME,Closed,Case Closed. Closed date : 2015-11-06 08:56:23.76 Case Resolved Dear Constituent     The Boston Public Works Department Construction Inspection Unit (CIU) has identified the sidewalk left in asphalt as belonging to National Grid.    Sidewalks are required to be restored within 60 days.    This particular work was done within the last 3 weeks.    Since the Public Works has a moratorium on all concrete pour work beginning in late November  this sidewalk may not be returned to concrete until the Spring    Since there was a moratorium on concrete and brick repair work until April 15th  the patch had to remain in asphalt.      We did request National Grid try to restore the sidewalk by November 15th.    The location has been entered into the CIU data base that tracks repairs to be made by utility companies or private contractors.    The CIU will monitor the progress of the repair.    Mark Cardarelli  Supervisor of Utility Coordination and Compliance  Boston Public Works Department  617-635-4951 Office,Highway Maintenance,Public Works Department,Highway Maintenance,Highway Maintenance,PWDx_Contractor Complaints,PWDx,,,78 Charles St  Boston  MA  02114,3.0,1B,8.0,A1,Back Bay,14.0,Ward 5,0511,RC,78 Charles St,2114.0,Address,29191.0,42.3581,-71.0707,Constituent Call,"(42.3581, -71.0707)"
657078,101001627658,11/04/2015 11:18:00 AM,,11/06/2015 07:01:55 AM,ONTIME,Closed,Case Closed. Closed date : 2015-11-06 07:01:55.44 Case Resolved pothole filled sidewalk made safe,Highway Maintenance,Public Works Department,Highway Maintenance,Highway Maintenance,PWDx_District 1B: North End,PWDx,,https://cityworker.cityofboston.gov:8443/attachments/report/563a3016d052cda8c397254e/closed_photo/Report.jpg,6A Long Whf  Boston  MA  02110,3.0,1B,1.0,A1,Boston,3.0,03,0301,C,6A Long Whf,2110.0,Address,172063.0,42.3602,-71.0502,Constituent Call,"(42.3602, -71.0502)"
657282,101001627978,11/04/2015 03:01:00 PM,,11/18/2015 11:22:32 AM,ONTIME,Closed,Case Closed. Closed date : 2015-11-18 11:22:32.46 Case Resolved Base is cemented. EP. 11/18/15.,Highway Maintenance//Printed ep,Public Works Department,Highway Maintenance,Highway Maintenance,PWDx_Street Light_General Lighting Request,PWDx,,https://cityworker.cityofboston.gov:8443/attachments/report/563a651ed052cda8c3973583/closed_photo/Report.jpg,1208 Dorchester Ave  Dorchester  MA  02125,7.0,03,3.0,C11,Dorchester,8.0,15,1506,,1208 Dorchester Ave,2125.0,Address,351624.0,42.3594,-71.0587,Employee Generated,"(0, 0)"
657289,101001627983,11/04/2015 03:06:00 PM,,11/16/2015 10:11:54 AM,ONTIME,Closed,Case Closed. Closed date : 2015-11-16 10:11:54.153 Case Resolved Base is cemented. EP. 11/16/15.,Streetlight Bases//Printed ep,Public Works Department,Highway Maintenance,Highway Maintenance,PWDx_Street Light_General Lighting Request,PWDx,,https://cityworker.cityofboston.gov:8443/attachments/report/563a6622d052cda8c39735b8/closed_photo/Report.jpg,39 Savin Hill Ave  Dorchester  MA  02125,7.0,03,3.0,C11,Dorchester,8.0,15,1504,,39 Savin Hill Ave,2125.0,Address,355113.0,42.3594,-71.0587,Employee Generated,"(0, 0)"
657297,101001628002,11/04/2015 03:14:00 PM,,11/16/2015 09:50:53 AM,ONTIME,Closed,Case Closed. Closed date : 2015-11-16 09:50:53.307 Case Resolved Base is cemented. EP. 11/16/15.,Streetlight Bases//Printed ep,Public Works Department,Highway Maintenance,Highway Maintenance,PWDx_Street Light_General Lighting Request,PWDx,,https://cityworker.cityofboston.gov:8443/attachments/report/563a6853d052cda8c3973664/closed_photo/Report.jpg,36 Normandy St  Dorchester  MA  02121,7.0,03,4.0,B2,Roxbury,13.0,Ward 14,1401,A,36 Normandy St,2121.0,Address,284075.0,42.3108,-71.0785,Employee Generated,"(42.3108, -71.0785)"
657305,101001628014,11/04/2015 03:25:00 PM,,11/05/2015 10:07:48 AM,ONTIME,Closed,Case Closed. Closed date : 2015-11-05 10:07:48.24 Duplicate of Existing Case duplicate of case number 101001628002,Highway Maintenance,Public Works Department,Highway Maintenance,Highway Maintenance,PWDx_District 03: North Dorchester,PWDx,,,36 Normandy St  Dorchester  MA  02121,7.0,03,4.0,B2,Roxbury,13.0,Ward 14,1401,A,36 Normandy St,2121.0,Address,284075.0,42.3108,-71.0785,Employee Generated,"(42.3108, -71.0785)"
657595,101001628468,11/05/2015 09:39:00 AM,,11/06/2015 08:05:58 AM,ONTIME,Closed,Case Closed. Closed date : 2015-11-06 08:05:58.04 Duplicate of Existing Case,Highway Maintenance,Public Works Department,Highway Maintenance,Highway Maintenance,PWDx_District 1C: Downtown,PWDx,,,225 Massachusetts Ave  Boston  MA  02115,4.0,10A,7.0,D4,Back Bay,14.0,Ward 4,0405,RC,225 Massachusetts Ave,2115.0,Address,155966.0,42.3443,-71.0868,Constituent Call,"(42.3443, -71.0868)"
657881,101001628951,11/05/2015 03:19:00 PM,,11/17/2015 09:29:49 AM,ONTIME,Closed,Case Closed. Closed date : 2015-11-17 09:29:49.54 Case Resolved Base is cemented. EP. 11/17/15.,Highway Maintenance///Printed ep,Public Works Department,Highway Maintenance,Highway Maintenance,PWDx_Street Light_General Lighting Request,PWDx,,https://cityworker.cityofboston.gov:8443/attachments/report/563bbabed052b8918595ef74/closed_photo/Report.jpg,312 Amory St  Jamaica Plain  MA  02130,9.0,02,6.0,E13,Jamaica Plain,11.0,Ward 11,1106,R1,312 Amory St,2130.0,Address,3345.0,42.3138,-71.1048,Employee Generated,"(42.3138, -71.1048)"
658088,101001629261,11/06/2015 07:29:00 AM,,11/27/2015 11:15:01 AM,ONTIME,Closed,Case Closed. Closed date : 2015-11-27 11:15:01.05 Case Resolved Base hase been cemented. EP. 11/27/15.,Highway Maintenance//Printed ep,Public Works Department,Highway Maintenance,Highway Maintenance,PWDx_Street Light_General Lighting Request,PWDx,,https://cityworker.cityofboston.gov:8443/attachments/report/563c9daad052a0569e42714a/closed_photo/Report.jpg,20 Dixwell St  Roxbury  MA  02119,9.0,02,7.0,E13,Jamaica Plain,11.0,Ward 11,1105,A,20 Dixwell St,2119.0,Address,224315.0,42.3143,-71.0978,Employee Generated,"(42.3143, -71.0978)"
658089,101001629263,11/06/2015 07:33:00 AM,,12/02/2015 01:25:12 PM,ONTIME,Closed,Case Closed. Closed date : 2015-12-02 13:25:12.45 Case Resolved This base has been cemented and made safe. EP. 12/2/15.,Highway Maintenance//Printed ep,Public Works Department,Highway Maintenance,Highway Maintenance,PWDx_Street Light_General Lighting Request,PWDx,,https://cityworker.cityofboston.gov:8443/attachments/report/563c9f1cd052a0569e427199/closed_photo/Report.jpg,INTERSECTION of Centre St & Highland Ave  Roxbury  MA,7.0,10B,7.0,B2,Roxbury,13.0,Ward 9,0905,,INTERSECTION Centre St & Highland Ave,,Intersection,2717.0,42.3297,-71.0932,Employee Generated,"(42.3297, -71.0932)"
658491,101001629851,11/06/2015 02:52:00 PM,,11/27/2015 10:17:57 AM,ONTIME,Closed,Case Closed. Closed date : 2015-11-27 10:17:57.93 Case Resolved Base has been cemented. EP. 11/27/15.,Highway Maintenance///Printed ep,Public Works Department,Highway Maintenance,Highway Maintenance,PWDx_Street Light_General Lighting Request,PWDx,,https://cityworker.cityofboston.gov:8443/attachments/report/563d0623d052a0569e42991d/closed_photo/Report.jpg,290 South St  Jamaica Plain  MA  02130,12.0,02,6.0,E13,Jamaica Plain,11.0,Ward 19,1902,E,290 South St,2130.0,Address,128810.0,42.3008,-71.1152,Employee Generated,"(42.3008, -71.1152)"
658508,101001629887,11/06/2015 03:17:00 PM,,11/27/2015 08:49:44 AM,ONTIME,Closed,Case Closed. Closed date : 2015-11-27 08:49:44.847 Case Resolved Base is cemented. EP. 11/27/15.,Highway Maintenance///Printed ep,Public Works Department,Highway Maintenance,Highway Maintenance,PWDx_Street Light_General Lighting Request,PWDx,,https://cityworker.cityofboston.gov:8443/attachments/report/563d0ba6d052a0569e429a28/closed_photo/Report.jpg,INTERSECTION of Asticou Rd & Washington St  Jamaica Plain  MA,12.0,02,6.0,E13,Jamaica Plain,11.0,Ward 19,1902,,INTERSECTION Asticou Rd & Washington St,,Intersection,689.0,42.3005,-71.1147,Employee Generated,"(42.3005, -71.1147)"
659168,101001630786,11/09/2015 07:26:00 AM,,11/19/2015 11:16:45 AM,ONTIME,Closed,Case Closed. Closed date : 2015-11-19 11:16:45.443 Case Resolved Base is cemented. EP. 11/19/15.,Streetlight Bases///Printed ep,Public Works Department,Highway Maintenance,Highway Maintenance,PWDx_Street Light_General Lighting Request,PWDx,,https://cityworker.cityofboston.gov:8443/attachments/report/5640916bd052a0569e42d24d/closed_photo/Report.jpg,211 L St  South Boston  MA  02127,6.0,05,2.0,C6,South Boston / South Boston Waterfront,5.0,Ward 7,0702,CM,211 L St,2127.0,Address,82526.0,42.3313,-71.0355,Employee Generated,"(42.3313, -71.0355)"
659614,101001631412,11/09/2015 03:03:00 PM,,11/16/2015 10:09:56 AM,ONTIME,Closed,Case Closed. Closed date : 2015-11-16 10:09:56.637 Case Resolved Base is cemented. EP. 11/16/15.,Streetlight Bases//printed ep,Public Works Department,Highway Maintenance,Highway Maintenance,PWDx_Street Light_General Lighting Request,PWDx,,https://cityworker.cityofboston.gov:8443/attachments/report/5640fcb2d052a0569e42f5bb/closed_photo/Report.jpg,INTERSECTION of Bellevue St & Hamilton St  Dorchester  MA,7.0,03,3.0,C11,Dorchester,8.0,Ward 15,1503,,INTERSECTION Bellevue St & Hamilton St,,Intersection,1246.0,42.3083,-71.0699,Employee Generated,"(42.3083, -71.0699)"
659636,101001631434,11/09/2015 03:11:00 PM,,11/16/2015 10:53:48 AM,ONTIME,Closed,Case Closed. Closed date : 2015-11-16 10:53:48.677 Case Resolved Base is cemented. EP. 11/16/15.,Streetlight Bases//printed ep,Public Works Department,Highway Maintenance,Highway Maintenance,PWDx_Street Light_General Lighting Request,PWDx,,https://cityworker.cityofboston.gov:8443/attachments/report/5640feacd052a0569e42f6b8/closed_photo/Report.jpg,354 Neponset Ave  Dorchester  MA  02122,8.0,07,3.0,C11,Dorchester,7.0,Ward 16,1610,E,354 Neponset Ave,2122.0,Address,100865.0,42.2873,-71.0456,Employee Generated,"(42.2873, -71.0456)"
659644,101001631444,11/09/2015 03:17:00 PM,,11/18/2015 10:57:07 AM,ONTIME,Closed,Case Closed. Closed date : 2015-11-18 10:57:07.86 Case Resolved Base is cemented. EP. 11/18/15.,Streetlight Bases//Printed ep,Public Works Department,Highway Maintenance,Highway Maintenance,PWDx_Street Light_General Lighting Request,PWDx,,https://cityworker.cityofboston.gov:8443/attachments/report/5640fff7d052a0569e42f72a/closed_photo/Report.jpg,292 Park St  Dorchester  MA  02124,8.0,07,4.0,C11,Dorchester,9.0,17,1703,,292 Park St,2124.0,Address,354013.0,42.3594,-71.0587,Employee Generated,"(0, 0)"
659648,101001631449,11/09/2015 03:21:00 PM,,11/18/2015 11:14:56 AM,ONTIME,Closed,Case Closed. Closed date : 2015-11-18 11:14:56.28 Case Resolved Base is cemented. EP. 11/18/15.,Streetlight Bases///Printed ep,Public Works Department,Highway Maintenance,Highway Maintenance,PWDx_Street Light_General Lighting Request,PWDx,,https://cityworker.cityofboston.gov:8443/attachments/report/564100f1d052a0569e42f75d/closed_photo/Report.jpg,0 Dorchester Ave  Dorchester  MA  02122,7.0,03,3.0,C11,Dorchester,8.0,Ward 15,1509,CL,0 Dorchester Ave,2122.0,Address,48104.0,42.3053,-71.0595,Employee Generated,"(42.3053, -71.0595)"
660848,101001633168,11/12/2015 08:04:00 AM,,11/18/2015 11:48:15 AM,ONTIME,Closed,Case Closed. Closed date : 2015-11-18 11:48:15.827 Case Resolved Base is cemented. EP. 11/18/15.,Highway Maintenance///Printed ep,Public Works Department,Highway Maintenance,Highway Maintenance,PWDx_Street Light_General Lighting Request,PWDx,,https://cityworker.cityofboston.gov:8443/attachments/report/56448f3bd052932be1dae502/closed_photo/Report.jpg,255 Freeport St  Dorchester  MA  02122,7.0,07,3.0,C11,Dorchester,7.0,Ward 16,1602,C,255 Freeport St,2122.0,Address,60870.0,42.3028,-71.053,Employee Generated,"(42.3028, -71.053)"
660853,101001633183,11/12/2015 08:12:00 AM,,11/18/2015 11:38:24 AM,ONTIME,Closed,Case Closed. Closed date : 2015-11-18 11:38:24.18 Case Resolved Base is cemented. EP. 11/18/15.,Highway Maintenance//Printed ep,Public Works Department,Highway Maintenance,Highway Maintenance,PWDx_Street Light_General Lighting Request,PWDx,,https://cityworker.cityofboston.gov:8443/attachments/report/56449125d052932be1dae5c5/closed_photo/Report.jpg,INTERSECTION of Clayton St & Freeport St  Dorchester  MA,7.0,03,3.0,C11,Dorchester,8.0,Ward 15,1506,,INTERSECTION Clayton St & Freeport St,,Intersection,3111.0,42.3045,-71.056,Employee Generated,"(42.3045, -71.056)"
660861,101001633193,11/12/2015 08:18:00 AM,,11/18/2015 11:37:20 AM,ONTIME,Closed,Case Closed. Closed date : 2015-11-18 11:37:20.673 Case Resolved Base is cemented. EP. 11/18/15.,Highway Maintenance//Printed ep,Public Works Department,Highway Maintenance,Highway Maintenance,PWDx_Street Light_General Lighting Request,PWDx,,https://cityworker.cityofboston.gov:8443/attachments/report/56449251d052932be1dae625/closed_photo/Report.jpg,INTERSECTION of Clayton St & Freeport St  Dorchester  MA,7.0,03,3.0,C11,Dorchester,8.0,Ward 15,1506,,INTERSECTION Clayton St & Freeport St,,Intersection,3111.0,42.3045,-71.056,Employee Generated,"(42.3045, -71.056)"
660864,101001633201,11/12/2015 08:26:00 AM,,11/18/2015 09:40:31 AM,ONTIME,Closed,Case Closed. Closed date : 2015-11-18 09:40:31.173 Case Resolved Base is cemented. EP. 11/18/15.,Highway Maintenance//Printed ep,Public Works Department,Highway Maintenance,Highway Maintenance,PWDx_Street Light_General Lighting Request,PWDx,,https://cityworker.cityofboston.gov:8443/attachments/report/56449481d052932be1dae6dc/closed_photo/Report.jpg,357 Neponset Ave  Dorchester  MA  02122,8.0,07,3.0,C11,Dorchester,7.0,Ward 16,1610,E,357 Neponset Ave,2122.0,Address,100866.0,42.287,-71.0464,Employee Generated,"(42.287, -71.0464)"
661218,101001633669,11/12/2015 02:47:00 PM,,11/27/2015 09:08:27 AM,ONTIME,Closed,Case Closed. Closed date : 2015-11-27 09:08:27.22 Case Resolved Base has been cemented. EP. 11/27/15.,Highway Maintenance///Printed ep,Public Works Department,Highway Maintenance,Highway Maintenance,PWDx_Street Light_General Lighting Request,PWDx,,https://cityworker.cityofboston.gov:8443/attachments/report/5644eda2d052932be1db0a09/closed_photo/Report.jpg,4775 Washington St  West Roxbury  MA  02132,12.0,06,6.0,E5,West Roxbury,12.0,Ward 20,2010,R2,4775 Washington St,2132.0,Address,331737.0,42.2727,-71.1444,Employee Generated,"(42.2727, -71.1444)"
661229,101001633692,11/12/2015 03:08:00 PM,,11/12/2015 09:59:22 PM,ONTIME,Closed,Case Closed. Closed date : 2015-11-12 21:59:22.307 Duplicate of Existing Case duplicate,Highway Maintenance,Public Works Department,Highway Maintenance,Highway Maintenance,PWDx_District 07: South Dorchester,PWDx,,,2090 Dorchester Ave  Dorchester  MA  02124,8.0,07,3.0,C11,Dorchester,7.0,Ward 16,1611,R2,2090 Dorchester Ave,2124.0,Address,48507.0,42.2791,-71.066,Employee Generated,"(42.2791, -71.066)"
661235,101001633699,11/12/2015 03:14:00 PM,,11/18/2015 09:22:20 AM,ONTIME,Closed,Case Closed. Closed date : 2015-11-18 09:22:20.013 Case Resolved Base is cemented. EP. 11/18/15.,Streetlight Bases///Printed ep,Public Works Department,Highway Maintenance,Highway Maintenance,PWDx_Street Light_General Lighting Request,PWDx,,https://cityworker.cityofboston.gov:8443/attachments/report/5644f3dfd052932be1db0bc8/closed_photo/Report.jpg,2096 Dorchester Ave  Dorchester  MA  02124,8.0,07,3.0,C11,Dorchester,7.0,Ward 16,1611,R1,2096 Dorchester Ave,2124.0,Address,48510.0,42.2786,-71.0661,Employee Generated,"(42.2786, -71.0661)"
661768,101001634445,11/13/2015 02:14:00 PM,,11/16/2015 11:57:55 AM,ONTIME,Closed,Case Closed. Closed date : 2015-11-16 11:57:55.167 Case Resolved 3 bricks filled,Highway Maintenance,Public Works Department,Highway Maintenance,Highway Maintenance,PWDx_District 10B: Roxbury,PWDx,,https://cityworker.cityofboston.gov:8443/attachments/report/564636edd052932be1db3fb6/closed_photo/Report.jpg,286 Roxbury St  Roxbury  MA  02119,7.0,10B,7.0,B2,Roxbury,13.0,Ward 9,0905,EA,286 Roxbury St,2119.0,Address,169333.0,42.33,-71.0941,Constituent Call,"(42.33, -71.0941)"
661771,101001634450,11/13/2015 02:16:00 PM,,11/27/2015 10:51:24 AM,ONTIME,Closed,Case Closed. Closed date : 2015-11-27 10:51:24.34 Case Resolved Base had been cemented. EP. 11/27/15.,Streetlight Bases///Printed ep,Public Works Department,Highway Maintenance,Highway Maintenance,PWDx_Street Light_General Lighting Request,PWDx,,https://cityworker.cityofboston.gov:8443/attachments/report/564637a3d052932be1db3fef/closed_photo/Report.jpg,INTERSECTION of Day St & Grotto Glen Rd  Jamaica Plain  MA,9.0,10A,6.0,E13,Jamaica Plain,11.0,Ward 10,1006,,INTERSECTION Day St & Grotto Glen Rd,,Intersection,3948.0,42.3254,-71.1077,Employee Generated,"(42.3254, -71.1077)"
661794,101001634491,11/13/2015 02:45:00 PM,11/23/2015 09:22:36 AM,11/27/2015 09:13:31 AM,OVERDUE,Closed,Case Closed. Closed date : 2015-11-27 09:13:31.527 Case Resolved Base has been cemented. 11/27/15. EP.,Highway Maintenance///Printed ep,Public Works Department,Highway Maintenance,Highway Maintenance,PWDx_Street Light_General Lighting Request,PWDx,,https://cityworker.cityofboston.gov:8443/attachments/report/56463f0ed052932be1db4254/closed_photo/Report.jpg,4775 Washington St  West Roxbury  MA  02132,12.0,06,6.0,E5,West Roxbury,12.0,Ward 20,2010,R2,4775 Washington St,2132.0,Address,331737.0,42.2727,-71.1444,Employee Generated,"(42.2727, -71.1444)"
662956,101001636108,11/16/2015 03:03:00 PM,,11/27/2015 10:53:41 AM,ONTIME,Closed,Case Closed. Closed date : 2015-11-27 10:53:41.13 Case Resolved Base has been cemented. EP. 11/27/15.,Highway Maintenance//Printed ep,Public Works Department,Highway Maintenance,Highway Maintenance,PWDx_Street Light_General Lighting Request,PWDx,,https://cityworker.cityofboston.gov:8443/attachments/report/564a3750d052932be1dba478/closed_photo/Report.jpg,INTERSECTION of Day St & Round Hill St  Jamaica Plain  MA,9.0,10A,6.0,E13,Jamaica Plain,11.0,Ward 10,1006,,INTERSECTION Day St & Round Hill St,,Intersection,3947.0,42.3249,-71.1078,Employee Generated,"(42.3249, -71.1078)"
662966,101001636116,11/16/2015 03:08:00 PM,,,ONTIME,Open,,Highway Maintenance//Printed ep,Public Works Department,Highway Maintenance,Highway Maintenance,PWDx_Street Light_General Lighting Request,PWDx,,,2135 Dorchester Ave  Dorchester  MA  02124,8.0,07,3.0,C11,Dorchester,7.0,Ward 17,1713,R3,2135 Dorchester Ave,2124.0,Address,48518.0,42.2777,-71.0668,Employee Generated,"(42.2777, -71.0668)"
662971,101001636125,11/16/2015 03:13:00 PM,,12/09/2015 09:43:10 AM,ONTIME,Closed,Case Closed. Closed date : 2015-12-09 09:43:10.03 Case Resolved This base has been cemented and made safe. EP. 12/9/15.,Streetlight Bases.///Printed ep,Public Works Department,Highway Maintenance,Highway Maintenance,PWDx_Street Light_General Lighting Request,PWDx,,https://cityworker.cityofboston.gov:8443/attachments/report/564a3a22d052932be1dba572/closed_photo/Report.jpg,4775 Washington St  West Roxbury  MA  02132,12.0,06,6.0,E5,West Roxbury,12.0,Ward 20,2010,R2,4775 Washington St,2132.0,Address,331737.0,42.2727,-71.1444,Employee Generated,"(42.2727, -71.1444)"
662980,101001636135,11/16/2015 03:22:00 PM,,12/04/2015 01:16:36 PM,ONTIME,Closed,Case Closed. Closed date : 2015-12-04 13:16:36.86 Case Resolved Base has been cemented and made safe. EP. 12/4/15.,Streetlight Bases///Printed ep,Public Works Department,Highway Maintenance,Highway Maintenance,PWDx_Street Light_General Lighting Request,PWDx,,https://cityworker.cityofboston.gov:8443/attachments/report/564a3bd8d052932be1dba5f7/closed_photo/Report.jpg,INTERSECTION of Eustis St & Magazine St  Roxbury  MA,7.0,03,7.0,B2,Roxbury,13.0,Ward 8,0805,,INTERSECTION Eustis St & Magazine St,,Intersection,4669.0,42.3257,-71.0732,Employee Generated,"(42.3257, -71.0732)"
663325,101001636607,11/17/2015 09:41:00 AM,,11/18/2015 10:46:54 AM,ONTIME,Closed,Case Closed. Closed date : 2015-11-18 10:46:54.56 Case Noted Please see notes attached. Thank you.,Highway Maintenance,Public Works Department,Highway Maintenance,Highway Maintenance,PWDx_Highway Construction,PWDx,,,41 Howell St  Dorchester  MA  02125,6.0,03,2.0,C6,Dorchester,5.0,Ward 7,0708,R3,41 Howell St,2125.0,Address,75658.0,42.3254,-71.0586,Constituent Call,"(42.3254, -71.0586)"
664323,101001638027,11/18/2015 03:04:00 PM,,12/07/2015 09:40:18 AM,ONTIME,Closed,Case Closed. Closed date : 2015-12-07 09:40:18.703 Case Resolved Base has been bricked and made safe. EP. 12/7/15.,Streetlight Bases///Printed ep,Public Works Department,Highway Maintenance,Highway Maintenance,PWDx_Street Light_General Lighting Request,PWDx,,https://cityworker.cityofboston.gov:8443/attachments/report/564cdae2d052932be1dc171a/closed_photo/Report.jpg,INTERSECTION of Harrison Ave & Worcester Sq  Roxbury  MA,4.0,1C,2.0,D4,South End,6.0,Ward 8,0802,,INTERSECTION Harrison Ave & Worcester Sq,,Intersection,5684.0,42.336,-71.0739,Employee Generated,"(42.336, -71.0739)"
664335,101001638036,11/18/2015 03:10:00 PM,,12/08/2015 09:46:13 AM,ONTIME,Closed,Case Closed. Closed date : 2015-12-08 09:46:13.647 Case Resolved This base has been cemented and made safe. EP. 12/8/15.,Streetlight Base///Printed ep,Public Works Department,Highway Maintenance,Highway Maintenance,PWDx_Street Light_General Lighting Request,PWDx,,https://cityworker.cityofboston.gov:8443/attachments/report/564cdbddd052932be1dc17cd/closed_photo/Report.jpg,175 Boston St  Dorchester  MA  02125,6.0,03,2.0,C6,Dorchester,5.0,Ward 7,0708,R2,175 Boston St,2125.0,Address,17119.0,42.3238,-71.0603,Employee Generated,"(42.3238, -71.0603)"
664555,101001638332,11/19/2015 07:41:00 AM,,11/19/2015 12:22:24 PM,ONTIME,Closed,Case Closed. Closed date : 2015-11-19 12:22:24.563 Case Resolved cemented,Highway Maintenance,Public Works Department,Highway Maintenance,Highway Maintenance,PWDx_District 06: West Roxbury and Roslindale,PWDx,,https://cityworker.cityofboston.gov:8443/attachments/report/564dc448d052932be1dc28d4/closed_photo/Report.jpg,60 Robin St  West Roxbury  MA  02132,12.0,06,6.0,E5,West Roxbury,12.0,Ward 20,2010,R1,60 Robin St,2132.0,Address,117343.0,42.2776,-71.1453,Employee Generated,"(42.2776, -71.1453)"
664882,101001638838,11/19/2015 01:58:00 PM,,11/27/2015 09:29:27 AM,ONTIME,Closed,Case Closed. Closed date : 2015-11-27 09:29:27.537 Case Resolved Base has been cemented. EP. 11/27/15.,Streetlight Bases.///Printed ep,Public Works Department,Highway Maintenance,Highway Maintenance,PWDx_Street Light_General Lighting Request,PWDx,,https://cityworker.cityofboston.gov:8443/attachments/report/564e1cb7d052932be1dc4702/closed_photo/Report.jpg,70 Robin St  West Roxbury  MA  02132,12.0,06,6.0,E5,West Roxbury,12.0,Ward 20,2010,R1,70 Robin St,2132.0,Address,117347.0,42.2779,-71.1449,Employee Generated,"(42.2779, -71.1449)"
664895,101001638853,11/19/2015 02:08:00 PM,,11/27/2015 09:40:05 AM,ONTIME,Closed,Case Closed. Closed date : 2015-11-27 09:40:05.567 Case Noted Need a more specific location description. Please resubmit with more details. Thank you.,Highway Maintenance,Public Works Department,Highway Maintenance,Highway Maintenance,INFO_Reallocation From Dept,INFO,,,61 Rockwood St  Jamaica Plain  MA  02130,9.0,02,6.0,E13,Jamaica Plain,11.0,19,1902,E,61 Rockwood St,2130.0,Address,117992.0,42.3136,-71.1275,Employee Generated,"(42.3136, -71.1275)"
664904,101001638871,11/19/2015 02:13:00 PM,,12/01/2015 08:25:20 AM,ONTIME,Closed,Case Closed. Closed date : 2015-12-01 08:25:20.953 Case Resolved Base has been cemented. EP. 12/1/15.,Streetlight Bases.///Printed ep,Public Works Department,Highway Maintenance,Highway Maintenance,PWDx_Street Light_General Lighting Request,PWDx,,https://cityworker.cityofboston.gov:8443/attachments/report/564e201dd052932be1dc4866/closed_photo/Report.jpg,INTERSECTION of Glenway St & Harvard St  Dorchester  MA,7.0,03,4.0,B3,Greater Mattapan,8.0,Ward 14,1402,,INTERSECTION Glenway St & Harvard St,,Intersection,5356.0,42.2964,-71.0805,Employee Generated,"(42.2964, -71.0805)"
664920,101001638884,11/19/2015 02:25:00 PM,,12/01/2015 09:16:16 AM,ONTIME,Closed,Case Closed. Closed date : 2015-12-01 09:16:16.553 Case Resolved This base has been cemented. EP. 12/1/15.,Streetlight Bases.///Printed ep,Public Works Department,Highway Maintenance,Highway Maintenance,PWDx_Street Light_General Lighting Request,PWDx,,https://cityworker.cityofboston.gov:8443/attachments/report/564e229dd052932be1dc48ee/closed_photo/Report.jpg,198 Geneva Ave  Dorchester  MA  02121,7.0,03,4.0,C11,Dorchester,13.0,Ward 14,1401,E,198 Geneva Ave,2121.0,Address,165585.0,42.3056,-71.0756,Employee Generated,"(42.3056, -71.0756)"
664930,101001638898,11/19/2015 02:31:00 PM,,12/01/2015 11:01:02 AM,ONTIME,Closed,Case Closed. Closed date : 2015-12-01 11:01:02.913 Case Resolved This base has been cemented. EP. 12/1/15.,Streetlight Bases.///Printed ep,Public Works Department,Highway Maintenance,Highway Maintenance,PWDx_Street Light_General Lighting Request,PWDx,,https://cityworker.cityofboston.gov:8443/attachments/report/564e242ed052932be1dc499a/closed_photo/Report.jpg,28 Parkman St  Dorchester  MA  02122,7.0,07,3.0,C11,Dorchester,7.0,Ward 16,1601,R1,28 Parkman St,2122.0,Address,108063.0,42.2969,-71.0588,Employee Generated,"(42.2969, -71.0588)"
664939,101001638912,11/19/2015 02:36:00 PM,,12/02/2015 10:10:45 AM,ONTIME,Closed,Case Closed. Closed date : 2015-12-02 10:10:45.043 Case Resolved This base hss been cemented and made safe. EP. 12/2/15.,Streetlight Bases///Printed ep,Public Works Department,Highway Maintenance,Highway Maintenance,PWDx_Street Light_General Lighting Request,PWDx,,https://cityworker.cityofboston.gov:8443/attachments/report/564e255ad052932be1dc4a1c/closed_photo/Report.jpg,281 Neponset Ave  Dorchester  MA  02122,8.0,07,3.0,C11,Dorchester,7.0,Ward 16,1610,R1,281 Neponset Ave,2122.0,Address,100843.0,42.2894,-71.0482,Employee Generated,"(42.2894, -71.0482)"
664946,101001638918,11/19/2015 02:39:00 PM,,12/02/2015 10:46:37 AM,ONTIME,Closed,Case Closed. Closed date : 2015-12-02 10:46:37.327 Case Resolved This base has been cemented and made safe. EP. 12/2/15.,Streetlight Bases.///Printed ep,Public Works Department,Highway Maintenance,Highway Maintenance,PWDx_Street Light_General Lighting Request,PWDx,,https://cityworker.cityofboston.gov:8443/attachments/report/564e25e6d052932be1dc4a46/closed_photo/Report.jpg,372 Neponset Ave  Dorchester  MA  02122,8.0,07,3.0,C11,Dorchester,7.0,Ward 16,1610,RC,372 Neponset Ave,2122.0,Address,100873.0,42.287,-71.045,Employee Generated,"(42.287, -71.045)"
664952,101001638924,11/19/2015 02:43:00 PM,,12/02/2015 09:55:11 AM,ONTIME,Closed,Case Closed. Closed date : 2015-12-02 09:55:11.04 Case Resolved This base has been cemented and made safe. EP. 12/2/15.,Streetlight Bases///Printed ep,Public Works Department,Highway Maintenance,Highway Maintenance,PWDx_Street Light_General Lighting Request,PWDx,,https://cityworker.cityofboston.gov:8443/attachments/report/564e26c2d052932be1dc4acc/closed_photo/Report.jpg,373 Adams St  Dorchester  MA  02122,7.0,07,3.0,C11,Dorchester,7.0,16,1601,R3,373 Adams St,2122.0,Address,686.0,42.2967,-71.0567,Employee Generated,"(42.2967, -71.0567)"
666171,101001640708,11/23/2015 07:34:00 AM,,12/09/2015 11:49:36 AM,ONTIME,Closed,Case Closed. Closed date : 2015-12-09 11:49:36.973 Case Resolved This base has been cemented and made safe. EP. 12/9/15.,Highway Maintenance//Printed ep,Public Works Department,Highway Maintenance,Highway Maintenance,PWDx_Street Light_General Lighting Request,PWDx,,https://cityworker.cityofboston.gov:8443/attachments/report/565308a3d052db5a46ea09e9/closed_photo/Report.jpg,INTERSECTION of Arthur St & N Beacon St  Allston  MA,11.0,04,9.0,D14,Allston / Brighton,15.0,Ward 22,2205,,INTERSECTION Arthur St & N Beacon St,,Intersection,613.0,42.3545,-71.1426,Employee Generated,"(42.3545, -71.1426)"
666176,101001640713,11/23/2015 07:42:00 AM,,12/07/2015 10:25:07 AM,ONTIME,Closed,Case Closed. Closed date : 2015-12-07 10:25:07.967 Case Resolved Base has been cemented and made safe. EP. 12/7/15.,Streetlight Bases///Printed ep,Public Works Department,Highway Maintenance,Highway Maintenance,PWDx_Street Light_General Lighting Request,PWDx,,https://cityworker.cityofboston.gov:8443/attachments/report/56530aa1d052db5a46ea0ad1/closed_photo/Report.jpg,INTERSECTION of Dudley St & Dunmore St  Roxbury  MA,7.0,10B,7.0,B2,Roxbury,13.0,Ward 8,0807,,INTERSECTION Dudley St & Dunmore St,,Intersection,4277.0,42.3261,-71.0753,Employee Generated,"(42.3261, -71.0753)"
666179,101001640719,11/23/2015 07:55:00 AM,,12/22/2015 01:19:52 PM,ONTIME,Closed,Case Closed. Closed date : 2015-12-22 13:19:52.483 Case Resolved Area has been bricked and made safe. EP. 12/22/15.,Streetlight Bases///Printed ep,Public Works Department,Highway Maintenance,Highway Maintenance,PWDx_Street Light_General Lighting Request,PWDx,,https://cityworker.cityofboston.gov:8443/attachments/report/56530da6d052db5a46ea0bd5/closed_photo/Report.jpg,374-380 Commonwealth Ave  Boston  MA  02215,4.0,10A,8.0,D4,Boston,14.0,05,0510,RC,374-380 Commonwealth Ave,2215.0,Address,40458.0,42.3486,-71.089,Employee Generated,"(42.3486, -71.089)"
666989,101001642073,11/24/2015 01:22:00 PM,,11/27/2015 09:02:12 AM,ONTIME,Closed,Case Closed. Closed date : 2015-11-27 09:02:12.15 Case Noted No holes or loose bricks found at this location,Highway Maintenance,Public Works Department,Highway Maintenance,Highway Maintenance,PWDx_District 10B: Roxbury,PWDx,,https://cityworker.cityofboston.gov:8443/attachments/report/5654ab1fd052db5a46ea5726/closed_photo/Report.jpg,275 Roxbury St  Roxbury  MA  02119,7.0,10B,7.0,B2,Roxbury,13.0,Ward 9,0905,EA,275 Roxbury St,2119.0,Address,119174.0,42.3304,-71.0939,Constituent Call,"(42.3304, -71.0939)"
668383,101001643944,11/28/2015 03:06:00 PM,,11/29/2015 11:57:56 AM,ONTIME,Closed,Case Closed. Closed date : 2015-11-29 11:57:56.033 Case Resolved Location has been made safe. This sidewalk will be referred for permanent repair. See case #101001644130 for status of the permanent repair.,Highway Maintenance,Public Works Department,Highway Maintenance,Highway Maintenance,PWDx_District 1C: Downtown,PWDx,,,INTERSECTION of Harrison Ave & Massachusetts Ave  Roxbury  MA,7.0,1C,2.0,D4,Roxbury,6.0,Ward 8,0802,,INTERSECTION Harrison Ave & Massachusetts Ave,,Intersection,5680.0,42.3349,-71.0752,Constituent Call,"(42.3349, -71.0752)"
669117,101001655033,11/30/2015 03:11:00 PM,,,ONTIME,Open,,Streetlight Bases///Printed ep,Public Works Department,Highway Maintenance,Highway Maintenance,PWDx_Street Light_General Lighting Request,PWDx,,,INTERSECTION of Bunker Hill St & Lowney Way  Charlestown  MA,3.0,1A,1.0,A15,Charlestown,2.0,Ward 2,0202,,INTERSECTION Bunker Hill St & Lowney Way,,Intersection,2204.0,42.3757,-71.0564,Employee Generated,"(42.3757, -71.0564)"
669787,101001656022,12/01/2015 02:56:00 PM,,12/07/2015 11:26:43 AM,ONTIME,Closed,Case Closed. Closed date : 2015-12-07 11:26:43.673 Case Resolved This base has been cemented and made safe. EP. 12/7/15.,Streetlight Bases///Printed ep,Public Works Department,Highway Maintenance,Highway Maintenance,PWDx_Street Light_General Lighting Request,PWDx,,https://cityworker.cityofboston.gov:8443/attachments/report/565dfc5bd052fa972b39f203/closed_photo/Report.jpg,INTERSECTION of Dorchester Ave & Ellet St  Dorchester  MA,7.0,03,3.0,C11,Dorchester,8.0,Ward 15,1509,,INTERSECTION Dorchester Ave & Ellet St,,Intersection,4146.0,42.3043,-71.0592,Employee Generated,"(42.3043, -71.0592)"
669795,101001656042,12/01/2015 03:06:00 PM,,12/04/2015 11:50:43 AM,ONTIME,Closed,Case Closed. Closed date : 2015-12-04 11:50:43.94 Case Resolved This base has been cemented and safe. EP. 12/4/15.,Highway Maintenance///Printed ep,Public Works Department,Highway Maintenance,Highway Maintenance,PWDx_Street Light_General Lighting Request,PWDx,,https://cityworker.cityofboston.gov:8443/attachments/report/565dfe76d052fa972b39f308/closed_photo/Report.jpg,15 Cedar St  Roxbury  MA  02119,7.0,10B,7.0,B2,Roxbury,13.0,9,0905,,15 Cedar St,2119.0,Address,342019.0,42.3594,-71.0587,Employee Generated,"(0, 0)"
670023,101001656387,12/02/2015 08:07:00 AM,,12/07/2015 11:11:51 AM,ONTIME,Closed,Case Closed. Closed date : 2015-12-07 11:11:51.85 Case Resolved This base has been cemented and made safe. EP. 12/7/15.,Streetlight Bases///Printed ep,Public Works Department,Highway Maintenance,Highway Maintenance,PWDx_Street Light_General Lighting Request,PWDx,,https://cityworker.cityofboston.gov:8443/attachments/report/565eed94d052fa972b3a0858/closed_photo/Report.jpg,90 Cushing Ave  Dorchester  MA  02125,7.0,03,3.0,C11,Dorchester,7.0,Ward 13,1306,E,90 Cushing Ave,2125.0,Address,45189.0,42.3138,-71.0632,Employee Generated,"(42.3138, -71.0632)"
670024,101001656397,12/02/2015 08:11:00 AM,,12/07/2015 10:56:46 AM,ONTIME,Closed,Case Closed. Closed date : 2015-12-07 10:56:46.223 Case Resolved Base has been cemented and made safe. EP. 12/7/15.,Streetlight Bases///Printed ep,Public Works Department,Highway Maintenance,Highway Maintenance,PWDx_Street Light_General Lighting Request,PWDx,,https://cityworker.cityofboston.gov:8443/attachments/report/565eee97d052fa972b3a08a0/closed_photo/Report.jpg,79 Howard Ave  Dorchester  MA  02125,7.0,03,7.0,B2,Roxbury,13.0,Ward 13,1301,R1,79 Howard Ave,2125.0,Address,75553.0,42.318,-71.0745,Employee Generated,"(42.318, -71.0745)"
670545,101001657200,12/03/2015 07:34:00 AM,,12/11/2015 10:26:11 PM,ONTIME,Closed,Case Closed. Closed date : 2015-12-11 22:26:11.6 Case Resolved Light base finished in bricks. see attached photo.,Streetlight Bases.,Public Works Department,Highway Maintenance,Highway Maintenance,PWDx_Highway Construction General,PWDx,,,INTERSECTION of Clinton St & North St  Boston  MA,3.0,1B,1.0,A1,Downtown / Financial District,3.0,Ward 3,0301,,INTERSECTION Clinton St & North St,,Intersection,3148.0,42.3608,-71.0559,Employee Generated,"(42.3608, -71.0559)"
670547,101001657203,12/03/2015 07:39:00 AM,,,ONTIME,Open,,Streetlight Bases///Printed ep,Public Works Department,Highway Maintenance,Highway Maintenance,PWDx_Street Light_General Lighting Request,PWDx,,,24 North St  Boston  MA  02109,3.0,1B,1.0,A1,Downtown / Financial District,3.0,Ward 3,0306,C,24 North St,2109.0,Address,157501.0,42.3608,-71.0563,Employee Generated,"(42.3608, -71.0563)"
670783,101001657609,12/03/2015 12:49:00 PM,,12/04/2015 10:25:54 AM,ONTIME,Closed,Case Closed. Closed date : 2015-12-04 10:25:54.56 Case Resolved Location has been made safe. This sidewalk will be referred for permanent repair. See case #101001658238 for status of the permanent repair.,Highway Maintenance,Public Works Department,Highway Maintenance,Highway Maintenance,PWDx_District 1B: North End,PWDx,,,11 Lime St  Boston  MA  02108,3.0,1B,8.0,A1,Beacon Hill,14.0,Ward 5,0505,R1,11 Lime St,2108.0,Address,85932.0,42.3574,-71.071,Twitter,"(42.3574, -71.071)"
670789,101001657621,12/03/2015 01:01:00 PM,,12/09/2015 10:08:49 AM,ONTIME,Closed,Case Closed. Closed date : 2015-12-09 10:08:49.453 Case Resolved This base has been cemented and made safe. EP. 12/9/15.,Streetlight Bases///Printed ep,Public Works Department,Highway Maintenance,Highway Maintenance,PWDx_Street Light_General Lighting Request,PWDx,,https://cityworker.cityofboston.gov:8443/attachments/report/566084b8d052df0bae254c3a/closed_photo/Report.jpg,INTERSECTION of Amory St & Williams St  Jamaica Plain  MA,9.0,02,6.0,E13,Jamaica Plain,11.0,Ward 11,1107,,INTERSECTION Amory St & Williams St,,Intersection,408.0,42.3074,-71.1091,Employee Generated,"(42.3074, -71.1091)"
672462,101001659974,12/07/2015 03:00:00 PM,,12/10/2015 06:18:10 AM,ONTIME,Closed,Case Closed. Closed date : 2015-12-10 06:18:10.45 Case Resolved Pole concreted.,Streetlight Bases,Public Works Department,Highway Maintenance,Highway Maintenance,PWDx_Highway Construction,PWDx,,,2115 Dorchester Ave  Dorchester  MA  02124,8.0,07,3.0,C11,Dorchester,7.0,Ward 17,1704.0,R3,2115 Dorchester Ave,2124.0,Address,225128.0,42.2783,-71.0666,Employee Generated,"(42.2783, -71.0666)"
672469,101001659981,12/07/2015 03:06:00 PM,,12/10/2015 06:15:57 AM,ONTIME,Closed,Case Closed. Closed date : 2015-12-10 06:15:57.523 Case Resolved Pole concreted.,Streetlight Bases,Public Works Department,Highway Maintenance,Highway Maintenance,PWDx_Street Light_General Lighting Request,PWDx,,,2209 Dorchester Ave  Dorchester  MA  02124,8.0,07,3.0,C11,Dorchester,7.0,Ward 17,1713.0,E,2209 Dorchester Ave,2124.0,Address,48552.0,42.2752,-71.0676,Employee Generated,"(42.2752, -71.0676)"
672471,101001659987,12/07/2015 03:10:00 PM,,12/10/2015 06:18:35 AM,ONTIME,Closed,Case Closed. Closed date : 2015-12-10 06:18:35.94 Case Resolved Pole concreted.,Streetlight Bases,Public Works Department,Highway Maintenance,Highway Maintenance,PWDx_Street Light_General Lighting Request,PWDx,,,2115 Dorchester Ave  Dorchester  MA  02124,8.0,07,3.0,C11,Dorchester,7.0,Ward 17,1704.0,R3,2115 Dorchester Ave,2124.0,Address,225128.0,42.2783,-71.0666,Employee Generated,"(42.2783, -71.0666)"
673740,101001661912,12/09/2015 02:40:00 PM,,12/10/2015 02:06:30 PM,ONTIME,Closed,Case Closed. Closed date : 2015-12-10 14:06:30.317 Case Resolved Repair made.     If this case was closed in error  please contact Thomas.hanlon@boston.gov,Highway Maintenance,Public Works Department,Highway Maintenance,Highway Maintenance,PWDx_Highway Construction,PWDx,,,0 Edgerly Rd  Boston  MA  02115,4.0,10A,7.0,D4,Back Bay,14.0,Ward 4,405.0,E,0 Edgerly Rd,2115.0,Address,51165.0,42.3463,-71.088,Employee Generated,"(42.3463, -71.088)"
673952,101001662201,12/10/2015 07:19:00 AM,,12/11/2015 01:58:21 PM,ONTIME,Closed,Case Closed. Closed date : 2015-12-11 13:58:21.05 Case Resolved Done.,Highway Maintenance,Public Works Department,Highway Maintenance,Highway Maintenance,PWDx_Highway Construction,PWDx,,,408 Atlantic Ave  Boston  MA  02110,3.0,1C,1.0,A1,Boston,3.0,03,306.0,E,408 Atlantic Ave,2110.0,Address,6137.0,42.3553,-71.0507,Employee Generated,"(42.3553, -71.0507)"
673961,101001662213,12/10/2015 07:40:00 AM,,12/11/2015 11:05:31 AM,ONTIME,Closed,Case Closed. Closed date : 2015-12-11 11:05:31.307 Case Resolved,Highway Maintenance,Public Works Department,Highway Maintenance,Highway Maintenance,PWDx_District 1C: Downtown,PWDx,,https://cityworker.cityofboston.gov:8443/attachments/report/566973e7d052bf0ef15ae4ab/closed_photo/Report.jpg,0 Albany St  Boston  MA  02111,4.0,1C,2.0,D4,Downtown / Financial District,4.0,Ward 3,308.0,E,0 Albany St,2111.0,Address,1527.0,42.3463,-71.0622,Employee Generated,"(42.3463, -71.0622)"
674256,101001662650,12/10/2015 12:41:00 PM,,12/10/2015 09:16:28 PM,ONTIME,Closed,Case Closed. Closed date : 2015-12-10 21:16:28.68 Case Resolved Light base finished in cement,Highway Maintenance,Public Works Department,Highway Maintenance,Highway Maintenance,PWDx_Highway Construction,PWDx,,,231 Highland St  Roxbury  MA  02119,9.0,10B,7.0,B2,Roxbury,13.0,Ward 11,1101.0,R3,231 Highland St,2119.0,Address,73739.0,42.3233,-71.095,Employee Generated,"(42.3233, -71.095)"
674749,101001663348,12/11/2015 12:18:00 PM,,12/14/2015 11:47:54 AM,ONTIME,Closed,Case Closed. Closed date : 2015-12-14 11:47:54.173 Case Resolved,Highway Maintenance,Public Works Department,Highway Maintenance,Highway Maintenance,PWDx_District 1C: Downtown,PWDx,,https://cityworker.cityofboston.gov:8443/attachments/report/566b0653d052bf0ef15b2961/closed_photo/Report.jpg,INTERSECTION of Moore St & Southampton St  Roxbury  MA,6.0,1C,7.0,C6,South Boston / South Boston Waterfront,13.0,Ward 8,806.0,,INTERSECTION Moore St & Southampton St,,Intersection,7392.0,42.3313,-71.0659,Employee Generated,"(42.3313, -71.0659)"
674756,101001663355,12/11/2015 12:25:00 PM,,12/14/2015 10:38:01 AM,ONTIME,Closed,Case Closed. Closed date : 2015-12-14 10:38:01.547 Case Resolved,Highway Maintenance,Public Works Department,Highway Maintenance,Highway Maintenance,PWDx_District 1C: Downtown,PWDx,,https://cityworker.cityofboston.gov:8443/attachments/report/566b07bbd052bf0ef15b29a3/closed_photo/Report.jpg,INTERSECTION of Cummings St & Southampton St  Roxbury  MA,6.0,1C,7.0,C6,South Boston / South Boston Waterfront,13.0,Ward 8,806.0,,INTERSECTION Cummings St & Southampton St,,Intersection,3721.0,42.3315,-71.0669,Employee Generated,"(42.3315, -71.0669)"
675172,101001663958,12/12/2015 06:56:00 PM,,12/14/2015 07:31:31 AM,ONTIME,Closed,Case Closed. Closed date : 2015-12-14 07:31:31.24 Case Resolved Location has been made safe. This sidewalk will be referred for permanent repair. See case #101001664327 for status of the permanent repair.,Highway Maintenance,Public Works Department,Highway Maintenance,Highway Maintenance,PWDx_District 1B: North End,PWDx,,,11 Charles St  Boston  MA  02114,3.0,1B,8.0,A1,Beacon Hill,14.0,Ward 5,503.0,RC,11 Charles St,2114.0,Address,364447.0,42.3594,-71.0587,Constituent Call,"(0, 0)"
675853,101001664928,12/14/2015 02:33:00 PM,,12/16/2015 02:18:29 PM,ONTIME,Closed,Case Closed. Closed date : 2015-12-16 14:18:29.397 Case Resolved Complete,Highway Maintenance,Public Works Department,Highway Maintenance,Highway Maintenance,PWDx_Highway Construction,PWDx,,,INTERSECTION of Amory St & Williams St  Jamaica Plain  MA,9.0,02,6.0,E13,Jamaica Plain,11.0,Ward 11,1107.0,,INTERSECTION Amory St & Williams St,,Intersection,408.0,42.3074,-71.1091,Employee Generated,"(42.3074, -71.1091)"
675858,101001664933,12/14/2015 02:40:00 PM,,12/16/2015 10:13:57 PM,ONTIME,Closed,Case Closed. Closed date : 2015-12-16 22:13:57.847 Case Resolved Light base finished in cement.,Highway Maintenance,Public Works Department,Highway Maintenance,Highway Maintenance,PWDx_Highway Construction,PWDx,,,90 Boylston St  Jamaica Plain  MA  02130,9.0,02,6.0,E13,Jamaica Plain,11.0,19,1901.0,CM,90 Boylston St,2130.0,Address,18438.0,42.3173,-71.105,Employee Generated,"(42.3173, -71.105)"
675870,101001664953,12/14/2015 02:48:00 PM,,12/16/2015 10:05:29 PM,ONTIME,Closed,Case Closed. Closed date : 2015-12-16 22:05:29.787 Case Resolved Light base finished in cement.,Highway Maintenance,Public Works Department,Highway Maintenance,Highway Maintenance,PWDx_Highway Construction,PWDx,,,115-141 Newmarket Sq  Roxbury  MA  02118,6.0,1C,7.0,C6,Roxbury,13.0,08,806.0,,115-141 Newmarket Sq,2118.0,Address,355197.0,42.3594,-71.0587,Employee Generated,"(0, 0)"
675876,101001664970,12/14/2015 03:02:00 PM,,12/16/2015 02:19:00 PM,ONTIME,Closed,Case Closed. Closed date : 2015-12-16 14:19:00.243 Case Resolved,Highway Maintenance,Public Works Department,Highway Maintenance,Highway Maintenance,PWDx_Highway Construction,PWDx,,,INTERSECTION of Mallard Ave & New England Ave  Dorchester  MA,8.0,07,4.0,B3,Greater Mattapan,9.0,Ward 17,1705.0,,INTERSECTION Mallard Ave & New England Ave,,Intersection,7010.0,42.2908,-71.0779,Employee Generated,"(42.2908, -71.0779)"
676536,101001665887,12/15/2015 02:22:00 PM,,12/17/2015 02:21:21 PM,ONTIME,Closed,Case Closed. Closed date : 2015-12-17 14:21:21.597 Case Resolved,Highway Maintenance,Public Works Department,Highway Maintenance,Highway Maintenance,PWDx_Highway Construction,PWDx,,,11 Paris St  East Boston  MA  02128,1.0,09,1.0,A7,East Boston,1.0,Ward 1,103.0,A,11 Paris St,2128.0,Address,288289.0,42.3695,-71.0402,Employee Generated,"(42.3695, -71.0402)"
676553,101001665911,12/15/2015 02:27:00 PM,,12/16/2015 10:17:28 PM,ONTIME,Closed,Case Closed. Closed date : 2015-12-16 22:17:28.873 Case Resolved Light base finished in cement.,Highway Maintenance,Public Works Department,Highway Maintenance,Highway Maintenance,PWDx_Highway Construction,PWDx,,,INTERSECTION of Broadway St & Melrose St  Boston  MA,4.0,1C,2.0,A1,Back Bay,6.0,Ward 5,501.0,,INTERSECTION Broadway St & Melrose St,,Intersection,1980.0,42.3496,-71.0669,Employee Generated,"(42.3496, -71.0669)"
676570,101001665922,12/15/2015 02:37:00 PM,,12/16/2015 02:19:18 PM,ONTIME,Closed,Case Closed. Closed date : 2015-12-16 14:19:18.473 Case Resolved,Highway Maintenance,Public Works Department,Highway Maintenance,Highway Maintenance,PWDx_Highway Construction,PWDx,,,INTERSECTION of Dorchester Ave & Edison Grn  Dorchester  MA,7.0,03,2.0,C11,Dorchester,5.0,Ward 7,709.0,,INTERSECTION Dorchester Ave & Edison Grn,,Intersection,4187.0,42.3191,-71.0567,Employee Generated,"(42.3191, -71.0567)"
676577,101001665928,12/15/2015 02:43:00 PM,,12/17/2015 02:21:41 PM,ONTIME,Closed,Case Closed. Closed date : 2015-12-17 14:21:41.73 Case Resolved,Highway Maintenance,Public Works Department,Highway Maintenance,Highway Maintenance,PWDx_Highway Construction,PWDx,,,544 Saratoga St  East Boston  MA  02128,1.0,09,1.0,A7,East Boston,1.0,Ward 1,110.0,R3,544 Saratoga St,2128.0,Address,306133.0,42.3809,-71.0252,Employee Generated,"(42.3809, -71.0252)"
677223,101001666942,12/16/2015 03:05:00 PM,,12/23/2015 02:02:39 PM,ONTIME,Closed,Case Closed. Closed date : 2015-12-23 14:02:39.48 Case Resolved Done,Streetlight Bases,Public Works Department,Highway Maintenance,Highway Maintenance,PWDx_Highway Construction General,PWDx,,,226-232 Highland St  Roxbury  MA  02119,9.0,10B,7.0,B2,Roxbury,13.0,11,1102.0,,226-232 Highland St,2119.0,Address,343899.0,42.3594,-71.0587,Employee Generated,"(0, 0)"
677225,101001666948,12/16/2015 03:09:00 PM,,12/28/2015 07:22:22 PM,ONTIME,Closed,Case Closed. Closed date : 2015-12-28 19:22:22.173 Case Resolved Light base finished in cement.,Streetlight Bases,Public Works Department,Highway Maintenance,Highway Maintenance,PWDx_Highway Construction General,PWDx,,,INTERSECTION of Ruggles St & Kerr Way  Mission Hill  MA,7.0,10B,7.0,B2,Roxbury,13.0,Ward 9,904.0,,INTERSECTION Ruggles St & Kerr Way,,Intersection,8207.0,42.3332,-71.0859,Employee Generated,"(42.3332, -71.0859)"
677227,101001666954,12/16/2015 03:12:00 PM,,12/22/2015 02:10:50 PM,ONTIME,Closed,Case Closed. Closed date : 2015-12-22 14:10:50.32 Case Resolved,Streetlight Bases,Public Works Department,Highway Maintenance,Highway Maintenance,PWDx_Highway Construction General,PWDx,,,155 Forest Hills St  Jamaica Plain  MA  02130,9.0,02,6.0,E13,Jamaica Plain,11.0,Ward 11,1107.0,CM,155 Forest Hills St,2130.0,Address,59365.0,42.3069,-71.1029,Employee Generated,"(42.3069, -71.1029)"
677230,101001666958,12/16/2015 03:16:00 PM,,01/06/2016 02:08:56 PM,ONTIME,Closed,Case Closed. Closed date : 2016-01-06 14:08:56.957 Case Resolved Done,Streetlight Bases,Public Works Department,Highway Maintenance,Highway Maintenance,PWDx_Highway Construction General,PWDx,,,544 Saratoga St  East Boston  MA  02128,1.0,09,1.0,A7,East Boston,1.0,Ward 1,110.0,R3,544 Saratoga St,2128.0,Address,306133.0,42.3809,-71.0252,Employee Generated,"(42.3809, -71.0252)"
677461,101001667344,12/17/2015 09:49:00 AM,,,ONTIME,Open,,Highway Maintenance,Public Works Department,Highway Maintenance,Highway Maintenance,BWSC_All Cases,BWSC,,,35 Warren Ave  Hyde Park  MA  02136,12.0,08,5.0,E18,Hyde Park,10.0,Ward 18,1816.0,R2,35 Warren Ave,2136.0,Address,142837.0,42.2525,-71.1172,Constituent Call,"(42.2525, -71.1172)"
677636,101001677635,12/17/2015 01:44:00 PM,,12/21/2015 10:15:35 PM,ONTIME,Closed,Case Closed. Closed date : 2015-12-21 22:15:35.313 Case Resolved Light base finished in cement.,Streetlight Bases,Public Works Department,Highway Maintenance,Highway Maintenance,PWDx_Highway Construction General,PWDx,,,38 Howard Ave  Dorchester  MA  02125,7.0,03,7.0,B2,Roxbury,13.0,Ward 13,1302.0,R3,38 Howard Ave,2125.0,Address,75538.0,42.3191,-71.0727,Employee Generated,"(42.3191, -71.0727)"
677663,101001677679,12/17/2015 02:51:00 PM,,12/18/2015 01:26:57 PM,ONTIME,Closed,Case Closed. Closed date : 2015-12-18 13:26:57.007 Case Resolved bricks are missing but pass bills in the empty space in the sidewalk is made safe no other loose bricks were found,Highway Maintenance,Public Works Department,Highway Maintenance,Highway Maintenance,PWDx_District 1B: North End,PWDx,,https://cityworker.cityofboston.gov:8443/attachments/report/567312b8d052fbf41cf988b1/closed_photo/Report.jpg,93 Revere St  Boston  MA  02114,3.0,1B,8.0,A1,Beacon Hill,14.0,Ward 5,504.0,CM,93 Revere St,2114.0,Address,115498.0,42.3596,-71.07,Constituent Call,"(42.3596, -71.07)"
679018,101001679713,12/21/2015 02:31:00 PM,,12/23/2015 08:39:11 AM,ONTIME,Closed,Case Closed. Closed date : 2015-12-23 08:39:11.117 Case Resolved Location has been made safe. This sidewalk will be referred for permanent repair. See case #101001680867 for status of the permanent repair.,Highway Maintenance,Public Works Department,Highway Maintenance,Highway Maintenance,PWDx_District 1B: North End,PWDx,,,38 Chestnut St  Boston  MA  02108,3.0,1B,8.0,A1,Beacon Hill,14.0,Ward 5,503.0,R1,38 Chestnut St,2108.0,Address,31406.0,42.3573,-71.068,Twitter,"(42.3573, -71.068)"
679048,101001679762,12/21/2015 03:18:00 PM,,12/23/2015 08:37:44 AM,ONTIME,Closed,Case Closed. Closed date : 2015-12-23 08:37:44.777 Case Resolved Location has been made safe. This sidewalk will be referred for permanent repair. See case #101001680865 for status of the permanent repair.,Highway Maintenance,Public Works Department,Highway Maintenance,Highway Maintenance,PWDx_District 1B: North End,PWDx,,,127 Mount Vernon St  Boston  MA  02108,3.0,1B,8.0,A1,Back Bay,14.0,Ward 5,505.0,E,127 Mount Vernon St,2108.0,Address,98508.0,42.3578,-71.0709,Twitter,"(42.3578, -71.0709)"
679371,101001680346,12/22/2015 11:26:00 AM,,,ONTIME,Open,,Streetlight Bases,Public Works Department,Highway Maintenance,Highway Maintenance,PWDx_Street Light_General Lighting Request,PWDx,,,INTERSECTION of Nightingale St & Talbot Ave  Dorchester  MA,8.0,07,4.0,B3,Greater Mattapan,8.0,Ward 14,1407.0,,INTERSECTION Nightingale St & Talbot Ave,,Intersection,7580.0,42.2943,-71.086,Employee Generated,"(42.2943, -71.086)"
679390,101001680358,12/22/2015 11:43:00 AM,,12/28/2015 01:39:49 PM,ONTIME,Closed,Case Closed. Closed date : 2015-12-28 13:39:49.103 Case Resolved,Streetlight Bases,Public Works Department,Highway Maintenance,Highway Maintenance,PWDx_Highway Construction General,PWDx,,,0 Savin Hill Ave  Dorchester  MA  02125,7.0,03,3.0,C11,Dorchester,7.0,Ward 13,1310.0,E,0 Savin Hill Ave,2125.0,Address,123139.0,42.3118,-71.0519,Employee Generated,"(42.3118, -71.0519)"
679400,101001680372,12/22/2015 11:48:00 AM,,12/23/2015 08:50:15 AM,ONTIME,Closed,Case Closed. Closed date : 2015-12-23 08:50:15.593 Case Resolved job complete  cemented base of light pole.,Highway Maintenance,Public Works Department,Highway Maintenance,Highway Maintenance,PWDx_District 08: Hyde Park,PWDx,,https://cityworker.cityofboston.gov:8443/attachments/report/5679803170b46890fdbb6db2/closed_photo/Report.jpg,761 Hyde Park Ave  Roslindale  MA  02131,12.0,08,5.0,E18,Hyde Park,10.0,Ward 18,1808.0,E,761 Hyde Park Ave,2131.0,Address,77556.0,42.2742,-71.1205,Employee Generated,"(42.2742, -71.1205)"
679406,101001680378,12/22/2015 11:54:00 AM,,,ONTIME,Open,,StreetLight Pole Painting,Public Works Department,Highway Maintenance,Highway Maintenance,PWDx_Highway Construction General,PWDx,,,761 Hyde Park Ave  Roslindale  MA  02131,12.0,08,5.0,E18,Hyde Park,10.0,Ward 18,1808.0,E,761 Hyde Park Ave,2131.0,Address,77556.0,42.2742,-71.1205,Employee Generated,"(42.2742, -71.1205)"
680163,101001681522,12/24/2015 07:44:00 AM,,,ONTIME,Open,,Highway Maintenance,Public Works Department,Highway Maintenance,Highway Maintenance,PWDx_Highway Construction,PWDx,,,INTERSECTION of E Ninth St & Patterson Way  South Boston  MA,6.0,05,2.0,C6,South Boston / South Boston Waterfront,5.0,Ward 7,705.0,,INTERSECTION E Ninth St & Patterson Way,,Intersection,7586.0,42.3319,-71.0508,Employee Generated,"(42.3319, -71.0508)"
680164,101001681525,12/24/2015 07:56:00 AM,,,ONTIME,Open,,Streetlight Bases.,Public Works Department,Highway Maintenance,Highway Maintenance,PWDx_Highway Construction General,PWDx,,,26 Middle St  South Boston  MA  02127,6.0,05,2.0,C6,South Boston / South Boston Waterfront,5.0,Ward 7,705.0,R1,26 Middle St,2127.0,Address,95193.0,42.3313,-71.0552,Employee Generated,"(42.3313, -71.0552)"
680170,101001681530,12/24/2015 08:04:00 AM,,,ONTIME,Open,,Highway Maintenance,Public Works Department,Highway Maintenance,Highway Maintenance,PWDx_Highway Construction,PWDx,,,200 H St  South Boston  MA  02127,6.0,05,2.0,C6,South Boston / South Boston Waterfront,5.0,Ward 7,702.0,CM,200 H St,2127.0,Address,67856.0,42.331,-71.0412,Employee Generated,"(42.331, -71.0412)"
680285,101001681733,12/24/2015 12:44:00 PM,,12/24/2015 10:18:55 PM,ONTIME,Closed,Case Closed. Closed date : 2015-12-24 22:18:55.83 Case Resolved Sidewalk cave-in was back filled and compacted  bricks replaced  and additional bricks were reset.,Highway Maintenance,Public Works Department,Highway Maintenance,Highway Maintenance,PWDx_Highway Construction,PWDx,,,INTERSECTION of Charles St & Chestnut St  Boston  MA,3.0,1B,8.0,A1,Beacon Hill,14.0,Ward 5,511.0,,INTERSECTION Charles St & Chestnut St,,Intersection,2788.0,42.357,-71.0699,Twitter,"(42.357, -71.0699)"
680822,101001682453,12/28/2015 07:40:00 AM,,,ONTIME,Open,,Streetlight Bases.,Public Works Department,Highway Maintenance,Highway Maintenance,PWDx_Highway Construction,PWDx,,,79-85 Freeport St  Dorchester  MA  02122,7.0,03,3.0,C11,Dorchester,8.0,Ward 15,1506.0,I,79-85 Freeport St,2122.0,Address,60918.0,42.3056,-71.0577,Employee Generated,"(42.3056, -71.0577)"
680854,101001682507,12/28/2015 08:30:00 AM,,01/07/2016 05:28:55 PM,ONTIME,Closed,Case Closed. Closed date : 2016-01-07 17:28:55.273 Case Resolved Light base finished in cement.,Streetlight Bases.,Public Works Department,Highway Maintenance,Highway Maintenance,PWDx_Highway Construction General,PWDx,,,INTERSECTION of Freeport St & Linden St  Dorchester  MA,7.0,03,3.0,C11,Dorchester,8.0,Ward 15,1506.0,,INTERSECTION Freeport St & Linden St,,Intersection,5118.0,42.306,-71.0576,Employee Generated,"(42.306, -71.0576)"
680988,101001682729,12/28/2015 10:47:00 AM,,01/03/2016 06:18:34 AM,ONTIME,Closed,Case Closed. Closed date : 2016-01-03 06:18:34.397 Case Noted Property owner is responsible for making repairs to granite flags at brick sidewalk/ driveway    see attached pictures,Highway Maintenance,Public Works Department,Highway Maintenance,Highway Maintenance,PWDx_District 1C: Downtown,PWDx,,,INTERSECTION of Berkeley St & Warren Ave  Boston  MA,4.0,1C,2.0,D4,South End,6.0,Ward 5,501.0,,INTERSECTION Berkeley St & Warren Ave,,Intersection,1363.0,42.3454,-71.0702,Constituent Call,"(42.3454, -71.0702)"
681170,101001683030,12/28/2015 02:56:00 PM,,01/07/2016 09:56:38 PM,ONTIME,Closed,Case Closed. Closed date : 2016-01-07 21:56:38.5 Case Resolved Light base finished in cement.,Streetlight Bases.,Public Works Department,Highway Maintenance,Highway Maintenance,PWDx_Highway Construction General,PWDx,,,28 Prince St  Jamaica Plain  MA  02130,9.0,02,6.0,E13,Jamaica Plain,11.0,Ward 19,1909.0,R2,28 Prince St,2130.0,Address,159163.0,42.3102,-71.1212,Employee Generated,"(42.3102, -71.1212)"
681361,101001683298,12/29/2015 08:00:00 AM,,01/07/2016 09:57:55 PM,ONTIME,Closed,Case Closed. Closed date : 2016-01-07 21:57:55.103 Case Resolved Light base finished in cement.,Streetlight Bases.,Public Works Department,Highway Maintenance,Highway Maintenance,PWDx_Highway Construction General,PWDx,,,50 Forbes St  Jamaica Plain  MA  02130,9.0,02,6.0,E13,Jamaica Plain,11.0,Ward 10,1009.0,R3,50 Forbes St,2130.0,Address,59215.0,42.321,-71.1064,Employee Generated,"(42.321, -71.1064)"
681379,101001683337,12/29/2015 08:28:00 AM,,01/06/2016 09:50:10 PM,ONTIME,Closed,Case Closed. Closed date : 2016-01-06 21:50:10.713 Case Resolved Light base finished in cement.,Streetlight Bases.,Public Works Department,Highway Maintenance,Highway Maintenance,PWDx_Highway Construction General,PWDx,,,739 Parker St  Mission Hill  MA  02120,9.0,10A,8.0,B2,Mission Hill,14.0,10,1002.0,,739 Parker St,2120.0,Address,351698.0,42.3594,-71.0587,Employee Generated,"(0, 0)"
681384,101001683349,12/29/2015 08:38:00 AM,,01/06/2016 09:53:50 PM,ONTIME,Closed,Case Closed. Closed date : 2016-01-06 21:53:50.723 Case Resolved Light base finished in cement.,Streetlight Bases.,Public Works Department,Highway Maintenance,Highway Maintenance,PWDx_Highway Construction General,PWDx,,,73 Delle Ave  Mission Hill  MA  02120,9.0,10A,8.0,B2,Mission Hill,14.0,Ward 10,1002.0,R3,73 Delle Ave,2120.0,Address,47228.0,42.3317,-71.1,Employee Generated,"(42.3317, -71.1)"
682385,101001685273,12/31/2015 07:21:00 AM,,01/07/2016 05:27:25 PM,ONTIME,Closed,Case Closed. Closed date : 2016-01-07 17:27:25.423 Case Resolved Light base finished in cement.,Streetlight Bases.,Public Works Department,Highway Maintenance,Highway Maintenance,PWDx_Highway Construction General,PWDx,,,INTERSECTION of Magazine St & Norfolk Ave  Roxbury  MA,7.0,03,7.0,B2,Roxbury,13.0,Ward 8,806.0,,INTERSECTION Magazine St & Norfolk Ave,,Intersection,6980.0,42.3267,-71.0715,Employee Generated,"(42.3267, -71.0715)"
682390,101001685277,12/31/2015 07:32:00 AM,,,ONTIME,Open,,Streetlight Bases.,Public Works Department,Highway Maintenance,Highway Maintenance,PWDx_Highway Construction,PWDx,,,INTERSECTION of Washington St & Valley Rd  Dorchester  MA,8.0,07,3.0,C11,Dorchester,7.0,Ward 17,1704.0,,INTERSECTION Washington St & Valley Rd,,Intersection,6123.0,42.2772,-71.0695,Employee Generated,"(42.2772, -71.0695)"
682405,101001685297,12/31/2015 08:16:00 AM,,,ONTIME,Open,,Streetlight Bases.,Public Works Department,Highway Maintenance,Highway Maintenance,PWDx_Street Light_General Lighting Request,PWDx,,,3446 Washington St  Jamaica Plain  MA  02130,9.0,02,6.0,E13,Jamaica Plain,11.0,11,1107.0,C,3446 Washington St,2130.0,Address,171142.0,42.3073,-71.106,Employee Generated,"(42.3073, -71.106)"
