,CASE_ENQUIRY_ID,OPEN_DT,TARGET_DT,CLOSED_DT,OnTime_Status,CASE_STATUS,CLOSURE_REASON,CASE_TITLE,SUBJECT,REASON,TYPE,QUEUE,Department,SubmittedPhoto,ClosedPhoto,Location,fire_district,pwd_district,city_council_district,police_district,neighborhood,neighborhood_services_district,ward,precinct,land_usage,LOCATION_STREET_NAME,LOCATION_ZIPCODE,Property_Type,Property_ID,LATITUDE,LONGITUDE,Source,Geocoded_Location
470144,101001241765,01/03/2015 06:46:21 PM,01/06/2015 08:30:00 AM,01/05/2015 11:43:17 AM,ONTIME,Closed,Case Closed Case Resolved NSTAR RESTORED SERVICE 702L,Major System Failure,Public Works Department,Street Lights,Major System Failure,PWDx_Major System Failure,PWDx,,,INTERSECTION of Drummond St & Erie St  Dorchester  MA,7.0,03,4.0,B3,Greater Mattapan,13.0,Ward 14,1403.0,,INTERSECTION Drummond St & Erie St,,Intersection,4251.0,42.3009,-71.0837,Constituent Call,"(42.3009, -71.0837)"
470302,101001241966,01/04/2015 05:29:27 PM,01/06/2015 08:30:00 AM,01/06/2015 04:06:11 PM,OVERDUE,Closed,Case Closed Case Resolved installed overhead and located short in pb,Major System Failure////printed,Public Works Department,Street Lights,Major System Failure,PWDx_Major System Failure,PWDx,,,INTERSECTION of Bowen St & E St  South Boston  MA,6.0,05,2.0,C6,South Boston / South Boston Waterfront,5.0,Ward 6,602.0,,INTERSECTION Bowen St & E St,,Intersection,1746.0,42.3362,-71.0512,Constituent Call,"(42.3362, -71.0512)"
470306,101001241970,01/04/2015 05:48:55 PM,01/06/2015 08:30:00 AM,01/07/2015 09:46:07 AM,OVERDUE,Closed,Case Closed Case Resolved ON CALL MAN CHECKED OUT CONTROL PANEL RESET BREAKERS  INSPECTOR  D.PRIOLEAU,Major System Failure////printed,Public Works Department,Street Lights,Major System Failure,PWDx_Major System Failure,PWDx,,,10 Monmouth St  East Boston  MA  02128,1.0,09,1.0,A7,East Boston,1.0,Ward 1,108.0,R2,10 Monmouth St,2128.0,Address,96365.0,42.3797,-71.0387,Constituent Call,"(42.3797, -71.0387)"
470314,101001241981,01/04/2015 06:57:50 PM,01/06/2015 08:30:00 AM,01/05/2015 11:45:35 AM,ONTIME,Closed,Case Closed Case Resolved PULLED TIE CONNECTION NORMANDY ST IS BACK ON LINE 702L 301L,Major System Failure PRINTED,Public Works Department,Street Lights,Major System Failure,PWDx_Major System Failure,PWDx,,,INTERSECTION of Normandy St & Stanwood St  Dorchester  MA,7.0,03,4.0,B2,Roxbury,13.0,Ward 14,1401.0,,INTERSECTION Normandy St & Stanwood St,,Intersection,7613.0,42.3093,-71.0803,Constituent Call,"(42.3093, -71.0803)"
470333,101001242005,01/04/2015 10:02:35 PM,01/06/2015 08:30:00 AM,01/06/2015 04:05:37 PM,OVERDUE,Closed,Case Closed Case Resolved installed overhead and located short in pb,Major System Failure////printed,Public Works Department,Street Lights,Major System Failure,PWDx_Major System Failure,PWDx,,,INTERSECTION of Bowen St & D St  South Boston  MA,6.0,05,2.0,C6,South Boston / South Boston Waterfront,5.0,Ward 6,602.0,,INTERSECTION Bowen St & D St,,Intersection,1745.0,42.3372,-71.0528,Constituent Call,"(42.3372, -71.0528)"
470720,101001242580,01/05/2015 03:45:30 PM,01/06/2015 03:45:30 PM,01/26/2015 10:28:39 AM,OVERDUE,Closed,Case Closed Case Resolved CREW REPAIRED SEVERAL GAS SOLAR BURBERS IN AREA,outage////printed,Public Works Department,Street Lights,Major System Failure,PWDx_Street Light Outages,PWDx,,,54 Harvard St  Charlestown  MA  02129,3.0,1A,1.0,A15,Charlestown,2.0,Ward 2,201.0,R2,54 Harvard St,2129.0,Address,70725.0,42.3734,-71.0633,Constituent Call,"(42.3734, -71.0633)"
471167,101001243223,01/06/2015 03:16:02 PM,01/07/2015 03:16:02 PM,01/22/2015 11:18:25 AM,OVERDUE,Closed,Case Closed Case Resolved Repaired broken neutral  light is on.  Contractor Mark 1/21/15,Major System Failure/LAMP #N1454015  85 Austin St/sent,Public Works Department,Street Lights,Major System Failure,PWDx_Street Light_Pending_Contractor (Internal),PWDx,,,89 Austin St  Hyde Park  MA  02136,12.0,08,5.0,E18,Hyde Park,10.0,Ward 18,1812.0,R1,89 Austin St,2136.0,Address,6794.0,42.2618,-71.1256,Constituent Call,"(42.2618, -71.1256)"
471305,101001243401,01/07/2015 02:17:00 AM,01/08/2015 08:30:00 AM,01/07/2015 02:19:39 AM,ONTIME,Closed,Case Closed Case Resolved  Ballast Sitting On # 10 Wires  Repaired,Major System Failure,Public Works Department,Street Lights,Major System Failure,PWDx_Major System Failure,PWDx,,,,,,,,,,,,,,,,,42.3594,-71.0587,Employee Generated,"(0, 0)"
472094,101001244520,01/08/2015 07:40:46 PM,01/12/2015 08:30:00 AM,01/08/2015 09:42:24 PM,ONTIME,Closed,Case Closed Case Resolved Contactor replaced,Major System Failure,Public Works Department,Street Lights,Major System Failure,PWDx_Major System Failure,PWDx,,,INTERSECTION of Humboldt Ave & Seaver St  Dorchester  MA,9.0,10B,7.0,B2,Roxbury,13.0,Ward 12,1207.0,,INTERSECTION Humboldt Ave & Seaver St,,Intersection,6398.0,42.31,-71.0921,Constituent Call,"(42.31, -71.0921)"
472237,101001244736,01/09/2015 09:53:09 AM,01/12/2015 09:53:09 AM,01/13/2015 10:24:23 AM,OVERDUE,Closed,Case Closed Case Resolved checked out and all lights on,Major System Failure/printed,Public Works Department,Street Lights,Major System Failure,PWDx_Major System Failure,PWDx,,,INTERSECTION of Commonwealth Ave & Sutherland Rd  Brighton  MA,11.0,04,9.0,D14,Allston / Brighton,15.0,Ward 21,2112.0,,INTERSECTION Commonwealth Ave & Sutherland Rd,,Intersection,3348.0,42.3414,-71.1468,Constituent Call,"(42.3414, -71.1468)"
472495,101001245120,01/09/2015 03:58:59 PM,01/12/2015 03:58:00 PM,01/09/2015 04:59:42 PM,ONTIME,Closed,Case Closed Case Resolved w/o made to replace button eye. system is on.,Major System Failure///change button eye,Public Works Department,Street Lights,Major System Failure,PWDx_Major System Failure,PWDx,,,0 Shawmut Ave  Roxbury  MA  02118,4.0,1C,2.0,D4,South End,4.0,Ward 3,308.0,E,0 Shawmut Ave,2118.0,Address,126008.0,42.3457,-71.0659,Employee Generated,"(42.3457, -71.0659)"
472667,101001245367,01/10/2015 06:28:11 PM,01/13/2015 08:30:00 AM,01/12/2015 04:05:24 PM,ONTIME,Closed,Case Closed Case Resolved replaced contactor. kh/th,Major System Failure////printed,Public Works Department,Street Lights,Major System Failure,PWDx_Major System Failure,PWDx,,,INTERSECTION of Greenbrier St & Tonawanda St  Dorchester  MA,7.0,03,4.0,C11,Dorchester,9.0,Ward 17,1701.0,,INTERSECTION Greenbrier St & Tonawanda St,,Intersection,5442.0,42.2977,-71.0708,Constituent Call,"(42.2977, -71.0708)"
472803,101001245575,01/11/2015 07:24:23 PM,01/13/2015 08:30:00 AM,01/12/2015 04:02:09 PM,ONTIME,Closed,Case Closed Case Resolved replaced #4 in contactors and jumped dead nstar leg. kh/jf/rk,Major System Failure////printed,Public Works Department,Street Lights,Major System Failure,PWDx_Major System Failure,PWDx,,,INTERSECTION of Concord Sq & Tremont St  Roxbury  MA,4.0,1C,7.0,D4,South End,6.0,Ward 9,902.0,,INTERSECTION Concord Sq & Tremont St,,Intersection,3409.0,42.3405,-71.0781,Constituent Call,"(42.3405, -71.0781)"
472826,101001245609,01/11/2015 11:22:09 PM,01/13/2015 08:30:00 AM,01/12/2015 03:23:20 PM,ONTIME,Closed,Case Closed Case Resolved replaced contactor. kh/th,Major System Failure//printed,Public Works Department,Street Lights,Major System Failure,PWDx_Major System Failure,PWDx,,,16 Greenbrier St  Dorchester  MA  02124,7.0,03,4.0,C11,Dorchester,8.0,Ward 15,1505.0,RL,16 Greenbrier St,2124.0,Address,66452.0,42.2995,-71.0717,Constituent Call,"(42.2995, -71.0717)"
473047,101001245913,01/12/2015 10:48:56 AM,01/13/2015 10:48:55 AM,01/12/2015 03:22:46 PM,ONTIME,Closed,Case Closed Case Resolved replaced contactor. kh/th,Major System Failure//printed,Public Works Department,Street Lights,Major System Failure,PWDx_Major System Failure,PWDx,,,114 Greenbrier St  Dorchester  MA  02124,7.0,03,4.0,C11,Dorchester,9.0,Ward 17,1703.0,R3,114 Greenbrier St,2124.0,Address,66448.0,42.2962,-71.0702,Constituent Call,"(42.2962, -71.0702)"
473204,101001246204,01/12/2015 04:40:35 PM,01/13/2015 04:40:34 PM,01/13/2015 09:24:42 PM,OVERDUE,Closed,Case Closed Case Resolved left on constant. new w/o for button eye made,Major System Failure////printed,Public Works Department,Street Lights,Major System Failure,PWDx_Major System Failure,PWDx,,,INTERSECTION of Huntington Ave & Longwood Ave  Boston  MA,4.0,10A,8.0,B2,Fenway / Kenmore / Audubon Circle / Longwood,14.0,Ward 4,410.0,,INTERSECTION Huntington Ave & Longwood Ave,,Intersection,6426.0,42.3359,-71.1003,Constituent Call,"(42.3359, -71.1003)"
473263,101001246285,01/12/2015 11:27:58 PM,01/14/2015 08:30:00 AM,01/13/2015 09:25:25 PM,ONTIME,Closed,Case Closed Case Resolved replaced burned contactor. night(3rd shift),Major System Failure////printed,Public Works Department,Street Lights,Major System Failure,PWDx_Major System Failure,PWDx,,,INTERSECTION of F St & W Third St  South Boston  MA,6.0,05,2.0,C6,South Boston / South Boston Waterfront,5.0,Ward 6,604.0,,INTERSECTION F St & W Third St,,Intersection,4730.0,42.3376,-71.0468,Constituent Call,"(42.3376, -71.0468)"
473576,101001246750,01/13/2015 03:11:00 PM,01/14/2015 03:11:00 PM,01/15/2015 09:24:03 AM,OVERDUE,Closed,Case Closed Case Resolved These lights are all working.  Contractor Mark  1/14/15,Major System Failure//sent to contractor queue,Public Works Department,Street Lights,Major System Failure,PWDx_Street Light_Pending_Contractor (Internal),PWDx,,,118 F St  South Boston  MA  02127,6.0,05,2.0,C6,South Boston / South Boston Waterfront,5.0,Ward 6,603.0,R1,118 F St,2127.0,Address,55369.0,42.3364,-71.0485,Constituent Call,"(42.3364, -71.0485)"
473632,101001246831,01/13/2015 06:01:12 PM,01/15/2015 08:30:00 AM,01/13/2015 09:59:20 PM,ONTIME,Closed,Case Closed Case Resolved repaired control wires. md/jd,Major System Failure////printed,Public Works Department,Street Lights,Major System Failure,PWDx_Major System Failure,PWDx,,,INTERSECTION of Smith St & Wigglesworth St  Mission Hill  MA,9.0,10A,8.0,B2,Mission Hill,14.0,Ward 10,1002.0,,INTERSECTION Smith St & Wigglesworth St,,Intersection,8377.0,42.335,-71.1025,Constituent Call,"(42.335, -71.1025)"
473887,101001247183,01/14/2015 11:32:40 AM,01/15/2015 11:28:54 AM,01/14/2015 11:38:56 AM,ONTIME,Closed,Case Closed Case Resolved  Upon inspection  contractor found No lights out at all.  All lights were on at location .  1/13/15 Mark,Major System Failure ( Contractor ),Public Works Department,Street Lights,Major System Failure,PWDx_Street Light_Pending_Contractor (Internal),PWDx,,,INTERSECTION of F St & W Fourth St  South Boston  MA,6.0,05,2.0,C6,South Boston / South Boston Waterfront,5.0,Ward 6,603.0,,INTERSECTION F St & W Fourth St,,Intersection,4728.0,42.3361,-71.0486,Employee Generated,"(42.3361, -71.0486)"
474151,101001247578,01/15/2015 12:41:48 AM,01/16/2015 08:30:00 AM,01/15/2015 02:27:29 PM,ONTIME,Closed,Case Closed Case Resolved REPLACED BAD CONTACTOR 301L 003L,Major System Failure  //  PRINTED //,Public Works Department,Street Lights,Major System Failure,PWDx_Major System Failure,PWDx,,,230 Hanover St  Boston  MA  02113,3.0,1B,1.0,A1,Downtown / Financial District,3.0,03,303.0,,230 Hanover St,2113.0,Address,351777.0,42.3594,-71.0587,Constituent Call,"(0, 0)"
474445,101001248006,01/15/2015 02:47:20 PM,01/16/2015 02:47:20 PM,01/26/2015 10:34:21 AM,OVERDUE,Closed,Case Closed Case Resolved CONTRACTOR INSTALLED TEMPORARY LIGHTS UNTIL PULLBOX THAT WAS DAMAGED IS REPLACED,Major System Failure////printed,Public Works Department,Street Lights,Major System Failure,PWDx_Major System Failure,PWDx,,,135 Kneeland St  Boston  MA  02111,4.0,1C,2.0,A1,Boston,4.0,03,308.0,,135 Kneeland St,2111.0,Address,342559.0,42.3594,-71.0587,Constituent Call,"(0, 0)"
475113,101001248998,01/17/2015 01:37:29 PM,01/21/2015 08:30:00 AM,01/21/2015 12:59:17 PM,OVERDUE,Closed,Case Closed Case Resolved ON CALL MAN CHECKED LOCATION FOUND GAS LIGHTS OUT GAS REPAIRED SEVERAL LIGHTS IN AREA,Major System Failure//printed,Public Works Department,Street Lights,Major System Failure,PWDx_Major System Failure,PWDx,,,55-63 Main St  Charlestown  MA  02129,3.0,1A,1.0,A15,Charlestown,2.0,Ward 2,201.0,CM,55-63 Main St,2129.0,Address,167253.0,42.3736,-71.0622,Constituent Call,"(42.3736, -71.0622)"
475142,101001249041,01/17/2015 06:10:33 PM,01/21/2015 08:30:00 AM,01/20/2015 09:20:16 AM,ONTIME,Closed,Case Closed Case Resolved knockdown poles/ verizon poles and they were notified,Major System Failure//printed,Public Works Department,Street Lights,Major System Failure,PWDx_Major System Failure,PWDx,,,INTERSECTION of French St & Violet St  Mattapan  MA,8.0,07,4.0,B3,Greater Mattapan,9.0,Ward 18,1802.0,,INTERSECTION French St & Violet St,,Intersection,5130.0,42.2742,-71.0899,Constituent Call,"(42.2742, -71.0899)"
475207,101001249132,01/18/2015 11:54:14 AM,01/21/2015 08:30:00 AM,01/20/2015 03:22:07 PM,ONTIME,Closed,Case Closed Case Resolved repaired broken wire in PB#19 - lights on,Major System Failure//printed - gave to Dan Pl.,Public Works Department,Street Lights,Major System Failure,PWDx_Major System Failure,PWDx,,,INTERSECTION of Hanover St & Prince St  Boston  MA,3.0,1B,1.0,A1,Downtown / Financial District,3.0,Ward 3,303.0,,INTERSECTION Hanover St & Prince St,,Intersection,5616.0,42.3643,-71.0539,Constituent Call,"(42.3643, -71.0539)"
475266,101001249218,01/18/2015 06:05:38 PM,01/21/2015 08:30:00 AM,01/20/2015 03:01:27 PM,ONTIME,Closed,Case Closed Case Resolved connected ties - lights on,Major System Failure//printed out duplicate,Public Works Department,Street Lights,Major System Failure,PWDx_Major System Failure,PWDx,,,INTERSECTION of Belgrade Ave & Corinth St  Roslindale  MA,12.0,06,5.0,E5,Roslindale,10.0,Ward 20,2002.0,,INTERSECTION Belgrade Ave & Corinth St,,Intersection,1233.0,42.2868,-71.1308,Constituent Call,"(42.2868, -71.1308)"
475442,101001249447,01/19/2015 05:31:59 PM,01/21/2015 08:30:00 AM,01/20/2015 03:23:13 PM,ONTIME,Closed,Case Closed Case Resolved lights are on,Major System Failure///printed///duplicate,Public Works Department,Street Lights,Major System Failure,PWDx_Major System Failure,PWDx,,,19-27 Corinth St  Roslindale  MA  02131,12.0,06,5.0,E5,Roslindale,10.0,Ward 20,2002.0,C,19-27 Corinth St,2131.0,Address,42863.0,42.2862,-71.1301,Constituent Call,"(42.2862, -71.1301)"
475455,101001249460,01/19/2015 06:44:09 PM,01/21/2015 08:30:00 AM,01/20/2015 03:23:52 PM,ONTIME,Closed,Case Closed Case Resolved connected ties and lights on,Major System Failure//duplicate of #1249447,Public Works Department,Street Lights,Major System Failure,PWDx_Major System Failure,PWDx,,,INTERSECTION of Corinth St & Washington St  Roslindale  MA,12.0,06,5.0,E5,Roslindale,10.0,Ward 20,2002.0,,INTERSECTION Corinth St & Washington St,,Intersection,3547.0,42.2857,-71.1289,Constituent Call,"(42.2857, -71.1289)"
476643,101001251065,01/21/2015 11:32:44 AM,01/22/2015 11:32:44 AM,01/26/2015 10:37:49 AM,OVERDUE,Closed,Case Closed Case Resolved CREW CHECKED CONTROL PANEL RETURNED SYSTEM TO NORMAL OPERATION,Major System Failure  // PRINTED //,Public Works Department,Street Lights,Major System Failure,PWDx_Major System Failure,PWDx,,,452 Huntington Ave  Hyde Park  MA  02136,12.0,08,5.0,E18,Hyde Park,10.0,Ward 18,1815.0,CM,452 Huntington Ave,2136.0,Address,76591.0,42.263,-71.1143,Constituent Call,"(42.263, -71.1143)"
477003,101001251657,01/22/2015 09:05:36 AM,02/05/2015 09:05:00 AM,02/02/2015 01:22:17 PM,ONTIME,Closed,Case Closed Case Resolved Made new  secondary connection & replaced photocell  light is on.  Contr. Mark 1/29/15,Light replacement due to knocked down utility poles,Public Works Department,Street Lights,Major System Failure,PWDx_Street Light_Pending_Contractor (Internal),PWDx,,,4 Violet St  Mattapan  MA  02126,8.0,07,4.0,B3,Greater Mattapan,9.0,Ward 18,1802.0,R1,4 Violet St,2126.0,Address,140875.0,42.2737,-71.0901,Constituent Call,"(42.2737, -71.0901)"
477353,101001252195,01/22/2015 07:44:49 PM,01/26/2015 08:30:00 AM,03/06/2015 04:51:42 PM,OVERDUE,Closed,Case Closed Case Resolved,General Lighting Request///See Note,Public Works Department,Street Lights,Major System Failure,PWDx_Major System Failure,PWDx,,,716 Columbus Ave  Mission Hill  MA  02120,9.0,10B,7.0,D4,Roxbury,13.0,Ward 9,904.0,C,716 Columbus Ave,2120.0,Address,36070.0,42.3377,-71.0851,Constituent Call,"(42.3377, -71.0851)"
477768,101001252897,01/23/2015 07:28:03 PM,01/27/2015 08:30:00 AM,01/26/2015 02:59:10 PM,ONTIME,Closed,Case Closed Case Resolved CREW FROM SECOND SHIFT REPAIRED SHORT UNDERGROUND SYSTEM WORKING NORMAL J. BURNS / J.DUNN / K.BUCKLEY,Major System Failure///printed ///crew at scene 1/23/15,Public Works Department,Street Lights,Major System Failure,PWDx_Major System Failure,PWDx,,,280 Martin Luther King Jr Blvd  Roxbury  MA  02119,9.0,10B,7.0,B2,Roxbury,13.0,Ward 12,1205.0,E,280 Martin Luther King Jr Blvd,2119.0,Address,91766.0,42.3188,-71.0833,Constituent Call,"(42.3188, -71.0833)"
477778,101001252912,01/23/2015 08:42:09 PM,01/27/2015 08:30:00 AM,01/23/2015 08:50:48 PM,ONTIME,Closed,Case Closed Duplicate of Existing Case See CRM#1252897,Major System Failure,Public Works Department,Street Lights,Major System Failure,PWDx_Major System Failure,PWDx,,,280 Martin Luther King Jr Blvd  Roxbury  MA  02119,9.0,10B,7.0,B2,Roxbury,13.0,Ward 12,1205.0,E,280 Martin Luther King Jr Blvd,2119.0,Address,91766.0,42.3188,-71.0833,Constituent Call,"(42.3188, -71.0833)"
478086,101001253305,01/24/2015 05:26:04 PM,01/27/2015 08:30:00 AM,01/26/2015 10:52:49 AM,ONTIME,Closed,Case Closed Case Resolved CREW CHECKED CONTROL PANEL & RESET TIME CLOCK,Major System Failure  / PRINTED //,Public Works Department,Street Lights,Major System Failure,PWDx_Major System Failure,PWDx,,,INTERSECTION of Elmhurst St & Norfolk St  Dorchester  MA,8.0,07,4.0,B3,Dorchester,9.0,Ward 17,1708.0,,INTERSECTION Elmhurst St & Norfolk St,,Intersection,4545.0,42.2883,-71.0763,Constituent Call,"(42.2883, -71.0763)"
478098,101001253319,01/24/2015 06:37:59 PM,01/27/2015 08:30:00 AM,01/26/2015 10:57:00 AM,ONTIME,Closed,Case Closed Case Resolved CREW CHECKED OUT CONTROL PANEL FOUND ONE DEAD  N- STAR FEED INSTALLED JUMPER CABLE GOT LIGHTS WORKING,Major System Failure,Public Works Department,Street Lights,Major System Failure,PWDx_Major System Failure,PWDx,,,INTERSECTION of Batchelder St & Clifton St  Dorchester  MA,7.0,03,7.0,B2,Roxbury,13.0,Ward 8,805.0,,INTERSECTION Batchelder St & Clifton St,,Intersection,1006.0,42.3204,-71.0695,Constituent Call,"(42.3204, -71.0695)"
478277,101001253677,01/25/2015 05:41:46 PM,01/27/2015 08:30:00 AM,01/26/2015 12:53:00 PM,ONTIME,Closed,Case Closed Case Resolved CREW REPLACED CONTACTOR AND LOCATED AND REPAIRED DAMAGED CABLES UNDERGROUND,Major System Failure // PRINTED //,Public Works Department,Street Lights,Major System Failure,PWDx_Major System Failure,PWDx,,,INTERSECTION of Melville Ave & Upland Ave  Dorchester  MA,8.0,07,4.0,C11,Dorchester,8.0,Ward 17,1706.0,,INTERSECTION Melville Ave & Upland Ave,,Intersection,7242.0,42.2953,-71.0642,Constituent Call,"(42.2953, -71.0642)"
478457,101001254147,01/26/2015 11:12:00 AM,02/27/2015 11:12:00 AM,06/25/2015 01:39:42 PM,,Closed,Case Closed. Closed date : 2015-06-25 13:39:42.993 Case Noted The Major system failure has been resolved there are a few outages being addressed.,Major System Failure////suspended,Public Works Department,Street Lights,Major System Failure,PWDx_Street Light Outages - Long-Term Repair,PWDx,,,153-173 Kneeland St  Boston  MA  02111,4.0,1C,2.0,A1,Downtown / Financial District,4.0,Ward 3,308.0,I,153-173 Kneeland St,2111.0,Address,82306.0,42.3496,-71.0581,Constituent Call,"(42.3496, -71.0581)"
478458,101001254150,01/26/2015 11:13:23 AM,02/27/2015 11:13:00 AM,03/24/2015 10:03:56 AM,OVERDUE,Closed,Case Closed Case Resolved Lights are on at location.,Major System Failure////suspended,Public Works Department,Street Lights,Major System Failure,PWDx_Major System Failure,PWDx,,,49 Vallar Rd  East Boston  MA  02128,1.0,09,1.0,A7,East Boston,1.0,Ward 1,113.0,E,49 Vallar Rd,2128.0,Address,174556.0,42.393,-71.0092,Constituent Call,"(42.393, -71.0092)"
486720,101001265345,01/30/2015 06:20:40 PM,02/03/2015 08:30:00 AM,01/30/2015 09:17:29 PM,ONTIME,Closed,Case Closed Case Resolved See Note --- all lights working on one feed K Buckley V Mejias,Major System Failure///printed,Public Works Department,Street Lights,Major System Failure,PWDx_Major System Failure,PWDx,,,75 W Rutland Sq  Roxbury  MA  02118,4.0,1C,7.0,D4,Roxbury,6.0,4,404.0,,75 W Rutland Sq,2118.0,Address,342665.0,42.3594,-71.0587,Constituent Call,"(0, 0)"
486736,101001265365,01/30/2015 06:33:36 PM,02/03/2015 08:30:00 AM,01/30/2015 06:42:42 PM,ONTIME,Closed,Case Closed Duplicate of Existing Case,Major System Failure,Public Works Department,Street Lights,Major System Failure,PWDx_Major System Failure,PWDx,,,57 Rutland St  Roxbury  MA  02118,4.0,1C,2.0,D4,South End,6.0,Ward 9,901.0,R4,57 Rutland St,2118.0,Address,120200.0,42.3402,-71.0761,Constituent Call,"(42.3402, -71.0761)"
486739,101001265369,01/30/2015 06:36:26 PM,02/03/2015 08:30:00 AM,01/30/2015 06:42:56 PM,ONTIME,Closed,Case Closed Duplicate of Existing Case,Major System Failure,Public Works Department,Street Lights,Major System Failure,PWDx_Major System Failure,PWDx,,,53 Rutland Sq  Roxbury  MA  02118,4.0,1C,7.0,D4,South End,6.0,Ward 4,404.0,R3,53 Rutland Sq,2118.0,Address,120137.0,42.3424,-71.0785,Constituent Call,"(42.3424, -71.0785)"
486742,101001265372,01/30/2015 06:37:09 PM,02/03/2015 08:30:00 AM,01/30/2015 06:43:12 PM,ONTIME,Closed,Case Closed Duplicate of Existing Case,Major System Failure,Public Works Department,Street Lights,Major System Failure,PWDx_Major System Failure,PWDx,,,INTERSECTION of Rutland Sq & Tremont St  Roxbury  MA,4.0,1C,7.0,D4,South End,6.0,Ward 9,902.0,,INTERSECTION Rutland Sq & Tremont St,,Intersection,8228.0,42.3409,-71.0773,Constituent Call,"(42.3409, -71.0773)"
487378,101001266315,02/01/2015 01:05:58 AM,02/03/2015 08:30:00 AM,02/01/2015 01:40:26 PM,ONTIME,Closed,Case Closed Case Resolved isolated short circuit to one leg in contactor. returned 3/4 of lgihting system to operation. follow-up w/o issued,Major System Failure/////printed,Public Works Department,Street Lights,Major System Failure,PWDx_Major System Failure,PWDx,,,INTERSECTION of Hyde Park Ave & River St  Hyde Park  MA,12.0,08,5.0,E18,Hyde Park,10.0,Ward 18,1818.0,,INTERSECTION Hyde Park Ave & River St,,Intersection,6461.0,42.2558,-71.1241,Constituent Call,"(42.2558, -71.1241)"
488711,101001268141,02/02/2015 05:31:23 PM,02/04/2015 08:30:00 AM,02/02/2015 09:29:04 PM,ONTIME,Closed,Case Closed Case Resolved clock problem. left on constant. will return when construction site is open. jd/md,Major System Failure////printed,Public Works Department,Street Lights,Major System Failure,PWDx_Major System Failure,PWDx,,,88 Pembroke St  Roxbury  MA  02118,4.0,1C,2.0,D4,South End,6.0,Ward 4,403.0,CM,88 Pembroke St,2118.0,Address,109086.0,42.342,-71.0765,Constituent Call,"(42.342, -71.0765)"
497975,101001281778,02/07/2015 02:22:06 PM,02/10/2015 08:30:00 AM,02/10/2015 09:54:27 AM,OVERDUE,Closed,Case Closed Case Resolved ON CALL CREW CHECKED SYSTEM FAILURE RESET CIRCUIT BREAKER LIGHTS WORKING NOW P.LEDBETTER,Major System Failure // PRINTED //,Public Works Department,Street Lights,Major System Failure,PWDx_Major System Failure,PWDx,,,INTERSECTION of Columbia Rd & Wyola Pl  Dorchester  MA,7.0,03,4.0,C11,Roxbury,13.0,Ward 14,1401.0,,INTERSECTION Columbia Rd & Wyola Pl,,Intersection,3222.0,42.3082,-71.0751,Constituent Call,"(42.3082, -71.0751)"
498147,101001282073,02/07/2015 09:04:19 PM,02/10/2015 08:30:00 AM,02/10/2015 10:13:16 AM,OVERDUE,Closed,Case Closed Case Resolved ON CALL CREW CHECKED SYSTEM FAILURE FOUND ONE DEAD N-STAR FEED INSTALLED JUMPER CABLE GOT LIGHTS WORKING WILL HAVE N-STAR REPAIR FEED P.LEDDBETTER,Major System Failure //PRINTED //,Public Works Department,Street Lights,Major System Failure,PWDx_Major System Failure,PWDx,,,INTERSECTION of Blue Hill Ave & Esmond St  Dorchester  MA,7.0,03,4.0,B3,Greater Mattapan,8.0,Ward 14,1407.0,,INTERSECTION Blue Hill Ave & Esmond St,,Intersection,1554.0,42.2995,-71.0864,Constituent Call,"(42.2995, -71.0864)"
498633,101001282753,02/08/2015 08:23:00 PM,02/10/2015 08:30:00 AM,02/10/2015 09:50:16 AM,OVERDUE,Closed,Case Closed Case Resolved ON CALL CREW CHECKED OUT SYSTEM FAILURE PUT SYSTEM ON CONSTANT WILLRETURN TOO REPLACE TIME CLOCK LIGHTS ARE WORKING AT THIS TIME P.LEDBETTER,Major System Failure//PRINTED //,Public Works Department,Street Lights,Major System Failure,PWDx_Major System Failure,PWDx,,,INTERSECTION of Columbia Rd & Dudley St  Dorchester  MA,7.0,03,7.0,B2,Dorchester,13.0,Ward 7,710.0,,INTERSECTION Columbia Rd & Dudley St,,Intersection,3233.0,42.3171,-71.0652,Constituent Call,"(42.3171, -71.0652)"
503707,101001289666,02/11/2015 07:59:38 PM,02/13/2015 08:30:00 AM,02/11/2015 11:19:47 PM,ONTIME,Closed,Case Closed Case Referred to External Agency N-Star power outage in area --- homes as well as streets out --- Utility and police at scene,Major System Failure////printed,Public Works Department,Street Lights,Major System Failure,PWDx_Major System Failure,PWDx,,,40-42 Maverick St  East Boston  MA  02128,1.0,09,1.0,A7,East Boston,1.0,Ward 1,104.0,RC,40-42 Maverick St,2128.0,Address,93074.0,42.3714,-71.0414,Constituent Call,"(42.3714, -71.0414)"
506717,101001294205,02/13/2015 06:12:24 PM,02/18/2015 08:30:00 AM,02/13/2015 06:15:20 PM,ONTIME,Closed,Case Closed Duplicate of Existing Case See CRM#1292127,Major System Failure,Public Works Department,Street Lights,Major System Failure,PWDx_Major System Failure,PWDx,,,INTERSECTION of Columbia Rd & Stoughton St  Dorchester  MA,7.0,03,7.0,C11,Dorchester,13.0,Ward 7,710.0,,INTERSECTION Columbia Rd & Stoughton St,,Intersection,3234.0,42.317,-71.065,Constituent Call,"(42.317, -71.065)"
513254,101001302693,02/17/2015 07:59:55 PM,02/19/2015 08:30:00 AM,02/17/2015 10:02:11 PM,ONTIME,Closed,Case Closed Case Resolved No problem found K Buckley J Dunn,Major System Failure///printed,Public Works Department,Street Lights,Major System Failure,PWDx_Major System Failure,PWDx,,,55 Calumet St  Mission Hill  MA  02120,9.0,10A,8.0,B2,Mission Hill,14.0,Ward 10,1003.0,R3,55 Calumet St,2120.0,Address,24990.0,42.3321,-71.1053,Constituent Call,"(42.3321, -71.1053)"
516570,101001307602,02/19/2015 07:10:26 PM,02/23/2015 08:30:00 AM,03/03/2015 10:20:43 PM,OVERDUE,Closed,Case Closed Case Resolved system repaired by day crew,Major System Failure////printed,Public Works Department,Street Lights,Major System Failure,PWDx_Major System Failure,PWDx,,,INTERSECTION of Everett Ave & Sumner St  Dorchester  MA,7.0,03,3.0,C11,Dorchester,7.0,Ward 13,1306.0,,INTERSECTION Everett Ave & Sumner St,,Intersection,4690.0,42.316,-71.0627,Constituent Call,"(42.316, -71.0627)"
516711,101001307807,02/19/2015 10:37:53 PM,02/23/2015 08:30:00 AM,02/25/2015 01:15:37 PM,OVERDUE,Closed,Case Closed Case Resolved Lights placed on tie connection,Major System Failure    printed,Public Works Department,Street Lights,Major System Failure,PWDx_Major System Failure,PWDx,,,INTERSECTION of Causeway St & Portland St  Boston  MA,3.0,1B,1.0,A1,Downtown / Financial District,3.0,Ward 3,306.0,,INTERSECTION Causeway St & Portland St,,Intersection,2519.0,42.3648,-71.0623,Constituent Call,"(42.3648, -71.0623)"
517948,101001309562,02/20/2015 10:14:42 PM,02/24/2015 08:30:00 AM,02/20/2015 10:25:54 PM,ONTIME,Closed,Case Closed Case Resolved dug slcb from major snow bank. repaired center off switch. md/clif,Major System Failure,Public Works Department,Street Lights,Major System Failure,PWDx_Major System Failure,PWDx,,,INTERSECTION of Alban St & Talbot Ave  Dorchester  MA,8.0,07,3.0,C11,Dorchester,8.0,Ward 16,1603.0,,INTERSECTION Alban St & Talbot Ave,,Intersection,183.0,42.2891,-71.067,Constituent Call,"(42.2891, -71.067)"
519003,101001311211,02/22/2015 06:30:10 PM,02/24/2015 08:30:00 AM,02/24/2015 10:32:12 AM,OVERDUE,Closed,Case Closed Case Resolved ON CALL CREW CHECKED CONTROL SYSTEM FOUND SHORT IN PHOTO CONTROL REPAIRED SHORT & REPLACED GLASS FUSE J.MICHEL  K.HOGE  & T.HARVEY,Major System Failure   PRINTED,Public Works Department,Street Lights,Major System Failure,PWDx_Major System Failure,PWDx,,,INTERSECTION of Columbus Ave & Massachusetts Ave  Roxbury  MA,9.0,1C,7.0,D4,Roxbury,13.0,Ward 9,903.0,,INTERSECTION Columbus Ave & Massachusetts Ave,,Intersection,3292.0,42.3406,-71.0818,Constituent Call,"(42.3406, -71.0818)"
519413,101001311844,02/23/2015 09:42:17 AM,02/24/2015 09:42:17 AM,03/03/2015 02:41:09 PM,,Closed,Case Closed Case Resolved SEE CASE # 1292127,Major System Failure Printed,Public Works Department,Street Lights,Major System Failure,PWDx_Major System Failure,PWDx,,,7-11 Stoughton St  Dorchester  MA  02125,7.0,03,7.0,C11,Dorchester,13.0,Ward 13,1305.0,C,7-11 Stoughton St,2125.0,Address,131120.0,42.3167,-71.0649,Constituent Call,"(42.3167, -71.0649)"
520179,101001313003,02/23/2015 06:03:28 PM,02/25/2015 08:30:00 AM,02/24/2015 03:01:36 PM,ONTIME,Closed,Case Closed Case Resolved CREW CHECKED OUT CONTROL SYSTEM PUT SYSTEM ON CONSTANT TO SUPPLY POWER FOR B.P.D. CAMERAS J.FELDER / M.HAYNES,Major System Failure //PRINTED //,Public Works Department,Street Lights,Major System Failure,PWDx_Major System Failure,PWDx,,,264 Geneva Ave  Dorchester  MA  02121,7.0,03,4.0,C11,Dorchester,8.0,Ward 15,1502.0,R3,264 Geneva Ave,2121.0,Address,63286.0,42.3046,-71.0725,Constituent Call,"(42.3046, -71.0725)"
520286,101001313167,02/23/2015 09:26:57 PM,02/25/2015 08:30:00 AM,02/24/2015 03:35:26 PM,ONTIME,Closed,Case Closed Case Resolved EVENING SHIFT REPAIRED SYSTEM,Major System Failure // PRINTED //,Public Works Department,Street Lights,Major System Failure,PWDx_Major System Failure,PWDx,,,INTERSECTION of Centre St & Lagrange St  West Roxbury  MA,12.0,06,6.0,E5,West Roxbury,12.0,Ward 20,2005.0,,INTERSECTION Centre St & Lagrange St,,Intersection,2628.0,42.2807,-71.1582,Constituent Call,"(42.2807, -71.1582)"
520731,101001313838,02/24/2015 10:02:16 AM,02/25/2015 10:02:15 AM,02/24/2015 02:56:46 PM,ONTIME,Closed,Case Closed Case Resolved CREW CHECKED OUT CONTROL SYSTEM PUT SYSTEM ON CONSTANT FOR POWER SUPPLY TO B.P.D. CAMERAS,Major System Failure  // PRINTED //,Public Works Department,Street Lights,Major System Failure,PWDx_Major System Failure,PWDx,,,264 Geneva Ave  Dorchester  MA  02121,7.0,03,4.0,C11,Dorchester,8.0,Ward 15,1502.0,R3,264 Geneva Ave,2121.0,Address,63286.0,42.3046,-71.0725,Constituent Call,"(42.3046, -71.0725)"
521614,101001315066,02/24/2015 06:39:09 PM,02/26/2015 08:30:00 AM,02/24/2015 10:58:15 PM,ONTIME,Closed,Case Closed Case Resolved Board resecured inside cabinet --- all lights working M Drago V Mejias,Major System Failure///printed,Public Works Department,Street Lights,Major System Failure,PWDx_Major System Failure,PWDx,,,9 Holden St  Dorchester  MA  02125,7.0,03,7.0,B2,Dorchester,13.0,Ward 7,710.0,R4,9 Holden St,2125.0,Address,74581.0,42.319,-71.0643,Constituent Call,"(42.319, -71.0643)"
521684,101001315161,02/24/2015 09:08:54 PM,02/26/2015 08:30:00 AM,02/24/2015 09:14:21 PM,ONTIME,Closed,Case Closed Duplicate of Existing Case See CRM#1292127,Major System Failure,Public Works Department,Street Lights,Major System Failure,PWDx_Major System Failure,PWDx,,,15-21 Stoughton St  Dorchester  MA  02125,7.0,03,7.0,C11,Dorchester,13.0,Ward 13,1305.0,C,15-21 Stoughton St,2125.0,Address,131113.0,42.3167,-71.0647,Constituent Call,"(42.3167, -71.0647)"
522750,101001316696,02/25/2015 06:54:58 PM,02/27/2015 08:30:00 AM,02/25/2015 07:11:18 PM,ONTIME,Closed,Case Closed Duplicate of Existing Case See CRM#1292127,Major System Failure,Public Works Department,Street Lights,Major System Failure,PWDx_Major System Failure,PWDx,,,INTERSECTION of Columbia Rd & Stoughton St  Dorchester  MA,7.0,03,7.0,C11,Dorchester,13.0,Ward 7,710.0,,INTERSECTION Columbia Rd & Stoughton St,,Intersection,3234.0,42.317,-71.065,Constituent Call,"(42.317, -71.065)"
522753,101001316700,02/25/2015 07:00:33 PM,02/27/2015 08:30:00 AM,02/26/2015 10:32:04 PM,ONTIME,Closed,Case Closed Case Resolved system on constant. contactor needed.mxol/kb,Major System Failure///printed///See Note,Public Works Department,Street Lights,Major System Failure,PWDx_Major System Failure,PWDx,,,13-17 Oxford St  Boston  MA  02111,4.0,1C,2.0,A1,Downtown / Financial District,4.0,Ward 3,308.0,EA,13-17 Oxford St,2111.0,Address,106203.0,42.3519,-71.0606,Constituent Call,"(42.3519, -71.0606)"
522825,101001316805,02/25/2015 09:54:01 PM,02/27/2015 08:30:00 AM,02/25/2015 10:57:33 PM,ONTIME,Closed,Case Closed Case Resolved System placed on constant,Major System Failure///printed,Public Works Department,Street Lights,Major System Failure,PWDx_Major System Failure,PWDx,,,INTERSECTION of Bellevue St & Bird Pl  West Roxbury  MA,12.0,06,6.0,E5,West Roxbury,12.0,Ward 20,2012.0,,INTERSECTION Bellevue St & Bird Pl,,Intersection,1253.0,42.2837,-71.157,Constituent Call,"(42.2837, -71.157)"
523198,101001317337,02/26/2015 10:08:58 AM,02/27/2015 10:08:58 AM,03/02/2015 02:37:46 PM,OVERDUE,Closed,Case Closed Case Resolved INSTALLED NEW CONTACTOR 301L 204L 003L,Major System Failure     PRINTED,Public Works Department,Street Lights,Major System Failure,PWDx_Major System Failure,PWDx,,,166 Terrace St  Mission Hill  MA  02120,9.0,10A,8.0,B2,Mission Hill,14.0,Ward 10,1005.0,I,166 Terrace St,2120.0,Address,134513.0,42.3266,-71.0986,Constituent Call,"(42.3266, -71.0986)"
523627,101001317939,02/26/2015 02:20:07 PM,02/27/2015 02:20:06 PM,02/26/2015 10:28:39 PM,ONTIME,Closed,Case Closed Case Resolved replaced contactor. md/jd,Major System Failure     PRINTED,Public Works Department,Street Lights,Major System Failure,PWDx_Major System Failure,PWDx,,,INTERSECTION of N Washington St & Thacher St  Boston  MA,3.0,1B,1.0,A1,Downtown / Financial District,3.0,Ward 3,304.0,,INTERSECTION N Washington St & Thacher St,,Intersection,6130.0,42.3653,-71.0583,Constituent Call,"(42.3653, -71.0583)"
523877,101001318327,02/26/2015 05:53:32 PM,03/02/2015 08:30:00 AM,02/26/2015 10:27:38 PM,ONTIME,Closed,Case Closed Case Resolved system on constant. contactor needed. kb/mxol,Major System Failure////printed,Public Works Department,Street Lights,Major System Failure,PWDx_Major System Failure,PWDx,,,INTERSECTION of Braddock Park & Pembroke St  Boston  MA,4.0,1C,2.0,D4,South End,6.0,Ward 4,403.0,,INTERSECTION Braddock Park & Pembroke St,,Intersection,1812.0,42.3437,-71.0779,Constituent Call,"(42.3437, -71.0779)"
523896,101001318354,02/26/2015 06:14:22 PM,03/02/2015 08:30:00 AM,02/26/2015 10:26:09 PM,ONTIME,Closed,Case Closed Case Resolved system on constant. contactor needed. mxol/kb,Major System Failure////printed,Public Works Department,Street Lights,Major System Failure,PWDx_Major System Failure,PWDx,,,117 Warren Ave  Boston  MA  02116,4.0,1C,2.0,D4,South End,6.0,Ward 4,401.0,R1,117 Warren Ave,2116.0,Address,142883.0,42.3446,-71.0741,Constituent Call,"(42.3446, -71.0741)"
523915,101001318380,02/26/2015 06:37:28 PM,03/02/2015 08:30:00 AM,03/03/2015 02:49:42 PM,,Closed,Case Closed Case Resolved SEE CASE # 1292127,Major System Failure////printed,Public Works Department,Street Lights,Major System Failure,PWDx_Major System Failure,PWDx,,,INTERSECTION of Everett Ave & Sumner St  Dorchester  MA,7.0,03,3.0,C11,Dorchester,7.0,Ward 13,1306.0,,INTERSECTION Everett Ave & Sumner St,,Intersection,4690.0,42.316,-71.0627,Constituent Call,"(42.316, -71.0627)"
523934,101001318402,02/26/2015 06:58:29 PM,03/12/2015 08:30:00 AM,03/12/2015 11:40:25 AM,OVERDUE,Closed,Case Closed Case Resolved This light was repaired on 2/27/15 per Contractor,outage/LAMP #N0964010  Lithgow St/sent,Public Works Department,Street Lights,Major System Failure,PWDx_Street Light_Pending_Contractor (Internal),PWDx,,,33 Lithgow St  Dorchester  MA  02124,8.0,07,4.0,C11,Dorchester,8.0,Ward 17,1706.0,R3,33 Lithgow St,2124.0,Address,86758.0,42.2897,-71.0698,Constituent Call,"(42.2897, -71.0698)"
524744,101001319596,02/27/2015 05:49:00 PM,03/03/2015 08:30:00 AM,02/27/2015 10:47:34 PM,ONTIME,Closed,Case Closed Case Resolved located neutral/short circuit in control pole. need to return when the street is accessible to work on pole.,Major System Failure////printed,Public Works Department,Street Lights,Major System Failure,PWDx_Major System Failure,PWDx,,,18-20 Oxford St  Boston  MA  02111,4.0,1C,2.0,A1,Downtown / Financial District,4.0,Ward 3,308.0,C,18-20 Oxford St,2111.0,Address,106206.0,42.3519,-71.0603,Constituent Call,"(42.3519, -71.0603)"
524756,101001319617,02/27/2015 06:09:00 PM,03/03/2015 08:30:00 AM,03/02/2015 02:26:45 PM,ONTIME,Closed,Case Closed Case Resolved NP PROBLEM FOUND AT THIS LOCATION 003L,Major System Failure////printed,Public Works Department,Street Lights,Major System Failure,PWDx_Major System Failure,PWDx,,,1283 Hyde Park Ave  Hyde Park  MA  02136,12.0,08,5.0,E18,Hyde Park,10.0,Ward 18,1818.0,RC,1283 Hyde Park Ave,2136.0,Address,77095.0,42.2552,-71.1245,Constituent Call,"(42.2552, -71.1245)"
524787,101001319672,02/27/2015 06:47:38 PM,03/03/2015 08:30:00 AM,02/27/2015 10:45:44 PM,ONTIME,Closed,Case Closed Case Resolved system on constant. could not locate pull boxes. joubert/kb,Major System Failure////printed,Public Works Department,Street Lights,Major System Failure,PWDx_Major System Failure,PWDx,,,INTERSECTION of Bowdoin St & Cedar Ave  Dorchester  MA,7.0,03,4.0,C11,Dorchester,8.0,Ward 15,1505.0,,INTERSECTION Bowdoin St & Cedar Ave,,Intersection,1728.0,42.3034,-71.0715,Constituent Call,"(42.3034, -71.0715)"
524799,101001319696,02/27/2015 07:13:07 PM,03/03/2015 08:30:00 AM,03/03/2015 02:46:23 PM,,Closed,Case Closed Case Resolved SEE CASE # 1292127,Major System Failure////printed,Public Works Department,Street Lights,Major System Failure,PWDx_Major System Failure,PWDx,,,91 Stoughton St  Dorchester  MA  02125,7.0,03,3.0,C11,Dorchester,7.0,Ward 13,1306.0,A,91 Stoughton St,2125.0,Address,314730.0,42.3156,-71.0622,Constituent Call,"(42.3156, -71.0622)"
524811,101001319716,02/27/2015 07:55:33 PM,03/03/2015 08:30:00 AM,02/27/2015 10:43:28 PM,ONTIME,Closed,Case Closed Case Resolved put on constant. could not locate pull boxes. joubert/kb,Major System Failure////printed,Public Works Department,Street Lights,Major System Failure,PWDx_Major System Failure,PWDx,,,252 Geneva Ave  Dorchester  MA  02121,7.0,03,4.0,C11,Dorchester,8.0,Ward 15,1502.0,R3,252 Geneva Ave,2121.0,Address,63281.0,42.3048,-71.073,Constituent Call,"(42.3048, -71.073)"
525008,101001320032,02/28/2015 01:02:58 PM,03/03/2015 08:30:00 AM,03/03/2015 02:42:25 PM,OVERDUE,Closed,Case Closed Case Resolved SEE CASE # 129127,Major System Failure         PRINTED,Public Works Department,Street Lights,Major System Failure,PWDx_Major System Failure,PWDx,,,37 Stoughton St  Dorchester  MA  02125,7.0,03,7.0,C11,Dorchester,13.0,Ward 13,1305.0,E,37 Stoughton St,2125.0,Address,155774.0,42.3163,-71.0641,Constituent Call,"(42.3163, -71.0641)"
525345,101001320622,03/01/2015 02:59:14 PM,03/03/2015 08:30:00 AM,03/02/2015 02:39:57 PM,ONTIME,Closed,Case Closed Case Noted PARTIAL NEED TO GO BACK  TRACKED SHORT TO PB 30 301L 901L 003L,Major System Failure  PRINTED,Public Works Department,Street Lights,Major System Failure,PWDx_Major System Failure,PWDx,,,INTERSECTION of Dana Ave & Hyde Park Ave  Hyde Park  MA,12.0,08,5.0,E18,Hyde Park,10.0,Ward 18,1818.0,,INTERSECTION Dana Ave & Hyde Park Ave,,Intersection,3870.0,42.254,-71.1244,Constituent Call,"(42.254, -71.1244)"
525441,101001320776,03/02/2015 01:42:05 AM,03/03/2015 08:30:00 AM,03/02/2015 02:23:51 PM,ONTIME,Closed,Case Closed Case Resolved NO PROBLEM FOUND AT THIS LOCATION 003L,Major System Failure // PRINTED //,Public Works Department,Street Lights,Major System Failure,PWDx_Major System Failure,PWDx,,,INTERSECTION of Canterbury St & Hyde Park Ave  Roslindale  MA,12.0,08,5.0,E18,Roslindale,10.0,Ward 18,1808.0,,INTERSECTION Canterbury St & Hyde Park Ave,,Intersection,2410.0,42.2786,-71.1192,Constituent Call,"(42.2786, -71.1192)"
526254,101001321903,03/02/2015 06:15:19 PM,03/04/2015 08:30:00 AM,03/05/2015 12:39:28 PM,OVERDUE,Closed,Case Closed Case Resolved Reconnected  span lights are on. Contr Mark 3/4/15,Major System Failure/LAMP #N0162036  Bay St/sent,Public Works Department,Street Lights,Major System Failure,PWDx_Street Light_Pending_Contractor (Internal),PWDx,,,2 Bay St  Dorchester  MA  02125,7.0,03,3.0,C11,Dorchester,8.0,15,1506.0,E,2 Bay St,2125.0,Address,8899.0,42.3114,-71.0571,Constituent Call,"(42.3114, -71.0571)"
526276,101001321932,03/02/2015 06:59:43 PM,03/04/2015 08:30:00 AM,03/03/2015 10:13:51 PM,ONTIME,Closed,Case Closed Case Resolved replaced blown 100 amp fuse. replaced both contactors. kb/vm,Major System Failure////printed,Public Works Department,Street Lights,Major System Failure,PWDx_Major System Failure,PWDx,,,INTERSECTION of Asticou Rd & Washington St  Jamaica Plain  MA,12.0,02,6.0,E13,Jamaica Plain,11.0,Ward 19,1902.0,,INTERSECTION Asticou Rd & Washington St,,Intersection,689.0,42.3005,-71.1147,Constituent Call,"(42.3005, -71.1147)"
526279,101001321935,03/02/2015 07:03:02 PM,03/04/2015 08:30:00 AM,03/03/2015 02:43:40 PM,ONTIME,Closed,Case Closed Case Resolved SEE CASE # 1292127,Major System Failure/suspende,Public Works Department,Street Lights,Major System Failure,PWDx_Major System Failure,PWDx,,,63-71 Stoughton St  Dorchester  MA  02125,7.0,03,7.0,C11,Dorchester,13.0,Ward 13,1305.0,RL,63-71 Stoughton St,2125.0,Address,131119.0,42.316,-71.063,Constituent Call,"(42.316, -71.063)"
526281,101001321937,03/02/2015 07:05:38 PM,03/04/2015 08:30:00 AM,03/03/2015 10:11:53 PM,ONTIME,Closed,Case Closed Case Resolved shoveled slcb out. replaced contactor contactor. kb/vm,Major System Failure////printed,Public Works Department,Street Lights,Major System Failure,PWDx_Major System Failure,PWDx,,,INTERSECTION of Cemetery Rd & Jewish War Veterans Dr  Jamaica Plain  MA,9.0,02,7.0,B2,Greater Mattapan,13.0,Ward 12,1207.0,,INTERSECTION Cemetery Rd & Jewish War Veterans Dr,,Intersection,2583.0,42.3012,-71.1046,Constituent Call,"(42.3012, -71.1046)"
526304,101001321965,03/02/2015 07:51:15 PM,03/04/2015 08:30:00 AM,03/03/2015 02:48:00 PM,ONTIME,Closed,Case Closed Case Resolved SEE CASE # 1292127,Major System Failure/suspend,Public Works Department,Street Lights,Major System Failure,PWDx_Major System Failure,PWDx,,,INTERSECTION of Pleasant St & Stoughton St  Dorchester  MA,7.0,03,3.0,C11,Dorchester,7.0,Ward 13,1309.0,,INTERSECTION Pleasant St & Stoughton St,,Intersection,7907.0,42.3146,-71.06,Constituent Call,"(42.3146, -71.06)"
526311,101001321973,03/02/2015 08:15:57 PM,03/04/2015 08:30:00 AM,03/03/2015 10:14:38 PM,ONTIME,Closed,Case Closed Case Resolved replaced circuit breakers. kb/vm,Street Light Outages///printed,Public Works Department,Street Lights,Major System Failure,PWDx_Major System Failure,PWDx,,,1688 Washington St  Roxbury  MA  02118,4.0,1C,2.0,D4,South End,6.0,Ward 8,802.0,CM,1688 Washington St,2118.0,Address,144343.0,42.337,-71.0757,Employee Generated,"(42.337, -71.0757)"
526319,101001321984,03/02/2015 08:55:45 PM,03/04/2015 08:30:00 AM,03/02/2015 10:53:15 PM,ONTIME,Closed,Case Closed Case Resolved Wasa N-Star disruption --- all lights lit when power reestablished,Major System Failure///printed,Public Works Department,Street Lights,Major System Failure,PWDx_Major System Failure,PWDx,,,338 Main St  Charlestown  MA  02129,3.0,1A,1.0,A15,Charlestown,2.0,Ward 2,206.0,RC,338 Main St,2129.0,Address,267398.0,42.3787,-71.0686,Employee Generated,"(42.3787, -71.0686)"
527099,101001323239,03/04/2015 01:15:37 AM,03/05/2015 08:30:00 AM,03/04/2015 01:30:46 AM,ONTIME,Closed,Case Closed Case Resolved Tracked Problem To Broken #4 Cables In P.B.  Respliced,Major System Failure,Public Works Department,Street Lights,Major System Failure,PWDx_Major System Failure,PWDx,,,0 Boylston St  Boston  MA  02108,3.0,1C,8.0,A1,Beacon Hill,14.0,Ward 5,503.0,E,0 Boylston St,2108.0,Address,17935.0,42.3533,-71.0646,Employee Generated,"(42.3533, -71.0646)"
527818,101001324286,03/04/2015 06:07:35 PM,03/06/2015 08:30:00 AM,03/04/2015 10:11:04 PM,ONTIME,Closed,Case Closed Case Resolved clock misprogrammed. new w/o issued for circuit repair. vm/kb,Major System Failure////printed,Public Works Department,Street Lights,Major System Failure,PWDx_Major System Failure,PWDx,,,INTERSECTION of Blue Hill Ave & Schuyler St  Dorchester  MA,9.0,03,7.0,B2,Roxbury,13.0,Ward 12,1207.0,,INTERSECTION Blue Hill Ave & Schuyler St,,Intersection,1567.0,42.3076,-71.0839,Constituent Call,"(42.3076, -71.0839)"
527856,101001324346,03/04/2015 07:41:04 PM,03/06/2015 08:30:00 AM,03/05/2015 10:06:06 PM,ONTIME,Closed,Case Closed Case Resolved replaced contactor and glass fuse. drago and oleary,Major System Failure///printed,Public Works Department,Street Lights,Major System Failure,PWDx_Major System Failure,PWDx,,,37 Union St  Boston  MA  02108,3.0,1B,1.0,A1,Downtown / Financial District,3.0,Ward 3,306.0,C,37 Union St,2108.0,Address,139292.0,42.3612,-71.0569,Constituent Call,"(42.3612, -71.0569)"
528452,101001325245,03/05/2015 03:12:40 PM,03/06/2015 03:12:40 PM,03/11/2015 12:43:47 PM,OVERDUE,Closed,Case Closed Case Resolved Job completed 3/5/15 per Anton,Major System Failure/LAMP #N2725007  41 Vallar Rd/sent,Public Works Department,Street Lights,Major System Failure,PWDx_Street Light_Pending_Contractor (Internal),PWDx,,,49 Vallar Rd  East Boston  MA  02128,1.0,09,1.0,A7,East Boston,1.0,Ward 1,113.0,E,49 Vallar Rd,2128.0,Address,174556.0,42.393,-71.0092,Constituent Call,"(42.393, -71.0092)"
528648,101001325535,03/05/2015 10:03:41 PM,03/09/2015 08:30:00 AM,03/05/2015 11:14:50 PM,ONTIME,Closed,Case Closed Case Resolved circuit problem left on constant. mark and bill,Major System Failure////printed,Public Works Department,Street Lights,Major System Failure,PWDx_Major System Failure,PWDx,,,0 Pembroke St  Roxbury  MA  02118,4.0,1C,2.0,D4,South End,6.0,Ward 9,901.0,EA,0 Pembroke St,2118.0,Address,108975.0,42.341,-71.0748,Employee Generated,"(42.341, -71.0748)"
529293,101001326533,03/06/2015 10:27:50 PM,03/10/2015 08:30:00 AM,03/09/2015 09:08:02 PM,ONTIME,Closed,Case Closed Case Resolved left on constant. clock to be installed.,Major System Failure///printed,Public Works Department,Street Lights,Major System Failure,PWDx_Major System Failure,PWDx,,,INTERSECTION of Commonwealth Ave & Exeter St  Boston  MA,4.0,1C,8.0,D4,Back Bay,14.0,Ward 5,507.0,,INTERSECTION Commonwealth Ave & Exeter St,,Intersection,3396.0,42.3511,-71.0803,Constituent Call,"(42.3511, -71.0803)"
529507,101001326875,03/07/2015 06:49:39 PM,03/10/2015 08:30:00 AM,03/10/2015 06:26:23 AM,ONTIME,Closed,Case Closed Case Resolved REPLACED GLASS FUSE HOLDER & CONTACTOR 301L,Major System Failure               PRINTED,Public Works Department,Street Lights,Major System Failure,PWDx_Major System Failure,PWDx,,,22 Sheridan St  Jamaica Plain  MA  02130,9.0,02,6.0,E13,Jamaica Plain,11.0,Ward 19,1901.0,CD,22 Sheridan St,2130.0,Address,126813.0,42.3216,-71.1083,Constituent Call,"(42.3216, -71.1083)"
529514,101001326890,03/07/2015 07:15:19 PM,03/10/2015 08:30:00 AM,03/09/2015 01:17:12 PM,ONTIME,Closed,Case Closed Case Resolved Lights out due to steam leak causing issue with Controller.  Lights placed on constant until steam issue resolved.,Major System Failure     PRINTED,Public Works Department,Street Lights,Major System Failure,PWDx_Major System Failure,PWDx,,,INTERSECTION of Marshall St & Union St  Boston  MA,3.0,1B,1.0,A1,Downtown / Financial District,3.0,Ward 3,306.0,,INTERSECTION Marshall St & Union St,,Intersection,7110.0,42.3613,-71.0571,Constituent Call,"(42.3613, -71.0571)"
529700,101001327216,03/08/2015 07:18:01 PM,03/10/2015 08:30:00 AM,03/09/2015 08:48:32 AM,ONTIME,Closed,Case Closed Case Resolved on-call checked out and repaired,Major System Failure    PRINTED,Public Works Department,Street Lights,Major System Failure,PWDx_Major System Failure,PWDx,,,INTERSECTION of Marshall St & Union St  Boston  MA,3.0,1B,1.0,A1,Downtown / Financial District,3.0,Ward 3,306.0,,INTERSECTION Marshall St & Union St,,Intersection,7110.0,42.3613,-71.0571,Constituent Call,"(42.3613, -71.0571)"
529853,101001327468,03/09/2015 09:07:21 AM,03/10/2015 09:07:21 AM,03/12/2015 11:42:34 AM,OVERDUE,Closed,Case Closed Case Resolved This Light was repaired on 3/9/15 per contractor,Major System Failure       sent to maverick,Public Works Department,Street Lights,Major System Failure,PWDx_Street Light_Pending_Contractor (Internal),PWDx,,,50 Corona St  Dorchester  MA  02124,7.0,03,4.0,C11,Dorchester,8.0,Ward 15,1505.0,R3,50 Corona St,2124.0,Address,43171.0,42.3014,-71.0697,Constituent Call,"(42.3014, -71.0697)"
530296,101001328155,03/09/2015 04:03:57 PM,03/10/2015 04:03:57 PM,03/09/2015 09:26:08 PM,ONTIME,Closed,Case Closed Case Resolved All lights working upon arrival M Drago B Keane,Major System Failure///printed,Public Works Department,Street Lights,Major System Failure,PWDx_Major System Failure,PWDx,,,INTERSECTION of Bird St & Columbia Rd  Dorchester  MA,7.0,03,3.0,B2,Dorchester,8.0,Ward 15,1501.0,,INTERSECTION Bird St & Columbia Rd,,Intersection,1453.0,42.3146,-71.0674,Constituent Call,"(42.3146, -71.0674)"
530428,101001328349,03/09/2015 07:35:55 PM,03/11/2015 08:30:00 AM,03/11/2015 11:02:33 PM,OVERDUE,Closed,Case Closed Case Resolved located bad cable in control circuit. repaired. vm/conary,Major System Failure////printed,Public Works Department,Street Lights,Major System Failure,PWDx_Major System Failure,PWDx,,,493 Blue Hill Ave  Dorchester  MA  02121,9.0,10B,7.0,B2,Roxbury,13.0,Ward 12,1207.0,C,493 Blue Hill Ave,2121.0,Address,189946.0,42.3083,-71.0837,Constituent Call,"(42.3083, -71.0837)"
530779,101001328880,03/10/2015 11:19:36 AM,03/11/2015 11:19:36 AM,03/10/2015 02:52:12 PM,ONTIME,Closed,Case Closed Case Resolved RESET 100 AMP BREAKERS      CHECKED FOR STRAY VOLTAGE   FELDER  /  HAYES,Major System Failure    PRINTED,Public Works Department,Street Lights,Major System Failure,PWDx_Major System Failure,PWDx,,,34 Harrison Ave  Boston  MA  02111,4.0,1C,2.0,A1,Downtown / Financial District,4.0,Ward 3,308.0,RC,34 Harrison Ave,2111.0,Address,69827.0,42.3518,-71.061,Constituent Call,"(42.3518, -71.061)"
531260,101001329615,03/10/2015 09:21:32 PM,03/12/2015 08:30:00 AM,03/10/2015 10:16:36 PM,ONTIME,Closed,Case Closed Case Resolved reset tripped breaker in slcb all lights working,Major System Failure////printed,Public Works Department,Street Lights,Major System Failure,PWDx_Major System Failure,PWDx,,https://cityworker.cityofboston.gov:8443/attachments/report/54ff98a4d052a8008ccee41c/closed_photo/Report.jpg,INTERSECTION of Brent St & Washington St  Dorchester  MA,8.0,07,4.0,C11,Dorchester,8.0,Ward 17,1706.0,,INTERSECTION Brent St & Washington St,,Intersection,1920.0,42.2888,-71.0711,Constituent Call,"(42.2888, -71.0711)"
532465,101001331400,03/12/2015 12:41:57 PM,03/13/2015 12:39:00 PM,03/12/2015 12:42:30 PM,ONTIME,Closed,Case Closed Case Invalid,Major System Failure,Public Works Department,Street Lights,Major System Failure,PWDx_Major System Failure,PWDx,,,INTERSECTION of Causeway St & Staniford St  Boston  MA,3.0,1B,8.0,A1,Back Bay,3.0,Ward 3,305.0,,INTERSECTION Causeway St & Staniford St,,Intersection,2516.0,42.364,-71.0634,Employee Generated,"(42.364, -71.0634)"
532473,101001331408,03/12/2015 12:43:17 PM,03/13/2015 12:42:00 PM,03/12/2015 01:21:38 PM,ONTIME,Closed,Case Closed Case Resolved RESET CLOCK 003L,Major System Failure//printed,Public Works Department,Street Lights,Major System Failure,PWDx_Major System Failure,PWDx,,,INTERSECTION of Causeway St & Staniford St  Boston  MA,3.0,1B,8.0,A1,Back Bay,3.0,Ward 3,305.0,,INTERSECTION Causeway St & Staniford St,,Intersection,2516.0,42.364,-71.0634,Employee Generated,"(42.364, -71.0634)"
532480,101001331416,03/12/2015 12:46:59 PM,03/13/2015 12:45:00 PM,03/12/2015 01:20:55 PM,ONTIME,Closed,Case Closed Case Resolved RESET PHOTO CELL 003L,Major System Failure    PRINTED,Public Works Department,Street Lights,Major System Failure,PWDx_Major System Failure,PWDx,,,INTERSECTION of Causeway St & Friend St  Boston  MA,3.0,1B,1.0,A1,Downtown / Financial District,3.0,Ward 3,306.0,,INTERSECTION Causeway St & Friend St,,Intersection,2520.0,42.3651,-71.0618,Employee Generated,"(42.3651, -71.0618)"
532753,101001331865,03/12/2015 10:46:56 PM,03/16/2015 08:30:00 AM,03/14/2015 04:18:43 AM,ONTIME,Closed,Case Closed Case Resolved Shoveled Out Sidewalk  Broke Out Frozen P.B.  Found Broken #4 Cables  Respliced. System Ok,Major System Failure////printed,Public Works Department,Street Lights,Major System Failure,PWDx_Major System Failure,PWDx,,,INTERSECTION of Belmont St & Bunker Hill St  Charlestown  MA,3.0,1A,1.0,A15,Charlestown,2.0,Ward 2,205.0,,INTERSECTION Belmont St & Bunker Hill St,,Intersection,1279.0,42.3806,-71.0659,Constituent Call,"(42.3806, -71.0659)"
533499,101001332814,03/13/2015 03:23:33 PM,03/16/2015 03:23:33 PM,03/13/2015 10:41:44 PM,ONTIME,Closed,Case Closed Case Resolved tracked short circuit in street.  tracked short circuit in slcb. md/jd,Major System Failure////printed,Public Works Department,Street Lights,Major System Failure,PWDx_Major System Failure,PWDx,,,46 Tonawanda St  Dorchester  MA  02124,7.0,03,4.0,C11,Dorchester,8.0,Ward 17,1702.0,R2,46 Tonawanda St,2124.0,Address,136179.0,42.2986,-71.0669,Constituent Call,"(42.2986, -71.0669)"
533533,101001332877,03/13/2015 04:42:39 PM,03/16/2015 04:42:39 PM,03/20/2015 09:50:05 AM,OVERDUE,Closed,Case Closed Case Resolved Contractor RAN SPAN TO POWER UP LIGHTS  LIGHTS ARE ON 3/19/15 .,Major System Failure/LAMP #N014558  70 Grayfield Ave/sent,Public Works Department,Street Lights,Major System Failure,PWDx_Street Light_Pending_Contractor (Internal),PWDx,,,69 Grayfield Ave  West Roxbury  MA  02132,12.0,06,6.0,E5,West Roxbury,12.0,Ward 20,2012.0,R1,69 Grayfield Ave,2132.0,Address,66117.0,42.2888,-71.1619,Constituent Call,"(42.2888, -71.1619)"
533581,101001332962,03/13/2015 07:23:44 PM,03/17/2015 08:30:00 AM,03/13/2015 10:18:40 PM,ONTIME,Closed,Case Closed Case Resolved slcb back online. clif,Major System Failure////printed,Public Works Department,Street Lights,Major System Failure,PWDx_Major System Failure,PWDx,,,100 White St  East Boston  MA  02128,1.0,09,1.0,A7,East Boston,1.0,01,109.0,R1,100 White St,2128.0,Address,149205.0,42.3807,-71.0332,Constituent Call,"(42.3807, -71.0332)"
533689,101001333139,03/14/2015 12:49:34 PM,03/17/2015 08:30:00 AM,03/20/2015 10:28:19 AM,OVERDUE,Closed,Case Closed Case Resolved Ran span to power up lights are on 3/19/15,Major System Failure/LAMP #N014564  52 Grayfield Ave/sent,Public Works Department,Street Lights,Major System Failure,PWDx_Street Light_Pending_Contractor (Internal),PWDx,,,25 Grayfield Ave  West Roxbury  MA  02132,12.0,06,6.0,E5,West Roxbury,12.0,Ward 20,2012.0,R1,25 Grayfield Ave,2132.0,Address,66106.0,42.2897,-71.1607,Constituent Call,"(42.2897, -71.1607)"
533950,101001333570,03/15/2015 08:02:07 PM,03/17/2015 08:30:00 AM,03/16/2015 01:52:36 PM,ONTIME,Closed,Case Closed Case Resolved CHECKED SLCB AND PHOTO CONTROL ALL LIGHTS WORKING OK 301L 003L,Major System Failure   PRINTED,Public Works Department,Street Lights,Major System Failure,PWDx_Major System Failure,PWDx,,,41 Union St  Boston  MA  02108,3.0,1B,1.0,A1,Boston,3.0,03,306.0,C,41 Union St,2108.0,Address,139293.0,42.3613,-71.0569,Constituent Call,"(42.3613, -71.0569)"
534542,101001334435,03/16/2015 07:56:02 PM,03/18/2015 08:30:00 AM,06/12/2015 04:09:56 PM,OVERDUE,Closed,Case Closed. Closed date : 2015-06-12 16:09:56.54 Case Resolved,Major System Failure,Public Works Department,Street Lights,Major System Failure,INFO01_GenericeFormforOtherServiceRequestTypes,INFO,,,INTERSECTION of Columbia Rd & L St  South Boston  MA,6.0,05,2.0,C6,South Boston / South Boston Waterfront,5.0,Ward 7,701.0,,INTERSECTION Columbia Rd & L St,,Intersection,3263.0,42.3295,-71.0352,Constituent Call,"(42.3295, -71.0352)"
534570,101001334481,03/16/2015 10:40:00 PM,05/31/2015 08:30:00 AM,05/29/2015 07:47:11 AM,ONTIME,Closed,Case Closed. Closed date : 2015-05-29 07:47:11.887 Case Resolved Took down Colonial post. Blew out conduit that was full of debris. Snaked conduit and pulled all new #10 triplex cable from pull box to fixture. re-spliced and insulated cables as needed and checked out unit.  G McCarthy/ J Felder/ W Santry/ H Tyra  E Podgurski 5-28-15,Street Light outage/printed for jim k,Public Works Department,Street Lights,Major System Failure,PWDx_Street Light Outages,PWDx,,,20 Dartmouth Pl  Boston  MA  02116,4.0,1C,2.0,D4,South End,6.0,Ward 4,401.0,R3,20 Dartmouth Pl,2116.0,Address,46284.0,42.3451,-71.0731,Constituent Call,"(42.3451, -71.0731)"
535378,101001335591,03/17/2015 10:49:52 PM,03/19/2015 08:30:00 AM,03/23/2015 12:06:36 PM,OVERDUE,Closed,Case Closed Case Resolved,Major System Failure/printed for 3rd,Public Works Department,Street Lights,Major System Failure,PWDx_Major System Failure,PWDx,,,150 Staniford St  Boston  MA  02114,3.0,1B,8.0,A1,Back Bay,3.0,03,,,150 Staniford St,2114.0,Address,347193.0,42.3594,-71.0587,Constituent Call,"(0, 0)"
535759,101001336055,03/18/2015 10:07:31 AM,03/19/2015 10:07:31 AM,03/23/2015 12:05:33 PM,OVERDUE,Closed,Case Closed Case Resolved Lights refed overhead - now operational,Major System Failure  SENT TO MAVERICK,Public Works Department,Street Lights,Major System Failure,PWDx_Street Light_Pending_Contractor (Internal),PWDx,,,52 Grayfield Ave  West Roxbury  MA  02132,12.0,06,6.0,E5,West Roxbury,12.0,Ward 20,2012.0,R1,52 Grayfield Ave,2132.0,Address,66112.0,42.289,-71.1607,Constituent Call,"(42.289, -71.1607)"
535999,101001336379,03/18/2015 01:36:44 PM,03/19/2015 01:34:00 PM,03/18/2015 03:11:46 PM,ONTIME,Closed,Case Closed Case Resolved reset time clock     D. PRIOLAEU,Major System Failure   PRINTED,Public Works Department,Street Lights,Major System Failure,PWDx_Major System Failure,PWDx,,,1999 Centre St  West Roxbury  MA  02132,12.0,06,6.0,E5,West Roxbury,12.0,20,2005.0,,1999 Centre St,2132.0,Address,352652.0,42.3594,-71.0587,Maximo Integration,"(0, 0)"
536272,101001336738,03/18/2015 08:42:45 PM,03/20/2015 08:30:00 AM,03/18/2015 11:16:35 PM,ONTIME,Closed,Case Closed Case Resolved reset clock. victor/mchugh,Major System Failure////printed,Public Works Department,Street Lights,Major System Failure,PWDx_Major System Failure,PWDx,,,424 W Broadway  South Boston  MA  02127,6.0,05,2.0,C6,South Boston / South Boston Waterfront,5.0,Ward 6,604.0,E,424 W Broadway,2127.0,Address,158019.0,42.3367,-71.0472,Constituent Call,"(42.3367, -71.0472)"
536288,101001336754,03/18/2015 09:27:04 PM,03/20/2015 08:30:00 AM,03/23/2015 12:03:16 PM,OVERDUE,Closed,Case Closed Case Resolved,Major System Failure/LAMP #N014562  46 Grayfield Ave/sent,Public Works Department,Street Lights,Major System Failure,PWDx_Street Light_Pending_Contractor (Internal),PWDx,,,58 Grayfield Ave  West Roxbury  MA  02132,12.0,06,6.0,E5,West Roxbury,12.0,Ward 20,2012.0,R1,58 Grayfield Ave,2132.0,Address,66114.0,42.2889,-71.1609,Constituent Call,"(42.2889, -71.1609)"
536300,101001336768,03/18/2015 10:03:51 PM,03/20/2015 08:30:00 AM,03/18/2015 11:08:18 PM,ONTIME,Closed,Case Closed Case Resolved No problem found B Keane,Major System Failure/printed for 3rd,Public Works Department,Street Lights,Major System Failure,PWDx_Major System Failure,PWDx,,,50 Appleton St  Boston  MA  02116,4.0,1C,2.0,D4,South End,6.0,Ward 5,501.0,R4,50 Appleton St,2116.0,Address,4063.0,42.3457,-71.0721,Constituent Call,"(42.3457, -71.0721)"
536568,101001337135,03/19/2015 10:00:09 AM,04/03/2015 10:00:00 AM,03/31/2015 11:06:24 PM,ONTIME,Closed,Case Closed Case Resolved one outage located and new work order issued. not a major system failure,Street Light outages/////printed,Public Works Department,Street Lights,Major System Failure,PWDx_Major System Failure,PWDx,,,INTERSECTION of Belvidere St & Massachusetts Ave  Boston  MA,4.0,1C,7.0,D4,Back Bay,14.0,Ward 4,405.0,,INTERSECTION Belvidere St & Massachusetts Ave,,Intersection,1292.0,42.3465,-71.0873,Constituent Call,"(42.3465, -71.0873)"
537062,101001337820,03/19/2015 08:48:31 PM,03/23/2015 08:30:00 AM,03/23/2015 12:14:50 PM,OVERDUE,Closed,Case Closed Case Resolved Lights repaired,Major System Failure/LAMP #N1940002  76 Alban St./sent,Public Works Department,Street Lights,Major System Failure,PWDx_Street Light_Pending_Contractor (Internal),PWDx,,,71 Alban St  Dorchester  MA  02124,8.0,07,4.0,C11,Dorchester,8.0,Ward 17,1709.0,R1,71 Alban St,2124.0,Address,1458.0,42.2874,-71.0661,Constituent Call,"(42.2874, -71.0661)"
537076,101001337836,03/19/2015 10:58:32 PM,03/23/2015 08:30:00 AM,03/24/2015 02:53:23 PM,OVERDUE,Closed,Case Closed Case Resolved CHECKED SYSTEM WORKING OK 301L,Major System Failure/printed for 3rd,Public Works Department,Street Lights,Major System Failure,PWDx_Major System Failure,PWDx,,,13 Hartford St  Dorchester  MA  02125,7.0,03,7.0,B2,Roxbury,13.0,Ward 13,1304.0,R2,13 Hartford St,2125.0,Address,70200.0,42.3174,-71.0735,Constituent Call,"(42.3174, -71.0735)"
537776,101001338780,03/20/2015 07:27:44 PM,03/24/2015 08:30:00 AM,03/20/2015 11:38:19 PM,ONTIME,Closed,Case Closed Case Resolved,Major System Failure///printed,Public Works Department,Street Lights,Major System Failure,PWDx_Major System Failure,PWDx,,,7-9 Chamblet St  Dorchester  MA  02125,7.0,03,7.0,B2,Roxbury,13.0,Ward 13,1304.0,CM,7-9 Chamblet St,2125.0,Address,28568.0,42.3159,-71.0721,Constituent Call,"(42.3159, -71.0721)"
537789,101001338797,03/20/2015 08:45:45 PM,03/24/2015 08:30:00 AM,03/20/2015 08:53:30 PM,ONTIME,Closed,Case Closed Duplicate of Existing Case See CRM#1338780,Major System Failure,Public Works Department,Street Lights,Major System Failure,PWDx_Major System Failure,PWDx,,,10 Chamblet St  Dorchester  MA  02125,7.0,03,7.0,B2,Roxbury,13.0,Ward 13,1304.0,E,10 Chamblet St,2125.0,Address,28557.0,42.3156,-71.0722,Constituent Call,"(42.3156, -71.0722)"
537970,101001339062,03/21/2015 09:18:05 PM,03/24/2015 08:30:00 AM,03/23/2015 01:40:07 PM,ONTIME,Closed,Case Closed Case Resolved ON CALL MAN CHECKED OUT CONTROL PANEL RESET BREAKERS CHECKED  PHOTO CELL SYSTEM WORKING NORMAL AT THIS TIME B.LYNCH,Major System Failure // PRINTED //,Public Works Department,Street Lights,Major System Failure,PWDx_Major System Failure,PWDx,,,604 Columbus Ave  Roxbury  MA  02118,9.0,10B,7.0,D4,Roxbury,13.0,Ward 9,903.0,RC,604 Columbus Ave,2118.0,Address,156491.0,42.3398,-71.0824,Constituent Call,"(42.3398, -71.0824)"
538093,101001339263,03/22/2015 07:50:44 PM,03/24/2015 08:30:00 AM,03/23/2015 01:44:27 PM,ONTIME,Closed,Case Closed Case Resolved ON CALL CREW CHECKED LOCATION FOUND (6) GAS LIGHTS WERE OUT REPLACED MANTELS  SECURED GAS NOZZELES REPAIRED (5) LIGHTS WILL NEED TO REPLACE BURNER B.LYNCH  K.HOGE  .,Major System Failure  // PRINTED //,Public Works Department,Street Lights,Major System Failure,PWDx_Major System Failure,PWDx,,,INTERSECTION of Devens St & Main St  Charlestown  MA,3.0,1A,1.0,A15,Charlestown,2.0,Ward 2,201.0,,INTERSECTION Devens St & Main St,,Intersection,4048.0,42.374,-71.0632,Constituent Call,"(42.374, -71.0632)"
538103,101001339277,03/22/2015 09:12:10 PM,03/24/2015 08:30:00 AM,03/23/2015 01:51:51 PM,ONTIME,Closed,Case Closed Case Resolved ON CALL CREW CHECKED MAJOR FAILURE SECURED ALL CONNECTIONS WILL RETURN LOCATE UNDERGROUND PROBLEM (2) LIGHTS ARE OUT NOW B.LYNCH  K.HOGE  V.MEJIAS,Major System Failure  // PRINTED //,Public Works Department,Street Lights,Major System Failure,PWDx_Major System Failure,PWDx,,,33 Harrison Ave  Boston  MA  02111,4.0,1C,2.0,A1,Downtown / Financial District,4.0,Ward 3,308.0,C,33 Harrison Ave,2111.0,Address,247878.0,42.3516,-71.0614,Constituent Call,"(42.3516, -71.0614)"
539484,101001341160,03/24/2015 08:12:19 PM,03/26/2015 08:30:00 AM,03/30/2015 12:38:44 PM,OVERDUE,Closed,Case Closed Case Resolved Major system failure resolved.,Street Lighting Outages///printed,Public Works Department,Street Lights,Major System Failure,PWDx_Major System Failure,PWDx,,,INTERSECTION of E Broadway & I St  South Boston  MA,6.0,05,2.0,C6,South Boston / South Boston Waterfront,5.0,Ward 6,605.0,,INTERSECTION E Broadway & I St,,Intersection,1984.0,42.3356,-71.0399,Constituent Call,"(42.3356, -71.0399)"
540259,101001342202,03/25/2015 08:55:39 PM,03/27/2015 08:30:00 AM,03/25/2015 10:17:43 PM,ONTIME,Closed,Case Closed Case Resolved #4 cable dropped out of contactor---reinstalled and tested M Drago J Dunn,Major System Failure///printed,Public Works Department,Street Lights,Major System Failure,PWDx_Major System Failure,PWDx,,,26 Mount Pleasant Ave  Roxbury  MA  02119,7.0,10B,7.0,B2,Roxbury,13.0,Ward 8,803.0,R2,26 Mount Pleasant Ave,2119.0,Address,98399.0,42.3274,-71.0793,Constituent Call,"(42.3274, -71.0793)"
540814,101001343042,03/26/2015 09:23:35 PM,03/30/2015 08:30:00 AM,03/27/2015 09:45:16 PM,ONTIME,Closed,Case Closed Case Resolved slcb has been put back in service. joubert/conary,Major System Failure////printed,Public Works Department,Street Lights,Major System Failure,PWDx_Major System Failure,PWDx,,,INTERSECTION of Bennington St & Moore St  East Boston  MA,1.0,09,1.0,A7,East Boston,1.0,Ward 1,111.0,,INTERSECTION Bennington St & Moore St,,Intersection,1328.0,42.3826,-71.0184,Constituent Call,"(42.3826, -71.0184)"
540820,101001343050,03/26/2015 09:47:26 PM,03/30/2015 08:30:00 AM,03/26/2015 09:54:48 PM,ONTIME,Closed,Case Closed Duplicate of Existing Case,Major System Failure/////printed,Public Works Department,Street Lights,Major System Failure,PWDx_Major System Failure,PWDx,,,INTERSECTION of Bennington St & Byron St  East Boston  MA,1.0,09,1.0,A7,East Boston,1.0,Ward 1,111.0,,INTERSECTION Bennington St & Byron St,,Intersection,1329.0,42.3834,-71.0162,Constituent Call,"(42.3834, -71.0162)"
540899,101001343198,03/27/2015 08:48:27 AM,03/30/2015 08:46:00 AM,03/27/2015 03:05:15 PM,ONTIME,Closed,Case Closed Case Resolved CREW CHECKED OUT CONTROL PANEL REMOVED AND REPLACED DEFECTIVE CONTACTORS  K.HOGE / T.HARVEY,Major System Failure//printed,Public Works Department,Street Lights,Major System Failure,PWDx_Major System Failure,PWDx,,,210-212 W Broadway  South Boston  MA  02127,6.0,05,2.0,C6,South Boston / South Boston Waterfront,5.0,Ward 6,601.0,E,210-212 W Broadway,2127.0,Address,21401.0,42.3402,-71.0525,Employee Generated,"(42.3402, -71.0525)"
541658,101001344212,03/28/2015 08:23:11 PM,03/31/2015 08:30:00 AM,04/01/2015 07:50:27 PM,OVERDUE,Closed,Case Closed Case Resolved no problem found. th/kh,Major System Failure  //  PRINTED,Public Works Department,Street Lights,Major System Failure,PWDx_Major System Failure,PWDx,,,INTERSECTION of Huntington Ave & Longwood Ave  Boston  MA,4.0,10A,8.0,B2,Fenway / Kenmore / Audubon Circle / Longwood,14.0,Ward 4,410.0,,INTERSECTION Huntington Ave & Longwood Ave,,Intersection,6426.0,42.3359,-71.1003,Constituent Call,"(42.3359, -71.1003)"
541831,101001344465,03/30/2015 06:00:53 AM,03/31/2015 08:30:00 AM,03/31/2015 02:55:09 PM,OVERDUE,Closed,Case Closed Case Resolved RESET CLOCK 301L,Major System Failure  //  PRINTED,Public Works Department,Street Lights,Major System Failure,PWDx_Major System Failure,PWDx,,,INTERSECTION of W Broadway & D St  South Boston  MA,6.0,05,2.0,C6,South Boston / South Boston Waterfront,5.0,Ward 6,601.0,,INTERSECTION W Broadway & D St,,Intersection,1999.0,42.3388,-71.0508,Constituent Call,"(42.3388, -71.0508)"
542248,101001345061,03/30/2015 02:24:32 PM,03/31/2015 02:20:00 PM,03/30/2015 02:41:34 PM,ONTIME,Closed,Case Closed Case Resolved FOUND SHORT & REPAIRED 301L,Major System Failure  // PRINTED //,Public Works Department,Street Lights,Major System Failure,PWDx_Major System Failure,PWDx,,,0 E Broadway  South Boston  MA  02127,6.0,05,2.0,C6,South Boston / South Boston Waterfront,5.0,Ward 6,609.0,RL,0 E Broadway,2127.0,Address,20891.0,42.3356,-71.0256,Maximo Integration,"(42.3356, -71.0256)"
542475,101001345375,03/30/2015 09:19:32 PM,04/01/2015 08:30:00 AM,03/30/2015 10:33:59 PM,ONTIME,Closed,Case Closed Case Resolved Tested control circuit all lights on no problem found V Mejias J McHugh,Major System Failure///printed,Public Works Department,Street Lights,Major System Failure,PWDx_Major System Failure,PWDx,,,41 Union St  Boston  MA  02108,3.0,1B,1.0,A1,Boston,3.0,03,306.0,C,41 Union St,2108.0,Address,139293.0,42.3613,-71.0569,Constituent Call,"(42.3613, -71.0569)"
542486,101001345397,03/31/2015 12:32:56 AM,04/01/2015 08:30:00 AM,03/31/2015 02:51:53 PM,ONTIME,Closed,Case Closed Case Resolved COULD NOT REPAIR PIPE RAN OVERHEAD FEED TO PICK UP REST OF SYSTEM 301L 003L,Major System Failure   //  PRINTED,Public Works Department,Street Lights,Major System Failure,PWDx_Major System Failure,PWDx,,,30 Walnut Park  Roxbury  MA  02119,9.0,10B,7.0,E13,Roxbury,13.0,Ward 11,1103.0,A,30 Walnut Park,2119.0,Address,141989.0,42.3158,-71.0962,Constituent Call,"(42.3158, -71.0962)"
543964,101001347386,04/02/2015 02:56:46 AM,04/03/2015 08:30:00 AM,04/02/2015 03:00:53 AM,ONTIME,Closed,Case Closed Case Resolved Drilled Out & Installed Button Eye In SLCB,Major System Failure,Public Works Department,Street Lights,Major System Failure,PWDx_Major System Failure,PWDx,,,,,,,,,,,,,,,,,42.3594,-71.0587,Employee Generated,"(0, 0)"
544660,101001348392,04/03/2015 03:45:15 AM,04/06/2015 08:30:00 AM,04/03/2015 05:56:45 AM,ONTIME,Closed,Case Closed Case Resolved Tracked Issue To 100amp Breaker  Repaired,Major System Failure,Public Works Department,Street Lights,Major System Failure,PWDx_Major System Failure,PWDx,,,,,,,,,,,,,,,,,42.3594,-71.0587,Employee Generated,"(0, 0)"
544674,101001348411,04/03/2015 06:50:38 AM,04/06/2015 08:30:00 AM,04/03/2015 02:15:58 PM,ONTIME,Closed,Case Closed Case Resolved REPLACED PHOTO EYE 301L,Major System Failure   PRINTED,Public Works Department,Street Lights,Major System Failure,PWDx_Major System Failure,PWDx,,,INTERSECTION of Crawford St & Warren St  Dorchester  MA,9.0,10B,7.0,B2,Roxbury,13.0,Ward 12,1202.0,,INTERSECTION Crawford St & Warren St,,Intersection,3643.0,42.3106,-71.0833,Constituent Call,"(42.3106, -71.0833)"
544726,101001348485,04/03/2015 08:29:03 AM,04/06/2015 08:30:00 AM,04/03/2015 08:55:47 AM,ONTIME,Closed,Case Closed Case Noted CONTRACTOR INSTALLING NEW LIGHTING SYSTEM FOR MASS. HIGHWAY HAS BEEN NOTIFIED HE WILL REPAIR SYSTEM TODAY 4/3/15,Major System Failure,Public Works Department,Street Lights,Major System Failure,PWDx_Major System Failure,PWDx,,,INTERSECTION of Huntington Ave & Massachusetts Ave  Boston  MA,4.0,1C,7.0,D4,Back Bay,14.0,Ward 4,405.0,,INTERSECTION Huntington Ave & Massachusetts Ave,,Intersection,6433.0,42.3427,-71.0849,Constituent Call,"(42.3427, -71.0849)"
545189,101001349134,04/03/2015 08:06:28 PM,04/07/2015 08:30:00 AM,04/03/2015 11:01:42 PM,ONTIME,Closed,Case Closed Case Resolved N-Star grid shut down traffic signals out as well as buildings   B Keane,Major System Failure////printed,Public Works Department,Street Lights,Major System Failure,PWDx_Major System Failure,PWDx,,,INTERSECTION of Eustis St & Williams St  Roxbury  MA,7.0,10B,7.0,B2,Roxbury,13.0,Ward 9,904.0,,INTERSECTION Eustis St & Williams St,,Intersection,4662.0,42.332,-71.0817,Constituent Call,"(42.332, -71.0817)"
545201,101001349149,04/03/2015 09:11:07 PM,04/07/2015 08:30:00 AM,04/04/2015 05:11:22 AM,ONTIME,Closed,Case Closed Case Resolved All Lighs Working  ??,Major System Failure////printed,Public Works Department,Street Lights,Major System Failure,PWDx_Major System Failure,PWDx,,,INTERSECTION of Arlington St & Providence St  Boston  MA,4.0,1C,2.0,A1,,6.0,Ward 5,501.0,,INTERSECTION Arlington St & Providence St,,Intersection,584.0,42.3514,-71.0704,Constituent Call,"(42.3514, -71.0704)"
546205,101001350521,04/06/2015 07:31:53 PM,04/08/2015 08:30:00 AM,04/06/2015 09:06:45 PM,ONTIME,Closed,Case Closed Case Resolved Photoeye controlled system all lights lit upon arrival and both adjacent systems also all lights working B Keane K Kelley,Major System Failure///printed,Public Works Department,Street Lights,Major System Failure,PWDx_Major System Failure,PWDx,,,INTERSECTION of Hyde Park Ave & Southbourne Rd  Jamaica Plain  MA,12.0,02,6.0,E13,Jamaica Plain,10.0,Ward 19,1912.0,,INTERSECTION Hyde Park Ave & Southbourne Rd,,Intersection,6471.0,42.2899,-71.1182,Constituent Call,"(42.2899, -71.1182)"
546526,101001350964,04/07/2015 12:08:54 PM,04/08/2015 12:08:53 PM,04/09/2015 08:38:06 AM,OVERDUE,Closed,Case Closed Case Resolved,Major System Failure/LAMP #N1558020  127 Gordon Ave/sent,Public Works Department,Street Lights,Major System Failure,PWDx_Street Light_Pending_Contractor (Internal),PWDx,,,127 Gordon Ave  Hyde Park  MA  02136,12.0,08,5.0,E18,Roslindale,10.0,Ward 18,1812.0,R1,127 Gordon Ave,2136.0,Address,65372.0,42.2597,-71.1305,Constituent Call,"(42.2597, -71.1305)"
546913,101001351492,04/08/2015 03:32:58 AM,04/09/2015 08:30:00 AM,04/08/2015 03:33:53 AM,ONTIME,Closed,Case Closed Case Resolved Reset 100 amp Breaker,Major System Failure,Public Works Department,Street Lights,Major System Failure,PWDx_Major System Failure,PWDx,,,,,,,,,,,,,,,,,42.3594,-71.0587,Employee Generated,"(0, 0)"
547641,101001352411,04/08/2015 08:10:03 PM,04/10/2015 08:30:00 AM,04/08/2015 11:23:52 PM,ONTIME,Closed,Case Closed Case Resolved secured door. bk,General Lighting Request///printed,Public Works Department,Street Lights,Major System Failure,PWDx_Major System Failure,PWDx,,,INTERSECTION of Humboldt Ave & Walnut Ave  Roxbury  MA,9.0,10B,7.0,B2,Roxbury,13.0,Ward 12,1203.0,,INTERSECTION Humboldt Ave & Walnut Ave,,Intersection,6406.0,42.3207,-71.086,Constituent Call,"(42.3207, -71.086)"
548263,101001353261,04/09/2015 10:06:15 PM,04/13/2015 08:30:00 AM,04/09/2015 11:00:55 PM,ONTIME,Closed,Case Closed Case Resolved temporary repairs made. md/jd,all out////printed,Public Works Department,Street Lights,Major System Failure,PWDx_Major System Failure,PWDx,,,16 Paisley Park  Dorchester  MA  02124,8.0,07,3.0,C11,Dorchester,7.0,Ward 16,1601.0,R1,16 Paisley Park,2124.0,Address,106383.0,42.2974,-71.0634,Constituent Call,"(42.2974, -71.0634)"
549839,101001355480,04/13/2015 09:18:18 PM,04/15/2015 08:30:00 AM,04/13/2015 10:13:12 PM,ONTIME,Closed,Case Closed Case Resolved No problem found---all N-Star takeover units here---all working,Major System Failure,Public Works Department,Street Lights,Major System Failure,PWDx_Major System Failure,PWDx,,,INTERSECTION of Annafran St & Cummins Hwy  Roslindale  MA,12.0,08,5.0,E18,Hyde Park,10.0,Ward 18,1807.0,,INTERSECTION Annafran St & Cummins Hwy,,Intersection,457.0,42.2747,-71.1098,Constituent Call,"(42.2747, -71.1098)"
550572,101001356513,04/14/2015 09:24:23 PM,04/16/2015 08:30:00 AM,04/14/2015 09:50:09 PM,ONTIME,Closed,Case Closed Case Resolved on constant. burns/buckley,Major System Failure////printed,Public Works Department,Street Lights,Major System Failure,PWDx_Major System Failure,PWDx,,,INTERSECTION of Bennington St & Brooks St  East Boston  MA,1.0,09,1.0,A7,East Boston,1.0,Ward 1,105.0,,INTERSECTION Bennington St & Brooks St,,Intersection,1315.0,42.3768,-71.0337,Constituent Call,"(42.3768, -71.0337)"
550582,101001356524,04/14/2015 09:56:31 PM,04/16/2015 08:30:00 AM,04/14/2015 10:51:44 PM,ONTIME,Closed,Case Closed Case Resolved tracked short to orange leg. further work to be donw. victor/mchugh,Major System Failure////printed,Public Works Department,Street Lights,Major System Failure,PWDx_Major System Failure,PWDx,,,5 Wyoming St  Dorchester  MA  02121,9.0,10B,7.0,B2,Roxbury,13.0,Ward 12,1202.0,R3,5 Wyoming St,2121.0,Address,153168.0,42.3151,-71.0845,Constituent Call,"(42.3151, -71.0845)"
551009,101001357069,04/15/2015 12:59:49 PM,04/16/2015 12:59:49 PM,04/15/2015 03:32:19 PM,ONTIME,Closed,Case Closed Case Resolved CREW CHECKED CONTROL PANEL RETURNED MAIN DISCONNECT TO NORMAL POSITION  D.PRIOLEAU  K.HOGE  T.HARVEY,Major System Failure////printed,Public Works Department,Street Lights,Major System Failure,PWDx_Major System Failure,PWDx,,,INTERSECTION of Farragut Rd & E Second St  South Boston  MA,6.0,05,2.0,C6,South Boston / South Boston Waterfront,5.0,Ward 6,609.0,,INTERSECTION Farragut Rd & E Second St,,Intersection,4813.0,42.3375,-71.0251,Constituent Call,"(42.3375, -71.0251)"
551184,101001357312,04/15/2015 03:59:09 PM,04/16/2015 03:59:09 PM,04/16/2015 04:19:27 PM,OVERDUE,Closed,Case Closed Case Resolved replaced button eye. victor/mchugh/kelley/buckley,Major System Failure////printed,Public Works Department,Street Lights,Major System Failure,PWDx_Major System Failure,PWDx,,,INTERSECTION of Congress St & Hanover St  Boston  MA,3.0,1B,1.0,A1,Downtown / Financial District,3.0,Ward 3,306.0,,INTERSECTION Congress St & Hanover St,,Intersection,3428.0,42.3616,-71.0576,Constituent Call,"(42.3616, -71.0576)"
552555,101001359320,04/17/2015 08:04:59 PM,04/22/2015 08:30:00 AM,04/17/2015 08:36:12 PM,ONTIME,Closed,Case Closed Case Resolved all lights in area on at 8 15. mxol/clif,Major System Failure////printed,Public Works Department,Street Lights,Major System Failure,PWDx_Major System Failure,PWDx,,,INTERSECTION of Dudley St & Shirley St  Roxbury  MA,7.0,03,7.0,B2,Roxbury,13.0,Ward 8,805.0,,INTERSECTION Dudley St & Shirley St,,Intersection,4281.0,42.3231,-71.0733,Constituent Call,"(42.3231, -71.0733)"
552563,101001359329,04/17/2015 08:29:29 PM,04/22/2015 08:30:00 AM,04/18/2015 04:42:09 AM,ONTIME,Closed,Case Closed Case Resolved Reset Clock,Major System Failure////printed for jim k,Public Works Department,Street Lights,Major System Failure,PWDx_Major System Failure,PWDx,,,INTERSECTION of Commonwealth Ave & Exeter St  Boston  MA,4.0,1C,8.0,D4,Back Bay,14.0,Ward 5,507.0,,INTERSECTION Commonwealth Ave & Exeter St,,Intersection,3396.0,42.3511,-71.0803,Constituent Call,"(42.3511, -71.0803)"
553173,101001360189,04/20/2015 08:08:15 PM,04/22/2015 08:30:00 AM,04/21/2015 09:58:55 AM,ONTIME,Closed,Case Closed Case Resolved ON CALL CREW REPLACED PHOTO CONTROL CELL,Major System Failure //PRINTED //,Public Works Department,Street Lights,Major System Failure,PWDx_Major System Failure,PWDx,,,INTERSECTION of Blue Hill Ave & W Cottage St  Roxbury  MA,7.0,03,7.0,B2,Roxbury,13.0,Ward 8,807.0,,INTERSECTION Blue Hill Ave & W Cottage St,,Intersection,1595.0,42.3204,-71.0778,Constituent Call,"(42.3204, -71.0778)"
555050,101001362783,04/23/2015 08:05:13 PM,04/27/2015 08:30:00 AM,04/27/2015 07:21:37 AM,ONTIME,Closed,Case Closed Case Resolved,Major System Failure,Public Works Department,Street Lights,Major System Failure,BTDT_Traffic Signal_Repair,BTDT,,,INTERSECTION of Boston St & Southampton St  South Boston  MA,6.0,05,2.0,C6,South Boston / South Boston Waterfront,5.0,Ward 7,706.0,,INTERSECTION Boston St & Southampton St,,Intersection,1673.0,42.3295,-71.057,Constituent Call,"(42.3295, -71.057)"
555804,101001363879,04/25/2015 10:54:20 PM,04/28/2015 08:30:00 AM,04/27/2015 01:55:15 PM,ONTIME,Closed,Case Closed Case Resolved ON CALL CREW CHECKED CONTROL PANEL PUT SYSTEM ON CONSTANT CONTROL POLE HAS BEEN KOED LIGHTS ARE ON CONSTANT  M.DONOVAN  K.HOGE   J.McHUGH,Major System Failure  /PRINTED /,Public Works Department,Street Lights,Major System Failure,PWDx_Major System Failure,PWDx,,,INTERSECTION of Ellsworth St & Freeport St  Dorchester  MA,7.0,03,3.0,C11,Dorchester,8.0,Ward 15,1506.0,,INTERSECTION Ellsworth St & Freeport St,,Intersection,4511.0,42.3055,-71.0574,Constituent Call,"(42.3055, -71.0574)"
555940,101001364138,04/26/2015 08:24:49 PM,04/28/2015 08:30:00 AM,04/27/2015 01:50:17 PM,ONTIME,Closed,Case Closed Case Resolved ON CALL FOUND DEAD N-STAR  SERVICE GOT POWER IN RED LEG INSTALLED JUMPER CABLE LIGHTS ARE WORKING NOW M.DONOVAN,Major System Failure  /PRINTED //,Public Works Department,Street Lights,Major System Failure,PWDx_Major System Failure,PWDx,,,INTERSECTION of Iffley Rd & Walnut Ave  Jamaica Plain  MA,9.0,02,7.0,E13,Jamaica Plain,11.0,Ward 11,1105.0,,INTERSECTION Iffley Rd & Walnut Ave,,Intersection,6488.0,42.3117,-71.0976,Constituent Call,"(42.3117, -71.0976)"
556621,101001365039,04/27/2015 08:58:16 PM,04/29/2015 08:30:00 AM,04/28/2015 07:00:51 AM,ONTIME,Closed,Case Closed Case Resolved Tracked Dead Short To Burnt JJ In Pole  Reset breaker.,Major System Failure////printed,Public Works Department,Street Lights,Major System Failure,PWDx_Major System Failure,PWDx,,,INTERSECTION of Church St & Stuart St  Boston  MA,4.0,1C,2.0,A1,Back Bay,6.0,Ward 5,501.0,,INTERSECTION Church St & Stuart St,,Intersection,3006.0,42.3505,-71.0687,Constituent Call,"(42.3505, -71.0687)"
557116,101001365687,04/28/2015 02:58:39 PM,04/29/2015 02:58:39 PM,04/28/2015 09:53:04 PM,ONTIME,Closed,Case Closed Case Resolved replaced contactor  replaced main disconnecct  secured neutral at the neutral buss. victor/mchugh,Major System Failure////printed,Public Works Department,Street Lights,Major System Failure,PWDx_Major System Failure,PWDx,,,291 Roxbury St  Roxbury  MA  02119,7.0,10B,7.0,B2,Roxbury,13.0,Ward 9,905.0,RC,291 Roxbury St,2119.0,Address,119179.0,42.3304,-71.0943,Constituent Call,"(42.3304, -71.0943)"
557998,101001366923,04/30/2015 04:51:39 AM,05/01/2015 08:30:00 AM,04/30/2015 06:22:11 AM,ONTIME,Closed,Case Closed Case Resolved No Problem Found ???,Major System Failure,Public Works Department,Street Lights,Major System Failure,PWDx_Major System Failure,PWDx,,,INTERSECTION of Dudley St & Shirley St  Roxbury  MA,7.0,03,7.0,B2,Roxbury,13.0,Ward 8,805.0,,INTERSECTION Dudley St & Shirley St,,Intersection,4281.0,42.3231,-71.0733,Constituent Call,"(42.3231, -71.0733)"
558518,101001367681,04/30/2015 09:01:15 PM,05/04/2015 08:30:00 AM,05/01/2015 03:07:47 AM,ONTIME,Closed,Case Closed Case Resolved Left System On Constant  Will Replace Photo Eye  In Construction,Major System Failure////printed,Public Works Department,Street Lights,Major System Failure,PWDx_Major System Failure,PWDx,,,185 Cabot St  Mission Hill  MA  02120,7.0,10B,7.0,B2,Roxbury,13.0,Ward 9,904.0,E,185 Cabot St,2120.0,Address,173661.0,42.3334,-71.0879,Constituent Call,"(42.3334, -71.0879)"
559202,101001368787,05/02/2015 10:59:00 PM,05/05/2015 08:30:00 AM,05/06/2015 10:03:53 AM,OVERDUE,Closed,Case Closed. Closed date : 2015-05-06 10:03:53.51 Case Resolved lights are on now,PRINTED,Public Works Department,Street Lights,Major System Failure,PWDx_Major System Failure,PWDx,,,125 Amory St  Roxbury  MA  02119,9.0,10B,6.0,E13,Jamaica Plain,11.0,Ward 11,1104.0,E,125 Amory St,2119.0,Address,3261.0,42.3194,-71.1009,Constituent Call,"(42.3194, -71.1009)"
560016,101001369998,05/04/2015 08:32:00 PM,05/06/2015 08:30:00 AM,05/05/2015 03:26:10 PM,ONTIME,Closed,Case Closed. Closed date : 2015-05-05 15:26:10.223 Case Resolved no problem found,PRINTED,Public Works Department,Street Lights,Major System Failure,PWDx_Major System Failure,PWDx,,,INTERSECTION of Shawmut Ave & W Springfield St  Roxbury  MA,4.0,1C,7.0,D4,South End,6.0,Ward 9,902.0,,INTERSECTION Shawmut Ave & W Springfield St,,Intersection,8347.0,42.3378,-71.0773,Constituent Call,"(42.3378, -71.0773)"
562813,101001374177,05/10/2015 08:36:00 PM,05/12/2015 08:30:00 AM,05/11/2015 11:48:57 AM,ONTIME,Closed,Case Closed. Closed date : 2015-05-11 11:48:57.65 Case Resolved The on Call person and crew repaired the time clock the system is all set now.,PRINTED,Public Works Department,Street Lights,Major System Failure,PWDx_Major System Failure,PWDx,,,29 Monadnock St  Dorchester  MA  02125,7.0,03,7.0,B2,Dorchester,13.0,Ward 13,1305.0,R1,29 Monadnock St,2125.0,Address,96282.0,42.3167,-71.0688,Constituent Call,"(42.3167, -71.0688)"
563660,101001375471,05/12/2015 10:13:00 AM,05/13/2015 10:13:00 AM,05/12/2015 10:29:34 AM,ONTIME,Closed,Case Closed. Closed date : 2015-05-12 10:29:34.41 Case Resolved Case was resolved on Sunday 5-10-15  D Prioleau.,Major System Failure //Taken care of on 5-10-15- D Prioleau,Public Works Department,Street Lights,Major System Failure,PWDx_Major System Failure,PWDx,,,12 Monadnock St  Dorchester  MA  02125,7.0,03,7.0,B2,Dorchester,13.0,Ward 13,1305.0,R2,12 Monadnock St,2125.0,Address,96268.0,42.3173,-71.0676,Employee Generated,"(42.3173, -71.0676)"
564099,101001376115,05/12/2015 10:40:00 PM,05/14/2015 08:30:00 AM,05/13/2015 04:23:56 AM,ONTIME,Closed,Case Closed. Closed date : 2015-05-13 04:23:56.143 Case Resolved Repaired Terminal In Disconnect  Replaced 100a Fuse,PRINTED,Public Works Department,Street Lights,Major System Failure,PWDx_Major System Failure,PWDx,,,716 Columbus Ave  Mission Hill  MA  02120,9.0,10B,7.0,D4,Roxbury,13.0,Ward 9,904.0,C,716 Columbus Ave,2120.0,Address,36070.0,42.3377,-71.0851,Constituent Call,"(42.3377, -71.0851)"
564780,101001377090,05/14/2015 01:59:00 AM,05/15/2015 08:30:00 AM,05/14/2015 04:26:27 AM,ONTIME,Closed,Case Closed. Closed date : 2015-05-14 04:26:27.887 Case Resolved N-Star Outage,Major System Failure,Public Works Department,Street Lights,Major System Failure,PWDx_Major System Failure,PWDx,,,70 Dale St  Roxbury  MA  02119,9.0,10B,7.0,B2,Roxbury,13.0,Ward 12,1203.0,R3,70 Dale St,2119.0,Address,45754.0,42.3213,-71.0862,Constituent Call,"(42.3213, -71.0862)"
565111,101001377542,05/14/2015 12:23:00 PM,05/15/2015 12:23:53 PM,06/27/2015 05:55:13 AM,,Closed,Case Closed. Closed date : 2015-06-27 05:55:13.677 Case Resolved Work Completed On W/O # 1333164,PRINTED,Public Works Department,Street Lights,Major System Failure,PWDx_Major System Failure,PWDx,,,16-18 Blossom St  Boston  MA  02114,3.0,1B,8.0,A1,Boston,3.0,03,,E,16-18 Blossom St,2114.0,Address,16063.0,42.3617,-71.0672,Constituent Call,"(42.3617, -71.0672)"
565424,101001377972,05/15/2015 01:31:00 AM,05/18/2015 08:30:00 AM,05/15/2015 01:43:52 AM,ONTIME,Closed,Case Closed. Closed date : 2015-05-15 01:43:52.86 Case Resolved Resecured # 4 Cables On Breaker,Major System Failure,Public Works Department,Street Lights,Major System Failure,PWDx_Major System Failure,PWDx,,,,,,,,,,,,,,,,,42.3594,-71.0587,Employee Generated,"(0, 0)"
565933,101001378727,05/15/2015 11:26:00 PM,05/19/2015 08:30:00 AM,06/27/2015 05:43:06 AM,,Closed,Case Closed. Closed date : 2015-06-27 05:43:06.337 Case Resolved Work Completed On W/O #1333164,Major System Failure/uinderground problem/temp susp,Public Works Department,Street Lights,Major System Failure,PWDx_Major System Failure,PWDx,,,INTERSECTION of Blossom St & Parkman St  Boston  MA,3.0,1B,8.0,A1,Beacon Hill,3.0,Ward 3,305.0,,INTERSECTION Blossom St & Parkman St,,Intersection,1507.0,42.3622,-71.067,Constituent Call,"(42.3622, -71.067)"
566320,101001379276,05/17/2015 08:44:00 PM,05/19/2015 08:30:00 AM,05/20/2015 04:22:56 PM,OVERDUE,Closed,Case Closed. Closed date : 2015-05-20 16:22:56.2 Case Resolved dug hand holes. repaired overheads. removed squirrel from rectilinear.md/jd/jm,PRINTED,Public Works Department,Street Lights,Major System Failure,PWDx_Major System Failure,PWDx,,,INTERSECTION of Washington St & W Walnut Park  Roxbury  MA,9.0,10B,7.0,E13,Roxbury,11.0,Ward 11,1105.0,,INTERSECTION Washington St & W Walnut Park,,Intersection,6025.0,42.3164,-71.0977,Constituent Call,"(42.3164, -71.0977)"
569361,101001393839,05/23/2015 08:42:00 PM,05/27/2015 08:30:00 AM,05/26/2015 09:41:24 PM,ONTIME,Closed,Case Closed. Closed date : 2015-05-26 21:41:24.817 Case Resolved replaced 29' pole and installed new overhead. vm/jm/joubert/conary,Major System Failure////printed,Public Works Department,Street Lights,Major System Failure,PWDx_Major System Failure,PWDx,,,INTERSECTION of Warren St & Savin St  Roxbury  MA,9.0,10B,7.0,B2,Roxbury,13.0,Ward 12,1206.0,,INTERSECTION Warren St & Savin St,,Intersection,5941.0,42.3176,-71.0822,Constituent Call,"(42.3176, -71.0822)"
571137,101001396383,05/27/2015 08:50:00 PM,05/29/2015 08:30:00 AM,05/27/2015 10:46:23 PM,ONTIME,Closed,Case Closed. Closed date : 2015-05-27 22:46:23.72 Case Resolved Not an all out only 1 light out,PRINTED///Major Ststem Failure,Public Works Department,Street Lights,Major System Failure,PWDx_Major System Failure,PWDx,,,50 Stoughton St  Dorchester  MA  02125,7.0,03,7.0,C11,Dorchester,13.0,07,710.0,,50 Stoughton St,2125.0,Address,352999.0,42.3594,-71.0587,Constituent Call,"(0, 0)"
572656,101001398576,05/29/2015 11:20:00 PM,06/02/2015 08:30:00 AM,06/03/2015 03:14:24 PM,OVERDUE,Closed,Case Closed. Closed date : 2015-06-03 15:14:24.16 Case Resolved grid problem repaired,Major System Failure/printed,Public Works Department,Street Lights,Major System Failure,PWDx_Major System Failure,PWDx,,,28 Mountain Ave  Dorchester  MA  02124,8.0,07,4.0,B3,Greater Mattapan,9.0,Ward 14,1413.0,R2,28 Mountain Ave,2124.0,Address,99089.0,42.2857,-71.0853,Constituent Call,"(42.2857, -71.0853)"
572665,101001398587,05/30/2015 01:47:00 AM,06/02/2015 08:30:00 AM,05/30/2015 07:17:37 AM,ONTIME,Closed,Case Closed. Closed date : 2015-05-30 07:17:37.923 Case Resolved 3 outages. repaired one. new w/o to be issued. 3rd shift,Major System Failure,Public Works Department,Street Lights,Major System Failure,PWDx_Major System Failure,PWDx,,,291 Saint Botolph St  Boston  MA  02115,9.0,10A,7.0,D4,Fenway / Kenmore / Audubon Circle / Longwood,13.0,04,408.0,,291 Saint Botolph St,2115.0,Address,343328.0,42.3594,-71.0587,Constituent Call,"(0, 0)"
572948,101001398979,05/30/2015 10:20:00 PM,06/02/2015 08:30:00 AM,06/01/2015 02:07:46 PM,ONTIME,Closed,Case Closed. Closed date : 2015-06-01 14:07:46.83 Case Resolved REPLACED METER CLIP AND RE-WIRED METER CAN  K.HOGE / T.HARVEY,PRINTED,Public Works Department,Street Lights,Major System Failure,PWDx_Major System Failure,PWDx,,,INTERSECTION of Benton St & Columbus Ave  Mission Hill  MA,9.0,10B,7.0,D4,Roxbury,13.0,Ward 9,904.0,,INTERSECTION Benton St & Columbus Ave,,Intersection,1344.0,42.338,-71.0852,Constituent Call,"(42.338, -71.0852)"
572949,101001398980,05/30/2015 10:22:00 PM,06/02/2015 08:30:00 AM,06/03/2015 01:07:06 PM,OVERDUE,Closed,Case Closed. Closed date : 2015-06-03 13:07:06.39 Case Resolved Case resolved 5/30/15 by On-Call Street Lighting Representative,PRINTED,Public Works Department,Street Lights,Major System Failure,PWDx_Major System Failure,PWDx,,,INTERSECTION of Centre St & Burrage St  Jamaica Plain  MA,9.0,02,6.0,E13,Jamaica Plain,11.0,Ward 19,1905.0,,INTERSECTION Centre St & Burrage St,,Intersection,2681.0,42.316,-71.114,Constituent Call,"(42.316, -71.114)"
573204,101001399342,05/31/2015 09:54:00 PM,06/02/2015 08:30:00 AM,06/02/2015 05:31:03 PM,OVERDUE,Closed,Case Closed. Closed date : 2015-06-02 17:31:03.74 Case Resolved dead nstar service to slcb. put on tie connection to slcb #1264. joubert/conary,PRINTED,Public Works Department,Street Lights,Major System Failure,PWDx_Major System Failure,PWDx,,,INTERSECTION of Adams St & Winter St  Dorchester  MA,7.0,03,3.0,C11,Dorchester,8.0,Ward 15,1504.0,,INTERSECTION Adams St & Winter St,,Intersection,74.0,42.3075,-71.0627,Constituent Call,"(42.3075, -71.0627)"
573781,101001400141,06/01/2015 08:30:00 PM,06/03/2015 08:30:00 AM,06/01/2015 10:42:38 PM,ONTIME,Closed,Case Closed. Closed date : 2015-06-01 22:42:38.593 Case Resolved Replaced 100 Amp breaker on red and blue legs---Red leg read 33 Amps blue leg read 30 Amps  B Keane M O'Leary,PRINTED///Major System Failure,Public Works Department,Street Lights,Major System Failure,PWDx_Major System Failure,PWDx,,,INTERSECTION of Blakemore St & Hyde Park Ave  Roslindale  MA,12.0,02,5.0,E18,Roslindale,10.0,Ward 18,1807.0,,INTERSECTION Blakemore St & Hyde Park Ave,,Intersection,1487.0,42.2855,-71.1188,Constituent Call,"(42.2855, -71.1188)"
573794,101001400163,06/01/2015 10:44:00 PM,06/03/2015 08:30:00 AM,07/20/2015 01:39:23 PM,OVERDUE,Closed,Case Closed. Closed date : 2015-07-20 13:39:23.71 Case Resolved,PRINTED SENT TO MAVERICK //,Public Works Department,Street Lights,Major System Failure,PWDx_Street Light_Pending_Contractor (Internal),PWDx,,,INTERSECTION of Elm Hill Ave & Seaver St  Dorchester  MA,9.0,10B,7.0,B2,Roxbury,13.0,Ward 12,1207.0,,INTERSECTION Elm Hill Ave & Seaver St,,Intersection,4528.0,42.3076,-71.089,Constituent Call,"(42.3076, -71.089)"
574389,101001401061,06/02/2015 08:54:00 PM,06/04/2015 08:30:00 AM,06/02/2015 09:46:57 PM,ONTIME,Closed,Case Closed. Closed date : 2015-06-02 21:46:57.07 Duplicate of Existing Case,Major System Failure,Public Works Department,Street Lights,Major System Failure,PWDx_Major System Failure,PWDx,,,8 Asticou Rd  Roslindale  MA  02131,12.0,02,6.0,E13,Jamaica Plain,11.0,Ward 19,1902.0,R2,8 Asticou Rd,2131.0,Address,161673.0,42.3002,-71.115,Constituent Call,"(42.3002, -71.115)"
575029,101001402043,06/03/2015 09:23:00 PM,06/05/2015 08:30:00 AM,06/03/2015 10:55:46 PM,ONTIME,Closed,Case Closed. Closed date : 2015-06-03 22:55:46.527 Case Resolved Dead N-Star leg jumped to active leg Blue leg dead --- will notify Dennis --- SLCB#1243,Major System Failure////printed,Public Works Department,Street Lights,Major System Failure,PWDx_Major System Failure,PWDx,,,INTERSECTION of Shawmut Ave & W Springfield St  Roxbury  MA,4.0,1C,7.0,D4,South End,6.0,Ward 9,902.0,,INTERSECTION Shawmut Ave & W Springfield St,,Intersection,8347.0,42.3378,-71.0773,Constituent Call,"(42.3378, -71.0773)"
575030,101001402046,06/03/2015 09:37:00 PM,06/05/2015 08:30:00 AM,06/03/2015 10:57:19 PM,ONTIME,Closed,Case Closed. Closed date : 2015-06-03 22:57:19.517 Case Resolved Dead N-Star leg jumped to active leg --- Blue leg dead SLCB#1243 Will notify Dennis,Major System Failure////printed,Public Works Department,Street Lights,Major System Failure,PWDx_Major System Failure,PWDx,,,INTERSECTION of W Newton St & Shawmut Ave  Roxbury  MA,4.0,1C,2.0,D4,South End,6.0,Ward 9,901.0,,INTERSECTION W Newton St & Shawmut Ave,,Intersection,7579.0,42.3397,-71.0746,Constituent Call,"(42.3397, -71.0746)"
575046,101001402065,06/04/2015 03:32:00 AM,06/05/2015 08:30:00 AM,06/04/2015 04:51:47 AM,ONTIME,Closed,Case Closed. Closed date : 2015-06-04 04:51:47.323 Case Resolved Left System On Constant,Major System Failure,Public Works Department,Street Lights,Major System Failure,PWDx_Major System Failure,PWDx,,,,,,,,,,,,,,,,,42.3594,-71.0587,Employee Generated,"(0, 0)"
576372,101001403993,06/06/2015 09:55:00 PM,06/09/2015 08:30:00 AM,06/08/2015 03:25:46 PM,ONTIME,Closed,Case Closed. Closed date : 2015-06-08 15:25:46.813 Case Resolved,PRINTED,Public Works Department,Street Lights,Major System Failure,PWDx_Major System Failure,PWDx,,,INTERSECTION of M St & E Third St  South Boston  MA,6.0,05,2.0,C6,South Boston / South Boston Waterfront,5.0,Ward 6,607.0,,INTERSECTION M St & E Third St,,Intersection,6972.0,42.3365,-71.0334,Constituent Call,"(42.3365, -71.0334)"
576677,101001404506,06/08/2015 09:58:00 AM,06/09/2015 09:58:09 AM,06/08/2015 12:02:56 PM,ONTIME,Closed,Case Closed. Closed date : 2015-06-08 12:02:56.47 Case Resolved,PRINTED// Faxed to SL-1,Public Works Department,Street Lights,Major System Failure,PWDx_Major System Failure,PWDx,,,56 Rev Richard A Burke St  South Boston  MA  02127,6.0,05,2.0,C6,South Boston / South Boston Waterfront,5.0,07,706.0,,56 Rev Richard A Burke St,2127.0,Address,162746.0,42.331,-71.0502,Constituent Call,"(42.331, -71.0502)"
577608,101001405853,06/09/2015 01:34:00 PM,06/10/2015 01:34:51 PM,06/09/2015 02:53:56 PM,ONTIME,Closed,Case Closed. Closed date : 2015-06-09 14:53:56.067 Case Resolved CREW CHECKED CONTROL CIRCUIT RESET BREAKERS ALL LIGHTS WORKING NORMAL NOW  D.PRIOLEAU   T . HARVEY,PRINTED,Public Works Department,Street Lights,Major System Failure,PWDx_Major System Failure,PWDx,,,27 Fayston St  Dorchester  MA  02121,7.0,03,4.0,B2,Roxbury,13.0,Ward 14,1401.0,R3,27 Fayston St,2121.0,Address,234067.0,42.3132,-71.0778,Constituent Call,"(42.3132, -71.0778)"
577846,101001406198,06/10/2015 01:06:00 AM,06/11/2015 08:30:00 AM,06/10/2015 05:02:50 AM,ONTIME,Closed,Case Closed. Closed date : 2015-06-10 05:02:50.21 Case Resolved Contractor Using SLCB  Reset Clock,Major System Failure,Public Works Department,Street Lights,Major System Failure,PWDx_Major System Failure,PWDx,,,,,,,,,,,,,,,,,42.3594,-71.0587,Employee Generated,"(0, 0)"
578393,101001407023,06/10/2015 09:34:00 PM,06/12/2015 08:30:00 AM,06/11/2015 04:14:16 PM,ONTIME,Closed,Case Closed. Closed date : 2015-06-11 16:14:16.423 Case Resolved isolated short circuit. further repairs to be made. jd/md,Major System Failure/printed,Public Works Department,Street Lights,Major System Failure,PWDx_Major System Failure,PWDx,,,572 Freeport St  Dorchester  MA  02122,8.0,07,3.0,C11,Dorchester,7.0,Ward 16,1610.0,C,572 Freeport St,2122.0,Address,60897.0,42.2917,-71.0479,Constituent Call,"(42.2917, -71.0479)"
579935,101001409405,06/14/2015 09:37:00 PM,07/02/2015 04:58:00 PM,07/01/2015 04:59:08 PM,ONTIME,Closed,Case Closed. Closed date : 2015-07-01 16:59:08.2 Case Resolved w/o completd. replaced 250 mv on the train track. 6/30/15. conary/joubert,PRINTED,Public Works Department,Street Lights,Major System Failure,PWDx_Street Light Outages,PWDx,,,INTERSECTION of Huntington Ave & Wigglesworth St  Boston  MA,4.0,10A,8.0,B2,Fenway / Kenmore / Audubon Circle / Longwood,14.0,Ward 4,410.0,,INTERSECTION Huntington Ave & Wigglesworth St,,Intersection,6424.0,42.3352,-71.1024,Constituent Call,"(42.3352, -71.1024)"
579980,101001409481,06/15/2015 08:18:00 AM,06/16/2015 08:30:00 AM,06/16/2015 12:03:34 PM,OVERDUE,Closed,Case Closed. Closed date : 2015-06-16 12:03:34.68 Case Resolved Was able to track down the short to PB# 091305. The #10 cables in this conduit are damaged and need to be removed and replaced -w- new ones. Cables didn't move and snaking it was unsuccessful. Will need to take post down and clear conduit. Will issue a new work order to do so.  T Harvey/ H Tyra,PRINTED,Public Works Department,Street Lights,Major System Failure,PWDx_Major System Failure,PWDx,,,644-646 E Third St  South Boston  MA  02127,6.0,05,2.0,C6,South Boston / South Boston Waterfront,5.0,Ward 6,607.0,R2,644-646 E Third St,2127.0,Address,135077.0,42.3367,-71.0341,Constituent Call,"(42.3367, -71.0341)"
580975,101001410948,06/16/2015 10:36:00 PM,06/18/2015 08:30:00 AM,06/17/2015 03:55:31 AM,ONTIME,Closed,Case Closed. Closed date : 2015-06-17 03:55:31.657 Case Resolved Replaced Photo Eye,PRINTED,Public Works Department,Street Lights,Major System Failure,PWDx_Major System Failure,PWDx,,,44 Rockvale Cir  Jamaica Plain  MA  02130,9.0,02,6.0,E13,Jamaica Plain,11.0,Ward 11,1107.0,R3,44 Rockvale Cir,2130.0,Address,117817.0,42.3071,-71.1044,Constituent Call,"(42.3071, -71.1044)"
581694,101001412044,06/17/2015 10:48:00 PM,06/19/2015 08:30:00 AM,06/24/2015 11:34:01 AM,OVERDUE,Closed,Case Closed. Closed date : 2015-06-24 11:34:01.837 Case Resolved CASE RESOLVED OVERHEAD FEED CABLES HAVE BEEN REINSTALLED & RESPLICED LIGHTS ARE WORKING NORMAL NOW,PRINTED,Public Works Department,Street Lights,Major System Failure,PWDx_Major System Failure,PWDx,,,3 Dorchester St  South Boston  MA  02127,6.0,05,2.0,C6,South Boston / South Boston Waterfront,5.0,Ward 6,604.0,CM,3 Dorchester St,2127.0,Address,164352.0,42.3377,-71.0435,Constituent Call,"(42.3377, -71.0435)"
581714,101001412071,06/18/2015 03:43:00 AM,06/19/2015 08:30:00 AM,06/18/2015 05:41:30 AM,ONTIME,Closed,Case Closed. Closed date : 2015-06-18 05:41:30.76 Case Resolved Taped & Secured Wires,Major System Failure,Public Works Department,Street Lights,Major System Failure,PWDx_Major System Failure,PWDx,,,,,,,,,,,,,,,,,42.3594,-71.0587,Employee Generated,"(0, 0)"
582621,101001413479,06/19/2015 02:16:00 PM,06/22/2015 02:16:17 PM,06/24/2015 11:37:43 AM,OVERDUE,Closed,Case Closed. Closed date : 2015-06-24 11:37:43.677 Case Resolved OVERHEAD FEED CABLES HAVE BEEN REINSTALLED & RESPLICED ALL LIGHTS ARE WORKING NORMAL NOW,PRINTED,Public Works Department,Street Lights,Major System Failure,PWDx_Major System Failure,PWDx,,,3 Dorchester St  South Boston  MA  02127,6.0,05,2.0,C6,South Boston / South Boston Waterfront,5.0,Ward 6,604.0,CM,3 Dorchester St,2127.0,Address,164352.0,42.3377,-71.0435,Constituent Call,"(42.3377, -71.0435)"
582735,101001413633,06/19/2015 05:12:00 PM,06/23/2015 08:30:00 AM,06/19/2015 10:02:15 PM,ONTIME,Closed,Case Closed. Closed date : 2015-06-19 22:02:15.37 Case Resolved repaired cables in slcb. kb/kk,Major System Failure////printed,Public Works Department,Street Lights,Major System Failure,PWDx_Major System Failure,PWDx,,,INTERSECTION of First Ave & Sixteenth St  Charlestown  MA,3.0,1A,1.0,A15,Charlestown,2.0,Ward 2,202.0,,INTERSECTION First Ave & Sixteenth St,,Intersection,4926.0,42.3779,-71.0496,Constituent Call,"(42.3779, -71.0496)"
583841,101001415240,06/22/2015 09:51:00 PM,06/24/2015 08:30:00 AM,06/24/2015 04:06:50 PM,OVERDUE,Closed,Case Closed. Closed date : 2015-06-24 16:06:50.603 Case Resolved Photo eye installed 6/23/15 K Buckley K Kelley,PRINTED///See Note,Public Works Department,Street Lights,Major System Failure,PWDx_Major System Failure,PWDx,,,INTERSECTION of Farragut Rd & E First St  South Boston  MA,6.0,05,2.0,C6,South Boston / South Boston Waterfront,5.0,Ward 6,609.0,,INTERSECTION Farragut Rd & E First St,,Intersection,4812.0,42.3383,-71.0251,Constituent Call,"(42.3383, -71.0251)"
