,CASE_ENQUIRY_ID,OPEN_DT,TARGET_DT,CLOSED_DT,OnTime_Status,CASE_STATUS,CLOSURE_REASON,CASE_TITLE,SUBJECT,REASON,TYPE,QUEUE,Department,SubmittedPhoto,ClosedPhoto,Location,fire_district,pwd_district,city_council_district,police_district,neighborhood,neighborhood_services_district,ward,precinct,land_usage,LOCATION_STREET_NAME,LOCATION_ZIPCODE,Property_Type,Property_ID,LATITUDE,LONGITUDE,Source,Geocoded_Location
469709,101001241104,01/02/2015 09:55:52 AM,,01/07/2015 09:29:30 AM,ONTIME,Closed,"Case Closed Case Noted Dog rules signs apply to park.  ""No dogs allowed"" signs apply to the fenced in ball field area.  If you have any questions  please contact the Parkline at 617-635-7275. Thank you.",Parks General Request,Parks & Recreation Department,Administrative & General Requests,Parks General Request,PARK_Maintenance_Trades,PARK,,,239 Parker Hill Ave  Mission Hill  MA  02120,9.0,10A,8.0,B2,Mission Hill,14.0,10,1005.0,,239 Parker Hill Ave,2120.0,Address,342517.0,42.3594,-71.0587,Constituent Call,"(0, 0)"
470955,101001242908,01/06/2015 09:44:25 AM,,01/06/2015 01:18:42 PM,ONTIME,Closed,Case Closed Case Resolved case resolved by verizon 1-6-15,Parks General Request,Parks & Recreation Department,Administrative & General Requests,Parks General Request,PARK_Administration,PARK,,,115 Boylston St  Boston  MA  02108,3.0,1C,8.0,A1,Beacon Hill,14.0,05,503.0,,115 Boylston St,2108.0,Address,342696.0,42.3594,-71.0587,Constituent Call,"(0, 0)"
474075,101001247477,01/14/2015 04:25:57 PM,,01/15/2015 09:40:46 AM,ONTIME,Closed,Case Closed Case Noted The tree i front of 51 Charlotte St. will be removed in the Spring.  If you have any questions  please contact the Parkline at 617-635-7275. Thank you.,Parks General Request,Parks & Recreation Department,Administrative & General Requests,Parks General Request,PARK_Administration,PARK,,,52 Charlotte St  Dorchester  MA  02121,7.0,03,4.0,B3,Greater Mattapan,8.0,Ward 14,1407.0,R3,52 Charlotte St,2121.0,Address,29893.0,42.299,-71.084,Constituent Call,"(42.299, -71.084)"
475916,101001249939,01/20/2015 07:34:14 AM,,01/22/2015 07:37:22 AM,ONTIME,Closed,Case Closed Case Resolved document the incidents if we get luckie and catch the person  we can go fouther with it.,Ground Maintenance: Franklin Park  William J. Devine Golf Course,Parks & Recreation Department,Administrative & General Requests,Parks General Request,PARK_Maintenance_Region 3,PARK,,,1 Jewish War Veterans Dr  Jamaica Plain  MA  02130,9.0,02,7.0,B2,Greater Mattapan,13.0,12,1207.0,E,1 Jewish War Veterans Dr,2130.0,Address,163434.0,42.301,-71.0886,Constituent Call,"(42.301, -71.0886)"
476144,101001250289,01/20/2015 12:04:12 PM,,01/20/2015 12:50:54 PM,ONTIME,Closed,Case Closed Case Noted Lead items such granite and metal need to be fabricated.  Visible work on the site will probably start in late January.  Contract is set up for winter placement of concrete  so it should be open for use in early spring.  If you have any questions  please contact Parks and Recreation Design and Cosntruction Division at 617-635-4505. Thank you.,Parks General Request,Parks & Recreation Department,Administrative & General Requests,Parks General Request,PARK_Administration,PARK,,,33 Beacon St  Boston  MA  02108,3.0,1B,8.0,A1,Downtown / Financial District,14.0,Ward 5,503.0,E,33 Beacon St,2108.0,Address,11072.0,42.3574,-71.0648,Constituent Call,"(42.3574, -71.0648)"
476259,101001250482,01/20/2015 02:10:00 PM,,,ONTIME,Open,,Parks General Request,Parks & Recreation Department,Administrative & General Requests,Parks General Request,PARK_Maintenance_Ground Maintenance,PARK,,,550 Bennington St  East Boston  MA  02128,1.0,09,1.0,A7,East Boston,1.0,1,111.0,,550 Bennington St,2128.0,Address,342518.0,42.3594,-71.0587,Constituent Call,"(0, 0)"
476504,101001250861,01/21/2015 09:19:10 AM,,01/22/2015 07:38:36 AM,ONTIME,Closed,Case Closed Case Noted The Boston Parks Department does not fix  repair or pay for pipes to be fixed. The Boston Parks Department will only remove the tree and grind the stump once proper documentation is received. For the Boston Parks Department to remove a healthy shade tree we need proof of the roots damaging the pipes. Proof would include pictures and bills from a plumber that show the roots from the City tree growing into the pipes. Until then the tree will not be removed. Proof can be sent to 1010 Massachusetts Ave Boston  MA 02118 3rd floor. Attn: Tree Maintenance Division.,Parks General Request,Parks & Recreation Department,Administrative & General Requests,Parks General Request,PARK_Tree Maintenance Request,PARK,,,2 Saint Charles St  Boston  MA  02116,4.0,1C,2.0,D4,South End,6.0,Ward 5,501.0,R1,2 Saint Charles St,2116.0,Address,120987.0,42.347,-71.0721,Constituent Call,"(42.347, -71.0721)"
477371,101001252225,01/22/2015 11:26:12 PM,,01/23/2015 08:38:05 AM,ONTIME,Closed,Case Closed Case Resolved,Parks General Request,Parks & Recreation Department,Administrative & General Requests,Parks General Request,PARK_Administration,PARK,,,38 Beacon St  Boston  MA  02108,3.0,1C,8.0,A1,Beacon Hill,14.0,05,503.0,E,38 Beacon St,2108.0,Address,341748.0,42.3559,-71.0657,Constituent Call,"(42.3559, -71.0657)"
483811,101001260795,01/29/2015 09:05:13 AM,,01/29/2015 04:54:14 PM,ONTIME,Closed,Case Closed Case Resolved Walkways plowed Jan 29  2015.,Ground Maintenance: Ringer Playground  Ringer Playground,Parks & Recreation Department,Administrative & General Requests,Parks General Request,PARK_Maintenance_Region 4,PARK,,,85 Allston St  Allston  MA  02134,11.0,04,9.0,D14,Allston,15.0,21,2106.0,,85 Allston St,2134.0,Address,342014.0,42.3594,-71.0587,Constituent Call,"(0, 0)"
485968,101001264109,01/30/2015 09:59:55 AM,,02/04/2015 02:45:28 PM,ONTIME,Closed,Case Closed Case Resolved done,Ground Maintenance: Peters Park  Peter's Park,Parks & Recreation Department,Administrative & General Requests,Parks General Request,PARK_Maintenance_Region 5,PARK,,,230 Shawmut Ave  Roxbury  MA  02118,4.0,1C,2.0,D4,Roxbury,4.0,3,307.0,,230 Shawmut Ave,2118.0,Address,342571.0,42.3594,-71.0587,Constituent Call,"(0, 0)"
486719,101001265344,01/30/2015 06:17:26 PM,,02/04/2015 03:14:24 PM,ONTIME,Closed,Case Closed Case Resolved  Cleared on 2/4/15.,Ground Maintenance: Ronan Park  Ronan Park,Parks & Recreation Department,Administrative & General Requests,Parks General Request,PARK_Maintenance_Region 2,PARK,,,92 Mount Ida Rd  Dorchester  MA  02122,7.0,03,3.0,C11,Dorchester,8.0,15,1509.0,,92 Mount Ida Rd,2122.0,Address,342620.0,42.3594,-71.0587,Constituent Call,"(0, 0)"
490763,101001270853,02/03/2015 02:25:43 PM,,02/08/2015 08:57:24 AM,ONTIME,Closed,Case Closed Case Resolved jefferies st plowed,Ground Maintenance: Porzio Park  Porzio Park I,Parks & Recreation Department,Administrative & General Requests,Parks General Request,PARK_Maintenance_Region 1,PARK,,,14 Jeffries St  East Boston  MA  02128,1.0,09,1.0,A7,East Boston,1.0,01,101.0,,14 Jeffries St,2128.0,Address,344483.0,42.3594,-71.0587,Constituent Call,"(0, 0)"
491297,101001271607,02/03/2015 05:20:14 PM,,02/04/2015 09:25:10 AM,ONTIME,Closed,Case Closed Case Noted Noted.,Parks General Request,Parks & Recreation Department,Administrative & General Requests,Parks General Request,PARK_Administration,PARK,,,130 Commonwealth Ave  Boston  MA  02116,4.0,1C,8.0,D4,Back Bay,14.0,Ward 5,507.0,R1,130 Commonwealth Ave,2116.0,Address,37284.0,42.3517,-71.0773,Constituent Call,"(42.3517, -71.0773)"
491800,101001272276,02/03/2015 08:14:42 PM,,02/04/2015 09:25:39 AM,ONTIME,Closed,Case Closed Case Noted Closed as noted.,Parks General Request,Parks & Recreation Department,Administrative & General Requests,Parks General Request,PARK_Administration,PARK,,,125 Arborway  Jamaica Plain  MA  02130,9.0,02,6.0,E13,Jamaica Plain,11.0,19,1902.0,E,125 Arborway,2130.0,Address,341526.0,42.3012,-71.1228,Constituent Call,"(42.3012, -71.1228)"
500867,101001285531,02/10/2015 01:07:36 PM,,02/11/2015 08:08:11 AM,ONTIME,Closed,Case Closed Duplicate of Existing Case Same as #1285517.,Parks General Request,Parks & Recreation Department,Administrative & General Requests,Parks General Request,PARK_Administration,PARK,,,INTERSECTION of Atlantic Ave & Cross St  Boston  MA,3.0,1B,1.0,A1,Downtown / Financial District,3.0,Ward 3,301.0,,INTERSECTION Atlantic Ave & Cross St,,Intersection,735.0,42.361,-71.0526,Constituent Call,"(42.361, -71.0526)"
501129,101001285877,02/10/2015 02:48:54 PM,,,ONTIME,Open,,Parks General Request,Parks & Recreation Department,Administrative & General Requests,Parks General Request,PARK_Maintenance_Trades,PARK,,,330 Perkins St  Jamaica Plain  MA  02130,9.0,02,6.0,E13,Jamaica Plain,11.0,19,1903.0,,330 Perkins St,2130.0,Address,347229.0,42.3594,-71.0587,Constituent Call,"(0, 0)"
518738,101001310777,02/22/2015 10:08:22 AM,,02/27/2015 12:16:44 PM,ONTIME,Closed,Case Closed Case Noted Lindsey Simpson was contacted. She could not say who told her that the gate would be unlocked.  A permit is required to use Rotch.  For furture refeference  she was advised contact Parks Permitting for possible use of the field.,Parks General Request,Parks & Recreation Department,Administrative & General Requests,Parks General Request,PARK_Administration,PARK,,,INTERSECTION of Albany St & Randolph St  Roxbury  MA,4.0,1C,2.0,D4,South End,4.0,Ward 3,307.0,,INTERSECTION Albany St & Randolph St,,Intersection,212.0,42.341,-71.0635,Constituent Call,"(42.341, -71.0635)"
528044,101001324658,03/05/2015 09:27:00 AM,,,ONTIME,Open,,Parks General Request,Parks & Recreation Department,Administrative & General Requests,Parks General Request,INFO01_GenericeFormforOtherServiceRequestTypes,INFO,,,131 Hancock St  Dorchester  MA  02125,7.0,03,3.0,C11,Dorchester,8.0,Ward 15,1504.0,E,131 Hancock St,2125.0,Address,68883.0,42.3113,-71.0635,Constituent Call,"(42.3113, -71.0635)"
528905,101001325920,03/06/2015 11:00:32 AM,,03/06/2015 11:22:21 AM,ONTIME,Closed,Case Closed Case Noted The turf is currently being renovated. The field will be reseeded as part of the renovation.  There are no plans for trees  shrubs etc.,Parks General Request,Parks & Recreation Department,Administrative & General Requests,Parks General Request,PARK_Administration,PARK,,,4114 Washington St  Roslindale  MA  02131,12.0,02,5.0,E5,Roslindale,10.0,Ward 19,1913.0,R3,4114 Washington St,2131.0,Address,145125.0,42.2893,-71.1247,Constituent Call,"(42.2893, -71.1247)"
530495,101001328453,03/10/2015 07:58:29 AM,,03/12/2015 07:17:46 AM,ONTIME,Closed,Case Closed Case Resolved barrels emptied,Ground Maintenance: Brophy Park,Parks & Recreation Department,Administrative & General Requests,Parks General Request,PARK_Maintenance_Region 1,PARK,,,425 Sumner St  East Boston  MA  02128,1.0,09,1.0,A7,East Boston,1.0,Ward 1,101.0,E,425 Sumner St,2128.0,Address,155790.0,42.3655,-71.0326,Constituent Call,"(42.3655, -71.0326)"
531585,101001330123,03/11/2015 11:52:37 AM,,03/11/2015 12:41:30 PM,ONTIME,Closed,Case Closed Case Resolved  This is the maintenance building at the Boston Common known as Deer Park.  Park staff actually reported this to our department contact.  Contractor has been notified.,Parks General Request,Parks & Recreation Department,Administrative & General Requests,Parks General Request,PARK_Administration,PARK,,,115 Boylston St  Boston  MA  02108,3.0,1C,8.0,A1,Beacon Hill,14.0,05,503.0,,115 Boylston St,2108.0,Address,342696.0,42.3594,-71.0587,Constituent Call,"(0, 0)"
532140,101001331003,03/12/2015 09:48:54 AM,,03/12/2015 09:52:09 AM,ONTIME,Closed,Case Closed Case Invalid Case created in error for incorrect cue.,Parks General Request,Parks & Recreation Department,Administrative & General Requests,Parks General Request,PARK_Administration,PARK,,,49 Vine St  Charlestown  MA  02129,3.0,1A,1.0,A15,Charlestown,2.0,Ward 2,202.0,E,49 Vine St,2129.0,Address,140718.0,42.3772,-71.0568,Constituent Call,"(42.3772, -71.0568)"
532389,101001331311,03/12/2015 12:13:31 PM,,03/13/2015 12:32:10 PM,ONTIME,Closed,Case Closed Case Resolved . roden found and disposed of,Parks General Request,Parks & Recreation Department,Administrative & General Requests,Parks General Request,PARK_Maintenance_Region 1,PARK,,,1 Park St  Boston  MA  02108,3.0,1B,1.0,A1,Downtown / Financial District,3.0,Ward 3,306.0,E,1 Park St,2108.0,Address,107188.0,42.357,-71.0622,Constituent Call,"(42.357, -71.0622)"
532952,101001332151,03/13/2015 09:58:49 AM,,03/13/2015 03:30:04 PM,ONTIME,Closed,Case Closed Case Noted  Parks is aware if the issue.  Contractor has been notified.,Parks General Request,Parks & Recreation Department,Administrative & General Requests,Parks General Request,PARK_Administration,PARK,,,115 Boylston St  Boston  MA  02108,3.0,1C,8.0,A1,Beacon Hill,14.0,05,503.0,,115 Boylston St,2108.0,Address,342696.0,42.3594,-71.0587,Constituent Call,"(0, 0)"
533594,101001332986,03/13/2015 09:07:22 PM,,03/16/2015 09:33:59 AM,ONTIME,Closed,Case Closed Case Noted Contractor will be notified.,Parks General Request,Parks & Recreation Department,Administrative & General Requests,Parks General Request,PARK_Administration,PARK,,,115 Boylston St  Boston  MA  02108,3.0,1C,8.0,A1,Beacon Hill,14.0,05,503.0,,115 Boylston St,2108.0,Address,342696.0,42.3594,-71.0587,Constituent Call,"(0, 0)"
535249,101001335411,03/17/2015 04:28:26 PM,,03/25/2015 10:36:28 AM,ONTIME,Closed,Case Closed Case Noted no work was done by the Boston parks department at this location there are no limbs on the ground,Parks General Request,Parks & Recreation Department,Administrative & General Requests,Parks General Request,PARK_Tree Maintenance Request,PARK,,,61 Ashley St  East Boston  MA  02128,1.0,09,1.0,A7,East Boston,1.0,Ward 1,113.0,E,61 Ashley St,2128.0,Address,5273.0,42.3885,-71.0072,Constituent Call,"(42.3885, -71.0072)"
535264,101001335430,03/17/2015 04:43:19 PM,,03/20/2015 02:26:25 PM,ONTIME,Closed,Case Closed Case Resolved  Parks is aware of the problem.  Verizon is working the problem.,Parks General Request,Parks & Recreation Department,Administrative & General Requests,Parks General Request,PARK_Administration,PARK,,,115 Boylston St  Boston  MA  02108,3.0,1C,8.0,A1,Beacon Hill,14.0,05,503.0,,115 Boylston St,2108.0,Address,342696.0,42.3594,-71.0587,Constituent Call,"(0, 0)"
535808,101001336114,03/18/2015 10:35:38 AM,,03/18/2015 01:21:20 PM,ONTIME,Closed,Case Closed Case Noted,Parks General Request,Parks & Recreation Department,Administrative & General Requests,Parks General Request,PARK_Administration,PARK,,,369 Lagrange St  West Roxbury  MA  02132,12.0,06,6.0,E5,West Roxbury,12.0,20,2014.0,E,369 Lagrange St,2132.0,Address,166825.0,42.2803,-71.1569,Constituent Call,"(42.2803, -71.1569)"
539344,101001340946,03/24/2015 03:04:08 PM,,03/25/2015 07:24:56 AM,ONTIME,Closed,Case Closed Case Noted System was checked.,Parks General Request,Parks & Recreation Department,Administrative & General Requests,Parks General Request,PARK_Administration,PARK,,,139 Tremont St  Boston  MA  02108,3.0,1C,8.0,A1,Beacon Hill,14.0,05,503.0,E,139 Tremont St,2108.0,Address,341542.0,42.3554,-71.0638,Constituent Call,"(42.3554, -71.0638)"
539361,101001340969,03/24/2015 03:14:02 PM,,03/25/2015 11:19:12 AM,ONTIME,Closed,Case Closed Case Noted Park is managed by John Hancock.  Site is now open.  Maintenance will be scheduled ASAP.,Parks General Request,Parks & Recreation Department,Administrative & General Requests,Parks General Request,PARK_Administration,PARK,,,INTERSECTION of Clarendon St & Stanhope St  Boston  MA,4.0,1C,2.0,D4,Back Bay,6.0,Ward 4,402.0,,INTERSECTION Clarendon St & Stanhope St,,Intersection,3073.0,42.3481,-71.074,Constituent Call,"(42.3481, -71.074)"
539556,101001341265,03/25/2015 08:23:46 AM,,03/25/2015 09:12:09 AM,ONTIME,Closed,Case Closed Case Noted Sent to Steve Healy.,Parks General Request,Parks & Recreation Department,Administrative & General Requests,Parks General Request,PARK_Administration,PARK,,,139 Tremont St  Boston  MA  02108,3.0,1C,8.0,A1,Beacon Hill,14.0,05,503.0,E,139 Tremont St,2108.0,Address,341542.0,42.3554,-71.0638,Constituent Call,"(42.3554, -71.0638)"
540178,101001342085,03/25/2015 04:43:03 PM,,,ONTIME,Open,,Parks General Request,Parks & Recreation Department,Administrative & General Requests,Parks General Request,INFO01_GenericeFormforOtherServiceRequestTypes,INFO,,,120 Antwerp St  Brighton  MA  02135,11.0,04,9.0,D14,Brighton,15.0,22,2202.0,,120 Antwerp St,2135.0,Address,343304.0,42.3594,-71.0587,Constituent Call,"(0, 0)"
540235,101001342158,03/25/2015 06:38:12 PM,,03/31/2015 11:20:44 AM,ONTIME,Closed,Case Closed Case Noted Holdiay Lights are being removed by contractor.  Enforcement issues regarding smoking and skateboarding have been reported to the Park Rangers.,Parks General Request,Parks & Recreation Department,Administrative & General Requests,Parks General Request,PARK_Administration,PARK,,,139 Tremont St  Boston  MA  02108,3.0,1C,8.0,A1,Beacon Hill,14.0,05,503.0,E,139 Tremont St,2108.0,Address,341542.0,42.3554,-71.0638,Constituent Call,"(42.3554, -71.0638)"
540521,101001342583,03/26/2015 11:27:17 AM,,04/06/2015 02:49:09 PM,ONTIME,Closed,Case Closed Case Resolved done,Parks General Request,Parks & Recreation Department,Administrative & General Requests,Parks General Request,PARK_Maintenance_Trades,PARK,,,739 Huntington Ave  Boston  MA  02115,4.0,10A,8.0,B2,Mission Hill,14.0,Ward 10,1003.0,RC,739 Huntington Ave,2115.0,Address,255768.0,42.3341,-71.1055,Constituent Call,"(42.3341, -71.1055)"
541249,101001343647,03/27/2015 01:55:44 PM,,03/27/2015 04:07:49 PM,ONTIME,Closed,Case Closed Case Noted For questions regarding permit use  please contact Paul McCaffrey  Director of Permitting regarding this request.  paul.mccaffrey@boston.gov 617-635-4874. Thank you.,Parks General Request,Parks & Recreation Department,Administrative & General Requests,Parks General Request,PARK_Administration,PARK,,,72 Dale St  Roxbury  MA  02119,9.0,10B,7.0,B2,Roxbury,13.0,12,1203.0,R3,72 Dale St,2119.0,Address,45756.0,42.3214,-71.0864,Constituent Call,"(42.3214, -71.0864)"
541563,101001344058,03/28/2015 09:57:03 AM,,03/31/2015 07:51:19 AM,ONTIME,Closed,Case Closed Case Resolved no duck found when inspected,Ground Maintenance: Public Garden,Parks & Recreation Department,Administrative & General Requests,Parks General Request,PARK_Maintenance_Region 1,PARK,,,INTERSECTION of Arlington St & Beacon St  Boston  MA,4.0,1C,8.0,D4,Back Bay,14.0,Ward 5,505.0,,INTERSECTION Arlington St & Beacon St,,Intersection,575.0,42.3554,-71.0726,Constituent Call,"(42.3554, -71.0726)"
541734,101001344334,03/29/2015 02:04:26 PM,,03/30/2015 07:34:55 AM,ONTIME,Closed,Case Closed Case Noted People can use the turf field.,Parks General Request,Parks & Recreation Department,Administrative & General Requests,Parks General Request,PARK_Administration,PARK,,,INTERSECTION of Liverpool St & Sumner St  East Boston  MA,1.0,09,1.0,A7,East Boston,1.0,Ward 1,103.0,,INTERSECTION Liverpool St & Sumner St,,Intersection,6900.0,42.3701,-71.0426,Constituent Call,"(42.3701, -71.0426)"
542087,101001344826,03/30/2015 11:22:42 AM,,03/30/2015 11:53:34 AM,ONTIME,Closed,Case Closed Case Noted  Case hase been referred to the Permitting Division.,Parks General Request,Parks & Recreation Department,Administrative & General Requests,Parks General Request,PARK_Administration,PARK,,,INTERSECTION of Dale St & Washington St  Roxbury  MA,9.0,10B,7.0,B2,Roxbury,13.0,Ward 9,905.0,,INTERSECTION Dale St & Washington St,,Intersection,3843.0,42.3234,-71.0895,Constituent Call,"(42.3234, -71.0895)"
544224,101001347775,04/02/2015 12:06:21 PM,,04/02/2015 01:14:38 PM,ONTIME,Closed,Case Closed Case Noted Dog rules signs are currently posted at park.  BPD and or Animal Control are responsible for enforcement.,Parks General Request,Parks & Recreation Department,Administrative & General Requests,Parks General Request,PARK_Administration,PARK,,,INTERSECTION of D St & Flaherty Way  South Boston  MA,6.0,05,2.0,C6,South Boston / South Boston Waterfront,5.0,Ward 6,603.0,,INTERSECTION D St & Flaherty Way,,Intersection,3808.0,42.3375,-71.0524,Constituent Call,"(42.3375, -71.0524)"
545872,101001350074,04/06/2015 11:13:07 AM,,04/30/2015 02:40:03 PM,ONTIME,Closed,Case Closed Case Resolved,Parks General Request,Parks & Recreation Department,Administrative & General Requests,Parks General Request,PARK_Maintenance_Trades,PARK,,,45 Lambert Ave  Roxbury  MA  02119,7.0,10B,7.0,B2,Roxbury,13.0,9,905.0,,45 Lambert Ave,2119.0,Address,342504.0,42.3594,-71.0587,Constituent Call,"(0, 0)"
545925,101001350142,04/06/2015 11:51:40 AM,,04/08/2015 07:16:21 AM,ONTIME,Closed,Case Closed Case Resolved Copley Square is scheduled to be planted before the Marathon.,Parks General Request,Parks & Recreation Department,Administrative & General Requests,Parks General Request,PARK_Maintenance_Horticulture,PARK,,,560 Boylston St  Boston  MA  02116,4.0,1C,2.0,D4,Boston,6.0,04,402.0,,560 Boylston St,2116.0,Address,342031.0,42.3594,-71.0587,Constituent Call,"(0, 0)"
546098,101001350376,04/06/2015 03:12:37 PM,,01/05/2016 02:42:07 PM,ONTIME,Closed,Case Closed. Closed date : 2016-01-05 14:42:07.133 Case Resolved,Parks General Request,Parks & Recreation Department,Administrative & General Requests,Parks General Request,PARK_Park Improvement Requests,PARK,,,INTERSECTION of Adams St & Common St  Charlestown  MA,3.0,1A,1.0,A15,Charlestown,2.0,Ward 2,203.0,,INTERSECTION Adams St & Common St,,Intersection,56.0,42.3744,-71.0594,Constituent Call,"(42.3744, -71.0594)"
546667,101001351154,04/07/2015 02:04:01 PM,,04/10/2015 07:02:53 AM,ONTIME,Closed,Case Closed Case Resolved Tree fence was removed by MFD of the BPRD.,Parks General Request,Parks & Recreation Department,Administrative & General Requests,Parks General Request,PARK_Tree Maintenance Request,PARK,,,108 Newbury St  Boston  MA  02116,4.0,1C,8.0,D4,Back Bay,14.0,Ward 5,507.0,CM,108 Newbury St,2116.0,Address,156038.0,42.3512,-71.0757,Constituent Call,"(42.3512, -71.0757)"
547984,101001352838,04/09/2015 11:22:11 AM,,04/09/2015 11:52:06 AM,ONTIME,Closed,Case Closed Case Noted The Parks Dept. does not provide portable toilets for park use. In some cases portable toilets are provided for specific park events; however  portables toilets are not secured for playgrounds. Most park facilities dot have have public restrooms.  FYI  Lamartine and Green Street facilities are state facilities.  Those requests will be forwarded to the DCR.  If you have any questions  please contact the Parkline at 617-635-7275. Thank you.,Parks General Request,Parks & Recreation Department,Administrative & General Requests,Parks General Request,PARK_Administration,PARK,,,INTERSECTION of Robert St & South St  Roslindale  MA,9.0,06,5.0,E5,Roslindale,10.0,Ward 20,2004.0,,INTERSECTION Robert St & South St,,Intersection,8137.0,42.2884,-71.1354,Constituent Call,"(42.2884, -71.1354)"
547986,101001352841,04/09/2015 11:23:39 AM,,,ONTIME,Open,,Parks General Request,Parks & Recreation Department,Administrative & General Requests,Parks General Request,INFO01_GenericeFormforOtherServiceRequestTypes,INFO,,,INTERSECTION of Boylston St & Lamartine St  Jamaica Plain  MA,9.0,02,6.0,E13,Jamaica Plain,11.0,Ward 19,1904.0,,INTERSECTION Boylston St & Lamartine St,,Intersection,1797.0,42.317,-71.1049,Constituent Call,"(42.317, -71.1049)"
547989,101001352844,04/09/2015 11:24:59 AM,,,ONTIME,Open,,Parks General Request,Parks & Recreation Department,Administrative & General Requests,Parks General Request,INFO01_GenericeFormforOtherServiceRequestTypes,INFO,,,INTERSECTION of Cheshire St & Green St  Jamaica Plain  MA,9.0,02,6.0,E13,Jamaica Plain,11.0,Ward 19,1906.0,,INTERSECTION Cheshire St & Green St,,Intersection,2898.0,42.3117,-71.1098,Constituent Call,"(42.3117, -71.1098)"
549277,101001354696,04/13/2015 09:20:34 AM,,04/14/2015 03:03:15 PM,ONTIME,Closed,Case Closed Case Noted The Boston Parks Department re-plants all trees on major thoroughfares if they meet the planting requirements as this tree pit does. The department sends the letter to notify residents that the planting will occur and as the letter states the Department reserves the right to plant a tree in any City sidewalk.,Parks General Request,Parks & Recreation Department,Administrative & General Requests,Parks General Request,PARK_Administration,PARK,,,394 Bennington St  East Boston  MA  02128,1.0,09,1.0,A7,East Boston,1.0,Ward 1,110.0,R2,394 Bennington St,2128.0,Address,14725.0,42.3804,-71.0249,Constituent Call,"(42.3804, -71.0249)"
549541,101001355055,04/13/2015 01:11:00 PM,,01/12/2016 10:53:09 AM,ONTIME,Closed,Case Closed. Closed date : 2016-01-12 10:53:09.96 Case Noted This request will be reviewed for consideration:however  Franklin Park is over 500 acres.,Parks General Request,Parks & Recreation Department,Administrative & General Requests,Parks General Request,PARK_Maintenance_Trades,PARK,,,1 Jewish War Veterans Dr  Jamaica Plain  MA  02130,9.0,02,7.0,B2,Greater Mattapan,13.0,12,1207.0,E,1 Jewish War Veterans Dr,2130.0,Address,163434.0,42.301,-71.0886,Constituent Call,"(42.301, -71.0886)"
550873,101001356913,04/15/2015 10:36:58 AM,,04/17/2015 11:20:34 AM,ONTIME,Closed,Case Closed Case Noted When permitted  lights will be on until 11PM.  Unfortunately  the lights cannot be dimmed.,Parks General Request,Parks & Recreation Department,Administrative & General Requests,Parks General Request,PARK_Administration,PARK,,,25 Glendon St  East Boston  MA  02128,1.0,09,1.0,A7,East Boston,1.0,1,109.0,E,25 Glendon St,2128.0,Address,341999.0,42.3594,-71.0587,Constituent Call,"(0, 0)"
552720,101001359567,04/18/2015 03:40:06 PM,,05/12/2015 02:11:32 PM,ONTIME,Closed,Case Closed Case Noted  The City of Boston Parks & Recreation Department reserves the right to plant a new tree in any City of Boston sidewalk. The City maintains the tree throughout its life span.,Parks General Request,Parks & Recreation Department,Administrative & General Requests,Parks General Request,PARK_Administration,PARK,,,86 Rosseter St  Dorchester  MA  02121,7.0,03,4.0,C11,Dorchester,8.0,Ward 14,1404.0,R3,86 Rosseter St,2121.0,Address,118795.0,42.3034,-71.0739,Constituent Call,"(42.3034, -71.0739)"
554093,101001361508,04/22/2015 01:32:11 PM,,05/06/2015 12:02:32 PM,ONTIME,Closed,Case Closed. Closed date : 2015-05-06 12:02:32.857 Case Noted Construction is ongoing in Almont Park,Parks General Request,Parks & Recreation Department,Administrative & General Requests,Parks General Request,PARK_Park Improvement Requests,PARK,,,INTERSECTION of Almont St & Orlando St  Mattapan  MA,8.0,07,5.0,B3,Greater Mattapan,9.0,Ward 18,1803.0,,INTERSECTION Almont St & Orlando St,,Intersection,338.0,42.2763,-71.0973,Constituent Call,"(42.2763, -71.0973)"
554700,101001362296,04/23/2015 11:01:39 AM,,05/06/2015 12:00:38 PM,ONTIME,Closed,Case Closed. Closed date : 2015-05-06 12:00:38.453 Case Resolved all public garden signs in process of being changed,Parks General Request,Parks & Recreation Department,Administrative & General Requests,Parks General Request,PARK_Park Improvement Requests,PARK,,,INTERSECTION of Arlington St & Boylston St  Boston  MA,4.0,1C,8.0,A1,,14.0,Ward 5,503.0,,INTERSECTION Arlington St & Boylston St,,Intersection,583.0,42.3519,-71.0707,Constituent Call,"(42.3519, -71.0707)"
555532,101001363443,04/24/2015 03:26:33 PM,,04/30/2015 02:24:34 PM,ONTIME,Closed,Case Closed Case Resolved,Ground Maintenance: Mozart St. Playground  Mozart Street Playground,Parks & Recreation Department,Administrative & General Requests,Parks General Request,PARK_Maintenance_Ground Maintenance,PARK,,,10 Mozart St  Jamaica Plain  MA  02130,9.0,10A,6.0,E13,Jamaica Plain,11.0,10,1007.0,E,10 Mozart St,2130.0,Address,341941.0,42.3224,-71.1045,Constituent Call,"(42.3224, -71.1045)"
555890,101001364066,04/26/2015 02:46:23 PM,,04/27/2015 09:43:09 AM,ONTIME,Closed,Case Closed Case Noted Company will be notified to schedule cleaning.,Parks General Request,Parks & Recreation Department,Administrative & General Requests,Parks General Request,PARK_Administration,PARK,,,300 Gardner St  West Roxbury  MA  02132,12.0,06,6.0,E5,West Roxbury,12.0,20,2017.0,,300 Gardner St,2132.0,Address,342525.0,42.3594,-71.0587,Constituent Call,"(0, 0)"
556316,101001364633,04/27/2015 12:44:59 PM,,04/28/2015 11:07:19 AM,ONTIME,Closed,Case Closed Case Noted Parks is aware of the alarm issue. We're working with the alarm company to resolve the issue.,Parks General Request,Parks & Recreation Department,Administrative & General Requests,Parks General Request,PARK_Administration,PARK,,,220 Porter St  East Boston  MA  02128,1.0,09,1.0,A7,East Boston,1.0,01,105.0,CM,220 Porter St,2128.0,Address,168866.0,42.3712,-71.0298,Constituent Call,"(42.3712, -71.0298)"
556479,101001364833,04/27/2015 03:05:53 PM,,04/28/2015 07:45:29 AM,ONTIME,Closed,Case Closed Case Noted This vehicle will be brought in for maint.,Parks General Request,Parks & Recreation Department,Administrative & General Requests,Parks General Request,PARK_Administration,PARK,,,INTERSECTION of American Legion Hwy & Clare Ave  Hyde Park  MA,12.0,08,5.0,E18,Hyde Park,10.0,Ward 18,1808.0,,INTERSECTION American Legion Hwy & Clare Ave,,Intersection,384.0,42.2725,-71.119,Constituent Call,"(42.2725, -71.119)"
556815,101001365294,04/28/2015 10:01:44 AM,,04/28/2015 02:08:25 PM,ONTIME,Closed,Case Closed Case Noted The City of Boston Parks & Recreation Department reserves the right to plant a new tree in any City of Boston sidewalk. The City maintains the tree throughout its life span. If you ever have a maintenance request regarding the tree you can call 617-635-7275.,Parks General Request,Parks & Recreation Department,Administrative & General Requests,Parks General Request,PARK_Administration,PARK,,,258 Westville St  Dorchester  MA  02122,7.0,03,3.0,C11,Dorchester,8.0,Ward 15,1509.0,R1,258 Westville St,2122.0,Address,148937.0,42.3024,-71.0628,Constituent Call,"(42.3024, -71.0628)"
557933,101001366835,04/29/2015 06:00:11 PM,,04/30/2015 07:28:28 AM,ONTIME,Closed,Case Closed Case Noted The Police should be notified.,Parks General Request,Parks & Recreation Department,Administrative & General Requests,Parks General Request,PARK_Administration,PARK,,,30 Rogers Park Ave  Brighton  MA  02135,11.0,04,9.0,D14,Brighton,15.0,22,2210.0,,30 Rogers Park Ave,2135.0,Address,342618.0,42.3594,-71.0587,Constituent Call,"(0, 0)"
558731,101001367967,05/01/2015 10:11:00 AM,,06/03/2015 09:53:01 AM,ONTIME,Closed,Case Closed. Closed date : 2015-06-03 09:53:01.537 Case Resolved Constituent was contacted.  Staff Arborist was sent back to the site on multiple occassions.  Tree was planted. COB/Parks Dept. approved sidewalk planting.  If you have any questions  please contact the Parkline at 617-635-7275. Thank you.,Parks General Request,Parks & Recreation Department,Administrative & General Requests,Parks General Request,PARK_Administration,PARK,,,51 Richwood St  West Roxbury  MA  02132,12.0,06,6.0,E5,West Roxbury,12.0,Ward 20,2012.0,R1,51 Richwood St,2132.0,Address,115877.0,42.2866,-71.1594,Constituent Call,"(42.2866, -71.1594)"
559260,101001368877,05/03/2015 11:45:00 AM,,05/04/2015 10:27:10 AM,ONTIME,Closed,Case Closed. Closed date : 2015-05-04 10:27:10.033 Case Noted Parking is no parking in parks. All gates are locked after crews leave for the day.,Parks General Request,Parks & Recreation Department,Administrative & General Requests,Parks General Request,PARK_Administration,PARK,,,72 Dale St  Roxbury  MA  02119,9.0,10B,7.0,B2,Roxbury,13.0,12,1203.0,R3,72 Dale St,2119.0,Address,45756.0,42.3214,-71.0864,Constituent Call,"(42.3214, -71.0864)"
559272,101001368894,05/03/2015 12:17:00 PM,,05/04/2015 10:20:03 AM,ONTIME,Closed,Case Closed. Closed date : 2015-05-04 10:20:03.937 Case Noted This is not  a grass field it is artificial surface,Parks General Request,Parks & Recreation Department,Administrative & General Requests,Parks General Request,PARK_Administration,PARK,,,INTERSECTION of E Eagle St & Glendon St  East Boston  MA,1.0,09,1.0,A7,East Boston,1.0,Ward 1,109.0,,INTERSECTION E Eagle St & Glendon St,,Intersection,4372.0,42.3813,-71.0303,Constituent Call,"(42.3813, -71.0303)"
559315,101001368966,05/03/2015 04:41:00 PM,,05/04/2015 10:25:15 AM,ONTIME,Closed,Case Closed. Closed date : 2015-05-04 10:25:15.483 Case Noted Porto potty company will be notified.,Parks General Request,Parks & Recreation Department,Administrative & General Requests,Parks General Request,PARK_Administration,PARK,,,1005 Washington St  Dorchester  MA  02124,8.0,07,3.0,B3,Dorchester,7.0,17,1704.0,,1005 Washington St,2124.0,Address,342680.0,42.3594,-71.0587,Constituent Call,"(0, 0)"
562245,101001373306,05/08/2015 10:40:00 AM,,,ONTIME,Open,,Parks General Request,Parks & Recreation Department,Administrative & General Requests,Parks General Request,PARK_Park Improvement Requests,PARK,,,10 Brigham St  East Boston  MA  02128,1.0,09,1.0,A7,East Boston,1.0,1,101.0,E,10 Brigham St,2128.0,Address,341453.0,42.3594,-71.0587,Constituent Call,"(0, 0)"
564429,101001376578,05/13/2015 11:45:00 AM,,,ONTIME,Open,,Parks General Request,Parks & Recreation Department,Administrative & General Requests,Parks General Request,INFO01_GenericeFormforOtherServiceRequestTypes,INFO,,,300 Gardner St  West Roxbury  MA  02132,12.0,06,6.0,E5,West Roxbury,12.0,20,2017.0,,300 Gardner St,2132.0,Address,342525.0,42.3594,-71.0587,Constituent Call,"(0, 0)"
565922,101001378711,05/15/2015 09:13:00 PM,,06/18/2015 02:10:13 PM,ONTIME,Closed,Case Closed. Closed date : 2015-06-18 14:10:13.55 Case Noted park super reports no tractors on field,Parks General Request,Parks & Recreation Department,Administrative & General Requests,Parks General Request,PARK_Administration,PARK,,,INTERSECTION of Barlow St & Wachusett St  Jamaica Plain  MA,12.0,02,6.0,E13,Jamaica Plain,10.0,Ward 19,1907.0,,INTERSECTION Barlow St & Wachusett St,,Intersection,964.0,42.2967,-71.1129,Constituent Call,"(42.2967, -71.1129)"
566321,101001379278,05/17/2015 09:04:00 PM,,05/20/2015 12:24:14 PM,ONTIME,Closed,Case Closed. Closed date : 2015-05-20 12:24:14.797 Case Noted Case has been referred to Park Permitting Division.  League will be issued a notice/warning.,Parks General Request,Parks & Recreation Department,Administrative & General Requests,Parks General Request,PARK_Administration,PARK,,,INTERSECTION of Clancy Rd & Pleasant Hill Ave  Mattapan  MA,8.0,07,3.0,B3,Dorchester,7.0,Ward 17,1704.0,,INTERSECTION Clancy Rd & Pleasant Hill Ave,,Intersection,3050.0,42.2774,-71.0725,Constituent Call,"(42.2774, -71.0725)"
566573,101001379649,05/18/2015 10:59:00 AM,,05/18/2015 12:22:11 PM,ONTIME,Closed,Case Closed. Closed date : 2015-05-18 12:22:11.27 Case Noted The park is under construction  the signs will be installed when construction is completed.,Parks General Request,Parks & Recreation Department,Administrative & General Requests,Parks General Request,PARK_Administration,PARK,,,9 Eden St  Charlestown  MA  02129,3.0,1A,1.0,A15,Charlestown,2.0,Ward 2,206.0,R2,9 Eden St,2129.0,Address,51056.0,42.379,-71.068,Constituent Call,"(42.379, -71.068)"
566669,101001379777,05/18/2015 12:25:00 PM,,06/01/2015 04:24:28 PM,ONTIME,Closed,Case Closed Case Resolved  Pop Warner operates bathrooms from August to November  m-f 6-8 and Saturdays.  Bathrooms will can not be opened without supervision or attendant.,Parks General Request,Parks & Recreation Department,Administrative & General Requests,Parks General Request,PARK_Administration,PARK,,,369 Lagrange St  West Roxbury  MA  02132,12.0,06,6.0,E5,West Roxbury,12.0,20,2014.0,E,369 Lagrange St,2132.0,Address,166825.0,42.2803,-71.1569,Constituent Call,"(42.2803, -71.1569)"
567033,101001380340,05/19/2015 08:51:00 AM,,05/27/2015 11:24:09 AM,ONTIME,Closed,Case Closed. Closed date : 2015-05-27 11:24:09.823 Case Noted The Park Dept. will not be installing a structure to prevent bikes from entering the park.,Parks General Request,Parks & Recreation Department,Administrative & General Requests,Parks General Request,PARK_Maintenance_Trades,PARK,,,220 Porter St  East Boston  MA  02128,1.0,09,1.0,A7,East Boston,1.0,01,105.0,CM,220 Porter St,2128.0,Address,168866.0,42.3712,-71.0298,Constituent Call,"(42.3712, -71.0298)"
567789,101001381447,05/20/2015 10:09:00 AM,,06/24/2015 01:23:33 PM,ONTIME,Closed,Case Closed. Closed date : 2015-06-24 13:23:33.217 Case Resolved,Parks General Request,Parks & Recreation Department,Administrative & General Requests,Parks General Request,PARK_Maintenance_Trades,PARK,,,INTERSECTION of Bunker Hill St & Saint Martin St  Charlestown  MA,3.0,1A,1.0,A15,Charlestown,2.0,Ward 2,207.0,,INTERSECTION Bunker Hill St & Saint Martin St,,Intersection,2183.0,42.3819,-71.0686,Constituent Call,"(42.3819, -71.0686)"
568076,101001381854,05/20/2015 03:44:00 PM,,05/22/2015 07:40:15 AM,ONTIME,Closed,Case Closed Duplicate of Existing Case  Duplicate of case # 1345747. A sidewalk case was created to repair the sidewalk. The BPRD does not repair sidewalks.,Parks General Request,Parks & Recreation Department,Administrative & General Requests,Parks General Request,PARK_Tree Maintenance Request,PARK,,,425 Saratoga St  East Boston  MA  02128,1.0,09,1.0,A7,East Boston,1.0,Ward 1,110.0,R3,425 Saratoga St,2128.0,Address,122653.0,42.3792,-71.0289,Constituent Call,"(42.3792, -71.0289)"
569106,101001393460,05/22/2015 03:25:00 PM,,,ONTIME,Open,,Parks General Request,Parks & Recreation Department,Administrative & General Requests,Parks General Request,PARK_Park Improvement Requests,PARK,,,139 Tremont St  Boston  MA  02108,3.0,1C,8.0,A1,Beacon Hill,14.0,05,503.0,E,139 Tremont St,2108.0,Address,341542.0,42.3554,-71.0638,Constituent Call,"(42.3554, -71.0638)"
569136,101001393502,05/22/2015 04:19:00 PM,,06/02/2015 09:06:00 AM,ONTIME,Closed,Case Closed. Closed date : 2015-06-02 09:06:00.8 Case Resolved Completed,Ground Maintenance: Worcester Square,Parks & Recreation Department,Administrative & General Requests,Parks General Request,PARK_Maintenance_Region 5,PARK,,,30 Worcester Sq  Roxbury  MA  02118,4.0,1C,2.0,D4,South End,6.0,Ward 8,802.0,CM,30 Worcester Sq,2118.0,Address,152274.0,42.3365,-71.0741,Constituent Call,"(42.3365, -71.0741)"
569365,101001393844,05/23/2015 09:32:00 PM,,05/26/2015 11:30:15 AM,ONTIME,Closed,Case Closed. Closed date : 2015-05-26 11:30:15.767 Case Noted BPD was notified.,Parks General Request,Parks & Recreation Department,Administrative & General Requests,Parks General Request,PARK_Administration,PARK,,,INTERSECTION of Lagrange St & Sturges Rd  West Roxbury  MA,12.0,06,6.0,E5,West Roxbury,12.0,Ward 20,2014.0,,INTERSECTION Lagrange St & Sturges Rd,,Intersection,6712.0,42.2798,-71.1565,Constituent Call,"(42.2798, -71.1565)"
569420,101001393927,05/24/2015 12:22:00 PM,,05/27/2015 08:04:56 AM,ONTIME,Closed,Case Closed. Closed date : 2015-05-27 08:04:56.73 Case Resolved trash removed,Ground Maintenance: Boston Common,Parks & Recreation Department,Administrative & General Requests,Parks General Request,PARK_Maintenance_Region 1,PARK,,,INTERSECTION of Park St & Tremont St  Boston  MA,3.0,1C,8.0,A1,Downtown / Financial District,14.0,Ward 5,503.0,,INTERSECTION Park St & Tremont St,,Intersection,7782.0,42.3565,-71.062,Constituent Call,"(42.3565, -71.062)"
569628,101001394246,05/25/2015 03:12:00 PM,,05/26/2015 12:14:03 PM,ONTIME,Closed,Case Closed. Closed date : 2015-05-26 12:14:03.12 Case Noted BPD is incorrect.  Boston Park Rangers do not police Columbus Park.  It's not part of the Emerald Necklace.,Parks General Request,Parks & Recreation Department,Administrative & General Requests,Parks General Request,PARK_Administration,PARK,,,INTERSECTION of Atlantic Ave & Cross St  Boston  MA,3.0,1B,1.0,A1,Downtown / Financial District,3.0,Ward 3,301.0,,INTERSECTION Atlantic Ave & Cross St,,Intersection,735.0,42.361,-71.0526,Constituent Call,"(42.361, -71.0526)"
569638,101001394258,05/25/2015 04:19:00 PM,,05/27/2015 04:11:56 PM,ONTIME,Closed,Case Closed Case Noted  Director of Permitting has been notified of this notice.  Permitholder will be contacted and issued a warning. Thank you for reporting this information. If you have any questions  please contact the Parkline at 617-635-7275.,Parks General Request,Parks & Recreation Department,Administrative & General Requests,Parks General Request,PARK_Administration,PARK,,,INTERSECTION of Hyde Park Ave & Wyvern St  Roslindale  MA,12.0,02,6.0,E18,Jamaica Plain,10.0,Ward 19,1912.0,,INTERSECTION Hyde Park Ave & Wyvern St,,Intersection,6469.0,42.2888,-71.1183,Constituent Call,"(42.2888, -71.1183)"
569644,101001394265,05/25/2015 04:31:00 PM,,05/27/2015 04:10:47 PM,ONTIME,Closed,Case Closed Case Noted  Thank you for reporting this information.  If you have any questions  please contact the Parkline at 617-635-7275.,Parks General Request,Parks & Recreation Department,Administrative & General Requests,Parks General Request,PARK_Administration,PARK,,,INTERSECTION of Hyde Park Ave & Wyvern St  Roslindale  MA,12.0,02,6.0,E18,Jamaica Plain,10.0,Ward 19,1912.0,,INTERSECTION Hyde Park Ave & Wyvern St,,Intersection,6469.0,42.2888,-71.1183,Constituent Call,"(42.2888, -71.1183)"
570178,101001395053,05/26/2015 03:02:00 PM,,05/27/2015 02:15:39 PM,ONTIME,Closed,Case Closed. Closed date : 2015-05-27 14:15:39.74 Case Noted BPD should be notified if there is loitering after hours.  There are existing swing gates are locked;however  this is still open public space.  This is an enforcement issue that needs to be addressed by BPD.,Parks General Request,Parks & Recreation Department,Administrative & General Requests,Parks General Request,PARK_Administration,PARK,,,1 Jewish War Veterans Dr  Jamaica Plain  MA  02130,9.0,02,7.0,B2,Greater Mattapan,13.0,12,1207.0,E,1 Jewish War Veterans Dr,2130.0,Address,163434.0,42.301,-71.0886,Constituent Call,"(42.301, -71.0886)"
570261,101001395158,05/26/2015 03:39:00 PM,,10/01/2015 02:10:01 PM,ONTIME,Closed,Case Closed. Closed date : 2015-10-01 14:10:01.31 Case Resolved done 9-24-15,Parks General Request,Parks & Recreation Department,Administrative & General Requests,Parks General Request,PARK_Maintenance_Trades,PARK,,,INTERSECTION of Jamaicaway & Perkins St  Jamaica Plain  MA,9.0,02,6.0,E13,Jamaica Plain,11.0,Ward 19,1903.0,,INTERSECTION Jamaicaway & Perkins St,,Intersection,6540.0,42.321,-71.1166,Constituent Call,"(42.321, -71.1166)"
570449,101001395399,05/26/2015 09:06:00 PM,,06/05/2015 02:11:48 PM,ONTIME,Closed,Case Closed. Closed date : 2015-06-05 14:11:48.473 Case Noted no bike found at tree guard,Parks General Request,Parks & Recreation Department,Administrative & General Requests,Parks General Request,PARK_Maintenance_Trades,PARK,,,38 Hancock St  Boston  MA  02114,3.0,1B,1.0,A1,Beacon Hill,3.0,Ward 3,306.0,CM,38 Hancock St,2114.0,Address,68764.0,42.3598,-71.0642,Constituent Call,"(42.3598, -71.0642)"
570703,101001395765,05/27/2015 10:58:00 AM,,05/27/2015 11:16:51 AM,ONTIME,Closed,Case Closed. Closed date : 2015-05-27 11:16:51.233 Case Noted This island is not planted by the Parks Dept.  The panting are usually done by the Cedar Grove Civic Association.,Parks General Request,Parks & Recreation Department,Administrative & General Requests,Parks General Request,PARK_Administration,PARK,,,INTERSECTION of Adams St & Kenmare Rd  Dorchester  MA,8.0,07,3.0,C11,Dorchester,7.0,Ward 16,1611.0,,INTERSECTION Adams St & Kenmare Rd,,Intersection,106.0,42.2826,-71.0565,Constituent Call,"(42.2826, -71.0565)"
571088,101001396307,05/27/2015 06:38:00 PM,,06/01/2015 04:21:55 PM,ONTIME,Closed,Case Closed Case Resolved  Park is properly posted for dog rule signs.  Additional signs are not necessary.,Parks General Request,Parks & Recreation Department,Administrative & General Requests,Parks General Request,PARK_Administration,PARK,,,50 Myrtle St  Boston  MA  02114,3.0,1B,8.0,A1,Boston,14.0,5,503.0,,50 Myrtle St,2114.0,Address,342540.0,42.3594,-71.0587,Constituent Call,"(0, 0)"
571701,101001397209,05/28/2015 03:17:00 PM,,06/02/2015 09:51:28 PM,ONTIME,Closed,Case Closed. Closed date : 2015-06-02 21:51:28.47 Case Resolved Secured SLCB M Drago J Dunn,,Parks & Recreation Department,Administrative & General Requests,Parks General Request,PWDx_Street Light_General Lighting Request,PWDx,,,100 Boylston St  Boston  MA  02116,4.0,1C,2.0,A1,Boston,6.0,05,501.0,,100 Boylston St,2116.0,Address,348054.0,42.3594,-71.0587,Constituent Call,"(0, 0)"
572325,101001398049,05/29/2015 11:25:00 AM,,06/01/2015 10:33:55 AM,ONTIME,Closed,Case Closed Case Resolved  This location has been taken off the planting list.,Parks General Request,Parks & Recreation Department,Administrative & General Requests,Parks General Request,PARK_Administration,PARK,,,66 Alpheus Rd  Roslindale  MA  02131,12.0,08,5.0,E18,Hyde Park,10.0,Ward 18,1822.0,R1,66 Alpheus Rd,2131.0,Address,2882.0,42.2706,-71.1287,Constituent Call,"(42.2706, -71.1287)"
572527,101001398377,05/29/2015 04:04:00 PM,,06/02/2015 11:09:53 AM,ONTIME,Closed,Case Closed Case Noted  The Parks Department is responsible to clear park perimeter sidewalks.,Parks General Request,Parks & Recreation Department,Administrative & General Requests,Parks General Request,PARK_Administration,PARK,,,INTERSECTION of Columbus Ave & Walnut Ave  Dorchester  MA,9.0,10B,7.0,E13,Roxbury,11.0,Ward 11,1105.0,,INTERSECTION Columbus Ave & Walnut Ave,,Intersection,3282.0,42.3134,-71.0951,Constituent Call,"(42.3134, -71.0951)"
572624,101001398526,05/29/2015 08:12:00 PM,,06/01/2015 09:13:15 AM,ONTIME,Closed,Case Closed. Closed date : 2015-06-01 09:13:15.87 Case Resolved,Parks General Request,Parks & Recreation Department,Administrative & General Requests,Parks General Request,PARK_Administration,PARK,,,910 South St  Roslindale  MA  02131,9.0,06,5.0,E5,Roslindale,10.0,20,2004.0,,910 South St,2131.0,Address,342367.0,42.3594,-71.0587,Constituent Call,"(0, 0)"
572823,101001398801,05/30/2015 01:52:00 PM,,06/01/2015 09:42:35 AM,ONTIME,Closed,Case Closed. Closed date : 2015-06-01 09:42:35.157 Case Noted Permitting Director Paul McCaffrey contacted constituent. This was an approved permitted event/entertrainment licencse.  Event time was 12-6PM.,Parks General Request,Parks & Recreation Department,Administrative & General Requests,Parks General Request,PARK_Administration,PARK,,,9 High Rock Way  Allston  MA  02134,11.0,04,9.0,D14,Allston / Brighton,15.0,Ward 21,2106.0,CD,9 High Rock Way,2134.0,Address,73535.0,42.3515,-71.139,Constituent Call,"(42.3515, -71.139)"
574918,101001401887,06/03/2015 03:59:00 PM,,06/08/2015 02:54:02 PM,ONTIME,Closed,Case Closed. Closed date : 2015-06-08 14:54:02.45 Case Noted Thank you.� We have shared with the appropriate offices for review.,Parks General Request,Parks & Recreation Department,Administrative & General Requests,Parks General Request,INFO01_GenericeFormforOtherServiceRequestTypes,INFO,,,38 Beacon St  Boston  MA  02108,3.0,1C,8.0,A1,Beacon Hill,14.0,05,503.0,E,38 Beacon St,2108.0,Address,341748.0,42.3559,-71.0657,Constituent Call,"(42.3559, -71.0657)"
576175,101001403714,06/05/2015 09:19:00 PM,,06/09/2015 02:04:23 PM,ONTIME,Closed,Case Closed Case Resolved  Rangers were notified.,Parks General Request,Parks & Recreation Department,Administrative & General Requests,Parks General Request,PARK_Administration,PARK,,,507 Jamaicaway  Jamaica Plain  MA  02130,9.0,02,6.0,E13,Jamaica Plain,11.0,19,1903.0,E,507 Jamaicaway,2130.0,Address,341649.0,42.3594,-71.0587,Constituent Call,"(0, 0)"
576257,101001403833,06/06/2015 12:01:00 PM,,06/09/2015 11:37:08 AM,ONTIME,Closed,Case Closed Case Noted  Mr. White has been contacted.  We are sorry to hear about this incident. District Park Supt was notified of the incident.  Boston Police will also be notified of this incident to step up patrols.     If you have any questions  please contact the Parkline at 617-635-7275. Thank you.,Ground Maintenance: Ryan Play Area  Ryan Play Area,Parks & Recreation Department,Administrative & General Requests,Parks General Request,PARK_Maintenance_Region 2,PARK,,,960 Dorchester Ave  Dorchester  MA  02125,7.0,03,3.0,C11,Dorchester,7.0,13,1307.0,,960 Dorchester Ave,2125.0,Address,342630.0,42.3594,-71.0587,Constituent Call,"(0, 0)"
576462,101001404152,06/07/2015 03:41:00 PM,,06/08/2015 09:34:34 AM,ONTIME,Closed,Case Closed. Closed date : 2015-06-08 09:34:34.467 Case Noted,Parks General Request,Parks & Recreation Department,Administrative & General Requests,Parks General Request,PARK_Administration,PARK,,,151 Tremont St  Boston  MA  02111,3.0,1C,2.0,A1,Downtown / Financial District,4.0,Ward 3,308.0,E,151 Tremont St,2111.0,Address,136988.0,42.3544,-71.0634,Constituent Call,"(42.3544, -71.0634)"
576511,101001404222,06/07/2015 08:01:00 PM,,06/09/2015 10:40:18 AM,ONTIME,Closed,Case Closed. Closed date : 2015-06-09 10:40:18.367 Case Noted League has been put on notice by Parks Permitting Director.  Permit will be rescinded if rules are not adhered to properly .  If you have any questions  please contact the Parkline if you have any questions. Thank you.,Parks General Request,Parks & Recreation Department,Administrative & General Requests,Parks General Request,PARK_Administration,PARK,,,51 Clancy Rd  Dorchester  MA  02124,8.0,07,3.0,B3,Dorchester,7.0,Ward 17,1704.0,R1,51 Clancy Rd,2124.0,Address,32884.0,42.2776,-71.072,Constituent Call,"(42.2776, -71.072)"
576520,101001404239,06/07/2015 10:10:00 PM,,06/10/2015 12:02:07 PM,ONTIME,Closed,Case Closed. Closed date : 2015-06-10 12:02:07.367 Case Resolved we keep the gate lock   we don t no who open at night.,Ground Maintenance: Franklin Park,Parks & Recreation Department,Administrative & General Requests,Parks General Request,PARK_Maintenance_Region 3,PARK,,,INTERSECTION of Blue Hill Ave & Glen Ln  Jamaica Plain  MA,9.0,03,7.0,B2,Greater Mattapan,13.0,Ward 12,1207.0,,INTERSECTION Blue Hill Ave & Glen Ln,,Intersection,1557.0,42.3019,-71.0857,Constituent Call,"(42.3019, -71.0857)"
576523,101001404245,06/07/2015 11:27:00 PM,,09/09/2015 02:35:06 PM,ONTIME,Closed,Case Closed. Closed date : 2015-09-09 14:35:06.02 Case Resolved relamped light fixtures,,Parks & Recreation Department,Administrative & General Requests,Parks General Request,PARK_Maintenance_Lighting Electrical,PARK,,,INTERSECTION of Washington St & Mcbride St  Jamaica Plain  MA,9.0,02,6.0,E13,Jamaica Plain,11.0,Ward 11,1108.0,,INTERSECTION Washington St & Mcbride St,,Intersection,6013.0,42.3055,-71.1084,Constituent Call,"(42.3055, -71.1084)"
578329,101001406921,06/10/2015 05:07:00 PM,,06/17/2015 11:37:03 AM,ONTIME,Closed,Case Closed. Closed date : 2015-06-17 11:37:03.107 Case Noted Company has been notified.,Parks General Request,Parks & Recreation Department,Administrative & General Requests,Parks General Request,PARK_Administration,PARK,,,369 Lagrange St  West Roxbury  MA  02132,12.0,06,6.0,E5,West Roxbury,12.0,20,2014.0,E,369 Lagrange St,2132.0,Address,166825.0,42.2803,-71.1569,Constituent Call,"(42.2803, -71.1569)"
579195,101001408262,06/12/2015 09:48:00 AM,,06/12/2015 10:03:42 AM,ONTIME,Closed,Case Closed. Closed date : 2015-06-12 10:03:42.003 Case Noted Permitting Director will be notified;however  specific times are needed to determine which league is playing.,Parks General Request,Parks & Recreation Department,Administrative & General Requests,Parks General Request,PARK_Administration,PARK,,,30 Rogers Park Ave  Brighton  MA  02135,11.0,04,9.0,D14,Brighton,15.0,22,2210.0,,30 Rogers Park Ave,2135.0,Address,342618.0,42.3594,-71.0587,Constituent Call,"(0, 0)"
579263,101001408358,06/12/2015 10:56:00 AM,,06/15/2015 07:46:11 AM,ONTIME,Closed,Case Closed. Closed date : 2015-06-15 07:46:11.323 Case Resolved noted,Parks General Request,Parks & Recreation Department,Administrative & General Requests,Parks General Request,PARK_Maintenance_Horticulture,PARK,,,INTERSECTION of Congress St & North St  Boston  MA,3.0,1B,1.0,A1,Downtown / Financial District,3.0,Ward 3,306.0,,INTERSECTION Congress St & North St,,Intersection,3429.0,42.3602,-71.0571,Constituent Call,"(42.3602, -71.0571)"
579374,101001408531,06/12/2015 01:27:00 PM,,06/12/2015 02:18:05 PM,ONTIME,Closed,Case Closed. Closed date : 2015-06-12 14:18:05.427 Case Noted Cedar Grove Civic coordinates the plantings for this island.  Constituent has been notified.,Parks General Request,Parks & Recreation Department,Administrative & General Requests,Parks General Request,PARK_Administration,PARK,,,INTERSECTION of Adams St & Minot St  Dorchester  MA,8.0,07,3.0,C11,Dorchester,7.0,Ward 16,1611.0,,INTERSECTION Adams St & Minot St,,Intersection,115.0,42.2836,-71.0557,Constituent Call,"(42.2836, -71.0557)"
579890,101001409321,06/14/2015 04:23:00 PM,,07/09/2015 04:16:51 AM,ONTIME,Closed,Case Closed. Closed date : 2015-07-09 04:16:51.83 Case Resolved spray fixed,Parks General Request,Parks & Recreation Department,Administrative & General Requests,Parks General Request,PARK_Maintenance_Trades,PARK,,,1825 Commonwealth Ave  Brighton  MA  02135,11.0,04,9.0,D14,Brighton,15.0,21,2115.0,,1825 Commonwealth Ave,2135.0,Address,342635.0,42.3594,-71.0587,Constituent Call,"(0, 0)"
580739,101001410594,06/16/2015 11:50:00 AM,,06/18/2015 04:49:50 AM,ONTIME,Closed,Case Closed. Closed date : 2015-06-18 04:49:50.253 Case Resolved remove bike,Parks General Request,Parks & Recreation Department,Administrative & General Requests,Parks General Request,PARK_Maintenance_Trades,PARK,,,139 Tremont St  Boston  MA  02108,3.0,1C,8.0,A1,Beacon Hill,14.0,05,503.0,E,139 Tremont St,2108.0,Address,341542.0,42.3554,-71.0638,Constituent Call,"(42.3554, -71.0638)"
580867,101001410788,06/16/2015 02:15:00 PM,,06/16/2015 03:03:27 PM,ONTIME,Closed,Case Closed. Closed date : 2015-06-16 15:03:27.05 Case Noted Advised Mr. Faisser to contact Permitting Director Paul McCaffrey.,Parks General Request,Parks & Recreation Department,Administrative & General Requests,Parks General Request,PARK_Administration,PARK,,,160 Florence St  Roslindale  MA  02131,12.0,02,5.0,E5,Roslindale,10.0,19,1913.0,E,160 Florence St,2131.0,Address,155813.0,42.2882,-71.1223,Constituent Call,"(42.2882, -71.1223)"
582214,101001412819,06/18/2015 05:09:00 PM,,12/23/2015 10:02:33 AM,ONTIME,Closed,Case Closed. Closed date : 2015-12-23 10:02:33.923 Case Resolved,Parks General Request,Parks & Recreation Department,Administrative & General Requests,Parks General Request,PARK_Park Improvement Requests,PARK,,,107 Adams St  Dorchester  MA  02122,7.0,03,3.0,C11,Dorchester,8.0,Ward 15,1509.0,R2,107 Adams St,2122.0,Address,400.0,42.3052,-71.0617,Constituent Call,"(42.3052, -71.0617)"
582760,101001413668,06/19/2015 06:45:00 PM,,06/22/2015 10:38:54 AM,ONTIME,Closed,Case Closed. Closed date : 2015-06-22 10:38:54.803 Case Noted Boston Park Rangers should have been notified.,Parks General Request,Parks & Recreation Department,Administrative & General Requests,Parks General Request,PARK_Administration,PARK,,,507 Jamaicaway  Jamaica Plain  MA  02130,9.0,02,6.0,E13,Jamaica Plain,11.0,19,1903.0,E,507 Jamaicaway,2130.0,Address,341649.0,42.3594,-71.0587,Constituent Call,"(0, 0)"
583159,101001414198,06/21/2015 03:40:00 PM,,06/22/2015 09:33:56 AM,ONTIME,Closed,Case Closed. Closed date : 2015-06-22 09:33:56.75 Case Noted Animal Control will be notified to patrol park.,Parks General Request,Parks & Recreation Department,Administrative & General Requests,Parks General Request,PARK_Administration,PARK,,,349 Bunker Hill St  Charlestown  MA  02129,3.0,1A,1.0,A15,Charlestown,2.0,2,207.0,E,349 Bunker Hill St,2129.0,Address,23598.0,42.3824,-71.0678,Constituent Call,"(42.3824, -71.0678)"
584334,101001415885,06/23/2015 03:03:00 PM,,06/23/2015 04:18:01 PM,ONTIME,Closed,Case Closed. Closed date : 2015-06-23 16:18:01.91 Case Noted This dog park is owned by the Boston Naturals Areas Fund. info@bostonnatural.org 617-542-7696,Parks General Request,Parks & Recreation Department,Administrative & General Requests,Parks General Request,PARK_Administration,PARK,,,INTERSECTION of Dungarven Rd & Gartland St  Jamaica Plain  MA,9.0,02,6.0,E13,Jamaica Plain,11.0,Ward 11,1107.0,,INTERSECTION Dungarven Rd & Gartland St,,Intersection,4312.0,42.3056,-71.1055,Constituent Call,"(42.3056, -71.1055)"
584975,101001416813,06/24/2015 05:06:00 PM,,06/25/2015 11:01:35 AM,ONTIME,Closed,Case Closed Case Resolved  Communications contractor has been notified.,Parks General Request,Parks & Recreation Department,Administrative & General Requests,Parks General Request,PARK_Administration,PARK,,,115 Boylston St  Boston  MA  02108,3.0,1C,8.0,A1,Beacon Hill,14.0,05,503.0,,115 Boylston St,2108.0,Address,342696.0,42.3594,-71.0587,Employee Generated,"(0, 0)"
585304,101001417329,06/25/2015 12:44:00 PM,,06/25/2015 01:31:28 PM,ONTIME,Closed,Case Closed. Closed date : 2015-06-25 13:31:28.28 Case Noted,Parks General Request,Parks & Recreation Department,Administrative & General Requests,Parks General Request,PARK_Administration,PARK,,,115 Boylston St  Boston  MA  02108,3.0,1C,8.0,A1,Beacon Hill,14.0,05,503.0,,115 Boylston St,2108.0,Address,342696.0,42.3594,-71.0587,Constituent Call,"(0, 0)"
585493,101001417643,06/25/2015 05:40:00 PM,,06/26/2015 12:36:43 PM,ONTIME,Closed,Case Closed Case Noted  Environment Dept and Parks Department are working together to remove the crawfish and ensure the fountain is properly cleaned.,Parks General Request,Parks & Recreation Department,Administrative & General Requests,Parks General Request,PARK_Administration,PARK,,,INTERSECTION of E Brookline St & W Brookline St  Roxbury  MA,4.0,1C,2.0,D4,South End,6.0,Ward 8,802.0,,INTERSECTION E Brookline St & W Brookline St,,Intersection,2077.0,42.3396,-71.0725,Constituent Call,"(42.3396, -71.0725)"
586705,101001419416,06/29/2015 11:12:00 AM,,08/12/2015 09:19:52 AM,ONTIME,Closed,Case Closed. Closed date : 2015-08-12 09:19:52.937 Case Resolved No contact information for the constituent. The Park Dept. does not put out plantings for constituants without a watering and maintenance plan in place.,Parks General Request,Parks & Recreation Department,Administrative & General Requests,Parks General Request,PARK_Maintenance_Horticulture,PARK,,,INTERSECTION of Austin St & West St  Hyde Park  MA,12.0,08,5.0,E18,Hyde Park,10.0,Ward 18,1822.0,,INTERSECTION Austin St & West St,,Intersection,795.0,42.2633,-71.1256,Constituent Call,"(42.2633, -71.1256)"
586775,101001419519,06/29/2015 12:23:00 PM,,,ONTIME,Open,,Parks General Request,Parks & Recreation Department,Administrative & General Requests,Parks General Request,PARK_Maintenance_Trades,PARK,,,24 Glendon St  East Boston  MA  02128,1.0,09,1.0,A7,East Boston,1.0,Ward 1,109.0,R2,24 Glendon St,2128.0,Address,64226.0,42.3822,-71.0305,Constituent Call,"(42.3822, -71.0305)"
586908,101001419700,06/29/2015 02:29:00 PM,,07/01/2015 10:36:47 AM,ONTIME,Closed,Case Closed. Closed date : 2015-07-01 10:36:47.983 Case Resolved this is not a parks dept bench,Ground Maintenance: Porzio Park,Parks & Recreation Department,Administrative & General Requests,Parks General Request,PARK_Maintenance_Region 1,PARK,,,200 Everett St  East Boston  MA  02128,1.0,09,1.0,A7,East Boston,1.0,Ward 1,101.0,R1,200 Everett St,2128.0,Address,55087.0,42.3661,-71.0311,Constituent Call,"(42.3661, -71.0311)"
587364,101001420349,06/30/2015 10:52:00 AM,,10/14/2015 10:05:34 AM,ONTIME,Closed,Case Closed. Closed date : 2015-10-14 10:05:34.687 Case Resolved Thank you for your request. We apologize for the time that it has taken to respond to this case. If this issue persists  please resubmit your case or call 311 to speak to an agent.,Parks General Request,Parks & Recreation Department,Administrative & General Requests,Parks General Request,INFO_Reallocation From Dept,INFO,,,INTERSECTION of Beacon St & Chestnut Hill Ave  Brighton  MA,11.0,04,9.0,D14,Allston / Brighton,15.0,Ward 21,2116.0,,INTERSECTION Beacon St & Chestnut Hill Ave,,Intersection,1079.0,42.3359,-71.1509,Constituent Call,"(42.3359, -71.1509)"
587587,101001420643,06/30/2015 02:26:00 PM,,07/17/2015 10:13:29 AM,ONTIME,Closed,Case Closed. Closed date : 2015-07-17 10:13:29.6 Case Resolved add signs,Parks General Request,Parks & Recreation Department,Administrative & General Requests,Parks General Request,PARK_Maintenance_Trades,PARK,,,INTERSECTION of Bunker Hill St & Saint Martin St  Charlestown  MA,3.0,1A,1.0,A15,Charlestown,2.0,Ward 2,207.0,,INTERSECTION Bunker Hill St & Saint Martin St,,Intersection,2183.0,42.3819,-71.0686,Constituent Call,"(42.3819, -71.0686)"
587698,101001420806,06/30/2015 04:58:00 PM,,07/07/2015 02:34:40 PM,ONTIME,Closed,Case Closed. Closed date : 2015-07-07 14:34:40.277 Case Resolved made it safe,Sidewalk Repair Make Safe,Parks & Recreation Department,Administrative & General Requests,Parks General Request,PWDx_District 07: South Dorchester,PWDx,,,19 Mamelon Cir  Mattapan  MA  02126,8.0,07,4.0,B3,Greater Mattapan,9.0,Ward 18,1804.0,R2,19 Mamelon Cir,2126.0,Address,88850.0,42.2707,-71.0891,Constituent Call,"(42.2707, -71.0891)"
588186,101001421464,07/01/2015 01:54:00 PM,,07/07/2015 12:33:15 PM,ONTIME,Closed,Case Closed. Closed date : 2015-07-07 12:33:15.14 Case Noted This is a Community Garden maintained by people in the neighborhood.,Parks General Request,Parks & Recreation Department,Administrative & General Requests,Parks General Request,PARK_Administration,PARK,,,INTERSECTION of Church St & Melrose St  Boston  MA,4.0,1C,2.0,A1,Back Bay,6.0,Ward 5,501.0,,INTERSECTION Church St & Melrose St,,Intersection,3010.0,42.3491,-71.0682,Constituent Call,"(42.3491, -71.0682)"
589072,101001422722,07/03/2015 02:26:00 PM,,07/21/2015 10:16:03 AM,ONTIME,Closed,Case Closed. Closed date : 2015-07-21 10:16:03.897 Case Noted This work order was sent to our Design and Constr. dept. to evaluate this park.,Parks General Request,Parks & Recreation Department,Administrative & General Requests,Parks General Request,PARK_Administration,PARK,,,115 Paris St  East Boston  MA  02128,1.0,09,1.0,A7,East Boston,1.0,1,104.0,,115 Paris St,2128.0,Address,340867.0,42.3721,-71.037,Constituent Call,"(42.3721, -71.037)"
589117,101001422789,07/03/2015 06:34:00 PM,,07/06/2015 02:29:35 PM,ONTIME,Closed,Case Closed. Closed date : 2015-07-06 14:29:35.167 Case Noted the city of boston does not handle long horn beetle sightings the state does report sighting to  phone #866-702-9938  ww.mass.gov/agr,Parks General Request,Parks & Recreation Department,Administrative & General Requests,Parks General Request,PARK_Administration,PARK,,,126 Brown Ave  Roslindale  MA  02131,12.0,02,5.0,E5,Roslindale,10.0,Ward 19,1910.0,R2,126 Brown Ave,2131.0,Address,162681.0,42.284,-71.1214,Constituent Call,"(42.284, -71.1214)"
589234,101001422961,07/04/2015 07:18:00 PM,,07/06/2015 10:54:47 AM,ONTIME,Closed,Case Closed. Closed date : 2015-07-06 10:54:47.843 Case Resolved,Parks General Request,Parks & Recreation Department,Administrative & General Requests,Parks General Request,PARK_Administration,PARK,,,45 Fairview Ave  Hyde Park  MA  02136,12.0,08,5.0,E18,Hyde Park,10.0,18,1819.0,,45 Fairview Ave,2136.0,Address,342972.0,42.246,-71.1398,Constituent Call,"(42.246, -71.1398)"
589311,101001423104,07/05/2015 01:39:00 PM,,07/16/2015 03:11:43 PM,ONTIME,Closed,Case Closed. Closed date : 2015-07-16 15:11:43.417 Case Resolved,Parks General Request,Parks & Recreation Department,Administrative & General Requests,Parks General Request,PARK_Maintenance_Trades,PARK,,,92 Mount Ida Rd  Dorchester  MA  02122,7.0,03,3.0,C11,Dorchester,8.0,15,1509.0,,92 Mount Ida Rd,2122.0,Address,342620.0,42.3594,-71.0587,Constituent Call,"(0, 0)"
589315,101001423111,07/05/2015 02:11:00 PM,,07/28/2015 11:07:36 AM,ONTIME,Closed,Case Closed. Closed date : 2015-07-28 11:07:36.507 Case Resolved Park was cleaned.,Ground Maintenance: Clifford Playground,Parks & Recreation Department,Administrative & General Requests,Parks General Request,PARK_Maintenance_Region 5,PARK,,,INTERSECTION of Massachusetts Ave & Shirley St  Roxbury  MA,6.0,1C,7.0,C6,South Boston / South Boston Waterfront,13.0,Ward 8,806.0,,INTERSECTION Massachusetts Ave & Shirley St,,Intersection,7153.0,42.3269,-71.067,Constituent Call,"(42.3269, -71.067)"
589367,101001423185,07/05/2015 07:14:00 PM,,07/05/2015 07:16:48 PM,ONTIME,Closed,Case Closed. Closed date : 2015-07-05 19:16:48.25 Case Noted case cancelled. caller is all set.,Parks General Request,Parks & Recreation Department,Administrative & General Requests,Parks General Request,PARK_Administration,PARK,,,355 Walk Hill St  Roslindale  MA  02131,12.0,02,5.0,E18,Roslindale,10.0,18,1807.0,,355 Walk Hill St,2131.0,Address,342536.0,42.3594,-71.0587,Constituent Call,"(0, 0)"
589724,101001423696,07/06/2015 12:52:00 PM,,07/08/2015 06:55:49 PM,ONTIME,Closed,Case Closed. Closed date : 2015-07-08 18:55:49.05 Case Resolved I dont see anything in this location,Parks General Request,Parks & Recreation Department,Administrative & General Requests,Parks General Request,PWDx_District 06: West Roxbury and Roslindale,PWDx,,https://cityworker.cityofboston.gov:8443/attachments/report/559ab2a1d0526ec12e0d6d66/closed_photo/Report.jpg,INTERSECTION of Washington St & Lagrange St  Boston  MA,4.0,1C,2.0,A1,Downtown / Financial District,4.0,Ward 3,308.0,,INTERSECTION Washington St & Lagrange St,,Intersection,6068.0,42.3515,-71.0628,Constituent Call,"(42.3515, -71.0628)"
589847,101001423848,07/06/2015 02:48:00 PM,,10/14/2015 10:06:09 AM,ONTIME,Closed,Case Closed. Closed date : 2015-10-14 10:06:09.177 Case Resolved Thank you for your request. We apologize for the time that it has taken to respond to this case. If this issue persists  please resubmit your case or call 311 to speak to an agent.,Parks General Request,Parks & Recreation Department,Administrative & General Requests,Parks General Request,INFO_Reallocation From Dept,INFO,,,INTERSECTION of Washburn St & Howell St  Dorchester  MA,6.0,03,2.0,C6,Dorchester,5.0,Ward 7,708.0,,INTERSECTION Washburn St & Howell St,,Intersection,5951.0,42.3249,-71.0573,Constituent Call,"(42.3249, -71.0573)"
589999,101001424051,07/06/2015 07:04:00 PM,,07/07/2015 10:54:09 AM,ONTIME,Closed,Case Closed. Closed date : 2015-07-07 10:54:09.713 Case Noted Park rangers were notified.,Parks General Request,Parks & Recreation Department,Administrative & General Requests,Parks General Request,PARK_Administration,PARK,,,INTERSECTION of Huntington Ave & Jamaicaway  Jamaica Plain  MA,,,8.0,B2,Mission Hill,14.0,Ward 10,1004.0,,INTERSECTION Huntington Ave & Jamaicaway,,Intersection,6416.0,42.3319,-71.113,Constituent Call,"(42.3319, -71.113)"
590044,101001424117,07/06/2015 09:48:00 PM,,07/23/2015 03:26:59 PM,ONTIME,Closed,Case Closed. Closed date : 2015-07-23 15:26:59.19 Case Resolved,Parks General Request,Parks & Recreation Department,Administrative & General Requests,Parks General Request,PARK_Maintenance_Trades,PARK,,,INTERSECTION of Chiswick Rd & Commonwealth Ave  Brighton  MA,11.0,04,9.0,D14,Allston / Brighton,15.0,Ward 21,2113.0,,INTERSECTION Chiswick Rd & Commonwealth Ave,,Intersection,2992.0,42.3403,-71.1511,Constituent Call,"(42.3403, -71.1511)"
590493,101001424752,07/07/2015 03:40:00 PM,,07/15/2015 10:22:09 AM,ONTIME,Closed,Case Closed. Closed date : 2015-07-15 10:22:09.04 Case Resolved,Ground Maintenance: Highland Park,Parks & Recreation Department,Administrative & General Requests,Parks General Request,PARK_Maintenance_Region 5,PARK,,,INTERSECTION of Centre St & Highland Ave  Roxbury  MA,7.0,10B,7.0,B2,Roxbury,13.0,Ward 9,905.0,,INTERSECTION Centre St & Highland Ave,,Intersection,2717.0,42.3297,-71.0932,Constituent Call,"(42.3297, -71.0932)"
590625,101001424932,07/07/2015 09:11:00 PM,,,ONTIME,Open,,Parks General Request,Parks & Recreation Department,Administrative & General Requests,Parks General Request,PARK_Park Improvement Requests,PARK,,,124 Shirley St  Roxbury  MA  02119,7.0,03,7.0,B2,Roxbury,13.0,Ward 8,806.0,R3,124 Shirley St,2119.0,Address,127177.0,42.3254,-71.0689,Constituent Call,"(42.3254, -71.0689)"
591482,101001426063,07/09/2015 11:47:00 AM,,07/14/2015 11:10:19 AM,ONTIME,Closed,Case Closed. Closed date : 2015-07-14 11:10:19.713 Case Noted Golf course superintendant was notified.,Parks General Request,Parks & Recreation Department,Administrative & General Requests,Parks General Request,PARK_Administration,PARK,,,420 West St  Hyde Park  MA  02136,12.0,06,5.0,E18,Roslindale,10.0,18,1812.0,E,420 West St,2136.0,Address,147986.0,42.2684,-71.1329,Constituent Call,"(42.2684, -71.1329)"
591927,101001426688,07/10/2015 09:58:00 AM,,,ONTIME,Open,,Parks General Request,Parks & Recreation Department,Administrative & General Requests,Parks General Request,INFO01_GenericeFormforOtherServiceRequestTypes,INFO,,,INTERSECTION of Beacon St & Chestnut Hill Ave  Brighton  MA,11.0,04,9.0,D14,Allston / Brighton,15.0,Ward 21,2116.0,,INTERSECTION Beacon St & Chestnut Hill Ave,,Intersection,1079.0,42.3359,-71.1509,Constituent Call,"(42.3359, -71.1509)"
592251,101001427113,07/10/2015 03:44:00 PM,,07/14/2015 10:53:04 AM,ONTIME,Closed,Case Closed. Closed date : 2015-07-14 10:53:04.96 Case Noted Police should be notified  The park dept. superintendant was notified he will inspect this area.,Parks General Request,Parks & Recreation Department,Administrative & General Requests,Parks General Request,PARK_Administration,PARK,,,1005 Columbia Rd  South Boston  MA  02127,6.0,05,2.0,C6,South Boston,5.0,7,707.0,,1005 Columbia Rd,2127.0,Address,163529.0,42.3272,-71.0504,Constituent Call,"(42.3272, -71.0504)"
592676,101001427777,07/12/2015 08:18:00 PM,,07/14/2015 01:33:30 PM,ONTIME,Closed,Case Closed. Closed date : 2015-07-14 13:33:30.613 Case Noted Police should be notified.,Parks General Request,Parks & Recreation Department,Administrative & General Requests,Parks General Request,PARK_Administration,PARK,,,INTERSECTION of Iffley Rd & Walnut Ave  Jamaica Plain  MA,9.0,02,7.0,E13,Jamaica Plain,11.0,Ward 11,1105.0,,INTERSECTION Iffley Rd & Walnut Ave,,Intersection,6488.0,42.3117,-71.0976,Constituent Call,"(42.3117, -71.0976)"
594007,101001429525,07/14/2015 06:50:00 PM,,07/16/2015 12:23:31 PM,ONTIME,Closed,Case Closed. Closed date : 2015-07-16 12:23:31.067 Case Resolved Bees nest sprayed July 15  2015.,Ground Maintenance: Millenium Park  Millennium Park,Parks & Recreation Department,Administrative & General Requests,Parks General Request,PARK_Maintenance_Region 4,PARK,,,300 Gardner St  West Roxbury  MA  02132,12.0,06,6.0,E5,West Roxbury,12.0,20,2017.0,,300 Gardner St,2132.0,Address,342525.0,42.3594,-71.0587,Constituent Call,"(0, 0)"
594682,101001430429,07/15/2015 08:44:00 PM,,07/17/2015 09:21:05 AM,ONTIME,Closed,Case Closed. Closed date : 2015-07-17 09:21:05.23 Case Resolved close. well noted will check out machine for adjustment,Parks General Request,Parks & Recreation Department,Administrative & General Requests,Parks General Request,PARK_Maintenance_Region 1,PARK,,,INTERSECTION of S Bremen St & Marginal St  East Boston  MA,1.0,09,1.0,A7,East Boston,1.0,Ward 1,103.0,,INTERSECTION S Bremen St & Marginal St,,Intersection,1919.0,42.3671,-71.04,Constituent Call,"(42.3671, -71.04)"
595022,101001430851,07/16/2015 11:11:00 AM,,07/27/2015 05:46:54 PM,ONTIME,Closed,Case Closed. Closed date : 2015-07-27 17:46:54.013 Case Resolved the gate does not close properly and a work order has been put in to fix the problem.,Ground Maintenance: Walsh Playground,Parks & Recreation Department,Administrative & General Requests,Parks General Request,PARK_Maintenance_Region 2,PARK,,,INTERSECTION of Clancy Rd & Washington St  Dorchester  MA,8.0,07,3.0,C11,Dorchester,7.0,Ward 17,1704.0,,INTERSECTION Clancy Rd & Washington St,,Intersection,3051.0,42.278,-71.0695,Constituent Call,"(42.278, -71.0695)"
595413,101001431404,07/16/2015 09:56:00 PM,,07/21/2015 09:52:25 AM,ONTIME,Closed,Case Closed. Closed date : 2015-07-21 09:52:25.933 Case Resolved,Parks General Request,Parks & Recreation Department,Administrative & General Requests,Parks General Request,PARK_Administration,PARK,,,300 Gardner St  West Roxbury  MA  02132,12.0,06,6.0,E5,West Roxbury,12.0,20,2017.0,,300 Gardner St,2132.0,Address,342525.0,42.3594,-71.0587,Constituent Call,"(0, 0)"
595818,101001431885,07/17/2015 11:20:00 AM,,,ONTIME,Open,,Parks General Request,Parks & Recreation Department,Administrative & General Requests,Parks General Request,INFO01_GenericeFormforOtherServiceRequestTypes,INFO,,,540 Bennington St  East Boston  MA  02128,1.0,09,1.0,A7,East Boston,1.0,Ward 1,111.0,R3,540 Bennington St,2128.0,Address,14774.0,42.3824,-71.0197,Constituent Call,"(42.3824, -71.0197)"
595929,101001432028,07/17/2015 01:32:00 PM,,,ONTIME,Open,,Parks General Request,Parks & Recreation Department,Administrative & General Requests,Parks General Request,PARK_Park Improvement Requests,PARK,,,550 Norfolk St  Mattapan  MA  02126,8.0,07,4.0,B3,Greater Mattapan,9.0,18,1802.0,,550 Norfolk St,2126.0,Address,342029.0,42.3594,-71.0587,Constituent Call,"(0, 0)"
595944,101001432058,07/17/2015 01:58:00 PM,,07/21/2015 10:54:56 AM,ONTIME,Closed,Case Closed. Closed date : 2015-07-21 10:54:56.083 Case Noted Flag was lowered.,Parks General Request,Parks & Recreation Department,Administrative & General Requests,Parks General Request,PARK_Administration,PARK,,,4 Charles St  Boston  MA  02108,3.0,1C,8.0,A1,Boston,14.0,5,503.0,,4 Charles St,2108.0,Address,342578.0,42.3594,-71.0587,Constituent Call,"(0, 0)"
596055,101001432205,07/17/2015 04:07:00 PM,,07/21/2015 10:55:27 AM,ONTIME,Closed,Case Closed. Closed date : 2015-07-21 10:55:27.767 Case Invalid Flag was lowered.,Parks General Request,Parks & Recreation Department,Administrative & General Requests,Parks General Request,PARK_Administration,PARK,,,338 E Eagle St  East Boston  MA  02128,1.0,09,1.0,A7,East Boston,1.0,01,109.0,E,338 E Eagle St,2128.0,Address,50731.0,42.3824,-71.0281,Constituent Call,"(42.3824, -71.0281)"
596116,101001432291,07/17/2015 07:23:00 PM,,07/21/2015 10:55:56 AM,ONTIME,Closed,Case Closed. Closed date : 2015-07-21 10:55:56.053 Case Noted Flag was lowered.,Parks General Request,Parks & Recreation Department,Administrative & General Requests,Parks General Request,PARK_Administration,PARK,,,INTERSECTION of Cemetery Rd & Morton St  Jamaica Plain  MA,9.0,02,6.0,B2,Jamaica Plain,10.0,Ward 19,1907.0,,INTERSECTION Cemetery Rd & Morton St,,Intersection,2582.0,42.3002,-71.1047,Constituent Call,"(42.3002, -71.1047)"
596347,101001432624,07/19/2015 12:32:00 PM,,07/21/2015 10:25:54 AM,ONTIME,Closed,Case Closed. Closed date : 2015-07-21 10:25:54.79 Case Noted The permit holder will be notified.,Parks General Request,Parks & Recreation Department,Administrative & General Requests,Parks General Request,PARK_Administration,PARK,,,24 Glendon St  East Boston  MA  02128,1.0,09,1.0,A7,East Boston,1.0,Ward 1,109.0,R2,24 Glendon St,2128.0,Address,64226.0,42.3822,-71.0305,Constituent Call,"(42.3822, -71.0305)"
596371,101001432660,07/19/2015 04:21:00 PM,,07/21/2015 10:29:25 AM,ONTIME,Closed,Case Closed. Closed date : 2015-07-21 10:29:25.1 Case Noted The proper authorities will be notified.,Parks General Request,Parks & Recreation Department,Administrative & General Requests,Parks General Request,PARK_Administration,PARK,,,330 Perkins St  Jamaica Plain  MA  02130,9.0,02,6.0,E13,Jamaica Plain,11.0,19,1903.0,,330 Perkins St,2130.0,Address,347229.0,42.3594,-71.0587,Constituent Call,"(0, 0)"
596901,101001433364,07/20/2015 02:27:00 PM,,07/21/2015 10:30:28 AM,ONTIME,Closed,Case Closed. Closed date : 2015-07-21 10:30:28.453 Case Noted The Frog Pond Staff will be notified.,Parks General Request,Parks & Recreation Department,Administrative & General Requests,Parks General Request,PARK_Administration,PARK,,,38 Beacon St  Boston  MA  02108,3.0,1C,8.0,A1,Beacon Hill,14.0,05,503.0,E,38 Beacon St,2108.0,Address,341748.0,42.3559,-71.0657,Constituent Call,"(42.3559, -71.0657)"
598223,101001435272,07/23/2015 01:44:00 PM,,07/28/2015 09:08:19 AM,ONTIME,Closed,Case Closed. Closed date : 2015-07-28 09:08:19.853 Case Noted The event was permitted.,Parks General Request,Parks & Recreation Department,Administrative & General Requests,Parks General Request,PARK_Administration,PARK,,,INTERSECTION of Boylston St & Charles St S  Boston  MA,4.0,1C,2.0,A1,Downtown / Financial District,6.0,Ward 5,501.0,,INTERSECTION Boylston St & Charles St S,,Intersection,1781.0,42.3525,-71.0675,Constituent Call,"(42.3525, -71.0675)"
598299,101001435381,07/23/2015 02:33:00 PM,,,ONTIME,Open,,Parks General Request,Parks & Recreation Department,Administrative & General Requests,Parks General Request,PARK_Park Improvement Requests,PARK,,,92 Mount Ida Rd  Dorchester  MA  02122,7.0,03,3.0,C11,Dorchester,8.0,15,1509.0,,92 Mount Ida Rd,2122.0,Address,342620.0,42.3594,-71.0587,Constituent Call,"(0, 0)"
598590,101001435793,07/24/2015 05:46:00 AM,,07/28/2015 09:13:09 AM,ONTIME,Closed,Case Closed. Closed date : 2015-07-28 09:13:09.06 Case Noted Piers Park is run by Massport.,Parks General Request,Parks & Recreation Department,Administrative & General Requests,Parks General Request,PARK_Administration,PARK,,,INTERSECTION of Cottage St & Marginal St  East Boston  MA,1.0,09,1.0,A7,East Boston,1.0,Ward 1,101.0,,INTERSECTION Cottage St & Marginal St,,Intersection,3575.0,42.3657,-71.0368,Constituent Call,"(42.3657, -71.0368)"
598720,101001435966,07/24/2015 09:54:00 AM,,07/28/2015 09:14:28 AM,ONTIME,Closed,Case Closed. Closed date : 2015-07-28 09:14:28.34 Case Noted Police should be notified.,Parks General Request,Parks & Recreation Department,Administrative & General Requests,Parks General Request,PARK_Administration,PARK,,,INTERSECTION of Columbus Ave & Isabella St  Boston  MA,4.0,1C,2.0,D4,Back Bay,6.0,Ward 5,501.0,,INTERSECTION Columbus Ave & Isabella St,,Intersection,3301.0,42.3488,-71.0716,Constituent Call,"(42.3488, -71.0716)"
598721,101001435967,07/24/2015 09:54:00 AM,,07/29/2015 10:47:04 AM,ONTIME,Closed,Case Closed Case Noted  Public Works does not have a surplus of benches  we can help with the installation of a bench  once it is purchased  by the agency requesting it.,Parks General Request,Parks & Recreation Department,Administrative & General Requests,Parks General Request,PWDx_Administration,PWDx,,,60 Fairmount Ave  Hyde Park  MA  02136,12.0,08,5.0,E18,Hyde Park,10.0,18,1813.0,E,60 Fairmount Ave,2136.0,Address,55750.0,42.2551,-71.1199,Constituent Call,"(42.2551, -71.1199)"
598758,101001436019,07/24/2015 10:38:00 AM,,07/28/2015 09:16:46 AM,ONTIME,Closed,Case Closed. Closed date : 2015-07-28 09:16:46.287 Case Noted The Parks Dept. does not install No Trespassing signs  the Police should be notified.,Parks General Request,Parks & Recreation Department,Administrative & General Requests,Parks General Request,PARK_Administration,PARK,,,135 Prince St  Boston  MA  02113,3.0,1B,1.0,A1,Boston,3.0,3,303.0,,135 Prince St,2113.0,Address,342060.0,42.3594,-71.0587,Constituent Call,"(0, 0)"
598988,101001436305,07/24/2015 02:37:00 PM,,07/29/2015 10:53:23 AM,ONTIME,Closed,Case Closed. Closed date : 2015-07-29 10:53:23.927 Case Noted We apoligize if the flag was not lowered  thye crew was told to lower the flag.,Parks General Request,Parks & Recreation Department,Administrative & General Requests,Parks General Request,PARK_Administration,PARK,,,23 Everett St  Dorchester  MA  02122,7.0,07,3.0,C11,Dorchester,7.0,16,1602.0,E,23 Everett St,2122.0,Address,341627.0,42.3008,-71.0524,Constituent Call,"(42.3008, -71.0524)"
599232,101001436628,07/25/2015 02:17:00 PM,,07/28/2015 09:30:35 AM,ONTIME,Closed,Case Closed. Closed date : 2015-07-28 09:30:35.24 Case Noted There are no permits issued for soccer at American Legion Park on Saturdays. Police should be notified.,Parks General Request,Parks & Recreation Department,Administrative & General Requests,Parks General Request,PARK_Administration,PARK,,,301 E Eagle St  East Boston  MA  02128,1.0,09,1.0,A7,East Boston,1.0,Ward 1,109.0,R1,301 E Eagle St,2128.0,Address,50715.0,42.3812,-71.0295,Constituent Call,"(42.3812, -71.0295)"
599239,101001436639,07/25/2015 03:20:00 PM,,07/28/2015 09:32:37 AM,ONTIME,Closed,Case Closed. Closed date : 2015-07-28 09:32:37.183 Case Noted The porta pottie company was notified.,Parks General Request,Parks & Recreation Department,Administrative & General Requests,Parks General Request,PARK_Administration,PARK,,,220 Porter St  East Boston  MA  02128,1.0,09,1.0,A7,East Boston,1.0,01,105.0,CM,220 Porter St,2128.0,Address,168866.0,42.3712,-71.0298,Constituent Call,"(42.3712, -71.0298)"
599253,101001436656,07/25/2015 05:07:00 PM,,07/28/2015 10:07:17 AM,ONTIME,Closed,Case Closed. Closed date : 2015-07-28 10:07:17.907 Case Noted Not a Parks Dept. issue.,Parks General Request,Parks & Recreation Department,Administrative & General Requests,Parks General Request,PARK_Administration,PARK,,,10 Mozart St  Jamaica Plain  MA  02130,9.0,10A,6.0,E13,Jamaica Plain,11.0,10,1007.0,E,10 Mozart St,2130.0,Address,341941.0,42.3224,-71.1045,Constituent Call,"(42.3224, -71.1045)"
599256,101001436661,07/25/2015 05:19:00 PM,,07/28/2015 10:12:41 AM,ONTIME,Closed,Case Closed. Closed date : 2015-07-28 10:12:41.917 Case Noted The permit holder will be notified.,Parks General Request,Parks & Recreation Department,Administrative & General Requests,Parks General Request,PARK_Administration,PARK,,,10 Mozart St  Jamaica Plain  MA  02130,9.0,10A,6.0,E13,Jamaica Plain,11.0,10,1007.0,E,10 Mozart St,2130.0,Address,341941.0,42.3224,-71.1045,Constituent Call,"(42.3224, -71.1045)"
599361,101001436820,07/26/2015 11:13:00 AM,,07/28/2015 10:18:04 AM,ONTIME,Closed,Case Closed. Closed date : 2015-07-28 10:18:04.093 Case Noted Park Rangers were notified.,Parks General Request,Parks & Recreation Department,Administrative & General Requests,Parks General Request,PARK_Administration,PARK,,,139 Tremont St  Boston  MA  02108,3.0,1C,8.0,A1,Beacon Hill,14.0,05,503.0,E,139 Tremont St,2108.0,Address,341542.0,42.3554,-71.0638,Employee Generated,"(42.3554, -71.0638)"
599457,101001436974,07/26/2015 07:49:00 PM,,07/28/2015 10:22:29 AM,ONTIME,Closed,Case Closed. Closed date : 2015-07-28 10:22:29.387 Case Noted Police should be notified.,Parks General Request,Parks & Recreation Department,Administrative & General Requests,Parks General Request,PARK_Administration,PARK,,,INTERSECTION of Edgerly Rd & Haviland St  Boston  MA,4.0,10A,8.0,D4,Back Bay,14.0,Ward 4,406.0,,INTERSECTION Edgerly Rd & Haviland St,,Intersection,4411.0,42.3464,-71.0882,Constituent Call,"(42.3464, -71.0882)"
599477,101001437011,07/26/2015 10:35:00 PM,,12/14/2015 03:28:53 PM,ONTIME,Closed,Case Closed. Closed date : 2015-12-14 15:28:53.997 Case Resolved repairs made,Parks General Request,Parks & Recreation Department,Administrative & General Requests,Parks General Request,PARK_Park Improvement Requests,PARK,,,49 Firth Rd  Roslindale  MA  02131,12.0,02,5.0,E5,Roslindale,10.0,Ward 19,1913.0,R2,49 Firth Rd,2131.0,Address,58503.0,42.2871,-71.1236,Constituent Call,"(42.2871, -71.1236)"
599555,101001437124,07/27/2015 08:52:00 AM,,08/20/2015 11:55:10 AM,ONTIME,Closed,Case Closed Case Noted,Parks General Request,Parks & Recreation Department,Administrative & General Requests,Parks General Request,PARK_Cemetery Maintenance Request,PARK,,,INTERSECTION of Beacon St & Park St  Boston  MA,3.0,1B,8.0,A1,Beacon Hill,14.0,Ward 5,503.0,,INTERSECTION Beacon St & Park St,,Intersection,1110.0,42.3577,-71.0632,Constituent Call,"(42.3577, -71.0632)"
599730,101001437354,07/27/2015 10:52:00 AM,,07/28/2015 10:33:26 AM,ONTIME,Closed,Case Closed. Closed date : 2015-07-28 10:33:26.77 Case Noted Park Rangers were notified.,Parks General Request,Parks & Recreation Department,Administrative & General Requests,Parks General Request,PARK_Administration,PARK,,,139 Tremont St  Boston  MA  02108,3.0,1C,8.0,A1,Beacon Hill,14.0,05,503.0,E,139 Tremont St,2108.0,Address,341542.0,42.3554,-71.0638,Constituent Call,"(42.3554, -71.0638)"
600937,101001438916,07/28/2015 09:04:00 PM,,07/31/2015 02:31:26 PM,ONTIME,Closed,Case Closed. Closed date : 2015-07-31 14:31:26.07 Case Resolved,,Parks & Recreation Department,Administrative & General Requests,Parks General Request,PARK_Maintenance_Lighting Electrical,PARK,,,INTERSECTION of Centre St & Mozart St  Jamaica Plain  MA,9.0,10A,6.0,E13,Jamaica Plain,11.0,Ward 10,1006.0,,INTERSECTION Centre St & Mozart St,,Intersection,2699.0,42.3227,-71.1049,Constituent Call,"(42.3227, -71.1049)"
601703,101001499914,07/30/2015 09:07:42 AM,,07/30/2015 10:08:28 AM,ONTIME,Closed,Case Closed. Closed date : 2015-07-30 10:08:28.317 Case Noted Boston Police should be notified.,Parks General Request,Parks & Recreation Department,Administrative & General Requests,Parks General Request,PARK_Administration,PARK,,,1 Jewish War Veterans Dr  Jamaica Plain  MA  02130,9.0,02,7.0,B2,Greater Mattapan,13.0,12,1207.0,E,1 Jewish War Veterans Dr,2130.0,Address,163434.0,42.301,-71.0886,Constituent Call,"(42.301, -71.0886)"
602926,101001501584,08/01/2015 11:45:00 PM,,08/03/2015 12:33:34 PM,ONTIME,Closed,Case Closed Case Resolved,Parks General Request,Parks & Recreation Department,Administrative & General Requests,Parks General Request,PARK_Administration,PARK,,,300 Gardner St  West Roxbury  MA  02132,12.0,06,6.0,E5,West Roxbury,12.0,20,2017.0,,300 Gardner St,2132.0,Address,342525.0,42.3594,-71.0587,Constituent Call,"(0, 0)"
603786,101001502779,08/04/2015 09:15:00 AM,,,ONTIME,Open,,Parks General Request,Parks & Recreation Department,Administrative & General Requests,Parks General Request,PARK_Tree Maintenance Request,PARK,,,112 Bynner St  Jamaica Plain  MA  02130,9.0,02,6.0,E13,Jamaica Plain,11.0,Ward 10,1009.0,R2,112 Bynner St,2130.0,Address,200179.0,42.3239,-71.1136,Constituent Call,"(42.3239, -71.1136)"
604190,101001503313,08/04/2015 04:16:00 PM,,08/20/2015 11:26:33 AM,ONTIME,Closed,Case Closed. Closed date : 2015-08-20 11:26:33.707 Case Invalid There is no island on Canal St. Please resubmit with a better location.  Thank You  Boston 311,Parks General Request,Parks & Recreation Department,Administrative & General Requests,Parks General Request,INFO_Reallocation From Dept,INFO,,,1 Canal St  Boston  MA  02114,3.0,1B,1.0,A1,Boston,3.0,03,306.0,,1 Canal St,2114.0,Address,342962.0,42.3594,-71.0587,Constituent Call,"(0, 0)"
606021,101001505759,08/07/2015 11:55:00 AM,,08/18/2015 02:03:10 PM,ONTIME,Closed,Case Closed. Closed date : 2015-08-18 14:03:10.793 Case Resolved did not find any electrical boxes or doors protruding.,,Parks & Recreation Department,Administrative & General Requests,Parks General Request,PARK_Maintenance_Lighting Electrical,PARK,,,110 Atlantic Ave  Boston  MA  02110,3.0,1B,1.0,A1,Boston,3.0,3,301.0,,110 Atlantic Ave,2110.0,Address,161702.0,42.361,-71.0522,Constituent Call,"(42.361, -71.0522)"
606590,101001516567,08/09/2015 10:14:00 AM,,08/18/2015 05:52:54 AM,ONTIME,Closed,Case Closed. Closed date : 2015-08-18 05:52:54.813 Case Resolved contrator fix clock,Parks General Request,Parks & Recreation Department,Administrative & General Requests,Parks General Request,PARK_Maintenance_Trades,PARK,,,115 Paris St  East Boston  MA  02128,1.0,09,1.0,A7,East Boston,1.0,1,104.0,,115 Paris St,2128.0,Address,340867.0,42.3721,-71.037,Constituent Call,"(42.3721, -71.037)"
606696,101001516741,08/09/2015 09:11:00 PM,,,ONTIME,Open,,Parks General Request,Parks & Recreation Department,Administrative & General Requests,Parks General Request,PARK_Park Improvement Requests,PARK,,,INTERSECTION of Berkeley St & Commonwealth Ave  Boston  MA,4.0,1C,8.0,D4,Back Bay,14.0,Ward 5,506.0,,INTERSECTION Berkeley St & Commonwealth Ave,,Intersection,1349.0,42.3529,-71.0738,Constituent Call,"(42.3529, -71.0738)"
607760,101001518194,08/11/2015 12:58:00 PM,,08/11/2015 02:15:16 PM,ONTIME,Closed,Case Closed. Closed date : 2015-08-11 14:15:16.047 Case Noted Gate was designed this way to prevent children from pushing the gate outward and running out.,Parks General Request,Parks & Recreation Department,Administrative & General Requests,Parks General Request,PARK_Administration,PARK,,,369 Lagrange St  West Roxbury  MA  02132,12.0,06,6.0,E5,West Roxbury,12.0,20,2014.0,E,369 Lagrange St,2132.0,Address,166825.0,42.2803,-71.1569,Constituent Call,"(42.2803, -71.1569)"
608475,101001519118,08/12/2015 09:46:00 AM,,08/13/2015 02:10:42 PM,ONTIME,Closed,Case Closed. Closed date : 2015-08-13 14:10:42.863 Case Resolved l think you cardboard box barrels. l need to know the date of the event.,Ground Maintenance: Ringer Playground,Parks & Recreation Department,Administrative & General Requests,Parks General Request,PARK_Maintenance_Region 4,PARK,,,105 Allston St  Allston  MA  02134,11.0,04,9.0,D14,Allston / Brighton,15.0,Ward 21,2106.0,E,105 Allston St,2134.0,Address,158136.0,42.3499,-71.1372,Constituent Call,"(42.3499, -71.1372)"
608586,101001519245,08/12/2015 10:56:00 AM,,08/13/2015 03:17:48 PM,ONTIME,Closed,Case Closed Case Noted  The Boston Parks and Recreation Department did not have a crew at this location or on this street on the day this case was created. There was a crew dispatched to this street on 8/4/15 to clean up a large leader that fell onto front lawn of 27. The large debris was removed by the crew. The site was re-inspected today by the BPRD and found that small twigs and chips were left at the site and were cleaned up today at the time of inspection.,Parks General Request,Parks & Recreation Department,Administrative & General Requests,Parks General Request,PARK_Administration,PARK,,,31 Eastbourne St  Roslindale  MA  02131,12.0,06,5.0,E5,Roslindale,10.0,Ward 20,2009.0,R1,31 Eastbourne St,2131.0,Address,50846.0,42.2816,-71.1408,Constituent Call,"(42.2816, -71.1408)"
609063,101001519848,08/12/2015 07:31:00 PM,,08/13/2015 09:54:46 AM,ONTIME,Closed,Case Closed. Closed date : 2015-08-13 09:54:46.233 Case Noted There was a misunderstanding in the which field was the issue. The softball league plays at the little league.  Unfortunately  the softball ball field was inspected on 8/12/15.  A work order will be issued to inspect/prep Little League field for a gamed on Monday  August 17.,Parks General Request,Parks & Recreation Department,Administrative & General Requests,Parks General Request,PARK_Administration,PARK,,,529-543 Commercial St  Boston  MA  02109,3.0,1B,1.0,A1,Boston,3.0,3,302.0,E,529-543 Commercial St,2109.0,Address,36790.0,42.3688,-71.0562,Constituent Call,"(42.3688, -71.0562)"
609822,101001520780,08/13/2015 05:54:00 PM,,08/26/2015 01:45:39 PM,ONTIME,Closed,Case Closed. Closed date : 2015-08-26 13:45:39.0 Case Resolved done 8-19-15,Parks General Request,Parks & Recreation Department,Administrative & General Requests,Parks General Request,PARK_Maintenance_Trades,PARK,,,69 Proctor St  Roxbury  MA  02119,7.0,03,7.0,B2,Roxbury,13.0,08,806.0,,69 Proctor St,2119.0,Address,168943.0,42.3267,-71.0701,Constituent Call,"(42.3267, -71.0701)"
610766,101001521986,08/15/2015 12:36:00 PM,,08/17/2015 01:36:16 PM,ONTIME,Closed,Case Closed. Closed date : 2015-08-17 13:36:16.663 Case Noted This is an enforcement issue.  Animal Control or BPD should be notified when the violation is occuring.,Parks General Request,Parks & Recreation Department,Administrative & General Requests,Parks General Request,PARK_Administration,PARK,,,75 W Rutland Sq  Roxbury  MA  02118,4.0,1C,7.0,D4,Roxbury,6.0,4,404.0,,75 W Rutland Sq,2118.0,Address,342665.0,42.3594,-71.0587,Constituent Call,"(0, 0)"
611092,101001522419,08/16/2015 07:24:00 PM,,08/18/2015 11:07:02 AM,ONTIME,Closed,Case Closed Case Noted  Park Rangers and BPD are aware of this issue.  The issue has been raised at various public meetings including the Franklin Park Coalition.  There is the issue on non-compliance (not stopping) when attempting to advise or write a citation.  Please call 911 when the violation is occuring to ensure these incidents are registered.    If you have any questions  please contact the Parkline at 617-635-7275. Thank you.,Parks General Request,Parks & Recreation Department,Administrative & General Requests,Parks General Request,PARK_Administration,PARK,,,INTERSECTION of Pierpont Rd & Walnut Entrance  Jamaica Plain  MA,9.0,02,7.0,B2,Greater Mattapan,13.0,Ward 12,1207.0,,INTERSECTION Pierpont Rd & Walnut Entrance,,Intersection,7884.0,42.3111,-71.0963,Constituent Call,"(42.3111, -71.0963)"
611782,101001523331,08/17/2015 03:27:00 PM,,09/28/2015 12:38:14 PM,ONTIME,Closed,Case Closed. Closed date : 2015-09-28 12:38:14.343 Case Noted We will not be installing new signs all previous signs were vandilzed numerous times.,Parks General Request,Parks & Recreation Department,Administrative & General Requests,Parks General Request,PARK_Maintenance_Trades,PARK,,,4 Charles St  Boston  MA  02108,3.0,1C,8.0,A1,Boston,14.0,5,503.0,,4 Charles St,2108.0,Address,342578.0,42.3594,-71.0587,Constituent Call,"(0, 0)"
613362,101001525359,08/19/2015 01:39:00 PM,,09/25/2015 09:51:11 AM,ONTIME,Closed,Case Closed. Closed date : 2015-09-25 09:51:11.107 Case Resolved Hose was repaired.,Parks General Request,Parks & Recreation Department,Administrative & General Requests,Parks General Request,PARK_Maintenance_Trades,PARK,,,75 W Rutland Sq  Roxbury  MA  02118,4.0,1C,7.0,D4,Roxbury,6.0,4,404.0,,75 W Rutland Sq,2118.0,Address,342665.0,42.3594,-71.0587,Constituent Call,"(0, 0)"
617201,101001530366,08/25/2015 07:35:00 PM,,09/22/2015 03:12:15 PM,ONTIME,Closed,Case Closed. Closed date : 2015-09-22 15:12:15.293 Case Noted flags changed 9-14-15,Parks General Request,Parks & Recreation Department,Administrative & General Requests,Parks General Request,PARK_Maintenance_Trades,PARK,,,23 Everett St  Dorchester  MA  02122,7.0,07,3.0,C11,Dorchester,7.0,16,1602.0,E,23 Everett St,2122.0,Address,341627.0,42.3008,-71.0524,Constituent Call,"(42.3008, -71.0524)"
617546,101001530770,08/26/2015 09:27:00 AM,,08/27/2015 03:49:23 PM,ONTIME,Closed,Case Closed. Closed date : 2015-08-27 15:49:23.273 Case Noted City of Boston holds the record of ownership for the parcel  but the care  custody and control and maintenance of the parcel is held by DCR.  The same rule applies to Richardson Park (Blake House) further down Columbia Rd.  Please direct any maintenance issues to the DCR.  Thank you.,Parks General Request,Parks & Recreation Department,Administrative & General Requests,Parks General Request,PARK_Administration,PARK,,,INTERSECTION of Buttonwood St & Columbia Rd  Dorchester  MA,7.0,03,3.0,C6,Dorchester,7.0,Ward 13,1307.0,,INTERSECTION Buttonwood St & Columbia Rd,,Intersection,2266.0,42.3211,-71.0559,Constituent Call,"(42.3211, -71.0559)"
617914,101001541263,08/26/2015 03:01:00 PM,,08/31/2015 02:50:05 PM,ONTIME,Closed,Case Closed. Closed date : 2015-08-31 14:50:05.673 Case Resolved,Parks General Request,Parks & Recreation Department,Administrative & General Requests,Parks General Request,PARK_Maintenance_Trades,PARK,,,150 Martin Luther King Jr Blvd  Roxbury  MA  02119,9.0,10B,7.0,B2,Roxbury,13.0,12,1203.0,,150 Martin Luther King Jr Blvd,2119.0,Address,342513.0,42.3594,-71.0587,Constituent Call,"(0, 0)"
618007,101001541409,08/26/2015 05:11:00 PM,,08/27/2015 12:23:52 PM,ONTIME,Closed,Case Closed Case Noted  There are no City of Boston trees at thjs location. These are private trees on the lawn.,Parks General Request,Parks & Recreation Department,Administrative & General Requests,Parks General Request,PARK_Administration,PARK,,,83 Camden St  Roxbury  MA  02118,7.0,10B,7.0,D4,Roxbury,13.0,Ward 9,903.0,EA,83 Camden St,2118.0,Address,201323.0,42.3376,-71.0806,Constituent Call,"(42.3376, -71.0806)"
618247,101001541723,08/27/2015 08:28:00 AM,,08/27/2015 12:53:45 PM,ONTIME,Closed,Case Closed. Closed date : 2015-08-27 12:53:45.037 Case Resolved,Parks General Request,Parks & Recreation Department,Administrative & General Requests,Parks General Request,PARK_Administration,PARK,,,420 West St  Hyde Park  MA  02136,12.0,06,5.0,E18,Roslindale,10.0,18,1812.0,E,420 West St,2136.0,Address,147986.0,42.2684,-71.1329,Constituent Call,"(42.2684, -71.1329)"
618455,101001542007,08/27/2015 11:39:00 AM,,08/27/2015 12:02:01 PM,ONTIME,Closed,Case Closed. Closed date : 2015-08-27 12:02:01.733 Case Noted Staff has been notifed and will inspect. Contractors are working on site.,Parks General Request,Parks & Recreation Department,Administrative & General Requests,Parks General Request,PARK_Administration,PARK,,,222 Porter St  East Boston  MA  02128,1.0,09,1.0,A7,East Boston,1.0,01,105.0,,222 Porter St,2128.0,Address,343203.0,42.3594,-71.0587,Constituent Call,"(0, 0)"
619718,101001543684,08/29/2015 08:42:00 AM,,09/02/2015 08:58:36 AM,ONTIME,Closed,Case Closed. Closed date : 2015-09-02 08:58:36.95 Case Resolved when found we throw clothes in trash,Ground Maintenance: Rutherford Avenue Playground  Peter Looney Park,Parks & Recreation Department,Administrative & General Requests,Parks General Request,PARK_Maintenance_Region 1,PARK,,,34 Union St  Charlestown  MA  02129,3.0,1A,1.0,A15,Charlestown,2.0,2,201.0,,34 Union St,2129.0,Address,344014.0,42.3594,-71.0587,Constituent Call,"(0, 0)"
621581,101001546487,09/01/2015 11:21:00 AM,,09/08/2015 01:00:38 PM,ONTIME,Closed,Case Closed. Closed date : 2015-09-08 13:00:38.243 Case Noted fence repairs contracted out,Parks General Request,Parks & Recreation Department,Administrative & General Requests,Parks General Request,PARK_Administration,PARK,,,775 E First St  South Boston  MA  02127,6.0,05,2.0,C6,South Boston / South Boston Waterfront,5.0,06,607.0,,775 E First St,2127.0,Address,342025.0,42.3594,-71.0587,Constituent Call,"(0, 0)"
621681,101001546619,09/01/2015 12:56:00 PM,,09/01/2015 03:20:36 PM,ONTIME,Closed,Case Closed Case Noted  Authorized vehicles are allowed in the park.  Vehicle operator will be issued a warning.,Parks General Request,Parks & Recreation Department,Administrative & General Requests,Parks General Request,PARK_Administration,PARK,,,INTERSECTION of Adams St & Mallet St  Dorchester  MA,8.0,07,3.0,C11,Dorchester,7.0,Ward 16,1607.0,,INTERSECTION Adams St & Mallet St,,Intersection,104.0,42.2907,-71.0566,Constituent Call,"(42.2907, -71.0566)"
623402,101001548953,09/03/2015 09:50:00 AM,,09/28/2015 12:36:07 PM,ONTIME,Closed,Case Closed. Closed date : 2015-09-28 12:36:07.367 Case Noted Porta Potti compny will be removing them.,Parks General Request,Parks & Recreation Department,Administrative & General Requests,Parks General Request,PARK_Maintenance_Trades,PARK,,,2400 Beacon St  Brighton  MA  02135,11.0,04,9.0,D14,Allston / Brighton,15.0,Ward 21,2116.0,CM,2400 Beacon St,2135.0,Address,10389.0,42.3336,-71.1531,Constituent Call,"(42.3336, -71.1531)"
624625,101001570663,09/04/2015 08:39:00 PM,,09/08/2015 10:54:07 AM,ONTIME,Closed,Case Closed. Closed date : 2015-09-08 10:54:07.867 Case Noted,Parks General Request,Parks & Recreation Department,Administrative & General Requests,Parks General Request,PARK_Administration,PARK,,,1125 Centre St  Jamaica Plain  MA  02130,9.0,02,6.0,E13,Jamaica Plain,11.0,Ward 19,1902.0,E,1125 Centre St,2130.0,Address,27525.0,42.3032,-71.1276,Constituent Call,"(42.3032, -71.1276)"
627002,101001574095,09/09/2015 03:56:35 PM,,09/10/2015 07:53:52 AM,ONTIME,Closed,Case Closed. Closed date : 2015-09-10 07:53:52.823 Case Invalid,Parks General Request,Parks & Recreation Department,Administrative & General Requests,Parks General Request,PARK_Administration,PARK,,,15 Erie Pl  Jamaica Plain  MA  02130,9.0,02,7.0,E13,Jamaica Plain,11.0,Ward 11,1105.0,R2,15 Erie Pl,2130.0,Address,54176.0,42.3137,-71.0993,Constituent Call,"(42.3137, -71.0993)"
627038,101001574148,09/09/2015 05:09:00 PM,,09/10/2015 03:42:06 PM,ONTIME,Closed,Case Closed. Closed date : 2015-09-10 15:42:06.49 Case Resolved park cleaned up,Ground Maintenance: Copps Hill Terrace,Parks & Recreation Department,Administrative & General Requests,Parks General Request,PARK_Maintenance_Region 1,PARK,,,INTERSECTION of Charter St & Copps Hill Ters  Boston  MA,3.0,1B,1.0,A1,Downtown / Financial District,3.0,Ward 3,302.0,,INTERSECTION Charter St & Copps Hill Ters,,Intersection,2828.0,42.3678,-71.0558,Constituent Call,"(42.3678, -71.0558)"
628071,101001575700,09/11/2015 09:32:00 AM,,09/15/2015 11:53:50 AM,ONTIME,Closed,Case Closed. Closed date : 2015-09-15 11:53:50.673 Case Resolved the crew cut and trimmed this today.,Ground Maintenance: Centervale Park,Parks & Recreation Department,Administrative & General Requests,Parks General Request,PARK_Maintenance_Region 2,PARK,,,INTERSECTION of Bourneside St & Centervale Park  Dorchester  MA,8.0,07,3.0,C11,Dorchester,7.0,Ward 16,1601.0,,INTERSECTION Bourneside St & Centervale Park,,Intersection,1701.0,42.2966,-71.0626,Constituent Call,"(42.2966, -71.0626)"
629865,101001578174,09/14/2015 03:50:00 PM,,10/21/2015 04:16:03 PM,ONTIME,Closed,Case Closed. Closed date : 2015-10-21 16:16:03.16 Case Noted trades division reports plenty of signs up  15 posted,Parks General Request,Parks & Recreation Department,Administrative & General Requests,Parks General Request,PARK_Maintenance_Trades,PARK,,,330 Perkins St  Jamaica Plain  MA  02130,9.0,02,6.0,E13,Jamaica Plain,11.0,19,1903.0,,330 Perkins St,2130.0,Address,347229.0,42.3594,-71.0587,Constituent Call,"(0, 0)"
629945,101001578275,09/14/2015 05:49:00 PM,,09/15/2015 02:32:32 PM,ONTIME,Closed,Case Closed. Closed date : 2015-09-15 14:32:32.273 Case Noted On site now with our GC. Activators have been cleaned and lubricated.,Parks General Request,Parks & Recreation Department,Administrative & General Requests,Parks General Request,INFO01_GenericeFormforOtherServiceRequestTypes,INFO,,,42 Eighth St  Charlestown  MA  02129,3.0,1A,1.0,A15,Charlestown,2.0,Ward 2,202.0,CM,42 Eighth St,2129.0,Address,51681.0,42.3748,-71.0524,Constituent Call,"(42.3748, -71.0524)"
630233,101001578687,09/15/2015 09:24:00 AM,,09/15/2015 01:53:14 PM,ONTIME,Closed,Case Closed. Closed date : 2015-09-15 13:53:14.21 Case Noted Field technician responded and performed investigation  no leak found in and around the area,Parks General Request,Parks & Recreation Department,Administrative & General Requests,Parks General Request,INFO01_GenericeFormforOtherServiceRequestTypes,INFO,,,45 Prince St  Boston  MA  02113,3.0,1B,1.0,A1,Boston,3.0,3,303.0,,45 Prince St,2113.0,Address,342574.0,42.3594,-71.0587,Constituent Call,"(0, 0)"
630898,101001579584,09/15/2015 06:25:00 PM,,10/11/2015 09:00:50 AM,ONTIME,Closed,Case Closed. Closed date : 2015-10-11 09:00:50.967 Case Resolved the lots are open,Ground Maintenance: Almont Park/Hunt Playground,Parks & Recreation Department,Administrative & General Requests,Parks General Request,PARK_Maintenance_Region 2,PARK,,,INTERSECTION of Almont St & Orlando St  Mattapan  MA,8.0,07,5.0,B3,Greater Mattapan,9.0,Ward 18,1803.0,,INTERSECTION Almont St & Orlando St,,Intersection,338.0,42.2763,-71.0973,Constituent Call,"(42.2763, -71.0973)"
630919,101001579610,09/15/2015 06:59:00 PM,,09/16/2015 01:29:37 PM,ONTIME,Closed,Case Closed. Closed date : 2015-09-16 13:29:37.997 Case Noted Park Rangers responded to call.,Parks General Request,Parks & Recreation Department,Administrative & General Requests,Parks General Request,PARK_Administration,PARK,,,450 Walnut Ave  Jamaica Plain  MA  02130,9.0,02,7.0,B2,Greater Mattapan,13.0,12,1207.0,,450 Walnut Ave,2130.0,Address,342004.0,42.3594,-71.0587,Constituent Call,"(0, 0)"
631543,101001580597,09/16/2015 03:30:00 PM,,09/18/2015 07:03:11 PM,ONTIME,Closed,Case Closed. Closed date : 2015-09-18 19:03:11.49 Case Resolved we the parks drpt do not throw pebbles or dirt on walkways but if dirty we will clean it,Ground Maintenance: Brophy Park  Brophy Park,Parks & Recreation Department,Administrative & General Requests,Parks General Request,PARK_Maintenance_Region 1,PARK,,,192 Webster St  East Boston  MA  02128,1.0,09,1.0,A7,East Boston,1.0,1,101.0,,192 Webster St,2128.0,Address,342012.0,42.3594,-71.0587,Constituent Call,"(0, 0)"
631578,101001580649,09/16/2015 04:15:00 PM,,09/21/2015 08:53:30 AM,ONTIME,Closed,Case Closed. Closed date : 2015-09-21 08:53:30.433 Case Resolved bags pucked up sept 21,Ground Maintenance: Sumner and Lamson St. Playground,Parks & Recreation Department,Administrative & General Requests,Parks General Request,PARK_Maintenance_Region 1,PARK,,,294-296 Sumner St  East Boston  MA  02128,1.0,09,1.0,A7,East Boston,1.0,Ward 1,103.0,RL,294-296 Sumner St,2128.0,Address,132375.0,42.3677,-71.0367,Constituent Call,"(42.3677, -71.0367)"
631986,101001581226,09/17/2015 10:36:00 AM,,,ONTIME,Open,,Parks General Request,Parks & Recreation Department,Administrative & General Requests,Parks General Request,PARK_Administration,PARK,,,40 Almont St  Mattapan  MA  02126,8.0,07,5.0,B3,Mattapan,9.0,18,1803.0,E,40 Almont St,2126.0,Address,341524.0,42.2741,-71.0969,Constituent Call,"(42.2741, -71.0969)"
632975,101001582704,09/18/2015 04:45:00 PM,,09/22/2015 10:42:02 AM,ONTIME,Closed,Case Closed Case Noted  Park Rangers and BPD are aware of this activity. Please contact BPD when violation is occuring. Thank you.,Parks General Request,Parks & Recreation Department,Administrative & General Requests,Parks General Request,PARK_Administration,PARK,,,1 Franklin Park Rd  Jamaica Plain  MA  02130,9.0,02,7.0,B2,Jamaica Plain,13.0,12,1207.0,,1 Franklin Park Rd,2130.0,Address,340820.0,42.3029,-71.0876,Constituent Call,"(42.3029, -71.0876)"
634300,101001584556,09/21/2015 06:51:00 PM,,09/22/2015 10:28:26 AM,ONTIME,Closed,Case Closed Case Noted  There is no park land at this location (Pond Circle and Pond St .).,Parks General Request,Parks & Recreation Department,Administrative & General Requests,Parks General Request,PARK_Administration,PARK,,,INTERSECTION of Pond Cir & Pond St  Jamaica Plain  MA,9.0,02,6.0,E13,Jamaica Plain,11.0,Ward 19,1902.0,,INTERSECTION Pond Cir & Pond St,,Intersection,7927.0,42.3122,-71.1242,Constituent Call,"(42.3122, -71.1242)"
637312,101001598843,09/27/2015 09:54:00 AM,,09/28/2015 11:08:46 AM,ONTIME,Closed,Case Closed. Closed date : 2015-09-28 11:08:46.317 Case Resolved,Parks General Request,Parks & Recreation Department,Administrative & General Requests,Parks General Request,PARK_Administration,PARK,,,330 Perkins St  Jamaica Plain  MA  02130,9.0,02,6.0,E13,Jamaica Plain,11.0,19,1903.0,,330 Perkins St,2130.0,Address,347229.0,42.3594,-71.0587,Constituent Call,"(0, 0)"
637342,101001598885,09/27/2015 11:43:00 AM,,10/02/2015 06:09:46 AM,ONTIME,Closed,Case Closed. Closed date : 2015-10-02 06:09:46.9 Case Resolved water off 10/1/15,Parks General Request,Parks & Recreation Department,Administrative & General Requests,Parks General Request,PARK_Maintenance_Trades,PARK,,,349 Bunker Hill St  Charlestown  MA  02129,3.0,1A,1.0,A15,Charlestown,2.0,2,207.0,E,349 Bunker Hill St,2129.0,Address,23598.0,42.3824,-71.0678,Constituent Call,"(42.3824, -71.0678)"
637486,101001599080,09/27/2015 10:26:00 PM,,12/03/2015 12:16:34 PM,ONTIME,Closed,Case Closed. Closed date : 2015-12-03 12:16:34.007 Case Noted Thank you for your comments regarding the Hempfest  also known by its   organizers as The Boston Freedom Rally.  �  The Boston Parks and Recreation Department has legally challenged on multiple   occasions dating back to the 1990s.� The courts have allowed the event to continue   despite our concerns over illicit drug use  damage to park property  and amplified   music.� We must respect these court decisions and the First Amendment rights of   the participants.� �For those who have suggested that the event be moved to another   park location  please note that the organizers specifically request that the event be   held on Boston Common and we have no say in that part of their application.  �  We will continue to work with the City of Boston Law Department to discuss our   options moving forward.� Your support and input is invaluable to this process.� We   are currently collecting written comments that we will present as discussions of   this matter move forward.  �  Please understand that we are constrained by past legal decisions interpreting this   as an event protected by free speech but we will continue to work to mitigate   impacts on the Common and the community as best we can.  �  Chris Cook  Commissioner,Parks General Request,Parks & Recreation Department,Administrative & General Requests,Parks General Request,PARK_Administration,PARK,,,48 Beacon St  Boston  MA  02108,3.0,1B,8.0,A1,Beacon Hill,14.0,Ward 5,503.0,CM,48 Beacon St,2108.0,Address,11615.0,42.3568,-71.0675,Constituent Call,"(42.3568, -71.0675)"
638713,101001600859,09/29/2015 03:12:00 PM,,,ONTIME,Open,,Parks General Request,Parks & Recreation Department,Administrative & General Requests,Parks General Request,PARK_Administration,PARK,,,369 Lagrange St  West Roxbury  MA  02132,12.0,06,6.0,E5,West Roxbury,12.0,20,2014.0,E,369 Lagrange St,2132.0,Address,166825.0,42.2803,-71.1569,Constituent Call,"(42.2803, -71.1569)"
641124,101001604390,10/04/2015 11:58:00 AM,,10/06/2015 10:59:24 AM,ONTIME,Closed,Case Closed Case Noted  The bench was on park property and is in an active construction zone. We are taking back approx 6' of parkland that was sidewalk. It is an unfortunate inconvenience during construction.,Parks General Request,Parks & Recreation Department,Administrative & General Requests,Parks General Request,PARK_Administration,PARK,,,INTERSECTION of Dudley St & Howard Ave  Dorchester  MA,7.0,03,7.0,B2,Roxbury,13.0,Ward 8,805.0,,INTERSECTION Dudley St & Howard Ave,,Intersection,4284.0,42.3202,-71.0713,Constituent Call,"(42.3202, -71.0713)"
642728,101001606807,10/07/2015 09:22:00 AM,,10/09/2015 01:43:06 PM,ONTIME,Closed,Case Closed. Closed date : 2015-10-09 13:43:06.15 Case Noted Contract is awarded via public bid process.  Park/grass will be inspected.  Contractor will be notified.,Parks General Request,Parks & Recreation Department,Administrative & General Requests,Parks General Request,PARK_Administration,PARK,,,INTERSECTION of Beech Glen St & Fort Ave  Roxbury  MA,9.0,10B,7.0,B2,Roxbury,13.0,Ward 11,1101.0,,INTERSECTION Beech Glen St & Fort Ave,,Intersection,1197.0,42.3261,-71.0953,Constituent Call,"(42.3261, -71.0953)"
644786,101001609993,10/12/2015 08:15:00 AM,,10/13/2015 11:36:12 AM,ONTIME,Closed,Case Closed Case Noted  There was no City of Boston tree maintenance scheduled on 10/12/15.  This may have been a private contractor in which case a police detail should have been present.  If you have any questions  please contact the Parkline at 617-635-7275.  Thank you.,Parks General Request,Parks & Recreation Department,Administrative & General Requests,Parks General Request,PARK_Administration,PARK,,,145-149 Cedar St  Roxbury  MA  02119,9.0,10B,7.0,B2,Roxbury,13.0,11,1101.0,,145-149 Cedar St,2119.0,Address,354021.0,42.3594,-71.0587,Constituent Call,"(0, 0)"
644841,101001610061,10/12/2015 10:51:00 AM,,10/13/2015 11:22:28 AM,ONTIME,Closed,Case Closed. Closed date : 2015-10-13 11:22:28.577 Case Noted,Parks General Request,Parks & Recreation Department,Administrative & General Requests,Parks General Request,PARK_Administration,PARK,,,1 Franklin Park Rd  Jamaica Plain  MA  02130,9.0,02,7.0,B2,Jamaica Plain,13.0,12,1207.0,,1 Franklin Park Rd,2130.0,Address,340820.0,42.3029,-71.0876,Constituent Call,"(42.3029, -71.0876)"
645711,101001611315,10/13/2015 08:26:00 PM,,10/15/2015 09:48:33 AM,ONTIME,Closed,Case Closed. Closed date : 2015-10-15 09:48:33.777 Case Noted This case has been forwarded to the Director of the Cementery Division. Gate will be locked.,Parks General Request,Parks & Recreation Department,Administrative & General Requests,Parks General Request,PARK_Administration,PARK,,,INTERSECTION of Eustis St & Williams St  Roxbury  MA,7.0,10B,7.0,B2,Roxbury,13.0,Ward 9,904.0,,INTERSECTION Eustis St & Williams St,,Intersection,4662.0,42.332,-71.0817,Constituent Call,"(42.332, -71.0817)"
645849,101001611513,10/14/2015 08:52:00 AM,,,ONTIME,Open,,Parks General Request,Parks & Recreation Department,Administrative & General Requests,Parks General Request,PARK_Maintenance_Trades,PARK,,,INTERSECTION of Commonwealth Ave & Exeter St  Boston  MA,4.0,1C,8.0,D4,Back Bay,14.0,Ward 5,507.0,,INTERSECTION Commonwealth Ave & Exeter St,,Intersection,3396.0,42.3511,-71.0803,Constituent Call,"(42.3511, -71.0803)"
647295,101001613605,10/16/2015 09:58:00 AM,,11/09/2015 11:50:53 AM,ONTIME,Closed,Case Closed Case Noted  A stop work iorder has been issued by ISD.,Parks General Request,Parks & Recreation Department,Administrative & General Requests,Parks General Request,PARK_Administration,PARK,,,71 Grampian Way  Dorchester  MA  02125,7.0,03,3.0,C11,Dorchester,7.0,Ward 13,1310.0,R2,71 Grampian Way,2125.0,Address,65716.0,42.3116,-71.0485,Constituent Call,"(42.3116, -71.0485)"
648228,101001614859,10/19/2015 08:44:00 AM,,10/19/2015 01:09:45 PM,ONTIME,Closed,Case Closed. Closed date : 2015-10-19 13:09:45.223 Case Noted,Parks General Request,Parks & Recreation Department,Administrative & General Requests,Parks General Request,PARK_Administration,PARK,,,139 Tremont St  Boston  MA  02108,3.0,1C,8.0,A1,Beacon Hill,14.0,05,503.0,E,139 Tremont St,2108.0,Address,341542.0,42.3554,-71.0638,Constituent Call,"(42.3554, -71.0638)"
650898,101001618701,10/23/2015 09:08:00 AM,,10/23/2015 10:09:14 AM,ONTIME,Closed,Case Closed. Closed date : 2015-10-23 10:09:14.427 Case Noted Staff is on route ti inspect sprinkler system.,Parks General Request,Parks & Recreation Department,Administrative & General Requests,Parks General Request,PARK_Administration,PARK,,,393 Commonwealth Ave  Boston  MA  02215,4.0,10A,8.0,D4,Back Bay,14.0,Ward 5,509.0,CM,393 Commonwealth Ave,2215.0,Address,40636.0,42.3494,-71.0902,Constituent Call,"(42.3494, -71.0902)"
652041,101001620364,10/26/2015 10:48:00 AM,,10/26/2015 11:18:46 AM,ONTIME,Closed,Case Closed. Closed date : 2015-10-26 11:18:46.087 Case Resolved was taking care of.,Ground Maintenance: Mission Hill Playground  Mission Hill Playground,Parks & Recreation Department,Administrative & General Requests,Parks General Request,PARK_Maintenance_Region 3,PARK,,,60 Smith St  Mission Hill  MA  02120,9.0,10A,8.0,B2,Mission Hill,14.0,10,1002.0,,60 Smith St,2120.0,Address,342526.0,42.3594,-71.0587,Constituent Call,"(0, 0)"
652305,101001620777,10/26/2015 04:21:00 PM,,10/26/2015 04:51:20 PM,ONTIME,Closed,Case Closed. Closed date : 2015-10-26 16:51:20.283 Case Noted Signs are being fabricated and will be posted ASAP.,Parks General Request,Parks & Recreation Department,Administrative & General Requests,Parks General Request,PARK_Administration,PARK,,,55 Winthrop St  Charlestown  MA  02129,3.0,1A,1.0,A15,Charlestown,2.0,02,203.0,,55 Winthrop St,2129.0,Address,342691.0,42.3594,-71.0587,Constituent Call,"(0, 0)"
652465,101001621017,10/27/2015 08:24:00 AM,,10/27/2015 09:28:06 AM,ONTIME,Closed,Case Closed. Closed date : 2015-10-27 09:28:06.9 Case Noted,Parks General Request,Parks & Recreation Department,Administrative & General Requests,Parks General Request,PARK_Administration,PARK,,,1 Jewish War Veterans Dr  Jamaica Plain  MA  02130,9.0,02,7.0,B2,Greater Mattapan,13.0,12,1207.0,E,1 Jewish War Veterans Dr,2130.0,Address,163434.0,42.301,-71.0886,Constituent Call,"(42.301, -71.0886)"
653846,101001622956,10/29/2015 04:16:00 AM,,10/29/2015 11:13:12 AM,ONTIME,Closed,Case Closed Case Noted,Parks General Request,Parks & Recreation Department,Administrative & General Requests,Parks General Request,PARK_Administration,PARK,,,30 Randolph St  Roxbury  MA  02118,4.0,1C,2.0,D4,Roxbury,4.0,3,307.0,,30 Randolph St,2118.0,Address,172349.0,42.3416,-71.0641,Constituent Call,"(42.3416, -71.0641)"
654270,101001623603,10/29/2015 03:23:00 PM,,10/29/2015 04:33:04 PM,ONTIME,Closed,Case Closed. Closed date : 2015-10-29 16:33:04.15 Case Noted Park Rangers notified.,Parks General Request,Parks & Recreation Department,Administrative & General Requests,Parks General Request,PARK_Administration,PARK,,,INTERSECTION of Park St & Tremont St  Boston  MA,3.0,1C,8.0,A1,Downtown / Financial District,14.0,Ward 5,503.0,,INTERSECTION Park St & Tremont St,,Intersection,7782.0,42.3565,-71.062,Constituent Call,"(42.3565, -71.062)"
655386,101001625196,11/01/2015 04:13:00 PM,,11/02/2015 10:26:41 AM,ONTIME,Closed,Case Closed. Closed date : 2015-11-02 10:26:41.517 Case Noted This is enforcement issue.  BPD should always be notified.,Parks General Request,Parks & Recreation Department,Administrative & General Requests,Parks General Request,PARK_Administration,PARK,,,1 Franklin Park Rd  Jamaica Plain  MA  02130,9.0,02,7.0,B2,Jamaica Plain,13.0,12,1207,,1 Franklin Park Rd,2130.0,Address,340820.0,42.3029,-71.0876,Constituent Call,"(42.3029, -71.0876)"
657112,101001627710,11/04/2015 11:55:00 AM,,11/04/2015 04:40:23 PM,ONTIME,Closed,Case Closed Case Noted  According to Permitting Division  the lights usually go off at 8:30PM on a regular basis.  On 11/3  the lights were turned on later in error.  We apologize for the for the error.  Thank you for notifying us.   If you have any questions  please contact the Parkline at 617-635-7275.  Thank you.,Parks General Request,Parks & Recreation Department,Administrative & General Requests,Parks General Request,PARK_Administration,PARK,,,INTERSECTION of E Eagle St & Glendon St  East Boston  MA,1.0,09,1.0,A7,East Boston,1.0,Ward 1,0109,,INTERSECTION E Eagle St & Glendon St,,Intersection,4372.0,42.3813,-71.0303,Constituent Call,"(42.3813, -71.0303)"
658441,101001629763,11/06/2015 01:34:00 PM,,11/06/2015 04:10:18 PM,ONTIME,Closed,Case Closed. Closed date : 2015-11-06 16:10:18.223 Case Noted Park Rangers will be notified about enforcement conerns regarding cycling and drug use. The Squirrels and jogger are are allowed on the Common.,Parks General Request,Parks & Recreation Department,Administrative & General Requests,Parks General Request,PARK_Administration,PARK,,,139 Tremont St  Boston  MA  02108,3.0,1C,8.0,A1,Beacon Hill,14.0,05,0503,E,139 Tremont St,2108.0,Address,341542.0,42.3554,-71.0638,Constituent Call,"(42.3554, -71.0638)"
659180,101001630794,11/09/2015 07:39:15 AM,,11/09/2015 07:45:14 AM,ONTIME,Closed,Case Closed. Closed date : 2015-11-09 07:45:14.497 Case Invalid Wrong eform  see case 1630794,Parks General Request,Parks & Recreation Department,Administrative & General Requests,Parks General Request,PARK_Administration,PARK,,,550 Norfolk St  Mattapan  MA  02126,8.0,07,4.0,B3,Greater Mattapan,9.0,18,1802,,550 Norfolk St,2126.0,Address,342029.0,42.3594,-71.0587,Constituent Call,"(0, 0)"
660126,101001632144,11/10/2015 11:49:00 AM,,,ONTIME,Open,,Parks General Request,Parks & Recreation Department,Administrative & General Requests,Parks General Request,PARK_Tree Maintenance Request,PARK,,,1799 Dorchester Ave  Dorchester  MA  02124,8.0,07,3.0,C11,Dorchester,8.0,Ward 16,1603,R2,1799 Dorchester Ave,2124.0,Address,48413.0,42.2893,-71.0636,Constituent Call,"(42.2893, -71.0636)"
663290,101001636547,11/17/2015 09:04:00 AM,,11/17/2015 09:48:51 AM,ONTIME,Closed,Case Closed Case Noted  Thank you for your concern  this has been forwarded to the proper department and is being addressed.,Parks General Request,Parks & Recreation Department,Administrative & General Requests,Parks General Request,PWDx_Administration,PWDx,,,INTERSECTION of Blue Hill Ave & River St  Mattapan  MA,8.0,07,4.0,B3,Greater Mattapan,9.0,Ward 18,1804,,INTERSECTION Blue Hill Ave & River St,,Intersection,1513.0,42.2676,-71.0938,Constituent Call,"(42.2676, -71.0938)"
663302,101001636570,11/17/2015 09:23:00 AM,,11/18/2015 08:53:16 AM,ONTIME,Closed,Case Closed. Closed date : 2015-11-18 08:53:16.18 Case Resolved we will put out 2 barrels on sidewalk but if and when it snows they might have to be removed so we can plow sidewalks,Ground Maintenance: Winthrop Square  Winthrop Square Park,Parks & Recreation Department,Administrative & General Requests,Parks General Request,PARK_Maintenance_Region 1,PARK,,,55 Winthrop St  Charlestown  MA  02129,3.0,1A,1.0,A15,Charlestown,2.0,02,0203,,55 Winthrop St,2129.0,Address,342691.0,42.3594,-71.0587,Constituent Call,"(0, 0)"
665291,101001639413,11/20/2015 09:37:00 AM,,11/20/2015 10:29:52 AM,ONTIME,Closed,Case Closed. Closed date : 2015-11-20 10:29:52.48,Ground Maintenance: Franklin Park  William J. Devine Golf Course,Parks & Recreation Department,Administrative & General Requests,Parks General Request,PARK_Maintenance_Region 3,PARK,,,1 Jewish War Veterans Dr  Jamaica Plain  MA  02130,9.0,02,7.0,B2,Greater Mattapan,13.0,12,1207,E,1 Jewish War Veterans Dr,2130.0,Address,163434.0,42.301,-71.0886,Constituent Call,"(42.301, -71.0886)"
665436,101001639659,11/20/2015 12:37:00 PM,,12/03/2015 11:36:31 AM,ONTIME,Closed,Case Closed. Closed date : 2015-12-03 11:36:31.363 Case Resolved Dead squirrel were removed from union park.,Ground Maintenance: Union Park Street Play Area,Parks & Recreation Department,Administrative & General Requests,Parks General Request,PARK_Maintenance_Region 5,PARK,,,INTERSECTION of Albany St & Randolph St  Roxbury  MA,4.0,1C,2.0,D4,South End,4.0,Ward 3,0307,,INTERSECTION Albany St & Randolph St,,Intersection,212.0,42.341,-71.0635,Employee Generated,"(42.341, -71.0635)"
667094,101001642237,11/24/2015 03:29:00 PM,,11/24/2015 03:38:29 PM,ONTIME,Closed,Case Closed. Closed date : 2015-11-24 15:38:29.893 Case Invalid test case Aggie,Parks General Request,Parks & Recreation Department,Administrative & General Requests,Parks General Request,PARK_Administration,PARK,,,,,,,,,,,,,,,,,42.3594,-71.0587,Employee Generated,"(0, 0)"
667694,101001643074,11/25/2015 06:00:00 PM,,11/30/2015 09:15:19 AM,ONTIME,Closed,Case Closed. Closed date : 2015-11-30 09:15:19.493 Case Resolved Park was opened.,Parks General Request,Parks & Recreation Department,Administrative & General Requests,Parks General Request,PARK_Administration,PARK,,,INTERSECTION of Columbus Ave & Walnut Ave  Dorchester  MA,9.0,10B,7.0,E13,Roxbury,11.0,Ward 11,1105,,INTERSECTION Columbus Ave & Walnut Ave,,Intersection,3282.0,42.3134,-71.0951,Constituent Call,"(42.3134, -71.0951)"
668002,101001643491,11/27/2015 11:50:00 AM,,12/02/2015 03:46:25 PM,ONTIME,Closed,Case Closed. Closed date : 2015-12-02 15:46:25.87 Case Resolved This request was responded to  directly to the sender  Michael� Kozu.,Parks General Request,Parks & Recreation Department,Administrative & General Requests,Parks General Request,INFO01_GenericeFormforOtherServiceRequestTypes,INFO,,,320 Walnut Ave  Dorchester  MA  02121,9.0,10B,7.0,B2,Dorchester,13.0,12,1208,,320 Walnut Ave,2121.0,Address,342035.0,42.3594,-71.0587,Constituent Call,"(0, 0)"
668587,101001644207,11/29/2015 03:13:00 PM,,12/10/2015 11:00:40 AM,ONTIME,Closed,Case Closed. Closed date : 2015-12-10 11:00:40.577 Case Resolved THE GUYS WERE NOT DONE WITH THE LEAVES AND WOULD RETURN TO #77 E BERKLEY STREET AND FINISH THE JOB.,Ground Maintenance: Peters Park,Parks & Recreation Department,Administrative & General Requests,Parks General Request,PARK_Maintenance_Region 5,PARK,,,77-77A E Berkeley St  Roxbury  MA  02118,4.0,1C,2.0,D4,South End,4.0,Ward 3,0307,CM,77-77A E Berkeley St,2118.0,Address,164639.0,42.344,-71.0669,Constituent Call,"(42.344, -71.0669)"
669257,101001655233,11/30/2015 06:34:00 PM,,12/01/2015 02:58:08 PM,ONTIME,Closed,"Case Closed. Closed date : 2015-12-01 14:58:08.923 Case Noted Dear Mr Webb  Constituent called on 4/3/15 reporting low hanging branches on tree at 1949 Commonwealth Ave.  Certified Arborist Max Ford-Diamond inspected the tree on 4/7/15:  ""remove tree  28"" pear. top broke out previously.  all sucker growth"".  Site will be surveyed for a new tree.  If you have any questions  please contact the Parkline at 617-635-7275.  Thank you.",Parks General Request,Parks & Recreation Department,Administrative & General Requests,Parks General Request,PARK_Administration,PARK,,,1949 Commonwealth Ave  Brighton  MA  02135,11.0,04,9.0,D14,Allston / Brighton,15.0,Ward 21,2116,CM,1949 Commonwealth Ave,2135.0,Address,409723.0,42.3594,-71.0587,Constituent Call,"(0, 0)"
670027,101001656401,12/02/2015 08:13:00 AM,,12/12/2015 07:25:23 AM,ONTIME,Closed,Case Closed. Closed date : 2015-12-12 07:25:23.827 Case Resolved shut power off,,Parks & Recreation Department,Administrative & General Requests,Parks General Request,PARK_Maintenance_Lighting Electrical,PARK,,,230 Shawmut Ave  Roxbury  MA  02118,4.0,1C,2.0,D4,Roxbury,4.0,3,0307,,230 Shawmut Ave,2118.0,Address,342571.0,42.3594,-71.0587,Constituent Call,"(0, 0)"
673553,101001661608,12/09/2015 10:53:00 AM,,12/11/2015 02:35:03 PM,ONTIME,Closed,Case Closed. Closed date : 2015-12-11 14:35:03.983 Duplicate of Existing Case Duplicate CRM,Parks General Request,Parks & Recreation Department,Administrative & General Requests,Parks General Request,BTDT_District 01,BTDT,,,INTERSECTION of Condor St & Meridian St  East Boston  MA,1.0,09,1.0,A7,East Boston,1.0,Ward 1,108.0,,INTERSECTION Condor St & Meridian St,,Intersection,3423.0,42.3826,-71.0393,Constituent Call,"(42.3826, -71.0393)"
674307,101001662710,12/10/2015 01:53:00 PM,,12/16/2015 04:20:25 PM,ONTIME,Closed,Case Closed Case Resolved  Contractror will be notified.,Parks General Request,Parks & Recreation Department,Administrative & General Requests,Parks General Request,PARK_Administration,PARK,,,118 Lagrange St  West Roxbury  MA  02132,12.0,06,6.0,E5,West Roxbury,12.0,Ward 20,2010.0,R1,118 Lagrange St,2132.0,Address,82640.0,42.2756,-71.1478,Constituent Call,"(42.2756, -71.1478)"
674839,101001663480,12/11/2015 02:40:00 PM,,,ONTIME,Open,,Parks General Request,Parks & Recreation Department,Administrative & General Requests,Parks General Request,INFO01_GenericeFormforOtherServiceRequestTypes,INFO,,,INTERSECTION of Charlesgate West & Commonwealth Ave  Boston  MA,4.0,10A,8.0,D4,Fenway / Kenmore / Audubon Circle / Longwood,14.0,Ward 5,510.0,,INTERSECTION Charlesgate West & Commonwealth Ave,,Intersection,2820.0,42.3488,-71.0929,Twitter,"(42.3488, -71.0929)"
675319,101001664136,12/13/2015 12:39:00 PM,,12/16/2015 06:29:10 AM,ONTIME,Closed,Case Closed. Closed date : 2015-12-16 06:29:10.363 Case Resolved,Parks General Request,Parks & Recreation Department,Administrative & General Requests,Parks General Request,PARK_Maintenance_Trades,PARK,,,55 Malcolm X Blvd  Mission Hill  MA  02120,9.0,10B,7.0,B2,Mission Hill,13.0,09,905.0,E,55 Malcolm X Blvd,2120.0,Address,88754.0,42.3316,-71.0895,Constituent Call,"(42.3316, -71.0895)"
679031,101001679730,12/21/2015 02:43:00 PM,,01/07/2016 08:36:35 AM,ONTIME,Closed,Case Closed. Closed date : 2016-01-07 08:36:35.533 Case Resolved The graffiti tag at this location has been removed by the City of Boston Property Management Department. This case number has been resolved and is closed.,Parks General Request,Parks & Recreation Department,Administrative & General Requests,Parks General Request,PROP_GRAF_GraffitiRemoval,PROP,,,150-152 Harvard Ave  Allston  MA  02134,11.0,04,9.0,D14,Allston / Brighton,15.0,Ward 21,2105.0,C,150-152 Harvard Ave,2134.0,Address,157224.0,42.3517,-71.1319,Twitter,"(42.3517, -71.1319)"
680603,101001682167,12/26/2015 10:42:00 PM,,12/31/2015 08:51:57 AM,ONTIME,Closed,Case Closed. Closed date : 2015-12-31 08:51:57.917 Case Noted Park Dept. crew was notified  gate will be closed.,Parks General Request,Parks & Recreation Department,Administrative & General Requests,Parks General Request,PARK_Administration,PARK,,,48 Lambert Ave  Roxbury  MA  02119,7.0,10B,7.0,B2,Roxbury,13.0,Ward 9,905.0,R3,48 Lambert Ave,2119.0,Address,83627.0,42.3271,-71.0901,Constituent Call,"(42.3271, -71.0901)"
681498,101001683568,12/29/2015 11:09:00 AM,,01/06/2016 07:19:23 AM,ONTIME,Closed,Case Closed. Closed date : 2016-01-06 07:19:23.663 Case Resolved bags removed,Ground Maintenance: LoPresti Park,Parks & Recreation Department,Administrative & General Requests,Parks General Request,PARK_Maintenance_Region 1,PARK,,,899 E Broadway  South Boston  MA  02127,6.0,05,2.0,C6,South Boston / South Boston Waterfront,5.0,Ward 6,609.0,R3,899 E Broadway,2127.0,Address,21310.0,42.3355,-71.0282,Constituent Call,"(42.3355, -71.0282)"
682617,101001685614,12/31/2015 04:27:00 PM,,01/04/2016 11:25:37 AM,ONTIME,Closed,Case Closed Case Noted  No contact info.,Parks General Request,Parks & Recreation Department,Administrative & General Requests,Parks General Request,PARK_Administration,PARK,,,366 Cummins Hwy  Roslindale  MA  02131,12.0,02,5.0,E18,Roslindale,10.0,Ward 18,1807.0,E,366 Cummins Hwy,2131.0,Address,44875.0,42.2783,-71.1152,Constituent Call,"(42.2783, -71.1152)"
