,CASE_ENQUIRY_ID,OPEN_DT,TARGET_DT,CLOSED_DT,OnTime_Status,CASE_STATUS,CLOSURE_REASON,CASE_TITLE,SUBJECT,REASON,TYPE,QUEUE,Department,SubmittedPhoto,ClosedPhoto,Location,fire_district,pwd_district,city_council_district,police_district,neighborhood,neighborhood_services_district,ward,precinct,land_usage,LOCATION_STREET_NAME,LOCATION_ZIPCODE,Property_Type,Property_ID,LATITUDE,LONGITUDE,Source,Geocoded_Location
470959,101001242913,01/06/2015 09:48:19 AM,01/21/2015 09:48:19 AM,01/06/2015 09:48:23 AM,ONTIME,Closed,Case Closed Case Resolved Created Request for Recycling Bin,Recycling Cart Return,Public Works Department,Recycling,Recycling Cart Return,PWDx_IPL Damaged Cart Replacement,PWDx,https://cityworker.cityofboston.gov:8443/attachments/report/54abf5b1d052065cdb4cf231/photo/Report.jpg,,93 N St  South Boston  MA  02127,6.0,05,2.0,C6,South Boston / South Boston Waterfront,5.0,Ward 6,608.0,R1,93 N St,2127.0,Address,100152.0,42.3352,-71.0315,City Worker App,"(42.3352, -71.0315)"
473481,101001246610,01/13/2015 12:10:30 PM,01/28/2015 12:10:30 PM,01/13/2015 12:10:34 PM,ONTIME,Closed,Case Closed Case Resolved Created Request for Recycling Bin,Recycling Cart Return,Public Works Department,Recycling,Recycling Cart Return,PWDx_IPL Damaged Cart Replacement,PWDx,,,9 Stanton St  Dorchester  MA  02124,8.0,07,4.0,B3,Dorchester,9.0,17,1707.0,E,9 Stanton St,2124.0,Address,130247.0,42.2829,-71.0787,City Worker App,"(42.2829, -71.0787)"
473513,101001246654,01/13/2015 01:05:09 PM,01/28/2015 01:05:09 PM,01/13/2015 01:05:13 PM,ONTIME,Closed,Case Closed Case Resolved Created Request for Recycling Bin,Recycling Cart Return,Public Works Department,Recycling,Recycling Cart Return,PWDx_IPL Damaged Cart Replacement,PWDx,https://cityworker.cityofboston.gov:8443/attachments/report/54b55e52d052065cdb4d20c7/photo/Report.jpg,,134 Redlands Rd  West Roxbury  MA  02132,12.0,06,6.0,E5,West Roxbury,12.0,Ward 20,2020.0,R2,134 Redlands Rd,2132.0,Address,297758.0,42.2912,-71.1543,City Worker App,"(42.2912, -71.1543)"
476439,101001250737,01/21/2015 07:49:55 AM,02/04/2015 08:30:00 AM,01/21/2015 07:50:04 AM,ONTIME,Closed,Case Closed Case Resolved Created Request for Recycling Bin,Recycling Cart Return,Public Works Department,Recycling,Recycling Cart Return,PWDx_IPL Damaged Cart Replacement,PWDx,https://cityworker.cityofboston.gov:8443/attachments/report/54bfa071d052fe3c4d00f4eb/photo/Report.jpg,,524 E Fifth St  South Boston  MA  02127,6.0,05,2.0,C6,South Boston / South Boston Waterfront,5.0,Ward 6,606.0,R1,524 E Fifth St,2127.0,Address,57847.0,42.334,-71.0395,City Worker App,"(42.334, -71.0395)"
476739,101001251220,01/21/2015 01:53:31 PM,02/04/2015 01:53:30 PM,01/21/2015 01:53:35 PM,ONTIME,Closed,Case Closed Case Resolved Created Request for Recycling Bin,Recycling Cart Return,Public Works Department,Recycling,Recycling Cart Return,PWDx_IPL Damaged Cart Replacement,PWDx,https://cityworker.cityofboston.gov:8443/attachments/report/54bff5a5d052fe3c4d01012f/photo/Report.jpg,,81 Devon St  Dorchester  MA  02121,7.0,03,4.0,B2,Roxbury,13.0,Ward 14,1401.0,R3,81 Devon St,2121.0,Address,223902.0,42.3096,-71.0795,City Worker App,"(42.3096, -71.0795)"
477430,101001252329,01/23/2015 08:47:59 AM,02/06/2015 08:47:59 AM,01/23/2015 08:48:04 AM,ONTIME,Closed,Case Closed Case Resolved Created Request for Recycling Bin,Recycling Cart Return,Public Works Department,Recycling,Recycling Cart Return,PWDx_IPL Damaged Cart Replacement,PWDx,https://cityworker.cityofboston.gov:8443/attachments/report/54c2510ad0522e4ef0e339ea/photo/Report.jpg,,INTERSECTION of Farnham St & Reading St  Roxbury  MA,7.0,10B,7.0,B2,Roxbury,13.0,Ward 8,803.0,,INTERSECTION Farnham St & Reading St,,Intersection,4807.0,42.3304,-71.074,City Worker App,"(42.3304, -71.074)"
477434,101001252332,01/23/2015 08:49:24 AM,02/06/2015 08:49:24 AM,01/23/2015 08:49:27 AM,ONTIME,Closed,Case Closed Case Resolved Created Request for Recycling Bin,Recycling Cart Return,Public Works Department,Recycling,Recycling Cart Return,PWDx_IPL Damaged Cart Replacement,PWDx,https://cityworker.cityofboston.gov:8443/attachments/report/54c25160d0522e4ef0e339fc/photo/Report.jpg,,11-13 Farnham St  Roxbury  MA  02119,7.0,10B,7.0,B2,Roxbury,13.0,Ward 8,803.0,CL,11-13 Farnham St,2119.0,Address,56382.0,42.3304,-71.0742,City Worker App,"(42.3304, -71.0742)"
477589,101001252581,01/23/2015 11:41:05 AM,02/06/2015 11:41:05 AM,02/17/2015 03:46:40 PM,OVERDUE,Closed,Case Closed Case Resolved,Recycling Cart Return,Public Works Department,Recycling,Recycling Cart Return,PWDx_Recycling,PWDx,,,56 Marion St  East Boston  MA  02128,1.0,09,1.0,A7,East Boston,1.0,Ward 1,107.0,R1,56 Marion St,2128.0,Address,90050.0,42.379,-71.0377,Constituent Call,"(42.379, -71.0377)"
504438,101001290817,02/12/2015 10:28:20 AM,02/27/2015 10:28:20 AM,05/04/2015 03:17:58 PM,OVERDUE,Closed,Case Closed. Closed date : 2015-05-04 15:17:58.227 Case Resolved NO CART OUT 05/04/2015,Recycling Cart Return,Public Works Department,Recycling,Recycling Cart Return,PWDx_IPL Damaged Cart Replacement,PWDx,,,34 Shelby St  East Boston  MA  02128,1.0,09,1.0,A7,East Boston,1.0,Ward 1,110.0,R4,34 Shelby St,2128.0,Address,126636.0,42.3802,-71.0273,Constituent Call,"(42.3802, -71.0273)"
513899,101001303637,02/18/2015 09:55:10 AM,02/25/2015 09:55:09 AM,02/18/2015 09:55:16 AM,ONTIME,Closed,Case Closed Case Resolved Created Request for Recycling Bin,Recycling Cart Return,Public Works Department,Recycling,Recycling Cart Return,PWDx_IPL Damaged Cart Replacement,PWDx,,,140 Reservation Rd  Hyde Park  MA  02136,12.0,08,5.0,E18,Hyde Park,10.0,18,1819.0,,140 Reservation Rd,2136.0,Address,347352.0,42.3594,-71.0587,City Worker App,"(0, 0)"
529971,101001327647,03/09/2015 10:31:11 AM,03/16/2015 10:31:11 AM,04/02/2015 11:24:05 AM,OVERDUE,Closed,Case Closed Case Noted swapped out case close,Recycling Cart Return,Public Works Department,Recycling,Recycling Cart Return,PWDx_Recycling,PWDx,,,4-2 Ramsdell Ave  Roslindale  MA  02131,12.0,08,5.0,E18,Roslindale,10.0,Ward 18,1808.0,CM,4-2 Ramsdell Ave,2131.0,Address,114538.0,42.2769,-71.1192,Constituent Call,"(42.2769, -71.1192)"
532526,101001331497,03/12/2015 01:37:31 PM,03/19/2015 01:37:30 PM,03/12/2015 01:37:35 PM,ONTIME,Closed,Case Closed Case Resolved Created Request for Recycling Bin,Recycling Cart Return,Public Works Department,Recycling,Recycling Cart Return,PWDx_IPL Damaged Cart Replacement,PWDx,https://cityworker.cityofboston.gov:8443/attachments/report/5501ced8d052dab9f2a8702d/photo/Report.jpg,,32 Linwood St  Hyde Park  MA  02136,12.0,08,5.0,E18,Hyde Park,10.0,18,1812.0,R1,32 Linwood St,2136.0,Address,167110.0,42.2567,-71.1278,City Worker App,"(42.2567, -71.1278)"
534132,101001333839,03/16/2015 09:49:13 AM,03/23/2015 09:49:13 AM,03/16/2015 09:49:17 AM,ONTIME,Closed,Case Closed Case Resolved Created Request for Recycling Bin,Recycling Cart Return,Public Works Department,Recycling,Recycling Cart Return,PWDx_IPL Damaged Cart Replacement,PWDx,https://cityworker.cityofboston.gov:8443/attachments/report/5506df56d052dab9f2a88b6a/photo/Report.jpg,,19 Franklin St  Hyde Park  MA  02136,12.0,08,5.0,E18,Hyde Park,10.0,Ward 18,1819.0,R1,19 Franklin St,2136.0,Address,60709.0,42.2527,-71.133,City Worker App,"(42.2527, -71.133)"
534643,101001334594,03/17/2015 08:40:57 AM,03/24/2015 08:40:56 AM,03/17/2015 08:41:01 AM,ONTIME,Closed,Case Closed Case Resolved Created Request for Recycling Bin,Recycling Cart Return,Public Works Department,Recycling,Recycling Cart Return,PWDx_IPL Damaged Cart Replacement,PWDx,https://cityworker.cityofboston.gov:8443/attachments/report/550820d7d052dab9f2a89845/photo/Report.jpg,,69 Lubec St  East Boston  MA  02128,1.0,09,1.0,A7,East Boston,1.0,Ward 1,102.0,RL,69 Lubec St,2128.0,Address,87731.0,42.3704,-71.0332,City Worker App,"(42.3704, -71.0332)"
535959,101001336321,03/18/2015 12:55:29 PM,03/25/2015 12:55:29 PM,03/18/2015 12:55:36 PM,ONTIME,Closed,Case Closed Case Resolved Created Request for Recycling Bin,Recycling Cart Return,Public Works Department,Recycling,Recycling Cart Return,PWDx_IPL Damaged Cart Replacement,PWDx,https://cityworker.cityofboston.gov:8443/attachments/report/5509adfad052dab9f2a8b685/photo/Report.jpg,,3-5 Osceola St  Mattapan  MA  02126,8.0,08,5.0,E18,Hyde Park,9.0,Ward 18,1805.0,R2,3-5 Osceola St,2126.0,Address,106042.0,42.2632,-71.1036,City Worker App,"(42.2632, -71.1036)"
540124,101001341995,03/25/2015 03:18:41 PM,04/01/2015 03:18:41 PM,04/01/2015 12:52:04 PM,ONTIME,Closed,Case Closed Case Noted Cart collected on 4/1/15 at 10:21 a.m. by John Vibert.,Recycling Cart Return,Public Works Department,Recycling,Recycling Cart Return,PWDx_Recycling,PWDx,,,61 Tyndale St  Roslindale  MA  02131,9.0,06,6.0,E5,Roslindale,10.0,Ward 20,2007.0,CM,61 Tyndale St,2131.0,Address,138943.0,42.2872,-71.1399,Constituent Call,"(42.2872, -71.1399)"
540694,101001342832,03/26/2015 03:06:55 PM,04/02/2015 03:06:54 PM,04/03/2015 10:42:05 AM,OVERDUE,Closed,Case Closed Case Resolved brocken cart swapped new Cart # R9H026144 04/03/2015,Recycling Cart Return,Public Works Department,Recycling,Recycling Cart Return,PWDx_Recycling,PWDx,,,227 Savin Hill Ave  Dorchester  MA  02125,7.0,03,3.0,C11,Dorchester,7.0,Ward 13,1310.0,R1,227 Savin Hill Ave,2125.0,Address,123278.0,42.3088,-71.047,Constituent Call,"(42.3088, -71.047)"
541227,101001343612,03/27/2015 01:22:39 PM,04/03/2015 01:22:39 PM,05/07/2015 11:50:12 AM,OVERDUE,Closed,Case Closed. Closed date : 2015-05-07 11:50:12.573 Case Noted case needs more information  on cart in? need a serial # or tag  or note to service cart  1) needs to be out day of service. 2) needs to be rid of all Materials  3) identifying #s or tag  or note..please re create with all information. sorry for any in convenience,Recycling Cart Return,Public Works Department,Recycling,Recycling Cart Return,PWDx_IPL Damaged Cart Replacement,PWDx,,,61 Marlborough St  Boston  MA  02116,4.0,1C,8.0,D4,Back Bay,14.0,Ward 5,506.0,A,61 Marlborough St,2116.0,Address,91489.0,42.3541,-71.0752,Constituent Call,"(42.3541, -71.0752)"
542093,101001344833,03/30/2015 11:28:05 AM,04/06/2015 11:28:05 AM,04/29/2015 12:00:46 PM,OVERDUE,Closed,Case Closed Case Resolved broken cart swapped new cart # 0714424125 04/29/2015,Recycling Cart Return,Public Works Department,Recycling,Recycling Cart Return,PWDx_IPL Damaged Cart Replacement,PWDx,,,27 Monument Ave  Charlestown  MA  02129,3.0,1A,1.0,A15,Charlestown,2.0,Ward 2,203.0,R1,27 Monument Ave,2129.0,Address,96864.0,42.3744,-71.0619,Constituent Call,"(42.3744, -71.0619)"
543258,101001346464,04/01/2015 08:33:56 AM,04/08/2015 08:33:56 AM,05/29/2015 01:56:29 PM,OVERDUE,Closed,Case Closed Case Noted  no cart out 05/28/2015,Recycling Cart Return,Public Works Department,Recycling,Recycling Cart Return,PWDx_IPL Damaged Cart Replacement,PWDx,https://cityworker.cityofboston.gov:8443/attachments/report/551be5ae70b47681496b42b8/photo/Report.jpg,,14 Floral Pl  Hyde Park  MA  02136,12.0,08,5.0,E18,Hyde Park,10.0,Ward 18,1818.0,R1,14 Floral Pl,2136.0,Address,58777.0,42.2494,-71.119,City Worker App,"(42.2494, -71.119)"
543262,101001346468,04/01/2015 08:34:09 AM,04/08/2015 08:34:09 AM,04/01/2015 08:34:13 AM,ONTIME,Closed,Case Closed Case Resolved Created Request for Recycling Bin,Recycling Cart Return,Public Works Department,Recycling,Recycling Cart Return,PWDx_IPL Damaged Cart Replacement,PWDx,,,14 Floral Pl  Hyde Park  MA  02136,12.0,08,5.0,E18,Hyde Park,10.0,Ward 18,1818.0,R1,14 Floral Pl,2136.0,Address,58777.0,42.2494,-71.119,City Worker App,"(42.2494, -71.119)"
544399,101001348024,04/02/2015 01:54:41 PM,04/09/2015 01:54:41 PM,04/02/2015 01:54:45 PM,ONTIME,Closed,Case Closed Case Resolved Created Request for Recycling Bin,Recycling Cart Return,Public Works Department,Recycling,Recycling Cart Return,PWDx_IPL Damaged Cart Replacement,PWDx,https://cityworker.cityofboston.gov:8443/attachments/report/551d825e70b47681496b5ace/photo/Report.jpg,,204 W Ninth St  South Boston  MA  02127,6.0,05,2.0,C6,South Boston / South Boston Waterfront,5.0,Ward 7,705.0,CM,204 W Ninth St,2127.0,Address,102882.0,42.3333,-71.0524,City Worker App,"(42.3333, -71.0524)"
544982,101001348848,04/03/2015 02:00:07 PM,04/10/2015 02:00:07 PM,05/28/2015 02:31:07 PM,OVERDUE,Closed,Case Closed. Closed date : 2015-05-28 14:31:07.42 Case Resolved cart swapped out new cart #0714424135 05/22/15,Recycling Cart Return,Public Works Department,Recycling,Recycling Cart Return,PWDx_IPL Damaged Cart Replacement,PWDx,,,27 Mayhew St  Dorchester  MA  02125,6.0,03,2.0,C6,Dorchester,5.0,Ward 7,709.0,R1,27 Mayhew St,2125.0,Address,93259.0,42.3213,-71.0597,Constituent Call,"(42.3213, -71.0597)"
545736,101001349897,04/06/2015 09:21:59 AM,04/13/2015 09:21:59 AM,04/07/2015 09:35:25 AM,ONTIME,Closed,Case Closed Case Resolved Cart was pick up,Recycling Cart Return,Public Works Department,Recycling,Recycling Cart Return,PWDx_Recycling,PWDx,,,30 Overlook Rd  West Roxbury  MA  02132,12.0,06,6.0,E5,West Roxbury,12.0,Ward 20,2015.0,R1,30 Overlook Rd,2132.0,Address,106147.0,42.2624,-71.1577,Constituent Call,"(42.2624, -71.1577)"
546184,101001350495,04/06/2015 06:21:34 PM,04/14/2015 08:30:00 AM,04/29/2015 12:01:48 PM,OVERDUE,Closed,Case Closed Case Resolved broken cart swapped new cart # 0714424104 04/27/2015,Recycling Cart Return,Public Works Department,Recycling,Recycling Cart Return,PWDx_IPL Damaged Cart Replacement,PWDx,,,33 Pond Cir  Jamaica Plain  MA  02130,9.0,02,6.0,E13,Jamaica Plain,11.0,Ward 19,1902.0,R1,33 Pond Cir,2130.0,Address,111494.0,42.3134,-71.1246,Constituent Call,"(42.3134, -71.1246)"
546285,101001350630,04/07/2015 08:06:55 AM,04/14/2015 08:30:00 AM,04/07/2015 08:06:59 AM,ONTIME,Closed,Case Closed Case Resolved Created Request for Recycling Bin,Recycling Cart Return,Public Works Department,Recycling,Recycling Cart Return,PWDx_IPL Damaged Cart Replacement,PWDx,https://cityworker.cityofboston.gov:8443/attachments/report/5523c85970b47681496b7ef2/photo/Report.jpg,,1 City Hall Plz  Boston  MA  02108,3.0,1B,1.0,A1,Downtown / Financial District,3.0,Ward 3,306.0,E,1 City Hall Plz,2108.0,Address,340817.0,42.3601,-71.0579,City Worker App,"(42.3601, -71.0579)"
547152,101001351780,04/08/2015 09:35:57 AM,04/15/2015 09:35:57 AM,04/08/2015 09:35:59 AM,ONTIME,Closed,Case Closed Case Resolved Created Request for Recycling Bin,Recycling Cart Return,Public Works Department,Recycling,Recycling Cart Return,PWDx_IPL Damaged Cart Replacement,PWDx,,,400 Frontage Rd  Roxbury  MA  02118,6.0,05,2.0,C6,South Boston / South Boston Waterfront,6.0,Ward 8,801.0,E,400 Frontage Rd,2118.0,Address,61030.0,42.3412,-71.0615,City Worker App,"(42.3412, -71.0615)"
547390,101001352068,04/08/2015 12:24:08 PM,04/15/2015 12:24:07 PM,04/29/2015 12:01:13 PM,OVERDUE,Closed,Case Closed Case Resolved broken cart swapped new cart # 0814415239 04/29/2015,Recycling Cart Return,Public Works Department,Recycling,Recycling Cart Return,PWDx_IPL Damaged Cart Replacement,PWDx,,,16 Prospect St  Charlestown  MA  02129,3.0,1A,1.0,A15,Charlestown,2.0,Ward 2,203.0,R3,16 Prospect St,2129.0,Address,113444.0,42.3751,-71.0579,Constituent Call,"(42.3751, -71.0579)"
549511,101001355014,04/13/2015 12:38:31 PM,04/21/2015 12:38:31 PM,04/24/2015 08:52:10 AM,OVERDUE,Closed,Case Closed Case Resolved Picked up by PWD inspector,Recycling Cart Return,Public Works Department,Recycling,Recycling Cart Return,PWDx_IPL Damaged Cart Replacement,PWDx,,,44 Boylston St  Jamaica Plain  MA  02130,9.0,02,6.0,E13,Jamaica Plain,11.0,Ward 19,1901.0,R3,44 Boylston St,2130.0,Address,18574.0,42.3181,-71.1082,Constituent Call,"(42.3181, -71.1082)"
550402,101001356264,04/14/2015 03:01:16 PM,04/22/2015 03:01:15 PM,04/23/2015 02:36:21 PM,OVERDUE,Closed,Case Closed Case Resolved  PICKED UP,Recycling Cart Return,Public Works Department,Recycling,Recycling Cart Return,PWDx_Recycling,PWDx,,,217 Lexington St  East Boston  MA  02128,1.0,09,1.0,A7,East Boston,1.0,Ward 1,109.0,R3,217 Lexington St,2128.0,Address,264039.0,42.3796,-71.0319,Constituent Call,"(42.3796, -71.0319)"
550673,101001356640,04/15/2015 08:13:54 AM,04/23/2015 08:30:00 AM,05/12/2015 02:30:34 PM,OVERDUE,Closed,Case Closed. Closed date : 2015-05-12 14:30:34.55 Case Resolved broken cart swapped new cart # 0415302441 05/12/2015,Recycling Cart Return,Public Works Department,Recycling,Recycling Cart Return,PWDx_IPL Damaged Cart Replacement,PWDx,,,137 Saratoga St  East Boston  MA  02128,1.0,09,1.0,A7,East Boston,1.0,Ward 1,106.0,R2,137 Saratoga St,2128.0,Address,122499.0,42.3769,-71.0351,Constituent Call,"(42.3769, -71.0351)"
550777,101001356781,04/15/2015 09:39:48 AM,04/23/2015 09:39:48 AM,04/29/2015 02:31:48 PM,OVERDUE,Closed,Case Closed Case Resolved cart request filled  new cart #0714424122 04/29/2015,Recycling Cart Return,Public Works Department,Recycling,Recycling Cart Return,PWDx_IPL Damaged Cart Replacement,PWDx,,,121 Walter St  Roslindale  MA  02131,9.0,06,5.0,E5,Roslindale,10.0,Ward 20,2004.0,R1,121 Walter St,2131.0,Address,142268.0,42.2921,-71.1303,Constituent Call,"(42.2921, -71.1303)"
550812,101001356829,04/15/2015 09:50:03 AM,04/23/2015 09:50:03 AM,04/29/2015 12:02:23 PM,OVERDUE,Closed,Case Closed Case Resolved broken cart swapped new cart # 0714424152 04/27/2015,Recycling Cart Return,Public Works Department,Recycling,Recycling Cart Return,PWDx_IPL Damaged Cart Replacement,PWDx,,,184 Faneuil St  Brighton  MA  02135,11.0,04,9.0,D14,Allston / Brighton,15.0,Ward 22,2211.0,R2,184 Faneuil St,2135.0,Address,56172.0,42.3541,-71.1576,Constituent Call,"(42.3541, -71.1576)"
550980,101001357039,04/15/2015 12:31:24 PM,04/23/2015 12:31:23 PM,05/04/2015 08:58:02 AM,OVERDUE,Closed,Case Closed. Closed date : 2015-05-04 08:58:02.533 Case Invalid,Recycling Cart Return,Public Works Department,Recycling,Recycling Cart Return,PWDx_IPL Damaged Cart Replacement,PWDx,,,5 Hillside Ave  Jamaica Plain  MA  02130,12.0,02,6.0,E13,Jamaica Plain,10.0,Ward 19,1907.0,R1,5 Hillside Ave,2130.0,Address,74144.0,42.2974,-71.1131,Constituent Call,"(42.2974, -71.1131)"
551816,101001358229,04/16/2015 02:46:20 PM,04/24/2015 02:46:20 PM,04/30/2015 03:07:58 PM,OVERDUE,Closed,Case Closed Case Resolved NO CART OUT 04/30/2015,Recycling Cart Return,Public Works Department,Recycling,Recycling Cart Return,PWDx_IPL Damaged Cart Replacement,PWDx,,,22 Philbrick St  Roslindale  MA  02131,12.0,02,5.0,E18,Roslindale,10.0,Ward 18,1807.0,R1,22 Philbrick St,2131.0,Address,109953.0,42.2861,-71.1178,Constituent Call,"(42.2861, -71.1178)"
552219,101001358827,04/17/2015 11:32:43 AM,04/27/2015 11:32:43 AM,06/01/2015 03:07:40 PM,OVERDUE,Closed,Case Closed. Closed date : 2015-06-01 15:07:40.973 Duplicate of Existing Case Reference case # 101001383049,Recycling Cart Return,Public Works Department,Recycling,Recycling Cart Return,PWDx_Recycling,PWDx,,,8 Jacqueline Rd  West Roxbury  MA  02132,12.0,06,6.0,E5,West Roxbury,12.0,Ward 20,2016.0,R1,8 Jacqueline Rd,2132.0,Address,79244.0,42.274,-71.1622,Constituent Call,"(42.274, -71.1622)"
552307,101001358932,04/17/2015 12:33:39 PM,04/27/2015 12:33:39 PM,04/29/2015 02:30:59 PM,OVERDUE,Closed,Case Closed Case Resolved cart request filled  new cart #0714424133 04/29/2015,Recycling Cart Return,Public Works Department,Recycling,Recycling Cart Return,PWDx_IPL Damaged Cart Replacement,PWDx,,,64 Business St  Hyde Park  MA  02136,12.0,08,5.0,E18,Hyde Park,10.0,Ward 18,1819.0,CD,64 Business St,2136.0,Address,24255.0,42.2528,-71.1275,Constituent Call,"(42.2528, -71.1275)"
552447,101001359152,04/17/2015 03:26:30 PM,04/27/2015 03:26:30 PM,05/08/2015 02:57:44 PM,OVERDUE,Closed,Case Closed. Closed date : 2015-05-08 14:57:44.913 Case Resolved BROKEN CART SWAPPED NEW CART#5140017101,Recycling Cart Return,Public Works Department,Recycling,Recycling Cart Return,PWDx_IPL Damaged Cart Replacement,PWDx,,,603 River St  Mattapan  MA  02126,8.0,08,4.0,E18,Greater Mattapan,9.0,Ward 18,1804.0,R1,603 River St,2126.0,Address,116652.0,42.2662,-71.098,Constituent Call,"(42.2662, -71.098)"
553468,101001360640,04/21/2015 11:38:43 AM,04/28/2015 11:38:42 AM,04/21/2015 11:38:47 AM,ONTIME,Closed,Case Closed Case Resolved Created Request for Recycling Bin,Recycling Cart Return,Public Works Department,Recycling,Recycling Cart Return,PWDx_IPL Damaged Cart Replacement,PWDx,https://cityworker.cityofboston.gov:8443/attachments/report/55366f0070b4ba4e84f4a5bc/photo/Report.jpg,,50 Moseley St  Dorchester  MA  02125,7.0,03,3.0,C11,Dorchester,7.0,Ward 13,1307.0,R2,50 Moseley St,2125.0,Address,97910.0,42.3207,-71.0547,City Worker App,"(42.3207, -71.0547)"
553553,101001360758,04/21/2015 01:00:51 PM,04/28/2015 01:00:51 PM,04/21/2015 01:01:04 PM,ONTIME,Closed,Case Closed Case Resolved Created Request for Recycling Bin,Recycling Cart Return,Public Works Department,Recycling,Recycling Cart Return,PWDx_IPL Damaged Cart Replacement,PWDx,https://cityworker.cityofboston.gov:8443/attachments/report/5536824170b4ba4e84f4a97b/photo/Report.jpg,,6 Harleston St  Mission Hill  MA  02120,9.0,10A,8.0,B2,Mission Hill,14.0,Ward 10,1005.0,CD,6 Harleston St,2120.0,Address,69504.0,42.3292,-71.1023,City Worker App,"(42.3292, -71.1023)"
553581,101001360789,04/21/2015 01:20:03 PM,04/28/2015 01:20:03 PM,04/21/2015 01:20:07 PM,ONTIME,Closed,Case Closed Case Resolved Created Request for Recycling Bin,Recycling Cart Return,Public Works Department,Recycling,Recycling Cart Return,PWDx_IPL Damaged Cart Replacement,PWDx,https://cityworker.cityofboston.gov:8443/attachments/report/553686bf70b4ba4e84f4aa4e/photo/Report.jpg,,28 Fisher Ave  Mission Hill  MA  02120,9.0,10A,8.0,B2,Mission Hill,14.0,Ward 10,1005.0,R4,28 Fisher Ave,2120.0,Address,58577.0,42.3273,-71.1011,City Worker App,"(42.3273, -71.1011)"
554182,101001361639,04/22/2015 02:48:01 PM,04/29/2015 02:48:01 PM,04/22/2015 02:51:18 PM,ONTIME,Closed,Case Closed Case Invalid Call dropped before finished getting details.,Recycling Cart Return,Public Works Department,Recycling,Recycling Cart Return,PWDx_Recycling,PWDx,,,51-53 Harbor View St  Dorchester  MA  02125,7.0,03,3.0,C11,Dorchester,7.0,Ward 13,1308.0,R3,51-53 Harbor View St,2125.0,Address,69363.0,42.3169,-71.0542,Constituent Call,"(42.3169, -71.0542)"
554516,101001362080,04/23/2015 08:52:08 AM,04/30/2015 08:52:08 AM,04/23/2015 08:52:13 AM,ONTIME,Closed,Case Closed Case Resolved Created Request for Recycling Bin,Recycling Cart Return,Public Works Department,Recycling,Recycling Cart Return,PWDx_IPL Damaged Cart Replacement,PWDx,https://cityworker.cityofboston.gov:8443/attachments/report/5538eaf270b4ba4e84f4b8f2/photo/Report.jpg,,24 P St  South Boston  MA  02127,6.0,05,2.0,C6,South Boston / South Boston Waterfront,5.0,Ward 6,609.0,CM,24 P St,2127.0,Address,106251.0,42.3374,-71.027,City Worker App,"(42.3374, -71.027)"
554822,101001362446,04/23/2015 12:34:49 PM,04/30/2015 12:34:48 PM,04/30/2015 02:24:10 PM,OVERDUE,Closed,Case Closed Case Resolved no longer needs the cart and cart was picked up  cart # R9011146 04/30/2015,Recycling Cart Return,Public Works Department,Recycling,Recycling Cart Return,PWDx_IPL Damaged Cart Replacement,PWDx,,,22 Alaska St  Roxbury  MA  02119,7.0,10B,7.0,B2,Roxbury,13.0,Ward 12,1204.0,R2,22 Alaska St,2119.0,Address,1417.0,42.3211,-71.0784,Constituent Call,"(42.3211, -71.0784)"
555211,101001363040,04/24/2015 10:00:19 AM,05/01/2015 10:00:18 AM,04/24/2015 10:00:24 AM,ONTIME,Closed,Case Closed Case Resolved Created Request for Recycling Bin,Recycling Cart Return,Public Works Department,Recycling,Recycling Cart Return,PWDx_IPL Damaged Cart Replacement,PWDx,https://cityworker.cityofboston.gov:8443/attachments/report/553a4c6c70b4ba4e84f4ceb6/photo/Report.jpg,,INTERSECTION of Dorchester St & Old Harbor St  South Boston  MA,6.0,05,2.0,C6,South Boston / South Boston Waterfront,5.0,Ward 7,704.0,,INTERSECTION Dorchester St & Old Harbor St,,Intersection,4210.0,42.3346,-71.0475,City Worker App,"(42.3346, -71.0475)"
555384,101001363268,04/24/2015 01:45:41 PM,05/01/2015 01:45:41 PM,04/28/2015 10:17:29 AM,ONTIME,Closed,Case Closed Duplicate of Existing Case  Reference#101001363268,Recycling Cart Return,Public Works Department,Recycling,Recycling Cart Return,PWDx_Recycling,PWDx,,,19 Swan Ave  East Boston  MA  02128,1.0,09,1.0,A7,East Boston,1.0,Ward 1,112.0,R2,19 Swan Ave,2128.0,Address,133119.0,42.3886,-70.9971,Constituent Call,"(42.3886, -70.9971)"
556158,101001364435,04/27/2015 10:34:33 AM,05/04/2015 10:34:32 AM,06/03/2015 07:57:56 AM,OVERDUE,Closed,Case Closed. Closed date : 2015-06-03 07:57:56.157 Case Noted cart scheduled to be colelcted on 6-5-15,Recycling Cart Return,Public Works Department,Recycling,Recycling Cart Return,PWDx_Recycling,PWDx,,,8 Holmes St  Allston  MA  02134,11.0,04,9.0,D14,Allston / Brighton,15.0,Ward 22,2202.0,R2,8 Holmes St,2134.0,Address,252709.0,42.3617,-71.1323,Constituent Call,"(42.3617, -71.1323)"
556160,101001364437,04/27/2015 10:36:00 AM,06/06/2015 10:36:00 AM,06/03/2015 07:55:25 AM,ONTIME,Closed,Case Closed. Closed date : 2015-06-03 07:55:25.527 Case Noted scheduled to be removed 6-5-15,Recycling Cart Return,Public Works Department,Recycling,Recycling Cart Return,PWDx_Recycling,PWDx,,,8 Holmes St  Allston  MA  02134,11.0,04,9.0,D14,Allston / Brighton,15.0,Ward 22,2202.0,R2,8 Holmes St,2134.0,Address,252709.0,42.3617,-71.1323,Constituent Call,"(42.3617, -71.1323)"
556945,101001365452,04/28/2015 11:50:27 AM,05/05/2015 11:50:26 AM,04/28/2015 11:55:09 AM,ONTIME,Closed,Case Closed Case Invalid  Case created in error,Recycling Cart Return,Public Works Department,Recycling,Recycling Cart Return,PWDx_Recycling,PWDx,,,54 Burroughs St  Jamaica Plain  MA  02130,9.0,02,6.0,E13,Jamaica Plain,11.0,Ward 19,1908.0,R1,54 Burroughs St,2130.0,Address,24059.0,42.3137,-71.1178,Constituent Call,"(42.3137, -71.1178)"
557176,101001365757,04/28/2015 03:21:20 PM,05/05/2015 03:21:20 PM,04/28/2015 03:29:54 PM,ONTIME,Closed,Case Closed Case Invalid Wrong constituent name,Recycling Cart Return,Public Works Department,Recycling,Recycling Cart Return,PWDx_Recycling,PWDx,,,310 Paris St  East Boston  MA  02128,1.0,09,1.0,A7,East Boston,1.0,Ward 1,105.0,R1,310 Paris St,2128.0,Address,106560.0,42.3771,-71.0323,Constituent Call,"(42.3771, -71.0323)"
557182,101001365764,04/28/2015 03:25:00 PM,06/05/2015 03:25:00 PM,05/28/2015 02:49:30 PM,ONTIME,Closed,Case Closed. Closed date : 2015-05-28 14:49:30.763 Case Resolved cart picked up 05/28/2015,Recycling Cart Return,Public Works Department,Recycling,Recycling Cart Return,PWDx_Recycling,PWDx,,,310 Paris St  East Boston  MA  02128,1.0,09,1.0,A7,East Boston,1.0,Ward 1,105.0,R1,310 Paris St,2128.0,Address,106560.0,42.3771,-71.0323,Constituent Call,"(42.3771, -71.0323)"
558249,101001367279,04/30/2015 12:19:00 PM,05/07/2015 12:19:54 PM,05/12/2015 08:36:03 AM,OVERDUE,Closed,Case Closed. Closed date : 2015-05-12 08:36:03.29 Case Resolved cart pick up last week .5/12/15.,Recycling Cart Return,Public Works Department,Recycling,Recycling Cart Return,PWDx_IPL Damaged Cart Replacement,PWDx,,,31 Topliff St  Dorchester  MA  02122,7.0,03,4.0,C11,Dorchester,8.0,Ward 15,1502.0,R3,31 Topliff St,2122.0,Address,136233.0,42.3037,-71.0686,Constituent Call,"(42.3037, -71.0686)"
558451,101001367577,04/30/2015 04:48:08 PM,05/07/2015 04:48:08 PM,05/07/2015 03:18:32 PM,ONTIME,Closed,Case Closed. Closed date : 2015-05-07 15:18:32.77 Case Resolved cart was picked up on 5/07/2015,Recycling Cart Return,Public Works Department,Recycling,Recycling Cart Return,PWDx_Recycling,PWDx,,,55 Central Ave  Hyde Park  MA  02136,12.0,08,5.0,E18,Hyde Park,10.0,Ward 18,1813.0,R1,55 Central Ave,2136.0,Address,27301.0,42.2587,-71.1204,Constituent Call,"(42.2587, -71.1204)"
559110,101001368639,05/02/2015 01:54:00 PM,05/11/2015 08:30:00 AM,05/15/2015 02:38:29 PM,OVERDUE,Closed,Case Closed. Closed date : 2015-05-15 14:38:29.577 Case Resolved No broken cart out 05/15/2015,Recycling Cart Return,Public Works Department,Recycling,Recycling Cart Return,PWDx_IPL Damaged Cart Replacement,PWDx,,,96 Leyden St  East Boston  MA  02128,1.0,09,1.0,A7,East Boston,1.0,Ward 1,113.0,R2,96 Leyden St,2128.0,Address,85851.0,42.3895,-71.0085,Constituent Call,"(42.3895, -71.0085)"
559678,101001369483,05/04/2015 11:44:57 AM,05/11/2015 11:44:57 AM,05/04/2015 11:45:05 AM,ONTIME,Closed,Case Closed. Closed date : 2015-05-04 11:45:05.673 Case Resolved Created Request for Recycling Bin,Recycling Cart Return,Public Works Department,Recycling,Recycling Cart Return,PWDx_IPL Damaged Cart Replacement,PWDx,https://cityworker.cityofboston.gov:8443/attachments/report/554793fbd0526762dace1e0b/photo/Report.jpg,,137 Falcon St  East Boston  MA  02128,1.0,09,1.0,A7,East Boston,1.0,Ward 1,109.0,R3,137 Falcon St,2128.0,Address,233020.0,42.3818,-71.0333,City Worker App,"(42.3818, -71.0333)"
560311,101001370430,05/05/2015 11:31:07 AM,05/12/2015 11:31:07 AM,05/05/2015 11:31:14 AM,ONTIME,Closed,Case Closed. Closed date : 2015-05-05 11:31:14.12 Case Resolved Created Request for Recycling Bin,Recycling Cart Return,Public Works Department,Recycling,Recycling Cart Return,PWDx_IPL Damaged Cart Replacement,PWDx,https://cityworker.cityofboston.gov:8443/attachments/report/5548e241d0526762dace2b3d/photo/Report.jpg,,130 Saratoga St  East Boston  MA  02128,1.0,09,1.0,A7,East Boston,1.0,Ward 1,106.0,R3,130 Saratoga St,2128.0,Address,122493.0,42.3771,-71.0355,City Worker App,"(42.3771, -71.0355)"
560922,101001371258,05/06/2015 09:34:00 AM,05/13/2015 09:34:54 AM,06/03/2015 09:17:47 AM,OVERDUE,Closed,Case Closed. Closed date : 2015-06-03 09:17:47.007 Case Noted Cart removed by PWD inspector,Recycling Cart Return,Public Works Department,Recycling,Recycling Cart Return,PWDx_Recycling,PWDx,,,70 Chandler St  Boston  MA  02116,4.0,1C,2.0,D4,South End,6.0,Ward 5,501.0,R3,70 Chandler St,2116.0,Address,28794.0,42.3465,-71.072,Constituent Call,"(42.3465, -71.072)"
561039,101001371422,05/06/2015 11:21:00 AM,05/13/2015 11:21:10 AM,06/11/2015 07:46:43 AM,OVERDUE,Closed,Case Closed. Closed date : 2015-06-11 07:46:43.66 Case Resolved broken cart swapped new cart # 0515630656 06/10/15,Recycling Cart Return,Public Works Department,Recycling,Recycling Cart Return,PWDx_IPL Damaged Cart Replacement,PWDx,,,41 Stockton St  Dorchester  MA  02124,8.0,07,4.0,B3,Dorchester,9.0,Ward 17,1710.0,R3,41 Stockton St,2124.0,Address,130771.0,42.2827,-71.0742,Constituent Call,"(42.2827, -71.0742)"
563301,101001374953,05/11/2015 03:40:00 PM,05/18/2015 03:40:00 PM,05/21/2015 02:34:38 PM,OVERDUE,Closed,Case Closed. Closed date : 2015-05-21 14:34:38.347 Case Resolved Brocken cart swapped new cart # 0415302435 05/21/2015,Recycling Cart Return,Public Works Department,Recycling,Recycling Cart Return,PWDx_Recycling,PWDx,,,9 Carroll St  West Roxbury  MA  02132,12.0,06,6.0,E5,West Roxbury,12.0,Ward 20,2017.0,R1,9 Carroll St,2132.0,Address,26075.0,42.2867,-71.1673,Constituent Call,"(42.2867, -71.1673)"
563429,101001375123,05/11/2015 07:45:00 PM,05/19/2015 08:30:00 AM,07/29/2015 02:19:20 PM,OVERDUE,Closed,Case Closed. Closed date : 2015-07-29 14:19:20.023 Case Resolved third request no cart out,Recycling Cart Return,Public Works Department,Recycling,Recycling Cart Return,PWDx_IPL Damaged Cart Replacement,PWDx,,,INTERSECTION of Hyde Park Ave & Stanbro St  Hyde Park  MA,12.0,08,5.0,E18,Hyde Park,10.0,Ward 18,1820.0,,INTERSECTION Hyde Park Ave & Stanbro St,,Intersection,6449.0,42.2354,-71.1327,Constituent Call,"(42.2354, -71.1327)"
563607,101001375390,05/12/2015 09:23:00 AM,05/19/2015 09:23:30 AM,05/12/2015 09:27:09 AM,ONTIME,Closed,Case Closed. Closed date : 2015-05-12 09:27:09.267 Case Resolved Good morning highway removed a cart from 193 Manchester st in Dorchester. Cart number is r9#018483. I just replaced it with 514#0026946. Thank you,Recycling Cart Return,Public Works Department,Recycling,Recycling Cart Return,PWDx_Recycling,PWDx,,,193 Manchester St  Mattapan  MA  02126,8.0,07,3.0,B3,Dorchester,7.0,Ward 17,1714.0,R1,193 Manchester St,2126.0,Address,88879.0,42.2743,-71.0757,Constituent Call,"(42.2743, -71.0757)"
563762,101001375625,05/12/2015 11:56:23 AM,05/19/2015 11:56:22 AM,05/12/2015 11:56:28 AM,ONTIME,Closed,Case Closed. Closed date : 2015-05-12 11:56:28.757 Case Resolved Created Request for Recycling Bin,Recycling Cart Return,Public Works Department,Recycling,Recycling Cart Return,PWDx_IPL Damaged Cart Replacement,PWDx,https://cityworker.cityofboston.gov:8443/attachments/report/555222a8d05256bfb76da242/photo/Report.jpg,,124 Calumet St  Mission Hill  MA  02120,9.0,10A,8.0,B2,Mission Hill,14.0,Ward 10,1003.0,CM,124 Calumet St,2120.0,Address,24912.0,42.331,-71.1024,City Worker App,"(42.331, -71.1024)"
563766,101001375636,05/12/2015 11:58:23 AM,05/19/2015 11:58:22 AM,05/12/2015 11:58:28 AM,ONTIME,Closed,Case Closed. Closed date : 2015-05-12 11:58:28.3 Case Resolved Created Request for Recycling Bin,Recycling Cart Return,Public Works Department,Recycling,Recycling Cart Return,PWDx_IPL Damaged Cart Replacement,PWDx,https://cityworker.cityofboston.gov:8443/attachments/report/55522321d05256bfb76da26d/photo/Report.jpg,,126 Calumet St  Mission Hill  MA  02120,9.0,10A,8.0,B2,Mission Hill,14.0,Ward 10,1003.0,R3,126 Calumet St,2120.0,Address,200563.0,42.331,-71.1026,City Worker App,"(42.331, -71.1026)"
563932,101001375871,05/12/2015 03:04:00 PM,05/19/2015 03:04:07 PM,07/29/2015 02:16:42 PM,OVERDUE,Closed,Case Closed. Closed date : 2015-07-29 14:16:42.007 Case Resolved no cart out second  time,Recycling Cart Return,Public Works Department,Recycling,Recycling Cart Return,PWDx_IPL Damaged Cart Replacement,PWDx,,,37 Eldon St  Roslindale  MA  02131,9.0,06,5.0,E5,Roslindale,10.0,Ward 20,2001.0,R1,37 Eldon St,2131.0,Address,52611.0,42.2938,-71.1328,Constituent Call,"(42.2938, -71.1328)"
563989,101001375958,05/12/2015 04:25:00 PM,05/19/2015 04:25:43 PM,07/10/2015 02:34:04 PM,OVERDUE,Closed,Case Closed. Closed date : 2015-07-10 14:34:04.493 Case Resolved Third time out there no cart was out closed 07/10/2015,Recycling Cart Return,Public Works Department,Recycling,Recycling Cart Return,PWDx_IPL Damaged Cart Replacement,PWDx,,,80 E Brookline St  Roxbury  MA  02118,4.0,1C,2.0,D4,South End,6.0,Ward 8,801.0,CM,80 E Brookline St,2118.0,Address,22166.0,42.3377,-71.0699,Constituent Call,"(42.3377, -71.0699)"
564359,101001376488,05/13/2015 10:40:00 AM,05/20/2015 10:40:51 AM,05/13/2015 10:44:29 AM,ONTIME,Closed,Case Closed. Closed date : 2015-05-13 10:44:29.25 Case Resolved carts was picked up art# 0046761 -cart damage lip  Cart# 9004458 Cart.# 0613450554. 5/13/2015,Recycling Cart Return,Public Works Department,Recycling,Recycling Cart Return,PWDx_Recycling,PWDx,,,5 Pleasant St  Dorchester  MA  02125,7.0,03,3.0,C11,Dorchester,7.0,Ward 13,1306.0,CM,5 Pleasant St,2125.0,Address,111228.0,42.3184,-71.0592,Constituent Call,"(42.3184, -71.0592)"
564543,101001376745,05/13/2015 01:55:10 PM,05/20/2015 01:55:10 PM,05/19/2015 07:41:56 AM,ONTIME,Closed,Case Closed. Closed date : 2015-05-19 07:41:56.993 Case Resolved cart request filled new cart# 0714423742 05/14/15,Recycling Cart Return,Public Works Department,Recycling,Recycling Cart Return,PWDx_Recycling,PWDx,,,98 E Brookline St  Roxbury  MA  02118,4.0,1C,2.0,D4,South End,6.0,Ward 8,801.0,CM,98 E Brookline St,2118.0,Address,22217.0,42.3373,-71.0695,Constituent Call,"(42.3373, -71.0695)"
564909,101001377264,05/14/2015 08:49:11 AM,05/21/2015 08:49:11 AM,05/14/2015 08:49:16 AM,ONTIME,Closed,Case Closed. Closed date : 2015-05-14 08:49:16.95 Case Resolved Created Request for Recycling Bin,Recycling Cart Return,Public Works Department,Recycling,Recycling Cart Return,PWDx_IPL Damaged Cart Replacement,PWDx,https://cityworker.cityofboston.gov:8443/attachments/report/555499ced05256bfb76db998/photo/Report.jpg,,67 Chestnut St  Charlestown  MA  02129,3.0,1A,1.0,A15,Charlestown,2.0,Ward 2,203.0,R2,67 Chestnut St,2129.0,Address,31621.0,42.376,-71.0594,City Worker App,"(42.376, -71.0594)"
565287,101001377775,05/14/2015 04:06:00 PM,05/21/2015 04:06:21 PM,06/04/2015 09:06:58 AM,OVERDUE,Closed,Case Closed. Closed date : 2015-06-04 09:06:58.197 Case Noted cart removed by PWD inspector,Recycling Cart Return,Public Works Department,Recycling,Recycling Cart Return,PWDx_Missed Trash\Recycling\Yard Waste\Bulk Item,PWDx,,,24 Monument Ave  Charlestown  MA  02129,3.0,1A,1.0,A15,Charlestown,2.0,Ward 2,203.0,R1,24 Monument Ave,2129.0,Address,96861.0,42.3744,-71.0622,Constituent Call,"(42.3744, -71.0622)"
565533,101001378119,05/15/2015 09:18:56 AM,05/22/2015 09:18:56 AM,05/15/2015 09:21:17 AM,ONTIME,Closed,Case Closed. Closed date : 2015-05-15 09:21:17.05 Case Invalid,Recycling Cart Return,Public Works Department,Recycling,Recycling Cart Return,PWDx_Recycling,PWDx,,,47 Milwood St  Dorchester  MA  02124,8.0,07,3.0,C11,Dorchester,7.0,Ward 16,1611.0,R3,47 Milwood St,2124.0,Address,95971.0,42.2804,-71.0578,Constituent Call,"(42.2804, -71.0578)"
565738,101001378440,05/15/2015 01:07:00 PM,05/22/2015 01:07:33 PM,05/26/2015 12:17:36 PM,OVERDUE,Closed,Case Closed. Closed date : 2015-05-26 12:17:36.23 Case Resolved cart # 0415302390 dropped off on 5/22/15,Recycling Cart Return,Public Works Department,Recycling,Recycling Cart Return,PWDx_Recycling,PWDx,,,15 Rainier Rd  Mattapan  MA  02126,8.0,08,5.0,E18,Hyde Park,9.0,Ward 18,1805.0,R1,15 Rainier Rd,2126.0,Address,114443.0,42.2668,-71.1026,Constituent Call,"(42.2668, -71.1026)"
566401,101001379391,05/18/2015 08:15:00 AM,05/26/2015 08:30:00 AM,06/03/2015 07:51:58 AM,OVERDUE,Closed,Case Closed. Closed date : 2015-06-03 07:51:58.52 Case Noted CART SCHEDULED TO BE COLLECTED 6/5/15,Recycling Cart Return,Public Works Department,Recycling,Recycling Cart Return,PWDx_Recycling,PWDx,,,5 Saxton St  Dorchester  MA  02125,7.0,03,3.0,C11,Dorchester,7.0,Ward 13,1310.0,R3,5 Saxton St,2125.0,Address,123645.0,42.3124,-71.0547,Constituent Call,"(42.3124, -71.0547)"
566785,101001379939,05/18/2015 02:28:00 PM,05/26/2015 02:28:11 PM,06/12/2015 11:33:27 AM,OVERDUE,Closed,Case Closed. Closed date : 2015-06-12 11:33:27.683 Case Resolved allset was replaced on 06/05/2015,Recycling Cart Return,Public Works Department,Recycling,Recycling Cart Return,PWDx_IPL Damaged Cart Replacement,PWDx,,,1024 Bennington St  East Boston  MA  02128,1.0,09,1.0,A7,East Boston,1.0,Ward 1,113.0,R4,1024 Bennington St,2128.0,Address,14522.0,42.3872,-71.006,Constituent Call,"(42.3872, -71.006)"
566991,101001380250,05/19/2015 07:41:16 AM,05/27/2015 08:30:00 AM,05/19/2015 07:41:22 AM,ONTIME,Closed,Case Closed. Closed date : 2015-05-19 07:41:22.97 Case Resolved Created Request for Recycling Bin,Recycling Cart Return,Public Works Department,Recycling,Recycling Cart Return,PWDx_IPL Damaged Cart Replacement,PWDx,https://cityworker.cityofboston.gov:8443/attachments/report/555b2166d05256bfb76de41b/photo/Report.jpg,,14 Glenburne St  Dorchester  MA  02121,9.0,10B,7.0,B2,Roxbury,13.0,Ward 12,1206.0,R3,14 Glenburne St,2121.0,Address,64014.0,42.3157,-71.0825,City Worker App,"(42.3157, -71.0825)"
567470,101001380941,05/19/2015 04:29:00 PM,05/27/2015 04:29:21 PM,06/24/2015 02:59:09 PM,OVERDUE,Closed,Case Closed. Closed date : 2015-06-24 14:59:09.443 Case Resolved third time notthing was out case closed 06/24/2015,Recycling Cart Return,Public Works Department,Recycling,Recycling Cart Return,PWDx_IPL Damaged Cart Replacement,PWDx,,,22 Sackville St  Charlestown  MA  02129,3.0,1A,1.0,A15,Charlestown,2.0,Ward 2,205.0,R1,22 Sackville St,2129.0,Address,120385.0,42.3812,-71.0649,Constituent Call,"(42.3812, -71.0649)"
567637,101001381207,05/20/2015 07:31:36 AM,05/28/2015 08:30:00 AM,05/20/2015 07:31:41 AM,ONTIME,Closed,Case Closed. Closed date : 2015-05-20 07:31:41.503 Case Resolved Created Request for Recycling Bin,Recycling Cart Return,Public Works Department,Recycling,Recycling Cart Return,PWDx_IPL Damaged Cart Replacement,PWDx,https://cityworker.cityofboston.gov:8443/attachments/report/555c70a6d05256bfb76df0d6/photo/Report.jpg,,66 Chestnut St  Charlestown  MA  02129,3.0,1A,1.0,A15,Charlestown,2.0,Ward 2,203.0,R3,66 Chestnut St,2129.0,Address,163300.0,42.3759,-71.0599,City Worker App,"(42.3759, -71.0599)"
567742,101001381378,05/20/2015 09:36:49 AM,05/28/2015 09:37:02 AM,05/20/2015 09:37:08 AM,ONTIME,Closed,Case Closed. Closed date : 2015-05-20 09:37:08.793 Case Resolved Created Request for Recycling Bin,Recycling Cart Return,Public Works Department,Recycling,Recycling Cart Return,PWDx_IPL Damaged Cart Replacement,PWDx,https://cityworker.cityofboston.gov:8443/attachments/report/555c8df4d05256bfb76df40d/photo/Report.jpg,,INTERSECTION of Burrill Pl & I St  South Boston  MA,6.0,05,2.0,C6,South Boston / South Boston Waterfront,5.0,Ward 7,702.0,,INTERSECTION Burrill Pl & I St,,Intersection,2231.0,42.3325,-71.0399,City Worker App,"(42.3325, -71.0399)"
567788,101001381446,05/20/2015 10:08:00 AM,05/28/2015 10:08:59 AM,06/19/2015 09:36:26 AM,OVERDUE,Closed,Case Closed. Closed date : 2015-06-19 09:36:26.06 Case Resolved cart already picked up on 06/11/2015,Recycling Cart Return,Public Works Department,Recycling,Recycling Cart Return,PWDx_IPL Damaged Cart Replacement,PWDx,,,8 Crane St  Hyde Park  MA  02136,12.0,08,5.0,E18,Hyde Park,10.0,Ward 18,1808.0,R1,8 Crane St,2136.0,Address,43986.0,42.2706,-71.1171,Constituent Call,"(42.2706, -71.1171)"
567899,101001381603,05/20/2015 11:44:00 AM,05/28/2015 11:44:05 AM,07/29/2015 02:18:38 PM,OVERDUE,Closed,Case Closed. Closed date : 2015-07-29 14:18:38.633 Case Resolved No cart out second time,Recycling Cart Return,Public Works Department,Recycling,Recycling Cart Return,PWDx_IPL Damaged Cart Replacement,PWDx,,,40 Hewlett St  Roslindale  MA  02131,9.0,06,5.0,E5,Roslindale,10.0,Ward 20,2001.0,R3,40 Hewlett St,2131.0,Address,73182.0,42.29,-71.1354,Constituent Call,"(42.29, -71.1354)"
567962,101001381690,05/20/2015 01:00:54 PM,05/28/2015 01:00:53 PM,05/20/2015 01:00:57 PM,ONTIME,Closed,Case Closed. Closed date : 2015-05-20 13:00:57.77 Case Resolved Created Request for Recycling Bin,Recycling Cart Return,Public Works Department,Recycling,Recycling Cart Return,PWDx_IPL Damaged Cart Replacement,PWDx,,,84 School St  Charlestown  MA  02129,3.0,1A,1.0,A15,Charlestown,2.0,Ward 2,205.0,R3,84 School St,2129.0,Address,123825.0,42.379,-71.0635,City Worker App,"(42.379, -71.0635)"
568056,101001381831,05/20/2015 03:10:00 PM,05/28/2015 03:10:47 PM,06/03/2015 08:05:31 AM,OVERDUE,Closed,Case Closed. Closed date : 2015-06-03 08:05:31.013 Case Noted cart Scheduled for retun on 6-8-15,Recycling Cart Return,Public Works Department,Recycling,Recycling Cart Return,PWDx_Recycling,PWDx,,,9 Bilodeau Rd  Dorchester  MA  02121,7.0,03,4.0,B2,Roxbury,13.0,Ward 14,1403.0,R2,9 Bilodeau Rd,2121.0,Address,15504.0,42.3073,-71.0818,Constituent Call,"(42.3073, -71.0818)"
568077,101001381857,05/20/2015 03:46:00 PM,05/28/2015 03:46:07 PM,07/16/2015 02:19:55 PM,OVERDUE,Closed,Case Closed. Closed date : 2015-07-16 14:19:55.363 Case Resolved cart wasnt out 2nd request  closing case,Recycling Cart Return,Public Works Department,Recycling,Recycling Cart Return,PWDx_IPL Damaged Cart Replacement,PWDx,,,5 Juniper St  Roxbury  MA  02119,7.0,10B,7.0,B2,Roxbury,13.0,Ward 9,905.0,R3,5 Juniper St,2119.0,Address,80416.0,42.3246,-71.0891,Constituent Call,"(42.3246, -71.0891)"
568394,101001382343,05/21/2015 10:35:00 AM,05/29/2015 10:35:35 AM,05/21/2015 10:50:21 AM,ONTIME,Closed,Case Closed. Closed date : 2015-05-21 10:50:21.643 Duplicate of Existing Case ref#101001382368,Recycling Cart Return,Public Works Department,Recycling,Recycling Cart Return,PWDx_Recycling,PWDx,,,6-8 Johnson Ter  Dorchester  MA  02124,8.0,07,4.0,B3,Greater Mattapan,9.0,Ward 14,1410.0,R2,6-8 Johnson Ter,2124.0,Address,79935.0,42.2877,-71.0801,Constituent Call,"(42.2877, -71.0801)"
568412,101001382368,05/21/2015 10:47:00 AM,05/29/2015 10:47:55 AM,06/08/2015 02:29:57 PM,OVERDUE,Closed,Case Closed. Closed date : 2015-06-08 14:29:57.347 Case Resolved Damaged Cart picked up 06/08/2015,Recycling Cart Return,Public Works Department,Recycling,Recycling Cart Return,PWDx_IPL Damaged Cart Replacement,PWDx,,,6-8 Johnson Ter  Dorchester  MA  02124,8.0,07,4.0,B3,Greater Mattapan,9.0,Ward 14,1410.0,R2,6-8 Johnson Ter,2124.0,Address,79935.0,42.2877,-71.0801,Constituent Call,"(42.2877, -71.0801)"
568832,101001383049,05/22/2015 09:28:00 AM,06/01/2015 09:28:49 AM,06/01/2015 03:08:05 PM,OVERDUE,Closed,Case Closed. Closed date : 2015-06-01 15:08:05.397 Case Resolved Picked up on 6/01/2015,Recycling Cart Return,Public Works Department,Recycling,Recycling Cart Return,PWDx_Recycling,PWDx,,,8 Jacqueline Rd  West Roxbury  MA  02132,12.0,06,6.0,E5,West Roxbury,12.0,Ward 20,2016.0,R1,8 Jacqueline Rd,2132.0,Address,79244.0,42.274,-71.1622,Constituent Call,"(42.274, -71.1622)"
568833,101001383048,05/22/2015 09:28:13 AM,06/01/2015 09:28:13 AM,05/22/2015 09:29:19 AM,ONTIME,Closed,Case Closed. Closed date : 2015-05-22 09:29:19.207 Case Invalid Missing Info,Recycling Cart Return,Public Works Department,Recycling,Recycling Cart Return,PWDx_Recycling,PWDx,,,30 Monument Ave  Charlestown  MA  02129,3.0,1A,1.0,A15,Charlestown,2.0,Ward 2,203.0,R1,30 Monument Ave,2129.0,Address,96869.0,42.3745,-71.0621,Constituent Call,"(42.3745, -71.0621)"
568902,101001383158,05/22/2015 10:42:00 AM,06/01/2015 10:42:42 AM,06/03/2015 08:53:40 AM,OVERDUE,Closed,Case Closed. Closed date : 2015-06-03 08:53:40.11 Case Noted scheduled for removal 6-10-15,Recycling Cart Return,Public Works Department,Recycling,Recycling Cart Return,PWDx_Recycling,PWDx,,,22 Bluefield Ter  Mattapan  MA  02126,8.0,07,4.0,B3,Greater Mattapan,9.0,Ward 18,1804.0,R2,22 Bluefield Ter,2126.0,Address,16629.0,42.2731,-71.0852,Constituent Call,"(42.2731, -71.0852)"
569016,101001393331,05/22/2015 01:27:42 PM,06/01/2015 01:27:46 PM,05/22/2015 01:27:53 PM,ONTIME,Closed,Case Closed. Closed date : 2015-05-22 13:27:53.087 Case Resolved Created Request for Recycling Bin,Recycling Cart Return,Public Works Department,Recycling,Recycling Cart Return,PWDx_IPL Damaged Cart Replacement,PWDx,https://cityworker.cityofboston.gov:8443/attachments/report/555f670fd05256bfb76e1213/photo/Report.jpg,,79 Joy St  Boston  MA  02114,3.0,1B,1.0,A1,Beacon Hill,3.0,Ward 3,306.0,R1,79 Joy St,2114.0,Address,260049.0,42.3607,-71.065,City Worker App,"(42.3607, -71.065)"
569026,101001393342,05/22/2015 01:31:59 PM,06/01/2015 01:31:59 PM,05/22/2015 01:34:03 PM,ONTIME,Closed,Case Closed. Closed date : 2015-05-22 13:34:03.343 Case Invalid Cart identification number required in order to create work form.,Recycling Cart Return,Public Works Department,Recycling,Recycling Cart Return,PWDx_Recycling,PWDx,,,5 Hillside Ave  Jamaica Plain  MA  02130,12.0,02,6.0,E13,Jamaica Plain,10.0,Ward 19,1907.0,R1,5 Hillside Ave,2130.0,Address,74144.0,42.2974,-71.1131,Constituent Call,"(42.2974, -71.1131)"
569121,101001393485,05/22/2015 04:02:00 PM,06/01/2015 04:02:05 PM,06/03/2015 08:56:07 AM,OVERDUE,Closed,Case Closed. Closed date : 2015-06-03 08:56:07.663 Duplicate of Existing Case,Recycling Cart Return,Public Works Department,Recycling,Recycling Cart Return,PWDx_Recycling,PWDx,,,22 Sackville St  Charlestown  MA  02129,3.0,1A,1.0,A15,Charlestown,2.0,Ward 2,205.0,R1,22 Sackville St,2129.0,Address,120385.0,42.3812,-71.0649,Constituent Call,"(42.3812, -71.0649)"
569880,101001394613,05/26/2015 09:48:06 AM,06/02/2015 09:48:06 AM,05/26/2015 09:48:11 AM,ONTIME,Closed,Case Closed. Closed date : 2015-05-26 09:48:11.38 Case Resolved Created Request for Recycling Bin,Recycling Cart Return,Public Works Department,Recycling,Recycling Cart Return,PWDx_IPL Damaged Cart Replacement,PWDx,https://cityworker.cityofboston.gov:8443/attachments/report/556479a1d05256bfb76e2132/photo/Report.jpg,,6 Hillside St  Mission Hill  MA  02120,9.0,10A,8.0,B2,Mission Hill,14.0,Ward 10,1005.0,R1,6 Hillside St,2120.0,Address,74250.0,42.3292,-71.0995,City Worker App,"(42.3292, -71.0995)"
569885,101001394617,05/26/2015 09:50:08 AM,06/02/2015 09:50:08 AM,05/26/2015 09:50:14 AM,ONTIME,Closed,Case Closed. Closed date : 2015-05-26 09:50:14.607 Case Resolved Created Request for Recycling Bin,Recycling Cart Return,Public Works Department,Recycling,Recycling Cart Return,PWDx_IPL Damaged Cart Replacement,PWDx,https://cityworker.cityofboston.gov:8443/attachments/report/55647a1ad05256bfb76e2152/photo/Report.jpg,,7 Hillside St  Mission Hill  MA  02120,9.0,10A,8.0,B2,Mission Hill,14.0,Ward 10,1005.0,R3,7 Hillside St,2120.0,Address,252239.0,42.3294,-71.0992,City Worker App,"(42.3294, -71.0992)"
569897,101001394639,05/26/2015 10:00:00 AM,06/02/2015 10:00:36 AM,06/10/2015 01:37:20 PM,OVERDUE,Closed,Case Closed. Closed date : 2015-06-10 13:37:20.267 Case Noted Second week in a row PWD inspector has looked for this cart to collect and it is not out there. I is possible that another resident took it and is using it now.,Recycling Cart Return,Public Works Department,Recycling,Recycling Cart Return,PWDx_IPL Damaged Cart Replacement,PWDx,,,30 Monument Ave  Charlestown  MA  02129,3.0,1A,1.0,A15,Charlestown,2.0,Ward 2,203.0,R1,30 Monument Ave,2129.0,Address,96869.0,42.3745,-71.0621,Constituent Call,"(42.3745, -71.0621)"
570152,101001395016,05/26/2015 02:32:00 PM,06/02/2015 02:32:20 PM,07/10/2015 02:19:49 PM,OVERDUE,Closed,Case Closed. Closed date : 2015-07-10 14:19:49.277 Case Resolved No cart was out 2nd time closing case  7/10/2015,Recycling Cart Return,Public Works Department,Recycling,Recycling Cart Return,PWDx_IPL Damaged Cart Replacement,PWDx,,,1-3 Wadleigh Pl  South Boston  MA  02127,6.0,05,2.0,C6,South Boston / South Boston Waterfront,5.0,Ward 7,706.0,C,1-3 Wadleigh Pl,2127.0,Address,141268.0,42.3306,-71.0585,Constituent Call,"(42.3306, -71.0585)"
570773,101001395862,05/27/2015 11:45:00 AM,06/03/2015 11:45:50 AM,06/24/2015 02:58:11 PM,OVERDUE,Closed,Case Closed. Closed date : 2015-06-24 14:58:11.357 Case Resolved damaged cart removed 06/24/2015,Recycling Cart Return,Public Works Department,Recycling,Recycling Cart Return,PWDx_IPL Damaged Cart Replacement,PWDx,,,176 H St  South Boston  MA  02127,6.0,05,2.0,C6,South Boston / South Boston Waterfront,5.0,Ward 7,702.0,CM,176 H St,2127.0,Address,67833.0,42.3318,-71.0413,Constituent Call,"(42.3318, -71.0413)"
570961,101001396106,05/27/2015 03:00:00 PM,06/03/2015 03:00:47 PM,06/03/2015 08:17:04 AM,ONTIME,Closed,Case Closed. Closed date : 2015-06-03 08:17:04.427 Case Noted scheduled for collection on 6-5-15,Recycling Cart Return,Public Works Department,Recycling,Recycling Cart Return,PWDx_Recycling,PWDx,,,15 Rainier Rd  Mattapan  MA  02126,8.0,08,5.0,E18,Hyde Park,9.0,Ward 18,1805.0,R1,15 Rainier Rd,2126.0,Address,114443.0,42.2668,-71.1026,Constituent Call,"(42.2668, -71.1026)"
571670,101001397165,05/28/2015 02:56:13 PM,06/04/2015 02:56:12 PM,05/28/2015 02:56:18 PM,ONTIME,Closed,Case Closed. Closed date : 2015-05-28 14:56:18.41 Case Resolved Created Request for Recycling Bin,Recycling Cart Return,Public Works Department,Recycling,Recycling Cart Return,PWDx_IPL Damaged Cart Replacement,PWDx,https://cityworker.cityofboston.gov:8443/attachments/report/556764dfd052b85779265a80/photo/Report.jpg,,INTERSECTION of Webster St & Webster Pl  East Boston  MA,1.0,09,1.0,A7,East Boston,1.0,Ward 1,101.0,,INTERSECTION Webster St & Webster Pl,,Intersection,6163.0,42.3647,-71.0317,City Worker App,"(42.3647, -71.0317)"
571675,101001397170,05/28/2015 02:59:22 PM,06/04/2015 02:59:22 PM,05/28/2015 02:59:27 PM,ONTIME,Closed,Case Closed. Closed date : 2015-05-28 14:59:27.667 Case Resolved Created Request for Recycling Bin,Recycling Cart Return,Public Works Department,Recycling,Recycling Cart Return,PWDx_IPL Damaged Cart Replacement,PWDx,https://cityworker.cityofboston.gov:8443/attachments/report/55676598d052b85779265a95/photo/Report.jpg,,217 Webster St  East Boston  MA  02128,1.0,09,1.0,A7,East Boston,1.0,Ward 1,101.0,R3,217 Webster St,2128.0,Address,146835.0,42.3648,-71.0331,City Worker App,"(42.3648, -71.0331)"
571679,101001397174,05/28/2015 03:01:04 PM,06/04/2015 03:01:04 PM,05/28/2015 03:01:09 PM,ONTIME,Closed,Case Closed. Closed date : 2015-05-28 15:01:09.587 Case Resolved Created Request for Recycling Bin,Recycling Cart Return,Public Works Department,Recycling,Recycling Cart Return,PWDx_IPL Damaged Cart Replacement,PWDx,https://cityworker.cityofboston.gov:8443/attachments/report/55676601d052b85779265aa5/photo/Report.jpg,,INTERSECTION of Alna Pl & Webster St  East Boston  MA,1.0,09,1.0,A7,East Boston,1.0,Ward 1,101.0,,INTERSECTION Alna Pl & Webster St,,Intersection,341.0,42.3649,-71.0329,City Worker App,"(42.3649, -71.0329)"
571688,101001397188,05/28/2015 03:07:48 PM,06/04/2015 03:07:48 PM,05/28/2015 03:07:54 PM,ONTIME,Closed,Case Closed. Closed date : 2015-05-28 15:07:54.85 Case Resolved Created Request for Recycling Bin,Recycling Cart Return,Public Works Department,Recycling,Recycling Cart Return,PWDx_IPL Damaged Cart Replacement,PWDx,https://cityworker.cityofboston.gov:8443/attachments/report/55676795d052b85779265ad5/photo/Report.jpg,,116 Webster St  East Boston  MA  02128,1.0,09,1.0,A7,East Boston,1.0,Ward 1,103.0,R3,116 Webster St,2128.0,Address,146742.0,42.3667,-71.0365,City Worker App,"(42.3667, -71.0365)"
571695,101001397198,05/28/2015 03:12:18 PM,06/04/2015 03:12:18 PM,05/28/2015 03:12:23 PM,ONTIME,Closed,Case Closed. Closed date : 2015-05-28 15:12:23.6 Case Resolved Created Request for Recycling Bin,Recycling Cart Return,Public Works Department,Recycling,Recycling Cart Return,PWDx_IPL Damaged Cart Replacement,PWDx,https://cityworker.cityofboston.gov:8443/attachments/report/556768a4d052b85779265af9/photo/Report.jpg,,55 Webster St  East Boston  MA  02128,1.0,09,1.0,A7,East Boston,1.0,Ward 1,103.0,R2,55 Webster St,2128.0,Address,333602.0,42.3672,-71.0385,City Worker App,"(42.3672, -71.0385)"
571699,101001397207,05/28/2015 03:16:35 PM,06/04/2015 03:16:35 PM,05/28/2015 03:16:41 PM,ONTIME,Closed,Case Closed. Closed date : 2015-05-28 15:16:41.123 Case Resolved Created Request for Recycling Bin,Recycling Cart Return,Public Works Department,Recycling,Recycling Cart Return,PWDx_IPL Damaged Cart Replacement,PWDx,https://cityworker.cityofboston.gov:8443/attachments/report/556769a1d052b85779265b0a/photo/Report.jpg,,55 Webster St  East Boston  MA  02128,1.0,09,1.0,A7,East Boston,1.0,Ward 1,103.0,R2,55 Webster St,2128.0,Address,333602.0,42.3672,-71.0385,City Worker App,"(42.3672, -71.0385)"
571712,101001397230,05/28/2015 03:37:00 PM,06/04/2015 03:37:52 PM,06/05/2015 03:04:13 PM,OVERDUE,Closed,Case Closed. Closed date : 2015-06-05 15:04:13.7 Case Resolved damaged cart replaced new cart # 0714424089 06/05/2015,Recycling Cart Return,Public Works Department,Recycling,Recycling Cart Return,PWDx_IPL Damaged Cart Replacement,PWDx,,,24 Maryland St  Dorchester  MA  02125,7.0,03,3.0,C11,Dorchester,7.0,Ward 13,1310.0,R3,24 Maryland St,2125.0,Address,91829.0,42.3111,-71.0554,Constituent Call,"(42.3111, -71.0554)"
571726,101001397246,05/28/2015 03:52:00 PM,06/04/2015 03:52:10 PM,06/04/2015 02:16:57 PM,ONTIME,Closed,Case Closed. Closed date : 2015-06-04 14:16:57.32 Case Resolved broken cart picked up 06/04/2015,Recycling Cart Return,Public Works Department,Recycling,Recycling Cart Return,PWDx_IPL Damaged Cart Replacement,PWDx,,,94 Florian St  Jamaica Plain  MA  02130,12.0,02,6.0,E13,Jamaica Plain,10.0,Ward 19,1912.0,R1,94 Florian St,2130.0,Address,58918.0,42.2895,-71.1166,Constituent Call,"(42.2895, -71.1166)"
571996,101001397642,05/29/2015 08:48:00 AM,06/05/2015 08:48:34 AM,07/29/2015 02:15:57 PM,OVERDUE,Closed,Case Closed. Closed date : 2015-07-29 14:15:57.2 Case Resolved damaged cart swapped,Recycling Cart Return,Public Works Department,Recycling,Recycling Cart Return,PWDx_IPL Damaged Cart Replacement,PWDx,,,6 Realton Rd  West Roxbury  MA  02132,9.0,06,6.0,E5,West Roxbury,12.0,Ward 20,2019.0,R1,6 Realton Rd,2132.0,Address,114938.0,42.293,-71.1482,Constituent Call,"(42.293, -71.1482)"
572011,101001397662,05/29/2015 09:02:00 AM,06/05/2015 09:02:00 AM,06/08/2015 02:53:39 PM,OVERDUE,Closed,Case Closed. Closed date : 2015-06-08 14:53:39.33 Case Resolved cart picked up 06/08/15,Recycling Cart Return,Public Works Department,Recycling,Recycling Cart Return,PWDx_IPL Damaged Cart Replacement,PWDx,,,180 Marlborough St  Boston  MA  02116,4.0,1C,8.0,D4,Back Bay,14.0,Ward 5,507.0,CM,180 Marlborough St,2116.0,Address,90541.0,42.3523,-71.0798,Constituent Call,"(42.3523, -71.0798)"
572916,101001398934,05/30/2015 07:28:00 PM,06/08/2015 08:30:00 AM,06/05/2015 08:48:04 AM,ONTIME,Closed,Case Closed. Closed date : 2015-06-05 08:48:04.527 Case Noted Upon inspection bty PWD inspector  there were no carts out for collection with the serial numbers indicated in the request. If there is still a need for removal please call the Ops Center at 617-635-7574. Thank you,Recycling Cart Return,Public Works Department,Recycling,Recycling Cart Return,PWDx_IPL Damaged Cart Replacement,PWDx,,,154-156 Commercial St  Boston  MA  02109,3.0,1B,1.0,A1,Downtown / Financial District,3.0,Ward 3,301.0,CM,154-156 Commercial St,2109.0,Address,36203.0,42.3625,-71.0524,Constituent Call,"(42.3625, -71.0524)"
574158,101001400711,06/02/2015 01:07:48 PM,06/09/2015 01:07:48 PM,06/02/2015 01:07:54 PM,ONTIME,Closed,Case Closed. Closed date : 2015-06-02 13:07:54.49 Case Resolved Created Request for Recycling Bin,Recycling Cart Return,Public Works Department,Recycling,Recycling Cart Return,PWDx_IPL Damaged Cart Replacement,PWDx,https://cityworker.cityofboston.gov:8443/attachments/report/556de2e2d052b85779268a06/photo/Report.jpg,,194 Calumet St  Mission Hill  MA  02120,9.0,10A,8.0,B2,Mission Hill,14.0,Ward 10,1005.0,R2,194 Calumet St,2120.0,Address,24963.0,42.3292,-71.1009,City Worker App,"(42.3292, -71.1009)"
574756,101001401655,06/03/2015 12:48:00 PM,06/10/2015 12:48:01 PM,08/20/2015 02:32:11 PM,OVERDUE,Closed,Case Closed. Closed date : 2015-08-20 14:32:11.79 Case Resolved no brocken cart out for pick up,Recycling Cart Return,Public Works Department,Recycling,Recycling Cart Return,PWDx_IPL Damaged Cart Replacement,PWDx,,,17 Annabel St  Dorchester  MA  02125,7.0,03,7.0,C11,Dorchester,13.0,Ward 7,710.0,R1,17 Annabel St,2125.0,Address,3625.0,42.3181,-71.0626,Constituent Call,"(42.3181, -71.0626)"
574927,101001401898,06/03/2015 04:13:00 PM,06/10/2015 04:13:24 PM,07/29/2015 02:48:51 PM,OVERDUE,Closed,Case Closed. Closed date : 2015-07-29 14:48:51.01 Duplicate of Existing Case reference case #101001407805,Recycling Cart Return,Public Works Department,Recycling,Recycling Cart Return,PWDx_Recycling,PWDx,,,5 Hillside Ave  Jamaica Plain  MA  02130,12.0,02,6.0,E13,Jamaica Plain,10.0,Ward 19,1907.0,R1,5 Hillside Ave,2130.0,Address,74144.0,42.2974,-71.1131,Constituent Call,"(42.2974, -71.1131)"
574939,101001401914,06/03/2015 04:38:00 PM,06/10/2015 04:38:45 PM,08/20/2015 02:35:33 PM,OVERDUE,Closed,Case Closed. Closed date : 2015-08-20 14:35:33.77 Case Resolved no damaged cart per inspection at this location,Recycling Cart Return,Public Works Department,Recycling,Recycling Cart Return,PWDx_IPL Damaged Cart Replacement,PWDx,,,27 Clifton St  Roxbury  MA  02119,7.0,03,7.0,B2,Roxbury,13.0,Ward 8,805.0,R1,27 Clifton St,2119.0,Address,34002.0,42.3225,-71.0708,Constituent Call,"(42.3225, -71.0708)"
574965,101001401949,06/03/2015 05:35:00 PM,06/11/2015 08:30:00 AM,08/24/2015 02:35:00 PM,OVERDUE,Closed,Case Closed. Closed date : 2015-08-24 14:35:00.053 Case Resolved no cart out 08/24/2015,Recycling Cart Return,Public Works Department,Recycling,Recycling Cart Return,PWDx_IPL Damaged Cart Replacement,PWDx,,,220 Manthorne Rd  West Roxbury  MA  02132,12.0,06,6.0,E5,West Roxbury,12.0,Ward 20,2020.0,R1,220 Manthorne Rd,2132.0,Address,89135.0,42.2943,-71.1559,Constituent Call,"(42.2943, -71.1559)"
575215,101001402331,06/04/2015 10:04:00 AM,06/11/2015 10:04:59 AM,08/27/2015 07:41:41 AM,OVERDUE,Closed,Case Closed. Closed date : 2015-08-27 07:41:41.293 Case Resolved no cart out 08/26/2015,Recycling Cart Return,Public Works Department,Recycling,Recycling Cart Return,PWDx_IPL Damaged Cart Replacement,PWDx,,,141 Howard Ave  Dorchester  MA  02125,7.0,03,7.0,B2,Roxbury,13.0,Ward 13,1301.0,R3,141 Howard Ave,2125.0,Address,253601.0,42.3155,-71.0756,Constituent Call,"(42.3155, -71.0756)"
575571,101001402804,06/04/2015 03:33:00 PM,06/11/2015 03:33:35 PM,08/24/2015 02:40:25 PM,OVERDUE,Closed,Case Closed. Closed date : 2015-08-24 14:40:25.36 Case Resolved cart picked up 08/24/2015,Recycling Cart Return,Public Works Department,Recycling,Recycling Cart Return,PWDx_IPL Damaged Cart Replacement,PWDx,,,234 Lexington St  East Boston  MA  02128,1.0,09,1.0,A7,East Boston,1.0,Ward 1,109.0,R3,234 Lexington St,2128.0,Address,85608.0,42.3801,-71.0315,Constituent Call,"(42.3801, -71.0315)"
575815,101001403176,06/05/2015 09:50:30 AM,06/12/2015 09:50:37 AM,06/05/2015 09:50:42 AM,ONTIME,Closed,Case Closed. Closed date : 2015-06-05 09:50:42.287 Case Resolved Created Request for Recycling Bin,Recycling Cart Return,Public Works Department,Recycling,Recycling Cart Return,PWDx_IPL Damaged Cart Replacement,PWDx,https://cityworker.cityofboston.gov:8443/attachments/report/5571a928d052b8577926ac64/photo/Report.jpg,,54 Osceola St  Mattapan  MA  02126,8.0,08,5.0,E18,Hyde Park,9.0,Ward 18,1805.0,RL,54 Osceola St,2126.0,Address,106054.0,42.2615,-71.1018,City Worker App,"(42.2615, -71.1018)"
575913,101001403312,06/05/2015 11:21:00 AM,06/12/2015 11:21:38 AM,08/30/2015 08:37:28 AM,OVERDUE,Closed,Case Closed. Closed date : 2015-08-30 08:37:28.353 Case Resolved broken cart replaced new cart#5149007504,Recycling Cart Return,Public Works Department,Recycling,Recycling Cart Return,PWDx_IPL Damaged Cart Replacement,PWDx,,,36 Saint Margaret St  Dorchester  MA  02125,6.0,03,2.0,C6,Dorchester,5.0,Ward 7,709.0,R3,36 Saint Margaret St,2125.0,Address,121325.0,42.3218,-71.0586,Constituent Call,"(42.3218, -71.0586)"
576288,101001403868,06/06/2015 01:14:00 PM,06/15/2015 08:30:00 AM,08/20/2015 02:31:27 PM,OVERDUE,Closed,Case Closed. Closed date : 2015-08-20 14:31:27.88 Case Resolved dont need a cart already been replaced,Recycling Cart Return,Public Works Department,Recycling,Recycling Cart Return,PWDx_IPL Damaged Cart Replacement,PWDx,,,14 Nonquit St  Dorchester  MA  02125,7.0,03,7.0,B2,Dorchester,13.0,Ward 13,1305.0,R1,14 Nonquit St,2125.0,Address,103050.0,42.3176,-71.0684,Constituent Call,"(42.3176, -71.0684)"
576340,101001403932,06/06/2015 04:54:00 PM,06/15/2015 08:30:00 AM,08/27/2015 07:43:23 AM,OVERDUE,Closed,Case Closed. Closed date : 2015-08-27 07:43:23.17 Case Resolved no cart out 08/26/2015,Recycling Cart Return,Public Works Department,Recycling,Recycling Cart Return,PWDx_IPL Damaged Cart Replacement,PWDx,,,7 Bolton Pl  Charlestown  MA  02129,3.0,1A,1.0,A15,Charlestown,2.0,Ward 2,206.0,R1,7 Bolton Pl,2129.0,Address,16759.0,42.3789,-71.0664,Constituent Call,"(42.3789, -71.0664)"
576936,101001404892,06/08/2015 02:18:00 PM,06/15/2015 02:18:19 PM,07/14/2015 01:27:22 PM,OVERDUE,Closed,Case Closed. Closed date : 2015-07-14 13:27:22.393 Case Resolved brocken cart replaced new cart # 0515630579 07/13/2015,Recycling Cart Return,Public Works Department,Recycling,Recycling Cart Return,PWDx_IPL Damaged Cart Replacement,PWDx,,,31 Hewins St  Dorchester  MA  02121,7.0,03,4.0,B3,Greater Mattapan,8.0,Ward 14,1406.0,R3,31 Hewins St,2121.0,Address,73131.0,42.3028,-71.0818,Constituent Call,"(42.3028, -71.0818)"
576955,101001404920,06/08/2015 02:40:00 PM,06/15/2015 02:40:08 PM,07/29/2015 02:50:06 PM,OVERDUE,Closed,Case Closed. Closed date : 2015-07-29 14:50:06.907 Duplicate of Existing Case case reference #101001425393,Recycling Cart Return,Public Works Department,Recycling,Recycling Cart Return,PWDx_Recycling,PWDx,,,16 Greenwich Park  Roxbury  MA  02118,4.0,1C,7.0,D4,South End,6.0,Ward 4,404.0,R3,16 Greenwich Park,2118.0,Address,66765.0,42.3424,-71.0806,Constituent Call,"(42.3424, -71.0806)"
577394,101001405583,06/09/2015 10:29:09 AM,06/16/2015 10:29:09 AM,06/09/2015 10:29:15 AM,ONTIME,Closed,Case Closed. Closed date : 2015-06-09 10:29:15.06 Case Resolved Created Request for Recycling Bin,Recycling Cart Return,Public Works Department,Recycling,Recycling Cart Return,PWDx_IPL Damaged Cart Replacement,PWDx,https://cityworker.cityofboston.gov:8443/attachments/report/5576f841d052b8577926c8e3/photo/Report.jpg,,26 Keith St  West Roxbury  MA  02132,12.0,06,6.0,E5,West Roxbury,12.0,Ward 20,2017.0,R1,26 Keith St,2132.0,Address,80776.0,42.2879,-71.1673,City Worker App,"(42.2879, -71.1673)"
577695,101001405996,06/09/2015 03:39:00 PM,06/16/2015 03:39:35 PM,08/20/2015 02:41:01 PM,OVERDUE,Closed,Case Closed. Closed date : 2015-08-20 14:41:01.65 Case Resolved cart was replaced,Recycling Cart Return,Public Works Department,Recycling,Recycling Cart Return,PWDx_IPL Damaged Cart Replacement,PWDx,,,174 Chelsea St  East Boston  MA  02128,1.0,09,1.0,A7,East Boston,1.0,Ward 1,105.0,R3,174 Chelsea St,2128.0,Address,30362.0,42.3742,-71.0341,Constituent Call,"(42.3742, -71.0341)"
578123,101001406609,06/10/2015 11:42:00 AM,06/17/2015 11:42:36 AM,08/21/2015 03:09:54 PM,OVERDUE,Closed,Case Closed. Closed date : 2015-08-21 15:09:54.263 Case Resolved no cart out at this location,Recycling Cart Return,Public Works Department,Recycling,Recycling Cart Return,PWDx_IPL Damaged Cart Replacement,PWDx,,,224 Northampton St  Roxbury  MA  02118,7.0,10B,7.0,D4,Roxbury,13.0,Ward 9,903.0,A,224 Northampton St,2118.0,Address,103720.0,42.3381,-71.0805,Constituent Call,"(42.3381, -71.0805)"
578626,101001407389,06/11/2015 10:32:00 AM,06/18/2015 10:32:17 AM,08/27/2015 07:41:13 AM,OVERDUE,Closed,Case Closed. Closed date : 2015-08-27 07:41:13.447 Case Resolved no broken cart out 08/26/2015,Recycling Cart Return,Public Works Department,Recycling,Recycling Cart Return,PWDx_IPL Damaged Cart Replacement,PWDx,,,52 Stockton St  Dorchester  MA  02124,8.0,07,4.0,B3,Dorchester,9.0,Ward 17,1710.0,R2,52 Stockton St,2124.0,Address,130778.0,42.2824,-71.0742,Constituent Call,"(42.2824, -71.0742)"
578854,101001407769,06/11/2015 02:26:00 PM,06/18/2015 02:26:45 PM,08/27/2015 07:40:01 AM,OVERDUE,Closed,Case Closed. Closed date : 2015-08-27 07:40:01.243 Case Resolved broken cart picked up 08/26/2015,Recycling Cart Return,Public Works Department,Recycling,Recycling Cart Return,PWDx_IPL Damaged Cart Replacement,PWDx,,,36 Myopia Rd  Hyde Park  MA  02136,12.0,08,5.0,E18,Hyde Park,10.0,Ward 18,1812.0,R1,36 Myopia Rd,2136.0,Address,99608.0,42.2629,-71.1268,Constituent Call,"(42.2629, -71.1268)"
578880,101001407805,06/11/2015 03:08:00 PM,06/18/2015 03:08:31 PM,08/21/2015 03:10:42 PM,OVERDUE,Closed,Case Closed. Closed date : 2015-08-21 15:10:42.713 Case Resolved damaged cart swapped new cart # 5150029701,Recycling Cart Return,Public Works Department,Recycling,Recycling Cart Return,PWDx_IPL Damaged Cart Replacement,PWDx,,,5 Hillside Ave  Jamaica Plain  MA  02130,12.0,02,6.0,E13,Jamaica Plain,10.0,Ward 19,1907.0,R1,5 Hillside Ave,2130.0,Address,74144.0,42.2974,-71.1131,Constituent Call,"(42.2974, -71.1131)"
579426,101001408615,06/12/2015 02:41:00 PM,06/19/2015 02:41:29 PM,06/23/2015 01:29:07 PM,OVERDUE,Closed,Case Closed. Closed date : 2015-06-23 13:29:07.32 Case Resolved cart replaced new cart # 0515630653 06/22/2015,Recycling Cart Return,Public Works Department,Recycling,Recycling Cart Return,PWDx_Recycling,PWDx,,,40 Auckland St  Dorchester  MA  02125,7.0,03,3.0,C11,Dorchester,7.0,Ward 13,1309.0,R3,40 Auckland St,2125.0,Address,6520.0,42.3134,-71.0557,Constituent Call,"(42.3134, -71.0557)"
580093,101001409622,06/15/2015 09:44:00 AM,06/22/2015 09:44:02 AM,08/20/2015 02:32:47 PM,OVERDUE,Closed,Case Closed. Closed date : 2015-08-20 14:32:47.713 Case Resolved already been swapped out  new cart # 5150029725,Recycling Cart Return,Public Works Department,Recycling,Recycling Cart Return,PWDx_IPL Damaged Cart Replacement,PWDx,,,10 Longmeadow St  Roxbury  MA  02119,7.0,03,7.0,B2,Roxbury,13.0,Ward 8,806.0,R3,10 Longmeadow St,2119.0,Address,87152.0,42.3222,-71.0697,Constituent Call,"(42.3222, -71.0697)"
580238,101001409836,06/15/2015 12:35:00 PM,06/22/2015 12:35:42 PM,08/25/2015 12:25:12 PM,OVERDUE,Closed,Case Closed. Closed date : 2015-08-25 12:25:12.44 Case Resolved client allset 08/25/2015,Recycling Cart Return,Public Works Department,Recycling,Recycling Cart Return,PWDx_IPL Damaged Cart Replacement,PWDx,,,15 Gertrude Rd  West Roxbury  MA  02132,12.0,06,6.0,E5,West Roxbury,12.0,Ward 20,2014.0,CM,15 Gertrude Rd,2132.0,Address,63581.0,42.2803,-71.1494,Constituent Call,"(42.2803, -71.1494)"
580321,101001409954,06/15/2015 02:52:00 PM,06/22/2015 02:52:54 PM,08/24/2015 02:38:26 PM,OVERDUE,Closed,Case Closed. Closed date : 2015-08-24 14:38:26.597 Case Resolved no cart out 08/24/2015,Recycling Cart Return,Public Works Department,Recycling,Recycling Cart Return,PWDx_IPL Damaged Cart Replacement,PWDx,,,33 Pond Cir  Jamaica Plain  MA  02130,9.0,02,6.0,E13,Jamaica Plain,11.0,Ward 19,1902.0,R1,33 Pond Cir,2130.0,Address,111494.0,42.3134,-71.1246,Constituent Call,"(42.3134, -71.1246)"
580433,101001410128,06/15/2015 08:03:00 PM,06/23/2015 08:30:00 AM,08/24/2015 02:35:31 PM,OVERDUE,Closed,Case Closed. Closed date : 2015-08-24 14:35:31.98 Case Resolved no cart out 08/24/2015,Recycling Cart Return,Public Works Department,Recycling,Recycling Cart Return,PWDx_IPL Damaged Cart Replacement,PWDx,,,285 Corey St  West Roxbury  MA  02132,,,0.0,,West Roxbury,0.0,20,,,285 Corey St,2132.0,Address,349566.0,42.3594,-71.0587,Constituent Call,"(0, 0)"
580552,101001410324,06/16/2015 08:54:00 AM,06/23/2015 08:54:21 AM,07/29/2015 02:55:53 PM,OVERDUE,Closed,Case Closed. Closed date : 2015-07-29 14:55:53.037 Duplicate of Existing Case reference case #101001423296,Recycling Cart Return,Public Works Department,Recycling,Recycling Cart Return,PWDx_Recycling,PWDx,,,69 Howitt Rd  West Roxbury  MA  02132,12.0,06,6.0,E5,West Roxbury,12.0,Ward 20,2014.0,R1,69 Howitt Rd,2132.0,Address,75722.0,42.2766,-71.1539,Constituent Call,"(42.2766, -71.1539)"
580972,101001410942,06/16/2015 10:09:00 PM,06/24/2015 08:30:00 AM,08/21/2015 03:13:13 PM,OVERDUE,Closed,Case Closed. Closed date : 2015-08-21 15:13:13.657 Case Resolved no cart out,Recycling Cart Return,Public Works Department,Recycling,Recycling Cart Return,PWDx_IPL Damaged Cart Replacement,PWDx,,,154-156 Commercial St  Boston  MA  02109,3.0,1B,1.0,A1,Downtown / Financial District,3.0,Ward 3,301.0,CM,154-156 Commercial St,2109.0,Address,36203.0,42.3625,-71.0524,Constituent Call,"(42.3625, -71.0524)"
581267,101001411444,06/17/2015 11:26:16 AM,06/24/2015 11:26:16 AM,06/17/2015 11:26:57 AM,ONTIME,Closed,Case Closed. Closed date : 2015-06-17 11:26:57.383 Case Invalid wrong issue,Recycling Cart Return,Public Works Department,Recycling,Recycling Cart Return,PWDx_Recycling,PWDx,,,4 Keane Rd  West Roxbury  MA  02132,12.0,06,6.0,E5,West Roxbury,12.0,Ward 20,2020.0,R1,4 Keane Rd,2132.0,Address,80724.0,42.2943,-71.1618,Constituent Call,"(42.2943, -71.1618)"
581373,101001411582,06/17/2015 12:49:00 PM,06/24/2015 12:49:54 PM,07/01/2015 01:44:31 PM,OVERDUE,Closed,Case Closed. Closed date : 2015-07-01 13:44:31.797 Case Noted Cart collected on 6/30/15.,Recycling Cart Return,Public Works Department,Recycling,Recycling Cart Return,PWDx_Recycling,PWDx,,,158 Bowdoin St  Dorchester  MA  02121,7.0,03,4.0,C11,Dorchester,8.0,Ward 15,1502.0,R1,158 Bowdoin St,2121.0,Address,17657.0,42.3041,-71.0703,Constituent Call,"(42.3041, -71.0703)"
582254,101001412876,06/18/2015 07:09:00 PM,06/26/2015 08:30:00 AM,07/02/2015 09:15:28 AM,OVERDUE,Closed,Case Closed. Closed date : 2015-07-02 09:15:28.513 Case Resolved Big Building,Recycling Cart Return,Public Works Department,Recycling,Recycling Cart Return,PWDx_Recycling,PWDx,,,14 Cranston St  Jamaica Plain  MA  02130,9.0,02,6.0,E13,Jamaica Plain,11.0,Ward 19,1901.0,CM,14 Cranston St,2130.0,Address,44012.0,42.3212,-71.1093,Constituent Call,"(42.3212, -71.1093)"
583434,101001414616,06/22/2015 10:37:00 AM,06/29/2015 10:37:11 AM,08/21/2015 03:11:49 PM,OVERDUE,Closed,Case Closed. Closed date : 2015-08-21 15:11:49.613 Case Resolved damaged cart swapped new cart # 5150029724,Recycling Cart Return,Public Works Department,Recycling,Recycling Cart Return,PWDx_IPL Damaged Cart Replacement,PWDx,,,9 Cranston St  Jamaica Plain  MA  02130,9.0,02,6.0,E13,Jamaica Plain,11.0,Ward 19,1901.0,R4,9 Cranston St,2130.0,Address,44052.0,42.3214,-71.1095,Constituent Call,"(42.3214, -71.1095)"
584697,101001416395,06/24/2015 10:34:00 AM,07/01/2015 10:34:00 AM,08/24/2015 02:36:02 PM,OVERDUE,Closed,Case Closed. Closed date : 2015-08-24 14:36:02.427 Case Resolved no cart out 08/24/2015,Recycling Cart Return,Public Works Department,Recycling,Recycling Cart Return,PWDx_IPL Damaged Cart Replacement,PWDx,,,285 Corey St  West Roxbury  MA  02132,,,0.0,,West Roxbury,0.0,20,,,285 Corey St,2132.0,Address,349566.0,42.3594,-71.0587,Constituent Call,"(0, 0)"
585167,101001417131,06/25/2015 09:40:00 AM,07/02/2015 09:40:16 AM,08/21/2015 02:52:19 PM,OVERDUE,Closed,Case Closed. Closed date : 2015-08-21 14:52:19.53 Case Resolved cart was not put out,Recycling Cart Return,Public Works Department,Recycling,Recycling Cart Return,PWDx_IPL Damaged Cart Replacement,PWDx,,,121 Buttonwood St  Dorchester  MA  02125,6.0,03,2.0,C6,Dorchester,5.0,Ward 7,708.0,R2,121 Buttonwood St,2125.0,Address,24396.0,42.3227,-71.0557,Constituent Call,"(42.3227, -71.0557)"
586176,101001418675,06/27/2015 02:38:00 PM,07/06/2015 08:30:00 AM,09/08/2015 02:37:20 PM,OVERDUE,Closed,Case Closed Case Resolved,Recycling Cart Return,Public Works Department,Recycling,Recycling Cart Return,PWDx_IPL Damaged Cart Replacement,PWDx,,,551 E Eighth St  South Boston  MA  02127,6.0,05,2.0,C6,South Boston / South Boston Waterfront,5.0,Ward 7,702.0,RC,551 E Eighth St,2127.0,Address,228842.0,42.3313,-71.0395,Constituent Call,"(42.3313, -71.0395)"
586919,101001419713,06/29/2015 02:44:00 PM,07/06/2015 02:44:24 PM,08/17/2015 02:22:44 PM,OVERDUE,Closed,Case Closed. Closed date : 2015-08-17 14:22:44.67 Case Resolved cart replaced cart # 5150029660 08/18/2015,Recycling Cart Return,Public Works Department,Recycling,Recycling Cart Return,PWDx_Recycling,PWDx,,,17 Boylston St  Jamaica Plain  MA  02130,9.0,02,6.0,E13,Jamaica Plain,11.0,Ward 19,1903.0,CM,17 Boylston St,2130.0,Address,18479.0,42.3186,-71.1103,Constituent Call,"(42.3186, -71.1103)"
587433,101001420438,06/30/2015 11:54:00 AM,07/07/2015 11:54:10 AM,08/24/2015 02:39:11 PM,OVERDUE,Closed,Case Closed. Closed date : 2015-08-24 14:39:11.343 Case Resolved no cart out 08/24/2015,Recycling Cart Return,Public Works Department,Recycling,Recycling Cart Return,PWDx_IPL Damaged Cart Replacement,PWDx,,,33 Champney St  Brighton  MA  02135,11.0,04,9.0,D14,Allston / Brighton,15.0,Ward 22,2213.0,R2,33 Champney St,2135.0,Address,28604.0,42.3522,-71.1686,Constituent Call,"(42.3522, -71.1686)"
587515,101001420546,06/30/2015 01:13:00 PM,07/07/2015 01:13:03 PM,07/01/2015 02:21:02 PM,ONTIME,Closed,Case Closed. Closed date : 2015-07-01 14:21:02.487 Case Resolved cart picked and swapped new cart #0712402870 07/01/2015,Recycling Cart Return,Public Works Department,Recycling,Recycling Cart Return,PWDx_Recycling,PWDx,,,170 Hamilton St  Dorchester  MA  02122,7.0,03,3.0,C11,Dorchester,8.0,Ward 15,1507.0,R3,170 Hamilton St,2122.0,Address,68431.0,42.306,-71.0664,Constituent Call,"(42.306, -71.0664)"
587970,101001421172,07/01/2015 10:01:00 AM,07/08/2015 10:01:06 AM,07/29/2015 03:02:27 PM,OVERDUE,Closed,Case Closed. Closed date : 2015-07-29 15:02:27.303 Duplicate of Existing Case REference case #101001432533,Recycling Cart Return,Public Works Department,Recycling,Recycling Cart Return,PWDx_Recycling,PWDx,,,534 Poplar St  Roslindale  MA  02131,12.0,08,5.0,E18,Hyde Park,10.0,Ward 18,1822.0,R1,534 Poplar St,2131.0,Address,111920.0,42.2728,-71.1307,Constituent Call,"(42.2728, -71.1307)"
588070,101001421313,07/01/2015 11:50:00 AM,07/08/2015 11:50:01 AM,07/29/2015 03:01:41 PM,OVERDUE,Closed,Case Closed. Closed date : 2015-07-29 15:01:41.39 Duplicate of Existing Case Reference 101001423925,Recycling Cart Return,Public Works Department,Recycling,Recycling Cart Return,PWDx_Recycling,PWDx,,,387 Faneuil St  Brighton  MA  02135,11.0,04,9.0,D14,Allston / Brighton,15.0,Ward 22,2207.0,R1,387 Faneuil St,2135.0,Address,56285.0,42.3518,-71.1665,Constituent Call,"(42.3518, -71.1665)"
589437,101001423296,07/06/2015 08:22:00 AM,07/13/2015 08:30:00 AM,08/26/2015 07:52:17 AM,OVERDUE,Closed,Case Closed. Closed date : 2015-08-26 07:52:17.21 Case Resolved nothing out,Recycling Cart Return,Public Works Department,Recycling,Recycling Cart Return,PWDx_IPL Damaged Cart Replacement,PWDx,,,69 Howitt Rd  West Roxbury  MA  02132,12.0,06,6.0,E5,West Roxbury,12.0,Ward 20,2014.0,R1,69 Howitt Rd,2132.0,Address,75722.0,42.2766,-71.1539,Constituent Call,"(42.2766, -71.1539)"
589907,101001423925,07/06/2015 03:45:00 PM,07/13/2015 03:45:52 PM,08/24/2015 02:39:42 PM,OVERDUE,Closed,Case Closed. Closed date : 2015-08-24 14:39:42.293 Case Resolved no broken cart out 08/24/2015,Recycling Cart Return,Public Works Department,Recycling,Recycling Cart Return,PWDx_IPL Damaged Cart Replacement,PWDx,,,387 Faneuil St  Brighton  MA  02135,11.0,04,9.0,D14,Allston / Brighton,15.0,Ward 22,2207.0,R1,387 Faneuil St,2135.0,Address,56285.0,42.3518,-71.1665,Constituent Call,"(42.3518, -71.1665)"
590231,101001424382,07/07/2015 10:22:00 AM,07/14/2015 10:22:11 AM,08/26/2015 07:52:43 AM,OVERDUE,Closed,Case Closed. Closed date : 2015-08-26 07:52:43.17 Case Resolved broken cart swapped new cart #5150029723 08/25/2015,Recycling Cart Return,Public Works Department,Recycling,Recycling Cart Return,PWDx_IPL Damaged Cart Replacement,PWDx,,,26 Morrow Rd  Brighton  MA  02135,11.0,04,9.0,D14,Allston / Brighton,15.0,Ward 22,2206.0,R2,26 Morrow Rd,2135.0,Address,277664.0,42.3537,-71.149,Constituent Call,"(42.3537, -71.149)"
590283,101001424464,07/07/2015 11:15:00 AM,07/14/2015 11:15:59 AM,08/27/2015 07:38:26 AM,OVERDUE,Closed,Case Closed. Closed date : 2015-08-27 07:38:26.27 Case Resolved cart picked up 0415302621 08/26/2015,Recycling Cart Return,Public Works Department,Recycling,Recycling Cart Return,PWDx_IPL Damaged Cart Replacement,PWDx,,,30 Glenburnie Rd  Roslindale  MA  02132,9.0,06,6.0,E5,West Roxbury,12.0,Ward 20,2006.0,R1,30 Glenburnie Rd,2132.0,Address,64037.0,42.2924,-71.1446,Constituent Call,"(42.2924, -71.1446)"
590454,101001424697,07/07/2015 02:47:00 PM,07/14/2015 02:48:00 PM,08/26/2015 07:50:49 AM,OVERDUE,Closed,Case Closed. Closed date : 2015-08-26 07:50:49.57 Case Resolved cart picked up 08/25/2015,Recycling Cart Return,Public Works Department,Recycling,Recycling Cart Return,PWDx_IPL Damaged Cart Replacement,PWDx,,,707 W Roxbury Pkwy  West Roxbury  MA  02132,12.0,06,6.0,E5,West Roxbury,12.0,Ward 20,2010.0,R1,707 W Roxbury Pkwy,2132.0,Address,119252.0,42.281,-71.1455,Constituent Call,"(42.281, -71.1455)"
590459,101001424704,07/07/2015 02:55:05 PM,07/14/2015 02:55:05 PM,08/27/2015 07:40:41 AM,OVERDUE,Closed,Case Closed. Closed date : 2015-08-27 07:40:41.22 Case Resolved no c art out 08/26/2015,Recycling Cart Return,Public Works Department,Recycling,Recycling Cart Return,PWDx_IPL Damaged Cart Replacement,PWDx,,,339 Bowdoin St  Dorchester  MA  02122,7.0,03,3.0,C11,Dorchester,8.0,Ward 15,1504.0,R3,339 Bowdoin St,2122.0,Address,17720.0,42.3088,-71.0638,Constituent Call,"(42.3088, -71.0638)"
590850,101001425240,07/08/2015 10:39:58 AM,07/15/2015 10:39:58 AM,07/08/2015 10:40:05 AM,ONTIME,Closed,Case Closed. Closed date : 2015-07-08 10:40:05.033 Case Resolved Created Request for Recycling Bin,Recycling Cart Return,Public Works Department,Recycling,Recycling Cart Return,PWDx_IPL Damaged Cart Replacement,PWDx,https://cityworker.cityofboston.gov:8443/attachments/report/559d3661d0528e43ce39040a/photo/Report.jpg,,120 Woodrow Ave  Dorchester  MA  02124,8.0,07,4.0,B3,Greater Mattapan,9.0,Ward 14,1413.0,R2,120 Woodrow Ave,2124.0,Address,151820.0,42.2871,-71.0836,City Worker App,"(42.2871, -71.0836)"
590974,101001425393,07/08/2015 12:40:00 PM,07/15/2015 12:40:32 PM,08/21/2015 03:12:42 PM,OVERDUE,Closed,Case Closed. Closed date : 2015-08-21 15:12:42.06 Case Resolved no cart out 08/21/2015,Recycling Cart Return,Public Works Department,Recycling,Recycling Cart Return,PWDx_IPL Damaged Cart Replacement,PWDx,,,16 Greenwich Park  Roxbury  MA  02118,4.0,1C,7.0,D4,South End,6.0,Ward 4,404.0,R3,16 Greenwich Park,2118.0,Address,66765.0,42.3424,-71.0806,Constituent Call,"(42.3424, -71.0806)"
591053,101001425513,07/08/2015 02:27:00 PM,07/15/2015 02:27:16 PM,07/29/2015 02:45:25 PM,OVERDUE,Closed,Case Closed. Closed date : 2015-07-29 14:45:25.727 Case Resolved cart picked up 7/29/2015,Recycling Cart Return,Public Works Department,Recycling,Recycling Cart Return,PWDx_Recycling,PWDx,,,70-72 Gallivan Blvd  Dorchester  MA  02124,8.0,07,3.0,B3,Dorchester,7.0,Ward 17,1712.0,R2,70-72 Gallivan Blvd,2124.0,Address,62390.0,42.2784,-71.0754,Constituent Call,"(42.2784, -71.0754)"
592267,101001427136,07/10/2015 04:10:20 PM,07/17/2015 04:10:20 PM,07/10/2015 04:10:24 PM,ONTIME,Closed,Case Closed. Closed date : 2015-07-10 16:10:24.11 Case Resolved Created Request for Recycling Bin,Recycling Cart Return,Public Works Department,Recycling,Recycling Cart Return,PWDx_IPL Damaged Cart Replacement,PWDx,,,INTERSECTION of Houghton St & Payne St  Dorchester  MA,8.0,07,3.0,C11,Dorchester,7.0,Ward 16,1605.0,,INTERSECTION Houghton St & Payne St,,Intersection,6371.0,42.2948,-71.0513,City Worker App,"(42.2948, -71.0513)"
593129,101001428373,07/13/2015 03:10:00 PM,07/20/2015 03:10:52 PM,07/29/2015 07:46:46 AM,OVERDUE,Closed,Case Closed. Closed date : 2015-07-29 07:46:46.09 Case Resolved case resolved cart picked duplicate case  reference # 101001437271,Recycling Cart Return,Public Works Department,Recycling,Recycling Cart Return,PWDx_Recycling,PWDx,,,24 Monument Ave  Charlestown  MA  02129,3.0,1A,1.0,A15,Charlestown,2.0,Ward 2,203.0,R1,24 Monument Ave,2129.0,Address,96861.0,42.3744,-71.0622,Constituent Call,"(42.3744, -71.0622)"
593833,101001429303,07/14/2015 02:37:00 PM,07/21/2015 02:37:57 PM,08/21/2015 02:54:00 PM,OVERDUE,Closed,Case Closed. Closed date : 2015-08-21 14:54:00.783 Case Resolved cart was not put out,Recycling Cart Return,Public Works Department,Recycling,Recycling Cart Return,PWDx_IPL Damaged Cart Replacement,PWDx,,,64 Shepton St  Dorchester  MA  02124,8.0,07,3.0,C11,Dorchester,7.0,Ward 16,1606.0,R1,64 Shepton St,2124.0,Address,126751.0,42.2902,-71.0605,Constituent Call,"(42.2902, -71.0605)"
594192,101001429774,07/15/2015 09:05:52 AM,07/22/2015 09:05:52 AM,07/15/2015 09:05:59 AM,ONTIME,Closed,Case Closed. Closed date : 2015-07-15 09:05:59.32 Case Resolved Created Request for Recycling Bin,Recycling Cart Return,Public Works Department,Recycling,Recycling Cart Return,PWDx_IPL Damaged Cart Replacement,PWDx,https://cityworker.cityofboston.gov:8443/attachments/report/55a65aaed052d9589a756828/photo/Report.jpg,,59 Davison St  Hyde Park  MA  02136,12.0,08,5.0,E18,Hyde Park,10.0,Ward 18,1813.0,R3,59 Davison St,2136.0,Address,46628.0,42.2572,-71.1181,City Worker App,"(42.2572, -71.1181)"
594225,101001429815,07/15/2015 09:47:44 AM,07/22/2015 09:47:44 AM,07/15/2015 09:47:49 AM,ONTIME,Closed,Case Closed. Closed date : 2015-07-15 09:47:49.787 Case Resolved Created Request for Recycling Bin,Recycling Cart Return,Public Works Department,Recycling,Recycling Cart Return,PWDx_IPL Damaged Cart Replacement,PWDx,https://cityworker.cityofboston.gov:8443/attachments/report/55a6647fd052d9589a7569ae/photo/Report.jpg,,85 Fletcher St  Roslindale  MA  02131,9.0,06,5.0,E5,Roslindale,10.0,Ward 20,2001.0,R2,85 Fletcher St,2131.0,Address,236046.0,42.2907,-71.1385,City Worker App,"(42.2907, -71.1385)"
594243,101001429836,07/15/2015 09:59:00 AM,07/22/2015 09:59:17 AM,08/21/2015 02:54:44 PM,OVERDUE,Closed,Case Closed. Closed date : 2015-08-21 14:54:44.893 Case Resolved cart was not out,Recycling Cart Return,Public Works Department,Recycling,Recycling Cart Return,PWDx_IPL Damaged Cart Replacement,PWDx,,,11 Adanac Ter  Dorchester  MA  02124,8.0,07,3.0,C11,Dorchester,7.0,Ward 16,1606.0,R2,11 Adanac Ter,2124.0,Address,176087.0,42.2872,-71.061,Constituent Call,"(42.2872, -71.061)"
595073,101001430912,07/16/2015 11:49:36 AM,07/23/2015 11:49:36 AM,07/20/2015 07:40:56 AM,ONTIME,Closed,Case Closed. Closed date : 2015-07-20 07:40:56.827 Case Resolved caller did not have the cart #.  will call back,Recycling Cart Return,Public Works Department,Recycling,Recycling Cart Return,PWDx_Recycling,PWDx,,,24 Montgomery St  Roxbury  MA  02118,4.0,1C,2.0,D4,South End,6.0,Ward 4,401.0,CM,24 Montgomery St,2118.0,Address,96663.0,42.3438,-71.0728,Constituent Call,"(42.3438, -71.0728)"
595075,101001430916,07/16/2015 11:51:00 AM,07/23/2015 11:51:35 AM,07/29/2015 02:52:28 PM,OVERDUE,Closed,Case Closed. Closed date : 2015-07-29 14:52:28.487 Duplicate of Existing Case reference case #101001433435,Recycling Cart Return,Public Works Department,Recycling,Recycling Cart Return,PWDx_Recycling,PWDx,,,24 Montgomery St  Roxbury  MA  02118,4.0,1C,2.0,D4,South End,6.0,Ward 4,401.0,CM,24 Montgomery St,2118.0,Address,96663.0,42.3438,-71.0728,Constituent Call,"(42.3438, -71.0728)"
595178,101001431065,07/16/2015 01:53:00 PM,07/23/2015 01:53:33 PM,08/03/2015 02:52:39 PM,OVERDUE,Closed,Case Closed. Closed date : 2015-08-03 14:52:39.66 Case Resolved cart return cart # R9027541 08/013/2015,Recycling Cart Return,Public Works Department,Recycling,Recycling Cart Return,PWDx_Recycling,PWDx,,,150 Almont St  Mattapan  MA  02126,8.0,07,5.0,B3,Greater Mattapan,9.0,Ward 18,1803.0,R1,150 Almont St,2126.0,Address,2754.0,42.2778,-71.0984,Constituent Call,"(42.2778, -71.0984)"
595244,101001431156,07/16/2015 03:12:28 PM,07/23/2015 03:12:28 PM,07/16/2015 03:15:08 PM,ONTIME,Closed,Case Closed. Closed date : 2015-07-16 15:15:08.743 Case Invalid,Recycling Cart Return,Public Works Department,Recycling,Recycling Cart Return,PWDx_Recycling,PWDx,,,132 Callender St  Dorchester  MA  02124,8.0,07,4.0,B3,Greater Mattapan,9.0,Ward 14,1410.0,R3,132 Callender St,2124.0,Address,24787.0,42.2879,-71.0843,Constituent Call,"(42.2879, -71.0843)"
595291,101001431225,07/16/2015 03:56:00 PM,07/23/2015 03:56:52 PM,08/20/2015 02:41:27 PM,OVERDUE,Closed,Case Closed. Closed date : 2015-08-20 14:41:27.36 Case Resolved cart was picked up,Recycling Cart Return,Public Works Department,Recycling,Recycling Cart Return,PWDx_IPL Damaged Cart Replacement,PWDx,,,3 M St  South Boston  MA  02127,6.0,05,2.0,C6,South Boston / South Boston Waterfront,5.0,06,607.0,,3 M St,2127.0,Address,344041.0,42.3594,-71.0587,Constituent Call,"(0, 0)"
595852,101001431929,07/17/2015 11:55:00 AM,07/24/2015 11:56:10 AM,08/24/2015 11:42:47 AM,OVERDUE,Closed,Case Closed Case Invalid,Recycling Cart Return,Public Works Department,Recycling,Recycling Cart Return,PWDx_IPL Damaged Cart Replacement,PWDx,,,,,,,,,,,,,,,,,42.3594,-71.0587,Constituent Call,"(0, 0)"
595854,101001431932,07/17/2015 11:59:00 AM,07/24/2015 11:59:21 AM,08/24/2015 02:37:17 PM,OVERDUE,Closed,Case Closed. Closed date : 2015-08-24 14:37:17.827 Case Resolved no cart out 08/24/2015,Recycling Cart Return,Public Works Department,Recycling,Recycling Cart Return,PWDx_IPL Damaged Cart Replacement,PWDx,,,27 Floyd St  Dorchester  MA  02124,8.0,07,4.0,B3,Greater Mattapan,9.0,Ward 14,1412.0,R2,27 Floyd St,2124.0,Address,59041.0,42.2894,-71.0886,Constituent Call,"(42.2894, -71.0886)"
596030,101001432172,07/17/2015 03:36:00 PM,07/24/2015 03:36:23 PM,08/30/2015 08:36:28 AM,OVERDUE,Closed,Case Closed. Closed date : 2015-08-30 08:36:28.16 Case Resolved no cart out,Recycling Cart Return,Public Works Department,Recycling,Recycling Cart Return,PWDx_IPL Damaged Cart Replacement,PWDx,,,44 Mallet St  Dorchester  MA  02124,8.0,07,3.0,C11,Dorchester,7.0,Ward 16,1606.0,R2,44 Mallet St,2124.0,Address,88792.0,42.2902,-71.0583,Constituent Call,"(42.2902, -71.0583)"
596283,101001432533,07/18/2015 07:35:00 PM,07/27/2015 08:30:00 AM,09/23/2015 08:47:11 AM,OVERDUE,Closed,Case Closed Case Resolved  no broken cart out or same IPL number for pick 09/23/2015,Recycling Cart Return,Public Works Department,Recycling,Recycling Cart Return,PWDx_IPL Damaged Cart Replacement,PWDx,,,534 Poplar St  Roslindale  MA  02131,12.0,08,5.0,E18,Hyde Park,10.0,Ward 18,1822.0,R1,534 Poplar St,2131.0,Address,111920.0,42.2728,-71.1307,Constituent Call,"(42.2728, -71.1307)"
596510,101001432869,07/20/2015 09:10:00 AM,07/27/2015 09:10:20 AM,08/20/2015 07:56:17 AM,OVERDUE,Closed,Case Closed. Closed date : 2015-08-20 07:56:17.87 Case Noted Cart was delivered on 8/18 515#0029702 thank you.,Recycling Cart Return,Public Works Department,Recycling,Recycling Cart Return,PWDx_IPL Damaged Cart Replacement,PWDx,,,12 Stockton St  Dorchester  MA  02124,8.0,07,4.0,B3,Dorchester,9.0,Ward 17,1710.0,R1,12 Stockton St,2124.0,Address,130753.0,42.2827,-71.0725,Constituent Call,"(42.2827, -71.0725)"
596519,101001432884,07/20/2015 09:18:00 AM,07/27/2015 09:18:13 AM,08/24/2015 02:34:13 PM,OVERDUE,Closed,Case Closed. Closed date : 2015-08-24 14:34:13.26 Case Resolved cart picked up 08/24/2015,Recycling Cart Return,Public Works Department,Recycling,Recycling Cart Return,PWDx_IPL Damaged Cart Replacement,PWDx,,,14 Loring Pl  Hyde Park  MA  02136,12.0,08,5.0,E18,Hyde Park,10.0,Ward 18,1818.0,R2,14 Loring Pl,2136.0,Address,266311.0,42.2477,-71.1218,Constituent Call,"(42.2477, -71.1218)"
596602,101001432984,07/20/2015 10:21:00 AM,07/27/2015 10:21:33 AM,09/08/2015 02:39:19 PM,OVERDUE,Closed,Case Closed. Closed date : 2015-09-08 14:39:19.48 Case Resolved removed 09/07/2015,Recycling Cart Return,Public Works Department,Recycling,Recycling Cart Return,PWDx_IPL Damaged Cart Replacement,PWDx,,,442 Talbot Ave  Dorchester  MA  02124,8.0,07,3.0,C11,Dorchester,8.0,Ward 16,1603.0,R1,442 Talbot Ave,2124.0,Address,133724.0,42.2895,-71.0676,Constituent Call,"(42.2895, -71.0676)"
596816,101001433254,07/20/2015 01:07:00 PM,07/27/2015 01:07:26 PM,08/03/2015 02:54:53 PM,OVERDUE,Closed,Case Closed. Closed date : 2015-08-03 14:54:53.63 Case Resolved cart picked up 08/03/2015 R9027541,Recycling Cart Return,Public Works Department,Recycling,Recycling Cart Return,PWDx_Recycling,PWDx,,,150 Almont St  Mattapan  MA  02126,8.0,07,5.0,B3,Greater Mattapan,9.0,Ward 18,1803.0,R1,150 Almont St,2126.0,Address,2754.0,42.2778,-71.0984,Constituent Call,"(42.2778, -71.0984)"
596830,101001433273,07/20/2015 01:18:00 PM,07/27/2015 01:18:12 PM,08/21/2015 03:09:11 PM,OVERDUE,Closed,Case Closed. Closed date : 2015-08-21 15:09:11.53 Case Resolved cart wasnt out,Recycling Cart Return,Public Works Department,Recycling,Recycling Cart Return,PWDx_IPL Damaged Cart Replacement,PWDx,,,2 Dunford St  Roxbury  MA  02119,9.0,10B,7.0,B2,Roxbury,13.0,Ward 11,1103.0,R1,2 Dunford St,2119.0,Address,49956.0,42.3175,-71.0949,Constituent Call,"(42.3175, -71.0949)"
596875,101001433332,07/20/2015 01:58:00 PM,07/27/2015 01:58:36 PM,09/24/2015 09:32:17 AM,OVERDUE,Closed,Case Closed. Closed date : 2015-09-24 09:32:17.597 Case Noted Broken carts removed and replaced weeks ago.,Recycling Cart Return,Public Works Department,Recycling,Recycling Cart Return,PWDx_IPL Damaged Cart Replacement,PWDx,,,42-44 Dorset St  Dorchester  MA  02125,6.0,03,2.0,C6,Dorchester,5.0,Ward 7,708.0,R2,42-44 Dorset St,2125.0,Address,49192.0,42.3238,-71.0588,Constituent Call,"(42.3238, -71.0588)"
596953,101001433435,07/20/2015 03:39:00 PM,07/27/2015 03:39:15 PM,08/27/2015 02:05:36 PM,OVERDUE,Closed,Case Closed. Closed date : 2015-08-27 14:05:36.73 Case Resolved already picked up,Recycling Cart Return,Public Works Department,Recycling,Recycling Cart Return,PWDx_IPL Damaged Cart Replacement,PWDx,,,24 Montgomery St  Roxbury  MA  02118,4.0,1C,2.0,D4,South End,6.0,Ward 4,401.0,CM,24 Montgomery St,2118.0,Address,96663.0,42.3438,-71.0728,Constituent Call,"(42.3438, -71.0728)"
597316,101001433916,07/21/2015 09:58:00 AM,07/28/2015 09:58:21 AM,09/15/2015 12:35:36 AM,OVERDUE,Closed,Case Closed. Closed date : 2015-09-15 00:35:36.697 Case Noted Duplicate case already exists,Recycling Cart Return,Public Works Department,Recycling,Recycling Cart Return,PWDx_IPL Damaged Cart Replacement,PWDx,,,4815 Washington St  West Roxbury  MA  02132,12.0,06,6.0,E5,West Roxbury,12.0,Ward 20,2010.0,R2,4815 Washington St,2132.0,Address,145334.0,42.2715,-71.1459,Constituent Call,"(42.2715, -71.1459)"
597522,101001434174,07/21/2015 12:56:00 PM,07/28/2015 12:56:37 PM,08/19/2015 03:16:15 PM,OVERDUE,Closed,Case Closed. Closed date : 2015-08-19 15:16:15.01 Case Resolved cart was already picked up,Recycling Cart Return,Public Works Department,Recycling,Recycling Cart Return,PWDx_IPL Damaged Cart Replacement,PWDx,,,136 Chelsea St  East Boston  MA  02128,1.0,09,1.0,A7,East Boston,1.0,Ward 1,105.0,R3,136 Chelsea St,2128.0,Address,30314.0,42.3734,-71.035,Constituent Call,"(42.3734, -71.035)"
597524,101001434176,07/21/2015 12:58:00 PM,07/28/2015 12:58:47 PM,07/29/2015 03:00:08 PM,OVERDUE,Closed,Case Closed. Closed date : 2015-07-29 15:00:08.787 Case Resolved reference case #101001434178,Recycling Cart Return,Public Works Department,Recycling,Recycling Cart Return,PWDx_Recycling,PWDx,,,138 Chelsea St  East Boston  MA  02128,1.0,09,1.0,A7,East Boston,1.0,Ward 1,105.0,R3,138 Chelsea St,2128.0,Address,30316.0,42.3734,-71.0349,Constituent Call,"(42.3734, -71.0349)"
597525,101001434178,07/21/2015 01:00:00 PM,07/28/2015 01:00:07 PM,08/19/2015 03:16:44 PM,OVERDUE,Closed,Case Closed. Closed date : 2015-08-19 15:16:44.2 Case Resolved cart was already picked up,Recycling Cart Return,Public Works Department,Recycling,Recycling Cart Return,PWDx_IPL Damaged Cart Replacement,PWDx,,,138 Chelsea St  East Boston  MA  02128,1.0,09,1.0,A7,East Boston,1.0,Ward 1,105.0,R3,138 Chelsea St,2128.0,Address,30316.0,42.3734,-71.0349,Constituent Call,"(42.3734, -71.0349)"
597527,101001434180,07/21/2015 01:01:00 PM,07/28/2015 01:01:01 PM,07/29/2015 03:00:46 PM,OVERDUE,Closed,Case Closed. Closed date : 2015-07-29 15:00:46.233 Duplicate of Existing Case reference case #101001434178,Recycling Cart Return,Public Works Department,Recycling,Recycling Cart Return,PWDx_Recycling,PWDx,,,138 Chelsea St  East Boston  MA  02128,1.0,09,1.0,A7,East Boston,1.0,Ward 1,105.0,R3,138 Chelsea St,2128.0,Address,30316.0,42.3734,-71.0349,Constituent Call,"(42.3734, -71.0349)"
597593,101001434266,07/21/2015 02:15:00 PM,07/28/2015 02:15:27 PM,08/24/2015 02:38:00 PM,OVERDUE,Closed,Case Closed. Closed date : 2015-08-24 14:38:00.387 Case Resolved no cart out 08/24/2015,Recycling Cart Return,Public Works Department,Recycling,Recycling Cart Return,PWDx_IPL Damaged Cart Replacement,PWDx,,,5 Rollins Pl  Boston  MA  02114,3.0,1B,8.0,A1,Beacon Hill,14.0,Ward 5,504.0,R1,5 Rollins Pl,2114.0,Address,118100.0,42.3598,-71.0673,Constituent Call,"(42.3598, -71.0673)"
597597,101001434271,07/21/2015 02:21:00 PM,07/28/2015 02:21:26 PM,07/29/2015 07:46:04 AM,OVERDUE,Closed,Case Closed. Closed date : 2015-07-29 07:46:04.943 Case Resolved case resolved cart was picked up 07/29/2015,Recycling Cart Return,Public Works Department,Recycling,Recycling Cart Return,PWDx_Recycling,PWDx,,,24 Monument Ave  Charlestown  MA  02129,3.0,1A,1.0,A15,Charlestown,2.0,Ward 2,203.0,R1,24 Monument Ave,2129.0,Address,96861.0,42.3744,-71.0622,Constituent Call,"(42.3744, -71.0622)"
597611,101001434287,07/21/2015 02:34:00 PM,07/28/2015 02:34:32 PM,08/30/2015 08:37:03 AM,OVERDUE,Closed,Case Closed. Closed date : 2015-08-30 08:37:03.673 Case Resolved no cart out,Recycling Cart Return,Public Works Department,Recycling,Recycling Cart Return,PWDx_IPL Damaged Cart Replacement,PWDx,,,24 Saint Margaret St  Dorchester  MA  02125,6.0,03,2.0,C6,Dorchester,5.0,Ward 7,709.0,R3,24 Saint Margaret St,2125.0,Address,304435.0,42.322,-71.0593,Constituent Call,"(42.322, -71.0593)"
597735,101001434458,07/21/2015 05:34:00 PM,07/29/2015 08:30:00 AM,08/20/2015 02:33:34 PM,OVERDUE,Closed,Case Closed. Closed date : 2015-08-20 14:33:34.847 Case Resolved no cart out new cart was delivered,Recycling Cart Return,Public Works Department,Recycling,Recycling Cart Return,PWDx_IPL Damaged Cart Replacement,PWDx,,,130 Mount Pleasant Ave  Roxbury  MA  02119,7.0,10B,7.0,B2,Roxbury,13.0,Ward 8,807.0,CM,130 Mount Pleasant Ave,2119.0,Address,98389.0,42.3252,-71.0764,Constituent Call,"(42.3252, -71.0764)"
599676,101001437285,07/27/2015 10:24:00 AM,08/03/2015 10:24:19 AM,07/29/2015 02:57:35 PM,ONTIME,Closed,Case Closed. Closed date : 2015-07-29 14:57:35.507 Duplicate of Existing Case reference 101001437291,Recycling Cart Return,Public Works Department,Recycling,Recycling Cart Return,PWDx_Recycling,PWDx,,,105 Glenellen Rd  West Roxbury  MA  02132,12.0,06,6.0,E5,West Roxbury,12.0,Ward 20,2015.0,R1,105 Glenellen Rd,2132.0,Address,64312.0,42.2671,-71.1643,Constituent Call,"(42.2671, -71.1643)"
599949,101001437620,07/27/2015 01:41:00 PM,08/03/2015 01:41:14 PM,08/20/2015 02:39:11 PM,OVERDUE,Closed,Case Closed. Closed date : 2015-08-20 14:39:11.33 Case Resolved cart picked up 08/20/2015,Recycling Cart Return,Public Works Department,Recycling,Recycling Cart Return,PWDx_IPL Damaged Cart Replacement,PWDx,,,69 Whitford St  Roslindale  MA  02131,12.0,06,5.0,E5,Roslindale,10.0,Ward 18,1809.0,R1,69 Whitford St,2131.0,Address,149372.0,42.2796,-71.1276,Constituent Call,"(42.2796, -71.1276)"
600826,101001438758,07/28/2015 04:02:00 PM,08/04/2015 04:02:29 PM,07/29/2015 02:56:36 PM,ONTIME,Closed,Case Closed. Closed date : 2015-07-29 14:56:36.177 Duplicate of Existing Case REference case #101001438759,Recycling Cart Return,Public Works Department,Recycling,Recycling Cart Return,PWDx_Recycling,PWDx,,,93 Armandine St  Dorchester  MA  02124,8.0,07,4.0,B3,Dorchester,9.0,Ward 17,1708.0,R1,93 Armandine St,2124.0,Address,4991.0,42.2843,-71.075,Constituent Call,"(42.2843, -71.075)"
601637,101001499830,07/30/2015 07:33:38 AM,08/06/2015 08:30:00 AM,07/30/2015 07:33:43 AM,ONTIME,Closed,Case Closed. Closed date : 2015-07-30 07:33:43.95 Case Resolved Created Request for Recycling Bin,Recycling Cart Return,Public Works Department,Recycling,Recycling Cart Return,PWDx_IPL Damaged Cart Replacement,PWDx,https://cityworker.cityofboston.gov:8443/attachments/report/55ba0bb5d05214099915afa8/photo/Report.jpg,,43 Wallingford Rd  Brighton  MA  02135,11.0,04,9.0,D14,Allston / Brighton,15.0,Ward 21,2113.0,R2,43 Wallingford Rd,2135.0,Address,141852.0,42.3429,-71.1508,City Worker App,"(42.3429, -71.1508)"
601640,101001499833,07/30/2015 07:36:05 AM,08/06/2015 08:30:00 AM,07/30/2015 07:36:11 AM,ONTIME,Closed,Case Closed. Closed date : 2015-07-30 07:36:11.377 Case Resolved Created Request for Recycling Bin,Recycling Cart Return,Public Works Department,Recycling,Recycling Cart Return,PWDx_IPL Damaged Cart Replacement,PWDx,https://cityworker.cityofboston.gov:8443/attachments/report/55ba0c47d05214099915afba/photo/Report.jpg,,INTERSECTION of Melton Rd & Wallingford Rd  Brighton  MA,11.0,04,9.0,D14,Allston / Brighton,15.0,Ward 21,2113.0,,INTERSECTION Melton Rd & Wallingford Rd,,Intersection,7239.0,42.3432,-71.1509,City Worker App,"(42.3432, -71.1509)"
601661,101001499860,07/30/2015 08:18:00 AM,08/06/2015 08:30:00 AM,08/13/2015 02:13:27 PM,OVERDUE,Closed,Case Closed Case Resolved  Cart # 0040553 was picked up by PWD Supervisor on 8/13/15,Recycling Cart Return,Public Works Department,Recycling,Recycling Cart Return,PWDx_Recycling,PWDx,,,119-121 Minot St  Dorchester  MA  02122,8.0,07,3.0,C11,Dorchester,7.0,Ward 16,1609.0,R2,119-121 Minot St,2122.0,Address,96041.0,42.2846,-71.0518,Constituent Call,"(42.2846, -71.0518)"
601998,101001500328,07/30/2015 02:57:00 PM,08/06/2015 02:57:43 PM,09/29/2015 02:21:54 PM,OVERDUE,Closed,Case Closed. Closed date : 2015-09-29 14:21:54.017 Case Resolved no cart out 09/29/2015,Recycling Cart Return,Public Works Department,Recycling,Recycling Cart Return,PWDx_Recycling Cart Return,PWDx,,,4815 Washington St  West Roxbury  MA  02132,12.0,06,6.0,E5,West Roxbury,12.0,Ward 20,2010.0,R2,4815 Washington St,2132.0,Address,145334.0,42.2715,-71.1459,Constituent Call,"(42.2715, -71.1459)"
602280,101001500715,07/31/2015 09:10:00 AM,08/07/2015 09:10:53 AM,09/23/2015 08:46:34 AM,OVERDUE,Closed,Case Closed Case Resolved  no broken cart out 09/23/2015,Recycling Cart Return,Public Works Department,Recycling,Recycling Cart Return,PWDx_IPL Damaged Cart Replacement,PWDx,,,102 Fletcher St  Roslindale  MA  02131,9.0,06,5.0,E5,Roslindale,10.0,Ward 20,2001.0,R3,102 Fletcher St,2131.0,Address,58710.0,42.2908,-71.1394,Constituent Call,"(42.2908, -71.1394)"
602401,101001500869,07/31/2015 11:46:00 AM,08/07/2015 11:46:04 AM,09/15/2015 12:37:16 AM,OVERDUE,Closed,Case Closed. Closed date : 2015-09-15 00:37:16.543 Case Noted During inspection at this address there was a new cart at this location.,Recycling Cart Return,Public Works Department,Recycling,Recycling Cart Return,PWDx_IPL Damaged Cart Replacement,PWDx,,,14 Lenoxdale Ave  Dorchester  MA  02124,8.0,07,3.0,C11,Dorchester,7.0,Ward 16,1612.0,R1,14 Lenoxdale Ave,2124.0,Address,85083.0,42.2819,-71.0544,Constituent Call,"(42.2819, -71.0544)"
603146,101001501914,08/03/2015 08:47:03 AM,08/10/2015 08:47:03 AM,08/03/2015 08:54:42 AM,ONTIME,Closed,Case Closed. Closed date : 2015-08-03 08:54:42.627 Duplicate of Existing Case,Recycling Cart Return,Public Works Department,Recycling,Recycling Cart Return,PWDx_Recycling,PWDx,,,8 Carruth St  Dorchester  MA  02124,8.0,07,3.0,C11,Dorchester,7.0,Ward 16,1608.0,R2,8 Carruth St,2124.0,Address,26132.0,42.286,-71.0616,Constituent Call,"(42.286, -71.0616)"
603305,101001502127,08/03/2015 11:19:00 AM,08/10/2015 11:19:18 AM,09/28/2015 10:23:57 AM,OVERDUE,Closed,Case Closed. Closed date : 2015-09-28 10:23:57.827 Case Noted  case already exists in the system duplicate,Recycling Cart Return,Public Works Department,Recycling,Recycling Cart Return,PWDx_IPL Damaged Cart Replacement,PWDx,,,2 Corman Rd  Mattapan  MA  02126,8.0,07,5.0,B3,Greater Mattapan,9.0,Ward 18,1821.0,R1,2 Corman Rd,2126.0,Address,42879.0,42.2713,-71.1024,Constituent Call,"(42.2713, -71.1024)"
603440,101001502289,08/03/2015 01:25:00 PM,08/10/2015 01:25:30 PM,08/03/2015 02:54:04 PM,ONTIME,Closed,Case Closed. Closed date : 2015-08-03 14:54:04.42 Duplicate of Existing Case Referece case # 101001433254 08/03/2015,Recycling Cart Return,Public Works Department,Recycling,Recycling Cart Return,PWDx_Recycling,PWDx,,,150 Almont St  Mattapan  MA  02126,8.0,07,5.0,B3,Greater Mattapan,9.0,Ward 18,1803.0,R1,150 Almont St,2126.0,Address,2754.0,42.2778,-71.0984,Constituent Call,"(42.2778, -71.0984)"
604881,101001504228,08/05/2015 01:56:54 PM,08/12/2015 01:56:54 PM,08/05/2015 01:58:01 PM,ONTIME,Closed,Case Closed. Closed date : 2015-08-05 13:58:01.1 Case Invalid Constit cut,Recycling Cart Return,Public Works Department,Recycling,Recycling Cart Return,PWDx_Recycling,PWDx,,,55 Russell St  Charlestown  MA  02129,3.0,1A,1.0,A15,Charlestown,2.0,Ward 2,205.0,R1,55 Russell St,2129.0,Address,119692.0,42.3799,-71.0665,Constituent Call,"(42.3799, -71.0665)"
604906,101001504261,08/05/2015 02:21:00 PM,08/12/2015 02:21:52 PM,09/24/2015 08:48:55 AM,OVERDUE,Closed,Case Closed. Closed date : 2015-09-24 08:48:55.143 Case Noted We have inspected this area several times and could not find anything to match the identification number.  Please feel free to contact our office if invalid thank you.,Recycling Cart Return,Public Works Department,Recycling,Recycling Cart Return,PWDx_IPL Damaged Cart Replacement,PWDx,,,451 E Seventh St  South Boston  MA  02127,6.0,05,2.0,C6,South Boston / South Boston Waterfront,5.0,Ward 7,703.0,CM,451 E Seventh St,2127.0,Address,125291.0,42.332,-71.0419,Constituent Call,"(42.332, -71.0419)"
605575,101001505133,08/06/2015 03:04:00 PM,08/13/2015 03:04:03 PM,08/20/2015 02:42:08 PM,OVERDUE,Closed,Case Closed. Closed date : 2015-08-20 14:42:08.81 Case Resolved cart was picked up,Recycling Cart Return,Public Works Department,Recycling,Recycling Cart Return,PWDx_IPL Damaged Cart Replacement,PWDx,,,345 E St  South Boston  MA  02127,6.0,05,2.0,C6,South Boston / South Boston Waterfront,5.0,Ward 6,603.0,R4,345 E St,2127.0,Address,50632.0,42.3384,-71.0484,Constituent Call,"(42.3384, -71.0484)"
606083,101001505836,08/07/2015 01:03:04 PM,08/14/2015 01:03:04 PM,08/07/2015 01:09:44 PM,ONTIME,Closed,Case Closed Case Invalid  Case created in error,Recycling Cart Return,Public Works Department,Recycling,Recycling Cart Return,PWDx_Recycling,PWDx,,,237 Savin Hill Ave  Dorchester  MA  02125,7.0,03,3.0,C11,Dorchester,7.0,Ward 13,1310.0,R1,237 Savin Hill Ave,2125.0,Address,123285.0,42.3098,-71.0465,Constituent Call,"(42.3098, -71.0465)"
606742,101001516808,08/10/2015 08:02:00 AM,08/17/2015 08:30:00 AM,09/24/2015 09:32:54 AM,OVERDUE,Closed,Case Closed. Closed date : 2015-09-24 09:32:54.84 Case Noted Cart removed weeks ago by city inspector.,Recycling Cart Return,Public Works Department,Recycling,Recycling Cart Return,PWDx_IPL Damaged Cart Replacement,PWDx,,,101 Partridge St  West Roxbury  MA  02132,12.0,06,6.0,E5,West Roxbury,12.0,Ward 20,2010.0,R1,101 Partridge St,2132.0,Address,108384.0,42.272,-71.1492,Constituent Call,"(42.272, -71.1492)"
606974,101001517123,08/10/2015 11:51:08 AM,08/17/2015 11:51:08 AM,08/10/2015 11:51:37 AM,ONTIME,Closed,Case Closed. Closed date : 2015-08-10 11:51:37.83 Case Invalid did not have id number,Recycling Cart Return,Public Works Department,Recycling,Recycling Cart Return,PWDx_Recycling,PWDx,,,94 Bartlett St  Charlestown  MA  02129,3.0,1A,1.0,A15,Charlestown,2.0,Ward 2,206.0,R1,94 Bartlett St,2129.0,Address,8499.0,42.3787,-71.0651,Constituent Call,"(42.3787, -71.0651)"
607037,101001517221,08/10/2015 01:14:00 PM,08/17/2015 01:14:26 PM,09/22/2015 07:07:09 AM,OVERDUE,Closed,Case Closed Duplicate of Existing Case,Recycling Cart Return,Public Works Department,Recycling,Recycling Cart Return,PWDx_IPL Damaged Cart Replacement,PWDx,,,102 Fletcher St  Roslindale  MA  02131,9.0,06,5.0,E5,Roslindale,10.0,Ward 20,2001.0,R3,102 Fletcher St,2131.0,Address,58710.0,42.2908,-71.1394,Constituent Call,"(42.2908, -71.1394)"
607094,101001517302,08/10/2015 02:17:00 PM,08/17/2015 02:17:18 PM,08/20/2015 02:40:01 PM,OVERDUE,Closed,Case Closed. Closed date : 2015-08-20 14:40:01.33 Case Resolved cart was picked up,Recycling Cart Return,Public Works Department,Recycling,Recycling Cart Return,PWDx_IPL Damaged Cart Replacement,PWDx,,,69 Whitford St  Roslindale  MA  02131,12.0,06,5.0,E5,Roslindale,10.0,Ward 18,1809.0,R1,69 Whitford St,2131.0,Address,149372.0,42.2796,-71.1276,Constituent Call,"(42.2796, -71.1276)"
607549,101001517909,08/11/2015 09:03:53 AM,08/18/2015 09:03:53 AM,08/11/2015 09:03:58 AM,ONTIME,Closed,Case Closed. Closed date : 2015-08-11 09:03:58.72 Case Resolved Created Request for Recycling Bin,Recycling Cart Return,Public Works Department,Recycling,Recycling Cart Return,PWDx_IPL Damaged Cart Replacement,PWDx,https://cityworker.cityofboston.gov:8443/attachments/report/55c9f2c0d0521409991635c5/photo/Report.jpg,,5-7 Thornton St  Roxbury  MA  02119,7.0,10B,7.0,B2,Roxbury,13.0,Ward 9,905.0,R2,5-7 Thornton St,2119.0,Address,135864.0,42.3265,-71.0892,City Worker App,"(42.3265, -71.0892)"
608645,101001519325,08/12/2015 11:37:00 AM,08/19/2015 11:37:26 AM,09/24/2015 09:40:56 AM,OVERDUE,Closed,Case Closed. Closed date : 2015-09-24 09:40:56.16 Case Noted Cart was removed thank you.,Recycling Cart Return,Public Works Department,Recycling,Recycling Cart Return,PWDx_IPL Damaged Cart Replacement,PWDx,,https://cityworker.cityofboston.gov:8443/attachments/report/55cb68aed052094b3592581d/closed_photo/Report.jpg,164 Dorchester St  South Boston  MA  02127,6.0,05,2.0,C6,South Boston / South Boston Waterfront,5.0,Ward 7,704.0,R1,164 Dorchester St,2127.0,Address,48909.0,42.3339,-71.0486,Constituent Call,"(42.3339, -71.0486)"
608734,101001519440,08/12/2015 01:03:00 PM,08/19/2015 01:03:27 PM,08/27/2015 07:42:54 AM,OVERDUE,Closed,Case Closed. Closed date : 2015-08-27 07:42:54.513 Case Resolved no cart out 08/26/2015,Recycling Cart Return,Public Works Department,Recycling,Recycling Cart Return,PWDx_IPL Damaged Cart Replacement,PWDx,,,24 Auburn St  Charlestown  MA  02129,3.0,1A,1.0,A15,Charlestown,2.0,Ward 2,207.0,R2,24 Auburn St,2129.0,Address,6471.0,42.3811,-71.0694,Constituent Call,"(42.3811, -71.0694)"
609325,101001520186,08/13/2015 09:40:00 AM,08/20/2015 09:40:46 AM,08/27/2015 07:42:22 AM,OVERDUE,Closed,Case Closed. Closed date : 2015-08-27 07:42:22.943 Case Resolved broken carts picked up 08/26/2015,Recycling Cart Return,Public Works Department,Recycling,Recycling Cart Return,PWDx_IPL Damaged Cart Replacement,PWDx,,,170 Saint Alphonsus St  Mission Hill  MA  02120,9.0,10A,8.0,B2,Mission Hill,14.0,Ward 10,1003.0,R3,170 Saint Alphonsus St,2120.0,Address,120523.0,42.3315,-71.1021,Constituent Call,"(42.3315, -71.1021)"
610040,101001521072,08/14/2015 09:03:06 AM,08/21/2015 09:03:06 AM,08/14/2015 09:03:11 AM,ONTIME,Closed,Case Closed. Closed date : 2015-08-14 09:03:11.55 Case Resolved Created Request for Recycling Bin,Recycling Cart Return,Public Works Department,Recycling,Recycling Cart Return,PWDx_IPL Damaged Cart Replacement,PWDx,https://cityworker.cityofboston.gov:8443/attachments/report/55cde70bd052140999166d45/photo/Report.jpg,,INTERSECTION of Neponset Ave & Southwick St  Dorchester  MA,8.0,07,3.0,C11,Dorchester,7.0,Ward 16,1607.0,,INTERSECTION Neponset Ave & Southwick St,,Intersection,7517.0,42.2913,-71.0494,City Worker App,"(42.2913, -71.0494)"
610413,101001521525,08/14/2015 01:18:00 PM,08/21/2015 01:18:28 PM,09/23/2015 08:54:53 AM,OVERDUE,Closed,Case Closed Case Resolved  broken cart swapped new cart # 0515630523 09/23/2015,Recycling Cart Return,Public Works Department,Recycling,Recycling Cart Return,PWDx_IPL Damaged Cart Replacement,PWDx,,,37 Clearwater Dr  Mattapan  MA  02126,8.0,07,3.0,B3,Dorchester,7.0,Ward 17,1714.0,R1,37 Clearwater Dr,2126.0,Address,33719.0,42.275,-71.0758,Constituent Call,"(42.275, -71.0758)"
610414,101001521527,08/14/2015 01:20:00 PM,08/21/2015 01:20:05 PM,09/21/2015 03:19:48 PM,OVERDUE,Closed,Case Closed Duplicate of Existing Case  reference 101001521525 one per household,Recycling Cart Return,Public Works Department,Recycling,Recycling Cart Return,PWDx_IPL Damaged Cart Replacement,PWDx,,,37 Clearwater Dr  Mattapan  MA  02126,8.0,07,3.0,B3,Dorchester,7.0,Ward 17,1714.0,R1,37 Clearwater Dr,2126.0,Address,33719.0,42.275,-71.0758,Constituent Call,"(42.275, -71.0758)"
610512,101001521649,08/14/2015 03:13:00 PM,08/21/2015 03:13:30 PM,08/31/2015 02:45:11 PM,OVERDUE,Closed,Case Closed. Closed date : 2015-08-31 14:45:11.747 Case Resolved cart requested filled new cart #715671746 08/28/2015,Recycling Cart Return,Public Works Department,Recycling,Recycling Cart Return,PWDx_Recycling,PWDx,,,52-54 Houghton St  Dorchester  MA  02122,8.0,07,3.0,C11,Dorchester,7.0,Ward 16,1605.0,R2,52-54 Houghton St,2122.0,Address,75456.0,42.295,-71.0512,Constituent Call,"(42.295, -71.0512)"
612249,101001523944,08/18/2015 10:10:00 AM,08/25/2015 10:10:45 AM,09/28/2015 11:24:56 AM,OVERDUE,Closed,Case Closed. Closed date : 2015-09-28 11:24:56.903 Case Resolved recycle cart pick up on .9/28/15,Recycling Cart Return,Public Works Department,Recycling,Recycling Cart Return,PWDx_IPL Damaged Cart Replacement,PWDx,,https://cityworker.cityofboston.gov:8443/attachments/report/55d33d5ad052a1bf700f2d09/closed_photo/Report.jpg,1067 Centre St  Jamaica Plain  MA  02130,9.0,02,6.0,E13,Jamaica Plain,11.0,Ward 19,1902.0,R1,1067 Centre St,2130.0,Address,27517.0,42.3039,-71.1251,Constituent Call,"(42.3039, -71.1251)"
613720,101001525854,08/20/2015 07:35:55 AM,08/27/2015 08:30:00 AM,08/20/2015 07:36:03 AM,ONTIME,Closed,Case Closed. Closed date : 2015-08-20 07:36:03.837 Case Resolved Created Request for Recycling Bin,Recycling Cart Return,Public Works Department,Recycling,Recycling Cart Return,PWDx_IPL Damaged Cart Replacement,PWDx,https://cityworker.cityofboston.gov:8443/attachments/report/55d5bb9ad05203ad74b09e58/photo/Report.jpg,,10 Glenburne St  Dorchester  MA  02121,9.0,10B,7.0,B2,Roxbury,13.0,Ward 12,1206.0,R3,10 Glenburne St,2121.0,Address,64013.0,42.3156,-71.0825,City Worker App,"(42.3156, -71.0825)"
613858,101001526019,08/20/2015 09:48:00 AM,08/27/2015 09:48:02 AM,09/16/2015 01:47:10 PM,OVERDUE,Closed,Case Closed. Closed date : 2015-09-16 13:47:10.157 Case Noted During inspection there was nothing at this address for collection if you wish to have the Cart removed going forward please contact our office once again thank you.,Recycling Cart Return,Public Works Department,Recycling,Recycling Cart Return,PWDx_IPL Damaged Cart Replacement,PWDx,,,28 Morris St  East Boston  MA  02128,1.0,09,1.0,A7,East Boston,1.0,Ward 1,105.0,R3,28 Morris St,2128.0,Address,277568.0,42.3755,-71.0333,Constituent Call,"(42.3755, -71.0333)"
613981,101001526166,08/20/2015 11:20:00 AM,08/27/2015 11:20:17 AM,09/17/2015 11:41:32 AM,OVERDUE,Closed,Case Closed. Closed date : 2015-09-17 11:41:32.297 Case Noted Cart was removed thank you,Recycling Cart Return,Public Works Department,Recycling,Recycling Cart Return,PWDx_IPL Damaged Cart Replacement,PWDx,,,39 Emerson St  South Boston  MA  02127,6.0,05,2.0,C6,South Boston / South Boston Waterfront,5.0,Ward 6,604.0,R1,39 Emerson St,2127.0,Address,53666.0,42.3362,-71.0425,Constituent Call,"(42.3362, -71.0425)"
614389,101001526658,08/20/2015 05:27:00 PM,08/28/2015 08:30:00 AM,09/16/2015 12:55:17 PM,OVERDUE,Closed,Case Closed. Closed date : 2015-09-16 12:55:17.687 Case Noted During inspection at this address there was nothing out for removal. Please contact our office if you wish to make another request thank you.,Recycling Cart Return,Public Works Department,Recycling,Recycling Cart Return,PWDx_IPL Damaged Cart Replacement,PWDx,,,28 Pleasant St  Charlestown  MA  02129,3.0,1A,1.0,A15,Charlestown,2.0,Ward 2,203.0,CM,28 Pleasant St,2129.0,Address,111060.0,42.3748,-71.0626,Constituent Call,"(42.3748, -71.0626)"
614938,101001527338,08/21/2015 12:42:29 PM,08/28/2015 12:42:29 PM,08/21/2015 12:42:34 PM,ONTIME,Closed,Case Closed. Closed date : 2015-08-21 12:42:34.993 Case Resolved Created Request for Recycling Bin,Recycling Cart Return,Public Works Department,Recycling,Recycling Cart Return,PWDx_IPL Damaged Cart Replacement,PWDx,https://cityworker.cityofboston.gov:8443/attachments/report/55d754f0d052f8c25f1cf087/photo/Report.jpg,,INTERSECTION of Faraday St & Garfield Ave  Hyde Park  MA,,08,5.0,E18,Hyde Park,10.0,Ward 18,1817.0,,INTERSECTION Faraday St & Garfield Ave,,Intersection,4799.0,42.2418,-71.1214,City Worker App,"(42.2418, -71.1214)"
614959,101001527364,08/21/2015 01:02:00 PM,08/28/2015 01:02:39 PM,08/30/2015 02:48:28 PM,OVERDUE,Closed,Case Closed Duplicate of Existing Case  reference cart #101001527364,Recycling Cart Return,Public Works Department,Recycling,Recycling Cart Return,PWDx_Recycling,PWDx,,,98 Charles St  Boston  MA  02114,3.0,1B,8.0,A1,Back Bay,14.0,Ward 5,511.0,RC,98 Charles St,2114.0,Address,204970.0,42.3586,-71.0709,Constituent Call,"(42.3586, -71.0709)"
615794,101001528512,08/24/2015 08:50:09 AM,08/31/2015 08:50:18 AM,08/24/2015 08:50:24 AM,ONTIME,Closed,Case Closed. Closed date : 2015-08-24 08:50:24.417 Case Resolved Created Request for Recycling Bin,Recycling Cart Return,Public Works Department,Recycling,Recycling Cart Return,PWDx_IPL Damaged Cart Replacement,PWDx,https://cityworker.cityofboston.gov:8443/attachments/report/55db1307d052f8c25f1d019a/photo/Report.jpg,,944 VFW Pkwy  West Roxbury  MA  02132,12.0,06,6.0,E5,West Roxbury,12.0,Ward 20,2017.0,R1,944 VFW Pkwy,2132.0,Address,140425.0,42.2865,-71.1717,City Worker App,"(42.2865, -71.1717)"
615811,101001528539,08/24/2015 09:07:00 AM,08/31/2015 09:07:10 AM,09/21/2015 08:39:31 AM,OVERDUE,Closed,Case Closed. Closed date : 2015-09-21 08:39:31.3 Case Noted During inspection there was nothing at this address checked both locations front and back of the building.,Recycling Cart Return,Public Works Department,Recycling,Recycling Cart Return,PWDx_IPL Damaged Cart Replacement,PWDx,,,98 Charles St  Boston  MA  02114,3.0,1B,8.0,A1,Back Bay,14.0,Ward 5,511.0,RC,98 Charles St,2114.0,Address,204970.0,42.3586,-71.0709,Constituent Call,"(42.3586, -71.0709)"
618171,101001541617,08/27/2015 06:58:01 AM,09/03/2015 08:30:00 AM,08/27/2015 06:58:07 AM,ONTIME,Closed,Case Closed. Closed date : 2015-08-27 06:58:07.503 Case Resolved Created Request for Recycling Bin,Recycling Cart Return,Public Works Department,Recycling,Recycling Cart Return,PWDx_IPL Damaged Cart Replacement,PWDx,https://cityworker.cityofboston.gov:8443/attachments/report/55deed4ad052f8c25f1d3d8b/photo/Report.jpg,,34 Concord St  Charlestown  MA  02129,3.0,1A,1.0,A15,Charlestown,2.0,Ward 2,204.0,CM,34 Concord St,2129.0,Address,41742.0,42.3781,-71.0609,City Worker App,"(42.3781, -71.0609)"
618634,101001542258,08/27/2015 02:45:00 PM,09/03/2015 02:45:54 PM,10/02/2015 02:49:55 PM,OVERDUE,Closed,Case Closed. Closed date : 2015-10-02 14:49:55.673 Case Resolved no cart out 10/01/2015,Recycling Cart Return,Public Works Department,Recycling,Recycling Cart Return,PWDx_Recycling Cart Return,PWDx,,,24 Brainerd Rd  Allston  MA  02134,11.0,04,9.0,D14,Allston / Brighton,15.0,Ward 21,2105.0,R1,24 Brainerd Rd,2134.0,Address,19329.0,42.3486,-71.131,Employee Generated,"(42.3486, -71.131)"
618768,101001542436,08/27/2015 04:52:00 PM,09/03/2015 04:52:34 PM,09/24/2015 09:34:33 AM,OVERDUE,Closed,Case Closed. Closed date : 2015-09-24 09:34:33.273 Case Noted Cart removed from location by city inspector.,Recycling Cart Return,Public Works Department,Recycling,Recycling Cart Return,PWDx_IPL Damaged Cart Replacement,PWDx,,,8 Taft St  Dorchester  MA  02125,7.0,03,3.0,C11,Dorchester,7.0,Ward 13,1308.0,CM,8 Taft St,2125.0,Address,133615.0,42.317,-71.0572,Constituent Call,"(42.317, -71.0572)"
619612,101001543547,08/28/2015 08:18:00 PM,09/08/2015 08:30:00 AM,09/23/2015 02:43:55 PM,OVERDUE,Closed,Case Closed. Closed date : 2015-09-23 14:43:55.15 Case Noted Cart was removed thank you,Recycling Cart Return,Public Works Department,Recycling,Recycling Cart Return,PWDx_IPL Damaged Cart Replacement,PWDx,,,100 Chesbrough Rd  West Roxbury  MA  02132,12.0,06,6.0,E5,West Roxbury,12.0,Ward 20,2017.0,R1,100 Chesbrough Rd,2132.0,Address,30718.0,42.2831,-71.1688,Constituent Call,"(42.2831, -71.1688)"
620107,101001544304,08/30/2015 01:24:02 PM,09/08/2015 08:30:00 AM,08/30/2015 01:24:06 PM,ONTIME,Closed,Case Closed. Closed date : 2015-08-30 13:24:06.543 Case Resolved Created Request for Recycling Bin,Recycling Cart Return,Public Works Department,Recycling,Recycling Cart Return,PWDx_IPL Damaged Cart Replacement,PWDx,,,92 Foster St  Brighton  MA  02135,11.0,04,9.0,D14,Allston / Brighton,15.0,Ward 22,2209.0,CD,92 Foster St,2135.0,Address,59689.0,42.3477,-71.1572,City Worker App,"(42.3477, -71.1572)"
620745,101001545216,08/31/2015 12:53:00 PM,09/08/2015 12:53:28 PM,09/25/2015 08:30:15 AM,OVERDUE,Closed,Case Closed. Closed date : 2015-09-25 08:30:15.207 Case Noted No damaged cart out on 9/25/15. New cart at location already.,Recycling Cart Return,Public Works Department,Recycling,Recycling Cart Return,PWDx_IPL Damaged Cart Replacement,PWDx,,,88 Belle Ave  West Roxbury  MA  02132,12.0,06,6.0,E5,West Roxbury,12.0,20,2016.0,,88 Belle Ave,2132.0,Address,343940.0,42.3594,-71.0587,Constituent Call,"(0, 0)"
620747,101001545218,08/31/2015 12:54:00 PM,09/08/2015 12:54:32 PM,09/24/2015 08:51:27 AM,OVERDUE,Closed,Case Closed. Closed date : 2015-09-24 08:51:27.407 Case Noted Case already in the system for location.,Recycling Cart Return,Public Works Department,Recycling,Recycling Cart Return,PWDx_IPL Damaged Cart Replacement,PWDx,,,88 Belle Ave  West Roxbury  MA  02132,12.0,06,6.0,E5,West Roxbury,12.0,20,2016.0,,88 Belle Ave,2132.0,Address,343940.0,42.3594,-71.0587,Constituent Call,"(0, 0)"
621688,101001546634,09/01/2015 01:05:00 PM,09/09/2015 01:05:58 PM,10/06/2015 02:25:51 PM,OVERDUE,Closed,Case Closed Case Noted  nothing at this address on 10/6/15,Recycling Cart Return,Public Works Department,Recycling,Recycling Cart Return,PWDx_Recycling Cart Return,PWDx,,,13 Isabella St  Boston  MA  02116,4.0,1C,2.0,A1,Back Bay,6.0,Ward 5,501.0,E,13 Isabella St,2116.0,Address,79003.0,42.3488,-71.07,Constituent Call,"(42.3488, -71.07)"
622163,101001547270,09/01/2015 08:16:00 PM,09/10/2015 08:30:00 AM,09/29/2015 02:08:40 PM,OVERDUE,Closed,Case Closed. Closed date : 2015-09-29 14:08:40.117 Case Resolved No Cart out 09/29/2015,Recycling Cart Return,Public Works Department,Recycling,Recycling Cart Return,PWDx_Recycling Cart Return,PWDx,,,79 Montgomery St  Boston  MA  02116,4.0,1C,2.0,D4,South End,6.0,Ward 4,401.0,CM,79 Montgomery St,2116.0,Address,96709.0,42.3435,-71.075,Constituent Call,"(42.3435, -71.075)"
622325,101001547485,09/02/2015 08:43:00 AM,09/10/2015 08:43:10 AM,09/23/2015 08:49:43 AM,OVERDUE,Closed,Case Closed Case Resolved  no cart out with That IPL for Pick Up 09/23/2015,Recycling Cart Return,Public Works Department,Recycling,Recycling Cart Return,PWDx_Recycling,PWDx,,,102 Fletcher St  Roslindale  MA  02131,9.0,06,5.0,E5,Roslindale,10.0,Ward 20,2001.0,R3,102 Fletcher St,2131.0,Address,58710.0,42.2908,-71.1394,Constituent Call,"(42.2908, -71.1394)"
622432,101001547611,09/02/2015 09:46:20 AM,09/10/2015 09:46:20 AM,09/02/2015 09:46:25 AM,ONTIME,Closed,Case Closed. Closed date : 2015-09-02 09:46:25.913 Case Resolved Created Request for Recycling Bin,Recycling Cart Return,Public Works Department,Recycling,Recycling Cart Return,PWDx_IPL Damaged Cart Replacement,PWDx,https://cityworker.cityofboston.gov:8443/attachments/report/55e6fdd3d052f8c25f1dd3b0/photo/Report.jpg,,225 Fairmount Ave  Hyde Park  MA  02136,12.0,08,5.0,E18,Hyde Park,10.0,Ward 18,1816.0,R1,225 Fairmount Ave,2136.0,Address,55702.0,42.2501,-71.116,City Worker App,"(42.2501, -71.116)"
622657,101001547921,09/02/2015 11:21:00 AM,09/10/2015 11:21:18 AM,09/21/2015 10:21:11 AM,OVERDUE,Closed,Case Closed Duplicate of Existing Case  reference case #101001545216 and 101001545218,Recycling Cart Return,Public Works Department,Recycling,Recycling Cart Return,PWDx_IPL Damaged Cart Replacement,PWDx,,,88 Belle Ave  West Roxbury  MA  02132,12.0,06,6.0,E5,West Roxbury,12.0,20,2016.0,,88 Belle Ave,2132.0,Address,343940.0,42.3594,-71.0587,Constituent Call,"(0, 0)"
623551,101001549161,09/03/2015 11:30:00 AM,09/11/2015 11:30:10 AM,09/24/2015 10:43:52 AM,OVERDUE,Closed,Case Closed Case Resolved  This cart was removed and this case should have been closed out last week.,Recycling Cart Return,Public Works Department,Recycling,Recycling Cart Return,PWDx_Recycling,PWDx,,,94A Bartlett St  Charlestown  MA  02129,3.0,1A,1.0,A15,Charlestown,2.0,Ward 2,206.0,CM,94A Bartlett St,2129.0,Address,8500.0,42.3789,-71.0656,Constituent Call,"(42.3789, -71.0656)"
624087,101001569886,09/04/2015 08:06:02 AM,09/14/2015 08:30:00 AM,09/04/2015 08:06:10 AM,ONTIME,Closed,Case Closed. Closed date : 2015-09-04 08:06:10.73 Case Resolved Created Request for Recycling Bin,Recycling Cart Return,Public Works Department,Recycling,Recycling Cart Return,PWDx_IPL Damaged Cart Replacement,PWDx,https://cityworker.cityofboston.gov:8443/attachments/report/55e98954d052f8c25f1e0a78/photo/Report.jpg,,4371-4373 Washington St  Roslindale  MA  02131,12.0,06,5.0,E5,Roslindale,10.0,Ward 20,2002.0,R2,4371-4373 Washington St,2131.0,Address,145207.0,42.2825,-71.1326,City Worker App,"(42.2825, -71.1326)"
624211,101001570069,09/04/2015 09:57:47 AM,09/14/2015 09:57:47 AM,09/04/2015 09:57:52 AM,ONTIME,Closed,Case Closed. Closed date : 2015-09-04 09:57:52.18 Case Resolved Created Request for Recycling Bin,Recycling Cart Return,Public Works Department,Recycling,Recycling Cart Return,PWDx_IPL Damaged Cart Replacement,PWDx,https://cityworker.cityofboston.gov:8443/attachments/report/55e9a383d052f8c25f1e0fc3/photo/Report.jpg,,622 Warren St  Dorchester  MA  02121,9.0,10B,7.0,B2,Roxbury,13.0,Ward 12,1202.0,R2,622 Warren St,2121.0,Address,143322.0,42.3109,-71.0829,City Worker App,"(42.3109, -71.0829)"
624411,101001570386,09/04/2015 01:34:45 PM,09/14/2015 01:34:45 PM,09/04/2015 01:34:54 PM,ONTIME,Closed,Case Closed. Closed date : 2015-09-04 13:34:54.58 Case Resolved Created Request for Recycling Bin,Recycling Cart Return,Public Works Department,Recycling,Recycling Cart Return,PWDx_IPL Damaged Cart Replacement,PWDx,https://cityworker.cityofboston.gov:8443/attachments/report/55e9d660d052f8c25f1e191d/photo/Report.jpg,,191-193 Calumet St  Mission Hill  MA  02120,9.0,10A,8.0,B2,Mission Hill,14.0,Ward 10,1005.0,R2,191-193 Calumet St,2120.0,Address,24962.0,42.329,-71.1012,City Worker App,"(42.329, -71.1012)"
624454,101001570448,09/04/2015 02:42:00 PM,09/14/2015 02:42:48 PM,09/24/2015 09:06:56 AM,OVERDUE,Closed,Case Closed. Closed date : 2015-09-24 09:06:56.27 Case Invalid Address listed is not residential. Cart is not near 25 Bolton.,Recycling Cart Return,Public Works Department,Recycling,Recycling Cart Return,PWDx_Recycling,PWDx,,,25 Bolton St  South Boston  MA  02127,6.0,05,2.0,C6,South Boston / South Boston Waterfront,5.0,Ward 6,601.0,CL,25 Bolton St,2127.0,Address,16852.0,42.3423,-71.0535,Constituent Call,"(42.3423, -71.0535)"
624598,101001570630,09/04/2015 06:59:00 PM,09/15/2015 08:30:00 AM,09/25/2015 07:17:20 AM,OVERDUE,Closed,Case Closed Case Noted  Cart was removed,Recycling Cart Return,Public Works Department,Recycling,Recycling Cart Return,PWDx_Recycling Cart Return,PWDx,,,100 Chesbrough Rd  West Roxbury  MA  02132,12.0,06,6.0,E5,West Roxbury,12.0,Ward 20,2017.0,R1,100 Chesbrough Rd,2132.0,Address,30718.0,42.2831,-71.1688,Constituent Call,"(42.2831, -71.1688)"
625653,101001572101,09/08/2015 10:11:43 AM,09/15/2015 10:11:43 AM,09/08/2015 10:11:50 AM,ONTIME,Closed,Case Closed. Closed date : 2015-09-08 10:11:50.79 Case Resolved Created Request for Recycling Bin,Recycling Cart Return,Public Works Department,Recycling,Recycling Cart Return,PWDx_IPL Damaged Cart Replacement,PWDx,https://cityworker.cityofboston.gov:8443/attachments/report/55eeecdad052f8c25f1e3b48/photo/Report.jpg,,35-37 Newcastle Rd  Brighton  MA  02135,11.0,04,9.0,D14,Allston / Brighton,15.0,Ward 22,2210.0,R2,35-37 Newcastle Rd,2135.0,Address,102015.0,42.354,-71.1609,City Worker App,"(42.354, -71.1609)"
625782,101001572284,09/08/2015 11:32:34 AM,09/15/2015 11:32:34 AM,09/08/2015 02:25:12 PM,ONTIME,Closed,Case Closed Duplicate of Existing Case,Recycling Cart Return,Public Works Department,Recycling,Recycling Cart Return,PWDx_Recycling,PWDx,,,72 Georgia St  Dorchester  MA  02121,9.0,10B,7.0,B2,Roxbury,13.0,Ward 12,1202.0,R3,72 Georgia St,2121.0,Address,63492.0,42.3102,-71.0852,Constituent Call,"(42.3102, -71.0852)"
626701,101001573677,09/09/2015 11:58:00 AM,09/16/2015 11:58:46 AM,09/09/2015 12:15:02 PM,ONTIME,Closed,Case Closed. Closed date : 2015-09-09 12:15:02.93 Duplicate of Existing Case 101001573713,Recycling Cart Return,Public Works Department,Recycling,Recycling Cart Return,PWDx_Recycling,PWDx,,,72 Glendower Rd  Roslindale  MA  02131,12.0,06,5.0,E5,Roslindale,10.0,Ward 18,1810.0,CM,72 Glendower Rd,2131.0,Address,64279.0,42.2755,-71.1315,Constituent Call,"(42.2755, -71.1315)"
626732,101001573713,09/09/2015 12:11:00 PM,09/16/2015 12:11:38 PM,09/24/2015 09:04:39 AM,OVERDUE,Closed,Case Closed. Closed date : 2015-09-24 09:04:39.553 Case Resolved constituent called that she allset that cart was allready picked up 09/24/2015,Recycling Cart Return,Public Works Department,Recycling,Recycling Cart Return,PWDx_Recycling,PWDx,,,72 Glendower Rd  Roslindale  MA  02131,12.0,06,5.0,E5,Roslindale,10.0,Ward 18,1810.0,CD,72 Glendower Rd,2131.0,Address,64280.0,42.2755,-71.1315,Constituent Call,"(42.2755, -71.1315)"
628029,101001575629,09/11/2015 08:56:00 AM,09/18/2015 08:56:50 AM,09/23/2015 08:48:35 AM,OVERDUE,Closed,Case Closed Case Resolved  picked up 09/23/2015,Recycling Cart Return,Public Works Department,Recycling,Recycling Cart Return,PWDx_Recycling,PWDx,,,24 Ashfield St  Roslindale  MA  02131,9.0,06,5.0,E5,Roslindale,10.0,Ward 20,2004.0,R1,24 Ashfield St,2131.0,Address,5096.0,42.2902,-71.1311,Constituent Call,"(42.2902, -71.1311)"
628226,101001575927,09/11/2015 11:46:00 AM,09/18/2015 11:46:17 AM,10/02/2015 02:48:06 PM,OVERDUE,Closed,Case Closed. Closed date : 2015-10-02 14:48:06.55 Case Resolved cart swapped new cart # 0059453 10/02/2015,Recycling Cart Return,Public Works Department,Recycling,Recycling Cart Return,PWDx_Recycling Cart Return,PWDx,,,17-19 Greylock Rd  Allston  MA  02134,11.0,04,9.0,D14,Allston / Brighton,15.0,Ward 21,2107.0,R3,17-19 Greylock Rd,2134.0,Address,67209.0,42.3501,-71.1344,Employee Generated,"(42.3501, -71.1344)"
629371,101001577515,09/14/2015 09:24:48 AM,09/21/2015 09:24:48 AM,09/14/2015 09:24:53 AM,ONTIME,Closed,Case Closed. Closed date : 2015-09-14 09:24:53.2 Case Resolved Created Request for Recycling Bin,Recycling Cart Return,Public Works Department,Recycling,Recycling Cart Return,PWDx_IPL Damaged Cart Replacement,PWDx,https://cityworker.cityofboston.gov:8443/attachments/report/55f6caafd052f8c25f1e9614/photo/Report.jpg,,35 Riverview Rd  Brighton  MA  02135,11.0,04,9.0,D14,Allston / Brighton,15.0,Ward 22,2211.0,R2,35 Riverview Rd,2135.0,Address,300201.0,42.3569,-71.1604,City Worker App,"(42.3569, -71.1604)"
630208,101001578642,09/15/2015 09:14:16 AM,09/22/2015 09:14:16 AM,09/15/2015 09:14:24 AM,ONTIME,Closed,Case Closed. Closed date : 2015-09-15 09:14:24.567 Case Resolved Created Request for Recycling Bin,Recycling Cart Return,Public Works Department,Recycling,Recycling Cart Return,PWDx_IPL Damaged Cart Replacement,PWDx,https://cityworker.cityofboston.gov:8443/attachments/report/55f819bdd052f8c25f1ea838/photo/Report.jpg,,INTERSECTION of Melton Rd & Wallingford Rd  Brighton  MA,11.0,04,9.0,D14,Allston / Brighton,15.0,Ward 21,2113.0,,INTERSECTION Melton Rd & Wallingford Rd,,Intersection,7239.0,42.3432,-71.1509,City Worker App,"(42.3432, -71.1509)"
630404,101001578906,09/15/2015 10:50:24 AM,09/22/2015 10:50:24 AM,09/16/2015 09:50:40 AM,ONTIME,Closed,Case Closed Case Invalid,Recycling Cart Return,Public Works Department,Recycling,Recycling Cart Return,PWDx_Recycling,PWDx,,,1401 Dorchester Ave  Dorchester  MA  02122,7.0,03,3.0,C11,Dorchester,8.0,Ward 15,1509.0,R3,1401 Dorchester Ave,2122.0,Address,48306.0,42.3032,-71.0598,Constituent Call,"(42.3032, -71.0598)"
630405,101001578907,09/15/2015 10:50:52 AM,09/22/2015 10:50:52 AM,09/16/2015 09:50:28 AM,ONTIME,Closed,Case Closed Case Invalid,Recycling Cart Return,Public Works Department,Recycling,Recycling Cart Return,PWDx_Recycling,PWDx,,,1401 Dorchester Ave  Dorchester  MA  02122,7.0,03,3.0,C11,Dorchester,8.0,Ward 15,1509.0,R3,1401 Dorchester Ave,2122.0,Address,48306.0,42.3032,-71.0598,Constituent Call,"(42.3032, -71.0598)"
630426,101001578943,09/15/2015 11:12:00 AM,09/22/2015 11:12:35 AM,10/01/2015 10:38:53 AM,OVERDUE,Closed,Case Closed. Closed date : 2015-10-01 10:38:53.77 Duplicate of Existing Case,Recycling Cart Return,Public Works Department,Recycling,Recycling Cart Return,PWDx_Recycling Cart Return,PWDx,,,8 Matchett St  Brighton  MA  02135,11.0,04,9.0,D14,Allston / Brighton,15.0,Ward 22,2213.0,R2,8 Matchett St,2135.0,Address,92731.0,42.3527,-71.1717,Constituent Call,"(42.3527, -71.1717)"
631369,101001580321,09/16/2015 12:45:21 PM,09/23/2015 12:45:21 PM,09/16/2015 12:45:27 PM,ONTIME,Closed,Case Closed. Closed date : 2015-09-16 12:45:27.783 Case Resolved Created Request for Recycling Bin,Recycling Cart Return,Public Works Department,Recycling,Recycling Cart Return,PWDx_IPL Damaged Cart Replacement,PWDx,https://cityworker.cityofboston.gov:8443/attachments/report/55f99cbad052f8c25f1ec2ac/photo/Report.jpg,,21 Concord St  Charlestown  MA  02129,3.0,1A,1.0,A15,Charlestown,2.0,Ward 2,204.0,R1,21 Concord St,2129.0,Address,41729.0,42.3777,-71.0608,City Worker App,"(42.3777, -71.0608)"
631858,101001581024,09/17/2015 08:50:00 AM,09/24/2015 08:50:04 AM,09/24/2015 09:31:33 AM,OVERDUE,Closed,Case Closed. Closed date : 2015-09-24 09:31:33.67 Case Noted Broken cart collected and new cart dropped off on 9/23/15.,Recycling Cart Return,Public Works Department,Recycling,Recycling Cart Return,PWDx_IPL Damaged Cart Replacement,PWDx,,,5 Jamestown Ter  Mattapan  MA  02126,8.0,07,4.0,B3,Greater Mattapan,9.0,Ward 18,1801.0,R1,5 Jamestown Ter,2126.0,Address,79545.0,42.2723,-71.0882,Constituent Call,"(42.2723, -71.0882)"
633015,101001582746,09/18/2015 05:38:00 PM,09/28/2015 08:30:00 AM,09/24/2015 09:59:35 AM,ONTIME,Closed,Case Closed. Closed date : 2015-09-24 09:59:35.353 Case Noted Cart removed by city inspector on 9/24/15.,Recycling Cart Return,Public Works Department,Recycling,Recycling Cart Return,PWDx_IPL Damaged Cart Replacement,PWDx,,,38-40 Hatherly Rd  Brighton  MA  02135,11.0,04,9.0,D14,Allston / Brighton,15.0,Ward 22,2209.0,R2,38-40 Hatherly Rd,2135.0,Address,71221.0,42.3431,-71.1558,Constituent Call,"(42.3431, -71.1558)"
633946,101001584073,09/21/2015 11:39:00 AM,09/28/2015 11:39:28 AM,09/29/2015 11:39:24 AM,OVERDUE,Closed,Case Closed Duplicate of Existing Case,Recycling Cart Return,Public Works Department,Recycling,Recycling Cart Return,PWDx_Recycling Cart Return,PWDx,,,8 Matchett St  Brighton  MA  02135,11.0,04,9.0,D14,Allston / Brighton,15.0,Ward 22,2213.0,R2,8 Matchett St,2135.0,Address,92731.0,42.3527,-71.1717,Constituent Call,"(42.3527, -71.1717)"
634002,101001584154,09/21/2015 12:26:00 PM,09/28/2015 12:26:58 PM,09/24/2015 08:56:02 AM,ONTIME,Closed,Case Closed. Closed date : 2015-09-24 08:56:02.75 Case Resolved cart has been removed,Recycling Cart Return,Public Works Department,Recycling,Recycling Cart Return,PWDx_Recycling,PWDx,,,225 Bolton St  South Boston  MA  02127,6.0,05,2.0,C6,South Boston / South Boston Waterfront,5.0,Ward 6,603.0,R1,225 Bolton St,2127.0,Address,16842.0,42.3383,-71.0473,Constituent Call,"(42.3383, -71.0473)"
635240,101001585907,09/23/2015 09:32:19 AM,09/30/2015 09:32:19 AM,09/23/2015 09:32:27 AM,ONTIME,Closed,Case Closed. Closed date : 2015-09-23 09:32:27.69 Case Resolved Created Request for Recycling Bin,Recycling Cart Return,Public Works Department,Recycling,Recycling Cart Return,PWDx_IPL Damaged Cart Replacement,PWDx,https://cityworker.cityofboston.gov:8443/attachments/report/5602a9efd052f4d9a9fdf0e7/photo/Report.jpg,,581 E Eighth St  South Boston  MA  02127,6.0,05,2.0,C6,South Boston / South Boston Waterfront,5.0,Ward 7,702.0,R2,581 E Eighth St,2127.0,Address,52300.0,42.3313,-71.0384,City Worker App,"(42.3313, -71.0384)"
635311,101001586031,09/23/2015 10:51:15 AM,09/30/2015 10:51:15 AM,09/23/2015 10:51:22 AM,ONTIME,Closed,Case Closed. Closed date : 2015-09-23 10:51:22.777 Case Resolved Created Request for Recycling Bin,Recycling Cart Return,Public Works Department,Recycling,Recycling Cart Return,PWDx_IPL Damaged Cart Replacement,PWDx,https://cityworker.cityofboston.gov:8443/attachments/report/5602bc71d052f4d9a9fdf38e/photo/Report.jpg,,452-454 E Seventh St  South Boston  MA  02127,6.0,05,2.0,C6,South Boston / South Boston Waterfront,5.0,Ward 7,703.0,R3,452-454 E Seventh St,2127.0,Address,125295.0,42.3323,-71.043,City Worker App,"(42.3323, -71.043)"
635871,101001586831,09/24/2015 09:06:23 AM,10/01/2015 09:06:23 AM,09/24/2015 09:06:29 AM,ONTIME,Closed,Case Closed. Closed date : 2015-09-24 09:06:29.077 Case Resolved Created Request for Recycling Bin,Recycling Cart Return,Public Works Department,Recycling,Recycling Cart Return,PWDx_IPL Damaged Cart Replacement,PWDx,https://cityworker.cityofboston.gov:8443/attachments/report/5603f55fd052f4d9a9fe000b/photo/Report.jpg,,6-7 Hopkins Pl  Mattapan  MA  02126,8.0,07,4.0,B3,Greater Mattapan,9.0,Ward 18,1804.0,R1,6-7 Hopkins Pl,2126.0,Address,75268.0,42.2711,-71.0905,City Worker App,"(42.2711, -71.0905)"
635891,101001586860,09/24/2015 09:27:00 AM,10/01/2015 09:27:45 AM,09/29/2015 02:21:07 PM,ONTIME,Closed,Case Closed. Closed date : 2015-09-29 14:21:07.867 Case Resolved broken c art swapped new cart # 0515630201 09/29/2015,Recycling Cart Return,Public Works Department,Recycling,Recycling Cart Return,PWDx_Recycling Cart Return,PWDx,,,12 Ernest Ave  Hyde Park  MA  02136,12.0,08,5.0,E18,Hyde Park,10.0,Ward 18,1820.0,R1,12 Ernest Ave,2136.0,Address,54224.0,42.2418,-71.1433,Constituent Call,"(42.2418, -71.1433)"
635991,101001596992,09/24/2015 10:56:37 AM,10/01/2015 10:56:37 AM,09/24/2015 10:56:42 AM,ONTIME,Closed,Case Closed. Closed date : 2015-09-24 10:56:42.85 Case Resolved Created Request for Recycling Bin,Recycling Cart Return,Public Works Department,Recycling,Recycling Cart Return,PWDx_IPL Damaged Cart Replacement,PWDx,https://cityworker.cityofboston.gov:8443/attachments/report/56040f34d052f4d9a9fe04a9/photo/Report.jpg,,23 Dorchester St  South Boston  MA  02127,6.0,05,2.0,C6,South Boston / South Boston Waterfront,5.0,Ward 6,604.0,CD,23 Dorchester St,2127.0,Address,48569.0,42.3369,-71.0439,City Worker App,"(42.3369, -71.0439)"
636466,101001597679,09/25/2015 07:59:56 AM,10/02/2015 08:30:00 AM,09/25/2015 08:00:07 AM,ONTIME,Closed,Case Closed. Closed date : 2015-09-25 08:00:07.543 Case Resolved Created Request for Recycling Bin,Recycling Cart Return,Public Works Department,Recycling,Recycling Cart Return,PWDx_IPL Damaged Cart Replacement,PWDx,https://cityworker.cityofboston.gov:8443/attachments/report/5605373cd052f4d9a9fe0fde/photo/Report.jpg,,12 Hereford St  Boston  MA  02115,4.0,1C,8.0,D4,Back Bay,14.0,Ward 5,509.0,CM,12 Hereford St,2115.0,Address,72974.0,42.3513,-71.0867,City Worker App,"(42.3513, -71.0867)"
636469,101001597681,09/25/2015 08:01:23 AM,10/02/2015 08:30:00 AM,09/25/2015 08:01:29 AM,ONTIME,Closed,Case Closed. Closed date : 2015-09-25 08:01:29.473 Case Resolved Created Request for Recycling Bin,Recycling Cart Return,Public Works Department,Recycling,Recycling Cart Return,PWDx_IPL Damaged Cart Replacement,PWDx,https://cityworker.cityofboston.gov:8443/attachments/report/56053795d052f4d9a9fe0ff0/photo/Report.jpg,,12 Hereford St  Boston  MA  02115,4.0,1C,8.0,D4,Back Bay,14.0,Ward 5,509.0,CM,12 Hereford St,2115.0,Address,72974.0,42.3513,-71.0867,City Worker App,"(42.3513, -71.0867)"
636567,101001597849,09/25/2015 09:32:45 AM,10/02/2015 09:32:45 AM,09/25/2015 09:32:51 AM,ONTIME,Closed,Case Closed. Closed date : 2015-09-25 09:32:51.59 Case Resolved Created Request for Recycling Bin,Recycling Cart Return,Public Works Department,Recycling,Recycling Cart Return,PWDx_IPL Damaged Cart Replacement,PWDx,https://cityworker.cityofboston.gov:8443/attachments/report/56054cfdd052f4d9a9fe127f/photo/Report.jpg,,10 Westglow St  Dorchester  MA  02122,8.0,07,3.0,C11,Dorchester,7.0,Ward 16,1607.0,R1,10 Westglow St,2122.0,Address,148415.0,42.2891,-71.0551,City Worker App,"(42.2891, -71.0551)"
636602,101001597902,09/25/2015 10:02:59 AM,10/02/2015 10:02:59 AM,09/25/2015 10:03:05 AM,ONTIME,Closed,Case Closed. Closed date : 2015-09-25 10:03:05.237 Case Resolved Created Request for Recycling Bin,Recycling Cart Return,Public Works Department,Recycling,Recycling Cart Return,PWDx_IPL Damaged Cart Replacement,PWDx,https://cityworker.cityofboston.gov:8443/attachments/report/56055412d052f4d9a9fe1422/photo/Report.jpg,,837-839 Dorchester Ave  Dorchester  MA  02125,6.0,03,2.0,C6,Dorchester,5.0,Ward 7,709.0,R3,837-839 Dorchester Ave,2125.0,Address,48748.0,42.322,-71.057,City Worker App,"(42.322, -71.057)"
636605,101001597905,09/25/2015 10:04:31 AM,10/02/2015 10:04:31 AM,09/25/2015 10:04:36 AM,ONTIME,Closed,Case Closed. Closed date : 2015-09-25 10:04:36.857 Case Resolved Created Request for Recycling Bin,Recycling Cart Return,Public Works Department,Recycling,Recycling Cart Return,PWDx_IPL Damaged Cart Replacement,PWDx,https://cityworker.cityofboston.gov:8443/attachments/report/5605546dd052f4d9a9fe1441/photo/Report.jpg,,837-839 Dorchester Ave  Dorchester  MA  02125,6.0,03,2.0,C6,Dorchester,5.0,Ward 7,709.0,R3,837-839 Dorchester Ave,2125.0,Address,48748.0,42.322,-71.057,City Worker App,"(42.322, -71.057)"
636665,101001597997,09/25/2015 11:10:00 AM,10/02/2015 11:10:51 AM,09/30/2015 02:30:51 PM,ONTIME,Closed,Case Closed. Closed date : 2015-09-30 14:30:51.277 Case Resolved Constiturnt was looking for a smaller recycling cart and decided to keep the cart 09/30/2015,Recycling Cart Return,Public Works Department,Recycling,Recycling Cart Return,PWDx_Recycling Cart Return,PWDx,,,22 Cedar St  Charlestown  MA  02129,3.0,1A,1.0,A15,Charlestown,2.0,Ward 2,203.0,R1,22 Cedar St,2129.0,Address,26715.0,42.3768,-71.0621,Constituent Call,"(42.3768, -71.0621)"
636730,101001598090,09/25/2015 12:38:44 PM,10/02/2015 12:38:44 PM,09/25/2015 12:38:49 PM,ONTIME,Closed,Case Closed. Closed date : 2015-09-25 12:38:49.89 Case Resolved Created Request for Recycling Bin,Recycling Cart Return,Public Works Department,Recycling,Recycling Cart Return,PWDx_IPL Damaged Cart Replacement,PWDx,https://cityworker.cityofboston.gov:8443/attachments/report/56057895d052f4d9a9fe1ac7/photo/Report.jpg,,8 Spring Garden St  Dorchester  MA  02125,7.0,03,3.0,C11,Dorchester,7.0,Ward 13,1307.0,R3,8 Spring Garden St,2125.0,Address,129640.0,42.3186,-71.0531,City Worker App,"(42.3186, -71.0531)"
636740,101001598100,09/25/2015 12:41:55 PM,10/02/2015 12:41:55 PM,09/25/2015 12:42:02 PM,ONTIME,Closed,Case Closed. Closed date : 2015-09-25 12:42:02.187 Case Resolved Created Request for Recycling Bin,Recycling Cart Return,Public Works Department,Recycling,Recycling Cart Return,PWDx_IPL Damaged Cart Replacement,PWDx,https://cityworker.cityofboston.gov:8443/attachments/report/56057954d052f4d9a9fe1afc/photo/Report.jpg,,12 Spring Garden St  Dorchester  MA  02125,7.0,03,3.0,C11,Dorchester,7.0,Ward 13,1307.0,R2,12 Spring Garden St,2125.0,Address,159449.0,42.3185,-71.053,City Worker App,"(42.3185, -71.053)"
637122,101001598601,09/26/2015 11:07:00 AM,10/05/2015 08:30:00 AM,09/29/2015 07:52:24 AM,ONTIME,Closed,Case Closed. Closed date : 2015-09-29 07:52:24.34 Case Resolved cart picked up 09/29/2015,Recycling Cart Return,Public Works Department,Recycling,Recycling Cart Return,PWDx_Recycling Cart Return,PWDx,,,29 Phillips St  Boston  MA  02114,3.0,1B,8.0,A1,Beacon Hill,14.0,Ward 5,504.0,R4,29 Phillips St,2114.0,Address,110010.0,42.3604,-71.0676,Constituent Call,"(42.3604, -71.0676)"
637638,101001599320,09/28/2015 09:19:59 AM,10/05/2015 09:19:59 AM,09/28/2015 09:20:08 AM,ONTIME,Closed,Case Closed. Closed date : 2015-09-28 09:20:08.04 Case Resolved Created Request for Recycling Bin,Recycling Cart Return,Public Works Department,Recycling,Recycling Cart Return,PWDx_IPL Damaged Cart Replacement,PWDx,https://cityworker.cityofboston.gov:8443/attachments/report/56093e87d052f4d9a9fe2d6b/photo/Report.jpg,,54 Turner St  Brighton  MA  02135,11.0,04,9.0,D14,Allston / Brighton,15.0,Ward 22,2207.0,R3,54 Turner St,2135.0,Address,138627.0,42.351,-71.1623,City Worker App,"(42.351, -71.1623)"
637731,101001599465,09/28/2015 10:41:02 AM,10/05/2015 10:41:02 AM,09/28/2015 10:41:09 AM,ONTIME,Closed,Case Closed. Closed date : 2015-09-28 10:41:09.897 Case Resolved Created Request for Recycling Bin,Recycling Cart Return,Public Works Department,Recycling,Recycling Cart Return,PWDx_IPL Damaged Cart Replacement,PWDx,https://cityworker.cityofboston.gov:8443/attachments/report/56095187d052f4d9a9fe30bb/photo/Report.jpg,,29 Fort Ave  Roxbury  MA  02119,9.0,10B,7.0,B2,Roxbury,13.0,Ward 11,1101.0,R2,29 Fort Ave,2119.0,Address,236952.0,42.3258,-71.0943,City Worker App,"(42.3258, -71.0943)"
637743,101001599480,09/28/2015 10:48:33 AM,10/05/2015 10:48:33 AM,09/28/2015 10:48:40 AM,ONTIME,Closed,Case Closed. Closed date : 2015-09-28 10:48:40.473 Case Resolved Created Request for Recycling Bin,Recycling Cart Return,Public Works Department,Recycling,Recycling Cart Return,PWDx_IPL Damaged Cart Replacement,PWDx,https://cityworker.cityofboston.gov:8443/attachments/report/56095349d052f4d9a9fe3109/photo/Report.jpg,,163 Falcon St  East Boston  MA  02128,1.0,09,1.0,A7,East Boston,1.0,Ward 1,109.0,R3,163 Falcon St,2128.0,Address,233060.0,42.3818,-71.0322,City Worker App,"(42.3818, -71.0322)"
637749,101001599486,09/28/2015 10:52:51 AM,10/05/2015 10:52:51 AM,09/28/2015 10:52:56 AM,ONTIME,Closed,Case Closed. Closed date : 2015-09-28 10:52:56.56 Case Resolved Created Request for Recycling Bin,Recycling Cart Return,Public Works Department,Recycling,Recycling Cart Return,PWDx_IPL Damaged Cart Replacement,PWDx,https://cityworker.cityofboston.gov:8443/attachments/report/5609544fd052f4d9a9fe315b/photo/Report.jpg,,1 Fort Avenue Ter  Roxbury  MA  02119,9.0,10B,7.0,B2,Roxbury,13.0,Ward 11,1101.0,R1,1 Fort Avenue Ter,2119.0,Address,59578.0,42.3253,-71.094,City Worker App,"(42.3253, -71.094)"
637770,101001599518,09/28/2015 11:12:22 AM,10/05/2015 11:12:22 AM,09/28/2015 11:12:28 AM,ONTIME,Closed,Case Closed. Closed date : 2015-09-28 11:12:28.39 Case Resolved Created Request for Recycling Bin,Recycling Cart Return,Public Works Department,Recycling,Recycling Cart Return,PWDx_IPL Damaged Cart Replacement,PWDx,,,314 Centre St  Jamaica Plain  MA  02130,9.0,10A,6.0,E13,Jamaica Plain,11.0,Ward 10,1007.0,RC,314 Centre St,2130.0,Address,27969.0,42.3226,-71.104,City Worker App,"(42.3226, -71.104)"
637774,101001599524,09/28/2015 11:13:04 AM,10/05/2015 11:13:04 AM,09/28/2015 11:13:12 AM,ONTIME,Closed,Case Closed. Closed date : 2015-09-28 11:13:12.207 Case Resolved Created Request for Recycling Bin,Recycling Cart Return,Public Works Department,Recycling,Recycling Cart Return,PWDx_IPL Damaged Cart Replacement,PWDx,https://cityworker.cityofboston.gov:8443/attachments/report/5609590ad052f4d9a9fe3244/photo/Report.jpg,,27-33 Wilbert Rd  Dorchester  MA  02124,8.0,07,4.0,B3,Greater Mattapan,9.0,Ward 14,1409.0,A,27-33 Wilbert Rd,2124.0,Address,149650.0,42.2944,-71.0904,City Worker App,"(42.2944, -71.0904)"
637786,101001599549,09/28/2015 11:23:13 AM,10/05/2015 11:23:13 AM,09/28/2015 11:23:23 AM,ONTIME,Closed,Case Closed. Closed date : 2015-09-28 11:23:23.823 Case Resolved Created Request for Recycling Bin,Recycling Cart Return,Public Works Department,Recycling,Recycling Cart Return,PWDx_IPL Damaged Cart Replacement,PWDx,https://cityworker.cityofboston.gov:8443/attachments/report/56095b6bd052f4d9a9fe32e7/photo/Report.jpg,,INTERSECTION of Blue Hill Ave & Vesta Rd  Dorchester  MA,7.0,03,4.0,B3,Greater Mattapan,9.0,Ward 14,1409.0,,INTERSECTION Blue Hill Ave & Vesta Rd,,Intersection,1552.0,42.2966,-71.0873,City Worker App,"(42.2966, -71.0873)"
637788,101001599551,09/28/2015 11:23:25 AM,10/05/2015 11:23:25 AM,09/28/2015 11:23:33 AM,ONTIME,Closed,Case Closed. Closed date : 2015-09-28 11:23:33.79 Case Resolved Created Request for Recycling Bin,Recycling Cart Return,Public Works Department,Recycling,Recycling Cart Return,PWDx_IPL Damaged Cart Replacement,PWDx,https://cityworker.cityofboston.gov:8443/attachments/report/56095b6cd052f4d9a9fe32f7/photo/Report.jpg,,INTERSECTION of Blue Hill Ave & Vesta Rd  Dorchester  MA,7.0,03,4.0,B3,Greater Mattapan,9.0,Ward 14,1409.0,,INTERSECTION Blue Hill Ave & Vesta Rd,,Intersection,1552.0,42.2966,-71.0873,City Worker App,"(42.2966, -71.0873)"
637828,101001599617,09/28/2015 12:13:01 PM,10/05/2015 12:13:01 PM,09/28/2015 12:13:10 PM,ONTIME,Closed,Case Closed. Closed date : 2015-09-28 12:13:10.35 Case Resolved Created Request for Recycling Bin,Recycling Cart Return,Public Works Department,Recycling,Recycling Cart Return,PWDx_IPL Damaged Cart Replacement,PWDx,https://cityworker.cityofboston.gov:8443/attachments/report/56096718d052f4d9a9fe348e/photo/Report.jpg,,25 Wales St  Dorchester  MA  02124,7.0,03,4.0,B3,Greater Mattapan,8.0,Ward 14,1407.0,R2,25 Wales St,2124.0,Address,141568.0,42.2972,-71.0851,City Worker App,"(42.2972, -71.0851)"
637934,101001599772,09/28/2015 02:00:46 PM,10/05/2015 02:00:46 PM,09/28/2015 02:00:52 PM,ONTIME,Closed,Case Closed. Closed date : 2015-09-28 14:00:52.717 Case Resolved Created Request for Recycling Bin,Recycling Cart Return,Public Works Department,Recycling,Recycling Cart Return,PWDx_IPL Damaged Cart Replacement,PWDx,https://cityworker.cityofboston.gov:8443/attachments/report/5609805bd052f4d9a9fe38d3/photo/Report.jpg,,35 Hutchings St  Dorchester  MA  02121,9.0,10B,7.0,B2,Roxbury,13.0,Ward 12,1207.0,R1,35 Hutchings St,2121.0,Address,76907.0,42.3102,-71.0889,City Worker App,"(42.3102, -71.0889)"
637950,101001599796,09/28/2015 02:15:47 PM,10/05/2015 02:15:47 PM,09/28/2015 02:15:52 PM,ONTIME,Closed,Case Closed. Closed date : 2015-09-28 14:15:52.74 Case Resolved Created Request for Recycling Bin,Recycling Cart Return,Public Works Department,Recycling,Recycling Cart Return,PWDx_IPL Damaged Cart Replacement,PWDx,https://cityworker.cityofboston.gov:8443/attachments/report/560983ddd052f4d9a9fe38ff/photo/Report.jpg,,85 Fort Ave  Roxbury  MA  02119,9.0,10B,7.0,B2,Roxbury,13.0,Ward 11,1101.0,RL,85 Fort Ave,2119.0,Address,59567.0,42.3268,-71.0958,City Worker App,"(42.3268, -71.0958)"
638320,101001600287,09/29/2015 08:23:00 AM,10/06/2015 08:30:00 AM,10/07/2015 07:04:01 AM,OVERDUE,Closed,Case Closed Duplicate of Existing Case,Recycling Cart Return,Public Works Department,Recycling,Recycling Cart Return,PWDx_Recycling Cart Return,PWDx,,,109 F St  South Boston  MA  02127,6.0,05,2.0,C6,South Boston / South Boston Waterfront,5.0,Ward 7,704.0,CM,109 F St,2127.0,Address,55358.0,42.3359,-71.0486,Constituent Call,"(42.3359, -71.0486)"
638355,101001600346,09/29/2015 09:01:31 AM,10/06/2015 09:01:31 AM,09/29/2015 09:01:37 AM,ONTIME,Closed,Case Closed. Closed date : 2015-09-29 09:01:37.61 Case Resolved Created Request for Recycling Bin,Recycling Cart Return,Public Works Department,Recycling,Recycling Cart Return,PWDx_IPL Damaged Cart Replacement,PWDx,https://cityworker.cityofboston.gov:8443/attachments/report/560a8bbad052f4d9a9fe3e23/photo/Report.jpg,,396 Seaver St  Dorchester  MA  02121,7.0,03,4.0,B3,Roxbury,8.0,Ward 14,1406.0,R2,396 Seaver St,2121.0,Address,124189.0,42.3038,-71.0815,City Worker App,"(42.3038, -71.0815)"
638408,101001600421,09/29/2015 09:37:32 AM,10/06/2015 09:37:32 AM,09/29/2015 09:37:35 AM,ONTIME,Closed,Case Closed. Closed date : 2015-09-29 09:37:35.87 Case Resolved Created Request for Recycling Bin,Recycling Cart Return,Public Works Department,Recycling,Recycling Cart Return,PWDx_IPL Damaged Cart Replacement,PWDx,,,170-172 Calumet St  Mission Hill  MA  02120,9.0,10A,8.0,B2,Mission Hill,14.0,Ward 10,1005.0,R2,170-172 Calumet St,2120.0,Address,24951.0,42.3297,-71.1017,City Worker App,"(42.3297, -71.1017)"
638411,101001600426,09/29/2015 09:38:39 AM,10/06/2015 09:38:39 AM,09/29/2015 09:38:43 AM,ONTIME,Closed,Case Closed. Closed date : 2015-09-29 09:38:43.03 Case Resolved Created Request for Recycling Bin,Recycling Cart Return,Public Works Department,Recycling,Recycling Cart Return,PWDx_IPL Damaged Cart Replacement,PWDx,,,177 Calumet St  Mission Hill  MA  02120,9.0,10A,8.0,B2,Mission Hill,14.0,Ward 10,1005.0,R2,177 Calumet St,2120.0,Address,200611.0,42.3293,-71.1016,City Worker App,"(42.3293, -71.1016)"
638609,101001600700,09/29/2015 01:13:00 PM,10/06/2015 01:13:00 PM,09/29/2015 01:13:05 PM,ONTIME,Closed,Case Closed. Closed date : 2015-09-29 13:13:05.797 Case Resolved Created Request for Recycling Bin,Recycling Cart Return,Public Works Department,Recycling,Recycling Cart Return,PWDx_IPL Damaged Cart Replacement,PWDx,https://cityworker.cityofboston.gov:8443/attachments/report/560ac6a8d052f4d9a9fe480c/photo/Report.jpg,,7 Bowdoin Park  Dorchester  MA  02125,7.0,03,4.0,C11,Dorchester,8.0,Ward 15,1502.0,R2,7 Bowdoin Park,2125.0,Address,17457.0,42.3064,-71.0677,City Worker App,"(42.3064, -71.0677)"
639771,101001602320,10/01/2015 08:01:55 AM,10/08/2015 08:30:00 AM,10/01/2015 08:02:00 AM,ONTIME,Closed,Case Closed. Closed date : 2015-10-01 08:02:00.87 Case Resolved Created Request for Recycling Bin,Recycling Cart Return,Public Works Department,Recycling,Recycling Cart Return,PWDx_IPL Damaged Cart Replacement,PWDx,https://cityworker.cityofboston.gov:8443/attachments/report/560d20c9d052f4d9a9fe647c/photo/Report.jpg,,15 Radford Ln  Dorchester  MA  02124,8.0,07,3.0,C11,Dorchester,7.0,Ward 16,1608.0,R2,15 Radford Ln,2124.0,Address,114403.0,42.2841,-71.0618,City Worker App,"(42.2841, -71.0618)"
639956,101001602637,10/01/2015 11:11:23 AM,10/08/2015 11:11:23 AM,10/01/2015 11:11:32 AM,ONTIME,Closed,Case Closed. Closed date : 2015-10-01 11:11:32.773 Case Resolved Created Request for Recycling Bin,Recycling Cart Return,Public Works Department,Recycling,Recycling Cart Return,PWDx_IPL Damaged Cart Replacement,PWDx,https://cityworker.cityofboston.gov:8443/attachments/report/560d4d2cd052f4d9a9fe6bc8/photo/Report.jpg,,22 Delmont St  Dorchester  MA  02122,8.0,07,3.0,C11,Dorchester,7.0,16,1609.0,R3,22 Delmont St,2122.0,Address,172233.0,42.2862,-71.0539,City Worker App,"(42.2862, -71.0539)"
640061,101001602808,10/01/2015 02:00:50 PM,10/08/2015 02:00:50 PM,10/01/2015 02:00:56 PM,ONTIME,Closed,Case Closed. Closed date : 2015-10-01 14:00:56.633 Case Resolved Created Request for Recycling Bin,Recycling Cart Return,Public Works Department,Recycling,Recycling Cart Return,PWDx_IPL Damaged Cart Replacement,PWDx,https://cityworker.cityofboston.gov:8443/attachments/report/560d74e5d052f4d9a9fe722e/photo/Report.jpg,,43 Hutchings St  Dorchester  MA  02121,9.0,10B,7.0,B2,Roxbury,13.0,Ward 12,1207.0,R2,43 Hutchings St,2121.0,Address,76915.0,42.3106,-71.0894,City Worker App,"(42.3106, -71.0894)"
640326,101001603247,10/02/2015 08:32:38 AM,10/09/2015 08:32:38 AM,10/02/2015 08:32:43 AM,ONTIME,Closed,Case Closed. Closed date : 2015-10-02 08:32:43.683 Case Resolved Created Request for Recycling Bin,Recycling Cart Return,Public Works Department,Recycling,Recycling Cart Return,PWDx_IPL Damaged Cart Replacement,PWDx,https://cityworker.cityofboston.gov:8443/attachments/report/560e797cd052f4d9a9fe77b2/photo/Report.jpg,,285 E St  South Boston  MA  02127,6.0,05,2.0,C6,South Boston / South Boston Waterfront,5.0,Ward 6,603.0,CM,285 E St,2127.0,Address,50591.0,42.3366,-71.0505,City Worker App,"(42.3366, -71.0505)"
640361,101001603294,10/02/2015 08:58:42 AM,10/09/2015 08:58:42 AM,10/02/2015 08:58:46 AM,ONTIME,Closed,Case Closed. Closed date : 2015-10-02 08:58:46.12 Case Resolved Created Request for Recycling Bin,Recycling Cart Return,Public Works Department,Recycling,Recycling Cart Return,PWDx_IPL Damaged Cart Replacement,PWDx,,,INTERSECTION of D St & Silver St  South Boston  MA,6.0,05,2.0,C6,South Boston / South Boston Waterfront,5.0,Ward 6,602.0,,INTERSECTION D St & Silver St,,Intersection,3810.0,42.3384,-71.0513,City Worker App,"(42.3384, -71.0513)"
640467,101001603470,10/02/2015 10:56:32 AM,10/09/2015 10:56:32 AM,10/02/2015 10:56:36 AM,ONTIME,Closed,Case Closed. Closed date : 2015-10-02 10:56:36.107 Case Resolved Created Request for Recycling Bin,Recycling Cart Return,Public Works Department,Recycling,Recycling Cart Return,PWDx_IPL Damaged Cart Replacement,PWDx,,,358-360 Hanover St  Boston  MA  02113,3.0,1B,1.0,A1,Downtown / Financial District,3.0,Ward 3,301.0,C,358-360 Hanover St,2113.0,Address,69121.0,42.3653,-71.0533,City Worker App,"(42.3653, -71.0533)"
640538,101001603592,10/02/2015 12:51:20 PM,10/09/2015 12:51:20 PM,10/02/2015 12:51:25 PM,ONTIME,Closed,Case Closed. Closed date : 2015-10-02 12:51:25.453 Case Resolved Created Request for Recycling Bin,Recycling Cart Return,Public Works Department,Recycling,Recycling Cart Return,PWDx_IPL Damaged Cart Replacement,PWDx,https://cityworker.cityofboston.gov:8443/attachments/report/560eb61dd052f4d9a9fe7de6/photo/Report.jpg,,7 Germania St  Jamaica Plain  MA  02130,9.0,02,6.0,E13,Jamaica Plain,11.0,Ward 11,1106.0,R2,7 Germania St,2130.0,Address,63550.0,42.314,-71.1018,City Worker App,"(42.314, -71.1018)"
640553,101001603616,10/02/2015 01:11:54 PM,10/09/2015 01:11:53 PM,10/02/2015 01:11:57 PM,ONTIME,Closed,Case Closed. Closed date : 2015-10-02 13:11:57.643 Case Resolved Created Request for Recycling Bin,Recycling Cart Return,Public Works Department,Recycling,Recycling Cart Return,PWDx_IPL Damaged Cart Replacement,PWDx,,,INTERSECTION of Albany St & Randolph St  Roxbury  MA,4.0,1C,2.0,D4,South End,4.0,Ward 3,307.0,,INTERSECTION Albany St & Randolph St,,Intersection,212.0,42.341,-71.0635,City Worker App,"(42.341, -71.0635)"
640573,101001603639,10/02/2015 01:41:28 PM,10/09/2015 01:41:28 PM,10/02/2015 01:41:34 PM,ONTIME,Closed,Case Closed. Closed date : 2015-10-02 13:41:34.02 Case Resolved Created Request for Recycling Bin,Recycling Cart Return,Public Works Department,Recycling,Recycling Cart Return,PWDx_IPL Damaged Cart Replacement,PWDx,https://cityworker.cityofboston.gov:8443/attachments/report/560ec1e0d052f4d9a9fe7f11/photo/Report.jpg,,164 Leyden St  East Boston  MA  02128,1.0,09,1.0,A7,East Boston,1.0,Ward 1,113.0,R1,164 Leyden St,2128.0,Address,264371.0,42.389,-71.0055,City Worker App,"(42.389, -71.0055)"
640575,101001603641,10/02/2015 01:41:35 PM,10/09/2015 01:41:35 PM,10/02/2015 01:41:40 PM,ONTIME,Closed,Case Closed. Closed date : 2015-10-02 13:41:40.943 Case Resolved Created Request for Recycling Bin,Recycling Cart Return,Public Works Department,Recycling,Recycling Cart Return,PWDx_IPL Damaged Cart Replacement,PWDx,https://cityworker.cityofboston.gov:8443/attachments/report/560ec1e2d052f4d9a9fe7f21/photo/Report.jpg,,164 Leyden St  East Boston  MA  02128,1.0,09,1.0,A7,East Boston,1.0,Ward 1,113.0,R1,164 Leyden St,2128.0,Address,264371.0,42.389,-71.0055,City Worker App,"(42.389, -71.0055)"
640581,101001603647,10/02/2015 01:44:27 PM,10/09/2015 01:44:27 PM,10/02/2015 01:44:31 PM,ONTIME,Closed,Case Closed. Closed date : 2015-10-02 13:44:31.603 Case Resolved Created Request for Recycling Bin,Recycling Cart Return,Public Works Department,Recycling,Recycling Cart Return,PWDx_IPL Damaged Cart Replacement,PWDx,,,36 Ashley St  East Boston  MA  02128,1.0,09,1.0,A7,East Boston,1.0,Ward 1,113.0,CM,36 Ashley St,2128.0,Address,5260.0,42.3879,-71.0058,City Worker App,"(42.3879, -71.0058)"
640624,101001603718,10/02/2015 02:54:28 PM,10/09/2015 02:54:28 PM,10/02/2015 02:54:31 PM,ONTIME,Closed,Case Closed. Closed date : 2015-10-02 14:54:31.697 Case Resolved Created Request for Recycling Bin,Recycling Cart Return,Public Works Department,Recycling,Recycling Cart Return,PWDx_IPL Damaged Cart Replacement,PWDx,,,31 Bowdoin St  Boston  MA  02114,3.0,1B,1.0,A1,Beacon Hill,3.0,Ward 3,306.0,CM,31 Bowdoin St,2114.0,Address,17603.0,42.3603,-71.0631,City Worker App,"(42.3603, -71.0631)"
640629,101001603727,10/02/2015 03:02:49 PM,10/09/2015 03:02:49 PM,10/02/2015 03:02:54 PM,ONTIME,Closed,Case Closed. Closed date : 2015-10-02 15:02:54.193 Case Resolved Created Request for Recycling Bin,Recycling Cart Return,Public Works Department,Recycling,Recycling Cart Return,PWDx_IPL Damaged Cart Replacement,PWDx,https://cityworker.cityofboston.gov:8443/attachments/report/560ed4f0d052f4d9a9fe807c/photo/Report.jpg,,1 City Hall Plz  Boston  MA  02108,3.0,1B,1.0,A1,Downtown / Financial District,3.0,Ward 3,306.0,E,1 City Hall Plz,2108.0,Address,340817.0,42.3601,-71.0579,City Worker App,"(42.3601, -71.0579)"
640971,101001604182,10/03/2015 05:30:00 PM,10/13/2015 08:30:00 AM,10/05/2015 01:07:23 PM,ONTIME,Closed,Case Closed Case Noted  Cart #R9#001544 was removed today thank you,Recycling Cart Return,Public Works Department,Recycling,Recycling Cart Return,PWDx_Recycling Cart Return,PWDx,,,50-52 Hall St  Jamaica Plain  MA  02130,9.0,02,6.0,E13,Jamaica Plain,11.0,Ward 11,1110.0,CM,50-52 Hall St,2130.0,Address,68157.0,42.305,-71.1127,Constituent Call,"(42.305, -71.1127)"
641066,101001604310,10/04/2015 09:10:13 AM,10/13/2015 08:30:00 AM,10/22/2015 10:22:37 AM,OVERDUE,Closed,Case Closed. Closed date : 2015-10-22 10:22:37.22 Case Resolved broken cart swapped new cart # 0614402092 and 0415302619 10/21/2015,Recycling Cart Return,Public Works Department,Recycling,Recycling Cart Return,PWDx_Recycling Cart Return,PWDx,,,26 Everett St  Jamaica Plain  MA  02130,9.0,02,6.0,E13,Jamaica Plain,11.0,Ward 19,1906.0,CM,26 Everett St,2130.0,Address,55205.0,42.3091,-71.1088,Constituent Call,"(42.3091, -71.1088)"
641068,101001604313,10/04/2015 09:11:00 AM,10/13/2015 08:30:00 AM,10/07/2015 07:27:01 AM,ONTIME,Closed,Case Closed Duplicate of Existing Case,Recycling Cart Return,Public Works Department,Recycling,Recycling Cart Return,PWDx_Recycling Cart Return,PWDx,,,26 Everett St  Jamaica Plain  MA  02130,9.0,02,6.0,E13,Jamaica Plain,11.0,Ward 19,1906.0,CM,26 Everett St,2130.0,Address,55205.0,42.3091,-71.1088,Constituent Call,"(42.3091, -71.1088)"
641688,101001605252,10/05/2015 02:38:08 PM,10/13/2015 02:38:08 PM,10/05/2015 02:38:14 PM,ONTIME,Closed,Case Closed. Closed date : 2015-10-05 14:38:14.87 Case Resolved Created Request for Recycling Bin,Recycling Cart Return,Public Works Department,Recycling,Recycling Cart Return,PWDx_IPL Damaged Cart Replacement,PWDx,https://cityworker.cityofboston.gov:8443/attachments/report/5612c3b3d052f4d9a9fe994d/photo/Report.jpg,,146 Cedar St  Roxbury  MA  02119,9.0,10B,7.0,B2,Roxbury,13.0,Ward 11,1101.0,R2,146 Cedar St,2119.0,Address,202694.0,42.3273,-71.0952,City Worker App,"(42.3273, -71.0952)"
642075,101001605797,10/06/2015 09:48:51 AM,10/14/2015 09:48:51 AM,10/06/2015 09:48:56 AM,ONTIME,Closed,Case Closed. Closed date : 2015-10-06 09:48:56.733 Case Resolved Created Request for Recycling Bin,Recycling Cart Return,Public Works Department,Recycling,Recycling Cart Return,PWDx_IPL Damaged Cart Replacement,PWDx,https://cityworker.cityofboston.gov:8443/attachments/report/5613d166d052f4d9a9fe9e02/photo/Report.jpg,,713-725 E Seventh St  South Boston  MA  02127,6.0,05,2.0,C6,South Boston / South Boston Waterfront,5.0,Ward 7,701.0,,713-725 E Seventh St,2127.0,Address,340717.0,42.3322,-71.0316,City Worker App,"(42.3322, -71.0316)"
642084,101001605807,10/06/2015 09:55:41 AM,10/14/2015 09:55:41 AM,10/06/2015 09:55:50 AM,ONTIME,Closed,Case Closed. Closed date : 2015-10-06 09:55:50.02 Case Resolved Created Request for Recycling Bin,Recycling Cart Return,Public Works Department,Recycling,Recycling Cart Return,PWDx_IPL Damaged Cart Replacement,PWDx,https://cityworker.cityofboston.gov:8443/attachments/report/5613d302d052f4d9a9fe9e4c/photo/Report.jpg,,81 Farragut Rd  South Boston  MA  02127,6.0,05,2.0,C6,South Boston / South Boston Waterfront,5.0,Ward 6,609.0,R3,81 Farragut Rd,2127.0,Address,56551.0,42.3353,-71.0254,City Worker App,"(42.3353, -71.0254)"
642143,101001605891,10/06/2015 10:45:48 AM,10/14/2015 10:45:48 AM,10/06/2015 10:45:53 AM,ONTIME,Closed,Case Closed. Closed date : 2015-10-06 10:45:53.903 Case Resolved Created Request for Recycling Bin,Recycling Cart Return,Public Works Department,Recycling,Recycling Cart Return,PWDx_IPL Damaged Cart Replacement,PWDx,https://cityworker.cityofboston.gov:8443/attachments/report/5613debfd052f4d9a9fea02a/photo/Report.jpg,,144 M St  South Boston  MA  02127,6.0,05,2.0,C6,South Boston / South Boston Waterfront,5.0,Ward 6,608.0,R2,144 M St,2127.0,Address,88007.0,42.3331,-71.0331,City Worker App,"(42.3331, -71.0331)"
642148,101001605896,10/06/2015 10:48:10 AM,10/14/2015 10:48:10 AM,10/06/2015 10:48:16 AM,ONTIME,Closed,Case Closed. Closed date : 2015-10-06 10:48:16.33 Case Resolved Created Request for Recycling Bin,Recycling Cart Return,Public Works Department,Recycling,Recycling Cart Return,PWDx_IPL Damaged Cart Replacement,PWDx,https://cityworker.cityofboston.gov:8443/attachments/report/5613df51d052f4d9a9fea04a/photo/Report.jpg,,INTERSECTION of Monks St & E Sixth St  South Boston  MA,6.0,05,2.0,C6,South Boston / South Boston Waterfront,5.0,Ward 6,608.0,,INTERSECTION Monks St & E Sixth St,,Intersection,7361.0,42.3332,-71.0326,City Worker App,"(42.3332, -71.0326)"
642157,101001605912,10/06/2015 10:55:57 AM,10/14/2015 10:55:56 AM,10/06/2015 10:56:02 AM,ONTIME,Closed,Case Closed. Closed date : 2015-10-06 10:56:02.553 Case Resolved Created Request for Recycling Bin,Recycling Cart Return,Public Works Department,Recycling,Recycling Cart Return,PWDx_IPL Damaged Cart Replacement,PWDx,https://cityworker.cityofboston.gov:8443/attachments/report/5613e120d052f4d9a9fea0b0/photo/Report.jpg,,43 Mount Bowdoin Ter  Dorchester  MA  02121,7.0,03,4.0,C11,Dorchester,8.0,Ward 14,1404.0,R2,43 Mount Bowdoin Ter,2121.0,Address,98099.0,42.3029,-71.0751,City Worker App,"(42.3029, -71.0751)"
642159,101001605919,10/06/2015 10:57:59 AM,10/14/2015 10:57:59 AM,10/06/2015 10:58:04 AM,ONTIME,Closed,Case Closed. Closed date : 2015-10-06 10:58:04.783 Case Resolved Created Request for Recycling Bin,Recycling Cart Return,Public Works Department,Recycling,Recycling Cart Return,PWDx_IPL Damaged Cart Replacement,PWDx,https://cityworker.cityofboston.gov:8443/attachments/report/5613e19dd052f4d9a9fea0e4/photo/Report.jpg,,43 Mount Bowdoin Ter  Dorchester  MA  02121,7.0,03,4.0,C11,Dorchester,8.0,Ward 14,1404.0,R2,43 Mount Bowdoin Ter,2121.0,Address,98099.0,42.3029,-71.0751,City Worker App,"(42.3029, -71.0751)"
642165,101001605930,10/06/2015 11:07:53 AM,10/14/2015 11:07:53 AM,10/06/2015 11:08:00 AM,ONTIME,Closed,Case Closed. Closed date : 2015-10-06 11:08:00.61 Case Resolved Created Request for Recycling Bin,Recycling Cart Return,Public Works Department,Recycling,Recycling Cart Return,PWDx_IPL Damaged Cart Replacement,PWDx,https://cityworker.cityofboston.gov:8443/attachments/report/5613e3ecd052f4d9a9fea107/photo/Report.jpg,,97 Rosseter St  Dorchester  MA  02121,7.0,03,4.0,C11,Dorchester,8.0,Ward 14,1404.0,R2,97 Rosseter St,2121.0,Address,118800.0,42.3028,-71.0738,City Worker App,"(42.3028, -71.0738)"
642202,101001605993,10/06/2015 12:02:21 PM,10/14/2015 12:02:21 PM,10/06/2015 12:02:26 PM,ONTIME,Closed,Case Closed. Closed date : 2015-10-06 12:02:26.353 Case Resolved Created Request for Recycling Bin,Recycling Cart Return,Public Works Department,Recycling,Recycling Cart Return,PWDx_IPL Damaged Cart Replacement,PWDx,https://cityworker.cityofboston.gov:8443/attachments/report/5613f0b0d052f4d9a9fea1ee/photo/Report.jpg,,429 Centre St  Jamaica Plain  MA  02130,9.0,02,6.0,E13,Jamaica Plain,11.0,Ward 19,1903.0,C,429 Centre St,2130.0,Address,28041.0,42.3209,-71.111,City Worker App,"(42.3209, -71.111)"
642252,101001606069,10/06/2015 12:46:00 PM,10/14/2015 12:46:06 PM,10/19/2015 03:10:08 PM,OVERDUE,Closed,Case Closed Case Noted  cart was removed,Recycling Cart Return,Public Works Department,Recycling,Recycling Cart Return,PWDx_Recycling Cart Return,PWDx,,,109 F St  South Boston  MA  02127,6.0,05,2.0,C6,South Boston / South Boston Waterfront,5.0,Ward 7,704.0,CM,109 F St,2127.0,Address,55358.0,42.3359,-71.0486,Constituent Call,"(42.3359, -71.0486)"
642258,101001606077,10/06/2015 12:53:25 PM,10/14/2015 12:53:24 PM,10/06/2015 12:53:30 PM,ONTIME,Closed,Case Closed. Closed date : 2015-10-06 12:53:30.513 Case Resolved Created Request for Recycling Bin,Recycling Cart Return,Public Works Department,Recycling,Recycling Cart Return,PWDx_IPL Damaged Cart Replacement,PWDx,https://cityworker.cityofboston.gov:8443/attachments/report/5613fca8d052f4d9a9fea404/photo/Report.jpg,,27 Ashmont St  Dorchester  MA  02124,8.0,07,4.0,C11,Dorchester,8.0,Ward 17,1709.0,R2,27 Ashmont St,2124.0,Address,5372.0,42.285,-71.0689,City Worker App,"(42.285, -71.0689)"
642261,101001606082,10/06/2015 12:55:47 PM,10/14/2015 12:55:47 PM,10/06/2015 12:55:53 PM,ONTIME,Closed,Case Closed. Closed date : 2015-10-06 12:55:53.017 Case Resolved Created Request for Recycling Bin,Recycling Cart Return,Public Works Department,Recycling,Recycling Cart Return,PWDx_IPL Damaged Cart Replacement,PWDx,https://cityworker.cityofboston.gov:8443/attachments/report/5613fd36d052f4d9a9fea423/photo/Report.jpg,,98 Ashmont St  Dorchester  MA  02124,8.0,07,4.0,C11,Dorchester,8.0,Ward 17,1709.0,R1,98 Ashmont St,2124.0,Address,5533.0,42.2854,-71.0674,City Worker App,"(42.2854, -71.0674)"
642271,101001606093,10/06/2015 01:00:48 PM,10/14/2015 01:00:48 PM,10/06/2015 01:00:53 PM,ONTIME,Closed,Case Closed. Closed date : 2015-10-06 13:00:53.64 Case Resolved Created Request for Recycling Bin,Recycling Cart Return,Public Works Department,Recycling,Recycling Cart Return,PWDx_IPL Damaged Cart Replacement,PWDx,https://cityworker.cityofboston.gov:8443/attachments/report/5613fe65d052f4d9a9fea459/photo/Report.jpg,,26 Wheatland Ave  Dorchester  MA  02124,8.0,07,4.0,B3,Dorchester,9.0,Ward 17,1703.0,R2,26 Wheatland Ave,2124.0,Address,336092.0,42.2934,-71.0731,City Worker App,"(42.2934, -71.0731)"
642684,101001606724,10/07/2015 08:28:32 AM,10/15/2015 08:30:00 AM,10/07/2015 08:28:38 AM,ONTIME,Closed,Case Closed. Closed date : 2015-10-07 08:28:38.04 Case Resolved Created Request for Recycling Bin,Recycling Cart Return,Public Works Department,Recycling,Recycling Cart Return,PWDx_IPL Damaged Cart Replacement,PWDx,https://cityworker.cityofboston.gov:8443/attachments/report/56151017d052f4d9a9feac8e/photo/Report.jpg,,16 Huckins St  Roxbury  MA  02119,7.0,03,7.0,B2,Roxbury,13.0,Ward 8,805.0,EA,16 Huckins St,2119.0,Address,75832.0,42.3238,-71.0751,City Worker App,"(42.3238, -71.0751)"
642693,101001606739,10/07/2015 08:38:01 AM,10/15/2015 08:38:01 AM,10/07/2015 08:38:06 AM,ONTIME,Closed,Case Closed. Closed date : 2015-10-07 08:38:06.653 Case Resolved Created Request for Recycling Bin,Recycling Cart Return,Public Works Department,Recycling,Recycling Cart Return,PWDx_IPL Damaged Cart Replacement,PWDx,https://cityworker.cityofboston.gov:8443/attachments/report/56151250d052f4d9a9feacc2/photo/Report.jpg,,364 Bunker Hill St  Charlestown  MA  02129,3.0,1A,1.0,A15,Charlestown,2.0,Ward 2,206.0,R4,364 Bunker Hill St,2129.0,Address,23610.0,42.3817,-71.0685,City Worker App,"(42.3817, -71.0685)"
642699,101001606748,10/07/2015 08:43:59 AM,10/15/2015 08:43:58 AM,10/07/2015 08:44:04 AM,ONTIME,Closed,Case Closed. Closed date : 2015-10-07 08:44:04.453 Case Resolved Created Request for Recycling Bin,Recycling Cart Return,Public Works Department,Recycling,Recycling Cart Return,PWDx_IPL Damaged Cart Replacement,PWDx,https://cityworker.cityofboston.gov:8443/attachments/report/561513b3d052f4d9a9fead08/photo/Report.jpg,,379 Bunker Hill St  Charlestown  MA  02129,3.0,1A,1.0,A15,Charlestown,2.0,Ward 2,207.0,CD,379 Bunker Hill St,2129.0,Address,23629.0,42.3822,-71.0689,City Worker App,"(42.3822, -71.0689)"
642788,101001606908,10/07/2015 10:19:56 AM,10/15/2015 10:19:56 AM,10/07/2015 10:20:03 AM,ONTIME,Closed,Case Closed. Closed date : 2015-10-07 10:20:03.337 Case Resolved Created Request for Recycling Bin,Recycling Cart Return,Public Works Department,Recycling,Recycling Cart Return,PWDx_IPL Damaged Cart Replacement,PWDx,https://cityworker.cityofboston.gov:8443/attachments/report/56152a36d052f4d9a9feaf7d/photo/Report.jpg,,577 Norfolk St  Mattapan  MA  02126,8.0,07,4.0,B3,Greater Mattapan,9.0,Ward 18,1802.0,R3,577 Norfolk St,2126.0,Address,103385.0,42.2771,-71.0924,City Worker App,"(42.2771, -71.0924)"
642890,101001607061,10/07/2015 11:37:11 AM,10/15/2015 11:37:11 AM,10/07/2015 11:37:17 AM,ONTIME,Closed,Case Closed. Closed date : 2015-10-07 11:37:17.37 Case Resolved Created Request for Recycling Bin,Recycling Cart Return,Public Works Department,Recycling,Recycling Cart Return,PWDx_IPL Damaged Cart Replacement,PWDx,https://cityworker.cityofboston.gov:8443/attachments/report/56153c52d052f4d9a9feb302/photo/Report.jpg,,107 Warren St  Charlestown  MA  02129,3.0,1A,1.0,A15,Charlestown,2.0,Ward 2,203.0,RC,107 Warren St,2129.0,Address,143155.0,42.3751,-71.0634,City Worker App,"(42.3751, -71.0634)"
642897,101001607077,10/07/2015 11:45:14 AM,10/15/2015 11:45:14 AM,10/07/2015 11:45:21 AM,ONTIME,Closed,Case Closed. Closed date : 2015-10-07 11:45:21.853 Case Resolved Created Request for Recycling Bin,Recycling Cart Return,Public Works Department,Recycling,Recycling Cart Return,PWDx_IPL Damaged Cart Replacement,PWDx,https://cityworker.cityofboston.gov:8443/attachments/report/56153e33d052f4d9a9feb331/photo/Report.jpg,,23 Green St  Charlestown  MA  02129,3.0,1A,1.0,A15,Charlestown,2.0,Ward 2,205.0,CM,23 Green St,2129.0,Address,66237.0,42.3769,-71.0634,City Worker App,"(42.3769, -71.0634)"
642902,101001607086,10/07/2015 11:48:19 AM,10/15/2015 11:48:19 AM,10/07/2015 11:48:25 AM,ONTIME,Closed,Case Closed. Closed date : 2015-10-07 11:48:25.147 Case Resolved Created Request for Recycling Bin,Recycling Cart Return,Public Works Department,Recycling,Recycling Cart Return,PWDx_IPL Damaged Cart Replacement,PWDx,https://cityworker.cityofboston.gov:8443/attachments/report/56153eedd052f4d9a9feb36a/photo/Report.jpg,,23 Green St  Charlestown  MA  02129,3.0,1A,1.0,A15,Charlestown,2.0,Ward 2,205.0,CM,23 Green St,2129.0,Address,66237.0,42.3769,-71.0634,City Worker App,"(42.3769, -71.0634)"
642910,101001607105,10/07/2015 11:58:31 AM,10/15/2015 11:58:31 AM,10/07/2015 11:58:36 AM,ONTIME,Closed,Case Closed. Closed date : 2015-10-07 11:58:36.813 Case Resolved Created Request for Recycling Bin,Recycling Cart Return,Public Works Department,Recycling,Recycling Cart Return,PWDx_IPL Damaged Cart Replacement,PWDx,https://cityworker.cityofboston.gov:8443/attachments/report/56154150d052f4d9a9feb3dc/photo/Report.jpg,,90 Green St  Charlestown  MA  02129,3.0,1A,1.0,A15,Charlestown,2.0,Ward 2,204.0,R2,90 Green St,2129.0,Address,66315.0,42.3784,-71.0619,City Worker App,"(42.3784, -71.0619)"
642920,101001607125,10/07/2015 12:09:26 PM,10/15/2015 12:09:26 PM,10/07/2015 12:09:30 PM,ONTIME,Closed,Case Closed. Closed date : 2015-10-07 12:09:30.7 Case Resolved Created Request for Recycling Bin,Recycling Cart Return,Public Works Department,Recycling,Recycling Cart Return,PWDx_IPL Damaged Cart Replacement,PWDx,,,6 Monument St  Charlestown  MA  02129,3.0,1A,1.0,A15,Charlestown,2.0,Ward 2,204.0,R1,6 Monument St,2129.0,Address,97159.0,42.3774,-71.0604,City Worker App,"(42.3774, -71.0604)"
642925,101001607133,10/07/2015 12:13:22 PM,10/15/2015 12:13:22 PM,10/07/2015 12:13:28 PM,ONTIME,Closed,Case Closed. Closed date : 2015-10-07 12:13:28.38 Case Resolved Created Request for Recycling Bin,Recycling Cart Return,Public Works Department,Recycling,Recycling Cart Return,PWDx_IPL Damaged Cart Replacement,PWDx,https://cityworker.cityofboston.gov:8443/attachments/report/561544cbd052f4d9a9feb4a3/photo/Report.jpg,,25 Fendale Ave  Dorchester  MA  02124,8.0,07,3.0,B3,Dorchester,7.0,Ward 17,1704.0,R1,25 Fendale Ave,2124.0,Address,57337.0,42.2792,-71.0713,City Worker App,"(42.2792, -71.0713)"
642931,101001607142,10/07/2015 12:19:02 PM,10/15/2015 12:19:02 PM,10/07/2015 12:19:07 PM,ONTIME,Closed,Case Closed. Closed date : 2015-10-07 12:19:07.573 Case Resolved Created Request for Recycling Bin,Recycling Cart Return,Public Works Department,Recycling,Recycling Cart Return,PWDx_IPL Damaged Cart Replacement,PWDx,https://cityworker.cityofboston.gov:8443/attachments/report/5615461cd052f4d9a9feb4ef/photo/Report.jpg,,19 High St  Charlestown  MA  02129,3.0,1A,1.0,A15,Charlestown,2.0,Ward 2,203.0,R3,19 High St,2129.0,Address,251631.0,42.3762,-71.0621,City Worker App,"(42.3762, -71.0621)"
642951,101001607168,10/07/2015 12:32:08 PM,10/15/2015 12:32:08 PM,10/07/2015 12:32:13 PM,ONTIME,Closed,Case Closed. Closed date : 2015-10-07 12:32:13.41 Case Resolved Created Request for Recycling Bin,Recycling Cart Return,Public Works Department,Recycling,Recycling Cart Return,PWDx_IPL Damaged Cart Replacement,PWDx,https://cityworker.cityofboston.gov:8443/attachments/report/56154931d052f4d9a9feb57b/photo/Report.jpg,,311 Main St  Charlestown  MA  02129,3.0,1A,1.0,A15,Charlestown,2.0,02,206.0,R1,311 Main St,2129.0,Address,88528.0,42.3782,-71.0675,City Worker App,"(42.3782, -71.0675)"
642968,101001607191,10/07/2015 12:44:57 PM,10/15/2015 12:44:57 PM,10/07/2015 12:45:04 PM,ONTIME,Closed,Case Closed. Closed date : 2015-10-07 12:45:04.48 Case Resolved Created Request for Recycling Bin,Recycling Cart Return,Public Works Department,Recycling,Recycling Cart Return,PWDx_IPL Damaged Cart Replacement,PWDx,https://cityworker.cityofboston.gov:8443/attachments/report/56154c2fd052f4d9a9feb624/photo/Report.jpg,,455 Main St  Charlestown  MA  02129,3.0,1A,1.0,A15,Charlestown,2.0,Ward 2,207.0,R1,455 Main St,2129.0,Address,88633.0,42.3822,-71.0713,City Worker App,"(42.3822, -71.0713)"
643204,101001607555,10/07/2015 06:06:56 PM,10/16/2015 08:30:00 AM,10/07/2015 06:07:00 PM,ONTIME,Closed,Case Closed. Closed date : 2015-10-07 18:07:00.837 Case Resolved Created Request for Recycling Bin,Recycling Cart Return,Public Works Department,Recycling,Recycling Cart Return,PWDx_IPL Damaged Cart Replacement,PWDx,,,355-357 Ashmont St  Dorchester  MA  02124,8.0,07,3.0,C11,Dorchester,7.0,Ward 16,1608.0,R2,355-357 Ashmont St,2124.0,Address,5403.0,42.2871,-71.0583,City Worker App,"(42.2871, -71.0583)"
643354,101001607786,10/08/2015 08:46:00 AM,10/16/2015 08:46:47 AM,10/15/2015 11:41:35 AM,ONTIME,Closed,Case Closed. Closed date : 2015-10-15 11:41:35.42 Case Noted During inspection there was no broken cart at this address there appears to be a new recycling Cart in its place thank you for contacting our office,Recycling Cart Return,Public Works Department,Recycling,Recycling Cart Return,PWDx_IPL Damaged Cart Replacement,PWDx,,,20-22 Darling St  Mission Hill  MA  02120,9.0,10A,8.0,B2,Mission Hill,14.0,Ward 10,1003.0,R3,20-22 Darling St,2120.0,Address,46235.0,42.3318,-71.1055,Constituent Call,"(42.3318, -71.1055)"
643697,101001608331,10/08/2015 03:16:00 PM,10/16/2015 03:16:23 PM,10/22/2015 11:35:46 AM,OVERDUE,Closed,Case Closed Case Noted  During inspection there was no cart with ID# R9#014024 at this address however there was a new cart at this address.,Recycling Cart Return,Public Works Department,Recycling,Recycling Cart Return,PWDx_Recycling Cart Return,PWDx,,,11 Myopia Rd  Hyde Park  MA  02136,12.0,08,5.0,E18,Roslindale,10.0,Ward 18,1812.0,R1,11 Myopia Rd,2136.0,Address,99597.0,42.2638,-71.1275,Constituent Call,"(42.2638, -71.1275)"
643880,101001608588,10/09/2015 07:39:40 AM,10/19/2015 08:30:00 AM,10/09/2015 07:39:46 AM,ONTIME,Closed,Case Closed. Closed date : 2015-10-09 07:39:46.26 Case Resolved Created Request for Recycling Bin,Recycling Cart Return,Public Works Department,Recycling,Recycling Cart Return,PWDx_IPL Damaged Cart Replacement,PWDx,https://cityworker.cityofboston.gov:8443/attachments/report/5617a7a9d052f4d9a9feccd7/photo/Report.jpg,,63 Crescent Ave  Dorchester  MA  02125,7.0,03,3.0,C11,Dorchester,7.0,Ward 13,1307.0,CM,63 Crescent Ave,2125.0,Address,44229.0,42.3188,-71.0533,City Worker App,"(42.3188, -71.0533)"
643883,101001608591,10/09/2015 07:40:58 AM,10/19/2015 08:30:00 AM,10/09/2015 07:41:03 AM,ONTIME,Closed,Case Closed. Closed date : 2015-10-09 07:41:03.99 Case Resolved Created Request for Recycling Bin,Recycling Cart Return,Public Works Department,Recycling,Recycling Cart Return,PWDx_IPL Damaged Cart Replacement,PWDx,https://cityworker.cityofboston.gov:8443/attachments/report/5617a7f6d052f4d9a9fecce8/photo/Report.jpg,,3 Spring Garden St  Dorchester  MA  02125,7.0,03,3.0,C11,Dorchester,7.0,Ward 13,1307.0,CM,3 Spring Garden St,2125.0,Address,129624.0,42.3187,-71.0534,City Worker App,"(42.3187, -71.0534)"
644122,101001609012,10/09/2015 12:38:52 PM,10/19/2015 12:38:52 PM,10/09/2015 12:38:58 PM,ONTIME,Closed,Case Closed. Closed date : 2015-10-09 12:38:58.067 Case Resolved Created Request for Recycling Bin,Recycling Cart Return,Public Works Department,Recycling,Recycling Cart Return,PWDx_IPL Damaged Cart Replacement,PWDx,https://cityworker.cityofboston.gov:8443/attachments/report/5617edc9d052f4d9a9fed3b9/photo/Report.jpg,,31 Spring Garden St  Dorchester  MA  02125,7.0,03,3.0,C11,Dorchester,7.0,Ward 13,1307.0,A,31 Spring Garden St,2125.0,Address,129629.0,42.3175,-71.0535,City Worker App,"(42.3175, -71.0535)"
645427,101001610939,10/13/2015 01:57:00 PM,10/20/2015 01:57:09 PM,10/19/2015 03:10:37 PM,ONTIME,Closed,Case Closed Case Noted  cart was removed,Recycling Cart Return,Public Works Department,Recycling,Recycling Cart Return,PWDx_Recycling Cart Return,PWDx,,,109 F St  South Boston  MA  02127,6.0,05,2.0,C6,South Boston / South Boston Waterfront,5.0,Ward 7,704.0,CM,109 F St,2127.0,Address,55358.0,42.3359,-71.0486,Constituent Call,"(42.3359, -71.0486)"
646744,101001612821,10/15/2015 11:34:54 AM,10/22/2015 11:34:54 AM,10/15/2015 11:35:00 AM,ONTIME,Closed,Case Closed. Closed date : 2015-10-15 11:35:00.977 Case Resolved Created Request for Recycling Bin,Recycling Cart Return,Public Works Department,Recycling,Recycling Cart Return,PWDx_IPL Damaged Cart Replacement,PWDx,https://cityworker.cityofboston.gov:8443/attachments/report/561fc7a0d052f4d9a9ff0ffb/photo/Report.jpg,,112 Milton Ave  Dorchester  MA  02124,8.0,07,4.0,B3,Dorchester,9.0,Ward 17,1710.0,R3,112 Milton Ave,2124.0,Address,95687.0,42.2816,-71.0757,City Worker App,"(42.2816, -71.0757)"
646815,101001612927,10/15/2015 12:35:06 PM,10/22/2015 12:35:06 PM,10/15/2015 12:35:11 PM,ONTIME,Closed,Case Closed. Closed date : 2015-10-15 12:35:11.653 Case Resolved Created Request for Recycling Bin,Recycling Cart Return,Public Works Department,Recycling,Recycling Cart Return,PWDx_IPL Damaged Cart Replacement,PWDx,https://cityworker.cityofboston.gov:8443/attachments/report/561fd5bad052f4d9a9ff1200/photo/Report.jpg,,INTERSECTION of Westminster Ave & Westminster Ter  Roxbury  MA,9.0,10B,7.0,E13,Roxbury,13.0,Ward 11,1103.0,,INTERSECTION Westminster Ave & Westminster Ter,,Intersection,8642.0,42.3163,-71.0957,City Worker App,"(42.3163, -71.0957)"
646881,101001613013,10/15/2015 02:01:00 PM,10/22/2015 02:01:38 PM,10/23/2015 10:05:45 AM,OVERDUE,Closed,Case Closed. Closed date : 2015-10-23 10:05:45.203 Case Noted New carts where delivered this morning thank you,Recycling Cart Return,Public Works Department,Recycling,Recycling Cart Return,PWDx_IPL Damaged Cart Replacement,PWDx,,,255 Cambridge St  Allston  MA  02134,11.0,04,9.0,D14,Allston / Brighton,15.0,Ward 22,2201.0,RC,255 Cambridge St,2134.0,Address,25104.0,42.3577,-71.1278,Constituent Call,"(42.3577, -71.1278)"
647168,101001613408,10/16/2015 07:22:24 AM,10/23/2015 08:30:00 AM,10/16/2015 07:22:30 AM,ONTIME,Closed,Case Closed. Closed date : 2015-10-16 07:22:30.433 Case Resolved Created Request for Recycling Bin,Recycling Cart Return,Public Works Department,Recycling,Recycling Cart Return,PWDx_IPL Damaged Cart Replacement,PWDx,https://cityworker.cityofboston.gov:8443/attachments/report/5620ddf6d052f4d9a9ff1764/photo/Report.jpg,,14 Franklin St  Hyde Park  MA  02136,12.0,08,5.0,E18,Hyde Park,10.0,Ward 18,1819.0,R1,14 Franklin St,2136.0,Address,60707.0,42.2523,-71.1331,City Worker App,"(42.2523, -71.1331)"
647217,101001613469,10/16/2015 08:36:00 AM,10/23/2015 08:36:04 AM,10/23/2015 08:04:03 AM,ONTIME,Closed,Case Closed. Closed date : 2015-10-23 08:04:03.3 Case Noted During inspection at this address there was nothing for return at this time thank you.,Recycling Cart Return,Public Works Department,Recycling,Recycling Cart Return,PWDx_IPL Damaged Cart Replacement,PWDx,,https://cityworker.cityofboston.gov:8443/attachments/report/5620ef75d052ad6c08022747/closed_photo/Report.jpg,11 Gay Head St  Jamaica Plain  MA  02130,9.0,10A,6.0,E13,Jamaica Plain,11.0,Ward 10,1006.0,R2,11 Gay Head St,2130.0,Address,63143.0,42.3236,-71.1051,Constituent Call,"(42.3236, -71.1051)"
647497,101001613933,10/16/2015 01:55:00 PM,10/23/2015 01:55:59 PM,10/28/2015 03:01:33 PM,OVERDUE,Closed,Case Closed. Closed date : 2015-10-28 15:01:33.973 Case Resolved cart picked up 10/26/2015,Recycling Cart Return,Public Works Department,Recycling,Recycling Cart Return,PWDx_Recycling Cart Return,PWDx,,,4 Chestnut St  Boston  MA  02108,3.0,1B,8.0,A1,Beacon Hill,14.0,Ward 5,503.0,R2,4 Chestnut St,2108.0,Address,163302.0,42.3576,-71.0663,Constituent Call,"(42.3576, -71.0663)"
647793,101001614314,10/17/2015 09:50:43 AM,10/26/2015 08:30:00 AM,10/22/2015 10:04:32 AM,ONTIME,Closed,Case Closed. Closed date : 2015-10-22 10:04:32.587 Case Invalid Case already exists wrong queue belongs to ipl,Recycling Cart Return,Public Works Department,Recycling,Recycling Cart Return,PWDx_IPL Damaged Cart Replacement,PWDx,,,198 Waldemar Ave  East Boston  MA  02128,1.0,09,1.0,A7,East Boston,1.0,01,113.0,,198 Waldemar Ave,2128.0,Address,347146.0,42.3594,-71.0587,City Worker App,"(0, 0)"
647811,101001614338,10/17/2015 11:49:46 AM,10/26/2015 08:30:00 AM,10/17/2015 11:50:11 AM,ONTIME,Closed,Case Closed. Closed date : 2015-10-17 11:50:11.51 Case Resolved Created Request for Recycling Bin,Recycling Cart Return,Public Works Department,Recycling,Recycling Cart Return,PWDx_IPL Damaged Cart Replacement,PWDx,https://cityworker.cityofboston.gov:8443/attachments/report/56226e15d052f4d9a9ff2a36/photo/Report.jpg,,19 Hillis Rd  Hyde Park  MA  02136,12.0,08,5.0,E18,Hyde Park,10.0,Ward 18,1819.0,R1,19 Hillis Rd,2136.0,Address,74041.0,42.2504,-71.1319,City Worker App,"(42.2504, -71.1319)"
648012,101001614600,10/18/2015 08:12:37 AM,10/26/2015 08:30:00 AM,10/18/2015 08:12:44 AM,ONTIME,Closed,Case Closed. Closed date : 2015-10-18 08:12:44.047 Case Resolved Created Request for Recycling Bin,Recycling Cart Return,Public Works Department,Recycling,Recycling Cart Return,PWDx_IPL Damaged Cart Replacement,PWDx,https://cityworker.cityofboston.gov:8443/attachments/report/562262c7d052f4d9a9ff2988/photo/Report.jpg,,198 Waldemar Ave  East Boston  MA  02128,1.0,09,1.0,A7,East Boston,1.0,01,113.0,,198 Waldemar Ave,2128.0,Address,347146.0,42.3594,-71.0587,City Worker App,"(0, 0)"
648489,101001615211,10/19/2015 11:52:28 AM,10/26/2015 11:52:28 AM,10/19/2015 11:52:38 AM,ONTIME,Closed,Case Closed. Closed date : 2015-10-19 11:52:38.037 Case Resolved Created Request for Recycling Bin,Recycling Cart Return,Public Works Department,Recycling,Recycling Cart Return,PWDx_IPL Damaged Cart Replacement,PWDx,https://cityworker.cityofboston.gov:8443/attachments/report/562511c4d052f4d9a9ff3a8f/photo/Report.jpg,,9 Cranston St  Jamaica Plain  MA  02130,9.0,02,6.0,E13,Jamaica Plain,11.0,Ward 19,1901.0,R4,9 Cranston St,2130.0,Address,44052.0,42.3214,-71.1095,City Worker App,"(42.3214, -71.1095)"
648941,101001615849,10/20/2015 09:37:00 AM,10/27/2015 09:37:42 AM,10/23/2015 09:56:15 AM,ONTIME,Closed,Case Closed Case Noted  new carts where delivered 10/23/15,Recycling Cart Return,Public Works Department,Recycling,Recycling Cart Return,PWDx_Recycling Cart Return,PWDx,,,1058 Canterbury St  Roslindale  MA  02131,12.0,08,5.0,E18,Roslindale,10.0,Ward 18,1809.0,R3,1058 Canterbury St,2131.0,Address,25446.0,42.2779,-71.1219,Constituent Call,"(42.2779, -71.1219)"
649202,101001616214,10/20/2015 02:10:00 PM,10/27/2015 02:10:26 PM,10/28/2015 02:25:35 PM,OVERDUE,Closed,Case Closed Case Noted  old cart was removed and new one was delivered 515#0029788,Recycling Cart Return,Public Works Department,Recycling,Recycling Cart Return,PWDx_Recycling Cart Return,PWDx,,,10 Morrow Rd  Brighton  MA  02135,11.0,04,9.0,D14,Allston / Brighton,15.0,Ward 22,2206.0,R2,10 Morrow Rd,2135.0,Address,97574.0,42.3539,-71.1497,Constituent Call,"(42.3539, -71.1497)"
649215,101001616241,10/20/2015 02:39:38 PM,10/27/2015 02:39:38 PM,10/20/2015 02:39:46 PM,ONTIME,Closed,Case Closed. Closed date : 2015-10-20 14:39:46.17 Case Resolved Created Request for Recycling Bin,Recycling Cart Return,Public Works Department,Recycling,Recycling Cart Return,PWDx_IPL Damaged Cart Replacement,PWDx,https://cityworker.cityofboston.gov:8443/attachments/report/56268a65d052f4d9a9ff4dba/photo/Report.jpg,,523-523A Columbus Ave  Roxbury  MA  02118,4.0,1C,7.0,D4,South End,6.0,Ward 4,404.0,CM,523-523A Columbus Ave,2118.0,Address,35855.0,42.3421,-71.0803,City Worker App,"(42.3421, -71.0803)"
649695,101001616956,10/21/2015 10:57:12 AM,10/28/2015 10:57:13 AM,10/21/2015 10:57:19 AM,ONTIME,Closed,Case Closed. Closed date : 2015-10-21 10:57:19.133 Case Resolved Created Request for Recycling Bin,Recycling Cart Return,Public Works Department,Recycling,Recycling Cart Return,PWDx_IPL Damaged Cart Replacement,PWDx,https://cityworker.cityofboston.gov:8443/attachments/report/5627a7c9d052f4d9a9ff5949/photo/Report.jpg,,18 Sutton St  Mattapan  MA  02126,8.0,07,4.0,B3,Greater Mattapan,9.0,Ward 14,1405.0,R3,18 Sutton St,2126.0,Address,133071.0,42.2816,-71.0892,City Worker App,"(42.2816, -71.0892)"
649706,101001616973,10/21/2015 11:11:32 AM,10/28/2015 11:11:33 AM,10/21/2015 11:11:38 AM,ONTIME,Closed,Case Closed. Closed date : 2015-10-21 11:11:38.707 Case Resolved Created Request for Recycling Bin,Recycling Cart Return,Public Works Department,Recycling,Recycling Cart Return,PWDx_IPL Damaged Cart Replacement,PWDx,https://cityworker.cityofboston.gov:8443/attachments/report/5627ab26d052f4d9a9ff5a2a/photo/Report.jpg,,8 Griggs Pl  Allston  MA  02134,11.0,04,9.0,D14,Allston / Brighton,15.0,Ward 21,2106.0,R1,8 Griggs Pl,2134.0,Address,67246.0,42.3512,-71.1364,City Worker App,"(42.3512, -71.1364)"
649721,101001616998,10/21/2015 11:26:51 AM,10/28/2015 11:26:52 AM,10/21/2015 11:26:57 AM,ONTIME,Closed,Case Closed. Closed date : 2015-10-21 11:26:57.587 Case Resolved Created Request for Recycling Bin,Recycling Cart Return,Public Works Department,Recycling,Recycling Cart Return,PWDx_IPL Damaged Cart Replacement,PWDx,https://cityworker.cityofboston.gov:8443/attachments/report/5627aeb9d052f4d9a9ff5af5/photo/Report.jpg,,1 Laurel St  Charlestown  MA  02129,3.0,1A,1.0,A15,Charlestown,2.0,Ward 2,203.0,R1,1 Laurel St,2129.0,Address,84250.0,42.3766,-71.0619,City Worker App,"(42.3766, -71.0619)"
649805,101001617127,10/21/2015 12:33:22 PM,10/28/2015 12:33:22 PM,10/21/2015 12:33:28 PM,ONTIME,Closed,Case Closed. Closed date : 2015-10-21 12:33:28.777 Case Resolved Created Request for Recycling Bin,Recycling Cart Return,Public Works Department,Recycling,Recycling Cart Return,PWDx_IPL Damaged Cart Replacement,PWDx,https://cityworker.cityofboston.gov:8443/attachments/report/5627be55d052f4d9a9ff5e19/photo/Report.jpg,,233 Main St  Charlestown  MA  02129,3.0,1A,1.0,A15,Charlestown,2.0,Ward 2,206.0,RC,233 Main St,2129.0,Address,167263.0,42.3767,-71.0657,City Worker App,"(42.3767, -71.0657)"
649842,101001617191,10/21/2015 01:09:52 PM,10/28/2015 01:09:52 PM,10/21/2015 01:09:57 PM,ONTIME,Closed,Case Closed. Closed date : 2015-10-21 13:09:57.623 Case Resolved Created Request for Recycling Bin,Recycling Cart Return,Public Works Department,Recycling,Recycling Cart Return,PWDx_IPL Damaged Cart Replacement,PWDx,https://cityworker.cityofboston.gov:8443/attachments/report/5627c6dfd052f4d9a9ff5fc1/photo/Report.jpg,,219 W Canton St  Boston  MA  02116,4.0,1C,2.0,D4,South End,6.0,Ward 4,402.0,CM,219 W Canton St,2116.0,Address,25708.0,42.3454,-71.0771,City Worker App,"(42.3454, -71.0771)"
650485,101001618063,10/22/2015 01:01:01 PM,10/29/2015 01:01:03 PM,10/22/2015 01:01:09 PM,ONTIME,Closed,Case Closed. Closed date : 2015-10-22 13:01:09.36 Case Resolved Created Request for Recycling Bin,Recycling Cart Return,Public Works Department,Recycling,Recycling Cart Return,PWDx_IPL Damaged Cart Replacement,PWDx,https://cityworker.cityofboston.gov:8443/attachments/report/56291651d052f4d9a9ff6cfd/photo/Report.jpg,,117 Newbury St  Boston  MA  02116,4.0,1C,8.0,D4,Back Bay,14.0,Ward 5,507.0,C,117 Newbury St,2116.0,Address,101328.0,42.3515,-71.0763,City Worker App,"(42.3515, -71.0763)"
650883,101001618668,10/23/2015 08:41:14 AM,10/30/2015 08:41:14 AM,10/23/2015 08:41:19 AM,ONTIME,Closed,Case Closed. Closed date : 2015-10-23 08:41:19.84 Case Resolved Created Request for Recycling Bin,Recycling Cart Return,Public Works Department,Recycling,Recycling Cart Return,PWDx_IPL Damaged Cart Replacement,PWDx,https://cityworker.cityofboston.gov:8443/attachments/report/562a2aead052f4d9a9ff734f/photo/Report.jpg,,49 Cedar St  Roxbury  MA  02119,7.0,10B,7.0,B2,Roxbury,13.0,Ward 9,905.0,R3,49 Cedar St,2119.0,Address,26818.0,42.3253,-71.0906,City Worker App,"(42.3253, -71.0906)"
650994,101001618851,10/23/2015 10:33:51 AM,10/30/2015 10:33:51 AM,10/23/2015 10:33:56 AM,ONTIME,Closed,Case Closed. Closed date : 2015-10-23 10:33:56.41 Case Resolved Created Request for Recycling Bin,Recycling Cart Return,Public Works Department,Recycling,Recycling Cart Return,PWDx_IPL Damaged Cart Replacement,PWDx,https://cityworker.cityofboston.gov:8443/attachments/report/562a454cd052f4d9a9ff76c7/photo/Report.jpg,,INTERSECTION of Barnard Pl & E Second St  South Boston  MA,6.0,05,2.0,C6,South Boston / South Boston Waterfront,5.0,Ward 6,605.0,,INTERSECTION Barnard Pl & E Second St,,Intersection,967.0,42.3373,-71.0393,City Worker App,"(42.3373, -71.0393)"
651182,101001619143,10/23/2015 01:21:27 PM,10/30/2015 01:21:30 PM,10/23/2015 01:21:34 PM,ONTIME,Closed,Case Closed. Closed date : 2015-10-23 13:21:34.687 Case Resolved Created Request for Recycling Bin,Recycling Cart Return,Public Works Department,Recycling,Recycling Cart Return,PWDx_IPL Damaged Cart Replacement,PWDx,,,31 Faywood Ave  East Boston  MA  02128,1.0,09,1.0,A7,East Boston,1.0,Ward 1,114.0,R3,31 Faywood Ave,2128.0,Address,57111.0,42.3903,-71.0002,City Worker App,"(42.3903, -71.0002)"
651219,101001619195,10/23/2015 02:08:50 PM,10/30/2015 02:08:53 PM,10/23/2015 02:08:59 PM,ONTIME,Closed,Case Closed. Closed date : 2015-10-23 14:08:59.087 Case Resolved Created Request for Recycling Bin,Recycling Cart Return,Public Works Department,Recycling,Recycling Cart Return,PWDx_IPL Damaged Cart Replacement,PWDx,https://cityworker.cityofboston.gov:8443/attachments/report/562a77b2d052f4d9a9ff7de5/photo/Report.jpg,,33 Melrose St  Boston  MA  02116,4.0,1C,2.0,A1,Back Bay,6.0,Ward 5,501.0,R1,33 Melrose St,2116.0,Address,93968.0,42.3489,-71.0683,City Worker App,"(42.3489, -71.0683)"
651896,101001620127,10/26/2015 08:49:36 AM,11/02/2015 08:49:35 AM,10/26/2015 08:49:41 AM,ONTIME,Closed,Case Closed. Closed date : 2015-10-26 08:49:41.45 Case Resolved Created Request for Recycling Bin,Recycling Cart Return,Public Works Department,Recycling,Recycling Cart Return,PWDx_IPL Damaged Cart Replacement,PWDx,https://cityworker.cityofboston.gov:8443/attachments/report/562e215ed052f4d9a9ff8eb2/photo/Report.jpg,,201 Newbury St  Boston  MA  02116,4.0,1C,8.0,D4,Back Bay,14.0,Ward 5,508.0,CM,201 Newbury St,2116.0,Address,101387.0,42.3504,-71.0805,City Worker App,"(42.3504, -71.0805)"
651901,101001620131,10/26/2015 08:51:18 AM,11/02/2015 08:51:17 AM,10/26/2015 08:51:21 AM,ONTIME,Closed,Case Closed. Closed date : 2015-10-26 08:51:21.593 Case Resolved Created Request for Recycling Bin,Recycling Cart Return,Public Works Department,Recycling,Recycling Cart Return,PWDx_IPL Damaged Cart Replacement,PWDx,,,201 Newbury St  Boston  MA  02116,4.0,1C,8.0,D4,Back Bay,14.0,Ward 5,508.0,CM,201 Newbury St,2116.0,Address,101387.0,42.3504,-71.0805,City Worker App,"(42.3504, -71.0805)"
651942,101001620202,10/26/2015 09:31:05 AM,11/02/2015 09:31:05 AM,10/26/2015 09:31:11 AM,ONTIME,Closed,Case Closed. Closed date : 2015-10-26 09:31:11.587 Case Resolved Created Request for Recycling Bin,Recycling Cart Return,Public Works Department,Recycling,Recycling Cart Return,PWDx_IPL Damaged Cart Replacement,PWDx,https://cityworker.cityofboston.gov:8443/attachments/report/562e2b14d052f4d9a9ff9027/photo/Report.jpg,,48 Putnam St  East Boston  MA  02128,1.0,09,1.0,A7,East Boston,1.0,Ward 1,109.0,R3,48 Putnam St,2128.0,Address,113658.0,42.3813,-71.0333,City Worker App,"(42.3813, -71.0333)"
652043,101001620365,10/26/2015 10:49:11 AM,11/02/2015 10:49:11 AM,10/26/2015 10:49:17 AM,ONTIME,Closed,Case Closed. Closed date : 2015-10-26 10:49:17.097 Case Resolved Created Request for Recycling Bin,Recycling Cart Return,Public Works Department,Recycling,Recycling Cart Return,PWDx_IPL Damaged Cart Replacement,PWDx,https://cityworker.cityofboston.gov:8443/attachments/report/562e3d64d052f4d9a9ff937f/photo/Report.jpg,,2P Prescott St  East Boston  MA  02128,1.0,09,1.0,A7,East Boston,1.0,01,109.0,,2P Prescott St,2128.0,Address,350865.0,42.3594,-71.0587,City Worker App,"(0, 0)"
652220,101001620622,10/26/2015 02:15:19 PM,11/02/2015 02:15:18 PM,10/26/2015 02:15:24 PM,ONTIME,Closed,Case Closed. Closed date : 2015-10-26 14:15:24.553 Case Resolved Created Request for Recycling Bin,Recycling Cart Return,Public Works Department,Recycling,Recycling Cart Return,PWDx_IPL Damaged Cart Replacement,PWDx,https://cityworker.cityofboston.gov:8443/attachments/report/562e6db3d052f4d9a9ff98d3/photo/Report.jpg,,35-37 Elm Hill Park  Dorchester  MA  02121,9.0,10B,7.0,B2,Roxbury,13.0,Ward 12,1202.0,R2,35-37 Elm Hill Park,2121.0,Address,53258.0,42.3127,-71.0815,City Worker App,"(42.3127, -71.0815)"
652250,101001620680,10/26/2015 02:53:00 PM,11/02/2015 02:53:38 PM,10/29/2015 02:17:48 PM,ONTIME,Closed,Case Closed. Closed date : 2015-10-29 14:17:48.27 Case Resolved constituent said he never called to have cart removed 10/29/2015 DD,Recycling Cart Return,Public Works Department,Recycling,Recycling Cart Return,PWDx_Recycling Cart Return,PWDx,,,28 June St  Roslindale  MA  02131,12.0,06,5.0,E5,Roslindale,10.0,Ward 18,1811.0,R2,28 June St,2131.0,Address,80382.0,42.2757,-71.1355,Constituent Call,"(42.2757, -71.1355)"
653589,101001622606,10/28/2015 12:42:26 PM,11/04/2015 12:42:28 PM,10/28/2015 12:42:33 PM,ONTIME,Closed,Case Closed. Closed date : 2015-10-28 12:42:33.493 Case Resolved Created Request for Recycling Bin,Recycling Cart Return,Public Works Department,Recycling,Recycling Cart Return,PWDx_IPL Damaged Cart Replacement,PWDx,https://cityworker.cityofboston.gov:8443/attachments/report/5630faf1d052f4d9a9ffb65a/photo/Report.jpg,,INTERSECTION of Cordis St & Cordis Street Ave  Charlestown  MA,3.0,1A,1.0,A15,Charlestown,2.0,Ward 2,203.0,,INTERSECTION Cordis St & Cordis Street Ave,,Intersection,3505.0,42.3754,-71.0628,City Worker App,"(42.3754, -71.0628)"
653592,101001622609,10/28/2015 12:44:28 PM,11/04/2015 12:44:29 PM,10/28/2015 12:44:35 PM,ONTIME,Closed,Case Closed. Closed date : 2015-10-28 12:44:35.373 Case Resolved Created Request for Recycling Bin,Recycling Cart Return,Public Works Department,Recycling,Recycling Cart Return,PWDx_IPL Damaged Cart Replacement,PWDx,https://cityworker.cityofboston.gov:8443/attachments/report/5630fb68d052f4d9a9ffb67f/photo/Report.jpg,,5 Cordis Street Ave  Charlestown  MA  02129,3.0,1A,1.0,A15,Charlestown,2.0,Ward 2,203.0,CD,5 Cordis Street Ave,2129.0,Address,42585.0,42.3753,-71.0627,City Worker App,"(42.3753, -71.0627)"
653597,101001622615,10/28/2015 12:47:27 PM,11/04/2015 12:47:28 PM,10/28/2015 12:47:34 PM,ONTIME,Closed,Case Closed. Closed date : 2015-10-28 12:47:34.983 Case Resolved Created Request for Recycling Bin,Recycling Cart Return,Public Works Department,Recycling,Recycling Cart Return,PWDx_IPL Damaged Cart Replacement,PWDx,https://cityworker.cityofboston.gov:8443/attachments/report/5630fc1bd052f4d9a9ffb6aa/photo/Report.jpg,,27 Cordis St  Charlestown  MA  02129,3.0,1A,1.0,A15,Charlestown,2.0,Ward 2,203.0,R2,27 Cordis St,2129.0,Address,42568.0,42.3756,-71.0626,City Worker App,"(42.3756, -71.0626)"
653935,101001623094,10/29/2015 08:30:51 AM,11/05/2015 08:30:50 AM,10/29/2015 08:30:57 AM,ONTIME,Closed,Case Closed. Closed date : 2015-10-29 08:30:57.243 Case Resolved Created Request for Recycling Bin,Recycling Cart Return,Public Works Department,Recycling,Recycling Cart Return,PWDx_IPL Damaged Cart Replacement,PWDx,https://cityworker.cityofboston.gov:8443/attachments/report/56321178d052f4d9a9ffbd85/photo/Report.jpg,,13 Cross St  Charlestown  MA  02129,3.0,1A,1.0,A15,Charlestown,2.0,Ward 2,203.0,R1,13 Cross St,2129.0,Address,44516.0,42.3767,-71.0625,City Worker App,"(42.3767, -71.0625)"
653962,101001623136,10/29/2015 08:57:45 AM,11/05/2015 08:57:44 AM,10/29/2015 08:57:49 AM,ONTIME,Closed,Case Closed. Closed date : 2015-10-29 08:57:49.953 Case Resolved Created Request for Recycling Bin,Recycling Cart Return,Public Works Department,Recycling,Recycling Cart Return,PWDx_IPL Damaged Cart Replacement,PWDx,https://cityworker.cityofboston.gov:8443/attachments/report/563217c7d052f4d9a9ffbe2a/photo/Report.jpg,,1 Mystic River Brg  Charlestown  MA  02129,3.0,1A,1.0,A15,Charlestown,2.0,Ward 2,203.0,,1 Mystic River Brg,2129.0,Address,170367.0,42.3775,-71.0625,City Worker App,"(42.3775, -71.0625)"
653967,101001623143,10/29/2015 08:59:59 AM,11/05/2015 08:59:58 AM,10/29/2015 09:00:06 AM,ONTIME,Closed,Case Closed. Closed date : 2015-10-29 09:00:06.903 Case Resolved Created Request for Recycling Bin,Recycling Cart Return,Public Works Department,Recycling,Recycling Cart Return,PWDx_IPL Damaged Cart Replacement,PWDx,https://cityworker.cityofboston.gov:8443/attachments/report/5632184bd052f4d9a9ffbe56/photo/Report.jpg,,1 Mystic River Brg  Charlestown  MA  02129,3.0,1A,1.0,A15,Charlestown,2.0,Ward 2,203.0,,1 Mystic River Brg,2129.0,Address,170367.0,42.3775,-71.0625,City Worker App,"(42.3775, -71.0625)"
654000,101001623189,10/29/2015 09:24:13 AM,11/05/2015 09:24:13 AM,10/29/2015 09:24:16 AM,ONTIME,Closed,Case Closed. Closed date : 2015-10-29 09:24:16.77 Case Resolved Created Request for Recycling Bin,Recycling Cart Return,Public Works Department,Recycling,Recycling Cart Return,PWDx_IPL Damaged Cart Replacement,PWDx,,,83 Sumner St  Dorchester  MA  02125,7.0,03,7.0,C11,Dorchester,13.0,Ward 7,710.0,R3,83 Sumner St,2125.0,Address,132577.0,42.3168,-71.0626,City Worker App,"(42.3168, -71.0626)"
654002,101001623194,10/29/2015 09:25:38 AM,11/05/2015 09:25:38 AM,10/29/2015 09:25:43 AM,ONTIME,Closed,Case Closed. Closed date : 2015-10-29 09:25:43.82 Case Resolved Created Request for Recycling Bin,Recycling Cart Return,Public Works Department,Recycling,Recycling Cart Return,PWDx_IPL Damaged Cart Replacement,PWDx,https://cityworker.cityofboston.gov:8443/attachments/report/56321e50d052f4d9a9ffbed5/photo/Report.jpg,,66 Green St  Charlestown  MA  02129,3.0,1A,1.0,A15,Charlestown,2.0,Ward 2,204.0,R2,66 Green St,2129.0,Address,66290.0,42.3778,-71.0623,City Worker App,"(42.3778, -71.0623)"
654015,101001623217,10/29/2015 09:31:37 AM,11/05/2015 09:31:37 AM,10/29/2015 09:31:43 AM,ONTIME,Closed,Case Closed. Closed date : 2015-10-29 09:31:43.19 Case Resolved Created Request for Recycling Bin,Recycling Cart Return,Public Works Department,Recycling,Recycling Cart Return,PWDx_IPL Damaged Cart Replacement,PWDx,https://cityworker.cityofboston.gov:8443/attachments/report/56321fb8d052f4d9a9ffbf1b/photo/Report.jpg,,15 Savin Hill Ave  Dorchester  MA  02125,7.0,03,3.0,C11,Dorchester,8.0,Ward 15,1504.0,R3,15 Savin Hill Ave,2125.0,Address,123205.0,42.3127,-71.0583,City Worker App,"(42.3127, -71.0583)"
654117,101001623369,10/29/2015 11:25:51 AM,11/05/2015 11:25:50 AM,10/29/2015 11:25:56 AM,ONTIME,Closed,Case Closed. Closed date : 2015-10-29 11:25:56.247 Case Resolved Created Request for Recycling Bin,Recycling Cart Return,Public Works Department,Recycling,Recycling Cart Return,PWDx_IPL Damaged Cart Replacement,PWDx,https://cityworker.cityofboston.gov:8443/attachments/report/56323a7dd052f4d9a9ffc23a/photo/Report.jpg,,19 Chelmsford St  Dorchester  MA  02122,8.0,07,3.0,C11,Dorchester,7.0,Ward 16,1609.0,R3,19 Chelmsford St,2122.0,Address,205561.0,42.2846,-71.0541,City Worker App,"(42.2846, -71.0541)"
654119,101001623374,10/29/2015 11:28:22 AM,11/05/2015 11:28:22 AM,10/29/2015 11:28:28 AM,ONTIME,Closed,Case Closed. Closed date : 2015-10-29 11:28:28.117 Case Resolved Created Request for Recycling Bin,Recycling Cart Return,Public Works Department,Recycling,Recycling Cart Return,PWDx_IPL Damaged Cart Replacement,PWDx,https://cityworker.cityofboston.gov:8443/attachments/report/56323b13d052f4d9a9ffc24d/photo/Report.jpg,,17 Chelmsford St  Dorchester  MA  02122,8.0,07,3.0,C11,Dorchester,7.0,Ward 16,1609.0,R3,17 Chelmsford St,2122.0,Address,30162.0,42.2846,-71.0543,City Worker App,"(42.2846, -71.0543)"
654143,101001623409,10/29/2015 12:07:00 PM,11/05/2015 12:07:47 PM,10/30/2015 12:07:17 PM,ONTIME,Closed,Case Closed Case Noted  Cart was removed 10/30/15 #0915603215,Recycling Cart Return,Public Works Department,Recycling,Recycling Cart Return,PWDx_Recycling Cart Return,PWDx,,,33 Gartland St  Jamaica Plain  MA  02130,9.0,02,6.0,E13,Jamaica Plain,11.0,Ward 11,1107.0,CM,33 Gartland St,2130.0,Address,62962.0,42.3058,-71.1059,Constituent Call,"(42.3058, -71.1059)"
654294,101001623643,10/29/2015 04:00:00 PM,11/05/2015 04:00:38 PM,10/30/2015 02:55:41 PM,ONTIME,Closed,Case Closed. Closed date : 2015-10-30 14:55:41.867 Case Noted no cart out 10/30/2015,Recycling Cart Return,Public Works Department,Recycling,Recycling Cart Return,PWDx_Recycling Cart Return,PWDx,,,156 W Newton St  Roxbury  MA  02118,4.0,1C,7.0,D4,South End,6.0,Ward 4,404.0,R3,156 W Newton St,2118.0,Address,102425.0,42.3424,-71.0779,Constituent Call,"(42.3424, -71.0779)"
655476,101001625324,11/02/2015 07:45:00 AM,11/09/2015 08:30:00 AM,11/02/2015 07:45:04 AM,ONTIME,Closed,Case Closed. Closed date : 2015-11-02 07:45:04.7 Case Resolved Created Request for Recycling Bin,Recycling Cart Return,Public Works Department,Recycling,Recycling Cart Return,PWDx_IPL Damaged Cart Replacement,PWDx,https://cityworker.cityofboston.gov:8443/attachments/report/56375ac7d052f4d9a9ffe4cd/photo/Report.jpg,,229 Trenton St  East Boston  MA  02128,1.0,09,1.0,A7,East Boston,1.0,Ward 1,0109,R2,229 Trenton St,2128.0,Address,138359.0,42.381,-71.0304,City Worker App,"(42.381, -71.0304)"
655526,101001625397,11/02/2015 08:40:50 AM,11/09/2015 08:40:49 AM,11/02/2015 08:40:54 AM,ONTIME,Closed,Case Closed. Closed date : 2015-11-02 08:40:54.02 Case Resolved Created Request for Recycling Bin,Recycling Cart Return,Public Works Department,Recycling,Recycling Cart Return,PWDx_IPL Damaged Cart Replacement,PWDx,,,210 Lexington St  East Boston  MA  02128,1.0,09,1.0,A7,East Boston,1.0,Ward 1,0109,R3,210 Lexington St,2128.0,Address,85590.0,42.3798,-71.0324,City Worker App,"(42.3798, -71.0324)"
655638,101001625593,11/02/2015 10:39:33 AM,11/09/2015 10:39:33 AM,11/02/2015 10:39:38 AM,ONTIME,Closed,Case Closed. Closed date : 2015-11-02 10:39:38.22 Case Resolved Created Request for Recycling Bin,Recycling Cart Return,Public Works Department,Recycling,Recycling Cart Return,PWDx_IPL Damaged Cart Replacement,PWDx,https://cityworker.cityofboston.gov:8443/attachments/report/563783b4d052f4d9a9ffeacf/photo/Report.jpg,,6-12 Blackwood St  Boston  MA  02115,4.0,1C,7.0,D4,Back Bay,14.0,Ward 4,0405,A,6-12 Blackwood St,2115.0,Address,162107.0,42.3431,-71.0823,City Worker App,"(42.3431, -71.0823)"
655747,101001625741,11/02/2015 12:30:19 PM,11/09/2015 12:30:18 PM,11/02/2015 12:30:24 PM,ONTIME,Closed,Case Closed. Closed date : 2015-11-02 12:30:24.09 Case Resolved Created Request for Recycling Bin,Recycling Cart Return,Public Works Department,Recycling,Recycling Cart Return,PWDx_IPL Damaged Cart Replacement,PWDx,https://cityworker.cityofboston.gov:8443/attachments/report/56379da6d052f4d9a9ffedf3/photo/Report.jpg,,12 Stonecrest Rd  Mattapan  MA  02126,8.0,07,5.0,B3,Greater Mattapan,9.0,Ward 18,1803,R1,12 Stonecrest Rd,2126.0,Address,130819.0,42.2775,-71.1064,City Worker App,"(42.2775, -71.1064)"
656227,101001626400,11/03/2015 08:38:33 AM,11/10/2015 08:38:32 AM,11/03/2015 08:38:38 AM,ONTIME,Closed,Case Closed. Closed date : 2015-11-03 08:38:38.623 Case Resolved Created Request for Recycling Bin,Recycling Cart Return,Public Works Department,Recycling,Recycling Cart Return,PWDx_IPL Damaged Cart Replacement,PWDx,https://cityworker.cityofboston.gov:8443/attachments/report/5638b8d8d052f4d9a9fff699/photo/Report.jpg,,689-691 E Sixth St  South Boston  MA  02127,6.0,05,2.0,C6,South Boston / South Boston Waterfront,5.0,Ward 6,0608,R2,689-691 E Sixth St,2127.0,Address,127760.0,42.333,-71.0328,City Worker App,"(42.333, -71.0328)"
656392,101001626659,11/03/2015 10:46:42 AM,11/10/2015 10:46:41 AM,11/03/2015 10:46:47 AM,ONTIME,Closed,Case Closed. Closed date : 2015-11-03 10:46:47.39 Case Resolved Created Request for Recycling Bin,Recycling Cart Return,Public Works Department,Recycling,Recycling Cart Return,PWDx_IPL Damaged Cart Replacement,PWDx,https://cityworker.cityofboston.gov:8443/attachments/report/5638d6ded052f4d9a9fffd29/photo/Report.jpg,,478 Shawmut Ave  Roxbury  MA  02118,4.0,1C,7.0,D4,South End,6.0,Ward 9,0902,CM,478 Shawmut Ave,2118.0,Address,126364.0,42.3385,-71.076,City Worker App,"(42.3385, -71.076)"
657043,101001627609,11/04/2015 10:53:00 AM,11/12/2015 10:53:12 AM,11/12/2015 11:45:57 AM,OVERDUE,Closed,Case Closed. Closed date : 2015-11-12 11:45:57.163 Case Noted During inspection at this address there was no broken cart for replacement thank you,Recycling Cart Return,Public Works Department,Recycling,Recycling Cart Return,PWDx_IPL Damaged Cart Replacement,PWDx,,,46 W Selden St  Mattapan  MA  02126,8.0,07,4.0,B3,Greater Mattapan,9.0,Ward 18,1801,R2,46 W Selden St,2126.0,Address,125031.0,42.2792,-71.084,Constituent Call,"(42.2792, -71.084)"
657058,101001627631,11/04/2015 11:05:51 AM,11/12/2015 11:05:50 AM,11/04/2015 11:05:56 AM,ONTIME,Closed,Case Closed. Closed date : 2015-11-04 11:05:56.067 Case Resolved Created Request for Recycling Bin,Recycling Cart Return,Public Works Department,Recycling,Recycling Cart Return,PWDx_IPL Damaged Cart Replacement,PWDx,https://cityworker.cityofboston.gov:8443/attachments/report/563a2cded052f4d9aa00103f/photo/Report.jpg,,21 Concord St  Charlestown  MA  02129,3.0,1A,1.0,A15,Charlestown,2.0,Ward 2,0204,R1,21 Concord St,2129.0,Address,41729.0,42.3777,-71.0608,City Worker App,"(42.3777, -71.0608)"
657068,101001627648,11/04/2015 11:11:38 AM,11/12/2015 11:11:38 AM,11/04/2015 11:11:43 AM,ONTIME,Closed,Case Closed. Closed date : 2015-11-04 11:11:43.627 Case Resolved Created Request for Recycling Bin,Recycling Cart Return,Public Works Department,Recycling,Recycling Cart Return,PWDx_IPL Damaged Cart Replacement,PWDx,https://cityworker.cityofboston.gov:8443/attachments/report/563a2e3ad052f4d9aa001089/photo/Report.jpg,,INTERSECTION of Pleasant St & Perry Pl  Charlestown  MA,3.0,1A,1.0,A15,Charlestown,2.0,Ward 2,0203,,INTERSECTION Pleasant St & Perry Pl,,Intersection,7904.0,42.375,-71.0624,City Worker App,"(42.375, -71.0624)"
657098,101001627684,11/04/2015 11:37:14 AM,11/12/2015 11:37:13 AM,11/04/2015 11:37:19 AM,ONTIME,Closed,Case Closed. Closed date : 2015-11-04 11:37:19.037 Case Resolved Created Request for Recycling Bin,Recycling Cart Return,Public Works Department,Recycling,Recycling Cart Return,PWDx_IPL Damaged Cart Replacement,PWDx,,,634-636 E Seventh St  South Boston  MA  02127,6.0,05,2.0,C6,South Boston / South Boston Waterfront,5.0,Ward 6,0606,R2,634-636 E Seventh St,2127.0,Address,125450.0,42.3325,-71.0347,City Worker App,"(42.3325, -71.0347)"
657103,101001627693,11/04/2015 11:42:24 AM,11/12/2015 11:42:23 AM,11/04/2015 11:42:29 AM,ONTIME,Closed,Case Closed. Closed date : 2015-11-04 11:42:29.82 Case Resolved Created Request for Recycling Bin,Recycling Cart Return,Public Works Department,Recycling,Recycling Cart Return,PWDx_IPL Damaged Cart Replacement,PWDx,https://cityworker.cityofboston.gov:8443/attachments/report/563a356cd052f4d9aa00118b/photo/Report.jpg,,26 Levant St  Dorchester  MA  02122,7.0,03,4.0,C11,Dorchester,8.0,Ward 15,1502,R3,26 Levant St,2122.0,Address,85278.0,42.3037,-71.0692,City Worker App,"(42.3037, -71.0692)"
657110,101001627706,11/04/2015 11:47:15 AM,11/12/2015 11:47:14 AM,11/04/2015 11:47:20 AM,ONTIME,Closed,Case Closed. Closed date : 2015-11-04 11:47:20.023 Case Resolved Created Request for Recycling Bin,Recycling Cart Return,Public Works Department,Recycling,Recycling Cart Return,PWDx_IPL Damaged Cart Replacement,PWDx,https://cityworker.cityofboston.gov:8443/attachments/report/563a3691d052f4d9aa0011e5/photo/Report.jpg,,INTERSECTION of Boyle St & Cordis St  Charlestown  MA,3.0,1A,1.0,A15,Charlestown,2.0,Ward 2,0203,,INTERSECTION Boyle St & Cordis St,,Intersection,1759.0,42.3757,-71.0626,City Worker App,"(42.3757, -71.0626)"
657642,101001628545,11/05/2015 10:28:58 AM,11/13/2015 10:28:59 AM,11/05/2015 10:29:04 AM,ONTIME,Closed,Case Closed. Closed date : 2015-11-05 10:29:04.89 Case Resolved Created Request for Recycling Bin,Recycling Cart Return,Public Works Department,Recycling,Recycling Cart Return,PWDx_IPL Damaged Cart Replacement,PWDx,https://cityworker.cityofboston.gov:8443/attachments/report/563b75b9d052f4d9aa001d85/photo/Report.jpg,,INTERSECTION of Blue Hill Ave & Winthrop St  Roxbury  MA,7.0,03,7.0,B2,Roxbury,13.0,Ward 8,0807,,INTERSECTION Blue Hill Ave & Winthrop St,,Intersection,1604.0,42.3236,-71.0762,City Worker App,"(42.3236, -71.0762)"
657723,101001628674,11/05/2015 11:58:58 AM,11/13/2015 11:59:00 AM,11/05/2015 11:59:05 AM,ONTIME,Closed,Case Closed. Closed date : 2015-11-05 11:59:05.133 Case Resolved Created Request for Recycling Bin,Recycling Cart Return,Public Works Department,Recycling,Recycling Cart Return,PWDx_IPL Damaged Cart Replacement,PWDx,,,71-73 Neponset Ave  Roslindale  MA  02131,12.0,02,5.0,E18,Roslindale,10.0,Ward 18,1807,R2,71-73 Neponset Ave,2131.0,Address,100645.0,42.2863,-71.1152,City Worker App,"(42.2863, -71.1152)"
657786,101001628783,11/05/2015 01:23:10 PM,11/13/2015 01:23:12 PM,11/05/2015 01:23:21 PM,ONTIME,Closed,Case Closed. Closed date : 2015-11-05 13:23:21.363 Case Resolved Created Request for Recycling Bin,Recycling Cart Return,Public Works Department,Recycling,Recycling Cart Return,PWDx_IPL Damaged Cart Replacement,PWDx,https://cityworker.cityofboston.gov:8443/attachments/report/563b9e8ed052f4d9aa00223e/photo/Report.jpg,,261 Beacon St  Boston  MA  02116,4.0,1C,8.0,D4,Back Bay,14.0,Ward 5,0507,CM,261 Beacon St,2116.0,Address,10661.0,42.3533,-71.0795,City Worker App,"(42.3533, -71.0795)"
657878,101001628939,11/05/2015 03:14:00 PM,11/13/2015 03:14:45 PM,11/13/2015 09:34:30 AM,ONTIME,Closed,Case Closed Case Noted  Cart was removed on 11/13/15 thank you,Recycling Cart Return,Public Works Department,Recycling,Recycling Cart Return,PWDx_Recycling Cart Return,PWDx,,,8 Dixfield St  South Boston  MA  02127,6.0,05,2.0,C6,South Boston / South Boston Waterfront,5.0,Ward 7,0703,R1,8 Dixfield St,2127.0,Address,47974.0,42.3318,-71.0471,Constituent Call,"(42.3318, -71.0471)"
658248,101001629480,11/06/2015 09:55:01 AM,11/16/2015 09:55:01 AM,11/06/2015 09:55:08 AM,ONTIME,Closed,Case Closed. Closed date : 2015-11-06 09:55:08.327 Case Resolved Created Request for Recycling Bin,Recycling Cart Return,Public Works Department,Recycling,Recycling Cart Return,PWDx_IPL Damaged Cart Replacement,PWDx,https://cityworker.cityofboston.gov:8443/attachments/report/563cbf44d052f4d9aa002a81/photo/Report.jpg,,7 Everett St  Dorchester  MA  02122,7.0,07,3.0,C11,Dorchester,7.0,Ward 16,1602,R2,7 Everett St,2122.0,Address,232076.0,42.3016,-71.0532,City Worker App,"(42.3016, -71.0532)"
658326,101001629588,11/06/2015 11:00:23 AM,11/16/2015 11:00:23 AM,11/06/2015 11:00:31 AM,ONTIME,Closed,Case Closed. Closed date : 2015-11-06 11:00:31.943 Case Resolved Created Request for Recycling Bin,Recycling Cart Return,Public Works Department,Recycling,Recycling Cart Return,PWDx_IPL Damaged Cart Replacement,PWDx,https://cityworker.cityofboston.gov:8443/attachments/report/563cce96d052f4d9aa002cb0/photo/Report.jpg,,23 Upton St  Roxbury  MA  02118,4.0,1C,2.0,D4,South End,4.0,Ward 3,0307,A,23 Upton St,2118.0,Address,139572.0,42.3424,-71.072,City Worker App,"(42.3424, -71.072)"
658328,101001629592,11/06/2015 11:05:04 AM,11/16/2015 11:05:04 AM,11/06/2015 11:05:11 AM,ONTIME,Closed,Case Closed. Closed date : 2015-11-06 11:05:11.14 Case Resolved Created Request for Recycling Bin,Recycling Cart Return,Public Works Department,Recycling,Recycling Cart Return,PWDx_IPL Damaged Cart Replacement,PWDx,https://cityworker.cityofboston.gov:8443/attachments/report/563ccfaed052f4d9aa002cef/photo/Report.jpg,,INTERSECTION of H St & E Second St  South Boston  MA,6.0,05,2.0,C6,South Boston / South Boston Waterfront,5.0,Ward 6,0605,,INTERSECTION H St & E Second St,,Intersection,5532.0,42.3372,-71.0416,City Worker App,"(42.3372, -71.0416)"
659346,101001631024,11/09/2015 10:13:43 AM,11/17/2015 10:13:43 AM,11/09/2015 10:13:49 AM,ONTIME,Closed,Case Closed. Closed date : 2015-11-09 10:13:49.69 Case Resolved Created Request for Recycling Bin,Recycling Cart Return,Public Works Department,Recycling,Recycling Cart Return,PWDx_IPL Damaged Cart Replacement,PWDx,https://cityworker.cityofboston.gov:8443/attachments/report/5640b827d052f4d9aa004761/photo/Report.jpg,,16 Stonecrest Rd  Mattapan  MA  02126,8.0,07,5.0,B3,Greater Mattapan,9.0,Ward 18,1803,R1,16 Stonecrest Rd,2126.0,Address,130822.0,42.2773,-71.1061,City Worker App,"(42.2773, -71.1061)"
659351,101001631027,11/09/2015 10:15:06 AM,11/17/2015 10:15:05 AM,11/09/2015 10:15:11 AM,ONTIME,Closed,Case Closed. Closed date : 2015-11-09 10:15:11.77 Case Resolved Created Request for Recycling Bin,Recycling Cart Return,Public Works Department,Recycling,Recycling Cart Return,PWDx_IPL Damaged Cart Replacement,PWDx,https://cityworker.cityofboston.gov:8443/attachments/report/5640b878d052f4d9aa004787/photo/Report.jpg,,17 Stonecrest Rd  Mattapan  MA  02126,8.0,07,5.0,B3,Greater Mattapan,9.0,Ward 18,1803,R1,17 Stonecrest Rd,2126.0,Address,130823.0,42.2771,-71.1063,City Worker App,"(42.2771, -71.1063)"
659926,101001631827,11/10/2015 08:40:52 AM,11/18/2015 08:40:52 AM,11/10/2015 08:40:57 AM,ONTIME,Closed,Case Closed. Closed date : 2015-11-10 08:40:57.53 Case Resolved Created Request for Recycling Bin,Recycling Cart Return,Public Works Department,Recycling,Recycling Cart Return,PWDx_IPL Damaged Cart Replacement,PWDx,https://cityworker.cityofboston.gov:8443/attachments/report/5641f3ddd052f4d9aa005109/photo/Report.jpg,,INTERSECTION of Bigelow St & Hardwick St  Brighton  MA,11.0,04,9.0,D14,Allston / Brighton,15.0,Ward 22,2207,,INTERSECTION Bigelow St & Hardwick St,,Intersection,1411.0,42.355,-71.1672,City Worker App,"(42.355, -71.1672)"
660039,101001632004,11/10/2015 10:20:01 AM,11/18/2015 10:20:02 AM,11/10/2015 10:20:08 AM,ONTIME,Closed,Case Closed. Closed date : 2015-11-10 10:20:08.98 Case Resolved Created Request for Recycling Bin,Recycling Cart Return,Public Works Department,Recycling,Recycling Cart Return,PWDx_IPL Damaged Cart Replacement,PWDx,https://cityworker.cityofboston.gov:8443/attachments/report/56420b1ed052f4d9aa0054e0/photo/Report.jpg,,136 Rosseter St  Dorchester  MA  02121,7.0,03,4.0,C11,Dorchester,8.0,Ward 14,1404,R4,136 Rosseter St,2121.0,Address,118759.0,42.3011,-71.0726,City Worker App,"(42.3011, -71.0726)"
660100,101001632104,11/10/2015 11:24:00 AM,11/18/2015 11:24:42 AM,11/13/2015 01:56:34 PM,ONTIME,Closed,Case Closed. Closed date : 2015-11-13 13:56:34.667 Case Resolved cart picked up 11/13/2015,Recycling Cart Return,Public Works Department,Recycling,Recycling Cart Return,PWDx_Recycling Cart Return,PWDx,,,28 Wenham St  Jamaica Plain  MA  02130,12.0,02,6.0,E13,Jamaica Plain,10.0,Ward 19,1907,CM,28 Wenham St,2130.0,Address,147673.0,42.2964,-71.1151,Constituent Call,"(42.2964, -71.1151)"
660162,101001632209,11/10/2015 12:29:36 PM,11/18/2015 12:29:37 PM,11/10/2015 12:29:42 PM,ONTIME,Closed,Case Closed. Closed date : 2015-11-10 12:29:42.81 Case Resolved Created Request for Recycling Bin,Recycling Cart Return,Public Works Department,Recycling,Recycling Cart Return,PWDx_IPL Damaged Cart Replacement,PWDx,https://cityworker.cityofboston.gov:8443/attachments/report/5642297fd052f4d9aa00597c/photo/Report.jpg,,66 Boynton St  Jamaica Plain  MA  02130,9.0,02,6.0,E13,Jamaica Plain,11.0,Ward 11,1110,CM,66 Boynton St,2130.0,Address,18702.0,42.3055,-71.1119,City Worker App,"(42.3055, -71.1119)"
660168,101001632216,11/10/2015 12:33:24 PM,11/18/2015 12:33:24 PM,11/10/2015 12:33:30 PM,ONTIME,Closed,Case Closed. Closed date : 2015-11-10 12:33:30.357 Case Resolved Created Request for Recycling Bin,Recycling Cart Return,Public Works Department,Recycling,Recycling Cart Return,PWDx_IPL Damaged Cart Replacement,PWDx,https://cityworker.cityofboston.gov:8443/attachments/report/56422a64d052f4d9aa005995/photo/Report.jpg,,66 Boynton St  Jamaica Plain  MA  02130,9.0,02,6.0,E13,Jamaica Plain,11.0,Ward 11,1110,CM,66 Boynton St,2130.0,Address,18702.0,42.3055,-71.1119,City Worker App,"(42.3055, -71.1119)"
660666,101001632918,11/11/2015 11:18:34 AM,11/19/2015 08:30:00 AM,11/11/2015 11:18:39 AM,ONTIME,Closed,Case Closed. Closed date : 2015-11-11 11:18:39.243 Case Resolved Created Request for Recycling Bin,Recycling Cart Return,Public Works Department,Recycling,Recycling Cart Return,PWDx_IPL Damaged Cart Replacement,PWDx,https://cityworker.cityofboston.gov:8443/attachments/report/56436a55d052f4d9aa0063b4/photo/Report.jpg,,10 Thompson Sq  Charlestown  MA  02129,3.0,1A,1.0,A15,Charlestown,2.0,Ward 2,0201,C,10 Thompson Sq,2129.0,Address,135695.0,42.3749,-71.0637,City Worker App,"(42.3749, -71.0637)"
660703,101001632968,11/11/2015 01:05:00 PM,11/19/2015 08:30:00 AM,11/13/2015 09:35:18 AM,ONTIME,Closed,Case Closed Case Noted  Cart was removed on 11/13/15,Recycling Cart Return,Public Works Department,Recycling,Recycling Cart Return,PWDx_Recycling Cart Return,PWDx,,,550 E Eighth St  South Boston  MA  02127,6.0,05,2.0,C6,South Boston / South Boston Waterfront,5.0,Ward 7,0702,CM,550 E Eighth St,2127.0,Address,52266.0,42.3315,-71.0395,Constituent Call,"(42.3315, -71.0395)"
660858,101001633186,11/12/2015 08:17:17 AM,11/19/2015 08:30:00 AM,11/12/2015 08:17:23 AM,ONTIME,Closed,Case Closed. Closed date : 2015-11-12 08:17:23.73 Case Resolved Created Request for Recycling Bin,Recycling Cart Return,Public Works Department,Recycling,Recycling Cart Return,PWDx_IPL Damaged Cart Replacement,PWDx,https://cityworker.cityofboston.gov:8443/attachments/report/5644915ad052f4d9aa00675b/photo/Report.jpg,,21 Blakeville St  Dorchester  MA  02121,7.0,03,4.0,C11,Dorchester,8.0,Ward 15,1502,CM,21 Blakeville St,2121.0,Address,15930.0,42.3046,-71.0706,City Worker App,"(42.3046, -71.0706)"
661053,101001633465,11/12/2015 11:29:13 AM,11/19/2015 11:29:13 AM,11/12/2015 11:29:17 AM,ONTIME,Closed,Case Closed. Closed date : 2015-11-12 11:29:17.967 Case Resolved Created Request for Recycling Bin,Recycling Cart Return,Public Works Department,Recycling,Recycling Cart Return,PWDx_IPL Damaged Cart Replacement,PWDx,https://cityworker.cityofboston.gov:8443/attachments/report/5644be57d052f4d9aa006eb4/photo/Report.jpg,,59 Homes Ave  Dorchester  MA  02122,7.0,03,4.0,C11,Dorchester,8.0,Ward 15,1505,R2,59 Homes Ave,2122.0,Address,75048.0,42.3028,-71.0687,City Worker App,"(42.3028, -71.0687)"
661102,101001633524,11/12/2015 12:16:45 PM,11/19/2015 12:16:45 PM,11/12/2015 12:16:50 PM,ONTIME,Closed,Case Closed. Closed date : 2015-11-12 12:16:50.74 Case Resolved Created Request for Recycling Bin,Recycling Cart Return,Public Works Department,Recycling,Recycling Cart Return,PWDx_IPL Damaged Cart Replacement,PWDx,https://cityworker.cityofboston.gov:8443/attachments/report/5644c97dd052f4d9aa007133/photo/Report.jpg,,672 Adams St  Dorchester  MA  02122,8.0,07,3.0,C11,Dorchester,7.0,Ward 16,1609,R3,672 Adams St,2122.0,Address,894.0,42.2869,-71.0543,City Worker App,"(42.2869, -71.0543)"
661106,101001633529,11/12/2015 12:19:27 PM,11/19/2015 12:19:27 PM,11/12/2015 12:19:32 PM,ONTIME,Closed,Case Closed. Closed date : 2015-11-12 12:19:32.53 Case Resolved Created Request for Recycling Bin,Recycling Cart Return,Public Works Department,Recycling,Recycling Cart Return,PWDx_IPL Damaged Cart Replacement,PWDx,https://cityworker.cityofboston.gov:8443/attachments/report/5644ca1ed052f4d9aa007155/photo/Report.jpg,,648 Adams St  Dorchester  MA  02122,8.0,07,3.0,C11,Dorchester,7.0,Ward 16,1609,R3,648 Adams St,2122.0,Address,870.0,42.2878,-71.0547,City Worker App,"(42.2878, -71.0547)"
661142,101001633577,11/12/2015 01:14:22 PM,11/19/2015 01:14:21 PM,11/12/2015 01:14:27 PM,ONTIME,Closed,Case Closed. Closed date : 2015-11-12 13:14:27.23 Case Resolved Created Request for Recycling Bin,Recycling Cart Return,Public Works Department,Recycling,Recycling Cart Return,PWDx_IPL Damaged Cart Replacement,PWDx,https://cityworker.cityofboston.gov:8443/attachments/report/5644d6fcd052f4d9aa007334/photo/Report.jpg,,122-126 Cedar St  Roxbury  MA  02119,9.0,10B,7.0,B2,Roxbury,13.0,Ward 11,1101,R2,122-126 Cedar St,2119.0,Address,26771.0,42.327,-71.0941,City Worker App,"(42.327, -71.0941)"
661185,101001633627,11/12/2015 01:52:59 PM,11/19/2015 01:52:59 PM,11/12/2015 01:53:04 PM,ONTIME,Closed,Case Closed. Closed date : 2015-11-12 13:53:04.4 Case Resolved Created Request for Recycling Bin,Recycling Cart Return,Public Works Department,Recycling,Recycling Cart Return,PWDx_IPL Damaged Cart Replacement,PWDx,https://cityworker.cityofboston.gov:8443/attachments/report/5644e00bd052f4d9aa0073f3/photo/Report.jpg,,26-28 Cedar Park  Roxbury  MA  02119,9.0,10B,7.0,B2,Roxbury,13.0,Ward 11,1101,R2,26-28 Cedar Park,2119.0,Address,26680.0,42.3266,-71.0937,City Worker App,"(42.3266, -71.0937)"
661505,101001634063,11/13/2015 09:11:20 AM,11/20/2015 09:11:19 AM,11/13/2015 09:11:28 AM,ONTIME,Closed,Case Closed. Closed date : 2015-11-13 09:11:28.373 Case Resolved Created Request for Recycling Bin,Recycling Cart Return,Public Works Department,Recycling,Recycling Cart Return,PWDx_IPL Damaged Cart Replacement,PWDx,https://cityworker.cityofboston.gov:8443/attachments/report/5645ef83d052f4d9aa0079b8/photo/Report.jpg,,36 Emerson St  South Boston  MA  02127,6.0,05,2.0,C6,South Boston / South Boston Waterfront,5.0,Ward 6,0605,R3,36 Emerson St,2127.0,Address,53665.0,42.3366,-71.0427,City Worker App,"(42.3366, -71.0427)"
661583,101001634190,11/13/2015 10:29:00 AM,11/20/2015 10:29:19 AM,11/18/2015 07:55:30 AM,ONTIME,Closed,Case Closed Case Noted  Cart was removed on 11/17/2015 thank you.,Recycling Cart Return,Public Works Department,Recycling,Recycling Cart Return,PWDx_Recycling Cart Return,PWDx,,,156 W Newton St  Roxbury  MA  02118,4.0,1C,7.0,D4,South End,6.0,Ward 4,0404,R3,156 W Newton St,2118.0,Address,102425.0,42.3424,-71.0779,Constituent Call,"(42.3424, -71.0779)"
661695,101001634348,11/13/2015 12:45:22 PM,11/20/2015 12:45:22 PM,11/13/2015 12:45:26 PM,ONTIME,Closed,Case Closed. Closed date : 2015-11-13 12:45:26.687 Case Resolved Created Request for Recycling Bin,Recycling Cart Return,Public Works Department,Recycling,Recycling Cart Return,PWDx_IPL Damaged Cart Replacement,PWDx,,,INTERSECTION of Adams St & Oakton Ave  Dorchester  MA,8.0,07,3.0,C11,Dorchester,7.0,Ward 16,1609,,INTERSECTION Adams St & Oakton Ave,,Intersection,128.0,42.2866,-71.0545,City Worker App,"(42.2866, -71.0545)"
662697,101001635724,11/16/2015 10:52:00 AM,11/23/2015 10:52:13 AM,11/23/2015 09:46:09 AM,ONTIME,Closed,Case Closed. Closed date : 2015-11-23 09:46:09.173 Case Noted Removed broken cart r9#0031809 replaced with cart 515#0059765 on 11/23/15.,Recycling Cart Return,Public Works Department,Recycling,Recycling Cart Return,PWDx_IPL Damaged Cart Replacement,PWDx,,,14 Livingstone St  Dorchester  MA  02124,8.0,07,4.0,B3,Greater Mattapan,9.0,Ward 14,1412,R3,14 Livingstone St,2124.0,Address,265382.0,42.2853,-71.0897,Constituent Call,"(42.2853, -71.0897)"
662803,101001635871,11/16/2015 12:19:27 PM,11/23/2015 12:19:28 PM,11/16/2015 12:19:33 PM,ONTIME,Closed,Case Closed. Closed date : 2015-11-16 12:19:33.097 Case Resolved Created Request for Recycling Bin,Recycling Cart Return,Public Works Department,Recycling,Recycling Cart Return,PWDx_IPL Damaged Cart Replacement,PWDx,https://cityworker.cityofboston.gov:8443/attachments/report/564a101ed052f4d9aa009f4e/photo/Report.jpg,,129 Parsons St  Brighton  MA  02135,11.0,04,9.0,D14,Allston / Brighton,15.0,Ward 22,2212,R2,129 Parsons St,2135.0,Address,108301.0,42.3546,-71.155,City Worker App,"(42.3546, -71.155)"
663228,101001636452,11/17/2015 07:56:56 AM,11/24/2015 08:30:00 AM,11/17/2015 07:57:03 AM,ONTIME,Closed,Case Closed. Closed date : 2015-11-17 07:57:03.42 Case Resolved Created Request for Recycling Bin,Recycling Cart Return,Public Works Department,Recycling,Recycling Cart Return,PWDx_IPL Damaged Cart Replacement,PWDx,https://cityworker.cityofboston.gov:8443/attachments/report/564b2413d052f4d9aa00a70f/photo/Report.jpg,,7 Bicknell St  Dorchester  MA  02121,7.0,03,4.0,B3,Greater Mattapan,8.0,Ward 14,1402,R3,7 Bicknell St,2121.0,Address,15327.0,42.2967,-71.0822,City Worker App,"(42.2967, -71.0822)"
663447,101001636784,11/17/2015 11:34:00 AM,11/24/2015 11:34:01 AM,11/24/2015 09:23:06 AM,ONTIME,Closed,Case Closed. Closed date : 2015-11-24 09:23:06.19 Case Resolved Removed cart r9#010079 replaced with new cart 515#0029455 on 11/24/15.,Recycling Cart Return,Public Works Department,Recycling,Recycling Cart Return,PWDx_IPL Damaged Cart Replacement,PWDx,,,56 W Milton St  Hyde Park  MA  02136,12.0,08,5.0,E18,Hyde Park,10.0,Ward 18,1820,R2,56 W Milton St,2136.0,Address,95917.0,42.2399,-71.1395,Constituent Call,"(42.2399, -71.1395)"
663934,101001637480,11/18/2015 08:59:23 AM,11/25/2015 08:59:24 AM,11/18/2015 08:59:28 AM,ONTIME,Closed,Case Closed. Closed date : 2015-11-18 08:59:28.203 Case Resolved Created Request for Recycling Bin,Recycling Cart Return,Public Works Department,Recycling,Recycling Cart Return,PWDx_IPL Damaged Cart Replacement,PWDx,,,583 E Fourth St  South Boston  MA  02127,6.0,05,2.0,C6,South Boston / South Boston Waterfront,5.0,Ward 7,0703,R3,583 E Fourth St,2127.0,Address,59868.0,42.3345,-71.0423,City Worker App,"(42.3345, -71.0423)"
663988,101001637559,11/18/2015 09:42:00 AM,11/25/2015 09:42:50 AM,11/25/2015 08:04:26 AM,ONTIME,Closed,Case Closed. Closed date : 2015-11-25 08:04:26.873 Case Noted Removed old cart 0312411740 and replaced with cart 515#0029457 on 11/25/15 at 7:02 a.m.,Recycling Cart Return,Public Works Department,Recycling,Recycling Cart Return,PWDx_IPL Damaged Cart Replacement,PWDx,,,19 Linvale Ter  Mattapan  MA  02126,8.0,07,4.0,B3,Greater Mattapan,9.0,Ward 18,1804,R2,19 Linvale Ter,2126.0,Address,86597.0,42.2711,-71.0876,Constituent Call,"(42.2711, -71.0876)"
664012,101001637588,11/18/2015 10:00:00 AM,11/25/2015 10:00:01 AM,11/18/2015 10:00:10 AM,ONTIME,Closed,Case Closed. Closed date : 2015-11-18 10:00:10.32 Case Resolved Created Request for Recycling Bin,Recycling Cart Return,Public Works Department,Recycling,Recycling Cart Return,PWDx_IPL Damaged Cart Replacement,PWDx,https://cityworker.cityofboston.gov:8443/attachments/report/564c926dd052f4d9aa00c095/photo/Report.jpg,,549 E Eighth St  South Boston  MA  02127,6.0,05,2.0,C6,South Boston / South Boston Waterfront,5.0,Ward 7,0702,R3,549 E Eighth St,2127.0,Address,52265.0,42.3313,-71.0396,City Worker App,"(42.3313, -71.0396)"
664087,101001637696,11/18/2015 11:05:37 AM,11/25/2015 11:05:38 AM,11/18/2015 11:05:44 AM,ONTIME,Closed,Case Closed. Closed date : 2015-11-18 11:05:44.293 Case Resolved Created Request for Recycling Bin,Recycling Cart Return,Public Works Department,Recycling,Recycling Cart Return,PWDx_IPL Damaged Cart Replacement,PWDx,https://cityworker.cityofboston.gov:8443/attachments/report/564ca1ced052f4d9aa00c42a/photo/Report.jpg,,4 Hoffman St  Jamaica Plain  MA  02130,9.0,10A,6.0,E13,Jamaica Plain,11.0,10,1007,,4 Hoffman St,2130.0,Address,344817.0,42.3594,-71.0587,City Worker App,"(0, 0)"
664101,101001637709,11/18/2015 11:15:00 AM,11/25/2015 11:15:02 AM,11/25/2015 08:03:24 AM,ONTIME,Closed,Case Closed. Closed date : 2015-11-25 08:03:24.51 Case Noted Removed old cart r9#017142 and left cart 515#0029458 on 11/25/15 at 6:58 a.m.,Recycling Cart Return,Public Works Department,Recycling,Recycling Cart Return,PWDx_IPL Damaged Cart Replacement,PWDx,,,23 Meadowbank Ave  Mattapan  MA  02126,8.0,07,4.0,B3,Greater Mattapan,9.0,Ward 18,1801,R2,23 Meadowbank Ave,2126.0,Address,93623.0,42.2703,-71.0818,Constituent Call,"(42.2703, -71.0818)"
664263,101001637938,11/18/2015 01:50:20 PM,11/25/2015 01:50:20 PM,11/18/2015 01:50:23 PM,ONTIME,Closed,Case Closed. Closed date : 2015-11-18 13:50:23.89 Case Resolved Created Request for Recycling Bin,Recycling Cart Return,Public Works Department,Recycling,Recycling Cart Return,PWDx_IPL Damaged Cart Replacement,PWDx,,,294 Bunker Hill St  Charlestown  MA  02129,3.0,1A,1.0,A15,Charlestown,2.0,Ward 2,0205,R2,294 Bunker Hill St,2129.0,Address,23515.0,42.3804,-71.0658,City Worker App,"(42.3804, -71.0658)"
664603,101001638427,11/19/2015 08:38:46 AM,11/27/2015 08:38:46 AM,11/19/2015 08:38:49 AM,ONTIME,Closed,Case Closed. Closed date : 2015-11-19 08:38:49.74 Case Resolved Created Request for Recycling Bin,Recycling Cart Return,Public Works Department,Recycling,Recycling Cart Return,PWDx_IPL Damaged Cart Replacement,PWDx,,,915 E Second St  South Boston  MA  02127,6.0,05,2.0,C6,South Boston / South Boston Waterfront,5.0,Ward 6,0609,R2,915 E Second St,2127.0,Address,308405.0,42.3373,-71.0267,City Worker App,"(42.3373, -71.0267)"
664684,101001638554,11/19/2015 09:52:35 AM,11/27/2015 09:52:35 AM,11/19/2015 09:52:40 AM,ONTIME,Closed,Case Closed. Closed date : 2015-11-19 09:52:40.867 Case Resolved Created Request for Recycling Bin,Recycling Cart Return,Public Works Department,Recycling,Recycling Cart Return,PWDx_IPL Damaged Cart Replacement,PWDx,https://cityworker.cityofboston.gov:8443/attachments/report/564de22ed052f4d9aa00d3a2/photo/Report.jpg,,44 Pierce Ave  Dorchester  MA  02122,8.0,07,3.0,C11,Dorchester,7.0,Ward 16,1609,R1,44 Pierce Ave,2122.0,Address,110217.0,42.2877,-71.0524,City Worker App,"(42.2877, -71.0524)"
664691,101001638560,11/19/2015 09:56:12 AM,11/27/2015 09:56:12 AM,11/19/2015 09:56:17 AM,ONTIME,Closed,Case Closed. Closed date : 2015-11-19 09:56:17.15 Case Resolved Created Request for Recycling Bin,Recycling Cart Return,Public Works Department,Recycling,Recycling Cart Return,PWDx_IPL Damaged Cart Replacement,PWDx,https://cityworker.cityofboston.gov:8443/attachments/report/564de307d052f4d9aa00d3bb/photo/Report.jpg,,412 W Second St  South Boston  MA  02127,6.0,05,2.0,C6,South Boston / South Boston Waterfront,5.0,Ward 6,0604,R1,412 W Second St,2127.0,Address,124724.0,42.3375,-71.0449,City Worker App,"(42.3375, -71.0449)"
664695,101001638566,11/19/2015 09:58:35 AM,11/27/2015 09:58:35 AM,11/19/2015 09:58:40 AM,ONTIME,Closed,Case Closed. Closed date : 2015-11-19 09:58:40.543 Case Resolved Created Request for Recycling Bin,Recycling Cart Return,Public Works Department,Recycling,Recycling Cart Return,PWDx_IPL Damaged Cart Replacement,PWDx,https://cityworker.cityofboston.gov:8443/attachments/report/564de39ad052f4d9aa00d3df/photo/Report.jpg,,45 Coffey St  Dorchester  MA  02122,8.0,07,3.0,C11,Dorchester,7.0,16,1610,C,45 Coffey St,2122.0,Address,34220.0,42.2887,-71.0486,City Worker App,"(42.2887, -71.0486)"
664698,101001638570,11/19/2015 09:59:46 AM,11/27/2015 09:59:46 AM,11/19/2015 09:59:51 AM,ONTIME,Closed,Case Closed. Closed date : 2015-11-19 09:59:51.99 Case Resolved Created Request for Recycling Bin,Recycling Cart Return,Public Works Department,Recycling,Recycling Cart Return,PWDx_IPL Damaged Cart Replacement,PWDx,https://cityworker.cityofboston.gov:8443/attachments/report/564de3e0d052f4d9aa00d3fe/photo/Report.jpg,,264 Bolton St  South Boston  MA  02127,6.0,05,2.0,C6,South Boston / South Boston Waterfront,5.0,Ward 6,0604,R3,264 Bolton St,2127.0,Address,16861.0,42.3376,-71.046,City Worker App,"(42.3376, -71.046)"
664700,101001638572,11/19/2015 10:00:13 AM,11/27/2015 10:00:13 AM,11/19/2015 10:00:17 AM,ONTIME,Closed,Case Closed. Closed date : 2015-11-19 10:00:17.947 Case Resolved Created Request for Recycling Bin,Recycling Cart Return,Public Works Department,Recycling,Recycling Cart Return,PWDx_IPL Damaged Cart Replacement,PWDx,https://cityworker.cityofboston.gov:8443/attachments/report/564de3fdd052f4d9aa00d421/photo/Report.jpg,,45 Coffey St  Dorchester  MA  02122,8.0,07,3.0,C11,Dorchester,7.0,16,1610,C,45 Coffey St,2122.0,Address,34220.0,42.2887,-71.0486,City Worker App,"(42.2887, -71.0486)"
664745,101001638643,11/19/2015 10:51:13 AM,11/27/2015 10:51:13 AM,11/19/2015 10:51:18 AM,ONTIME,Closed,Case Closed. Closed date : 2015-11-19 10:51:18.69 Case Resolved Created Request for Recycling Bin,Recycling Cart Return,Public Works Department,Recycling,Recycling Cart Return,PWDx_IPL Damaged Cart Replacement,PWDx,https://cityworker.cityofboston.gov:8443/attachments/report/564deff1d052f4d9aa00d5ed/photo/Report.jpg,,86 Mount Pleasant Ave  Roxbury  MA  02119,7.0,10B,7.0,B2,Roxbury,13.0,Ward 8,0807,R1,86 Mount Pleasant Ave,2119.0,Address,98423.0,42.3258,-71.0778,City Worker App,"(42.3258, -71.0778)"
664753,101001638653,11/19/2015 10:58:56 AM,11/27/2015 10:58:56 AM,11/19/2015 10:59:02 AM,ONTIME,Closed,Case Closed. Closed date : 2015-11-19 10:59:02.14 Case Resolved Created Request for Recycling Bin,Recycling Cart Return,Public Works Department,Recycling,Recycling Cart Return,PWDx_IPL Damaged Cart Replacement,PWDx,https://cityworker.cityofboston.gov:8443/attachments/report/564df1bfd052f4d9aa00d645/photo/Report.jpg,,770 Hyde Park Ave  Hyde Park  MA  02136,12.0,08,5.0,E18,Hyde Park,10.0,Ward 18,1808,R1,770 Hyde Park Ave,2136.0,Address,77559.0,42.2737,-71.1197,City Worker App,"(42.2737, -71.1197)"
665371,101001639539,11/20/2015 11:04:00 AM,11/30/2015 11:04:56 AM,11/30/2015 08:18:20 AM,ONTIME,Closed,Case Closed. Closed date : 2015-11-30 08:18:20.15 Case Noted Old broken cart was removed and new replacement was issued 06144022922,Recycling Cart Return,Public Works Department,Recycling,Recycling Cart Return,PWDx_IPL Damaged Cart Replacement,PWDx,,https://cityworker.cityofboston.gov:8443/attachments/report/564f44ead052db5a46e9c469/closed_photo/Report.jpg,12 Buttonwood St  Dorchester  MA  02125,7.0,03,3.0,C11,Dorchester,7.0,Ward 13,1307,R3,12 Buttonwood St,2125.0,Address,24394.0,42.3195,-71.0561,Constituent Call,"(42.3195, -71.0561)"
666669,101001641517,11/23/2015 08:43:00 PM,12/02/2015 08:30:00 AM,11/25/2015 07:53:03 AM,ONTIME,Closed,Case Closed. Closed date : 2015-11-25 07:53:03.697 Case Noted no cart was out this location 11/25/2015,Recycling Cart Return,Public Works Department,Recycling,Recycling Cart Return,PWDx_Recycling Cart Return,PWDx,,,113 Princeton St  East Boston  MA  02128,1.0,09,1.0,A7,East Boston,1.0,Ward 1,0106,R3,113 Princeton St,2128.0,Address,113143.0,42.3776,-71.0353,Constituent Call,"(42.3776, -71.0353)"
666845,101001641834,11/24/2015 10:23:17 AM,12/02/2015 10:23:17 AM,11/24/2015 10:23:21 AM,ONTIME,Closed,Case Closed. Closed date : 2015-11-24 10:23:21.653 Case Resolved Created Request for Recycling Bin,Recycling Cart Return,Public Works Department,Recycling,Recycling Cart Return,PWDx_IPL Damaged Cart Replacement,PWDx,,,59 Hemenway St  Boston  MA  02115,4.0,10A,8.0,D4,Fenway / Kenmore / Audubon Circle / Longwood,14.0,Ward 4,0407,CM,59 Hemenway St,2115.0,Address,72714.0,42.3449,-71.0899,City Worker App,"(42.3449, -71.0899)"
666969,101001642041,11/24/2015 12:59:50 PM,12/02/2015 12:59:52 PM,11/24/2015 12:59:58 PM,ONTIME,Closed,Case Closed. Closed date : 2015-11-24 12:59:58.243 Case Resolved Created Request for Recycling Bin,Recycling Cart Return,Public Works Department,Recycling,Recycling Cart Return,PWDx_IPL Damaged Cart Replacement,PWDx,https://cityworker.cityofboston.gov:8443/attachments/report/5654a597d052851ecec788ac/photo/Report.jpg,,15 Rockwood Ter  Jamaica Plain  MA  02130,9.0,02,6.0,E13,Jamaica Plain,11.0,Ward 19,1902,R1,15 Rockwood Ter,2130.0,Address,118000.0,42.313,-71.1269,City Worker App,"(42.313, -71.1269)"
667304,101001642514,11/25/2015 08:07:00 AM,12/03/2015 08:30:00 AM,12/04/2015 02:35:51 PM,OVERDUE,Closed,Case Closed. Closed date : 2015-12-04 14:35:51.483 Case Resolved damaged cart swapped new cart # 5150059421 12/04/2015,Recycling Cart Return,Public Works Department,Recycling,Recycling Cart Return,PWDx_IPL Damaged Cart Replacement,PWDx,,,43 Morris St  East Boston  MA  02128,1.0,09,1.0,A7,East Boston,1.0,Ward 1,0105,R2,43 Morris St,2128.0,Address,97544.0,42.3757,-71.0328,Constituent Call,"(42.3757, -71.0328)"
667315,101001642536,11/25/2015 08:14:24 AM,12/03/2015 08:30:00 AM,11/25/2015 08:14:30 AM,ONTIME,Closed,Case Closed. Closed date : 2015-11-25 08:14:30.723 Case Resolved Created Request for Recycling Bin,Recycling Cart Return,Public Works Department,Recycling,Recycling Cart Return,PWDx_IPL Damaged Cart Replacement,PWDx,https://cityworker.cityofboston.gov:8443/attachments/report/5655b42cd052851ecec791c0/photo/Report.jpg,,524 E Seventh St  South Boston  MA  02127,6.0,05,2.0,C6,South Boston / South Boston Waterfront,5.0,Ward 7,0702,R3,524 E Seventh St,2127.0,Address,308992.0,42.3324,-71.0395,City Worker App,"(42.3324, -71.0395)"
667381,101001642655,11/25/2015 09:26:31 AM,12/03/2015 09:26:31 AM,11/25/2015 09:26:36 AM,ONTIME,Closed,Case Closed. Closed date : 2015-11-25 09:26:36.96 Case Resolved Created Request for Recycling Bin,Recycling Cart Return,Public Works Department,Recycling,Recycling Cart Return,PWDx_IPL Damaged Cart Replacement,PWDx,https://cityworker.cityofboston.gov:8443/attachments/report/5655c514d052851ecec794b1/photo/Report.jpg,,504-504R E Seventh St  South Boston  MA  02127,6.0,05,2.0,C6,South Boston / South Boston Waterfront,5.0,Ward 7,0702,R2,504-504R E Seventh St,2127.0,Address,125358.0,42.3323,-71.0404,City Worker App,"(42.3323, -71.0404)"
667452,101001642757,11/25/2015 10:25:00 AM,12/03/2015 10:25:13 AM,12/01/2015 01:57:40 PM,ONTIME,Closed,Case Closed. Closed date : 2015-12-01 13:57:40.723 Case Noted New cart was delivered 515#0059414,Recycling Cart Return,Public Works Department,Recycling,Recycling Cart Return,PWDx_IPL Damaged Cart Replacement,PWDx,,https://cityworker.cityofboston.gov:8443/attachments/report/5655d31fd052db5a46ea7756/closed_photo/Report.jpg,99 Hillside St  Mission Hill  MA  02120,9.0,10A,8.0,B2,Mission Hill,14.0,Ward 10,1003,RL,99 Hillside St,2120.0,Address,74287.0,42.331,-71.1042,Constituent Call,"(42.331, -71.1042)"
667588,101001642952,11/25/2015 01:00:31 PM,12/03/2015 01:00:31 PM,11/25/2015 01:00:36 PM,ONTIME,Closed,Case Closed. Closed date : 2015-11-25 13:00:36.527 Case Resolved Created Request for Recycling Bin,Recycling Cart Return,Public Works Department,Recycling,Recycling Cart Return,PWDx_IPL Damaged Cart Replacement,PWDx,https://cityworker.cityofboston.gov:8443/attachments/report/5655f73fd052851ecec79b46/photo/Report.jpg,,2 Monument Sq  Charlestown  MA  02129,3.0,1A,1.0,A15,Charlestown,2.0,Ward 2,0203,CM,2 Monument Sq,2129.0,Address,96969.0,42.3754,-71.0601,City Worker App,"(42.3754, -71.0601)"
667881,101001643338,11/27/2015 09:30:03 AM,12/04/2015 09:30:03 AM,11/27/2015 09:30:09 AM,ONTIME,Closed,Case Closed. Closed date : 2015-11-27 09:30:09.737 Case Resolved Created Request for Recycling Bin,Recycling Cart Return,Public Works Department,Recycling,Recycling Cart Return,PWDx_IPL Damaged Cart Replacement,PWDx,https://cityworker.cityofboston.gov:8443/attachments/report/565868e8d052851ecec7a427/photo/Report.jpg,,12 Carpenter St  South Boston  MA  02127,6.0,05,2.0,C6,South Boston / South Boston Waterfront,5.0,07,0706,R2,12 Carpenter St,2127.0,Address,26045.0,42.329,-71.0562,City Worker App,"(42.329, -71.0562)"
668142,101001643662,11/27/2015 03:57:00 PM,12/04/2015 03:57:56 PM,12/03/2015 02:28:20 PM,ONTIME,Closed,Case Closed. Closed date : 2015-12-03 14:28:20.4 Case Resolved returned cart picked up 12/03/2015,Recycling Cart Return,Public Works Department,Recycling,Recycling Cart Return,PWDx_Recycling Cart Return,PWDx,,,25-27 Rogers Park Ave  Brighton  MA  02135,11.0,04,9.0,D14,Brighton,15.0,22,2209,,25-27 Rogers Park Ave,2135.0,Address,355518.0,42.3594,-71.0587,Constituent Call,"(0, 0)"
668333,101001643883,11/28/2015 12:28:02 PM,12/07/2015 08:30:00 AM,11/28/2015 12:28:09 PM,ONTIME,Closed,Case Closed. Closed date : 2015-11-28 12:28:09.653 Case Resolved Created Request for Recycling Bin,Recycling Cart Return,Public Works Department,Recycling,Recycling Cart Return,PWDx_IPL Damaged Cart Replacement,PWDx,https://cityworker.cityofboston.gov:8443/attachments/report/5659e41ed052851ecec7b293/photo/Report.jpg,,137 Savin Hill Ave  Dorchester  MA  02125,7.0,03,3.0,C11,Dorchester,7.0,Ward 13,1310,R3,137 Savin Hill Ave,2125.0,Address,123178.0,42.3105,-71.0524,City Worker App,"(42.3105, -71.0524)"
668336,101001643887,11/28/2015 12:34:02 PM,12/07/2015 08:30:00 AM,11/28/2015 12:34:06 PM,ONTIME,Closed,Case Closed. Closed date : 2015-11-28 12:34:06.707 Case Resolved Created Request for Recycling Bin,Recycling Cart Return,Public Works Department,Recycling,Recycling Cart Return,PWDx_IPL Damaged Cart Replacement,PWDx,https://cityworker.cityofboston.gov:8443/attachments/report/5659e589d052851ecec7b2a6/photo/Report.jpg,,220 Savin Hill Ave  Dorchester  MA  02125,7.0,03,3.0,C11,Dorchester,7.0,Ward 13,1310,R2,220 Savin Hill Ave,2125.0,Address,123274.0,42.3093,-71.0478,City Worker App,"(42.3093, -71.0478)"
668339,101001643889,11/28/2015 12:39:14 PM,12/07/2015 08:30:00 AM,11/28/2015 12:39:19 PM,ONTIME,Closed,Case Closed. Closed date : 2015-11-28 12:39:19.683 Case Resolved Created Request for Recycling Bin,Recycling Cart Return,Public Works Department,Recycling,Recycling Cart Return,PWDx_IPL Damaged Cart Replacement,PWDx,https://cityworker.cityofboston.gov:8443/attachments/report/5659e6bdd052851ecec7b2c8/photo/Report.jpg,,18 Grampian Way  Dorchester  MA  02125,7.0,03,3.0,C11,Dorchester,7.0,Ward 13,1310,R2,18 Grampian Way,2125.0,Address,242833.0,42.3112,-71.0516,City Worker App,"(42.3112, -71.0516)"
668341,101001643892,11/28/2015 12:40:09 PM,12/07/2015 08:30:00 AM,11/28/2015 12:40:15 PM,ONTIME,Closed,Case Closed. Closed date : 2015-11-28 12:40:15.01 Case Resolved Created Request for Recycling Bin,Recycling Cart Return,Public Works Department,Recycling,Recycling Cart Return,PWDx_IPL Damaged Cart Replacement,PWDx,https://cityworker.cityofboston.gov:8443/attachments/report/5659e6f2d052851ecec7b2d8/photo/Report.jpg,,18 Grampian Way  Dorchester  MA  02125,7.0,03,3.0,C11,Dorchester,7.0,Ward 13,1310,R2,18 Grampian Way,2125.0,Address,242833.0,42.3112,-71.0516,City Worker App,"(42.3112, -71.0516)"
668345,101001643898,11/28/2015 12:45:37 PM,12/07/2015 08:30:00 AM,11/28/2015 12:45:42 PM,ONTIME,Closed,Case Closed. Closed date : 2015-11-28 12:45:42.647 Case Resolved Created Request for Recycling Bin,Recycling Cart Return,Public Works Department,Recycling,Recycling Cart Return,PWDx_IPL Damaged Cart Replacement,PWDx,https://cityworker.cityofboston.gov:8443/attachments/report/5659e83ed052851ecec7b2ea/photo/Report.jpg,,329-331 Savin Hill Ave  Dorchester  MA  02125,7.0,03,3.0,C11,Dorchester,7.0,Ward 13,1310,R2,329-331 Savin Hill Ave,2125.0,Address,123357.0,42.3127,-71.0491,City Worker App,"(42.3127, -71.0491)"
668689,101001654354,11/30/2015 07:48:14 AM,12/07/2015 08:30:00 AM,11/30/2015 07:48:20 AM,ONTIME,Closed,Case Closed. Closed date : 2015-11-30 07:48:20.767 Case Resolved Created Request for Recycling Bin,Recycling Cart Return,Public Works Department,Recycling,Recycling Cart Return,PWDx_IPL Damaged Cart Replacement,PWDx,https://cityworker.cityofboston.gov:8443/attachments/report/565c458cd052851ecec7bbff/photo/Report.jpg,,97 Northampton St  Roxbury  MA  02118,7.0,10B,2.0,D4,Roxbury,6.0,Ward 8,0802,A,97 Northampton St,2118.0,Address,284910.0,42.3354,-71.0767,City Worker App,"(42.3354, -71.0767)"
668786,101001654529,11/30/2015 09:42:36 AM,12/07/2015 09:42:38 AM,11/30/2015 09:42:45 AM,ONTIME,Closed,Case Closed. Closed date : 2015-11-30 09:42:45.317 Case Resolved Created Request for Recycling Bin,Recycling Cart Return,Public Works Department,Recycling,Recycling Cart Return,PWDx_IPL Damaged Cart Replacement,PWDx,https://cityworker.cityofboston.gov:8443/attachments/report/565c6059d052851ecec7bf5c/photo/Report.jpg,,21 Stonecrest Rd  Mattapan  MA  02126,8.0,07,5.0,B3,Greater Mattapan,9.0,Ward 18,1803,R1,21 Stonecrest Rd,2126.0,Address,130828.0,42.2769,-71.106,City Worker App,"(42.2769, -71.106)"
668941,101001654760,11/30/2015 12:17:24 PM,12/07/2015 12:17:27 PM,11/30/2015 12:17:33 PM,ONTIME,Closed,Case Closed. Closed date : 2015-11-30 12:17:33.35 Case Resolved Created Request for Recycling Bin,Recycling Cart Return,Public Works Department,Recycling,Recycling Cart Return,PWDx_IPL Damaged Cart Replacement,PWDx,https://cityworker.cityofboston.gov:8443/attachments/report/565c84a1d052851ecec7c442/photo/Report.jpg,,103 Cedar St  Roxbury  MA  02119,7.0,10B,7.0,B2,Roxbury,13.0,Ward 11,1101,R2,103 Cedar St,2119.0,Address,202676.0,42.3271,-71.0932,City Worker App,"(42.3271, -71.0932)"
668970,101001654816,11/30/2015 12:52:00 PM,12/07/2015 12:52:47 PM,12/14/2015 02:28:03 PM,OVERDUE,Closed,Case Closed. Closed date : 2015-12-14 14:28:03.16 Case Resolved cart removed 12/14/2015,Recycling Cart Return,Public Works Department,Recycling,Recycling Cart Return,PWDx_Recycling Cart Return,PWDx,,,16 Garth Rd  West Roxbury  MA  02132,12.0,06,6.0,E5,West Roxbury,12.0,Ward 20,2018,R2,16 Garth Rd,2132.0,Address,62921.0,42.2891,-71.1563,Constituent Call,"(42.2891, -71.1563)"
668988,101001654848,11/30/2015 01:17:46 PM,12/07/2015 01:17:50 PM,11/30/2015 01:17:56 PM,ONTIME,Closed,Case Closed. Closed date : 2015-11-30 13:17:56.547 Case Resolved Created Request for Recycling Bin,Recycling Cart Return,Public Works Department,Recycling,Recycling Cart Return,PWDx_IPL Damaged Cart Replacement,PWDx,https://cityworker.cityofboston.gov:8443/attachments/report/565c92c8d052851ecec7c5b8/photo/Report.jpg,,8 Chesterton St  Roxbury  MA  02119,7.0,10B,7.0,B2,Roxbury,13.0,Ward 8,0806,R3,8 Chesterton St,2119.0,Address,31008.0,42.3301,-71.0706,City Worker App,"(42.3301, -71.0706)"
669002,101001654874,11/30/2015 01:40:00 PM,12/07/2015 01:40:25 PM,12/14/2015 02:24:46 PM,OVERDUE,Closed,Case Closed. Closed date : 2015-12-14 14:24:46.047 Case Noted no cart out 11/14/2015,Recycling Cart Return,Public Works Department,Recycling,Recycling Cart Return,PWDx_Recycling Cart Return,PWDx,,,20 Conry Cres  Jamaica Plain  MA  02130,9.0,02,6.0,E13,Jamaica Plain,11.0,Ward 19,1902,R1,20 Conry Cres,2130.0,Address,42215.0,42.3126,-71.1283,Constituent Call,"(42.3126, -71.1283)"
669051,101001654941,11/30/2015 02:22:39 PM,12/07/2015 02:22:39 PM,11/30/2015 02:22:46 PM,ONTIME,Closed,Case Closed. Closed date : 2015-11-30 14:22:46.94 Case Resolved Created Request for Recycling Bin,Recycling Cart Return,Public Works Department,Recycling,Recycling Cart Return,PWDx_IPL Damaged Cart Replacement,PWDx,https://cityworker.cityofboston.gov:8443/attachments/report/565ca1ffd052851ecec7c6d6/photo/Report.jpg,,229 Marlborough St  Boston  MA  02116,4.0,1C,8.0,D4,Back Bay,14.0,Ward 5,0508,R1,229 Marlborough St,2116.0,Address,90675.0,42.3524,-71.0815,City Worker App,"(42.3524, -71.0815)"
669640,101001655793,12/01/2015 11:31:00 AM,12/15/2015 11:31:00 AM,12/14/2015 02:26:01 PM,ONTIME,Closed,Case Closed. Closed date : 2015-12-14 14:26:01.14 Case Resolved damaged cart replacrd new cart # 5150029265 12/11/2015,Recycling Cart Return,Public Works Department,Recycling,Recycling Cart Return,PWDx_IPL Damaged Cart Replacement,PWDx,,,211 Parsons St  Brighton  MA  02135,11.0,04,9.0,D14,Allston / Brighton,15.0,Ward 22,2211,R2,211 Parsons St,2135.0,Address,406032.0,42.3594,-71.0587,Constituent Call,"(0, 0)"
669733,101001655924,12/01/2015 01:18:41 PM,12/08/2015 01:18:41 PM,12/01/2015 01:18:48 PM,ONTIME,Closed,Case Closed. Closed date : 2015-12-01 13:18:48.437 Case Resolved Created Request for Recycling Bin,Recycling Cart Return,Public Works Department,Recycling,Recycling Cart Return,PWDx_IPL Damaged Cart Replacement,PWDx,https://cityworker.cityofboston.gov:8443/attachments/report/565de47ed052851ecec7da0b/photo/Report.jpg,,INTERSECTION of Clifford St & Stanbro St  Hyde Park  MA,12.0,08,5.0,E18,Hyde Park,10.0,Ward 18,1820,,INTERSECTION Clifford St & Stanbro St,,Intersection,3137.0,42.2349,-71.1307,City Worker App,"(42.2349, -71.1307)"
669737,101001655928,12/01/2015 01:21:22 PM,12/08/2015 01:21:22 PM,12/01/2015 01:21:28 PM,ONTIME,Closed,Case Closed. Closed date : 2015-12-01 13:21:28.123 Case Resolved Created Request for Recycling Bin,Recycling Cart Return,Public Works Department,Recycling,Recycling Cart Return,PWDx_IPL Damaged Cart Replacement,PWDx,https://cityworker.cityofboston.gov:8443/attachments/report/565de520d052851ecec7da54/photo/Report.jpg,,39 Colchester St  Hyde Park  MA  02136,12.0,08,5.0,E18,Hyde Park,10.0,Ward 18,1820,R1,39 Colchester St,2136.0,Address,34603.0,42.2341,-71.1303,City Worker App,"(42.2341, -71.1303)"
669761,101001655961,12/01/2015 01:54:00 PM,12/15/2015 01:54:00 PM,12/08/2015 02:25:39 PM,ONTIME,Closed,Case Closed. Closed date : 2015-12-08 14:25:39.43 Case Resolved damaged cart replaced new cart # 5150059997 12/08/2015,Recycling Cart Return,Public Works Department,Recycling,Recycling Cart Return,PWDx_IPL Damaged Cart Replacement,PWDx,,,39 Stonehurst St  Dorchester  MA  02122,7.0,03,3.0,C11,Dorchester,8.0,Ward 15,1507,R2,39 Stonehurst St,2122.0,Address,131001.0,42.3051,-71.0667,Constituent Call,"(42.3051, -71.0667)"
670102,101001656534,12/02/2015 09:33:49 AM,12/09/2015 09:33:50 AM,12/02/2015 09:33:56 AM,ONTIME,Closed,Case Closed. Closed date : 2015-12-02 09:33:56.417 Case Resolved Created Request for Recycling Bin,Recycling Cart Return,Public Works Department,Recycling,Recycling Cart Return,PWDx_IPL Damaged Cart Replacement,PWDx,https://cityworker.cityofboston.gov:8443/attachments/report/565f014bd052851ecec7e47a/photo/Report.jpg,,339 Park St  Dorchester  MA  02124,7.0,03,4.0,C11,Dorchester,9.0,Ward 17,1703,R1,339 Park St,2124.0,Address,107336.0,42.2968,-71.0678,City Worker App,"(42.2968, -71.0678)"
670189,101001656661,12/02/2015 10:57:00 AM,12/09/2015 10:57:30 AM,12/08/2015 08:35:47 AM,ONTIME,Closed,Case Closed. Closed date : 2015-12-08 08:35:47.243 Case Noted Removed cart r9#0044976 replaced with cart 515#0059422 on 12/8/15.,Recycling Cart Return,Public Works Department,Recycling,Recycling Cart Return,PWDx_IPL Damaged Cart Replacement,PWDx,,,15 Morse St  Dorchester  MA  02121,7.0,03,4.0,C11,Roxbury,8.0,Ward 14,1404,R4,15 Morse St,2121.0,Address,97590.0,42.3041,-71.0782,Constituent Call,"(42.3041, -71.0782)"
670191,101001656663,12/02/2015 10:57:56 AM,12/09/2015 10:57:57 AM,12/02/2015 10:58:03 AM,ONTIME,Closed,Case Closed. Closed date : 2015-12-02 10:58:03.603 Case Resolved Created Request for Recycling Bin,Recycling Cart Return,Public Works Department,Recycling,Recycling Cart Return,PWDx_IPL Damaged Cart Replacement,PWDx,https://cityworker.cityofboston.gov:8443/attachments/report/565f1502d052851ecec7e891/photo/Report.jpg,,36-38 Russell St  Charlestown  MA  02129,3.0,1A,1.0,A15,Charlestown,2.0,02,0206,,36-38 Russell St,2129.0,Address,173065.0,42.3795,-71.0658,City Worker App,"(42.3795, -71.0658)"
670233,101001656726,12/02/2015 11:49:09 AM,12/09/2015 11:49:09 AM,12/02/2015 11:49:13 AM,ONTIME,Closed,Case Closed. Closed date : 2015-12-02 11:49:13.623 Case Resolved Created Request for Recycling Bin,Recycling Cart Return,Public Works Department,Recycling,Recycling Cart Return,PWDx_IPL Damaged Cart Replacement,PWDx,,,75 Nelson St  Dorchester  MA  02124,8.0,07,4.0,B3,Dorchester,9.0,Ward 17,1710,R3,75 Nelson St,2124.0,Address,100554.0,42.2809,-71.082,City Worker App,"(42.2809, -71.082)"
670291,101001656832,12/02/2015 01:26:40 PM,12/09/2015 01:26:39 PM,12/02/2015 01:26:45 PM,ONTIME,Closed,Case Closed. Closed date : 2015-12-02 13:26:45.387 Case Resolved Created Request for Recycling Bin,Recycling Cart Return,Public Works Department,Recycling,Recycling Cart Return,PWDx_IPL Damaged Cart Replacement,PWDx,https://cityworker.cityofboston.gov:8443/attachments/report/565f37dbd052851ecec7ed1e/photo/Report.jpg,,235-237 Bunker Hill St  Charlestown  MA  02129,3.0,1A,1.0,A15,Charlestown,2.0,02,0205,,235-237 Bunker Hill St,2129.0,Address,172152.0,42.3795,-71.0634,City Worker App,"(42.3795, -71.0634)"
670604,101001657317,12/03/2015 08:59:05 AM,12/10/2015 08:59:06 AM,12/03/2015 08:59:12 AM,ONTIME,Closed,Case Closed. Closed date : 2015-12-03 08:59:12.997 Case Resolved Created Request for Recycling Bin,Recycling Cart Return,Public Works Department,Recycling,Recycling Cart Return,PWDx_IPL Damaged Cart Replacement,PWDx,https://cityworker.cityofboston.gov:8443/attachments/report/56604aa9d052851ecec7f47a/photo/Report.jpg,,47 Lyon St  Dorchester  MA  02122,7.0,03,3.0,C11,Dorchester,8.0,Ward 15,1504,R3,47 Lyon St,2122.0,Address,87955.0,42.3063,-71.061,City Worker App,"(42.3063, -71.061)"
670648,101001657397,12/03/2015 09:44:31 AM,12/10/2015 09:44:31 AM,12/03/2015 09:44:37 AM,ONTIME,Closed,Case Closed. Closed date : 2015-12-03 09:44:37.417 Case Resolved Created Request for Recycling Bin,Recycling Cart Return,Public Works Department,Recycling,Recycling Cart Return,PWDx_IPL Damaged Cart Replacement,PWDx,https://cityworker.cityofboston.gov:8443/attachments/report/5660554cd052851ecec7f5d9/photo/Report.jpg,,31 Glenhill Rd  Mattapan  MA  02126,8.0,07,4.0,B3,Greater Mattapan,9.0,Ward 18,1801,R1,31 Glenhill Rd,2126.0,Address,64444.0,42.2776,-71.0827,City Worker App,"(42.2776, -71.0827)"
670683,101001657451,12/03/2015 10:23:00 AM,12/10/2015 10:23:59 AM,12/09/2015 02:18:10 PM,ONTIME,Closed,Case Closed. Closed date : 2015-12-09 14:18:10.39 Case Resolved damaged cart replaced new cart #5150059404 12/09/2015,Recycling Cart Return,Public Works Department,Recycling,Recycling Cart Return,PWDx_IPL Damaged Cart Replacement,PWDx,,,52 Wilmington Ave  Dorchester  MA  02124,8.0,07,3.0,B3,Dorchester,7.0,Ward 17,1712,R1,52 Wilmington Ave,2124.0,Address,150448.0,42.2793,-71.0774,Constituent Call,"(42.2793, -71.0774)"
670729,101001657518,12/03/2015 11:01:00 AM,12/10/2015 11:01:43 AM,12/11/2015 07:39:21 AM,OVERDUE,Closed,Case Closed. Closed date : 2015-12-11 07:39:21.553 Case Resolved damaged cart replaced new cart #5150059840 12/10/2015,Recycling Cart Return,Public Works Department,Recycling,Recycling Cart Return,PWDx_Recycling Cart Return,PWDx,,,159 Walnut St  Dorchester  MA  02122,8.0,07,3.0,C11,Dorchester,7.0,Ward 16,1610,R1,159 Walnut St,2122.0,Address,142118.0,42.2902,-71.0396,Constituent Call,"(42.2902, -71.0396)"
670786,101001657613,12/03/2015 12:53:00 PM,12/10/2015 12:53:16 PM,12/10/2015 01:07:56 PM,OVERDUE,Closed,Case Closed. Closed date : 2015-12-10 13:07:56.827 Case Noted Removed broken cart r9#023633 and replaced with 515#0059836 at 7:32 a.m. on 12/10/15.,Recycling Cart Return,Public Works Department,Recycling,Recycling Cart Return,PWDx_IPL Damaged Cart Replacement,PWDx,,,84 Tacoma St  Hyde Park  MA  02136,12.0,08,5.0,E18,Hyde Park,10.0,Ward 18,1808,R1,84 Tacoma St,2136.0,Address,133571.0,42.2675,-71.1149,Constituent Call,"(42.2675, -71.1149)"
670808,101001657642,12/03/2015 01:21:27 PM,12/10/2015 01:21:26 PM,12/03/2015 01:21:35 PM,ONTIME,Closed,Case Closed. Closed date : 2015-12-03 13:21:35.497 Case Resolved Created Request for Recycling Bin,Recycling Cart Return,Public Works Department,Recycling,Recycling Cart Return,PWDx_IPL Damaged Cart Replacement,PWDx,https://cityworker.cityofboston.gov:8443/attachments/report/56608826d052851ecec7fd0c/photo/Report.jpg,,19 Wyoming St  Dorchester  MA  02121,9.0,10B,7.0,B2,Roxbury,13.0,Ward 12,1202,R2,19 Wyoming St,2121.0,Address,153156.0,42.3153,-71.0854,City Worker App,"(42.3153, -71.0854)"
670817,101001657653,12/03/2015 01:36:37 PM,12/10/2015 01:36:36 PM,12/03/2015 01:36:43 PM,ONTIME,Closed,Case Closed. Closed date : 2015-12-03 13:36:43.493 Case Resolved Created Request for Recycling Bin,Recycling Cart Return,Public Works Department,Recycling,Recycling Cart Return,PWDx_IPL Damaged Cart Replacement,PWDx,https://cityworker.cityofboston.gov:8443/attachments/report/56608bb5d052851ecec7fd79/photo/Report.jpg,,794-798 Canterbury St  Roslindale  MA  02131,12.0,02,5.0,E18,Roslindale,10.0,Ward 18,1807,CM,794-798 Canterbury St,2131.0,Address,25495.0,42.2825,-71.1124,City Worker App,"(42.2825, -71.1124)"
670851,101001657713,12/03/2015 02:49:00 PM,12/10/2015 02:49:42 PM,12/04/2015 02:36:48 PM,ONTIME,Closed,Case Closed. Closed date : 2015-12-04 14:36:48.437 Case Resolved cart picked up 12/04/2015 DD,Recycling Cart Return,Public Works Department,Recycling,Recycling Cart Return,PWDx_Recycling Cart Return,PWDx,,,170 Bunker Hill St  Charlestown  MA  02129,3.0,1A,1.0,A15,Charlestown,2.0,Ward 2,0204,R2,170 Bunker Hill St,2129.0,Address,23311.0,42.3783,-71.0612,Constituent Call,"(42.3783, -71.0612)"
671085,101001658050,12/04/2015 08:23:56 AM,12/11/2015 08:30:00 AM,12/04/2015 08:24:00 AM,ONTIME,Closed,Case Closed. Closed date : 2015-12-04 08:24:00.12 Case Resolved Created Request for Recycling Bin,Recycling Cart Return,Public Works Department,Recycling,Recycling Cart Return,PWDx_IPL Damaged Cart Replacement,PWDx,,,1 Wyman Pl  Jamaica Plain  MA  02130,9.0,10A,6.0,E13,Jamaica Plain,11.0,Ward 10,1007,R2,1 Wyman Pl,2130.0,Address,153138.0,42.3227,-71.1021,City Worker App,"(42.3227, -71.1021)"
671089,101001658058,12/04/2015 08:25:28 AM,12/11/2015 08:30:00 AM,12/04/2015 08:25:33 AM,ONTIME,Closed,Case Closed. Closed date : 2015-12-04 08:25:33.973 Case Resolved Created Request for Recycling Bin,Recycling Cart Return,Public Works Department,Recycling,Recycling Cart Return,PWDx_IPL Damaged Cart Replacement,PWDx,https://cityworker.cityofboston.gov:8443/attachments/report/56619447d052851ecec80251/photo/Report.jpg,,2 Wyman Pl  Jamaica Plain  MA  02130,9.0,10A,6.0,E13,Jamaica Plain,11.0,Ward 10,1007,R3,2 Wyman Pl,2130.0,Address,339738.0,42.3226,-71.1021,City Worker App,"(42.3226, -71.1021)"
671251,101001658332,12/04/2015 11:28:00 AM,12/11/2015 11:28:47 AM,12/11/2015 02:23:08 PM,OVERDUE,Closed,Case Closed. Closed date : 2015-12-11 14:23:08.863 Case Resolved damaged cart swapped new cart #5150059391 12/11/2015,Recycling Cart Return,Public Works Department,Recycling,Recycling Cart Return,PWDx_Recycling Cart Return,PWDx,,,1 Everett St  Dorchester  MA  02122,7.0,07,3.0,C11,Dorchester,7.0,Ward 16,1602,R3,1 Everett St,2122.0,Address,55233.0,42.3018,-71.0536,Constituent Call,"(42.3018, -71.0536)"
671333,101001658460,12/04/2015 01:27:00 PM,12/11/2015 01:27:00 PM,12/11/2015 07:37:42 AM,ONTIME,Closed,Case Closed. Closed date : 2015-12-11 07:37:42.153 Case Resolved damaged cart replaced new cart #5150059401 12/10/2015,Recycling Cart Return,Public Works Department,Recycling,Recycling Cart Return,PWDx_IPL Damaged Cart Replacement,PWDx,,,76 Westmoreland St  Dorchester  MA  02124,8.0,07,3.0,C11,Dorchester,7.0,Ward 16,1608,R2,76 Westmoreland St,2124.0,Address,148776.0,42.2841,-71.0591,Constituent Call,"(42.2841, -71.0591)"
672364,101001659855,12/07/2015 01:21:00 PM,12/14/2015 01:21:50 PM,12/08/2015 08:34:40 AM,ONTIME,Closed,Case Closed. Closed date : 2015-12-08 08:34:40.253 Case Noted Removed broken cart r9#026066 replaced with cart 515#0060005 on 12/8/15.,Recycling Cart Return,Public Works Department,Recycling,Recycling Cart Return,PWDx_IPL Damaged Cart Replacement,PWDx,,,11 Merlin St  Dorchester  MA  02124,8.0,03,4.0,B3,Dorchester,9.0,Ward 17,1701.0,R1,11 Merlin St,2124.0,Address,94645.0,42.2958,-71.0748,Constituent Call,"(42.2958, -71.0748)"
672989,101001660718,12/08/2015 11:30:50 AM,12/15/2015 11:30:51 AM,12/08/2015 11:31:00 AM,ONTIME,Closed,Case Closed. Closed date : 2015-12-08 11:31:00.033 Case Resolved Created Request for Recycling Bin,Recycling Cart Return,Public Works Department,Recycling,Recycling Cart Return,PWDx_IPL Damaged Cart Replacement,PWDx,https://cityworker.cityofboston.gov:8443/attachments/report/566705bad052851ecec8348d/photo/Report.jpg,,34 Alwin St  Hyde Park  MA  02136,12.0,08,5.0,E18,Hyde Park,10.0,Ward 18,1819.0,R1,34 Alwin St,2136.0,Address,3064.0,42.2537,-71.1427,City Worker App,"(42.2537, -71.1427)"
672999,101001660737,12/08/2015 11:41:00 AM,12/15/2015 11:41:52 AM,12/14/2015 02:26:53 PM,ONTIME,Closed,Case Closed. Closed date : 2015-12-14 14:26:53.497 Case Resolved damaged cart replaced new cart #5150059390 12/14/2015,Recycling Cart Return,Public Works Department,Recycling,Recycling Cart Return,PWDx_Recycling Cart Return,PWDx,,,742 VFW Pkwy  West Roxbury  MA  02132,12.0,06,6.0,E5,West Roxbury,12.0,Ward 20,2017.0,R2,742 VFW Pkwy,2132.0,Address,401433.0,42.3594,-71.0587,Constituent Call,"(0, 0)"
673412,101001661343,12/09/2015 08:24:43 AM,12/16/2015 08:30:00 AM,12/09/2015 08:24:52 AM,ONTIME,Closed,Case Closed. Closed date : 2015-12-09 08:24:52.617 Case Resolved Created Request for Recycling Bin,Recycling Cart Return,Public Works Department,Recycling,Recycling Cart Return,PWDx_IPL Damaged Cart Replacement,PWDx,https://cityworker.cityofboston.gov:8443/attachments/report/56682b98d052851ecec840f5/photo/Report.jpg,,69 Draper St  Dorchester  MA  02122,7.0,03,3.0,C11,Dorchester,8.0,Ward 15,1509.0,R3,69 Draper St,2122.0,Address,49445.0,42.3037,-71.0642,City Worker App,"(42.3037, -71.0642)"
673748,101001661916,12/09/2015 02:52:00 PM,12/16/2015 02:52:45 PM,12/15/2015 01:49:13 PM,ONTIME,Closed,Case Closed. Closed date : 2015-12-15 13:49:13.71 Case Noted Removed cart r9#0036545 and replaced with cart 515#0059838 on 12/15/15. Other recycle cart out were not broken at location.,Recycling Cart Return,Public Works Department,Recycling,Recycling Cart Return,PWDx_IPL Damaged Cart Replacement,PWDx,,,14 Bowdoin Ave  Dorchester  MA  02121,7.0,03,4.0,C11,Dorchester,8.0,Ward 14,1404.0,R4,14 Bowdoin Ave,2121.0,Address,17402.0,42.3029,-71.076,Constituent Call,"(42.3029, -71.076)"
674150,101001662505,12/10/2015 10:41:50 AM,12/17/2015 10:41:50 AM,12/10/2015 10:42:14 AM,ONTIME,Closed,Case Closed. Closed date : 2015-12-10 10:42:14.58 Case Invalid Caller did not have her ID,Recycling Cart Return,Public Works Department,Recycling,Recycling Cart Return,PWDx_Recycling Cart Return,PWDx,,,50 Messinger St  Mattapan  MA  02126,8.0,07,5.0,B3,Greater Mattapan,9.0,Ward 18,1821.0,R1,50 Messinger St,2126.0,Address,94734.0,42.2734,-71.0998,Constituent Call,"(42.2734, -71.0998)"
674259,101001662653,12/10/2015 12:43:27 PM,12/17/2015 12:43:29 PM,12/10/2015 12:43:35 PM,ONTIME,Closed,Case Closed. Closed date : 2015-12-10 12:43:35.53 Case Resolved Created Request for Recycling Bin,Recycling Cart Return,Public Works Department,Recycling,Recycling Cart Return,PWDx_IPL Damaged Cart Replacement,PWDx,https://cityworker.cityofboston.gov:8443/attachments/report/5669b9bed052851ecec8604f/photo/Report.jpg,,360 W Second St  South Boston  MA  02127,6.0,05,2.0,C6,South Boston,5.0,06,604.0,,360 W Second St,2127.0,Address,343200.0,42.3594,-71.0587,City Worker App,"(0, 0)"
674621,101001663144,12/11/2015 09:37:24 AM,12/18/2015 09:37:29 AM,12/11/2015 09:37:36 AM,ONTIME,Closed,Case Closed. Closed date : 2015-12-11 09:37:36.467 Case Resolved Created Request for Recycling Bin,Recycling Cart Return,Public Works Department,Recycling,Recycling Cart Return,PWDx_IPL Damaged Cart Replacement,PWDx,https://cityworker.cityofboston.gov:8443/attachments/report/566adfa6d052851ecec867e7/photo/Report.jpg,,41 Easton St  Allston  MA  02134,11.0,04,9.0,D14,Allston / Brighton,15.0,Ward 22,2201.0,R3,41 Easton St,2134.0,Address,50996.0,42.36,-71.1309,City Worker App,"(42.36, -71.1309)"
674641,101001663172,12/11/2015 10:09:29 AM,12/18/2015 10:09:34 AM,12/11/2015 10:09:39 AM,ONTIME,Closed,Case Closed. Closed date : 2015-12-11 10:09:39.67 Case Resolved Created Request for Recycling Bin,Recycling Cart Return,Public Works Department,Recycling,Recycling Cart Return,PWDx_IPL Damaged Cart Replacement,PWDx,https://cityworker.cityofboston.gov:8443/attachments/report/566ae72ad052851ecec868f7/photo/Report.jpg,,75 Lonsdale St  Dorchester  MA  02124,8.0,07,3.0,C11,Dorchester,7.0,Ward 16,1606.0,R3,75 Lonsdale St,2124.0,Address,87244.0,42.2907,-71.0594,City Worker App,"(42.2907, -71.0594)"
674704,101001663267,12/11/2015 11:13:11 AM,12/18/2015 11:13:16 AM,12/11/2015 11:13:22 AM,ONTIME,Closed,Case Closed. Closed date : 2015-12-11 11:13:22.553 Case Resolved Created Request for Recycling Bin,Recycling Cart Return,Public Works Department,Recycling,Recycling Cart Return,PWDx_IPL Damaged Cart Replacement,PWDx,https://cityworker.cityofboston.gov:8443/attachments/report/566af61bd052851ecec86a99/photo/Report.jpg,,824 Parker St  Mission Hill  MA  02120,9.0,10A,8.0,B2,Mission Hill,14.0,Ward 10,1005.0,R1,824 Parker St,2120.0,Address,107887.0,42.3277,-71.0993,City Worker App,"(42.3277, -71.0993)"
674768,101001663375,12/11/2015 12:45:52 PM,12/18/2015 12:45:57 PM,12/11/2015 12:46:03 PM,ONTIME,Closed,Case Closed. Closed date : 2015-12-11 12:46:03.003 Case Resolved Created Request for Recycling Bin,Recycling Cart Return,Public Works Department,Recycling,Recycling Cart Return,PWDx_IPL Damaged Cart Replacement,PWDx,https://cityworker.cityofboston.gov:8443/attachments/report/566b0bd2d052851ecec86d27/photo/Report.jpg,,51 Manor St  Dorchester  MA  02122,8.0,07,3.0,C11,Dorchester,7.0,Ward 16,1607.0,R1,51 Manor St,2122.0,Address,88999.0,42.2911,-71.0541,City Worker App,"(42.2911, -71.0541)"
674827,101001663468,12/11/2015 02:32:00 PM,12/18/2015 02:32:02 PM,12/11/2015 02:35:54 PM,ONTIME,Closed,Case Closed. Closed date : 2015-12-11 14:35:54.293 Case Resolved damaged cart replaced new cart # 5150059995 12/11/2015,Recycling Cart Return,Public Works Department,Recycling,Recycling Cart Return,PWDx_Recycling Cart Return,PWDx,,,75 Lonsdale St  Dorchester  MA  02124,8.0,07,3.0,C11,Dorchester,7.0,Ward 16,1606.0,R3,75 Lonsdale St,2124.0,Address,87244.0,42.2907,-71.0594,Constituent Call,"(42.2907, -71.0594)"
675555,101001664494,12/14/2015 09:35:00 AM,12/21/2015 09:35:26 AM,12/22/2015 03:22:19 PM,OVERDUE,Closed,Case Closed Case Noted  Cart was removed today thank you,Recycling Cart Return,Public Works Department,Recycling,Recycling Cart Return,PWDx_Recycling Cart Return,PWDx,,,45 Rutland Sq  Roxbury  MA  02118,4.0,1C,7.0,D4,South End,6.0,Ward 4,404.0,R3,45 Rutland Sq,2118.0,Address,120116.0,42.3422,-71.0783,Constituent Call,"(42.3422, -71.0783)"
675594,101001664560,12/14/2015 10:14:36 AM,12/21/2015 10:14:36 AM,12/14/2015 10:14:42 AM,ONTIME,Closed,Case Closed. Closed date : 2015-12-14 10:14:42.913 Case Resolved Created Request for Recycling Bin,Recycling Cart Return,Public Works Department,Recycling,Recycling Cart Return,PWDx_IPL Damaged Cart Replacement,PWDx,https://cityworker.cityofboston.gov:8443/attachments/report/566edcd8d052851ecec87ecb/photo/Report.jpg,,404 Marlborough St  Boston  MA  02115,4.0,1C,8.0,D4,Back Bay,14.0,Ward 5,509.0,R4,404 Marlborough St,2115.0,Address,91265.0,42.35,-71.0883,City Worker App,"(42.35, -71.0883)"
675686,101001664703,12/14/2015 11:42:25 AM,12/21/2015 11:42:25 AM,12/14/2015 11:42:31 AM,ONTIME,Closed,Case Closed. Closed date : 2015-12-14 11:42:31.107 Case Resolved Created Request for Recycling Bin,Recycling Cart Return,Public Works Department,Recycling,Recycling Cart Return,PWDx_IPL Damaged Cart Replacement,PWDx,https://cityworker.cityofboston.gov:8443/attachments/report/566ef171d052851ecec88288/photo/Report.jpg,,145 Corey St  West Roxbury  MA  02132,12.0,06,6.0,E5,West Roxbury,12.0,Ward 20,2018.0,R1,145 Corey St,2132.0,Address,42748.0,42.2885,-71.1571,City Worker App,"(42.2885, -71.1571)"
675789,101001664841,12/14/2015 01:27:19 PM,12/21/2015 01:27:19 PM,12/14/2015 01:29:07 PM,ONTIME,Closed,Case Closed. Closed date : 2015-12-14 13:29:07.137 Case Invalid Caller reports it was stolen and does not need to be returned.,Recycling Cart Return,Public Works Department,Recycling,Recycling Cart Return,PWDx_Recycling Cart Return,PWDx,,,70 S Hobart St  Brighton  MA  02135,11.0,04,9.0,D14,Allston / Brighton,15.0,Ward 22,2210.0,R2,70 S Hobart St,2135.0,Address,74384.0,42.3512,-71.1578,Constituent Call,"(42.3512, -71.1578)"
675852,101001664924,12/14/2015 02:31:00 PM,12/21/2015 02:31:35 PM,12/14/2015 02:34:01 PM,ONTIME,Closed,Case Closed. Closed date : 2015-12-14 14:34:01.603 Case Noted cart was taken due to misused of recycling cart for trash 12/14/2015,Recycling Cart Return,Public Works Department,Recycling,Recycling Cart Return,PWDx_Recycling Cart Return,PWDx,,,21 Faneuil St  Brighton  MA  02135,11.0,04,9.0,D14,Allston / Brighton,15.0,Ward 22,2212.0,R2,21 Faneuil St,2135.0,Address,406045.0,42.3594,-71.0587,Constituent Call,"(0, 0)"
675932,101001665062,12/14/2015 04:14:00 PM,12/21/2015 04:14:57 PM,12/17/2015 09:31:05 AM,ONTIME,Closed,Case Closed Case Noted  Cart was removed thank you.,Recycling Cart Return,Public Works Department,Recycling,Recycling Cart Return,PWDx_Recycling Cart Return,PWDx,,,20 Conry Cres  Jamaica Plain  MA  02130,9.0,02,6.0,E13,Jamaica Plain,11.0,Ward 19,1902.0,R1,20 Conry Cres,2130.0,Address,42215.0,42.3126,-71.1283,Constituent Call,"(42.3126, -71.1283)"
676140,101001665333,12/15/2015 08:39:00 AM,12/22/2015 08:39:01 AM,12/15/2015 08:42:08 AM,ONTIME,Closed,Case Closed Case Invalid,Recycling Cart Return,Public Works Department,Recycling,Recycling Cart Return,PWDx_Recycling Cart Return,PWDx,,,37 Weymouth Ave  West Roxbury  MA  02132,12.0,06,6.0,E5,West Roxbury,12.0,Ward 20,2005.0,R1,37 Weymouth Ave,2132.0,Address,149036.0,42.2673,-71.1529,Constituent Call,"(42.2673, -71.1529)"
676141,101001665334,12/15/2015 08:39:43 AM,12/22/2015 08:39:43 AM,12/15/2015 08:41:55 AM,ONTIME,Closed,Case Closed Case Invalid,Recycling Cart Return,Public Works Department,Recycling,Recycling Cart Return,PWDx_Recycling Cart Return,PWDx,,,37 Weymouth Ave  West Roxbury  MA  02132,12.0,06,6.0,E5,West Roxbury,12.0,Ward 20,2005.0,R1,37 Weymouth Ave,2132.0,Address,149036.0,42.2673,-71.1529,Constituent Call,"(42.2673, -71.1529)"
676143,101001665335,12/15/2015 08:40:01 AM,12/22/2015 08:40:01 AM,12/15/2015 08:40:07 AM,ONTIME,Closed,Case Closed. Closed date : 2015-12-15 08:40:07.197 Case Resolved Created Request for Recycling Bin,Recycling Cart Return,Public Works Department,Recycling,Recycling Cart Return,PWDx_IPL Damaged Cart Replacement,PWDx,https://cityworker.cityofboston.gov:8443/attachments/report/5670182dd052202cffaf9218/photo/Report.jpg,,95 Lagrange St  West Roxbury  MA  02132,12.0,06,6.0,E5,West Roxbury,12.0,Ward 20,2010.0,R1,95 Lagrange St,2132.0,Address,82951.0,42.2757,-71.1463,City Worker App,"(42.2757, -71.1463)"
676239,101001665462,12/15/2015 09:44:15 AM,12/22/2015 09:44:15 AM,12/15/2015 09:44:21 AM,ONTIME,Closed,Case Closed. Closed date : 2015-12-15 09:44:21.813 Case Resolved Created Request for Recycling Bin,Recycling Cart Return,Public Works Department,Recycling,Recycling Cart Return,PWDx_IPL Damaged Cart Replacement,PWDx,https://cityworker.cityofboston.gov:8443/attachments/report/5670273bd052202cffaf95ce/photo/Report.jpg,,7 Penhallow St  Dorchester  MA  02124,8.0,07,4.0,C11,Dorchester,8.0,Ward 17,1706.0,R1,7 Penhallow St,2124.0,Address,109162.0,42.2954,-71.0633,City Worker App,"(42.2954, -71.0633)"
676247,101001665474,12/15/2015 09:48:56 AM,12/22/2015 09:48:55 AM,12/15/2015 09:49:02 AM,ONTIME,Closed,Case Closed. Closed date : 2015-12-15 09:49:02.81 Case Resolved Created Request for Recycling Bin,Recycling Cart Return,Public Works Department,Recycling,Recycling Cart Return,PWDx_IPL Damaged Cart Replacement,PWDx,https://cityworker.cityofboston.gov:8443/attachments/report/56702857d052202cffaf961a/photo/Report.jpg,,106 Melville Ave  Dorchester  MA  02124,8.0,07,4.0,C11,Dorchester,9.0,Ward 17,1703.0,R1,106 Melville Ave,2124.0,Address,94035.0,42.2957,-71.0637,City Worker App,"(42.2957, -71.0637)"
676258,101001665488,12/15/2015 09:56:22 AM,12/22/2015 09:56:22 AM,12/15/2015 09:56:28 AM,ONTIME,Closed,Case Closed. Closed date : 2015-12-15 09:56:28.607 Case Resolved Created Request for Recycling Bin,Recycling Cart Return,Public Works Department,Recycling,Recycling Cart Return,PWDx_IPL Damaged Cart Replacement,PWDx,https://cityworker.cityofboston.gov:8443/attachments/report/56702a13d052202cffaf968b/photo/Report.jpg,,93 Bowdoin St  Dorchester  MA  02122,7.0,03,4.0,C11,Dorchester,8.0,Ward 15,1505.0,R1,93 Bowdoin St,2122.0,Address,17789.0,42.302,-71.0715,City Worker App,"(42.302, -71.0715)"
677052,101001666650,12/16/2015 10:42:26 AM,12/23/2015 10:42:25 AM,12/16/2015 10:42:31 AM,ONTIME,Closed,Case Closed. Closed date : 2015-12-16 10:42:31.65 Case Resolved Created Request for Recycling Bin,Recycling Cart Return,Public Works Department,Recycling,Recycling Cart Return,PWDx_IPL Damaged Cart Replacement,PWDx,https://cityworker.cityofboston.gov:8443/attachments/report/5671865cd05237c5e7017b0b/photo/Report.jpg,,18 Hamilton St  Hyde Park  MA  02136,12.0,08,5.0,E18,Hyde Park,10.0,Ward 18,1820.0,R3,18 Hamilton St,2136.0,Address,245283.0,42.236,-71.1311,City Worker App,"(42.236, -71.1311)"
677399,101001667222,12/17/2015 08:29:13 AM,12/24/2015 08:30:00 AM,12/17/2015 08:29:19 AM,ONTIME,Closed,Case Closed. Closed date : 2015-12-17 08:29:19.413 Case Resolved Created Request for Recycling Bin,Recycling Cart Return,Public Works Department,Recycling,Recycling Cart Return,PWDx_IPL Damaged Cart Replacement,PWDx,https://cityworker.cityofboston.gov:8443/attachments/report/5672b8a6d05237c5e701875e/photo/Report.jpg,,3 Sargent St  Dorchester  MA  02125,7.0,03,7.0,B2,Roxbury,13.0,Ward 13,1304.0,R2,3 Sargent St,2125.0,Address,122944.0,42.3169,-71.0742,City Worker App,"(42.3169, -71.0742)"
677552,101001677484,12/17/2015 11:23:59 AM,12/24/2015 11:24:00 AM,12/17/2015 11:24:07 AM,ONTIME,Closed,Case Closed. Closed date : 2015-12-17 11:24:07.73 Case Resolved Created Request for Recycling Bin,Recycling Cart Return,Public Works Department,Recycling,Recycling Cart Return,PWDx_IPL Damaged Cart Replacement,PWDx,https://cityworker.cityofboston.gov:8443/attachments/report/5672e19dd05237c5e7018bfb/photo/Report.jpg,,INTERSECTION of Brook Ave & Winthrop St  Roxbury  MA,7.0,03,7.0,B2,Roxbury,13.0,Ward 8,805.0,,INTERSECTION Brook Ave & Winthrop St,,Intersection,2024.0,42.3222,-71.074,City Worker App,"(42.3222, -71.074)"
677565,101001677505,12/17/2015 11:42:00 AM,01/15/2016 11:42:00 AM,01/04/2016 10:11:33 AM,ONTIME,Closed,Case Closed. Closed date : 2016-01-04 10:11:33.28 Case Noted No recycling Cart at this location we have tried several times to remove thank you for contacting our office email was sent to constituent.,Recycling Cart Return,Public Works Department,Recycling,Recycling Cart Return,PWDx_Recycling Cart Return,PWDx,,,70 Beacon St  Boston  MA  02108,3.0,1B,8.0,A1,Beacon Hill,14.0,Ward 5,505.0,R1,70 Beacon St,2108.0,Address,12212.0,42.3563,-71.07,Constituent Call,"(42.3563, -71.07)"
677883,101001678040,12/18/2015 09:25:20 AM,12/28/2015 09:25:20 AM,12/18/2015 09:25:25 AM,ONTIME,Closed,Case Closed. Closed date : 2015-12-18 09:25:25.837 Case Resolved Created Request for Recycling Bin,Recycling Cart Return,Public Works Department,Recycling,Recycling Cart Return,PWDx_IPL Damaged Cart Replacement,PWDx,https://cityworker.cityofboston.gov:8443/attachments/report/5674174c70b480b2278decc3/photo/Report.jpg,,419 W Fourth St  South Boston  MA  02127,6.0,05,2.0,C6,South Boston / South Boston Waterfront,5.0,Ward 7,704.0,CM,419 W Fourth St,2127.0,Address,60290.0,42.3357,-71.0483,City Worker App,"(42.3357, -71.0483)"
678702,101001679208,12/21/2015 08:14:46 AM,12/29/2015 08:30:00 AM,12/21/2015 08:14:51 AM,ONTIME,Closed,Case Closed. Closed date : 2015-12-21 08:14:51.7 Case Resolved Created Request for Recycling Bin,Recycling Cart Return,Public Works Department,Recycling,Recycling Cart Return,PWDx_IPL Damaged Cart Replacement,PWDx,https://cityworker.cityofboston.gov:8443/attachments/report/5677fb4370b480b2278e04f5/photo/Report.jpg,,12 Bradlee St  Dorchester  MA  02124,8.0,03,4.0,B3,Dorchester,9.0,Ward 17,1701.0,R2,12 Bradlee St,2124.0,Address,19082.0,42.2973,-71.0731,City Worker App,"(42.2973, -71.0731)"
678945,101001679606,12/21/2015 12:45:00 PM,12/29/2015 12:45:57 PM,01/04/2016 02:04:37 PM,OVERDUE,Closed,Case Closed. Closed date : 2016-01-04 14:04:37.603 Case Noted Broken cart was removed and New recycle cart: 515# 0060018 was dropped off,Recycling Cart Return,Public Works Department,Recycling,Recycling Cart Return,PWDx_Recycling Cart Return,PWDx,,,4 Vesta Rd  Dorchester  MA  02124,7.0,03,4.0,B3,Greater Mattapan,9.0,Ward 14,1409.0,R3,4 Vesta Rd,2124.0,Address,380381.0,42.3594,-71.0587,Constituent Call,"(0, 0)"
679023,101001679721,12/21/2015 02:37:41 PM,12/29/2015 02:37:41 PM,12/21/2015 02:37:46 PM,ONTIME,Closed,Case Closed. Closed date : 2015-12-21 14:37:46.75 Case Resolved Created Request for Recycling Bin,Recycling Cart Return,Public Works Department,Recycling,Recycling Cart Return,PWDx_IPL Damaged Cart Replacement,PWDx,https://cityworker.cityofboston.gov:8443/attachments/report/5678550670b480b2278e11b6/photo/Report.jpg,,394 Washington St  Dorchester  MA  02124,7.0,03,4.0,C11,Dorchester,9.0,Ward 17,1701.0,R2,394 Washington St,2124.0,Address,146058.0,42.2978,-71.0724,City Worker App,"(42.2978, -71.0724)"
679284,101001680160,12/22/2015 09:39:15 AM,12/30/2015 09:39:14 AM,12/22/2015 09:39:20 AM,ONTIME,Closed,Case Closed. Closed date : 2015-12-22 09:39:20.267 Case Resolved Created Request for Recycling Bin,Recycling Cart Return,Public Works Department,Recycling,Recycling Cart Return,PWDx_IPL Damaged Cart Replacement,PWDx,https://cityworker.cityofboston.gov:8443/attachments/report/5679609170b480b2278e1716/photo/Report.jpg,,6 Gleason St  Dorchester  MA  02121,7.0,03,4.0,B3,Greater Mattapan,8.0,Ward 14,1402.0,R3,6 Gleason St,2121.0,Address,63918.0,42.2965,-71.0817,City Worker App,"(42.2965, -71.0817)"
679693,101001680823,12/23/2015 08:16:13 AM,12/31/2015 08:30:00 AM,12/23/2015 08:16:18 AM,ONTIME,Closed,Case Closed. Closed date : 2015-12-23 08:16:18.59 Case Resolved Created Request for Recycling Bin,Recycling Cart Return,Public Works Department,Recycling,Recycling Cart Return,PWDx_IPL Damaged Cart Replacement,PWDx,https://cityworker.cityofboston.gov:8443/attachments/report/567a9e9970b480b2278e24a6/photo/Report.jpg,,107 Fisher Ave  Mission Hill  MA  02120,9.0,10A,8.0,B2,Mission Hill,14.0,Ward 10,1005.0,E,107 Fisher Ave,2120.0,Address,58520.0,42.3281,-71.1048,City Worker App,"(42.3281, -71.1048)"
679886,101001681104,12/23/2015 11:04:00 AM,12/31/2015 11:04:36 AM,12/30/2015 02:51:20 PM,ONTIME,Closed,Case Closed. Closed date : 2015-12-30 14:51:20.603 Case Resolved broken cart swapped new cart # 5150059304 12/30/2015,Recycling Cart Return,Public Works Department,Recycling,Recycling Cart Return,PWDx_IPL Damaged Cart Replacement,PWDx,,,116 Brook Ave  Dorchester  MA  02125,7.0,03,7.0,B2,Roxbury,13.0,Ward 13,1302.0,R2,116 Brook Ave,2125.0,Address,21829.0,42.3206,-71.0728,Constituent Call,"(42.3206, -71.0728)"
679960,101001681212,12/23/2015 12:51:00 PM,12/31/2015 12:51:31 PM,12/30/2015 01:18:20 PM,ONTIME,Closed,Case Closed. Closed date : 2015-12-30 13:18:20.133 Case Resolved Pick up two cart # DO 779809 and # DO 778742 . All set . 12/30/2015,Recycling Cart Return,Public Works Department,Recycling,Recycling Cart Return,PWDx_Recycling Cart Return,PWDx,,,3841-3843 Washington St  Roslindale  MA  02131,12.0,02,6.0,E5,Jamaica Plain,10.0,Ward 19,1907.0,RC,3841-3843 Washington St,2131.0,Address,144983.0,42.2971,-71.1171,Constituent Call,"(42.2971, -71.1171)"
680165,101001681523,12/24/2015 07:56:34 AM,01/04/2016 08:30:00 AM,12/24/2015 07:56:41 AM,ONTIME,Closed,Case Closed. Closed date : 2015-12-24 07:56:41.31 Case Resolved Created Request for Recycling Bin,Recycling Cart Return,Public Works Department,Recycling,Recycling Cart Return,PWDx_IPL Damaged Cart Replacement,PWDx,https://cityworker.cityofboston.gov:8443/attachments/report/567beb7e70b480b2278e3254/photo/Report.jpg,,24 Nahant Ave  Dorchester  MA  02122,8.0,07,3.0,C11,Dorchester,7.0,Ward 16,1609.0,CM,24 Nahant Ave,2122.0,Address,100165.0,42.2879,-71.0534,City Worker App,"(42.2879, -71.0534)"
680167,101001681526,12/24/2015 07:57:42 AM,01/04/2016 08:30:00 AM,12/24/2015 07:57:48 AM,ONTIME,Closed,Case Closed. Closed date : 2015-12-24 07:57:48.39 Case Resolved Created Request for Recycling Bin,Recycling Cart Return,Public Works Department,Recycling,Recycling Cart Return,PWDx_IPL Damaged Cart Replacement,PWDx,https://cityworker.cityofboston.gov:8443/attachments/report/567bebc270b480b2278e3268/photo/Report.jpg,,24 Nahant Ave  Dorchester  MA  02122,8.0,07,3.0,C11,Dorchester,7.0,Ward 16,1609.0,CM,24 Nahant Ave,2122.0,Address,100165.0,42.2879,-71.0534,City Worker App,"(42.2879, -71.0534)"
680171,101001681532,12/24/2015 08:08:21 AM,01/04/2016 08:30:00 AM,12/24/2015 08:08:26 AM,ONTIME,Closed,Case Closed. Closed date : 2015-12-24 08:08:26.423 Case Resolved Created Request for Recycling Bin,Recycling Cart Return,Public Works Department,Recycling,Recycling Cart Return,PWDx_IPL Damaged Cart Replacement,PWDx,https://cityworker.cityofboston.gov:8443/attachments/report/567bee4370b480b2278e3285/photo/Report.jpg,,61 Beaumont St  Dorchester  MA  02124,8.0,07,3.0,C11,Dorchester,7.0,Ward 16,1608.0,R2,61 Beaumont St,2124.0,Address,12953.0,42.2851,-71.0581,City Worker App,"(42.2851, -71.0581)"
680177,101001681540,12/24/2015 08:15:34 AM,01/04/2016 08:30:00 AM,12/24/2015 08:15:39 AM,ONTIME,Closed,Case Closed. Closed date : 2015-12-24 08:15:39.827 Case Resolved Created Request for Recycling Bin,Recycling Cart Return,Public Works Department,Recycling,Recycling Cart Return,PWDx_IPL Damaged Cart Replacement,PWDx,https://cityworker.cityofboston.gov:8443/attachments/report/567beff670b480b2278e32c0/photo/Report.jpg,,14 Westmoreland St  Dorchester  MA  02124,8.0,07,3.0,C11,Dorchester,7.0,Ward 16,1608.0,R2,14 Westmoreland St,2124.0,Address,148747.0,42.2846,-71.0571,City Worker App,"(42.2846, -71.0571)"
680264,101001681700,12/24/2015 11:56:02 AM,01/04/2016 11:56:02 AM,12/24/2015 11:56:06 AM,ONTIME,Closed,Case Closed. Closed date : 2015-12-24 11:56:06.08 Case Resolved Created Request for Recycling Bin,Recycling Cart Return,Public Works Department,Recycling,Recycling Cart Return,PWDx_IPL Damaged Cart Replacement,PWDx,,,5-7 Milton St  Dorchester  MA  02124,8.0,07,3.0,C11,Dorchester,7.0,Ward 16,1611.0,R2,5-7 Milton St,2124.0,Address,95846.0,42.2797,-71.0599,City Worker App,"(42.2797, -71.0599)"
680277,101001681720,12/24/2015 12:26:53 PM,01/04/2016 12:26:53 PM,12/24/2015 12:26:57 PM,ONTIME,Closed,Case Closed. Closed date : 2015-12-24 12:26:57.207 Case Resolved Created Request for Recycling Bin,Recycling Cart Return,Public Works Department,Recycling,Recycling Cart Return,PWDx_IPL Damaged Cart Replacement,PWDx,,,573 Gallivan Blvd  Dorchester  MA  02124,8.0,07,3.0,C11,Dorchester,7.0,Ward 16,1612.0,R2,573 Gallivan Blvd,2124.0,Address,239184.0,42.2829,-71.0523,City Worker App,"(42.2829, -71.0523)"
681010,101001682764,12/28/2015 11:12:00 AM,01/05/2016 11:12:38 AM,01/02/2016 10:35:57 AM,ONTIME,Closed,Case Closed. Closed date : 2016-01-02 10:35:57.423 Case Noted During inspection Carts appear to be in good condition please feel free to call back if incorrect thank you.,Recycling Cart Return,Public Works Department,Recycling,Recycling Cart Return,PWDx_Recycling Cart Return,PWDx,,,290 Lincoln St  Allston  MA  02134,11.0,04,9.0,D14,Allston / Brighton,15.0,Ward 22,2202.0,R2,290 Lincoln St,2134.0,Address,403059.0,42.3594,-71.0587,Constituent Call,"(0, 0)"
681668,101001683869,12/29/2015 03:20:00 PM,01/06/2016 03:20:22 PM,01/06/2016 08:10:05 AM,ONTIME,Closed,Case Closed. Closed date : 2016-01-06 08:10:05.06 Case Resolved damaged cart swapped new cart # 5150059832 and 5150060019 01/05/2016,Recycling Cart Return,Public Works Department,Recycling,Recycling Cart Return,PWDx_IPL Damaged Cart Replacement,PWDx,,,921 E Fourth St  South Boston  MA  02127,6.0,05,2.0,C6,South Boston / South Boston Waterfront,5.0,Ward 6,609.0,R1,921 E Fourth St,2127.0,Address,60111.0,42.3348,-71.0262,Constituent Call,"(42.3348, -71.0262)"
681701,101001683939,12/29/2015 04:22:00 PM,01/06/2016 04:22:49 PM,01/05/2016 01:36:28 PM,ONTIME,Closed,Case Closed. Closed date : 2016-01-05 13:36:28.467 Case Resolved On reminder list pick up recycle broken cart # 0513426581 new cart R9 0034446 . 1/05/2016,Recycling Cart Return,Public Works Department,Recycling,Recycling Cart Return,PWDx_IPL Damaged Cart Replacement,PWDx,,,15-17 Grovenor Rd  Jamaica Plain  MA  02130,9.0,02,6.0,E13,Jamaica Plain,11.0,Ward 19,1905.0,CM,15-17 Grovenor Rd,2130.0,Address,165885.0,42.3144,-71.1148,Constituent Call,"(42.3144, -71.1148)"
681878,101001684227,12/30/2015 08:03:00 AM,01/07/2016 08:30:00 AM,12/30/2015 08:03:09 AM,ONTIME,Closed,Case Closed. Closed date : 2015-12-30 08:03:09.703 Case Resolved Created Request for Recycling Bin,Recycling Cart Return,Public Works Department,Recycling,Recycling Cart Return,PWDx_IPL Damaged Cart Replacement,PWDx,https://cityworker.cityofboston.gov:8443/attachments/report/5683d60270b48cf7b37d4c0b/photo/Report.jpg,,9 Holiday St  Dorchester  MA  02122,7.0,03,4.0,C11,Dorchester,8.0,Ward 15,1505.0,R1,9 Holiday St,2122.0,Address,74609.0,42.3018,-71.0712,City Worker App,"(42.3018, -71.0712)"
681924,101001684355,12/30/2015 08:58:04 AM,01/07/2016 08:58:04 AM,12/30/2015 08:58:09 AM,ONTIME,Closed,Case Closed. Closed date : 2015-12-30 08:58:09.6 Case Resolved Created Request for Recycling Bin,Recycling Cart Return,Public Works Department,Recycling,Recycling Cart Return,PWDx_IPL Damaged Cart Replacement,PWDx,https://cityworker.cityofboston.gov:8443/attachments/report/5683e2ea70b48cf7b37d4daa/photo/Report.jpg,,263 Fuller St  Dorchester  MA  02124,8.0,07,4.0,B3,Dorchester,9.0,Ward 17,1710.0,R3,263 Fuller St,2124.0,Address,61168.0,42.2807,-71.0781,City Worker App,"(42.2807, -71.0781)"
682030,101001684557,12/30/2015 10:38:27 AM,01/07/2016 10:38:27 AM,12/30/2015 10:38:33 AM,ONTIME,Closed,Case Closed. Closed date : 2015-12-30 10:38:33.123 Case Resolved Created Request for Recycling Bin,Recycling Cart Return,Public Works Department,Recycling,Recycling Cart Return,PWDx_IPL Damaged Cart Replacement,PWDx,https://cityworker.cityofboston.gov:8443/attachments/report/5683fa7270b48cf7b37d5288/photo/Report.jpg,,30 Meadowbank Ave  Mattapan  MA  02126,8.0,07,4.0,B3,Greater Mattapan,9.0,Ward 18,1801.0,R2,30 Meadowbank Ave,2126.0,Address,93626.0,42.27,-71.0817,City Worker App,"(42.27, -71.0817)"
682044,101001684575,12/30/2015 10:50:06 AM,01/07/2016 10:50:06 AM,12/30/2015 10:50:11 AM,ONTIME,Closed,Case Closed. Closed date : 2015-12-30 10:50:11.727 Case Resolved Created Request for Recycling Bin,Recycling Cart Return,Public Works Department,Recycling,Recycling Cart Return,PWDx_IPL Damaged Cart Replacement,PWDx,https://cityworker.cityofboston.gov:8443/attachments/report/5683fd2b70b48cf7b37d52cf/photo/Report.jpg,,308 River St  Mattapan  MA  02126,8.0,07,4.0,B3,Greater Mattapan,9.0,Ward 18,1801.0,R2,308 River St,2126.0,Address,116577.0,42.2709,-71.0846,City Worker App,"(42.2709, -71.0846)"
682413,101001685303,12/31/2015 08:33:00 AM,01/08/2016 08:33:21 AM,01/07/2016 01:31:34 PM,ONTIME,Closed,Case Closed. Closed date : 2016-01-07 13:31:34.203 Case Resolved Please see below to retrieve the cart information:  Damaged Cart: 0912453637 New Cart: 515# 0059830 1/06/2016,Recycling Cart Return,Public Works Department,Recycling,Recycling Cart Return,PWDx_IPL Damaged Cart Replacement,PWDx,,,103 Russell St  Charlestown  MA  02129,3.0,1A,1.0,A15,Charlestown,2.0,Ward 2,206.0,R2,103 Russell St,2129.0,Address,119622.0,42.3809,-71.0683,Constituent Call,"(42.3809, -71.0683)"
682544,101001685518,12/31/2015 12:53:54 PM,01/08/2016 12:53:54 PM,12/31/2015 12:54:01 PM,ONTIME,Closed,Case Closed. Closed date : 2015-12-31 12:54:01.347 Case Resolved Created Request for Recycling Bin,Recycling Cart Return,Public Works Department,Recycling,Recycling Cart Return,PWDx_IPL Damaged Cart Replacement,PWDx,https://cityworker.cityofboston.gov:8443/attachments/report/56856bb170b48cf7b37d64a5/photo/Report.jpg,,27 Robin Hood St  Dorchester  MA  02125,7.0,03,7.0,B2,Roxbury,13.0,Ward 13,1302.0,R1,27 Robin Hood St,2125.0,Address,117361.0,42.3175,-71.0728,City Worker App,"(42.3175, -71.0728)"
682559,101001685534,12/31/2015 01:22:41 PM,01/08/2016 01:22:41 PM,12/31/2015 01:22:47 PM,ONTIME,Closed,Case Closed. Closed date : 2015-12-31 13:22:47.55 Case Resolved Created Request for Recycling Bin,Recycling Cart Return,Public Works Department,Recycling,Recycling Cart Return,PWDx_IPL Damaged Cart Replacement,PWDx,https://cityworker.cityofboston.gov:8443/attachments/report/5685727070b48cf7b37d6500/photo/Report.jpg,,30 Granville St  Dorchester  MA  02124,8.0,07,3.0,C11,Dorchester,7.0,Ward 16,1611.0,R2,30 Granville St,2124.0,Address,65994.0,42.2811,-71.0565,City Worker App,"(42.2811, -71.0565)"
