,CASE_ENQUIRY_ID,OPEN_DT,TARGET_DT,CLOSED_DT,OnTime_Status,CASE_STATUS,CLOSURE_REASON,CASE_TITLE,SUBJECT,REASON,TYPE,QUEUE,Department,SubmittedPhoto,ClosedPhoto,Location,fire_district,pwd_district,city_council_district,police_district,neighborhood,neighborhood_services_district,ward,precinct,land_usage,LOCATION_STREET_NAME,LOCATION_ZIPCODE,Property_Type,Property_ID,LATITUDE,LONGITUDE,Source,Geocoded_Location
469816,101001241258,01/02/2015 11:52:36 AM,02/02/2015 11:52:36 AM,03/27/2015 02:22:22 PM,OVERDUE,Closed,Case Closed Case Resolved This request has been approved. Request for Recycling Cart has been created. See case #101001343718 for status of the request.,Recyling Cart Inquiry,Public Works Department,Recycling,Request for Recycling Cart,PWDx_Recycling Cart Inquiry,PWDx,,,23-25 Holman St  Allston  MA  02134,11.0,04,9.0,D14,Allston / Brighton,15.0,Ward 22,2201.0,R2,23-25 Holman St,2134.0,Address,74773.0,42.359,-71.1298,Constituent Call,"(42.359, -71.1298)"
469915,101001241407,01/02/2015 02:43:01 PM,05/27/2015 02:43:00 PM,05/12/2015 12:15:11 PM,ONTIME,Closed,Case Closed. Closed date : 2015-05-12 12:15:11.053 Case Resolved cart requested filled new cart # 0415302938 05/11/2015,Recycling Cart Inquiry,Public Works Department,Recycling,Request for Recycling Cart,PWDx_Recycling,PWDx,,,195 South St  Jamaica Plain  MA  02130,9.0,02,6.0,E13,Jamaica Plain,11.0,Ward 11,1110.0,CD,195 South St,2130.0,Address,128772.0,42.3034,-71.1149,Self Service,"(42.3034, -71.1149)"
470011,101001241568,01/02/2015 10:21:50 PM,02/03/2015 08:30:00 AM,03/27/2015 12:29:51 PM,OVERDUE,Closed,Case Closed Case Resolved This request has been approved. Request for Recycling Cart has been created. See case #101001343535 for status of the request.,Recycling Cart Inquiry,Public Works Department,Recycling,Request for Recycling Cart,PWDx_Recycling Cart Inquiry,PWDx,,,28 Hawthorne St  Roxbury  MA  02119,9.0,10B,7.0,B2,Roxbury,13.0,Ward 11,1102.0,R3,28 Hawthorne St,2119.0,Address,158952.0,42.3241,-71.0917,Self Service,"(42.3241, -71.0917)"
470099,101001241691,01/03/2015 02:53:48 PM,02/03/2015 08:30:00 AM,03/27/2015 12:31:38 PM,OVERDUE,Closed,Case Closed Case Resolved This request has been approved. Request for Recycling Cart has been created. See case #101001343540 for status of the request.,recycling Cart Inquiry,Public Works Department,Recycling,Request for Recycling Cart,PWDx_Recycling Cart Inquiry,PWDx,,,209 D St  South Boston  MA  02127,6.0,05,2.0,C6,South Boston / South Boston Waterfront,5.0,Ward 6,603.0,CM,209 D St,2127.0,Address,45453.0,42.3376,-71.052,Self Service,"(42.3376, -71.052)"
470263,101001241909,01/04/2015 12:17:01 PM,02/03/2015 08:30:00 AM,01/09/2015 02:42:35 PM,ONTIME,Closed,Case Closed Case Resolved Cart was dropped off by PWD inspector.,Request for Recycling Cart,Public Works Department,Recycling,Request for Recycling Cart,PWDx_Recycling,PWDx,,,16-18 Donnybrook Rd  Brighton  MA  02135,11.0,04,9.0,D14,Allston / Brighton,15.0,Ward 22,2210.0,R2,16-18 Donnybrook Rd,2135.0,Address,48047.0,42.3541,-71.1592,Self Service,"(42.3541, -71.1592)"
470305,101001241969,01/04/2015 05:40:40 PM,05/27/2015 08:30:00 AM,05/01/2015 01:08:36 PM,ONTIME,Closed,Case Closed Case Resolved cart requested filled new cart#0714423704 04/30/2015,Recycling Cart Inquiry,Public Works Department,Recycling,Request for Recycling Cart,PWDx_Recycling,PWDx,,,40 Dennison St  Roxbury  MA  02119,9.0,10B,7.0,B2,Roxbury,13.0,11,1103.0,,40 Dennison St,2119.0,Address,345970.0,42.3594,-71.0587,Self Service,"(0, 0)"
470642,101001242457,01/05/2015 01:36:50 PM,02/03/2015 01:36:50 PM,04/23/2015 11:50:38 AM,OVERDUE,Closed,Case Closed Case Resolved request filled new cart # 0714423823 04/17/2015,Recycling Cart Inquiry,Public Works Department,Recycling,Request for Recycling Cart,PWDx_Recycling Cart Inquiry,PWDx,,,36 Dudley St  Roxbury  MA  02119,7.0,10B,7.0,B2,Roxbury,13.0,Ward 9,905.0,R1,36 Dudley St,2119.0,Address,49711.0,42.3295,-71.0884,Self Service,"(42.3295, -71.0884)"
470774,101001242650,01/05/2015 05:30:18 PM,02/04/2015 08:30:00 AM,03/27/2015 02:45:54 PM,OVERDUE,Closed,Case Closed Case Resolved This request has been approved. Request for Recycling Cart has been created. See case #101001343759 for status of the request.,Recycling Cart Inquiry,Public Works Department,Recycling,Request for Recycling Cart,PWDx_Recycling Cart Inquiry,PWDx,,,33 Sackville St  Charlestown  MA  02129,3.0,1A,1.0,A15,Charlestown,2.0,Ward 2,205.0,R1,33 Sackville St,2129.0,Address,120391.0,42.3815,-71.0643,Self Service,"(42.3815, -71.0643)"
470960,101001242914,01/06/2015 09:48:21 AM,02/04/2015 09:48:21 AM,05/12/2015 02:27:51 PM,OVERDUE,Closed,Case Closed. Closed date : 2015-05-12 14:27:51.1 Case Resolved no broken cart out 5/12/2015,Request for Recycling Cart,Public Works Department,Recycling,Request for Recycling Cart,PWDx_IPL Damaged Cart Replacement,PWDx,https://cityworker.cityofboston.gov:8443/attachments/report/54abf5b4d052556a652f2f5d/photo/Report.jpg,,796 E Fourth St  South Boston  MA  02127,6.0,05,2.0,C6,South Boston / South Boston Waterfront,5.0,Ward 6,608.0,R1,796 E Fourth St,2127.0,Address,59994.0,42.335,-71.0314,City Worker App,"(42.335, -71.0314)"
471012,101001242986,01/06/2015 10:44:34 AM,02/04/2015 10:44:33 AM,03/27/2015 02:48:00 PM,OVERDUE,Closed,Case Closed Case Resolved Already recieved a cart,Recycling Cart Inquiry,Public Works Department,Recycling,Request for Recycling Cart,PWDx_Recycling Cart Inquiry,PWDx,,,35 Parkton Rd  Jamaica Plain  MA  02130,9.0,02,6.0,E13,Jamaica Plain,11.0,Ward 10,1009.0,R3,35 Parkton Rd,2130.0,Address,290963.0,42.3226,-71.1141,Self Service,"(42.3226, -71.1141)"
471118,101001243159,01/06/2015 02:13:37 PM,02/04/2015 02:13:37 PM,02/02/2015 03:16:40 AM,ONTIME,Closed,Case Closed Case Noted Failed to identify associated serial numbers. Hopefully resident sorted out the issue. If not please call PWD Waste Reduction.,Request for Recycling Cart,Public Works Department,Recycling,Request for Recycling Cart,PWDx_Recycling,PWDx,,,15 Anson St  Jamaica Plain  MA  02130,9.0,02,6.0,E13,Jamaica Plain,11.0,Ward 11,1110.0,R3,15 Anson St,2130.0,Address,3727.0,42.3029,-71.1137,Self Service,"(42.3029, -71.1137)"
471238,101001243311,01/06/2015 04:50:19 PM,02/04/2015 04:50:19 PM,03/27/2015 02:50:19 PM,OVERDUE,Closed,Case Closed Case Resolved This request has been approved. Request for Recycling Cart has been created. See case #101001343766 for status of the request.,Recycling Cart Inquiry,Public Works Department,Recycling,Request for Recycling Cart,PWDx_Recycling Cart Inquiry,PWDx,,,5-7 Wilmington Ave  Dorchester  MA  02124,8.0,07,3.0,B3,Dorchester,7.0,Ward 17,1712.0,R2,5-7 Wilmington Ave,2124.0,Address,150447.0,42.2788,-71.0782,Self Service,"(42.2788, -71.0782)"
471628,101001243875,01/07/2015 09:32:57 PM,05/27/2015 08:30:00 AM,04/28/2015 10:11:35 AM,ONTIME,Closed,Case Closed Duplicate of Existing Case  Reference #101001362678,Recycling Cart Inquiry,Public Works Department,Recycling,Request for Recycling Cart,PWDx_Recycling,PWDx,,,7 Haverford St  Jamaica Plain  MA  02130,9.0,02,6.0,E13,Jamaica Plain,11.0,Ward 11,1106.0,R2,7 Haverford St,2130.0,Address,71342.0,42.312,-71.1028,Self Service,"(42.312, -71.1028)"
471708,101001244004,01/08/2015 09:34:07 AM,05/27/2015 09:34:00 AM,04/28/2015 02:19:34 PM,ONTIME,Closed,Case Closed Duplicate of Existing Case  case reference # 101001362912one cart per household,Recycling Cart Inquiry,Public Works Department,Recycling,Request for Recycling Cart,PWDx_Recycling,PWDx,,,77 Augustus Ave  Roslindale  MA  02131,12.0,06,5.0,E5,Roslindale,10.0,Ward 18,1810.0,CM,77 Augustus Ave,2131.0,Address,6590.0,42.28,-71.1304,Self Service,"(42.28, -71.1304)"
472003,101001244395,01/08/2015 03:07:25 PM,02/06/2015 03:07:25 PM,01/09/2015 02:23:23 PM,ONTIME,Closed,Case Closed Case Noted resident does not have space for a cart and thought we were delivering the small bins  not the large carts.  request cancelled,Request for Recycling Cart,Public Works Department,Recycling,Request for Recycling Cart,PWDx_Recycling,PWDx,,,1 Powers Ct  Boston  MA  02109,3.0,1B,1.0,A1,Downtown / Financial District,3.0,Ward 3,301.0,R4,1 Powers Ct,2109.0,Address,295064.0,42.366,-71.0517,Self Service,"(42.366, -71.0517)"
472125,101001244567,01/08/2015 10:04:00 PM,05/27/2015 08:30:00 AM,06/09/2015 12:23:28 PM,OVERDUE,Closed,Case Closed. Closed date : 2015-06-09 12:23:28.38 Case Resolved cart requested filled new cart #0415313551 06/08/2015,Recycling Cart Inquiry,Public Works Department,Recycling,Request for Recycling Cart,PWDx_Recycling,PWDx,,,36 Condor St  East Boston  MA  02128,1.0,09,1.0,A7,East Boston,1.0,Ward 1,108.0,R2,36 Condor St,2128.0,Address,218177.0,42.3828,-71.0387,Self Service,"(42.3828, -71.0387)"
472480,101001245096,01/09/2015 03:17:00 PM,05/27/2015 03:17:00 PM,06/08/2015 12:12:10 PM,OVERDUE,Closed,Case Closed. Closed date : 2015-06-08 12:12:10.81 Case Resolved cart requested filled new cart #0415302529 06/04/2015,Recycling Cart Inquiry,Public Works Department,Recycling,Request for Recycling Cart,PWDx_Recycling,PWDx,,,18 Burt St  Dorchester  MA  02124,8.0,07,4.0,C11,Dorchester,8.0,Ward 17,1711.0,R1,18 Burt St,2124.0,Address,24104.0,42.2847,-71.0678,Self Service,"(42.2847, -71.0678)"
472642,101001245324,01/10/2015 02:15:37 PM,02/10/2015 08:30:00 AM,03/20/2015 02:24:56 PM,OVERDUE,Closed,Case Closed Case Resolved This request has been approved. Request for Recycling Cart has been created. See case #101001338472 for status of the request.,Recycling Cart Inquiry,Public Works Department,Recycling,Request for Recycling Cart,PWDx_Recycling Cart Inquiry,PWDx,,,7 Rowell St  Dorchester  MA  02125,7.0,03,3.0,C11,Dorchester,7.0,Ward 13,1306.0,CM,7 Rowell St,2125.0,Address,119103.0,42.3131,-71.064,Self Service,"(42.3131, -71.064)"
473137,101001246092,01/12/2015 01:41:45 PM,02/10/2015 01:41:45 PM,02/02/2015 03:14:49 AM,ONTIME,Closed,Case Closed Case Resolved New cart dropped off,Request for Recycling Cart,Public Works Department,Recycling,Request for Recycling Cart,PWDx_Recycling,PWDx,,,15 Rita Rd  Dorchester  MA  02124,8.0,07,3.0,C11,Dorchester,7.0,Ward 16,1612.0,E,15 Rita Rd,2124.0,Address,169104.0,42.2826,-71.0512,Self Service,"(42.2826, -71.0512)"
473482,101001246611,01/13/2015 12:10:33 PM,02/11/2015 12:10:33 PM,01/21/2015 02:34:42 PM,ONTIME,Closed,Case Closed Case Noted brocken cart swapped new cart# 5149007364 1/21/15,Request for Recycling Cart,Public Works Department,Recycling,Request for Recycling Cart,PWDx_IPL Damaged Cart Replacement,PWDx,,,9 Stanton St  Dorchester  MA  02124,8.0,07,4.0,B3,Dorchester,9.0,17,1707.0,E,9 Stanton St,2124.0,Address,130247.0,42.2829,-71.0787,City Worker App,"(42.2829, -71.0787)"
473514,101001246657,01/13/2015 01:05:11 PM,02/11/2015 01:05:11 PM,01/13/2015 01:14:41 PM,ONTIME,Closed,Case Closed Case Resolved Replaced with cart #0513426794 on 1-13-15 by PWD inspector.,Request for Recycling Cart,Public Works Department,Recycling,Request for Recycling Cart,PWDx_IPL Damaged Cart Replacement,PWDx,https://cityworker.cityofboston.gov:8443/attachments/report/54b55e56d052556a652f2f96/photo/Report.jpg,,134 Redlands Rd  West Roxbury  MA  02132,12.0,06,6.0,E5,West Roxbury,12.0,Ward 20,2020.0,R2,134 Redlands Rd,2132.0,Address,297758.0,42.2912,-71.1543,City Worker App,"(42.2912, -71.1543)"
473652,101001246857,01/13/2015 07:21:14 PM,05/27/2015 08:30:00 AM,06/03/2015 02:00:16 PM,OVERDUE,Closed,Case Closed. Closed date : 2015-06-03 14:00:16.1 Case Resolved cart requested filled new cart #714423805 06/01/2015,recycling Cart Inquiry,Public Works Department,Recycling,Request for Recycling Cart,PWDx_Recycling,PWDx,,,46 Atherton St  Roxbury  MA  02119,9.0,02,6.0,E13,Jamaica Plain,11.0,Ward 11,1104.0,R2,46 Atherton St,2119.0,Address,5879.0,42.3176,-71.1009,Self Service,"(42.3176, -71.1009)"
473661,101001246869,01/13/2015 08:01:31 PM,05/27/2015 08:30:00 AM,05/01/2015 01:07:45 PM,ONTIME,Closed,Case Closed Case Resolved cart requested filled new cart# 0714423704 04/30/2015,Recycling Cart Inquiry,Public Works Department,Recycling,Request for Recycling Cart,PWDx_Recycling,PWDx,,,43 Fort Ave  Roxbury  MA  02119,9.0,10B,7.0,B2,Roxbury,13.0,Ward 11,1101.0,R2,43 Fort Ave,2119.0,Address,236958.0,42.326,-71.0949,Self Service,"(42.326, -71.0949)"
473675,101001246887,01/13/2015 09:00:35 PM,02/12/2015 08:30:00 AM,02/02/2015 03:10:17 AM,ONTIME,Closed,Case Closed Case Resolved new cart dropped off on 1/22/15,Request for Recycling Cart,Public Works Department,Recycling,Request for Recycling Cart,PWDx_Recycling,PWDx,,,49 Imrie Rd  Allston  MA  02134,11.0,04,9.0,D14,Allston / Brighton,15.0,Ward 21,2106.0,R2,49 Imrie Rd,2134.0,Address,78039.0,42.3515,-71.1382,Self Service,"(42.3515, -71.1382)"
473832,101001247106,01/14/2015 10:22:50 AM,02/12/2015 10:22:50 AM,04/21/2015 09:34:37 AM,OVERDUE,Closed,Case Closed Case Resolved Cart requested swapped out new cart #0714423978 04/15/2015,Recycling Cart Inquiry,Public Works Department,Recycling,Request for Recycling Cart,PWDx_Recycling,PWDx,,,514 Sumner St  East Boston  MA  02128,1.0,09,1.0,A7,East Boston,1.0,Ward 1,101.0,R4,514 Sumner St,2128.0,Address,132512.0,42.3649,-71.0302,Self Service,"(42.3649, -71.0302)"
474009,101001247373,01/14/2015 02:54:37 PM,05/27/2015 02:54:00 PM,06/03/2015 01:00:22 PM,OVERDUE,Closed,Case Closed. Closed date : 2015-06-03 13:00:22.5 Case Resolved cart requested filled new cart #0415302212 05/27/15,Recycling Cart Inquiry,Public Works Department,Recycling,Request for Recycling Cart,PWDx_Recycling,PWDx,,,15 Gertrude Rd  West Roxbury  MA  02132,12.0,06,6.0,E5,West Roxbury,12.0,Ward 20,2014.0,CM,15 Gertrude Rd,2132.0,Address,63581.0,42.2803,-71.1494,Constituent Call,"(42.2803, -71.1494)"
474060,101001247457,01/14/2015 04:04:25 PM,02/12/2015 04:04:25 PM,03/27/2015 03:55:14 PM,OVERDUE,Closed,Case Closed Case Resolved This request has been approved. Request for Recycling Cart has been created. See case #101001343835 for status of the request.,Recycling Cart Inquiry,Public Works Department,Recycling,Request for Recycling Cart,PWDx_Recycling Cart Inquiry,PWDx,,,14 Emerson St  South Boston  MA  02127,6.0,05,2.0,C6,South Boston / South Boston Waterfront,5.0,Ward 6,605.0,E,14 Emerson St,2127.0,Address,53553.0,42.3367,-71.0435,Self Service,"(42.3367, -71.0435)"
474117,101001247529,01/14/2015 07:29:21 PM,02/13/2015 08:30:00 AM,03/31/2015 11:00:00 AM,OVERDUE,Closed,Case Closed Case Resolved Constituent no longer requests a recycling cart.,Recycling Cart Inquiry,Public Works Department,Recycling,Request for Recycling Cart,PWDx_Recycling Cart Inquiry,PWDx,,,19 Brown Ave  Roslindale  MA  02131,12.0,06,5.0,E5,Roslindale,10.0,Ward 19,1910.0,R1,19 Brown Ave,2131.0,Address,22747.0,42.2805,-71.1238,Self Service,"(42.2805, -71.1238)"
474929,101001248722,01/16/2015 02:45:00 PM,05/27/2015 02:45:00 PM,06/09/2015 11:59:48 AM,OVERDUE,Closed,Case Closed. Closed date : 2015-06-09 11:59:48.13 Case Resolved cart requested filled new cart #0415302477 06/08/2015,Recycling Cart Inquiry,Public Works Department,Recycling,Request for Recycling Cart,PWDx_Recycling,PWDx,,,5 Driftwood Rd  Jamaica Plain  MA  02130,9.0,02,6.0,E13,Jamaica Plain,11.0,Ward 19,1902.0,R1,5 Driftwood Rd,2130.0,Address,49544.0,42.3084,-71.1276,Self Service,"(42.3084, -71.1276)"
475239,101001249179,01/18/2015 02:52:30 PM,05/28/2015 08:30:00 AM,04/30/2015 10:33:37 AM,ONTIME,Closed,Case Closed Case Resolved cart requested filled new cart #0714423770 04/29/2015,Recycling Cart Inquiry,Public Works Department,Recycling,Request for Recycling Cart,PWDx_Recycling,PWDx,,,17 Monument Ave  Charlestown  MA  02129,3.0,1A,1.0,A15,Charlestown,2.0,Ward 2,203.0,R1,17 Monument Ave,2129.0,Address,96852.0,42.3742,-71.062,Self Service,"(42.3742, -71.062)"
475425,101001249425,01/19/2015 04:41:56 PM,02/18/2015 08:30:00 AM,03/24/2015 11:48:35 AM,OVERDUE,Closed,Case Closed Case Resolved This request has been approved. Request for Recycling Cart has been created. See case #101001340625 for status of the request.,Recycling Cart Inquiry,Public Works Department,Recycling,Request for Recycling Cart,PWDx_Recycling,PWDx,,,28 Copeland St  Roxbury  MA  02119,7.0,10B,7.0,B2,Roxbury,13.0,Ward 12,1201.0,R3,28 Copeland St,2119.0,Address,42447.0,42.3224,-71.0809,Self Service,"(42.3224, -71.0809)"
475432,101001249432,01/19/2015 04:54:09 PM,05/28/2015 08:30:00 AM,05/06/2015 09:10:12 AM,ONTIME,Closed,Case Closed. Closed date : 2015-05-06 09:10:12.88 Case Resolved cart requested filled new cart #0714423863 04/16/2015,Recycling Cart Inquiry,Public Works Department,Recycling,Request for Recycling Cart,PWDx_Recycling,PWDx,,,81 Mount Pleasant Ave  Roxbury  MA  02119,7.0,10B,7.0,B2,Roxbury,13.0,Ward 8,804.0,R1,81 Mount Pleasant Ave,2119.0,Address,98419.0,42.3258,-71.0784,Self Service,"(42.3258, -71.0784)"
476197,101001250393,01/20/2015 01:16:59 PM,02/18/2015 01:16:59 PM,03/24/2015 01:26:32 PM,OVERDUE,Closed,Case Closed Case Resolved This request has been approved. Request for Recycling Cart has been created. See case #101001340789 for status of the request.,Recycling Cart Inquiry,Public Works Department,Recycling,Request for Recycling Cart,PWDx_Recycling Cart Inquiry,PWDx,,,15 Litchfield St  Brighton  MA  02135,11.0,04,9.0,D14,Allston / Brighton,15.0,Ward 22,2205.0,R3,15 Litchfield St,2135.0,Address,265060.0,42.3586,-71.1413,Self Service,"(42.3586, -71.1413)"
476440,101001250738,01/21/2015 07:50:03 AM,02/19/2015 08:30:00 AM,04/29/2015 02:04:18 PM,OVERDUE,Closed,Case Closed Case Resolved BROKEN CART SWAPPED NEW CART # 0714424117 04/29/2015,Request for Recycling Cart,Public Works Department,Recycling,Request for Recycling Cart,PWDx_IPL Damaged Cart Replacement,PWDx,https://cityworker.cityofboston.gov:8443/attachments/report/54bfa07ad052187a05b47c5b/photo/Report.jpg,,524 E Fifth St  South Boston  MA  02127,6.0,05,2.0,C6,South Boston / South Boston Waterfront,5.0,Ward 6,606.0,R1,524 E Fifth St,2127.0,Address,57847.0,42.334,-71.0395,City Worker App,"(42.334, -71.0395)"
476741,101001251222,01/21/2015 01:53:33 PM,02/19/2015 01:53:33 PM,05/29/2015 01:57:26 PM,OVERDUE,Closed,Case Closed Case Resolved  cart already been replaced,Request for Recycling Cart,Public Works Department,Recycling,Request for Recycling Cart,PWDx_IPL Damaged Cart Replacement,PWDx,https://cityworker.cityofboston.gov:8443/attachments/report/54bff5acd052187a05b47c96/photo/Report.jpg,,79 Devon St  Dorchester  MA  02121,7.0,03,4.0,B2,Roxbury,13.0,Ward 14,1401.0,R3,79 Devon St,2121.0,Address,47595.0,42.3097,-71.0796,City Worker App,"(42.3097, -71.0796)"
476840,101001251383,01/21/2015 03:42:00 PM,05/28/2015 03:42:00 PM,08/20/2015 12:26:56 PM,OVERDUE,Closed,Case Closed Case Resolved  one cart per household,Recycling Cart Inquiry,Public Works Department,Recycling,Request for Recycling Cart,PWDx_Recycling,PWDx,,,57 Olney St  Dorchester  MA  02121,7.0,03,4.0,C11,Dorchester,8.0,Ward 15,1502.0,R3,57 Olney St,2121.0,Address,287126.0,42.3057,-71.0715,Self Service,"(42.3057, -71.0715)"
477075,101001251754,01/22/2015 10:22:20 AM,02/20/2015 10:22:20 AM,03/24/2015 12:22:20 PM,OVERDUE,Closed,Case Closed Case Resolved This request has been approved. Request for Recycling Cart has been created. See case #101001340683 for status of the request.,recyling cart inquery,Public Works Department,Recycling,Request for Recycling Cart,PWDx_Recycling Cart Inquiry,PWDx,,,5 Hillside Ave  Jamaica Plain  MA  02130,12.0,02,6.0,E13,Jamaica Plain,10.0,Ward 19,1907.0,R1,5 Hillside Ave,2130.0,Address,74144.0,42.2974,-71.1131,Self Service,"(42.2974, -71.1131)"
477431,101001252330,01/23/2015 08:48:02 AM,02/23/2015 08:48:02 AM,04/24/2015 08:32:18 AM,OVERDUE,Closed,Case Closed Case Noted,Request for Recycling Cart,Public Works Department,Recycling,Request for Recycling Cart,PWDx_IPL Damaged Cart Replacement,PWDx,https://cityworker.cityofboston.gov:8443/attachments/report/54c25110d052599f22a16c3c/photo/Report.jpg,,INTERSECTION of Farnham St & Reading St  Roxbury  MA,7.0,10B,7.0,B2,Roxbury,13.0,Ward 8,803.0,,INTERSECTION Farnham St & Reading St,,Intersection,4807.0,42.3304,-71.074,City Worker App,"(42.3304, -71.074)"
477433,101001252333,01/23/2015 08:49:00 AM,05/29/2015 08:49:00 AM,08/20/2015 12:27:26 PM,OVERDUE,Closed,Case Closed Case Resolved  already delivered,Request for Recycling Cart,Public Works Department,Recycling,Request for Recycling Cart,PWDx_Recycling,PWDx,https://cityworker.cityofboston.gov:8443/attachments/report/54c25165d052599f22a16c5d/photo/Report.jpg,,11-13 Farnham St  Roxbury  MA  02119,7.0,10B,7.0,B2,Roxbury,13.0,Ward 8,803.0,CL,11-13 Farnham St,2119.0,Address,56382.0,42.3304,-71.0742,City Worker App,"(42.3304, -71.0742)"
478122,101001253354,01/24/2015 09:49:25 PM,02/24/2015 08:30:00 AM,03/24/2015 01:29:06 PM,OVERDUE,Closed,Case Closed Case Resolved This request has been approved. Request for Recycling Cart has been created. See case #101001340792 for status of the request.,Recycling Cart Inquiry,Public Works Department,Recycling,Request for Recycling Cart,PWDx_Recycling Cart Inquiry,PWDx,,,26 Bremen St  East Boston  MA  02128,1.0,09,1.0,A7,East Boston,1.0,Ward 1,103.0,R3,26 Bremen St,2128.0,Address,19844.0,42.3693,-71.0385,Self Service,"(42.3693, -71.0385)"
479265,101001255322,01/27/2015 03:31:02 PM,02/25/2015 03:31:02 PM,03/25/2015 11:56:28 AM,OVERDUE,Closed,Case Closed Case Resolved This request has been approved. Request for Recycling Cart has been created. See case #101001341642 for status of the request.,Recycling Cart Inquiry,Public Works Department,Recycling,Request for Recycling Cart,PWDx_Recycling Cart Inquiry,PWDx,,,3 Lovis St  South Boston  MA  02127,6.0,05,2.0,C6,South Boston / South Boston Waterfront,5.0,Ward 6,603.0,R1,3 Lovis St,2127.0,Address,87685.0,42.3369,-71.0509,Self Service,"(42.3369, -71.0509)"
480243,101001256410,01/27/2015 09:32:28 PM,02/26/2015 08:30:00 AM,03/25/2015 01:35:14 PM,OVERDUE,Closed,Case Closed Case Resolved does not want the cart,Recycling Cart Inquiry,Public Works Department,Recycling,Request for Recycling Cart,PWDx_Recycling Cart Inquiry,PWDx,,,32 Prospect St  Charlestown  MA  02129,3.0,1A,1.0,A15,Charlestown,2.0,Ward 2,203.0,R3,32 Prospect St,2129.0,Address,296290.0,42.3756,-71.0582,Self Service,"(42.3756, -71.0582)"
480369,101001256547,01/27/2015 11:41:31 PM,05/28/2015 08:30:00 AM,05/14/2015 01:47:27 PM,ONTIME,Closed,Case Closed. Closed date : 2015-05-14 13:47:27.147 Case Resolved cart request filled new cart #0415302381 05/13/2015,Recycling Cart Inquiry,Public Works Department,Recycling,Request for Recycling Cart,PWDx_Recycling,PWDx,,,259 Everett St  East Boston  MA  02128,1.0,09,1.0,A7,East Boston,1.0,Ward 1,101.0,R2,259 Everett St,2128.0,Address,231939.0,42.3652,-71.0297,Self Service,"(42.3652, -71.0297)"
481170,101001257502,01/28/2015 10:12:12 AM,02/26/2015 10:12:12 AM,02/02/2015 02:55:58 AM,ONTIME,Closed,Case Closed Case Noted Constituent states they do not wish to receive a big cart. Public Works no longer issues small blue bins.,Request for Recycling Cart,Public Works Department,Recycling,Request for Recycling Cart,PWDx_Recycling,PWDx,,,32 Prospect St  Charlestown  MA  02129,3.0,1A,1.0,A15,Charlestown,2.0,Ward 2,203.0,R3,32 Prospect St,2129.0,Address,296290.0,42.3756,-71.0582,Self Service,"(42.3756, -71.0582)"
481264,101001257612,01/28/2015 10:37:46 AM,05/28/2015 10:37:00 AM,05/26/2015 12:16:11 PM,ONTIME,Closed,Case Closed. Closed date : 2015-05-26 12:16:11.863 Duplicate of Existing Case,Recycling Cart Inquiry,Public Works Department,Recycling,Request for Recycling Cart,PWDx_Recycling,PWDx,,,46 Rosemont St  Dorchester  MA  02122,8.0,07,3.0,C11,Dorchester,7.0,Ward 16,1605.0,CM,46 Rosemont St,2122.0,Address,118500.0,42.2932,-71.0549,Self Service,"(42.2932, -71.0549)"
481621,101001258033,01/28/2015 12:10:55 PM,02/26/2015 12:10:55 PM,03/25/2015 01:49:06 PM,OVERDUE,Closed,Case Closed Case Resolved This request has been approved. Request for Recycling Cart has been created. See case #101001341860 for status of the request.,Recyclin Cart Inquiry,Public Works Department,Recycling,Request for Recycling Cart,PWDx_Recycling Cart Inquiry,PWDx,,,9 Bowdoin Ave  Dorchester  MA  02121,7.0,03,4.0,C11,Dorchester,8.0,Ward 14,1404.0,R2,9 Bowdoin Ave,2121.0,Address,17447.0,42.3026,-71.077,Constituent Call,"(42.3026, -71.077)"
481976,101001258455,01/28/2015 01:44:00 PM,05/28/2015 01:44:00 PM,06/09/2015 11:59:20 AM,OVERDUE,Closed,Case Closed. Closed date : 2015-06-09 11:59:20.817 Case Resolved cart requested filled new cart #0415302471 06/08/2015,Recycling Cart Inquiry,Public Works Department,Recycling,Request for Recycling Cart,PWDx_Recycling,PWDx,,,11 Anson St  Jamaica Plain  MA  02130,9.0,02,6.0,E13,Jamaica Plain,11.0,Ward 11,1110.0,R3,11 Anson St,2130.0,Address,178538.0,42.3029,-71.1139,Self Service,"(42.3029, -71.1139)"
486176,101001264444,01/30/2015 11:40:00 AM,03/02/2015 11:40:00 AM,03/25/2015 02:46:09 PM,OVERDUE,Closed,Case Closed Case Resolved This request has been approved. Request for Recycling Cart has been created. See case #101001341945 for status of the request.,Recycling Cart Inquiry,Public Works Department,Recycling,Request for Recycling Cart,PWDx_Recycling Cart Inquiry,PWDx,,,29 Duval St  Brighton  MA  02135,11.0,04,9.0,D14,Allston / Brighton,15.0,Ward 22,2205.0,R2,29 Duval St,2135.0,Address,227272.0,42.3608,-71.1411,Self Service,"(42.3608, -71.1411)"
486622,101001265164,01/30/2015 04:47:46 PM,05/28/2015 04:47:00 PM,06/03/2015 02:50:13 PM,OVERDUE,Closed,Case Closed. Closed date : 2015-06-03 14:50:13.187 Case Resolved This request has been approved. Request for Recycling Cart has been created. See case #101001401802 for status of the request.,Recycling Cart Inquiry,Public Works Department,Recycling,Request for Recycling Cart,PWDx_Recycling,PWDx,,,7 Frederick St  South Boston  MA  02127,6.0,05,2.0,C6,South Boston / South Boston Waterfront,5.0,Ward 7,705.0,R1,7 Frederick St,2127.0,Address,60770.0,42.3335,-71.0534,Self Service,"(42.3335, -71.0534)"
487156,101001265969,01/31/2015 01:57:20 PM,03/03/2015 08:30:00 AM,03/25/2015 11:00:23 AM,OVERDUE,Closed,Case Closed Case Resolved This request has been approved. Request for Recycling Cart has been created. See case #101001341558 for status of the request.,Recycling cart Inquiry,Public Works Department,Recycling,Request for Recycling Cart,PWDx_Recycling Cart Inquiry,PWDx,,,12 Moultrie St  Dorchester  MA  02124,8.0,07,4.0,C11,Dorchester,8.0,Ward 17,1706.0,R2,12 Moultrie St,2124.0,Address,278360.0,42.2918,-71.0681,Self Service,"(42.2918, -71.0681)"
487278,101001266155,01/31/2015 05:12:22 PM,03/03/2015 08:30:00 AM,03/27/2015 04:46:15 PM,OVERDUE,Closed,Case Closed Case Noted Caller no longer needs cart.,Recycling Cart Inquiry,Public Works Department,Recycling,Request for Recycling Cart,PWDx_Recycling Cart Inquiry,PWDx,,,17 Middle St  South Boston  MA  02127,6.0,05,2.0,C6,South Boston / South Boston Waterfront,5.0,Ward 7,705.0,CD,17 Middle St,2127.0,Address,95184.0,42.3313,-71.0548,Self Service,"(42.3313, -71.0548)"
487303,101001266190,01/31/2015 06:54:44 PM,03/03/2015 08:30:00 AM,03/24/2015 03:21:35 PM,OVERDUE,Closed,Case Closed Case Resolved This request has been approved. Request for Recycling Cart has been created. See case #101001340977 for status of the request.,recycling Cart Inquiry,Public Works Department,Recycling,Request for Recycling Cart,PWDx_Recycling Cart Inquiry,PWDx,,,67 Hampstead Rd  Jamaica Plain  MA  02130,9.0,02,6.0,E13,Jamaica Plain,11.0,Ward 11,1110.0,R3,67 Hampstead Rd,2130.0,Address,245808.0,42.3041,-71.1173,Self Service,"(42.3041, -71.1173)"
488984,101001268449,02/02/2015 07:22:46 PM,03/04/2015 08:30:00 AM,04/09/2015 01:19:22 PM,OVERDUE,Closed,Case Closed Case Resolved broken cart swapped new cart number #0514000175 04/08/2015,Recycling cart inquiry,Public Works Department,Recycling,Request for Recycling Cart,PWDx_Recycling,PWDx,,,35 Maxwell St  Dorchester  MA  02124,8.0,07,4.0,B3,Dorchester,9.0,Ward 17,1710.0,R3,35 Maxwell St,2124.0,Address,93130.0,42.2824,-71.0778,Self Service,"(42.2824, -71.0778)"
491953,101001272479,02/03/2015 09:59:55 PM,03/05/2015 08:30:00 AM,04/22/2015 02:15:54 PM,OVERDUE,Closed,Case Closed Case Resolved cart requested swapped out new cart #0514000685 04/06/2015,Recycling Cart Inquiry,Public Works Department,Recycling,Request for Recycling Cart,PWDx_Recycling,PWDx,,,129 Eutaw St  East Boston  MA  02128,1.0,09,1.0,A7,East Boston,1.0,Ward 1,108.0,R3,129 Eutaw St,2128.0,Address,231349.0,42.3802,-71.0346,Self Service,"(42.3802, -71.0346)"
492946,101001273975,02/04/2015 10:29:00 AM,05/28/2015 10:29:00 AM,06/16/2015 09:03:29 AM,OVERDUE,Closed,Case Closed. Closed date : 2015-06-16 09:03:29.283 Duplicate of Existing Case delivered 05/22/2015,Recycling Cart Inquiry,Public Works Department,Recycling,Request for Recycling Cart,PWDx_Recycling,PWDx,,,49 Dighton St  Brighton  MA  02135,11.0,04,9.0,D14,Allston / Brighton,15.0,Ward 22,2209.0,,49 Dighton St,2135.0,Address,224139.0,42.3476,-71.1561,Self Service,"(42.3476, -71.1561)"
493503,101001274770,02/04/2015 01:13:56 PM,03/05/2015 01:13:56 PM,04/17/2015 03:26:13 PM,OVERDUE,Closed,Case Closed Case Resolved cart requested swapped new cart # 0714423865 04/16/2015,Recycling Cart Inquiry,Public Works Department,Recycling,Request for Recycling Cart,PWDx_Recycling,PWDx,,,67 Moreland St  Roxbury  MA  02119,7.0,10B,7.0,B2,Roxbury,13.0,Ward 12,1201.0,R3,67 Moreland St,2119.0,Address,97422.0,42.324,-71.0797,Constituent Call,"(42.324, -71.0797)"
494170,101001275746,02/04/2015 04:51:00 PM,05/27/2015 04:51:00 PM,06/05/2015 07:33:08 AM,OVERDUE,Closed,Case Closed. Closed date : 2015-06-05 07:33:08.07 Case Resolved Cart requested filled new cart #0415302652 06/02/2015,Recycling Cart Request,Public Works Department,Recycling,Request for Recycling Cart,PWDx_Recycling,PWDx,,,11 Mount Hood Rd  Brighton  MA  02135,11.0,04,9.0,D14,Allston / Brighton,15.0,Ward 21,2112.0,A,11 Mount Hood Rd,2135.0,Address,278474.0,42.3418,-71.1418,Self Service,"(42.3418, -71.1418)"
495908,101001278515,02/05/2015 03:57:51 PM,05/28/2015 03:57:00 PM,06/09/2015 12:11:56 PM,OVERDUE,Closed,Case Closed. Closed date : 2015-06-09 12:11:56.633 Case Resolved cart requested filled new cart #0415302472 06/08/2015,Recycling Cart Inquiry,Public Works Department,Recycling,Request for Recycling Cart,PWDx_Recycling,PWDx,,,647 Washington St  Brighton  MA  02135,11.0,04,9.0,D14,Allston / Brighton,15.0,Ward 22,2213.0,R2,647 Washington St,2135.0,Address,329992.0,42.3514,-71.1692,Self Service,"(42.3514, -71.1692)"
496661,101001279667,02/06/2015 09:38:15 AM,05/27/2015 09:38:00 AM,06/02/2015 11:50:07 AM,OVERDUE,Closed,Case Closed. Closed date : 2015-06-02 11:50:07.14 Case Resolved cart requested filled new cart # 0415313683 05/29/2015,Recycling Cart Inquiry,Public Works Department,Recycling,Request for Recycling Cart,PWDx_Recycling,PWDx,,,21 Rushmore St  Brighton  MA  02135,11.0,04,9.0,D14,Allston / Brighton,15.0,Ward 22,2209.0,R2,21 Rushmore St,2135.0,Address,302226.0,42.3462,-71.156,Self Service,"(42.3462, -71.156)"
497263,101001280608,02/06/2015 02:54:30 PM,03/09/2015 02:54:30 PM,04/22/2015 02:20:54 PM,OVERDUE,Closed,Case Closed Case Resolved cart requested swapped out new cart #0714423972 04/16/2015,Recycling Cart Inquiry,Public Works Department,Recycling,Request for Recycling Cart,PWDx_Recycling,PWDx,,,49 Clarence St  Roxbury  MA  02119,7.0,03,7.0,B2,Roxbury,13.0,Ward 8,805.0,R1,49 Clarence St,2119.0,Address,33126.0,42.3248,-71.0724,Self Service,"(42.3248, -71.0724)"
497375,101001280803,02/06/2015 04:25:24 PM,03/09/2015 04:25:22 PM,04/07/2015 12:17:34 PM,OVERDUE,Closed,Case Closed Case Resolved new cart swapped new cart #0514000814 04/06/2015,Recycling Cart inquiry,Public Works Department,Recycling,Request for Recycling Cart,PWDx_Recycling,PWDx,,,101 Redlands Rd  West Roxbury  MA  02132,12.0,06,6.0,E5,West Roxbury,12.0,Ward 20,2018.0,R3,101 Redlands Rd,2132.0,Address,115021.0,42.2903,-71.153,Constituent Call,"(42.2903, -71.153)"
498391,101001282401,02/08/2015 01:09:14 PM,03/10/2015 08:30:00 AM,04/27/2015 11:14:52 AM,OVERDUE,Closed,Case Closed Case Resolved constituent called cancel the request 04/27/2015,Recycling Cart Inquiry,Public Works Department,Recycling,Request for Recycling Cart,PWDx_Recycling Cart Inquiry,PWDx,,,48 Shannon St  Brighton  MA  02135,11.0,04,9.0,D14,Allston / Brighton,15.0,Ward 22,2203.0,R4,48 Shannon St,2135.0,Address,309637.0,42.3459,-71.1498,Self Service,"(42.3459, -71.1498)"
498581,101001282674,02/08/2015 06:07:19 PM,03/10/2015 08:30:00 AM,04/03/2015 01:13:07 PM,OVERDUE,Closed,Case Closed Case Resolved New cart swapped new cart # 0514000792 4/01/2015,Recycling Cart Inquiry,Public Works Department,Recycling,Request for Recycling Cart,PWDx_Recycling,PWDx,,,70 Bateman St  Roslindale  MA  02131,12.0,08,5.0,E18,Hyde Park,10.0,Ward 18,1822.0,R2,70 Bateman St,2131.0,Address,182551.0,42.2702,-71.1301,Self Service,"(42.2702, -71.1301)"
498702,101001282862,02/09/2015 01:52:27 AM,03/10/2015 08:30:00 AM,04/03/2015 12:07:11 PM,OVERDUE,Closed,Case Closed Case Resolved New cart swapped new cart # 0514000743 04/02/15,Recycling Cart Inquiry,Public Works Department,Recycling,Request for Recycling Cart,PWDx_Recycling,PWDx,,,87 Burt St  Dorchester  MA  02124,8.0,07,4.0,C11,Dorchester,8.0,Ward 17,1709.0,R2,87 Burt St,2124.0,Address,24146.0,42.2838,-71.0711,Self Service,"(42.2838, -71.0711)"
499209,101001283481,02/09/2015 01:59:13 PM,03/10/2015 01:59:12 PM,02/13/2015 10:24:12 AM,ONTIME,Closed,Case Closed Case Noted matrrial srrviced,Request for Recycling Cart,Public Works Department,Recycling,Request for Recycling Cart,PWDx_Recycling,PWDx,,,13 Trenton St  Charlestown  MA  02129,3.0,1A,1.0,A15,Charlestown,2.0,Ward 2,204.0,R2,13 Trenton St,2129.0,Address,138213.0,42.3779,-71.0616,Self Service,"(42.3779, -71.0616)"
502806,101001288335,02/11/2015 12:05:08 PM,05/27/2015 12:05:00 PM,05/15/2015 11:52:01 AM,ONTIME,Closed,Case Closed. Closed date : 2015-05-15 11:52:01.323 Case Resolved cart requested new cart#0415302971 05/14/2015,Recycling Cart Inquiry,Public Works Department,Recycling,Request for Recycling Cart,PWDx_Recycling,PWDx,,,32 Albano St  Roslindale  MA  02131,12.0,06,5.0,E5,Roslindale,10.0,Ward 18,1810.0,R1,32 Albano St,2131.0,Address,1483.0,42.2827,-71.1306,Constituent Call,"(42.2827, -71.1306)"
503002,101001288623,02/11/2015 01:50:35 PM,03/12/2015 01:50:34 PM,04/03/2015 12:07:59 PM,OVERDUE,Closed,Case Closed Case Resolved New cart swapped new cart # 0514000742 04/02/15,Recycling Cart Inquiry,Public Works Department,Recycling,Request for Recycling Cart,PWDx_Recycling,PWDx,,,54-56 Granite Ave  Dorchester  MA  02124,8.0,07,3.0,C11,Dorchester,7.0,Ward 16,1612.0,R2,54-56 Granite Ave,2124.0,Address,65908.0,42.2813,-71.0549,Self Service,"(42.2813, -71.0549)"
503096,101001288751,02/11/2015 02:31:21 PM,05/28/2015 02:31:00 PM,06/11/2015 02:06:00 PM,OVERDUE,Closed,Case Closed. Closed date : 2015-06-11 14:06:00.993 Case Resolved cart requested filled new cart#0415302466 06/09/2015,Recycling Cart Inquiry,Public Works Department,Recycling,Request for Recycling Cart,PWDx_Recycling,PWDx,,,2496 Beacon St  Brighton  MA  02135,11.0,04,9.0,D14,Allston / Brighton,15.0,Ward 21,2116.0,R1,2496 Beacon St,2135.0,Address,10553.0,42.3313,-71.1569,Constituent Call,"(42.3313, -71.1569)"
504335,101001290675,02/12/2015 09:52:02 AM,03/13/2015 09:52:02 AM,03/24/2015 12:01:23 PM,OVERDUE,Closed,Case Closed Case Resolved This request has been approved. Request for Recycling Cart has been created. See case #101001340652 for status of the request.,Recycling Cart Inquiry,Public Works Department,Recycling,Request for Recycling Cart,PWDx_Recycling,PWDx,,,84 Danny Rd  Hyde Park  MA  02136,12.0,08,5.0,E18,Hyde Park,10.0,Ward 18,1820.0,R1,84 Danny Rd,2136.0,Address,46201.0,42.2418,-71.1419,Constituent Call,"(42.2418, -71.1419)"
505820,101001292914,02/13/2015 09:23:07 AM,03/16/2015 09:23:07 AM,02/13/2015 09:35:24 AM,ONTIME,Closed,Case Closed Case Noted Trash is a day late due to storm on monday.,Request for Recycling Cart,Public Works Department,Recycling,Request for Recycling Cart,PWDx_Recycling,PWDx,,,76 Parkman St  Dorchester  MA  02122,7.0,07,3.0,C11,Dorchester,7.0,Ward 16,1602.0,RC,76 Parkman St,2122.0,Address,290939.0,42.2976,-71.0559,Self Service,"(42.2976, -71.0559)"
506469,101001293838,02/13/2015 03:03:20 PM,03/16/2015 03:03:20 PM,04/03/2015 12:08:32 PM,OVERDUE,Closed,Case Closed Case Resolved New cart swapped new cart # 0514000759 04/02/15,Recycling Cart Inquiry,Public Works Department,Recycling,Request for Recycling Cart,PWDx_Recycling,PWDx,,,1045 Adams St  Dorchester  MA  02124,8.0,07,3.0,C11,Dorchester,7.0,Ward 16,1611.0,R2,1045 Adams St,2124.0,Address,175189.0,42.2756,-71.0618,Self Service,"(42.2756, -71.0618)"
507005,101001294626,02/14/2015 09:26:02 AM,03/17/2015 08:30:00 AM,04/08/2015 01:44:57 PM,OVERDUE,Closed,Case Closed Case Resolved new cart swapped new cart # 0514000181 04/07/2015,Recycling Cart Inquiry,Public Works Department,Recycling,Request for Recycling Cart,PWDx_Recycling,PWDx,,,105-107 Kilsyth Rd  Brighton  MA  02135,11.0,04,9.0,D14,Allston / Brighton,15.0,Ward 21,2112.0,R2,105-107 Kilsyth Rd,2135.0,Address,81585.0,42.3406,-71.1461,Self Service,"(42.3406, -71.1461)"
511226,101001299832,02/16/2015 11:50:09 PM,03/10/2015 08:30:00 AM,04/14/2015 11:54:31 AM,OVERDUE,Closed,Case Closed Case Resolved broken cart swapped new cart #0714424139-04/13/2015,Recycling Cart Inquiry,Public Works Department,Recycling,Request for Recycling Cart,PWDx_Recycling,PWDx,,,46 Atherton St  Roxbury  MA  02119,9.0,02,6.0,E13,Jamaica Plain,11.0,Ward 11,1104.0,R2,46 Atherton St,2119.0,Address,5879.0,42.3176,-71.1009,Self Service,"(42.3176, -71.1009)"
511804,101001300684,02/17/2015 10:32:20 AM,03/10/2015 10:32:20 AM,03/24/2015 12:44:13 PM,OVERDUE,Closed,Case Closed Case Resolved This request has been approved. Request for Recycling Cart has been created. See case #101001340714 for status of the request.,Recycling Cart Inquiry,Public Works Department,Recycling,Request for Recycling Cart,PWDx_Recycling,PWDx,,,49 Hall St  Jamaica Plain  MA  02130,9.0,02,6.0,E13,Jamaica Plain,11.0,Ward 11,1110.0,CD,49 Hall St,2130.0,Address,68154.0,42.3047,-71.1126,Self Service,"(42.3047, -71.1126)"
512316,101001301401,02/17/2015 01:35:11 PM,03/10/2015 01:35:11 PM,03/25/2015 12:25:25 PM,OVERDUE,Closed,Case Closed Case Resolved This request has been approved. Request for Recycling Cart has been created. See case #101001341716 for status of the request.,Recycling Cart Inquiry,Public Works Department,Recycling,Request for Recycling Cart,PWDx_Recycling,PWDx,,,18 Fendale Ave  Dorchester  MA  02124,8.0,07,3.0,B3,Dorchester,7.0,Ward 17,1704.0,R2,18 Fendale Ave,2124.0,Address,57334.0,42.279,-71.0708,Self Service,"(42.279, -71.0708)"
513119,101001302491,02/17/2015 06:32:08 PM,03/11/2015 08:30:00 AM,03/24/2015 12:57:46 PM,OVERDUE,Closed,Case Closed Case Resolved This request has been approved. Request for Recycling Cart has been created. See case #101001340733 for status of the request.,Recycling Cart Inquiry,Public Works Department,Recycling,Request for Recycling Cart,PWDx_Recycling Cart Inquiry,PWDx,,,9 Hartford St  Dorchester  MA  02125,7.0,03,7.0,B2,Roxbury,13.0,Ward 13,1304.0,R2,9 Hartford St,2125.0,Address,248275.0,42.3177,-71.0737,Self Service,"(42.3177, -71.0737)"
513900,101001303638,02/18/2015 09:55:12 AM,03/11/2015 09:55:11 AM,05/12/2015 03:13:25 PM,OVERDUE,Closed,Case Closed. Closed date : 2015-05-12 15:13:25.193 Case Invalid not good address 05/12/2015,Request for Recycling Cart,Public Works Department,Recycling,Request for Recycling Cart,PWDx_IPL Damaged Cart Replacement,PWDx,,,140 Reservation Rd  Hyde Park  MA  02136,12.0,08,5.0,E18,Hyde Park,10.0,18,1819.0,,140 Reservation Rd,2136.0,Address,347352.0,42.3594,-71.0587,City Worker App,"(0, 0)"
514620,101001304657,02/18/2015 03:09:28 PM,03/11/2015 03:09:27 PM,03/24/2015 03:44:32 PM,OVERDUE,Closed,Case Closed Case Resolved This request has been approved. Request for Recycling Cart has been created. See case #101001341000 for status of the request.,Recycling Cart Inquiry,Public Works Department,Recycling,Request for Recycling Cart,PWDx_Recycling Cart Inquiry,PWDx,,,109 Brooks St  Brighton  MA  02135,11.0,04,9.0,D14,Allston / Brighton,15.0,Ward 22,2207.0,R1,109 Brooks St,2135.0,Address,22363.0,42.3537,-71.1632,Self Service,"(42.3537, -71.1632)"
515369,101001305845,02/19/2015 08:36:55 AM,05/27/2015 08:36:00 AM,05/01/2015 01:09:13 PM,ONTIME,Closed,Case Closed Case Resolved cart requested filled new cart#0714423707 04/30/2015,Recycling Cart Inquiry,Public Works Department,Recycling,Request for Recycling Cart,PWDx_Recycling,PWDx,,,117 Centre St  Roxbury  MA  02119,9.0,10B,7.0,B2,Roxbury,13.0,Ward 11,1101.0,R1,117 Centre St,2119.0,Address,27530.0,42.3274,-71.0961,Self Service,"(42.3274, -71.0961)"
516354,101001307297,02/19/2015 04:35:56 PM,05/27/2015 04:35:00 PM,05/29/2015 02:20:44 PM,OVERDUE,Closed,Case Closed. Closed date : 2015-05-29 14:20:44.157 Case Resolved cart requested filled new cart#0415302618 05/27/15,Recycling Cart Inquiry,Public Works Department,Recycling,Request for Recycling Cart,PWDx_Recycling,PWDx,,,43 Spring Park Ave  Jamaica Plain  MA  02130,9.0,02,6.0,E13,Jamaica Plain,11.0,Ward 19,1904.0,R2,43 Spring Park Ave,2130.0,Address,129694.0,42.3164,-71.1104,Self Service,"(42.3164, -71.1104)"
516739,101001307861,02/20/2015 05:13:55 AM,03/13/2015 08:30:00 AM,03/24/2015 01:08:53 PM,OVERDUE,Closed,Case Closed Case Resolved This request has been approved. Request for Recycling Cart has been created. See case #101001340760 for status of the request.,Recycling Cart Inquiry,Public Works Department,Recycling,Request for Recycling Cart,PWDx_Recycling Cart Inquiry,PWDx,,,10 Grovenor Rd  Jamaica Plain  MA  02130,9.0,02,6.0,E13,Jamaica Plain,11.0,Ward 19,1905.0,CD,10 Grovenor Rd,2130.0,Address,67624.0,42.3141,-71.1147,Self Service,"(42.3141, -71.1147)"
517851,101001309432,02/20/2015 07:18:02 PM,03/16/2015 08:30:00 AM,03/24/2015 01:35:14 PM,OVERDUE,Closed,Case Closed Case Resolved This request has been approved. Request for Recycling Cart has been created. See case #101001340801 for status of the request.,Recycling Cart Inquiry,Public Works Department,Recycling,Request for Recycling Cart,PWDx_Recycling Cart Inquiry,PWDx,,,96 Chelsea St  East Boston  MA  02128,1.0,09,1.0,A7,East Boston,1.0,Ward 1,104.0,R2,96 Chelsea St,2128.0,Address,206400.0,42.3724,-71.0362,Self Service,"(42.3724, -71.0362)"
519615,101001312147,02/23/2015 11:22:15 AM,03/16/2015 11:22:15 AM,03/25/2015 02:44:50 PM,OVERDUE,Closed,Case Closed Duplicate of Existing Case,Request for Recycling Cart,Public Works Department,Recycling,Request for Recycling Cart,PWDx_Recycling,PWDx,,,29 Duval St  Brighton  MA  02135,11.0,04,9.0,D14,Allston / Brighton,15.0,Ward 22,2205.0,R2,29 Duval St,2135.0,Address,227272.0,42.3608,-71.1411,Self Service,"(42.3608, -71.1411)"
519748,101001312339,02/23/2015 12:55:38 PM,05/27/2015 12:55:00 PM,05/21/2015 02:37:43 PM,ONTIME,Closed,Case Closed. Closed date : 2015-05-21 14:37:43.22 Case Resolved cart requested filled new cart # 0415302918 05/20/2015,Recycling Cart Inquiry,Public Works Department,Recycling,Request for Recycling Cart,PWDx_Recycling,PWDx,,,174A Magnolia St  Dorchester  MA  02125,7.0,03,7.0,B2,Roxbury,13.0,Ward 13,1304.0,A,174A Magnolia St,2125.0,Address,158747.0,42.3127,-71.0724,Constituent Call,"(42.3127, -71.0724)"
520110,101001312914,02/23/2015 05:01:15 PM,03/17/2015 08:30:00 AM,04/08/2015 01:34:00 PM,OVERDUE,Closed,Case Closed Case Resolved new cart swapped new cart # 0514000571 04/06/2015,Recycling Cart Inquiry,Public Works Department,Recycling,Request for Recycling Cart,PWDx_Recycling,PWDx,,,7 Roseway St  Jamaica Plain  MA  02130,9.0,02,6.0,E13,Jamaica Plain,11.0,Ward 19,1903.0,R2,7 Roseway St,2130.0,Address,301410.0,42.3188,-71.1117,Self Service,"(42.3188, -71.1117)"
521084,101001314305,02/24/2015 12:16:31 PM,03/17/2015 12:16:31 PM,04/09/2015 01:00:54 PM,OVERDUE,Closed,Case Closed Case Resolved broken cart swapped new cart number #0514000082 04/08/15,Recycling Cart Inquiry,Public Works Department,Recycling,Request for Recycling Cart,PWDx_Recycling,PWDx,,,24 Potosi St  Dorchester  MA  02122,7.0,03,3.0,C11,Dorchester,8.0,Ward 15,1503.0,CD,24 Potosi St,2122.0,Address,112430.0,42.3066,-71.0649,Self Service,"(42.3066, -71.0649)"
521203,101001314467,02/24/2015 01:27:57 PM,05/28/2015 01:27:00 PM,06/09/2015 08:43:49 AM,OVERDUE,Closed,Case Closed Case Resolved,Recycling Cart Inquiry,Public Works Department,Recycling,Request for Recycling Cart,PWDx_Recycling,PWDx,,,158 Wachusett St  Jamaica Plain  MA  02130,12.0,02,6.0,E13,Jamaica Plain,10.0,Ward 19,1907.0,R4,158 Wachusett St,2130.0,Address,159876.0,42.2939,-71.1161,Constituent Call,"(42.2939, -71.1161)"
521774,101001315295,02/25/2015 07:24:23 AM,03/18/2015 08:30:00 AM,04/03/2015 01:13:59 PM,OVERDUE,Closed,Case Closed Case Resolved New cart swapped new cart # 0514000793 04/01/2015,Recycling Cart Inquiry,Public Works Department,Recycling,Request for Recycling Cart,PWDx_Recycling,PWDx,,,32 Linwood St  Hyde Park  MA  02136,12.0,08,5.0,E18,Hyde Park,10.0,18,1812.0,R1,32 Linwood St,2136.0,Address,167110.0,42.2567,-71.1278,Self Service,"(42.2567, -71.1278)"
522040,101001315717,02/25/2015 10:23:27 AM,05/27/2015 10:23:00 AM,04/30/2015 10:32:59 AM,ONTIME,Closed,Case Closed Case Resolved cart requested filled new cart #0714423701 04/29/2015,Recycling Cart Inquiry,Public Works Department,Recycling,Request for Recycling Cart,PWDx_Recycling,PWDx,,,14-14 Franklin St  Charlestown  MA  02129,3.0,1A,1.0,A15,Charlestown,2.0,02,206.0,CM,14-14 Franklin St,2129.0,Address,341810.0,42.3594,-71.0587,Self Service,"(0, 0)"
522544,101001316406,02/25/2015 03:39:19 PM,03/18/2015 03:39:18 PM,03/24/2015 01:51:48 PM,OVERDUE,Closed,Case Closed Case Invalid Wrong Address. New Case #101001340815,Recycling Cart Inquiry,Public Works Department,Recycling,Request for Recycling Cart,PWDx_Recycling Cart Inquiry,PWDx,,,29 Mystic St  Charlestown  MA  02129,3.0,1A,1.0,A15,Charlestown,2.0,Ward 2,204.0,R1,29 Mystic St,2129.0,Address,99985.0,42.3802,-71.0622,Self Service,"(42.3802, -71.0622)"
523622,101001317933,02/26/2015 02:14:05 PM,05/28/2015 02:13:00 PM,04/28/2015 10:32:26 AM,ONTIME,Closed,Case Closed Duplicate of Existing Case  Reference#101001351832 one per a household,Recycling cart Inquiry,Public Works Department,Recycling,Request for Recycling Cart,PWDx_Recycling,PWDx,,,44 Robinwood Ave  Jamaica Plain  MA  02130,9.0,02,6.0,E13,Jamaica Plain,11.0,Ward 19,1904.0,R4,44 Robinwood Ave,2130.0,Address,117458.0,42.3164,-71.1114,Employee Generated,"(42.3164, -71.1114)"
523718,101001318095,02/26/2015 03:45:40 PM,03/19/2015 03:45:40 PM,04/03/2015 12:02:27 PM,OVERDUE,Closed,Case Closed Case Resolved New cart swapped new cart # 0514000668 04/02/15,Recycling Cart Inquiry,Public Works Department,Recycling,Request for Recycling Cart,PWDx_Recycling,PWDx,,,29 Pratt St  Allston  MA  02134,11.0,04,9.0,D14,Allston / Brighton,15.0,Ward 21,2104.0,R2,29 Pratt St,2134.0,Address,112501.0,42.3548,-71.1287,Self Service,"(42.3548, -71.1287)"
524219,101001318831,02/27/2015 09:53:17 AM,05/27/2015 09:53:00 AM,06/03/2015 09:44:59 AM,OVERDUE,Closed,Case Closed. Closed date : 2015-06-03 09:44:59.73 Case Resolved This request has been approved. Request for Recycling Cart has been created. See case #101001401345 for status of the request.,Recycling Cart Inquiry,Public Works Department,Recycling,Request for Recycling Cart,PWDx_Recycling,PWDx,,,80 Hamilton St  Hyde Park  MA  02136,12.0,08,5.0,E18,Hyde Park,10.0,Ward 18,1820.0,R1,80 Hamilton St,2136.0,Address,68394.0,42.2328,-71.1326,Employee Generated,"(42.2328, -71.1326)"
524781,101001319661,02/27/2015 06:38:44 PM,05/28/2015 08:30:00 AM,05/18/2015 02:41:02 PM,ONTIME,Closed,Case Closed. Closed date : 2015-05-18 14:41:02.937 Case Resolved request cart filled new cart # 0415313668 05/15/2015,Recycling Cart Inquiry,Public Works Department,Recycling,Request for Recycling Cart,PWDx_Recycling,PWDx,,,21 Saint Peter St  Jamaica Plain  MA  02130,9.0,02,6.0,E13,Jamaica Plain,11.0,Ward 19,1901.0,R3,21 Saint Peter St,2130.0,Address,304672.0,42.3185,-71.1082,Self Service,"(42.3185, -71.1082)"
525050,101001320100,02/28/2015 02:59:00 PM,05/28/2015 08:30:00 AM,06/11/2015 02:04:25 PM,OVERDUE,Closed,Case Closed. Closed date : 2015-06-11 14:04:25.49 Case Resolved cart requested filled new cart#0415302363 06/09/2015,Request for Inquiry,Public Works Department,Recycling,Request for Recycling Cart,PWDx_Recycling,PWDx,,,53 Shannon St  Brighton  MA  02135,11.0,04,9.0,D14,Allston / Brighton,15.0,Ward 22,2203.0,R3,53 Shannon St,2135.0,Address,309640.0,42.346,-71.1502,Self Service,"(42.346, -71.1502)"
525169,101001320338,03/01/2015 06:54:14 AM,03/23/2015 08:30:00 AM,03/24/2015 11:58:36 AM,OVERDUE,Closed,Case Closed Case Resolved This request has been approved. Request for Recycling Cart has been created. See case #101001340646 for status of the request.,Recycling Cart Inquiry,Public Works Department,Recycling,Request for Recycling Cart,PWDx_Recycling Cart Inquiry,PWDx,,,237 Trenton St  East Boston  MA  02128,1.0,09,1.0,A7,East Boston,1.0,Ward 1,109.0,CD,237 Trenton St,2128.0,Address,138361.0,42.3811,-71.0301,Self Service,"(42.3811, -71.0301)"
525179,101001320358,03/01/2015 08:11:46 AM,03/23/2015 08:30:00 AM,03/24/2015 12:37:32 PM,OVERDUE,Closed,Case Closed Case Resolved This request has been approved. Request for Recycling Cart has been created. See case #101001340703 for status of the request.,Recycling Cart Inquiry,Public Works Department,Recycling,Request for Recycling Cart,PWDx_Recycling Cart Inquiry,PWDx,,,70 Brayton Rd  Brighton  MA  02135,11.0,04,9.0,D14,Allston / Brighton,15.0,Ward 22,2204.0,R2,70 Brayton Rd,2135.0,Address,195478.0,42.3485,-71.1701,Self Service,"(42.3485, -71.1701)"
526547,101001322397,03/03/2015 09:51:34 AM,05/28/2015 09:51:00 AM,06/02/2015 11:33:16 AM,OVERDUE,Closed,Case Closed. Closed date : 2015-06-02 11:33:16.417 Case Resolved cart requested filled new cart # 0415302613 06/01/2015,Recycling Cart Inquiry,Public Works Department,Recycling,Request for Recycling Cart,PWDx_Recycling,PWDx,,,50 Fairbanks St  Brighton  MA  02135,11.0,04,9.0,D14,Allston / Brighton,15.0,Ward 22,2207.0,R1,50 Fairbanks St,2135.0,Address,55524.0,42.3508,-71.1632,Self Service,"(42.3508, -71.1632)"
526648,101001322536,03/03/2015 11:00:20 AM,05/27/2015 11:00:00 AM,04/28/2015 02:18:32 PM,ONTIME,Closed,Case Closed Duplicate of Existing Case  case reference # 101001343449 one cart per household,Recycling Cart Inquiry,Public Works Department,Recycling,Request for Recycling Cart,PWDx_Recycling,PWDx,,,112 Hazleton St  Mattapan  MA  02126,8.0,07,4.0,B3,Greater Mattapan,9.0,14,1408.0,R2,112 Hazleton St,2126.0,Address,72237.0,42.2818,-71.0976,Constituent Call,"(42.2818, -71.0976)"
526696,101001322602,03/03/2015 11:42:34 AM,05/27/2015 11:42:00 AM,05/01/2015 01:09:43 PM,ONTIME,Closed,Case Closed Case Resolved cart requested filled new cart#0714423881 04/30/2015,Recycling Cart Inquiry,Public Works Department,Recycling,Request for Recycling Cart,PWDx_Recycling,PWDx,,,29-31 Townsend St  Roxbury  MA  02119,9.0,10B,7.0,B2,Roxbury,13.0,Ward 11,1103.0,R2,29-31 Townsend St,2119.0,Address,136474.0,42.3195,-71.0928,Constituent Call,"(42.3195, -71.0928)"
526753,101001322707,03/03/2015 12:55:43 PM,03/24/2015 12:55:43 PM,03/27/2015 11:47:44 AM,OVERDUE,Closed,Case Closed Case Resolved This request has been approved. Request for Recycling Cart has been created. See case #101001343462 for status of the request.,Recycling Cart Inquiry,Public Works Department,Recycling,Request for Recycling Cart,PWDx_Recycling Cart Inquiry,PWDx,,,4 Chase St  Dorchester  MA  02125,7.0,03,2.0,C11,Dorchester,5.0,Ward 7,709.0,R2,4 Chase St,2125.0,Address,30069.0,42.3182,-71.06,Self Service,"(42.3182, -71.06)"
526788,101001322761,03/03/2015 01:34:09 PM,03/24/2015 01:34:09 PM,03/23/2015 05:18:52 PM,ONTIME,Closed,Case Closed Case Resolved This request has been approved. Request for Recycling Cart has been created. See case #101001340103 for status of the request.,Recycling Cart Inquiry,Public Works Department,Recycling,Request for Recycling Cart,PWDx_Recycling Cart Inquiry,PWDx,,,48 Newton St  Brighton  MA  02135,11.0,04,9.0,D14,Allston / Brighton,15.0,Ward 22,2211.0,CD,48 Newton St,2135.0,Address,102328.0,42.3568,-71.165,Self Service,"(42.3568, -71.165)"
526848,101001322846,03/03/2015 02:30:57 PM,03/24/2015 02:30:57 PM,04/21/2015 02:46:21 PM,OVERDUE,Closed,Case Closed Duplicate of Existing Case Case already exists in the recycling Queue. Cart should be dropped off soon.,Recycling Cart Inquiry,Public Works Department,Recycling,Request for Recycling Cart,PWDx_Recycling Cart Inquiry,PWDx,,,61 Hill Top St  Dorchester  MA  02124,8.0,07,3.0,C11,Dorchester,7.0,Ward 16,1612.0,R1,61 Hill Top St,2124.0,Address,74005.0,42.2795,-71.0518,Constituent Call,"(42.2795, -71.0518)"
526850,101001322852,03/03/2015 02:33:10 PM,05/27/2015 02:33:00 PM,05/18/2015 02:45:13 PM,ONTIME,Closed,Case Closed. Closed date : 2015-05-18 14:45:13.643 Case Resolved request cart filled new cart # 0415313670 05/15/2015,Recycling Cart INQUIRY,Public Works Department,Recycling,Request for Recycling Cart,PWDx_Recycling,PWDx,,,107-107A Litchfield St  Brighton  MA  02135,11.0,04,9.0,D14,Brighton,15.0,22,2202.0,,107-107A Litchfield St,2135.0,Address,347393.0,42.3594,-71.0587,Self Service,"(0, 0)"
527784,101001324225,03/04/2015 05:17:51 PM,05/27/2015 08:30:00 AM,04/28/2015 02:20:59 PM,ONTIME,Closed,Case Closed Duplicate of Existing Case  case reference # 101001357682 one cart per household,Recycling Cart Inquiry,Public Works Department,Recycling,Request for Recycling Cart,PWDx_Recycling,PWDx,,,131 Eutaw St  East Boston  MA  02128,1.0,09,1.0,A7,East Boston,1.0,Ward 1,108.0,R3,131 Eutaw St,2128.0,Address,54682.0,42.3802,-71.0345,Self Service,"(42.3802, -71.0345)"
527871,101001324375,03/04/2015 08:39:29 PM,03/26/2015 08:30:00 AM,03/27/2015 02:58:24 PM,OVERDUE,Closed,Case Closed Case Resolved This request has been approved. Request for Recycling Cart has been created. See case #101001343781 for status of the request.,Recycling Cart Inquiry,Public Works Department,Recycling,Request for Recycling Cart,PWDx_Recycling Cart Inquiry,PWDx,,,113-113A Holton St  Brighton  MA  02135,11.0,04,9.0,D14,Allston / Brighton,15.0,22,2202.0,,113-113A Holton St,2135.0,Address,347394.0,42.3594,-71.0587,Self Service,"(0, 0)"
528014,101001324606,03/05/2015 09:05:18 AM,03/26/2015 09:05:18 AM,03/27/2015 12:30:04 PM,OVERDUE,Closed,Case Closed Case Resolved This request has been approved. Request for Recycling Cart has been created. See case #101001343537 for status of the request.,Recycling Cart Inquiry,Public Works Department,Recycling,Request for Recycling Cart,PWDx_Recycling Cart Inquiry,PWDx,,,29 Brookside Ave  Jamaica Plain  MA  02130,9.0,02,6.0,E13,Jamaica Plain,11.0,Ward 11,1106.0,R3,29 Brookside Ave,2130.0,Address,198392.0,42.3138,-71.1032,Self Service,"(42.3138, -71.1032)"
528973,101001326025,03/06/2015 12:14:36 PM,03/27/2015 12:14:36 PM,03/25/2015 11:32:27 AM,ONTIME,Closed,Case Closed Case Resolved This request has been approved. Request for Recycling Cart has been created. See case #101001341601 for status of the request.,Recycling Cart Inquiry,Public Works Department,Recycling,Request for Recycling Cart,PWDx_Recycling Cart Inquiry,PWDx,,,103-103A Litchfield St  Brighton  MA  02135,11.0,04,9.0,D14,Brighton,15.0,22,2202.0,,103-103A Litchfield St,2135.0,Address,347391.0,42.3594,-71.0587,Self Service,"(0, 0)"
529578,101001326990,03/08/2015 10:30:32 AM,05/28/2015 08:30:00 AM,04/29/2015 11:47:38 AM,ONTIME,Closed,Case Closed Case Resolved cart request filled new cart #0714423785 04/16/2015,Recycling Cart Inquiry,Public Works Department,Recycling,Request for Recycling Cart,PWDx_Recycling,PWDx,,,41 Saint Botolph St  Boston  MA  02116,4.0,1C,2.0,D4,Back Bay,6.0,Ward 4,402.0,CD,41 Saint Botolph St,2116.0,Address,120855.0,42.3464,-71.0792,Self Service,"(42.3464, -71.0792)"
530304,101001328165,03/09/2015 04:12:35 PM,03/30/2015 04:12:35 PM,03/26/2015 11:22:53 AM,ONTIME,Closed,Case Closed Case Resolved This request has been approved. Request for Recycling Cart has been created. See case #101001342571 for status of the request.,Recycling Cart Inquiry,Public Works Department,Recycling,Request for Recycling Cart,PWDx_Recycling Cart Inquiry,PWDx,,,105 Hazleton St  Mattapan  MA  02126,8.0,07,4.0,B3,Greater Mattapan,9.0,14,1408.0,R2,105 Hazleton St,2126.0,Address,72233.0,42.2818,-71.0969,Constituent Call,"(42.2818, -71.0969)"
530365,101001328250,03/09/2015 05:44:54 PM,03/31/2015 08:30:00 AM,03/26/2015 10:41:23 AM,ONTIME,Closed,Case Closed Case Resolved This request has been approved. Request for Recycling Cart has been created. See case #101001342499 for status of the request.,Recycling Cart Inquiry,Public Works Department,Recycling,Request for Recycling Cart,PWDx_Recycling Cart Inquiry,PWDx,,,7 Putnam St  East Boston  MA  02128,1.0,09,1.0,A7,East Boston,1.0,Ward 1,108.0,R2,7 Putnam St,2128.0,Address,113673.0,42.3822,-71.0336,Self Service,"(42.3822, -71.0336)"
530416,101001328332,03/09/2015 07:11:00 PM,05/28/2015 08:30:00 AM,06/08/2015 10:55:58 AM,OVERDUE,Closed,Case Closed. Closed date : 2015-06-08 10:55:58.627 Case Resolved cart requested filled new cart #0415302462 06/05/2015,Recycling Cart Inquiry,Public Works Department,Recycling,Request for Recycling Cart,PWDx_Recycling,PWDx,,,96 Neponset Ave  Dorchester  MA  02122,,,0.0,,Dorchester,0.0,16,,,96 Neponset Ave,2122.0,Address,349155.0,42.3594,-71.0587,Self Service,"(0, 0)"
530485,101001328438,03/10/2015 07:23:22 AM,03/31/2015 08:30:00 AM,03/24/2015 10:20:51 AM,ONTIME,Closed,Case Closed Case Resolved This request has been approved. Request for Recycling Cart has been created. See case #101001340487 for status of the request.,Recycling Cart Inquiry,Public Works Department,Recycling,Request for Recycling Cart,PWDx_Recycling Cart Inquiry,PWDx,,,122 Turtle Pond Pkwy  Hyde Park  MA  02136,12.0,08,5.0,E18,Hyde Park,10.0,Ward 18,1819.0,R1,122 Turtle Pond Pkwy,2136.0,Address,138667.0,42.2501,-71.1396,Self Service,"(42.2501, -71.1396)"
530713,101001328792,03/10/2015 10:40:13 AM,05/28/2015 10:40:00 AM,05/21/2015 02:38:33 PM,ONTIME,Closed,Case Closed. Closed date : 2015-05-21 14:38:33.47 Case Resolved cart requested filled new cart # 0415302902 05/20/15,Recycling Cart Inquiry,Public Works Department,Recycling,Request for Recycling Cart,PWDx_Recycling,PWDx,,,3 Ware St  Dorchester  MA  02125,7.0,03,3.0,C11,Dorchester,8.0,Ward 15,1504.0,R2,3 Ware St,2125.0,Address,142738.0,42.3115,-71.0666,Constituent Call,"(42.3115, -71.0666)"
530942,101001329109,03/10/2015 12:50:23 PM,03/31/2015 12:50:23 PM,03/24/2015 12:35:29 PM,ONTIME,Closed,Case Closed Case Resolved This request has been approved. Request for Recycling Cart has been created. See case #101001340700 for status of the request.,Recycling Cart Inquiry,Public Works Department,Recycling,Request for Recycling Cart,PWDx_Recycling Cart Inquiry,PWDx,,,854 Dorchester Ave  Dorchester  MA  02125,6.0,03,2.0,C6,Dorchester,5.0,Ward 7,708.0,CD,854 Dorchester Ave,2125.0,Address,48758.0,42.3217,-71.0566,Self Service,"(42.3217, -71.0566)"
531001,101001329199,03/10/2015 01:50:03 PM,03/31/2015 01:50:02 PM,04/08/2015 01:29:35 PM,OVERDUE,Closed,Case Closed Case Resolved new cart swapped new cart # 0514000178 04/06/2015,Recycling Cart Inquiry,Public Works Department,Recycling,Request for Recycling Cart,PWDx_Recycling,PWDx,,,69 Kingsdale St  Dorchester  MA  02124,8.0,03,4.0,B3,Greater Mattapan,8.0,Ward 14,1407.0,R3,69 Kingsdale St,2124.0,Address,81961.0,42.2949,-71.0826,Constituent Call,"(42.2949, -71.0826)"
531046,101001329259,03/10/2015 02:34:26 PM,03/31/2015 02:34:26 PM,03/24/2015 11:28:06 AM,ONTIME,Closed,Case Closed Case Resolved This request has been approved. Request for Recycling Cart has been created. See case #101001340585 for status of the request.,Recycling Cart Inquiry,Public Works Department,Recycling,Request for Recycling Cart,PWDx_Recycling Cart Inquiry,PWDx,,,82 Eutaw St  East Boston  MA  02128,1.0,09,1.0,A7,East Boston,1.0,Ward 1,107.0,R1,82 Eutaw St,2128.0,Address,54738.0,42.3798,-71.0365,Self Service,"(42.3798, -71.0365)"
531275,101001329641,03/10/2015 11:12:56 PM,04/01/2015 08:30:00 AM,03/26/2015 11:25:07 AM,ONTIME,Closed,Case Closed Case Resolved This request has been approved. Request for Recycling Cart has been created. See case #101001342576 for status of the request.,Recycling Cart Inquiry,Public Works Department,Recycling,Request for Recycling Cart,PWDx_Recycling Cart Inquiry,PWDx,,,3-4 Folsom Ave  Mission Hill  MA  02120,9.0,10A,8.0,B2,Mission Hill,14.0,Ward 10,1005.0,R2,3-4 Folsom Ave,2120.0,Address,59139.0,42.3299,-71.0993,Self Service,"(42.3299, -71.0993)"
531319,101001329707,03/11/2015 07:45:21 AM,04/01/2015 08:30:00 AM,03/26/2015 11:28:43 AM,ONTIME,Closed,Case Closed Case Resolved Constituent no longer needs a recycling cart.,recycling Cart Inquiry,Public Works Department,Recycling,Request for Recycling Cart,PWDx_Recycling Cart Inquiry,PWDx,,,116-118 Hillside St  Mission Hill  MA  02120,9.0,10A,8.0,B2,Mission Hill,14.0,Ward 10,1005.0,R2,116-118 Hillside St,2120.0,Address,74156.0,42.3307,-71.1046,Self Service,"(42.3307, -71.1046)"
531803,101001330488,03/11/2015 03:51:11 PM,04/01/2015 03:51:11 PM,03/26/2015 01:50:45 PM,ONTIME,Closed,Case Closed Case Resolved This request has been approved. Request for Recycling Cart has been created. See case #101001342765 for status of the request.,Recycling Cart Inquiry,Public Works Department,Recycling,Request for Recycling Cart,PWDx_Recycling Cart Inquiry,PWDx,,,28 Juliette St  Dorchester  MA  02122,7.0,03,3.0,C11,Dorchester,8.0,Ward 15,1509.0,R3,28 Juliette St,2122.0,Address,80359.0,42.3058,-71.0624,Self Service,"(42.3058, -71.0624)"
531902,101001330634,03/11/2015 06:21:19 PM,04/02/2015 08:30:00 AM,03/26/2015 02:43:40 PM,ONTIME,Closed,Case Closed Case Resolved This request has been approved. Request for Recycling Cart has been created. See case #101001342813 for status of the request.,Recycling Cart Inquiry,Public Works Department,Recycling,Request for Recycling Cart,PWDx_Recycling Cart Inquiry,PWDx,,,1161-1163 Hyde Park Ave  Hyde Park  MA  02136,12.0,08,5.0,E18,Hyde Park,10.0,Ward 18,1813.0,R2,1161-1163 Hyde Park Ave,2136.0,Address,77066.0,42.2593,-71.1236,Self Service,"(42.2593, -71.1236)"
531971,101001330750,03/11/2015 11:14:40 PM,05/28/2015 08:30:00 AM,06/09/2015 12:11:26 PM,OVERDUE,Closed,Case Closed. Closed date : 2015-06-09 12:11:26.48 Case Resolved cart requested filled new cart #0415302405 06/08/2015,Recycling Cart Inquiry,Public Works Department,Recycling,Request for Recycling Cart,PWDx_Recycling,PWDx,,,27 Montfern Ave  Brighton  MA  02135,11.0,04,9.0,D14,Allston / Brighton,15.0,Ward 22,2207.0,R3,27 Montfern Ave,2135.0,Address,276759.0,42.3509,-71.1643,Self Service,"(42.3509, -71.1643)"
532166,101001331038,03/12/2015 10:13:51 AM,05/28/2015 10:13:00 AM,06/02/2015 11:44:27 AM,OVERDUE,Closed,Case Closed. Closed date : 2015-06-02 11:44:27.66 Case Resolved cart requested filled new cart # 0415313676 05/30/2015,Recycling Cart Inquiry,Public Works Department,Recycling,Request for Recycling Cart,PWDx_Recycling,PWDx,,,29 Sudan St  Dorchester  MA  02125,7.0,03,3.0,C11,Dorchester,7.0,Ward 13,1308.0,CM,29 Sudan St,2125.0,Address,131727.0,42.3165,-71.0554,Self Service,"(42.3165, -71.0554)"
532394,101001331316,03/12/2015 12:16:17 PM,04/02/2015 12:16:16 PM,03/27/2015 02:48:14 PM,ONTIME,Closed,Case Closed Case Resolved This request has been approved. Request for Recycling Cart has been created. See case #101001343763 for status of the request.,Recycling Cart Inquiry,Public Works Department,Recycling,Request for Recycling Cart,PWDx_Recycling Cart Inquiry,PWDx,,,101 Almont St  Mattapan  MA  02126,8.0,07,5.0,B3,Greater Mattapan,9.0,Ward 18,1803.0,R1,101 Almont St,2126.0,Address,2743.0,42.2769,-71.0975,Constituent Call,"(42.2769, -71.0975)"
532527,101001331498,03/12/2015 01:37:34 PM,04/02/2015 01:37:33 PM,04/29/2015 02:30:22 PM,OVERDUE,Closed,Case Closed Case Resolved cart request filled  new cart #0814415238 04/29/2015,Request for Recycling Cart,Public Works Department,Recycling,Request for Recycling Cart,PWDx_IPL Damaged Cart Replacement,PWDx,https://cityworker.cityofboston.gov:8443/attachments/report/5501cedcd052ca9f54f2ebce/photo/Report.jpg,,32 Linwood St  Hyde Park  MA  02136,12.0,08,5.0,E18,Hyde Park,10.0,18,1812.0,R1,32 Linwood St,2136.0,Address,167110.0,42.2567,-71.1278,City Worker App,"(42.2567, -71.1278)"
532592,101001331615,03/12/2015 03:20:18 PM,04/02/2015 03:20:17 PM,03/27/2015 02:56:39 PM,ONTIME,Closed,Case Closed Case Resolved This request has been approved. Request for Recycling Cart has been created. See case #101001343775 for status of the request.,Recycling Cart Inquiry,Public Works Department,Recycling,Request for Recycling Cart,PWDx_Recycling Cart Inquiry,PWDx,,,26 Larchmont St  Dorchester  MA  02124,7.0,03,4.0,C11,Dorchester,9.0,Ward 17,1703.0,R2,26 Larchmont St,2124.0,Address,84066.0,42.2968,-71.0687,Constituent Call,"(42.2968, -71.0687)"
532799,101001331938,03/13/2015 08:24:41 AM,05/28/2015 08:30:00 AM,08/20/2015 12:27:55 PM,OVERDUE,Closed,Case Closed Case Resolved  already delivered,recycling Cart Inquiry,Public Works Department,Recycling,Request for Recycling Cart,PWDx_Recycling,PWDx,,,44 Leamington Rd  Brighton  MA  02135,11.0,04,9.0,D14,Allston / Brighton,15.0,Ward 21,2113.0,R1,44 Leamington Rd,2135.0,Address,84758.0,42.3418,-71.1509,Self Service,"(42.3418, -71.1509)"
533966,101001333593,03/15/2015 10:35:30 PM,04/06/2015 08:30:00 AM,04/09/2015 12:49:24 PM,OVERDUE,Closed,Case Closed Case Resolved broken cart swapped new cart number #0514000129 04/08/2015,Request for Recycling Cart,Public Works Department,Recycling,Request for Recycling Cart,PWDx_Recycling,PWDx,,,613 South St  Roslindale  MA  02131,9.0,02,5.0,E5,Roslindale,10.0,Ward 20,2002.0,R1,613 South St,2131.0,Address,128880.0,42.2919,-71.1242,Self Service,"(42.2919, -71.1242)"
534133,101001333840,03/16/2015 09:49:16 AM,04/06/2015 09:49:16 AM,03/17/2015 10:13:14 AM,ONTIME,Closed,Case Closed Case Noted Delivered ipl cart 514#0026467 on 3/17/15. Left in the driveway.,Request for Recycling Cart,Public Works Department,Recycling,Request for Recycling Cart,PWDx_IPL Damaged Cart Replacement,PWDx,https://cityworker.cityofboston.gov:8443/attachments/report/5506df5bd052ca9f54f2ec49/photo/Report.jpg,,19 Franklin St  Hyde Park  MA  02136,12.0,08,5.0,E18,Hyde Park,10.0,Ward 18,1819.0,R1,19 Franklin St,2136.0,Address,60709.0,42.2527,-71.133,City Worker App,"(42.2527, -71.133)"
534189,101001333924,03/16/2015 10:56:03 AM,04/06/2015 10:56:03 AM,04/17/2015 03:27:18 PM,OVERDUE,Closed,Case Closed Case Resolved cart requested swapped new cart # 0714423864 04/16/2015,Request for Recycling Cart,Public Works Department,Recycling,Request for Recycling Cart,PWDx_Recycling,PWDx,,,1 Dunford St  Roxbury  MA  02119,9.0,10B,7.0,B2,Roxbury,13.0,Ward 11,1103.0,R1,1 Dunford St,2119.0,Address,49955.0,42.3174,-71.0945,Constituent Call,"(42.3174, -71.0945)"
534444,101001334288,03/16/2015 03:52:14 PM,04/06/2015 03:52:13 PM,04/17/2015 03:28:23 PM,OVERDUE,Closed,Case Closed Case Resolved cart requested swapped new cart # 0714423786 04/16/2015,Request for Recycling Cart,Public Works Department,Recycling,Request for Recycling Cart,PWDx_Recycling,PWDx,,,3 Hilton Ter  Roxbury  MA  02119,9.0,10B,7.0,B2,Roxbury,13.0,Ward 11,1103.0,R1,3 Hilton Ter,2119.0,Address,74327.0,42.3153,-71.0939,Constituent Call,"(42.3153, -71.0939)"
534476,101001334338,03/16/2015 05:06:41 PM,04/07/2015 08:30:00 AM,04/08/2015 01:45:26 PM,OVERDUE,Closed,Case Closed Case Resolved new cart swapped new cart # 0514000573 04/07/15,Request for Recycling Cart,Public Works Department,Recycling,Request for Recycling Cart,PWDx_Recycling,PWDx,,,105 Kilsyth Rd  Brighton  MA  02135,11.0,04,9.0,D14,Allston / Brighton,15.0,Ward 21,2112.0,R2,105 Kilsyth Rd,2135.0,Address,261416.0,42.3406,-71.1461,Self Service,"(42.3406, -71.1461)"
534501,101001334370,03/16/2015 05:47:04 PM,04/07/2015 08:30:00 AM,04/06/2015 12:30:36 PM,ONTIME,Closed,Case Closed Case Resolved new cart swapped new cart #0514000746 04/03/15,Request for Recycling Cart,Public Works Department,Recycling,Request for Recycling Cart,PWDx_Recycling,PWDx,,,227 Bowen St  South Boston  MA  02127,6.0,05,2.0,C6,South Boston / South Boston Waterfront,5.0,Ward 6,603.0,CD,227 Bowen St,2127.0,Address,17849.0,42.3354,-71.0502,Self Service,"(42.3354, -71.0502)"
534502,101001334371,03/16/2015 05:50:03 PM,04/07/2015 08:30:00 AM,04/09/2015 01:01:47 PM,OVERDUE,Closed,Case Closed Case Resolved broken cart swapped new cart number # 0514000083 04/08/2015,Request for Recycling Cart,Public Works Department,Recycling,Request for Recycling Cart,PWDx_Recycling,PWDx,,,32 Brook Ave  Roxbury  MA  02119,7.0,03,7.0,B2,Roxbury,13.0,Ward 8,805.0,R2,32 Brook Ave,2119.0,Address,21847.0,42.3218,-71.0738,Constituent Call,"(42.3218, -71.0738)"
534516,101001334399,03/16/2015 06:31:18 PM,04/07/2015 08:30:00 AM,04/06/2015 12:51:50 PM,ONTIME,Closed,Case Closed Case Resolved new cart swapped new cart #0514000744 04/03/15,Request for Recycling Cart,Public Works Department,Recycling,Request for Recycling Cart,PWDx_Recycling,PWDx,,,91 Pleasantview St  Hyde Park  MA  02136,12.0,08,5.0,E18,Hyde Park,10.0,Ward 18,1808.0,R2,91 Pleasantview St,2136.0,Address,111408.0,42.2728,-71.1119,Self Service,"(42.2728, -71.1119)"
534606,101001334527,03/17/2015 07:52:39 AM,04/07/2015 08:30:00 AM,04/22/2015 02:16:54 PM,OVERDUE,Closed,Case Closed Case Resolved cart requested swapped out new cart #0514000747 04/06/2015,Request for Recycling Cart,Public Works Department,Recycling,Request for Recycling Cart,PWDx_Recycling,PWDx,,,107 Lexington St  East Boston  MA  02128,1.0,09,1.0,A7,East Boston,1.0,Ward 1,107.0,R2,107 Lexington St,2128.0,Address,85498.0,42.3782,-71.0358,Constituent Call,"(42.3782, -71.0358)"
534644,101001334595,03/17/2015 08:40:59 AM,05/28/2015 08:40:00 AM,07/10/2015 02:35:22 PM,OVERDUE,Closed,Case Closed. Closed date : 2015-07-10 14:35:22.237 Case Resolved Closed no cart out 7/10/2015,Request for Recycling Cart,Public Works Department,Recycling,Request for Recycling Cart,PWDx_IPL Damaged Cart Replacement,PWDx,https://cityworker.cityofboston.gov:8443/attachments/report/550820dad052ca9f54f2ecf1/photo/Report.jpg,,69 Lubec St  East Boston  MA  02128,1.0,09,1.0,A7,East Boston,1.0,Ward 1,102.0,RL,69 Lubec St,2128.0,Address,87731.0,42.3704,-71.0332,City Worker App,"(42.3704, -71.0332)"
534651,101001334605,03/17/2015 08:47:49 AM,05/28/2015 08:47:00 AM,04/29/2015 11:46:46 AM,ONTIME,Closed,Case Closed Case Resolved cart request filled new cart #0714423786 04/16/2015,Request for Recycling Cart,Public Works Department,Recycling,Request for Recycling Cart,PWDx_Recycling,PWDx,,,30 Juniper St  Roxbury  MA  02119,7.0,10B,7.0,B2,Roxbury,13.0,Ward 9,905.0,R2,30 Juniper St,2119.0,Address,80401.0,42.3255,-71.0889,Constituent Call,"(42.3255, -71.0889)"
534704,101001334677,03/17/2015 09:25:12 AM,04/07/2015 09:25:12 AM,04/08/2015 01:31:09 PM,OVERDUE,Closed,Case Closed Case Resolved new cart swapped new cart # 0514000819 04/06/2015,Request for Recycling Cart,Public Works Department,Recycling,Request for Recycling Cart,PWDx_Recycling,PWDx,,,29 Mountain Ave  Dorchester  MA  02124,8.0,07,4.0,B3,Greater Mattapan,9.0,Ward 14,1413.0,R1,29 Mountain Ave,2124.0,Address,99090.0,42.2856,-71.0857,Constituent Call,"(42.2856, -71.0857)"
535002,101001335073,03/17/2015 01:08:58 PM,04/07/2015 01:08:58 PM,04/06/2015 12:27:34 PM,ONTIME,Closed,Case Closed Case Resolved new cart swapped new cart #051400521 04/03/15,Request for Recycling Cart,Public Works Department,Recycling,Request for Recycling Cart,PWDx_Recycling,PWDx,,,116-118 Holton St  Brighton  MA  02135,11.0,04,9.0,D14,Allston / Brighton,15.0,Ward 22,2202.0,R3,116-118 Holton St,2135.0,Address,74815.0,42.3606,-71.1391,Constituent Call,"(42.3606, -71.1391)"
535045,101001335141,03/17/2015 01:49:46 PM,05/28/2015 01:49:00 PM,04/29/2015 11:44:10 AM,ONTIME,Closed,Case Closed Case Resolved cart request filled new cart # 0714423862 04/16/2015,Request for Recycling Cart,Public Works Department,Recycling,Request for Recycling Cart,PWDx_Recycling,PWDx,,,1 Hilton Ter  Roxbury  MA  02119,9.0,10B,7.0,B2,Roxbury,13.0,Ward 11,1103.0,R1,1 Hilton Ter,2119.0,Address,74317.0,42.3153,-71.0938,Constituent Call,"(42.3153, -71.0938)"
535054,101001335156,03/17/2015 01:58:59 PM,04/07/2015 01:58:59 PM,04/24/2015 10:14:50 AM,OVERDUE,Closed,Case Closed Case Resolved Cart requested filled new cart #0714423907 04/16/2015,Request for Recycling Cart,Public Works Department,Recycling,Request for Recycling Cart,PWDx_Recycling,PWDx,,,87 Bailey St  Dorchester  MA  02124,8.0,07,4.0,C11,Dorchester,8.0,Ward 17,1711.0,CM,87 Bailey St,2124.0,Address,7571.0,42.2847,-71.0651,Constituent Call,"(42.2847, -71.0651)"
535099,101001335215,03/17/2015 02:42:52 PM,04/07/2015 02:42:51 PM,04/06/2015 12:19:52 PM,ONTIME,Closed,Case Closed Case Resolved new cart swapped new cart #0514000678 04/03/2015,Request for Recycling Cart,Public Works Department,Recycling,Request for Recycling Cart,PWDx_Recycling,PWDx,,,8 Spring Garden St  Dorchester  MA  02125,7.0,03,3.0,C11,Dorchester,7.0,Ward 13,1307.0,R3,8 Spring Garden St,2125.0,Address,129640.0,42.3186,-71.0531,Constituent Call,"(42.3186, -71.0531)"
535259,101001335424,03/17/2015 04:37:04 PM,04/07/2015 04:37:04 PM,04/03/2015 12:13:15 PM,ONTIME,Closed,Case Closed Case Resolved New cart swapped new cart # 0514000667 04/03/15,Request for Recycling Cart,Public Works Department,Recycling,Request for Recycling Cart,PWDx_Recycling,PWDx,,,174 Chelsea St  East Boston  MA  02128,1.0,09,1.0,A7,East Boston,1.0,Ward 1,105.0,R3,174 Chelsea St,2128.0,Address,30362.0,42.3742,-71.0341,Constituent Call,"(42.3742, -71.0341)"
535321,101001335508,03/17/2015 06:08:00 PM,05/28/2015 08:30:00 AM,08/20/2015 12:28:23 PM,OVERDUE,Closed,Case Closed Case Resolved  already delivered,Request for Recycling Cart,Public Works Department,Recycling,Request for Recycling Cart,PWDx_Recycling,PWDx,,,239 Magnolia St  Dorchester  MA  02121,7.0,03,4.0,B2,Roxbury,13.0,Ward 14,1401.0,R1,239 Magnolia St,2121.0,Address,88301.0,42.3109,-71.0745,Self Service,"(42.3109, -71.0745)"
535417,101001335644,03/18/2015 07:45:51 AM,04/08/2015 08:30:00 AM,04/22/2015 02:23:52 PM,OVERDUE,Closed,Case Closed Case Resolved cart requested swapped out new cart #0714423893 04/16/2015,Request for Recycling Cart,Public Works Department,Recycling,Request for Recycling Cart,PWDx_Recycling,PWDx,,,133 Bolton St  South Boston  MA  02127,6.0,05,2.0,C6,South Boston / South Boston Waterfront,5.0,Ward 6,601.0,CD,133 Bolton St,2127.0,Address,16808.0,42.3402,-71.0502,Constituent Call,"(42.3402, -71.0502)"
535785,101001336084,03/18/2015 10:20:05 AM,04/08/2015 10:20:05 AM,04/08/2015 01:49:17 PM,OVERDUE,Closed,Case Closed Case Resolved new cart swapped new cart # 0514000352 04/07/2015,Request for Recycling Cart,Public Works Department,Recycling,Request for Recycling Cart,PWDx_Recycling,PWDx,,,40 Sharp St  Dorchester  MA  02124,8.0,07,4.0,C11,Dorchester,8.0,Ward 17,1706.0,R1,40 Sharp St,2124.0,Address,125970.0,42.2926,-71.0665,Constituent Call,"(42.2926, -71.0665)"
535835,101001336150,03/18/2015 10:55:30 AM,04/08/2015 10:55:29 AM,04/17/2015 02:45:16 PM,OVERDUE,Closed,Case Closed Case Resolved cart requested swapped new cart # 0714423867 04/16/2015,Request for Recycling Cart,Public Works Department,Recycling,Request for Recycling Cart,PWDx_Recycling,PWDx,,,520 Beacon St  Boston  MA  02215,4.0,10A,8.0,D4,Back Bay,14.0,Ward 5,509.0,CM,520 Beacon St,2215.0,Address,11867.0,42.3508,-71.0907,Constituent Call,"(42.3508, -71.0907)"
535960,101001336322,03/18/2015 12:55:35 PM,04/08/2015 12:55:35 PM,05/14/2015 02:26:43 PM,OVERDUE,Closed,Case Closed. Closed date : 2015-05-14 14:26:43.257 Case Resolved cart requested swapped new cart# 5140017099 05/14/2015,Request for Recycling Cart,Public Works Department,Recycling,Request for Recycling Cart,PWDx_IPL Damaged Cart Replacement,PWDx,https://cityworker.cityofboston.gov:8443/attachments/report/5509ae06d052ca9f54f2ed5d/photo/Report.jpg,,3-5 Osceola St  Mattapan  MA  02126,8.0,08,5.0,E18,Hyde Park,9.0,Ward 18,1805.0,R2,3-5 Osceola St,2126.0,Address,106042.0,42.2632,-71.1036,City Worker App,"(42.2632, -71.1036)"
535982,101001336351,03/18/2015 01:16:30 PM,04/08/2015 01:16:30 PM,04/22/2015 02:24:26 PM,OVERDUE,Closed,Case Closed Case Resolved cart requested swapped out new cart #0818423892 04/16/2015,Request for Recycling Cart,Public Works Department,Recycling,Request for Recycling Cart,PWDx_Recycling,PWDx,,,841 E Broadway   South Boston  MA  02127,6.0,05,2.0,C6,South Boston,5.0,06,608.0,E,841 E Broadway,2127.0,Address,341367.0,42.3355,-71.0309,Employee Generated,"(42.3355, -71.0309)"
536011,101001336398,03/18/2015 01:48:04 PM,04/08/2015 01:48:04 PM,04/03/2015 01:14:50 PM,ONTIME,Closed,Case Closed Case Resolved New cart swapped new cart # 0514000794 04/01/15,Request for Recycling Cart,Public Works Department,Recycling,Request for Recycling Cart,PWDx_Recycling,PWDx,,,95-97 Sunnyside St  Hyde Park  MA  02136,12.0,08,5.0,E18,Hyde Park,10.0,Ward 18,1819.0,R2,95-97 Sunnyside St,2136.0,Address,132669.0,42.2495,-71.1353,Constituent Call,"(42.2495, -71.1353)"
536193,101001336634,03/18/2015 04:46:43 PM,04/08/2015 04:46:42 PM,04/06/2015 12:13:56 PM,ONTIME,Closed,Case Closed Case Resolved new cart swapped new cart #0514000711,Request for Recycling Cart,Public Works Department,Recycling,Request for Recycling Cart,PWDx_Recycling,PWDx,,,15 Germania St  Jamaica Plain  MA  02130,9.0,02,6.0,E13,Jamaica Plain,11.0,Ward 11,1106.0,CM,15 Germania St,2130.0,Address,63535.0,42.3141,-71.1021,Constituent Call,"(42.3141, -71.1021)"
536196,101001336639,03/18/2015 04:52:36 PM,04/08/2015 04:52:36 PM,04/06/2015 12:28:35 PM,ONTIME,Closed,Case Closed Case Resolved new cart swapped new cart #0514000522 04/03/15,Request for Recycling Cart,Public Works Department,Recycling,Request for Recycling Cart,PWDx_Recycling,PWDx,,,103-103A Litchfield St  Brighton  MA  02135,11.0,04,9.0,D14,Brighton,15.0,22,2202.0,,103-103A Litchfield St,2135.0,Address,347391.0,42.3594,-71.0587,Constituent Call,"(0, 0)"
536226,101001336685,03/18/2015 06:19:16 PM,04/09/2015 08:30:00 AM,04/08/2015 01:34:39 PM,ONTIME,Closed,Case Closed Case Resolved new cart swapped new cart # 0514000172 04/06/2015,Request for Recycling Cart,Public Works Department,Recycling,Request for Recycling Cart,PWDx_Recycling,PWDx,,,48-50 Seaverns Ave  Jamaica Plain  MA  02130,9.0,02,6.0,E13,Jamaica Plain,11.0,Ward 19,1906.0,CM,48-50 Seaverns Ave,2130.0,Address,124278.0,42.312,-71.1113,Constituent Call,"(42.312, -71.1113)"
536235,101001336697,03/18/2015 06:40:53 PM,04/09/2015 08:30:00 AM,04/08/2015 01:30:15 PM,ONTIME,Closed,Case Closed Case Resolved new cart swapped new cart # 0514000577 04/06/2015,Request for Recycling Cart,Public Works Department,Recycling,Request for Recycling Cart,PWDx_Recycling,PWDx,,,43-45 Millet St  Dorchester  MA  02124,8.0,03,4.0,B3,Dorchester,9.0,Ward 17,1701.0,R2,43-45 Millet St,2124.0,Address,95533.0,42.2951,-71.0776,Constituent Call,"(42.2951, -71.0776)"
536425,101001336964,03/19/2015 09:13:30 AM,04/09/2015 09:13:30 AM,04/08/2015 01:52:01 PM,ONTIME,Closed,Case Closed Case Resolved new cart swapped new cart # 0514000146 04/07/15,Request for Recycling Cart,Public Works Department,Recycling,Request for Recycling Cart,PWDx_Recycling,PWDx,,,314 Saratoga St  East Boston  MA  02128,1.0,09,1.0,A7,East Boston,1.0,Ward 1,110.0,R3,314 Saratoga St,2128.0,Address,122604.0,42.3786,-71.0315,Constituent Call,"(42.3786, -71.0315)"
536549,101001337115,03/19/2015 09:56:16 AM,04/09/2015 09:56:15 AM,04/07/2015 12:31:54 PM,ONTIME,Closed,Case Closed Case Noted new cart swapped new cart #0714424292 04/01/15,Request for Recycling Cart,Public Works Department,Recycling,Request for Recycling Cart,PWDx_Recycling,PWDx,,,19 Park St  Charlestown  MA  02129,3.0,1A,1.0,A15,Charlestown,2.0,Ward 2,201.0,CM,19 Park St,2129.0,Address,107210.0,42.3725,-71.0611,Constituent Call,"(42.3725, -71.0611)"
536571,101001337138,03/19/2015 10:00:54 AM,04/09/2015 10:00:53 AM,04/22/2015 02:25:11 PM,OVERDUE,Closed,Case Closed Case Resolved cart requested swapped out new cart #0814423895 04/16/2015,Request for Recycling Cart,Public Works Department,Recycling,Request for Recycling Cart,PWDx_Recycling,PWDx,,,267 W Third St  South Boston  MA  02127,6.0,05,2.0,C6,South Boston / South Boston Waterfront,5.0,Ward 6,603.0,E,267 W Third St,2127.0,Address,135339.0,42.338,-71.0479,Constituent Call,"(42.338, -71.0479)"
536575,101001337143,03/19/2015 10:02:47 AM,04/09/2015 10:02:46 AM,04/22/2015 02:25:46 PM,OVERDUE,Closed,Case Closed Case Resolved cart requested swapped out new cart #0814423894 04/16/2015,Request for Recycling Cart,Public Works Department,Recycling,Request for Recycling Cart,PWDx_Recycling,PWDx,,,34-36 H St  South Boston  MA  02127,6.0,05,2.0,C6,South Boston / South Boston Waterfront,5.0,Ward 6,605.0,CD,34-36 H St,2127.0,Address,67874.0,42.3368,-71.0414,Self Service,"(42.3368, -71.0414)"
536742,101001337358,03/19/2015 12:20:21 PM,04/09/2015 12:20:21 PM,04/22/2015 03:15:01 PM,OVERDUE,Closed,Case Closed Case Resolved cart requested swapped out new cart #0714423975 04/16/2015,Request for Recycling Cart,Public Works Department,Recycling,Request for Recycling Cart,PWDx_Recycling,PWDx,,,242 Hyde Park Ave  Jamaica Plain  MA  02130,12.0,02,6.0,E13,Jamaica Plain,10.0,Ward 19,1907.0,R3,242 Hyde Park Ave,2130.0,Address,77272.0,42.2934,-71.1173,Constituent Call,"(42.2934, -71.1173)"
536795,101001337437,03/19/2015 01:41:50 PM,04/09/2015 01:41:49 PM,04/03/2015 12:11:48 PM,ONTIME,Closed,Case Closed Case Resolved New cart swapped new cart # 0514000756 04/02/15,Request for Recycling Cart,Public Works Department,Recycling,Request for Recycling Cart,PWDx_Recycling,PWDx,,,105 Navarre St  Hyde Park  MA  02136,12.0,08,5.0,E18,Hyde Park,10.0,Ward 18,1808.0,R1,105 Navarre St,2136.0,Address,100392.0,42.275,-71.1177,Constituent Call,"(42.275, -71.1177)"
536836,101001337495,03/19/2015 02:31:51 PM,05/28/2015 02:31:00 PM,04/29/2015 11:48:05 AM,ONTIME,Closed,Case Closed Case Resolved cart request filled new cart #0714423782 04/16/2015,Request for Recycling Cart,Public Works Department,Recycling,Request for Recycling Cart,PWDx_Recycling,PWDx,,,117 Marlborough St  Boston  MA  02116,4.0,1C,8.0,D4,Back Bay,14.0,Ward 5,507.0,CM,117 Marlborough St,2116.0,Address,90344.0,42.3534,-71.0775,Constituent Call,"(42.3534, -71.0775)"
536848,101001337515,03/19/2015 02:49:57 PM,04/09/2015 02:49:57 PM,04/03/2015 11:37:19 AM,ONTIME,Closed,Case Closed Case Resolved new cart swapped new cart # 0514000760 04/02/15,Request for Recycling Cart,Public Works Department,Recycling,Request for Recycling Cart,PWDx_Recycling,PWDx,,,29 Taft St  Dorchester  MA  02125,7.0,03,3.0,C11,Dorchester,7.0,Ward 13,1308.0,R3,29 Taft St,2125.0,Address,133604.0,42.3176,-71.0584,Constituent Call,"(42.3176, -71.0584)"
536852,101001337521,03/19/2015 02:51:10 PM,04/09/2015 02:51:10 PM,04/16/2015 03:09:56 PM,OVERDUE,Closed,Case Closed Case Resolved cart requested has been filled new cart number is  0714424024 04/14/2015,Request for Recycling Cart,Public Works Department,Recycling,Request for Recycling Cart,PWDx_Recycling,PWDx,,,54-56 Hamilton St  Hyde Park  MA  02136,12.0,08,5.0,E18,Hyde Park,10.0,Ward 18,1820.0,R2,54-56 Hamilton St,2136.0,Address,68388.0,42.2339,-71.132,Employee Generated,"(42.2339, -71.132)"
536858,101001337528,03/19/2015 02:53:07 PM,04/09/2015 02:53:07 PM,04/21/2015 09:15:37 AM,OVERDUE,Closed,Case Closed Case Resolved Cart requested swapped out new cart #0714423946 04/15/2015,Request for Recycling Cart,Public Works Department,Recycling,Request for Recycling Cart,PWDx_Recycling,PWDx,,,65 Old Harbor St  South Boston  MA  02127,6.0,05,2.0,C6,South Boston / South Boston Waterfront,5.0,Ward 7,704.0,R1,65 Old Harbor St,2127.0,Address,105135.0,42.3326,-71.0476,Constituent Call,"(42.3326, -71.0476)"
536874,101001337544,03/19/2015 02:55:44 PM,04/09/2015 02:55:44 PM,04/24/2015 10:15:26 AM,OVERDUE,Closed,Case Closed Case Resolved Cart requested filled new cart #0714423906 04/16/2015,Request for Recycling Cart,Public Works Department,Recycling,Request for Recycling Cart,PWDx_Recycling,PWDx,,,299 Gallivan Blvd  Dorchester  MA  02124,8.0,07,3.0,C11,Dorchester,7.0,Ward 16,1611.0,C,299 Gallivan Blvd,2124.0,Address,165519.0,42.2797,-71.0658,Employee Generated,"(42.2797, -71.0658)"
536880,101001337553,03/19/2015 03:03:00 PM,05/28/2015 03:03:00 PM,08/20/2015 12:28:53 PM,OVERDUE,Closed,Case Closed Case Resolved  already delivered dupli case,Request for Recycling Cart,Public Works Department,Recycling,Request for Recycling Cart,PWDx_Recycling,PWDx,,,39 Brook Ave  Roxbury  MA  02119,7.0,03,7.0,B2,Roxbury,13.0,08,805.0,,39 Brook Ave,2119.0,Address,352643.0,42.3594,-71.0587,Employee Generated,"(0, 0)"
536882,101001337555,03/19/2015 03:04:15 PM,04/09/2015 03:04:15 PM,04/22/2015 02:32:26 PM,OVERDUE,Closed,Case Closed Case Resolved cart requested swapped out new cart #0714423962 04/16/2015,Request for Recycling Cart,Public Works Department,Recycling,Request for Recycling Cart,PWDx_Recycling,PWDx,,,210 Bremen St  East Boston  MA  02128,1.0,09,1.0,A7,East Boston,1.0,Ward 1,105.0,R3,210 Bremen St,2128.0,Address,195665.0,42.3737,-71.0336,Constituent Call,"(42.3737, -71.0336)"
536888,101001337564,03/19/2015 03:11:25 PM,04/09/2015 03:11:25 PM,04/22/2015 02:26:20 PM,OVERDUE,Closed,Case Closed Case Resolved cart requested swapped out new cart #0814423971 04/16/2015,Request for Recycling Cart,Public Works Department,Recycling,Request for Recycling Cart,PWDx_Recycling,PWDx,,,923 E Broadway  South Boston  MA  02127,6.0,05,2.0,C6,South Boston / South Boston Waterfront,5.0,Ward 6,609.0,RC,923 E Broadway,2127.0,Address,196795.0,42.3356,-71.027,Employee Generated,"(42.3356, -71.027)"
536919,101001337609,03/19/2015 03:36:30 PM,04/09/2015 03:36:29 PM,04/27/2015 01:25:25 PM,OVERDUE,Closed,Case Closed Case Resolved RECYCLING CART LIST REQUEST FILLED NEW CART #0415302206 04/24/2015,Request for Recycling Cart,Public Works Department,Recycling,Request for Recycling Cart,PWDx_Recycling,PWDx,,,267 W Third St  South Boston  MA  02127,6.0,05,2.0,C6,South Boston / South Boston Waterfront,5.0,Ward 6,603.0,E,267 W Third St,2127.0,Address,135339.0,42.338,-71.0479,Constituent Call,"(42.338, -71.0479)"
536926,101001337621,03/19/2015 03:47:25 PM,04/09/2015 03:47:24 PM,04/22/2015 02:21:44 PM,OVERDUE,Closed,Case Closed Case Resolved cart requested swapped out new cart #0714423974 04/16/2015,Request for Recycling Cart,Public Works Department,Recycling,Request for Recycling Cart,PWDx_Recycling,PWDx,,,210 E Cottage St  Dorchester  MA  02125,7.0,03,2.0,C11,Dorchester,5.0,07,709.0,,210 E Cottage St,2125.0,Address,352648.0,42.3594,-71.0587,Constituent Call,"(0, 0)"
536931,101001337626,03/19/2015 03:50:50 PM,04/09/2015 03:50:50 PM,04/09/2015 01:02:29 PM,ONTIME,Closed,Case Closed Case Resolved broken cart swapped new cart number #0514000121 04/08/2015,Request for Recycling Cart,Public Works Department,Recycling,Request for Recycling Cart,PWDx_Recycling,PWDx,,,339 Bowdoin St  Dorchester  MA  02122,7.0,03,3.0,C11,Dorchester,8.0,Ward 15,1504.0,R3,339 Bowdoin St,2122.0,Address,17720.0,42.3088,-71.0638,Constituent Call,"(42.3088, -71.0638)"
536932,101001337627,03/19/2015 03:51:33 PM,04/09/2015 03:51:33 PM,04/09/2015 01:03:04 PM,ONTIME,Closed,Case Closed Case Resolved broken cart swapped new cart number #0514000090 04/08/2015,Request for Recycling Cart,Public Works Department,Recycling,Request for Recycling Cart,PWDx_Recycling,PWDx,,,339 Bowdoin St  Dorchester  MA  02122,7.0,03,3.0,C11,Dorchester,8.0,Ward 15,1504.0,R3,339 Bowdoin St,2122.0,Address,17720.0,42.3088,-71.0638,Constituent Call,"(42.3088, -71.0638)"
536937,101001337634,03/19/2015 03:54:13 PM,04/09/2015 03:54:13 PM,04/06/2015 12:25:29 PM,ONTIME,Closed,Case Closed Case Resolved new cart swapped new cart #0514000677 04/03/15,Request for Recycling Cart,Public Works Department,Recycling,Request for Recycling Cart,PWDx_Recycling,PWDx,,,48-50 Mount Vernon St  Dorchester  MA  02125,6.0,03,2.0,C6,Dorchester,5.0,07,708.0,,48-50 Mount Vernon St,2125.0,Address,345106.0,42.3594,-71.0587,Self Service,"(0, 0)"
536957,101001337665,03/19/2015 04:29:06 PM,05/28/2015 04:29:00 PM,06/02/2015 11:41:25 AM,OVERDUE,Closed,Case Closed. Closed date : 2015-06-02 11:41:25.127 Case Resolved cart requested filled new cart # 0415313561 06/01/2015,Request for Recycling Cart,Public Works Department,Recycling,Request for Recycling Cart,PWDx_Recycling,PWDx,,,295 Lexington St  East Boston  MA  02128,1.0,09,1.0,A7,East Boston,1.0,Ward 1,109.0,R3,295 Lexington St,2128.0,Address,85674.0,42.3807,-71.0289,Constituent Call,"(42.3807, -71.0289)"
536976,101001337689,03/19/2015 04:52:57 PM,04/09/2015 04:52:57 PM,04/14/2015 02:44:36 PM,OVERDUE,Closed,Case Closed Case Resolved broken cart swapped new cart #0714424274 04/13/2015,Request for Recycling Cart,Public Works Department,Recycling,Request for Recycling Cart,PWDx_Recycling,PWDx,,,8 W Cedar St  Boston  MA  02108,3.0,1B,8.0,A1,Beacon Hill,14.0,Ward 5,511.0,R1,8 W Cedar St,2108.0,Address,27023.0,42.3575,-71.0695,Constituent Call,"(42.3575, -71.0695)"
536980,101001337694,03/19/2015 04:56:21 PM,04/09/2015 04:56:20 PM,04/16/2015 03:02:24 PM,OVERDUE,Closed,Case Closed Case Resolved cart requested has been filled new cart number is 0714424022 04/14/15,Request for Recycling Cart,Public Works Department,Recycling,Request for Recycling Cart,PWDx_Recycling,PWDx,,,59 Homes Ave  Dorchester  MA  02122,7.0,03,4.0,C11,Dorchester,8.0,Ward 15,1505.0,R2,59 Homes Ave,2122.0,Address,75048.0,42.3028,-71.0687,Constituent Call,"(42.3028, -71.0687)"
536984,101001337698,03/19/2015 05:03:14 PM,04/10/2015 08:30:00 AM,04/07/2015 12:34:04 PM,ONTIME,Closed,Case Closed Case Resolved new cart swapped new cart #0714424277 04/01/2015,Request for Recycling Cart,Public Works Department,Recycling,Request for Recycling Cart,PWDx_Recycling,PWDx,,,17 Monument Ave  Charlestown  MA  02129,3.0,1A,1.0,A15,Charlestown,2.0,Ward 2,203.0,R1,17 Monument Ave,2129.0,Address,96852.0,42.3742,-71.062,Constituent Call,"(42.3742, -71.062)"
537151,101001337961,03/20/2015 08:38:51 AM,04/10/2015 08:38:50 AM,04/24/2015 10:16:27 AM,OVERDUE,Closed,Case Closed Case Resolved Cart requested filled new cart #0714423909 4/16/2015,Request for Recycling Cart,Public Works Department,Recycling,Request for Recycling Cart,PWDx_Recycling,PWDx,,,22 O'Connell Rd  Dorchester  MA  02124,8.0,07,3.0,C11,Dorchester,7.0,17,1704.0,R2,22 O'Connell Rd,2124.0,Address,104475.0,42.2783,-71.0682,Constituent Call,"(42.2783, -71.0682)"
537166,101001337987,03/20/2015 08:58:22 AM,05/28/2015 08:58:00 AM,04/29/2015 11:48:38 AM,ONTIME,Closed,Case Closed Case Resolved cart request filled new cart #0714423787 04/16/2015,Request for Recycling Cart,Public Works Department,Recycling,Request for Recycling Cart,PWDx_Recycling,PWDx,,,251 Commonwealth Ave  Boston  MA  02116,4.0,1C,8.0,D4,Back Bay,14.0,Ward 5,508.0,R4,251 Commonwealth Ave,2116.0,Address,216562.0,42.3509,-71.0834,Constituent Call,"(42.3509, -71.0834)"
537170,101001337995,03/20/2015 09:03:05 AM,04/10/2015 09:03:05 AM,04/27/2015 01:25:57 PM,OVERDUE,Closed,Case Closed Case Resolved RECYCLING CART LIST REQUEST FILLED NEW CART #0415302207 04/24/2015,Request for Recycling Cart,Public Works Department,Recycling,Request for Recycling Cart,PWDx_Recycling,PWDx,,,4 Kemble Pl  South Boston  MA  02127,6.0,05,2.0,C6,South Boston / South Boston Waterfront,5.0,Ward 6,607.0,R1,4 Kemble Pl,2127.0,Address,81023.0,42.3378,-71.0275,Constituent Call,"(42.3378, -71.0275)"
537219,101001338070,03/20/2015 09:47:54 AM,04/10/2015 09:47:53 AM,04/21/2015 09:37:25 AM,OVERDUE,Closed,Case Closed Case Resolved Cart requested swapped out new cart # 0714423976 04/15/2015,Request for Recycling Cart,Public Works Department,Recycling,Request for Recycling Cart,PWDx_Recycling,PWDx,,,263 Webster St  East Boston  MA  02128,1.0,09,1.0,A7,East Boston,1.0,Ward 1,101.0,R3,263 Webster St,2128.0,Address,333577.0,42.3646,-71.0313,Constituent Call,"(42.3646, -71.0313)"
537276,101001338134,03/20/2015 10:23:02 AM,04/10/2015 10:23:01 AM,04/03/2015 11:34:02 AM,ONTIME,Closed,Case Closed Case Resolved cart swappped new cart # 0514000670 4/02/15,Request for Recycling Cart,Public Works Department,Recycling,Request for Recycling Cart,PWDx_Recycling,PWDx,,,45 Philbrick St  Roslindale  MA  02131,12.0,02,5.0,E18,Roslindale,10.0,Ward 18,1807.0,R1,45 Philbrick St,2131.0,Address,109961.0,42.2853,-71.1182,Constituent Call,"(42.2853, -71.1182)"
537278,101001338137,03/20/2015 10:24:23 AM,04/10/2015 10:24:23 AM,04/27/2015 01:26:29 PM,OVERDUE,Closed,Case Closed Case Resolved RECYCLING CART LIST REQUEST FILLED NEW CART #0415302208 04/24/2015,Request for Recycling Cart,Public Works Department,Recycling,Request for Recycling Cart,PWDx_Recycling,PWDx,,,472 E Third St  South Boston  MA  02127,6.0,05,2.0,C6,South Boston / South Boston Waterfront,5.0,Ward 6,605.0,CM,472 E Third St,2127.0,Address,134934.0,42.3366,-71.041,Constituent Call,"(42.3366, -71.041)"
537281,101001338140,03/20/2015 10:25:03 AM,05/28/2015 10:25:00 AM,06/03/2015 01:13:09 PM,OVERDUE,Closed,Case Closed. Closed date : 2015-06-03 13:13:09.743 Case Resolved cart requested filled new cart #0415302373 05/29/2015,Request for Recycling Cart,Public Works Department,Recycling,Request for Recycling Cart,PWDx_Recycling,PWDx,,,42 Vinton St  South Boston  MA  02127,6.0,05,2.0,C6,South Boston / South Boston Waterfront,5.0,Ward 7,706.0,R3,42 Vinton St,2127.0,Address,140836.0,42.3294,-71.0533,Constituent Call,"(42.3294, -71.0533)"
537286,101001338145,03/20/2015 10:26:58 AM,04/10/2015 10:26:58 AM,04/27/2015 01:40:37 PM,OVERDUE,Closed,Case Closed Case Resolved RECYCLING CART LIST REQUEST FILLED NEW CART #0415302211 04/25/2015,Request for Recycling Cart,Public Works Department,Recycling,Request for Recycling Cart,PWDx_Recycling,PWDx,,,267 E St  South Boston  MA  02127,6.0,05,2.0,C6,South Boston / South Boston Waterfront,5.0,Ward 6,603.0,CM,267 E St,2127.0,Address,50572.0,42.3362,-71.0509,Constituent Call,"(42.3362, -71.0509)"
537289,101001338150,03/20/2015 10:28:46 AM,04/10/2015 10:28:45 AM,04/06/2015 12:53:37 PM,ONTIME,Closed,Case Closed Case Resolved new cart swapped new cart #0514000716 04/03/15,Request for Recycling Cart,Public Works Department,Recycling,Request for Recycling Cart,PWDx_Recycling,PWDx,,,609 River St  Mattapan  MA  02126,8.0,08,4.0,E18,Greater Mattapan,9.0,Ward 18,1804.0,R2,609 River St,2126.0,Address,116655.0,42.2659,-71.0982,Constituent Call,"(42.2659, -71.0982)"
537291,101001338152,03/20/2015 10:29:50 AM,04/10/2015 10:29:50 AM,04/08/2015 01:49:52 PM,ONTIME,Closed,Case Closed Case Resolved new cart swapped new cart # 0514000822 04/07/15,Request for Recycling Cart,Public Works Department,Recycling,Request for Recycling Cart,PWDx_Recycling,PWDx,,,65 Thetford Ave  Dorchester  MA  02124,8.0,07,4.0,B3,Dorchester,9.0,Ward 17,1707.0,R2,65 Thetford Ave,2124.0,Address,134826.0,42.2842,-71.0783,Constituent Call,"(42.2842, -71.0783)"
537301,101001338168,03/20/2015 10:45:11 AM,04/10/2015 10:45:11 AM,03/20/2015 10:45:50 AM,ONTIME,Closed,Case Closed Duplicate of Existing Case,Request for Recycling Cart,Public Works Department,Recycling,Request for Recycling Cart,PWDx_Recycling,PWDx,,,42 Vinton St  South Boston  MA  02127,6.0,05,2.0,C6,South Boston / South Boston Waterfront,5.0,Ward 7,706.0,R3,42 Vinton St,2127.0,Address,140836.0,42.3294,-71.0533,Constituent Call,"(42.3294, -71.0533)"
537361,101001338268,03/20/2015 12:00:16 PM,04/10/2015 12:00:16 PM,04/03/2015 12:06:01 PM,ONTIME,Closed,Case Closed Case Resolved New cart swapped new cart # 051400754 04/02/15,Request for Recycling Cart,Public Works Department,Recycling,Request for Recycling Cart,PWDx_Recycling,PWDx,,,65 Beryl St  Roslindale  MA  02131,12.0,06,5.0,E5,Roslindale,10.0,20,2002.0,,65 Beryl St,2131.0,Address,349467.0,42.3594,-71.0587,Constituent Call,"(0, 0)"
537408,101001338318,03/20/2015 12:41:03 PM,04/10/2015 12:41:03 PM,04/09/2015 01:29:54 PM,ONTIME,Closed,Case Closed Case Resolved broken cart swapped new cart number #0514000127 04/08/2015,Request for Recycling Cart,Public Works Department,Recycling,Request for Recycling Cart,PWDx_Recycling,PWDx,,,5 Lodgehill Rd  Hyde Park  MA  02136,12.0,08,5.0,E18,Hyde Park,10.0,Ward 18,1822.0,CD,5 Lodgehill Rd,2136.0,Address,86922.0,42.265,-71.1272,Employee Generated,"(42.265, -71.1272)"
537424,101001338334,03/20/2015 12:44:12 PM,04/10/2015 12:44:12 PM,04/08/2015 01:35:19 PM,ONTIME,Closed,Case Closed Case Resolved new cart swapped new cart # 05140000582 04/06/2015,Request for Recycling Cart,Public Works Department,Recycling,Request for Recycling Cart,PWDx_Recycling,PWDx,,,72 Dunster Rd  Jamaica Plain  MA  02130,9.0,02,6.0,E13,Jamaica Plain,11.0,Ward 19,1908.0,R2,72 Dunster Rd,2130.0,Address,227127.0,42.3113,-71.1191,Self Service,"(42.3113, -71.1191)"
537436,101001338348,03/20/2015 12:47:01 PM,04/10/2015 12:47:00 PM,04/06/2015 12:29:29 PM,ONTIME,Closed,Case Closed Case Resolved new cart swapped new cart #0514000520 04/03/15,Request for Recycling Cart,Public Works Department,Recycling,Request for Recycling Cart,PWDx_Recycling,PWDx,,,105-105A Litchfield St  Brighton  MA  02135,11.0,04,9.0,D14,Brighton,15.0,22,2202.0,,105-105A Litchfield St,2135.0,Address,347392.0,42.3594,-71.0587,Constituent Call,"(0, 0)"
537437,101001338349,03/20/2015 12:47:24 PM,04/10/2015 12:47:24 PM,04/24/2015 10:17:01 AM,OVERDUE,Closed,Case Closed Case Resolved Cart requested filled new cart # 0714423908 04/16/2015,Request for Recycling Cart,Public Works Department,Recycling,Request for Recycling Cart,PWDx_Recycling,PWDx,,,15 Grayson St  Dorchester  MA  02124,8.0,07,3.0,C11,Dorchester,7.0,Ward 16,1612.0,R1,15 Grayson St,2124.0,Address,66131.0,42.2828,-71.0505,Employee Generated,"(42.2828, -71.0505)"
537438,101001338350,03/20/2015 12:49:02 PM,04/10/2015 12:49:02 PM,04/22/2015 02:18:48 PM,OVERDUE,Closed,Case Closed Case Resolved cart requested swapped out new cart #0714424030 04/15/2015,Request for Recycling Cart,Public Works Department,Recycling,Request for Recycling Cart,PWDx_Recycling,PWDx,,,33-35 Glenhill Rd  Mattapan  MA  02126,8.0,07,4.0,B3,Greater Mattapan,9.0,Ward 18,1801.0,R2,33-35 Glenhill Rd,2126.0,Address,64445.0,42.2775,-71.0828,Employee Generated,"(42.2775, -71.0828)"
537443,101001338359,03/20/2015 12:54:25 PM,04/10/2015 12:54:25 PM,04/03/2015 12:12:26 PM,ONTIME,Closed,Case Closed Case Resolved New cart swapped new cart # 0514000752 04/02/15,Request for Recycling Cart,Public Works Department,Recycling,Request for Recycling Cart,PWDx_Recycling,PWDx,,,11 Victoria Heights Rd  Hyde Park  MA  02136,12.0,08,5.0,E18,Hyde Park,10.0,18,1808.0,CM,11 Victoria Heights Rd,2136.0,Address,170766.0,42.2704,-71.1112,Constituent Call,"(42.2704, -71.1112)"
537450,101001338368,03/20/2015 01:00:05 PM,04/10/2015 01:00:05 PM,04/03/2015 12:13:49 PM,ONTIME,Closed,Case Closed Case Resolved New cart swapped new cart # 0514000757 04/02/15,Request for Recycling Cart,Public Works Department,Recycling,Request for Recycling Cart,PWDx_Recycling,PWDx,,,681 Saratoga St  East Boston  MA  02128,1.0,09,1.0,A7,East Boston,1.0,Ward 1,111.0,R3,681 Saratoga St,2128.0,Address,122756.0,42.3826,-71.0199,Self Service,"(42.3826, -71.0199)"
537451,101001338369,03/20/2015 01:01:21 PM,04/10/2015 01:01:20 PM,04/15/2015 01:45:41 PM,OVERDUE,Closed,Case Closed Case Resolved Cart request has been filled new cart number is #0714423953 04/14/2015,Request for Recycling Cart,Public Works Department,Recycling,Request for Recycling Cart,PWDx_Recycling,PWDx,,,166-168 Calumet St  Mission Hill  MA  02120,9.0,10A,8.0,B2,Mission Hill,14.0,Ward 10,1005.0,R2,166-168 Calumet St,2120.0,Address,24949.0,42.3297,-71.1018,Constituent Call,"(42.3297, -71.1018)"
537454,101001338373,03/20/2015 01:03:01 PM,04/10/2015 01:03:01 PM,04/03/2015 11:38:00 AM,ONTIME,Closed,Case Closed Case Resolved new cart swapped new cart # 0514000758 04/02/15,Request for Recycling Cart,Public Works Department,Recycling,Request for Recycling Cart,PWDx_Recycling,PWDx,,,4 Windermere Rd  Dorchester  MA  02125,7.0,03,3.0,C11,Dorchester,7.0,Ward 13,1306.0,R3,4 Windermere Rd,2125.0,Address,337514.0,42.3152,-71.062,Employee Generated,"(42.3152, -71.062)"
537458,101001338381,03/20/2015 01:08:13 PM,04/10/2015 01:08:13 PM,03/23/2015 08:56:44 AM,ONTIME,Closed,Case Closed Case Resolved Constituent called back to say that they no longer need a recycling cart.,Request for Recycling Cart,Public Works Department,Recycling,Request for Recycling Cart,PWDx_Recycling,PWDx,,,11 Gordon St  Jamaica Plain  MA  02130,9.0,02,6.0,E13,Jamaica Plain,11.0,Ward 19,1906.0,E,11 Gordon St,2130.0,Address,65526.0,42.3105,-71.1081,Constituent Call,"(42.3105, -71.1081)"
537461,101001338384,03/20/2015 01:10:24 PM,04/10/2015 01:10:24 PM,04/24/2015 02:21:40 PM,OVERDUE,Closed,Case Closed Case Resolved Cart request filled new cart # 0714423763 04/23/2015,Request for Recycling Cart,Public Works Department,Recycling,Request for Recycling Cart,PWDx_Recycling,PWDx,,,202 Highland St  Roxbury  MA  02119,9.0,10B,7.0,B2,Roxbury,13.0,Ward 11,1102.0,R3,202 Highland St,2119.0,Address,73721.0,42.323,-71.0938,Employee Generated,"(42.323, -71.0938)"
537468,101001338393,03/20/2015 01:20:54 PM,04/10/2015 01:20:54 PM,04/22/2015 02:30:29 PM,OVERDUE,Closed,Case Closed Case Resolved cart requested swapped out new cart #0714423966 04/16/2015,Request for Recycling Cart,Public Works Department,Recycling,Request for Recycling Cart,PWDx_Recycling,PWDx,,,15 Elm St  Hyde Park  MA  02136,12.0,08,5.0,E18,Hyde Park,10.0,Ward 18,1815.0,R1,15 Elm St,2136.0,Address,53159.0,42.2601,-71.1182,Employee Generated,"(42.2601, -71.1182)"
537471,101001338398,03/20/2015 01:26:15 PM,05/28/2015 01:26:00 PM,05/15/2015 11:54:22 AM,ONTIME,Closed,Case Closed. Closed date : 2015-05-15 11:54:22.123 Case Resolved cart requested new cart#0415302487 05/14/2015,Request for Recycling Cart,Public Works Department,Recycling,Request for Recycling Cart,PWDx_Recycling,PWDx,,,465 Ashmont St  Dorchester  MA  02122,8.0,07,3.0,C11,Dorchester,7.0,Ward 16,1609.0,CM,465 Ashmont St,2122.0,Address,5455.0,42.2885,-71.054,Employee Generated,"(42.2885, -71.054)"
537479,101001338406,03/20/2015 01:30:14 PM,04/10/2015 01:30:14 PM,04/08/2015 01:42:15 PM,ONTIME,Closed,Case Closed Case Resolved new cart swapped new cart # 0514000173 04/07/2015,Request for Recycling Cart,Public Works Department,Recycling,Request for Recycling Cart,PWDx_Recycling,PWDx,,,14 Abbot St  Dorchester  MA  02124,7.0,03,4.0,B3,Greater Mattapan,8.0,Ward 14,1407.0,R2,14 Abbot St,2124.0,Address,63.0,42.2973,-71.0859,Constituent Call,"(42.2973, -71.0859)"
537482,101001338410,03/20/2015 01:32:26 PM,04/10/2015 01:32:26 PM,04/03/2015 12:01:02 PM,ONTIME,Closed,Case Closed Case Resolved New cart swapped new cart # 0514000741 04/03/2015,Request for Recycling Cart,Public Works Department,Recycling,Request for Recycling Cart,PWDx_Recycling,PWDx,,,15 Victoria St  Dorchester  MA  02125,7.0,03,3.0,C11,Dorchester,7.0,Ward 13,1308.0,R3,15 Victoria St,2125.0,Address,140447.0,42.3159,-71.0582,Constituent Call,"(42.3159, -71.0582)"
537485,101001338413,03/20/2015 01:34:05 PM,04/10/2015 01:34:05 PM,04/16/2015 03:04:30 PM,OVERDUE,Closed,Case Closed Case Resolved cart requested has been filled new cart number is 0714424142 04/14/2015,Request for Recycling Cart,Public Works Department,Recycling,Request for Recycling Cart,PWDx_Recycling,PWDx,,,744 E Broadway  South Boston  MA  02127,6.0,05,2.0,C6,South Boston / South Boston Waterfront,5.0,Ward 6,605.0,RC,744 E Broadway,2127.0,Address,196639.0,42.3358,-71.0357,Constituent Call,"(42.3358, -71.0357)"
537507,101001338444,03/20/2015 01:50:52 PM,04/10/2015 01:50:52 PM,04/21/2015 09:41:06 AM,OVERDUE,Closed,Case Closed Case Resolved Cart requested swapped out new cart #0714423979 04/15/2015,Request for Recycling Cart,Public Works Department,Recycling,Request for Recycling Cart,PWDx_Recycling,PWDx,,,89 Orleans St  East Boston  MA  02128,1.0,09,1.0,A7,East Boston,1.0,Ward 1,102.0,R3,89 Orleans St,2128.0,Address,287697.0,42.369,-71.037,Employee Generated,"(42.369, -71.037)"
537526,101001338472,03/20/2015 02:24:51 PM,04/10/2015 02:24:51 PM,04/22/2015 02:22:42 PM,OVERDUE,Closed,Case Closed Case Resolved cart requested swapped out new cart #0714423973 04/16/2015,Request for Recycling Cart,Public Works Department,Recycling,Request for Recycling Cart,PWDx_Recycling,PWDx,,,7 Rowell St  Dorchester  MA  02125,7.0,03,3.0,C11,Dorchester,7.0,Ward 13,1306.0,CM,7 Rowell St,2125.0,Address,119103.0,42.3131,-71.064,Employee Generated,"(42.3131, -71.064)"
537880,101001338921,03/21/2015 12:56:54 PM,05/28/2015 08:30:00 AM,06/08/2015 11:17:20 AM,OVERDUE,Closed,Case Closed. Closed date : 2015-06-08 11:17:20.413 Case Resolved cart requested filled new cart #0415302533 06/04/2015,Request for Recycling Cart,Public Works Department,Recycling,Request for Recycling Cart,PWDx_Recycling,PWDx,,,688 E Second St  South Boston  MA  02127,6.0,05,2.0,C6,South Boston / South Boston Waterfront,5.0,Ward 6,605.0,R1,688 E Second St,2127.0,Address,124440.0,42.3375,-71.0358,Constituent Call,"(42.3375, -71.0358)"
538150,101001339346,03/23/2015 08:08:46 AM,04/13/2015 08:30:00 AM,04/03/2015 11:34:47 AM,ONTIME,Closed,Case Closed Case Resolved new cart swapped new cart # 0514000671 04/02/15,Request for Recycling Cart,Public Works Department,Recycling,Request for Recycling Cart,PWDx_Recycling,PWDx,,,32 Leland St  Jamaica Plain  MA  02130,12.0,02,6.0,E13,Jamaica Plain,10.0,Ward 19,1907.0,CM,32 Leland St,2130.0,Address,85027.0,42.2973,-71.1129,Self Service,"(42.2973, -71.1129)"
538190,101001339419,03/23/2015 08:57:23 AM,04/13/2015 08:57:23 AM,04/08/2015 01:50:59 PM,ONTIME,Closed,Case Closed Case Resolved new cart swapped new cart # 0514000579 04/07/15,Request for Recycling Cart,Public Works Department,Recycling,Request for Recycling Cart,PWDx_Recycling,PWDx,,,12 Riley Rd  Hyde Park  MA  02136,12.0,08,5.0,E18,Hyde Park,10.0,Ward 18,1820.0,R1,12 Riley Rd,2136.0,Address,116076.0,42.2369,-71.1289,Constituent Call,"(42.2369, -71.1289)"
538201,101001339434,03/23/2015 09:08:04 AM,05/28/2015 09:08:00 AM,06/05/2015 08:35:56 AM,OVERDUE,Closed,Case Closed. Closed date : 2015-06-05 08:35:56.587 Case Resolved Cart requested filled new cart #0415313572 05/18/2015,Request for Recycling Cart,Public Works Department,Recycling,Request for Recycling Cart,PWDx_Recycling,PWDx,,,195 Brooks St  East Boston  MA  02128,1.0,09,1.0,A7,East Boston,1.0,Ward 1,108.0,R3,195 Brooks St,2128.0,Address,22469.0,42.3803,-71.0359,Constituent Call,"(42.3803, -71.0359)"
538231,101001339470,03/23/2015 09:26:34 AM,04/13/2015 09:26:33 AM,04/09/2015 01:04:45 PM,ONTIME,Closed,Case Closed Case Resolved broken cart swapped new cart number #0514000085 04/08/2015,Request for Recycling Cart,Public Works Department,Recycling,Request for Recycling Cart,PWDx_Recycling,PWDx,,,511 E Seventh St  South Boston  MA  02127,6.0,05,2.0,C6,South Boston / South Boston Waterfront,5.0,Ward 7,702.0,R2,511 E Seventh St,2127.0,Address,125364.0,42.3321,-71.0401,Constituent Call,"(42.3321, -71.0401)"
538258,101001339510,03/23/2015 09:51:02 AM,05/28/2015 09:51:00 AM,05/01/2015 01:11:17 PM,ONTIME,Closed,Case Closed Case Resolved cart requested filled new cart#0714423853 04/30/2015,Request for Recycling Cart,Public Works Department,Recycling,Request for Recycling Cart,PWDx_Recycling,PWDx,,,105 Marlborough St  Boston  MA  02116,4.0,1C,8.0,D4,Back Bay,14.0,Ward 5,507.0,CM,105 Marlborough St,2116.0,Address,90306.0,42.3535,-71.077,Constituent Call,"(42.3535, -71.077)"
538322,101001339597,03/23/2015 10:36:08 AM,04/13/2015 10:36:08 AM,04/08/2015 01:36:00 PM,ONTIME,Closed,Case Closed Case Resolved new cart swapped new cart # 0514000582 04/06/2015,Request for Recycling Cart,Public Works Department,Recycling,Request for Recycling Cart,PWDx_Recycling,PWDx,,,28 Castleton St  Jamaica Plain  MA  02130,9.0,02,6.0,E13,Jamaica Plain,11.0,Ward 10,1009.0,R2,28 Castleton St,2130.0,Address,26393.0,42.3232,-71.1144,Self Service,"(42.3232, -71.1144)"
538323,101001339598,03/23/2015 10:38:36 AM,04/13/2015 10:38:36 AM,04/07/2015 12:18:19 PM,ONTIME,Closed,Case Closed Case Resolved new cart swapped new cart #05140000817 04/06/15,Request for Recycling Cart,Public Works Department,Recycling,Request for Recycling Cart,PWDx_Recycling,PWDx,,,139 Maple St  West Roxbury  MA  02132,12.0,06,6.0,E5,West Roxbury,12.0,Ward 20,2018.0,R1,139 Maple St,2132.0,Address,89298.0,42.2912,-71.157,Constituent Call,"(42.2912, -71.157)"
538354,101001339642,03/23/2015 11:13:33 AM,04/13/2015 11:13:33 AM,04/21/2015 09:41:48 AM,OVERDUE,Closed,Case Closed Case Resolved Cart requested swapped out new cart #0714423950 04/15/2015,Request for Recycling Cart,Public Works Department,Recycling,Request for Recycling Cart,PWDx_Recycling,PWDx,,,91 Webster St  East Boston  MA  02128,1.0,09,1.0,A7,East Boston,1.0,Ward 1,103.0,CM,91 Webster St,2128.0,Address,146941.0,42.3667,-71.0373,Constituent Call,"(42.3667, -71.0373)"
538355,101001339645,03/23/2015 11:14:49 AM,05/28/2015 11:14:00 AM,06/03/2015 01:13:42 PM,OVERDUE,Closed,Case Closed. Closed date : 2015-06-03 13:13:42.503 Case Resolved cart requested filled new cart #0415302654 05/29/2015,Request for Recycling Cart,Public Works Department,Recycling,Request for Recycling Cart,PWDx_Recycling,PWDx,,,28 I St  South Boston  MA  02127,6.0,05,2.0,C6,South Boston / South Boston Waterfront,5.0,Ward 6,605.0,CM,28 I St,2127.0,Address,166547.0,42.3371,-71.0398,Constituent Call,"(42.3371, -71.0398)"
538356,101001339646,03/23/2015 11:14:58 AM,04/13/2015 11:14:58 AM,04/08/2015 01:46:45 PM,ONTIME,Closed,Case Closed Case Resolved new cart swapped new cart # 0514000818 04/07/15,Request for Recycling Cart,Public Works Department,Recycling,Request for Recycling Cart,PWDx_Recycling,PWDx,,,709 E Fifth St  South Boston  MA  02127,6.0,05,2.0,C6,South Boston / South Boston Waterfront,5.0,Ward 6,608.0,CD,709 E Fifth St,2127.0,Address,58012.0,42.3339,-71.0318,Self Service,"(42.3339, -71.0318)"
538358,101001339648,03/23/2015 11:16:49 AM,04/13/2015 11:16:49 AM,04/24/2015 09:59:54 AM,OVERDUE,Closed,Case Closed Case Resolved cart requested filled new cart # 0814423875 04/17/2015,Request for Recycling Cart,Public Works Department,Recycling,Request for Recycling Cart,PWDx_Recycling,PWDx,,,90 Lonsdale St  Dorchester  MA  02124,8.0,07,3.0,C11,Dorchester,7.0,Ward 16,1604.0,R3,90 Lonsdale St,2124.0,Address,266270.0,42.2912,-71.0589,Employee Generated,"(42.2912, -71.0589)"
538363,101001339654,03/23/2015 11:22:15 AM,04/13/2015 11:22:15 AM,04/15/2015 01:49:53 PM,OVERDUE,Closed,Case Closed Case Resolved Cart request has been filled new cart number is #0714423861 04/14/2014,Request for Recycling Cart,Public Works Department,Recycling,Request for Recycling Cart,PWDx_Recycling,PWDx,,,589 Tremont St  Roxbury  MA  02118,4.0,1C,2.0,D4,South End,6.0,Ward 4,401.0,CM,589 Tremont St,2118.0,Address,137706.0,42.3434,-71.0731,Employee Generated,"(42.3434, -71.0731)"
538368,101001339661,03/23/2015 11:31:15 AM,04/13/2015 11:31:15 AM,04/15/2015 01:50:29 PM,OVERDUE,Closed,Case Closed Case Resolved Cart request has been filled new cart number is #0714423837 04/14/2014,Request for Recycling Cart,Public Works Department,Recycling,Request for Recycling Cart,PWDx_Recycling,PWDx,,,182 W Brookline St  Roxbury  MA  02118,4.0,1C,2.0,D4,South End,6.0,Ward 4,403.0,R4,182 W Brookline St,2118.0,Address,198074.0,42.3429,-71.0764,Constituent Call,"(42.3429, -71.0764)"
538383,101001339678,03/23/2015 11:39:57 AM,04/13/2015 11:39:57 AM,04/08/2015 01:50:24 PM,ONTIME,Closed,Case Closed Case Resolved new cart swapped new cart # 0514000179 04/07/15,Request for Recycling Cart,Public Works Department,Recycling,Request for Recycling Cart,PWDx_Recycling,PWDx,,,7 Samoset St  Dorchester  MA  02124,8.0,07,3.0,C11,Dorchester,8.0,Ward 16,1603.0,R3,7 Samoset St,2124.0,Address,305421.0,42.2919,-71.0652,Constituent Call,"(42.2919, -71.0652)"
538393,101001339695,03/23/2015 11:47:00 AM,05/28/2015 11:47:00 AM,06/08/2015 11:07:54 AM,OVERDUE,Closed,Case Closed. Closed date : 2015-06-08 11:07:54.867 Case Resolved cart requested filled new cart #0415302460 06/05/2015,Request for Recycling Cart,Public Works Department,Recycling,Request for Recycling Cart,PWDx_Recycling,PWDx,,,61 Saint Andrew Rd  East Boston  MA  02128,1.0,09,1.0,A7,East Boston,1.0,01,112.0,RL,61 Saint Andrew Rd,2128.0,Address,120583.0,42.3843,-71.0025,Employee Generated,"(42.3843, -71.0025)"
538398,101001339699,03/23/2015 11:49:28 AM,04/13/2015 11:49:28 AM,04/27/2015 01:43:30 PM,OVERDUE,Closed,Case Closed Case Resolved RECYCLING CART REQUEST FILLED NEW CART # 0415302214 04/25/2015,Request for Recycling Cart,Public Works Department,Recycling,Request for Recycling Cart,PWDx_Recycling,PWDx,,,31 Running Brook Rd  West Roxbury  MA  02132,12.0,06,6.0,E5,West Roxbury,10.0,Ward 20,2003.0,R1,31 Running Brook Rd,2132.0,Address,119493.0,42.2646,-71.1511,Constituent Call,"(42.2646, -71.1511)"
538405,101001339708,03/23/2015 11:54:31 AM,04/13/2015 11:54:31 AM,04/07/2015 11:16:39 AM,ONTIME,Closed,Case Closed Case Resolved new cart swapped new cart #051400423 04/06/2015,Request for Recycling Cart,Public Works Department,Recycling,Request for Recycling Cart,PWDx_Recycling,PWDx,,,11 Anson St  Jamaica Plain  MA  02130,9.0,02,6.0,E13,Jamaica Plain,11.0,Ward 11,1110.0,R3,11 Anson St,2130.0,Address,178538.0,42.3029,-71.1139,Employee Generated,"(42.3029, -71.1139)"
538409,101001339711,03/23/2015 11:54:53 AM,04/13/2015 11:54:53 AM,04/17/2015 03:11:38 PM,OVERDUE,Closed,Case Closed Case Resolved cart requested swapped new cart # 0714423870 04/16/2015,Request for Recycling Cart,Public Works Department,Recycling,Request for Recycling Cart,PWDx_Recycling,PWDx,,,38 Creighton St  Jamaica Plain  MA  02130,9.0,10A,8.0,E13,Jamaica Plain,11.0,Ward 10,1008.0,R2,38 Creighton St,2130.0,Address,44168.0,42.3237,-71.1081,Constituent Call,"(42.3237, -71.1081)"
538414,101001339717,03/23/2015 11:57:07 AM,04/13/2015 11:57:07 AM,04/22/2015 02:19:33 PM,OVERDUE,Closed,Case Closed Case Resolved cart requested swapped out new cart #0714424029 04/15/2015,Request for Recycling Cart,Public Works Department,Recycling,Request for Recycling Cart,PWDx_Recycling,PWDx,,,37 Gallivan Blvd  Dorchester  MA  02124,8.0,07,3.0,B3,Dorchester,7.0,Ward 17,1712.0,R2,37 Gallivan Blvd,2124.0,Address,239119.0,42.2782,-71.0773,Constituent Call,"(42.2782, -71.0773)"
538417,101001339720,03/23/2015 11:57:44 AM,04/13/2015 11:57:44 AM,04/06/2015 12:18:12 PM,ONTIME,Closed,Case Closed Case Resolved new cart swapped new cart #051400712 04/03/2015,Request for Recycling Cart,Public Works Department,Recycling,Request for Recycling Cart,PWDx_Recycling,PWDx,,,22 Dalrymple St  Jamaica Plain  MA  02130,9.0,02,6.0,E13,Jamaica Plain,11.0,Ward 11,1104.0,R3,22 Dalrymple St,2130.0,Address,45792.0,42.3153,-71.1016,Employee Generated,"(42.3153, -71.1016)"
538422,101001339725,03/23/2015 11:59:26 AM,04/13/2015 11:59:26 AM,04/14/2015 01:19:53 PM,OVERDUE,Closed,Case Closed Case Resolved broken cart swapped new cart #0714424072 04/13/2015,Request for Recycling Cart,Public Works Department,Recycling,Request for Recycling Cart,PWDx_Recycling,PWDx,,,617 Morton St  Mattapan  MA  02126,8.0,07,4.0,B3,Greater Mattapan,9.0,Ward 14,1411.0,CM,617 Morton St,2126.0,Address,97730.0,42.2866,-71.0938,Employee Generated,"(42.2866, -71.0938)"
538425,101001339734,03/23/2015 12:04:52 PM,04/13/2015 12:04:52 PM,04/08/2015 01:32:08 PM,ONTIME,Closed,Case Closed Case Resolved new cart swapped new cart # 0514000686 04/06/2015,Request for Recycling Cart,Public Works Department,Recycling,Request for Recycling Cart,PWDx_Recycling,PWDx,,,617 Morton St  Mattapan  MA  02126,8.0,07,4.0,B3,Greater Mattapan,9.0,Ward 14,1411.0,CM,617 Morton St,2126.0,Address,97730.0,42.2866,-71.0938,Constituent Call,"(42.2866, -71.0938)"
538427,101001339736,03/23/2015 12:10:15 PM,04/13/2015 12:10:15 PM,04/08/2015 09:11:39 AM,ONTIME,Closed,Case Closed Case Resolved new cart swapped new cart # 0714424049,Request for Recycling Cart,Public Works Department,Recycling,Request for Recycling Cart,PWDx_Recycling,PWDx,,,23 Warwick St  Mission Hill  MA  02120,7.0,10B,7.0,D4,Roxbury,13.0,Ward 9,904.0,R3,23 Warwick St,2120.0,Address,328921.0,42.3363,-71.0842,Constituent Call,"(42.3363, -71.0842)"
538428,101001339737,03/23/2015 12:11:26 PM,04/13/2015 12:11:26 PM,04/15/2015 01:46:40 PM,OVERDUE,Closed,Case Closed Case Resolved Cart request has been filled new cart number is #0714423840 04/14/2015,Request for Recycling Cart,Public Works Department,Recycling,Request for Recycling Cart,PWDx_Recycling,PWDx,,,33 Delle Ave  Mission Hill  MA  02120,9.0,10A,8.0,B2,Mission Hill,14.0,Ward 10,1002.0,R2,33 Delle Ave,2120.0,Address,223388.0,42.3312,-71.0987,Employee Generated,"(42.3312, -71.0987)"
538434,101001339743,03/23/2015 12:16:55 PM,04/13/2015 12:16:55 PM,04/16/2015 03:08:07 PM,OVERDUE,Closed,Case Closed Case Resolved cart requested has been filled new cart number is 0714424021 04/14/2015,Request for Recycling Cart,Public Works Department,Recycling,Request for Recycling Cart,PWDx_Recycling,PWDx,,,504 Talbot Ave  Dorchester  MA  02124,8.0,07,3.0,C11,Dorchester,8.0,Ward 16,1603.0,R3,504 Talbot Ave,2124.0,Address,317803.0,42.2882,-71.0653,Employee Generated,"(42.2882, -71.0653)"
538470,101001339788,03/23/2015 12:54:36 PM,04/13/2015 12:54:36 PM,04/08/2015 01:28:41 PM,ONTIME,Closed,Case Closed Case Resolved new cart swapped new cart # 0514000576 04/06/2015,Request for Recycling Cart,Public Works Department,Recycling,Request for Recycling Cart,PWDx_Recycling,PWDx,,,28 Draper St  Dorchester  MA  02122,7.0,03,4.0,C11,Dorchester,8.0,Ward 15,1505.0,R3,28 Draper St,2122.0,Address,49426.0,42.3023,-71.0639,Constituent Call,"(42.3023, -71.0639)"
538485,101001339805,03/23/2015 01:07:23 PM,04/13/2015 01:07:22 PM,04/17/2015 03:12:17 PM,OVERDUE,Closed,Case Closed Case Resolved cart requested swapped new cart # 0714423868 04/16/2015,Request for Recycling Cart,Public Works Department,Recycling,Request for Recycling Cart,PWDx_Recycling,PWDx,,,96 Day St  Jamaica Plain  MA  02130,9.0,10A,8.0,E13,Jamaica Plain,11.0,Ward 10,1008.0,R3,96 Day St,2130.0,Address,222690.0,42.3234,-71.1093,Constituent Call,"(42.3234, -71.1093)"
538504,101001339830,03/23/2015 01:21:44 PM,04/13/2015 01:21:44 PM,04/15/2015 01:56:10 PM,OVERDUE,Closed,Case Closed Case Resolved 14 Bickford doesnt exist no door number 14 04/14/2014,Request for Recycling Cart,Public Works Department,Recycling,Request for Recycling Cart,PWDx_Recycling,PWDx,,,14 Bickford St  Mission Hill  MA  02120,9.0,10A,6.0,B2,Mission Hill,11.0,Ward 10,1006.0,R2,14 Bickford St,2120.0,Address,15285.0,42.327,-71.1028,Constituent Call,"(42.327, -71.1028)"
538506,101001339832,03/23/2015 01:23:36 PM,05/28/2015 01:23:00 PM,04/30/2015 10:34:07 AM,ONTIME,Closed,Case Closed Case Resolved cart requested filled new cart #0714423768 04/29/2015,Request for Recycling Cart,Public Works Department,Recycling,Request for Recycling Cart,PWDx_Recycling,PWDx,,,27 Winthrop St  Charlestown  MA  02129,3.0,1A,1.0,A15,Charlestown,2.0,02,201.0,,27 Winthrop St,2129.0,Address,346819.0,42.3594,-71.0587,Employee Generated,"(0, 0)"
538507,101001339833,03/23/2015 01:23:41 PM,04/13/2015 01:23:41 PM,04/27/2015 01:07:06 PM,OVERDUE,Closed,Case Closed Case Resolved RECYCLING CART LIST REQUEST FILLED NEW CART #0514000569 04/17/2015,Request for Recycling Cart,Public Works Department,Recycling,Request for Recycling Cart,PWDx_Recycling,PWDx,,,31 Rugby Rd  Mattapan  MA  02126,8.0,08,5.0,E18,Greater Mattapan,10.0,Ward 18,1806.0,R2,31 Rugby Rd,2126.0,Address,119420.0,42.27,-71.1043,Constituent Call,"(42.27, -71.1043)"
538515,101001339843,03/23/2015 01:29:05 PM,05/28/2015 01:29:00 PM,06/02/2015 11:39:55 AM,OVERDUE,Closed,Case Closed. Closed date : 2015-06-02 11:39:55.257 Case Resolved cart requested filled new cart # 0415302681 06/01/2015,Request for Recycling Cart,Public Works Department,Recycling,Request for Recycling Cart,PWDx_Recycling,PWDx,,,242 Lexington St  East Boston  MA  02128,1.0,09,1.0,A7,East Boston,1.0,Ward 1,109.0,R3,242 Lexington St,2128.0,Address,264100.0,42.3802,-71.0312,Constituent Call,"(42.3802, -71.0312)"
538534,101001339871,03/23/2015 01:52:40 PM,04/13/2015 01:52:40 PM,04/16/2015 02:59:38 PM,OVERDUE,Closed,Case Closed Case Resolved cart requested has been filled new cart number is 101001339871 04/14/2015,Request for Recycling Cart,Public Works Department,Recycling,Request for Recycling Cart,PWDx_Recycling,PWDx,,,33 Ashcroft St  Jamaica Plain  MA  02130,9.0,02,6.0,E13,Jamaica Plain,11.0,Ward 19,1903.0,R2,33 Ashcroft St,2130.0,Address,5060.0,42.3201,-71.1141,Constituent Call,"(42.3201, -71.1141)"
538541,101001339879,03/23/2015 01:56:00 PM,04/13/2015 01:56:00 PM,04/16/2015 02:48:56 PM,OVERDUE,Closed,Case Closed Case Resolved cart requested has been filled new cart number is 0714423789 04/15/2015,Request for Recycling Cart,Public Works Department,Recycling,Request for Recycling Cart,PWDx_Recycling,PWDx,,,235 Main St  Charlestown  MA  02129,3.0,1A,1.0,A15,Charlestown,2.0,Ward 2,206.0,R1,235 Main St,2129.0,Address,88464.0,42.3768,-71.0658,Constituent Call,"(42.3768, -71.0658)"
538543,101001339882,03/23/2015 01:57:49 PM,04/13/2015 01:57:49 PM,04/09/2015 01:18:49 PM,ONTIME,Closed,Case Closed Case Resolved broken cart swapped new cart number #0514000128 04/08/2015,Request for Recycling Cart,Public Works Department,Recycling,Request for Recycling Cart,PWDx_Recycling,PWDx,,,24 Hollywood Rd  West Roxbury  MA  02132,9.0,06,6.0,E5,West Roxbury,12.0,Ward 20,2019.0,R1,24 Hollywood Rd,2132.0,Address,74743.0,42.296,-71.1488,Employee Generated,"(42.296, -71.1488)"
538544,101001339883,03/23/2015 01:59:22 PM,04/13/2015 01:59:22 PM,04/21/2015 09:16:24 AM,OVERDUE,Closed,Case Closed Case Resolved Cart requested swapped out new cart #0714423947 04/15/2015,Request for Recycling Cart,Public Works Department,Recycling,Request for Recycling Cart,PWDx_Recycling,PWDx,,,480 E Seventh St  South Boston  MA  02127,6.0,05,2.0,C6,South Boston / South Boston Waterfront,5.0,Ward 7,703.0,R2,480 E Seventh St,2127.0,Address,125316.0,42.3323,-71.0418,Constituent Call,"(42.3323, -71.0418)"
538550,101001339891,03/23/2015 02:03:00 PM,04/13/2015 02:03:00 PM,04/14/2015 01:23:31 PM,OVERDUE,Closed,Case Closed Case Resolved broken cart swapped new cart #0514000829 04/13/2015,Request for Recycling Cart,Public Works Department,Recycling,Request for Recycling Cart,PWDx_Recycling,PWDx,,,222 Paris St  East Boston  MA  02128,1.0,09,1.0,A7,East Boston,1.0,Ward 1,105.0,R3,222 Paris St,2128.0,Address,106515.0,42.375,-71.0349,Constituent Call,"(42.375, -71.0349)"
538576,101001339933,03/23/2015 02:48:11 PM,04/13/2015 02:48:11 PM,04/16/2015 03:05:21 PM,OVERDUE,Closed,Case Closed Case Resolved cart requested has been filled new cart number is 0714424026 04/14/2015,Request for Recycling Cart,Public Works Department,Recycling,Request for Recycling Cart,PWDx_Recycling,PWDx,,,16 Willet St  West Roxbury  MA  02132,12.0,06,6.0,E5,West Roxbury,12.0,20,2005.0,R1,16 Willet St,2132.0,Address,172401.0,42.2704,-71.1518,Constituent Call,"(42.2704, -71.1518)"
538580,101001339937,03/23/2015 02:49:25 PM,05/28/2015 02:49:00 PM,06/12/2015 10:51:36 AM,OVERDUE,Closed,Case Closed. Closed date : 2015-06-12 10:51:36.517 Case Resolved cart requested filled new cart # 0415302320 06/11/2015,Request for Recycling Cart,Public Works Department,Recycling,Request for Recycling Cart,PWDx_Recycling,PWDx,,,1281-1283 Dorchester Ave  Dorchester  MA  02122,7.0,03,3.0,C11,Dorchester,8.0,15,1504.0,C,1281-1283 Dorchester Ave,2122.0,Address,48275.0,42.3071,-71.0587,Constituent Call,"(42.3071, -71.0587)"
538583,101001339947,03/23/2015 03:03:25 PM,04/13/2015 03:03:24 PM,04/09/2015 01:05:17 PM,ONTIME,Closed,Case Closed Case Resolved broken cart swapped new cart number #0514000180 4/08/2015,Request for Recycling Cart,Public Works Department,Recycling,Request for Recycling Cart,PWDx_Recycling,PWDx,,,496 E Eighth St  South Boston  MA  02127,6.0,05,2.0,C6,South Boston / South Boston Waterfront,5.0,Ward 7,703.0,R3,496 E Eighth St,2127.0,Address,228807.0,42.3315,-71.0417,Self Service,"(42.3315, -71.0417)"
538646,101001340014,03/23/2015 03:44:56 PM,04/13/2015 03:44:56 PM,04/27/2015 01:41:07 PM,OVERDUE,Closed,Case Closed Case Resolved RECYCLING CART LIST REQUEST FILLED NEW CART #0415302210 04/25/2015,Request for Recycling Cart,Public Works Department,Recycling,Request for Recycling Cart,PWDx_Recycling,PWDx,,,77 F St  South Boston  MA  02127,6.0,05,2.0,C6,South Boston / South Boston Waterfront,5.0,Ward 7,704.0,R3,77 F St,2127.0,Address,55450.0,42.3351,-71.0495,Employee Generated,"(42.3351, -71.0495)"
538675,101001340053,03/23/2015 04:15:49 PM,04/13/2015 04:15:49 PM,04/15/2015 01:47:13 PM,OVERDUE,Closed,Case Closed Case Resolved Cart request has been filled new cart number is #0714423826 04/14/2014,Request for Recycling Cart,Public Works Department,Recycling,Request for Recycling Cart,PWDx_Recycling,PWDx,,,470 Commonwealth Ave  Boston  MA  02215,4.0,10A,8.0,D4,Fenway / Kenmore / Audubon Circle / Longwood,14.0,Ward 5,510.0,RC,470 Commonwealth Ave,2215.0,Address,40983.0,42.3485,-71.0936,Constituent Call,"(42.3485, -71.0936)"
538694,101001340077,03/23/2015 04:45:26 PM,04/13/2015 04:45:26 PM,04/22/2015 02:31:08 PM,OVERDUE,Closed,Case Closed Case Resolved cart requested swapped out new cart #0714423899 04/16/2015,Request for Recycling Cart,Public Works Department,Recycling,Request for Recycling Cart,PWDx_Recycling,PWDx,,,1086 Hyde Park Ave  Hyde Park  MA  02136,12.0,08,5.0,E18,Hyde Park,10.0,Ward 18,1814.0,R2,1086 Hyde Park Ave,2136.0,Address,257150.0,42.2621,-71.1215,Constituent Call,"(42.2621, -71.1215)"
538697,101001340081,03/23/2015 04:47:39 PM,04/13/2015 04:47:39 PM,04/09/2015 12:53:08 PM,ONTIME,Closed,Case Closed Case Resolved broken cart swapped new cart number #051400010 04/08/2015,Request for Recycling Cart,Public Works Department,Recycling,Request for Recycling Cart,PWDx_Recycling,PWDx,,,58 Glen Rd  Jamaica Plain  MA  02130,9.0,02,6.0,E13,Jamaica Plain,11.0,Ward 11,1107.0,R3,58 Glen Rd,2130.0,Address,241387.0,42.3087,-71.1012,Constituent Call,"(42.3087, -71.1012)"
538702,101001340086,03/23/2015 04:56:20 PM,04/13/2015 04:56:20 PM,04/08/2015 01:51:27 PM,ONTIME,Closed,Case Closed Case Resolved new cart swapped new cart # 0514000578 04/07/15,Request for Recycling Cart,Public Works Department,Recycling,Request for Recycling Cart,PWDx_Recycling,PWDx,,,19-20 Margin St  Hyde Park  MA  02136,12.0,08,5.0,E18,Hyde Park,10.0,Ward 18,1818.0,R2,19-20 Margin St,2136.0,Address,89675.0,42.2512,-71.124,Constituent Call,"(42.2512, -71.124)"
538704,101001340089,03/23/2015 04:58:20 PM,04/13/2015 04:58:20 PM,04/16/2015 03:10:25 PM,OVERDUE,Closed,Case Closed Case Resolved cart requested has been filled new cart number is 0714424023 04/14/2015,Request for Recycling Cart,Public Works Department,Recycling,Request for Recycling Cart,PWDx_Recycling,PWDx,,,21-22 Fulton St  Hyde Park  MA  02136,12.0,08,5.0,E18,Hyde Park,10.0,Ward 18,1818.0,R2,21-22 Fulton St,2136.0,Address,61496.0,42.2511,-71.1237,Constituent Call,"(42.2511, -71.1237)"
538716,101001340103,03/23/2015 05:18:49 PM,04/14/2015 08:30:00 AM,04/14/2015 01:03:44 PM,OVERDUE,Closed,Case Closed Case Resolved broken cart swapped new cart #0714424136 04/13/2015,Request for Recycling Cart,Public Works Department,Recycling,Request for Recycling Cart,PWDx_Recycling,PWDx,,,48 Newton St  Brighton  MA  02135,11.0,04,9.0,D14,Allston / Brighton,15.0,Ward 22,2211.0,CD,48 Newton St,2135.0,Address,102328.0,42.3568,-71.165,Employee Generated,"(42.3568, -71.165)"
538763,101001340175,03/23/2015 08:07:35 PM,04/14/2015 08:30:00 AM,04/14/2015 01:02:18 PM,OVERDUE,Closed,Case Closed Case Noted broken cart swapped new cart #0714424074 04/13/2015,Request for Recycling Cart,Public Works Department,Recycling,Request for Recycling Cart,PWDx_Recycling,PWDx,,,288 Washington St  Dorchester  MA  02121,7.0,03,4.0,C11,Dorchester,8.0,Ward 14,1404.0,R3,288 Washington St,2121.0,Address,146015.0,42.3009,-71.0754,Constituent Call,"(42.3009, -71.0754)"
538767,101001340179,03/23/2015 08:28:49 PM,05/29/2015 08:30:00 AM,06/12/2015 10:57:36 AM,OVERDUE,Closed,Case Closed. Closed date : 2015-06-12 10:57:36.077 Case Resolved cart requested filled new cart # 0415313501 06/11/2015,Request for Recycling Cart,Public Works Department,Recycling,Request for Recycling Cart,PWDx_Recycling,PWDx,,,366 Dorchester St  South Boston  MA  02127,6.0,05,2.0,C6,South Boston / South Boston Waterfront,5.0,Ward 7,706.0,CD,366 Dorchester St,2127.0,Address,49031.0,42.3302,-71.0553,Self Service,"(42.3302, -71.0553)"
538876,101001340340,03/24/2015 08:51:16 AM,04/14/2015 08:51:16 AM,04/16/2015 02:49:49 PM,OVERDUE,Closed,Case Closed Case Resolved cart requested has been filled new cart number is 0714423781 04/15/2015,Request for Recycling Cart,Public Works Department,Recycling,Request for Recycling Cart,PWDx_Recycling,PWDx,,,69 Tremont St  Charlestown  MA  02129,3.0,1A,1.0,A15,Charlestown,2.0,Ward 2,203.0,R1,69 Tremont St,2129.0,Address,136749.0,42.3755,-71.057,Constituent Call,"(42.3755, -71.057)"
538947,101001340430,03/24/2015 09:45:09 AM,04/14/2015 09:45:09 AM,04/07/2015 02:11:26 PM,ONTIME,Closed,Case Closed Case Resolved new cart swapped new cart #0714424276 04/01/2015,Request for Recycling Cart,Public Works Department,Recycling,Request for Recycling Cart,PWDx_Recycling,PWDx,,,27 Mount Vernon St  Charlestown  MA  02129,3.0,1A,1.0,A15,Charlestown,2.0,Ward 2,203.0,CM,27 Mount Vernon St,2129.0,Address,98845.0,42.3754,-71.0583,Constituent Call,"(42.3754, -71.0583)"
538959,101001340444,03/24/2015 09:52:58 AM,04/14/2015 09:52:58 AM,04/07/2015 02:57:46 PM,ONTIME,Closed,Case Closed Case Resolved new cart swapped new cart #0714424279 04/06/15,Request for Recycling Cart,Public Works Department,Recycling,Request for Recycling Cart,PWDx_Recycling,PWDx,,,27 Mount Vernon St  Charlestown  MA  02129,3.0,1A,1.0,A15,Charlestown,2.0,Ward 2,203.0,CD,27 Mount Vernon St,2129.0,Address,98847.0,42.3754,-71.0583,Constituent Call,"(42.3754, -71.0583)"
538966,101001340453,03/24/2015 09:59:15 AM,04/14/2015 09:59:14 AM,04/21/2015 09:18:08 AM,OVERDUE,Closed,Case Closed Case Resolved Cart requested swapped out new cart #0714423942 04/15/2015,Request for Recycling Cart,Public Works Department,Recycling,Request for Recycling Cart,PWDx_Recycling,PWDx,,,88 Leland Rd  Chestnut Hill  MA  02467,9.0,06,6.0,E5,West Roxbury,12.0,Ward 20,2006.0,R1,88 Leland Rd,2467.0,Address,85016.0,42.2983,-71.1434,Constituent Call,"(42.2983, -71.1434)"
538969,101001340457,03/24/2015 10:00:23 AM,04/14/2015 10:00:23 AM,04/24/2015 02:22:17 PM,OVERDUE,Closed,Case Closed Case Resolved Cart request filled new cart # 0714423764 04/23/2015,Request for Recycling Cart,Public Works Department,Recycling,Request for Recycling Cart,PWDx_Recycling,PWDx,,,20 Walnut Park  Roxbury  MA  02119,9.0,10B,7.0,E13,Roxbury,13.0,Ward 11,1103.0,CM,20 Walnut Park,2119.0,Address,141984.0,42.316,-71.0967,Constituent Call,"(42.316, -71.0967)"
538992,101001340484,03/24/2015 10:17:36 AM,05/28/2015 10:17:00 AM,06/04/2015 03:07:31 PM,OVERDUE,Closed,Case Closed. Closed date : 2015-06-04 15:07:31.31 Case Resolved Cart requested filled new cart #0415302352 05/29/15,Request for Recycling Cart,Public Works Department,Recycling,Request for Recycling Cart,PWDx_Recycling,PWDx,,,68 Westmoreland St  Dorchester  MA  02124,8.0,07,3.0,C11,Dorchester,7.0,Ward 16,1608.0,R2,68 Westmoreland St,2124.0,Address,148772.0,42.2842,-71.0588,Constituent Call,"(42.2842, -71.0588)"
538994,101001340487,03/24/2015 10:20:47 AM,05/28/2015 10:20:00 AM,06/05/2015 07:37:56 AM,OVERDUE,Closed,Case Closed. Closed date : 2015-06-05 07:37:56.133 Case Resolved Cart requested filled new cart #0415302494 06/02/2015,Request for Recycling Cart,Public Works Department,Recycling,Request for Recycling Cart,PWDx_Recycling,PWDx,,,122 Turtle Pond Pkwy  Hyde Park  MA  02136,12.0,08,5.0,E18,Hyde Park,10.0,Ward 18,1819.0,R1,122 Turtle Pond Pkwy,2136.0,Address,138667.0,42.2501,-71.1396,Employee Generated,"(42.2501, -71.1396)"
538995,101001340488,03/24/2015 10:20:52 AM,04/14/2015 10:20:52 AM,04/03/2015 12:03:14 PM,ONTIME,Closed,Case Closed Case Resolved New cart swapped new cart # 0514000673 04/02/15,Request for Recycling Cart,Public Works Department,Recycling,Request for Recycling Cart,PWDx_Recycling,PWDx,,,25 Brayton Rd  Brighton  MA  02135,11.0,04,9.0,D14,Allston / Brighton,15.0,Ward 22,2204.0,R2,25 Brayton Rd,2135.0,Address,195473.0,42.3473,-71.1684,Constituent Call,"(42.3473, -71.1684)"
538998,101001340492,03/24/2015 10:22:48 AM,04/14/2015 10:22:48 AM,04/22/2015 02:27:07 PM,OVERDUE,Closed,Case Closed Case Resolved cart requested swapped out new cart #0714423898 04/16/2015,Request for Recycling Cart,Public Works Department,Recycling,Request for Recycling Cart,PWDx_Recycling,PWDx,,,133 Metropolitan Ave  Roslindale  MA  02131,12.0,06,5.0,E5,Roslindale,10.0,Ward 18,1810.0,R1,133 Metropolitan Ave,2131.0,Address,94794.0,42.2792,-71.1301,Employee Generated,"(42.2792, -71.1301)"
538999,101001340493,03/24/2015 10:25:08 AM,04/14/2015 10:25:08 AM,04/06/2015 12:35:49 PM,ONTIME,Closed,Case Closed Case Resolved new cart swapped new cart #0514000745 04/03/15,Request for Recycling Cart,Public Works Department,Recycling,Request for Recycling Cart,PWDx_Recycling,PWDx,,,22 Gould St  West Roxbury  MA  02132,12.0,06,6.0,E5,West Roxbury,12.0,20,2016.0,,22 Gould St,2132.0,Address,345332.0,42.3594,-71.0587,Constituent Call,"(0, 0)"
539016,101001340513,03/24/2015 10:36:06 AM,04/14/2015 10:36:06 AM,04/16/2015 02:50:59 PM,OVERDUE,Closed,Case Closed Case Resolved cart requested has been filled new cart number is 0714427788 04/15/2015,Request for Recycling Cart,Public Works Department,Recycling,Request for Recycling Cart,PWDx_Recycling,PWDx,,,37 Mystic St  Charlestown  MA  02129,3.0,1A,1.0,A15,Charlestown,2.0,Ward 2,204.0,R3,37 Mystic St,2129.0,Address,100008.0,42.3805,-71.062,Employee Generated,"(42.3805, -71.062)"
539026,101001340527,03/24/2015 10:43:48 AM,04/14/2015 10:43:47 AM,04/17/2015 03:23:15 PM,OVERDUE,Closed,Case Closed Case Resolved cart requested swapped new cart # 0714423869 04/16/2015,Request for Recycling Cart,Public Works Department,Recycling,Request for Recycling Cart,PWDx_Recycling,PWDx,,,96 Day St  Jamaica Plain  MA  02130,9.0,10A,8.0,E13,Jamaica Plain,11.0,Ward 10,1008.0,R3,96 Day St,2130.0,Address,46747.0,42.3234,-71.1093,Constituent Call,"(42.3234, -71.1093)"
539027,101001340529,03/24/2015 10:46:07 AM,04/14/2015 10:46:07 AM,04/15/2015 01:47:47 PM,OVERDUE,Closed,Case Closed Case Resolved Cart request has been filled new cart number is #0714423952 04/14/2014,Request for Recycling Cart,Public Works Department,Recycling,Request for Recycling Cart,PWDx_Recycling,PWDx,,,63 Pontiac St  Mission Hill  MA  02120,9.0,10A,8.0,B2,Mission Hill,14.0,Ward 10,1003.0,R3,63 Pontiac St,2120.0,Address,111733.0,42.3308,-71.1021,Constituent Call,"(42.3308, -71.1021)"
539028,101001340531,03/24/2015 10:48:15 AM,04/14/2015 10:48:15 AM,04/16/2015 03:00:39 PM,OVERDUE,Closed,Case Closed Case Resolved cart requested has been filled new cart number is 0714424071 04/14/2015,Request for Recycling Cart,Public Works Department,Recycling,Request for Recycling Cart,PWDx_Recycling,PWDx,,,48-50 Seaverns Ave  Jamaica Plain  MA  02130,9.0,02,6.0,E13,Jamaica Plain,11.0,Ward 19,1906.0,CM,48-50 Seaverns Ave,2130.0,Address,124278.0,42.312,-71.1113,Constituent Call,"(42.312, -71.1113)"
539041,101001340551,03/24/2015 11:01:59 AM,04/14/2015 11:01:59 AM,04/14/2015 01:20:46 PM,OVERDUE,Closed,Case Closed Case Resolved broken cart swapped new cart #07144204076 04/13/2015,Request for Recycling Cart,Public Works Department,Recycling,Request for Recycling Cart,PWDx_Recycling,PWDx,,,35-41 Wilbert Rd  Dorchester  MA  02124,8.0,07,4.0,B3,Greater Mattapan,9.0,Ward 14,1409.0,A,35-41 Wilbert Rd,2124.0,Address,149651.0,42.2945,-71.0907,Constituent Call,"(42.2945, -71.0907)"
539053,101001340568,03/24/2015 11:13:33 AM,04/14/2015 11:13:33 AM,04/22/2015 02:31:43 PM,OVERDUE,Closed,Case Closed Case Resolved cart requested swapped out new cart #0714423900 04/16/2015,Request for Recycling Cart,Public Works Department,Recycling,Request for Recycling Cart,PWDx_Recycling,PWDx,,,1086 Hyde Park Ave  Hyde Park  MA  02136,12.0,08,5.0,E18,Hyde Park,10.0,Ward 18,1814.0,R2,1086 Hyde Park Ave,2136.0,Address,77028.0,42.2621,-71.1215,Constituent Call,"(42.2621, -71.1215)"
539064,101001340580,03/24/2015 11:21:47 AM,04/14/2015 11:21:47 AM,04/06/2015 12:26:04 PM,ONTIME,Closed,Case Closed Case Resolved new cart swapped new cart #0514000679 04/03/15,Request for Recycling Cart,Public Works Department,Recycling,Request for Recycling Cart,PWDx_Recycling,PWDx,,,5 Romsey St  Dorchester  MA  02125,7.0,03,3.0,C11,Dorchester,7.0,Ward 13,1308.0,R1,5 Romsey St,2125.0,Address,118175.0,42.3161,-71.0564,Employee Generated,"(42.3161, -71.0564)"
539068,101001340585,03/24/2015 11:28:03 AM,04/14/2015 11:28:03 AM,04/14/2015 01:24:11 PM,OVERDUE,Closed,Case Closed Case Resolved broken cart swapped new cart #0514000807 04/13/2015,Request for Recycling Cart,Public Works Department,Recycling,Request for Recycling Cart,PWDx_Recycling,PWDx,,,82 Eutaw St  East Boston  MA  02128,1.0,09,1.0,A7,East Boston,1.0,Ward 1,107.0,R1,82 Eutaw St,2128.0,Address,54738.0,42.3798,-71.0365,Employee Generated,"(42.3798, -71.0365)"
539071,101001340589,03/24/2015 11:31:35 AM,04/14/2015 11:31:35 AM,04/13/2015 02:29:05 PM,ONTIME,Closed,Case Closed Case Resolved BROKEN CART SWAPPED NEW CART #0514000812 4/10/15,Request for Recycling Cart,Public Works Department,Recycling,Request for Recycling Cart,PWDx_Recycling,PWDx,,,19 Holman St  Allston  MA  02134,11.0,04,9.0,D14,Allston / Brighton,15.0,Ward 22,2201.0,R2,19 Holman St,2134.0,Address,74769.0,42.3588,-71.1297,Constituent Call,"(42.3588, -71.1297)"
539072,101001340590,03/24/2015 11:31:47 AM,04/14/2015 11:31:47 AM,04/13/2015 02:33:25 PM,ONTIME,Closed,Case Closed Case Resolved BROKEN CART SWAPPED NEW CART #0514000811 04/10/2015,Request for Recycling Cart,Public Works Department,Recycling,Request for Recycling Cart,PWDx_Recycling,PWDx,,,19 Holman St  Allston  MA  02134,11.0,04,9.0,D14,Allston / Brighton,15.0,Ward 22,2201.0,R2,19 Holman St,2134.0,Address,74769.0,42.3588,-71.1297,Constituent Call,"(42.3588, -71.1297)"
539080,101001340598,03/24/2015 11:37:07 AM,04/14/2015 11:37:07 AM,04/07/2015 11:17:59 AM,ONTIME,Closed,Case Closed Case Resolved new cart swapped new cart #00514000682 04/06/2015,Request for Recycling Cart,Public Works Department,Recycling,Request for Recycling Cart,PWDx_Recycling,PWDx,,,23 Mossdale Rd  Jamaica Plain  MA  02130,9.0,02,6.0,E13,Jamaica Plain,11.0,Ward 19,1902.0,R1,23 Mossdale Rd,2130.0,Address,98006.0,42.3082,-71.1269,Constituent Call,"(42.3082, -71.1269)"
539095,101001340625,03/24/2015 11:48:31 AM,04/14/2015 11:48:31 AM,04/14/2015 02:40:59 PM,OVERDUE,Closed,Case Closed Case Resolved broken cart swapped new cart #0714423790 04/13/2015,Request for Recycling Cart,Public Works Department,Recycling,Request for Recycling Cart,PWDx_Recycling,PWDx,,,28 Copeland St  Roxbury  MA  02119,7.0,10B,7.0,B2,Roxbury,13.0,Ward 12,1201.0,R3,28 Copeland St,2119.0,Address,42447.0,42.3224,-71.0809,Employee Generated,"(42.3224, -71.0809)"
539107,101001340637,03/24/2015 11:54:53 AM,04/14/2015 11:54:53 AM,04/24/2015 02:14:56 PM,OVERDUE,Closed,Case Closed Case Resolved Cart request filled new cart # 0514000032 04/23/2015,Request for Recycling Cart,Public Works Department,Recycling,Request for Recycling Cart,PWDx_Recycling,PWDx,,,48 Evelyn St  Mattapan  MA  02126,8.0,07,4.0,B3,Greater Mattapan,9.0,Ward 14,1414.0,R3,48 Evelyn St,2126.0,Address,54878.0,42.2793,-71.0908,Employee Generated,"(42.2793, -71.0908)"
539109,101001340642,03/24/2015 11:56:37 AM,04/14/2015 11:56:37 AM,04/14/2015 01:04:23 PM,OVERDUE,Closed,Case Closed Case Resolved broken cart swapped new cart #0714424140 04/13/2015,Request for Recycling Cart,Public Works Department,Recycling,Request for Recycling Cart,PWDx_Recycling,PWDx,,,129 Brooks St  Brighton  MA  02135,11.0,04,9.0,D14,Allston / Brighton,15.0,Ward 22,2207.0,R2,129 Brooks St,2135.0,Address,198122.0,42.3532,-71.1633,Constituent Call,"(42.3532, -71.1633)"
539113,101001340646,03/24/2015 11:58:31 AM,04/14/2015 11:58:31 AM,04/14/2015 01:24:54 PM,OVERDUE,Closed,Case Closed Case Resolved broken cart swapped new cart #0514000837 04/13/2015,Request for Recycling Cart,Public Works Department,Recycling,Request for Recycling Cart,PWDx_Recycling,PWDx,,,237 Trenton St  East Boston  MA  02128,1.0,09,1.0,A7,East Boston,1.0,Ward 1,109.0,CD,237 Trenton St,2128.0,Address,138361.0,42.3811,-71.0301,Employee Generated,"(42.3811, -71.0301)"
539116,101001340652,03/24/2015 12:01:15 PM,05/28/2015 12:01:00 PM,06/11/2015 02:19:59 PM,OVERDUE,Closed,Case Closed. Closed date : 2015-06-11 14:19:59.677 Case Resolved cart requested filled new cart#0415302364 06/09/2015,Request for Recycling Cart,Public Works Department,Recycling,Request for Recycling Cart,PWDx_Recycling,PWDx,,,84 Danny Rd  Hyde Park  MA  02136,12.0,08,5.0,E18,Hyde Park,10.0,Ward 18,1820.0,R1,84 Danny Rd,2136.0,Address,46201.0,42.2418,-71.1419,Constituent Call,"(42.2418, -71.1419)"
539125,101001340666,03/24/2015 12:08:29 PM,04/14/2015 12:08:29 PM,04/09/2015 01:17:03 PM,ONTIME,Closed,Case Closed Case Resolved broken cart swapped new cart number #0514000087 04/08/2015,Request for Recycling Cart,Public Works Department,Recycling,Request for Recycling Cart,PWDx_Recycling,PWDx,,,17 Gates St  South Boston  MA  02127,6.0,05,2.0,C6,South Boston / South Boston Waterfront,5.0,Ward 7,704.0,CD,17 Gates St,2127.0,Address,63034.0,42.3334,-71.0484,Constituent Call,"(42.3334, -71.0484)"
539134,101001340675,03/24/2015 12:16:51 PM,04/14/2015 12:16:51 PM,04/21/2015 09:00:14 AM,OVERDUE,Closed,Case Closed Case Resolved Cart requested swapped out new cart #0714423949 04/15/2015,Request for Recycling Cart,Public Works Department,Recycling,Request for Recycling Cart,PWDx_Recycling,PWDx,,,32 Brook Ave  Roxbury  MA  02119,7.0,03,7.0,B2,Roxbury,13.0,Ward 8,805.0,R2,32 Brook Ave,2119.0,Address,21847.0,42.3218,-71.0738,Constituent Call,"(42.3218, -71.0738)"
539137,101001340678,03/24/2015 12:18:40 PM,04/14/2015 12:18:40 PM,04/21/2015 09:11:53 AM,OVERDUE,Closed,Case Closed Case Resolved Cart requested swapped out new cart #0714424027 04/15/2015,Request for Recycling Cart,Public Works Department,Recycling,Request for Recycling Cart,PWDx_Recycling,PWDx,,,10-12 Ridgemont St  Allston  MA  02134,11.0,04,9.0,D14,Allston / Brighton,15.0,Ward 21,2109.0,R2,10-12 Ridgemont St,2134.0,Address,115917.0,42.3512,-71.1407,Constituent Call,"(42.3512, -71.1407)"
539138,101001340679,03/24/2015 12:18:47 PM,05/28/2015 12:18:00 PM,05/01/2015 01:11:44 PM,ONTIME,Closed,Case Closed Case Resolved cart requested filled new cart#0714423852 04/30/2015,Request for Recycling Cart,Public Works Department,Recycling,Request for Recycling Cart,PWDx_Recycling,PWDx,,,296 Commonwealth Ave  Boston  MA  02115,4.0,1C,8.0,D4,Back Bay,14.0,Ward 5,509.0,CM,296 Commonwealth Ave,2115.0,Address,40037.0,42.3496,-71.085,Constituent Call,"(42.3496, -71.085)"
539140,101001340681,03/24/2015 12:19:39 PM,04/14/2015 12:19:39 PM,04/07/2015 12:24:43 PM,ONTIME,Closed,Case Closed Case Resolved new cart swapped new cart #0514000820 04/06/2015,Request for Recycling Cart,Public Works Department,Recycling,Request for Recycling Cart,PWDx_Recycling,PWDx,,,121 Warren Ave  Hyde Park  MA  02136,12.0,08,5.0,E18,Hyde Park,10.0,18,1816.0,,121 Warren Ave,2136.0,Address,350898.0,42.3594,-71.0587,Constituent Call,"(0, 0)"
539141,101001340682,03/24/2015 12:20:36 PM,04/14/2015 12:20:36 PM,04/27/2015 01:20:50 PM,OVERDUE,Closed,Case Closed Case Resolved RECYCLING CART LIST REQUEST FILLED NEW CART #0415313523 04/23/2015,Request for Recycling Cart,Public Works Department,Recycling,Request for Recycling Cart,PWDx_Recycling,PWDx,,,12 Holden St  Dorchester  MA  02125,7.0,03,7.0,B2,Dorchester,13.0,Ward 7,710.0,R3,12 Holden St,2125.0,Address,74569.0,42.3188,-71.0644,Constituent Call,"(42.3188, -71.0644)"
539142,101001340683,03/24/2015 12:22:15 PM,04/14/2015 12:22:15 PM,04/03/2015 11:35:59 AM,ONTIME,Closed,Case Closed Case Resolved new cart swapped new cart # 0514000669,Request for Recycling Cart,Public Works Department,Recycling,Request for Recycling Cart,PWDx_Recycling,PWDx,,,5 Hillside Ave  Jamaica Plain  MA  02130,12.0,02,6.0,E13,Jamaica Plain,10.0,Ward 19,1907.0,R1,5 Hillside Ave,2130.0,Address,74144.0,42.2974,-71.1131,Employee Generated,"(42.2974, -71.1131)"
539145,101001340687,03/24/2015 12:24:29 PM,04/14/2015 12:24:29 PM,04/13/2015 02:39:25 PM,ONTIME,Closed,Case Closed Case Resolved BROKEN CART SWAPPED NEW CART #0514000832 04/10/2015,Request for Recycling Cart,Public Works Department,Recycling,Request for Recycling Cart,PWDx_Recycling,PWDx,,,41 Mansfield St  Allston  MA  02134,11.0,04,9.0,D14,Allston / Brighton,15.0,Ward 22,2202.0,R2,41 Mansfield St,2134.0,Address,267725.0,42.3586,-71.1312,Employee Generated,"(42.3586, -71.1312)"
539147,101001340691,03/24/2015 12:29:06 PM,04/14/2015 12:29:06 PM,04/07/2015 12:25:17 PM,ONTIME,Closed,Case Closed Case Resolved new cart swapped new cart # 04/06/2015,Request for Recycling Cart,Public Works Department,Recycling,Request for Recycling Cart,PWDx_Recycling,PWDx,,,7 Maynard St  Roslindale  MA  02131,12.0,08,5.0,E18,Roslindale,10.0,Ward 18,1809.0,R1,7 Maynard St,2131.0,Address,93297.0,42.2762,-71.1246,Employee Generated,"(42.2762, -71.1246)"
539148,101001340693,03/24/2015 12:31:15 PM,04/14/2015 12:31:15 PM,04/15/2015 01:51:28 PM,OVERDUE,Closed,Case Closed Case Resolved Cart request has been filled new cart number is #0714423839 04/14/2014,Request for Recycling Cart,Public Works Department,Recycling,Request for Recycling Cart,PWDx_Recycling,PWDx,,,177 W Brookline St  Roxbury  MA  02118,4.0,1C,2.0,D4,South End,6.0,Ward 4,401.0,CM,177 W Brookline St,2118.0,Address,22294.0,42.3429,-71.076,Constituent Call,"(42.3429, -71.076)"
539149,101001340698,03/24/2015 12:33:22 PM,04/14/2015 12:33:22 PM,04/09/2015 01:19:53 PM,ONTIME,Closed,Case Closed Case Resolved broken cart swapped new cart number #0514000081 04/08/2015,Request for Recycling Cart,Public Works Department,Recycling,Request for Recycling Cart,PWDx_Recycling,PWDx,,,77 Mora St  Dorchester  MA  02124,8.0,07,4.0,B3,Dorchester,9.0,Ward 17,1710.0,R3,77 Mora St,2124.0,Address,97287.0,42.282,-71.0747,Constituent Call,"(42.282, -71.0747)"
539151,101001340700,03/24/2015 12:35:25 PM,04/14/2015 12:35:25 PM,04/24/2015 10:05:47 AM,OVERDUE,Closed,Case Closed Case Resolved Cart requested filled new cart #0714423901 04/17/2015,Request for Recycling Cart,Public Works Department,Recycling,Request for Recycling Cart,PWDx_Recycling,PWDx,,,854 Dorchester Ave  Dorchester  MA  02125,6.0,03,2.0,C6,Dorchester,5.0,Ward 7,708.0,CD,854 Dorchester Ave,2125.0,Address,48758.0,42.3217,-71.0566,Employee Generated,"(42.3217, -71.0566)"
539153,101001340703,03/24/2015 12:37:29 PM,04/14/2015 12:37:29 PM,04/03/2015 12:03:50 PM,ONTIME,Closed,Case Closed Case Resolved New cart swapped new cart # 0514000672 04/02/15,Request for Recycling Cart,Public Works Department,Recycling,Request for Recycling Cart,PWDx_Recycling,PWDx,,,70 Brayton Rd  Brighton  MA  02135,11.0,04,9.0,D14,Allston / Brighton,15.0,Ward 22,2204.0,R2,70 Brayton Rd,2135.0,Address,195478.0,42.3485,-71.1701,Employee Generated,"(42.3485, -71.1701)"
539156,101001340709,03/24/2015 12:42:21 PM,04/14/2015 12:42:20 PM,04/07/2015 12:23:11 PM,ONTIME,Closed,Case Closed Case Resolved new cart swapped new cart #0514000815 04/06/15,Request for Recycling Cart,Public Works Department,Recycling,Request for Recycling Cart,PWDx_Recycling,PWDx,,,10 Avalon Rd  West Roxbury  MA  02132,12.0,06,6.0,E5,West Roxbury,12.0,Ward 20,2020.0,R1,10 Avalon Rd,2132.0,Address,6810.0,42.2921,-71.1592,Constituent Call,"(42.2921, -71.1592)"
539158,101001340711,03/24/2015 12:42:33 PM,04/14/2015 12:42:33 PM,04/06/2015 12:36:27 PM,ONTIME,Closed,Case Closed Case Resolved new cart swapped new cart #0514000714 04/03/15,Request for Recycling Cart,Public Works Department,Recycling,Request for Recycling Cart,PWDx_Recycling,PWDx,,,54 Stimson St  West Roxbury  MA  02132,12.0,06,6.0,E5,West Roxbury,12.0,Ward 20,2015.0,R1,54 Stimson St,2132.0,Address,130701.0,42.2604,-71.1593,Employee Generated,"(42.2604, -71.1593)"
539161,101001340714,03/24/2015 12:44:04 PM,04/14/2015 12:44:04 PM,04/14/2015 11:56:58 AM,ONTIME,Closed,Case Closed Case Resolved broken cart swapped new cart #07140024137 04/13/2015,Request for Recycling Cart,Public Works Department,Recycling,Request for Recycling Cart,PWDx_Recycling,PWDx,,,49 Hall St  Jamaica Plain  MA  02130,9.0,02,6.0,E13,Jamaica Plain,11.0,Ward 11,1110.0,CD,49 Hall St,2130.0,Address,68154.0,42.3047,-71.1126,Employee Generated,"(42.3047, -71.1126)"
539174,101001340730,03/24/2015 12:50:25 PM,04/14/2015 12:50:25 PM,04/09/2015 01:17:50 PM,ONTIME,Closed,Case Closed Case Resolved broken cart swapped new cart number #0514000084 04/08/2015,Request for Recycling Cart,Public Works Department,Recycling,Request for Recycling Cart,PWDx_Recycling,PWDx,,,53 Thomas Park  South Boston  MA  02127,6.0,05,2.0,C6,South Boston / South Boston Waterfront,5.0,Ward 7,703.0,CM,53 Thomas Park,2127.0,Address,135649.0,42.332,-71.0464,Constituent Call,"(42.332, -71.0464)"
539175,101001340731,03/24/2015 12:51:16 PM,04/14/2015 12:51:16 PM,04/08/2015 01:32:48 PM,ONTIME,Closed,Case Closed Case Resolved new cart swapped new cart # 0514000174 04/06/2015,Request for Recycling Cart,Public Works Department,Recycling,Request for Recycling Cart,PWDx_Recycling,PWDx,,,19 Snowden Way  Dorchester  MA  02124,8.0,07,4.0,B3,Dorchester,9.0,14,1411.0,RL,19 Snowden Way,2124.0,Address,155006.0,42.2906,-71.0928,Constituent Call,"(42.2906, -71.0928)"
539176,101001340732,03/24/2015 12:54:51 PM,04/14/2015 12:54:51 PM,04/08/2015 01:47:21 PM,ONTIME,Closed,Case Closed Case Resolved new cart swapped new cart # 0514000249 04/07/15,Request for Recycling Cart,Public Works Department,Recycling,Request for Recycling Cart,PWDx_Recycling,PWDx,,,836-838 E Fifth St  South Boston  MA  02127,6.0,05,2.0,C6,South Boston / South Boston Waterfront,5.0,Ward 6,609.0,R1,836-838 E Fifth St,2127.0,Address,58114.0,42.3342,-71.0268,Constituent Call,"(42.3342, -71.0268)"
539177,101001340733,03/24/2015 12:57:43 PM,04/14/2015 12:57:42 PM,04/21/2015 09:04:59 AM,OVERDUE,Closed,Case Closed Case Resolved Cart requested swapped out new cart #0714423941 04/15/2015,Request for Recycling Cart,Public Works Department,Recycling,Request for Recycling Cart,PWDx_Recycling,PWDx,,,9 Hartford St  Dorchester  MA  02125,7.0,03,7.0,B2,Roxbury,13.0,Ward 13,1304.0,R2,9 Hartford St,2125.0,Address,248275.0,42.3177,-71.0737,Employee Generated,"(42.3177, -71.0737)"
539178,101001340734,03/24/2015 12:57:51 PM,04/14/2015 12:57:51 PM,04/07/2015 12:23:44 PM,ONTIME,Closed,Case Closed Case Resolved new cart swapped new cart #0514000813 04/06/2015,Request for Recycling Cart,Public Works Department,Recycling,Request for Recycling Cart,PWDx_Recycling,PWDx,,,5 Welton Rd  West Roxbury  MA  02132,12.0,06,6.0,E5,West Roxbury,12.0,Ward 20,2013.0,R1,5 Welton Rd,2132.0,Address,147625.0,42.2831,-71.1617,Constituent Call,"(42.2831, -71.1617)"
539182,101001340741,03/24/2015 01:01:24 PM,05/28/2015 01:01:00 PM,06/12/2015 11:08:54 AM,OVERDUE,Closed,Case Closed. Closed date : 2015-06-12 11:08:54.487 Case Resolved cart requested filled new cart # 0415302319 06/11/2015,Request for Recycling Cart,Public Works Department,Recycling,Request for Recycling Cart,PWDx_Recycling,PWDx,,,11 Delmont St  Dorchester  MA  02122,8.0,07,3.0,C11,Dorchester,7.0,Ward 16,1609.0,R2,11 Delmont St,2122.0,Address,223449.0,42.2858,-71.0541,Employee Generated,"(42.2858, -71.0541)"
539185,101001340747,03/24/2015 01:04:25 PM,04/14/2015 01:04:25 PM,04/13/2015 02:44:31 PM,ONTIME,Closed,Case Closed Case Resolved BROKEN CART SWAPPED NEW CART #0154000801 04/10/2015,Request for Recycling Cart,Public Works Department,Recycling,Request for Recycling Cart,PWDx_Recycling,PWDx,,,43-45 Raymond St  Allston  MA  02134,11.0,04,9.0,D14,Allston / Brighton,15.0,Ward 22,2202.0,R2,43-45 Raymond St,2134.0,Address,114833.0,42.3612,-71.1323,Constituent Call,"(42.3612, -71.1323)"
539187,101001340749,03/24/2015 01:06:17 PM,04/14/2015 01:06:17 PM,04/14/2015 02:36:08 PM,OVERDUE,Closed,Case Closed Case Resolved,Request for Recycling Cart,Public Works Department,Recycling,Request for Recycling Cart,PWDx_Recycling,PWDx,,,101-103 Lamartine St  Jamaica Plain  MA  02130,9.0,10A,6.0,E13,Jamaica Plain,11.0,Ward 10,1007.0,CM,101-103 Lamartine St,2130.0,Address,83483.0,42.3198,-71.1031,Constituent Call,"(42.3198, -71.1031)"
539193,101001340755,03/24/2015 01:07:19 PM,04/14/2015 01:07:19 PM,04/08/2015 01:36:49 PM,ONTIME,Closed,Case Closed Case Resolved new cart swapped new cart # 0514000580 04/06/2015,Request for Recycling Cart,Public Works Department,Recycling,Request for Recycling Cart,PWDx_Recycling,PWDx,,,38 Dunster Rd  Jamaica Plain  MA  02130,9.0,02,6.0,E13,Jamaica Plain,11.0,Ward 19,1908.0,R2,38 Dunster Rd,2130.0,Address,50072.0,42.3101,-71.1183,Employee Generated,"(42.3101, -71.1183)"
539194,101001340757,03/24/2015 01:07:58 PM,04/14/2015 01:07:58 PM,04/27/2015 01:22:08 PM,OVERDUE,Closed,Case Closed Case Resolved RECYCLING CART LIST REQUEST FILLED NEW CART #0415313521 04/24/15,Request for Recycling Cart,Public Works Department,Recycling,Request for Recycling Cart,PWDx_Recycling,PWDx,,,16 Whitby Ter  Dorchester  MA  02125,7.0,03,3.0,C11,Dorchester,7.0,Ward 13,1309.0,R2,16 Whitby Ter,2125.0,Address,149162.0,42.3141,-71.0607,Constituent Call,"(42.3141, -71.0607)"
539195,101001340758,03/24/2015 01:08:04 PM,04/14/2015 01:08:04 PM,04/16/2015 03:01:13 PM,OVERDUE,Closed,Case Closed Case Resolved cart requested has been filled new cart number is 0714424025 04/14/2015,Request for Recycling Cart,Public Works Department,Recycling,Request for Recycling Cart,PWDx_Recycling,PWDx,,,38 Dunster Rd  Jamaica Plain  MA  02130,9.0,02,6.0,E13,Jamaica Plain,11.0,Ward 19,1908.0,R2,38 Dunster Rd,2130.0,Address,50072.0,42.3101,-71.1183,Employee Generated,"(42.3101, -71.1183)"
539196,101001340760,03/24/2015 01:08:49 PM,05/28/2015 01:08:00 PM,06/05/2015 07:30:05 AM,OVERDUE,Closed,Case Closed. Closed date : 2015-06-05 07:30:05.707 Case Resolved Cart requested filled new cart #0415302455 06/02/2015,Request for Recycling Cart,Public Works Department,Recycling,Request for Recycling Cart,PWDx_Recycling,PWDx,,,10 Grovenor Rd  Jamaica Plain  MA  02130,9.0,02,6.0,E13,Jamaica Plain,11.0,Ward 19,1905.0,CD,10 Grovenor Rd,2130.0,Address,67624.0,42.3141,-71.1147,Employee Generated,"(42.3141, -71.1147)"
539199,101001340763,03/24/2015 01:10:44 PM,04/14/2015 01:10:44 PM,04/21/2015 09:17:18 AM,OVERDUE,Closed,Case Closed Case Resolved Cart requested swapped out new cart #0714423977 04/15/2015,Request for Recycling Cart,Public Works Department,Recycling,Request for Recycling Cart,PWDx_Recycling,PWDx,,,557 E Seventh St  South Boston  MA  02127,6.0,05,2.0,C6,South Boston / South Boston Waterfront,5.0,Ward 7,702.0,R1,557 E Seventh St,2127.0,Address,125398.0,42.3321,-71.0382,Constituent Call,"(42.3321, -71.0382)"
539200,101001340764,03/24/2015 01:11:12 PM,04/14/2015 01:11:12 PM,04/16/2015 03:08:43 PM,OVERDUE,Closed,Case Closed Case Resolved cart requested has been filled new cart number is 0714424144 04/14/2015,Request for Recycling Cart,Public Works Department,Recycling,Request for Recycling Cart,PWDx_Recycling,PWDx,,,38 Alpha Rd  Dorchester  MA  02124,8.0,07,4.0,C11,Dorchester,9.0,Ward 17,1703.0,R2,38 Alpha Rd,2124.0,Address,177223.0,42.2956,-71.0691,Constituent Call,"(42.2956, -71.0691)"
539204,101001340770,03/24/2015 01:13:15 PM,05/28/2015 01:13:00 PM,06/12/2015 10:55:02 AM,OVERDUE,Closed,Case Closed. Closed date : 2015-06-12 10:55:02.303 Case Resolved cart requested filled new cart # 0415313495 06/11/2015,Request for Recycling Cart,Public Works Department,Recycling,Request for Recycling Cart,PWDx_Recycling,PWDx,,,14 Vinton St  South Boston  MA  02127,6.0,05,2.0,C6,South Boston / South Boston Waterfront,5.0,Ward 7,706.0,CD,14 Vinton St,2127.0,Address,140790.0,42.3301,-71.054,Constituent Call,"(42.3301, -71.054)"
539207,101001340773,03/24/2015 01:14:21 PM,04/14/2015 01:14:21 PM,04/22/2015 02:33:01 PM,OVERDUE,Closed,Case Closed Case Resolved cart requested swapped out new cart #0714423891 04/16/2015,Request for Recycling Cart,Public Works Department,Recycling,Request for Recycling Cart,PWDx_Recycling,PWDx,,,740 Saratoga St  East Boston  MA  02128,1.0,09,1.0,A7,East Boston,1.0,Ward 1,111.0,R3,740 Saratoga St,2128.0,Address,122779.0,42.3837,-71.018,Constituent Call,"(42.3837, -71.018)"
539213,101001340789,03/24/2015 01:26:29 PM,04/14/2015 01:26:29 PM,04/13/2015 02:45:18 PM,ONTIME,Closed,Case Closed Case Resolved BROKEN CART SWAPPED NEW CART #015400839 04/10/2015,Request for Recycling Cart,Public Works Department,Recycling,Request for Recycling Cart,PWDx_Recycling,PWDx,,,15 Litchfield St  Brighton  MA  02135,11.0,04,9.0,D14,Allston / Brighton,15.0,Ward 22,2205.0,R3,15 Litchfield St,2135.0,Address,265060.0,42.3586,-71.1413,Employee Generated,"(42.3586, -71.1413)"
539214,101001340790,03/24/2015 01:26:40 PM,04/14/2015 01:26:39 PM,04/16/2015 03:09:18 PM,OVERDUE,Closed,Case Closed Case Resolved cart requested has been filled new cart number is 0714424143 04/14/2015,Request for Recycling Cart,Public Works Department,Recycling,Request for Recycling Cart,PWDx_Recycling,PWDx,,,119-121 Whitfield St  Dorchester  MA  02124,8.0,07,4.0,B3,Dorchester,9.0,Ward 17,1703.0,R2,119-121 Whitfield St,2124.0,Address,149282.0,42.2936,-71.0749,Constituent Call,"(42.2936, -71.0749)"
539216,101001340792,03/24/2015 01:29:03 PM,04/14/2015 01:29:03 PM,04/09/2015 01:36:57 PM,ONTIME,Closed,Case Closed Case Resolved broken cart swapped new cart number #0514000088 04/08/15,Request for Recycling Cart,Public Works Department,Recycling,Request for Recycling Cart,PWDx_Recycling,PWDx,,,26 Bremen St  East Boston  MA  02128,1.0,09,1.0,A7,East Boston,1.0,Ward 1,103.0,R3,26 Bremen St,2128.0,Address,19844.0,42.3693,-71.0385,Employee Generated,"(42.3693, -71.0385)"
539219,101001340795,03/24/2015 01:30:35 PM,04/14/2015 01:30:34 PM,04/14/2015 01:21:25 PM,ONTIME,Closed,Case Closed Case Resolved broken cart swapped new cart #0714424073 04/13/2015,Request for Recycling Cart,Public Works Department,Recycling,Request for Recycling Cart,PWDx_Recycling,PWDx,,,20 Greenock St  Dorchester  MA  02124,8.0,07,4.0,B3,Greater Mattapan,9.0,Ward 14,1411.0,R3,20 Greenock St,2124.0,Address,66630.0,42.2901,-71.0904,Constituent Call,"(42.2901, -71.0904)"
539221,101001340797,03/24/2015 01:33:56 PM,04/14/2015 01:33:56 PM,04/16/2015 03:06:09 PM,OVERDUE,Closed,Case Closed Case Resolved cart requested has been filled new cart number is 0714424141 04/14/2015,Request for Recycling Cart,Public Works Department,Recycling,Request for Recycling Cart,PWDx_Recycling,PWDx,,,9 Gertrude Rd  West Roxbury  MA  02132,12.0,06,6.0,E5,West Roxbury,12.0,Ward 20,2014.0,R2,9 Gertrude Rd,2132.0,Address,63589.0,42.2805,-71.1492,Constituent Call,"(42.2805, -71.1492)"
539224,101001340801,03/24/2015 01:35:08 PM,04/14/2015 01:35:08 PM,04/09/2015 01:37:50 PM,ONTIME,Closed,Case Closed Case Resolved broken cart swapped new cart number #0514000086 04/08/2015,Request for Recycling Cart,Public Works Department,Recycling,Request for Recycling Cart,PWDx_Recycling,PWDx,,,96 Chelsea St  East Boston  MA  02128,1.0,09,1.0,A7,East Boston,1.0,Ward 1,104.0,R2,96 Chelsea St,2128.0,Address,206400.0,42.3724,-71.0362,Employee Generated,"(42.3724, -71.0362)"
539225,101001340803,03/24/2015 01:36:30 PM,04/14/2015 01:36:30 PM,04/14/2015 02:45:35 PM,OVERDUE,Closed,Case Closed Case Resolved broken cart swapped new cart #714424110 04/13/2015,Request for Recycling Cart,Public Works Department,Recycling,Request for Recycling Cart,PWDx_Recycling,PWDx,,,6 Baldwin Pl  Boston  MA  02113,3.0,1B,1.0,A1,Downtown / Financial District,3.0,Ward 3,304.0,R4,6 Baldwin Pl,2113.0,Address,7847.0,42.3647,-71.056,Constituent Call,"(42.3647, -71.056)"
539227,101001340806,03/24/2015 01:42:48 PM,04/14/2015 01:42:48 PM,04/24/2015 02:16:01 PM,OVERDUE,Closed,Case Closed Case Resolved Cart request filled new cart # 05140000027 04/23/2015,Request for Recycling Cart,Public Works Department,Recycling,Request for Recycling Cart,PWDx_Recycling,PWDx,,,526 Norfolk St  Mattapan  MA  02126,8.0,07,4.0,B3,Greater Mattapan,9.0,Ward 18,1802.0,R1,526 Norfolk St,2126.0,Address,103367.0,42.2785,-71.0896,Constituent Call,"(42.2785, -71.0896)"
539228,101001340807,03/24/2015 01:44:29 PM,04/14/2015 01:44:29 PM,04/27/2015 01:27:15 PM,OVERDUE,Closed,Case Closed Case Resolved RECYCLING CART LIST REQUEST FILLED NEW CART #0415313518 04/24/2015,Request for Recycling Cart,Public Works Department,Recycling,Request for Recycling Cart,PWDx_Recycling,PWDx,,,40 Mckone St  Dorchester  MA  02122,8.0,07,3.0,C11,Dorchester,7.0,Ward 16,1610.0,CD,40 Mckone St,2122.0,Address,93466.0,42.2908,-71.0475,Constituent Call,"(42.2908, -71.0475)"
539234,101001340815,03/24/2015 01:48:09 PM,04/14/2015 01:48:09 PM,04/07/2015 02:58:22 PM,ONTIME,Closed,Case Closed Case Resolved new cart swapped new cart #0714424293 04/06/15,Request for Recycling Cart,Public Works Department,Recycling,Request for Recycling Cart,PWDx_Recycling,PWDx,,,24 Mystic St  Charlestown  MA  02129,3.0,1A,1.0,A15,Charlestown,2.0,Ward 2,205.0,CM,24 Mystic St,2129.0,Address,99977.0,42.3799,-71.0627,Constituent Call,"(42.3799, -71.0627)"
539248,101001340833,03/24/2015 01:55:10 PM,04/14/2015 01:55:10 PM,04/06/2015 12:18:53 PM,ONTIME,Closed,Case Closed Case Resolved new cart swapped new cart #051400710 04/03/15,Request for Recycling Cart,Public Works Department,Recycling,Request for Recycling Cart,PWDx_Recycling,PWDx,,,4 Belmore Ter  Jamaica Plain  MA  02130,9.0,02,6.0,E13,Jamaica Plain,11.0,Ward 19,1901.0,CD,4 Belmore Ter,2130.0,Address,14184.0,42.3191,-71.1106,Constituent Call,"(42.3191, -71.1106)"
539250,101001340837,03/24/2015 01:57:22 PM,04/14/2015 01:57:22 PM,04/21/2015 08:53:41 AM,OVERDUE,Closed,Case Closed Case Resolved Cart requested swapped out new cart #071442046 04/03/2015,Request for Recycling Cart,Public Works Department,Recycling,Request for Recycling Cart,PWDx_Recycling,PWDx,,,30 Braddock Park  Boston  MA  02116,4.0,1C,2.0,D4,South End,6.0,Ward 4,403.0,R2,30 Braddock Park,2116.0,Address,194818.0,42.3443,-71.0791,Constituent Call,"(42.3443, -71.0791)"
539263,101001340851,03/24/2015 02:06:07 PM,05/28/2015 02:06:00 PM,06/12/2015 10:55:27 AM,OVERDUE,Closed,Case Closed. Closed date : 2015-06-12 10:55:27.033 Case Resolved cart requested filled new cart # 0415302419 06/11/2015,Request for Recycling Cart,Public Works Department,Recycling,Request for Recycling Cart,PWDx_Recycling,PWDx,,,49 M St  South Boston  MA  02127,6.0,05,2.0,C6,South Boston / South Boston Waterfront,5.0,Ward 6,607.0,CD,49 M St,2127.0,Address,88094.0,42.3364,-71.0336,Constituent Call,"(42.3364, -71.0336)"
539273,101001340863,03/24/2015 02:12:26 PM,04/14/2015 02:12:26 PM,04/22/2015 03:15:36 PM,OVERDUE,Closed,Case Closed Case Resolved cart requested swapped out new cart #0714423997 04/16/2015,Request for Recycling Cart,Public Works Department,Recycling,Request for Recycling Cart,PWDx_Recycling,PWDx,,,22 Philbrick St  Roslindale  MA  02131,12.0,02,5.0,E18,Roslindale,10.0,Ward 18,1807.0,R1,22 Philbrick St,2131.0,Address,109953.0,42.2861,-71.1178,Employee Generated,"(42.2861, -71.1178)"
539294,101001340886,03/24/2015 02:23:42 PM,04/14/2015 02:23:42 PM,04/14/2015 01:02:55 PM,ONTIME,Closed,Case Closed Case Resolved broken cart swapped new cart #0714424077 04/13/2015,Request for Recycling Cart,Public Works Department,Recycling,Request for Recycling Cart,PWDx_Recycling,PWDx,,,407 Seaver St  Dorchester  MA  02121,7.0,03,4.0,B3,Greater Mattapan,8.0,Ward 14,1406.0,R2,407 Seaver St,2121.0,Address,124192.0,42.3033,-71.0814,Employee Generated,"(42.3033, -71.0814)"
539314,101001340909,03/24/2015 02:45:05 PM,04/14/2015 02:45:05 PM,04/28/2015 10:31:38 AM,OVERDUE,Closed,Case Closed Duplicate of Existing Case  Reference# 101001360179 one per a household,Request for Recycling Cart,Public Works Department,Recycling,Request for Recycling Cart,PWDx_Recycling,PWDx,,,42 Chestnut Sq  Jamaica Plain  MA  02130,9.0,02,6.0,E13,Jamaica Plain,11.0,Ward 19,1904.0,CD,42 Chestnut Sq,2130.0,Address,31283.0,42.3146,-71.1072,Employee Generated,"(42.3146, -71.1072)"
539316,101001340911,03/24/2015 02:45:54 PM,04/14/2015 02:45:54 PM,04/14/2015 02:37:06 PM,ONTIME,Closed,Case Closed Case Resolved broken cart swapped new cart #0714423955 04/13/2015,Request for Recycling Cart,Public Works Department,Recycling,Request for Recycling Cart,PWDx_Recycling,PWDx,,,92 Day St  Jamaica Plain  MA  02130,9.0,10A,8.0,E13,Jamaica Plain,11.0,Ward 10,1008.0,R3,92 Day St,2130.0,Address,46742.0,42.3236,-71.1091,Constituent Call,"(42.3236, -71.1091)"
539319,101001340914,03/24/2015 02:50:42 PM,04/14/2015 02:50:41 PM,04/24/2015 01:57:29 PM,OVERDUE,Closed,Case Closed Case Resolved Cart request filled new cart # 0514000059 04/23/2015,Request for Recycling Cart,Public Works Department,Recycling,Request for Recycling Cart,PWDx_Recycling,PWDx,,,56 Gates St  South Boston  MA  02127,6.0,05,2.0,C6,South Boston / South Boston Waterfront,5.0,Ward 7,704.0,R3,56 Gates St,2127.0,Address,63087.0,42.3321,-71.0481,Constituent Call,"(42.3321, -71.0481)"
539322,101001340919,03/24/2015 02:55:36 PM,04/14/2015 02:55:36 PM,04/08/2015 01:46:02 PM,ONTIME,Closed,Case Closed Case Resolved new cart swapped new cart # 0514000524 04/07/15,Request for Recycling Cart,Public Works Department,Recycling,Request for Recycling Cart,PWDx_Recycling,PWDx,,,111 Sutherland Rd  Brighton  MA  02135,11.0,04,9.0,D14,Allston / Brighton,15.0,Ward 21,2114.0,CM,111 Sutherland Rd,2135.0,Address,132870.0,42.3398,-71.1482,Constituent Call,"(42.3398, -71.1482)"
539363,101001340977,03/24/2015 03:21:31 PM,04/14/2015 03:21:31 PM,04/14/2015 11:59:59 AM,ONTIME,Closed,Case Closed Case Resolved broken cart swapped new cart #0714424138 04/13/2015,Request for Recycling Cart,Public Works Department,Recycling,Request for Recycling Cart,PWDx_Recycling,PWDx,,,67 Hampstead Rd  Jamaica Plain  MA  02130,9.0,02,6.0,E13,Jamaica Plain,11.0,Ward 11,1110.0,R3,67 Hampstead Rd,2130.0,Address,245808.0,42.3041,-71.1173,Employee Generated,"(42.3041, -71.1173)"
539368,101001340989,03/24/2015 03:36:06 PM,04/14/2015 03:36:06 PM,03/24/2015 03:40:07 PM,ONTIME,Closed,Case Closed Duplicate of Existing Case Duplicate case in system,Request for Recycling Cart,Public Works Department,Recycling,Request for Recycling Cart,PWDx_Recycling,PWDx,,,1071 Centre St  Jamaica Plain  MA  02130,9.0,02,6.0,E13,Jamaica Plain,11.0,Ward 19,1902.0,R1,1071 Centre St,2130.0,Address,27519.0,42.3037,-71.1252,Constituent Call,"(42.3037, -71.1252)"
539369,101001340991,03/24/2015 03:37:57 PM,05/28/2015 03:37:00 PM,06/05/2015 07:31:09 AM,OVERDUE,Closed,Case Closed. Closed date : 2015-06-05 07:31:09.327 Case Resolved Cart requested filled new cart #0415302451 06/02/2015,Request for Recycling Cart,Public Works Department,Recycling,Request for Recycling Cart,PWDx_Recycling,PWDx,,,13 Parley Ave  Jamaica Plain  MA  02130,9.0,02,6.0,E13,Jamaica Plain,11.0,Ward 19,1905.0,CD,13 Parley Ave,2130.0,Address,108233.0,42.3148,-71.1133,Constituent Call,"(42.3148, -71.1133)"
539370,101001340993,03/24/2015 03:38:00 PM,05/29/2015 03:38:00 PM,06/09/2015 11:54:11 AM,OVERDUE,Closed,Case Closed. Closed date : 2015-06-09 11:54:11.177 Case Resolved cart requested filled new cart #0415302470 06/08/2015,Request for Recycling Cart,Public Works Department,Recycling,Request for Recycling Cart,PWDx_Recycling,PWDx,,,1071 Centre St  Jamaica Plain  MA  02130,9.0,02,6.0,E13,Jamaica Plain,11.0,Ward 19,1902.0,R1,1071 Centre St,2130.0,Address,27519.0,42.3037,-71.1252,Employee Generated,"(42.3037, -71.1252)"
539374,101001341000,03/24/2015 03:44:28 PM,04/14/2015 03:44:28 PM,04/07/2015 11:38:30 AM,ONTIME,Closed,Case Closed Case Resolved new cart swapped new cart #0514000683 04/06/2015,Request for Recycling Cart,Public Works Department,Recycling,Request for Recycling Cart,PWDx_Recycling,PWDx,,,109 Brooks St  Brighton  MA  02135,11.0,04,9.0,D14,Allston / Brighton,15.0,Ward 22,2207.0,R1,109 Brooks St,2135.0,Address,22363.0,42.3537,-71.1632,Employee Generated,"(42.3537, -71.1632)"
539378,101001341007,03/24/2015 03:54:52 PM,04/14/2015 03:54:52 PM,04/08/2015 01:43:06 PM,ONTIME,Closed,Case Closed Case Resolved new cart swapped new cart # 0514000821 04/07/2015,Request for Recycling Cart,Public Works Department,Recycling,Request for Recycling Cart,PWDx_Recycling,PWDx,,,43 Mount Bowdoin Ter  Dorchester  MA  02121,7.0,03,4.0,C11,Dorchester,8.0,Ward 14,1404.0,R2,43 Mount Bowdoin Ter,2121.0,Address,98099.0,42.3029,-71.0751,Constituent Call,"(42.3029, -71.0751)"
539380,101001341009,03/24/2015 03:56:03 PM,04/14/2015 03:56:03 PM,04/15/2015 01:48:26 PM,OVERDUE,Closed,Case Closed Case Resolved Cart request has been filled new cart number is #0714423836 04/14/2014,Request for Recycling Cart,Public Works Department,Recycling,Request for Recycling Cart,PWDx_Recycling,PWDx,,,1 Parker Hill Ter  Mission Hill  MA  02120,9.0,10A,8.0,B2,Mission Hill,11.0,Ward 10,1008.0,R3,1 Parker Hill Ter,2120.0,Address,108005.0,42.3316,-71.11,Constituent Call,"(42.3316, -71.11)"
539384,101001341013,03/24/2015 03:58:41 PM,04/14/2015 03:58:41 PM,04/15/2015 01:49:16 PM,OVERDUE,Closed,Case Closed Case Resolved Cart request has been filled new cart number is #0714423827 04/14/2014,Request for Recycling Cart,Public Works Department,Recycling,Request for Recycling Cart,PWDx_Recycling,PWDx,,,19 Parker Hill Ave  Mission Hill  MA  02120,9.0,10A,8.0,B2,Mission Hill,11.0,Ward 10,1008.0,R3,19 Parker Hill Ave,2120.0,Address,107960.0,42.3323,-71.1098,Constituent Call,"(42.3323, -71.1098)"
539411,101001341048,03/24/2015 04:46:23 PM,04/14/2015 04:46:23 PM,04/16/2015 03:06:45 PM,OVERDUE,Closed,Case Closed Case Resolved cart requested has been filled new cart number is 0714424028 04/14/2015,Request for Recycling Cart,Public Works Department,Recycling,Request for Recycling Cart,PWDx_Recycling,PWDx,,,49 Wren St  West Roxbury  MA  02132,12.0,06,6.0,E5,West Roxbury,12.0,Ward 20,2014.0,R1,49 Wren St,2132.0,Address,152914.0,42.2811,-71.152,Employee Generated,"(42.2811, -71.152)"
539413,101001341052,03/24/2015 04:50:53 PM,04/14/2015 04:50:53 PM,04/21/2015 09:06:12 AM,OVERDUE,Closed,Case Closed Case Resolved Cart requested swapped out new cart #0714423945 04/15/2015,Request for Recycling Cart,Public Works Department,Recycling,Request for Recycling Cart,PWDx_Recycling,PWDx,,,28 High St  Dorchester  MA  02122,7.0,03,3.0,C11,Dorchester,8.0,Ward 15,1504.0,R1,28 High St,2122.0,Address,73492.0,42.3092,-71.061,Constituent Call,"(42.3092, -71.061)"
539415,101001341056,03/24/2015 04:55:10 PM,04/14/2015 04:55:10 PM,04/07/2015 02:59:03 PM,ONTIME,Closed,Case Closed Case Resolved new cart swapped new cart # 0714424294 04/06/15,Request for Recycling Cart,Public Works Department,Recycling,Request for Recycling Cart,PWDx_Recycling,PWDx,,,82 School St  Charlestown  MA  02129,3.0,1A,1.0,A15,Charlestown,2.0,Ward 2,205.0,CD,82 School St,2129.0,Address,123823.0,42.3789,-71.0635,Employee Generated,"(42.3789, -71.0635)"
539459,101001341123,03/24/2015 06:29:59 PM,04/15/2015 08:30:00 AM,04/08/2015 01:48:06 PM,ONTIME,Closed,Case Closed Case Resolved new cart swapped new cart # 0514000182 04/07/15,Request for Recycling Cart,Public Works Department,Recycling,Request for Recycling Cart,PWDx_Recycling,PWDx,,,16 Willet St  West Roxbury  MA  02132,12.0,06,6.0,E5,West Roxbury,12.0,20,2005.0,R1,16 Willet St,2132.0,Address,172401.0,42.2704,-71.1518,Constituent Call,"(42.2704, -71.1518)"
539647,101001341373,03/25/2015 09:15:33 AM,04/15/2015 09:15:33 AM,03/26/2015 02:41:59 PM,ONTIME,Closed,Case Closed Case Resolved Constituent no longer wants a recycling cart.,Request for Recycling Cart,Public Works Department,Recycling,Request for Recycling Cart,PWDx_Recycling,PWDx,,,11 I St  South Boston  MA  02127,6.0,05,2.0,C6,South Boston / South Boston Waterfront,5.0,Ward 6,605.0,R3,11 I St,2127.0,Address,77742.0,42.3377,-71.0402,Constituent Call,"(42.3377, -71.0402)"
539648,101001341375,03/25/2015 09:16:01 AM,04/15/2015 09:16:01 AM,04/21/2015 09:42:20 AM,OVERDUE,Closed,Case Closed Case Resolved Cart requested swapped out new cart #071442348 04/15/2015,Request for Recycling Cart,Public Works Department,Recycling,Request for Recycling Cart,PWDx_Recycling,PWDx,,,464 Sumner St  East Boston  MA  02128,1.0,09,1.0,A7,East Boston,1.0,Ward 1,101.0,R3,464 Sumner St,2128.0,Address,316307.0,42.3655,-71.0316,Constituent Call,"(42.3655, -71.0316)"
539801,101001341558,03/25/2015 11:00:20 AM,05/29/2015 11:00:00 AM,06/11/2015 02:17:44 PM,OVERDUE,Closed,Case Closed. Closed date : 2015-06-11 14:17:44.7 Case Resolved cart requested filled new cart#0415002366 06/09/2015,Request for Recycling Cart,Public Works Department,Recycling,Request for Recycling Cart,PWDx_Recycling,PWDx,,,12 Moultrie St  Dorchester  MA  02124,8.0,07,4.0,C11,Dorchester,8.0,Ward 17,1706.0,R2,12 Moultrie St,2124.0,Address,278360.0,42.2918,-71.0681,Employee Generated,"(42.2918, -71.0681)"
539838,101001341601,03/25/2015 11:32:23 AM,05/29/2015 11:32:00 AM,08/20/2015 12:29:37 PM,OVERDUE,Closed,Case Closed Case Resolved  duplicated case under damaged cart request,Request for Recycling Cart,Public Works Department,Recycling,Request for Recycling Cart,PWDx_Recycling,PWDx,,,103-103A Litchfield St  Brighton  MA  02135,11.0,04,9.0,D14,Brighton,15.0,22,2202.0,,103-103A Litchfield St,2135.0,Address,347391.0,42.3594,-71.0587,Employee Generated,"(0, 0)"
539845,101001341609,03/25/2015 11:36:35 AM,04/15/2015 11:36:35 AM,04/07/2015 02:59:53 PM,ONTIME,Closed,Case Closed Case Resolved new cart swapped new cart #0714424295 04/06/15,Request for Recycling Cart,Public Works Department,Recycling,Request for Recycling Cart,PWDx_Recycling,PWDx,,,48 Rutherford Ave  Charlestown  MA  02129,3.0,1A,1.0,A15,Charlestown,2.0,02,201.0,,48 Rutherford Ave,2129.0,Address,343273.0,42.3594,-71.0587,Self Service,"(0, 0)"
539849,101001341616,03/25/2015 11:42:34 AM,04/15/2015 11:42:33 AM,04/08/2015 01:48:38 PM,ONTIME,Closed,Case Closed Case Resolved new cart swapped new cart # 0514000583 04/07/16,Request for Recycling Cart,Public Works Department,Recycling,Request for Recycling Cart,PWDx_Recycling,PWDx,,,150 Aldrich St  Roslindale  MA  02131,12.0,06,5.0,E5,Roslindale,10.0,Ward 20,2008.0,R1,150 Aldrich St,2131.0,Address,1832.0,42.2818,-71.144,Constituent Call,"(42.2818, -71.144)"
539874,101001341642,03/25/2015 11:56:24 AM,04/15/2015 11:56:24 AM,04/06/2015 12:31:30 PM,ONTIME,Closed,Case Closed Case Resolved new cart swapped new cart #0514000717 04/03/15,Request for Recycling Cart,Public Works Department,Recycling,Request for Recycling Cart,PWDx_Recycling,PWDx,,,3 Lovis St  South Boston  MA  02127,6.0,05,2.0,C6,South Boston / South Boston Waterfront,5.0,Ward 6,603.0,R1,3 Lovis St,2127.0,Address,87685.0,42.3369,-71.0509,Employee Generated,"(42.3369, -71.0509)"
539877,101001341646,03/25/2015 11:57:41 AM,04/15/2015 11:57:41 AM,04/06/2015 12:32:07 PM,ONTIME,Closed,Case Closed Case Resolved new cart swapped new cart #0514000718 04/03/15,Request for Recycling Cart,Public Works Department,Recycling,Request for Recycling Cart,PWDx_Recycling,PWDx,,,267 E St  South Boston  MA  02127,6.0,05,2.0,C6,South Boston / South Boston Waterfront,5.0,Ward 6,603.0,CM,267 E St,2127.0,Address,50572.0,42.3362,-71.0509,Constituent Call,"(42.3362, -71.0509)"
539892,101001341662,03/25/2015 12:02:26 PM,04/15/2015 12:02:24 PM,04/08/2015 01:43:48 PM,ONTIME,Closed,Case Closed Case Resolved new cart swapped new cart #  0514000756 04/07/2015,Request for Recycling Cart,Public Works Department,Recycling,Request for Recycling Cart,PWDx_Recycling,PWDx,,,95 Mount Ida Rd  Dorchester  MA  02122,7.0,03,3.0,C11,Dorchester,8.0,Ward 15,1509.0,R3,95 Mount Ida Rd,2122.0,Address,98360.0,42.3038,-71.0635,Constituent Call,"(42.3038, -71.0635)"
539931,101001341704,03/25/2015 12:19:35 PM,04/15/2015 12:19:35 PM,04/28/2015 11:01:20 AM,OVERDUE,Closed,Case Closed Duplicate of Existing Case  reference case# 101001350454,Request for Recycling Cart,Public Works Department,Recycling,Request for Recycling Cart,PWDx_Recycling,PWDx,,,66 Imbaro Rd  Hyde Park  MA  02136,12.0,08,5.0,E18,Hyde Park,10.0,Ward 18,1819.0,R1,66 Imbaro Rd,2136.0,Address,78016.0,42.2429,-71.1385,Employee Generated,"(42.2429, -71.1385)"
539933,101001341706,03/25/2015 12:19:57 PM,04/15/2015 12:19:57 PM,04/13/2015 02:18:58 PM,ONTIME,Closed,Case Closed Case Resolved BROKEN CART SWAPPED NEW CART #0514000810 04/10/2015,Request for Recycling Cart,Public Works Department,Recycling,Request for Recycling Cart,PWDx_Recycling,PWDx,,,5 Haverford St  Jamaica Plain  MA  02130,9.0,02,6.0,E13,Jamaica Plain,11.0,Ward 11,1106.0,R3,5 Haverford St,2130.0,Address,71337.0,42.3119,-71.1028,Constituent Call,"(42.3119, -71.1028)"
539942,101001341716,03/25/2015 12:25:22 PM,04/15/2015 12:25:22 PM,04/09/2015 01:20:30 PM,ONTIME,Closed,Case Closed Case Resolved broken cart swapped new cart number #0514000089 04/08/2015,Request for Recycling Cart,Public Works Department,Recycling,Request for Recycling Cart,PWDx_Recycling,PWDx,,,18 Fendale Ave  Dorchester  MA  02124,8.0,07,3.0,B3,Dorchester,7.0,Ward 17,1704.0,R2,18 Fendale Ave,2124.0,Address,57334.0,42.279,-71.0708,Employee Generated,"(42.279, -71.0708)"
539948,101001341722,03/25/2015 12:27:52 PM,04/15/2015 12:27:52 PM,04/14/2015 02:41:41 PM,ONTIME,Closed,Case Closed Case Resolved broken cart swapped new cart #714423829 04/13/2015,Request for Recycling Cart,Public Works Department,Recycling,Request for Recycling Cart,PWDx_Recycling,PWDx,,,17 Dorr St  Roxbury  MA  02119,7.0,10B,7.0,B2,Roxbury,13.0,Ward 11,1102.0,R3,17 Dorr St,2119.0,Address,49149.0,42.3272,-71.0919,Constituent Call,"(42.3272, -71.0919)"
540041,101001341860,03/25/2015 01:48:58 PM,04/15/2015 01:48:58 PM,04/08/2015 01:44:22 PM,ONTIME,Closed,Case Closed Case Resolved new cart swapped new cart # 0514000816 04/07/15,Request for Recycling Cart,Public Works Department,Recycling,Request for Recycling Cart,PWDx_Recycling,PWDx,,,9 Bowdoin Ave  Dorchester  MA  02121,7.0,03,4.0,C11,Dorchester,8.0,Ward 14,1404.0,R2,9 Bowdoin Ave,2121.0,Address,17447.0,42.3026,-71.077,Constituent Call,"(42.3026, -71.077)"
540094,101001341945,03/25/2015 02:45:59 PM,04/15/2015 02:45:59 PM,04/13/2015 03:02:07 PM,ONTIME,Closed,Case Closed Case Resolved BROKEN CART SWAPPED NEW CART #0154000838 04/10/2015,Request for Recycling Cart,Public Works Department,Recycling,Request for Recycling Cart,PWDx_Recycling,PWDx,,,29 Duval St  Brighton  MA  02135,11.0,04,9.0,D14,Allston / Brighton,15.0,Ward 22,2205.0,R2,29 Duval St,2135.0,Address,227272.0,42.3608,-71.1411,Employee Generated,"(42.3608, -71.1411)"
540098,101001341952,03/25/2015 02:51:18 PM,04/15/2015 02:51:18 PM,04/09/2015 01:30:36 PM,ONTIME,Closed,Case Closed Case Resolved broken cart swapped new cart number #0514000122 04/08/2015,Request for Recycling Cart,Public Works Department,Recycling,Request for Recycling Cart,PWDx_Recycling,PWDx,,,5 Magee St  Hyde Park  MA  02136,12.0,08,5.0,E18,Hyde Park,10.0,Ward 18,1822.0,R1,5 Magee St,2136.0,Address,88223.0,42.2647,-71.1259,Employee Generated,"(42.2647, -71.1259)"
540106,101001341968,03/25/2015 02:58:14 PM,04/15/2015 02:58:14 PM,04/27/2015 01:22:44 PM,OVERDUE,Closed,Case Closed Case Resolved RECYCLING CART LIST REQUEST FILLED NEW CART #0415313520 04/24/15,Request for Recycling Cart,Public Works Department,Recycling,Request for Recycling Cart,PWDx_Recycling,PWDx,,,10 Willis St  Dorchester  MA  02125,7.0,03,3.0,C11,Dorchester,7.0,Ward 13,1306.0,R2,10 Willis St,2125.0,Address,150158.0,42.3177,-71.0597,Constituent Call,"(42.3177, -71.0597)"
540111,101001341980,03/25/2015 03:08:19 PM,04/15/2015 03:08:18 PM,04/09/2015 01:32:57 PM,ONTIME,Closed,Case Closed Case Resolved broken cart swapped new cart number #0514000123 04/08/2015,Request for Recycling Cart,Public Works Department,Recycling,Request for Recycling Cart,PWDx_Recycling,PWDx,,,136 Child St  Hyde Park  MA  02136,12.0,08,5.0,E18,Hyde Park,10.0,Ward 18,1812.0,R1,136 Child St,2136.0,Address,32118.0,42.254,-71.1308,Constituent Call,"(42.254, -71.1308)"
540140,101001342026,03/25/2015 03:50:33 PM,04/15/2015 03:50:33 PM,04/13/2015 02:24:28 PM,ONTIME,Closed,Case Closed Case Resolved BROKEN CART SWAPPED NEW CART #0514000808 4/10/2015,Request for Recycling Cart,Public Works Department,Recycling,Request for Recycling Cart,PWDx_Recycling,PWDx,,,21 Saint Peter St  Jamaica Plain  MA  02130,9.0,02,6.0,E13,Jamaica Plain,11.0,Ward 19,1901.0,R3,21 Saint Peter St,2130.0,Address,121479.0,42.3185,-71.1082,Constituent Call,"(42.3185, -71.1082)"
540142,101001342029,03/25/2015 03:51:05 PM,04/15/2015 03:51:05 PM,04/14/2015 02:42:27 PM,ONTIME,Closed,Case Closed Case Resolved broken cart swapped new cart #714423821 04/13/2015,Request for Recycling Cart,Public Works Department,Recycling,Request for Recycling Cart,PWDx_Recycling,PWDx,,,135 Cedar St  Roxbury  MA  02119,7.0,10B,7.0,B2,Roxbury,13.0,Ward 11,1101.0,R2,135 Cedar St,2119.0,Address,202690.0,42.3276,-71.0947,Employee Generated,"(42.3276, -71.0947)"
540143,101001342030,03/25/2015 03:51:16 PM,04/15/2015 03:51:16 PM,04/28/2015 10:18:32 AM,OVERDUE,Closed,Case Closed Duplicate of Existing Case  Reference 101001343917 one cart per a household,Request for Recycling Cart,Public Works Department,Recycling,Request for Recycling Cart,PWDx_Recycling,PWDx,,,23 Clive St  Jamaica Plain  MA  02130,9.0,02,6.0,E13,Jamaica Plain,11.0,Ward 19,1901.0,R4,23 Clive St,2130.0,Address,34063.0,42.3172,-71.1084,Constituent Call,"(42.3172, -71.1084)"
540152,101001342050,03/25/2015 04:00:37 PM,04/15/2015 04:00:37 PM,04/21/2015 11:54:38 AM,OVERDUE,Closed,Case Closed Case Resolved Recycling cart requested swpped new cart # 0714423835 04/17/2015,Request for Recycling Cart,Public Works Department,Recycling,Request for Recycling Cart,PWDx_Recycling,PWDx,,,40 Alleghany St  Mission Hill  MA  02120,9.0,10A,8.0,B2,Mission Hill,14.0,Ward 10,1005.0,CM,40 Alleghany St,2120.0,Address,2253.0,42.3302,-71.0992,Constituent Call,"(42.3302, -71.0992)"
540156,101001342054,03/25/2015 04:02:59 PM,04/15/2015 04:02:59 PM,04/14/2015 02:43:00 PM,ONTIME,Closed,Case Closed Case Resolved broken cart swapped new cart #0714423995 04/13/2015,Request for Recycling Cart,Public Works Department,Recycling,Request for Recycling Cart,PWDx_Recycling,PWDx,,,212B Highland St  Roxbury  MA  02119,9.0,10B,7.0,B2,Roxbury,13.0,Ward 11,1102.0,CD,212B Highland St,2119.0,Address,73731.0,42.323,-71.0943,Constituent Call,"(42.323, -71.0943)"
540160,101001342059,03/25/2015 04:09:47 PM,04/15/2015 04:09:47 PM,04/22/2015 03:16:11 PM,OVERDUE,Closed,Case Closed Case Resolved cart requested swapped out new cart #0714423896 04/16/2015,Request for Recycling Cart,Public Works Department,Recycling,Request for Recycling Cart,PWDx_Recycling,PWDx,,,50 Stella Rd  Roslindale  MA  02131,12.0,02,5.0,E18,Roslindale,10.0,Ward 18,1807.0,R1,50 Stella Rd,2131.0,Address,130490.0,42.2813,-71.1168,Constituent Call,"(42.2813, -71.1168)"
540174,101001342080,03/25/2015 04:35:26 PM,04/15/2015 04:35:25 PM,04/14/2015 02:37:52 PM,ONTIME,Closed,Case Closed Case Resolved broken cart swapped new cart #0714423996 04/13/2015,Request for Recycling Cart,Public Works Department,Recycling,Request for Recycling Cart,PWDx_Recycling,PWDx,,,419 Commonwealth Ave  Boston  MA  02215,4.0,10A,8.0,D4,Back Bay,14.0,Ward 5,509.0,A,419 Commonwealth Ave,2215.0,Address,340120.0,42.3495,-71.0914,Employee Generated,"(42.3495, -71.0914)"
540176,101001342083,03/25/2015 04:39:45 PM,04/15/2015 04:39:44 PM,04/09/2015 01:33:32 PM,ONTIME,Closed,Case Closed Case Resolved broken cart swapped new cart number #0514000124 04/08/2015,Request for Recycling Cart,Public Works Department,Recycling,Request for Recycling Cart,PWDx_Recycling,PWDx,,,11 Thompson St  Hyde Park  MA  02136,12.0,08,5.0,E18,Hyde Park,10.0,Ward 18,1819.0,R2,11 Thompson St,2136.0,Address,135713.0,42.2534,-71.1329,Constituent Call,"(42.2534, -71.1329)"
540179,101001342086,03/25/2015 04:45:05 PM,04/15/2015 04:45:05 PM,04/24/2015 01:58:47 PM,OVERDUE,Closed,Case Closed Case Resolved Cart request filled new cart # 0514000034 04/23/2015,Request for Recycling Cart,Public Works Department,Recycling,Request for Recycling Cart,PWDx_Recycling,PWDx,,,12 Linden St  South Boston  MA  02127,6.0,05,2.0,C6,South Boston / South Boston Waterfront,5.0,Ward 7,703.0,R2,12 Linden St,2127.0,Address,86467.0,42.3341,-71.0451,Constituent Call,"(42.3341, -71.0451)"
540181,101001342090,03/25/2015 04:53:21 PM,05/28/2015 04:53:00 PM,06/01/2015 10:20:10 AM,OVERDUE,Closed,Case Closed. Closed date : 2015-06-01 10:20:10.683 Duplicate of Existing Case case id#101001372739,Request for Recycling Cart,Public Works Department,Recycling,Request for Recycling Cart,PWDx_Recycling,PWDx,,,26 Alpha Rd  Dorchester  MA  02124,8.0,07,4.0,C11,Dorchester,9.0,Ward 17,1703.0,R2,26 Alpha Rd,2124.0,Address,2834.0,42.2958,-71.0684,Constituent Call,"(42.2958, -71.0684)"
540182,101001342091,03/25/2015 04:53:24 PM,04/15/2015 04:53:24 PM,04/07/2015 11:39:02 AM,ONTIME,Closed,Case Closed Case Resolved new cart swapped new cart #0514000681 04/06/2015,Request for Recycling Cart,Public Works Department,Recycling,Request for Recycling Cart,PWDx_Recycling,PWDx,,,7 Allen Rd  Brighton  MA  02135,11.0,04,9.0,D14,Allston / Brighton,15.0,Ward 22,2210.0,R2,7 Allen Rd,2135.0,Address,161486.0,42.3501,-71.1594,Constituent Call,"(42.3501, -71.1594)"
540202,101001342119,03/25/2015 05:32:31 PM,04/16/2015 08:30:00 AM,04/14/2015 02:43:38 PM,ONTIME,Closed,Case Closed Case Resolved broken cart swapped new cart #0714423828 04/13/2015,Request for Recycling Cart,Public Works Department,Recycling,Request for Recycling Cart,PWDx_Recycling,PWDx,,,9 Abbotsford St  Dorchester  MA  02121,9.0,10B,7.0,B2,Roxbury,13.0,Ward 12,1208.0,CM,9 Abbotsford St,2121.0,Address,111.0,42.3144,-71.0925,Constituent Call,"(42.3144, -71.0925)"
540254,101001342194,03/25/2015 08:13:53 PM,05/29/2015 08:30:00 AM,05/15/2015 11:43:07 AM,ONTIME,Closed,Case Closed. Closed date : 2015-05-15 11:43:07.603 Case Resolved cart requested new cart#04152942 05/14/2015,Request for Recycling Cart,Public Works Department,Recycling,Request for Recycling Cart,PWDx_Recycling,PWDx,,,149 W Eighth St  South Boston  MA  02127,6.0,05,2.0,C6,South Boston / South Boston Waterfront,5.0,Ward 7,705.0,R3,149 W Eighth St,2127.0,Address,52516.0,42.3346,-71.0535,Constituent Call,"(42.3346, -71.0535)"
540287,101001342247,03/26/2015 07:35:49 AM,04/16/2015 08:30:00 AM,04/21/2015 09:07:25 AM,OVERDUE,Closed,Case Closed Case Resolved Cart requested swapped out new cart #0714423943 04/15/2015,Request for Recycling Cart,Public Works Department,Recycling,Request for Recycling Cart,PWDx_Recycling,PWDx,,,462 Quincy St  Dorchester  MA  02125,7.0,03,3.0,C11,Dorchester,8.0,Ward 15,1504.0,R2,462 Quincy St,2125.0,Address,297188.0,42.3093,-71.0662,Constituent Call,"(42.3093, -71.0662)"
540342,101001342326,03/26/2015 08:48:56 AM,04/16/2015 08:48:56 AM,04/14/2015 01:01:25 PM,ONTIME,Closed,Case Closed Case Resolved broken cart swapped new cart #0714424080 04/13/2015,Request for Recycling Cart,Public Works Department,Recycling,Request for Recycling Cart,PWDx_Recycling,PWDx,,,10 Malcolm Rd  Jamaica Plain  MA  02130,9.0,02,6.0,E13,Jamaica Plain,11.0,Ward 19,1902.0,R1,10 Malcolm Rd,2130.0,Address,88712.0,42.3028,-71.1302,Constituent Call,"(42.3028, -71.1302)"
540413,101001342431,03/26/2015 09:59:08 AM,04/16/2015 09:59:07 AM,04/28/2015 03:00:08 PM,OVERDUE,Closed,Case Closed Duplicate of Existing Case  reference case #101001352495 one cart per household,Request for Recycling Cart,Public Works Department,Recycling,Request for Recycling Cart,PWDx_Recycling,PWDx,,,348 Huntington Ave  Hyde Park  MA  02136,12.0,08,5.0,E18,Hyde Park,10.0,Ward 18,1808.0,R2,348 Huntington Ave,2136.0,Address,76550.0,42.2663,-71.1162,Constituent Call,"(42.2663, -71.1162)"
540422,101001342440,03/26/2015 10:11:32 AM,04/16/2015 10:11:31 AM,04/06/2015 12:58:03 PM,ONTIME,Closed,Case Closed Case Resolved new cart swapped new cart #0514000719 04/03/15,Request for Recycling Cart,Public Works Department,Recycling,Request for Recycling Cart,PWDx_Recycling,PWDx,,,29 Swan Ave  East Boston  MA  02128,1.0,09,1.0,A7,East Boston,1.0,Ward 1,112.0,R2,29 Swan Ave,2128.0,Address,317024.0,42.3892,-70.9964,Self Service,"(42.3892, -70.9964)"
540465,101001342499,03/26/2015 10:41:19 AM,04/16/2015 10:41:19 AM,04/14/2015 01:25:36 PM,ONTIME,Closed,Case Closed Case Resolved broken cart swapped new cart #0514000809 04/13/2015,Request for Recycling Cart,Public Works Department,Recycling,Request for Recycling Cart,PWDx_Recycling,PWDx,,,7 Putnam St  East Boston  MA  02128,1.0,09,1.0,A7,East Boston,1.0,Ward 1,108.0,R2,7 Putnam St,2128.0,Address,113673.0,42.3822,-71.0336,Employee Generated,"(42.3822, -71.0336)"
540490,101001342543,03/26/2015 11:04:47 AM,04/16/2015 11:04:44 AM,04/14/2015 01:26:16 PM,ONTIME,Closed,Case Closed Case Resolved broken cart swapped new cart #0514000835 04/13/2015,Request for Recycling Cart,Public Works Department,Recycling,Request for Recycling Cart,PWDx_Recycling,PWDx,,,212 Lexington St  East Boston  MA  02128,1.0,09,1.0,A7,East Boston,1.0,Ward 1,109.0,R3,212 Lexington St,2128.0,Address,264030.0,42.3798,-71.0323,Constituent Call,"(42.3798, -71.0323)"
540492,101001342545,03/26/2015 11:06:46 AM,04/16/2015 11:06:46 AM,04/01/2015 04:16:16 PM,ONTIME,Closed,Case Closed Case Resolved Constituent called to cancel request,Request for Recycling Cart,Public Works Department,Recycling,Request for Recycling Cart,PWDx_Recycling,PWDx,,,582 E Fourth St  South Boston  MA  02127,6.0,05,2.0,C6,South Boston / South Boston Waterfront,5.0,Ward 6,604.0,CD,582 E Fourth St,2127.0,Address,59867.0,42.3348,-71.0414,Constituent Call,"(42.3348, -71.0414)"
540497,101001342551,03/26/2015 11:11:41 AM,04/16/2015 11:11:41 AM,04/24/2015 01:59:25 PM,OVERDUE,Closed,Case Closed Case Resolved Cart request filled new cart # 0514000516 04/23/2015,Request for Recycling Cart,Public Works Department,Recycling,Request for Recycling Cart,PWDx_Recycling,PWDx,,,176 H St  South Boston  MA  02127,6.0,05,2.0,C6,South Boston / South Boston Waterfront,5.0,Ward 7,702.0,CM,176 H St,2127.0,Address,67833.0,42.3318,-71.0413,Constituent Call,"(42.3318, -71.0413)"
540512,101001342571,03/26/2015 11:22:28 AM,04/16/2015 11:22:28 AM,04/14/2015 01:22:03 PM,ONTIME,Closed,Case Closed Case Resolved broken cart swapped new cart #0714424075 04/13/2015,Request for Recycling Cart,Public Works Department,Recycling,Request for Recycling Cart,PWDx_Recycling,PWDx,,,105 Hazleton St  Mattapan  MA  02126,8.0,07,4.0,B3,Greater Mattapan,9.0,14,1408.0,R2,105 Hazleton St,2126.0,Address,72233.0,42.2818,-71.0969,Constituent Call,"(42.2818, -71.0969)"
540516,101001342576,03/26/2015 11:25:01 AM,04/16/2015 11:25:01 AM,04/21/2015 12:18:02 PM,OVERDUE,Closed,Case Closed Case Resolved Recycling cart requested swpped new cart # 0714423830 04/17/2015,Request for Recycling Cart,Public Works Department,Recycling,Request for Recycling Cart,PWDx_Recycling,PWDx,,,3-4 Folsom Ave  Mission Hill  MA  02120,9.0,10A,8.0,B2,Mission Hill,14.0,Ward 10,1005.0,R2,3-4 Folsom Ave,2120.0,Address,59139.0,42.3299,-71.0993,Employee Generated,"(42.3299, -71.0993)"
540581,101001342671,03/26/2015 12:36:10 PM,05/28/2015 12:36:00 PM,06/12/2015 10:50:35 AM,OVERDUE,Closed,Case Closed. Closed date : 2015-06-12 10:50:35.047 Case Resolved cart requested filled new cart # 0415313649 06/11/2015,Request for Recycling Cart,Public Works Department,Recycling,Request for Recycling Cart,PWDx_Recycling,PWDx,,,11 Savin Hill Ave  Dorchester  MA  02125,7.0,03,3.0,C11,Dorchester,8.0,Ward 15,1504.0,R3,11 Savin Hill Ave,2125.0,Address,123167.0,42.3126,-71.0585,Constituent Call,"(42.3126, -71.0585)"
540583,101001342675,03/26/2015 12:42:00 PM,05/28/2015 12:41:00 PM,06/12/2015 10:51:08 AM,OVERDUE,Closed,Case Closed. Closed date : 2015-06-12 10:51:08.85 Case Resolved cart requested filled new cart # 0415302421 06/11/2015,Request for Recycling Cart,Public Works Department,Recycling,Request for Recycling Cart,PWDx_Recycling,PWDx,,,133 E Cottage St  Dorchester  MA  02125,7.0,03,7.0,B2,Dorchester,13.0,Ward 7,710.0,R2,133 E Cottage St,2125.0,Address,43535.0,42.3209,-71.064,Constituent Call,"(42.3209, -71.064)"
540654,101001342765,03/26/2015 01:50:42 PM,04/16/2015 01:50:42 PM,04/21/2015 09:08:17 AM,OVERDUE,Closed,Case Closed Case Resolved Cart requested swapped out new cart #0714423944 04/15/2015,Request for Recycling Cart,Public Works Department,Recycling,Request for Recycling Cart,PWDx_Recycling,PWDx,,,28 Juliette St  Dorchester  MA  02122,7.0,03,3.0,C11,Dorchester,8.0,Ward 15,1509.0,R3,28 Juliette St,2122.0,Address,80359.0,42.3058,-71.0624,Employee Generated,"(42.3058, -71.0624)"
540656,101001342768,03/26/2015 01:59:13 PM,05/28/2015 01:59:00 PM,06/11/2015 02:01:53 PM,OVERDUE,Closed,Case Closed. Closed date : 2015-06-11 14:01:53.877 Case Resolved cart requested filled new cart#0415313552 06/09/2015,Request for Recycling Cart,Public Works Department,Recycling,Request for Recycling Cart,PWDx_Recycling,PWDx,,,158 Bowdoin St  Dorchester  MA  02121,7.0,03,4.0,C11,Dorchester,8.0,Ward 15,1502.0,R1,158 Bowdoin St,2121.0,Address,17657.0,42.3041,-71.0703,Constituent Call,"(42.3041, -71.0703)"
540681,101001342813,03/26/2015 02:43:23 PM,05/27/2015 02:43:00 PM,04/27/2015 01:31:42 PM,ONTIME,Closed,Case Closed Case Resolved RECYCLING CART LIST REQUEST FILLED NEW CART #0415302215 04/24/2015,Request for Recycling Cart,Public Works Department,Recycling,Request for Recycling Cart,PWDx_Recycling,PWDx,,,1161-1163 Hyde Park Ave  Hyde Park  MA  02136,12.0,08,5.0,E18,Hyde Park,10.0,Ward 18,1813.0,R2,1161-1163 Hyde Park Ave,2136.0,Address,77066.0,42.2593,-71.1236,Employee Generated,"(42.2593, -71.1236)"
540696,101001342836,03/26/2015 03:08:51 PM,04/16/2015 03:08:51 PM,04/13/2015 02:28:16 PM,ONTIME,Closed,Case Closed Case Resolved BROKEN CART SWAPPED NEW CART #0514000802 4/10/2015,Damaged Cart - New Request,Public Works Department,Recycling,Request for Recycling Cart,PWDx_Recycling,PWDx,,,227 Savin Hill Ave  Dorchester  MA  02125,7.0,03,3.0,C11,Dorchester,7.0,Ward 13,1310.0,R1,227 Savin Hill Ave,2125.0,Address,123278.0,42.3088,-71.047,Employee Generated,"(42.3088, -71.047)"
540704,101001342847,03/26/2015 03:20:57 PM,04/16/2015 03:20:57 PM,04/24/2015 02:24:50 PM,OVERDUE,Closed,Case Closed Case Resolved Cart request filled new cart # 0714423765  04/23/2015,Request for Recycling Cart,Public Works Department,Recycling,Request for Recycling Cart,PWDx_Recycling,PWDx,,,205 Beacon St  Boston  MA  02116,4.0,1C,8.0,D4,Back Bay,14.0,Ward 5,507.0,A,205 Beacon St,2116.0,Address,10078.0,42.3539,-71.0771,Constituent Call,"(42.3539, -71.0771)"
540705,101001342848,03/26/2015 03:21:34 PM,04/16/2015 03:21:34 PM,04/14/2015 02:46:18 PM,ONTIME,Closed,Case Closed Case Resolved broken cart swapped new cart #714424271 04/13/2015,Request for Recycling Cart,Public Works Department,Recycling,Request for Recycling Cart,PWDx_Recycling,PWDx,,,469 Beacon St  Boston  MA  02115,4.0,1C,8.0,D4,Back Bay,14.0,Ward 5,509.0,A,469 Beacon St,2115.0,Address,11560.0,42.3509,-71.0885,Constituent Call,"(42.3509, -71.0885)"
540706,101001342849,03/26/2015 03:22:09 PM,04/16/2015 03:22:09 PM,04/14/2015 02:38:40 PM,ONTIME,Closed,Case Closed Case Resolved broken cart swapped new cart #714423999 04/13/2015,Request for Recycling Cart,Public Works Department,Recycling,Request for Recycling Cart,PWDx_Recycling,PWDx,,,509 Beacon St  Boston  MA  02215,4.0,10A,8.0,D4,Back Bay,14.0,Ward 5,509.0,A,509 Beacon St,2215.0,Address,11838.0,42.3504,-71.0902,Constituent Call,"(42.3504, -71.0902)"
540707,101001342850,03/26/2015 03:22:42 PM,04/16/2015 03:22:42 PM,04/14/2015 02:40:18 PM,ONTIME,Closed,Case Closed Case Resolved broken cart swapped new cart #0714424273 04/13/2015,Request for Recycling Cart,Public Works Department,Recycling,Request for Recycling Cart,PWDx_Recycling,PWDx,,,513 Beacon St  Boston  MA  02215,4.0,10A,8.0,D4,Back Bay,14.0,Ward 5,509.0,A,513 Beacon St,2215.0,Address,11861.0,42.3504,-71.0904,Constituent Call,"(42.3504, -71.0904)"
540709,101001342852,03/26/2015 03:23:14 PM,04/16/2015 03:23:14 PM,04/14/2015 02:47:01 PM,ONTIME,Closed,Case Closed Case Resolved broken cart swapped new cart #714424272 04/13/2015,Request for Recycling Cart,Public Works Department,Recycling,Request for Recycling Cart,PWDx_Recycling,PWDx,,,172 Marlborough St  Boston  MA  02116,4.0,1C,8.0,D4,Back Bay,14.0,Ward 5,507.0,A,172 Marlborough St,2116.0,Address,90522.0,42.3524,-71.0795,Constituent Call,"(42.3524, -71.0795)"
540710,101001342853,03/26/2015 03:23:44 PM,04/16/2015 03:23:44 PM,04/14/2015 02:47:36 PM,ONTIME,Closed,Case Closed Case Resolved broken cart swapped new cart #0714424000 04/13/2015,Request for Recycling Cart,Public Works Department,Recycling,Request for Recycling Cart,PWDx_Recycling,PWDx,,,397 Beacon St  Boston  MA  02116,4.0,1C,8.0,D4,Back Bay,14.0,Ward 5,508.0,A,397 Beacon St,2116.0,Address,11351.0,42.3518,-71.0851,Constituent Call,"(42.3518, -71.0851)"
540711,101001342854,03/26/2015 03:24:34 PM,04/16/2015 03:24:34 PM,04/14/2015 02:48:04 PM,ONTIME,Closed,Case Closed Case Resolved broken cart swapped new cart #0714423997 04/13/2015,Request for Recycling Cart,Public Works Department,Recycling,Request for Recycling Cart,PWDx_Recycling,PWDx,,,1 Gloucester St  Boston  MA  02116,4.0,1C,8.0,D4,Back Bay,14.0,Ward 5,508.0,A,1 Gloucester St,2116.0,Address,64880.0,42.3517,-71.0852,Constituent Call,"(42.3517, -71.0852)"
540735,101001342910,03/26/2015 04:04:19 PM,04/16/2015 04:04:19 PM,04/21/2015 12:53:13 PM,OVERDUE,Closed,Case Closed Case Resolved Recycling cart requested swpped new cart #0714423834 04/17/2015,Request for Recycling Cart,Public Works Department,Recycling,Request for Recycling Cart,PWDx_Recycling,PWDx,,,923 Beacon St  Boston  MA  02215,,10A,8.0,D4,Fenway / Kenmore / Audubon Circle / Longwood,14.0,Ward 21,2101.0,R3,923 Beacon St,2215.0,Address,12464.0,42.3459,-71.1065,Constituent Call,"(42.3459, -71.1065)"
540768,101001342964,03/26/2015 05:33:22 PM,05/27/2015 08:30:00 AM,06/05/2015 07:32:42 AM,OVERDUE,Closed,Case Closed. Closed date : 2015-06-05 07:32:42.393 Case Resolved Cart requested filled new cart #0415302522 06/02/2015,Request for Recycling Cart,Public Works Department,Recycling,Request for Recycling Cart,PWDx_Recycling,PWDx,,,12 Wallingford Rd  Brighton  MA  02135,11.0,04,9.0,D14,Allston / Brighton,15.0,Ward 21,2113.0,R2,12 Wallingford Rd,2135.0,Address,326458.0,42.3412,-71.1514,Constituent Call,"(42.3412, -71.1514)"
540853,101001343100,03/27/2015 07:34:03 AM,04/17/2015 08:30:00 AM,04/06/2015 12:38:24 PM,ONTIME,Closed,Case Closed Case Resolved new cart swapped new cart #0514000715 04/03/15,Request for Recycling Cart,Public Works Department,Recycling,Request for Recycling Cart,PWDx_Recycling,PWDx,,,39 Dracut St  Dorchester  MA  02124,8.0,07,3.0,C11,Dorchester,7.0,Ward 16,1606.0,R1,39 Dracut St,2124.0,Address,49345.0,42.2873,-71.0618,Constituent Call,"(42.2873, -71.0618)"
540901,101001343201,03/27/2015 08:50:02 AM,04/17/2015 08:50:01 AM,04/27/2015 01:27:48 PM,OVERDUE,Closed,Case Closed Case Resolved RECYCLING CART LIST REQUEST FILLED NEW CART #0415313515 04/24/2015,Request for Recycling Cart,Public Works Department,Recycling,Request for Recycling Cart,PWDx_Recycling,PWDx,,,730 Adams St  Dorchester  MA  02122,8.0,07,3.0,C11,Dorchester,7.0,Ward 16,1609.0,CM,730 Adams St,2122.0,Address,946.0,42.2847,-71.055,Constituent Call,"(42.2847, -71.055)"
540912,101001343214,03/27/2015 09:00:50 AM,05/28/2015 09:00:00 AM,06/03/2015 01:07:31 PM,OVERDUE,Closed,Case Closed. Closed date : 2015-06-03 13:07:31.36 Case Resolved cart requested filled new cart #0415302611 05/29/2015,Request for Recycling Cart,Public Works Department,Recycling,Request for Recycling Cart,PWDx_Recycling,PWDx,,,14 Nonquit St  Dorchester  MA  02125,7.0,03,7.0,B2,Dorchester,13.0,Ward 13,1305.0,R1,14 Nonquit St,2125.0,Address,103050.0,42.3176,-71.0684,Self Service,"(42.3176, -71.0684)"
540945,101001343266,03/27/2015 09:31:36 AM,04/17/2015 09:31:35 AM,04/24/2015 02:19:43 PM,OVERDUE,Closed,Case Closed Case Resolved Cart request filled new cart # Cart request filled new cart # 051400033 04/23/2015,Request for Recycling Cart,Public Works Department,Recycling,Request for Recycling Cart,PWDx_Recycling,PWDx,,,264 Webster St  East Boston  MA  02128,1.0,09,1.0,A7,East Boston,1.0,Ward 1,101.0,CM,264 Webster St,2128.0,Address,146869.0,42.3649,-71.0312,Constituent Call,"(42.3649, -71.0312)"
541007,101001343343,03/27/2015 10:25:55 AM,04/17/2015 10:25:55 AM,04/24/2015 01:53:25 PM,OVERDUE,Closed,Case Closed Case Resolved Cart request filled new cart # 0614402651 04/23/2015,Request for Recycling Cart,Public Works Department,Recycling,Request for Recycling Cart,PWDx_Recycling,PWDx,,,21 Wayland St  Dorchester  MA  02125,7.0,03,7.0,B2,Roxbury,13.0,Ward 13,1304.0,R1,21 Wayland St,2125.0,Address,146639.0,42.3138,-71.073,Constituent Call,"(42.3138, -71.073)"
541062,101001343414,03/27/2015 11:17:01 AM,04/17/2015 11:17:01 AM,04/27/2015 01:36:09 PM,OVERDUE,Closed,Case Closed Case Resolved RECYCLING CART LIST REQUEST FILLED NEW CART #0415313506 04/24/15,Request for Recycling Cart,Public Works Department,Recycling,Request for Recycling Cart,PWDx_Recycling,PWDx,,,332 Chelsea St  East Boston  MA  02128,1.0,09,1.0,A7,East Boston,1.0,Ward 1,110.0,R3,332 Chelsea St,2128.0,Address,206160.0,42.3776,-71.0301,Constituent Call,"(42.3776, -71.0301)"
541087,101001343449,03/27/2015 11:40:21 AM,05/28/2015 11:40:00 AM,06/02/2015 11:36:46 AM,OVERDUE,Closed,Case Closed. Closed date : 2015-06-02 11:36:46.82 Case Resolved cart requested filled new cart # 0415313678 06/01/2015,Request for Recycling Cart,Public Works Department,Recycling,Request for Recycling Cart,PWDx_Recycling,PWDx,,,112 Hazleton St  Mattapan  MA  02126,8.0,07,4.0,B3,Greater Mattapan,9.0,14,1408.0,R2,112 Hazleton St,2126.0,Address,72237.0,42.2818,-71.0976,Constituent Call,"(42.2818, -71.0976)"
541094,101001343458,03/27/2015 11:45:47 AM,04/17/2015 11:45:47 AM,04/24/2015 02:16:50 PM,OVERDUE,Closed,Case Closed Case Resolved Cart request filled new cart # 0514000567 04/23/15,Request for Recycling Cart,Public Works Department,Recycling,Request for Recycling Cart,PWDx_Recycling,PWDx,,,82 Woodruff Way  Mattapan  MA  02126,8.0,07,4.0,B3,Greater Mattapan,9.0,Ward 18,1801.0,E,82 Woodruff Way,2126.0,Address,338727.0,42.2739,-71.0804,Employee Generated,"(42.2739, -71.0804)"
541098,101001343462,03/27/2015 11:47:37 AM,05/28/2015 11:47:00 AM,06/03/2015 01:07:57 PM,OVERDUE,Closed,Case Closed. Closed date : 2015-06-03 13:07:57.247 Case Resolved cart requested filled new cart #0415302371 05/29/2015,Request for Recycling Cart,Public Works Department,Recycling,Request for Recycling Cart,PWDx_Recycling,PWDx,,,4 Chase St  Dorchester  MA  02125,7.0,03,2.0,C11,Dorchester,5.0,Ward 7,709.0,R2,4 Chase St,2125.0,Address,30069.0,42.3182,-71.06,Employee Generated,"(42.3182, -71.06)"
541113,101001343484,03/27/2015 12:00:08 PM,04/17/2015 12:00:08 PM,04/24/2015 02:00:54 PM,OVERDUE,Closed,Case Closed Case Resolved Cart request filled new cart # 0514000024 04/23/2015,Request for Recycling Cart,Public Works Department,Recycling,Request for Recycling Cart,PWDx_Recycling,PWDx,,,16 Conway St  Roslindale  MA  02131,9.0,06,5.0,E5,Roslindale,10.0,Ward 20,2004.0,CD,16 Conway St,2131.0,Address,42288.0,42.2887,-71.1299,Constituent Call,"(42.2887, -71.1299)"
541114,101001343485,03/27/2015 12:00:13 PM,05/28/2015 12:00:00 PM,04/28/2015 10:22:45 AM,ONTIME,Closed,Case Closed Duplicate of Existing Case  reference#101001343485,Request for Recycling Cart,Public Works Department,Recycling,Request for Recycling Cart,PWDx_Recycling,PWDx,,,25 Hunnewell Ave  Brighton  MA  02135,11.0,04,9.0,D14,Allston / Brighton,15.0,Ward 22,2213.0,R2,25 Hunnewell Ave,2135.0,Address,76105.0,42.3524,-71.1697,Constituent Call,"(42.3524, -71.1697)"
541118,101001343489,03/27/2015 12:05:38 PM,04/17/2015 12:05:38 PM,04/24/2015 02:00:01 PM,OVERDUE,Closed,Case Closed Case Resolved Cart request filled new cart # 0514000031 04/23/2015,Request for Recycling Cart,Public Works Department,Recycling,Request for Recycling Cart,PWDx_Recycling,PWDx,,,548 E Broadway  South Boston  MA  02127,6.0,05,2.0,C6,South Boston / South Boston Waterfront,5.0,Ward 6,604.0,CM,548 E Broadway,2127.0,Address,21002.0,42.3357,-71.0423,Constituent Call,"(42.3357, -71.0423)"
541125,101001343499,03/27/2015 12:10:34 PM,05/28/2015 12:10:00 PM,06/11/2015 02:20:26 PM,OVERDUE,Closed,Case Closed. Closed date : 2015-06-11 14:20:26.283 Case Resolved cart requested filled new cart# 0415302359 06/09/2015,Request for Recycling Cart,Public Works Department,Recycling,Request for Recycling Cart,PWDx_Recycling,PWDx,,,23-35 Grantley St  Hyde Park  MA  02136,12.0,08,5.0,E18,Hyde Park,10.0,Ward 18,1818.0,CM,23-35 Grantley St,2136.0,Address,65957.0,42.2493,-71.1254,Constituent Call,"(42.2493, -71.1254)"
541133,101001343507,03/27/2015 12:14:29 PM,05/28/2015 12:14:00 PM,06/02/2015 11:24:40 AM,OVERDUE,Closed,Case Closed. Closed date : 2015-06-02 11:24:40.493 Case Resolved cart requested filled new cart # 0415313560 06/01/2015,Request for Recycling Cart,Public Works Department,Recycling,Request for Recycling Cart,PWDx_Recycling,PWDx,,,38 Westville St  Dorchester  MA  02124,7.0,03,4.0,C11,Dorchester,8.0,Ward 15,1505.0,R3,38 Westville St,2124.0,Address,148943.0,42.3004,-71.0707,Constituent Call,"(42.3004, -71.0707)"
541143,101001343517,03/27/2015 12:20:00 PM,05/28/2015 12:20:00 PM,06/11/2015 01:56:57 PM,OVERDUE,Closed,Case Closed. Closed date : 2015-06-11 13:56:57.583 Case Resolved cart requested filled new cart#0415302630 06/09/2015,Request for Recycling Cart,Public Works Department,Recycling,Request for Recycling Cart,PWDx_Recycling,PWDx,,,5 Greenough Park  Jamaica Plain  MA  02130,9.0,02,6.0,E13,Jamaica Plain,11.0,Ward 19,1906.0,CM,5 Greenough Park,2130.0,Address,66697.0,42.3101,-71.1133,Constituent Call,"(42.3101, -71.1133)"
541154,101001343528,03/27/2015 12:25:37 PM,05/28/2015 12:25:00 PM,06/12/2015 10:48:20 AM,OVERDUE,Closed,Case Closed. Closed date : 2015-06-12 10:48:20.657 Case Resolved cart requested filled new cart # 0415313651 06/11/2015,Request for Recycling Cart,Public Works Department,Recycling,Request for Recycling Cart,PWDx_Recycling,PWDx,,,54 Clayton St  Dorchester  MA  02122,7.0,03,3.0,C11,Dorchester,8.0,Ward 15,1506.0,C,54 Clayton St,2122.0,Address,33701.0,42.3024,-71.056,Constituent Call,"(42.3024, -71.056)"
541156,101001343530,03/27/2015 12:26:12 PM,05/28/2015 12:26:00 PM,06/12/2015 10:49:34 AM,OVERDUE,Closed,Case Closed. Closed date : 2015-06-12 10:49:34.56 Case Resolved cart requested filled new cart # 0415302422 06/11/2015,Request for Recycling Cart,Public Works Department,Recycling,Request for Recycling Cart,PWDx_Recycling,PWDx,,,40 Shirley St  Roxbury  MA  02119,7.0,03,7.0,B2,Roxbury,13.0,Ward 8,805.0,R2,40 Shirley St,2119.0,Address,127204.0,42.3239,-71.0719,Constituent Call,"(42.3239, -71.0719)"
541161,101001343537,03/27/2015 12:29:00 PM,05/28/2015 12:29:00 PM,06/23/2015 12:14:19 PM,OVERDUE,Closed,Case Closed. Closed date : 2015-06-23 12:14:19.613 Case Resolved cart requested filled new cart# 0515630619 06/19/2015,Request for Recycling Cart,Public Works Department,Recycling,Request for Recycling Cart,PWDx_Recycling,PWDx,,,29 Brookside Ave  Jamaica Plain  MA  02130,9.0,02,6.0,E13,Jamaica Plain,11.0,Ward 11,1106.0,R3,29 Brookside Ave,2130.0,Address,198392.0,42.3138,-71.1032,Employee Generated,"(42.3138, -71.1032)"
541162,101001343535,03/27/2015 12:29:46 PM,04/17/2015 12:29:46 PM,04/24/2015 02:22:56 PM,OVERDUE,Closed,Case Closed Case Resolved Cart request filled new cart # 0714423762 04/23/2015,Request for Recycling Cart,Public Works Department,Recycling,Request for Recycling Cart,PWDx_Recycling,PWDx,,,28 Hawthorne St  Roxbury  MA  02119,9.0,10B,7.0,B2,Roxbury,13.0,Ward 11,1102.0,R3,28 Hawthorne St,2119.0,Address,158952.0,42.3241,-71.0917,Employee Generated,"(42.3241, -71.0917)"
541163,101001343536,03/27/2015 12:29:53 PM,05/28/2015 12:29:00 PM,08/20/2015 12:30:16 PM,OVERDUE,Closed,Case Closed Case Resolved  already delivered,Request for Recycling Cart,Public Works Department,Recycling,Request for Recycling Cart,PWDx_Recycling,PWDx,,,62 Wyman St  Jamaica Plain  MA  02130,9.0,02,6.0,E13,Jamaica Plain,11.0,Ward 10,1009.0,R3,62 Wyman St,2130.0,Address,339705.0,42.3207,-71.1052,Employee Generated,"(42.3207, -71.1052)"
541166,101001343540,03/27/2015 12:31:30 PM,04/17/2015 12:31:30 PM,04/27/2015 01:41:54 PM,OVERDUE,Closed,Case Closed Case Resolved RECYCLING CART LIST REQUEST FILLED NEW CART # 04/25/15,Request for Recycling Cart,Public Works Department,Recycling,Request for Recycling Cart,PWDx_Recycling,PWDx,,,209 D St  South Boston  MA  02127,6.0,05,2.0,C6,South Boston / South Boston Waterfront,5.0,Ward 6,603.0,CM,209 D St,2127.0,Address,45453.0,42.3376,-71.052,Employee Generated,"(42.3376, -71.052)"
541244,101001343638,03/27/2015 01:44:20 PM,04/17/2015 01:44:20 PM,04/27/2015 01:28:22 PM,OVERDUE,Closed,Case Closed Case Resolved RECYCLING CART LIST REQUEST FILLED NEW CART #0415313517 04/24/2015,Request for Recycling Cart,Public Works Department,Recycling,Request for Recycling Cart,PWDx_Recycling,PWDx,,,15 Grayson St  Dorchester  MA  02124,8.0,07,3.0,C11,Dorchester,7.0,Ward 16,1612.0,R1,15 Grayson St,2124.0,Address,66131.0,42.2828,-71.0505,Constituent Call,"(42.2828, -71.0505)"
541302,101001343704,03/27/2015 02:20:02 PM,04/17/2015 02:20:02 PM,05/07/2015 01:56:44 PM,OVERDUE,Closed,Case Closed Case Resolved  Recycling bin was picked up on 5/7/2015,Request for Recycling Cart,Public Works Department,Recycling,Request for Recycling Cart,PWDx_Recycling,PWDx,,,55 Central Ave  Hyde Park  MA  02136,12.0,08,5.0,E18,Hyde Park,10.0,Ward 18,1813.0,R1,55 Central Ave,2136.0,Address,27301.0,42.2587,-71.1204,Constituent Call,"(42.2587, -71.1204)"
541315,101001343718,03/27/2015 02:22:14 PM,04/17/2015 02:22:14 PM,04/27/2015 01:39:16 PM,OVERDUE,Closed,Case Closed Case Resolved RECYCLING CART LIST REQUEST FILLED NEW CART #0415313504 04/25/2015,Request for Recycling Cart,Public Works Department,Recycling,Request for Recycling Cart,PWDx_Recycling,PWDx,,,23-25 Holman St  Allston  MA  02134,11.0,04,9.0,D14,Allston / Brighton,15.0,Ward 22,2201.0,R2,23-25 Holman St,2134.0,Address,74773.0,42.359,-71.1298,Constituent Call,"(42.359, -71.1298)"
541318,101001343721,03/27/2015 02:22:24 PM,05/28/2015 02:22:00 PM,05/12/2015 01:27:47 PM,ONTIME,Closed,Case Closed. Closed date : 2015-05-12 13:27:47.373 Case Resolved cart requested filled new cart # 0415302512 05/11/2015,Request for Recycling Cart,Public Works Department,Recycling,Request for Recycling Cart,PWDx_Recycling,PWDx,,,136 Milton Ave  Hyde Park  MA  02136,12.0,08,5.0,E18,Hyde Park,10.0,Ward 18,1816.0,R1,136 Milton Ave,2136.0,Address,95652.0,42.2501,-71.1106,Constituent Call,"(42.2501, -71.1106)"
541338,101001343742,03/27/2015 02:32:26 PM,05/28/2015 02:32:00 PM,04/30/2015 01:55:52 PM,ONTIME,Closed,Case Closed Case Resolved cart requested filled new cart #514000586 04/29/2015,Request for Recycling Cart,Public Works Department,Recycling,Request for Recycling Cart,PWDx_Recycling,PWDx,,,15 W Selden St  Mattapan  MA  02126,8.0,07,4.0,B3,Greater Mattapan,9.0,Ward 18,1802.0,R2,15 W Selden St,2126.0,Address,308666.0,42.2801,-71.0837,Constituent Call,"(42.2801, -71.0837)"
541341,101001343746,03/27/2015 02:36:50 PM,04/17/2015 02:36:50 PM,04/16/2015 02:51:45 PM,ONTIME,Closed,Case Closed Case Resolved cart requested has been filled new cart number is 0714423784 04/15/2015,Request for Recycling Cart,Public Works Department,Recycling,Request for Recycling Cart,PWDx_Recycling,PWDx,,,69 High St  Charlestown  MA  02129,3.0,1A,1.0,A15,Charlestown,2.0,Ward 2,205.0,CD,69 High St,2129.0,Address,73455.0,42.3769,-71.064,Constituent Call,"(42.3769, -71.064)"
541347,101001343754,03/27/2015 02:43:36 PM,04/17/2015 02:43:36 PM,04/16/2015 02:52:58 PM,ONTIME,Closed,Case Closed Case Resolved cart requested has been filled new cart number is 0714423838 04/15/2015,Request for Recycling Cart,Public Works Department,Recycling,Request for Recycling Cart,PWDx_Recycling,PWDx,,,243 Bunker Hill St  Charlestown  MA  02129,3.0,1A,1.0,A15,Charlestown,2.0,Ward 2,205.0,CD,243 Bunker Hill St,2129.0,Address,23399.0,42.3797,-71.0637,Employee Generated,"(42.3797, -71.0637)"
541351,101001343759,03/27/2015 02:45:38 PM,04/17/2015 02:45:38 PM,04/16/2015 02:53:33 PM,ONTIME,Closed,Case Closed Case Resolved cart requested has been filled new cart number is 0714423822 04/15/2015,Request for Recycling Cart,Public Works Department,Recycling,Request for Recycling Cart,PWDx_Recycling,PWDx,,,33 Sackville St  Charlestown  MA  02129,3.0,1A,1.0,A15,Charlestown,2.0,Ward 2,205.0,R1,33 Sackville St,2129.0,Address,120391.0,42.3815,-71.0643,Employee Generated,"(42.3815, -71.0643)"
541355,101001343763,03/27/2015 02:48:11 PM,05/28/2015 02:48:00 PM,06/09/2015 12:16:29 PM,OVERDUE,Closed,Case Closed. Closed date : 2015-06-09 12:16:29.553 Case Resolved cart requested filled new cart #0415313553 06/08/2015,Request for Recycling Cart,Public Works Department,Recycling,Request for Recycling Cart,PWDx_Recycling,PWDx,,,101 Almont St  Mattapan  MA  02126,8.0,07,5.0,B3,Greater Mattapan,9.0,Ward 18,1803.0,R1,101 Almont St,2126.0,Address,2743.0,42.2769,-71.0975,Constituent Call,"(42.2769, -71.0975)"
541357,101001343766,03/27/2015 02:50:11 PM,04/17/2015 02:50:11 PM,04/24/2015 02:18:22 PM,OVERDUE,Closed,Case Closed Case Resolved Cart request filled new cart # 05140000559,Request for Recycling Cart,Public Works Department,Recycling,Request for Recycling Cart,PWDx_Recycling,PWDx,,,5-7 Wilmington Ave  Dorchester  MA  02124,8.0,07,3.0,B3,Dorchester,7.0,Ward 17,1712.0,R2,5-7 Wilmington Ave,2124.0,Address,150447.0,42.2788,-71.0782,Employee Generated,"(42.2788, -71.0782)"
541359,101001343768,03/27/2015 02:50:22 PM,04/17/2015 02:50:22 PM,04/17/2015 03:24:22 PM,OVERDUE,Closed,Case Closed Case Resolved cart requested swapped new cart # 0714423783 04/16/2015,Request for Recycling Cart,Public Works Department,Recycling,Request for Recycling Cart,PWDx_Recycling,PWDx,,,2 Buckley Ave  Jamaica Plain  MA  02130,9.0,10A,6.0,E13,Jamaica Plain,11.0,Ward 10,1007.0,R3,2 Buckley Ave,2130.0,Address,198965.0,42.3223,-71.1032,Employee Generated,"(42.3223, -71.1032)"
541362,101001343772,03/27/2015 02:53:11 PM,05/28/2015 02:53:00 PM,04/28/2015 10:14:49 AM,ONTIME,Closed,Case Closed Duplicate of Existing Case  Reference #101001343786,Request for Recycling Cart,Public Works Department,Recycling,Request for Recycling Cart,PWDx_Recycling,PWDx,,,10 Gleason St  Dorchester  MA  02121,7.0,03,4.0,B3,Greater Mattapan,8.0,14,1402.0,,10 Gleason St,2121.0,Address,352000.0,42.3594,-71.0587,Constituent Call,"(0, 0)"
541363,101001343773,03/27/2015 02:56:22 PM,05/28/2015 02:56:00 PM,06/12/2015 10:55:59 AM,OVERDUE,Closed,Case Closed. Closed date : 2015-06-12 10:55:59.65 Case Resolved cart requested filled new cart # 0415313499 06/11/2015,Request for Recycling Cart,Public Works Department,Recycling,Request for Recycling Cart,PWDx_Recycling,PWDx,,,195 W Third St  South Boston  MA  02127,6.0,05,2.0,C6,South Boston / South Boston Waterfront,5.0,Ward 6,603.0,R4,195 W Third St,2127.0,Address,319101.0,42.3394,-71.0499,Employee Generated,"(42.3394, -71.0499)"
541365,101001343775,03/27/2015 02:56:34 PM,05/28/2015 02:56:00 PM,06/02/2015 11:25:06 AM,OVERDUE,Closed,Case Closed. Closed date : 2015-06-02 11:25:06.833 Case Resolved cart requested filled new cart # 0415302520 06/01/2015,Request for Recycling Cart,Public Works Department,Recycling,Request for Recycling Cart,PWDx_Recycling,PWDx,,,26 Larchmont St  Dorchester  MA  02124,7.0,03,4.0,C11,Dorchester,9.0,Ward 17,1703.0,R2,26 Larchmont St,2124.0,Address,84066.0,42.2968,-71.0687,Constituent Call,"(42.2968, -71.0687)"
541369,101001343781,03/27/2015 02:58:16 PM,05/28/2015 02:58:00 PM,06/08/2015 10:53:47 AM,OVERDUE,Closed,Case Closed. Closed date : 2015-06-08 10:53:47.193 Case Resolved cart requested filled new cart #0415302280 06/05/2015,Request for Recycling Cart,Public Works Department,Recycling,Request for Recycling Cart,PWDx_Recycling,PWDx,,,113-113A Holton St  Brighton  MA  02135,11.0,04,9.0,D14,Allston / Brighton,15.0,22,2202.0,,113-113A Holton St,2135.0,Address,347394.0,42.3594,-71.0587,Employee Generated,"(0, 0)"
541371,101001343783,03/27/2015 02:58:36 PM,04/17/2015 02:58:36 PM,04/27/2015 01:24:36 PM,OVERDUE,Closed,Case Closed Case Resolved RECYCLING CART LIST REQUEST FILLED NEW CART #0415313505 04/24/2015,Request for Recycling Cart,Public Works Department,Recycling,Request for Recycling Cart,PWDx_Recycling,PWDx,,,652 Washington St  Brighton  MA  02135,11.0,04,9.0,D14,Allston / Brighton,15.0,Ward 22,2204.0,R2,652 Washington St,2135.0,Address,143661.0,42.3511,-71.1698,Constituent Call,"(42.3511, -71.1698)"
541372,101001343786,03/27/2015 03:00:14 PM,05/28/2015 03:00:00 PM,06/02/2015 11:30:38 AM,OVERDUE,Closed,Case Closed. Closed date : 2015-06-02 11:30:38.543 Case Resolved cart requested filled new cart # 0415313562 06/01/2015,Request for Recycling Cart,Public Works Department,Recycling,Request for Recycling Cart,PWDx_Recycling,PWDx,,,10 Gleason St  Dorchester  MA  02121,7.0,03,4.0,B3,Greater Mattapan,8.0,14,1402.0,,10 Gleason St,2121.0,Address,352000.0,42.3594,-71.0587,Constituent Call,"(0, 0)"
541382,101001343801,03/27/2015 03:20:52 PM,04/17/2015 03:20:52 PM,04/23/2015 11:28:19 AM,OVERDUE,Closed,Case Closed Case Resolved request filled new cart # 0714423631 04/22/15,Request for Recycling Cart,Public Works Department,Recycling,Request for Recycling Cart,PWDx_Recycling,PWDx,,,24 Monument Ave  Charlestown  MA  02129,3.0,1A,1.0,A15,Charlestown,2.0,Ward 2,203.0,R1,24 Monument Ave,2129.0,Address,96861.0,42.3744,-71.0622,Constituent Call,"(42.3744, -71.0622)"
541383,101001343803,03/27/2015 03:22:46 PM,04/17/2015 03:22:46 PM,04/23/2015 11:29:26 AM,OVERDUE,Closed,Case Closed Case Resolved request filled new cart # 0714423630 04/22/2015,Request for Recycling Cart,Public Works Department,Recycling,Request for Recycling Cart,PWDx_Recycling,PWDx,,,21-23 Monument St  Charlestown  MA  02129,3.0,1A,1.0,A15,Charlestown,2.0,Ward 2,204.0,R2,21-23 Monument St,2129.0,Address,97145.0,42.3778,-71.0598,Employee Generated,"(42.3778, -71.0598)"
541391,101001343812,03/27/2015 03:30:22 PM,04/17/2015 03:30:22 PM,04/27/2015 01:39:49 PM,OVERDUE,Closed,Case Closed Case Resolved RECYCLING CART LIST REQUEST FILLED NEW CART #0415313503 04/25/2015,Request for Recycling Cart,Public Works Department,Recycling,Request for Recycling Cart,PWDx_Recycling,PWDx,,,29 Easton St  Allston  MA  02134,11.0,04,9.0,D14,Allston / Brighton,15.0,Ward 22,2201.0,R2,29 Easton St,2134.0,Address,50990.0,42.3602,-71.1305,Constituent Call,"(42.3602, -71.1305)"
541392,101001343813,03/27/2015 03:31:21 PM,05/28/2015 03:31:00 PM,06/09/2015 12:18:22 PM,OVERDUE,Closed,Case Closed. Closed date : 2015-06-09 12:18:22.32 Case Resolved cart requested filled new cart #0415313550 06/08/2015,Request for Recycling Cart,Public Works Department,Recycling,Request for Recycling Cart,PWDx_Recycling,PWDx,,,26 Marden Ave  Dorchester  MA  02124,8.0,07,4.0,B3,Greater Mattapan,9.0,Ward 14,1413.0,CD,26 Marden Ave,2124.0,Address,89644.0,42.2846,-71.0869,Constituent Call,"(42.2846, -71.0869)"
541394,101001343815,03/27/2015 03:34:00 PM,05/28/2015 03:34:00 PM,06/03/2015 01:03:05 PM,OVERDUE,Closed,Case Closed. Closed date : 2015-06-03 13:03:05.03 Case Resolved cart requested filled new cart #0415302449 05/27/15,Request for Recycling Cart,Public Works Department,Recycling,Request for Recycling Cart,PWDx_Recycling,PWDx,,,218 Wren St  West Roxbury  MA  02132,12.0,06,6.0,E5,West Roxbury,12.0,Ward 20,2010.0,R1,218 Wren St,2132.0,Address,152894.0,42.2778,-71.1459,Constituent Call,"(42.2778, -71.1459)"
541395,101001343816,03/27/2015 03:34:17 PM,05/28/2015 03:34:00 PM,05/15/2015 11:26:57 AM,ONTIME,Closed,Case Closed. Closed date : 2015-05-15 11:26:57.707 Case Resolved cart requested filled new cart#0415302397 05/14/2015,Request for Recycling Cart,Public Works Department,Recycling,Request for Recycling Cart,PWDx_Recycling,PWDx,,,73-75 Wachusett St  Jamaica Plain  MA  02130,12.0,02,6.0,E13,Jamaica Plain,10.0,19,1907.0,,73-75 Wachusett St,2130.0,Address,345011.0,42.3594,-71.0587,Constituent Call,"(0, 0)"
541410,101001343835,03/27/2015 03:54:58 PM,05/28/2015 03:54:00 PM,04/28/2015 10:15:41 AM,ONTIME,Closed,Case Closed Duplicate of Existing Case  Reference#101001353835,Request for Recycling Cart,Public Works Department,Recycling,Request for Recycling Cart,PWDx_Recycling,PWDx,,,14 Emerson St  South Boston  MA  02127,6.0,05,2.0,C6,South Boston / South Boston Waterfront,5.0,Ward 6,605.0,E,14 Emerson St,2127.0,Address,53553.0,42.3367,-71.0435,Employee Generated,"(42.3367, -71.0435)"
541416,101001343841,03/27/2015 04:02:53 PM,04/17/2015 04:02:53 PM,04/24/2015 10:04:57 AM,OVERDUE,Closed,Case Closed Case Resolved Cart requested filled new cart #0814423963 04/17/2015,Request for Recycling Cart,Public Works Department,Recycling,Request for Recycling Cart,PWDx_Recycling,PWDx,,,15 Elmdale St  Dorchester  MA  02122,8.0,07,3.0,C11,Dorchester,7.0,Ward 16,1605.0,R1,15 Elmdale St,2122.0,Address,53273.0,42.2942,-71.0555,Constituent Call,"(42.2942, -71.0555)"
541417,101001343842,03/27/2015 04:02:55 PM,04/17/2015 04:02:55 PM,04/06/2015 12:37:19 PM,ONTIME,Closed,Case Closed Case Resolved new cart swapped new cart #0514000713 04/03/15,Request for Recycling Cart,Public Works Department,Recycling,Request for Recycling Cart,PWDx_Recycling,PWDx,,,164 Baker St  West Roxbury  MA  02132,12.0,06,6.0,E5,West Roxbury,12.0,Ward 20,2016.0,R1,164 Baker St,2132.0,Address,7655.0,42.2751,-71.1673,Constituent Call,"(42.2751, -71.1673)"
541425,101001343850,03/27/2015 04:06:31 PM,04/17/2015 04:06:31 PM,04/27/2015 01:28:56 PM,OVERDUE,Closed,Case Closed Case Resolved RECYCLING CART LIST REQUEST FILLED NEW CART #0415313516 04/24/2015,Request for Recycling Cart,Public Works Department,Recycling,Request for Recycling Cart,PWDx_Recycling,PWDx,,,19-21 Ely Rd  Dorchester  MA  02124,8.0,07,3.0,C11,Dorchester,7.0,Ward 16,1611.0,R2,19-21 Ely Rd,2124.0,Address,53480.0,42.2828,-71.0579,Constituent Call,"(42.2828, -71.0579)"
541443,101001343870,03/27/2015 04:18:21 PM,04/17/2015 04:18:21 PM,04/07/2015 03:00:26 PM,ONTIME,Closed,Case Closed Case Resolved new cart swapped new cart #0714424278 04/06/15,Request for Recycling Cart,Public Works Department,Recycling,Request for Recycling Cart,PWDx_Recycling,PWDx,,,49 Monument Sq  Charlestown  MA  02129,3.0,1A,1.0,A15,Charlestown,2.0,Ward 2,203.0,CM,49 Monument Sq,2129.0,Address,97083.0,42.3753,-71.0606,Constituent Call,"(42.3753, -71.0606)"
541470,101001343917,03/27/2015 05:57:13 PM,05/28/2015 08:30:00 AM,06/05/2015 07:29:36 AM,OVERDUE,Closed,Case Closed. Closed date : 2015-06-05 07:29:36.417 Case Resolved Cart requested filled new cart #0415302453 06/02/2015,Request for Recycling Cart,Public Works Department,Recycling,Request for Recycling Cart,PWDx_Recycling,PWDx,,,23 Clive St  Jamaica Plain  MA  02130,9.0,02,6.0,E13,Jamaica Plain,11.0,Ward 19,1901.0,R4,23 Clive St,2130.0,Address,34063.0,42.3172,-71.1084,Constituent Call,"(42.3172, -71.1084)"
541512,101001343987,03/27/2015 09:39:36 PM,05/28/2015 08:30:00 AM,06/02/2015 11:39:14 AM,OVERDUE,Closed,Case Closed. Closed date : 2015-06-02 11:39:14.05 Case Resolved cart requested filled new cart # 0415313558 06/01/2015,Request for Recycling Cart,Public Works Department,Recycling,Request for Recycling Cart,PWDx_Recycling,PWDx,,,234 Lexington St  East Boston  MA  02128,1.0,09,1.0,A7,East Boston,1.0,Ward 1,109.0,R3,234 Lexington St,2128.0,Address,85608.0,42.3801,-71.0315,Constituent Call,"(42.3801, -71.0315)"
541522,101001344002,03/27/2015 10:49:37 PM,04/21/2015 08:30:00 AM,04/24/2015 02:01:30 PM,OVERDUE,Closed,Case Closed Case Resolved Cart request filled new cart # 0514000568 04/23/2015,Request for Recycling Cart,Public Works Department,Recycling,Request for Recycling Cart,PWDx_Recycling,PWDx,,,57 Bradfield Ave  Roslindale  MA  02131,9.0,06,6.0,E5,Roslindale,10.0,Ward 20,2007.0,CD,57 Bradfield Ave,2131.0,Address,18893.0,42.2894,-71.1395,Self Service,"(42.2894, -71.1395)"
541619,101001344148,03/28/2015 02:29:57 PM,04/21/2015 08:30:00 AM,04/24/2015 02:20:20 PM,OVERDUE,Closed,Case Closed Case Resolved Cart request filled new cart # 0514000476 04/23/2015,Request for Recycling Cart,Public Works Department,Recycling,Request for Recycling Cart,PWDx_Recycling,PWDx,,,288 Sumner St  East Boston  MA  02128,1.0,09,1.0,A7,East Boston,1.0,Ward 1,103.0,R4,288 Sumner St,2128.0,Address,132369.0,42.3678,-71.0369,Self Service,"(42.3678, -71.0369)"
541653,101001344204,03/28/2015 07:16:02 PM,04/21/2015 08:30:00 AM,04/13/2015 03:05:53 PM,ONTIME,Closed,Case Closed Case Resolved BROKEN CART SWAPPED NEW CART #015400831 04/10/2015,Request for Recycling Cart,Public Works Department,Recycling,Request for Recycling Cart,PWDx_Recycling,PWDx,,,23 Caton St  Mattapan  MA  02126,8.0,08,5.0,E18,Hyde Park,9.0,Ward 18,1805.0,R1,23 Caton St,2126.0,Address,26480.0,42.2657,-71.1008,Self Service,"(42.2657, -71.1008)"
541671,101001344235,03/29/2015 08:19:53 AM,05/28/2015 08:30:00 AM,06/05/2015 07:37:26 AM,OVERDUE,Closed,Case Closed. Closed date : 2015-06-05 07:37:26.653 Case Resolved Cart requested filled new cart #0415302493 06/02/2015,Request for Recycling Cart,Public Works Department,Recycling,Request for Recycling Cart,PWDx_Recycling,PWDx,,,7 Mcdonough Ct  Hyde Park  MA  02136,12.0,08,5.0,E18,Hyde Park,10.0,Ward 18,1820.0,R1,7 Mcdonough Ct,2136.0,Address,93433.0,42.2429,-71.135,Self Service,"(42.2429, -71.135)"
541811,101001344438,03/29/2015 07:28:07 PM,04/21/2015 08:30:00 AM,04/27/2015 01:36:45 PM,OVERDUE,Closed,Case Closed Case Resolved RECYCLING CART LIST REQUEST FILLED NEW CART #0415313508 04/24/2015,Request for Recycling Cart,Public Works Department,Recycling,Request for Recycling Cart,PWDx_Recycling,PWDx,,,59 Horace St  East Boston  MA  02128,1.0,09,1.0,A7,East Boston,1.0,Ward 1,111.0,R1,59 Horace St,2128.0,Address,75333.0,42.382,-71.0175,Constituent Call,"(42.382, -71.0175)"
541838,101001344472,03/30/2015 06:56:15 AM,04/21/2015 08:30:00 AM,04/13/2015 03:02:46 PM,ONTIME,Closed,Case Closed Case Resolved BROKEN CART SWAPPED NEW CART #0154000836 04/10/2015,Request for Recycling Cart,Public Works Department,Recycling,Request for Recycling Cart,PWDx_Recycling,PWDx,,,195 Cambridge St  Allston  MA  02134,11.0,04,9.0,D14,Allston / Brighton,15.0,Ward 22,2201.0,R3,195 Cambridge St,2134.0,Address,158824.0,42.3585,-71.1255,Self Service,"(42.3585, -71.1255)"
541865,101001344505,03/30/2015 07:44:05 AM,04/21/2015 08:30:00 AM,04/24/2015 02:23:31 PM,OVERDUE,Closed,Case Closed Case Resolved Cart request filled new cart # 0714423761 04/23/2015,Request for Recycling Cart,Public Works Department,Recycling,Request for Recycling Cart,PWDx_Recycling,PWDx,,,64 Beech Glen St  Roxbury  MA  02119,9.0,10B,7.0,B2,Roxbury,13.0,Ward 11,1101.0,R1,64 Beech Glen St,2119.0,Address,13358.0,42.3243,-71.094,Constituent Call,"(42.3243, -71.094)"
541944,101001344636,03/30/2015 09:04:00 AM,05/28/2015 09:03:00 AM,06/03/2015 01:12:41 PM,OVERDUE,Closed,Case Closed. Closed date : 2015-06-03 13:12:41.457 Case Resolved cart requested filled new cart #0415302610 04/29/2015,Request for Recycling Cart,Public Works Department,Recycling,Request for Recycling Cart,PWDx_Recycling,PWDx,,,690 Dorchester Ave  South Boston  MA  02127,6.0,05,2.0,C6,South Boston / South Boston Waterfront,5.0,Ward 7,707.0,CD,690 Dorchester Ave,2127.0,Address,48690.0,42.3267,-71.0567,Employee Generated,"(42.3267, -71.0567)"
541970,101001344673,03/30/2015 09:26:11 AM,04/21/2015 09:26:11 AM,04/06/2015 12:39:01 PM,ONTIME,Closed,Case Closed Case Resolved new cart swapped new cart # 0514000680 04/03/15,Request for Recycling Cart,Public Works Department,Recycling,Request for Recycling Cart,PWDx_Recycling,PWDx,,,9-11 S Munroe Ter  Dorchester  MA  02122,8.0,07,3.0,C11,Dorchester,7.0,Ward 16,1607.0,R2,9-11 S Munroe Ter,2122.0,Address,99464.0,42.2926,-71.0511,Constituent Call,"(42.2926, -71.0511)"
541977,101001344682,03/30/2015 09:31:00 AM,05/28/2015 09:31:00 AM,08/20/2015 12:33:16 PM,OVERDUE,Closed,Case Closed Case Resolved  already delivered duplicate case,Request for Recycling Cart,Public Works Department,Recycling,Request for Recycling Cart,PWDx_Recycling,PWDx,,,306 Athens St  South Boston  MA  02127,,,0.0,,South Boston / South Boston Waterfront,0.0,06,,,306 Athens St,2127.0,Address,348615.0,42.3594,-71.0587,Employee Generated,"(0, 0)"
542012,101001344733,03/30/2015 10:14:58 AM,04/21/2015 10:14:58 AM,04/13/2015 03:06:27 PM,ONTIME,Closed,Case Closed Case Resolved BROKEN CART SWAPPED NEW CART #0514000803 04/10/15,Request for Recycling Cart,Public Works Department,Recycling,Request for Recycling Cart,PWDx_Recycling,PWDx,,,1-3 Sefton St  Mattapan  MA  02126,8.0,08,5.0,E18,Hyde Park,10.0,Ward 18,1806.0,R2,1-3 Sefton St,2126.0,Address,124836.0,42.2709,-71.1066,Constituent Call,"(42.2709, -71.1066)"
542127,101001344880,03/30/2015 12:16:13 PM,05/28/2015 12:16:00 PM,06/11/2015 02:21:01 PM,OVERDUE,Closed,Case Closed. Closed date : 2015-06-11 14:21:01.933 Case Resolved cart requested filled new cart#0415313544 06/09/2015,Request for Recycling Cart,Public Works Department,Recycling,Request for Recycling Cart,PWDx_Recycling,PWDx,,,1849 Hyde Park Ave  Hyde Park  MA  02136,12.0,08,5.0,E18,Hyde Park,10.0,Ward 18,1820.0,R3,1849 Hyde Park Ave,2136.0,Address,77231.0,42.236,-71.1327,Constituent Call,"(42.236, -71.1327)"
542147,101001344908,03/30/2015 12:37:04 PM,04/21/2015 12:37:03 PM,04/27/2015 01:33:06 PM,OVERDUE,Closed,Case Closed Case Resolved RECYCLING CART LIST REQUEST FILLED NEW CART #0415313513 04/24/15,Request for Recycling Cart,Public Works Department,Recycling,Request for Recycling Cart,PWDx_Recycling,PWDx,,,95 Navarre St  Hyde Park  MA  02136,12.0,08,5.0,E18,Hyde Park,10.0,Ward 18,1808.0,R1,95 Navarre St,2136.0,Address,100434.0,42.2753,-71.1175,Constituent Call,"(42.2753, -71.1175)"
542197,101001344988,03/30/2015 01:26:33 PM,04/21/2015 01:26:33 PM,04/13/2015 03:03:39 PM,ONTIME,Closed,Case Closed Case Resolved BROKEN CART SWAPPED NEW CART #015400834 04/10/2015,Request for Recycling Cart,Public Works Department,Recycling,Request for Recycling Cart,PWDx_Recycling,PWDx,,,4 Athol St  Allston  MA  02134,11.0,04,9.0,D14,Allston / Brighton,15.0,Ward 22,2202.0,R3,4 Athol St,2134.0,Address,5914.0,42.3614,-71.134,Self Service,"(42.3614, -71.134)"
542350,101001345194,03/30/2015 04:08:04 PM,04/21/2015 04:08:04 PM,04/24/2015 02:18:59 PM,OVERDUE,Closed,Case Closed Case Resolved Cart request filled new cart # 0714423879 04/23/2015,Request for Recycling Cart,Public Works Department,Recycling,Request for Recycling Cart,PWDx_Recycling,PWDx,,,10 Pine Ridge Rd  Mattapan  MA  02126,8.0,07,3.0,B3,Dorchester,7.0,Ward 17,1712.0,R1,10 Pine Ridge Rd,2126.0,Address,110823.0,42.2777,-71.0763,Constituent Call,"(42.2777, -71.0763)"
542362,101001345212,03/30/2015 04:31:48 PM,04/21/2015 04:31:47 PM,04/21/2015 08:49:14 AM,ONTIME,Closed,Case Closed Case Resolved Cart requested swapped out new cart # 0714424141 04/02/15,Request for Recycling Cart,Public Works Department,Recycling,Request for Recycling Cart,PWDx_Recycling,PWDx,,,92 Marlborough St  Boston  MA  02116,4.0,1C,8.0,D4,Back Bay,14.0,Ward 5,506.0,A,92 Marlborough St,2116.0,Address,91610.0,42.3533,-71.0763,Constituent Call,"(42.3533, -71.0763)"
542443,101001345334,03/30/2015 07:46:09 PM,05/28/2015 08:30:00 AM,05/29/2015 02:21:08 PM,OVERDUE,Closed,Case Closed. Closed date : 2015-05-29 14:21:08.393 Case Resolved cart requested filled new cart#0415302619 05/27/15,Request for Recycling Cart,Public Works Department,Recycling,Request for Recycling Cart,PWDx_Recycling,PWDx,,,30 Everett St  Jamaica Plain  MA  02130,9.0,02,6.0,E13,Jamaica Plain,11.0,Ward 19,1906.0,CD,30 Everett St,2130.0,Address,55214.0,42.309,-71.1089,Constituent Call,"(42.309, -71.1089)"
542498,101001345417,03/31/2015 06:54:50 AM,05/28/2015 08:30:00 AM,05/29/2015 02:24:42 PM,OVERDUE,Closed,Case Closed. Closed date : 2015-05-29 14:24:42.643 Case Resolved cart requested filled new cart#0415302267 05/27/15,Request for Recycling Cart,Public Works Department,Recycling,Request for Recycling Cart,PWDx_Recycling,PWDx,,,115 Bowdoin St  Dorchester  MA  02122,7.0,03,4.0,C11,Dorchester,8.0,Ward 15,1505.0,R2,115 Bowdoin St,2122.0,Address,192055.0,42.3028,-71.0713,Self Service,"(42.3028, -71.0713)"
542503,101001345422,03/31/2015 07:14:00 AM,05/28/2015 08:30:00 AM,06/04/2015 03:03:36 PM,OVERDUE,Closed,Case Closed. Closed date : 2015-06-04 15:03:36.947 Case Resolved Cart requested filled new cart #0415302498 05/27/15,Request for Recycling Cart,Public Works Department,Recycling,Request for Recycling Cart,PWDx_Recycling,PWDx,,,9 Faulkner St  Dorchester  MA  02122,7.0,07,3.0,C11,Dorchester,7.0,Ward 16,1601.0,R3,9 Faulkner St,2122.0,Address,233752.0,42.2998,-71.0609,Constituent Call,"(42.2998, -71.0609)"
542505,101001345425,03/31/2015 07:16:11 AM,05/28/2015 08:30:00 AM,04/28/2015 10:12:56 AM,ONTIME,Closed,Case Closed Duplicate of Existing Case  one cart per house hold reference # 101001345422,Request for Recycling Cart,Public Works Department,Recycling,Request for Recycling Cart,PWDx_Recycling,PWDx,,,9 Faulkner St  Dorchester  MA  02122,7.0,07,3.0,C11,Dorchester,7.0,Ward 16,1601.0,R3,9 Faulkner St,2122.0,Address,233751.0,42.2998,-71.0609,Constituent Call,"(42.2998, -71.0609)"
542506,101001345426,03/31/2015 07:17:40 AM,05/28/2015 08:30:00 AM,04/28/2015 10:13:53 AM,ONTIME,Closed,Case Closed Duplicate of Existing Case  Reference # 101001345422 one cart per house,Request for Recycling Cart,Public Works Department,Recycling,Request for Recycling Cart,PWDx_Recycling,PWDx,,,9 Faulkner St  Dorchester  MA  02122,7.0,07,3.0,C11,Dorchester,7.0,Ward 16,1601.0,R3,9 Faulkner St,2122.0,Address,233753.0,42.2998,-71.0609,Constituent Call,"(42.2998, -71.0609)"
542509,101001345429,03/31/2015 07:20:10 AM,04/22/2015 08:30:00 AM,05/06/2015 01:47:42 PM,OVERDUE,Closed,Case Closed. Closed date : 2015-05-06 13:47:42.117 Case Resolved cart request filled new cart # 0415302447 05/05/2015,Request for Recycling Cart,Public Works Department,Recycling,Request for Recycling Cart,PWDx_Recycling,PWDx,,,9 Faulkner St  Dorchester  MA  02122,7.0,07,3.0,C11,Dorchester,7.0,Ward 16,1601.0,R3,9 Faulkner St,2122.0,Address,233751.0,42.2998,-71.0609,Constituent Call,"(42.2998, -71.0609)"
542533,101001345463,03/31/2015 08:11:54 AM,05/29/2015 08:30:00 AM,05/08/2015 10:09:53 AM,ONTIME,Closed,Case Closed. Closed date : 2015-05-08 10:09:53.56 Case Resolved cart requested filled new cart #0514302547 04/30/2015,Request for Recycling Cart,Public Works Department,Recycling,Request for Recycling Cart,PWDx_Recycling,PWDx,,,15-19 Taylor St  Dorchester  MA  02122,8.0,07,3.0,C11,Dorchester,7.0,16,1610.0,,15-19 Taylor St,2122.0,Address,343512.0,42.2858,-71.0407,Constituent Call,"(42.2858, -71.0407)"
542677,101001345652,03/31/2015 09:47:26 AM,05/29/2015 09:47:00 AM,05/08/2015 10:10:22 AM,ONTIME,Closed,Case Closed. Closed date : 2015-05-08 10:10:22.99 Case Resolved cart requested filled new cart #0514302544 04/30/2015,Request for Recycling Cart,Public Works Department,Recycling,Request for Recycling Cart,PWDx_Recycling,PWDx,,,34-36 Lenoxdale Ave  Dorchester  MA  02124,8.0,07,3.0,C11,Dorchester,7.0,Ward 16,1612.0,R2,34-36 Lenoxdale Ave,2124.0,Address,85096.0,42.281,-71.054,Constituent Call,"(42.281, -71.054)"
542683,101001345658,03/31/2015 09:49:44 AM,05/28/2015 09:49:00 AM,05/08/2015 10:05:19 AM,ONTIME,Closed,Case Closed. Closed date : 2015-05-08 10:05:19.237 Case Resolved cart requested filled new cart #0714423579 05/07/2015,Request for Recycling Cart,Public Works Department,Recycling,Request for Recycling Cart,PWDx_Recycling,PWDx,,,112 Hutchings St  Dorchester  MA  02121,9.0,10B,7.0,B2,Roxbury,13.0,Ward 12,1209.0,R3,112 Hutchings St,2121.0,Address,76896.0,42.3115,-71.0922,Constituent Call,"(42.3115, -71.0922)"
542733,101001345721,03/31/2015 10:36:46 AM,04/22/2015 10:36:46 AM,04/23/2015 11:30:16 AM,OVERDUE,Closed,Case Closed Case Resolved request filled new cart # 0714423629 04/22/15,Request for Recycling Cart,Public Works Department,Recycling,Request for Recycling Cart,PWDx_Recycling,PWDx,,,25 Salem St  Charlestown  MA  02129,3.0,1A,1.0,A15,Charlestown,2.0,Ward 2,206.0,R1,25 Salem St,2129.0,Address,121973.0,42.3777,-71.0658,Employee Generated,"(42.3777, -71.0658)"
542750,101001345741,03/31/2015 10:48:32 AM,05/28/2015 10:48:00 AM,04/30/2015 01:51:18 PM,ONTIME,Closed,Case Closed Case Resolved cart requested filled new cart #0514302226 04/29/2015,Request for Recycling Cart,Public Works Department,Recycling,Request for Recycling Cart,PWDx_Recycling,PWDx,,,37 Rossmore Rd  Jamaica Plain  MA  02130,9.0,02,6.0,E13,Jamaica Plain,11.0,Ward 11,1108.0,CM,37 Rossmore Rd,2130.0,Address,118824.0,42.3046,-71.1071,Constituent Call,"(42.3046, -71.1071)"
542808,101001345836,03/31/2015 12:09:31 PM,05/28/2015 12:09:00 PM,05/12/2015 12:16:20 PM,ONTIME,Closed,Case Closed. Closed date : 2015-05-12 12:16:20.617 Case Resolved cart requested filled new cart # 0415302939 05/11/2015,Request for Recycling Cart,Public Works Department,Recycling,Request for Recycling Cart,PWDx_Recycling,PWDx,,,234 South St  Jamaica Plain  MA  02130,9.0,02,6.0,E13,Jamaica Plain,11.0,Ward 11,1110.0,R1,234 South St,2130.0,Address,128805.0,42.3022,-71.1142,Constituent Call,"(42.3022, -71.1142)"
542854,101001345888,03/31/2015 12:41:49 PM,05/28/2015 12:41:00 PM,06/05/2015 07:40:32 AM,OVERDUE,Closed,Case Closed. Closed date : 2015-06-05 07:40:32.223 Case Resolved Cart requested filled new cart #0415302647 06/02/2015,Request for Recycling Cart,Public Works Department,Recycling,Request for Recycling Cart,PWDx_Recycling,PWDx,,,342 Princeton St  East Boston  MA  02128,1.0,09,1.0,A7,East Boston,1.0,01,109.0,,342 Princeton St,2128.0,Address,350627.0,42.3594,-71.0587,Constituent Call,"(0, 0)"
542873,101001345907,03/31/2015 12:55:58 PM,04/22/2015 12:55:58 PM,04/13/2015 03:04:26 PM,ONTIME,Closed,Case Closed Case Resolved BROKEN CART SWAPPED NEW CART #015400806 04/10/2015,Request for Recycling Cart,Public Works Department,Recycling,Request for Recycling Cart,PWDx_Recycling,PWDx,,,107-109 Hooker St  Allston  MA  02134,11.0,04,9.0,D14,Allston / Brighton,15.0,Ward 22,2201.0,R3,107-109 Hooker St,2134.0,Address,75161.0,42.3592,-71.1257,Constituent Call,"(42.3592, -71.1257)"
543070,101001346185,03/31/2015 03:59:47 PM,05/29/2015 03:59:00 PM,06/05/2015 07:34:48 AM,OVERDUE,Closed,Case Closed. Closed date : 2015-06-05 07:34:48.887 Case Resolved Cart requested filled new cart #0415302448 06/02/2015,Request for Recycling Cart,Public Works Department,Recycling,Request for Recycling Cart,PWDx_Recycling,PWDx,,,707 W Roxbury Pkwy  West Roxbury  MA  02132,12.0,06,6.0,E5,West Roxbury,12.0,Ward 20,2010.0,R1,707 W Roxbury Pkwy,2132.0,Address,119252.0,42.281,-71.1455,Self Service,"(42.281, -71.1455)"
543102,101001346239,03/31/2015 05:48:17 PM,05/28/2015 08:30:00 AM,06/05/2015 07:35:24 AM,OVERDUE,Closed,Case Closed. Closed date : 2015-06-05 07:35:24.833 Case Resolved Cart requested filled new cart #0415302609 06/02/2015,Request for Recycling Cart,Public Works Department,Recycling,Request for Recycling Cart,PWDx_Recycling,PWDx,,,4 Hooper St  Dorchester  MA  02124,8.0,07,4.0,C11,Dorchester,9.0,Ward 17,1703.0,R1,4 Hooper St,2124.0,Address,75191.0,42.2949,-71.0689,Constituent Call,"(42.2949, -71.0689)"
543255,101001346460,04/01/2015 08:31:39 AM,05/28/2015 08:31:00 AM,06/05/2015 07:35:53 AM,OVERDUE,Closed,Case Closed. Closed date : 2015-06-05 07:35:53.29 Case Resolved Cart requested filled new cart #0415302608 06/02/2015,Request for Recycling Cart,Public Works Department,Recycling,Request for Recycling Cart,PWDx_Recycling,PWDx,,,247 Norwell St  Dorchester  MA  02124,8.0,07,4.0,B3,Dorchester,9.0,Ward 17,1703.0,R2,247 Norwell St,2124.0,Address,285472.0,42.2939,-71.0781,Constituent Call,"(42.2939, -71.0781)"
543260,101001346466,04/01/2015 08:34:01 AM,04/23/2015 08:34:01 AM,04/24/2015 08:37:59 AM,OVERDUE,Closed,Case Closed Duplicate of Existing Case,Request for Recycling Cart,Public Works Department,Recycling,Request for Recycling Cart,PWDx_IPL Damaged Cart Replacement,PWDx,https://cityworker.cityofboston.gov:8443/attachments/report/551be5b870b4391e011f2ea4/photo/Report.jpg,,14 Floral Pl  Hyde Park  MA  02136,12.0,08,5.0,E18,Hyde Park,10.0,Ward 18,1818.0,R1,14 Floral Pl,2136.0,Address,58777.0,42.2494,-71.119,City Worker App,"(42.2494, -71.119)"
543263,101001346469,04/01/2015 08:34:12 AM,04/23/2015 08:34:12 AM,04/24/2015 08:37:50 AM,OVERDUE,Closed,Case Closed Duplicate of Existing Case,Request for Recycling Cart,Public Works Department,Recycling,Request for Recycling Cart,PWDx_IPL Damaged Cart Replacement,PWDx,https://cityworker.cityofboston.gov:8443/attachments/report/551be5c270b4391e011f2ec5/photo/Report.jpg,,14 Floral Pl  Hyde Park  MA  02136,12.0,08,5.0,E18,Hyde Park,10.0,Ward 18,1818.0,R1,14 Floral Pl,2136.0,Address,58777.0,42.2494,-71.119,City Worker App,"(42.2494, -71.119)"
543329,101001346559,04/01/2015 09:20:30 AM,05/28/2015 09:20:00 AM,05/15/2015 02:09:14 PM,ONTIME,Closed,Case Closed. Closed date : 2015-05-15 14:09:14.333 Case Resolved cart requested new cart#0514302585 04/29/2015,Request for Recycling Cart,Public Works Department,Recycling,Request for Recycling Cart,PWDx_Recycling,PWDx,,,15 Jeffries St  East Boston  MA  02128,1.0,09,1.0,A7,East Boston,1.0,Ward 1,101.0,R1,15 Jeffries St,2128.0,Address,79585.0,42.3654,-71.0293,Constituent Call,"(42.3654, -71.0293)"
543344,101001346581,04/01/2015 09:32:33 AM,05/29/2015 09:32:00 AM,05/15/2015 02:07:34 PM,ONTIME,Closed,Case Closed. Closed date : 2015-05-15 14:07:34.773 Case Resolved cart requested new cart#0415313022 04/29/2015,Request for Recycling Cart,Public Works Department,Recycling,Request for Recycling Cart,PWDx_Recycling,PWDx,,,215-217 I St  South Boston  MA  02127,6.0,05,2.0,C6,South Boston / South Boston Waterfront,5.0,Ward 7,702.0,R1,215-217 I St,2127.0,Address,77871.0,42.3309,-71.04,Constituent Call,"(42.3309, -71.04)"
543434,101001346702,04/01/2015 10:32:56 AM,05/29/2015 10:32:00 AM,05/15/2015 11:43:33 AM,ONTIME,Closed,Case Closed. Closed date : 2015-05-15 11:43:33.527 Case Resolved cart requested new cart#04152299 05/14/2015,Request for Recycling Cart,Public Works Department,Recycling,Request for Recycling Cart,PWDx_Recycling,PWDx,,,88 W Third St  South Boston  MA  02127,6.0,05,2.0,C6,South Boston / South Boston Waterfront,5.0,Ward 6,601.0,R1,88 W Third St,2127.0,Address,135449.0,42.3414,-71.0525,Constituent Call,"(42.3414, -71.0525)"
543498,101001346773,04/01/2015 11:10:31 AM,04/23/2015 11:10:31 AM,04/10/2015 11:02:24 AM,ONTIME,Closed,Case Closed Case Resolved broken cart swapped new cart #07144242269 04/09/2015,Request for Recycling Cart,Public Works Department,Recycling,Request for Recycling Cart,PWDx_Recycling,PWDx,,,74 Georgia St  Dorchester  MA  02121,9.0,10B,7.0,B2,Roxbury,13.0,Ward 12,1202.0,CM,74 Georgia St,2121.0,Address,63493.0,42.3102,-71.0855,Constituent Call,"(42.3102, -71.0855)"
543499,101001346774,04/01/2015 11:11:58 AM,04/30/2015 11:11:00 AM,04/30/2015 09:40:28 AM,ONTIME,Closed,Case Closed Case Resolved cart request filled new cart#0714423825 4/17/2015,Request for Recycling Cart,Public Works Department,Recycling,Request for Recycling Cart,PWDx_Recycling,PWDx,,,24 Worthington St  Mission Hill  MA  02120,9.0,10A,8.0,B2,Mission Hill,14.0,Ward 10,1002.0,R2,24 Worthington St,2120.0,Address,152838.0,42.3344,-71.1023,Constituent Call,"(42.3344, -71.1023)"
543501,101001346776,04/01/2015 11:12:28 AM,04/23/2015 11:12:28 AM,04/08/2015 09:12:17 AM,ONTIME,Closed,Case Closed Case Resolved new cart swapped new cart # 0714424050 04/07/15,Request for Recycling Cart,Public Works Department,Recycling,Request for Recycling Cart,PWDx_Recycling,PWDx,,,1031 Tremont St  Mission Hill  MA  02120,9.0,10B,7.0,D4,Roxbury,13.0,Ward 9,904.0,RC,1031 Tremont St,2120.0,Address,320366.0,42.3368,-71.0854,Constituent Call,"(42.3368, -71.0854)"
543505,101001346780,04/01/2015 11:13:03 AM,04/23/2015 11:13:03 AM,04/13/2015 03:04:57 PM,ONTIME,Closed,Case Closed Case Resolved BROKEN CART SWAPPED NEW CART #0154000771 04/10/2015,Request for Recycling Cart,Public Works Department,Recycling,Request for Recycling Cart,PWDx_Recycling,PWDx,,,17 Holman St  Allston  MA  02134,11.0,04,9.0,D14,Allston / Brighton,15.0,Ward 22,2201.0,R2,17 Holman St,2134.0,Address,74768.0,42.3587,-71.1296,Constituent Call,"(42.3587, -71.1296)"
543548,101001346832,04/01/2015 11:43:01 AM,05/28/2015 11:43:00 AM,06/05/2015 07:38:32 AM,OVERDUE,Closed,Case Closed. Closed date : 2015-06-05 07:38:32.39 Case Resolved Cart requested filled new cart #0415302496 06/02/2015,Request for Recycling Cart,Public Works Department,Recycling,Request for Recycling Cart,PWDx_Recycling,PWDx,,,30 Alwin St  Hyde Park  MA  02136,12.0,08,5.0,E18,Hyde Park,10.0,Ward 18,1819.0,R1,30 Alwin St,2136.0,Address,3062.0,42.2536,-71.1425,Constituent Call,"(42.2536, -71.1425)"
543551,101001346835,04/01/2015 11:46:37 AM,05/28/2015 11:46:00 AM,05/21/2015 02:40:07 PM,ONTIME,Closed,Case Closed. Closed date : 2015-05-21 14:40:07.3 Case Resolved cart requested filled new cart # 0415302924 05/20/15,Request for Recycling Cart,Public Works Department,Recycling,Request for Recycling Cart,PWDx_Recycling,PWDx,,,51 N Beacon St  Brighton  MA  02135,11.0,04,9.0,D14,Allston / Brighton,15.0,Ward 22,2205.0,CM,51 N Beacon St,2135.0,Address,12788.0,42.3541,-71.14,Constituent Call,"(42.3541, -71.14)"
543701,101001347044,04/01/2015 02:18:55 PM,04/23/2015 02:18:55 PM,04/21/2015 08:58:39 AM,ONTIME,Closed,Case Closed Case Resolved Cart requested swapped out new cart #101001347044 04/06/2015,Request for Recycling Cart,Public Works Department,Recycling,Request for Recycling Cart,PWDx_Recycling,PWDx,,,128 Commonwealth Ave  Boston  MA  02116,4.0,1C,8.0,D4,Boston,14.0,05,507.0,CM,128 Commonwealth Ave,2116.0,Address,37259.0,42.3517,-71.0772,Constituent Call,"(42.3517, -71.0772)"
543706,101001347051,04/01/2015 02:28:12 PM,05/29/2015 02:28:00 PM,05/15/2015 02:08:00 PM,ONTIME,Closed,Case Closed. Closed date : 2015-05-15 14:08:00.503 Case Resolved cart requested new cart#0415302671 04/29/2015,Request for Recycling Cart,Public Works Department,Recycling,Request for Recycling Cart,PWDx_Recycling,PWDx,,,215-217 I St  South Boston  MA  02127,6.0,05,2.0,C6,South Boston / South Boston Waterfront,5.0,Ward 7,702.0,R1,215-217 I St,2127.0,Address,77871.0,42.3309,-71.04,Constituent Call,"(42.3309, -71.04)"
543777,101001347146,04/01/2015 04:00:55 PM,04/23/2015 04:00:54 PM,04/09/2015 11:02:34 AM,ONTIME,Closed,Case Closed Case Resolved broken cart swapped new cart number # 0714424041 04/08/2015,Request for Recycling Cart,Public Works Department,Recycling,Request for Recycling Cart,PWDx_Recycling,PWDx,,,8 Cordis St  Charlestown  MA  02129,3.0,1A,1.0,A15,Charlestown,2.0,Ward 2,203.0,R4,8 Cordis St,2129.0,Address,42581.0,42.375,-71.0631,Constituent Call,"(42.375, -71.0631)"
543778,101001347147,04/01/2015 04:01:00 PM,05/28/2015 04:01:00 PM,08/26/2015 01:44:42 PM,OVERDUE,Closed,Case Closed. Closed date : 2015-08-26 13:44:42.213 Case Resolved cart requested filled new cart #0715671633 08/25/2015,Request for Recycling Cart,Public Works Department,Recycling,Request for Recycling Cart,PWDx_Recycling,PWDx,,,48 W Milton St  Hyde Park  MA  02136,12.0,08,5.0,E18,Hyde Park,10.0,Ward 18,1820.0,RL,48 W Milton St,2136.0,Address,95907.0,42.2401,-71.1402,Constituent Call,"(42.2401, -71.1402)"
543784,101001347154,04/01/2015 04:04:00 PM,05/29/2015 04:04:00 PM,09/03/2015 11:29:39 AM,OVERDUE,Closed,Case Closed. Closed date : 2015-09-03 11:29:39.1 Case Resolved cart requested filled new cart #0715671538 09/01/2015,Request for Recycling Cart,Public Works Department,Recycling,Request for Recycling Cart,PWDx_Recycling,PWDx,,,863 E Fourth St  South Boston  MA  02127,6.0,05,2.0,C6,South Boston,5.0,06,609.0,,863 E Fourth St,2127.0,Address,354424.0,42.3594,-71.0587,Constituent Call,"(0, 0)"
543894,101001347292,04/01/2015 06:32:17 PM,05/28/2015 08:30:00 AM,06/19/2015 08:22:32 AM,OVERDUE,Closed,Case Closed. Closed date : 2015-06-19 08:22:32.857 Case Resolved cart requested filled new cart #,Request for Recycling Cart,Public Works Department,Recycling,Request for Recycling Cart,PWDx_Recycling,PWDx,,,166 Amory St  Roxbury  MA  02119,9.0,02,6.0,E13,Jamaica Plain,11.0,11,1104.0,,166 Amory St,2119.0,Address,346485.0,42.3594,-71.0587,Constituent Call,"(0, 0)"
543947,101001347359,04/01/2015 09:12:33 PM,04/24/2015 08:30:00 AM,04/10/2015 11:03:53 AM,ONTIME,Closed,Case Closed Case Resolved broken cart swapped new cart # 0714424270 04/09/2015,Request for Recycling Cart,Public Works Department,Recycling,Request for Recycling Cart,PWDx_Recycling,PWDx,,,38 Homestead St  Dorchester  MA  02121,9.0,10B,7.0,B2,Roxbury,13.0,Ward 12,1208.0,R1,38 Homestead St,2121.0,Address,75133.0,42.3132,-71.0927,Self Service,"(42.3132, -71.0927)"
543975,101001347397,04/02/2015 05:12:33 AM,05/28/2015 08:30:00 AM,05/21/2015 02:39:40 PM,ONTIME,Closed,Case Closed. Closed date : 2015-05-21 14:39:40.617 Case Resolved cart requested filled new cart # 0415302923 05/20/2015,Request for Recycling Cart,Public Works Department,Recycling,Request for Recycling Cart,PWDx_Recycling,PWDx,,,5 Manton Ter  Allston  MA  02134,,04,9.0,D14,Allston / Brighton,15.0,Ward 21,2105.0,R3,5 Manton Ter,2134.0,Address,89190.0,42.3481,-71.1315,Self Service,"(42.3481, -71.1315)"
543997,101001347425,04/02/2015 07:28:44 AM,05/28/2015 08:30:00 AM,06/02/2015 11:50:59 AM,OVERDUE,Closed,Case Closed. Closed date : 2015-06-02 11:50:59.983 Case Resolved cart requested filled new cart # 0415302687 05/29/2015,Request for Recycling Cart,Public Works Department,Recycling,Request for Recycling Cart,PWDx_Recycling,PWDx,,,15 Hatherly Rd  Brighton  MA  02135,11.0,04,9.0,D14,Allston / Brighton,15.0,Ward 22,2209.0,R2,15 Hatherly Rd,2135.0,Address,71207.0,42.343,-71.1545,Constituent Call,"(42.343, -71.1545)"
544062,101001347539,04/02/2015 09:13:55 AM,04/24/2015 09:13:55 AM,04/21/2015 08:54:56 AM,ONTIME,Closed,Case Closed Case Resolved Cart requested swapped out new cart #0714424105 04/10/2015,Request for Recycling Cart,Public Works Department,Recycling,Request for Recycling Cart,PWDx_Recycling,PWDx,,,774 Parker St  Mission Hill  MA  02120,9.0,10A,8.0,B2,Mission Hill,14.0,Ward 10,1005.0,R1,774 Parker St,2120.0,Address,107845.0,42.3298,-71.0984,Constituent Call,"(42.3298, -71.0984)"
544072,101001347560,04/02/2015 09:27:39 AM,05/29/2015 09:27:00 AM,05/15/2015 11:40:44 AM,ONTIME,Closed,Case Closed. Closed date : 2015-05-15 11:40:44.443 Case Resolved cart requested new cart#0415302941 05/14/2015,Request for Recycling Cart,Public Works Department,Recycling,Request for Recycling Cart,PWDx_Recycling,PWDx,,,74-76 Brayton Rd  Brighton  MA  02135,11.0,04,9.0,D14,Allston / Brighton,15.0,Ward 22,2204.0,R2,74-76 Brayton Rd,2135.0,Address,19653.0,42.3486,-71.1703,Constituent Call,"(42.3486, -71.1703)"
544074,101001347562,04/02/2015 09:28:54 AM,05/29/2015 09:28:00 AM,06/08/2015 11:10:55 AM,OVERDUE,Closed,Case Closed. Closed date : 2015-06-08 11:10:55.137 Case Resolved cart requested filled new cart #0415302562 06/04/2015,Request for Recycling Cart,Public Works Department,Recycling,Request for Recycling Cart,PWDx_Recycling,PWDx,,,145 Pleasant St  Dorchester  MA  02125,7.0,03,3.0,C11,Dorchester,7.0,Ward 13,1306.0,R3,145 Pleasant St,2125.0,Address,111170.0,42.3107,-71.0598,Constituent Call,"(42.3107, -71.0598)"
544086,101001347577,04/02/2015 09:36:52 AM,04/24/2015 09:36:52 AM,04/10/2015 11:04:48 AM,ONTIME,Closed,Case Closed Case Resolved broken cart swapped new cart # 0714423994 04/09/2015,Request for Recycling Cart,Public Works Department,Recycling,Request for Recycling Cart,PWDx_Recycling,PWDx,,,119 Regent St  Roxbury  MA  02119,7.0,10B,7.0,B2,Roxbury,13.0,Ward 9,905.0,R3,119 Regent St,2119.0,Address,115148.0,42.3227,-71.0882,Constituent Call,"(42.3227, -71.0882)"
544094,101001347588,04/02/2015 09:41:45 AM,05/30/2015 09:41:00 AM,06/17/2015 02:51:03 PM,OVERDUE,Closed,Case Closed. Closed date : 2015-06-17 14:51:03.183 Case Resolved cart requested filled new cart #0415313622 06/16/2015,Request for Recycling Cart,Public Works Department,Recycling,Request for Recycling Cart,PWDx_Recycling,PWDx,,,68 Brooks St  East Boston  MA  02128,1.0,09,1.0,A7,East Boston,1.0,Ward 1,105.0,R3,68 Brooks St,2128.0,Address,22502.0,42.3766,-71.0335,Constituent Call,"(42.3766, -71.0335)"
544106,101001347606,04/02/2015 09:54:19 AM,05/28/2015 09:54:00 AM,05/18/2015 02:47:46 PM,ONTIME,Closed,Case Closed. Closed date : 2015-05-18 14:47:46.63 Case Resolved request cart filled new cart # 0415313674 05/15/15,Request for Recycling Cart,Public Works Department,Recycling,Request for Recycling Cart,PWDx_Recycling,PWDx,,,262 E St  South Boston  MA  02127,6.0,05,2.0,C6,South Boston / South Boston Waterfront,5.0,Ward 6,602.0,R3,262 E St,2127.0,Address,50569.0,42.3362,-71.0514,Self Service,"(42.3362, -71.0514)"
544143,101001347662,04/02/2015 10:33:23 AM,04/24/2015 10:33:22 AM,04/28/2015 02:27:15 PM,OVERDUE,Closed,Case Closed Duplicate of Existing Case  case reference # 101001347662one cart per household,Request for Recycling Cart,Public Works Department,Recycling,Request for Recycling Cart,PWDx_Recycling,PWDx,,,234 Princeton St  East Boston  MA  02128,1.0,09,1.0,A7,East Boston,1.0,Ward 1,109.0,R3,234 Princeton St,2128.0,Address,113246.0,42.3794,-71.0313,Constituent Call,"(42.3794, -71.0313)"
544147,101001347666,04/02/2015 10:34:58 AM,04/24/2015 10:34:58 AM,04/28/2015 02:26:19 PM,OVERDUE,Closed,Case Closed Duplicate of Existing Case  case reference # 101001347668 one cart per household,Request for Recycling Cart,Public Works Department,Recycling,Request for Recycling Cart,PWDx_Recycling,PWDx,,,234 Princeton St  East Boston  MA  02128,1.0,09,1.0,A7,East Boston,1.0,Ward 1,109.0,R3,234 Princeton St,2128.0,Address,295973.0,42.3794,-71.0313,Constituent Call,"(42.3794, -71.0313)"
544149,101001347668,04/02/2015 10:35:33 AM,05/29/2015 10:35:00 AM,06/05/2015 07:41:00 AM,OVERDUE,Closed,Case Closed. Closed date : 2015-06-05 07:41:00.047 Case Resolved Cart requested filled new cart #0415302651 06/02/2015,Request for Recycling Cart,Public Works Department,Recycling,Request for Recycling Cart,PWDx_Recycling,PWDx,,,234 Princeton St  East Boston  MA  02128,1.0,09,1.0,A7,East Boston,1.0,Ward 1,109.0,R3,234 Princeton St,2128.0,Address,295974.0,42.3794,-71.0313,Constituent Call,"(42.3794, -71.0313)"
544159,101001347686,04/02/2015 10:51:44 AM,05/28/2015 10:51:00 AM,06/02/2015 11:47:04 AM,OVERDUE,Closed,Case Closed. Closed date : 2015-06-02 11:47:04.203 Case Resolved cart requested filled new cart # 0415302525 05/30/2015,Request for Recycling Cart,Public Works Department,Recycling,Request for Recycling Cart,PWDx_Recycling,PWDx,,,36 Thelma Rd  Dorchester  MA  02122,8.0,07,3.0,C11,Dorchester,7.0,Ward 16,1605.0,R3,36 Thelma Rd,2122.0,Address,134725.0,42.2943,-71.0543,Constituent Call,"(42.2943, -71.0543)"
544208,101001347750,04/02/2015 11:48:20 AM,04/24/2015 11:48:20 AM,04/09/2015 11:03:36 AM,ONTIME,Closed,Case Closed Case Resolved broken cart swapped new cart number #0714424044 04/08/2015,Request for Recycling Cart,Public Works Department,Recycling,Request for Recycling Cart,PWDx_Recycling,PWDx,,,125 Bartlett St  Charlestown  MA  02129,3.0,1A,1.0,A15,Charlestown,2.0,Ward 2,206.0,E,125 Bartlett St,2129.0,Address,8424.0,42.3794,-71.0665,Constituent Call,"(42.3794, -71.0665)"
544267,101001347843,04/02/2015 12:44:56 PM,04/24/2015 12:44:55 PM,04/22/2015 02:39:48 PM,ONTIME,Closed,Case Closed Case Resolved cart requested swapped out new cart #0714423970 04/17/2015,Request for Recycling Cart,Public Works Department,Recycling,Request for Recycling Cart,PWDx_Recycling,PWDx,,,69 Paul Gore St  Jamaica Plain  MA  02130,9.0,02,6.0,E13,Jamaica Plain,11.0,Ward 19,1901.0,R3,69 Paul Gore St,2130.0,Address,108600.0,42.3193,-71.108,Constituent Call,"(42.3193, -71.108)"
544339,101001347934,04/02/2015 01:21:33 PM,04/24/2015 01:21:33 PM,04/09/2015 11:04:16 AM,ONTIME,Closed,Case Closed Case Resolved broken cart swapped new cart number #0714424042 04/08/2015,Request for Recycling Cart,Public Works Department,Recycling,Request for Recycling Cart,PWDx_Recycling,PWDx,,,46 Pleasant St  Charlestown  MA  02129,3.0,1A,1.0,A15,Charlestown,2.0,Ward 2,203.0,R3,46 Pleasant St,2129.0,Address,111087.0,42.3754,-71.0623,Constituent Call,"(42.3754, -71.0623)"
544400,101001348025,04/02/2015 01:54:43 PM,04/24/2015 01:54:43 PM,06/23/2015 01:26:51 PM,OVERDUE,Closed,Case Closed. Closed date : 2015-06-23 13:26:51.4 Case Resolved Replaced,Request for Recycling Cart,Public Works Department,Recycling,Request for Recycling Cart,PWDx_IPL Damaged Cart Replacement,PWDx,https://cityworker.cityofboston.gov:8443/attachments/report/551d826270b4391e011f2f9a/photo/Report.jpg,,204 W Ninth St  South Boston  MA  02127,6.0,05,2.0,C6,South Boston / South Boston Waterfront,5.0,Ward 7,705.0,CM,204 W Ninth St,2127.0,Address,102882.0,42.3333,-71.0524,City Worker App,"(42.3333, -71.0524)"
544436,101001348071,04/02/2015 02:22:58 PM,05/29/2015 02:22:00 PM,05/06/2015 01:24:09 PM,ONTIME,Closed,Case Closed. Closed date : 2015-05-06 13:24:09.683 Case Resolved cart request filled new cart # 051400023 4/30/2015,Request for Recycling Cart,Public Works Department,Recycling,Request for Recycling Cart,PWDx_Recycling,PWDx,,,863 Canterbury St  Roslindale  MA  02131,12.0,02,5.0,E18,Roslindale,10.0,Ward 18,1807.0,R1,863 Canterbury St,2131.0,Address,25517.0,42.2807,-71.1146,Constituent Call,"(42.2807, -71.1146)"
544480,101001348134,04/02/2015 03:14:09 PM,05/29/2015 03:14:00 PM,04/30/2015 01:52:02 PM,ONTIME,Closed,Case Closed Case Resolved cart requested filled new cart #0514000591 04/29/2015,Request for Recycling Cart,Public Works Department,Recycling,Request for Recycling Cart,PWDx_Recycling,PWDx,,,20-22 Radcliffe Rd  Allston  MA  02134,11.0,04,9.0,D14,Allston / Brighton,15.0,Ward 21,2106.0,CM,20-22 Radcliffe Rd,2134.0,Address,114274.0,42.3511,-71.1349,Self Service,"(42.3511, -71.1349)"
544513,101001348185,04/02/2015 03:57:53 PM,05/29/2015 03:57:00 PM,04/30/2015 01:52:45 PM,ONTIME,Closed,Case Closed Case Resolved cart requested filled new cart #0514302220 04/29/2015,Request for Recycling Cart,Public Works Department,Recycling,Request for Recycling Cart,PWDx_Recycling,PWDx,,,20-22 Radcliffe Rd  Allston  MA  02134,11.0,04,9.0,D14,Allston / Brighton,15.0,Ward 21,2106.0,CM,20-22 Radcliffe Rd,2134.0,Address,114274.0,42.3511,-71.1349,Self Service,"(42.3511, -71.1349)"
544516,101001348190,04/02/2015 04:05:00 PM,05/29/2015 04:05:00 PM,08/26/2015 01:48:31 PM,OVERDUE,Closed,Case Closed. Closed date : 2015-08-26 13:48:31.043 Case Resolved cart requested filled new cart #0715671349 08/25/2015,Request for Recycling Cart,Public Works Department,Recycling,Request for Recycling Cart,PWDx_Recycling,PWDx,,,41-67 Colborne Rd  Brighton  MA  02135,11.0,04,9.0,D14,Allston / Brighton,15.0,21,2111.0,CM,41-67 Colborne Rd,2135.0,Address,34419.0,42.3438,-71.1465,Self Service,"(42.3438, -71.1465)"
544524,101001348199,04/02/2015 04:11:45 PM,05/29/2015 04:11:00 PM,04/30/2015 01:53:22 PM,ONTIME,Closed,Case Closed Case Resolved cart requested filled new cart #05140000592 04/29/2015,Request for Recycling Cart,Public Works Department,Recycling,Request for Recycling Cart,PWDx_Recycling,PWDx,,,1251 Commonwealth Ave  Allston  MA  02134,11.0,04,9.0,D14,Allston / Brighton,15.0,Ward 21,2105.0,CM,1251 Commonwealth Ave,2134.0,Address,163754.0,42.3501,-71.1326,Self Service,"(42.3501, -71.1326)"
544535,101001348217,04/02/2015 04:20:01 PM,04/24/2015 04:20:01 PM,04/22/2015 02:40:22 PM,ONTIME,Closed,Case Closed Case Resolved cart requested swapped out new cart #0714423969 04/17/2015,Request for Recycling Cart,Public Works Department,Recycling,Request for Recycling Cart,PWDx_Recycling,PWDx,,,95-97 Sheridan St  Jamaica Plain  MA  02130,9.0,02,6.0,E13,Jamaica Plain,11.0,Ward 19,1901.0,R2,95-97 Sheridan St,2130.0,Address,126872.0,42.3194,-71.1064,Self Service,"(42.3194, -71.1064)"
544536,101001348219,04/02/2015 04:21:20 PM,05/29/2015 04:21:00 PM,04/30/2015 01:53:59 PM,ONTIME,Closed,Case Closed Case Resolved cart requested filled new cart #0514502221 04/29/2015,Request for Recycling Cart,Public Works Department,Recycling,Request for Recycling Cart,PWDx_Recycling,PWDx,,,INTERSECTION of Allston St & Commonwealth Ct  Brighton  MA,11.0,04,9.0,D14,Allston / Brighton,15.0,Ward 21,2108.0,,INTERSECTION Allston St & Commonwealth Ct,,Intersection,310.0,42.3459,-71.1392,Self Service,"(42.3459, -71.1392)"
544544,101001348227,04/02/2015 04:25:13 PM,05/29/2015 04:25:00 PM,04/30/2015 01:54:31 PM,ONTIME,Closed,Case Closed Case Resolved cart requested filled new cart #0514302539 04/29/2015,Request for Recycling Cart,Public Works Department,Recycling,Request for Recycling Cart,PWDx_Recycling,PWDx,,,1330 Commonwealth Ave  Allston  MA  02134,11.0,04,9.0,D14,Allston / Brighton,15.0,Ward 21,2108.0,CD,1330 Commonwealth Ave,2134.0,Address,37394.0,42.3479,-71.135,Self Service,"(42.3479, -71.135)"
544548,101001348234,04/02/2015 04:32:35 PM,04/24/2015 04:32:35 PM,04/23/2015 11:48:30 AM,ONTIME,Closed,Case Closed Case Resolved request filled new cart # 0714423960 04/17/2015,Request for Recycling Cart,Public Works Department,Recycling,Request for Recycling Cart,PWDx_Recycling,PWDx,,,100 City Hall Plz  Boston  MA  02108,3.0,1B,1.0,A1,Downtown / Financial District,3.0,Ward 3,306.0,C,100 City Hall Plz,2108.0,Address,207940.0,42.3595,-71.0588,Self Service,"(42.3595, -71.0588)"
544556,101001348247,04/02/2015 04:41:37 PM,04/24/2015 04:41:36 PM,04/24/2015 10:06:24 AM,ONTIME,Closed,Case Closed Case Resolved Cart requested filled new cart #0718423871 04/17/2015,Request for Recycling Cart,Public Works Department,Recycling,Request for Recycling Cart,PWDx_Recycling,PWDx,,,65 Grampian Way  Dorchester  MA  02125,7.0,03,3.0,C11,Dorchester,7.0,Ward 13,1310.0,R2,65 Grampian Way,2125.0,Address,65704.0,42.3117,-71.0488,Constituent Call,"(42.3117, -71.0488)"
544559,101001348250,04/02/2015 04:51:06 PM,05/29/2015 04:51:00 PM,05/14/2015 01:43:12 PM,ONTIME,Closed,Case Closed. Closed date : 2015-05-14 13:43:12.39 Case Resolved cart request filled new cart #0415307483 05/13/15,Request for Recycling Cart,Public Works Department,Recycling,Request for Recycling Cart,PWDx_Recycling,PWDx,,,147 Blue Hill Ave  Roxbury  MA  02119,7.0,10B,7.0,B2,Roxbury,13.0,Ward 12,1204.0,R1,147 Blue Hill Ave,2119.0,Address,16292.0,42.3198,-71.078,Constituent Call,"(42.3198, -71.078)"
544575,101001348276,04/02/2015 05:13:14 PM,05/28/2015 08:30:00 AM,04/30/2015 01:56:35 PM,ONTIME,Closed,Case Closed Case Resolved cart requested filled new cart #0514303225 04/29/2015,Request for Recycling Cart,Public Works Department,Recycling,Request for Recycling Cart,PWDx_Recycling,PWDx,,,42 Cleveland St  Hyde Park  MA  02136,12.0,08,5.0,E18,Hyde Park,10.0,Ward 18,1812.0,R1,42 Cleveland St,2136.0,Address,33865.0,42.2553,-71.1313,Constituent Call,"(42.2553, -71.1313)"
544637,101001348362,04/02/2015 09:34:42 PM,05/29/2015 08:30:00 AM,05/15/2015 02:10:42 PM,ONTIME,Closed,Case Closed. Closed date : 2015-05-15 14:10:42.773 Case Resolved cart requested new cart#0415302660 04/30/2015,Request for Recycling Cart,Public Works Department,Recycling,Request for Recycling Cart,PWDx_Recycling,PWDx,,,2-2A Maynard St  Roslindale  MA  02131,12.0,08,5.0,E18,Roslindale,10.0,Ward 18,1809.0,R2,2-2A Maynard St,2131.0,Address,93281.0,42.2766,-71.1245,Self Service,"(42.2766, -71.1245)"
544714,101001348466,04/03/2015 08:15:01 AM,05/28/2015 08:30:00 AM,05/26/2015 12:14:53 PM,ONTIME,Closed,Case Closed. Closed date : 2015-05-26 12:14:53.813 Case Resolved cart # 0415313656 dropped off on 5/22/15,Request for Recycling Cart,Public Works Department,Recycling,Request for Recycling Cart,PWDx_Recycling,PWDx,,,138 Monsignor Patrick J Lydon Way  Dorchester  MA  02124,8.0,07,3.0,C11,Dorchester,7.0,16,1606.0,R3,138 Monsignor Patrick J Lydon Way,2124.0,Address,279839.0,42.2901,-71.0564,Constituent Call,"(42.2901, -71.0564)"
544845,101001348643,04/03/2015 10:20:26 AM,04/27/2015 10:20:26 AM,04/09/2015 11:05:45 AM,ONTIME,Closed,Case Closed Case Resolved broken cart swapped new cart number #0714424043 04/08/2015,Request for Recycling Cart,Public Works Department,Recycling,Request for Recycling Cart,PWDx_Recycling,PWDx,,,13 Trenton St  Charlestown  MA  02129,3.0,1A,1.0,A15,Charlestown,2.0,Ward 2,204.0,R2,13 Trenton St,2129.0,Address,138213.0,42.3779,-71.0616,Constituent Call,"(42.3779, -71.0616)"
544902,101001348722,04/03/2015 11:26:43 AM,05/29/2015 11:26:00 AM,06/02/2015 11:34:02 AM,OVERDUE,Closed,Case Closed. Closed date : 2015-06-02 11:34:02.16 Case Resolved cart requested filled new cart # 0415302615 06/01/2015,Request for Recycling Cart,Public Works Department,Recycling,Request for Recycling Cart,PWDx_Recycling,PWDx,,,220 Manthorne Rd  West Roxbury  MA  02132,12.0,06,6.0,E5,West Roxbury,12.0,Ward 20,2020.0,R1,220 Manthorne Rd,2132.0,Address,89135.0,42.2943,-71.1559,Constituent Call,"(42.2943, -71.1559)"
544908,101001348733,04/03/2015 11:35:32 AM,04/27/2015 11:35:31 AM,04/10/2015 11:06:03 AM,ONTIME,Closed,Case Closed Case Resolved broken cart swapped new cart # 0714424260 04/09/2015,Request for Recycling Cart,Public Works Department,Recycling,Request for Recycling Cart,PWDx_Recycling,PWDx,,,41 Copeland St  Roxbury  MA  02119,7.0,10B,7.0,B2,Roxbury,13.0,Ward 12,1204.0,R3,41 Copeland St,2119.0,Address,42457.0,42.3223,-71.0802,Constituent Call,"(42.3223, -71.0802)"
544913,101001348742,04/03/2015 11:52:14 AM,05/29/2015 11:52:00 AM,05/15/2015 02:11:10 PM,ONTIME,Closed,Case Closed. Closed date : 2015-05-15 14:11:10.497 Case Resolved cart requested new cart#0415302438 04/30/2015,Request for Recycling Cart,Public Works Department,Recycling,Request for Recycling Cart,PWDx_Recycling,PWDx,,,651-653 Hyde Park Ave  Roslindale  MA  02131,12.0,08,5.0,E18,Roslindale,10.0,Ward 18,1808.0,R3,651-653 Hyde Park Ave,2131.0,Address,77493.0,42.2781,-71.1196,Constituent Call,"(42.2781, -71.1196)"
544915,101001348745,04/03/2015 11:54:13 AM,05/29/2015 11:54:00 AM,06/05/2015 08:36:52 AM,OVERDUE,Closed,Case Closed. Closed date : 2015-06-05 08:36:52.563 Case Resolved Cart requested filled new cart #0415313603 05/18/2015,Request for Recycling Cart,Public Works Department,Recycling,Request for Recycling Cart,PWDx_Recycling,PWDx,,,81 W Eagle St  East Boston  MA  02128,1.0,09,1.0,A7,East Boston,1.0,Ward 1,108.0,R2,81 W Eagle St,2128.0,Address,50785.0,42.3812,-71.0365,Constituent Call,"(42.3812, -71.0365)"
544935,101001348781,04/03/2015 12:41:53 PM,05/28/2015 12:41:00 PM,04/28/2015 02:20:02 PM,ONTIME,Closed,Case Closed Duplicate of Existing Case  case reference # 101001362912 one cart per household,Request for Recycling Cart,Public Works Department,Recycling,Request for Recycling Cart,PWDx_Recycling,PWDx,,,77 Augustus Ave  Roslindale  MA  02131,12.0,06,5.0,E5,Roslindale,10.0,Ward 18,1810.0,CM,77 Augustus Ave,2131.0,Address,6590.0,42.28,-71.1304,Employee Generated,"(42.28, -71.1304)"
544941,101001348791,04/03/2015 12:54:32 PM,05/29/2015 12:54:00 PM,05/12/2015 12:18:19 PM,ONTIME,Closed,Case Closed. Closed date : 2015-05-12 12:18:19.85 Case Resolved cart requested filled new cart # 0415302940 05/11/2015,Request for Recycling Cart,Public Works Department,Recycling,Request for Recycling Cart,PWDx_Recycling,PWDx,,,75 South St  Jamaica Plain  MA  02130,9.0,02,6.0,E13,Jamaica Plain,11.0,11,1109.0,R3,75 South St,2130.0,Address,128943.0,42.3072,-71.1157,Constituent Call,"(42.3072, -71.1157)"
544950,101001348805,04/03/2015 01:11:50 PM,05/29/2015 01:11:00 PM,05/08/2015 10:10:53 AM,ONTIME,Closed,Case Closed. Closed date : 2015-05-08 10:10:53.003 Case Resolved cart requested filled new cart #0514000593 04/30/2015,Request for Recycling Cart,Public Works Department,Recycling,Request for Recycling Cart,PWDx_Recycling,PWDx,,,2005 Dorchester Ave  Dorchester  MA  02124,8.0,07,3.0,C11,Dorchester,7.0,Ward 17,1704.0,R1,2005 Dorchester Ave,2124.0,Address,48465.0,42.2824,-71.0655,Constituent Call,"(42.2824, -71.0655)"
544995,101001348875,04/03/2015 02:16:00 PM,05/28/2015 02:16:00 PM,08/26/2015 01:53:22 PM,OVERDUE,Closed,Case Closed. Closed date : 2015-08-26 13:53:22.653 Case Resolved cart requested filled new cart #715671539 08/25/2015,Request for Recycling Cart,Public Works Department,Recycling,Request for Recycling Cart,PWDx_Recycling,PWDx,,,23-25 Welles Ave  Dorchester  MA  02124,8.0,07,4.0,C11,Dorchester,8.0,Ward 17,1709.0,R2,23-25 Welles Ave,2124.0,Address,147333.0,42.288,-71.07,Constituent Call,"(42.288, -71.07)"
544999,101001348880,04/03/2015 02:24:34 PM,05/29/2015 02:24:00 PM,06/11/2015 02:19:03 PM,OVERDUE,Closed,Case Closed. Closed date : 2015-06-11 14:19:03.647 Case Resolved cart requested filled new cart#0415302367 06/09/2015,Request for Recycling Cart,Public Works Department,Recycling,Request for Recycling Cart,PWDx_Recycling,PWDx,,,23-25 Welles Ave  Dorchester  MA  02124,8.0,07,4.0,C11,Dorchester,8.0,Ward 17,1709.0,R2,23-25 Welles Ave,2124.0,Address,147333.0,42.288,-71.07,Constituent Call,"(42.288, -71.07)"
545018,101001348911,04/03/2015 02:48:23 PM,05/27/2015 02:48:00 PM,06/03/2015 01:28:32 PM,OVERDUE,Closed,Case Closed. Closed date : 2015-06-03 13:28:32.46 Case Resolved cart requested filled new cart #0415313494 05/30/2015,Request for Recycling Cart,Public Works Department,Recycling,Request for Recycling Cart,PWDx_Recycling,PWDx,,,190 Dorchester St  South Boston  MA  02127,6.0,05,2.0,C6,South Boston / South Boston Waterfront,5.0,Ward 7,705.0,R1,190 Dorchester St,2127.0,Address,48926.0,42.3334,-71.0495,Constituent Call,"(42.3334, -71.0495)"
545030,101001348930,04/03/2015 03:04:50 PM,05/27/2015 03:04:00 PM,05/15/2015 12:01:39 PM,ONTIME,Closed,Case Closed. Closed date : 2015-05-15 12:01:39.433 Case Resolved cart requested new cart#0415302434 05/14/2015,Request for Recycling Cart,Public Works Department,Recycling,Request for Recycling Cart,PWDx_Recycling,PWDx,,,756 Saratoga St  East Boston  MA  02128,1.0,09,1.0,A7,East Boston,1.0,Ward 1,111.0,R3,756 Saratoga St,2128.0,Address,122788.0,42.3839,-71.0173,Constituent Call,"(42.3839, -71.0173)"
545038,101001348939,04/03/2015 03:12:23 PM,05/28/2015 03:12:00 PM,06/11/2015 02:21:52 PM,OVERDUE,Closed,Case Closed. Closed date : 2015-06-11 14:21:52.987 Case Resolved cart requested filled new cart#0415302286 06/09/2015,Request for Recycling Cart,Public Works Department,Recycling,Request for Recycling Cart,PWDx_Recycling,PWDx,,,310 Saratoga St  East Boston  MA  02128,1.0,09,1.0,A7,East Boston,1.0,Ward 1,110.0,R3,310 Saratoga St,2128.0,Address,122600.0,42.3785,-71.0317,Constituent Call,"(42.3785, -71.0317)"
545054,101001348959,04/03/2015 03:34:49 PM,05/27/2015 03:34:00 PM,05/21/2015 12:00:16 PM,ONTIME,Closed,Case Closed. Closed date : 2015-05-21 12:00:16.19 Duplicate of Existing Case reference case # 10100038051 05/21/2015,Request for Recycling Cart,Public Works Department,Recycling,Request for Recycling Cart,PWDx_Recycling,PWDx,,,6-8 Johnson Ter  Dorchester  MA  02124,8.0,07,4.0,B3,Greater Mattapan,9.0,Ward 14,1410.0,R2,6-8 Johnson Ter,2124.0,Address,79935.0,42.2877,-71.0801,Constituent Call,"(42.2877, -71.0801)"
545055,101001348960,04/03/2015 03:35:11 PM,04/27/2015 03:35:11 PM,04/24/2015 10:07:07 AM,ONTIME,Closed,Case Closed Case Resolved Cart requested filled new cart #0714423872 04/17/2015,Request for Recycling Cart,Public Works Department,Recycling,Request for Recycling Cart,PWDx_Recycling,PWDx,,,40 Auckland St  Dorchester  MA  02125,7.0,03,3.0,C11,Dorchester,7.0,Ward 13,1309.0,R3,40 Auckland St,2125.0,Address,6520.0,42.3134,-71.0557,Constituent Call,"(42.3134, -71.0557)"
545129,101001349056,04/03/2015 05:06:12 PM,05/28/2015 08:30:00 AM,04/30/2015 01:55:06 PM,ONTIME,Closed,Case Closed Case Resolved cart requested filled new cart # 0514302538 04/29/2015,Request for Recycling Cart,Public Works Department,Recycling,Request for Recycling Cart,PWDx_Recycling,PWDx,,,1431 Centre St  Roslindale  MA  02132,9.0,06,6.0,E5,West Roxbury,12.0,Ward 20,2006.0,CD,1431 Centre St,2132.0,Address,27575.0,42.2937,-71.1372,Self Service,"(42.2937, -71.1372)"
545149,101001349079,04/03/2015 05:29:22 PM,05/28/2015 08:30:00 AM,05/15/2015 02:08:39 PM,ONTIME,Closed,Case Closed. Closed date : 2015-05-15 14:08:39.12 Case Resolved cart requested new cart#0415302670 04/29/2015,Request for Recycling Cart,Public Works Department,Recycling,Request for Recycling Cart,PWDx_Recycling,PWDx,,,3 Jason Ter  South Boston  MA  02127,6.0,05,2.0,C6,South Boston / South Boston Waterfront,5.0,Ward 7,703.0,R1,3 Jason Ter,2127.0,Address,79558.0,42.3317,-71.0446,Constituent Call,"(42.3317, -71.0446)"
545292,101001349271,04/04/2015 11:57:58 AM,05/29/2015 08:30:00 AM,06/11/2015 02:11:31 PM,OVERDUE,Closed,Case Closed. Closed date : 2015-06-11 14:11:31.79 Case Resolved cart requested filled new cart#0415302277  06/09/2015,Request for Recycling Cart,Public Works Department,Recycling,Request for Recycling Cart,PWDx_Recycling,PWDx,,,733 R E Broadway  South Boston  MA  02127,6.0,05,2.0,C6,South Boston / South Boston Waterfront,5.0,Ward 6,605.0,R3,733 R E Broadway,2127.0,Address,21147.0,42.3353,-71.0362,Self Service,"(42.3353, -71.0362)"
545301,101001349284,04/04/2015 12:43:09 PM,04/28/2015 08:30:00 AM,04/24/2015 10:07:48 AM,ONTIME,Closed,Case Closed Case Resolved Cart requested filled new cart #0814423873 04/17/2015,Request for Recycling Cart,Public Works Department,Recycling,Request for Recycling Cart,PWDx_Recycling,PWDx,,,4 Roseclair St  Dorchester  MA  02125,6.0,03,2.0,C6,Dorchester,5.0,Ward 7,709.0,R3,4 Roseclair St,2125.0,Address,118309.0,42.3212,-71.061,Constituent Call,"(42.3212, -71.061)"
545333,101001349333,04/04/2015 02:42:00 PM,05/29/2015 08:30:00 AM,08/20/2015 12:35:03 PM,OVERDUE,Closed,Case Closed Case Resolved  already delivered to this address,Request for Recycling Cart,Public Works Department,Recycling,Request for Recycling Cart,PWDx_Recycling,PWDx,,,377-379 W Second St  South Boston  MA  02127,6.0,05,2.0,C6,South Boston,5.0,06,604.0,R4,377-379 W Second St,2127.0,Address,171647.0,42.3384,-71.0462,Self Service,"(42.3384, -71.0462)"
545456,101001349508,04/05/2015 08:05:47 AM,04/28/2015 08:30:00 AM,04/21/2015 08:56:25 AM,ONTIME,Closed,Case Closed Case Resolved Cart requested swapped out new cart #0714424107 04/10/2015,Request for Recycling Cart,Public Works Department,Recycling,Request for Recycling Cart,PWDx_Recycling,PWDx,,,38 Lawn St  Mission Hill  MA  02120,9.0,10A,6.0,B2,Mission Hill,11.0,10,1006.0,CM,38 Lawn St,2120.0,Address,166968.0,42.3268,-71.1051,Constituent Call,"(42.3268, -71.1051)"
545464,101001349520,04/05/2015 09:56:17 AM,05/28/2015 08:30:00 AM,06/02/2015 11:50:32 AM,OVERDUE,Closed,Case Closed. Closed date : 2015-06-02 11:50:32.7 Case Resolved cart requested filled new cart # 0415302683 05/9/2015,Request for Recycling Cart,Public Works Department,Recycling,Request for Recycling Cart,PWDx_Recycling,PWDx,,,18 Rose Garden Cir  Brighton  MA  02135,11.0,04,9.0,D14,Allston / Brighton,15.0,Ward 22,2209.0,R2,18 Rose Garden Cir,2135.0,Address,301163.0,42.342,-71.1575,Self Service,"(42.342, -71.1575)"
545502,101001349572,04/05/2015 12:48:48 PM,04/28/2015 08:30:00 AM,04/21/2015 08:55:40 AM,ONTIME,Closed,Case Closed Case Resolved Cart requested swapped out new cart #0714423991 04/10/2015,Request for Recycling Cart,Public Works Department,Recycling,Request for Recycling Cart,PWDx_Recycling,PWDx,,,7 Judge St  Mission Hill  MA  02120,9.0,10A,8.0,B2,Mission Hill,14.0,Ward 10,1005.0,R2,7 Judge St,2120.0,Address,80263.0,42.3294,-71.1026,Constituent Call,"(42.3294, -71.1026)"
545513,101001349589,04/05/2015 01:38:22 PM,05/29/2015 08:30:00 AM,05/15/2015 12:02:18 PM,ONTIME,Closed,Case Closed. Closed date : 2015-05-15 12:02:18.977 Case Resolved cart requested new cart#0415302432 05/14/2015,Request for Recycling Cart,Public Works Department,Recycling,Request for Recycling Cart,PWDx_Recycling,PWDx,,,676 Saratoga St  East Boston  MA  02128,1.0,09,1.0,A7,East Boston,1.0,Ward 1,111.0,R4,676 Saratoga St,2128.0,Address,306201.0,42.3827,-71.0203,Self Service,"(42.3827, -71.0203)"
545517,101001349594,04/05/2015 01:53:02 PM,04/28/2015 08:30:00 AM,04/21/2015 08:57:08 AM,ONTIME,Closed,Case Closed Case Resolved Cart requested swapped out new cart #0714424048 04/10/2015,Request for Recycling Cart,Public Works Department,Recycling,Request for Recycling Cart,PWDx_Recycling,PWDx,,,4 Wigglesworth St  Mission Hill  MA  02120,9.0,10A,8.0,B2,Mission Hill,14.0,Ward 10,1003.0,R4,4 Wigglesworth St,2120.0,Address,149633.0,42.3342,-71.1033,Self Service,"(42.3342, -71.1033)"
545724,101001349879,04/06/2015 09:10:03 AM,05/29/2015 09:10:00 AM,06/02/2015 11:41:56 AM,OVERDUE,Closed,Case Closed. Closed date : 2015-06-02 11:41:56.62 Case Resolved cart requested filled new cart # 0415313675 06/0/12015,Request for Recycling Cart,Public Works Department,Recycling,Request for Recycling Cart,PWDx_Recycling,PWDx,,,89 Lexington St  East Boston  MA  02128,1.0,09,1.0,A7,East Boston,1.0,Ward 1,107.0,R3,89 Lexington St,2128.0,Address,85720.0,42.3779,-71.0364,Constituent Call,"(42.3779, -71.0364)"
545746,101001349910,04/06/2015 09:29:19 AM,05/28/2015 09:29:00 AM,06/16/2015 08:34:06 AM,OVERDUE,Closed,Case Closed. Closed date : 2015-06-16 08:34:06.713 Case Resolved recycling cart request filled new cart#0415313640 06/12/2015,Request for Recycling Cart,Public Works Department,Recycling,Request for Recycling Cart,PWDx_Recycling,PWDx,,,30 Overlook Rd  West Roxbury  MA  02132,12.0,06,6.0,E5,West Roxbury,12.0,Ward 20,2015.0,R1,30 Overlook Rd,2132.0,Address,106147.0,42.2624,-71.1577,Constituent Call,"(42.2624, -71.1577)"
545768,101001349940,04/06/2015 09:45:59 AM,05/28/2015 09:45:00 AM,06/04/2015 03:07:03 PM,OVERDUE,Closed,Case Closed. Closed date : 2015-06-04 15:07:03.33 Case Resolved Cart requested filled new cart #0415302947 05/29/2015,Request for Recycling Cart,Public Works Department,Recycling,Request for Recycling Cart,PWDx_Recycling,PWDx,,,42 Myrtlebank Ave  Dorchester  MA  02124,8.0,07,3.0,C11,Dorchester,7.0,Ward 16,1612.0,R1,42 Myrtlebank Ave,2124.0,Address,99916.0,42.2811,-71.0532,Constituent Call,"(42.2811, -71.0532)"
545784,101001349965,04/06/2015 09:59:39 AM,04/28/2015 09:59:39 AM,04/10/2015 11:06:50 AM,ONTIME,Closed,Case Closed Case Resolved broken cart swapped new cart # 0714423995 04/09/2015,Request for Recycling Cart,Public Works Department,Recycling,Request for Recycling Cart,PWDx_Recycling,PWDx,,,19 Dale St  Roxbury  MA  02119,7.0,10B,7.0,B2,Roxbury,13.0,Ward 12,1203.0,R1,19 Dale St,2119.0,Address,45720.0,42.3208,-71.0831,Constituent Call,"(42.3208, -71.0831)"
545804,101001349989,04/06/2015 10:13:35 AM,05/29/2015 10:13:00 AM,06/05/2015 07:33:43 AM,OVERDUE,Closed,Case Closed. Closed date : 2015-06-05 07:33:43.667 Case Resolved Cart requested filled new cart #0415302648 06/02/2015,Request for Recycling Cart,Public Works Department,Recycling,Request for Recycling Cart,PWDx_Recycling,PWDx,,,84 P St  South Boston  MA  02127,6.0,05,2.0,C6,South Boston / South Boston Waterfront,5.0,Ward 6,609.0,R3,84 P St,2127.0,Address,106280.0,42.3354,-71.027,Constituent Call,"(42.3354, -71.027)"
545816,101001350004,04/06/2015 10:25:01 AM,04/28/2015 10:25:01 AM,04/10/2015 11:07:51 AM,ONTIME,Closed,Case Closed Case Resolved broken cart swapped new cart # 0714424267 04/09/2015,Request for Recycling Cart,Public Works Department,Recycling,Request for Recycling Cart,PWDx_Recycling,PWDx,,,35 Howland St  Dorchester  MA  02121,9.0,10B,7.0,B2,Roxbury,13.0,Ward 12,1209.0,R2,35 Howland St,2121.0,Address,75770.0,42.3131,-71.0861,Constituent Call,"(42.3131, -71.0861)"
545823,101001350014,04/06/2015 10:28:26 AM,05/28/2015 10:28:00 AM,06/02/2015 11:36:08 AM,OVERDUE,Closed,Case Closed. Closed date : 2015-06-02 11:36:08.043 Case Resolved cart requested filled new cart # 0415313559 06/01/2015,Request for Recycling Cart,Public Works Department,Recycling,Request for Recycling Cart,PWDx_Recycling,PWDx,,,28 Jacob St  Dorchester  MA  02124,8.0,07,4.0,B3,Greater Mattapan,9.0,Ward 14,1413.0,R1,28 Jacob St,2124.0,Address,79202.0,42.2855,-71.0833,Constituent Call,"(42.2855, -71.0833)"
545847,101001350043,04/06/2015 10:50:13 AM,05/28/2015 10:50:00 AM,06/17/2015 02:29:45 PM,OVERDUE,Closed,Case Closed. Closed date : 2015-06-17 14:29:45.017 Case Resolved cart requested filled new cart #0415313615 06/15/2015,Request for Recycling Cart,Public Works Department,Recycling,Request for Recycling Cart,PWDx_Recycling,PWDx,,,8 Michigan Ave  Dorchester  MA  02121,7.0,03,4.0,B3,Greater Mattapan,8.0,Ward 14,1406.0,R2,8 Michigan Ave,2121.0,Address,95174.0,42.3029,-71.0835,Constituent Call,"(42.3029, -71.0835)"
545876,101001350078,04/06/2015 11:21:06 AM,05/29/2015 11:21:00 AM,06/05/2015 07:34:16 AM,OVERDUE,Closed,Case Closed. Closed date : 2015-06-05 07:34:16.243 Case Resolved Cart requested filled new cart #0415302495 06/02/2015,Request for Recycling Cart,Public Works Department,Recycling,Request for Recycling Cart,PWDx_Recycling,PWDx,,,243 Belgrade Ave  Roslindale  MA  02131,9.0,06,5.0,E5,Roslindale,10.0,Ward 20,2008.0,R1,243 Belgrade Ave,2131.0,Address,13615.0,42.2863,-71.1411,Constituent Call,"(42.2863, -71.1411)"
545926,101001350143,04/06/2015 11:53:01 AM,05/28/2015 11:53:00 AM,06/02/2015 11:49:17 AM,OVERDUE,Closed,Case Closed. Closed date : 2015-06-02 11:49:17.187 Case Resolved cart requested filled new cart # 0415302624 05/29/2015,Request for Recycling Cart,Public Works Department,Recycling,Request for Recycling Cart,PWDx_Recycling,PWDx,,,240 Hyde Park Ave  Jamaica Plain  MA  02130,12.0,02,6.0,E13,Jamaica Plain,10.0,Ward 19,1907.0,R3,240 Hyde Park Ave,2130.0,Address,77271.0,42.2935,-71.1172,Constituent Call,"(42.2935, -71.1172)"
545943,101001350161,04/06/2015 12:12:37 PM,04/28/2015 12:12:37 PM,04/09/2015 11:06:22 AM,ONTIME,Closed,Case Closed Case Resolved broken cart swapped new cart number # 0714424045 04/08/2015,Request for Recycling Cart,Public Works Department,Recycling,Request for Recycling Cart,PWDx_Recycling,PWDx,,,14 Parker St  Charlestown  MA  02129,3.0,1A,1.0,A15,Charlestown,2.0,Ward 2,207.0,R1,14 Parker St,2129.0,Address,107739.0,42.3834,-71.0787,Constituent Call,"(42.3834, -71.0787)"
545944,101001350162,04/06/2015 12:12:38 PM,05/28/2015 12:12:00 PM,05/22/2015 03:24:24 PM,ONTIME,Closed,Case Closed. Closed date : 2015-05-22 15:24:24.6 Case Resolved cart # 0415302978 dropped off on 5-21-15,Request for Recycling Cart,Public Works Department,Recycling,Request for Recycling Cart,PWDx_Recycling,PWDx,,,132 Hyde Park Ave  Jamaica Plain  MA  02130,12.0,02,6.0,E13,Jamaica Plain,10.0,Ward 19,1907.0,R3,132 Hyde Park Ave,2130.0,Address,77104.0,42.2965,-71.1156,Constituent Call,"(42.2965, -71.1156)"
545947,101001350166,04/06/2015 12:15:36 PM,05/28/2015 12:15:00 PM,05/25/2015 06:15:32 AM,ONTIME,Closed,Case Closed. Closed date : 2015-05-25 06:15:32.317 Case Resolved cart # 0415313661 was dropped off on 5/21/15,Request for Recycling Cart,Public Works Department,Recycling,Request for Recycling Cart,PWDx_Recycling,PWDx,,,319 Hyde Park Ave  Jamaica Plain  MA  02130,12.0,02,6.0,E13,Jamaica Plain,10.0,Ward 19,1907.0,R3,319 Hyde Park Ave,2130.0,Address,77300.0,42.2905,-71.1184,Constituent Call,"(42.2905, -71.1184)"
545959,101001350189,04/06/2015 12:32:53 PM,05/28/2015 12:32:00 PM,06/05/2015 07:31:36 AM,OVERDUE,Closed,Case Closed. Closed date : 2015-06-05 07:31:36.997 Case Resolved Cart requested filled new cart #0415302521 06/02/2015,Request for Recycling Cart,Public Works Department,Recycling,Request for Recycling Cart,PWDx_Recycling,PWDx,,,233 Columbia Rd  Dorchester  MA  02121,7.0,03,4.0,C11,Roxbury,13.0,Ward 14,1401.0,R3,233 Columbia Rd,2121.0,Address,35188.0,42.3075,-71.0754,Constituent Call,"(42.3075, -71.0754)"
545967,101001350199,04/06/2015 12:44:07 PM,05/28/2015 12:44:00 PM,06/04/2015 03:07:55 PM,OVERDUE,Closed,Case Closed. Closed date : 2015-06-04 15:07:55.683 Case Resolved Cart requested filled new cart #0415302950 05/29/15,Request for Recycling Cart,Public Works Department,Recycling,Request for Recycling Cart,PWDx_Recycling,PWDx,,,26 Tolman St  Dorchester  MA  02122,8.0,07,3.0,C11,Dorchester,7.0,Ward 16,1610.0,R2,26 Tolman St,2122.0,Address,136129.0,42.2895,-71.0464,Constituent Call,"(42.2895, -71.0464)"
546034,101001350294,04/06/2015 02:10:21 PM,05/29/2015 02:10:00 PM,05/06/2015 01:24:49 PM,ONTIME,Closed,Case Closed. Closed date : 2015-05-06 13:24:49.613 Case Resolved cart request filled new cart # 0514000025 04/30/2015,Request for Recycling Cart,Public Works Department,Recycling,Request for Recycling Cart,PWDx_Recycling,PWDx,,,21-23 Bradstreet Ave  Roslindale  MA  02131,12.0,02,5.0,E18,Roslindale,10.0,Ward 18,1807.0,R2,21-23 Bradstreet Ave,2131.0,Address,19130.0,42.2827,-71.1173,Constituent Call,"(42.2827, -71.1173)"
546046,101001350311,04/06/2015 02:25:28 PM,05/29/2015 02:25:00 PM,06/09/2015 12:21:00 PM,OVERDUE,Closed,Case Closed. Closed date : 2015-06-09 12:21:00.26 Case Resolved cart requested filled new cart #0415302407 06/08/2015,Request for Recycling Cart,Public Works Department,Recycling,Request for Recycling Cart,PWDx_Recycling,PWDx,,,264 Lexington St  East Boston  MA  02128,1.0,09,1.0,A7,East Boston,1.0,Ward 1,109.0,R1,264 Lexington St,2128.0,Address,85634.0,42.3806,-71.0303,Self Service,"(42.3806, -71.0303)"
546055,101001350320,04/06/2015 02:31:56 PM,04/28/2015 02:31:56 PM,04/10/2015 11:10:12 AM,ONTIME,Closed,Case Closed Case Resolved broken cart swapped new cart # 0714423992 04/09/2015,Request for Recycling Cart,Public Works Department,Recycling,Request for Recycling Cart,PWDx_Recycling,PWDx,,,2-3 Eliot Ter  Roxbury  MA  02119,7.0,10B,7.0,B2,Roxbury,13.0,Ward 9,905.0,R2,2-3 Eliot Ter,2119.0,Address,164949.0,42.3295,-71.0921,Constituent Call,"(42.3295, -71.0921)"
546070,101001350342,04/06/2015 02:44:49 PM,05/28/2015 02:44:00 PM,06/05/2015 08:36:28 AM,OVERDUE,Closed,Case Closed. Closed date : 2015-06-05 08:36:28.067 Case Resolved Cart requested filled new cart #0415313601 05/18/2015,Request for Recycling Cart,Public Works Department,Recycling,Request for Recycling Cart,PWDx_Recycling,PWDx,,,229 Trenton St  East Boston  MA  02128,1.0,09,1.0,A7,East Boston,1.0,Ward 1,109.0,R2,229 Trenton St,2128.0,Address,138359.0,42.381,-71.0304,Constituent Call,"(42.381, -71.0304)"
546107,101001350394,04/06/2015 03:26:00 PM,04/28/2015 03:26:00 PM,04/28/2015 02:16:52 PM,ONTIME,Closed,Case Closed Duplicate of Existing Case  case referece case # 101001363025,Request for Recycling Cart,Public Works Department,Recycling,Request for Recycling Cart,PWDx_Recycling,PWDx,,,94 Fuller St  Dorchester  MA  02124,8.0,07,3.0,C11,Dorchester,7.0,Ward 17,1704.0,R1,94 Fuller St,2124.0,Address,61249.0,42.2823,-71.07,Constituent Call,"(42.2823, -71.07)"
546151,101001350454,04/06/2015 04:56:07 PM,05/29/2015 04:56:00 PM,06/17/2015 02:48:35 PM,OVERDUE,Closed,Case Closed. Closed date : 2015-06-17 14:48:35.47 Case Resolved cart requested filled new cart #415313648 06/16/2015,Request for Recycling Cart,Public Works Department,Recycling,Request for Recycling Cart,PWDx_Recycling,PWDx,,,66 Imbaro Rd  Hyde Park  MA  02136,12.0,08,5.0,E18,Hyde Park,10.0,Ward 18,1819.0,R1,66 Imbaro Rd,2136.0,Address,78016.0,42.2429,-71.1385,Constituent Call,"(42.2429, -71.1385)"
546152,101001350455,04/06/2015 04:57:25 PM,04/28/2015 04:57:25 PM,04/24/2015 10:08:16 AM,ONTIME,Closed,Case Closed Case Resolved Cart requested filled new cart #0814423874 04/17/2015,Request for Recycling Cart,Public Works Department,Recycling,Request for Recycling Cart,PWDx_Recycling,PWDx,,,4 Saint Margaret St  Dorchester  MA  02125,6.0,03,2.0,C6,Dorchester,5.0,Ward 7,709.0,R2,4 Saint Margaret St,2125.0,Address,121329.0,42.3225,-71.0607,Self Service,"(42.3225, -71.0607)"
546157,101001350460,04/06/2015 05:07:04 PM,05/29/2015 08:30:00 AM,05/12/2015 12:16:56 PM,ONTIME,Closed,Case Closed. Closed date : 2015-05-12 12:16:56.623 Case Resolved cart requested filled new cart # 0415302595 05/11/2015,Request for Recycling Cart,Public Works Department,Recycling,Request for Recycling Cart,PWDx_Recycling,PWDx,,,77-99 South St  Jamaica Plain  MA  02130,9.0,02,6.0,E13,Jamaica Plain,11.0,11,1109.0,R3,77-99 South St,2130.0,Address,169784.0,42.307,-71.1156,Constituent Call,"(42.307, -71.1156)"
546171,101001350476,04/06/2015 05:34:30 PM,04/29/2015 08:30:00 AM,05/06/2015 01:48:11 PM,OVERDUE,Closed,Case Closed. Closed date : 2015-05-06 13:48:11.837 Case Resolved cart request filled new cart # 0415302635 05/05/2015,Request for Recycling Cart,Public Works Department,Recycling,Request for Recycling Cart,PWDx_Recycling,PWDx,,,558 Park St  Dorchester  MA  02124,8.0,07,4.0,B3,Dorchester,9.0,Ward 17,1703.0,R1,558 Park St,2124.0,Address,107393.0,42.2947,-71.0761,Constituent Call,"(42.2947, -71.0761)"
546185,101001350496,04/06/2015 06:22:00 PM,05/29/2015 08:30:00 AM,06/08/2015 02:28:51 PM,OVERDUE,Closed,Case Closed. Closed date : 2015-06-08 14:28:51.99 Case Resolved Damaged cart replaced new cart#0714423928 06/08/2015,Damaged Cart - New Request,Public Works Department,Recycling,Request for Recycling Cart,PWDx_IPL Damaged Cart Replacement,PWDx,,,33 Pond Cir  Jamaica Plain  MA  02130,9.0,02,6.0,E13,Jamaica Plain,11.0,Ward 19,1902.0,R1,33 Pond Cir,2130.0,Address,111494.0,42.3134,-71.1246,Employee Generated,"(42.3134, -71.1246)"
546212,101001350531,04/06/2015 07:45:16 PM,05/29/2015 08:30:00 AM,06/02/2015 11:31:09 AM,OVERDUE,Closed,Case Closed. Closed date : 2015-06-02 11:31:09.827 Case Resolved cart requested filled new cart # 0415313563 06/01/2015,Request for Recycling Cart,Public Works Department,Recycling,Request for Recycling Cart,PWDx_Recycling,PWDx,,,84 Bloomfield St  Dorchester  MA  02124,7.0,03,4.0,C11,Dorchester,8.0,Ward 17,1702.0,R3,84 Bloomfield St,2124.0,Address,189387.0,42.2986,-71.0694,Constituent Call,"(42.2986, -71.0694)"
546234,101001350563,04/06/2015 10:38:11 PM,05/29/2015 08:30:00 AM,05/15/2015 11:42:10 AM,ONTIME,Closed,Case Closed. Closed date : 2015-05-15 11:42:10.553 Case Resolved cart requested new cart#04152436 05/14/2015,Request for Recycling Cart,Public Works Department,Recycling,Request for Recycling Cart,PWDx_Recycling,PWDx,,,132 W Eighth St  South Boston  MA  02127,6.0,05,2.0,C6,South Boston / South Boston Waterfront,5.0,Ward 6,602.0,R3,132 W Eighth St,2127.0,Address,52488.0,42.3351,-71.0537,Self Service,"(42.3351, -71.0537)"
546286,101001350631,04/07/2015 08:06:58 AM,04/29/2015 08:30:00 AM,05/01/2015 02:51:47 PM,OVERDUE,Closed,Case Closed Case Resolved no cart out 4/30/2015,Request for Recycling Cart,Public Works Department,Recycling,Request for Recycling Cart,PWDx_IPL Damaged Cart Replacement,PWDx,https://cityworker.cityofboston.gov:8443/attachments/report/5523c86070b4391e011f2fca/photo/Report.jpg,,47 Iroquois St  Mission Hill  MA  02120,9.0,10A,8.0,B2,Mission Hill,14.0,Ward 10,1005.0,R2,47 Iroquois St,2120.0,Address,258867.0,42.3304,-71.105,City Worker App,"(42.3304, -71.105)"
546310,101001350661,04/07/2015 08:31:27 AM,05/29/2015 08:31:00 AM,06/02/2015 11:47:28 AM,OVERDUE,Closed,Case Closed. Closed date : 2015-06-02 11:47:28.977 Case Resolved cart requested filled new cart # 0415302679 05/30/2015,Request for Recycling Cart,Public Works Department,Recycling,Request for Recycling Cart,PWDx_Recycling,PWDx,,,55 Whitten St  Dorchester  MA  02122,8.0,07,3.0,C11,Dorchester,7.0,Ward 16,1604.0,R3,55 Whitten St,2122.0,Address,149519.0,42.2935,-71.0585,Constituent Call,"(42.2935, -71.0585)"
546354,101001350734,04/07/2015 09:18:56 AM,05/29/2015 09:18:00 AM,06/11/2015 01:57:46 PM,OVERDUE,Closed,Case Closed. Closed date : 2015-06-11 13:57:46.49 Case Resolved cart requested filled new cart#0415302502 06/09/2015,Request for Recycling Cart,Public Works Department,Recycling,Request for Recycling Cart,PWDx_Recycling,PWDx,,,62 Dunster Rd  Jamaica Plain  MA  02130,9.0,02,6.0,E13,Jamaica Plain,11.0,Ward 19,1908.0,CM,62 Dunster Rd,2130.0,Address,50092.0,42.3108,-71.1188,Constituent Call,"(42.3108, -71.1188)"
546358,101001350738,04/07/2015 09:20:30 AM,04/29/2015 09:20:30 AM,04/07/2015 09:30:09 AM,ONTIME,Closed,Case Closed Case Invalid Opened in error,Request for Recycling Cart,Public Works Department,Recycling,Request for Recycling Cart,PWDx_Recycling,PWDx,,,INTERSECTION of Albany St & E Newton St  Roxbury  MA,4.0,1C,2.0,D4,South End,6.0,Ward 8,802.0,,INTERSECTION Albany St & E Newton St,,Intersection,204.0,42.3359,-71.0701,Constituent Call,"(42.3359, -71.0701)"
546391,101001350778,04/07/2015 09:50:38 AM,05/29/2015 09:50:00 AM,06/09/2015 12:00:51 PM,OVERDUE,Closed,Case Closed. Closed date : 2015-06-09 12:00:51.357 Case Resolved cart requested filled new cart #0415302475 06/08/2015,Request for Recycling Cart,Public Works Department,Recycling,Request for Recycling Cart,PWDx_Recycling,PWDx,,,43 Gleason St  Dorchester  MA  02121,7.0,03,4.0,B3,Greater Mattapan,8.0,Ward 14,1402.0,R2,43 Gleason St,2121.0,Address,241343.0,42.2987,-71.0821,Constituent Call,"(42.2987, -71.0821)"
546644,101001351116,04/07/2015 01:42:19 PM,04/29/2015 01:42:19 PM,05/06/2015 01:49:40 PM,OVERDUE,Closed,Case Closed. Closed date : 2015-05-06 13:49:40.353 Case Resolved cart request filled new cart # 0415302630 05/05/2015,Request for Recycling Cart,Public Works Department,Recycling,Request for Recycling Cart,PWDx_Recycling,PWDx,,,319 Saratoga St  East Boston  MA  02128,1.0,09,1.0,A7,East Boston,1.0,Ward 1,110.0,R3,319 Saratoga St,2128.0,Address,122608.0,42.3784,-71.0312,Constituent Call,"(42.3784, -71.0312)"
546654,101001351135,04/07/2015 01:52:31 PM,04/29/2015 01:52:31 PM,04/27/2015 01:18:27 PM,ONTIME,Closed,Case Closed Case Resolved RECYCLING CART LIST REQUEST FILLED NEW CART #0514000751 04/17/15,Request for Recycling Cart,Public Works Department,Recycling,Request for Recycling Cart,PWDx_Recycling,PWDx,,,22 Wood Ave  Mattapan  MA  02126,8.0,08,5.0,E18,Hyde Park,10.0,Ward 18,1806.0,R1,22 Wood Ave,2126.0,Address,151248.0,42.2734,-71.1095,Constituent Call,"(42.2734, -71.1095)"
546696,101001351191,04/07/2015 02:16:53 PM,04/29/2015 02:16:53 PM,04/28/2015 01:02:56 PM,ONTIME,Closed,Case Closed Case Resolved CART REQUESTED FILLED NEW CART # 0714423880 04/27/2015,Request for Recycling Cart,Public Works Department,Recycling,Request for Recycling Cart,PWDx_Recycling,PWDx,,,10 Chestnut Ave  Jamaica Plain  MA  02130,9.0,10A,6.0,E13,Jamaica Plain,11.0,Ward 10,1007.0,R3,10 Chestnut Ave,2130.0,Address,31017.0,42.3222,-71.1019,Constituent Call,"(42.3222, -71.1019)"
546726,101001351224,04/07/2015 02:27:08 PM,05/29/2015 02:27:00 PM,06/11/2015 02:07:24 PM,OVERDUE,Closed,Case Closed. Closed date : 2015-06-11 14:07:24.36 Case Resolved cart requested filled new cart#0415302362 06/09/2015,Request for Recycling Cart,Public Works Department,Recycling,Request for Recycling Cart,PWDx_Recycling,PWDx,,,144 Washington St  Brighton  MA  02135,11.0,04,9.0,D14,Allston / Brighton,15.0,Ward 21,2111.0,R2,144 Washington St,2135.0,Address,143469.0,42.3453,-71.1458,Constituent Call,"(42.3453, -71.1458)"
546735,101001351238,04/07/2015 02:36:19 PM,05/30/2015 02:36:00 PM,05/05/2015 07:44:18 AM,ONTIME,Closed,Case Closed. Closed date : 2015-05-05 07:44:18.543 Case Resolved CART REQUESTED FILLED NEW CART #0415302604 05/05/2015,Request for Recycling Cart,Public Works Department,Recycling,Request for Recycling Cart,PWDx_Recycling,PWDx,,,114-116 Stanwood St  Dorchester  MA  02121,7.0,03,4.0,B2,Roxbury,13.0,Ward 14,1401.0,R2,114-116 Stanwood St,2121.0,Address,130254.0,42.3084,-71.0785,Constituent Call,"(42.3084, -71.0785)"
546748,101001351259,04/07/2015 02:44:44 PM,04/29/2015 02:44:44 PM,04/28/2015 10:30:05 AM,ONTIME,Closed,Case Closed Duplicate of Existing Case  Reference#101001352177 one per a household,Request for Recycling Cart,Public Works Department,Recycling,Request for Recycling Cart,PWDx_Recycling,PWDx,,,40 Child St  Hyde Park  MA  02136,12.0,08,5.0,E18,Hyde Park,10.0,Ward 18,1812.0,R1,40 Child St,2136.0,Address,32129.0,42.2583,-71.1278,Constituent Call,"(42.2583, -71.1278)"
546758,101001351269,04/07/2015 02:59:41 PM,05/29/2015 02:59:00 PM,05/21/2015 02:47:49 PM,ONTIME,Closed,Case Closed. Closed date : 2015-05-21 14:47:49.347 Case Resolved cart requested filled new cart # 0415302230 05/20/2015,Request for Recycling Cart,Public Works Department,Recycling,Request for Recycling Cart,PWDx_Recycling,PWDx,,,12-14 Frankfort St  East Boston  MA  02128,1.0,09,1.0,A7,East Boston,1.0,Ward 1,102.0,R3,12-14 Frankfort St,2128.0,Address,60502.0,42.3694,-71.0362,Constituent Call,"(42.3694, -71.0362)"
546785,101001351321,04/07/2015 03:51:47 PM,05/29/2015 03:51:00 PM,05/14/2015 09:24:05 AM,ONTIME,Closed,Case Closed. Closed date : 2015-05-14 09:24:05.237 Case Resolved cart requested filled new cart # 0714423968 04/17/2015,Request for Recycling Cart,Public Works Department,Recycling,Request for Recycling Cart,PWDx_Recycling,PWDx,,,102-104 Litchfield St  Brighton  MA  02135,11.0,04,9.0,D14,Allston / Brighton,15.0,Ward 22,2205.0,R2,102-104 Litchfield St,2135.0,Address,86697.0,42.3617,-71.1401,Constituent Call,"(42.3617, -71.1401)"
546795,101001351333,04/07/2015 03:57:50 PM,04/29/2015 03:57:50 PM,04/10/2015 11:10:50 AM,ONTIME,Closed,Case Closed Case Resolved broken cart swapped new cart # 0714423993 04/09/2015,Request for Recycling Cart,Public Works Department,Recycling,Request for Recycling Cart,PWDx_Recycling,PWDx,,,19 Circuit St  Roxbury  MA  02119,7.0,10B,7.0,B2,Roxbury,13.0,12,1201.0,CD,19 Circuit St,2119.0,Address,32809.0,42.3239,-71.085,Constituent Call,"(42.3239, -71.085)"
546810,101001351357,04/07/2015 04:34:12 PM,05/29/2015 04:34:00 PM,06/02/2015 11:34:32 AM,OVERDUE,Closed,Case Closed. Closed date : 2015-06-02 11:34:32.67 Case Resolved cart requested filled new cart # 0415313684,Request for Recycling Cart,Public Works Department,Recycling,Request for Recycling Cart,PWDx_Recycling,PWDx,,,48 Richwood St  West Roxbury  MA  02132,12.0,06,6.0,E5,West Roxbury,12.0,Ward 20,2012.0,R1,48 Richwood St,2132.0,Address,115876.0,42.2863,-71.1597,Constituent Call,"(42.2863, -71.1597)"
546886,101001351454,04/07/2015 08:26:00 PM,06/06/2015 08:30:00 AM,05/08/2015 10:50:46 AM,ONTIME,Closed,Case Closed. Closed date : 2015-05-08 10:50:46.927 Case Resolved cart requested filled new cart #0415302962 05/06/2015,Request for Recycling Cart,Public Works Department,Recycling,Request for Recycling Cart,PWDx_Recycling,PWDx,,,4 Colebrook St  South Boston  MA  02127,6.0,05,2.0,C6,South Boston / South Boston Waterfront,5.0,Ward 7,703.0,R1,4 Colebrook St,2127.0,Address,34650.0,42.3327,-71.0419,Self Service,"(42.3327, -71.0419)"
546894,101001351467,04/07/2015 09:29:00 PM,06/06/2015 08:30:00 AM,05/15/2015 02:21:46 PM,ONTIME,Closed,Case Closed. Closed date : 2015-05-15 14:21:46.633 Case Resolved cart requested new cart#0514302582 05/1/2015,Request for Recycling Cart,Public Works Department,Recycling,Request for Recycling Cart,PWDx_Recycling,PWDx,,,7 Crestway Rd  East Boston  MA  02128,1.0,09,1.0,A7,East Boston,1.0,Ward 1,114.0,R2,7 Crestway Rd,2128.0,Address,44397.0,42.3923,-71.0047,Self Service,"(42.3923, -71.0047)"
546896,101001351469,04/07/2015 09:40:14 PM,04/30/2015 08:30:00 AM,04/10/2015 11:11:34 AM,ONTIME,Closed,Case Closed Case Resolved broken cart swapped new cart # 0714424268 04/09/2015,Request for Recycling Cart,Public Works Department,Recycling,Request for Recycling Cart,PWDx_Recycling,PWDx,,,21 Hartwell St  Dorchester  MA  02121,9.0,10B,7.0,B2,Roxbury,13.0,Ward 12,1207.0,R2,21 Hartwell St,2121.0,Address,248315.0,42.3093,-71.0845,Self Service,"(42.3093, -71.0845)"
546900,101001351473,04/07/2015 10:17:04 PM,04/30/2015 08:30:00 AM,05/06/2015 01:44:13 PM,OVERDUE,Closed,Case Closed. Closed date : 2015-05-06 13:44:13.713 Case Resolved cart request filled new cart # 0415302440 05/05/15,Request for Recycling Cart,Public Works Department,Recycling,Request for Recycling Cart,PWDx_Recycling,PWDx,,,845 E Fifth St  South Boston  MA  02127,6.0,05,2.0,C6,South Boston / South Boston Waterfront,5.0,Ward 6,609.0,CM,845 E Fifth St,2127.0,Address,58122.0,42.3339,-71.0265,Constituent Call,"(42.3339, -71.0265)"
546903,101001351478,04/07/2015 10:34:05 PM,04/30/2015 08:30:00 AM,05/06/2015 01:25:28 PM,OVERDUE,Closed,Case Closed. Closed date : 2015-05-06 13:25:28.157 Case Resolved cart request filled new cart # 051400037 04/30/2015,Request for Recycling Cart,Public Works Department,Recycling,Request for Recycling Cart,PWDx_Recycling,PWDx,,,162 Wachusett St  Jamaica Plain  MA  02130,12.0,02,6.0,E13,Jamaica Plain,10.0,Ward 19,1907.0,R3,162 Wachusett St,2130.0,Address,325408.0,42.2938,-71.1163,Self Service,"(42.2938, -71.1163)"
546936,101001351518,04/08/2015 07:55:10 AM,05/30/2015 08:30:00 AM,05/13/2015 08:09:12 AM,ONTIME,Closed,Case Closed Duplicate of Existing Case  reference case 101001334288 4/16/2015,Request for Recycling Cart,Public Works Department,Recycling,Request for Recycling Cart,PWDx_Recycling,PWDx,,,3 Hilton Ter  Roxbury  MA  02119,9.0,10B,7.0,B2,Roxbury,13.0,Ward 11,1103.0,R1,3 Hilton Ter,2119.0,Address,74327.0,42.3153,-71.0939,Constituent Call,"(42.3153, -71.0939)"
547001,101001351609,04/08/2015 08:59:00 AM,05/30/2015 08:59:00 AM,05/08/2015 10:48:45 AM,ONTIME,Closed,Case Closed. Closed date : 2015-05-08 10:48:45.653 Case Resolved cart requested filled new cart #0415302964 05/06/2015,Request for Recycling Cart,Public Works Department,Recycling,Request for Recycling Cart,PWDx_Recycling,PWDx,,,250 Allston St  Brighton  MA  02135,11.0,04,9.0,D14,Allston / Brighton,15.0,Ward 21,2108.0,R3,250 Allston St,2135.0,Address,2414.0,42.3456,-71.139,Constituent Call,"(42.3456, -71.139)"
547153,101001351781,04/08/2015 09:35:58 AM,04/30/2015 09:35:58 AM,05/13/2015 02:39:50 PM,OVERDUE,Closed,Case Closed. Closed date : 2015-05-13 14:39:50.37 Case Resolved no cart out 05/13/15,Request for Recycling Cart,Public Works Department,Recycling,Request for Recycling Cart,PWDx_IPL Damaged Cart Replacement,PWDx,,,526 E Sixth St  South Boston  MA  02127,6.0,05,2.0,C6,South Boston / South Boston Waterfront,5.0,Ward 6,606.0,R3,526 E Sixth St,2127.0,Address,311397.0,42.3332,-71.0392,City Worker App,"(42.3332, -71.0392)"
547188,101001351824,04/08/2015 09:59:19 AM,04/30/2015 09:59:19 AM,04/27/2015 01:19:48 PM,ONTIME,Closed,Case Closed Case Resolved RECYCLING CART LIST REQUEST FILLED NEW CART #0514000675 04/17/2015,Request for Recycling Cart,Public Works Department,Recycling,Request for Recycling Cart,PWDx_Recycling,PWDx,,,140-142 Wood Ave  Mattapan  MA  02126,8.0,08,5.0,E18,Hyde Park,10.0,Ward 18,1806.0,CM,140-142 Wood Ave,2126.0,Address,151218.0,42.2692,-71.1107,Self Service,"(42.2692, -71.1107)"
547191,101001351827,04/08/2015 10:01:53 AM,04/30/2015 10:01:53 AM,04/28/2015 10:28:59 AM,ONTIME,Closed,Case Closed Duplicate of Existing Case  Reference#101001351829 one per a household,Request for Recycling Cart,Public Works Department,Recycling,Request for Recycling Cart,PWDx_Recycling,PWDx,,,36 Hartford St  Dorchester  MA  02125,7.0,03,7.0,B2,Roxbury,13.0,Ward 13,1304.0,R3,36 Hartford St,2125.0,Address,248225.0,42.3162,-71.0727,Self Service,"(42.3162, -71.0727)"
547193,101001351829,04/08/2015 10:03:00 AM,05/30/2015 10:03:00 AM,05/08/2015 10:45:42 AM,ONTIME,Closed,Case Closed. Closed date : 2015-05-08 10:45:42.54 Case Resolved cart requested filled new cart #0415302514 05/06/2015,Request for Recycling Cart,Public Works Department,Recycling,Request for Recycling Cart,PWDx_Recycling,PWDx,,,36 Hartford St  Dorchester  MA  02125,7.0,03,7.0,B2,Roxbury,13.0,Ward 13,1304.0,R3,36 Hartford St,2125.0,Address,248226.0,42.3162,-71.0727,Self Service,"(42.3162, -71.0727)"
547195,101001351832,04/08/2015 10:05:30 AM,04/30/2015 10:05:29 AM,05/06/2015 01:30:38 PM,OVERDUE,Closed,Case Closed. Closed date : 2015-05-06 13:30:38.24 Case Resolved cart request filled new cart # 0415302996 5/05/15,Request for Recycling Cart,Public Works Department,Recycling,Request for Recycling Cart,PWDx_Recycling,PWDx,,,44 Robinwood Ave  Jamaica Plain  MA  02130,9.0,02,6.0,E13,Jamaica Plain,11.0,Ward 19,1904.0,R4,44 Robinwood Ave,2130.0,Address,117458.0,42.3164,-71.1114,Constituent Call,"(42.3164, -71.1114)"
547214,101001351852,04/08/2015 10:15:00 AM,05/30/2015 10:15:00 AM,05/08/2015 10:11:21 AM,ONTIME,Closed,Case Closed. Closed date : 2015-05-08 10:11:21.707 Case Resolved cart requested filled new cart #0514302541 04/30/2015,Request for Recycling Cart,Public Works Department,Recycling,Request for Recycling Cart,PWDx_Recycling,PWDx,,,29-31 Chickatawbut St  Dorchester  MA  02122,8.0,07,3.0,C11,Dorchester,7.0,Ward 16,1610.0,R3,29-31 Chickatawbut St,2122.0,Address,32015.0,42.2866,-71.0473,Constituent Call,"(42.2866, -71.0473)"
547221,101001351859,04/08/2015 10:18:59 AM,04/30/2015 10:18:59 AM,05/06/2015 01:50:07 PM,OVERDUE,Closed,Case Closed. Closed date : 2015-05-06 13:50:07.547 Case Resolved cart request filled new cart # 0415302441 05/05/2015,Request for Recycling Cart,Public Works Department,Recycling,Request for Recycling Cart,PWDx_Recycling,PWDx,,,137 Saratoga St  East Boston  MA  02128,1.0,09,1.0,A7,East Boston,1.0,Ward 1,106.0,R2,137 Saratoga St,2128.0,Address,122499.0,42.3769,-71.0351,Constituent Call,"(42.3769, -71.0351)"
547271,101001351914,04/08/2015 10:34:00 AM,05/30/2015 10:34:00 AM,05/15/2015 02:15:27 PM,ONTIME,Closed,Case Closed. Closed date : 2015-05-15 14:15:27.077 Case Resolved cart requested new cart#0415302669 05/01/2015,Request for Recycling Cart,Public Works Department,Recycling,Request for Recycling Cart,PWDx_Recycling,PWDx,,,252 Gold St  South Boston  MA  02127,6.0,05,2.0,C6,South Boston / South Boston Waterfront,5.0,Ward 7,704.0,R3,252 Gold St,2127.0,Address,242325.0,42.3356,-71.0484,Self Service,"(42.3356, -71.0484)"
547370,101001352041,04/08/2015 12:09:00 PM,05/30/2015 12:09:00 PM,05/08/2015 10:42:40 AM,ONTIME,Closed,Case Closed. Closed date : 2015-05-08 10:42:40.337 Case Resolved cart requested filled new cart #0415302556 05/06/2015,Request for Recycling Cart,Public Works Department,Recycling,Request for Recycling Cart,PWDx_Recycling,PWDx,,,31 Kenton Rd  Jamaica Plain  MA  02130,9.0,02,6.0,E13,Jamaica Plain,11.0,Ward 11,1107.0,R1,31 Kenton Rd,2130.0,Address,81368.0,42.3065,-71.1055,Constituent Call,"(42.3065, -71.1055)"
547375,101001352053,04/08/2015 12:15:55 PM,04/30/2015 12:15:55 PM,04/23/2015 11:30:56 AM,ONTIME,Closed,Case Closed Case Resolved request filled new cart # 0714423956 04/22/15,Request for Recycling Cart,Public Works Department,Recycling,Request for Recycling Cart,PWDx_Recycling,PWDx,,,34 Mead St  Charlestown  MA  02129,3.0,1A,1.0,A15,Charlestown,2.0,Ward 2,206.0,R2,34 Mead St,2129.0,Address,93537.0,42.3804,-71.0683,Constituent Call,"(42.3804, -71.0683)"
547386,101001352064,04/08/2015 12:22:45 PM,04/30/2015 12:22:45 PM,04/23/2015 11:31:40 AM,ONTIME,Closed,Case Closed Case Resolved request filled new cart # 0714423632 04/22/15,Request for Recycling Cart,Public Works Department,Recycling,Request for Recycling Cart,PWDx_Recycling,PWDx,,,16 Prospect St  Charlestown  MA  02129,3.0,1A,1.0,A15,Charlestown,2.0,Ward 2,203.0,R3,16 Prospect St,2129.0,Address,113444.0,42.3751,-71.0579,Constituent Call,"(42.3751, -71.0579)"
547424,101001352114,04/08/2015 01:06:00 PM,05/30/2015 01:06:00 PM,05/15/2015 02:30:24 PM,ONTIME,Closed,Case Closed. Closed date : 2015-05-15 14:30:24.847 Case Resolved cart requested new cart#0415302315 05/04/2015,Request for Recycling Cart,Public Works Department,Recycling,Request for Recycling Cart,PWDx_Recycling,PWDx,,,24 Charlotte St  Dorchester  MA  02121,7.0,03,4.0,B3,Greater Mattapan,8.0,Ward 14,1407.0,R4,24 Charlotte St,2121.0,Address,29876.0,42.2998,-71.085,Constituent Call,"(42.2998, -71.085)"
547462,101001352177,04/08/2015 02:04:00 PM,05/30/2015 02:04:00 PM,05/08/2015 10:55:05 AM,ONTIME,Closed,Case Closed. Closed date : 2015-05-08 10:55:05.647 Case Resolved cart requested filled new cart #0415302415 05/06/2015,Request for Recycling Cart,Public Works Department,Recycling,Request for Recycling Cart,PWDx_Recycling,PWDx,,,40 Child St  Hyde Park  MA  02136,12.0,08,5.0,E18,Hyde Park,10.0,Ward 18,1812.0,R1,40 Child St,2136.0,Address,32129.0,42.2583,-71.1278,Constituent Call,"(42.2583, -71.1278)"
547606,101001352362,04/08/2015 04:58:00 PM,05/30/2015 04:58:00 PM,05/08/2015 10:56:28 AM,ONTIME,Closed,Case Closed. Closed date : 2015-05-08 10:56:28.57 Case Resolved no cart needed 05/06/2015,Request for Recycling Cart,Public Works Department,Recycling,Request for Recycling Cart,PWDx_Recycling,PWDx,,,24 S Bremen St  East Boston  MA  02128,1.0,09,1.0,A7,East Boston,1.0,Ward 1,103.0,E,24 S Bremen St,2128.0,Address,174290.0,42.3683,-71.0399,Constituent Call,"(42.3683, -71.0399)"
547689,101001352465,04/09/2015 07:14:00 AM,05/30/2015 08:30:00 AM,05/08/2015 10:18:53 AM,ONTIME,Closed,Case Closed. Closed date : 2015-05-08 10:18:53.7 Case Resolved cart requested filled new cart #0514302508 04/30/2015,Request for Recycling Cart,Public Works Department,Recycling,Request for Recycling Cart,PWDx_Recycling,PWDx,,,235 Ashmont St  Dorchester  MA  02124,8.0,07,3.0,C11,Dorchester,7.0,Ward 16,1608.0,R1,235 Ashmont St,2124.0,Address,5365.0,42.2862,-71.0622,Constituent Call,"(42.2862, -71.0622)"
547716,101001352495,04/09/2015 07:41:39 AM,05/01/2015 08:30:00 AM,05/05/2015 08:19:03 AM,OVERDUE,Closed,Case Closed. Closed date : 2015-05-05 08:19:03.88 Case Resolved CART REQUESTED FILLED NEW CART # CART WAS ALREADY DELIVERED,Request for Recycling Cart,Public Works Department,Recycling,Request for Recycling Cart,PWDx_Recycling,PWDx,,,348 Huntington Ave  Hyde Park  MA  02136,12.0,08,5.0,E18,Hyde Park,10.0,Ward 18,1808.0,R2,348 Huntington Ave,2136.0,Address,76550.0,42.2663,-71.1162,Self Service,"(42.2663, -71.1162)"
547763,101001352548,04/09/2015 08:05:00 AM,05/30/2015 08:30:00 AM,05/08/2015 10:53:35 AM,ONTIME,Closed,Case Closed. Closed date : 2015-05-08 10:53:35.45 Case Resolved cart requested filled new cart #0415302408 05/06/2015,Request for Recycling Cart,Public Works Department,Recycling,Request for Recycling Cart,PWDx_Recycling,PWDx,,,120 Selden St  Dorchester  MA  02124,8.0,07,4.0,B3,Dorchester,9.0,Ward 17,1710.0,R2,120 Selden St,2124.0,Address,124882.0,42.2804,-71.0815,Constituent Call,"(42.2804, -71.0815)"
547827,101001352637,04/09/2015 09:01:00 AM,05/30/2015 09:01:00 AM,05/08/2015 10:47:09 AM,ONTIME,Closed,Case Closed. Closed date : 2015-05-08 10:47:09.2 Case Resolved cart requested filled new cart #0415302515 05/06/2015,Request for Recycling Cart,Public Works Department,Recycling,Request for Recycling Cart,PWDx_Recycling,PWDx,,,16 Glendale St  Dorchester  MA  02125,7.0,03,3.0,C11,Dorchester,8.0,Ward 15,1501.0,R2,16 Glendale St,2125.0,Address,64186.0,42.3131,-71.0658,Constituent Call,"(42.3131, -71.0658)"
547849,101001352662,04/09/2015 09:17:17 AM,05/01/2015 09:17:17 AM,04/28/2015 01:03:30 PM,ONTIME,Closed,Case Closed Case Resolved CART REQUESTED FILLED NEW CART # 0714423890 04/27/2015,Request for Recycling Cart,Public Works Department,Recycling,Request for Recycling Cart,PWDx_Recycling,PWDx,,,19 Estrella St  Jamaica Plain  MA  02130,9.0,10A,6.0,E13,Jamaica Plain,11.0,Ward 10,1007.0,R3,19 Estrella St,2130.0,Address,54428.0,42.3222,-71.103,Constituent Call,"(42.3222, -71.103)"
547885,101001352716,04/09/2015 09:45:27 AM,05/01/2015 09:45:27 AM,04/28/2015 01:04:10 PM,ONTIME,Closed,Case Closed Case Resolved CART REQUESTED FILLED NEW CART # 0714423915 04/27/2015,Request for Recycling Cart,Public Works Department,Recycling,Request for Recycling Cart,PWDx_Recycling,PWDx,,,25 Sunnyside St  Jamaica Plain  MA  02130,9.0,10A,6.0,E13,Jamaica Plain,11.0,Ward 10,1006.0,R1,25 Sunnyside St,2130.0,Address,132683.0,42.3238,-71.107,Self Service,"(42.3238, -71.107)"
547909,101001352744,04/09/2015 10:05:00 AM,05/30/2015 10:05:00 AM,05/15/2015 02:24:17 PM,ONTIME,Closed,Case Closed. Closed date : 2015-05-15 14:24:17.31 Case Resolved cart requested new cart#0415313688 05/04/2015,Request for Recycling Cart,Public Works Department,Recycling,Request for Recycling Cart,PWDx_Recycling,PWDx,,,93 Sedgwick St  Jamaica Plain  MA  02130,9.0,02,6.0,E13,Jamaica Plain,11.0,Ward 19,1906.0,E,93 Sedgwick St,2130.0,Address,124832.0,42.3082,-71.112,Constituent Call,"(42.3082, -71.112)"
547930,101001352769,04/09/2015 10:24:00 AM,05/30/2015 10:24:00 AM,06/05/2015 07:36:53 AM,OVERDUE,Closed,Case Closed. Closed date : 2015-06-05 07:36:53.42 Case Resolved Cart requested filled new cart #0415302656 06/02/2015,Request for Recycling Cart,Public Works Department,Recycling,Request for Recycling Cart,PWDx_Recycling,PWDx,,,94 Alban St  Dorchester  MA  02124,8.0,07,4.0,C11,Dorchester,8.0,Ward 17,1709.0,CD,94 Alban St,2124.0,Address,1469.0,42.288,-71.067,Self Service,"(42.288, -71.067)"
547934,101001352773,04/09/2015 10:27:00 AM,05/30/2015 10:27:00 AM,05/15/2015 02:12:18 PM,ONTIME,Closed,Case Closed. Closed date : 2015-05-15 14:12:18.84 Case Resolved cart requested new cart#0415313692 04/30/2015,Request for Recycling Cart,Public Works Department,Recycling,Request for Recycling Cart,PWDx_Recycling,PWDx,,,248 Huntington Ave  Hyde Park  MA  02136,12.0,08,5.0,E18,Hyde Park,10.0,Ward 18,1808.0,R2,248 Huntington Ave,2136.0,Address,76512.0,42.2693,-71.1181,Constituent Call,"(42.2693, -71.1181)"
547941,101001352782,04/09/2015 10:39:03 AM,05/01/2015 10:39:03 AM,04/22/2015 03:13:19 PM,ONTIME,Closed,Case Closed Case Resolved cart requested swapped out new cart #0714423824 04/17/2015,Request for Recycling Cart,Public Works Department,Recycling,Request for Recycling Cart,PWDx_Recycling,PWDx,,,53 Rutland St  Roxbury  MA  02118,4.0,1C,2.0,D4,South End,6.0,Ward 9,901.0,CM,53 Rutland St,2118.0,Address,120195.0,42.3401,-71.0761,Self Service,"(42.3401, -71.0761)"
547948,101001352790,04/09/2015 10:42:00 AM,05/29/2015 10:42:00 AM,05/15/2015 11:41:10 AM,ONTIME,Closed,Case Closed. Closed date : 2015-05-15 11:41:10.81 Case Resolved cart requested new cart#0415302486 05/14/2015,Request for Recycling Cart,Public Works Department,Recycling,Request for Recycling Cart,PWDx_Recycling,PWDx,,,25 Hatherly Rd  Brighton  MA  02135,11.0,04,9.0,D14,Allston / Brighton,15.0,Ward 22,2209.0,R2,25 Hatherly Rd,2135.0,Address,249257.0,42.3431,-71.1548,Self Service,"(42.3431, -71.1548)"
547949,101001352791,04/09/2015 10:42:00 AM,05/30/2015 10:42:00 AM,05/08/2015 09:59:05 AM,ONTIME,Closed,Case Closed. Closed date : 2015-05-08 09:59:05.17 Case Resolved cart requested filled new cart # 0714423580 05/07/2015,Request for Recycling Cart,Public Works Department,Recycling,Request for Recycling Cart,PWDx_Recycling,PWDx,,,21-23 Cheney St  Dorchester  MA  02121,9.0,10B,7.0,B2,Roxbury,13.0,Ward 12,1207.0,R3,21-23 Cheney St,2121.0,Address,30647.0,42.309,-71.0842,Constituent Call,"(42.309, -71.0842)"
547954,101001352797,04/09/2015 10:46:00 AM,05/30/2015 10:46:00 AM,05/15/2015 02:12:51 PM,ONTIME,Closed,Case Closed. Closed date : 2015-05-15 14:12:51.883 Case Resolved cart requested new cart#0415302667 04/30/15,Request for Recycling Cart,Public Works Department,Recycling,Request for Recycling Cart,PWDx_Recycling,PWDx,,,12 Crane St  Hyde Park  MA  02136,12.0,08,5.0,E18,Hyde Park,10.0,Ward 18,1808.0,R1,12 Crane St,2136.0,Address,43979.0,42.2707,-71.1169,Constituent Call,"(42.2707, -71.1169)"
547960,101001352807,04/09/2015 11:02:00 AM,05/30/2015 11:02:00 AM,05/15/2015 02:33:36 PM,ONTIME,Closed,Case Closed. Closed date : 2015-05-15 14:33:36.367 Case Resolved cart requested new cart#0415302673 05/04/2015,Request for Recycling Cart,Public Works Department,Recycling,Request for Recycling Cart,PWDx_Recycling,PWDx,,,143 Newfield St  West Roxbury  MA  02132,12.0,06,6.0,E5,West Roxbury,12.0,20,2017.0,,143 Newfield St,2132.0,Address,344300.0,42.3594,-71.0587,Constituent Call,"(0, 0)"
547983,101001352837,04/09/2015 11:20:55 AM,05/01/2015 11:20:54 AM,04/15/2015 11:08:12 AM,ONTIME,Closed,Case Closed Case Invalid Caller cancelled the request,Request for Recycling Cart,Public Works Department,Recycling,Request for Recycling Cart,PWDx_Recycling,PWDx,,,15 Fox St  Dorchester  MA  02122,7.0,03,3.0,C11,Dorchester,8.0,Ward 15,1503.0,R1,15 Fox St,2122.0,Address,60381.0,42.3066,-71.063,Constituent Call,"(42.3066, -71.063)"
548063,101001352952,04/09/2015 01:06:00 PM,05/30/2015 01:06:00 PM,05/08/2015 10:19:29 AM,ONTIME,Closed,Case Closed. Closed date : 2015-05-08 10:19:29.68 Case Resolved cart requested filled new cart #0514302223 04/30/2015,Request for Recycling Cart,Public Works Department,Recycling,Request for Recycling Cart,PWDx_Recycling,PWDx,,,101 Oakton Ave  Dorchester  MA  02122,8.0,07,3.0,C11,Dorchester,7.0,Ward 16,1609.0,CD,101 Oakton Ave,2122.0,Address,104886.0,42.2872,-71.0495,Constituent Call,"(42.2872, -71.0495)"
548090,101001352991,04/09/2015 01:34:00 PM,05/30/2015 01:34:00 PM,05/08/2015 10:02:22 AM,ONTIME,Closed,Case Closed. Closed date : 2015-05-08 10:02:22.2 Case Resolved cart requested filled new cart #0714423749 05/07/2015,Request for Recycling Cart,Public Works Department,Recycling,Request for Recycling Cart,PWDx_Recycling,PWDx,,,133 Cedar St  Roxbury  MA  02119,9.0,10B,7.0,B2,Roxbury,13.0,11,1101.0,,133 Cedar St,2119.0,Address,352825.0,42.3594,-71.0587,Constituent Call,"(0, 0)"
548115,101001353028,04/09/2015 02:19:58 PM,05/01/2015 02:19:58 PM,05/04/2015 09:01:04 AM,OVERDUE,Closed,Case Closed. Closed date : 2015-05-04 09:01:04.92 Case Invalid,Request for Recycling Cart,Public Works Department,Recycling,Request for Recycling Cart,PWDx_Recycling,PWDx,,,16 Blakeville St  Dorchester  MA  02121,7.0,03,4.0,C11,Dorchester,8.0,Ward 15,1502.0,R2,16 Blakeville St,2121.0,Address,15926.0,42.3044,-71.071,Constituent Call,"(42.3044, -71.071)"
548124,101001353040,04/09/2015 02:42:43 PM,05/01/2015 02:42:43 PM,05/06/2015 01:31:22 PM,OVERDUE,Closed,Case Closed. Closed date : 2015-05-06 13:31:22.21 Case Resolved cart request filled new cart # 0415302658 05/05/15,Request for Recycling Cart,Public Works Department,Recycling,Request for Recycling Cart,PWDx_Recycling,PWDx,,,27 Green St  Jamaica Plain  MA  02130,9.0,02,6.0,E13,Jamaica Plain,11.0,Ward 19,1906.0,R2,27 Green St,2130.0,Address,66375.0,42.3126,-71.1127,Constituent Call,"(42.3126, -71.1127)"
548363,101001353408,04/10/2015 09:23:16 AM,05/04/2015 09:23:16 AM,04/30/2015 09:41:36 AM,ONTIME,Closed,Case Closed Case Resolved cart request filled new cart#0714423823 04/17/2015,Request for Recycling Cart,Public Works Department,Recycling,Request for Recycling Cart,PWDx_Recycling,PWDx,,,36 Dudley St  Roxbury  MA  02119,7.0,10B,7.0,B2,Roxbury,13.0,Ward 9,905.0,R1,36 Dudley St,2119.0,Address,49711.0,42.3295,-71.0884,Constituent Call,"(42.3295, -71.0884)"
548369,101001353415,04/10/2015 09:27:19 AM,05/04/2015 09:27:18 AM,04/23/2015 11:32:18 AM,ONTIME,Closed,Case Closed Case Resolved request filled new cart # 0714423634 04/22/15,Request for Recycling Cart,Public Works Department,Recycling,Request for Recycling Cart,PWDx_Recycling,PWDx,,,48 Rutherford Ave  Charlestown  MA  02129,3.0,1A,1.0,A15,Charlestown,2.0,02,201.0,,48 Rutherford Ave,2129.0,Address,343273.0,42.3594,-71.0587,Constituent Call,"(0, 0)"
548436,101001353498,04/10/2015 10:35:00 AM,06/06/2015 10:35:00 AM,05/29/2015 02:31:34 PM,ONTIME,Closed,Case Closed. Closed date : 2015-05-29 14:31:34.343 Case Resolved cart requested filled new cart#0415302268 05/28/2015,Request for Recycling Cart,Public Works Department,Recycling,Request for Recycling Cart,PWDx_Recycling,PWDx,,,5 Downey Ct  Dorchester  MA  02125,7.0,03,7.0,B2,Roxbury,13.0,Ward 13,1302.0,R1,5 Downey Ct,2125.0,Address,49325.0,42.3198,-71.0735,Constituent Call,"(42.3198, -71.0735)"
548439,101001353501,04/10/2015 10:38:05 AM,05/04/2015 10:38:05 AM,04/23/2015 11:46:22 AM,ONTIME,Closed,Case Closed Case Resolved request filled new cart # 0714423958 04/17/2015,Request for Recycling Cart,Public Works Department,Recycling,Request for Recycling Cart,PWDx_Recycling,PWDx,,,34 Edgerly Rd  Boston  MA  02115,4.0,10A,7.0,D4,Back Bay,14.0,Ward 4,405.0,CM,34 Edgerly Rd,2115.0,Address,51185.0,42.3455,-71.0876,Constituent Call,"(42.3455, -71.0876)"
548457,101001353529,04/10/2015 11:08:36 AM,05/04/2015 11:08:35 AM,04/23/2015 11:45:47 AM,ONTIME,Closed,Case Closed Case Resolved request filled new cart # 0714423957 04/17/2015,Request for Recycling Cart,Public Works Department,Recycling,Request for Recycling Cart,PWDx_Recycling,PWDx,,,192 Hillside St  Mission Hill  MA  02120,9.0,10A,8.0,B2,Mission Hill,14.0,Ward 10,1004.0,R3,192 Hillside St,2120.0,Address,74216.0,42.3318,-71.1087,Constituent Call,"(42.3318, -71.1087)"
548507,101001353585,04/10/2015 12:03:29 PM,05/04/2015 12:03:29 PM,05/01/2015 12:52:48 PM,ONTIME,Closed,Case Closed Case Resolved cart requested filled new cart#0714423882 04/30/2015,Request for Recycling Cart,Public Works Department,Recycling,Request for Recycling Cart,PWDx_Recycling,PWDx,,,29-31 Townsend St  Roxbury  MA  02119,9.0,10B,7.0,B2,Roxbury,13.0,Ward 11,1103.0,R2,29-31 Townsend St,2119.0,Address,136474.0,42.3195,-71.0928,Constituent Call,"(42.3195, -71.0928)"
548513,101001353594,04/10/2015 12:14:24 PM,05/04/2015 12:14:24 PM,05/01/2015 12:53:31 PM,ONTIME,Closed,Case Closed Case Resolved cart requested filled new cart# 0714423883 04/30/2015,Request for Recycling Cart,Public Works Department,Recycling,Request for Recycling Cart,PWDx_Recycling,PWDx,,,221 Walnut Ave  Roxbury  MA  02119,9.0,10B,7.0,B2,Roxbury,13.0,Ward 11,1103.0,R3,221 Walnut Ave,2119.0,Address,170888.0,42.3193,-71.0906,Constituent Call,"(42.3193, -71.0906)"
548582,101001353680,04/10/2015 01:57:56 PM,05/04/2015 01:57:56 PM,04/28/2015 01:04:42 PM,ONTIME,Closed,Case Closed Case Resolved CART REQUESTED FILLED NEW CART # 0714423911 04/27/2015,Request for Recycling Cart,Public Works Department,Recycling,Request for Recycling Cart,PWDx_Recycling,PWDx,,,60 Round Hill St  Jamaica Plain  MA  02130,9.0,10A,6.0,E13,Jamaica Plain,11.0,Ward 10,1006.0,R1,60 Round Hill St,2130.0,Address,118919.0,42.3248,-71.107,Constituent Call,"(42.3248, -71.107)"
548646,101001353754,04/10/2015 03:18:00 PM,05/30/2015 03:18:00 PM,05/08/2015 10:57:22 AM,ONTIME,Closed,Case Closed. Closed date : 2015-05-08 10:57:22.057 Case Resolved cart requested filled new cart #0415302555 05/06/2015,Request for Recycling Cart,Public Works Department,Recycling,Request for Recycling Cart,PWDx_Recycling,PWDx,,,306-308 Maverick St  East Boston  MA  02128,1.0,09,1.0,A7,East Boston,1.0,Ward 1,102.0,R3,306-308 Maverick St,2128.0,Address,93048.0,42.3673,-71.032,Self Service,"(42.3673, -71.032)"
548819,101001354000,04/11/2015 10:24:00 AM,05/30/2015 08:30:00 AM,05/15/2015 02:31:27 PM,ONTIME,Closed,Case Closed. Closed date : 2015-05-15 14:31:27.11 Case Resolved cart requested new cart#0415313018 05/04/2015,Request for Recycling Cart,Public Works Department,Recycling,Request for Recycling Cart,PWDx_Recycling,PWDx,,,25 Hunnewell Ave  Brighton  MA  02135,11.0,04,9.0,D14,Allston / Brighton,15.0,Ward 22,2213.0,R2,25 Hunnewell Ave,2135.0,Address,76105.0,42.3524,-71.1697,Self Service,"(42.3524, -71.1697)"
548860,101001354053,04/11/2015 12:29:37 PM,05/05/2015 08:30:00 AM,05/06/2015 01:31:58 PM,OVERDUE,Closed,Case Closed. Closed date : 2015-05-06 13:31:58.84 Case Resolved cart request filled new cart # 0415302666 05/05/15,Request for Recycling Cart,Public Works Department,Recycling,Request for Recycling Cart,PWDx_Recycling,PWDx,,,9 Parkwood Ter  Jamaica Plain  MA  02130,9.0,02,6.0,E13,Jamaica Plain,11.0,Ward 10,1009.0,R2,9 Parkwood Ter,2130.0,Address,108220.0,42.3227,-71.1151,Self Service,"(42.3227, -71.1151)"
549137,101001354490,04/12/2015 08:07:00 PM,05/30/2015 08:30:00 AM,05/08/2015 10:55:29 AM,ONTIME,Closed,Case Closed. Closed date : 2015-05-08 10:55:29.363 Case Resolved cart requested filled new cart #0415302998 05/06/2015,Request for Recycling Cart,Public Works Department,Recycling,Request for Recycling Cart,PWDx_Recycling,PWDx,,,592-594 Beech St  Roslindale  MA  02131,12.0,08,5.0,E18,Hyde Park,10.0,Ward 18,1822.0,R2,592-594 Beech St,2131.0,Address,13287.0,42.2732,-71.1287,Constituent Call,"(42.2732, -71.1287)"
549326,101001354768,04/13/2015 10:07:00 AM,05/30/2015 10:07:00 AM,09/02/2015 02:36:07 PM,OVERDUE,Closed,Case Closed. Closed date : 2015-09-02 14:36:07.89 Case Resolved broken cart swapped new cart #5139002802,Request for Recycling Cart,Public Works Department,Recycling,Request for Recycling Cart,PWDx_Recycling,PWDx,,,72 Homestead St  Dorchester  MA  02121,9.0,10B,7.0,B2,Roxbury,13.0,Ward 12,1209.0,R2,72 Homestead St,2121.0,Address,166311.0,42.3125,-71.0912,Constituent Call,"(42.3125, -71.0912)"
549333,101001354777,04/13/2015 10:13:27 AM,05/05/2015 10:13:27 AM,05/06/2015 01:34:13 PM,OVERDUE,Closed,Case Closed. Closed date : 2015-05-06 13:34:13.953 Case Resolved cart request filled new cart # 0415302443 05/05/2015,Request for Recycling Cart,Public Works Department,Recycling,Request for Recycling Cart,PWDx_Recycling,PWDx,,,25 Brinsley St  Dorchester  MA  02121,7.0,03,4.0,C11,Roxbury,8.0,Ward 14,1404.0,R3,25 Brinsley St,2121.0,Address,20431.0,42.3055,-71.0784,Constituent Call,"(42.3055, -71.0784)"
549336,101001354780,04/13/2015 10:15:00 AM,06/05/2015 10:15:00 AM,05/15/2015 02:17:42 PM,ONTIME,Closed,Case Closed. Closed date : 2015-05-15 14:17:42.11 Case Resolved cart requested new cart#0415302676 05/01/2015,Request for Recycling Cart,Public Works Department,Recycling,Request for Recycling Cart,PWDx_Recycling,PWDx,,,20 Berwick St  West Roxbury  MA  02132,12.0,06,6.0,E5,West Roxbury,12.0,Ward 20,2017.0,R1,20 Berwick St,2132.0,Address,15208.0,42.2823,-71.1704,Constituent Call,"(42.2823, -71.1704)"
549364,101001354824,04/13/2015 10:45:22 AM,05/05/2015 10:45:22 AM,05/06/2015 01:33:25 PM,OVERDUE,Closed,Case Closed. Closed date : 2015-05-06 13:33:25.38 Case Resolved cart request filled new cart # 0415002659 05/05/2015,Request for Recycling Cart,Public Works Department,Recycling,Request for Recycling Cart,PWDx_Recycling,PWDx,,,31 Parkton Rd  Jamaica Plain  MA  02130,9.0,02,6.0,E13,Jamaica Plain,11.0,Ward 10,1009.0,R3,31 Parkton Rd,2130.0,Address,108154.0,42.3224,-71.114,Self Service,"(42.3224, -71.114)"
549372,101001354834,04/13/2015 10:49:00 AM,06/05/2015 10:49:00 AM,05/12/2015 12:26:03 PM,ONTIME,Closed,Case Closed. Closed date : 2015-05-12 12:26:03.573 Case Resolved cart requested filled new cart # 0415302437 5/11/2015,Request for Recycling Cart,Public Works Department,Recycling,Request for Recycling Cart,PWDx_Recycling,PWDx,,,931 Lagrange St  West Roxbury  MA  02132,12.0,06,6.0,E5,West Roxbury,12.0,Ward 20,2017.0,CD,931 Lagrange St,2132.0,Address,340418.0,42.2959,-71.1713,Self Service,"(42.2959, -71.1713)"
549386,101001354851,04/13/2015 11:04:38 AM,05/05/2015 11:04:38 AM,05/01/2015 12:50:21 PM,ONTIME,Closed,Case Closed Case Resolved cart requested filled new cart#0714423917 04/30/2015,Request for Recycling Cart,Public Works Department,Recycling,Request for Recycling Cart,PWDx_Recycling,PWDx,,,17 Arcola St  Jamaica Plain  MA  02130,9.0,10A,8.0,E13,Jamaica Plain,11.0,Ward 10,1008.0,CM,17 Arcola St,2130.0,Address,4590.0,42.325,-71.109,Self Service,"(42.325, -71.109)"
549389,101001354855,04/13/2015 11:07:00 AM,06/05/2015 11:07:00 AM,08/28/2015 01:05:53 PM,OVERDUE,Closed,Case Closed. Closed date : 2015-08-28 13:05:53.947 Case Resolved cart requested filled new cart #0715671572 08/26/2015,Request for Recycling Cart,Public Works Department,Recycling,Request for Recycling Cart,PWDx_Recycling,PWDx,,,92 Evans St  Dorchester  MA  02124,8.0,07,4.0,B3,Dorchester,9.0,Ward 17,1710.0,CD,92 Evans St,2124.0,Address,54846.0,42.2819,-71.0816,Constituent Call,"(42.2819, -71.0816)"
549414,101001354888,04/13/2015 11:27:00 AM,06/05/2015 11:27:00 AM,05/15/2015 02:23:44 PM,ONTIME,Closed,Case Closed. Closed date : 2015-05-15 14:23:44.27 Case Resolved cart requested new cart#0415302677 05/04/2015,Request for Recycling Cart,Public Works Department,Recycling,Request for Recycling Cart,PWDx_Recycling,PWDx,,,368 Centre St  Jamaica Plain  MA  02130,9.0,02,6.0,E13,Jamaica Plain,11.0,Ward 19,1901.0,RC,368 Centre St,2130.0,Address,28008.0,42.3222,-71.1086,Constituent Call,"(42.3222, -71.1086)"
549415,101001354886,04/13/2015 11:27:00 AM,06/05/2015 11:27:00 AM,05/15/2015 02:24:44 PM,ONTIME,Closed,Case Closed. Closed date : 2015-05-15 14:24:44.747 Case Resolved cart requested new cart#0415313688 05/04/2015,Request for Recycling Cart,Public Works Department,Recycling,Request for Recycling Cart,PWDx_Recycling,PWDx,,,105 Child St  Jamaica Plain  MA  02130,9.0,02,6.0,E13,Jamaica Plain,11.0,Ward 11,1109.0,R3,105 Child St,2130.0,Address,32162.0,42.3069,-71.1113,Constituent Call,"(42.3069, -71.1113)"
549416,101001354887,04/13/2015 11:27:19 AM,05/05/2015 11:27:19 AM,05/01/2015 01:10:21 PM,ONTIME,Closed,Case Closed Case Resolved cart requested filled new cart#0714423851 04/30/15,Request for Recycling Cart,Public Works Department,Recycling,Request for Recycling Cart,PWDx_Recycling,PWDx,,,234 W Newton St  Boston  MA  02115,4.0,1C,7.0,D4,Back Bay,14.0,Ward 4,405.0,CM,234 W Newton St,2115.0,Address,102513.0,42.3442,-71.0804,Constituent Call,"(42.3442, -71.0804)"
549461,101001354945,04/13/2015 11:55:46 AM,05/05/2015 11:55:46 AM,05/06/2015 01:11:49 PM,OVERDUE,Closed,Case Closed. Closed date : 2015-05-06 13:11:49.313 Case Resolved cart request filled new cart # 0415300586 04/04/2015,Request for Recycling Cart,Public Works Department,Recycling,Request for Recycling Cart,PWDx_Recycling,PWDx,,,641 Walk Hill St  Mattapan  MA  02126,8.0,07,5.0,B3,Greater Mattapan,9.0,Ward 18,1803.0,R3,641 Walk Hill St,2126.0,Address,326350.0,42.2794,-71.0965,Self Service,"(42.2794, -71.0965)"
549471,101001354961,04/13/2015 12:08:00 PM,06/06/2015 12:08:00 PM,05/08/2015 10:20:01 AM,ONTIME,Closed,Case Closed. Closed date : 2015-05-08 10:20:01.463 Case Resolved cart requested filled new cart #0514000590 04/30/2015,Request for Recycling Cart,Public Works Department,Recycling,Request for Recycling Cart,PWDx_Recycling,PWDx,,,1 Fairfax St  Dorchester  MA  02124,8.0,07,3.0,C11,Dorchester,7.0,Ward 16,1608.0,R1,1 Fairfax St,2124.0,Address,55554.0,42.2837,-71.0605,Self Service,"(42.2837, -71.0605)"
549483,101001354973,04/13/2015 12:15:00 PM,06/05/2015 12:15:00 PM,05/12/2015 12:21:36 PM,ONTIME,Closed,Case Closed. Closed date : 2015-05-12 12:21:36.447 Case Resolved cart requested filled new cart # 0415302303 05/11/2015,Request for Recycling Cart,Public Works Department,Recycling,Request for Recycling Cart,PWDx_Recycling,PWDx,,,29 Vassar St  Dorchester  MA  02121,7.0,03,4.0,B3,Dorchester,8.0,Ward 14,1402.0,R1,29 Vassar St,2121.0,Address,139884.0,42.3,-71.0777,Constituent Call,"(42.3, -71.0777)"
549501,101001355000,04/13/2015 12:28:20 PM,05/05/2015 12:28:20 PM,05/01/2015 01:03:41 PM,ONTIME,Closed,Case Closed Case Resolved cart requested filled new cart#0714423884 04/30/2015,Request for Recycling Cart,Public Works Department,Recycling,Request for Recycling Cart,PWDx_Recycling,PWDx,,,23 Southwood St  Roxbury  MA  02119,9.0,10B,7.0,B2,Roxbury,13.0,Ward 12,1204.0,R3,23 Southwood St,2119.0,Address,312861.0,42.3183,-71.0797,Constituent Call,"(42.3183, -71.0797)"
549529,101001355038,04/13/2015 12:57:00 PM,06/05/2015 12:57:00 PM,05/15/2015 01:51:55 PM,ONTIME,Closed,Case Closed. Closed date : 2015-05-15 13:51:55.013 Case Resolved cart requested new cart#0514302581 04/28/2015,Request for Recycling Cart,Public Works Department,Recycling,Request for Recycling Cart,PWDx_Recycling,PWDx,,,62 London St  East Boston  MA  02128,1.0,09,1.0,A7,East Boston,1.0,Ward 1,104.0,R2,62 London St,2128.0,Address,265793.0,42.3716,-71.0407,Constituent Call,"(42.3716, -71.0407)"
549559,101001355083,04/13/2015 01:32:09 PM,05/05/2015 01:32:09 PM,04/23/2015 11:33:04 AM,ONTIME,Closed,Case Closed Case Resolved request filled new cart # 0714423633 04/22/15,Request for Recycling Cart,Public Works Department,Recycling,Request for Recycling Cart,PWDx_Recycling,PWDx,,,44 Mount Vernon St  Charlestown  MA  02129,3.0,1A,1.0,A15,Charlestown,2.0,Ward 2,203.0,R2,44 Mount Vernon St,2129.0,Address,98872.0,42.3747,-71.0583,Constituent Call,"(42.3747, -71.0583)"
549592,101001355137,04/13/2015 02:11:28 PM,05/05/2015 02:11:27 PM,05/06/2015 01:26:17 PM,OVERDUE,Closed,Case Closed. Closed date : 2015-05-06 13:26:17.937 Case Resolved cart request filled new cart # 051400026 04/30/2015,Request for Recycling Cart,Public Works Department,Recycling,Request for Recycling Cart,PWDx_Recycling,PWDx,,,32 Florian St  Roslindale  MA  02131,12.0,02,6.0,E18,Jamaica Plain,10.0,Ward 19,1912.0,CM,32 Florian St,2131.0,Address,58902.0,42.2876,-71.1176,Constituent Call,"(42.2876, -71.1176)"
549596,101001355146,04/13/2015 02:19:00 PM,06/05/2015 02:19:00 PM,05/11/2015 08:20:05 AM,ONTIME,Closed,Case Closed. Closed date : 2015-05-11 08:20:05.003 Case Resolved Cart delivered by Contractor,Request for Recycling Cart,Public Works Department,Recycling,Request for Recycling Cart,PWDx_Recycling,PWDx,,,12-14 Adair Rd  Brighton  MA  02135,11.0,04,9.0,D14,Allston / Brighton,15.0,Ward 22,2207.0,R2,12-14 Adair Rd,2135.0,Address,292.0,42.352,-71.1669,Constituent Call,"(42.352, -71.1669)"
549598,101001355147,04/13/2015 02:21:00 PM,06/05/2015 02:21:00 PM,05/15/2015 01:52:32 PM,ONTIME,Closed,Case Closed. Closed date : 2015-05-15 13:52:32.1 Case Resolved cart requested new cart#0514302316 04/28/2015,Request for Recycling Cart,Public Works Department,Recycling,Request for Recycling Cart,PWDx_Recycling,PWDx,,,33 Havre St  East Boston  MA  02128,1.0,09,1.0,A7,East Boston,1.0,Ward 1,103.0,R3,33 Havre St,2128.0,Address,71477.0,42.3704,-71.0404,Constituent Call,"(42.3704, -71.0404)"
549624,101001355185,04/13/2015 02:49:00 PM,06/05/2015 02:49:00 PM,05/15/2015 11:41:34 AM,ONTIME,Closed,Case Closed. Closed date : 2015-05-15 11:41:34.863 Case Resolved cart requested new cart#0415302484 05/14/2015,Request for Recycling Cart,Public Works Department,Recycling,Request for Recycling Cart,PWDx_Recycling,PWDx,,,58 S Crescent Cirt  Brighton  MA  02135,11.0,04,9.0,D14,Allston / Brighton,15.0,Ward 22,2210.0,R3,58 S Crescent Cirt,2135.0,Address,44297.0,42.3479,-71.167,Self Service,"(42.3479, -71.167)"
549662,101001355231,04/13/2015 03:21:11 PM,05/05/2015 03:21:11 PM,05/08/2015 10:20:30 AM,OVERDUE,Closed,Case Closed. Closed date : 2015-05-08 10:20:30.517 Case Resolved cart requested filled new cart #0514302546 04/30/2015,Request for Recycling Cart,Public Works Department,Recycling,Request for Recycling Cart,PWDx_Recycling,PWDx,,,59-61 Franconia St  Dorchester  MA  02122,8.0,07,3.0,C11,Dorchester,7.0,Ward 16,1609.0,R2,59-61 Franconia St,2122.0,Address,60482.0,42.2855,-71.0526,Constituent Call,"(42.2855, -71.0526)"
549670,101001355243,04/13/2015 03:29:45 PM,05/05/2015 03:29:45 PM,05/06/2015 01:20:34 PM,OVERDUE,Closed,Case Closed. Closed date : 2015-05-06 13:20:34.693 Case Resolved cart request filled new cart # 0415313186 05/04/2015,Request for Recycling Cart,Public Works Department,Recycling,Request for Recycling Cart,PWDx_Recycling,PWDx,,,691 Walk Hill St  Mattapan  MA  02126,8.0,07,5.0,B3,Greater Mattapan,9.0,Ward 18,1803.0,R1,691 Walk Hill St,2126.0,Address,141725.0,42.2779,-71.0949,Constituent Call,"(42.2779, -71.0949)"
549675,101001355249,04/13/2015 03:33:41 PM,05/05/2015 03:33:41 PM,05/01/2015 12:55:05 PM,ONTIME,Closed,Case Closed Case Resolved cart requested filled new cart#0714423919 04/30/2015,Request for Recycling Cart,Public Works Department,Recycling,Request for Recycling Cart,PWDx_Recycling,PWDx,,,22 Hollander St  Dorchester  MA  02121,9.0,10B,7.0,B2,Roxbury,13.0,Ward 12,1202.0,CD,22 Hollander St,2121.0,Address,74615.0,42.3155,-71.0893,Constituent Call,"(42.3155, -71.0893)"
549683,101001355257,04/13/2015 03:42:00 PM,06/05/2015 03:42:00 PM,05/12/2015 12:26:41 PM,ONTIME,Closed,Case Closed. Closed date : 2015-05-12 12:26:41.17 Case Resolved cart requested filled new cart # 0415302435 05/11/2015,Request for Recycling Cart,Public Works Department,Recycling,Request for Recycling Cart,PWDx_Recycling,PWDx,,,9 Carroll St  West Roxbury  MA  02132,12.0,06,6.0,E5,West Roxbury,12.0,Ward 20,2017.0,R1,9 Carroll St,2132.0,Address,26075.0,42.2867,-71.1673,Constituent Call,"(42.2867, -71.1673)"
549703,101001355286,04/13/2015 04:02:42 PM,05/05/2015 04:02:41 PM,05/08/2015 10:54:05 AM,OVERDUE,Closed,Case Closed. Closed date : 2015-05-08 10:54:05.35 Case Resolved cart requested filled new cart #0415302409 05/06/2015,Request for Recycling Cart,Public Works Department,Recycling,Request for Recycling Cart,PWDx_Recycling,PWDx,,,77 Wilmington Ave  Dorchester  MA  02124,8.0,07,3.0,B3,Dorchester,7.0,Ward 17,1712.0,R1,77 Wilmington Ave,2124.0,Address,150457.0,42.2792,-71.0765,Constituent Call,"(42.2792, -71.0765)"
549715,101001355299,04/13/2015 04:14:00 PM,06/05/2015 04:14:00 PM,05/15/2015 02:10:05 PM,ONTIME,Closed,Case Closed. Closed date : 2015-05-15 14:10:05.79 Case Resolved cart requested new cart#0415202668 04/30/2015,Request for Recycling Cart,Public Works Department,Recycling,Request for Recycling Cart,PWDx_Recycling,PWDx,,,901 E Broadway  South Boston  MA  02127,6.0,05,2.0,C6,South Boston / South Boston Waterfront,5.0,Ward 6,609.0,R1,901 E Broadway,2127.0,Address,21311.0,42.3355,-71.028,Constituent Call,"(42.3355, -71.028)"
549716,101001355300,04/13/2015 04:16:25 PM,05/05/2015 04:16:25 PM,05/08/2015 10:21:05 AM,OVERDUE,Closed,Case Closed. Closed date : 2015-05-08 10:21:05.623,Request for Recycling Cart,Public Works Department,Recycling,Request for Recycling Cart,PWDx_Recycling,PWDx,,,68-70 Crockett Ave  Dorchester  MA  02124,8.0,07,3.0,C11,Dorchester,7.0,Ward 16,1612.0,R2,68-70 Crockett Ave,2124.0,Address,44473.0,42.2824,-71.0527,Constituent Call,"(42.2824, -71.0527)"
549748,101001355346,04/13/2015 05:02:14 PM,05/06/2015 08:30:00 AM,05/01/2015 12:51:04 PM,ONTIME,Closed,Case Closed Case Resolved cart requested filled new cart#714423855 04/30/15,Request for Recycling Cart,Public Works Department,Recycling,Request for Recycling Cart,PWDx_Recycling,PWDx,,,74 Day St  Jamaica Plain  MA  02130,9.0,10A,8.0,E13,Jamaica Plain,11.0,Ward 10,1008.0,R3,74 Day St,2130.0,Address,46732.0,42.3241,-71.1085,Constituent Call,"(42.3241, -71.1085)"
549781,101001355396,04/13/2015 06:06:51 PM,05/06/2015 08:30:00 AM,05/08/2015 10:54:32 AM,OVERDUE,Closed,Case Closed. Closed date : 2015-05-08 10:54:32.087 Case Resolved cart requested filled new cart #0415302413 05/06/2015,Request for Recycling Cart,Public Works Department,Recycling,Request for Recycling Cart,PWDx_Recycling,PWDx,,,12 Sutton St  Mattapan  MA  02126,8.0,07,4.0,B3,Greater Mattapan,9.0,Ward 14,1405.0,R3,12 Sutton St,2126.0,Address,133066.0,42.2819,-71.089,Self Service,"(42.2819, -71.089)"
549812,101001355441,04/13/2015 07:22:17 PM,05/06/2015 08:30:00 AM,05/08/2015 10:51:38 AM,OVERDUE,Closed,Case Closed. Closed date : 2015-05-08 10:51:38.27 Case Resolved cart requested filled new cart #0415302963 05/06/2015,Request for Recycling Cart,Public Works Department,Recycling,Request for Recycling Cart,PWDx_Recycling,PWDx,,,17 Gates St  South Boston  MA  02127,6.0,05,2.0,C6,South Boston / South Boston Waterfront,5.0,Ward 7,704.0,CD,17 Gates St,2127.0,Address,63034.0,42.3334,-71.0484,Self Service,"(42.3334, -71.0484)"
549959,101001355667,04/14/2015 09:00:57 AM,05/06/2015 09:00:57 AM,04/28/2015 03:00:57 PM,ONTIME,Closed,Case Closed Duplicate of Existing Case  reference case #101001357249 one cart per household,Request for Recycling Cart,Public Works Department,Recycling,Request for Recycling Cart,PWDx_Recycling,PWDx,,,387 Faneuil St  Brighton  MA  02135,11.0,04,9.0,D14,Allston / Brighton,15.0,Ward 22,2207.0,R1,387 Faneuil St,2135.0,Address,56285.0,42.3518,-71.1665,Constituent Call,"(42.3518, -71.1665)"
549964,101001355672,04/14/2015 09:01:59 AM,05/06/2015 09:01:58 AM,04/23/2015 11:33:39 AM,ONTIME,Closed,Case Closed Case Resolved request filled new cart # 0714423628 04/22/2015,Request for Recycling Cart,Public Works Department,Recycling,Request for Recycling Cart,PWDx_Recycling,PWDx,,,7-9 Franklin St  Charlestown  MA  02129,3.0,1A,1.0,A15,Charlestown,2.0,Ward 2,206.0,R3,7-9 Franklin St,2129.0,Address,60704.0,42.3782,-71.067,Constituent Call,"(42.3782, -71.067)"
550011,101001355742,04/14/2015 09:41:08 AM,05/06/2015 09:41:07 AM,04/23/2015 11:45:14 AM,ONTIME,Closed,Case Closed Case Resolved request filled new cart # 0714423959 04/17/2015,Request for Recycling Cart,Public Works Department,Recycling,Request for Recycling Cart,PWDx_Recycling,PWDx,,,31 Symphony Rd  Boston  MA  02115,4.0,10A,8.0,D4,Boston,14.0,04,407.0,A,31 Symphony Rd,2115.0,Address,317324.0,42.3431,-71.088,Constituent Call,"(42.3431, -71.088)"
550058,101001355810,04/14/2015 10:10:00 AM,06/05/2015 10:10:00 AM,06/04/2015 02:59:57 PM,ONTIME,Closed,Case Closed. Closed date : 2015-06-04 14:59:57.443 Case Resolved Cart requested filled new cart #0415302351 06/03/2015,Request for Recycling Cart,Public Works Department,Recycling,Request for Recycling Cart,PWDx_Recycling,PWDx,,,120 Capen St  Dorchester  MA  02124,8.0,07,3.0,B3,Dorchester,7.0,Ward 17,1712.0,R3,120 Capen St,2124.0,Address,25811.0,42.2804,-71.0783,Constituent Call,"(42.2804, -71.0783)"
550060,101001355808,04/14/2015 10:10:33 AM,05/06/2015 10:10:33 AM,04/28/2015 01:35:27 PM,ONTIME,Closed,Case Closed Case Resolved NEW CART REQUEST FILLED NEW CART#0714423856 04/27/2015,Request for Recycling Cart,Public Works Department,Recycling,Request for Recycling Cart,PWDx_Recycling,PWDx,,,249 Beacon St  Boston  MA  02116,4.0,1C,8.0,D4,Back Bay,14.0,Ward 5,507.0,CM,249 Beacon St,2116.0,Address,10549.0,42.3535,-71.0786,Constituent Call,"(42.3535, -71.0786)"
550079,101001355830,04/14/2015 10:21:00 AM,06/05/2015 10:21:00 AM,06/17/2015 02:31:32 PM,OVERDUE,Closed,Case Closed. Closed date : 2015-06-17 14:31:32.293 Case Resolved cart requested filled new cart #0415302262 06/16/2015,Request for Recycling Cart,Public Works Department,Recycling,Request for Recycling Cart,PWDx_Recycling,PWDx,,,23 Eliot St  Jamaica Plain  MA  02130,9.0,02,6.0,E13,Jamaica Plain,11.0,Ward 19,1908.0,R1,23 Eliot St,2130.0,Address,52717.0,42.3113,-71.1167,Constituent Call,"(42.3113, -71.1167)"
550108,101001355867,04/14/2015 10:36:36 AM,05/06/2015 10:36:35 AM,05/06/2015 01:46:42 PM,OVERDUE,Closed,Case Closed. Closed date : 2015-05-06 13:46:42.14 Case Resolved cart request filled new cart # 0415302995 05/05/2015,Request for Recycling Cart,Public Works Department,Recycling,Request for Recycling Cart,PWDx_Recycling,PWDx,,,49 Pheasant St  West Roxbury  MA  02132,12.0,06,6.0,E5,West Roxbury,12.0,Ward 20,2010.0,R1,49 Pheasant St,2132.0,Address,109950.0,42.2734,-71.1464,Constituent Call,"(42.2734, -71.1464)"
550140,101001355906,04/14/2015 10:55:53 AM,05/06/2015 10:55:52 AM,05/06/2015 01:44:48 PM,OVERDUE,Closed,Case Closed. Closed date : 2015-05-06 13:44:48.353 Case Resolved cart request filled new cart # 0415302442 05/05/2015,Request for Recycling Cart,Public Works Department,Recycling,Request for Recycling Cart,PWDx_Recycling,PWDx,,,846 E Fifth St  South Boston  MA  02127,6.0,05,2.0,C6,South Boston / South Boston Waterfront,5.0,Ward 6,609.0,CM,846 E Fifth St,2127.0,Address,58126.0,42.3343,-71.0264,Constituent Call,"(42.3343, -71.0264)"
550236,101001356034,04/14/2015 12:22:56 PM,05/06/2015 12:22:56 PM,04/28/2015 01:36:17 PM,ONTIME,Closed,Case Closed Case Resolved NEW CART REQUEST FILLED NEW CART#0714423912 04/27/2015,Request for Recycling Cart,Public Works Department,Recycling,Request for Recycling Cart,PWDx_Recycling,PWDx,,,465 Beacon St  Boston  MA  02115,4.0,1C,8.0,D4,Back Bay,14.0,Ward 5,509.0,CM,465 Beacon St,2115.0,Address,11553.0,42.3509,-71.0883,Constituent Call,"(42.3509, -71.0883)"
550238,101001356036,04/14/2015 12:24:00 PM,06/05/2015 12:24:00 PM,05/15/2015 02:13:58 PM,ONTIME,Closed,Case Closed. Closed date : 2015-05-15 14:13:58.03 Case Resolved cart requested new cart#041513016 05/01/2015,Request for Recycling Cart,Public Works Department,Recycling,Request for Recycling Cart,PWDx_Recycling,PWDx,,,23 Portsmouth St  Brighton  MA  02135,11.0,04,9.0,D14,Allston / Brighton,15.0,Ward 22,2205.0,R2,23 Portsmouth St,2135.0,Address,294930.0,42.3599,-71.1445,Self Service,"(42.3599, -71.1445)"
550300,101001356112,04/14/2015 01:16:00 PM,06/05/2015 01:16:00 PM,05/15/2015 11:57:12 AM,ONTIME,Closed,Case Closed. Closed date : 2015-05-15 11:57:12.27 Case Resolved cart requested new cart#0415302970 05/14/2015,Request for Recycling Cart,Public Works Department,Recycling,Request for Recycling Cart,PWDx_Recycling,PWDx,,,88 Victoria Heights Rd  Hyde Park  MA  02136,12.0,08,5.0,E18,Hyde Park,10.0,18,1808.0,CD,88 Victoria Heights Rd,2136.0,Address,140562.0,42.2713,-71.1122,Constituent Call,"(42.2713, -71.1122)"
550313,101001356132,04/14/2015 01:32:00 PM,06/05/2015 01:32:00 PM,06/17/2015 02:47:34 PM,OVERDUE,Closed,Case Closed. Closed date : 2015-06-17 14:47:34.717 Case Resolved cart requested filled new cart #0415313652 06/16/2015,Request for Recycling Cart,Public Works Department,Recycling,Request for Recycling Cart,PWDx_Recycling,PWDx,,,17 Southern Ave  Dorchester  MA  02124,8.0,07,4.0,B3,Dorchester,9.0,Ward 17,1703.0,R2,17 Southern Ave,2124.0,Address,129162.0,42.291,-71.0726,Constituent Call,"(42.291, -71.0726)"
550367,101001356211,04/14/2015 02:11:08 PM,05/06/2015 02:11:07 PM,04/15/2015 02:51:01 PM,ONTIME,Closed,Case Closed Case Resolved CART REQUESTED HAS BEEN DELIVERED 5140026324 04/15/2015,Request for Recycling Cart,Public Works Department,Recycling,Request for Recycling Cart,PWDx_Recycling,PWDx,,,220 Manthorne Rd  West Roxbury  MA  02132,12.0,06,6.0,E5,West Roxbury,12.0,Ward 20,2020.0,R1,220 Manthorne Rd,2132.0,Address,89135.0,42.2943,-71.1559,Constituent Call,"(42.2943, -71.1559)"
550403,101001356269,04/14/2015 03:06:00 PM,06/05/2015 03:06:00 PM,05/15/2015 02:27:55 PM,ONTIME,Closed,Case Closed. Closed date : 2015-05-15 14:27:55.7 Case Resolved cart requested new cart#0415313689 05/04/2015,Request for Recycling Cart,Public Works Department,Recycling,Request for Recycling Cart,PWDx_Recycling,PWDx,,,340 Pond St  Jamaica Plain  MA  02130,9.0,02,6.0,E13,Jamaica Plain,11.0,19,1902.0,,340 Pond St,2130.0,Address,352212.0,42.3594,-71.0587,Constituent Call,"(0, 0)"
550496,101001356403,04/14/2015 05:17:00 PM,06/05/2015 08:30:00 AM,05/15/2015 11:53:13 AM,ONTIME,Closed,Case Closed. Closed date : 2015-05-15 11:53:13.013 Case Resolved cart requested new cart#0415302968 05/15/2015,Request for Recycling Cart,Public Works Department,Recycling,Request for Recycling Cart,PWDx_Recycling,PWDx,,,76-78 Durnell Ave  Roslindale  MA  02131,12.0,06,5.0,E5,Roslindale,10.0,20,2002.0,,76-78 Durnell Ave,2131.0,Address,343321.0,42.2855,-71.1366,Constituent Call,"(42.2855, -71.1366)"
550501,101001356409,04/14/2015 05:27:00 PM,06/05/2015 08:30:00 AM,05/11/2015 08:21:01 AM,ONTIME,Closed,Case Closed. Closed date : 2015-05-11 08:21:01.387 Case Resolved Cart Delivered by contractor,Request for Recycling Cart,Public Works Department,Recycling,Request for Recycling Cart,PWDx_Recycling,PWDx,,,44 Presentation Rd  Brighton  MA  02135,11.0,04,9.0,D14,Allston / Brighton,15.0,Ward 22,2213.0,R2,44 Presentation Rd,2135.0,Address,295318.0,42.3543,-71.1713,Self Service,"(42.3543, -71.1713)"
550666,101001356634,04/15/2015 08:09:00 AM,06/05/2015 08:30:00 AM,06/04/2015 02:58:42 PM,ONTIME,Closed,Case Closed. Closed date : 2015-06-04 14:58:42.44 Case Resolved Cart requested filled new cart #041530945 06/03/2015,Request for Recycling Cart,Public Works Department,Recycling,Request for Recycling Cart,PWDx_Recycling,PWDx,,,76 Clearwater Dr  Mattapan  MA  02126,8.0,07,3.0,B3,Dorchester,7.0,Ward 17,1714.0,R1,76 Clearwater Dr,2126.0,Address,33735.0,42.2743,-71.0777,Constituent Call,"(42.2743, -71.0777)"
550669,101001356637,04/15/2015 08:11:00 AM,06/05/2015 08:30:00 AM,06/11/2015 01:58:12 PM,OVERDUE,Closed,Case Closed. Closed date : 2015-06-11 13:58:12.107 Case Resolved cart requested filled new cart#0415302500 06/10/2015,Request for Recycling Cart,Public Works Department,Recycling,Request for Recycling Cart,PWDx_Recycling,PWDx,,,51 Seaverns Ave  Jamaica Plain  MA  02130,9.0,02,6.0,E13,Jamaica Plain,11.0,19,1906.0,R4,51 Seaverns Ave,2130.0,Address,308148.0,42.3116,-71.1114,Constituent Call,"(42.3116, -71.1114)"
550726,101001356716,04/15/2015 08:55:57 AM,05/07/2015 08:55:57 AM,04/28/2015 10:19:49 AM,ONTIME,Closed,Case Closed Duplicate of Existing Case  Reference#101001356720 one bin per a household,Request for Recycling Cart,Public Works Department,Recycling,Request for Recycling Cart,PWDx_Recycling,PWDx,,,23 Thomas Park  South Boston  MA  02127,6.0,05,2.0,C6,South Boston / South Boston Waterfront,5.0,Ward 7,704.0,R3,23 Thomas Park,2127.0,Address,319215.0,42.3337,-71.0464,Self Service,"(42.3337, -71.0464)"
550730,101001356720,04/15/2015 08:59:00 AM,06/05/2015 08:59:00 AM,06/04/2015 02:56:50 PM,ONTIME,Closed,Case Closed. Closed date : 2015-06-04 14:56:50.68 Case Resolved Cart requested filled new cart #0415302357 06/03/2015,Request for Recycling Cart,Public Works Department,Recycling,Request for Recycling Cart,PWDx_Recycling,PWDx,,,23 Thomas Park  South Boston  MA  02127,6.0,05,2.0,C6,South Boston / South Boston Waterfront,5.0,Ward 7,704.0,R3,23 Thomas Park,2127.0,Address,319216.0,42.3337,-71.0464,Self Service,"(42.3337, -71.0464)"
550780,101001356784,04/15/2015 09:40:38 AM,05/07/2015 09:40:38 AM,05/08/2015 10:52:31 AM,OVERDUE,Closed,Case Closed. Closed date : 2015-05-08 10:52:31.923 Case Resolved cart requested filled new cart #0415302548 05/06/2015,Damaged Cart - New Request,Public Works Department,Recycling,Request for Recycling Cart,PWDx_Recycling,PWDx,,,121 Walter St  Roslindale  MA  02131,9.0,06,5.0,E5,Roslindale,10.0,Ward 20,2004.0,R1,121 Walter St,2131.0,Address,142268.0,42.2921,-71.1303,Employee Generated,"(42.2921, -71.1303)"
550811,101001356830,04/15/2015 09:50:00 AM,06/05/2015 09:50:00 AM,05/11/2015 08:14:23 AM,ONTIME,Closed,Case Closed. Closed date : 2015-05-11 08:14:23.88 Case Resolved Cart picked up by PWD inspector,Damaged Cart - New Request,Public Works Department,Recycling,Request for Recycling Cart,PWDx_Recycling,PWDx,,,184 Faneuil St  Brighton  MA  02135,11.0,04,9.0,D14,Allston / Brighton,15.0,Ward 22,2211.0,R2,184 Faneuil St,2135.0,Address,56172.0,42.3541,-71.1576,Employee Generated,"(42.3541, -71.1576)"
550824,101001356850,04/15/2015 10:05:50 AM,05/07/2015 10:05:49 AM,04/27/2015 01:37:56 PM,ONTIME,Closed,Case Closed Case Resolved RECYCLING CART LIST REQUEST FILLED NEW CART #0415302213 04/25/2015,Request for Recycling Cart,Public Works Department,Recycling,Request for Recycling Cart,PWDx_Recycling,PWDx,,,61 Hill Top St  Dorchester  MA  02124,8.0,07,3.0,C11,Dorchester,7.0,Ward 16,1612.0,R1,61 Hill Top St,2124.0,Address,74005.0,42.2795,-71.0518,Constituent Call,"(42.2795, -71.0518)"
550837,101001356867,04/15/2015 10:10:56 AM,05/07/2015 10:10:56 AM,05/08/2015 10:58:14 AM,OVERDUE,Closed,Case Closed. Closed date : 2015-05-08 10:58:14.51 Case Resolved cart requested filled new cart #0415302961 05/06/2015,Request for Recycling Cart,Public Works Department,Recycling,Request for Recycling Cart,PWDx_Recycling,PWDx,,,119 Webster St  East Boston  MA  02128,1.0,09,1.0,A7,East Boston,1.0,Ward 1,103.0,R3,119 Webster St,2128.0,Address,146745.0,42.3663,-71.0365,Constituent Call,"(42.3663, -71.0365)"
550842,101001356872,04/15/2015 10:12:21 AM,05/07/2015 10:12:20 AM,05/08/2015 10:58:37 AM,OVERDUE,Closed,Case Closed. Closed date : 2015-05-08 10:58:37.647 Case Resolved cart requested filled new cart #0415302554 05/06/2015,Request for Recycling Cart,Public Works Department,Recycling,Request for Recycling Cart,PWDx_Recycling,PWDx,,,125 Webster St  East Boston  MA  02128,1.0,09,1.0,A7,East Boston,1.0,Ward 1,101.0,R3,125 Webster St,2128.0,Address,146753.0,42.3662,-71.0362,Constituent Call,"(42.3662, -71.0362)"
550867,101001356905,04/15/2015 10:33:24 AM,05/07/2015 10:33:24 AM,05/08/2015 10:37:35 AM,OVERDUE,Closed,Case Closed. Closed date : 2015-05-08 10:37:35.387 Case Resolved cart requested filled new cart #0514000594 05/01/2015,Request for Recycling Cart,Public Works Department,Recycling,Request for Recycling Cart,PWDx_Recycling,PWDx,,,23 Midland St  Dorchester  MA  02125,7.0,03,3.0,C11,Dorchester,7.0,Ward 13,1310.0,R3,23 Midland St,2125.0,Address,95270.0,42.3112,-71.0549,Constituent Call,"(42.3112, -71.0549)"
550899,101001356942,04/15/2015 11:01:03 AM,05/07/2015 11:01:03 AM,04/28/2015 10:28:01 AM,ONTIME,Closed,Case Closed Duplicate of Existing Case  Reference#101001362655,Request for Recycling Cart,Public Works Department,Recycling,Request for Recycling Cart,PWDx_Recycling,PWDx,,,30 Montcalm Ave  Brighton  MA  02135,11.0,04,9.0,D14,Allston / Brighton,15.0,Ward 22,2206.0,R3,30 Montcalm Ave,2135.0,Address,276597.0,42.3527,-71.1471,Constituent Call,"(42.3527, -71.1471)"
550905,101001356953,04/15/2015 11:07:00 AM,06/05/2015 11:07:00 AM,05/15/2015 02:18:12 PM,ONTIME,Closed,Case Closed. Closed date : 2015-05-15 14:18:12.183 Case Resolved cart requested new cart#0415302584 05/01/2015,Request for Recycling Cart,Public Works Department,Recycling,Request for Recycling Cart,PWDx_Recycling,PWDx,,,51 Dow Rd  West Roxbury  MA  02132,12.0,06,6.0,E5,West Roxbury,12.0,Ward 20,2005.0,R1,51 Dow Rd,2132.0,Address,49260.0,42.2824,-71.1684,Constituent Call,"(42.2824, -71.1684)"
550929,101001356979,04/15/2015 11:33:00 AM,06/05/2015 11:33:00 AM,06/11/2015 02:19:30 PM,OVERDUE,Closed,Case Closed. Closed date : 2015-06-11 14:19:30.06 Case Resolved cart requested filled new cart#0415302365 06/09/2015,Request for Recycling Cart,Public Works Department,Recycling,Request for Recycling Cart,PWDx_Recycling,PWDx,,,37 Aspinwall Rd  Dorchester  MA  02124,8.0,07,4.0,B3,Dorchester,9.0,Ward 17,1703.0,R3,37 Aspinwall Rd,2124.0,Address,5591.0,42.2916,-71.074,Constituent Call,"(42.2916, -71.074)"
551006,101001357066,04/15/2015 12:57:11 PM,05/07/2015 12:57:11 PM,06/12/2015 11:00:28 AM,OVERDUE,Closed,Case Closed. Closed date : 2015-06-12 11:00:28.993 Case Resolved cart requested filled new cart # 0415302321 06/11/2015,Request for Recycling Cart,Public Works Department,Recycling,Request for Recycling Cart,PWDx_Recycling,PWDx,,,78 Carruth St  Dorchester  MA  02124,8.0,07,3.0,C11,Dorchester,7.0,Ward 16,1611.0,R2,78 Carruth St,2124.0,Address,26131.0,42.2822,-71.0599,Constituent Call,"(42.2822, -71.0599)"
551021,101001357087,04/15/2015 01:15:30 PM,05/07/2015 01:15:30 PM,05/01/2015 01:04:49 PM,ONTIME,Closed,Case Closed Case Resolved cart requested filled new cart#0714423706 04/30/2015,Request for Recycling Cart,Public Works Department,Recycling,Request for Recycling Cart,PWDx_Recycling,PWDx,,,122-126 Cedar St  Roxbury  MA  02119,9.0,10B,7.0,B2,Roxbury,13.0,Ward 11,1101.0,R2,122-126 Cedar St,2119.0,Address,26771.0,42.327,-71.0941,Constituent Call,"(42.327, -71.0941)"
551067,101001357141,04/15/2015 01:53:38 PM,05/07/2015 01:53:37 PM,05/08/2015 10:55:56 AM,OVERDUE,Closed,Case Closed. Closed date : 2015-05-08 10:55:56.06 Case Resolved cart requested filled new cart #0415302557 05/06/2015,Request for Recycling Cart,Public Works Department,Recycling,Request for Recycling Cart,PWDx_Recycling,PWDx,,,1485 River St  Hyde Park  MA  02136,12.0,08,5.0,E18,Hyde Park,10.0,Ward 18,1819.0,R1,1485 River St,2136.0,Address,116454.0,42.2513,-71.1312,Constituent Call,"(42.2513, -71.1312)"
551073,101001357152,04/15/2015 01:56:00 PM,06/05/2015 01:56:00 PM,05/15/2015 11:57:46 AM,ONTIME,Closed,Case Closed. Closed date : 2015-05-15 11:57:46.427 Case Resolved cart requested new cart#0415302972 05/14/2015,Request for Recycling Cart,Public Works Department,Recycling,Request for Recycling Cart,PWDx_Recycling,PWDx,,,1058 Hyde Park Ave  Hyde Park  MA  02136,12.0,08,5.0,E18,Hyde Park,10.0,Ward 18,1814.0,R2,1058 Hyde Park Ave,2136.0,Address,77020.0,42.2631,-71.1212,Constituent Call,"(42.2631, -71.1212)"
551112,101001357204,04/15/2015 02:44:00 PM,06/05/2015 02:44:00 PM,05/15/2015 02:15:53 PM,ONTIME,Closed,Case Closed. Closed date : 2015-05-15 14:15:53.753 Case Resolved cart requested new cart#0415302497 05/01/2015,Request for Recycling Cart,Public Works Department,Recycling,Request for Recycling Cart,PWDx_Recycling,PWDx,,,214-216 Dorchester St  South Boston  MA  02127,6.0,05,2.0,C6,South Boston / South Boston Waterfront,5.0,Ward 7,705.0,C,214-216 Dorchester St,2127.0,Address,48939.0,42.3331,-71.0504,Constituent Call,"(42.3331, -71.0504)"
551134,101001357249,04/15/2015 03:07:00 PM,06/05/2015 03:07:00 PM,05/15/2015 02:32:29 PM,ONTIME,Closed,Case Closed. Closed date : 2015-05-15 14:32:29.743 Case Resolved cart requested new cart#0415302314 05/04/2015,Request for Recycling Cart,Public Works Department,Recycling,Request for Recycling Cart,PWDx_Recycling,PWDx,,,387 Faneuil St  Brighton  MA  02135,11.0,04,9.0,D14,Allston / Brighton,15.0,Ward 22,2207.0,R1,387 Faneuil St,2135.0,Address,56285.0,42.3518,-71.1665,Constituent Call,"(42.3518, -71.1665)"
551141,101001357258,04/15/2015 03:15:00 PM,06/05/2015 03:15:00 PM,05/29/2015 02:54:41 PM,ONTIME,Closed,Case Closed. Closed date : 2015-05-29 14:54:41.61 Case Resolved cart requested filled new cart#0415302274 05/28/2015,Request for Recycling Cart,Public Works Department,Recycling,Request for Recycling Cart,PWDx_Recycling,PWDx,,,9 Noble Ct  East Boston  MA  02128,1.0,09,1.0,A7,East Boston,1.0,Ward 1,101.0,R2,9 Noble Ct,2128.0,Address,102953.0,42.3663,-71.0348,Constituent Call,"(42.3663, -71.0348)"
551154,101001357278,04/15/2015 03:30:00 PM,06/05/2015 03:30:00 PM,06/04/2015 03:01:36 PM,ONTIME,Closed,Case Closed. Closed date : 2015-06-04 15:01:36.167 Case Resolved Cart requested filled new cart #0415302953 06/03/2015,Request for Recycling Cart,Public Works Department,Recycling,Request for Recycling Cart,PWDx_Recycling,PWDx,,,497 Sumner St  East Boston  MA  02128,1.0,09,1.0,A7,East Boston,1.0,Ward 1,101.0,R3,497 Sumner St,2128.0,Address,316350.0,42.3645,-71.0301,Self Service,"(42.3645, -71.0301)"
551182,101001357310,04/15/2015 03:57:35 PM,05/07/2015 03:57:34 PM,05/08/2015 10:38:01 AM,OVERDUE,Closed,Case Closed. Closed date : 2015-05-08 10:38:01.89 Case Resolved cart requested filled new cart #0514302542 05/01/2015,Request for Recycling Cart,Public Works Department,Recycling,Request for Recycling Cart,PWDx_Recycling,PWDx,,,1 Carson St  Dorchester  MA  02125,7.0,03,3.0,C11,Dorchester,7.0,Ward 13,1307.0,R3,1 Carson St,2125.0,Address,26137.0,42.3192,-71.0542,Constituent Call,"(42.3192, -71.0542)"
551224,101001357359,04/15/2015 04:52:00 PM,06/08/2015 04:52:00 PM,05/08/2015 10:47:35 AM,ONTIME,Closed,Case Closed. Closed date : 2015-05-08 10:47:35.87 Case Resolved cart requested filled new cart #0415302956 05/06/2015,Request for Recycling Cart,Public Works Department,Recycling,Request for Recycling Cart,PWDx_Recycling,PWDx,,,65 Monadnock St  Dorchester  MA  02125,7.0,03,7.0,B2,Dorchester,13.0,Ward 13,1305.0,R1,65 Monadnock St,2125.0,Address,96325.0,42.3149,-71.0697,Constituent Call,"(42.3149, -71.0697)"
551252,101001357403,04/15/2015 06:05:00 PM,06/05/2015 08:30:00 AM,06/04/2015 02:59:29 PM,ONTIME,Closed,Case Closed. Closed date : 2015-06-04 14:59:29.127 Case Resolved Cart requested filled new cart #0415302353 06/03/2015,Request for Recycling Cart,Public Works Department,Recycling,Request for Recycling Cart,PWDx_Recycling,PWDx,,,135 Milton Ave  Dorchester  MA  02124,8.0,07,3.0,B3,Dorchester,7.0,Ward 17,1712.0,R1,135 Milton Ave,2124.0,Address,275706.0,42.2806,-71.0758,Constituent Call,"(42.2806, -71.0758)"
551353,101001357542,04/16/2015 06:29:56 AM,05/08/2015 08:30:00 AM,05/01/2015 01:05:35 PM,ONTIME,Closed,Case Closed Case Resolved cart requested filled new cart#0714423705 04/30/2015,Request for Recycling Cart,Public Works Department,Recycling,Request for Recycling Cart,PWDx_Recycling,PWDx,,,17 Dorr St  Roxbury  MA  02119,7.0,10B,7.0,B2,Roxbury,13.0,Ward 11,1102.0,R3,17 Dorr St,2119.0,Address,49149.0,42.3272,-71.0919,Constituent Call,"(42.3272, -71.0919)"
551378,101001357578,04/16/2015 08:04:05 AM,05/08/2015 08:30:00 AM,05/06/2015 01:41:01 PM,ONTIME,Closed,Case Closed. Closed date : 2015-05-06 13:41:01.183 Case Resolved cart request filled new cart # 0415302633 05/05/2015,Request for Recycling Cart,Public Works Department,Recycling,Request for Recycling Cart,PWDx_Recycling,PWDx,,,1749 Commonwealth Ave  Brighton  MA  02135,11.0,04,9.0,D14,Allston / Brighton,15.0,Ward 21,2113.0,R2,1749 Commonwealth Ave,2135.0,Address,38597.0,42.3417,-71.1498,Constituent Call,"(42.3417, -71.1498)"
551396,101001357607,04/16/2015 08:22:00 AM,06/05/2015 08:30:00 AM,05/15/2015 11:37:48 AM,ONTIME,Closed,Case Closed. Closed date : 2015-05-15 11:37:48.01 Case Resolved cart requested new cart#0415302340 05/14/2015,Request for Recycling Cart,Public Works Department,Recycling,Request for Recycling Cart,PWDx_Recycling,PWDx,,,5 Hillside Ave  Jamaica Plain  MA  02130,12.0,02,6.0,E13,Jamaica Plain,10.0,Ward 19,1907.0,R1,5 Hillside Ave,2130.0,Address,74144.0,42.2974,-71.1131,Constituent Call,"(42.2974, -71.1131)"
551426,101001357682,04/16/2015 08:44:00 AM,06/05/2015 08:44:00 AM,05/15/2015 02:35:54 PM,ONTIME,Closed,Case Closed. Closed date : 2015-05-15 14:35:54.34 Case Resolved cart requested new cart#0514313017 05/04/2015,Request for Recycling Cart,Public Works Department,Recycling,Request for Recycling Cart,PWDx_Recycling,PWDx,,,131 Eutaw St  East Boston  MA  02128,1.0,09,1.0,A7,East Boston,1.0,Ward 1,108.0,R3,131 Eutaw St,2128.0,Address,54682.0,42.3802,-71.0345,Self Service,"(42.3802, -71.0345)"
551453,101001357718,04/16/2015 09:07:16 AM,05/08/2015 09:07:16 AM,05/01/2015 12:51:40 PM,ONTIME,Closed,Case Closed Case Resolved cart requested filled new cart#0714423916 04/30/2015,Request for Recycling Cart,Public Works Department,Recycling,Request for Recycling Cart,PWDx_Recycling,PWDx,,,6 Kenney St  Jamaica Plain  MA  02130,9.0,10A,8.0,E13,Jamaica Plain,11.0,Ward 10,1008.0,CM,6 Kenney St,2130.0,Address,81197.0,42.3243,-71.1092,Self Service,"(42.3243, -71.1092)"
551506,101001357784,04/16/2015 09:43:00 AM,06/05/2015 09:43:00 AM,05/15/2015 02:34:25 PM,ONTIME,Closed,Case Closed. Closed date : 2015-05-15 14:34:25.02 Case Resolved cart requested new cart#0415302672 05/04/2015,Request for Recycling Cart,Public Works Department,Recycling,Request for Recycling Cart,PWDx_Recycling,PWDx,,,100 Vermont St  West Roxbury  MA  02132,12.0,06,6.0,E5,West Roxbury,12.0,Ward 20,2012.0,R1,100 Vermont St,2132.0,Address,139975.0,42.2884,-71.1636,Constituent Call,"(42.2884, -71.1636)"
551573,101001357871,04/16/2015 10:29:00 AM,06/05/2015 10:29:00 AM,05/15/2015 11:40:08 AM,ONTIME,Closed,Case Closed. Closed date : 2015-05-15 11:40:08.28 Case Resolved cart requested new cart#04152485 05/14/2015,Request for Recycling Cart,Public Works Department,Recycling,Request for Recycling Cart,PWDx_Recycling,PWDx,,,24 Eastman St  Dorchester  MA  02125,7.0,03,7.0,B2,Dorchester,13.0,Ward 7,710.0,R2,24 Eastman St,2125.0,Address,50934.0,42.3197,-71.0645,Self Service,"(42.3197, -71.0645)"
551629,101001357964,04/16/2015 11:18:20 AM,05/08/2015 11:18:20 AM,04/28/2015 08:30:22 AM,ONTIME,Closed,Case Closed Case Noted This program offers only carts for recycling - at this time the City does not  provide trash barrels or trash carts,Request for Recycling Cart,Public Works Department,Recycling,Request for Recycling Cart,PWDx_Recycling,PWDx,,,100 City Hall Plz  Boston  MA  02108,3.0,1B,1.0,A1,Downtown / Financial District,3.0,Ward 3,306.0,C,100 City Hall Plz,2108.0,Address,207940.0,42.3595,-71.0588,Self Service,"(42.3595, -71.0588)"
551648,101001357994,04/16/2015 11:35:57 AM,05/08/2015 11:35:57 AM,05/08/2015 10:48:11 AM,ONTIME,Closed,Case Closed. Closed date : 2015-05-08 10:48:11.81 Case Resolved cart requested filled new cart #0415302414 05/06/2015,Request for Recycling Cart,Public Works Department,Recycling,Request for Recycling Cart,PWDx_Recycling,PWDx,,,19 Dacia St  Dorchester  MA  02125,7.0,03,7.0,B2,Roxbury,13.0,Ward 13,1301.0,R3,19 Dacia St,2125.0,Address,221659.0,42.3147,-71.0773,Constituent Call,"(42.3147, -71.0773)"
551720,101001358088,04/16/2015 12:47:14 PM,05/08/2015 12:47:14 PM,05/01/2015 01:06:05 PM,ONTIME,Closed,Case Closed Case Resolved cart requested filled new cart# 0714423903 04/30/2015,Request for Recycling Cart,Public Works Department,Recycling,Request for Recycling Cart,PWDx_Recycling,PWDx,,,16 Marcella St  Roxbury  MA  02119,9.0,10B,7.0,B2,Roxbury,13.0,Ward 11,1102.0,R2,16 Marcella St,2119.0,Address,89549.0,42.3212,-71.0941,Constituent Call,"(42.3212, -71.0941)"
551737,101001358113,04/16/2015 01:04:00 PM,06/05/2015 01:04:00 PM,06/04/2015 02:57:22 PM,ONTIME,Closed,Case Closed. Closed date : 2015-06-04 14:57:22.17 Case Resolved Cart requested filled new cart #0415302946 06/03/2015,Request for Recycling Cart,Public Works Department,Recycling,Request for Recycling Cart,PWDx_Recycling,PWDx,,,399-401 E Fifth St  South Boston  MA  02127,6.0,05,2.0,C6,South Boston / South Boston Waterfront,5.0,Ward 7,703.0,R2,399-401 E Fifth St,2127.0,Address,57775.0,42.3337,-71.0435,Self Service,"(42.3337, -71.0435)"
551790,101001358194,04/16/2015 02:11:00 PM,06/05/2015 02:11:00 PM,05/15/2015 02:18:35 PM,ONTIME,Closed,Case Closed. Closed date : 2015-05-15 14:18:35.33 Case Resolved cart requested new cart#0415302587 05/01/2015,Request for Recycling Cart,Public Works Department,Recycling,Request for Recycling Cart,PWDx_Recycling,PWDx,,,36 Fairlane Rd  West Roxbury  MA  02132,12.0,06,6.0,E5,West Roxbury,12.0,Ward 20,2015.0,R1,36 Fairlane Rd,2132.0,Address,55656.0,42.2664,-71.1649,Constituent Call,"(42.2664, -71.1649)"
551798,101001358203,04/16/2015 02:19:00 PM,06/05/2015 02:19:00 PM,05/15/2015 11:58:19 AM,ONTIME,Closed,Case Closed. Closed date : 2015-05-15 11:58:19.76 Case Resolved cart requested new cart#0415302347 05/14/2015,Request for Recycling Cart,Public Works Department,Recycling,Request for Recycling Cart,PWDx_Recycling,PWDx,,,81 West St  Hyde Park  MA  02136,12.0,08,5.0,E18,Hyde Park,10.0,Ward 18,1814.0,R1,81 West St,2136.0,Address,148002.0,42.26,-71.1192,Self Service,"(42.26, -71.1192)"
551809,101001358220,04/16/2015 02:41:49 PM,05/08/2015 02:41:48 PM,05/04/2015 09:15:55 AM,ONTIME,Closed,Case Closed. Closed date : 2015-05-04 09:15:55.56 Duplicate of Existing Case 05	743 E Broadway ::::	1		Tuesday		101001358226,Request for Recycling Cart,Public Works Department,Recycling,Request for Recycling Cart,PWDx_Recycling,PWDx,,,743 E Broadway  South Boston  MA  02127,6.0,05,2.0,C6,South Boston / South Boston Waterfront,5.0,Ward 6,605.0,RC,743 E Broadway,2127.0,Address,21153.0,42.3354,-71.0359,Constituent Call,"(42.3354, -71.0359)"
551813,101001358226,04/16/2015 02:45:10 PM,05/08/2015 02:45:09 PM,05/06/2015 01:45:19 PM,ONTIME,Closed,Case Closed. Closed date : 2015-05-06 13:45:19.343 Case Resolved cart request filled new cart # 0415302662 05/05/2015,Request for Recycling Cart,Public Works Department,Recycling,Request for Recycling Cart,PWDx_Recycling,PWDx,,,743 E Broadway  South Boston  MA  02127,6.0,05,2.0,C6,South Boston / South Boston Waterfront,5.0,Ward 6,605.0,RC,743 E Broadway,2127.0,Address,21153.0,42.3354,-71.0359,Constituent Call,"(42.3354, -71.0359)"
551847,101001358285,04/16/2015 03:23:00 PM,06/05/2015 03:23:00 PM,06/04/2015 03:01:05 PM,ONTIME,Closed,Case Closed. Closed date : 2015-06-04 15:01:05.89 Case Resolved Cart requested filled new cart #0415302356 06/03/2015,Request for Recycling Cart,Public Works Department,Recycling,Request for Recycling Cart,PWDx_Recycling,PWDx,,,11 Thompson St  Hyde Park  MA  02136,12.0,08,5.0,E18,Hyde Park,10.0,Ward 18,1819.0,R2,11 Thompson St,2136.0,Address,135713.0,42.2534,-71.1329,Constituent Call,"(42.2534, -71.1329)"
551851,101001358292,04/16/2015 03:26:10 PM,05/08/2015 03:26:10 PM,05/01/2015 12:52:11 PM,ONTIME,Closed,Case Closed Case Resolved cart requested filled new cart# 0714423918 04/30/2015,Request for Recycling Cart,Public Works Department,Recycling,Request for Recycling Cart,PWDx_Recycling,PWDx,,,5 Estrella St  Jamaica Plain  MA  02130,9.0,10A,6.0,E13,Jamaica Plain,11.0,Ward 10,1007.0,R1,5 Estrella St,2130.0,Address,54433.0,42.3226,-71.103,Constituent Call,"(42.3226, -71.103)"
551861,101001358312,04/16/2015 03:36:00 PM,06/05/2015 03:36:00 PM,06/04/2015 03:00:33 PM,ONTIME,Closed,Case Closed. Closed date : 2015-06-04 15:00:33.753 Case Resolved Cart requested filled new cart #0415302355 06/03/2015,Request for Recycling Cart,Public Works Department,Recycling,Request for Recycling Cart,PWDx_Recycling,PWDx,,,5 Fairmount St  Dorchester  MA  02124,8.0,07,3.0,B3,Dorchester,7.0,Ward 17,1704.0,R3,5 Fairmount St,2124.0,Address,55829.0,42.2813,-71.0714,Constituent Call,"(42.2813, -71.0714)"
551863,101001358315,04/16/2015 03:39:00 PM,06/05/2015 03:39:00 PM,05/12/2015 12:23:01 PM,ONTIME,Closed,Case Closed. Closed date : 2015-05-12 12:23:01.513 Case Resolved cart requested filled new cart # 0415302589 05/11/2015,Request for Recycling Cart,Public Works Department,Recycling,Request for Recycling Cart,PWDx_Recycling,PWDx,,,29-31 Warner St  Dorchester  MA  02124,8.0,03,4.0,B3,Greater Mattapan,8.0,Ward 14,1402.0,CM,29-31 Warner St,2124.0,Address,142794.0,42.295,-71.0802,Self Service,"(42.295, -71.0802)"
551908,101001358373,04/16/2015 04:28:00 PM,06/05/2015 04:28:00 PM,06/04/2015 03:02:04 PM,ONTIME,Closed,Case Closed. Closed date : 2015-06-04 15:02:04.073 Case Resolved Cart requested filled new cart #0415302498 06/03/2015,Request for Recycling Cart,Public Works Department,Recycling,Request for Recycling Cart,PWDx_Recycling,PWDx,,,242-244 Maverick St  East Boston  MA  02128,1.0,09,1.0,A7,East Boston,1.0,Ward 1,102.0,R3,242-244 Maverick St,2128.0,Address,93014.0,42.3684,-71.0345,Constituent Call,"(42.3684, -71.0345)"
552039,101001358557,04/17/2015 08:07:00 AM,06/11/2015 08:30:00 AM,08/20/2015 12:36:44 PM,OVERDUE,Closed,Case Closed Case Resolved  already received a cart duplicate case,Request for Recycling Cart,Public Works Department,Recycling,Request for Recycling Cart,PWDx_Recycling,PWDx,,,20 Snowden Way  Dorchester  MA  02124,8.0,07,4.0,B3,Greater Mattapan,9.0,Ward 14,1411.0,RL,20 Snowden Way,2124.0,Address,155007.0,42.2903,-71.0925,Constituent Call,"(42.2903, -71.0925)"
552046,101001358564,04/17/2015 08:11:00 AM,06/11/2015 08:30:00 AM,09/08/2015 02:29:21 PM,OVERDUE,Closed,Case Closed Case Resolved,Request for Recycling Cart,Public Works Department,Recycling,Request for Recycling Cart,PWDx_IPL Damaged Cart Replacement,PWDx,,,105-105A Litchfield St  Brighton  MA  02135,11.0,04,9.0,D14,Brighton,15.0,22,2202.0,,105-105A Litchfield St,2135.0,Address,347392.0,42.3594,-71.0587,Self Service,"(0, 0)"
552087,101001358650,04/17/2015 09:11:31 AM,05/11/2015 09:11:31 AM,04/28/2015 01:32:48 PM,ONTIME,Closed,Case Closed Case Resolved NEW CART REQUEST FILLED NEW CART#0714423859 04/27/2015,Request for Recycling Cart,Public Works Department,Recycling,Request for Recycling Cart,PWDx_Recycling,PWDx,,,73-75 Endicott St  Boston  MA  02113,3.0,1B,1.0,A1,Downtown / Financial District,3.0,Ward 3,304.0,RC,73-75 Endicott St,2113.0,Address,53876.0,42.3639,-71.0571,Constituent Call,"(42.3639, -71.0571)"
552089,101001358652,04/17/2015 09:12:03 AM,05/11/2015 09:12:03 AM,04/28/2015 01:33:27 PM,ONTIME,Closed,Case Closed Case Resolved NEW CART REQUEST FILLED NEW CART#0714423858 04/27/2015,Request for Recycling Cart,Public Works Department,Recycling,Request for Recycling Cart,PWDx_Recycling,PWDx,,,129-129A Endicott St  Boston  MA  02113,3.0,1B,1.0,A1,Downtown / Financial District,3.0,Ward 3,304.0,RC,129-129A Endicott St,2113.0,Address,53801.0,42.3647,-71.0572,Constituent Call,"(42.3647, -71.0572)"
552091,101001358655,04/17/2015 09:12:29 AM,05/11/2015 09:12:29 AM,04/28/2015 01:34:03 PM,ONTIME,Closed,Case Closed Case Resolved NEW CART REQUEST FILLED NEW CART#0714423860 04/27/2015,Request for Recycling Cart,Public Works Department,Recycling,Request for Recycling Cart,PWDx_Recycling,PWDx,,,131 Endicott St  Boston  MA  02113,3.0,1B,1.0,A1,Downtown / Financial District,3.0,Ward 3,304.0,RC,131 Endicott St,2113.0,Address,53802.0,42.3648,-71.0572,Constituent Call,"(42.3648, -71.0572)"
552093,101001358658,04/17/2015 09:13:50 AM,05/11/2015 09:13:50 AM,05/05/2015 07:57:44 AM,ONTIME,Closed,Case Closed. Closed date : 2015-05-05 07:57:44.36 Case Resolved CART REQUESTED FILLED NEW CART #0714424061 05/01/2015,Request for Recycling Cart,Public Works Department,Recycling,Request for Recycling Cart,PWDx_Recycling,PWDx,,,70-72 Commercial St  Boston  MA  02109,3.0,1B,1.0,A1,Downtown / Financial District,3.0,Ward 3,301.0,R4,70-72 Commercial St,2109.0,Address,36815.0,42.3614,-71.0534,Constituent Call,"(42.3614, -71.0534)"
552110,101001358678,04/17/2015 09:23:16 AM,05/11/2015 09:23:15 AM,04/28/2015 01:29:36 PM,ONTIME,Closed,Case Closed Case Resolved NEW CART REQUEST FILLED NEW CART#0714423889 04/27/2015,Request for Recycling Cart,Public Works Department,Recycling,Request for Recycling Cart,PWDx_Recycling,PWDx,,,4 Savin St  Roxbury  MA  02119,9.0,10B,7.0,B2,Roxbury,13.0,Ward 12,1206.0,R2,4 Savin St,2119.0,Address,123107.0,42.3175,-71.0817,Constituent Call,"(42.3175, -71.0817)"
552284,101001358898,04/17/2015 12:03:00 PM,06/11/2015 12:03:00 PM,08/31/2015 02:44:45 PM,OVERDUE,Closed,Case Closed. Closed date : 2015-08-31 14:44:45.927 Case Resolved cart requested filled new cart #715671749 08/28/2015,Request for Recycling Cart,Public Works Department,Recycling,Request for Recycling Cart,PWDx_Recycling,PWDx,,,17 Lafield St  Dorchester  MA  02122,7.0,07,3.0,C11,Dorchester,7.0,16,1604.0,RL,17 Lafield St,2122.0,Address,82967.0,42.2946,-71.0597,Constituent Call,"(42.2946, -71.0597)"
552292,101001358908,04/17/2015 12:14:00 PM,05/29/2015 12:14:00 PM,08/28/2015 12:40:45 PM,OVERDUE,Closed,Case Closed. Closed date : 2015-08-28 12:40:45.777 Case Resolved cart requested filled new cart #0715671506 08/26/2015,Request for Recycling Cart,Public Works Department,Recycling,Request for Recycling Cart,PWDx_Recycling,PWDx,,,71 Church St  Dorchester  MA  02122,,,0.0,,Dorchester,0.0,15,,,71 Church St,2122.0,Address,349137.0,42.3594,-71.0587,Constituent Call,"(0, 0)"
552297,101001358916,04/17/2015 12:20:00 PM,06/11/2015 12:20:00 PM,06/12/2015 11:11:22 AM,OVERDUE,Closed,Case Closed. Closed date : 2015-06-12 11:11:22.323 Case Resolved cart requested filled new cart # 0415313646 06/11/2015,Request for Recycling Cart,Public Works Department,Recycling,Request for Recycling Cart,PWDx_Recycling,PWDx,,,378 Neponset Ave  Dorchester  MA  02122,8.0,07,3.0,C11,Dorchester,7.0,Ward 16,1610.0,R3,378 Neponset Ave,2122.0,Address,281482.0,42.287,-71.0448,Constituent Call,"(42.287, -71.0448)"
552298,101001358918,04/17/2015 12:22:00 PM,05/11/2015 12:22:31 PM,06/19/2015 09:37:37 AM,OVERDUE,Closed,Case Closed. Closed date : 2015-06-19 09:37:37.99 Case Resolved cart delivered on 6/12/2015,Request for Recycling Cart,Public Works Department,Recycling,Request for Recycling Cart,PWDx_Recycling,PWDx,,,476 Metropolitan Ave  Hyde Park  MA  02136,12.0,08,5.0,E18,Hyde Park,10.0,Ward 18,1808.0,R2,476 Metropolitan Ave,2136.0,Address,94913.0,42.2699,-71.12,Self Service,"(42.2699, -71.12)"
552305,101001358930,04/17/2015 12:32:00 PM,06/11/2015 12:32:00 PM,05/29/2015 02:47:22 PM,ONTIME,Closed,Case Closed. Closed date : 2015-05-29 14:47:22.207 Case Resolved cart requested filled new cart#0415305685 05/28/2015,Request for Recycling Cart,Public Works Department,Recycling,Request for Recycling Cart,PWDx_Recycling,PWDx,,,64 Business St  Hyde Park  MA  02136,12.0,08,5.0,E18,Hyde Park,10.0,Ward 18,1819.0,CD,64 Business St,2136.0,Address,24255.0,42.2528,-71.1275,Constituent Call,"(42.2528, -71.1275)"
552356,101001359014,04/17/2015 01:37:00 PM,06/12/2015 01:37:00 PM,06/03/2015 01:05:24 PM,ONTIME,Closed,Case Closed. Closed date : 2015-06-03 13:05:24.257 Case Resolved cart requested filled new cart #0415302612 05/28/2015,Request for Recycling Cart,Public Works Department,Recycling,Request for Recycling Cart,PWDx_Recycling,PWDx,,,317 Fuller St  Dorchester  MA  02124,8.0,07,4.0,B3,Dorchester,9.0,Ward 17,1710.0,R2,317 Fuller St,2124.0,Address,238696.0,42.2802,-71.0803,Constituent Call,"(42.2802, -71.0803)"
552400,101001359083,04/17/2015 02:19:00 PM,06/08/2015 02:19:00 PM,05/15/2015 02:16:20 PM,ONTIME,Closed,Case Closed. Closed date : 2015-05-15 14:16:20.38 Case Resolved cart requested new cart#0415313023 05/01/2015,Request for Recycling Cart,Public Works Department,Recycling,Request for Recycling Cart,PWDx_Recycling,PWDx,,,278 W Fifth St  South Boston  MA  02127,6.0,05,2.0,C6,South Boston / South Boston Waterfront,5.0,Ward 7,704.0,R1,278 W Fifth St,2127.0,Address,58283.0,42.3351,-71.0485,Constituent Call,"(42.3351, -71.0485)"
552436,101001359134,04/17/2015 03:09:41 PM,05/11/2015 03:09:41 PM,05/08/2015 10:38:26 AM,ONTIME,Closed,Case Closed. Closed date : 2015-05-08 10:38:26.507 Case Resolved cart requested filled new cart #0514302222 05/01/2015,Request for Recycling Cart,Public Works Department,Recycling,Request for Recycling Cart,PWDx_Recycling,PWDx,,,161 Sydney St  Dorchester  MA  02125,7.0,03,3.0,C11,Dorchester,7.0,Ward 13,1310.0,R1,161 Sydney St,2125.0,Address,133264.0,42.3171,-71.0525,Constituent Call,"(42.3171, -71.0525)"
552444,101001359147,04/17/2015 03:24:00 PM,06/11/2015 03:24:00 PM,05/15/2015 02:19:11 PM,ONTIME,Closed,Case Closed. Closed date : 2015-05-15 14:19:11.26 Case Resolved cart requested new cart#0415313687 05/1/2015,Request for Recycling Cart,Public Works Department,Recycling,Request for Recycling Cart,PWDx_Recycling,PWDx,,,603 River St  Mattapan  MA  02126,8.0,08,4.0,E18,Greater Mattapan,9.0,Ward 18,1804.0,R1,603 River St,2126.0,Address,116652.0,42.2662,-71.098,Constituent Call,"(42.2662, -71.098)"
552469,101001359196,04/17/2015 03:53:56 PM,05/11/2015 03:53:55 PM,05/06/2015 01:21:09 PM,ONTIME,Closed,Case Closed. Closed date : 2015-05-06 13:21:09.727 Case Resolved cart request filled new cart # 0415302445 05/04/2015,Request for Recycling Cart,Public Works Department,Recycling,Request for Recycling Cart,PWDx_Recycling,PWDx,,,864 Cummins Hwy  Mattapan  MA  02126,8.0,07,5.0,B3,Greater Mattapan,9.0,Ward 18,1821.0,R3,864 Cummins Hwy,2126.0,Address,45022.0,42.2694,-71.0964,Constituent Call,"(42.2694, -71.0964)"
552499,101001359238,04/17/2015 05:06:37 PM,05/12/2015 08:30:00 AM,04/28/2015 01:31:17 PM,ONTIME,Closed,Case Closed Case Resolved NEW CART REQUEST FILLED NEW CART#0714423888 04/27/2015,Request for Recycling Cart,Public Works Department,Recycling,Request for Recycling Cart,PWDx_Recycling,PWDx,,,14 Perrin St  Roxbury  MA  02119,7.0,10B,7.0,B2,Roxbury,13.0,Ward 12,1204.0,R2,14 Perrin St,2119.0,Address,109577.0,42.3227,-71.0777,Self Service,"(42.3227, -71.0777)"
552658,101001359475,04/18/2015 12:02:56 PM,05/12/2015 08:30:00 AM,05/08/2015 10:52:57 AM,ONTIME,Closed,Case Closed. Closed date : 2015-05-08 10:52:57.67 Case Resolved cart requested filled new cart #0415302955 05/06/2015,Request for Recycling Cart,Public Works Department,Recycling,Request for Recycling Cart,PWDx_Recycling,PWDx,,,28 Sheffield Rd  Roslindale  MA  02131,9.0,06,5.0,E5,Roslindale,10.0,Ward 20,2001.0,CD,28 Sheffield Rd,2131.0,Address,126603.0,42.2904,-71.1346,Self Service,"(42.2904, -71.1346)"
552683,101001359514,04/18/2015 01:20:31 PM,05/12/2015 08:30:00 AM,05/08/2015 10:38:53 AM,ONTIME,Closed,Case Closed. Closed date : 2015-05-08 10:38:53.29 Case Resolved cart requested filled new cart #0514302224 05/01/2015,Request for Recycling Cart,Public Works Department,Recycling,Request for Recycling Cart,PWDx_Recycling,PWDx,,,7 Buttonwood Ct  Dorchester  MA  02125,7.0,03,3.0,C11,Dorchester,7.0,Ward 13,1307.0,R1,7 Buttonwood Ct,2125.0,Address,24375.0,42.3208,-71.0552,Constituent Call,"(42.3208, -71.0552)"
552717,101001359563,04/18/2015 03:31:07 PM,05/12/2015 08:30:00 AM,05/05/2015 07:45:28 AM,ONTIME,Closed,Case Closed. Closed date : 2015-05-05 07:45:28.887 Case Resolved CART REQUESTED FILLED NEW CART #0415302602 05/05/2015,Request for Recycling Cart,Public Works Department,Recycling,Request for Recycling Cart,PWDx_Recycling,PWDx,,,25 Josephine St  Dorchester  MA  02122,7.0,03,3.0,C11,Dorchester,8.0,Ward 15,1508.0,R2,25 Josephine St,2122.0,Address,259803.0,42.3005,-71.0643,Self Service,"(42.3005, -71.0643)"
552963,101001359941,04/20/2015 08:33:00 AM,06/12/2015 08:30:00 AM,05/18/2015 02:43:39 PM,ONTIME,Closed,Case Closed. Closed date : 2015-05-18 14:43:39.297 Case Resolved request cart filled new cart # 0415302969,Request for Recycling Cart,Public Works Department,Recycling,Request for Recycling Cart,PWDx_Recycling,PWDx,,,10 Saint Margaret St  Dorchester  MA  02125,6.0,03,2.0,C6,Dorchester,5.0,Ward 7,709.0,R1,10 Saint Margaret St,2125.0,Address,121303.0,42.3224,-71.0603,Constituent Call,"(42.3224, -71.0603)"
552968,101001359947,04/20/2015 08:43:37 AM,05/12/2015 08:30:00 AM,06/03/2015 08:45:29 AM,OVERDUE,Closed,Case Closed. Closed date : 2015-06-03 08:45:29.47 Case Resolved Cart dropped off on 6-3-15 by DPW inspector,Request for Recycling Cart,Public Works Department,Recycling,Request for Recycling Cart,PWDx_Recycling,PWDx,,,14 Emerson St  South Boston  MA  02127,6.0,05,2.0,C6,South Boston / South Boston Waterfront,5.0,Ward 6,605.0,E,14 Emerson St,2127.0,Address,53553.0,42.3367,-71.0435,Self Service,"(42.3367, -71.0435)"
553020,101001360008,04/20/2015 10:59:36 AM,05/12/2015 08:30:00 AM,05/15/2015 02:28:27 PM,OVERDUE,Closed,Case Closed. Closed date : 2015-05-15 14:28:27.987 Case Resolved cart requested new cart#0415313693 05/04/2015,Request for Recycling Cart,Public Works Department,Recycling,Request for Recycling Cart,PWDx_Recycling,PWDx,,,115 Sedgwick St  Jamaica Plain  MA  02130,9.0,02,6.0,E13,Jamaica Plain,11.0,Ward 19,1906.0,R2,115 Sedgwick St,2130.0,Address,124773.0,42.3082,-71.1111,Constituent Call,"(42.3082, -71.1111)"
553024,101001360012,04/20/2015 11:02:27 AM,05/12/2015 08:30:00 AM,05/12/2015 12:23:34 PM,OVERDUE,Closed,Case Closed. Closed date : 2015-05-12 12:23:34.7 Case Resolved cart requested filled new cart # 0415302305 05/11/2015,Request for Recycling Cart,Public Works Department,Recycling,Request for Recycling Cart,PWDx_Recycling,PWDx,,,12 Larchmont St  Dorchester  MA  02124,7.0,03,4.0,C11,Dorchester,9.0,Ward 17,1703.0,R1,12 Larchmont St,2124.0,Address,84057.0,42.297,-71.068,Constituent Call,"(42.297, -71.068)"
553029,101001360018,04/20/2015 11:16:00 AM,05/12/2015 08:30:00 AM,06/08/2015 12:12:43 PM,OVERDUE,Closed,Case Closed. Closed date : 2015-06-08 12:12:43.757 Case Resolved cart requested filled new cart #0415302534 06/04/2015,Request for Recycling Cart,Public Works Department,Recycling,Request for Recycling Cart,PWDx_Recycling,PWDx,,,15 Rock Rd  Mattapan  MA  02126,8.0,08,5.0,E18,Hyde Park,10.0,18,1806.0,,15 Rock Rd,2126.0,Address,343922.0,42.3594,-71.0587,Constituent Call,"(0, 0)"
553055,101001360046,04/20/2015 12:21:13 PM,05/12/2015 08:30:00 AM,04/27/2015 10:59:12 AM,ONTIME,Closed,Case Closed Case Resolved RECYCLING CART LIST REQUEST FILLED NEW CART #0714423637 04/24/2015,Request for Recycling Cart,Public Works Department,Recycling,Request for Recycling Cart,PWDx_Recycling,PWDx,,,154A Fisher Ave  Mission Hill  MA  02120,9.0,10A,6.0,B2,Mission Hill,11.0,Ward 10,1006.0,CD,154A Fisher Ave,2120.0,Address,58543.0,42.3281,-71.1066,Self Service,"(42.3281, -71.1066)"
553091,101001360090,04/20/2015 02:01:06 PM,05/12/2015 08:30:00 AM,04/28/2015 01:30:14 PM,ONTIME,Closed,Case Closed Case Resolved NEW CART REQUEST FILLED NEW CART#0714423887 04/27/2015,Request for Recycling Cart,Public Works Department,Recycling,Request for Recycling Cart,PWDx_Recycling,PWDx,,,192-194 Highland St  Roxbury  MA  02119,9.0,10B,7.0,B2,Roxbury,13.0,Ward 11,1102.0,CD,192-194 Highland St,2119.0,Address,73712.0,42.3231,-71.0934,Constituent Call,"(42.3231, -71.0934)"
553099,101001360100,04/20/2015 02:33:43 PM,05/12/2015 08:30:00 AM,05/15/2015 02:20:53 PM,OVERDUE,Closed,Case Closed. Closed date : 2015-05-15 14:20:53.277 Case Resolved cart requested new cart#0415313685 05/01/2015,Request for Recycling Cart,Public Works Department,Recycling,Request for Recycling Cart,PWDx_Recycling,PWDx,,,18 Weybosset St  Mattapan  MA  02126,8.0,08,5.0,E18,Hyde Park,10.0,Ward 18,1806.0,R1,18 Weybosset St,2126.0,Address,148995.0,42.2709,-71.1071,Constituent Call,"(42.2709, -71.1071)"
553100,101001360101,04/20/2015 02:36:27 PM,05/12/2015 08:30:00 AM,04/29/2015 02:25:18 PM,ONTIME,Closed,Case Closed Case Resolved cart request filled  new cart #0714423698 04/28/2015,Request for Recycling Cart,Public Works Department,Recycling,Request for Recycling Cart,PWDx_Recycling,PWDx,,,70 Chandler St  Boston  MA  02116,4.0,1C,2.0,D4,South End,6.0,Ward 5,501.0,R3,70 Chandler St,2116.0,Address,28794.0,42.3465,-71.072,Constituent Call,"(42.3465, -71.072)"
553165,101001360179,04/20/2015 07:31:15 PM,05/12/2015 08:30:00 AM,05/13/2015 02:13:36 PM,OVERDUE,Closed,Case Closed. Closed date : 2015-05-13 14:13:36.853 Case Resolved cart requested filled new cart # 0415302431 05/12/15,Request for Recycling Cart,Public Works Department,Recycling,Request for Recycling Cart,PWDx_Recycling,PWDx,,,42 Chestnut Sq  Jamaica Plain  MA  02130,9.0,02,6.0,E13,Jamaica Plain,11.0,Ward 19,1904.0,CD,42 Chestnut Sq,2130.0,Address,31283.0,42.3146,-71.1072,Self Service,"(42.3146, -71.1072)"
553297,101001360423,04/21/2015 09:16:38 AM,05/12/2015 09:16:38 AM,04/27/2015 11:02:20 AM,ONTIME,Closed,Case Closed Case Resolved RECYCLING CART LIST REQUEST FILLED NEW CART #0714423636 04/24/2015,Request for Recycling Cart,Public Works Department,Recycling,Request for Recycling Cart,PWDx_Recycling,PWDx,,,1 Torpie St  Mission Hill  MA  02120,9.0,10A,8.0,B2,Mission Hill,14.0,Ward 10,1003.0,R3,1 Torpie St,2120.0,Address,136273.0,42.3331,-71.1027,Constituent Call,"(42.3331, -71.1027)"
553325,101001360458,04/21/2015 09:55:17 AM,05/12/2015 09:55:17 AM,05/25/2015 06:34:47 AM,OVERDUE,Closed,Case Closed. Closed date : 2015-05-25 06:34:47.653 Case Resolved cart # 04152313664 dropped off on 5/21/15,Request for Recycling Cart,Public Works Department,Recycling,Request for Recycling Cart,PWDx_Recycling,PWDx,,,54-56 Granite Ave  Dorchester  MA  02124,8.0,07,3.0,C11,Dorchester,7.0,Ward 16,1612.0,R2,54-56 Granite Ave,2124.0,Address,65908.0,42.2813,-71.0549,Constituent Call,"(42.2813, -71.0549)"
553469,101001360641,04/21/2015 11:38:45 AM,05/12/2015 11:38:45 AM,05/21/2015 02:35:25 PM,OVERDUE,Closed,Case Closed. Closed date : 2015-05-21 14:35:25.133 Case Resolved no cart out 05/21/2015,Request for Recycling Cart,Public Works Department,Recycling,Request for Recycling Cart,PWDx_IPL Damaged Cart Replacement,PWDx,https://cityworker.cityofboston.gov:8443/attachments/report/55366f0470b4469b1b9dca9d/photo/Report.jpg,,50 Moseley St  Dorchester  MA  02125,7.0,03,3.0,C11,Dorchester,7.0,Ward 13,1307.0,R2,50 Moseley St,2125.0,Address,97910.0,42.3207,-71.0547,City Worker App,"(42.3207, -71.0547)"
553521,101001360713,04/21/2015 12:17:27 PM,05/12/2015 12:17:27 PM,05/06/2015 01:22:08 PM,ONTIME,Closed,Case Closed. Closed date : 2015-05-06 13:22:08.203 Case Resolved cart request filled new cart # 0415302636 05/04/2015,Request for Recycling Cart,Public Works Department,Recycling,Request for Recycling Cart,PWDx_Recycling,PWDx,,,6 Snowden Way  Dorchester  MA  02124,8.0,07,4.0,B3,Greater Mattapan,9.0,14,1411.0,RL,6 Snowden Way,2124.0,Address,155019.0,42.2914,-71.0915,Constituent Call,"(42.2914, -71.0915)"
553530,101001360727,04/21/2015 12:24:44 PM,05/12/2015 12:24:44 PM,05/15/2015 02:36:18 PM,OVERDUE,Closed,Case Closed. Closed date : 2015-05-15 14:36:18.18 Case Resolved cart requested new cart#0514302580 05/04/2015,Request for Recycling Cart,Public Works Department,Recycling,Request for Recycling Cart,PWDx_Recycling,PWDx,,,125 Condor St  East Boston  MA  02128,1.0,09,1.0,A7,East Boston,1.0,01,108.0,,125 Condor St,2128.0,Address,344683.0,42.3594,-71.0587,Constituent Call,"(0, 0)"
553532,101001360729,04/21/2015 12:25:17 PM,05/12/2015 12:25:16 PM,05/15/2015 02:36:43 PM,OVERDUE,Closed,Case Closed. Closed date : 2015-05-15 14:36:43.2 Case Resolved cart requested new cart#0514302317 05/04/2015,Request for Recycling Cart,Public Works Department,Recycling,Request for Recycling Cart,PWDx_Recycling,PWDx,,,129 Condor St  East Boston  MA  02128,1.0,09,1.0,A7,East Boston,1.0,01,108.0,,129 Condor St,2128.0,Address,344684.0,42.3594,-71.0587,Constituent Call,"(0, 0)"
553555,101001360760,04/21/2015 01:01:02 PM,05/12/2015 01:01:02 PM,05/05/2015 02:18:52 PM,ONTIME,Closed,Case Closed. Closed date : 2015-05-05 14:18:52.71 Case Resolved broken cart old cart # R(0045938  new cart# 5140017097 05/05/2015,Request for Recycling Cart,Public Works Department,Recycling,Request for Recycling Cart,PWDx_IPL Damaged Cart Replacement,PWDx,https://cityworker.cityofboston.gov:8443/attachments/report/5536824c70b4469b1b9dcabe/photo/Report.jpg,,6 Harleston St  Mission Hill  MA  02120,9.0,10A,8.0,B2,Mission Hill,14.0,Ward 10,1005.0,CD,6 Harleston St,2120.0,Address,69504.0,42.3292,-71.1023,City Worker App,"(42.3292, -71.1023)"
553570,101001360775,04/21/2015 01:09:22 PM,05/12/2015 01:09:21 PM,04/30/2015 10:03:49 AM,ONTIME,Closed,Case Closed Case Resolved cart requested filled new cart #0714423762 04/29/2015,Request for Recycling Cart,Public Works Department,Recycling,Request for Recycling Cart,PWDx_Recycling,PWDx,,,14 Wood St  Charlestown  MA  02129,3.0,1A,1.0,A15,Charlestown,2.0,Ward 2,201.0,CM,14 Wood St,2129.0,Address,151322.0,42.3763,-71.0642,Constituent Call,"(42.3763, -71.0642)"
553583,101001360791,04/21/2015 01:20:06 PM,05/12/2015 01:20:05 PM,05/08/2015 02:58:39 PM,ONTIME,Closed,Case Closed. Closed date : 2015-05-08 14:58:39.557 Case Resolved BROKEN CART SWAPPED NEW CART # 5140017096,Request for Recycling Cart,Public Works Department,Recycling,Request for Recycling Cart,PWDx_IPL Damaged Cart Replacement,PWDx,https://cityworker.cityofboston.gov:8443/attachments/report/553686c470b4469b1b9dcadf/photo/Report.jpg,,28 Fisher Ave  Mission Hill  MA  02120,9.0,10A,8.0,B2,Mission Hill,14.0,Ward 10,1005.0,R4,28 Fisher Ave,2120.0,Address,58577.0,42.3273,-71.1011,City Worker App,"(42.3273, -71.1011)"
553602,101001360812,04/21/2015 01:40:36 PM,05/12/2015 01:40:36 PM,05/26/2015 12:10:18 PM,OVERDUE,Closed,Case Closed. Closed date : 2015-05-26 12:10:18.607 Case Resolved cart # 0415302975 dropped off on 5/22/15,Request for Recycling Cart,Public Works Department,Recycling,Request for Recycling Cart,PWDx_Recycling,PWDx,,,35 Newport St  Dorchester  MA  02125,7.0,03,3.0,C11,Dorchester,7.0,Ward 13,1307.0,R3,35 Newport St,2125.0,Address,282698.0,42.3178,-71.0543,Constituent Call,"(42.3178, -71.0543)"
553609,101001360823,04/21/2015 01:45:09 PM,05/12/2015 01:45:09 PM,05/08/2015 10:29:48 AM,ONTIME,Closed,Case Closed. Closed date : 2015-05-08 10:29:48.997 Case Resolved cart requested filled new cart #0514302543 05/01/2015,Request for Recycling Cart,Public Works Department,Recycling,Request for Recycling Cart,PWDx_Recycling,PWDx,,,24 Dix St  Dorchester  MA  02122,7.0,07,3.0,C11,Dorchester,7.0,Ward 16,1601.0,R2,24 Dix St,2122.0,Address,47865.0,42.2954,-71.0605,Constituent Call,"(42.2954, -71.0605)"
553630,101001360846,04/21/2015 01:57:25 PM,05/12/2015 01:57:24 PM,05/08/2015 10:30:14 AM,ONTIME,Closed,Case Closed. Closed date : 2015-05-08 10:30:14.027 Case Resolved cart requested filled new cart #0514302546 05/01/2015,Request for Recycling Cart,Public Works Department,Recycling,Request for Recycling Cart,PWDx_Recycling,PWDx,,,129 Neponset Ave  Dorchester  MA  02122,8.0,07,3.0,C11,Dorchester,7.0,Ward 16,1605.0,CM,129 Neponset Ave,2122.0,Address,100730.0,42.294,-71.0523,Constituent Call,"(42.294, -71.0523)"
553654,101001360880,04/21/2015 02:33:53 PM,05/12/2015 02:33:52 PM,05/25/2015 06:30:43 AM,OVERDUE,Closed,Case Closed. Closed date : 2015-05-25 06:30:43.837 Case Resolved cart # 0415302235 dropped off on 5/21/15,Request for Recycling Cart,Public Works Department,Recycling,Request for Recycling Cart,PWDx_Recycling,PWDx,,,206 W Eighth St  South Boston  MA  02127,6.0,05,2.0,C6,South Boston / South Boston Waterfront,5.0,Ward 7,705.0,R1,206 W Eighth St,2127.0,Address,52554.0,42.3332,-71.0514,Constituent Call,"(42.3332, -71.0514)"
553668,101001360898,04/21/2015 02:48:05 PM,05/12/2015 02:48:05 PM,05/15/2015 02:37:13 PM,OVERDUE,Closed,Case Closed. Closed date : 2015-05-15 14:37:13.36 Case Resolved cart requested new cart#0514302317 05/04/2015,Request for Recycling Cart,Public Works Department,Recycling,Request for Recycling Cart,PWDx_Recycling,PWDx,,,82 Eutaw St  East Boston  MA  02128,1.0,09,1.0,A7,East Boston,1.0,Ward 1,107.0,R1,82 Eutaw St,2128.0,Address,54738.0,42.3798,-71.0365,Constituent Call,"(42.3798, -71.0365)"
553694,101001360948,04/21/2015 04:05:31 PM,05/12/2015 04:05:31 PM,05/14/2015 01:37:41 PM,OVERDUE,Closed,Case Closed. Closed date : 2015-05-14 13:37:41.687 Case Resolved cart request filled new cart #0415302384 05/13/2015,Request for Recycling Cart,Public Works Department,Recycling,Request for Recycling Cart,PWDx_Recycling,PWDx,,,487 E Sixth St  South Boston  MA  02127,6.0,05,2.0,C6,South Boston / South Boston Waterfront,5.0,Ward 7,702.0,R2,487 E Sixth St,2127.0,Address,311363.0,42.3329,-71.0411,Constituent Call,"(42.3329, -71.0411)"
553704,101001360965,04/21/2015 04:15:10 PM,05/12/2015 04:15:10 PM,05/15/2015 02:29:17 PM,OVERDUE,Closed,Case Closed. Closed date : 2015-05-15 14:29:17.893 Case Resolved cart requested new cart#0415302439 05/04/2015,Request for Recycling Cart,Public Works Department,Recycling,Request for Recycling Cart,PWDx_Recycling,PWDx,,,25 Hall St  Jamaica Plain  MA  02130,9.0,02,6.0,E13,Jamaica Plain,11.0,Ward 11,1110.0,R2,25 Hall St,2130.0,Address,68128.0,42.3047,-71.1136,Constituent Call,"(42.3047, -71.1136)"
553718,101001360983,04/21/2015 04:38:39 PM,05/12/2015 04:38:39 PM,05/06/2015 01:48:43 PM,ONTIME,Closed,Case Closed. Closed date : 2015-05-06 13:48:43.747 Case Resolved cart request filled new cart # 0415302664 05/05/2015,Request for Recycling Cart,Public Works Department,Recycling,Request for Recycling Cart,PWDx_Recycling,PWDx,,,22 Norton St  Hyde Park  MA  02136,12.0,08,5.0,E18,Hyde Park,10.0,Ward 18,1820.0,R2,22 Norton St,2136.0,Address,103916.0,42.2425,-71.1362,Constituent Call,"(42.2425, -71.1362)"
553798,101001361101,04/21/2015 08:14:00 PM,05/13/2015 08:30:00 AM,06/11/2015 12:26:14 PM,OVERDUE,Closed,Case Closed. Closed date : 2015-06-11 12:26:14.773 Case Resolved cart requested filled new cart#0415302418 06/10/2015,Request for Recycling Cart,Public Works Department,Recycling,Request for Recycling Cart,PWDx_Recycling,PWDx,,,624 Cambridge St  Allston  MA  02134,11.0,04,9.0,D14,Allston / Brighton,15.0,Ward 21,2109.0,R1,624 Cambridge St,2134.0,Address,25183.0,42.3513,-71.1432,Self Service,"(42.3513, -71.1432)"
553869,101001361207,04/22/2015 09:25:56 AM,05/13/2015 09:25:56 AM,05/25/2015 06:24:10 AM,OVERDUE,Closed,Case Closed. Closed date : 2015-05-25 06:24:10.897 Case Resolved cart # 0415313596 dropped off on 5/21/15,Request for Recycling Cart,Public Works Department,Recycling,Request for Recycling Cart,PWDx_Recycling,PWDx,,,38 Mount Vernon St  Brighton  MA  02135,11.0,04,9.0,D14,Allston / Brighton,15.0,Ward 22,2209.0,R2,38 Mount Vernon St,2135.0,Address,98479.0,42.3469,-71.1561,Constituent Call,"(42.3469, -71.1561)"
553896,101001361236,04/22/2015 09:42:06 AM,05/13/2015 09:42:06 AM,05/13/2015 02:16:56 PM,OVERDUE,Closed,Case Closed. Closed date : 2015-05-13 14:16:56.48 Case Resolved cart requested filled new cart #0415302306 05/12/15,Request for Recycling Cart,Public Works Department,Recycling,Request for Recycling Cart,PWDx_Recycling,PWDx,,,8 Lakeville Rd  Jamaica Plain  MA  02130,9.0,02,6.0,E13,Jamaica Plain,11.0,Ward 19,1905.0,CD,8 Lakeville Rd,2130.0,Address,83472.0,42.316,-71.1144,Constituent Call,"(42.316, -71.1144)"
553903,101001361245,04/22/2015 09:47:51 AM,05/13/2015 09:47:50 AM,05/25/2015 06:35:17 AM,OVERDUE,Closed,Case Closed. Closed date : 2015-05-25 06:35:17.713 Case Resolved cart # 0415313663 dropped off on 5/21/15,Request for Recycling Cart,Public Works Department,Recycling,Request for Recycling Cart,PWDx_Recycling,PWDx,,,24 Milwood St  Dorchester  MA  02124,8.0,07,3.0,C11,Dorchester,7.0,Ward 16,1611.0,R2,24 Milwood St,2124.0,Address,167731.0,42.2813,-71.0574,Constituent Call,"(42.2813, -71.0574)"
553908,101001361251,04/22/2015 09:51:49 AM,05/13/2015 09:51:49 AM,06/12/2015 11:06:59 AM,OVERDUE,Closed,Case Closed. Closed date : 2015-06-12 11:06:59.253 Case Resolved cart requested filled new cart # 0415302318 06/11/2015,Request for Recycling Cart,Public Works Department,Recycling,Request for Recycling Cart,PWDx_Recycling,PWDx,,,63 Franconia St  Dorchester  MA  02122,8.0,07,3.0,C11,Dorchester,7.0,Ward 16,1609.0,R2,63 Franconia St,2122.0,Address,237895.0,42.2855,-71.0524,Constituent Call,"(42.2855, -71.0524)"
553915,101001361259,04/22/2015 09:58:29 AM,05/13/2015 09:58:29 AM,06/12/2015 11:07:36 AM,OVERDUE,Closed,Case Closed. Closed date : 2015-06-12 11:07:36.55 Case Resolved cart requested filled new cart # 0415213498 06/11/2015,Request for Recycling Cart,Public Works Department,Recycling,Request for Recycling Cart,PWDx_Recycling,PWDx,,,34 Mercier Ave  Dorchester  MA  02124,8.0,07,3.0,C11,Dorchester,7.0,Ward 17,1704.0,R2,34 Mercier Ave,2124.0,Address,274339.0,42.2824,-71.0666,Constituent Call,"(42.2824, -71.0666)"
553923,101001361269,04/22/2015 10:11:18 AM,05/13/2015 10:11:17 AM,06/16/2015 08:29:46 AM,OVERDUE,Closed,Case Closed. Closed date : 2015-06-16 08:29:46.66 Case Resolved recycling cart request filled new cart#0415313635 06/12/2015,Request for Recycling Cart,Public Works Department,Recycling,Request for Recycling Cart,PWDx_Recycling,PWDx,,,5073-5075 Washington St  West Roxbury  MA  02132,12.0,06,6.0,E5,West Roxbury,12.0,Ward 20,2005.0,R2,5073-5075 Washington St,2132.0,Address,145576.0,42.2648,-71.1537,Constituent Call,"(42.2648, -71.1537)"
553940,101001361292,04/22/2015 10:28:02 AM,05/13/2015 10:28:01 AM,05/13/2015 02:17:27 PM,OVERDUE,Closed,Case Closed. Closed date : 2015-05-13 14:17:27.02 Case Resolved cart requested filled new cart #0415302510 05/12/15,Request for Recycling Cart,Public Works Department,Recycling,Request for Recycling Cart,PWDx_Recycling,PWDx,,,40 Alveston St  Jamaica Plain  MA  02130,9.0,02,6.0,E13,Jamaica Plain,11.0,Ward 19,1906.0,R3,40 Alveston St,2130.0,Address,3037.0,42.3097,-71.1126,Constituent Call,"(42.3097, -71.1126)"
553981,101001361352,04/22/2015 12:07:21 PM,05/13/2015 12:07:20 PM,05/14/2015 01:38:14 PM,OVERDUE,Closed,Case Closed. Closed date : 2015-05-14 13:38:14.963 Case Resolved cart request filled new cart #0415302383 05/13/2015,Request for Recycling Cart,Public Works Department,Recycling,Request for Recycling Cart,PWDx_Recycling,PWDx,,,105 H St  South Boston  MA  02127,6.0,05,2.0,C6,South Boston / South Boston Waterfront,5.0,Ward 7,703.0,R3,105 H St,2127.0,Address,67780.0,42.3341,-71.0417,Constituent Call,"(42.3341, -71.0417)"
553998,101001361373,04/22/2015 12:15:56 PM,05/13/2015 12:15:56 PM,04/28/2015 02:16:29 PM,ONTIME,Closed,Case Closed Case Noted Property is a big building  resident needs to get carts through the property manager.,Request for Recycling Cart,Public Works Department,Recycling,Request for Recycling Cart,PWDx_Recycling,PWDx,,,1687 Commonwealth Ave  Brighton  MA  02135,11.0,04,9.0,D14,Allston / Brighton,15.0,Ward 21,2111.0,A,1687 Commonwealth Ave,2135.0,Address,38418.0,42.342,-71.1464,Constituent Call,"(42.342, -71.1464)"
554005,101001361382,04/22/2015 12:21:00 PM,05/13/2015 12:21:36 PM,05/06/2015 01:22:57 PM,ONTIME,Closed,Case Closed. Closed date : 2015-05-06 13:22:57.92 Case Resolved cart request filled new cart # 0415302634 05/04/2015,Request for Recycling Cart,Public Works Department,Recycling,Request for Recycling Cart,PWDx_Recycling,PWDx,,,41 Favre St  Mattapan  MA  02126,8.0,07,5.0,B3,Greater Mattapan,9.0,Ward 18,1821.0,R2,41 Favre St,2126.0,Address,233792.0,42.2717,-71.0992,Constituent Call,"(42.2717, -71.0992)"
554006,101001361383,04/22/2015 12:21:40 PM,05/13/2015 12:21:40 PM,05/15/2015 02:37:38 PM,OVERDUE,Closed,Case Closed. Closed date : 2015-05-15 14:37:38.67 Case Resolved cart requested new cart#0514313020 05/04/2015,Request for Recycling Cart,Public Works Department,Recycling,Request for Recycling Cart,PWDx_Recycling,PWDx,,,44 White St  East Boston  MA  02128,1.0,09,1.0,A7,East Boston,1.0,Ward 1,108.0,R3,44 White St,2128.0,Address,149236.0,42.3807,-71.0381,Constituent Call,"(42.3807, -71.0381)"
554015,101001361393,04/22/2015 12:27:52 PM,05/13/2015 12:27:51 PM,04/30/2015 10:08:55 AM,ONTIME,Closed,Case Closed Case Resolved cart requested filled new cart # 0714423769 04/29/2015,Request for Recycling Cart,Public Works Department,Recycling,Request for Recycling Cart,PWDx_Recycling,PWDx,,,27 Monument Sq  Charlestown  MA  02129,3.0,1A,1.0,A15,Charlestown,2.0,Ward 2,204.0,CD,27 Monument Sq,2129.0,Address,97000.0,42.3773,-71.0609,Constituent Call,"(42.3773, -71.0609)"
554049,101001361442,04/22/2015 01:05:46 PM,05/13/2015 01:05:46 PM,05/25/2015 06:31:35 AM,OVERDUE,Closed,Case Closed. Closed date : 2015-05-25 06:31:35.94 Case Resolved cart # 0415302981 dropped off on 5/21/15,Request for Recycling Cart,Public Works Department,Recycling,Request for Recycling Cart,PWDx_Recycling,PWDx,,,374 Dorchester St  South Boston  MA  02127,6.0,05,2.0,C6,South Boston / South Boston Waterfront,5.0,Ward 7,706.0,E,374 Dorchester St,2127.0,Address,49050.0,42.33,-71.0557,Constituent Call,"(42.33, -71.0557)"
554075,101001361485,04/22/2015 01:20:31 PM,05/13/2015 01:20:31 PM,06/08/2015 10:42:55 AM,OVERDUE,Closed,Case Closed. Closed date : 2015-06-08 10:42:55.2 Case Resolved cart requested filled new cart #0415302413 06/05/2015,Request for Recycling Cart,Public Works Department,Recycling,Request for Recycling Cart,PWDx_Recycling,PWDx,,,15 W Bellflower St  Dorchester  MA  02125,6.0,03,2.0,C6,Dorchester,5.0,Ward 7,708.0,R2,15 W Bellflower St,2125.0,Address,14036.0,42.3251,-71.06,Constituent Call,"(42.3251, -71.06)"
554100,101001361517,04/22/2015 01:35:55 PM,05/13/2015 01:35:54 PM,05/14/2015 01:40:44 PM,OVERDUE,Closed,Case Closed. Closed date : 2015-05-14 13:40:44.643 Case Resolved cart request filled new cart #0415302341 05/13/2015,Request for Recycling Cart,Public Works Department,Recycling,Request for Recycling Cart,PWDx_Recycling,PWDx,,,119-121 Gallivan Blvd  Mattapan  MA  02126,8.0,07,3.0,B3,Dorchester,7.0,Ward 17,1712.0,R2,119-121 Gallivan Blvd,2126.0,Address,62206.0,42.2778,-71.0729,Constituent Call,"(42.2778, -71.0729)"
554122,101001361553,04/22/2015 01:49:00 PM,05/13/2015 01:49:00 PM,04/30/2015 01:45:32 PM,ONTIME,Closed,Case Closed Case Resolved cart requested filled new cart #0415302602 04/28/2015,Request for Recycling Cart,Public Works Department,Recycling,Request for Recycling Cart,PWDx_Recycling,PWDx,,,22 Oldfields Rd  Dorchester  MA  02121,7.0,03,4.0,B2,Roxbury,13.0,Ward 14,1401.0,R2,22 Oldfields Rd,2121.0,Address,105217.0,42.307,-71.0786,Constituent Call,"(42.307, -71.0786)"
554192,101001361653,04/22/2015 02:55:20 PM,05/13/2015 02:55:20 PM,05/26/2015 12:12:56 PM,OVERDUE,Closed,Case Closed. Closed date : 2015-05-26 12:12:56.41 Case Resolved cart # 0415302395 dropped off on 5/22/15,Request for Recycling Cart,Public Works Department,Recycling,Request for Recycling Cart,PWDx_Recycling,PWDx,,,51-53 Harbor View St  Dorchester  MA  02125,7.0,03,3.0,C11,Dorchester,7.0,Ward 13,1308.0,R3,51-53 Harbor View St,2125.0,Address,69363.0,42.3169,-71.0542,Constituent Call,"(42.3169, -71.0542)"
554252,101001361721,04/22/2015 03:40:23 PM,05/13/2015 03:40:23 PM,05/15/2015 02:29:40 PM,OVERDUE,Closed,Case Closed. Closed date : 2015-05-15 14:29:40.28 Case Resolved cart requested new cart#0415313691 05/04/2015,Request for Recycling Cart,Public Works Department,Recycling,Request for Recycling Cart,PWDx_Recycling,PWDx,,,74 Saint Rose St  Jamaica Plain  MA  02130,9.0,02,6.0,E13,Jamaica Plain,11.0,Ward 11,1110.0,R3,74 Saint Rose St,2130.0,Address,121539.0,42.3045,-71.1176,Self Service,"(42.3045, -71.1176)"
554258,101001361728,04/22/2015 03:44:45 PM,05/13/2015 03:44:45 PM,05/14/2015 01:38:46 PM,OVERDUE,Closed,Case Closed. Closed date : 2015-05-14 13:38:46.883 Case Resolved cart request filled new cart #0415302345 05/13/2015,Request for Recycling Cart,Public Works Department,Recycling,Request for Recycling Cart,PWDx_Recycling,PWDx,,,49 Marine Rd  South Boston  MA  02127,6.0,05,2.0,C6,South Boston / South Boston Waterfront,5.0,Ward 7,701.0,R1,49 Marine Rd,2127.0,Address,89919.0,42.3305,-71.0377,Constituent Call,"(42.3305, -71.0377)"
554300,101001361792,04/22/2015 04:18:40 PM,05/13/2015 04:18:39 PM,05/06/2015 01:45:52 PM,ONTIME,Closed,Case Closed. Closed date : 2015-05-06 13:45:52.19 Case Resolved cart request filled new cart # 0415302637 05/05/15,Request for Recycling Cart,Public Works Department,Recycling,Request for Recycling Cart,PWDx_Recycling,PWDx,,,702 E Fifth St  South Boston  MA  02127,6.0,05,2.0,C6,South Boston / South Boston Waterfront,5.0,Ward 6,608.0,R3,702 E Fifth St,2127.0,Address,58002.0,42.3341,-71.0321,Constituent Call,"(42.3341, -71.0321)"
554325,101001361822,04/22/2015 05:06:27 PM,05/14/2015 08:30:00 AM,05/15/2015 02:14:28 PM,OVERDUE,Closed,Case Closed. Closed date : 2015-05-15 14:14:28.543 Case Resolved cart requested new cart#0415302663 05/01/2015,Request for Recycling Cart,Public Works Department,Recycling,Request for Recycling Cart,PWDx_Recycling,PWDx,,,3-5 Duval St  Brighton  MA  02135,11.0,04,9.0,D14,Allston / Brighton,15.0,Ward 22,2205.0,R2,3-5 Duval St,2135.0,Address,50306.0,42.3605,-71.1399,Constituent Call,"(42.3605, -71.1399)"
554328,101001361826,04/22/2015 05:19:10 PM,05/14/2015 08:30:00 AM,05/14/2015 01:41:14 PM,OVERDUE,Closed,Case Closed. Closed date : 2015-05-14 13:41:14.763 Case Resolved cart request filled new cart #0415302379 05/13/2015,Request for Recycling Cart,Public Works Department,Recycling,Request for Recycling Cart,PWDx_Recycling,PWDx,,,37 Hosmer St  Mattapan  MA  02126,8.0,07,4.0,B3,Greater Mattapan,9.0,Ward 14,1414.0,R3,37 Hosmer St,2126.0,Address,75391.0,42.2804,-71.09,Constituent Call,"(42.2804, -71.09)"
554385,101001361913,04/22/2015 09:09:01 PM,05/14/2015 08:30:00 AM,05/25/2015 06:32:19 AM,OVERDUE,Closed,Case Closed. Closed date : 2015-05-25 06:32:19.563 Case Resolved cart # 0415313660 dropped off on 5/21/15,Request for Recycling Cart,Public Works Department,Recycling,Request for Recycling Cart,PWDx_Recycling,PWDx,,,84 Hemman St  Roslindale  MA  02131,12.0,06,5.0,E5,Roslindale,10.0,Ward 18,1810.0,R1,84 Hemman St,2131.0,Address,72788.0,42.2769,-71.1296,Self Service,"(42.2769, -71.1296)"
554393,101001361925,04/22/2015 10:13:01 PM,05/14/2015 08:30:00 AM,06/08/2015 11:15:20 AM,OVERDUE,Closed,Case Closed. Closed date : 2015-06-08 11:15:20.317 Case Resolved cart requested filled new cart #0415302643 06/04/2015,Request for Recycling Cart,Public Works Department,Recycling,Request for Recycling Cart,PWDx_Recycling,PWDx,,,33 Ward St  South Boston  MA  02127,6.0,05,2.0,C6,South Boston / South Boston Waterfront,5.0,Ward 7,706.0,R1,33 Ward St,2127.0,Address,142706.0,42.3295,-71.0547,Self Service,"(42.3295, -71.0547)"
554496,101001362056,04/23/2015 08:38:40 AM,05/14/2015 08:38:40 AM,05/14/2015 01:36:27 PM,OVERDUE,Closed,Case Closed. Closed date : 2015-05-14 13:36:27.723 Case Resolved cart request filled new cart #0415302387 05/13/2015,Request for Recycling Cart,Public Works Department,Recycling,Request for Recycling Cart,PWDx_Recycling,PWDx,,,296 Summit Ave  Brighton  MA  02135,11.0,04,9.0,D14,Allston / Brighton,15.0,Ward 21,2110.0,R3,296 Summit Ave,2135.0,Address,132103.0,42.3443,-71.1389,Constituent Call,"(42.3443, -71.1389)"
554499,101001362059,04/23/2015 08:40:08 AM,05/14/2015 08:40:07 AM,05/06/2015 01:49:09 PM,ONTIME,Closed,Case Closed. Closed date : 2015-05-06 13:49:09.2 Case Resolved cart request filled new cart # 0415302446 05/05/2015,Request for Recycling Cart,Public Works Department,Recycling,Request for Recycling Cart,PWDx_Recycling,PWDx,,,18 Parkson St  Hyde Park  MA  02136,12.0,08,5.0,E18,Hyde Park,10.0,Ward 18,1820.0,R1,18 Parkson St,2136.0,Address,108123.0,42.2343,-71.1323,Constituent Call,"(42.2343, -71.1323)"
554500,101001362060,04/23/2015 08:40:09 AM,05/14/2015 08:40:09 AM,05/25/2015 06:37:56 AM,OVERDUE,Closed,Case Closed. Closed date : 2015-05-25 06:37:56.047 Case Resolved cart # 0415313662 dropped off on 5/21/15,Request for Recycling Cart,Public Works Department,Recycling,Request for Recycling Cart,PWDx_Recycling,PWDx,,,164 Chelsea St  East Boston  MA  02128,1.0,09,1.0,A7,East Boston,1.0,Ward 1,105.0,R4,164 Chelsea St,2128.0,Address,30353.0,42.374,-71.0344,Constituent Call,"(42.374, -71.0344)"
554517,101001362081,04/23/2015 08:52:12 AM,05/14/2015 08:52:12 AM,04/29/2015 02:06:49 PM,ONTIME,Closed,Case Closed Case Resolved BROKEN CART SWAPPED NEW CART # 0714424130 04/29/2015,Request for Recycling Cart,Public Works Department,Recycling,Request for Recycling Cart,PWDx_IPL Damaged Cart Replacement,PWDx,https://cityworker.cityofboston.gov:8443/attachments/report/5538eafa70b4469b1b9dcb2e/photo/Report.jpg,,915 E Second St  South Boston  MA  02127,6.0,05,2.0,C6,South Boston / South Boston Waterfront,5.0,Ward 6,609.0,R2,915 E Second St,2127.0,Address,308405.0,42.3373,-71.0267,City Worker App,"(42.3373, -71.0267)"
554519,101001362083,04/23/2015 08:53:32 AM,05/14/2015 08:53:32 AM,04/30/2015 10:16:01 AM,ONTIME,Closed,Case Closed Case Resolved cart requested filled new cart #0714423767 04/29/2015,Request for Recycling Cart,Public Works Department,Recycling,Request for Recycling Cart,PWDx_Recycling,PWDx,,,37 Washington St  Charlestown  MA  02129,3.0,1A,1.0,A15,Charlestown,2.0,Ward 2,201.0,R1,37 Washington St,2129.0,Address,145821.0,42.3732,-71.0649,Constituent Call,"(42.3732, -71.0649)"
554543,101001362113,04/23/2015 09:21:28 AM,05/14/2015 09:21:28 AM,05/25/2015 06:24:41 AM,OVERDUE,Closed,Case Closed. Closed date : 2015-05-25 06:24:41.66 Case Resolved cart # 0415302233 dropped off on 5/21/15,Request for Recycling Cart,Public Works Department,Recycling,Request for Recycling Cart,PWDx_Recycling,PWDx,,,24 Highgate St  Allston  MA  02134,11.0,04,9.0,D14,Allston / Brighton,15.0,Ward 21,2104.0,R1,24 Highgate St,2134.0,Address,73595.0,42.355,-71.1315,Self Service,"(42.355, -71.1315)"
554567,101001362146,04/23/2015 09:49:00 AM,05/14/2015 09:49:15 AM,08/31/2015 02:38:56 PM,OVERDUE,Closed,Case Closed. Closed date : 2015-08-31 14:38:56.12 Case Resolved cart requested filled new cart # 7156717501 08/28/2015,Request for Recycling Cart,Public Works Department,Recycling,Request for Recycling Cart,PWDx_Recycling,PWDx,,,591-593 Adams St  Dorchester  MA  02124,8.0,07,3.0,C11,Dorchester,7.0,Ward 16,1606.0,CM,591-593 Adams St,2124.0,Address,841.0,42.2895,-71.0561,Constituent Call,"(42.2895, -71.0561)"
554605,101001362186,04/23/2015 10:14:41 AM,05/14/2015 10:14:40 AM,04/28/2015 01:36:50 PM,ONTIME,Closed,Case Closed Case Resolved NEW CART REQUEST FILLED NEW CART#0714423916 04/27/2015,Request for Recycling Cart,Public Works Department,Recycling,Request for Recycling Cart,PWDx_Recycling,PWDx,,,463 Beacon St  Boston  MA  02115,4.0,1C,8.0,D4,Back Bay,14.0,Ward 5,509.0,RC,463 Beacon St,2115.0,Address,11540.0,42.3509,-71.0882,Employee Generated,"(42.3509, -71.0882)"
554630,101001362217,04/23/2015 10:28:00 AM,05/14/2015 10:28:45 AM,09/22/2015 09:13:00 AM,OVERDUE,Closed,Case Closed Case Resolved  already recieved cart,Request for Recycling Cart,Public Works Department,Recycling,Request for Recycling Cart,PWDx_Recycling,PWDx,,,256-262 Hanover St  Boston  MA  02113,3.0,1B,1.0,A1,Boston,3.0,03,303.0,C,256-262 Hanover St,2113.0,Address,69072.0,42.3637,-71.055,Constituent Call,"(42.3637, -71.055)"
554634,101001362220,04/23/2015 10:29:58 AM,05/14/2015 10:29:58 AM,05/05/2015 08:21:00 AM,ONTIME,Closed,Case Closed. Closed date : 2015-05-05 08:21:00.32 Case Resolved CART REQUESTED FILLED NEW CART #0714424061 05/01/2015,Request for Recycling Cart,Public Works Department,Recycling,Request for Recycling Cart,PWDx_Recycling,PWDx,,,277 North St  Boston  MA  02109,3.0,1B,1.0,A1,Downtown / Financial District,3.0,Ward 3,301.0,RC,277 North St,2109.0,Address,284225.0,42.364,-71.0517,Constituent Call,"(42.364, -71.0517)"
554638,101001362224,04/23/2015 10:30:43 AM,05/14/2015 10:30:43 AM,05/05/2015 08:21:56 AM,ONTIME,Closed,Case Closed. Closed date : 2015-05-05 08:21:56.217 Case Resolved CART REQUESTED FILLED NEW CART #0714424066 05/05/2015,Request for Recycling Cart,Public Works Department,Recycling,Request for Recycling Cart,PWDx_Recycling,PWDx,,,165 Salem St  Boston  MA  02113,3.0,1B,1.0,A1,Downtown / Financial District,3.0,Ward 3,303.0,RC,165 Salem St,2113.0,Address,305212.0,42.3657,-71.0551,Constituent Call,"(42.3657, -71.0551)"
554708,101001362304,04/23/2015 11:04:19 AM,05/14/2015 11:04:19 AM,04/29/2015 02:27:08 PM,ONTIME,Closed,Case Closed Case Resolved cart request filled  new cart #0714423699 04/28/2015,Request for Recycling Cart,Public Works Department,Recycling,Request for Recycling Cart,PWDx_Recycling,PWDx,,,15 San Juan St  Roxbury  MA  02118,4.0,1C,2.0,D4,South End,6.0,09,901.0,,15 San Juan St,2118.0,Address,351010.0,42.3594,-71.0587,Constituent Call,"(0, 0)"
554830,101001362454,04/23/2015 12:44:02 PM,05/14/2015 12:44:02 PM,05/06/2015 01:23:29 PM,ONTIME,Closed,Case Closed. Closed date : 2015-05-06 13:23:29.507 Case Resolved cart request filled new cart # 0415302631 05/04/2015,Request for Recycling Cart,Public Works Department,Recycling,Request for Recycling Cart,PWDx_Recycling,PWDx,,,6-8 Johnson Ter  Dorchester  MA  02124,8.0,07,4.0,B3,Greater Mattapan,9.0,Ward 14,1410.0,R2,6-8 Johnson Ter,2124.0,Address,79935.0,42.2877,-71.0801,Constituent Call,"(42.2877, -71.0801)"
554836,101001362465,04/23/2015 12:52:19 PM,05/14/2015 12:52:18 PM,05/15/2015 02:16:50 PM,OVERDUE,Closed,Case Closed. Closed date : 2015-05-15 14:16:50.093 Case Resolved cart requested new cart#0415302578 05/01/2015,Request for Recycling Cart,Public Works Department,Recycling,Request for Recycling Cart,PWDx_Recycling,PWDx,,,118 F St  South Boston  MA  02127,6.0,05,2.0,C6,South Boston / South Boston Waterfront,5.0,Ward 6,603.0,R1,118 F St,2127.0,Address,55369.0,42.3364,-71.0485,Constituent Call,"(42.3364, -71.0485)"
554884,101001362535,04/23/2015 01:24:47 PM,05/14/2015 01:24:47 PM,05/15/2015 02:14:52 PM,OVERDUE,Closed,Case Closed. Closed date : 2015-05-15 14:14:52.477 Case Resolved cart requested new cart#0415302665 05/01/15,Request for Recycling Cart,Public Works Department,Recycling,Request for Recycling Cart,PWDx_Recycling,PWDx,,,39-41 Aldie St  Allston  MA  02134,11.0,04,9.0,D14,Allston / Brighton,15.0,Ward 22,2202.0,CM,39-41 Aldie St,2134.0,Address,1779.0,42.3588,-71.1353,Constituent Call,"(42.3588, -71.1353)"
554948,101001362620,04/23/2015 02:49:14 PM,05/14/2015 02:49:14 PM,05/08/2015 10:30:41 AM,ONTIME,Closed,Case Closed. Closed date : 2015-05-08 10:30:41.877 Case Resolved cart requested filled new cart #0514302545 05/01/2015,Request for Recycling Cart,Public Works Department,Recycling,Request for Recycling Cart,PWDx_Recycling,PWDx,,,67 Semont Rd  Dorchester  MA  02124,8.0,07,3.0,C11,Dorchester,7.0,Ward 16,1604.0,R3,67 Semont Rd,2124.0,Address,125207.0,42.2912,-71.0604,Constituent Call,"(42.2912, -71.0604)"
554975,101001362655,04/23/2015 03:34:53 PM,05/14/2015 03:34:53 PM,05/06/2015 01:41:29 PM,ONTIME,Closed,Case Closed. Closed date : 2015-05-06 13:41:29.023 Case Resolved cart request filled new cart # 0415302444 05/05/2015,Request for Recycling Cart,Public Works Department,Recycling,Request for Recycling Cart,PWDx_Recycling,PWDx,,,30 Montcalm Ave  Brighton  MA  02135,11.0,04,9.0,D14,Allston / Brighton,15.0,Ward 22,2206.0,R3,30 Montcalm Ave,2135.0,Address,276597.0,42.3527,-71.1471,Constituent Call,"(42.3527, -71.1471)"
554992,101001362678,04/23/2015 04:02:00 PM,05/14/2015 04:02:00 PM,05/15/2015 02:13:27 PM,OVERDUE,Closed,Case Closed. Closed date : 2015-05-15 14:13:27.0 Case Resolved cart requested new cart#0415313694 05/01/2015,Request for Recycling Cart,Public Works Department,Recycling,Request for Recycling Cart,PWDx_Recycling,PWDx,,,7 Haverford St  Jamaica Plain  MA  02130,9.0,02,6.0,E13,Jamaica Plain,11.0,Ward 11,1106.0,R2,7 Haverford St,2130.0,Address,249361.0,42.312,-71.1028,Self Service,"(42.312, -71.1028)"
555027,101001362735,04/23/2015 05:14:23 PM,05/15/2015 08:30:00 AM,05/18/2015 02:51:41 PM,OVERDUE,Closed,Case Closed. Closed date : 2015-05-18 14:51:41.06 Case Resolved request cart filled new cart # 0415302246 05/15/15,Request for Recycling Cart,Public Works Department,Recycling,Request for Recycling Cart,PWDx_Recycling,PWDx,,,28 George St  Mattapan  MA  02126,8.0,08,5.0,E18,Hyde Park,10.0,Ward 18,1806.0,R1,28 George St,2126.0,Address,63412.0,42.2645,-71.1084,Constituent Call,"(42.2645, -71.1084)"
555032,101001362751,04/23/2015 06:49:08 PM,05/15/2015 08:30:00 AM,04/28/2015 01:31:56 PM,ONTIME,Closed,Case Closed Case Resolved NEW CART REQUEST FILLED NEW CART#0714423913 04/27/2015,Request for Recycling Cart,Public Works Department,Recycling,Request for Recycling Cart,PWDx_Recycling,PWDx,,,44 Quincy St  Roxbury  MA  02119,9.0,10B,7.0,B2,Roxbury,13.0,Ward 12,1206.0,R3,44 Quincy St,2119.0,Address,297172.0,42.3156,-71.0803,Self Service,"(42.3156, -71.0803)"
555038,101001362759,04/23/2015 06:52:18 PM,05/15/2015 08:30:00 AM,05/15/2015 02:07:02 PM,OVERDUE,Closed,Case Closed. Closed date : 2015-05-15 14:07:02.0 Case Resolved cart requested new cart#0514302583 04/28/2015,Request for Recycling Cart,Public Works Department,Recycling,Request for Recycling Cart,PWDx_Recycling,PWDx,,,92 Bennington St  East Boston  MA  02128,1.0,09,1.0,A7,East Boston,1.0,Ward 1,106.0,R3,92 Bennington St,2128.0,Address,14942.0,42.3764,-71.0354,Constituent Call,"(42.3764, -71.0354)"
555077,101001362825,04/23/2015 10:10:19 PM,05/15/2015 08:30:00 AM,05/12/2015 12:00:08 PM,ONTIME,Closed,Case Closed. Closed date : 2015-05-12 12:00:08.287 Case Resolved Cart already delivered on 4/28/2015,Request for Recycling Cart,Public Works Department,Recycling,Request for Recycling Cart,PWDx_Recycling,PWDx,,,91 Claymoss Rd  Brighton  MA  02135,11.0,04,9.0,D14,Allston / Brighton,15.0,Ward 21,2111.0,R2,91 Claymoss Rd,2135.0,Address,33687.0,42.3454,-71.1466,Self Service,"(42.3454, -71.1466)"
555133,101001362912,04/24/2015 08:23:56 AM,05/15/2015 08:30:00 AM,05/25/2015 06:33:08 AM,OVERDUE,Closed,Case Closed. Closed date : 2015-05-25 06:33:08.853 Case Resolved cart # 0415302977 dropped off on 5/21/15,Request for Recycling Cart,Public Works Department,Recycling,Request for Recycling Cart,PWDx_Recycling,PWDx,,,77 Augustus Ave  Roslindale  MA  02131,12.0,06,5.0,E5,Roslindale,10.0,Ward 18,1810.0,CM,77 Augustus Ave,2131.0,Address,6590.0,42.28,-71.1304,Self Service,"(42.28, -71.1304)"
555149,101001362954,04/24/2015 08:54:40 AM,05/15/2015 08:54:40 AM,05/14/2015 01:46:57 PM,ONTIME,Closed,Case Closed. Closed date : 2015-05-14 13:46:57.59 Case Resolved cart request filled new cart #0415302338 05/13/2015,Request for Recycling Cart,Public Works Department,Recycling,Request for Recycling Cart,PWDx_Recycling,PWDx,,,200 Everett St  East Boston  MA  02128,1.0,09,1.0,A7,East Boston,1.0,Ward 1,101.0,R1,200 Everett St,2128.0,Address,55087.0,42.3661,-71.0311,Constituent Call,"(42.3661, -71.0311)"
555200,101001363025,04/24/2015 09:45:36 AM,05/15/2015 09:45:36 AM,05/15/2015 11:53:56 AM,OVERDUE,Closed,Case Closed. Closed date : 2015-05-15 11:53:56.267 Case Resolved cart requested new cart#0415302433 05/14/2015,Request for Recycling Cart,Public Works Department,Recycling,Request for Recycling Cart,PWDx_Recycling,PWDx,,,94 Fuller St  Dorchester  MA  02124,8.0,07,3.0,C11,Dorchester,7.0,Ward 17,1704.0,R1,94 Fuller St,2124.0,Address,61249.0,42.2823,-71.07,Constituent Call,"(42.2823, -71.07)"
555212,101001363041,04/24/2015 10:00:21 AM,05/15/2015 10:00:21 AM,05/28/2015 02:32:10 PM,OVERDUE,Closed,Case Closed. Closed date : 2015-05-28 14:32:10.873 Case Resolved cart swapped new cart#0714423698 05/22/2015,Request for Recycling Cart,Public Works Department,Recycling,Request for Recycling Cart,PWDx_IPL Damaged Cart Replacement,PWDx,https://cityworker.cityofboston.gov:8443/attachments/report/553a4c7470b4469b1b9dcb7e/photo/Report.jpg,,268 Gold St  South Boston  MA  02127,6.0,05,2.0,C6,South Boston / South Boston Waterfront,5.0,Ward 7,704.0,R3,268 Gold St,2127.0,Address,65118.0,42.3353,-71.048,City Worker App,"(42.3353, -71.048)"
555264,101001363100,04/24/2015 10:51:27 AM,05/15/2015 10:51:27 AM,04/28/2015 03:02:36 PM,ONTIME,Closed,Case Closed Duplicate of Existing Case  reference case #101001357249 one cart per household,Request for Recycling Cart,Public Works Department,Recycling,Request for Recycling Cart,PWDx_Recycling,PWDx,,,387 Faneuil St  Brighton  MA  02135,11.0,04,9.0,D14,Allston / Brighton,15.0,Ward 22,2207.0,R1,387 Faneuil St,2135.0,Address,56285.0,42.3518,-71.1665,Constituent Call,"(42.3518, -71.1665)"
555296,101001363147,04/24/2015 11:43:38 AM,05/15/2015 11:43:37 AM,05/25/2015 06:17:07 AM,OVERDUE,Closed,Case Closed. Closed date : 2015-05-25 06:17:07.147 Case Resolved cart # 0415302982 was dropped off on 5/21/15,Request for Recycling Cart,Public Works Department,Recycling,Request for Recycling Cart,PWDx_Recycling,PWDx,,,24 Willis St  Dorchester  MA  02125,7.0,03,3.0,C11,Dorchester,7.0,Ward 13,1306.0,R3,24 Willis St,2125.0,Address,150166.0,42.3179,-71.0604,Constituent Call,"(42.3179, -71.0604)"
555305,101001363160,04/24/2015 11:58:14 AM,05/15/2015 11:58:14 AM,05/26/2015 12:04:39 PM,OVERDUE,Closed,Case Closed. Closed date : 2015-05-26 12:04:39.07 Case Resolved cart #0415302388 dropped off on 5/22/15,Request for Recycling Cart,Public Works Department,Recycling,Request for Recycling Cart,PWDx_Recycling,PWDx,,,27 Union Ave  Jamaica Plain  MA  02130,9.0,02,6.0,E13,Jamaica Plain,11.0,Ward 11,1107.0,R1,27 Union Ave,2130.0,Address,139038.0,42.3091,-71.1066,Constituent Call,"(42.3091, -71.1066)"
555352,101001363225,04/24/2015 12:58:42 PM,05/15/2015 12:58:42 PM,05/25/2015 06:36:41 AM,OVERDUE,Closed,Case Closed. Closed date : 2015-05-25 06:36:41.483 Case Resolved cart # 0415313658 dropped off on 5/21/15,Request for Recycling Cart,Public Works Department,Recycling,Request for Recycling Cart,PWDx_Recycling,PWDx,,,9 Mattakeeset St  Mattapan  MA  02126,8.0,08,5.0,E18,Hyde Park,9.0,Ward 18,1805.0,R3,9 Mattakeeset St,2126.0,Address,92809.0,42.2644,-71.0995,Constituent Call,"(42.2644, -71.0995)"
555359,101001363235,04/24/2015 01:14:17 PM,05/15/2015 01:14:17 PM,06/02/2015 11:31:47 AM,OVERDUE,Closed,Case Closed. Closed date : 2015-06-02 11:31:47.737 Case Resolved cart requested filled new cart # 0415313681 06/01/2015,Request for Recycling Cart,Public Works Department,Recycling,Request for Recycling Cart,PWDx_Recycling,PWDx,,,11 Oak Square Ave  Brighton  MA  02135,11.0,04,9.0,D14,Allston / Brighton,15.0,Ward 22,2207.0,R1,11 Oak Square Ave,2135.0,Address,104632.0,42.3502,-71.1638,Self Service,"(42.3502, -71.1638)"
555387,101001363271,04/24/2015 01:48:52 PM,05/15/2015 01:48:52 PM,05/26/2015 12:18:08 PM,OVERDUE,Closed,Case Closed. Closed date : 2015-05-26 12:18:08.927 Case Resolved cart # 0415302396 dropped off on 5/22/15,Request for Recycling Cart,Public Works Department,Recycling,Request for Recycling Cart,PWDx_Recycling,PWDx,,,19 Swan Ave  East Boston  MA  02128,1.0,09,1.0,A7,East Boston,1.0,Ward 1,112.0,R2,19 Swan Ave,2128.0,Address,133119.0,42.3886,-70.9971,Constituent Call,"(42.3886, -70.9971)"
555413,101001363303,04/24/2015 02:29:00 PM,05/15/2015 02:29:00 PM,06/02/2015 11:48:35 AM,OVERDUE,Closed,Case Closed. Closed date : 2015-06-02 11:48:35.73 Case Resolved cart requested filled new cart # 0415302617 05/29/2015,Request for Recycling Cart,Public Works Department,Recycling,Request for Recycling Cart,PWDx_Recycling,PWDx,,,7 Weld Hill St  Jamaica Plain  MA  02130,12.0,02,6.0,E13,Jamaica Plain,10.0,Ward 19,1907.0,R4,7 Weld Hill St,2130.0,Address,147274.0,42.2987,-71.1138,Constituent Call,"(42.2987, -71.1138)"
555439,101001363341,04/24/2015 02:58:32 PM,05/15/2015 02:58:31 PM,06/16/2015 08:30:41 AM,OVERDUE,Closed,Case Closed. Closed date : 2015-06-16 08:30:41.083 Case Resolved recycling cart request filled new cart#0415313637 06/12/2015,Request for Recycling Cart,Public Works Department,Recycling,Request for Recycling Cart,PWDx_Recycling,PWDx,,,26 Stimson Rd  West Roxbury  MA  02132,12.0,06,6.0,E5,West Roxbury,12.0,Ward 20,2015.0,R1,26 Stimson Rd,2132.0,Address,130635.0,42.2617,-71.1595,Constituent Call,"(42.2617, -71.1595)"
555576,101001363494,04/24/2015 03:56:43 PM,05/15/2015 03:56:43 PM,05/25/2015 06:37:18 AM,OVERDUE,Closed,Case Closed. Closed date : 2015-05-25 06:37:18.603 Case Resolved cart # 0415313657 dropped off on 5/21/15,Request for Recycling Cart,Public Works Department,Recycling,Request for Recycling Cart,PWDx_Recycling,PWDx,,,21 Derry Rd  Hyde Park  MA  02136,12.0,08,5.0,E18,Hyde Park,10.0,Ward 18,1808.0,R1,21 Derry Rd,2136.0,Address,47463.0,42.2657,-71.1138,Constituent Call,"(42.2657, -71.1138)"
555597,101001363533,04/24/2015 04:42:19 PM,05/15/2015 04:42:19 PM,05/14/2015 12:26:44 PM,ONTIME,Closed,Case Closed. Closed date : 2015-05-14 12:26:44.74 Case Resolved cart request filled new cart #0514302385 05/13/2015,Request for Recycling Cart,Public Works Department,Recycling,Request for Recycling Cart,PWDx_Recycling,PWDx,,,15 Dalkeith St  Dorchester  MA  02125,7.0,03,7.0,B2,Roxbury,13.0,Ward 13,1301.0,A,15 Dalkeith St,2125.0,Address,164129.0,42.3153,-71.0762,Constituent Call,"(42.3153, -71.0762)"
555617,101001363568,04/24/2015 05:34:30 PM,05/18/2015 08:30:00 AM,05/15/2015 12:01:07 PM,ONTIME,Closed,Case Closed. Closed date : 2015-05-15 12:01:07.72 Case Resolved cart requested new cart#0415302593 05/14/2015,Request for Recycling Cart,Public Works Department,Recycling,Request for Recycling Cart,PWDx_Recycling,PWDx,,,196 Bremen St  East Boston  MA  02128,1.0,09,1.0,A7,East Boston,1.0,Ward 1,105.0,R3,196 Bremen St,2128.0,Address,195657.0,42.3733,-71.034,Self Service,"(42.3733, -71.034)"
555670,101001363647,04/25/2015 07:59:00 AM,05/18/2015 08:30:00 AM,06/01/2015 03:01:15 PM,OVERDUE,Closed,Case Closed. Closed date : 2015-06-01 15:01:15.123 Case Resolved Carty requested filled new cart#0714423587 05/29/2015,Request for Recycling Cart,Public Works Department,Recycling,Request for Recycling Cart,PWDx_Recycling,PWDx,,,51-53 Boylston St  Boston  MA  02111,3.0,1C,2.0,A1,Downtown / Financial District,4.0,Ward 3,308.0,E,51-53 Boylston St,2111.0,Address,18337.0,42.3525,-71.0642,Constituent Call,"(42.3525, -71.0642)"
555671,101001363648,04/25/2015 08:02:11 AM,05/18/2015 08:30:00 AM,04/28/2015 10:58:01 AM,ONTIME,Closed,Case Closed Duplicate of Existing Case  Reference#101001363657,Request for Recycling Cart,Public Works Department,Recycling,Request for Recycling Cart,PWDx_Recycling,PWDx,,,53 Boylston St  Jamaica Plain  MA  02130,9.0,02,6.0,E13,Jamaica Plain,11.0,Ward 19,1904.0,R2,53 Boylston St,2130.0,Address,18585.0,42.3175,-71.1075,Constituent Call,"(42.3175, -71.1075)"
555678,101001363657,04/25/2015 09:40:15 AM,05/18/2015 08:30:00 AM,05/26/2015 12:05:33 PM,OVERDUE,Closed,Case Closed. Closed date : 2015-05-26 12:05:33.523 Case Resolved cart # 0415313613 dropped off on 5/22/15,Request for Recycling Cart,Public Works Department,Recycling,Request for Recycling Cart,PWDx_Recycling,PWDx,,,53 Boylston St  Jamaica Plain  MA  02130,9.0,02,6.0,E13,Jamaica Plain,11.0,Ward 19,1904.0,R2,53 Boylston St,2130.0,Address,18585.0,42.3175,-71.1075,Constituent Call,"(42.3175, -71.1075)"
555810,101001363890,04/26/2015 08:20:03 AM,05/18/2015 08:30:00 AM,04/28/2015 02:23:01 PM,ONTIME,Closed,Case Closed Duplicate of Existing Case  case reference # 101001363890 one cart per household,Request for Recycling Cart,Public Works Department,Recycling,Request for Recycling Cart,PWDx_Recycling,PWDx,,,136 Milton Ave  Hyde Park  MA  02136,12.0,08,5.0,E18,Hyde Park,10.0,Ward 18,1816.0,R1,136 Milton Ave,2136.0,Address,95652.0,42.2501,-71.1106,Self Service,"(42.2501, -71.1106)"
555943,101001364144,04/26/2015 09:11:47 PM,05/18/2015 08:30:00 AM,05/21/2015 02:40:43 PM,OVERDUE,Closed,Case Closed. Closed date : 2015-05-21 14:40:43.3 Case Resolved cart requested filled new cart # 0415302921 05/20/2015,Request for Recycling Cart,Public Works Department,Recycling,Request for Recycling Cart,PWDx_Recycling,PWDx,,,9 Pacific St  South Boston  MA  02127,6.0,05,2.0,C6,South Boston / South Boston Waterfront,5.0,Ward 7,704.0,R3,9 Pacific St,2127.0,Address,288153.0,42.334,-71.0458,Self Service,"(42.334, -71.0458)"
556013,101001364246,04/27/2015 08:25:00 AM,05/18/2015 08:30:00 AM,08/31/2015 02:43:12 PM,OVERDUE,Closed,Case Closed. Closed date : 2015-08-31 14:43:12.61 Case Resolved cart requested filled new cart #0715671381 08/28/2015,Request for Recycling Cart,Public Works Department,Recycling,Request for Recycling Cart,PWDx_Recycling,PWDx,,,5261 Washington St  West Roxbury  MA  02132,12.0,06,6.0,E5,West Roxbury,12.0,Ward 20,2015.0,CD,5261 Washington St,2132.0,Address,145680.0,42.2598,-71.1593,Constituent Call,"(42.2598, -71.1593)"
556038,101001364282,04/27/2015 08:49:43 AM,05/18/2015 08:49:43 AM,06/02/2015 11:45:34 AM,OVERDUE,Closed,Case Closed. Closed date : 2015-06-02 11:45:34.67 Case Resolved cart requested filled new cart # 0415313680 05/30/2015,Request for Recycling Cart,Public Works Department,Recycling,Request for Recycling Cart,PWDx_Recycling,PWDx,,,79 Franklin St  Allston  MA  02134,11.0,04,9.0,D14,Allston / Brighton,15.0,Ward 22,2202.0,CD,79 Franklin St,2134.0,Address,60649.0,42.3584,-71.1328,Self Service,"(42.3584, -71.1328)"
556131,101001364399,04/27/2015 10:13:57 AM,05/18/2015 10:13:57 AM,06/05/2015 08:31:41 AM,OVERDUE,Closed,Case Closed. Closed date : 2015-06-05 08:31:41.053 Case Resolved Cart requested filled new cart #0415313565 05/18/2015,Request for Recycling Cart,Public Works Department,Recycling,Request for Recycling Cart,PWDx_Recycling,PWDx,,,21 Gaylord St  Dorchester  MA  02124,8.0,03,4.0,B3,Dorchester,9.0,Ward 17,1701.0,R3,21 Gaylord St,2124.0,Address,240470.0,42.2985,-71.0741,Constituent Call,"(42.2985, -71.0741)"
556159,101001364436,04/27/2015 10:35:07 AM,05/18/2015 10:35:07 AM,05/06/2015 08:57:00 AM,ONTIME,Closed,Case Closed. Closed date : 2015-05-06 08:57:00.623 Duplicate of Existing Case,Damaged Cart - New Request,Public Works Department,Recycling,Request for Recycling Cart,PWDx_Recycling,PWDx,,,8 Holmes St  Allston  MA  02134,11.0,04,9.0,D14,Allston / Brighton,15.0,Ward 22,2202.0,R2,8 Holmes St,2134.0,Address,252709.0,42.3617,-71.1323,Employee Generated,"(42.3617, -71.1323)"
556161,101001364440,04/27/2015 10:37:00 AM,05/18/2015 10:37:47 AM,06/05/2015 03:02:59 PM,OVERDUE,Closed,Case Closed. Closed date : 2015-06-05 15:02:59.27 Case Resolved no damaged cart 2nd time no bin out 06/05/2015,Damaged Cart - New Request,Public Works Department,Recycling,Request for Recycling Cart,PWDx_IPL Damaged Cart Replacement,PWDx,,,8 Holmes St  Allston  MA  02134,11.0,04,9.0,D14,Allston / Brighton,15.0,Ward 22,2202.0,R2,8 Holmes St,2134.0,Address,252709.0,42.3617,-71.1323,Employee Generated,"(42.3617, -71.1323)"
556190,101001364481,04/27/2015 11:03:41 AM,05/18/2015 11:03:40 AM,05/12/2015 01:25:20 PM,ONTIME,Closed,Case Closed. Closed date : 2015-05-12 13:25:20.31 Case Resolved cart requested filled new cart # 0415302428 05/11/2015,Request for Recycling Cart,Public Works Department,Recycling,Request for Recycling Cart,PWDx_Recycling,PWDx,,,151 Summit St  Hyde Park  MA  02136,12.0,08,5.0,E18,Hyde Park,10.0,Ward 18,1817.0,R2,151 Summit St,2136.0,Address,315896.0,42.2477,-71.1174,Employee Generated,"(42.2477, -71.1174)"
556233,101001364541,04/27/2015 11:53:41 AM,05/18/2015 11:53:40 AM,06/02/2015 11:46:04 AM,OVERDUE,Closed,Case Closed. Closed date : 2015-06-02 11:46:04.117 Case Resolved cart requested filled new cart # 0415302686 05/30/2015,Request for Recycling Cart,Public Works Department,Recycling,Request for Recycling Cart,PWDx_Recycling,PWDx,,,52 Mansfield St  Allston  MA  02134,11.0,04,9.0,D14,Allston / Brighton,15.0,Ward 22,2201.0,R3,52 Mansfield St,2134.0,Address,267734.0,42.3588,-71.1319,Constituent Call,"(42.3588, -71.1319)"
556258,101001364569,04/27/2015 12:18:39 PM,05/18/2015 12:18:39 PM,06/05/2015 08:32:10 AM,OVERDUE,Closed,Case Closed. Closed date : 2015-06-05 08:32:10.577 Case Resolved Cart requested filled new cart #0415313573 05/18/2015,Request for Recycling Cart,Public Works Department,Recycling,Request for Recycling Cart,PWDx_Recycling,PWDx,,,9 Bilodeau Rd  Dorchester  MA  02121,7.0,03,4.0,B2,Roxbury,13.0,Ward 14,1403.0,R2,9 Bilodeau Rd,2121.0,Address,15504.0,42.3073,-71.0818,Constituent Call,"(42.3073, -71.0818)"
556307,101001364624,04/27/2015 12:43:23 PM,05/18/2015 12:43:23 PM,05/01/2015 01:10:50 PM,ONTIME,Closed,Case Closed Case Resolved cart requested filled new cart#0714423854 04/30/2015,Request for Recycling Cart,Public Works Department,Recycling,Request for Recycling Cart,PWDx_Recycling,PWDx,,,407 Marlborough St  Boston  MA  02115,4.0,1C,8.0,D4,Back Bay,14.0,Ward 5,509.0,CM,407 Marlborough St,2115.0,Address,91283.0,42.3504,-71.0887,Constituent Call,"(42.3504, -71.0887)"
556308,101001364625,04/27/2015 12:43:52 PM,05/18/2015 12:43:52 PM,05/01/2015 01:06:46 PM,ONTIME,Closed,Case Closed Case Resolved cart requested filled new cart# 0714423885 04/30/2015,Request for Recycling Cart,Public Works Department,Recycling,Request for Recycling Cart,PWDx_Recycling,PWDx,,,54 Clifford St  Roxbury  MA  02119,7.0,10B,7.0,B2,Roxbury,13.0,Ward 12,1204.0,R3,54 Clifford St,2119.0,Address,33966.0,42.3198,-71.0791,Constituent Call,"(42.3198, -71.0791)"
556373,101001364700,04/27/2015 01:23:00 PM,05/18/2015 01:23:23 PM,06/12/2015 11:12:24 AM,OVERDUE,Closed,Case Closed. Closed date : 2015-06-12 11:12:24.21 Case Resolved cart requested filled new cart # 0514000564 06/11/2015,Request for Recycling Cart,Public Works Department,Recycling,Request for Recycling Cart,PWDx_Recycling,PWDx,,,902 Hyde Park Ave  Hyde Park  MA  02136,12.0,08,5.0,E18,Hyde Park,10.0,Ward 18,1814.0,R2,902 Hyde Park Ave,2136.0,Address,258143.0,42.269,-71.1205,Employee Generated,"(42.269, -71.1205)"
556382,101001364708,04/27/2015 01:29:29 PM,05/18/2015 01:29:28 PM,06/02/2015 11:37:33 AM,OVERDUE,Closed,Case Closed. Closed date : 2015-06-02 11:37:33.78 Case Resolved cart requested filled new cart # 0415302527 06/01/2015,Request for Recycling Cart,Public Works Department,Recycling,Request for Recycling Cart,PWDx_Recycling,PWDx,,,219 Lexington St  East Boston  MA  02128,1.0,09,1.0,A7,East Boston,1.0,Ward 1,109.0,R3,219 Lexington St,2128.0,Address,85596.0,42.3796,-71.0318,Constituent Call,"(42.3796, -71.0318)"
556417,101001364752,04/27/2015 02:04:18 PM,05/18/2015 02:04:18 PM,05/21/2015 02:41:09 PM,OVERDUE,Closed,Case Closed. Closed date : 2015-05-21 14:41:09.937 Case Resolved cart requested filled new cart # 0415302234 05/20/2015,Request for Recycling Cart,Public Works Department,Recycling,Request for Recycling Cart,PWDx_Recycling,PWDx,,,186 I St  South Boston  MA  02127,6.0,05,2.0,C6,South Boston / South Boston Waterfront,5.0,Ward 7,702.0,R3,186 I St,2127.0,Address,258273.0,42.3319,-71.0397,Self Service,"(42.3319, -71.0397)"
556418,101001364753,04/27/2015 02:04:29 PM,05/18/2015 02:04:28 PM,06/09/2015 12:15:23 PM,OVERDUE,Closed,Case Closed. Closed date : 2015-06-09 12:15:23.15 Case Resolved cart requested filled new cart #041502400 06/08/2015,Request for Recycling Cart,Public Works Department,Recycling,Request for Recycling Cart,PWDx_Recycling,PWDx,,,285 Corey St  West Roxbury  MA  02132,,,0.0,,West Roxbury,0.0,20,,,285 Corey St,2132.0,Address,349566.0,42.3594,-71.0587,Constituent Call,"(0, 0)"
556470,101001364822,04/27/2015 03:01:36 PM,05/18/2015 03:01:35 PM,05/12/2015 01:26:42 PM,ONTIME,Closed,Case Closed. Closed date : 2015-05-12 13:26:42.993 Case Resolved cart requested filled new cart # 0415302430 05/11/2015,Request for Recycling Cart,Public Works Department,Recycling,Request for Recycling Cart,PWDx_Recycling,PWDx,,,125 Dana Ave  Hyde Park  MA  02136,12.0,08,5.0,E18,Hyde Park,10.0,Ward 18,1818.0,R3,125 Dana Ave,2136.0,Address,45881.0,42.2488,-71.1215,Constituent Call,"(42.2488, -71.1215)"
556600,101001365000,04/27/2015 06:40:28 PM,05/19/2015 08:30:00 AM,06/08/2015 11:15:50 AM,OVERDUE,Closed,Case Closed. Closed date : 2015-06-08 11:15:50.33 Case Resolved cart requested filled new cart #0415302561 06/04/2015,Request for Recycling Cart,Public Works Department,Recycling,Request for Recycling Cart,PWDx_Recycling,PWDx,,,45 M St  South Boston  MA  02127,6.0,05,2.0,C6,South Boston / South Boston Waterfront,5.0,Ward 6,607.0,R1,45 M St,2127.0,Address,88091.0,42.3366,-71.0336,Self Service,"(42.3366, -71.0336)"
556726,101001365192,04/28/2015 08:48:14 AM,05/19/2015 08:48:14 AM,05/18/2015 02:47:10 PM,ONTIME,Closed,Case Closed. Closed date : 2015-05-18 14:47:10.08 Case Resolved request cart filled new cart # 0415302967 05/15/15,Request for Recycling Cart,Public Works Department,Recycling,Request for Recycling Cart,PWDx_Recycling,PWDx,,,207 E St  South Boston  MA  02127,6.0,05,2.0,C6,South Boston / South Boston Waterfront,5.0,06,602.0,E,207 E St,2127.0,Address,50523.0,42.3345,-71.0526,Constituent Call,"(42.3345, -71.0526)"
556767,101001365240,04/28/2015 09:24:55 AM,05/19/2015 09:24:55 AM,05/13/2015 02:28:57 PM,ONTIME,Closed,Case Closed. Closed date : 2015-05-13 14:28:57.25 Case Resolved cart requested filled new cart #0415302592 5/12/15,Request for Recycling Cart,Public Works Department,Recycling,Request for Recycling Cart,PWDx_Recycling,PWDx,,,1492 Hyde Park Ave  Hyde Park  MA  02136,12.0,08,5.0,E18,Hyde Park,10.0,Ward 18,1818.0,R2,1492 Hyde Park Ave,2136.0,Address,257563.0,42.2477,-71.1274,Self Service,"(42.2477, -71.1274)"
556858,101001365349,04/28/2015 10:40:10 AM,05/19/2015 10:40:09 AM,06/12/2015 11:08:07 AM,OVERDUE,Closed,Case Closed. Closed date : 2015-06-12 11:08:07.55 Case Resolved cart requested filled new cart # 0415213498 06/11/2015,Request for Recycling Cart,Public Works Department,Recycling,Request for Recycling Cart,PWDx_Recycling,PWDx,,,40 Westmoreland St  Dorchester  MA  02124,8.0,07,3.0,C11,Dorchester,7.0,Ward 16,1608.0,R2,40 Westmoreland St,2124.0,Address,148757.0,42.2842,-71.0577,Constituent Call,"(42.2842, -71.0577)"
556873,101001365368,04/28/2015 10:50:51 AM,05/19/2015 10:50:51 AM,05/13/2015 02:29:24 PM,ONTIME,Closed,Case Closed. Closed date : 2015-05-13 14:29:24.593 Case Resolved cart requested filled new cart #0415313000 05/12/15,Request for Recycling Cart,Public Works Department,Recycling,Request for Recycling Cart,PWDx_Recycling,PWDx,,,15-17 Knight St  Hyde Park  MA  02136,12.0,08,5.0,E18,Hyde Park,10.0,Ward 18,1819.0,R2,15-17 Knight St,2136.0,Address,82321.0,42.2459,-71.1332,Constituent Call,"(42.2459, -71.1332)"
556951,101001365458,04/28/2015 11:53:51 AM,05/19/2015 11:53:51 AM,05/13/2015 02:18:10 PM,ONTIME,Closed,Case Closed. Closed date : 2015-05-13 14:18:10.53 Case Resolved cart requested filled new cart #0415302429 05/12/15,Request for Recycling Cart,Public Works Department,Recycling,Request for Recycling Cart,PWDx_Recycling,PWDx,,,54 Burroughs St  Jamaica Plain  MA  02130,9.0,02,6.0,E13,Jamaica Plain,11.0,Ward 19,1908.0,R1,54 Burroughs St,2130.0,Address,24059.0,42.3137,-71.1178,Constituent Call,"(42.3137, -71.1178)"
556959,101001365470,04/28/2015 12:00:19 PM,05/19/2015 12:00:19 PM,06/02/2015 11:43:03 AM,OVERDUE,Closed,Case Closed. Closed date : 2015-06-02 11:43:03.74 Case Resolved cart requested filled new cart # 0415313679 05/30/2015,Request for Recycling Cart,Public Works Department,Recycling,Request for Recycling Cart,PWDx_Recycling,PWDx,,,130 Boston St  Dorchester  MA  02125,6.0,03,2.0,C6,Dorchester,5.0,Ward 7,708.0,R3,130 Boston St,2125.0,Address,17085.0,42.325,-71.059,Constituent Call,"(42.325, -71.059)"
557029,101001365574,04/28/2015 01:27:02 PM,05/19/2015 01:27:02 PM,05/14/2015 12:24:11 PM,ONTIME,Closed,Case Closed. Closed date : 2015-05-14 12:24:11.293 Case Resolved cart request filled new cart # 0415302944 05/13/2015,Request for Recycling Cart,Public Works Department,Recycling,Request for Recycling Cart,PWDx_Recycling,PWDx,,,70 Glen Rd  Jamaica Plain  MA  02130,9.0,02,6.0,E13,Jamaica Plain,11.0,Ward 11,1107.0,E,70 Glen Rd,2130.0,Address,63960.0,42.3087,-71.101,Constituent Call,"(42.3087, -71.101)"
557063,101001365619,04/28/2015 02:13:43 PM,05/19/2015 02:13:43 PM,05/13/2015 02:24:50 PM,ONTIME,Closed,Case Closed. Closed date : 2015-05-13 14:24:50.36 Case Resolved cart requested filled new cart #415302331 05/12/15,Request for Recycling Cart,Public Works Department,Recycling,Request for Recycling Cart,PWDx_Recycling,PWDx,,,226 L St  South Boston  MA  02127,6.0,05,2.0,C6,South Boston / South Boston Waterfront,5.0,Ward 7,701.0,R2,226 L St,2127.0,Address,82544.0,42.3304,-71.035,Constituent Call,"(42.3304, -71.035)"
557074,101001365632,04/28/2015 02:21:00 PM,05/19/2015 02:21:59 PM,06/09/2015 12:20:20 PM,OVERDUE,Closed,Case Closed. Closed date : 2015-06-09 12:20:20.52 Case Resolved cart requested filled new cart #0415302401 06/08/2015,Request for Recycling Cart,Public Works Department,Recycling,Request for Recycling Cart,PWDx_Recycling,PWDx,,,92 Eutaw St  East Boston  MA  02128,1.0,09,1.0,A7,East Boston,1.0,Ward 1,107.0,R1,92 Eutaw St,2128.0,Address,54746.0,42.3799,-71.0361,Constituent Call,"(42.3799, -71.0361)"
557177,101001365759,04/28/2015 03:21:57 PM,05/19/2015 03:21:57 PM,04/28/2015 03:29:43 PM,ONTIME,Closed,Case Closed Case Invalid Wrong constituent name,Damaged Cart - New Request,Public Works Department,Recycling,Request for Recycling Cart,PWDx_Recycling,PWDx,,,310 Paris St  East Boston  MA  02128,1.0,09,1.0,A7,East Boston,1.0,Ward 1,105.0,R1,310 Paris St,2128.0,Address,106560.0,42.3771,-71.0323,Employee Generated,"(42.3771, -71.0323)"
557184,101001365766,04/28/2015 03:26:15 PM,05/19/2015 03:26:15 PM,05/29/2015 02:26:12 PM,OVERDUE,Closed,Case Closed. Closed date : 2015-05-29 14:26:12.583 Case Resolved cart requested filled new cart#0415302270 05/27/15,Damaged Cart - New Request,Public Works Department,Recycling,Request for Recycling Cart,PWDx_Recycling,PWDx,,,310 Paris St  East Boston  MA  02128,1.0,09,1.0,A7,East Boston,1.0,Ward 1,105.0,R1,310 Paris St,2128.0,Address,106560.0,42.3771,-71.0323,Employee Generated,"(42.3771, -71.0323)"
557195,101001365778,04/28/2015 03:34:30 PM,05/19/2015 03:34:30 PM,05/13/2015 02:20:16 PM,ONTIME,Closed,Case Closed. Closed date : 2015-05-13 14:20:16.783 Case Resolved cart requested filled new cart #415313003 5/12/15,Request for Recycling Cart,Public Works Department,Recycling,Request for Recycling Cart,PWDx_Recycling,PWDx,,,70 Bellevue St  Dorchester  MA  02125,7.0,03,3.0,C11,Dorchester,8.0,Ward 15,1503.0,R3,70 Bellevue St,2125.0,Address,13882.0,42.3087,-71.0692,Constituent Call,"(42.3087, -71.0692)"
557274,101001365897,04/28/2015 06:16:40 PM,05/20/2015 08:30:00 AM,05/13/2015 02:26:47 PM,ONTIME,Closed,Case Closed. Closed date : 2015-05-13 14:26:47.943 Case Resolved cart requested filled new cart #415302302 5/12/15,Request for Recycling Cart,Public Works Department,Recycling,Request for Recycling Cart,PWDx_Recycling,PWDx,,,46 Colonial Ave  Dorchester  MA  02124,8.0,07,4.0,B3,Dorchester,9.0,Ward 17,1705.0,R3,46 Colonial Ave,2124.0,Address,34879.0,42.2903,-71.0768,Constituent Call,"(42.2903, -71.0768)"
557284,101001365909,04/28/2015 06:43:14 PM,05/20/2015 08:30:00 AM,05/25/2015 06:33:48 AM,OVERDUE,Closed,Case Closed. Closed date : 2015-05-25 06:33:48.39 Case Resolved cart # 0415313659 dropped off on 5/21/15,Request for Recycling Cart,Public Works Department,Recycling,Request for Recycling Cart,PWDx_Recycling,PWDx,,,15 Eugenia Rd  Roslindale  MA  02131,12.0,06,5.0,E5,Roslindale,10.0,Ward 20,2009.0,R1,15 Eugenia Rd,2131.0,Address,54516.0,42.2793,-71.1378,Self Service,"(42.2793, -71.1378)"
557402,101001366064,04/29/2015 07:32:24 AM,05/20/2015 08:30:00 AM,06/02/2015 11:38:06 AM,OVERDUE,Closed,Case Closed. Closed date : 2015-06-02 11:38:06.76 Case Resolved cart requested filled new cart # 0415202526 06/01/2015,Request for Recycling Cart,Public Works Department,Recycling,Request for Recycling Cart,PWDx_Recycling,PWDx,,,203 Lexington St  East Boston  MA  02128,1.0,09,1.0,A7,East Boston,1.0,Ward 1,109.0,R2,203 Lexington St,2128.0,Address,85580.0,42.3795,-71.0323,Constituent Call,"(42.3795, -71.0323)"
557453,101001366134,04/29/2015 08:35:54 AM,05/20/2015 08:35:54 AM,06/02/2015 11:32:15 AM,OVERDUE,Closed,Case Closed. Closed date : 2015-06-02 11:32:15.077 Case Resolved cart requested filled new cart # 0415302678 06/01/2015,Request for Recycling Cart,Public Works Department,Recycling,Request for Recycling Cart,PWDx_Recycling,PWDx,,,4 Falkland St  Brighton  MA  02135,11.0,04,9.0,D14,Allston / Brighton,15.0,Ward 22,2211.0,CM,4 Falkland St,2135.0,Address,56109.0,42.3543,-71.1583,Self Service,"(42.3543, -71.1583)"
557454,101001366135,04/29/2015 08:37:36 AM,05/20/2015 08:37:36 AM,05/05/2015 11:27:09 AM,ONTIME,Closed,Case Closed. Closed date : 2015-05-05 11:27:09.56 Case Resolved recycling cart request filled new cart number is #0714423747 05/04/2015,Request for Recycling Cart,Public Works Department,Recycling,Request for Recycling Cart,PWDx_Recycling,PWDx,,,461 Beacon St  Boston  MA  02115,4.0,1C,8.0,D4,Back Bay,14.0,Ward 5,509.0,CD,461 Beacon St,2115.0,Address,11522.0,42.3509,-71.0881,Self Service,"(42.3509, -71.0881)"
557463,101001366146,04/29/2015 08:43:11 AM,05/20/2015 08:43:08 AM,05/05/2015 08:23:46 AM,ONTIME,Closed,Case Closed. Closed date : 2015-05-05 08:23:46.77 Case Resolved CART REQUESTED FILLED NEW CART #0714424063 05/01/2015,Request for Recycling Cart,Public Works Department,Recycling,Request for Recycling Cart,PWDx_Recycling,PWDx,,,98 E Brookline St  Roxbury  MA  02118,4.0,1C,2.0,D4,South End,6.0,Ward 8,801.0,CM,98 E Brookline St,2118.0,Address,22217.0,42.3373,-71.0695,Employee Generated,"(42.3373, -71.0695)"
557649,101001366404,04/29/2015 11:03:08 AM,05/20/2015 11:03:07 AM,05/18/2015 02:52:20 PM,ONTIME,Closed,Case Closed. Closed date : 2015-05-18 14:52:20.717 Case Resolved request cart filled new cart # 0415302239 05/15/15,Request for Recycling Cart,Public Works Department,Recycling,Request for Recycling Cart,PWDx_Recycling,PWDx,,,25 George St  Mattapan  MA  02126,8.0,08,5.0,E18,Hyde Park,10.0,Ward 18,1806.0,R1,25 George St,2126.0,Address,63409.0,42.2645,-71.108,Constituent Call,"(42.2645, -71.108)"
557693,101001366462,04/29/2015 11:44:01 AM,05/20/2015 11:44:01 AM,06/17/2015 02:20:15 PM,OVERDUE,Closed,Case Closed. Closed date : 2015-06-17 14:20:15.927 Case Resolved cart requested filled new cart #0415302257 06/15/2015,Request for Recycling Cart,Public Works Department,Recycling,Request for Recycling Cart,PWDx_Recycling,PWDx,,,437 Meridian St  East Boston  MA  02128,1.0,09,1.0,A7,East Boston,1.0,Ward 1,108.0,CM,437 Meridian St,2128.0,Address,94595.0,42.3815,-71.0391,Constituent Call,"(42.3815, -71.0391)"
557695,101001366466,04/29/2015 11:46:50 AM,05/20/2015 11:46:50 AM,05/21/2015 02:41:41 PM,OVERDUE,Closed,Case Closed. Closed date : 2015-05-21 14:41:41.353 Case Resolved cart requested filled new cart # 0415302234 05/20/2015,Request for Recycling Cart,Public Works Department,Recycling,Request for Recycling Cart,PWDx_Recycling,PWDx,,,94 G St  South Boston  MA  02127,6.0,05,2.0,C6,South Boston / South Boston Waterfront,5.0,Ward 7,703.0,CD,94 G St,2127.0,Address,61697.0,42.3327,-71.0439,Constituent Call,"(42.3327, -71.0439)"
557768,101001366579,04/29/2015 01:27:26 PM,05/20/2015 01:27:26 PM,06/02/2015 11:38:37 AM,OVERDUE,Closed,Case Closed. Closed date : 2015-06-02 11:38:37.34 Case Resolved cart requested filled new cart # 0415302518 06/01/2015,Request for Recycling Cart,Public Works Department,Recycling,Request for Recycling Cart,PWDx_Recycling,PWDx,,,297 Lexington St  East Boston  MA  02128,1.0,09,1.0,A7,East Boston,1.0,Ward 1,109.0,R3,297 Lexington St,2128.0,Address,85676.0,42.3808,-71.0289,Constituent Call,"(42.3808, -71.0289)"
557834,101001366706,04/29/2015 03:33:03 PM,05/20/2015 03:33:03 PM,06/08/2015 12:07:48 PM,OVERDUE,Closed,Case Closed. Closed date : 2015-06-08 12:07:48.23 Case Resolved cart requested filled new cart #0415302560 06/04/2015,Request for Recycling Cart,Public Works Department,Recycling,Request for Recycling Cart,PWDx_Recycling,PWDx,,,28 Granville St  Dorchester  MA  02124,8.0,07,3.0,C11,Dorchester,7.0,Ward 16,1611.0,R3,28 Granville St,2124.0,Address,243048.0,42.2812,-71.0565,Self Service,"(42.2812, -71.0565)"
557843,101001366716,04/29/2015 03:40:32 PM,05/20/2015 03:40:31 PM,05/13/2015 02:23:45 PM,ONTIME,Closed,Case Closed. Closed date : 2015-05-13 14:23:45.663 Case Resolved cart requested filled new cart #415313005 05/12/15,Request for Recycling Cart,Public Works Department,Recycling,Request for Recycling Cart,PWDx_Recycling,PWDx,,,31 Topliff St  Dorchester  MA  02122,7.0,03,4.0,C11,Dorchester,8.0,Ward 15,1502.0,R3,31 Topliff St,2122.0,Address,136233.0,42.3037,-71.0686,Constituent Call,"(42.3037, -71.0686)"
557885,101001366771,04/29/2015 04:25:09 PM,05/20/2015 04:25:09 PM,05/13/2015 02:18:45 PM,ONTIME,Closed,Case Closed. Closed date : 2015-05-13 14:18:45.98 Case Resolved cart requested filled new cart #0415302307 05/12/15,Request for Recycling Cart,Public Works Department,Recycling,Request for Recycling Cart,PWDx_Recycling,PWDx,,,95 Parkton Rd  Jamaica Plain  MA  02130,9.0,02,6.0,E13,Jamaica Plain,11.0,Ward 10,1009.0,R1,95 Parkton Rd,2130.0,Address,108213.0,42.3217,-71.1148,Constituent Call,"(42.3217, -71.1148)"
557930,101001366827,04/29/2015 05:50:24 PM,05/21/2015 08:30:00 AM,05/18/2015 02:49:27 PM,ONTIME,Closed,Case Closed. Closed date : 2015-05-18 14:49:27.01 Case Resolved request cart filled new cart # 0415302242 05/15/2015,Request for Recycling Cart,Public Works Department,Recycling,Request for Recycling Cart,PWDx_Recycling,PWDx,,,51 Semont Rd  Dorchester  MA  02124,8.0,07,3.0,C11,Dorchester,7.0,Ward 16,1604.0,R3,51 Semont Rd,2124.0,Address,308894.0,42.2909,-71.0608,Self Service,"(42.2909, -71.0608)"
557935,101001366839,04/29/2015 06:04:37 PM,05/21/2015 08:30:00 AM,05/14/2015 01:39:22 PM,ONTIME,Closed,Case Closed. Closed date : 2015-05-14 13:39:22.26 Case Resolved cart request filled new cart #0415302478 05/13/2015,Request for Recycling Cart,Public Works Department,Recycling,Request for Recycling Cart,PWDx_Recycling,PWDx,,,12 Fairview St  Roslindale  MA  02131,9.0,06,5.0,E5,Roslindale,10.0,Ward 20,2004.0,R1,12 Fairview St,2131.0,Address,55864.0,42.2888,-71.131,Self Service,"(42.2888, -71.131)"
557943,101001366850,04/29/2015 06:32:54 PM,05/21/2015 08:30:00 AM,05/29/2015 02:28:01 PM,OVERDUE,Closed,Case Closed. Closed date : 2015-05-29 14:28:01.987 Case Resolved cart requested filled new cart#0415302276 05/27/15,Request for Recycling Cart,Public Works Department,Recycling,Request for Recycling Cart,PWDx_Recycling,PWDx,,,311 Saratoga St  East Boston  MA  02128,1.0,09,1.0,A7,East Boston,1.0,Ward 1,110.0,R3,311 Saratoga St,2128.0,Address,305905.0,42.3783,-71.0314,Self Service,"(42.3783, -71.0314)"
557981,101001366905,04/29/2015 11:13:31 PM,05/21/2015 08:30:00 AM,05/05/2015 07:53:11 AM,ONTIME,Closed,Case Closed. Closed date : 2015-05-05 07:53:11.88 Case Resolved CART REQUESTED FILLED NEW CART #074424064 05/01/2015,Request for Recycling Cart,Public Works Department,Recycling,Request for Recycling Cart,PWDx_Recycling,PWDx,,,249 Roxbury St  Roxbury  MA  02119,7.0,10B,7.0,B2,Roxbury,13.0,Ward 9,905.0,CD,249 Roxbury St,2119.0,Address,119164.0,42.3304,-71.0933,Self Service,"(42.3304, -71.0933)"
558079,101001367050,04/30/2015 09:22:59 AM,05/21/2015 09:22:59 AM,05/25/2015 06:17:54 AM,OVERDUE,Closed,Case Closed. Closed date : 2015-05-25 06:17:54.913 Case Resolved cart # 0415302983 was ropped off on 5/21/15,Request for Recycling Cart,Public Works Department,Recycling,Request for Recycling Cart,PWDx_Recycling,PWDx,,,40 Granger St  Dorchester  MA  02122,7.0,03,3.0,C11,Dorchester,8.0,15,1506.0,,40 Granger St,2122.0,Address,343943.0,42.3024,-71.058,Constituent Call,"(42.3024, -71.058)"
558088,101001367060,04/30/2015 09:27:16 AM,05/21/2015 09:27:16 AM,05/12/2015 01:27:14 PM,ONTIME,Closed,Case Closed. Closed date : 2015-05-12 13:27:14.92 Case Resolved cart requested filled new cart # 0415302588 05/11/2015,Request for Recycling Cart,Public Works Department,Recycling,Request for Recycling Cart,PWDx_Recycling,PWDx,,,99 Glenwood Ave  Hyde Park  MA  02136,12.0,08,5.0,E18,Hyde Park,10.0,Ward 18,1818.0,R1,99 Glenwood Ave,2136.0,Address,64833.0,42.2468,-71.1243,Constituent Call,"(42.2468, -71.1243)"
558218,101001367229,04/30/2015 11:39:02 AM,05/21/2015 11:39:02 AM,05/12/2015 08:57:17 AM,ONTIME,Closed,Case Closed. Closed date : 2015-05-12 08:57:17.757 Duplicate of Existing Case duplicated case reference case # 101001361826,Request for Recycling Cart,Public Works Department,Recycling,Request for Recycling Cart,PWDx_Recycling,PWDx,,,37 Hosmer St  Mattapan  MA  02126,8.0,07,4.0,B3,Greater Mattapan,9.0,Ward 14,1414.0,R3,37 Hosmer St,2126.0,Address,253503.0,42.2804,-71.09,Self Service,"(42.2804, -71.09)"
558256,101001367292,04/30/2015 12:38:46 PM,05/21/2015 12:38:46 PM,06/08/2015 09:38:40 AM,OVERDUE,Closed,Case Closed. Closed date : 2015-06-08 09:38:40.063 Duplicate of Existing Case reference case # 101001367292 06/08/2015,Request for Recycling Cart,Public Works Department,Recycling,Request for Recycling Cart,PWDx_Recycling,PWDx,,,54 Crescent Ave  Dorchester  MA  02125,7.0,03,3.0,C11,Dorchester,7.0,Ward 13,1307.0,CM,54 Crescent Ave,2125.0,Address,44209.0,42.3194,-71.0539,Constituent Call,"(42.3194, -71.0539)"
558266,101001367306,04/30/2015 12:48:45 PM,05/21/2015 12:48:45 PM,06/03/2015 07:53:14 AM,OVERDUE,Closed,Case Closed. Closed date : 2015-06-03 07:53:14.18 Case Invalid House has 3 carts already,Request for Recycling Cart,Public Works Department,Recycling,Request for Recycling Cart,PWDx_Recycling,PWDx,,,6 Michigan Ave  Dorchester  MA  02121,7.0,03,4.0,B3,Greater Mattapan,8.0,Ward 14,1406.0,R2,6 Michigan Ave,2121.0,Address,95172.0,42.303,-71.0836,Constituent Call,"(42.303, -71.0836)"
558276,101001367316,04/30/2015 12:54:18 PM,05/21/2015 12:54:18 PM,05/05/2015 11:28:09 AM,ONTIME,Closed,Case Closed. Closed date : 2015-05-05 11:28:09.363 Case Resolved recycling cart request filled new cart number is #0714423746 05/04/2015,Request for Recycling Cart,Public Works Department,Recycling,Request for Recycling Cart,PWDx_Recycling,PWDx,,,365 Marlborough St  Boston  MA  02115,4.0,1C,8.0,D4,Back Bay,14.0,Ward 5,509.0,CM,365 Marlborough St,2115.0,Address,91087.0,42.3508,-71.0871,Constituent Call,"(42.3508, -71.0871)"
558440,101001367564,04/30/2015 04:36:01 PM,05/21/2015 04:36:01 PM,06/09/2015 12:02:44 PM,OVERDUE,Closed,Case Closed. Closed date : 2015-06-09 12:02:44.223 Case Resolved cart requested filled new cart #0415302641 06/08/2015,Request for Recycling Cart,Public Works Department,Recycling,Request for Recycling Cart,PWDx_Recycling,PWDx,,,7 Dunboy St  Brighton  MA  02135,11.0,04,9.0,D14,Allston / Brighton,15.0,Ward 22,2207.0,A,7 Dunboy St,2135.0,Address,226897.0,42.3524,-71.1646,Self Service,"(42.3524, -71.1646)"
558519,101001367684,04/30/2015 09:11:49 PM,05/22/2015 08:30:00 AM,05/18/2015 02:39:20 PM,ONTIME,Closed,Case Closed. Closed date : 2015-05-18 14:39:20.507 Case Resolved cart requested filled new cart # 0415313669 05/15/2015,Request for Recycling Cart,Public Works Department,Recycling,Request for Recycling Cart,PWDx_Recycling,PWDx,,,16 Ophir St  Jamaica Plain  MA  02130,9.0,02,6.0,E13,Jamaica Plain,11.0,11,1106.0,,16 Ophir St,2130.0,Address,350888.0,42.3594,-71.0587,Self Service,"(0, 0)"
558624,101001367822,05/01/2015 08:11:00 AM,07/01/2015 08:30:00 AM,06/08/2015 11:16:17 AM,ONTIME,Closed,Case Closed. Closed date : 2015-06-08 11:16:17.657 Case Resolved cart requested filled new cart #0415302530 06/04/2015,Request for Recycling Cart,Public Works Department,Recycling,Request for Recycling Cart,PWDx_Recycling,PWDx,,,838 E Broadway  South Boston  MA  02127,6.0,05,2.0,C6,South Boston / South Boston Waterfront,5.0,Ward 6,607.0,CM,838 E Broadway,2127.0,Address,21240.0,42.336,-71.031,Constituent Call,"(42.336, -71.031)"
558699,101001367918,05/01/2015 09:36:37 AM,05/22/2015 09:36:37 AM,05/26/2015 12:18:41 PM,OVERDUE,Closed,Case Closed. Closed date : 2015-05-26 12:18:41.03 Case Resolved cart # 0415302393 dropped off on 5/22/15,Request for Recycling Cart,Public Works Department,Recycling,Request for Recycling Cart,PWDx_Recycling,PWDx,,,100 Leyden St  East Boston  MA  02128,1.0,09,1.0,A7,East Boston,1.0,Ward 1,113.0,R1,100 Leyden St,2128.0,Address,85735.0,42.3894,-71.0083,Constituent Call,"(42.3894, -71.0083)"
558713,101001367942,05/01/2015 09:51:17 AM,05/22/2015 09:51:15 AM,05/14/2015 12:24:58 PM,ONTIME,Closed,Case Closed. Closed date : 2015-05-14 12:24:58.14 Case Resolved cart request filled new cart #0415302386 05/13/2015,Request for Recycling Cart,Public Works Department,Recycling,Request for Recycling Cart,PWDx_Recycling,PWDx,,,19-21 Murray Hill Rd  Roslindale  MA  02131,12.0,02,5.0,E5,Roslindale,10.0,Ward 19,1913.0,R2,19-21 Murray Hill Rd,2131.0,Address,99563.0,42.2872,-71.1264,Constituent Call,"(42.2872, -71.1264)"
558718,101001367947,05/01/2015 09:54:01 AM,05/22/2015 09:54:01 AM,05/25/2015 06:18:32 AM,OVERDUE,Closed,Case Closed. Closed date : 2015-05-25 06:18:32.27 Case Resolved cart # 0415302984 was dropped off on 5/21/15,Request for Recycling Cart,Public Works Department,Recycling,Request for Recycling Cart,PWDx_Recycling,PWDx,,,55 Bakersfield St  Dorchester  MA  02125,7.0,03,3.0,C11,Dorchester,7.0,Ward 13,1306.0,CM,55 Bakersfield St,2125.0,Address,7820.0,42.3163,-71.0617,Constituent Call,"(42.3163, -71.0617)"
558826,101001368107,05/01/2015 12:02:10 PM,05/22/2015 12:02:10 PM,05/13/2015 02:28:24 PM,ONTIME,Closed,Case Closed. Closed date : 2015-05-13 14:28:24.54 Case Resolved cart requested filled new cart #415302304 5/12/15,Request for Recycling Cart,Public Works Department,Recycling,Request for Recycling Cart,PWDx_Recycling,PWDx,,,34 Torrey St  Dorchester  MA  02124,8.0,07,4.0,B3,Dorchester,9.0,Ward 17,1708.0,R1,34 Torrey St,2124.0,Address,136293.0,42.2872,-71.0728,Constituent Call,"(42.2872, -71.0728)"
559117,101001368646,05/02/2015 02:01:00 PM,07/01/2015 08:30:00 AM,08/31/2015 02:47:19 PM,OVERDUE,Closed,Case Closed. Closed date : 2015-08-31 14:47:19.15 Case Resolved cart requested filled new cart #0715671758  08/28/2015,Request for Recycling Cart,Public Works Department,Recycling,Request for Recycling Cart,PWDx_Recycling,PWDx,,,12 Blue Ledge Dr  Roslindale  MA  02131,12.0,06,5.0,E5,Roslindale,10.0,18,1811.0,,12 Blue Ledge Dr,2131.0,Address,354761.0,42.3594,-71.0587,Constituent Call,"(0, 0)"
559119,101001368648,05/02/2015 02:03:00 PM,05/26/2015 08:30:00 AM,05/21/2015 02:45:05 PM,ONTIME,Closed,Case Closed. Closed date : 2015-05-21 14:45:05.827 Case Resolved cart requested filled new cart # 0415302922 05/20/2015,Request for Recycling Cart,Public Works Department,Recycling,Request for Recycling Cart,PWDx_Recycling,PWDx,,,28 Gallivan Blvd  Dorchester  MA  02124,8.0,07,3.0,B3,Dorchester,7.0,Ward 17,1712.0,R1,28 Gallivan Blvd,2124.0,Address,62257.0,42.2786,-71.0776,Constituent Call,"(42.2786, -71.0776)"
559147,101001368692,05/02/2015 03:20:00 PM,07/01/2015 08:30:00 AM,07/29/2015 02:46:52 PM,OVERDUE,Closed,Case Closed. Closed date : 2015-07-29 14:46:52.953 Case Resolved duplicate case reference #101001418473,Request for Recycling Cart,Public Works Department,Recycling,Request for Recycling Cart,PWDx_Recycling,PWDx,,,78 -80 Jamaica St  Jamaica Plain  MA  02130,9.0,02,6.0,E13,Jamaica Plain,11.0,Ward 11,1109.0,,78 -80 Jamaica St,2130.0,Address,172731.0,42.3054,-71.1171,Self Service,"(42.3054, -71.1171)"
559242,101001368848,05/03/2015 10:12:00 AM,05/26/2015 08:30:00 AM,06/02/2015 11:47:58 AM,OVERDUE,Closed,Case Closed. Closed date : 2015-06-02 11:47:58.6 Case Resolved cart requested filled new cart # 0415302519 05/30/2015,Request for Recycling Cart,Public Works Department,Recycling,Request for Recycling Cart,PWDx_Recycling,PWDx,,,61 Waldemar Ave  East Boston  MA  02128,1.0,09,1.0,A7,East Boston,1.0,Ward 1,114.0,R1,61 Waldemar Ave,2128.0,Address,141504.0,42.3914,-71.0007,Constituent Call,"(42.3914, -71.0007)"
559246,101001368858,05/03/2015 10:39:27 AM,05/26/2015 08:30:00 AM,06/02/2015 11:43:28 AM,OVERDUE,Closed,Case Closed. Closed date : 2015-06-02 11:43:28.847 Case Resolved cart requested filled new cart # 0415302524 05/30/2015,Request for Recycling Cart,Public Works Department,Recycling,Request for Recycling Cart,PWDx_Recycling,PWDx,,,15 Hallam St  Dorchester  MA  02125,7.0,03,3.0,C11,Dorchester,7.0,Ward 13,1309.0,R3,15 Hallam St,2125.0,Address,245003.0,42.3141,-71.056,Self Service,"(42.3141, -71.056)"
559266,101001368883,05/03/2015 11:55:21 AM,05/26/2015 08:30:00 AM,05/13/2015 11:46:10 AM,ONTIME,Closed,Case Closed. Closed date : 2015-05-13 11:46:10.637 Case Resolved CART REQUESTED FILLED NEW CART # 0714423750 05/12/2015,Request for Recycling Cart,Public Works Department,Recycling,Request for Recycling Cart,PWDx_Recycling,PWDx,,,68 Hillside St  Mission Hill  MA  02120,9.0,10A,8.0,B2,Mission Hill,14.0,Ward 10,1005.0,R3,68 Hillside St,2120.0,Address,252236.0,42.3301,-71.1021,Self Service,"(42.3301, -71.1021)"
559345,101001369029,05/03/2015 08:21:18 PM,05/26/2015 08:30:00 AM,05/29/2015 02:21:43 PM,OVERDUE,Closed,Case Closed. Closed date : 2015-05-29 14:21:43.75 Case Resolved cart requested filled new cart#0415302372 05/27/15,Request for Recycling Cart,Public Works Department,Recycling,Request for Recycling Cart,PWDx_Recycling,PWDx,,,214-216 Bowdoin St  Dorchester  MA  02125,7.0,03,4.0,C11,Dorchester,8.0,15,1502.0,RC,214-216 Bowdoin St,2125.0,Address,162391.0,42.3054,-71.0683,Self Service,"(42.3054, -71.0683)"
559400,101001369104,05/04/2015 07:10:00 AM,05/26/2015 08:30:00 AM,05/18/2015 02:50:47 PM,ONTIME,Closed,Case Closed. Closed date : 2015-05-18 14:50:47.597 Case Resolved request cart filled new cart # 0415302965  05/15/2015,Request for Recycling Cart,Public Works Department,Recycling,Request for Recycling Cart,PWDx_Recycling,PWDx,,,10 Ginita St  Dorchester  MA  02122,8.0,07,3.0,C11,Dorchester,7.0,Ward 16,1604.0,R3,10 Ginita St,2122.0,Address,63712.0,42.2944,-71.0576,Constituent Call,"(42.2944, -71.0576)"
559441,101001369165,05/04/2015 08:23:00 AM,05/26/2015 08:30:00 AM,05/08/2015 10:03:05 AM,ONTIME,Closed,Case Closed. Closed date : 2015-05-08 10:03:05.143 Case Resolved cart requested filled new cart #0714423577 05/07/2015,Request for Recycling Cart,Public Works Department,Recycling,Request for Recycling Cart,PWDx_Recycling,PWDx,,,140 Harrishof St  Dorchester  MA  02121,9.0,10B,7.0,B2,Roxbury,13.0,Ward 12,1208.0,R4,140 Harrishof St,2121.0,Address,69727.0,42.3173,-71.0908,Constituent Call,"(42.3173, -71.0908)"
559457,101001369192,05/04/2015 08:46:00 AM,05/26/2015 08:46:46 AM,05/12/2015 12:27:54 PM,ONTIME,Closed,Case Closed. Closed date : 2015-05-12 12:27:54.897 Case Resolved cart requested filled new cart # 0415302301 05/11/2015,Request for Recycling Cart,Public Works Department,Recycling,Request for Recycling Cart,PWDx_Recycling,PWDx,,,35 Johnston Rd  Dorchester  MA  02124,8.0,07,4.0,B3,Greater Mattapan,9.0,Ward 14,1411.0,R2,35 Johnston Rd,2124.0,Address,79950.0,42.2877,-71.092,Constituent Call,"(42.2877, -71.092)"
559582,101001369362,05/04/2015 10:35:00 AM,05/26/2015 10:35:06 AM,06/02/2015 11:21:24 AM,OVERDUE,Closed,Case Closed. Closed date : 2015-06-02 11:21:24.917 Case Resolved cart requested filled new cart # 0415302616 6/01/2015,Request for Recycling Cart,Public Works Department,Recycling,Request for Recycling Cart,PWDx_Recycling,PWDx,,,6 Louder's Ln  Jamaica Plain  MA  02130,9.0,02,6.0,E13,Jamaica Plain,11.0,Ward 19,1902.0,R1,6 Louder's Ln,2130.0,Address,87539.0,42.3056,-71.1249,Constituent Call,"(42.3056, -71.1249)"
559591,101001369372,05/04/2015 10:40:00 AM,07/01/2015 10:40:00 AM,06/08/2015 11:16:45 AM,ONTIME,Closed,Case Closed. Closed date : 2015-06-08 11:16:45.127 Case Resolved cart requested filled new cart #0415302646 06/04/2015,Request for Recycling Cart,Public Works Department,Recycling,Request for Recycling Cart,PWDx_Recycling,PWDx,,,849 E First St  South Boston  MA  02127,6.0,05,2.0,C6,South Boston / South Boston Waterfront,5.0,Ward 6,607.0,R3,849 E First St,2127.0,Address,58387.0,42.3381,-71.0303,Constituent Call,"(42.3381, -71.0303)"
559599,101001369382,05/04/2015 10:46:00 AM,05/26/2015 10:46:20 AM,05/14/2015 01:46:14 PM,ONTIME,Closed,Case Closed. Closed date : 2015-05-14 13:46:14.133 Case Resolved cart request filled new cart #0415302344 05/13/2015,Request for Recycling Cart,Public Works Department,Recycling,Request for Recycling Cart,PWDx_Recycling,PWDx,,,15 Windham Rd  Hyde Park  MA  02136,12.0,08,5.0,E18,Hyde Park,10.0,Ward 18,1822.0,R1,15 Windham Rd,2136.0,Address,150662.0,42.272,-71.1255,Constituent Call,"(42.272, -71.1255)"
559677,101001369482,05/04/2015 11:44:43 AM,05/26/2015 11:44:43 AM,05/21/2015 02:42:13 PM,ONTIME,Closed,Case Closed. Closed date : 2015-05-21 14:42:13.903 Case Noted no good street,Request for Recycling Cart,Public Works Department,Recycling,Request for Recycling Cart,PWDx_Recycling,PWDx,,,INTERSECTION of E Broadway & P St  South Boston  MA,6.0,05,2.0,C6,South Boston / South Boston Waterfront,5.0,Ward 6,607.0,,INTERSECTION E Broadway & P St,,Intersection,1990.0,42.3358,-71.0272,Self Service,"(42.3358, -71.0272)"
559679,101001369484,05/04/2015 11:45:02 AM,05/26/2015 11:45:02 AM,05/21/2015 10:33:42 AM,ONTIME,Closed,Case Closed. Closed date : 2015-05-21 10:33:42.067 Case Resolved cart picked up on 5/21/2015,Request for Recycling Cart,Public Works Department,Recycling,Request for Recycling Cart,PWDx_IPL Damaged Cart Replacement,PWDx,https://cityworker.cityofboston.gov:8443/attachments/report/55479404d052eab61a1b8653/photo/Report.jpg,,137 Falcon St  East Boston  MA  02128,1.0,09,1.0,A7,East Boston,1.0,Ward 1,109.0,R3,137 Falcon St,2128.0,Address,233020.0,42.3818,-71.0333,City Worker App,"(42.3818, -71.0333)"
559730,101001369566,05/04/2015 12:26:00 PM,07/01/2015 12:26:00 PM,08/28/2015 01:14:50 PM,OVERDUE,Closed,Case Closed. Closed date : 2015-08-28 13:14:50.43 Case Resolved cart requested filled new cart #0715671580 08/26/2015,Request for Recycling Cart,Public Works Department,Recycling,Request for Recycling Cart,PWDx_Recycling,PWDx,,,115 Dresser St  South Boston  MA  02127,6.0,05,2.0,C6,South Boston / South Boston Waterfront,5.0,06,604.0,RL,115 Dresser St,2127.0,Address,49528.0,42.3373,-71.0442,Self Service,"(42.3373, -71.0442)"
559797,101001369656,05/04/2015 01:46:00 PM,07/01/2015 01:46:00 PM,08/31/2015 02:40:21 PM,OVERDUE,Closed,Case Closed. Closed date : 2015-08-31 14:40:21.253 Case Resolved cart requested filled new cart #0715671372 08/28/2015,Request for Recycling Cart,Public Works Department,Recycling,Request for Recycling Cart,PWDx_Recycling,PWDx,,,117-117A Holton St  Brighton  MA  02135,11.0,04,9.0,D14,Allston / Brighton,15.0,22,2202.0,,117-117A Holton St,2135.0,Address,347396.0,42.3594,-71.0587,Self Service,"(0, 0)"
559805,101001369670,05/04/2015 01:54:00 PM,07/01/2015 01:54:00 PM,06/05/2015 08:34:38 AM,ONTIME,Closed,Case Closed. Closed date : 2015-06-05 08:34:38.62 Case Resolved Cart requested filled new cart #0415313599 05/18/2015,Request for Recycling Cart,Public Works Department,Recycling,Request for Recycling Cart,PWDx_Recycling,PWDx,,,761 VFW Pkwy  West Roxbury  MA  02132,12.0,06,6.0,E5,West Roxbury,12.0,Ward 20,2017.0,R2,761 VFW Pkwy,2132.0,Address,140393.0,42.2922,-71.1656,Constituent Call,"(42.2922, -71.1656)"
559844,101001369730,05/04/2015 02:44:00 PM,05/26/2015 02:44:10 PM,05/29/2015 02:25:41 PM,OVERDUE,Closed,Case Closed. Closed date : 2015-05-29 14:25:41.137 Case Resolved cart requested filled new cart#0415313536 05/27/15,Request for Recycling Cart,Public Works Department,Recycling,Request for Recycling Cart,PWDx_Recycling,PWDx,,,52-54 Mapleton St  Brighton  MA  02135,11.0,04,9.0,D14,Allston / Brighton,15.0,Ward 22,2203.0,R2,52-54 Mapleton St,2135.0,Address,89438.0,42.3519,-71.1488,Constituent Call,"(42.3519, -71.1488)"
559904,101001369814,05/04/2015 03:52:00 PM,05/26/2015 03:52:08 PM,05/08/2015 10:03:47 AM,ONTIME,Closed,Case Closed. Closed date : 2015-05-08 10:03:47.997 Case Resolved cart requested filled new cart #0714423581 0507/15,Request for Recycling Cart,Public Works Department,Recycling,Request for Recycling Cart,PWDx_Recycling,PWDx,,,3 Langford Park  Roxbury  MA  02119,7.0,10B,7.0,B2,Roxbury,13.0,Ward 12,1204.0,CD,3 Langford Park,2119.0,Address,83950.0,42.3222,-71.0798,Constituent Call,"(42.3222, -71.0798)"
559931,101001369861,05/04/2015 04:53:00 PM,07/01/2015 04:53:00 PM,06/05/2015 07:32:14 AM,ONTIME,Closed,Case Closed. Closed date : 2015-06-05 07:32:14.603 Case Resolved Cart requested filled new cart #0415302653 06/02/2015,Request for Recycling Cart,Public Works Department,Recycling,Request for Recycling Cart,PWDx_Recycling,PWDx,,,44 Mapleton St  Brighton  MA  02135,11.0,04,9.0,D14,Allston / Brighton,15.0,Ward 22,2203.0,R2,44 Mapleton St,2135.0,Address,268154.0,42.352,-71.1491,Self Service,"(42.352, -71.1491)"
559938,101001369872,05/04/2015 05:09:00 PM,07/01/2015 08:30:00 AM,06/25/2015 08:15:20 AM,ONTIME,Closed,Case Closed. Closed date : 2015-06-25 08:15:20.357 Case Resolved cart requested filled new cart #0515630413 06/22/2015,Request for Recycling Cart,Public Works Department,Recycling,Request for Recycling Cart,PWDx_Recycling,PWDx,,,60-62 Newton St  Brighton  MA  02135,11.0,04,9.0,D14,Brighton,15.0,22,2211.0,E,60-62 Newton St,2135.0,Address,341465.0,42.3594,-71.0587,Constituent Call,"(0, 0)"
559953,101001369895,05/04/2015 05:37:00 PM,05/27/2015 08:30:00 AM,05/12/2015 12:28:32 PM,ONTIME,Closed,Case Closed. Closed date : 2015-05-12 12:28:32.517 Case Resolved cart requested filled new cart # 0410017098 05/11/2015,Request for Recycling Cart,Public Works Department,Recycling,Request for Recycling Cart,PWDx_Recycling,PWDx,,,41 Favre St  Mattapan  MA  02126,8.0,07,5.0,B3,Greater Mattapan,9.0,Ward 18,1821.0,R2,41 Favre St,2126.0,Address,56760.0,42.2717,-71.0992,Constituent Call,"(42.2717, -71.0992)"
559998,101001369969,05/04/2015 07:15:00 PM,07/01/2015 08:30:00 AM,06/25/2015 08:14:33 AM,ONTIME,Closed,Case Closed. Closed date : 2015-06-25 08:14:33.937 Case Resolved cart requested filled new cart #051563414 06/22/2015,Request for Recycling Cart,Public Works Department,Recycling,Request for Recycling Cart,PWDx_Recycling,PWDx,,,61-63 Surrey St  Brighton  MA  02135,11.0,04,9.0,D14,Allston / Brighton,15.0,Ward 22,2210.0,R3,61-63 Surrey St,2135.0,Address,132808.0,42.3509,-71.1557,Self Service,"(42.3509, -71.1557)"
560020,101001370003,05/04/2015 08:47:00 PM,07/01/2015 08:30:00 AM,06/04/2015 03:05:35 PM,ONTIME,Closed,Case Closed. Closed date : 2015-06-04 15:05:35.6 Case Resolved Cart requested filled new cart #0415302450 05/27/15,Request for Recycling Cart,Public Works Department,Recycling,Request for Recycling Cart,PWDx_Recycling,PWDx,,,18 Maple Leaf Dr  Hyde Park  MA  02136,12.0,08,5.0,E18,Hyde Park,10.0,18,1819.0,RL,18 Maple Leaf Dr,2136.0,Address,89399.0,42.2492,-71.1418,Self Service,"(42.2492, -71.1418)"
560219,101001370304,05/05/2015 10:23:00 AM,05/27/2015 10:23:49 AM,05/21/2015 02:45:48 PM,ONTIME,Closed,Case Closed. Closed date : 2015-05-21 14:45:48.543 Case Resolved cart requested filled new cart # 0415313594 05/20/2015,Request for Recycling Cart,Public Works Department,Recycling,Request for Recycling Cart,PWDx_Recycling,PWDx,,,43 Braeburn Rd  Hyde Park  MA  02136,12.0,08,5.0,E18,Roslindale,10.0,Ward 18,1812.0,R1,43 Braeburn Rd,2136.0,Address,19195.0,42.2606,-71.1277,Constituent Call,"(42.2606, -71.1277)"
560256,101001370353,05/05/2015 10:49:00 AM,05/27/2015 10:49:22 AM,05/14/2015 01:37:02 PM,ONTIME,Closed,Case Closed. Closed date : 2015-05-14 13:37:02.953 Case Resolved cart request filled new cart #0415302380 05/13/2015,Request for Recycling Cart,Public Works Department,Recycling,Request for Recycling Cart,PWDx_Recycling,PWDx,,,35-37 Woodstock Ave  Brighton  MA  02135,11.0,04,9.0,D14,Allston / Brighton,15.0,Ward 21,2108.0,R2,35-37 Woodstock Ave,2135.0,Address,151961.0,42.3456,-71.1376,Constituent Call,"(42.3456, -71.1376)"
560272,101001370372,05/05/2015 10:59:00 AM,05/27/2015 10:59:09 AM,06/02/2015 11:22:21 AM,OVERDUE,Closed,Case Closed. Closed date : 2015-06-02 11:22:21.28 Case Resolved cart requested filled new cart # 0415302620 06/01/2015,Request for Recycling Cart,Public Works Department,Recycling,Request for Recycling Cart,PWDx_Recycling,PWDx,,,1071 Centre St  Jamaica Plain  MA  02130,9.0,02,6.0,E13,Jamaica Plain,11.0,Ward 19,1902.0,R1,1071 Centre St,2130.0,Address,27519.0,42.3037,-71.1252,Constituent Call,"(42.3037, -71.1252)"
560274,101001370374,05/05/2015 11:01:00 AM,05/27/2015 11:01:38 AM,05/21/2015 02:46:13 PM,ONTIME,Closed,Case Closed. Closed date : 2015-05-21 14:46:13.96 Case Resolved cart requested filled new cart # 0415313598 05/20/2015,Request for Recycling Cart,Public Works Department,Recycling,Request for Recycling Cart,PWDx_Recycling,PWDx,,,1575 River St  Hyde Park  MA  02136,12.0,08,5.0,E18,Hyde Park,10.0,Ward 18,1819.0,R1,1575 River St,2136.0,Address,116491.0,42.2485,-71.1325,Constituent Call,"(42.2485, -71.1325)"
560291,101001370401,05/05/2015 11:18:25 AM,05/27/2015 11:18:25 AM,05/18/2015 02:44:44 PM,ONTIME,Closed,Case Closed. Closed date : 2015-05-18 14:44:44.483 Case Resolved request cart filled new cart # 0415302240 05/15/2015,Request for Recycling Cart,Public Works Department,Recycling,Request for Recycling Cart,PWDx_Recycling,PWDx,,,102-104 Litchfield St  Brighton  MA  02135,11.0,04,9.0,D14,Allston / Brighton,15.0,Ward 22,2205.0,R2,102-104 Litchfield St,2135.0,Address,86697.0,42.3617,-71.1401,Constituent Call,"(42.3617, -71.1401)"
560312,101001370431,05/05/2015 11:31:11 AM,05/27/2015 11:31:11 AM,05/12/2015 02:30:02 PM,ONTIME,Closed,Case Closed. Closed date : 2015-05-12 14:30:02.667 Case Resolved no broken cart 5/12/2015,Request for Recycling Cart,Public Works Department,Recycling,Request for Recycling Cart,PWDx_IPL Damaged Cart Replacement,PWDx,https://cityworker.cityofboston.gov:8443/attachments/report/5548e248d052eab61a1b86b0/photo/Report.jpg,,130 Saratoga St  East Boston  MA  02128,1.0,09,1.0,A7,East Boston,1.0,Ward 1,106.0,R3,130 Saratoga St,2128.0,Address,122493.0,42.3771,-71.0355,City Worker App,"(42.3771, -71.0355)"
560323,101001370446,05/05/2015 11:43:00 AM,05/27/2015 11:43:22 AM,05/12/2015 09:41:24 AM,ONTIME,Closed,Case Closed. Closed date : 2015-05-12 09:41:24.473 Case Invalid caller called to cancell this request as there is already a bin there.,Request for Recycling Cart,Public Works Department,Recycling,Request for Recycling Cart,PWDx_Recycling,PWDx,,,22 Sackville St  Charlestown  MA  02129,3.0,1A,1.0,A15,Charlestown,2.0,Ward 2,205.0,R1,22 Sackville St,2129.0,Address,120385.0,42.3812,-71.0649,Constituent Call,"(42.3812, -71.0649)"
560359,101001370502,05/05/2015 12:35:00 PM,05/27/2015 12:35:06 PM,06/02/2015 11:22:55 AM,OVERDUE,Closed,Case Closed. Closed date : 2015-06-02 11:22:55.563 Case Resolved cart requested filled new cart # 0415313682 06/01/2015,Request for Recycling Cart,Public Works Department,Recycling,Request for Recycling Cart,PWDx_Recycling,PWDx,,,25 Hall St  Jamaica Plain  MA  02130,9.0,02,6.0,E13,Jamaica Plain,11.0,Ward 11,1110.0,R2,25 Hall St,2130.0,Address,68128.0,42.3047,-71.1136,Constituent Call,"(42.3047, -71.1136)"
560366,101001370508,05/05/2015 12:39:00 PM,07/01/2015 12:39:00 PM,06/25/2015 09:23:04 AM,ONTIME,Closed,Case Closed. Closed date : 2015-06-25 09:23:04.237 Case Resolved cart requested filled new cart #515630608 06/23/2015,Request for Recycling Cart,Public Works Department,Recycling,Request for Recycling Cart,PWDx_Recycling,PWDx,,,701 E Sixth St  South Boston  MA  02127,6.0,05,2.0,C6,South Boston / South Boston Waterfront,5.0,Ward 6,608.0,R2,701 E Sixth St,2127.0,Address,127773.0,42.333,-71.0323,Constituent Call,"(42.333, -71.0323)"
560367,101001370510,05/05/2015 12:40:00 PM,05/27/2015 12:40:43 PM,05/08/2015 10:04:37 AM,ONTIME,Closed,Case Closed. Closed date : 2015-05-08 10:04:37.443 Case Resolved cart requested filled new cart #0714423582 05/07/2015,Request for Recycling Cart,Public Works Department,Recycling,Request for Recycling Cart,PWDx_Recycling,PWDx,,,74 Mount Pleasant Ave  Roxbury  MA  02119,7.0,10B,7.0,B2,Roxbury,13.0,Ward 8,803.0,R1,74 Mount Pleasant Ave,2119.0,Address,98415.0,42.3261,-71.0782,Constituent Call,"(42.3261, -71.0782)"
560368,101001370511,05/05/2015 12:41:00 PM,05/27/2015 12:41:07 PM,05/06/2015 09:39:49 AM,ONTIME,Closed,Case Closed. Closed date : 2015-05-06 09:39:49.677 Case Resolved New cart dropped on May 6 2014. cart 514#0017105,Request for Recycling Cart,Public Works Department,Recycling,Request for Recycling Cart,PWDx_Recycling,PWDx,,https://cityworker.cityofboston.gov:8443/attachments/report/5548f2b4d0527bbb35855259/closed_photo/Report.jpg,149 Princeton St  East Boston  MA  02128,1.0,09,1.0,A7,East Boston,1.0,Ward 1,106.0,R3,149 Princeton St,2128.0,Address,113177.0,42.3781,-71.0339,Constituent Call,"(42.3781, -71.0339)"
560369,101001370512,05/05/2015 12:42:00 PM,07/01/2015 12:42:00 PM,06/05/2015 07:40:01 AM,ONTIME,Closed,Case Closed. Closed date : 2015-06-05 07:40:01.32 Case Resolved Cart requested filled new cart #0415302488 06/02/2015,Request for Recycling Cart,Public Works Department,Recycling,Request for Recycling Cart,PWDx_Recycling,PWDx,,,151 Princeton St  East Boston  MA  02128,1.0,09,1.0,A7,East Boston,1.0,Ward 1,106.0,R3,151 Princeton St,2128.0,Address,113180.0,42.3782,-71.0338,Constituent Call,"(42.3782, -71.0338)"
560383,101001370528,05/05/2015 12:54:00 PM,05/27/2015 12:54:11 PM,06/03/2015 11:58:54 AM,OVERDUE,Closed,Case Closed. Closed date : 2015-06-03 11:58:54.917 Case Resolved cart requested filled new cart #0415302452 05/27/2015,Request for Recycling Cart,Public Works Department,Recycling,Request for Recycling Cart,PWDx_Recycling,PWDx,,,19 Maxfield St  West Roxbury  MA  02132,12.0,06,6.0,E5,West Roxbury,12.0,Ward 20,2014.0,R1,19 Maxfield St,2132.0,Address,93098.0,42.2805,-71.1547,Constituent Call,"(42.2805, -71.1547)"
560393,101001370543,05/05/2015 01:08:00 PM,07/01/2015 01:08:00 PM,06/08/2015 11:09:44 AM,ONTIME,Closed,Case Closed. Closed date : 2015-06-08 11:09:44.32 Case Resolved cart requested filled new cart #0415302566 06/04/2015,Request for Recycling Cart,Public Works Department,Recycling,Request for Recycling Cart,PWDx_Recycling,PWDx,,,75-77 Clayton St  Dorchester  MA  02122,7.0,03,3.0,C11,Dorchester,8.0,15,1508.0,,75-77 Clayton St,2122.0,Address,346689.0,42.3594,-71.0587,Constituent Call,"(0, 0)"
560445,101001370601,05/05/2015 01:48:34 PM,05/27/2015 01:48:33 PM,06/03/2015 01:14:23 PM,OVERDUE,Closed,Case Closed. Closed date : 2015-06-03 13:14:23.21 Case Resolved cart requested filled new cart #0415302491 05/29/2015,Request for Recycling Cart,Public Works Department,Recycling,Request for Recycling Cart,PWDx_Recycling,PWDx,,,12 Ayles Rd  Hyde Park  MA  02136,12.0,08,5.0,E18,Hyde Park,10.0,Ward 18,1808.0,R1,12 Ayles Rd,2136.0,Address,7301.0,42.2665,-71.1129,Self Service,"(42.2665, -71.1129)"
560538,101001370703,05/05/2015 02:25:51 PM,05/27/2015 02:25:51 PM,06/03/2015 01:15:05 PM,OVERDUE,Closed,Case Closed. Closed date : 2015-06-03 13:15:05.157 Case Resolved cart requested filled new cart #0415302490 05/29/2015,Request for Recycling Cart,Public Works Department,Recycling,Request for Recycling Cart,PWDx_Recycling,PWDx,,,9 Reddy Ave  Hyde Park  MA  02136,12.0,08,5.0,E18,Hyde Park,10.0,Ward 18,1815.0,R2,9 Reddy Ave,2136.0,Address,114988.0,42.2623,-71.1113,Self Service,"(42.2623, -71.1113)"
560625,101001370831,05/05/2015 04:06:00 PM,07/01/2015 04:06:00 PM,06/25/2015 07:44:56 AM,ONTIME,Closed,Case Closed. Closed date : 2015-06-25 07:44:56.05 Case Resolved cart requested filled new cart #0515630363 06/22/2015,Request for Recycling Cart,Public Works Department,Recycling,Request for Recycling Cart,PWDx_Recycling,PWDx,,,338 Pond St  Jamaica Plain  MA  02130,9.0,02,6.0,E13,Jamaica Plain,11.0,19,1902.0,R1,338 Pond St,2130.0,Address,111649.0,42.3103,-71.1287,Self Service,"(42.3103, -71.1287)"
560641,101001370851,05/05/2015 04:20:00 PM,05/27/2015 04:20:07 PM,06/03/2015 01:26:41 PM,OVERDUE,Closed,Case Closed. Closed date : 2015-06-03 13:26:41.353 Case Resolved no good address 05/29/2015,Request for Recycling Cart,Public Works Department,Recycling,Request for Recycling Cart,PWDx_Recycling,PWDx,,,57-81 Grew Ave  Roslindale  MA  02131,12.0,08,5.0,E18,Roslindale,10.0,18,1809.0,CM,57-81 Grew Ave,2131.0,Address,165823.0,42.2758,-71.1225,Constituent Call,"(42.2758, -71.1225)"
560650,101001370867,05/05/2015 04:30:00 PM,07/01/2015 04:30:00 PM,06/04/2015 03:06:30 PM,ONTIME,Closed,Case Closed. Closed date : 2015-06-04 15:06:30.07 Case Resolved Cart requested filled new cart #0415302349 05/27/15,Request for Recycling Cart,Public Works Department,Recycling,Request for Recycling Cart,PWDx_Recycling,PWDx,,,66 Oak St  Hyde Park  MA  02136,12.0,08,5.0,E18,Hyde Park,10.0,Ward 18,1818.0,R1,66 Oak St,2136.0,Address,104625.0,42.2539,-71.1204,Self Service,"(42.2539, -71.1204)"
560659,101001370884,05/05/2015 04:39:00 PM,07/01/2015 04:39:00 PM,09/01/2015 12:05:56 PM,OVERDUE,Closed,Case Closed. Closed date : 2015-09-01 12:05:56.01 Case Resolved new cart requested new cart #0715671177 08/31/2015,Request for Recycling Cart,Public Works Department,Recycling,Request for Recycling Cart,PWDx_Recycling,PWDx,,,66 Donnybrook Rd  Brighton  MA  02135,11.0,04,9.0,D14,Allston / Brighton,15.0,Ward 22,2210.0,R2,66 Donnybrook Rd,2135.0,Address,224535.0,42.3545,-71.1615,Employee Generated,"(42.3545, -71.1615)"
560764,101001371054,05/06/2015 12:14:22 AM,05/28/2015 08:30:00 AM,06/02/2015 11:32:43 AM,OVERDUE,Closed,Case Closed. Closed date : 2015-06-02 11:32:43.593 Case Resolved cart requested filled new cart # 0415302614 06/01/2015,Request for Recycling Cart,Public Works Department,Recycling,Request for Recycling Cart,PWDx_Recycling,PWDx,,,171 Bigelow St  Brighton  MA  02135,11.0,04,9.0,D14,Allston / Brighton,15.0,Ward 22,2207.0,R1,171 Bigelow St,2135.0,Address,15402.0,42.3557,-71.1649,Self Service,"(42.3557, -71.1649)"
560836,101001371132,05/06/2015 08:05:00 AM,07/01/2015 08:30:00 AM,08/31/2015 02:46:27 PM,OVERDUE,Closed,Case Closed. Closed date : 2015-08-31 14:46:27.537 Case Resolved broken cart swapped new cart # 5150029608,Request for Recycling Cart,Public Works Department,Recycling,Request for Recycling Cart,PWDx_Recycling,PWDx,,,490 Truman Hwy  Hyde Park  MA  02136,12.0,08,5.0,E18,Hyde Park,10.0,18,1816.0,R2,490 Truman Hwy,2136.0,Address,154850.0,42.2576,-71.1128,Constituent Call,"(42.2576, -71.1128)"
560973,101001371323,05/06/2015 10:22:36 AM,05/28/2015 10:22:23 AM,05/14/2015 10:03:26 AM,ONTIME,Closed,Case Closed. Closed date : 2015-05-14 10:03:26.793 Case Resolved cart requested filled new cart#0614403074 05/13/2015,Request for Recycling Cart,Public Works Department,Recycling,Request for Recycling Cart,PWDx_Recycling,PWDx,,,20 Sullivan St  Charlestown  MA  02129,3.0,1A,1.0,A15,Charlestown,2.0,Ward 2,206.0,CD,20 Sullivan St,2129.0,Address,131802.0,42.3782,-71.0667,Self Service,"(42.3782, -71.0667)"
560976,101001371331,05/06/2015 10:28:00 AM,05/28/2015 10:28:40 AM,05/12/2015 03:21:51 PM,ONTIME,Closed,Case Closed. Closed date : 2015-05-12 15:21:51.373 Case Resolved cart requested filled new cart #0714423592 05/11/2015,Request for Recycling Cart,Public Works Department,Recycling,Request for Recycling Cart,PWDx_Recycling,PWDx,,,65 Clifford St  Roxbury  MA  02119,9.0,10B,7.0,B2,Roxbury,13.0,Ward 12,1204.0,R3,65 Clifford St,2119.0,Address,33976.0,42.3191,-71.0785,Constituent Call,"(42.3191, -71.0785)"
560993,101001371353,05/06/2015 10:42:00 AM,05/28/2015 10:42:36 AM,05/21/2015 02:43:41 PM,ONTIME,Closed,Case Closed. Closed date : 2015-05-21 14:43:41.053 Case Resolved cart requested filled new cart # 0415302919 05/20/2015,Request for Recycling Cart,Public Works Department,Recycling,Request for Recycling Cart,PWDx_Recycling,PWDx,,,411-413 E Fifth St  South Boston  MA  02127,6.0,05,2.0,C6,South Boston / South Boston Waterfront,5.0,Ward 7,703.0,R2,411-413 E Fifth St,2127.0,Address,57779.0,42.3337,-71.0432,Constituent Call,"(42.3337, -71.0432)"
561038,101001371423,05/06/2015 11:21:00 AM,05/28/2015 11:21:41 AM,06/04/2015 02:58:07 PM,OVERDUE,Closed,Case Closed. Closed date : 2015-06-04 14:58:07.44 Case Resolved Cart requested filled new cart #0415302456 06/03/2015,Damaged Cart - New Request,Public Works Department,Recycling,Request for Recycling Cart,PWDx_IPL Damaged Cart Replacement,PWDx,,,41 Stockton St  Dorchester  MA  02124,8.0,07,4.0,B3,Dorchester,9.0,Ward 17,1710.0,R3,41 Stockton St,2124.0,Address,130771.0,42.2827,-71.0742,Employee Generated,"(42.2827, -71.0742)"
561080,101001371485,05/06/2015 12:18:00 PM,05/28/2015 12:18:10 PM,05/14/2015 01:39:49 PM,ONTIME,Closed,Case Closed. Closed date : 2015-05-14 13:39:49.77 Case Resolved cart request filled new cart #0415302479 05/13/2015,Request for Recycling Cart,Public Works Department,Recycling,Request for Recycling Cart,PWDx_Recycling,PWDx,,,30-32 Guernsey St  Roslindale  MA  02131,9.0,06,6.0,E5,Roslindale,10.0,Ward 20,2007.0,R2,30-32 Guernsey St,2131.0,Address,67672.0,42.2884,-71.1421,Constituent Call,"(42.2884, -71.1421)"
561174,101001371640,05/06/2015 01:53:00 PM,07/01/2015 01:53:00 PM,06/05/2015 07:30:34 AM,ONTIME,Closed,Case Closed. Closed date : 2015-06-05 07:30:34.32 Case Resolved Cart requested filled new cart #0415302454 06/02/2015,Request for Recycling Cart,Public Works Department,Recycling,Request for Recycling Cart,PWDx_Recycling,PWDx,,,109 Rockview St  Jamaica Plain  MA  02130,9.0,02,6.0,E13,Jamaica Plain,11.0,Ward 19,1906.0,CD,109 Rockview St,2130.0,Address,117841.0,42.313,-71.1113,Self Service,"(42.313, -71.1113)"
561268,101001371783,05/06/2015 03:42:00 PM,05/28/2015 03:42:34 PM,05/15/2015 11:35:13 AM,ONTIME,Closed,Case Closed. Closed date : 2015-05-15 11:35:13.94 Case Resolved cart requested new cart# 0415302974 05/14/2015,Request for Recycling Cart,Public Works Department,Recycling,Request for Recycling Cart,PWDx_Recycling,PWDx,,,40 Catherine St  Roslindale  MA  02131,12.0,02,6.0,E13,Jamaica Plain,10.0,Ward 19,1912.0,R2,40 Catherine St,2131.0,Address,26456.0,42.2884,-71.115,Constituent Call,"(42.2884, -71.115)"
561382,101001371982,05/06/2015 09:05:03 PM,05/29/2015 08:30:00 AM,06/02/2015 11:44:52 AM,OVERDUE,Closed,Case Closed. Closed date : 2015-06-02 11:44:52.613 Case Resolved cart requested filled new cart # 0415302523 05/30/2015,Request for Recycling Cart,Public Works Department,Recycling,Request for Recycling Cart,PWDx_Recycling,PWDx,,,23 Saxton St  Dorchester  MA  02125,7.0,03,3.0,C11,Dorchester,7.0,Ward 13,1310.0,R2,23 Saxton St,2125.0,Address,306935.0,42.3131,-71.0543,Self Service,"(42.3131, -71.0543)"
561439,101001372050,05/07/2015 02:23:37 AM,05/29/2015 08:30:00 AM,06/03/2015 08:08:04 AM,OVERDUE,Closed,Case Closed. Closed date : 2015-06-03 08:08:04.12 Duplicate of Existing Case Case address is already on the list for delivery.,Request for Recycling Cart,Public Works Department,Recycling,Request for Recycling Cart,PWDx_Recycling,PWDx,,,11 Goldsmith St  Jamaica Plain  MA  02130,9.0,02,6.0,E13,Jamaica Plain,11.0,Ward 19,1909.0,CM,11 Goldsmith St,2130.0,Address,65135.0,42.3084,-71.1192,Self Service,"(42.3084, -71.1192)"
561480,101001372106,05/07/2015 07:46:00 AM,05/29/2015 08:30:00 AM,05/21/2015 02:39:02 PM,ONTIME,Closed,Case Closed. Closed date : 2015-05-21 14:39:02.127 Case Resolved cart requested filled new cart # 0415302904 05/20/2015,Request for Recycling Cart,Public Works Department,Recycling,Request for Recycling Cart,PWDx_Recycling,PWDx,,,15 Stanley St  Dorchester  MA  02125,7.0,03,3.0,C11,Dorchester,8.0,Ward 15,1501.0,R2,15 Stanley St,2125.0,Address,313945.0,42.3113,-71.0685,Constituent Call,"(42.3113, -71.0685)"
561499,101001372134,05/07/2015 08:12:00 AM,05/29/2015 08:30:00 AM,05/14/2015 01:47:55 PM,ONTIME,Closed,Case Closed. Closed date : 2015-05-14 13:47:55.747 Case Resolved cart request filled new cart #0415302343 05/13/2015,Request for Recycling Cart,Public Works Department,Recycling,Request for Recycling Cart,PWDx_Recycling,PWDx,,,75 Everett St  East Boston  MA  02128,1.0,09,1.0,A7,East Boston,1.0,Ward 1,101.0,R3,75 Everett St,2128.0,Address,55172.0,42.3674,-71.0349,Constituent Call,"(42.3674, -71.0349)"
561550,101001372225,05/07/2015 09:12:00 AM,07/01/2015 09:12:00 AM,06/08/2015 11:10:18 AM,ONTIME,Closed,Case Closed. Closed date : 2015-06-08 11:10:18.673 Case Resolved cart requested filled new cart #0415302535 06/04/2015,Request for Recycling Cart,Public Works Department,Recycling,Request for Recycling Cart,PWDx_Recycling,PWDx,,,17 E Cottage St  Dorchester  MA  02125,7.0,03,7.0,B2,Roxbury,13.0,Ward 8,805.0,R3,17 E Cottage St,2125.0,Address,219750.0,42.3213,-71.0709,Constituent Call,"(42.3213, -71.0709)"
561583,101001372270,05/07/2015 09:45:00 AM,05/29/2015 09:45:30 AM,05/15/2015 11:54:49 AM,ONTIME,Closed,Case Closed. Closed date : 2015-05-15 11:54:49.017 Case Resolved cart requested new cart#0415302511 05/14/2015,Request for Recycling Cart,Public Works Department,Recycling,Request for Recycling Cart,PWDx_Recycling,PWDx,,,385 Ashmont St  Dorchester  MA  02124,8.0,07,3.0,C11,Dorchester,7.0,Ward 16,1608.0,R2,385 Ashmont St,2124.0,Address,5410.0,42.2874,-71.0571,Constituent Call,"(42.2874, -71.0571)"
561595,101001372294,05/07/2015 09:57:00 AM,05/29/2015 09:57:10 AM,05/12/2015 03:23:28 PM,ONTIME,Closed,Case Closed. Closed date : 2015-05-12 15:23:28.707 Case Resolved cart requested filled new cart #0714423589 05/11/2015,Request for Recycling Cart,Public Works Department,Recycling,Request for Recycling Cart,PWDx_Recycling,PWDx,,,191 Commonwealth Ave  Boston  MA  02116,4.0,1C,8.0,D4,Back Bay,14.0,Ward 5,507.0,CM,191 Commonwealth Ave,2116.0,Address,38920.0,42.3518,-71.0803,Constituent Call,"(42.3518, -71.0803)"
561756,101001372547,05/07/2015 12:04:40 PM,05/29/2015 12:04:40 PM,05/13/2015 11:47:06 AM,ONTIME,Closed,Case Closed. Closed date : 2015-05-13 11:47:06.523 Case Resolved CART REQUESTED FILLED NEW CART # 0614403071 05/12/2015,Request for Recycling Cart,Public Works Department,Recycling,Request for Recycling Cart,PWDx_Recycling,PWDx,,,33 Symphony Rd  Boston  MA  02115,4.0,10A,8.0,D4,Boston,14.0,04,407.0,A,33 Symphony Rd,2115.0,Address,133485.0,42.3431,-71.0881,Constituent Call,"(42.3431, -71.0881)"
561764,101001372564,05/07/2015 12:10:00 PM,05/29/2015 12:10:15 PM,05/18/2015 02:42:17 PM,ONTIME,Closed,Case Closed. Closed date : 2015-05-18 14:42:17.873 Case Resolved request cart filled new cart # 0415313673 05/14/2015,Request for Recycling Cart,Public Works Department,Recycling,Request for Recycling Cart,PWDx_Recycling,PWDx,,,1068-1074 Dorchester Ave  Dorchester  MA  02125,7.0,03,3.0,C11,Dorchester,7.0,Ward 13,1309.0,C,1068-1074 Dorchester Ave,2125.0,Address,48185.0,42.3143,-71.0567,Constituent Call,"(42.3143, -71.0567)"
561801,101001372616,05/07/2015 01:02:00 PM,07/01/2015 01:02:00 PM,06/25/2015 09:03:15 AM,ONTIME,Closed,Case Closed. Closed date : 2015-06-25 09:03:15.517 Case Resolved cart requested filled new cart #0515630132 06/23/2015,Request for Recycling Cart,Public Works Department,Recycling,Request for Recycling Cart,PWDx_Recycling,PWDx,,,26 Montcalm Ave  Brighton  MA  02135,11.0,04,9.0,D14,Allston / Brighton,15.0,Ward 22,2206.0,R2,26 Montcalm Ave,2135.0,Address,167768.0,42.3527,-71.1468,Constituent Call,"(42.3527, -71.1468)"
561847,101001372689,05/07/2015 01:53:00 PM,05/29/2015 01:53:21 PM,06/03/2015 01:08:36 PM,OVERDUE,Closed,Case Closed. Closed date : 2015-06-03 13:08:36.767 Case Resolved cart requested filled new cart #0415302657 05/29/2015,Request for Recycling Cart,Public Works Department,Recycling,Request for Recycling Cart,PWDx_Recycling,PWDx,,,17 Annabel St  Dorchester  MA  02125,7.0,03,7.0,C11,Dorchester,13.0,Ward 7,710.0,R1,17 Annabel St,2125.0,Address,3625.0,42.3181,-71.0626,Constituent Call,"(42.3181, -71.0626)"
561862,101001372711,05/07/2015 02:18:00 PM,07/07/2015 02:18:00 PM,08/17/2015 08:15:58 AM,OVERDUE,Closed,Case Closed. Closed date : 2015-08-17 08:15:58.003 Case Resolved cart requested filled new cart #0715671389 08/13/2015,Request for Recycling Cart,Public Works Department,Recycling,Request for Recycling Cart,PWDx_Recycling,PWDx,,,39 H St  South Boston  MA  02127,6.0,05,2.0,C6,South Boston / South Boston Waterfront,5.0,Ward 6,605.0,CD,39 H St,2127.0,Address,67878.0,42.3366,-71.0418,Self Service,"(42.3366, -71.0418)"
561880,101001372737,05/07/2015 02:44:00 PM,05/29/2015 02:44:29 PM,05/21/2015 02:44:11 PM,ONTIME,Closed,Case Closed. Closed date : 2015-05-21 14:44:11.75 Case Resolved cart requested filled new cart # 0415302231 05/20/2015,Request for Recycling Cart,Public Works Department,Recycling,Request for Recycling Cart,PWDx_Recycling,PWDx,,,445 E Sixth St  South Boston  MA  02127,6.0,05,2.0,C6,South Boston / South Boston Waterfront,5.0,Ward 7,703.0,R1,445 E Sixth St,2127.0,Address,127541.0,42.3329,-71.0426,Constituent Call,"(42.3329, -71.0426)"
561881,101001372739,05/07/2015 02:45:00 PM,07/07/2015 02:45:00 PM,06/05/2015 07:36:24 AM,ONTIME,Closed,Case Closed. Closed date : 2015-06-05 07:36:24.397 Case Resolved Cart requested filled new cart #0415302377 06/02/2015,Request for Recycling Cart,Public Works Department,Recycling,Request for Recycling Cart,PWDx_Recycling,PWDx,,,26 Alpha Rd  Dorchester  MA  02124,8.0,07,4.0,C11,Dorchester,9.0,Ward 17,1703.0,R2,26 Alpha Rd,2124.0,Address,2834.0,42.2958,-71.0684,Constituent Call,"(42.2958, -71.0684)"
561905,101001372780,05/07/2015 03:34:00 PM,07/07/2015 03:34:00 PM,08/20/2015 12:34:17 PM,OVERDUE,Closed,Case Closed Case Invalid  need a address,Request for Recycling Cart,Public Works Department,Recycling,Request for Recycling Cart,PWDx_Recycling,PWDx,,,INTERSECTION of Ashcroft St & Halifax St  Jamaica Plain  MA,9.0,02,6.0,E13,Jamaica Plain,11.0,Ward 19,1903.0,,INTERSECTION Ashcroft St & Halifax St,,Intersection,625.0,42.3206,-71.114,Self Service,"(42.3206, -71.114)"
561932,101001372825,05/07/2015 04:24:00 PM,07/07/2015 04:24:00 PM,07/24/2015 02:40:20 PM,OVERDUE,Closed,Case Closed. Closed date : 2015-07-24 14:40:20.8 Case Resolved Cart requested filled new cart #0715671855 07/23/2015,Request for Recycling Cart,Public Works Department,Recycling,Request for Recycling Cart,PWDx_Recycling,PWDx,,,364 Gallivan Blvd  Dorchester  MA  02124,8.0,07,3.0,C11,Dorchester,7.0,Ward 16,1611.0,R1,364 Gallivan Blvd,2124.0,Address,62285.0,42.281,-71.0628,Constituent Call,"(42.281, -71.0628)"
562003,101001372941,05/07/2015 07:03:00 PM,07/07/2015 08:30:00 AM,07/07/2015 03:21:22 PM,OVERDUE,Closed,Case Closed. Closed date : 2015-07-07 15:21:22.843 Case Resolved cart requested filled new cart # 0615611029 07/06/2015,Request for Recycling Cart,Public Works Department,Recycling,Request for Recycling Cart,PWDx_Recycling,PWDx,,,7-11 Wilbert Cir  Dorchester  MA  02124,8.0,07,4.0,B3,Greater Mattapan,9.0,Ward 14,1409.0,A,7-11 Wilbert Cir,2124.0,Address,155406.0,42.2942,-71.0911,Constituent Call,"(42.2942, -71.0911)"
562110,101001373097,05/08/2015 08:29:00 AM,06/01/2015 08:30:00 AM,05/13/2015 11:47:36 AM,ONTIME,Closed,Case Closed. Closed date : 2015-05-13 11:47:36.543 Case Resolved CART REQUESTED FILLED NEW CART # 0714423588 05/12/2015,Request for Recycling Cart,Public Works Department,Recycling,Request for Recycling Cart,PWDx_Recycling,PWDx,,,17 Burney St  Mission Hill  MA  02120,9.0,10A,8.0,B2,Mission Hill,14.0,Ward 10,1002.0,R3,17 Burney St,2120.0,Address,23883.0,42.3317,-71.0998,Constituent Call,"(42.3317, -71.0998)"
562180,101001373212,05/08/2015 09:31:00 AM,07/08/2015 09:31:00 AM,07/15/2015 11:43:52 AM,OVERDUE,Closed,Case Closed. Closed date : 2015-07-15 11:43:52.98 Case Resolved cart requested filled new cart #0515630592 07/14/2015,Request for Recycling Cart,Public Works Department,Recycling,Request for Recycling Cart,PWDx_Recycling,PWDx,,,12 Mason St  Hyde Park  MA  02136,12.0,08,5.0,E18,Hyde Park,10.0,Ward 18,1818.0,R2,12 Mason St,2136.0,Address,91908.0,42.2478,-71.1266,Self Service,"(42.2478, -71.1266)"
562207,101001373253,05/08/2015 10:00:14 AM,06/01/2015 10:00:14 AM,06/03/2015 08:45:15 AM,OVERDUE,Closed,Case Closed. Closed date : 2015-06-03 08:45:15.687 Duplicate of Existing Case,Request for Recycling Cart,Public Works Department,Recycling,Request for Recycling Cart,PWDx_Recycling,PWDx,,,14 Emerson St  South Boston  MA  02127,6.0,05,2.0,C6,South Boston / South Boston Waterfront,5.0,Ward 6,605.0,E,14 Emerson St,2127.0,Address,53553.0,42.3367,-71.0435,Self Service,"(42.3367, -71.0435)"
562375,101001373503,05/08/2015 01:51:00 PM,06/01/2015 01:51:10 PM,05/18/2015 02:43:06 PM,ONTIME,Closed,Case Closed. Closed date : 2015-05-18 14:43:06.243 Case Resolved request cart filled new cart # 0415302241 05/14/2015,Request for Recycling Cart,Public Works Department,Recycling,Request for Recycling Cart,PWDx_Recycling,PWDx,,,35 Elton St  Dorchester  MA  02125,7.0,03,3.0,C11,Dorchester,7.0,Ward 13,1309.0,R2,35 Elton St,2125.0,Address,164986.0,42.3135,-71.0553,Constituent Call,"(42.3135, -71.0553)"
562397,101001373539,05/08/2015 02:39:00 PM,06/01/2015 02:39:01 PM,05/18/2015 02:53:13 PM,ONTIME,Closed,Case Closed. Closed date : 2015-05-18 14:53:13.793 Case Resolved request cart filled new cart # 0415302237  05/15/2015,Request for Recycling Cart,Public Works Department,Recycling,Request for Recycling Cart,PWDx_Recycling,PWDx,,,1052 Bennington St  East Boston  MA  02128,1.0,09,1.0,A7,East Boston,1.0,Ward 1,113.0,R3,1052 Bennington St,2128.0,Address,187199.0,42.3875,-71.005,Self Service,"(42.3875, -71.005)"
562458,101001373625,05/08/2015 04:08:00 PM,06/01/2015 04:08:14 PM,05/18/2015 02:53:40 PM,ONTIME,Closed,Case Closed. Closed date : 2015-05-18 14:53:40.59 Case Resolved request cart filled new cart # 0415302238 05/15/15,Request for Recycling Cart,Public Works Department,Recycling,Request for Recycling Cart,PWDx_Recycling,PWDx,,,23 Beachview Rd  East Boston  MA  02128,1.0,09,1.0,A7,East Boston,1.0,Ward 1,114.0,R2,23 Beachview Rd,2128.0,Address,9432.0,42.3907,-71.0026,Constituent Call,"(42.3907, -71.0026)"
562467,101001373634,05/08/2015 04:21:00 PM,06/01/2015 04:21:23 PM,05/15/2015 11:39:11 AM,ONTIME,Closed,Case Closed. Closed date : 2015-05-15 11:39:11.957 Case Resolved cart requested new cart#04152943 05/14/2015,Request for Recycling Cart,Public Works Department,Recycling,Request for Recycling Cart,PWDx_Recycling,PWDx,,,75-77 Clayton St  Dorchester  MA  02122,7.0,03,3.0,C11,Dorchester,8.0,15,1508.0,,75-77 Clayton St,2122.0,Address,346689.0,42.3594,-71.0587,Constituent Call,"(0, 0)"
562476,101001373647,05/08/2015 04:45:00 PM,06/01/2015 04:45:10 PM,05/15/2015 11:52:34 AM,ONTIME,Closed,Case Closed. Closed date : 2015-05-15 11:52:34.827 Case Resolved cart requested new cart#0415302973 05/15/2015,Request for Recycling Cart,Public Works Department,Recycling,Request for Recycling Cart,PWDx_Recycling,PWDx,,,363 Poplar St  Roslindale  MA  02131,12.0,06,5.0,E5,Roslindale,10.0,Ward 18,1809.0,R1,363 Poplar St,2131.0,Address,111850.0,42.2783,-71.124,Constituent Call,"(42.2783, -71.124)"
562561,101001373772,05/09/2015 10:03:00 AM,06/02/2015 08:30:00 AM,05/15/2015 12:13:43 PM,ONTIME,Closed,Case Closed. Closed date : 2015-05-15 12:13:43.447 Case Resolved cart requested new cart#0614403075 05/15/2015,Request for Recycling Cart,Public Works Department,Recycling,Request for Recycling Cart,PWDx_Recycling,PWDx,,,345 Marlborough St  Boston  MA  02115,4.0,1C,8.0,D4,Back Bay,14.0,Ward 5,509.0,RC,345 Marlborough St,2115.0,Address,91006.0,42.3511,-71.0859,Constituent Call,"(42.3511, -71.0859)"
562638,101001373891,05/09/2015 03:33:00 PM,07/08/2015 08:30:00 AM,07/01/2015 09:46:53 AM,ONTIME,Closed,Case Closed. Closed date : 2015-07-01 09:46:53.23 Case Resolved cart requested filled new cart #0615611095 06/29/2015,Request for Recycling Cart,Public Works Department,Recycling,Request for Recycling Cart,PWDx_Recycling,PWDx,,,63 Parsons St  Brighton  MA  02135,11.0,04,9.0,D14,Allston / Brighton,15.0,Ward 22,2203.0,CD,63 Parsons St,2135.0,Address,108359.0,42.352,-71.1544,Self Service,"(42.352, -71.1544)"
562650,101001373906,05/09/2015 04:04:00 PM,06/02/2015 08:30:00 AM,05/15/2015 12:12:52 PM,ONTIME,Closed,Case Closed. Closed date : 2015-05-15 12:12:52.31 Case Resolved cart requested new cart#0714423741 05/14/2015,Request for Recycling Cart,Public Works Department,Recycling,Request for Recycling Cart,PWDx_Recycling,PWDx,,,19 Brinton St  Roxbury  MA  02119,9.0,10B,7.0,B2,Roxbury,13.0,11,1103.0,,19 Brinton St,2119.0,Address,347053.0,42.3594,-71.0587,Constituent Call,"(0, 0)"
562726,101001374048,05/10/2015 10:57:37 AM,06/02/2015 08:30:00 AM,05/15/2015 11:39:42 AM,ONTIME,Closed,Case Closed. Closed date : 2015-05-15 11:39:42.28 Case Resolved cart requested new cart#04152513 05/14/2015,Request for Recycling Cart,Public Works Department,Recycling,Request for Recycling Cart,PWDx_Recycling,PWDx,,,145 Pleasant St  Dorchester  MA  02125,7.0,03,3.0,C11,Dorchester,7.0,Ward 13,1306.0,R3,145 Pleasant St,2125.0,Address,111170.0,42.3107,-71.0598,Self Service,"(42.3107, -71.0598)"
562738,101001374068,05/10/2015 11:39:26 AM,06/02/2015 08:30:00 AM,05/14/2015 10:25:07 AM,ONTIME,Closed,Case Closed. Closed date : 2015-05-14 10:25:07.303 Case Resolved cart request filled new cart # 0614403074 05/13/2015,Request for Recycling Cart,Public Works Department,Recycling,Request for Recycling Cart,PWDx_Recycling,PWDx,,,12 Salem Street Ave  Charlestown  MA  02129,3.0,1A,1.0,A15,Charlestown,2.0,Ward 2,206.0,R3,12 Salem Street Ave,2129.0,Address,305354.0,42.378,-71.0662,Self Service,"(42.378, -71.0662)"
563028,101001374551,05/11/2015 10:41:00 AM,07/11/2015 10:41:00 AM,07/08/2015 02:23:23 PM,ONTIME,Closed,Case Closed. Closed date : 2015-07-08 14:23:23.197 Case Resolved cart requested filled new cart #0515610994 07/07/2015,Request for Recycling Cart,Public Works Department,Recycling,Request for Recycling Cart,PWDx_Recycling,PWDx,,,6 Grovenor Rd  Jamaica Plain  MA  02130,9.0,02,6.0,E13,Jamaica Plain,11.0,Ward 19,1905.0,R3,6 Grovenor Rd,2130.0,Address,244568.0,42.3141,-71.1145,Self Service,"(42.3141, -71.1145)"
