,CASE_ENQUIRY_ID,OPEN_DT,TARGET_DT,CLOSED_DT,OnTime_Status,CASE_STATUS,CLOSURE_REASON,CASE_TITLE,SUBJECT,REASON,TYPE,QUEUE,Department,SubmittedPhoto,ClosedPhoto,Location,fire_district,pwd_district,city_council_district,police_district,neighborhood,neighborhood_services_district,ward,precinct,land_usage,LOCATION_STREET_NAME,LOCATION_ZIPCODE,Property_Type,Property_ID,LATITUDE,LONGITUDE,Source,Geocoded_Location
573966,101001400427,06/02/2015 09:54:00 AM,06/03/2015 09:54:30 AM,06/02/2015 02:39:15 PM,ONTIME,Closed,Case Closed. Closed date : 2015-06-02 14:39:15.73 Case Resolved found online normal operation. Further questions please call 617-635-3126. TY Dominic,Traffic Signal Inspection,Transportation - Traffic Division,Signs & Signals,Traffic Signal Inspection,BTDT_Traffic Signal_Repair,BTDT,,,INTERSECTION of E Broadway & Dorchester St  South Boston  MA,6.0,05,2.0,C6,South Boston / South Boston Waterfront,5.0,Ward 6,604.0,,INTERSECTION E Broadway & Dorchester St,,Intersection,1981.0,42.3355,-71.0455,Constituent Call,"(42.3355, -71.0455)"
601489,101001439635,07/29/2015 04:00:00 PM,07/30/2015 04:00:20 PM,08/04/2015 06:49:42 AM,OVERDUE,Closed,Case Closed. Closed date : 2015-08-04 06:49:42.69 Case Resolved,Traffic Signal Inspection,Transportation - Traffic Division,Signs & Signals,Traffic Signal Inspection,BTDT_Traffic Signal_Repair,BTDT,,,INTERSECTION of Faneuil St & Parsons St  Brighton  MA,11.0,04,9.0,D14,Allston / Brighton,15.0,Ward 22,2211.0,,INTERSECTION Faneuil St & Parsons St,,Intersection,4792.0,42.3553,-71.1562,Constituent Call,"(42.3553, -71.1562)"
601502,101001439650,07/29/2015 04:23:00 PM,07/30/2015 04:23:03 PM,08/04/2015 06:49:24 AM,OVERDUE,Closed,Case Closed. Closed date : 2015-08-04 06:49:24.977 Case Resolved,Traffic Signal Inspection,Transportation - Traffic Division,Signs & Signals,Traffic Signal Inspection,BTDT_Traffic Signal_Repair,BTDT,,,INTERSECTION of Faneuil St & Parsons St  Brighton  MA,11.0,04,9.0,D14,Allston / Brighton,15.0,Ward 22,2211.0,,INTERSECTION Faneuil St & Parsons St,,Intersection,4792.0,42.3553,-71.1562,Constituent Call,"(42.3553, -71.1562)"
601510,101001439663,07/29/2015 04:40:00 PM,07/30/2015 04:40:58 PM,08/04/2015 06:49:01 AM,OVERDUE,Closed,Case Closed. Closed date : 2015-08-04 06:49:01.917 Case Resolved,Traffic Signal Inspection,Transportation - Traffic Division,Signs & Signals,Traffic Signal Inspection,BTDT_Traffic Signal_Repair,BTDT,,,INTERSECTION of Faneuil St & Parsons St  Brighton  MA,11.0,04,9.0,D14,Allston / Brighton,15.0,Ward 22,2211.0,,INTERSECTION Faneuil St & Parsons St,,Intersection,4792.0,42.3553,-71.1562,Constituent Call,"(42.3553, -71.1562)"
601557,101001439719,07/29/2015 06:19:00 PM,07/30/2015 06:19:28 PM,08/04/2015 07:23:54 AM,OVERDUE,Closed,Case Closed. Closed date : 2015-08-04 07:23:54.4 Case Resolved,Traffic Signal Inspection,Transportation - Traffic Division,Signs & Signals,Traffic Signal Inspection,BTDT_Traffic Signal_Repair,BTDT,,,INTERSECTION of Carolina Ave & Custer St  Jamaica Plain  MA,9.0,02,6.0,E13,Jamaica Plain,11.0,Ward 19,1906.0,,INTERSECTION Carolina Ave & Custer St,,Intersection,2458.0,42.3077,-71.1155,Constituent Call,"(42.3077, -71.1155)"
601564,101001439726,07/29/2015 06:31:00 PM,07/30/2015 06:31:35 PM,08/04/2015 06:48:27 AM,OVERDUE,Closed,Case Closed. Closed date : 2015-08-04 06:48:27.54 Case Resolved Refaced housing,Traffic Signal Inspection,Transportation - Traffic Division,Signs & Signals,Traffic Signal Inspection,BTDT_Traffic Signal_Repair,BTDT,,,INTERSECTION of Dorchester Ave & W Fourth St  South Boston  MA,6.0,05,2.0,C6,South Boston / South Boston Waterfront,5.0,Ward 6,601.0,,INTERSECTION Dorchester Ave & W Fourth St,,Intersection,4163.0,42.3416,-71.0572,Constituent Call,"(42.3416, -71.0572)"
601619,101001499803,07/30/2015 06:07:00 AM,07/31/2015 06:07:04 AM,08/04/2015 06:47:08 AM,OVERDUE,Closed,Case Closed. Closed date : 2015-08-04 06:47:08.447 Case Resolved,Traffic Signal Inspection,Transportation - Traffic Division,Signs & Signals,Traffic Signal Inspection,BTDT_Traffic Signal_Repair,BTDT,,,INTERSECTION of Harvard St & Morton St  Dorchester  MA,8.0,07,4.0,B3,Greater Mattapan,9.0,Ward 14,1411.0,,INTERSECTION Harvard St & Morton St,,Intersection,5749.0,42.2876,-71.0939,Constituent Call,"(42.2876, -71.0939)"
601623,101001499812,07/30/2015 06:58:00 AM,07/31/2015 06:58:21 AM,08/03/2015 02:30:55 PM,OVERDUE,Closed,Case Closed. Closed date : 2015-08-03 14:30:55.657 Case Resolved,Traffic Signal Inspection,Transportation - Traffic Division,Signs & Signals,Traffic Signal Inspection,BTDT_Traffic Signal_Repair,BTDT,,,INTERSECTION of Congress St & Purchase St  Boston  MA,6.0,1C,1.0,A1,Downtown / Financial District,3.0,Ward 3,306.0,,INTERSECTION Congress St & Purchase St,,Intersection,3440.0,42.3542,-71.0541,Constituent Call,"(42.3542, -71.0541)"
601631,101001499824,07/30/2015 07:21:00 AM,07/31/2015 07:21:28 AM,08/04/2015 06:46:40 AM,OVERDUE,Closed,Case Closed. Closed date : 2015-08-04 06:46:40.84 Case Resolved,Traffic Signal Inspection,Transportation - Traffic Division,Signs & Signals,Traffic Signal Inspection,BTDT_Traffic Signal_Repair,BTDT,,,INTERSECTION of Columbia Rd & Hancock St  Dorchester  MA,7.0,03,7.0,B2,Dorchester,13.0,Ward 13,1305.0,,INTERSECTION Columbia Rd & Hancock St,,Intersection,3231.0,42.3158,-71.0663,Constituent Call,"(42.3158, -71.0663)"
601647,101001499841,07/30/2015 07:50:00 AM,07/31/2015 07:50:38 AM,08/04/2015 07:28:52 AM,OVERDUE,Closed,Case Closed. Closed date : 2015-08-04 07:28:52.493 Case Resolved,Traffic Signal Inspection,Transportation - Traffic Division,Signs & Signals,Traffic Signal Inspection,BTDT_Traffic Signal_Repair,BTDT,,,INTERSECTION of Washington St & Mcbride St  Jamaica Plain  MA,9.0,02,6.0,E13,Jamaica Plain,11.0,Ward 11,1108.0,,INTERSECTION Washington St & Mcbride St,,Intersection,6013.0,42.3055,-71.1084,Constituent Call,"(42.3055, -71.1084)"
601668,101001499868,07/30/2015 08:23:00 AM,07/31/2015 08:23:25 AM,,OVERDUE,Open,,Traffic Signal Inspection,Transportation - Traffic Division,Signs & Signals,Traffic Signal Inspection,INFO01_GenericeFormforOtherServiceRequestTypes,INFO,,,INTERSECTION of Harvard St & Morton St  Dorchester  MA,8.0,07,4.0,B3,Greater Mattapan,9.0,Ward 14,1411.0,,INTERSECTION Harvard St & Morton St,,Intersection,5749.0,42.2876,-71.0939,Constituent Call,"(42.2876, -71.0939)"
601683,101001499887,07/30/2015 08:42:00 AM,07/31/2015 08:42:18 AM,08/04/2015 07:28:30 AM,OVERDUE,Closed,Case Closed. Closed date : 2015-08-04 07:28:30.37 Case Resolved,Traffic Signal Inspection,Transportation - Traffic Division,Signs & Signals,Traffic Signal Inspection,BTDT_Traffic Signal_Repair,BTDT,,,INTERSECTION of Blue Hill Ave & Mount Pleasant Ave  Roxbury  MA,7.0,03,7.0,B2,Roxbury,13.0,Ward 8,807.0,,INTERSECTION Blue Hill Ave & Mount Pleasant Ave,,Intersection,1606.0,42.3253,-71.075,Constituent Call,"(42.3253, -71.075)"
601926,101001500227,07/30/2015 01:39:00 PM,07/31/2015 01:39:43 PM,07/31/2015 10:59:01 AM,ONTIME,Closed,Case Closed. Closed date : 2015-07-31 10:59:01.33 Case Resolved Back on stop and go,Traffic Signal Inspection,Transportation - Traffic Division,Signs & Signals,Traffic Signal Inspection,BTDT_Traffic Signal_Repair,BTDT,,,INTERSECTION of Brock St & Lake St  Brighton  MA,11.0,04,9.0,D14,Allston / Brighton,15.0,Ward 22,2210.0,,INTERSECTION Brock St & Lake St,,Intersection,2007.0,42.3489,-71.1605,Constituent Call,"(42.3489, -71.1605)"
602107,101001500472,07/30/2015 06:47:00 PM,07/31/2015 06:47:00 PM,08/03/2015 02:26:50 PM,OVERDUE,Closed,Case Closed. Closed date : 2015-08-03 14:26:50.393 Case Resolved,Traffic Signal Inspection,Transportation - Traffic Division,Signs & Signals,Traffic Signal Inspection,BTDT_Traffic Signal_Repair,BTDT,,,INTERSECTION of Boylston St & Charlesgate East  Boston  MA,4.0,10A,8.0,D4,Fenway / Kenmore / Audubon Circle / Longwood,14.0,Ward 5,510.0,,INTERSECTION Boylston St & Charlesgate East,,Intersection,1768.0,42.3466,-71.0904,Constituent Call,"(42.3466, -71.0904)"
602162,101001500543,07/30/2015 08:54:00 PM,07/31/2015 08:54:59 PM,07/31/2015 10:57:49 AM,ONTIME,Closed,Case Closed. Closed date : 2015-07-31 10:57:49.5 Case Resolved N star Problem Back on stop and go,Traffic Signal Inspection,Transportation - Traffic Division,Signs & Signals,Traffic Signal Inspection,BTDT_Traffic Signal_Repair,BTDT,,,INTERSECTION of Congress St & Purchase St  Boston  MA,6.0,1C,1.0,A1,Downtown / Financial District,3.0,Ward 3,306.0,,INTERSECTION Congress St & Purchase St,,Intersection,3440.0,42.3542,-71.0541,Constituent Call,"(42.3542, -71.0541)"
602187,101001500582,07/31/2015 02:17:00 AM,08/01/2015 02:17:44 AM,07/31/2015 10:54:04 AM,ONTIME,Closed,Case Closed. Closed date : 2015-07-31 10:54:04.6 Case Resolved Back on stop and go,Traffic Signal Inspection,Transportation - Traffic Division,Signs & Signals,Traffic Signal Inspection,BTDT_Traffic Signal_Repair,BTDT,,,INTERSECTION of Bennington St & Saratoga St  East Boston  MA,1.0,09,1.0,A7,East Boston,1.0,Ward 1,112.0,,INTERSECTION Bennington St & Saratoga St,,Intersection,1333.0,42.3866,-71.0067,Constituent Call,"(42.3866, -71.0067)"
602205,101001500605,07/31/2015 07:20:00 AM,08/01/2015 07:20:49 AM,,OVERDUE,Open,,Traffic Signal Inspection,Transportation - Traffic Division,Signs & Signals,Traffic Signal Inspection,INFO01_GenericeFormforOtherServiceRequestTypes,INFO,,,1341-1355 Boylston St  Boston  MA  02215,4.0,10A,8.0,D4,Fenway / Kenmore / Audubon Circle / Longwood,14.0,05,502.0,C,1341-1355 Boylston St,2215.0,Address,18094.0,42.3444,-71.0996,Constituent Call,"(42.3444, -71.0996)"
602287,101001500720,07/31/2015 09:14:00 AM,08/01/2015 09:14:50 AM,07/31/2015 10:52:51 AM,ONTIME,Closed,Case Closed. Closed date : 2015-07-31 10:52:51.94 Case Resolved Back on stop and go,Traffic Signal Inspection,Transportation - Traffic Division,Signs & Signals,Traffic Signal Inspection,BTDT_Traffic Signal_Repair,BTDT,,,INTERSECTION of Dudley St & Washington St  Roxbury  MA,7.0,10B,7.0,B2,Roxbury,13.0,Ward 9,905.0,,INTERSECTION Dudley St & Washington St,,Intersection,4266.0,42.3289,-71.0852,Constituent Call,"(42.3289, -71.0852)"
602348,101001500803,07/31/2015 10:43:00 AM,08/01/2015 10:43:32 AM,07/31/2015 10:52:03 AM,ONTIME,Closed,Case Closed. Closed date : 2015-07-31 10:52:03.86 Case Resolved Back on stop and go,Traffic Signal Inspection,Transportation - Traffic Division,Signs & Signals,Traffic Signal Inspection,BTDT_Traffic Signal_Repair,BTDT,,,INTERSECTION of Blossom St & Garden St  Boston  MA,3.0,1B,8.0,A1,Beacon Hill,14.0,Ward 5,504.0,,INTERSECTION Blossom St & Garden St,,Intersection,1508.0,42.3611,-71.067,Constituent Call,"(42.3611, -71.067)"
602506,101001500992,07/31/2015 01:56:00 PM,08/01/2015 01:56:06 PM,08/05/2015 02:49:02 PM,OVERDUE,Closed,Case Closed. Closed date : 2015-08-05 14:49:02.403 Case Resolved,Traffic Signal Inspection,Transportation - Traffic Division,Signs & Signals,Traffic Signal Inspection,BTDT_Traffic Signal_Repair,BTDT,,,INTERSECTION of Commercial St & Hanover St  Boston  MA,3.0,1B,1.0,A1,Downtown / Financial District,3.0,Ward 3,301.0,,INTERSECTION Commercial St & Hanover St,,Intersection,3319.0,42.3672,-71.0525,Constituent Call,"(42.3672, -71.0525)"
602682,101001501224,07/31/2015 06:31:00 PM,08/01/2015 06:31:55 PM,08/05/2015 02:48:40 PM,OVERDUE,Closed,Case Closed. Closed date : 2015-08-05 14:48:40.283 Case Resolved,Traffic Signal Inspection,Transportation - Traffic Division,Signs & Signals,Traffic Signal Inspection,BTDT_Traffic Signal_Repair,BTDT,,,INTERSECTION of Cross St & Hanover St  Boston  MA,3.0,1B,1.0,A1,Downtown / Financial District,3.0,Ward 3,303.0,,INTERSECTION Cross St & Hanover St,,Intersection,3689.0,42.3626,-71.0557,Constituent Call,"(42.3626, -71.0557)"
602754,101001501349,08/01/2015 08:46:00 AM,08/02/2015 08:46:27 AM,08/10/2015 07:29:02 AM,OVERDUE,Closed,Case Closed. Closed date : 2015-08-10 07:29:02.42 Case Resolved,Traffic Signal Inspection,Transportation - Traffic Division,Signs & Signals,Traffic Signal Inspection,BTDT_Traffic Signal_Repair,BTDT,,,INTERSECTION of Bennington St & Saratoga St  East Boston  MA,1.0,09,1.0,A7,East Boston,1.0,Ward 1,112.0,,INTERSECTION Bennington St & Saratoga St,,Intersection,1333.0,42.3866,-71.0067,Constituent Call,"(42.3866, -71.0067)"
602772,101001501372,08/01/2015 09:54:16 AM,08/02/2015 09:54:16 AM,08/03/2015 07:11:35 AM,OVERDUE,Closed,Case Closed. Closed date : 2015-08-03 07:11:35.577 Case Resolved,Traffic Signal Inspection,Transportation - Traffic Division,Signs & Signals,Traffic Signal Inspection,BTDT_Traffic Signal_Repair,BTDT,,,INTERSECTION of Hampden St & Melnea Cass Blvd  Roxbury  MA,7.0,10B,7.0,B2,Roxbury,13.0,Ward 8,803.0,,INTERSECTION Hampden St & Melnea Cass Blvd,,Intersection,5587.0,42.3312,-71.0749,Constituent Call,"(42.3312, -71.0749)"
602777,101001501384,08/01/2015 10:22:15 AM,08/02/2015 10:22:15 AM,08/03/2015 07:11:21 AM,OVERDUE,Closed,Case Closed. Closed date : 2015-08-03 07:11:21.153 Case Resolved,Traffic Signal Inspection,Transportation - Traffic Division,Signs & Signals,Traffic Signal Inspection,BTDT_Traffic Signal_Repair,BTDT,,,INTERSECTION of Dorchester Ave & Gibson St  Dorchester  MA,7.0,07,3.0,C11,Dorchester,7.0,Ward 16,1601.0,,INTERSECTION Dorchester Ave & Gibson St,,Intersection,4140.0,42.2972,-71.061,Constituent Call,"(42.2972, -71.061)"
602778,101001501386,08/01/2015 10:24:24 AM,08/02/2015 10:24:24 AM,08/03/2015 07:10:19 AM,OVERDUE,Closed,Case Closed. Closed date : 2015-08-03 07:10:19.593 Case Resolved,Traffic Signal Inspection,Transportation - Traffic Division,Signs & Signals,Traffic Signal Inspection,BTDT_Traffic Signal_Repair,BTDT,,,INTERSECTION of Hampden St & Melnea Cass Blvd  Roxbury  MA,7.0,10B,7.0,B2,Roxbury,13.0,Ward 8,803.0,,INTERSECTION Hampden St & Melnea Cass Blvd,,Intersection,5587.0,42.3312,-71.0749,Constituent Call,"(42.3312, -71.0749)"
602807,101001501419,08/01/2015 11:15:09 AM,08/02/2015 11:15:09 AM,08/03/2015 07:10:46 AM,OVERDUE,Closed,Case Closed. Closed date : 2015-08-03 07:10:46.263 Case Resolved,Traffic Signal Inspection,Transportation - Traffic Division,Signs & Signals,Traffic Signal Inspection,BTDT_Traffic Signal_Repair,BTDT,,,INTERSECTION of Cedar St & Centre St  Roxbury  MA,7.0,10B,7.0,B2,Roxbury,13.0,Ward 11,1101.0,,INTERSECTION Cedar St & Centre St,,Intersection,2547.0,42.3277,-71.0957,Constituent Call,"(42.3277, -71.0957)"
602825,101001501451,08/01/2015 12:13:33 PM,08/02/2015 12:13:33 PM,08/03/2015 07:09:34 AM,OVERDUE,Closed,Case Closed. Closed date : 2015-08-03 07:09:34.763 Case Resolved,Traffic Signal Inspection,Transportation - Traffic Division,Signs & Signals,Traffic Signal Inspection,BTDT_Traffic Signal_Repair,BTDT,,,INTERSECTION of Atlantic Ave & Milk St  Boston  MA,3.0,1C,1.0,A1,Downtown / Financial District,3.0,Ward 3,306.0,,INTERSECTION Atlantic Ave & Milk St,,Intersection,739.0,42.3588,-71.0515,Constituent Call,"(42.3588, -71.0515)"
602828,101001501454,08/01/2015 12:20:08 PM,08/02/2015 12:20:08 PM,08/03/2015 07:09:20 AM,OVERDUE,Closed,Case Closed. Closed date : 2015-08-03 07:09:20.69 Case Resolved,Traffic Signal Inspection,Transportation - Traffic Division,Signs & Signals,Traffic Signal Inspection,BTDT_Traffic Signal_Repair,BTDT,,,INTERSECTION of Berkeley St & Columbus Ave  Boston  MA,4.0,1C,2.0,D4,Back Bay,6.0,Ward 5,501.0,,INTERSECTION Berkeley St & Columbus Ave,,Intersection,1358.0,42.3487,-71.0718,Constituent Call,"(42.3487, -71.0718)"
602836,101001501464,08/01/2015 12:34:47 PM,08/02/2015 12:34:47 PM,08/03/2015 07:08:46 AM,OVERDUE,Closed,Case Closed. Closed date : 2015-08-03 07:08:46.78 Case Resolved,Traffic Signal Inspection,Transportation - Traffic Division,Signs & Signals,Traffic Signal Inspection,BTDT_Traffic Signal_Repair,BTDT,,,INTERSECTION of Berkeley St & Columbus Ave  Boston  MA,4.0,1C,2.0,D4,Back Bay,6.0,Ward 5,501.0,,INTERSECTION Berkeley St & Columbus Ave,,Intersection,1358.0,42.3487,-71.0718,Constituent Call,"(42.3487, -71.0718)"
602902,101001501554,08/01/2015 08:35:56 PM,08/02/2015 08:35:56 PM,08/03/2015 07:07:41 AM,OVERDUE,Closed,Case Closed. Closed date : 2015-08-03 07:07:41.64 Case Resolved,Traffic Signal Inspection,Transportation - Traffic Division,Signs & Signals,Traffic Signal Inspection,BTDT_Traffic Signal_Repair,BTDT,,,INTERSECTION of Seaport Blvd & Sleeper St  Boston  MA,6.0,05,2.0,C6,South Boston / South Boston Waterfront,5.0,Ward 6,601.0,,INTERSECTION Seaport Blvd & Sleeper St,,Intersection,8312.0,42.3532,-71.0485,Constituent Call,"(42.3532, -71.0485)"
602933,101001501593,08/02/2015 01:40:44 AM,08/03/2015 01:40:45 AM,08/02/2015 01:41:34 AM,ONTIME,Closed,Case Closed. Closed date : 2015-08-02 01:41:34.637 Case Invalid error,Traffic Signal Inspection,Transportation - Traffic Division,Signs & Signals,Traffic Signal Inspection,BTDT_Traffic Signal_Repair,BTDT,,,INTERSECTION of Cross St & Hanover St  Boston  MA,3.0,1B,1.0,A1,Downtown / Financial District,3.0,Ward 3,303.0,,INTERSECTION Cross St & Hanover St,,Intersection,3689.0,42.3626,-71.0557,Constituent Call,"(42.3626, -71.0557)"
602946,101001501610,08/02/2015 08:01:00 AM,08/03/2015 08:01:23 AM,08/07/2015 07:19:58 AM,OVERDUE,Closed,Case Closed. Closed date : 2015-08-07 07:19:58.81 Case Resolved Painted some posts. Further questions please call me @ 617-635-3126. Ty Dominic,Traffic Signal Inspection,Transportation - Traffic Division,Signs & Signals,Traffic Signal Inspection,BTDT_Traffic Signal_Repair,BTDT,,,INTERSECTION of Marlborough St & Massachusetts Ave  Boston  MA,4.0,1C,8.0,D4,Back Bay,14.0,Ward 5,509.0,,INTERSECTION Marlborough St & Massachusetts Ave,,Intersection,7105.0,42.35,-71.0891,Constituent Call,"(42.35, -71.0891)"
602976,101001501649,08/02/2015 10:45:54 AM,08/03/2015 10:45:54 AM,08/03/2015 07:06:40 AM,ONTIME,Closed,Case Closed. Closed date : 2015-08-03 07:06:40.333 Case Resolved,Traffic Signal Inspection,Transportation - Traffic Division,Signs & Signals,Traffic Signal Inspection,BTDT_Traffic Signal_Repair,BTDT,,,INTERSECTION of Cedar St & Washington St  Roxbury  MA,7.0,10B,7.0,B2,Roxbury,13.0,Ward 9,905.0,,INTERSECTION Cedar St & Washington St,,Intersection,2555.0,42.3242,-71.0888,Constituent Call,"(42.3242, -71.0888)"
603080,101001501821,08/02/2015 11:34:08 PM,08/03/2015 11:34:08 PM,08/03/2015 08:48:38 AM,ONTIME,Closed,Case Closed. Closed date : 2015-08-03 08:48:38.657 Case Noted Made safe,Traffic Signal Inspection,Transportation - Traffic Division,Signs & Signals,Traffic Signal Inspection,BTDT_Traffic Signal_Repair,BTDT,,,INTERSECTION of Brighton Ave & Commonwealth Ave  Boston  MA,11.0,04,9.0,D14,Allston / Brighton,14.0,Ward 21,2103.0,,INTERSECTION Brighton Ave & Commonwealth Ave,,Intersection,1953.0,42.3521,-71.1247,Constituent Call,"(42.3521, -71.1247)"
603280,101001502093,08/03/2015 10:53:00 AM,08/04/2015 10:53:49 AM,08/03/2015 01:35:27 PM,ONTIME,Closed,Case Closed. Closed date : 2015-08-03 13:35:27.133 Case Noted made safe,Traffic Signal Inspection,Transportation - Traffic Division,Signs & Signals,Traffic Signal Inspection,BTDT_Traffic Signal_Repair,BTDT,,,140 Harvard St  Dorchester  MA  02124,8.0,03,4.0,B3,Greater Mattapan,8.0,Ward 14,1402.0,RC,140 Harvard St,2124.0,Address,248634.0,42.2962,-71.0806,Constituent Call,"(42.2962, -71.0806)"
603638,101001502573,08/03/2015 07:59:00 PM,08/04/2015 07:59:12 PM,08/04/2015 06:43:15 AM,ONTIME,Closed,Case Closed. Closed date : 2015-08-04 06:43:15.413 Case Resolved,Traffic Signal Inspection,Transportation - Traffic Division,Signs & Signals,Traffic Signal Inspection,BTDT_Traffic Signal_Repair,BTDT,,,INTERSECTION of Dartmouth St & Tremont St  Roxbury  MA,4.0,1C,2.0,D4,South End,6.0,Ward 9,901.0,,INTERSECTION Dartmouth St & Tremont St,,Intersection,3922.0,42.3428,-71.0737,Constituent Call,"(42.3428, -71.0737)"
603702,101001502664,08/04/2015 07:26:00 AM,08/05/2015 07:26:08 AM,08/04/2015 10:01:32 AM,ONTIME,Closed,Case Closed. Closed date : 2015-08-04 10:01:32.153 Case Resolved Back on stop and go,Traffic Signal Inspection,Transportation - Traffic Division,Signs & Signals,Traffic Signal Inspection,BTDT_Traffic Signal_Repair,BTDT,,,INTERSECTION of Congress St & E Service Rd  Boston  MA,6.0,05,2.0,C6,South Boston / South Boston Waterfront,5.0,Ward 6,601.0,,INTERSECTION Congress St & E Service Rd,,Intersection,3446.0,42.3488,-71.0459,Constituent Call,"(42.3488, -71.0459)"
603706,101001502669,08/04/2015 07:33:00 AM,08/05/2015 07:33:03 AM,,OVERDUE,Open,,Traffic Signal Inspection,Transportation - Traffic Division,Signs & Signals,Traffic Signal Inspection,INFO01_GenericeFormforOtherServiceRequestTypes,INFO,,,INTERSECTION of Evans Way & Louis Prang St  Boston  MA,4.0,10A,8.0,B2,Fenway / Kenmore / Audubon Circle / Longwood,14.0,Ward 4,410.0,,INTERSECTION Evans Way & Louis Prang St,,Intersection,4684.0,42.3385,-71.0973,Constituent Call,"(42.3385, -71.0973)"
603708,101001502672,08/04/2015 07:38:17 AM,08/05/2015 07:38:17 AM,08/04/2015 07:41:30 AM,ONTIME,Closed,Case Closed. Closed date : 2015-08-04 07:41:30.82 Duplicate of Existing Case,Traffic Signal Inspection,Transportation - Traffic Division,Signs & Signals,Traffic Signal Inspection,BTDT_Traffic Signal_Repair,BTDT,,,INTERSECTION of Maverick St & New St  East Boston  MA,1.0,09,1.0,A7,East Boston,1.0,Ward 1,104.0,,INTERSECTION Maverick St & New St,,Intersection,7166.0,42.3719,-71.0429,Constituent Call,"(42.3719, -71.0429)"
603728,101001502698,08/04/2015 08:07:00 AM,08/05/2015 08:07:56 AM,08/04/2015 08:30:14 AM,ONTIME,Closed,Case Closed. Closed date : 2015-08-04 08:30:14.233 Case Resolved Back on stop and go,Traffic Signal Inspection,Transportation - Traffic Division,Signs & Signals,Traffic Signal Inspection,BTDT_Traffic Signal_Repair,BTDT,,,INTERSECTION of Berkeley St & Boylston St  Boston  MA,4.0,1C,8.0,D4,Back Bay,14.0,Ward 5,506.0,,INTERSECTION Berkeley St & Boylston St,,Intersection,1353.0,42.3512,-71.0731,Constituent Call,"(42.3512, -71.0731)"
603760,101001502741,08/04/2015 08:44:00 AM,08/05/2015 08:44:57 AM,08/04/2015 09:55:50 AM,ONTIME,Closed,Case Closed. Closed date : 2015-08-04 09:55:50.297 Case Resolved Back on stop and go,Traffic Signal Inspection,Transportation - Traffic Division,Signs & Signals,Traffic Signal Inspection,BTDT_Traffic Signal_Repair,BTDT,,,INTERSECTION of Hampden St & Norfolk Ave  Roxbury  MA,7.0,10B,7.0,B2,Roxbury,13.0,Ward 8,803.0,,INTERSECTION Hampden St & Norfolk Ave,,Intersection,5585.0,42.3291,-71.075,Constituent Call,"(42.3291, -71.075)"
603919,101001502958,08/04/2015 11:16:00 AM,08/05/2015 11:16:54 AM,08/05/2015 02:43:35 PM,OVERDUE,Closed,Case Closed. Closed date : 2015-08-05 14:43:35.503 Case Resolved,Traffic Signal Inspection,Transportation - Traffic Division,Signs & Signals,Traffic Signal Inspection,BTDT_Traffic Signal_Repair,BTDT,,,INTERSECTION of Berkeley St & E Berkeley St  Roxbury  MA,4.0,1C,2.0,D4,South End,4.0,Ward 3,307.0,,INTERSECTION Berkeley St & E Berkeley St,,Intersection,1364.0,42.3453,-71.0698,Constituent Call,"(42.3453, -71.0698)"
604017,101001503094,08/04/2015 01:14:00 PM,08/05/2015 01:14:35 PM,09/14/2015 11:33:01 AM,OVERDUE,Closed,Case Closed. Closed date : 2015-09-14 11:33:01.003 Case Noted There is no traffic signal at Melnea Cass Blvd & Northampton St but all traffic signals around that area appear to be properly working.,Traffic Signal Inspection,Transportation - Traffic Division,Signs & Signals,Traffic Signal Inspection,BTDT_Engineering_Request for Traffic Signal Study or Review,BTDT,,,INTERSECTION of Albany St & Northampton St  Roxbury  MA,7.0,10B,7.0,D4,Roxbury,13.0,Ward 8,803.0,,INTERSECTION Albany St & Northampton St,,Intersection,201.0,42.3328,-71.0744,Constituent Call,"(42.3328, -71.0744)"
604043,101001503130,08/04/2015 01:53:00 PM,08/05/2015 01:53:20 PM,09/04/2015 11:33:04 AM,OVERDUE,Closed,Case Closed. Closed date : 2015-09-04 11:33:04.977 Case Noted The Rectangular Rapid Flasher has been repaired.,Traffic Signal Inspection,Transportation - Traffic Division,Signs & Signals,Traffic Signal Inspection,BTDT_Engineering_Request for Traffic Signal Study or Review,BTDT,,,INTERSECTION of Cambridge St & Hano St  Allston  MA,11.0,04,9.0,D14,Allston / Brighton,15.0,Ward 21,2104.0,,INTERSECTION Cambridge St & Hano St,,Intersection,2343.0,42.354,-71.1363,Constituent Call,"(42.354, -71.1363)"
604102,101001503198,08/04/2015 02:48:00 PM,08/05/2015 02:48:09 PM,08/04/2015 02:58:03 PM,ONTIME,Closed,Case Closed. Closed date : 2015-08-04 14:58:03.213 Case Resolved,Traffic Signal Inspection,Transportation - Traffic Division,Signs & Signals,Traffic Signal Inspection,BTDT_Traffic Signal_Repair,BTDT,,,INTERSECTION of Berkeley St & E Berkeley St  Roxbury  MA,4.0,1C,2.0,D4,South End,4.0,Ward 3,307.0,,INTERSECTION Berkeley St & E Berkeley St,,Intersection,1364.0,42.3453,-71.0698,Constituent Call,"(42.3453, -71.0698)"
604149,101001503264,08/04/2015 03:39:00 PM,08/05/2015 03:39:42 PM,08/05/2015 02:39:08 PM,ONTIME,Closed,Case Closed. Closed date : 2015-08-05 14:39:08.09 Case Resolved,Traffic Signal Inspection,Transportation - Traffic Division,Signs & Signals,Traffic Signal Inspection,BTDT_Traffic Signal_Repair,BTDT,,,INTERSECTION of Fenway & Westland Entrance  Boston  MA,4.0,10A,8.0,D4,Fenway / Kenmore / Audubon Circle / Longwood,14.0,Ward 4,407.0,,INTERSECTION Fenway & Westland Entrance,,Intersection,4874.0,42.3443,-71.0907,Constituent Call,"(42.3443, -71.0907)"
604168,101001503285,08/04/2015 03:55:00 PM,08/05/2015 03:55:36 PM,08/05/2015 02:37:03 PM,ONTIME,Closed,Case Closed. Closed date : 2015-08-05 14:37:03.86 Case Resolved,Traffic Signal Inspection,Transportation - Traffic Division,Signs & Signals,Traffic Signal Inspection,BTDT_Traffic Signal_Repair,BTDT,,,INTERSECTION of Berkeley St & E Berkeley St  Roxbury  MA,4.0,1C,2.0,D4,South End,4.0,Ward 3,307.0,,INTERSECTION Berkeley St & E Berkeley St,,Intersection,1364.0,42.3453,-71.0698,Constituent Call,"(42.3453, -71.0698)"
604171,101001503288,08/04/2015 03:57:00 PM,08/05/2015 03:57:55 PM,08/05/2015 02:36:50 PM,ONTIME,Closed,Case Closed. Closed date : 2015-08-05 14:36:50.087 Case Resolved,Traffic Signal Inspection,Transportation - Traffic Division,Signs & Signals,Traffic Signal Inspection,BTDT_Traffic Signal_Repair,BTDT,,,INTERSECTION of Berkeley St & E Berkeley St  Roxbury  MA,4.0,1C,2.0,D4,South End,4.0,Ward 3,307.0,,INTERSECTION Berkeley St & E Berkeley St,,Intersection,1364.0,42.3453,-71.0698,Constituent Call,"(42.3453, -71.0698)"
604179,101001503300,08/04/2015 04:05:00 PM,08/05/2015 04:05:18 PM,08/05/2015 02:36:35 PM,ONTIME,Closed,Case Closed. Closed date : 2015-08-05 14:36:35.25 Case Resolved,Traffic Signal Inspection,Transportation - Traffic Division,Signs & Signals,Traffic Signal Inspection,BTDT_Traffic Signal_Repair,BTDT,,,INTERSECTION of Berkeley St & E Berkeley St  Roxbury  MA,4.0,1C,2.0,D4,South End,4.0,Ward 3,307.0,,INTERSECTION Berkeley St & E Berkeley St,,Intersection,1364.0,42.3453,-71.0698,Constituent Call,"(42.3453, -71.0698)"
604235,101001503375,08/04/2015 04:50:00 PM,08/05/2015 04:50:46 PM,08/05/2015 02:38:18 PM,ONTIME,Closed,Case Closed. Closed date : 2015-08-05 14:38:18.053 Case Resolved,Traffic Signal Inspection,Transportation - Traffic Division,Signs & Signals,Traffic Signal Inspection,BTDT_Traffic Signal_Repair,BTDT,,,INTERSECTION of Cambridge St & Maffa Way  Charlestown  MA,3.0,1A,1.0,A15,Charlestown,2.0,Ward 2,207.0,,INTERSECTION Cambridge St & Maffa Way,,Intersection,2365.0,42.384,-71.0743,Constituent Call,"(42.384, -71.0743)"
604285,101001503440,08/04/2015 05:30:00 PM,08/05/2015 05:30:47 PM,08/05/2015 02:34:21 PM,ONTIME,Closed,Case Closed. Closed date : 2015-08-05 14:34:21.567 Case Resolved,Traffic Signal Inspection,Transportation - Traffic Division,Signs & Signals,Traffic Signal Inspection,BTDT_Traffic Signal_Repair,BTDT,,,INTERSECTION of Baker St & Spring St  West Roxbury  MA,12.0,06,6.0,E5,West Roxbury,12.0,Ward 20,2016.0,,INTERSECTION Baker St & Spring St,,Intersection,903.0,42.2758,-71.1672,Constituent Call,"(42.2758, -71.1672)"
604305,101001503465,08/04/2015 05:53:00 PM,08/05/2015 05:53:32 PM,08/05/2015 02:37:18 PM,ONTIME,Closed,Case Closed. Closed date : 2015-08-05 14:37:18.853 Case Resolved,Traffic Signal Inspection,Transportation - Traffic Division,Signs & Signals,Traffic Signal Inspection,BTDT_Traffic Signal_Repair,BTDT,,,INTERSECTION of Berkeley St & E Berkeley St  Roxbury  MA,4.0,1C,2.0,D4,South End,4.0,Ward 3,307.0,,INTERSECTION Berkeley St & E Berkeley St,,Intersection,1364.0,42.3453,-71.0698,Constituent Call,"(42.3453, -71.0698)"
604350,101001503530,08/04/2015 06:45:00 PM,08/05/2015 06:45:40 PM,08/05/2015 02:37:38 PM,ONTIME,Closed,Case Closed. Closed date : 2015-08-05 14:37:38.007 Case Resolved,Traffic Signal Inspection,Transportation - Traffic Division,Signs & Signals,Traffic Signal Inspection,BTDT_Traffic Signal_Repair,BTDT,,,INTERSECTION of Commonwealth Ave & Lake St  Brighton  MA,,04,9.0,D14,Allston / Brighton,15.0,Ward 22,2208.0,,INTERSECTION Commonwealth Ave & Lake St,,Intersection,3336.0,42.3401,-71.1661,Constituent Call,"(42.3401, -71.1661)"
604354,101001503538,08/04/2015 06:57:00 PM,08/05/2015 06:57:22 PM,,OVERDUE,Open,,Traffic Signal Inspection,Transportation - Traffic Division,Signs & Signals,Traffic Signal Inspection,INFO01_GenericeFormforOtherServiceRequestTypes,INFO,,,1850 Soldiers Field Rd  Brighton  MA  02135,11.0,04,9.0,D14,Allston / Brighton,15.0,Ward 22,2212.0,C,1850 Soldiers Field Rd,2135.0,Address,128310.0,42.3586,-71.1573,Constituent Call,"(42.3586, -71.1573)"
604361,101001503550,08/04/2015 07:11:00 PM,08/05/2015 07:11:28 PM,08/10/2015 07:28:01 AM,OVERDUE,Closed,Case Closed. Closed date : 2015-08-10 07:28:01.733 Case Resolved S-24 repaired ped operation. Further questions call me @ 617-635-3126,Traffic Signal Inspection,Transportation - Traffic Division,Signs & Signals,Traffic Signal Inspection,BTDT_Traffic Signal_Repair,BTDT,,,INTERSECTION of Adams St & Dorchester Ave  Dorchester  MA,8.0,07,3.0,C11,Dorchester,7.0,Ward 17,1713.0,,INTERSECTION Adams St & Dorchester Ave,,Intersection,68.0,42.2722,-71.068,Constituent Call,"(42.2722, -71.068)"
604370,101001503556,08/04/2015 07:17:00 PM,08/05/2015 07:17:38 PM,08/05/2015 02:35:19 PM,ONTIME,Closed,Case Closed. Closed date : 2015-08-05 14:35:19.427 Case Resolved,Traffic Signal Inspection,Transportation - Traffic Division,Signs & Signals,Traffic Signal Inspection,BTDT_Traffic Signal_Repair,BTDT,,,INTERSECTION of Centre St & Heath St  Jamaica Plain  MA,9.0,10B,7.0,E13,Jamaica Plain,13.0,Ward 11,1101.0,,INTERSECTION Centre St & Heath St,,Intersection,2708.0,42.3249,-71.0984,Constituent Call,"(42.3249, -71.0984)"
604383,101001503580,08/04/2015 07:55:00 PM,08/05/2015 07:55:29 PM,08/05/2015 02:35:04 PM,ONTIME,Closed,Case Closed. Closed date : 2015-08-05 14:35:04.443 Case Resolved,Traffic Signal Inspection,Transportation - Traffic Division,Signs & Signals,Traffic Signal Inspection,BTDT_Traffic Signal_Repair,BTDT,,,INTERSECTION of Atlantic Ave & Milk St  Boston  MA,3.0,1C,1.0,A1,Downtown / Financial District,3.0,Ward 3,306.0,,INTERSECTION Atlantic Ave & Milk St,,Intersection,739.0,42.3588,-71.0515,Constituent Call,"(42.3588, -71.0515)"
604389,101001503589,08/04/2015 08:15:00 PM,08/05/2015 08:15:05 PM,08/05/2015 02:34:43 PM,ONTIME,Closed,Case Closed. Closed date : 2015-08-05 14:34:43.113 Case Resolved,Traffic Signal Inspection,Transportation - Traffic Division,Signs & Signals,Traffic Signal Inspection,BTDT_Traffic Signal_Repair,BTDT,,,INTERSECTION of Atlantic Ave & Milk St  Boston  MA,3.0,1C,1.0,A1,Downtown / Financial District,3.0,Ward 3,306.0,,INTERSECTION Atlantic Ave & Milk St,,Intersection,739.0,42.3588,-71.0515,Constituent Call,"(42.3588, -71.0515)"
604392,101001503590,08/04/2015 08:16:00 PM,08/05/2015 08:16:06 PM,08/07/2015 07:18:53 AM,OVERDUE,Closed,Case Closed. Closed date : 2015-08-07 07:18:53.387 Case Resolved Replaced all bulbs out. Further questions please call me @ 617-635-3126 Ty Dominic,Traffic Signal Inspection,Transportation - Traffic Division,Signs & Signals,Traffic Signal Inspection,BTDT_Traffic Signal_Repair,BTDT,,,INTERSECTION of Ruggles St & Whittier St  Mission Hill  MA,9.0,10B,7.0,B2,Roxbury,13.0,Ward 9,904.0,,INTERSECTION Ruggles St & Whittier St,,Intersection,8206.0,42.3345,-71.0895,Constituent Call,"(42.3345, -71.0895)"
604398,101001503600,08/04/2015 08:36:00 PM,08/05/2015 08:36:13 PM,08/05/2015 07:05:00 AM,ONTIME,Closed,Case Closed. Closed date : 2015-08-05 07:05:00.42 Case Resolved,Traffic Signal Inspection,Transportation - Traffic Division,Signs & Signals,Traffic Signal Inspection,BTDT_Traffic Signal_Repair,BTDT,,,INTERSECTION of Atlantic Ave & Milk St  Boston  MA,3.0,1C,1.0,A1,Downtown / Financial District,3.0,Ward 3,306.0,,INTERSECTION Atlantic Ave & Milk St,,Intersection,739.0,42.3588,-71.0515,Constituent Call,"(42.3588, -71.0515)"
604434,101001503654,08/04/2015 11:17:00 PM,08/05/2015 11:17:44 PM,08/05/2015 06:57:46 AM,ONTIME,Closed,Case Closed. Closed date : 2015-08-05 06:57:46.517 Case Resolved,Traffic Signal Inspection,Transportation - Traffic Division,Signs & Signals,Traffic Signal Inspection,BTDT_Traffic Signal_Repair,BTDT,,,INTERSECTION of Essex St & Kingston St  Boston  MA,3.0,1C,2.0,A1,Downtown / Financial District,4.0,Ward 3,308.0,,INTERSECTION Essex St & Kingston St,,Intersection,4636.0,42.3525,-71.0594,Constituent Call,"(42.3525, -71.0594)"
604435,101001503656,08/04/2015 11:25:00 PM,08/05/2015 11:25:21 PM,08/05/2015 02:29:06 PM,ONTIME,Closed,Case Closed. Closed date : 2015-08-05 14:29:06.79 Case Resolved,Traffic Signal Inspection,Transportation - Traffic Division,Signs & Signals,Traffic Signal Inspection,BTDT_Traffic Signal_Repair,BTDT,,,INTERSECTION of Commonwealth Ave & Kelton St  Allston  MA,11.0,04,9.0,D14,Allston / Brighton,15.0,Ward 21,2109.0,,INTERSECTION Commonwealth Ave & Kelton St,,Intersection,3360.0,42.3485,-71.1399,Constituent Call,"(42.3485, -71.1399)"
604460,101001503681,08/05/2015 03:11:00 AM,08/06/2015 03:11:15 AM,08/05/2015 06:51:56 AM,ONTIME,Closed,Case Closed. Closed date : 2015-08-05 06:51:56.967 Case Resolved,Traffic Signal Inspection,Transportation - Traffic Division,Signs & Signals,Traffic Signal Inspection,BTDT_Traffic Signal_Repair,BTDT,,,INTERSECTION of Clarendon St & Commonwealth Ave  Boston  MA,4.0,1C,8.0,D4,Back Bay,14.0,Ward 5,507.0,,INTERSECTION Clarendon St & Commonwealth Ave,,Intersection,3067.0,42.3523,-71.076,Constituent Call,"(42.3523, -71.076)"
604467,101001503693,08/05/2015 05:55:00 AM,08/06/2015 05:55:43 AM,08/05/2015 06:52:13 AM,ONTIME,Closed,Case Closed. Closed date : 2015-08-05 06:52:13.047 Case Resolved,Traffic Signal Inspection,Transportation - Traffic Division,Signs & Signals,Traffic Signal Inspection,BTDT_Traffic Signal_Repair,BTDT,,,INTERSECTION of Ruggles St & Whittier St  Mission Hill  MA,9.0,10B,7.0,B2,Roxbury,13.0,Ward 9,904.0,,INTERSECTION Ruggles St & Whittier St,,Intersection,8206.0,42.3345,-71.0895,Constituent Call,"(42.3345, -71.0895)"
604473,101001503707,08/05/2015 06:58:00 AM,08/06/2015 06:58:19 AM,08/05/2015 02:28:55 PM,ONTIME,Closed,Case Closed. Closed date : 2015-08-05 14:28:55.93 Case Resolved,Traffic Signal Inspection,Transportation - Traffic Division,Signs & Signals,Traffic Signal Inspection,BTDT_Traffic Signal_Repair,BTDT,,,INTERSECTION of Bowdoin St & New Chardon St  Boston  MA,3.0,1B,1.0,A1,Beacon Hill,3.0,Ward 3,306.0,,INTERSECTION Bowdoin St & New Chardon St,,Intersection,1719.0,42.3612,-71.0629,Constituent Call,"(42.3612, -71.0629)"
604476,101001503710,08/05/2015 07:00:00 AM,08/06/2015 07:00:01 AM,08/05/2015 02:26:23 PM,ONTIME,Closed,Case Closed. Closed date : 2015-08-05 14:26:23.533 Case Resolved,Traffic Signal Inspection,Transportation - Traffic Division,Signs & Signals,Traffic Signal Inspection,BTDT_Traffic Signal_Repair,BTDT,,,INTERSECTION of Alford St & Cambridge St  Charlestown  MA,3.0,1A,1.0,A15,Charlestown,2.0,Ward 2,207.0,,INTERSECTION Alford St & Cambridge St,,Intersection,263.0,42.3848,-71.0739,Constituent Call,"(42.3848, -71.0739)"
604482,101001503716,08/05/2015 07:13:00 AM,08/06/2015 07:13:03 AM,08/05/2015 02:26:11 PM,ONTIME,Closed,Case Closed. Closed date : 2015-08-05 14:26:11.897 Case Resolved,Traffic Signal Inspection,Transportation - Traffic Division,Signs & Signals,Traffic Signal Inspection,BTDT_Traffic Signal_Repair,BTDT,,,INTERSECTION of Commonwealth Ave & Fairfield St  Boston  MA,4.0,1C,8.0,D4,Back Bay,14.0,Ward 5,508.0,,INTERSECTION Commonwealth Ave & Fairfield St,,Intersection,3395.0,42.3505,-71.0826,Constituent Call,"(42.3505, -71.0826)"
604484,101001503720,08/05/2015 07:16:00 AM,08/06/2015 07:16:02 AM,08/05/2015 02:25:51 PM,ONTIME,Closed,Case Closed. Closed date : 2015-08-05 14:25:51.227 Case Resolved,Traffic Signal Inspection,Transportation - Traffic Division,Signs & Signals,Traffic Signal Inspection,BTDT_Traffic Signal_Repair,BTDT,,,INTERSECTION of Cambridge St & Maffa Way  Charlestown  MA,3.0,1A,1.0,A15,Charlestown,2.0,Ward 2,207.0,,INTERSECTION Cambridge St & Maffa Way,,Intersection,2365.0,42.384,-71.0743,Constituent Call,"(42.384, -71.0743)"
604504,101001503744,08/05/2015 07:49:00 AM,08/06/2015 07:49:35 AM,08/06/2015 06:59:34 AM,ONTIME,Closed,Case Closed. Closed date : 2015-08-06 06:59:34.587 Case Resolved,Traffic Signal Inspection,Transportation - Traffic Division,Signs & Signals,Traffic Signal Inspection,BTDT_Traffic Signal_Repair,BTDT,,,INTERSECTION of Pleasant St & Sawyer Ave  Dorchester  MA,7.0,03,3.0,C11,Dorchester,7.0,Ward 13,1309.0,,INTERSECTION Pleasant St & Sawyer Ave,,Intersection,7914.0,42.3128,-71.0589,Constituent Call,"(42.3128, -71.0589)"
604512,101001503752,08/05/2015 07:56:00 AM,08/06/2015 07:56:25 AM,08/05/2015 02:21:35 PM,ONTIME,Closed,Case Closed. Closed date : 2015-08-05 14:21:35.54 Case Resolved Reinstalled post,Traffic Signal Inspection,Transportation - Traffic Division,Signs & Signals,Traffic Signal Inspection,BTDT_Traffic Signal_Repair,BTDT,,,INTERSECTION of Arlington St & Stuart St  Boston  MA,4.0,1C,2.0,A1,Back Bay,6.0,Ward 5,501.0,,INTERSECTION Arlington St & Stuart St,,Intersection,586.0,42.3501,-71.0699,Constituent Call,"(42.3501, -71.0699)"
604514,101001503754,08/05/2015 07:58:00 AM,08/06/2015 07:58:21 AM,08/06/2015 06:59:21 AM,ONTIME,Closed,Case Closed. Closed date : 2015-08-06 06:59:21.187 Case Resolved,Traffic Signal Inspection,Transportation - Traffic Division,Signs & Signals,Traffic Signal Inspection,BTDT_Traffic Signal_Repair,BTDT,,,INTERSECTION of Pleasant St & Sawyer Ave  Dorchester  MA,7.0,03,3.0,C11,Dorchester,7.0,Ward 13,1309.0,,INTERSECTION Pleasant St & Sawyer Ave,,Intersection,7914.0,42.3128,-71.0589,Constituent Call,"(42.3128, -71.0589)"
604518,101001503759,08/05/2015 08:01:00 AM,08/06/2015 08:01:17 AM,08/05/2015 02:20:40 PM,ONTIME,Closed,Case Closed. Closed date : 2015-08-05 14:20:40.25 Case Resolved,Traffic Signal Inspection,Transportation - Traffic Division,Signs & Signals,Traffic Signal Inspection,BTDT_Traffic Signal_Repair,BTDT,,,INTERSECTION of Baker St & Spring St  West Roxbury  MA,12.0,06,6.0,E5,West Roxbury,12.0,Ward 20,2016.0,,INTERSECTION Baker St & Spring St,,Intersection,903.0,42.2758,-71.1672,Constituent Call,"(42.2758, -71.1672)"
604590,101001503848,08/05/2015 09:15:00 AM,08/06/2015 09:15:53 AM,08/05/2015 02:19:48 PM,ONTIME,Closed,Case Closed. Closed date : 2015-08-05 14:19:48.427 Duplicate of Existing Case,Traffic Signal Inspection,Transportation - Traffic Division,Signs & Signals,Traffic Signal Inspection,BTDT_Traffic Signal_Repair,BTDT,,,INTERSECTION of Seaport Blvd & Sleeper St  Boston  MA,6.0,05,2.0,C6,South Boston / South Boston Waterfront,5.0,Ward 6,601.0,,INTERSECTION Seaport Blvd & Sleeper St,,Intersection,8312.0,42.3532,-71.0485,Constituent Call,"(42.3532, -71.0485)"
604612,101001503872,08/05/2015 09:37:02 AM,08/06/2015 09:37:02 AM,08/06/2015 06:58:39 AM,ONTIME,Closed,Case Closed. Closed date : 2015-08-06 06:58:39.847 Case Resolved,Traffic Signal Inspection,Transportation - Traffic Division,Signs & Signals,Traffic Signal Inspection,BTDT_Traffic Signal_Repair,BTDT,,,INTERSECTION of Pleasant St & Sawyer Ave  Dorchester  MA,7.0,03,3.0,C11,Dorchester,7.0,Ward 13,1309.0,,INTERSECTION Pleasant St & Sawyer Ave,,Intersection,7914.0,42.3128,-71.0589,Constituent Call,"(42.3128, -71.0589)"
604614,101001503874,08/05/2015 09:38:00 AM,08/06/2015 09:38:21 AM,08/05/2015 02:18:37 PM,ONTIME,Closed,Case Closed. Closed date : 2015-08-05 14:18:37.303 Case Resolved,Traffic Signal Inspection,Transportation - Traffic Division,Signs & Signals,Traffic Signal Inspection,BTDT_Traffic Signal_Repair,BTDT,,,INTERSECTION of Bowdoin St & New Chardon St  Boston  MA,3.0,1B,1.0,A1,Beacon Hill,3.0,Ward 3,306.0,,INTERSECTION Bowdoin St & New Chardon St,,Intersection,1719.0,42.3612,-71.0629,Constituent Call,"(42.3612, -71.0629)"
604621,101001503887,08/05/2015 09:46:00 AM,08/06/2015 09:46:21 AM,08/05/2015 02:18:25 PM,ONTIME,Closed,Case Closed. Closed date : 2015-08-05 14:18:25.433 Duplicate of Existing Case,Traffic Signal Inspection,Transportation - Traffic Division,Signs & Signals,Traffic Signal Inspection,BTDT_Traffic Signal_Repair,BTDT,,,INTERSECTION of Seaport Blvd & Sleeper St  Boston  MA,6.0,05,2.0,C6,South Boston / South Boston Waterfront,5.0,Ward 6,601.0,,INTERSECTION Seaport Blvd & Sleeper St,,Intersection,8312.0,42.3532,-71.0485,Constituent Call,"(42.3532, -71.0485)"
604629,101001503896,08/05/2015 09:52:00 AM,08/06/2015 09:52:50 AM,08/06/2015 10:35:54 AM,OVERDUE,Closed,Case Closed. Closed date : 2015-08-06 10:35:54.893 Case Noted There was a power issue which has been resolved.,Traffic Signal Inspection,Transportation - Traffic Division,Signs & Signals,Traffic Signal Inspection,BTDT_Engineering_Request for Traffic Signal Study or Review,BTDT,,,INTERSECTION of Seaport Blvd & Sleeper St  Boston  MA,6.0,05,2.0,C6,South Boston / South Boston Waterfront,5.0,Ward 6,601.0,,INTERSECTION Seaport Blvd & Sleeper St,,Intersection,8312.0,42.3532,-71.0485,Constituent Call,"(42.3532, -71.0485)"
604642,101001503908,08/05/2015 10:01:16 AM,08/06/2015 10:01:16 AM,08/05/2015 10:04:31 AM,ONTIME,Closed,Case Closed. Closed date : 2015-08-05 10:04:31.61 Duplicate of Existing Case case has already been submitted,Traffic Signal Inspection,Transportation - Traffic Division,Signs & Signals,Traffic Signal Inspection,BTDT_Traffic Signal_Repair,BTDT,,,INTERSECTION of Pleasant St & Sawyer Ave  Dorchester  MA,7.0,03,3.0,C11,Dorchester,7.0,Ward 13,1309.0,,INTERSECTION Pleasant St & Sawyer Ave,,Intersection,7914.0,42.3128,-71.0589,Constituent Call,"(42.3128, -71.0589)"
604675,101001503959,08/05/2015 10:30:00 AM,08/06/2015 10:30:10 AM,08/05/2015 02:17:38 PM,ONTIME,Closed,Case Closed. Closed date : 2015-08-05 14:17:38.857 Case Resolved,Traffic Signal Inspection,Transportation - Traffic Division,Signs & Signals,Traffic Signal Inspection,BTDT_Traffic Signal_Repair,BTDT,,,INTERSECTION of Colborne Rd & Commonwealth Ave  Brighton  MA,11.0,04,9.0,D14,Allston / Brighton,15.0,Ward 21,2111.0,,INTERSECTION Colborne Rd & Commonwealth Ave,,Intersection,3179.0,42.3419,-71.1459,Constituent Call,"(42.3419, -71.1459)"
604689,101001503981,08/05/2015 10:44:00 AM,08/06/2015 10:44:45 AM,08/05/2015 02:16:55 PM,ONTIME,Closed,Case Closed. Closed date : 2015-08-05 14:16:55.96 Case Resolved,Traffic Signal Inspection,Transportation - Traffic Division,Signs & Signals,Traffic Signal Inspection,BTDT_Traffic Signal_Repair,BTDT,,,INTERSECTION of Commonwealth Ave & University Rd  Boston  MA,,10A,8.0,D4,Fenway / Kenmore / Audubon Circle / Longwood,14.0,Ward 21,2102.0,,INTERSECTION Commonwealth Ave & University Rd,,Intersection,3382.0,42.3502,-71.1094,Constituent Call,"(42.3502, -71.1094)"
604719,101001504023,08/05/2015 11:05:00 AM,08/06/2015 11:05:42 AM,08/05/2015 02:28:42 PM,ONTIME,Closed,Case Closed. Closed date : 2015-08-05 14:28:42.687 Case Resolved If we are talking about City Square. Which is Rutherford and Chelsea had S-23 check and found no arrow out. Further questions please call me @ 617-635-3126. Ty Dominic,Traffic Signal Inspection,Transportation - Traffic Division,Signs & Signals,Traffic Signal Inspection,BTDT_Traffic Signal_Repair,BTDT,,,INTERSECTION of Chelsea St & Rutherford Ave  Charlestown  MA,3.0,1A,1.0,A15,Charlestown,2.0,Ward 2,201.0,,INTERSECTION Chelsea St & Rutherford Ave,,Intersection,2852.0,42.3712,-71.062,Constituent Call,"(42.3712, -71.062)"
604766,101001504084,08/05/2015 11:57:00 AM,08/06/2015 11:57:21 AM,08/05/2015 02:16:33 PM,ONTIME,Closed,Case Closed. Closed date : 2015-08-05 14:16:33.497 Case Resolved,Traffic Signal Inspection,Transportation - Traffic Division,Signs & Signals,Traffic Signal Inspection,BTDT_Traffic Signal_Repair,BTDT,,,INTERSECTION of Commonwealth Ave & Fairfield St  Boston  MA,4.0,1C,8.0,D4,Back Bay,14.0,Ward 5,508.0,,INTERSECTION Commonwealth Ave & Fairfield St,,Intersection,3395.0,42.3505,-71.0826,Constituent Call,"(42.3505, -71.0826)"
604913,101001504265,08/05/2015 02:25:00 PM,08/06/2015 02:25:16 PM,08/06/2015 02:15:00 PM,ONTIME,Closed,Case Closed. Closed date : 2015-08-06 14:15:00.53 Case Resolved Replaced bad Led's,Traffic Signal Inspection,Transportation - Traffic Division,Signs & Signals,Traffic Signal Inspection,BTDT_Traffic Signal_Repair,BTDT,,,719 Washington St  Dorchester  MA  02124,8.0,07,4.0,C11,Dorchester,9.0,17,1708.0,E,719 Washington St,2124.0,Address,146158.0,42.2862,-71.0715,Constituent Call,"(42.2862, -71.0715)"
604939,101001504299,08/05/2015 02:55:00 PM,08/06/2015 02:55:48 PM,08/06/2015 06:58:27 AM,ONTIME,Closed,Case Closed. Closed date : 2015-08-06 06:58:27.233 Case Resolved,Traffic Signal Inspection,Transportation - Traffic Division,Signs & Signals,Traffic Signal Inspection,BTDT_Traffic Signal_Repair,BTDT,,,INTERSECTION of Centre St & Ritchie St  Jamaica Plain  MA,9.0,10B,6.0,E13,Jamaica Plain,11.0,Ward 11,1104.0,,INTERSECTION Centre St & Ritchie St,,Intersection,2707.0,42.3228,-71.0997,Constituent Call,"(42.3228, -71.0997)"
605019,101001504413,08/05/2015 04:26:00 PM,08/06/2015 04:26:52 PM,08/06/2015 02:14:18 PM,ONTIME,Closed,Case Closed. Closed date : 2015-08-06 14:14:18.53 Case Resolved Refaced housing,Traffic Signal Inspection,Transportation - Traffic Division,Signs & Signals,Traffic Signal Inspection,BTDT_Traffic Signal_Repair,BTDT,,,INTERSECTION of Lincoln St & Summer St  Boston  MA,3.0,1C,2.0,A1,Downtown / Financial District,4.0,Ward 3,308.0,,INTERSECTION Lincoln St & Summer St,,Intersection,6878.0,42.3535,-71.0577,Constituent Call,"(42.3535, -71.0577)"
605045,101001504445,08/05/2015 05:14:00 PM,08/06/2015 05:14:03 PM,08/06/2015 07:33:33 AM,ONTIME,Closed,Case Closed. Closed date : 2015-08-06 07:33:33.487 Case Resolved system was down should be good now. Further questions please call me @ 617-635-3126. Ty Dominic,Traffic Signal Inspection,Transportation - Traffic Division,Signs & Signals,Traffic Signal Inspection,BTDT_Traffic Signal_Repair,BTDT,,,INTERSECTION of Boylston St & Charlesgate East  Boston  MA,4.0,10A,8.0,D4,Fenway / Kenmore / Audubon Circle / Longwood,14.0,Ward 5,510.0,,INTERSECTION Boylston St & Charlesgate East,,Intersection,1768.0,42.3466,-71.0904,Constituent Call,"(42.3466, -71.0904)"
605158,101001504600,08/06/2015 06:32:00 AM,08/07/2015 06:32:25 AM,08/06/2015 01:20:32 PM,ONTIME,Closed,Case Closed. Closed date : 2015-08-06 13:20:32.023 Case Resolved,Traffic Signal Inspection,Transportation - Traffic Division,Signs & Signals,Traffic Signal Inspection,BTDT_Traffic Signal_Repair,BTDT,,,INTERSECTION of Huntington Ave & Longwood Ave  Boston  MA,4.0,10A,8.0,B2,Fenway / Kenmore / Audubon Circle / Longwood,14.0,Ward 4,410.0,,INTERSECTION Huntington Ave & Longwood Ave,,Intersection,6426.0,42.3359,-71.1003,Constituent Call,"(42.3359, -71.1003)"
605175,101001504618,08/06/2015 07:19:00 AM,08/07/2015 07:19:35 AM,08/06/2015 01:20:13 PM,ONTIME,Closed,Case Closed. Closed date : 2015-08-06 13:20:13.29 Case Resolved,Traffic Signal Inspection,Transportation - Traffic Division,Signs & Signals,Traffic Signal Inspection,BTDT_Traffic Signal_Repair,BTDT,,,INTERSECTION of Commonwealth Ave & Fairfield St  Boston  MA,4.0,1C,8.0,D4,Back Bay,14.0,Ward 5,508.0,,INTERSECTION Commonwealth Ave & Fairfield St,,Intersection,3395.0,42.3505,-71.0826,Constituent Call,"(42.3505, -71.0826)"
605586,101001505148,08/06/2015 03:16:00 PM,08/07/2015 03:16:06 PM,08/10/2015 07:24:14 AM,OVERDUE,Closed,Case Closed. Closed date : 2015-08-10 07:24:14.257 Case Resolved,Traffic Signal Inspection,Transportation - Traffic Division,Signs & Signals,Traffic Signal Inspection,BTDT_Traffic Signal_Repair,BTDT,,,INTERSECTION of Centre St & Ritchie St  Jamaica Plain  MA,9.0,10B,6.0,E13,Jamaica Plain,11.0,Ward 11,1104.0,,INTERSECTION Centre St & Ritchie St,,Intersection,2707.0,42.3228,-71.0997,Constituent Call,"(42.3228, -71.0997)"
605608,101001505179,08/06/2015 03:49:00 PM,08/07/2015 03:49:07 PM,08/07/2015 07:15:07 AM,ONTIME,Closed,Case Closed. Closed date : 2015-08-07 07:15:07.24 Case Resolved Right now we are having problem with our system. If still occurs please call me @ 617-635-3126. Ty Dominic,Traffic Signal Inspection,Transportation - Traffic Division,Signs & Signals,Traffic Signal Inspection,BTDT_Traffic Signal_Repair,BTDT,,,INTERSECTION of Centre St & Columbus Ave  Roxbury  MA,9.0,10B,7.0,B2,Roxbury,13.0,Ward 11,1101.0,,INTERSECTION Centre St & Columbus Ave,,Intersection,2709.0,42.3249,-71.0983,Constituent Call,"(42.3249, -71.0983)"
605656,101001505248,08/06/2015 05:33:00 PM,08/07/2015 05:33:02 PM,08/10/2015 07:22:07 AM,OVERDUE,Closed,Case Closed. Closed date : 2015-08-10 07:22:07.47 Case Resolved,Traffic Signal Inspection,Transportation - Traffic Division,Signs & Signals,Traffic Signal Inspection,BTDT_Traffic Signal_Repair,BTDT,,,INTERSECTION of Elm Hill Ave & Warren St  Dorchester  MA,9.0,10B,7.0,B2,Roxbury,13.0,Ward 12,1202.0,,INTERSECTION Elm Hill Ave & Warren St,,Intersection,4537.0,42.3131,-71.0835,Constituent Call,"(42.3131, -71.0835)"
605708,101001505324,08/06/2015 07:23:00 PM,08/07/2015 07:23:38 PM,08/07/2015 06:53:53 AM,ONTIME,Closed,Case Closed. Closed date : 2015-08-07 06:53:53.227 Case Resolved,Traffic Signal Inspection,Transportation - Traffic Division,Signs & Signals,Traffic Signal Inspection,BTDT_Traffic Signal_Repair,BTDT,,,INTERSECTION of Charlesgate East & Commonwealth Ave  Boston  MA,4.0,10A,8.0,D4,Fenway / Kenmore / Audubon Circle / Longwood,14.0,Ward 5,510.0,,INTERSECTION Charlesgate East & Commonwealth Ave,,Intersection,2817.0,42.3488,-71.0916,Constituent Call,"(42.3488, -71.0916)"
605718,101001505337,08/06/2015 07:48:00 PM,08/07/2015 07:48:12 PM,08/07/2015 06:51:03 AM,ONTIME,Closed,Case Closed. Closed date : 2015-08-07 06:51:03.887 Case Resolved,Traffic Signal Inspection,Transportation - Traffic Division,Signs & Signals,Traffic Signal Inspection,BTDT_Traffic Signal_Repair,BTDT,,,INTERSECTION of Congress St & Milk St  Boston  MA,3.0,1C,1.0,A1,Downtown / Financial District,3.0,Ward 3,306.0,,INTERSECTION Congress St & Milk St,,Intersection,3436.0,42.3568,-71.0563,Constituent Call,"(42.3568, -71.0563)"
605865,101001505544,08/07/2015 09:19:48 AM,08/08/2015 09:19:48 AM,08/07/2015 09:29:09 AM,ONTIME,Closed,Case Closed. Closed date : 2015-08-07 09:29:09.623 Case Invalid,Traffic Signal Inspection,Transportation - Traffic Division,Signs & Signals,Traffic Signal Inspection,INFO_Reallocation From Dept,INFO,,,INTERSECTION of Independence Dr & VFW Pkwy  West Roxbury  MA,12.0,06,6.0,E5,West Roxbury,12.0,Ward 20,2020.0,,INTERSECTION Independence Dr & VFW Pkwy,,Intersection,6491.0,42.2955,-71.1576,Constituent Call,"(42.2955, -71.1576)"
605947,101001505658,08/07/2015 10:44:00 AM,08/08/2015 10:44:20 AM,08/12/2015 02:50:55 PM,OVERDUE,Closed,Case Closed. Closed date : 2015-08-12 14:50:55.18 Case Resolved,Traffic Signal Inspection,Transportation - Traffic Division,Signs & Signals,Traffic Signal Inspection,BTDT_Traffic Signal_Repair,BTDT,,,INTERSECTION of Purchase St & Summer St  Boston  MA,3.0,1C,2.0,A1,Downtown / Financial District,4.0,Ward 3,308.0,,INTERSECTION Purchase St & Summer St,,Intersection,8020.0,42.3528,-71.0557,Constituent Call,"(42.3528, -71.0557)"
606080,101001505831,08/07/2015 01:00:00 PM,08/08/2015 01:00:15 PM,08/07/2015 02:55:12 PM,ONTIME,Closed,Case Closed. Closed date : 2015-08-07 14:55:12.373 Case Resolved,Traffic Signal Inspection,Transportation - Traffic Division,Signs & Signals,Traffic Signal Inspection,BTDT_Traffic Signal_Repair,BTDT,,,INTERSECTION of Bennington St & Saratoga St  East Boston  MA,1.0,09,1.0,A7,East Boston,1.0,Ward 1,112.0,,INTERSECTION Bennington St & Saratoga St,,Intersection,1333.0,42.3866,-71.0067,Constituent Call,"(42.3866, -71.0067)"
606244,101001506059,08/07/2015 03:47:00 PM,08/08/2015 03:47:02 PM,08/10/2015 01:47:00 PM,OVERDUE,Closed,Case Closed. Closed date : 2015-08-10 13:47:00.223 Case Resolved,Traffic Signal Inspection,Transportation - Traffic Division,Signs & Signals,Traffic Signal Inspection,BTDT_Traffic Signal_Repair,BTDT,,,INTERSECTION of Massachusetts Ave & Tremont St  Roxbury  MA,9.0,1C,7.0,D4,Roxbury,13.0,Ward 9,903.0,,INTERSECTION Massachusetts Ave & Tremont St,,Intersection,7142.0,42.3393,-71.0804,Constituent Call,"(42.3393, -71.0804)"
606298,101001516131,08/07/2015 05:15:00 PM,08/08/2015 05:15:17 PM,08/10/2015 07:18:04 AM,OVERDUE,Closed,Case Closed. Closed date : 2015-08-10 07:18:04.727 Case Resolved,Traffic Signal Inspection,Transportation - Traffic Division,Signs & Signals,Traffic Signal Inspection,BTDT_Traffic Signal_Repair,BTDT,,,INTERSECTION of Washington St & Hyde Park Ave  Jamaica Plain  MA,12.0,02,6.0,E13,Jamaica Plain,11.0,Ward 11,1108.0,,INTERSECTION Washington St & Hyde Park Ave,,Intersection,6010.0,42.3013,-71.1126,Constituent Call,"(42.3013, -71.1126)"
606441,101001516335,08/08/2015 10:36:00 AM,08/09/2015 10:36:10 AM,08/10/2015 07:08:58 AM,OVERDUE,Closed,Case Closed. Closed date : 2015-08-10 07:08:58.987 Case Resolved,Traffic Signal Inspection,Transportation - Traffic Division,Signs & Signals,Traffic Signal Inspection,BTDT_Traffic Signal_Repair,BTDT,,,INTERSECTION of Berkeley St & Columbus Ave  Boston  MA,4.0,1C,2.0,D4,Back Bay,6.0,Ward 5,501.0,,INTERSECTION Berkeley St & Columbus Ave,,Intersection,1358.0,42.3487,-71.0718,Constituent Call,"(42.3487, -71.0718)"
606443,101001516339,08/08/2015 10:57:00 AM,08/09/2015 10:57:36 AM,08/10/2015 07:08:47 AM,OVERDUE,Closed,Case Closed. Closed date : 2015-08-10 07:08:47.083 Case Resolved,Traffic Signal Inspection,Transportation - Traffic Division,Signs & Signals,Traffic Signal Inspection,BTDT_Traffic Signal_Repair,BTDT,,,INTERSECTION of Berkeley St & Columbus Ave  Boston  MA,4.0,1C,2.0,D4,Back Bay,6.0,Ward 5,501.0,,INTERSECTION Berkeley St & Columbus Ave,,Intersection,1358.0,42.3487,-71.0718,Constituent Call,"(42.3487, -71.0718)"
606594,101001516574,08/09/2015 10:52:00 AM,08/10/2015 10:52:04 AM,08/10/2015 07:08:36 AM,ONTIME,Closed,Case Closed. Closed date : 2015-08-10 07:08:36.87 Case Resolved,Traffic Signal Inspection,Transportation - Traffic Division,Signs & Signals,Traffic Signal Inspection,BTDT_Traffic Signal_Repair,BTDT,,,INTERSECTION of Cumberland St & Huntington Ave  Boston  MA,4.0,1C,7.0,D4,Back Bay,14.0,Ward 4,405.0,,INTERSECTION Cumberland St & Huntington Ave,,Intersection,3717.0,42.3443,-71.083,Constituent Call,"(42.3443, -71.083)"
606640,101001516648,08/09/2015 02:21:00 PM,08/10/2015 02:21:23 PM,08/10/2015 07:08:26 AM,ONTIME,Closed,Case Closed. Closed date : 2015-08-10 07:08:26.477 Case Resolved,Traffic Signal Inspection,Transportation - Traffic Division,Signs & Signals,Traffic Signal Inspection,BTDT_Traffic Signal_Repair,BTDT,,,INTERSECTION of Berkeley St & Columbus Ave  Boston  MA,4.0,1C,2.0,D4,Back Bay,6.0,Ward 5,501.0,,INTERSECTION Berkeley St & Columbus Ave,,Intersection,1358.0,42.3487,-71.0718,Constituent Call,"(42.3487, -71.0718)"
606712,101001516761,08/10/2015 05:55:00 AM,08/11/2015 05:55:40 AM,08/10/2015 01:45:23 PM,ONTIME,Closed,Case Closed. Closed date : 2015-08-10 13:45:23.89 Case Resolved,Traffic Signal Inspection,Transportation - Traffic Division,Signs & Signals,Traffic Signal Inspection,BTDT_Traffic Signal_Repair,BTDT,,,INTERSECTION of Washington St & Marginal Rd  Boston  MA,4.0,1C,2.0,A1,Downtown / Financial District,4.0,Ward 3,308.0,,INTERSECTION Washington St & Marginal Rd,,Intersection,6063.0,42.3473,-71.0644,Constituent Call,"(42.3473, -71.0644)"
606780,101001516863,08/10/2015 08:56:00 AM,08/11/2015 08:56:56 AM,08/10/2015 01:38:08 PM,ONTIME,Closed,Case Closed. Closed date : 2015-08-10 13:38:08.363 Case Resolved,Traffic Signal Inspection,Transportation - Traffic Division,Signs & Signals,Traffic Signal Inspection,BTDT_Traffic Signal_Repair,BTDT,,,INTERSECTION of Columbia Rd & Hamilton St  Dorchester  MA,7.0,03,3.0,C11,Dorchester,8.0,Ward 15,1501.0,,INTERSECTION Columbia Rd & Hamilton St,,Intersection,3225.0,42.3101,-71.0723,Constituent Call,"(42.3101, -71.0723)"
606791,101001516876,08/10/2015 09:03:00 AM,08/11/2015 09:03:06 AM,08/10/2015 01:37:57 PM,ONTIME,Closed,Case Closed. Closed date : 2015-08-10 13:37:57.337 Case Resolved S-11 found running normal operations,Traffic Signal Inspection,Transportation - Traffic Division,Signs & Signals,Traffic Signal Inspection,BTDT_Traffic Signal_Repair,BTDT,,,INTERSECTION of Blue Hill Ave & Mount Pleasant Ave  Roxbury  MA,7.0,03,7.0,B2,Roxbury,13.0,Ward 8,807.0,,INTERSECTION Blue Hill Ave & Mount Pleasant Ave,,Intersection,1606.0,42.3253,-71.075,Constituent Call,"(42.3253, -71.075)"
606941,101001517073,08/10/2015 11:22:00 AM,08/11/2015 11:22:17 AM,08/12/2015 02:48:43 PM,OVERDUE,Closed,Case Closed. Closed date : 2015-08-12 14:48:43.83 Case Resolved,Traffic Signal Inspection,Transportation - Traffic Division,Signs & Signals,Traffic Signal Inspection,BTDT_Traffic Signal_Repair,BTDT,,,INTERSECTION of Commonwealth Ave & Lake St  Brighton  MA,,04,9.0,D14,Allston / Brighton,15.0,Ward 22,2208.0,,INTERSECTION Commonwealth Ave & Lake St,,Intersection,3336.0,42.3401,-71.1661,Constituent Call,"(42.3401, -71.1661)"
607312,101001517601,08/10/2015 07:12:08 PM,08/11/2015 07:12:08 PM,08/13/2015 07:09:38 AM,OVERDUE,Closed,Case Closed. Closed date : 2015-08-13 07:09:38.69 Case Resolved,Traffic Signal Inspection,Transportation - Traffic Division,Signs & Signals,Traffic Signal Inspection,BTDT_Traffic Signal_Repair,BTDT,https://mayors24.cityofboston.gov/media/boston/report/photos/55c92fca6963fe2d4ed26218/report.jpg,,INTERSECTION of Huntington Ave & Longwood Ave  Boston  MA,4.0,10A,8.0,B2,Fenway / Kenmore / Audubon Circle / Longwood,14.0,Ward 4,410.0,,INTERSECTION Huntington Ave & Longwood Ave,,Intersection,6426.0,42.3359,-71.1003,Citizens Connect App,"(42.3359, -71.1003)"
607426,101001517752,08/11/2015 06:41:00 AM,08/12/2015 06:41:22 AM,08/12/2015 02:46:38 PM,OVERDUE,Closed,Case Closed. Closed date : 2015-08-12 14:46:38.253 Case Resolved Secured housing will reinstall on 8-13-15 Yy Further questions please call me @ 617-635-3126. Dominic,Traffic Signal Inspection,Transportation - Traffic Division,Signs & Signals,Traffic Signal Inspection,BTDT_Traffic Signal_Repair,BTDT,,,INTERSECTION of Federal St & High St  Boston  MA,3.0,1C,1.0,A1,Downtown / Financial District,3.0,Ward 3,306.0,,INTERSECTION Federal St & High St,,Intersection,4852.0,42.3536,-71.0562,Constituent Call,"(42.3536, -71.0562)"
607442,101001517772,08/11/2015 07:41:27 AM,08/12/2015 07:41:28 AM,08/12/2015 02:44:41 PM,OVERDUE,Closed,Case Closed. Closed date : 2015-08-12 14:44:41.563 Duplicate of Existing Case,Traffic Signal Inspection,Transportation - Traffic Division,Signs & Signals,Traffic Signal Inspection,BTDT_Traffic Signal_Repair,BTDT,,,INTERSECTION of Boylston St & Clarendon St  Boston  MA,4.0,1C,2.0,D4,Back Bay,6.0,Ward 4,402.0,,INTERSECTION Boylston St & Clarendon St,,Intersection,1779.0,42.3507,-71.0752,Citizens Connect App,"(42.3507, -71.0752)"
607491,101001517830,08/11/2015 08:27:57 AM,08/12/2015 08:27:57 AM,08/13/2015 09:59:01 AM,OVERDUE,Closed,Case Closed. Closed date : 2015-08-13 09:59:01.377 Case Resolved,Traffic Signal Inspection,Transportation - Traffic Division,Signs & Signals,Traffic Signal Inspection,BTDT_Traffic Signal_Repair,BTDT,https://mayors24.cityofboston.gov/media/boston/report/photos/55c9ea526963fe2d4ed26a19/photo_20150811_082733.jpg,,INTERSECTION of South St & Summer St  Boston  MA,3.0,1C,2.0,A1,Downtown / Financial District,4.0,Ward 3,308.0,,INTERSECTION South St & Summer St,,Intersection,8396.0,42.3532,-71.0569,Citizens Connect App,"(42.3532, -71.0569)"
607495,101001517834,08/11/2015 08:31:43 AM,08/12/2015 08:31:43 AM,08/12/2015 02:43:27 PM,OVERDUE,Closed,Case Closed. Closed date : 2015-08-12 14:43:27.747 Duplicate of Existing Case,Traffic Signal Inspection,Transportation - Traffic Division,Signs & Signals,Traffic Signal Inspection,BTDT_Traffic Signal_Repair,BTDT,https://mayors24.cityofboston.gov/media/boston/report/photos/55c9eb316963fe2d4ed26a47/report.jpg,,INTERSECTION of Boylston St & Clarendon St  Boston  MA,4.0,1C,2.0,D4,Back Bay,6.0,Ward 4,402.0,,INTERSECTION Boylston St & Clarendon St,,Intersection,1779.0,42.3507,-71.0752,Citizens Connect App,"(42.3507, -71.0752)"
607531,101001517888,08/11/2015 08:54:00 AM,08/12/2015 08:54:49 AM,08/12/2015 02:42:06 PM,OVERDUE,Closed,Case Closed. Closed date : 2015-08-12 14:42:06.003 Case Resolved,Traffic Signal Inspection,Transportation - Traffic Division,Signs & Signals,Traffic Signal Inspection,BTDT_Traffic Signal_Repair,BTDT,,,INTERSECTION of Federal St & High St  Boston  MA,3.0,1C,1.0,A1,Downtown / Financial District,3.0,Ward 3,306.0,,INTERSECTION Federal St & High St,,Intersection,4852.0,42.3536,-71.0562,Constituent Call,"(42.3536, -71.0562)"
607535,101001517894,08/11/2015 08:56:00 AM,08/12/2015 08:56:33 AM,08/12/2015 07:49:43 AM,ONTIME,Closed,Case Closed. Closed date : 2015-08-12 07:49:43.727 Case Resolved,Traffic Signal Inspection,Transportation - Traffic Division,Signs & Signals,Traffic Signal Inspection,BTDT_Traffic Signal_Repair,BTDT,,,INTERSECTION of Blue Hill Ave & W Cottage St  Roxbury  MA,7.0,03,7.0,B2,Roxbury,13.0,Ward 8,807.0,,INTERSECTION Blue Hill Ave & W Cottage St,,Intersection,1595.0,42.3204,-71.0778,Constituent Call,"(42.3204, -71.0778)"
607657,101001518042,08/11/2015 10:40:05 AM,08/12/2015 10:40:05 AM,08/13/2015 07:06:29 AM,OVERDUE,Closed,Case Closed. Closed date : 2015-08-13 07:06:29.957 Duplicate of Existing Case,Traffic Signal Inspection,Transportation - Traffic Division,Signs & Signals,Traffic Signal Inspection,BTDT_Traffic Signal_Repair,BTDT,,,INTERSECTION of Boylston St & Clarendon St  Boston  MA,4.0,1C,2.0,D4,Back Bay,6.0,Ward 4,402.0,,INTERSECTION Boylston St & Clarendon St,,Intersection,1779.0,42.3507,-71.0752,Citizens Connect App,"(42.3507, -71.0752)"
607691,101001518088,08/11/2015 11:12:00 AM,08/12/2015 11:12:36 AM,08/12/2015 07:48:06 AM,ONTIME,Closed,Case Closed. Closed date : 2015-08-12 07:48:06.753 Case Resolved,Traffic Signal Inspection,Transportation - Traffic Division,Signs & Signals,Traffic Signal Inspection,BTDT_Traffic Signal_Repair,BTDT,,,INTERSECTION of Archdale Rd & Washington St  Roslindale  MA,12.0,02,5.0,E5,Roslindale,10.0,Ward 19,1911.0,,INTERSECTION Archdale Rd & Washington St,,Intersection,540.0,42.2928,-71.1214,Constituent Call,"(42.2928, -71.1214)"
607716,101001518119,08/11/2015 11:36:03 AM,08/12/2015 11:36:03 AM,08/11/2015 11:38:41 AM,ONTIME,Closed,Case Closed. Closed date : 2015-08-11 11:38:41.013 Duplicate of Existing Case traffic mgmt is aware of issue,Traffic Signal Inspection,Transportation - Traffic Division,Signs & Signals,Traffic Signal Inspection,BTDT_Traffic Signal_Repair,BTDT,,,INTERSECTION of Boylston St & Massachusetts Ave  Boston  MA,4.0,1C,8.0,D4,Back Bay,14.0,Ward 4,406.0,,INTERSECTION Boylston St & Massachusetts Ave,,Intersection,1770.0,42.3473,-71.0877,Constituent Call,"(42.3473, -71.0877)"
607738,101001518156,08/11/2015 12:20:36 PM,08/12/2015 12:20:37 PM,08/13/2015 10:03:11 AM,OVERDUE,Closed,Case Closed. Closed date : 2015-08-13 10:03:11.4 Case Resolved Replaced 2 bad buttons,Traffic Signal Inspection,Transportation - Traffic Division,Signs & Signals,Traffic Signal Inspection,BTDT_Traffic Signal_Repair,BTDT,,,INTERSECTION of Arlington St & Beacon St  Boston  MA,4.0,1C,8.0,D4,Back Bay,14.0,Ward 5,505.0,,INTERSECTION Arlington St & Beacon St,,Intersection,575.0,42.3554,-71.0726,Citizens Connect App,"(42.3554, -71.0726)"
607740,101001518158,08/11/2015 12:21:00 PM,08/12/2015 12:21:19 PM,08/11/2015 01:08:55 PM,ONTIME,Closed,Case Closed. Closed date : 2015-08-11 13:08:55.517 Case Resolved,Traffic Signal Inspection,Transportation - Traffic Division,Signs & Signals,Traffic Signal Inspection,BTDT_Traffic Signal_Repair,BTDT,,,INTERSECTION of Boylston St & Massachusetts Ave  Boston  MA,4.0,1C,8.0,D4,Back Bay,14.0,Ward 4,406.0,,INTERSECTION Boylston St & Massachusetts Ave,,Intersection,1770.0,42.3473,-71.0877,Constituent Call,"(42.3473, -71.0877)"
607767,101001518204,08/11/2015 01:09:00 PM,08/12/2015 01:09:03 PM,08/12/2015 07:47:14 AM,ONTIME,Closed,Case Closed. Closed date : 2015-08-12 07:47:14.367 Case Resolved,Traffic Signal Inspection,Transportation - Traffic Division,Signs & Signals,Traffic Signal Inspection,BTDT_Traffic Signal_Repair,BTDT,,,INTERSECTION of Beacon St & Charles St  Boston  MA,3.0,1B,8.0,A1,Beacon Hill,14.0,Ward 5,503.0,,INTERSECTION Beacon St & Charles St,,Intersection,1106.0,42.3562,-71.0694,Constituent Call,"(42.3562, -71.0694)"
607813,101001518263,08/11/2015 01:44:36 PM,08/12/2015 01:44:36 PM,08/12/2015 02:41:28 PM,OVERDUE,Closed,Case Closed. Closed date : 2015-08-12 14:41:28.57 Case Noted We have made it safe. But it needs new foundation which is on list to be done. My guess is that it willbe done sometime this month. Furhter questions please call me @ 617-635-3126. Ty  Dominic,Traffic Signal Inspection,Transportation - Traffic Division,Signs & Signals,Traffic Signal Inspection,BTDT_Traffic Signal_Repair,BTDT,,,INTERSECTION of Washington St & Melnea Cass Blvd  Roxbury  MA,7.0,10B,7.0,B2,Roxbury,13.0,Ward 8,804.0,,INTERSECTION Washington St & Melnea Cass Blvd,,Intersection,6040.0,42.3329,-71.081,Citizens Connect App,"(42.3329, -71.081)"
607835,101001518297,08/11/2015 02:07:00 PM,08/12/2015 02:07:52 PM,08/12/2015 07:46:15 AM,ONTIME,Closed,Case Closed. Closed date : 2015-08-12 07:46:15.713 Case Resolved,Traffic Signal Inspection,Transportation - Traffic Division,Signs & Signals,Traffic Signal Inspection,BTDT_Traffic Signal_Repair,BTDT,,,INTERSECTION of Beacon St & Charles St  Boston  MA,3.0,1B,8.0,A1,Beacon Hill,14.0,Ward 5,503.0,,INTERSECTION Beacon St & Charles St,,Intersection,1106.0,42.3562,-71.0694,Constituent Call,"(42.3562, -71.0694)"
607898,101001518381,08/11/2015 02:59:54 PM,08/12/2015 02:59:54 PM,08/12/2015 01:12:23 PM,ONTIME,Closed,Case Closed. Closed date : 2015-08-12 13:12:23.807 Case Resolved replaced bad green,Traffic Signal Inspection,Transportation - Traffic Division,Signs & Signals,Traffic Signal Inspection,BTDT_Traffic Signal_Repair,BTDT,,,INTERSECTION of Hesston Ter & Pleasant St  Dorchester  MA,7.0,03,3.0,C11,Dorchester,7.0,Ward 13,1309.0,,INTERSECTION Hesston Ter & Pleasant St,,Intersection,5892.0,42.3142,-71.0599,Citizens Connect App,"(42.3142, -71.0599)"
607900,101001518384,08/11/2015 03:03:00 PM,08/12/2015 03:03:01 PM,08/12/2015 07:45:30 AM,ONTIME,Closed,Case Closed. Closed date : 2015-08-12 07:45:30.07 Case Resolved,Traffic Signal Inspection,Transportation - Traffic Division,Signs & Signals,Traffic Signal Inspection,BTDT_Traffic Signal_Repair,BTDT,,,INTERSECTION of Beacon St & Charles St  Boston  MA,3.0,1B,8.0,A1,Beacon Hill,14.0,Ward 5,503.0,,INTERSECTION Beacon St & Charles St,,Intersection,1106.0,42.3562,-71.0694,Constituent Call,"(42.3562, -71.0694)"
607910,101001518402,08/11/2015 03:10:00 PM,08/12/2015 03:10:27 PM,08/14/2015 07:16:59 AM,OVERDUE,Closed,Case Closed. Closed date : 2015-08-14 07:16:59.007 Case Resolved Repaired same  further questions please call me @ 617-635-3126. ty Dominc,Traffic Signal Inspection,Transportation - Traffic Division,Signs & Signals,Traffic Signal Inspection,BTDT_Traffic Signal_Repair,BTDT,,,INTERSECTION of Main St & School St  Charlestown  MA,3.0,1A,1.0,A15,Charlestown,2.0,Ward 2,201.0,,INTERSECTION Main St & School St,,Intersection,7000.0,42.3765,-71.0658,Constituent Call,"(42.3765, -71.0658)"
607914,101001518404,08/11/2015 03:12:00 PM,08/12/2015 03:12:09 PM,08/12/2015 04:35:58 PM,OVERDUE,Closed,Case Closed. Closed date : 2015-08-12 16:35:58.33 Case Invalid There are no traffic signals at this location. Please provide a better location.,Traffic Signal Inspection,Transportation - Traffic Division,Signs & Signals,Traffic Signal Inspection,INFO_Reallocation From Dept,INFO,,,INTERSECTION of New Haven St & Stimson St  West Roxbury  MA,12.0,06,6.0,E5,West Roxbury,12.0,Ward 20,2015.0,,INTERSECTION New Haven St & Stimson St,,Intersection,7541.0,42.2633,-71.1667,Citizens Connect App,"(42.2633, -71.1667)"
607921,101001518411,08/11/2015 03:18:00 PM,08/12/2015 03:18:23 PM,,OVERDUE,Open,,Traffic Signal Inspection,Transportation - Traffic Division,Signs & Signals,Traffic Signal Inspection,INFO01_GenericeFormforOtherServiceRequestTypes,INFO,,,INTERSECTION of Columbia Rd & G St  South Boston  MA,6.0,05,2.0,C6,South Boston / South Boston Waterfront,5.0,Ward 7,703.0,,INTERSECTION Columbia Rd & G St,,Intersection,3255.0,42.3305,-71.0441,Citizens Connect App,"(42.3305, -71.0441)"
607931,101001518427,08/11/2015 03:23:00 PM,08/12/2015 03:23:57 PM,08/12/2015 07:44:52 AM,ONTIME,Closed,Case Closed. Closed date : 2015-08-12 07:44:52.85 Case Resolved,Traffic Signal Inspection,Transportation - Traffic Division,Signs & Signals,Traffic Signal Inspection,BTDT_Traffic Signal_Repair,BTDT,,,INTERSECTION of Beacon St & Charles St  Boston  MA,3.0,1B,8.0,A1,Beacon Hill,14.0,Ward 5,503.0,,INTERSECTION Beacon St & Charles St,,Intersection,1106.0,42.3562,-71.0694,Constituent Call,"(42.3562, -71.0694)"
607933,101001518426,08/11/2015 03:23:54 PM,08/12/2015 03:23:55 PM,08/14/2015 07:15:09 AM,OVERDUE,Closed,Case Closed. Closed date : 2015-08-14 07:15:09.92 Case Resolved,Traffic Signal Inspection,Transportation - Traffic Division,Signs & Signals,Traffic Signal Inspection,BTDT_Traffic Signal_Repair,BTDT,,,INTERSECTION of Warren St & Monastery Path  Boston  MA,11.0,04,9.0,D14,Allston / Brighton,15.0,Ward 21,2109.0,,INTERSECTION Warren St & Monastery Path,,Intersection,5913.0,42.3497,-71.1441,Citizens Connect App,"(42.3497, -71.1441)"
607981,101001518494,08/11/2015 03:55:00 PM,08/12/2015 03:55:13 PM,08/12/2015 07:43:52 AM,ONTIME,Closed,Case Closed. Closed date : 2015-08-12 07:43:52.88 Case Resolved,Traffic Signal Inspection,Transportation - Traffic Division,Signs & Signals,Traffic Signal Inspection,BTDT_Traffic Signal_Repair,BTDT,,,INTERSECTION of Clarendon St & Tremont St  Boston  MA,4.0,1C,2.0,D4,South End,4.0,Ward 3,307.0,,INTERSECTION Clarendon St & Tremont St,,Intersection,3080.0,42.3439,-71.0718,Constituent Call,"(42.3439, -71.0718)"
607993,101001518514,08/11/2015 04:07:00 PM,08/12/2015 04:07:50 PM,08/12/2015 07:20:43 AM,ONTIME,Closed,Case Closed. Closed date : 2015-08-12 07:20:43.233 Case Resolved,Traffic Signal Inspection,Transportation - Traffic Division,Signs & Signals,Traffic Signal Inspection,BTDT_Traffic Signal_Repair,BTDT,,,INTERSECTION of Clarendon St & Tremont St  Boston  MA,4.0,1C,2.0,D4,South End,4.0,Ward 3,307.0,,INTERSECTION Clarendon St & Tremont St,,Intersection,3080.0,42.3439,-71.0718,Constituent Call,"(42.3439, -71.0718)"
607997,101001518517,08/11/2015 04:08:00 PM,08/12/2015 04:08:24 PM,08/28/2015 01:38:56 PM,OVERDUE,Closed,Case Closed. Closed date : 2015-08-28 13:38:56.447 Case Noted A traffic signal is being designed for this location.,Traffic Signal Inspection,Transportation - Traffic Division,Signs & Signals,Traffic Signal Inspection,BTDT_Engineering_Request for Traffic Signal Study or Review,BTDT,,,INTERSECTION of Geneva Ave & Olney St  Dorchester  MA,7.0,03,4.0,C11,Dorchester,8.0,Ward 14,1404.0,,INTERSECTION Geneva Ave & Olney St,,Intersection,5250.0,42.3049,-71.0741,Citizens Connect App,"(42.3049, -71.0741)"
608028,101001518560,08/11/2015 04:31:25 PM,08/12/2015 04:31:25 PM,09/19/2015 08:27:01 AM,OVERDUE,Closed,Case Closed. Closed date : 2015-09-19 08:27:01.43 Case Resolved,Traffic Signal Inspection,Transportation - Traffic Division,Signs & Signals,Traffic Signal Inspection,BTDT_Traffic Signal_Repair,BTDT,,,INTERSECTION of Atlantic Ave & Essex St  Boston  MA,3.0,1C,2.0,A1,Downtown / Financial District,4.0,Ward 3,308.0,,INTERSECTION Atlantic Ave & Essex St,,Intersection,731.0,42.3518,-71.0559,Citizens Connect App,"(42.3518, -71.0559)"
608038,101001518574,08/11/2015 04:40:00 PM,08/12/2015 04:40:27 PM,08/12/2015 07:19:35 AM,ONTIME,Closed,Case Closed. Closed date : 2015-08-12 07:19:35.54 Case Resolved,Traffic Signal Inspection,Transportation - Traffic Division,Signs & Signals,Traffic Signal Inspection,BTDT_Traffic Signal_Repair,BTDT,,,INTERSECTION of Clarendon St & Tremont St  Boston  MA,4.0,1C,2.0,D4,South End,4.0,Ward 3,307.0,,INTERSECTION Clarendon St & Tremont St,,Intersection,3080.0,42.3439,-71.0718,Constituent Call,"(42.3439, -71.0718)"
608057,101001518598,08/11/2015 04:55:57 PM,08/12/2015 04:55:57 PM,08/13/2015 07:02:31 AM,OVERDUE,Closed,Case Closed. Closed date : 2015-08-13 07:02:31.81 Case Resolved Centre Adams Elmdale. S-19 found no trouble. Further questions please call me @ 617-635-3126. Ty Dominic,Traffic Signal Inspection,Transportation - Traffic Division,Signs & Signals,Traffic Signal Inspection,BTDT_Traffic Signal_Repair,BTDT,,,INTERSECTION of Houghton St & Victory Rd  Dorchester  MA,8.0,07,3.0,C11,Dorchester,7.0,Ward 16,1605.0,,INTERSECTION Houghton St & Victory Rd,,Intersection,6370.0,42.296,-71.0534,Citizens Connect App,"(42.296, -71.0534)"
608059,101001518600,08/11/2015 04:57:24 PM,08/12/2015 04:57:25 PM,08/18/2015 06:46:35 AM,OVERDUE,Closed,Case Closed. Closed date : 2015-08-18 06:46:35.447 Case Resolved,Traffic Signal Inspection,Transportation - Traffic Division,Signs & Signals,Traffic Signal Inspection,BTDT_Traffic Signal_Repair,BTDT,,,INTERSECTION of Cambridge St & N Harvard St  Allston  MA,11.0,04,9.0,D14,Allston / Brighton,15.0,Ward 22,2201.0,,INTERSECTION Cambridge St & N Harvard St,,Intersection,2355.0,42.3578,-71.1264,Citizens Connect App,"(42.3578, -71.1264)"
608083,101001518636,08/11/2015 05:20:00 PM,08/12/2015 05:20:51 PM,08/12/2015 07:12:45 AM,ONTIME,Closed,Case Closed. Closed date : 2015-08-12 07:12:45.563 Case Resolved,Traffic Signal Inspection,Transportation - Traffic Division,Signs & Signals,Traffic Signal Inspection,BTDT_Traffic Signal_Repair,BTDT,,,INTERSECTION of Brighton Ave & Linden St  Allston  MA,11.0,04,9.0,D14,Allston / Brighton,15.0,Ward 21,2105.0,,INTERSECTION Brighton Ave & Linden St,,Intersection,1947.0,42.3527,-71.1302,Constituent Call,"(42.3527, -71.1302)"
608178,101001518754,08/11/2015 06:59:24 PM,08/12/2015 06:59:25 PM,08/14/2015 07:14:35 AM,OVERDUE,Closed,Case Closed. Closed date : 2015-08-14 07:14:35.343 Case Resolved now have time on 93 ped,Traffic Signal Inspection,Transportation - Traffic Division,Signs & Signals,Traffic Signal Inspection,BTDT_Traffic Signal_Repair,BTDT,https://mayors24.cityofboston.gov/media/boston/report/photos/55ca7e526963fe2d4ed289d9/report.jpg,,INTERSECTION of Oliver St & Purchase St  Boston  MA,6.0,1C,1.0,A1,Downtown / Financial District,3.0,Ward 3,306.0,,INTERSECTION Oliver St & Purchase St,,Intersection,7723.0,42.3552,-71.0521,Citizens Connect App,"(42.3552, -71.0521)"
608232,101001518825,08/11/2015 08:27:39 PM,08/12/2015 08:27:39 PM,08/12/2015 01:49:41 PM,ONTIME,Closed,Case Closed. Closed date : 2015-08-12 13:49:41.057 Case Resolved Installed housing,Traffic Signal Inspection,Transportation - Traffic Division,Signs & Signals,Traffic Signal Inspection,BTDT_Traffic Signal_Repair,BTDT,,,INTERSECTION of Chiswick Rd & Commonwealth Ave  Brighton  MA,11.0,04,9.0,D14,Allston / Brighton,15.0,Ward 21,2113.0,,INTERSECTION Chiswick Rd & Commonwealth Ave,,Intersection,2992.0,42.3403,-71.1511,Citizens Connect App,"(42.3403, -71.1511)"
608252,101001518848,08/11/2015 09:31:00 PM,08/12/2015 09:31:55 PM,08/12/2015 07:00:18 AM,ONTIME,Closed,Case Closed. Closed date : 2015-08-12 07:00:18.313 Case Noted Made safe,Traffic Signal Inspection,Transportation - Traffic Division,Signs & Signals,Traffic Signal Inspection,BTDT_Traffic Signal_Repair,BTDT,,,INTERSECTION of Magazine St & Norfolk Ave  Roxbury  MA,7.0,03,7.0,B2,Roxbury,13.0,Ward 8,806.0,,INTERSECTION Magazine St & Norfolk Ave,,Intersection,6980.0,42.3267,-71.0715,Constituent Call,"(42.3267, -71.0715)"
608282,101001518879,08/11/2015 11:47:00 PM,08/12/2015 11:47:55 PM,,OVERDUE,Open,,Traffic Signal Inspection,Transportation - Traffic Division,Signs & Signals,Traffic Signal Inspection,INFO01_GenericeFormforOtherServiceRequestTypes,INFO,,,INTERSECTION of Weld St & W Roxbury Pkwy  West Roxbury  MA,9.0,06,6.0,E5,West Roxbury,12.0,Ward 20,2019.0,,INTERSECTION Weld St & W Roxbury Pkwy,,Intersection,6182.0,42.2937,-71.146,Citizens Connect App,"(42.2937, -71.146)"
608286,101001518883,08/12/2015 12:28:00 AM,08/13/2015 12:28:21 AM,08/14/2015 11:19:52 AM,OVERDUE,Closed,Case Closed. Closed date : 2015-08-14 11:19:52.763 Case Noted This location is in the town of Brookline. Please contact Brookline City Hall to report.  Thank You  Boston 311,Traffic Signal Inspection,Transportation - Traffic Division,Signs & Signals,Traffic Signal Inspection,INFO_Reallocation From Dept,INFO,,,INTERSECTION of Commonwealth Ave & University Rd  Boston  MA,,10A,8.0,D4,Fenway / Kenmore / Audubon Circle / Longwood,14.0,Ward 21,2102.0,,INTERSECTION Commonwealth Ave & University Rd,,Intersection,3382.0,42.3502,-71.1094,Citizens Connect App,"(42.3502, -71.1094)"
608295,101001518894,08/12/2015 05:48:00 AM,08/13/2015 05:48:11 AM,,OVERDUE,Open,,Traffic Signal Inspection,Transportation - Traffic Division,Signs & Signals,Traffic Signal Inspection,INFO01_GenericeFormforOtherServiceRequestTypes,INFO,https://mayors24.cityofboston.gov/media/boston/report/photos/55cb16616963fe2d4ed293ed/report.jpg,,INTERSECTION of Mount Vernon St & William T Morrissey Blvd  South Boston  MA,7.0,03,3.0,C6,South Boston / South Boston Waterfront,7.0,Ward 13,1303.0,,INTERSECTION Mount Vernon St & William T Morrissey Blvd,,Intersection,7447.0,42.3206,-71.0501,Citizens Connect App,"(42.3206, -71.0501)"
608316,101001518919,08/12/2015 06:58:00 AM,08/13/2015 06:58:48 AM,08/12/2015 01:50:48 PM,ONTIME,Closed,Case Closed. Closed date : 2015-08-12 13:50:48.14 Case Resolved,Traffic Signal Inspection,Transportation - Traffic Division,Signs & Signals,Traffic Signal Inspection,BTDT_Traffic Signal_Repair,BTDT,,,INTERSECTION of A St & Dorchester Ave  South Boston  MA,6.0,05,2.0,C6,South Boston / South Boston Waterfront,5.0,Ward 6,601.0,,INTERSECTION A St & Dorchester Ave,,Intersection,3.0,42.3406,-71.0572,Constituent Call,"(42.3406, -71.0572)"
608320,101001518926,08/12/2015 07:17:02 AM,08/13/2015 07:17:02 AM,08/14/2015 07:14:01 AM,OVERDUE,Closed,Case Closed. Closed date : 2015-08-14 07:14:01.65 Case Resolved Replaced 2 bad buttons,Traffic Signal Inspection,Transportation - Traffic Division,Signs & Signals,Traffic Signal Inspection,BTDT_Traffic Signal_Repair,BTDT,https://mayors24.cityofboston.gov/media/boston/report/photos/55cb2b356963fe2d4ed2956a/report.jpg,,INTERSECTION of Ashmont St & Talbot Ave  Dorchester  MA,8.0,07,3.0,C11,Dorchester,7.0,Ward 16,1608.0,,INTERSECTION Ashmont St & Talbot Ave,,Intersection,660.0,42.2857,-71.0643,Citizens Connect App,"(42.2857, -71.0643)"
608322,101001518927,08/12/2015 07:20:06 AM,08/13/2015 07:20:06 AM,08/12/2015 07:23:25 AM,ONTIME,Closed,Case Closed. Closed date : 2015-08-12 07:23:25.313 Case Invalid Roadway DCR jurisdiction  making new E-Form,Traffic Signal Inspection,Transportation - Traffic Division,Signs & Signals,Traffic Signal Inspection,INFO_Reallocation From Dept,INFO,,,INTERSECTION of Mount Vernon St & William T Morrissey Blvd  South Boston  MA,7.0,03,3.0,C6,South Boston / South Boston Waterfront,7.0,Ward 13,1303.0,,INTERSECTION Mount Vernon St & William T Morrissey Blvd,,Intersection,7447.0,42.3206,-71.0501,Constituent Call,"(42.3206, -71.0501)"
608335,101001518945,08/12/2015 07:34:19 AM,08/13/2015 07:34:19 AM,08/12/2015 09:04:59 AM,ONTIME,Closed,Case Closed. Closed date : 2015-08-12 09:04:59.377 Case Resolved,Traffic Signal Inspection,Transportation - Traffic Division,Signs & Signals,Traffic Signal Inspection,BTDT_Traffic Signal_Repair,BTDT,,,INTERSECTION of A St & Dorchester Ave  South Boston  MA,6.0,05,2.0,C6,South Boston / South Boston Waterfront,5.0,Ward 6,601.0,,INTERSECTION A St & Dorchester Ave,,Intersection,3.0,42.3406,-71.0572,Citizens Connect App,"(42.3406, -71.0572)"
608372,101001518990,08/12/2015 08:20:00 AM,08/13/2015 08:20:03 AM,08/12/2015 09:04:51 AM,ONTIME,Closed,Case Closed. Closed date : 2015-08-12 09:04:51.663 Case Resolved restored operations,Traffic Signal Inspection,Transportation - Traffic Division,Signs & Signals,Traffic Signal Inspection,BTDT_Traffic Signal_Repair,BTDT,,,INTERSECTION of Brighton Ave & Commonwealth Ave  Boston  MA,11.0,04,9.0,D14,Allston / Brighton,14.0,Ward 21,2103.0,,INTERSECTION Brighton Ave & Commonwealth Ave,,Intersection,1953.0,42.3521,-71.1247,Constituent Call,"(42.3521, -71.1247)"
608376,101001518995,08/12/2015 08:21:50 AM,08/13/2015 08:21:50 AM,08/12/2015 09:04:31 AM,ONTIME,Closed,Case Closed. Closed date : 2015-08-12 09:04:31.637 Case Resolved found online running normal operations,Traffic Signal Inspection,Transportation - Traffic Division,Signs & Signals,Traffic Signal Inspection,BTDT_Traffic Signal_Repair,BTDT,,,INTERSECTION of Brighton Ave & Commonwealth Ave  Boston  MA,11.0,04,9.0,D14,Allston / Brighton,14.0,Ward 21,2103.0,,INTERSECTION Brighton Ave & Commonwealth Ave,,Intersection,1953.0,42.3521,-71.1247,Constituent Call,"(42.3521, -71.1247)"
608407,101001519034,08/12/2015 08:46:00 AM,08/13/2015 08:46:12 AM,,OVERDUE,Open,,Traffic Signal Inspection,Transportation - Traffic Division,Signs & Signals,Traffic Signal Inspection,INFO01_GenericeFormforOtherServiceRequestTypes,INFO,,,INTERSECTION of Adams St & Lonsdale St  Dorchester  MA,8.0,07,3.0,C11,Dorchester,7.0,Ward 16,1607.0,,INTERSECTION Adams St & Lonsdale St,,Intersection,99.0,42.2914,-71.0572,Citizens Connect App,"(42.2914, -71.0572)"
608420,101001519048,08/12/2015 09:02:00 AM,08/13/2015 09:02:31 AM,08/12/2015 09:26:33 AM,ONTIME,Closed,Case Closed. Closed date : 2015-08-12 09:26:33.74 Case Resolved If we are talking about Oak sq near fire station  that flasher working. If this is wrong location please call me @ 617-635-3126. Ty Dominic,Traffic Signal Inspection,Transportation - Traffic Division,Signs & Signals,Traffic Signal Inspection,BTDT_Traffic Signal_Repair,BTDT,,,INTERSECTION of Cambridge St & Hano St  Allston  MA,11.0,04,9.0,D14,Allston / Brighton,15.0,Ward 21,2104.0,,INTERSECTION Cambridge St & Hano St,,Intersection,2343.0,42.354,-71.1363,Constituent Call,"(42.354, -71.1363)"
608438,101001519069,08/12/2015 09:16:35 AM,08/13/2015 09:16:36 AM,08/14/2015 07:14:58 AM,OVERDUE,Closed,Case Closed. Closed date : 2015-08-14 07:14:58.41 Case Resolved,Traffic Signal Inspection,Transportation - Traffic Division,Signs & Signals,Traffic Signal Inspection,BTDT_Traffic Signal_Repair,BTDT,https://mayors24.cityofboston.gov/media/boston/report/photos/55cb473e6963fe2d4ed29915/report.jpg,,INTERSECTION of E Berkeley St & Harrison Ave  Roxbury  MA,4.0,1C,2.0,D4,South End,4.0,Ward 3,307.0,,INTERSECTION E Berkeley St & Harrison Ave,,Intersection,1370.0,42.3435,-71.0644,Citizens Connect App,"(42.3435, -71.0644)"
608446,101001519076,08/12/2015 09:23:28 AM,08/13/2015 09:23:29 AM,08/12/2015 12:37:23 PM,ONTIME,Closed,Case Closed. Closed date : 2015-08-12 12:37:23.38 Case Resolved,Traffic Signal Inspection,Transportation - Traffic Division,Signs & Signals,Traffic Signal Inspection,BTDT_Traffic Signal_Repair,BTDT,,,INTERSECTION of Field St & Parker St  Boston  MA,9.0,10A,7.0,D4,Mission Hill,13.0,Ward 4,409.0,,INTERSECTION Field St & Parker St,,Intersection,4897.0,42.3384,-71.0927,Citizens Connect App,"(42.3384, -71.0927)"
608644,101001519324,08/12/2015 11:37:00 AM,08/13/2015 11:37:01 AM,08/12/2015 12:37:31 PM,ONTIME,Closed,Case Closed. Closed date : 2015-08-12 12:37:31.55 Case Resolved,Traffic Signal Inspection,Transportation - Traffic Division,Signs & Signals,Traffic Signal Inspection,BTDT_Traffic Signal_Repair,BTDT,,,INTERSECTION of Cumberland St & Huntington Ave  Boston  MA,4.0,1C,7.0,D4,Back Bay,14.0,Ward 4,405.0,,INTERSECTION Cumberland St & Huntington Ave,,Intersection,3717.0,42.3443,-71.083,Constituent Call,"(42.3443, -71.083)"
608912,101001519660,08/12/2015 04:10:00 PM,08/13/2015 04:10:24 PM,08/28/2015 01:25:19 PM,OVERDUE,Closed,Case Closed. Closed date : 2015-08-28 13:25:19.28 Case Noted The Boston Transportation department conducted an Engineering study of this location to see if this location would meet minimum criteria for installation of a traffic signal.  The Engineering study showed that it did not meet the minimum criteria for traffic signal installation and therefore  a traffic signal is not recommended at this time.,Traffic Signal Inspection,Transportation - Traffic Division,Signs & Signals,Traffic Signal Inspection,BTDT_Engineering_Request for Traffic Signal Study or Review,BTDT,,,INTERSECTION of Bailey St & Dorchester Ave  Dorchester  MA,8.0,07,3.0,C11,Dorchester,7.0,Ward 16,1608.0,,INTERSECTION Bailey St & Dorchester Ave,,Intersection,879.0,42.2848,-71.0646,Citizens Connect App,"(42.2848, -71.0646)"
608924,101001519680,08/12/2015 04:32:00 PM,08/13/2015 04:32:22 PM,08/28/2015 11:59:32 AM,OVERDUE,Closed,Case Closed. Closed date : 2015-08-28 11:59:32.93 Case Noted Signals have been repaired.,Traffic Signal Inspection,Transportation - Traffic Division,Signs & Signals,Traffic Signal Inspection,BTDT_Engineering_Request for Traffic Signal Study or Review,BTDT,,,INTERSECTION of Basile St & South St  Roslindale  MA,12.0,02,5.0,E5,Roslindale,10.0,Ward 19,1913.0,,INTERSECTION Basile St & South St,,Intersection,1003.0,42.2871,-71.1274,Constituent Call,"(42.2871, -71.1274)"
608929,101001519684,08/12/2015 04:35:34 PM,08/13/2015 04:35:34 PM,08/12/2015 04:38:42 PM,ONTIME,Closed,Case Closed. Closed date : 2015-08-12 16:38:42.623 Case Invalid Duplicate Case.,Traffic Signal Inspection,Transportation - Traffic Division,Signs & Signals,Traffic Signal Inspection,BTDT_Traffic Signal_Repair,BTDT,,,INTERSECTION of Arborway & South St  Jamaica Plain  MA,9.0,02,6.0,E13,Jamaica Plain,11.0,Ward 19,1902.0,,INTERSECTION Arborway & South St,,Intersection,513.0,42.3017,-71.1145,Constituent Call,"(42.3017, -71.1145)"
608930,101001519685,08/12/2015 04:36:28 PM,08/13/2015 04:36:28 PM,08/13/2015 06:58:34 AM,ONTIME,Closed,Case Closed. Closed date : 2015-08-13 06:58:34.083 Case Resolved,Traffic Signal Inspection,Transportation - Traffic Division,Signs & Signals,Traffic Signal Inspection,BTDT_Traffic Signal_Repair,BTDT,,,INTERSECTION of Monsignor William J Casey Hwy & South St  Jamaica Plain  MA,9.0,02,6.0,E13,Jamaica Plain,11.0,Ward 19,1902.0,,INTERSECTION Monsignor William J Casey Hwy & South St,,Intersection,6257.0,42.3018,-71.1145,Citizens Connect App,"(42.3018, -71.1145)"
608934,101001519689,08/12/2015 04:39:18 PM,08/13/2015 04:39:18 PM,08/12/2015 04:42:18 PM,ONTIME,Closed,Case Closed. Closed date : 2015-08-12 16:42:18.463 Case Invalid Case already submitted for same light,Traffic Signal Inspection,Transportation - Traffic Division,Signs & Signals,Traffic Signal Inspection,BTDT_Traffic Signal_Repair,BTDT,,,95 Forest Hills Ave  Jamaica Plain  MA  02130,12.0,02,6.0,E13,Jamaica Plain,10.0,19,1907.0,,95 Forest Hills Ave,2130.0,Address,343999.0,42.2983,-71.1081,Constituent Call,"(42.2983, -71.1081)"
608939,101001519698,08/12/2015 04:45:00 PM,08/13/2015 04:45:22 PM,08/14/2015 07:13:26 AM,OVERDUE,Closed,Case Closed. Closed date : 2015-08-14 07:13:26.647 Case Resolved,Traffic Signal Inspection,Transportation - Traffic Division,Signs & Signals,Traffic Signal Inspection,BTDT_Traffic Signal_Repair,BTDT,,,INTERSECTION of Main St & School St  Charlestown  MA,3.0,1A,1.0,A15,Charlestown,2.0,Ward 2,201.0,,INTERSECTION Main St & School St,,Intersection,7000.0,42.3765,-71.0658,Constituent Call,"(42.3765, -71.0658)"
608940,101001519697,08/12/2015 04:45:00 PM,08/13/2015 04:45:10 PM,08/13/2015 06:58:10 AM,ONTIME,Closed,Case Closed. Closed date : 2015-08-13 06:58:10.877 Case Resolved,Traffic Signal Inspection,Transportation - Traffic Division,Signs & Signals,Traffic Signal Inspection,BTDT_Traffic Signal_Repair,BTDT,,,INTERSECTION of Cedar St & Washington St  Roxbury  MA,7.0,10B,7.0,B2,Roxbury,13.0,Ward 9,905.0,,INTERSECTION Cedar St & Washington St,,Intersection,2555.0,42.3242,-71.0888,Constituent Call,"(42.3242, -71.0888)"
608945,101001519703,08/12/2015 04:47:00 PM,08/13/2015 04:47:27 PM,08/13/2015 06:58:03 AM,ONTIME,Closed,Case Closed. Closed date : 2015-08-13 06:58:03.36 Case Resolved,Traffic Signal Inspection,Transportation - Traffic Division,Signs & Signals,Traffic Signal Inspection,BTDT_Traffic Signal_Repair,BTDT,,,INTERSECTION of Washington St & Ukraine Way  Roslindale  MA,12.0,02,6.0,E5,Jamaica Plain,10.0,Ward 19,1907.0,,INTERSECTION Washington St & Ukraine Way,,Intersection,6009.0,42.2983,-71.1158,Constituent Call,"(42.2983, -71.1158)"
608951,101001519710,08/12/2015 04:51:00 PM,08/13/2015 04:51:25 PM,08/13/2015 06:57:54 AM,ONTIME,Closed,Case Closed. Closed date : 2015-08-13 06:57:54.013 Case Resolved,Traffic Signal Inspection,Transportation - Traffic Division,Signs & Signals,Traffic Signal Inspection,BTDT_Traffic Signal_Repair,BTDT,,,INTERSECTION of Cedar St & Washington St  Roxbury  MA,7.0,10B,7.0,B2,Roxbury,13.0,Ward 9,905.0,,INTERSECTION Cedar St & Washington St,,Intersection,2555.0,42.3242,-71.0888,Constituent Call,"(42.3242, -71.0888)"
608980,101001519747,08/12/2015 05:40:02 PM,08/13/2015 05:40:02 PM,08/14/2015 07:13:43 AM,OVERDUE,Closed,Case Closed. Closed date : 2015-08-14 07:13:43.623 Case Resolved,Traffic Signal Inspection,Transportation - Traffic Division,Signs & Signals,Traffic Signal Inspection,BTDT_Traffic Signal_Repair,BTDT,https://mayors24.cityofboston.gov/media/boston/report/photos/55cbbd3e6963fe2d4ed2a65c/report.jpg,,INTERSECTION of Boylston St & Clarendon St  Boston  MA,4.0,1C,2.0,D4,Back Bay,6.0,Ward 4,402.0,,INTERSECTION Boylston St & Clarendon St,,Intersection,1779.0,42.3507,-71.0752,Citizens Connect App,"(42.3507, -71.0752)"
609018,101001519792,08/12/2015 06:33:00 PM,08/13/2015 06:33:04 PM,08/13/2015 06:56:17 AM,ONTIME,Closed,Case Closed. Closed date : 2015-08-13 06:56:17.637 Case Resolved,Traffic Signal Inspection,Transportation - Traffic Division,Signs & Signals,Traffic Signal Inspection,BTDT_Traffic Signal_Repair,BTDT,,,INTERSECTION of Columbus Ave & Massachusetts Ave  Roxbury  MA,9.0,1C,7.0,D4,Roxbury,13.0,Ward 9,903.0,,INTERSECTION Columbus Ave & Massachusetts Ave,,Intersection,3292.0,42.3406,-71.0818,Constituent Call,"(42.3406, -71.0818)"
609025,101001519802,08/12/2015 06:41:00 PM,08/13/2015 06:41:26 PM,08/13/2015 07:11:45 AM,ONTIME,Closed,Case Closed. Closed date : 2015-08-13 07:11:45.113 Case Resolved,Traffic Signal Inspection,Transportation - Traffic Division,Signs & Signals,Traffic Signal Inspection,BTDT_Traffic Signal_Repair,BTDT,,,INTERSECTION of Cummins Hwy & Hyde Park Ave  Roslindale  MA,12.0,08,5.0,E18,Roslindale,10.0,Ward 18,1807.0,,INTERSECTION Cummins Hwy & Hyde Park Ave,,Intersection,3731.0,42.2799,-71.1189,Constituent Call,"(42.2799, -71.1189)"
609043,101001519827,08/12/2015 07:10:00 PM,08/13/2015 07:10:40 PM,08/14/2015 07:12:46 AM,OVERDUE,Closed,Case Closed. Closed date : 2015-08-14 07:12:46.237 Case Resolved,Traffic Signal Inspection,Transportation - Traffic Division,Signs & Signals,Traffic Signal Inspection,BTDT_Traffic Signal_Repair,BTDT,,,1500 Dorchester Ave  Dorchester  MA  02122,7.0,07,3.0,C11,Dorchester,7.0,Ward 16,1601.0,E,1500 Dorchester Ave,2122.0,Address,164483.0,42.2996,-71.0601,Constituent Call,"(42.2996, -71.0601)"
609044,101001519826,08/12/2015 07:10:00 PM,08/13/2015 07:10:39 PM,08/13/2015 06:54:43 AM,ONTIME,Closed,Case Closed. Closed date : 2015-08-13 06:54:43.837 Case Resolved,Traffic Signal Inspection,Transportation - Traffic Division,Signs & Signals,Traffic Signal Inspection,BTDT_Traffic Signal_Repair,BTDT,,,INTERSECTION of Columbia Rd & Geneva Ave  Dorchester  MA,7.0,03,4.0,C11,Roxbury,13.0,Ward 14,1401.0,,INTERSECTION Columbia Rd & Geneva Ave,,Intersection,3218.0,42.306,-71.0782,Constituent Call,"(42.306, -71.0782)"
609047,101001519832,08/12/2015 07:14:00 PM,08/13/2015 07:14:45 PM,08/13/2015 06:54:22 AM,ONTIME,Closed,Case Closed. Closed date : 2015-08-13 06:54:22.377 Case Resolved,Traffic Signal Inspection,Transportation - Traffic Division,Signs & Signals,Traffic Signal Inspection,BTDT_Traffic Signal_Repair,BTDT,,,INTERSECTION of American Legion Hwy & Blue Hill Ave  Dorchester  MA,8.0,03,4.0,B3,Greater Mattapan,9.0,Ward 14,1409.0,,INTERSECTION American Legion Hwy & Blue Hill Ave,,Intersection,401.0,42.2981,-71.0871,Constituent Call,"(42.2981, -71.0871)"
609125,101001519926,08/12/2015 10:51:09 PM,08/13/2015 10:51:09 PM,08/14/2015 07:10:06 AM,OVERDUE,Closed,Case Closed. Closed date : 2015-08-14 07:10:06.143 Case Resolved,Traffic Signal Inspection,Transportation - Traffic Division,Signs & Signals,Traffic Signal Inspection,BTDT_Traffic Signal_Repair,BTDT,https://mayors24.cityofboston.gov/media/boston/report/photos/55cc06286963fe2d4ed2ac83/report.jpg,,INTERSECTION of Cummins Hwy & Sycamore St  Roslindale  MA,12.0,06,5.0,E5,Roslindale,10.0,Ward 19,1910.0,,INTERSECTION Cummins Hwy & Sycamore St,,Intersection,3727.0,42.2845,-71.1251,Citizens Connect App,"(42.2845, -71.1251)"
609191,101001520008,08/13/2015 07:46:00 AM,08/14/2015 07:46:01 AM,08/13/2015 09:54:43 AM,ONTIME,Closed,Case Closed. Closed date : 2015-08-13 09:54:43.66 Duplicate of Existing Case,Traffic Signal Inspection,Transportation - Traffic Division,Signs & Signals,Traffic Signal Inspection,BTDT_Traffic Signal_Repair,BTDT,,,INTERSECTION of Tremont St & Winter St  Boston  MA,3.0,1C,8.0,A1,Downtown / Financial District,14.0,Ward 5,503.0,,INTERSECTION Tremont St & Winter St,,Intersection,8555.0,42.3563,-71.0623,Constituent Call,"(42.3563, -71.0623)"
609204,101001520028,08/13/2015 08:14:00 AM,08/14/2015 08:14:29 AM,08/14/2015 02:41:18 PM,OVERDUE,Closed,Case Closed. Closed date : 2015-08-14 14:41:18.89 Case Resolved The signal at this location has been repaired.,Traffic Signal Inspection,Transportation - Traffic Division,Signs & Signals,Traffic Signal Inspection,BTDT_Engineering_Request for Traffic Signal Study or Review,BTDT,,,INTERSECTION of Columbia Rd & Hancock St  Dorchester  MA,7.0,03,7.0,B2,Dorchester,13.0,Ward 13,1305.0,,INTERSECTION Columbia Rd & Hancock St,,Intersection,3231.0,42.3158,-71.0663,Citizens Connect App,"(42.3158, -71.0663)"
609219,101001520052,08/13/2015 08:27:00 AM,08/14/2015 08:27:31 AM,08/13/2015 09:54:06 AM,ONTIME,Closed,Case Closed. Closed date : 2015-08-13 09:54:06.403 Case Resolved,Traffic Signal Inspection,Transportation - Traffic Division,Signs & Signals,Traffic Signal Inspection,BTDT_Traffic Signal_Repair,BTDT,,,INTERSECTION of Blossom St & Garden St  Boston  MA,3.0,1B,8.0,A1,Beacon Hill,14.0,Ward 5,504.0,,INTERSECTION Blossom St & Garden St,,Intersection,1508.0,42.3611,-71.067,Constituent Call,"(42.3611, -71.067)"
609225,101001520060,08/13/2015 08:32:00 AM,08/14/2015 08:32:05 AM,08/13/2015 09:54:00 AM,ONTIME,Closed,Case Closed. Closed date : 2015-08-13 09:54:00.497 Case Resolved,Traffic Signal Inspection,Transportation - Traffic Division,Signs & Signals,Traffic Signal Inspection,BTDT_Traffic Signal_Repair,BTDT,,,INTERSECTION of Blossom St & Garden St  Boston  MA,3.0,1B,8.0,A1,Beacon Hill,14.0,Ward 5,504.0,,INTERSECTION Blossom St & Garden St,,Intersection,1508.0,42.3611,-71.067,Constituent Call,"(42.3611, -71.067)"
609240,101001520080,08/13/2015 08:47:00 AM,08/14/2015 08:47:40 AM,08/13/2015 10:00:03 AM,ONTIME,Closed,Case Closed. Closed date : 2015-08-13 10:00:03.223 Duplicate of Existing Case working on problem,Traffic Signal Inspection,Transportation - Traffic Division,Signs & Signals,Traffic Signal Inspection,BTDT_Traffic Signal_Repair,BTDT,,,INTERSECTION of Park St & Tremont St  Boston  MA,3.0,1C,8.0,A1,Downtown / Financial District,14.0,Ward 5,503.0,,INTERSECTION Park St & Tremont St,,Intersection,7782.0,42.3565,-71.062,Constituent Call,"(42.3565, -71.062)"
609245,101001520087,08/13/2015 08:50:00 AM,08/14/2015 08:50:30 AM,,OVERDUE,Open,,Traffic Signal Inspection,Transportation - Traffic Division,Signs & Signals,Traffic Signal Inspection,INFO01_GenericeFormforOtherServiceRequestTypes,INFO,,,535 W Roxbury Pkwy  West Roxbury  MA  02132,9.0,06,6.0,E5,West Roxbury,10.0,Ward 20,2007.0,E,535 W Roxbury Pkwy,2132.0,Address,156749.0,42.288,-71.1484,Constituent Call,"(42.288, -71.1484)"
609253,101001520094,08/13/2015 08:54:34 AM,08/14/2015 08:54:34 AM,08/13/2015 09:52:18 AM,ONTIME,Closed,Case Closed. Closed date : 2015-08-13 09:52:18.047 Case Noted Contrator dug up wire  working on repairing,Traffic Signal Inspection,Transportation - Traffic Division,Signs & Signals,Traffic Signal Inspection,BTDT_Traffic Signal_Repair,BTDT,,,INTERSECTION of Park St & Park Street Pl  Boston  MA,3.0,1B,8.0,A1,Beacon Hill,14.0,Ward 5,503.0,,INTERSECTION Park St & Park Street Pl,,Intersection,7781.0,42.3574,-71.063,Citizens Connect App,"(42.3574, -71.063)"
609414,101001520283,08/13/2015 11:02:45 AM,08/14/2015 11:02:45 AM,08/14/2015 07:07:09 AM,ONTIME,Closed,Case Closed. Closed date : 2015-08-14 07:07:09.593 Case Resolved Replaced bad module,Traffic Signal Inspection,Transportation - Traffic Division,Signs & Signals,Traffic Signal Inspection,BTDT_Traffic Signal_Repair,BTDT,,,INTERSECTION of W Canton St & Columbus Ave  Boston  MA,4.0,1C,2.0,D4,South End,6.0,Ward 4,403.0,,INTERSECTION W Canton St & Columbus Ave,,Intersection,2425.0,42.3448,-71.0765,Citizens Connect App,"(42.3448, -71.0765)"
609443,101001520322,08/13/2015 11:32:05 AM,08/14/2015 11:32:05 AM,08/17/2015 03:13:36 PM,OVERDUE,Closed,Case Closed. Closed date : 2015-08-17 15:13:36.093 Case Resolved Secured for now have to replace foundation and is on list. Further questions please call me @ 617-635-3126. TY Dominic,Traffic Signal Inspection,Transportation - Traffic Division,Signs & Signals,Traffic Signal Inspection,BTDT_Traffic Signal_Repair,BTDT,https://mayors24.cityofboston.gov/media/boston/report/photos/55ccb8846963fe2d4ed2b3dd/report.jpg,,INTERSECTION of Brookline Ave & Francis St  Boston  MA,4.0,10A,8.0,B2,Fenway / Kenmore / Audubon Circle / Longwood,14.0,Ward 10,1004.0,,INTERSECTION Brookline Ave & Francis St,,Intersection,2061.0,42.337,-71.1092,Citizens Connect App,"(42.337, -71.1092)"
609630,101001520541,08/13/2015 02:19:00 PM,08/14/2015 02:19:48 PM,08/14/2015 07:00:15 AM,ONTIME,Closed,Case Closed. Closed date : 2015-08-14 07:00:15.457 Case Resolved,Traffic Signal Inspection,Transportation - Traffic Division,Signs & Signals,Traffic Signal Inspection,BTDT_Traffic Signal_Repair,BTDT,,,INTERSECTION of Blackstone St & Hanover St  Boston  MA,3.0,1B,1.0,A1,Downtown / Financial District,3.0,Ward 3,306.0,,INTERSECTION Blackstone St & Hanover St,,Intersection,1469.0,42.3621,-71.0567,Constituent Call,"(42.3621, -71.0567)"
609646,101001520564,08/13/2015 02:48:00 PM,08/14/2015 02:49:18 PM,,OVERDUE,Open,,Traffic Signal Inspection,Transportation - Traffic Division,Signs & Signals,Traffic Signal Inspection,INFO01_GenericeFormforOtherServiceRequestTypes,INFO,,,INTERSECTION of Centre St & Louder's Ln  Jamaica Plain  MA,9.0,02,6.0,E13,Jamaica Plain,11.0,Ward 19,1902.0,,INTERSECTION Centre St & Louder's Ln,,Intersection,2660.0,42.3063,-71.1242,Citizens Connect App,"(42.3063, -71.1242)"
609684,101001520614,08/13/2015 03:27:00 PM,08/14/2015 03:27:59 PM,08/14/2015 02:30:05 PM,ONTIME,Closed,Case Closed. Closed date : 2015-08-14 14:30:05.357 Case Resolved This traffic signal has been repaired.,Traffic Signal Inspection,Transportation - Traffic Division,Signs & Signals,Traffic Signal Inspection,BTDT_Engineering_Request for Traffic Signal Study or Review,BTDT,,,INTERSECTION of Tremont St & Winter St  Boston  MA,3.0,1C,8.0,A1,Downtown / Financial District,14.0,Ward 5,503.0,,INTERSECTION Tremont St & Winter St,,Intersection,8555.0,42.3563,-71.0623,Constituent Call,"(42.3563, -71.0623)"
