,CASE_ENQUIRY_ID,OPEN_DT,TARGET_DT,CLOSED_DT,OnTime_Status,CASE_STATUS,CLOSURE_REASON,CASE_TITLE,SUBJECT,REASON,TYPE,QUEUE,Department,SubmittedPhoto,ClosedPhoto,Location,fire_district,pwd_district,city_council_district,police_district,neighborhood,neighborhood_services_district,ward,precinct,land_usage,LOCATION_STREET_NAME,LOCATION_ZIPCODE,Property_Type,Property_ID,LATITUDE,LONGITUDE,Source,Geocoded_Location
470996,101001242961,01/06/2015 10:26:05 AM,02/06/2015 02:43:10 PM,02/12/2015 10:41:24 AM,OVERDUE,Closed,Case Closed Case Noted spoke w vehicle owner--she complained that I called her 1 month after case opened--complaint was not given to me until Friday  2/6...she is still unhappy that her vehicle was towed.,Transportation General Request,Transportation - Traffic Division,Administrative & General Requests,Transportation General Request,BTDT_AVRS Interface Queue,BTDT,,,18 Rector Rd  Mattapan  MA  02126,8.0,08,5.0,E18,Hyde Park,9.0,Ward 18,1805.0,R3,18 Rector Rd,2126.0,Address,114946.0,42.2656,-71.1001,Constituent Call,"(42.2656, -71.1001)"
471129,101001243172,01/06/2015 02:30:25 PM,,01/14/2015 01:21:22 PM,ONTIME,Closed,Case Closed Case Resolved bikes removed,Transportation General Request,Transportation - Traffic Division,Administrative & General Requests,Transportation General Request,PWDx_District 10A: Roxbury,PWDx,,,413-415 Commonwealth Ave  Boston  MA  02215,4.0,10A,8.0,D4,Back Bay,14.0,Ward 5,509.0,A,413-415 Commonwealth Ave,2215.0,Address,163722.0,42.3495,-71.0912,Employee Generated,"(42.3495, -71.0912)"
472722,101001245465,01/11/2015 11:21:40 AM,,02/05/2015 12:17:14 PM,ONTIME,Closed,Case Closed Case Resolved  BPD was notified of the issue,Transportation General Request,Transportation - Traffic Division,Administrative & General Requests,Transportation General Request,BTDT_Administration,BTDT,,,120 Waldemar Ave  East Boston  MA  02128,1.0,09,1.0,A7,East Boston,1.0,Ward 1,114.0,R2,120 Waldemar Ave,2128.0,Address,141473.0,42.3923,-71.0036,Constituent Call,"(42.3923, -71.0036)"
473171,101001246147,01/12/2015 03:22:00 PM,,03/09/2015 12:36:55 PM,ONTIME,Closed,Case Closed Case Resolved Work completed 3/9/15.,Transportation General Request,Transportation - Traffic Division,Administrative & General Requests,Transportation General Request,BTDT_Sign Shop_Sign Installation,BTDT,,,INTERSECTION of W Newton St & Saint Botolph St  Boston  MA,4.0,1C,7.0,D4,Back Bay,14.0,Ward 4,405.0,,INTERSECTION W Newton St & Saint Botolph St,,Intersection,7575.0,42.3448,-71.0809,Constituent Call,"(42.3448, -71.0809)"
476295,101001250525,01/20/2015 02:38:46 PM,,09/23/2015 04:42:48 PM,ONTIME,Closed,Case Closed. Closed date : 2015-09-23 16:42:48.893 Case Noted Thank you for your request. We apologize for the time that it has taken to respond to this case. We now consider this service request closed. If this issue persists  please resubmit your case or call 311 to speak to an agent.,Transportation General Request,Transportation - Traffic Division,Administrative & General Requests,Transportation General Request,INFO_Reallocation From Dept,INFO,,,INTERSECTION of Greenfield Rd & Greenfield Road Fwy  Mattapan  MA,8.0,08,4.0,E18,Hyde Park,9.0,Ward 18,1804.0,,INTERSECTION Greenfield Rd & Greenfield Road Fwy,,Intersection,5456.0,42.2669,-71.1014,Constituent Call,"(42.2669, -71.1014)"
477125,101001251835,01/22/2015 11:29:12 AM,,02/05/2015 03:36:40 PM,ONTIME,Closed,Case Closed Case Resolved ticket is being scheduled for a hearing,Transportation General Request,Transportation - Traffic Division,Administrative & General Requests,Transportation General Request,BTDT_OPC_Phone Bank Service,BTDT,,,1 City Hall Plz  Boston  MA  02108,3.0,1B,1.0,A1,Downtown / Financial District,3.0,03,306.0,E,1 City Hall Plz,2108.0,Address,32856.0,42.3604,-71.0583,Constituent Call,"(42.3604, -71.0583)"
477967,101001253145,01/24/2015 12:50:11 PM,,01/29/2015 11:53:52 AM,ONTIME,Closed,Case Closed Case Resolved,Transportation General Request,Transportation - Traffic Division,Administrative & General Requests,Transportation General Request,BTDT_Parking Lot_Municipal Parking Lot Complaints,BTDT,,,19 Tafthill Ter  Roslindale  MA  02131,9.0,02,5.0,E5,Roslindale,10.0,Ward 20,2002.0,R2,19 Tafthill Ter,2131.0,Address,133625.0,42.2875,-71.1276,Constituent Call,"(42.2875, -71.1276)"
478591,101001254473,01/26/2015 04:14:43 PM,,03/09/2015 12:09:35 PM,ONTIME,Closed,Case Closed Case Resolved In regards to the privately owned garages that offer discounted prices to residents in the area: the City of Boston and the garages try to accommodate residents as best as they can while the garages to run their business at the same time. Each garage offers a certain amount of parking spots to the city. Once those spots are filled  the garages have the right to do as they please. The city cannot intervene with their day to day operations.  If the garage informs the city that they are at capacity  then we have to take them for their word.     The city of Boston apologizes for any inconvenience that this may have caused. If you would like to discuss it further  please contact Tracey Ganiatsos via email: tracey.ganiatsos@boston.gov,Transportation General Request,Transportation - Traffic Division,Administrative & General Requests,Transportation General Request,BTDT_Administration,BTDT,,,INTERSECTION of Beacon St & Charles St  Boston  MA,3.0,1B,8.0,A1,Beacon Hill,14.0,Ward 5,503.0,,INTERSECTION Beacon St & Charles St,,Intersection,1106.0,42.3562,-71.0694,Constituent Call,"(42.3562, -71.0694)"
478649,101001254597,01/26/2015 09:30:51 PM,,02/05/2015 07:01:01 PM,ONTIME,Closed,Case Closed Case Resolved this area was checked and clear at this time,Transportation General Request,Transportation - Traffic Division,Administrative & General Requests,Transportation General Request,BTDT_Parking Enforcement,BTDT,,,INTERSECTION of E St & Old Colony Ave  South Boston  MA,6.0,05,2.0,C6,South Boston / South Boston Waterfront,5.0,Ward 7,705.0,,INTERSECTION E St & Old Colony Ave,,Intersection,4351.0,42.3337,-71.0544,Constituent Call,"(42.3337, -71.0544)"
481345,101001257705,01/28/2015 10:57:44 AM,,02/02/2015 08:02:22 AM,ONTIME,Closed,Case Closed Case Invalid No eform,Transportation General Request,Transportation - Traffic Division,Administrative & General Requests,Transportation General Request,BTDT_Administration,BTDT,,,1 Avenue De Lafayette   Boston  MA  02111,3.0,1C,2.0,A1,Boston,4.0,03,308.0,,1 Avenue De Lafayette,2111.0,Address,156352.0,42.3533,-71.0613,Constituent Call,"(42.3533, -71.0613)"
481349,101001257711,01/28/2015 10:58:33 AM,,03/09/2015 12:09:53 PM,ONTIME,Closed,Case Closed Case Resolved In regards to the privately owned garages that offer discounted prices to residents in the area: the City of Boston and the garages try to accommodate residents as best as they can while the garages to run their business at the same time. Each garage offers a certain amount of parking spots to the city. Once those spots are filled  the garages have the right to do as they please. The city cannot intervene with their day to day operations.  If the garage informs the city that they are at capacity  then we have to take them for their word.     The city of Boston apologizes for any inconvenience that this may have caused. If you would like to discuss it further  please contact Tracey Ganiatsos via email: tracey.ganiatsos@boston.gov,Transportation General Request,Transportation - Traffic Division,Administrative & General Requests,Transportation General Request,BTDT_Administration,BTDT,,,136 Blackstone St  Boston  MA  02108,3.0,1B,1.0,A1,Downtown / Financial District,3.0,Ward 3,306.0,E,136 Blackstone St,2108.0,Address,15795.0,42.3622,-71.0575,Constituent Call,"(42.3622, -71.0575)"
481425,101001257797,01/28/2015 11:19:01 AM,,02/05/2015 12:13:57 PM,ONTIME,Closed,Case Closed Case Resolved  THe weather has effected parking throughout the city.  The city is doing everything it can to remove the snow.,Transportation General Request,Transportation - Traffic Division,Administrative & General Requests,Transportation General Request,BTDT_Administration,BTDT,,,199 Thirteenth St  Charlestown  MA  02129,3.0,1A,1.0,A15,Charlestown,2.0,02,202.0,,199 Thirteenth St,2129.0,Address,343307.0,42.3784,-71.0515,Constituent Call,"(42.3784, -71.0515)"
483429,101001260258,01/29/2015 06:52:23 AM,,03/09/2015 12:10:11 PM,ONTIME,Closed,Case Closed Case Resolved In regards to the privately owned garages that offer discounted prices to residents in the area: the City of Boston and the garages try to accommodate residents as best as they can while the garages to run their business at the same time. Each garage offers a certain amount of parking spots to the city. Once those spots are filled  the garages have the right to do as they please. The city cannot intervene with their day to day operations.  If the garage informs the city that they are at capacity  then we have to take them for their word.     The city of Boston apologizes for any inconvenience that this may have caused. If you would like to discuss it further  please contact Tracey Ganiatsos via email: tracey.ganiatsos@boston.gov,Transportation General Request,Transportation - Traffic Division,Administrative & General Requests,Transportation General Request,BTDT_Administration,BTDT,,,800 Boylston St  Boston  MA  02199,4.0,1C,2.0,D4,Back Bay,6.0,04,402.0,,800 Boylston St,2199.0,Address,157244.0,42.3473,-71.0815,Constituent Call,"(42.3473, -71.0815)"
486051,101001264254,01/30/2015 10:43:03 AM,,02/11/2015 08:20:58 AM,ONTIME,Closed,Case Closed Case Noted Your request for pavement marking replacement has been inspected by the traffic investigator and has been determined that it is in poor condition. A new Service Request has been created 101001287412 and will be added to an active list for re-painting  weather condition pending.,Transportation General Request,Transportation - Traffic Division,Administrative & General Requests,Transportation General Request,BTDT_District 03,BTDT,,,INTERSECTION of Huntington Ave & S Huntington Ave  Mission Hill  MA,9.0,10A,8.0,B2,Mission Hill,11.0,Ward 10,1008.0,,INTERSECTION Huntington Ave & S Huntington Ave,,Intersection,6417.0,42.332,-71.1121,Constituent Call,"(42.332, -71.1121)"
487687,101001266803,02/02/2015 05:58:41 AM,,02/05/2015 12:11:09 PM,ONTIME,Closed,Case Closed Case Resolved  Enforcement was notified,Transportation General Request,Transportation - Traffic Division,Administrative & General Requests,Transportation General Request,BTDT_Administration,BTDT,,,1400 Washington St  Roxbury  MA  02118,4.0,1C,2.0,D4,Roxbury,6.0,08,801.0,,1400 Washington St,2118.0,Address,342923.0,42.3409,-71.0699,Constituent Call,"(42.3409, -71.0699)"
487828,101001267048,02/02/2015 09:45:14 AM,,03/26/2015 08:34:10 AM,ONTIME,Closed,Case Closed Case Resolved  not at location 3/26.,Transportation General Request,Transportation - Traffic Division,Administrative & General Requests,Transportation General Request,BTDT_AVRS Interface Queue,BTDT,,,136 Sherrin St  Hyde Park  MA  02136,12.0,08,5.0,E18,Hyde Park,10.0,Ward 18,1822.0,RL,136 Sherrin St,2136.0,Address,126919.0,42.2669,-71.1251,Constituent Call,"(42.2669, -71.1251)"
492584,101001273406,02/04/2015 09:03:19 AM,,02/05/2015 06:08:33 PM,ONTIME,Closed,Case Closed Case Resolved vehicle tagged,Transportation General Request,Transportation - Traffic Division,Administrative & General Requests,Transportation General Request,BTDT_Parking Enforcement,BTDT,,,10 Cherokee St  Mission Hill  MA  02120,9.0,10A,8.0,B2,Mission Hill,14.0,Ward 10,1005.0,R2,10 Cherokee St,2120.0,Address,30676.0,42.3303,-71.1008,Constituent Call,"(42.3303, -71.1008)"
494298,101001275962,02/04/2015 05:51:27 PM,,04/14/2015 10:51:12 AM,ONTIME,Closed,Case Closed Case Noted,Transportation General Request,Transportation - Traffic Division,Administrative & General Requests,Transportation General Request,PWDx_District 1C: Downtown,PWDx,,,INTERSECTION of Bay State Rd & Beacon St  Boston  MA,4.0,10A,8.0,D4,Fenway / Kenmore / Audubon Circle / Longwood,14.0,Ward 5,510.0,,INTERSECTION Bay State Rd & Beacon St,,Intersection,1040.0,42.3499,-71.0931,Constituent Call,"(42.3499, -71.0931)"
495549,101001277909,02/05/2015 12:25:24 PM,,02/24/2015 06:04:43 PM,ONTIME,Closed,Case Closed Case Resolved THIS VEHICLE IS GONE,Transportation General Request,Transportation - Traffic Division,Administrative & General Requests,Transportation General Request,BTDT_Parking Enforcement,BTDT,,,109 Chestnut St  Boston  MA  02108,3.0,1B,8.0,A1,Back Bay,14.0,Ward 5,511.0,CM,109 Chestnut St,2108.0,Address,31318.0,42.3565,-71.0727,Constituent Call,"(42.3565, -71.0727)"
496891,101001280007,02/06/2015 11:23:50 AM,,02/24/2015 03:24:19 PM,ONTIME,Closed,Case Closed Case Resolved  BTD and BPD investigated and responded to this complaint,Transportation General Request,Transportation - Traffic Division,Administrative & General Requests,Transportation General Request,BTDT_Administration,BTDT,,,INTERSECTION of Dudley St & Howard Ave  Dorchester  MA,7.0,03,7.0,B2,Roxbury,13.0,Ward 8,805.0,,INTERSECTION Dudley St & Howard Ave,,Intersection,4284.0,42.3202,-71.0713,Constituent Call,"(42.3202, -71.0713)"
498349,101001282351,02/08/2015 12:14:30 PM,,02/11/2015 10:33:23 AM,ONTIME,Closed,Case Closed Case Noted All Muni lots have been snowploed.  They will  continue to be monitored for clean up of snow,Transportation General Request,Transportation - Traffic Division,Administrative & General Requests,Transportation General Request,BTDT_Parking Lot_Municipal Parking Lot Complaints,BTDT,,,1249 Hyde Park Ave  Hyde Park  MA  02136,12.0,08,5.0,E18,Hyde Park,10.0,18,1813.0,E,1249 Hyde Park Ave,2136.0,Address,340349.0,42.2565,-71.1242,Constituent Call,"(42.2565, -71.1242)"
498446,101001282487,02/08/2015 02:37:35 PM,,02/11/2015 06:31:47 PM,ONTIME,Closed,Case Closed Case Resolved THEY HAVE RPP STICKERS.,Transportation General Request,Transportation - Traffic Division,Administrative & General Requests,Transportation General Request,BTDT_Parking Enforcement,BTDT,,,36-44 Bennington St  East Boston  MA  02128,1.0,09,1.0,A7,East Boston,1.0,Ward 1,106.0,E,36-44 Bennington St,2128.0,Address,14722.0,42.3756,-71.0377,Constituent Call,"(42.3756, -71.0377)"
500918,101001285597,02/10/2015 01:29:02 PM,,03/06/2015 12:24:26 PM,ONTIME,Closed,Case Closed Case Noted ticket or plate information not given to investigate,Transportation General Request,Transportation - Traffic Division,Administrative & General Requests,Transportation General Request,BTDT_OPC_Phone Bank Service,BTDT,,,INTERSECTION of Corey St & Ledgewood Rd  West Roxbury  MA,12.0,06,6.0,E5,West Roxbury,12.0,Ward 20,2020.0,,INTERSECTION Corey St & Ledgewood Rd,,Intersection,3525.0,42.2945,-71.1649,Constituent Call,"(42.2945, -71.1649)"
502574,101001287994,02/11/2015 10:26:02 AM,,02/25/2015 09:24:31 AM,ONTIME,Closed,Case Closed Duplicate of Existing Case 101001283344,Transportation General Request,Transportation - Traffic Division,Administrative & General Requests,Transportation General Request,BTDT_AVRS Interface Queue,BTDT,,,11-15 Elmira St  Brighton  MA  02135,11.0,04,9.0,D14,Allston / Brighton,15.0,Ward 22,2203.0,R2,11-15 Elmira St,2135.0,Address,53336.0,42.353,-71.1502,Constituent Call,"(42.353, -71.1502)"
502994,101001288612,02/11/2015 01:48:42 PM,,10/13/2015 11:08:57 AM,ONTIME,Closed,Case Closed. Closed date : 2015-10-13 11:08:57.407 Case Resolved Thank you for your request. We apologize for the time that it has taken to respond to this case. If this issue persists  please resubmit your case or call 311 to speak to an agent.,Transportation General Request,Transportation - Traffic Division,Administrative & General Requests,Transportation General Request,INFO_Reallocation From Dept,INFO,,,1501 Commonwealth Ave  Brighton  MA  02135,11.0,04,9.0,D14,Allston / Brighton,15.0,Ward 21,2109.0,E,1501 Commonwealth Ave,2135.0,Address,37764.0,42.3473,-71.1413,Constituent Call,"(42.3473, -71.1413)"
503734,101001289725,02/11/2015 08:30:23 PM,,02/11/2015 09:03:04 PM,ONTIME,Closed,Case Closed Case Noted Commissioner Dennehy replies  no one was towed.  BTD made annoucements on speaker  and knock doors.,Transportation General Request,Transportation - Traffic Division,Administrative & General Requests,Transportation General Request,BTDT_Administration,BTDT,,,60 L St  South Boston  MA  02127,6.0,05,2.0,C6,South Boston / South Boston Waterfront,5.0,Ward 6,607.0,R2,60 L St,2127.0,Address,82575.0,42.3362,-71.0352,Constituent Call,"(42.3362, -71.0352)"
508455,101001296461,02/15/2015 05:23:37 PM,,10/13/2015 11:11:05 AM,ONTIME,Closed,Case Closed. Closed date : 2015-10-13 11:11:05.023 Case Resolved Thank you for your request. We apologize for the time that it has taken to respond to this case. If this issue persists  please resubmit your case or call 311 to speak to an agent.,Transportation General Request,Transportation - Traffic Division,Administrative & General Requests,Transportation General Request,INFO_Reallocation From Dept,INFO,,,88 Marlborough St  Boston  MA  02116,4.0,1C,8.0,D4,Back Bay,14.0,Ward 5,506.0,CM,88 Marlborough St,2116.0,Address,91593.0,42.3534,-71.0759,Constituent Call,"(42.3534, -71.0759)"
509998,101001298291,02/16/2015 01:23:35 PM,,03/09/2015 12:14:19 PM,ONTIME,Closed,Case Closed Case Resolved The Boston Transportation Department is currently looking at every two way street in every neighborhood that may be affected by snow. We are working with the Public Works Department snow removal team to help with this process.  We are also working with the Boston Police Department and other first responding agencies that may have any feedback pertaining to this matter.  The City of Boston is doing everything they can to help residents and visitors traveling through our streets safely and efficiently this winter and for any severe weather in the future that may impede safe travel.  If you have any questions  please do not hesitate to contact me.  Kevin Donahue  Director of Community Affairs  Boston Transportation Department  617-635-2447  Kevin.donahue@boston.gov,Transportation General Request,Transportation - Traffic Division,Administrative & General Requests,Transportation General Request,BTDT_Administration,BTDT,,,INTERSECTION of E Fourth St & L St  South Boston  MA,6.0,05,2.0,C6,South Boston / South Boston Waterfront,5.0,Ward 6,607.0,,INTERSECTION E Fourth St & L St,,Intersection,5048.0,42.3348,-71.0354,Constituent Call,"(42.3348, -71.0354)"
510462,101001298858,02/16/2015 03:47:25 PM,,03/09/2015 12:14:36 PM,ONTIME,Closed,Case Closed Case Resolved The Boston Transportation Department is currently looking at every two way street in every neighborhood that may be affected by snow. We are working with the Public Works Department snow removal team to help with this process.  We are also working with the Boston Police Department and other first responding agencies that may have any feedback pertaining to this matter.  The City of Boston is doing everything they can to help residents and visitors traveling through our streets safely and efficiently this winter and for any severe weather in the future that may impede safe travel.  If you have any questions  please do not hesitate to contact me.  Kevin Donahue  Director of Community Affairs  Boston Transportation Department  617-635-2447  Kevin.donahue@boston.gov,Transportation General Request,Transportation - Traffic Division,Administrative & General Requests,Transportation General Request,BTDT_Administration,BTDT,,,94 Ballou Ave  Dorchester  MA  02124,8.0,07,4.0,B3,Greater Mattapan,9.0,Ward 14,1413.0,R1,94 Ballou Ave,2124.0,Address,172845.0,42.285,-71.0827,Constituent Call,"(42.285, -71.0827)"
511451,101001300143,02/17/2015 08:30:08 AM,,03/06/2015 12:25:27 PM,ONTIME,Closed,Case Closed Case Noted ticket number or plate number not provided,Transportation General Request,Transportation - Traffic Division,Administrative & General Requests,Transportation General Request,BTDT_OPC_Phone Bank Service,BTDT,,,9 Byron St  Boston  MA  02108,3.0,1B,8.0,A1,Beacon Hill,14.0,Ward 5,505.0,R1,9 Byron St,2108.0,Address,24574.0,42.3564,-71.0708,Constituent Call,"(42.3564, -71.0708)"
512024,101001300981,02/17/2015 11:43:14 AM,,03/09/2015 12:15:00 PM,ONTIME,Closed,Case Closed Case Resolved The Boston Transportation Department is currently looking at every two way street in every neighborhood that may be affected by snow. We are working with the Public Works Department snow removal team to help with this process.  We are also working with the Boston Police Department and other first responding agencies that may have any feedback pertaining to this matter.  The City of Boston is doing everything they can to help residents and visitors traveling through our streets safely and efficiently this winter and for any severe weather in the future that may impede safe travel.  If you have any questions  please do not hesitate to contact me.  Kevin Donahue  Director of Community Affairs  Boston Transportation Department  617-635-2447  Kevin.donahue@boston.gov,Transportation General Request,Transportation - Traffic Division,Administrative & General Requests,Transportation General Request,BTDT_Administration,BTDT,,,3 Langford Park  Roxbury  MA  02119,7.0,10B,7.0,B2,Roxbury,13.0,Ward 12,1204.0,CD,3 Langford Park,2119.0,Address,83950.0,42.3222,-71.0798,Constituent Call,"(42.3222, -71.0798)"
512113,101001301111,02/17/2015 12:13:13 PM,,02/24/2015 04:01:39 PM,ONTIME,Closed,Case Closed Case Resolved  All vehicles are to obey whatever the parking restrictions state on the street signs.,Transportation General Request,Transportation - Traffic Division,Administrative & General Requests,Transportation General Request,BTDT_Administration,BTDT,,,1705 Columbus Ave  Roxbury  MA  02119,9.0,10B,6.0,E13,Jamaica Plain,11.0,Ward 11,1104.0,RC,1705 Columbus Ave,2119.0,Address,35494.0,42.3203,-71.0989,Constituent Call,"(42.3203, -71.0989)"
514939,101001305131,02/18/2015 05:58:21 PM,,03/09/2015 12:10:34 PM,ONTIME,Closed,Case Closed Case Resolved In regards to the privately owned garages that offer discounted prices to residents in the area: the City of Boston and the garages try to accommodate residents as best as they can while the garages to run their business at the same time. Each garage offers a certain amount of parking spots to the city. Once those spots are filled  the garages have the right to do as they please. The city cannot intervene with their day to day operations.  If the garage informs the city that they are at capacity  then we have to take them for their word.     The city of Boston apologizes for any inconvenience that this may have caused. If you would like to discuss it further  please contact Tracey Ganiatsos via email: tracey.ganiatsos@boston.gov,Transportation General Request,Transportation - Traffic Division,Administrative & General Requests,Transportation General Request,BTDT_Administration,BTDT,,,39 Charter St  Boston  MA  02109,3.0,1B,1.0,A1,Downtown / Financial District,3.0,Ward 3,302.0,A,39 Charter St,2109.0,Address,205279.0,42.3671,-71.0541,Constituent Call,"(42.3671, -71.0541)"
515485,101001306042,02/19/2015 09:22:23 AM,,02/24/2015 04:05:34 PM,ONTIME,Closed,Case Closed Case Resolved  The cause could be a number of things.  BTD and BPD  as well as the MSP are working on this issue. BTD has made adjustments to their traffic signal to help.  Any other questions should be directed to BPD.,Transportation General Request,Transportation - Traffic Division,Administrative & General Requests,Transportation General Request,BTDT_Administration,BTDT,,,INTERSECTION of Cambridge St & Charles St  Boston  MA,3.0,1B,8.0,A1,Beacon Hill,14.0,Ward 5,511.0,,INTERSECTION Cambridge St & Charles St,,Intersection,2367.0,42.3609,-71.0706,Constituent Call,"(42.3609, -71.0706)"
516359,101001307306,02/19/2015 04:39:53 PM,,02/27/2015 08:27:49 AM,ONTIME,Closed,Case Closed Case Resolved Dear Constituent     National Grid responding to a gas leak on your street activated an emergency permit.    Emergency work must be performed no matter what time of day or night in the interest of public safety and the protection of private property.    The city apologizes for the inconvenience this necessary work caused.    The work is now completed.    If you want to discuss this matter further  please don't hesitate to contact the number listed bellow.    Sincerely      Mark Cardarelli  Supervisor of Utility Coordination and Compliance  Boston Public Works Department  617-635-4951 Office,Transportation General Request,Transportation - Traffic Division,Administrative & General Requests,Transportation General Request,PWDx_Contractor Complaints,PWDx,,,INTERSECTION of Codman Park & Townsend St  Roxbury  MA,9.0,10B,7.0,B2,Roxbury,13.0,Ward 11,1103.0,,INTERSECTION Codman Park & Townsend St,,Intersection,3160.0,42.3198,-71.0933,Constituent Call,"(42.3198, -71.0933)"
517320,101001308690,02/20/2015 12:43:50 PM,,02/25/2015 12:28:17 PM,ONTIME,Closed,Case Closed Case Noted  Thank you for the call.,Transportation General Request,Transportation - Traffic Division,Administrative & General Requests,Transportation General Request,PWDx_Administration,PWDx,,,INTERSECTION of Columbia Rd & Hancock St  Dorchester  MA,7.0,03,7.0,B2,Dorchester,13.0,Ward 13,1305.0,,INTERSECTION Columbia Rd & Hancock St,,Intersection,3231.0,42.3158,-71.0663,Constituent Call,"(42.3158, -71.0663)"
517635,101001309128,02/20/2015 04:09:13 PM,,03/10/2015 09:19:08 AM,ONTIME,Closed,Case Closed Case Noted Please contact Ed Hesford or come to BTD room 721 after becoming bonded with PWD (617-635-4910).,Transportation General Request,Transportation - Traffic Division,Administrative & General Requests,Transportation General Request,BTDT_Engineering_New Sign and Pavement Marking Requests,BTDT,,,28 Howell St  Dorchester  MA  02125,6.0,03,2.0,C6,Dorchester,5.0,Ward 7,708.0,R3,28 Howell St,2125.0,Address,75651.0,42.325,-71.0583,Constituent Call,"(42.325, -71.0583)"
517908,101001309509,02/20/2015 08:51:08 PM,,02/25/2015 01:47:32 PM,ONTIME,Closed,Case Closed Case Noted,Transportation General Request,Transportation - Traffic Division,Administrative & General Requests,Transportation General Request,BTDT_Parking Lot_Municipal Parking Lot Complaints,BTDT,,,INTERSECTION of Cheney St & Hartwell St  Dorchester  MA,9.0,10B,7.0,B2,Roxbury,13.0,Ward 12,1207.0,,INTERSECTION Cheney St & Hartwell St,,Intersection,2885.0,42.309,-71.0845,Constituent Call,"(42.309, -71.0845)"
518826,101001310923,02/22/2015 12:44:39 PM,,02/25/2015 09:07:50 AM,ONTIME,Closed,Case Closed Case Noted City is working to clear all these roads.,Transportation General Request,Transportation - Traffic Division,Administrative & General Requests,Transportation General Request,BTDT_Parking Enforcement,BTDT,,,449 Bennington St  East Boston  MA  02128,1.0,09,1.0,A7,East Boston,1.0,Ward 1,110.0,R2,449 Bennington St,2128.0,Address,14737.0,42.3807,-71.0228,Constituent Call,"(42.3807, -71.0228)"
519244,101001311601,02/23/2015 08:33:01 AM,,02/24/2015 01:54:11 PM,ONTIME,Closed,Case Closed Case Resolved  During a Snow Emergency  certain metered streets are restricted of parking.,Transportation General Request,Transportation - Traffic Division,Administrative & General Requests,Transportation General Request,BTDT_Administration,BTDT,,,38 Newbury St  Boston  MA  02116,4.0,1C,8.0,D4,Back Bay,14.0,Ward 5,506.0,C,38 Newbury St,2116.0,Address,282480.0,42.3519,-71.0729,Constituent Call,"(42.3519, -71.0729)"
519319,101001311710,02/23/2015 09:03:33 AM,,03/09/2015 12:15:19 PM,ONTIME,Closed,Case Closed Case Resolved The Boston Transportation Department is currently looking at every two way street in every neighborhood that may be affected by snow. We are working with the Public Works Department snow removal team to help with this process.  We are also working with the Boston Police Department and other first responding agencies that may have any feedback pertaining to this matter.  The City of Boston is doing everything they can to help residents and visitors traveling through our streets safely and efficiently this winter and for any severe weather in the future that may impede safe travel.  If you have any questions  please do not hesitate to contact me.  Kevin Donahue  Director of Community Affairs  Boston Transportation Department  617-635-2447  Kevin.donahue@boston.gov,Transportation General Request,Transportation - Traffic Division,Administrative & General Requests,Transportation General Request,BTDT_Administration,BTDT,,,35 Sunnyside St  Hyde Park  MA  02136,12.0,08,5.0,E18,Hyde Park,10.0,18,1819.0,E,35 Sunnyside St,2136.0,Address,132633.0,42.2516,-71.1333,Constituent Call,"(42.2516, -71.1333)"
522768,101001316722,02/25/2015 07:22:05 PM,,03/02/2015 11:37:10 AM,ONTIME,Closed,Case Closed Case Noted Will speak with driver of vehicle.,Transportation General Request,Transportation - Traffic Division,Administrative & General Requests,Transportation General Request,BTDT_Parking Enforcement,BTDT,,,INTERSECTION of Arlington St & Boylston St  Boston  MA,4.0,1C,8.0,A1,,14.0,Ward 5,503.0,,INTERSECTION Arlington St & Boylston St,,Intersection,583.0,42.3519,-71.0707,Constituent Call,"(42.3519, -71.0707)"
523912,101001318376,02/26/2015 06:32:33 PM,,,ONTIME,Open,,Transportation General Request,Transportation - Traffic Division,Administrative & General Requests,Transportation General Request,INFO_General Comments Complaints Compliments,INFO,,,391-395 Hanover St  Boston  MA  02113,3.0,1B,1.0,A1,Downtown / Financial District,3.0,Ward 3,301.0,RC,391-395 Hanover St,2113.0,Address,69129.0,42.3652,-71.0529,Constituent Call,"(42.3652, -71.0529)"
524685,101001319500,02/27/2015 04:25:31 PM,,03/09/2015 02:06:57 PM,ONTIME,Closed,Case Closed Case Resolved The Boston Transportation Department is currently looking at every two way street in every neighborhood that may be affected by snow. We are working with the Public Works Department snow removal team to help with this process.  We are also working with the Boston Police Department and other first responding agencies that may have any feedback pertaining to this matter.  The City of Boston is doing everything they can to help residents and visitors traveling through our streets safely and efficiently this winter and for any severe weather in the future that may impede safe travel.  If you have any questions  please do not hesitate to contact me.  Kevin Donahue  Director of Community Affairs  Boston Transportation Department  617-635-2447  Kevin.donahue@boston.gov,Transportation General Request,Transportation - Traffic Division,Administrative & General Requests,Transportation General Request,BTDT_Administration,BTDT,,,580-590 Dudley St  Dorchester  MA  02125,7.0,03,7.0,B2,Dorchester,13.0,08,805.0,E,580-590 Dudley St,2125.0,Address,49797.0,42.3209,-71.0718,Constituent Call,"(42.3209, -71.0718)"
524810,101001319715,02/27/2015 07:52:07 PM,,03/10/2015 06:55:44 AM,ONTIME,Closed,Case Closed Case Noted Ticket # invalid. Not enough info.,Transportation General Request,Transportation - Traffic Division,Administrative & General Requests,Transportation General Request,BTDT_Parking Enforcement,BTDT,,,24 Westland Ave  Boston  MA  02115,4.0,10A,8.0,D4,Fenway / Kenmore / Audubon Circle / Longwood,14.0,Ward 4,407.0,RC,24 Westland Ave,2115.0,Address,148485.0,42.3433,-71.0871,Constituent Call,"(42.3433, -71.0871)"
526914,101001322942,03/03/2015 03:41:57 PM,,,ONTIME,Open,,Transportation General Request,Transportation - Traffic Division,Administrative & General Requests,Transportation General Request,INFO01_GenericeFormforOtherServiceRequestTypes,INFO,,,INTERSECTION of Boylston St & Massachusetts Ave  Boston  MA,4.0,1C,8.0,D4,Back Bay,14.0,Ward 4,406.0,,INTERSECTION Boylston St & Massachusetts Ave,,Intersection,1770.0,42.3473,-71.0877,Constituent Call,"(42.3473, -71.0877)"
528428,101001325214,03/05/2015 02:50:31 PM,,04/07/2015 11:23:26 AM,ONTIME,Closed,Case Closed Case Noted Alec   is this for the funeral home?  is so is it on Sarnac Street?  what times? days?,Transportation General Request,Transportation - Traffic Division,Administrative & General Requests,Transportation General Request,BTDT_Engineering_New Sign and Pavement Marking Requests,BTDT,,,740 Adams St  Dorchester  MA  02122,8.0,07,3.0,C11,Dorchester,7.0,Ward 16,1609.0,RC,740 Adams St,2122.0,Address,951.0,42.2845,-71.0551,Constituent Call,"(42.2845, -71.0551)"
529191,101001326355,03/06/2015 04:15:47 PM,,03/09/2015 12:16:21 PM,ONTIME,Closed,Case Closed Case Resolved The Boston Transportation Department is currently looking at every two way street in every neighborhood that may be affected by snow. We are working with the Public Works Department snow removal team to help with this process.  We are also working with the Boston Police Department and other first responding agencies that may have any feedback pertaining to this matter.  The City of Boston is doing everything they can to help residents and visitors traveling through our streets safely and efficiently this winter and for any severe weather in the future that may impede safe travel.  If you have any questions  please do not hesitate to contact me.  Kevin Donahue  Director of Community Affairs  Boston Transportation Department  617-635-2447  Kevin.donahue@boston.gov,Transportation General Request,Transportation - Traffic Division,Administrative & General Requests,Transportation General Request,BTDT_Administration,BTDT,,,15 Stonecrest Rd  Mattapan  MA  02126,8.0,07,5.0,B3,Greater Mattapan,9.0,Ward 18,1803.0,R1,15 Stonecrest Rd,2126.0,Address,130821.0,42.2771,-71.1065,Constituent Call,"(42.2771, -71.1065)"
530983,101001329175,03/10/2015 01:33:52 PM,,03/10/2015 04:38:55 PM,ONTIME,Closed,Case Closed Case Resolved  Speed Humps are not installed on Boston streets. BTD will review this area for any other solutions that can be helpful.,Transportation General Request,Transportation - Traffic Division,Administrative & General Requests,Transportation General Request,BTDT_Administration,BTDT,,,INTERSECTION of Blossom St & William Cardinal O'Connell Way  Boston  MA,3.0,1B,8.0,A1,Back Bay,3.0,Ward 3,305.0,,INTERSECTION Blossom St & William Cardinal O'Connell Way,,Intersection,1509.0,42.3634,-71.0669,Constituent Call,"(42.3634, -71.0669)"
531423,101001329876,03/11/2015 09:15:43 AM,,03/13/2015 06:54:48 PM,ONTIME,Closed,Case Closed Case Invalid Need more information nothing listed of what the problem is at this location.  Ted Skalinski,Transportation General Request,Transportation - Traffic Division,Administrative & General Requests,Transportation General Request,INFO_Reallocation From Dept,INFO,,,INTERSECTION of H St & E Second St  South Boston  MA,6.0,05,2.0,C6,South Boston / South Boston Waterfront,5.0,Ward 6,605.0,,INTERSECTION H St & E Second St,,Intersection,5532.0,42.3372,-71.0416,Constituent Call,"(42.3372, -71.0416)"
532508,101001331459,03/12/2015 01:11:18 PM,,03/18/2015 06:39:30 AM,ONTIME,Closed,Case Closed Case Noted This is BTD policy.,Transportation General Request,Transportation - Traffic Division,Administrative & General Requests,Transportation General Request,BTDT_Parking Enforcement,BTDT,,,,,,,,,,,,,,,,,42.3594,-71.0587,Constituent Call,"(0, 0)"
533856,101001333408,03/15/2015 11:28:37 AM,,03/16/2015 01:06:04 PM,ONTIME,Closed,Case Closed Case Resolved area clear,Transportation General Request,Transportation - Traffic Division,Administrative & General Requests,Transportation General Request,BTDT_Parking Enforcement,BTDT,,,173 Brookway Rd  Roslindale  MA  02131,12.0,02,5.0,E5,Roslindale,10.0,Ward 19,1911.0,R1,173 Brookway Rd,2131.0,Address,22703.0,42.2916,-71.1207,Constituent Call,"(42.2916, -71.1207)"
535293,101001335467,03/17/2015 05:27:21 PM,,05/20/2015 01:28:14 PM,ONTIME,Closed,Case Closed. Closed date : 2015-05-20 13:28:14.637 Case Noted Streets have reverted to previous conditions.,Transportation General Request,Transportation - Traffic Division,Administrative & General Requests,Transportation General Request,BTDT_Sign Shop_Sign Installation,BTDT,,,337 E St  South Boston  MA  02127,6.0,05,2.0,C6,South Boston / South Boston Waterfront,5.0,Ward 6,603.0,CM,337 E St,2127.0,Address,50624.0,42.3382,-71.0486,Constituent Call,"(42.3382, -71.0486)"
536192,101001336632,03/18/2015 04:45:10 PM,,03/19/2015 11:57:52 AM,ONTIME,Closed,Case Closed Case Noted Handicap placards are not exempt from street cleaning. Tickets issued can be appealed at parking clerks office.,Transportation General Request,Transportation - Traffic Division,Administrative & General Requests,Transportation General Request,BTDT_Parking Enforcement,BTDT,,,52 Boylston St  Jamaica Plain  MA  02130,9.0,02,6.0,E13,Jamaica Plain,11.0,Ward 19,1901.0,R4,52 Boylston St,2130.0,Address,18584.0,42.3177,-71.1072,Constituent Call,"(42.3177, -71.1072)"
537252,101001338106,03/20/2015 10:11:30 AM,,03/20/2015 10:12:45 AM,ONTIME,Closed,Case Closed Duplicate of Existing Case Case created in error for incorrect request.,Transportation General Request,Transportation - Traffic Division,Administrative & General Requests,Transportation General Request,BTDT_Administration,BTDT,,,9 Neponset Ave  Dorchester  MA  02122,7.0,07,3.0,C11,Dorchester,7.0,Ward 16,1602.0,R1,9 Neponset Ave,2122.0,Address,100914.0,42.2969,-71.0563,Constituent Call,"(42.2969, -71.0563)"
537873,101001338911,03/21/2015 12:39:40 PM,,03/21/2015 12:41:13 PM,ONTIME,Closed,Case Closed Case Invalid case opened in error,Transportation General Request,Transportation - Traffic Division,Administrative & General Requests,Transportation General Request,BTDT_Administration,BTDT,,,62 Hereford St  Boston  MA  02115,4.0,1C,8.0,D4,Back Bay,14.0,05,509.0,C,62 Hereford St,2115.0,Address,73017.0,42.3486,-71.0854,Constituent Call,"(42.3486, -71.0854)"
538379,101001339672,03/23/2015 11:38:05 AM,,03/26/2015 10:27:43 AM,ONTIME,Closed,Case Closed Case Noted Tow Zone No Parking signs with double arrows recently posted on Jenkins St. only restrict that side of street not both sides of street. There is resident permit parking signs posted on right side of street and still is resident permit parking on this side of street.,Transportation General Request,Transportation - Traffic Division,Administrative & General Requests,Transportation General Request,BTDT_Engineering_New Sign and Pavement Marking Requests,BTDT,,https://cityworker.cityofboston.gov:8443/attachments/report/5510335fd052a8008cd0af57/closed_photo/Report.jpg,9 Jenkins St  South Boston  MA  02127,6.0,05,2.0,C6,South Boston / South Boston Waterfront,5.0,Ward 7,706.0,R1,9 Jenkins St,2127.0,Address,79631.0,42.3308,-71.0538,Constituent Call,"(42.3308, -71.0538)"
538789,101001340213,03/24/2015 04:30:22 AM,,03/30/2015 06:47:03 AM,ONTIME,Closed,Case Closed Case Noted Left message and call has not been returned.,Transportation General Request,Transportation - Traffic Division,Administrative & General Requests,Transportation General Request,BTDT_Parking Enforcement,BTDT,,,842 E Fourth St  South Boston  MA  02127,6.0,05,2.0,C6,South Boston / South Boston Waterfront,5.0,Ward 6,608.0,R3,842 E Fourth St,2127.0,Address,60025.0,42.335,-71.0298,Constituent Call,"(42.335, -71.0298)"
541345,101001343751,03/27/2015 02:41:50 PM,,03/27/2015 02:44:59 PM,ONTIME,Closed,Case Closed Case Invalid Case opened in error,Transportation General Request,Transportation - Traffic Division,Administrative & General Requests,Transportation General Request,BTDT_Administration,BTDT,,,358 Centre St  Jamaica Plain  MA  02130,9.0,02,6.0,E13,Jamaica Plain,11.0,Ward 10,1009.0,CM,358 Centre St,2130.0,Address,27998.0,42.3223,-71.1076,Constituent Call,"(42.3223, -71.1076)"
541478,101001343931,03/27/2015 06:37:16 PM,,04/01/2015 12:55:43 PM,ONTIME,Closed,Case Closed Case Resolved  Constituent has been referred to the proper authority in this matter.,Transportation General Request,Transportation - Traffic Division,Administrative & General Requests,Transportation General Request,BTDT_Administration,BTDT,,,INTERSECTION of Beacon St & Chestnut Hill Ave  Brighton  MA,11.0,04,9.0,D14,Allston / Brighton,15.0,Ward 21,2116.0,,INTERSECTION Beacon St & Chestnut Hill Ave,,Intersection,1079.0,42.3359,-71.1509,Constituent Call,"(42.3359, -71.1509)"
542001,101001344721,03/30/2015 10:07:01 AM,,04/01/2015 02:07:46 PM,ONTIME,Closed,Case Closed Case Noted  Thank you for your call  the city is not towing until further notice due to some neighborhoods still having snow on streets.,Transportation General Request,Transportation - Traffic Division,Administrative & General Requests,Transportation General Request,PWDx_Administration,PWDx,,,4 Colonial Ave  Dorchester  MA  02124,8.0,07,4.0,B3,Dorchester,9.0,Ward 17,1705.0,R3,4 Colonial Ave,2124.0,Address,34876.0,42.2908,-71.0748,Constituent Call,"(42.2908, -71.0748)"
542680,101001345655,03/31/2015 09:49:16 AM,,,ONTIME,Open,,Transportation General Request,Transportation - Traffic Division,Administrative & General Requests,Transportation General Request,INFO01_GenericeFormforOtherServiceRequestTypes,INFO,,,INTERSECTION of W Broadway & Dorchester Ave  South Boston  MA,6.0,05,2.0,C6,South Boston / South Boston Waterfront,5.0,Ward 6,601.0,,INTERSECTION W Broadway & Dorchester Ave,,Intersection,1992.0,42.343,-71.0572,Constituent Call,"(42.343, -71.0572)"
542824,101001345854,03/31/2015 12:18:36 PM,,04/13/2015 09:48:17 AM,ONTIME,Closed,Case Closed Case Noted BTD is aware of the situation at #6-10 Devine Way. Another work order was issued to replace resident parking signs and poles that were illegally removed again. Boston Police have been notified.,Transportation General Request,Transportation - Traffic Division,Administrative & General Requests,Transportation General Request,BTDT_District 05,BTDT,,,6 General William H Devine Way  South Boston  MA  02127,6.0,05,2.0,C6,South Boston / South Boston Waterfront,5.0,Ward 7,706.0,C,6 General William H Devine Way,2127.0,Address,63241.0,42.3287,-71.0565,Constituent Call,"(42.3287, -71.0565)"
543063,101001346172,03/31/2015 03:50:20 PM,,04/01/2015 04:23:33 PM,ONTIME,Closed,Case Closed Case Noted DAY SHIFT SUPERVISORS INFORMED.,Transportation General Request,Transportation - Traffic Division,Administrative & General Requests,Transportation General Request,BTDT_Parking Enforcement,BTDT,,,395 Washington St  Brighton  MA  02135,11.0,04,9.0,D14,Allston / Brighton,15.0,Ward 22,2203.0,C,395 Washington St,2135.0,Address,155714.0,42.3493,-71.1549,Constituent Call,"(42.3493, -71.1549)"
543192,101001346372,04/01/2015 06:08:08 AM,,04/02/2015 05:45:23 AM,ONTIME,Closed,Case Closed Case Resolved Vehicle was removed.,Transportation General Request,Transportation - Traffic Division,Administrative & General Requests,Transportation General Request,BTDT_Parking Enforcement,BTDT,,,INTERSECTION of Dorchester Ave & Melville Ave  Dorchester  MA,8.0,07,3.0,C11,Dorchester,7.0,Ward 16,1601.0,,INTERSECTION Dorchester Ave & Melville Ave,,Intersection,4138.0,42.2961,-71.0614,Constituent Call,"(42.2961, -71.0614)"
543944,101001347355,04/01/2015 09:00:00 PM,,,ONTIME,Open,,box relocation request sent to engineering,Transportation - Traffic Division,Administrative & General Requests,Transportation General Request,PWDx_Street Light_General Lighting Request,PWDx,,,832 Parker St  Mission Hill  MA  02120,9.0,10A,8.0,B2,Mission Hill,14.0,Ward 10,1005.0,R4,832 Parker St,2120.0,Address,107891.0,42.3273,-71.0994,Constituent Call,"(42.3273, -71.0994)"
545388,101001349417,04/04/2015 06:01:18 PM,,09/02/2015 12:53:37 PM,ONTIME,Closed,Case Closed. Closed date : 2015-09-02 12:53:37.31 Case Noted Thank you for bringing this matter to our attention.    In order to help us better understand your request for a barrier; please visit the link below to download a request form to provide some background information on your request. Upon receipt of the completed form  engineering staff will review the form and any supporting documentation and perform a site visit for a safety evaluation. Based on the information provided and the site evaluation  we will determine what safety measures (if any) can be implemented in response to your request.     Please note that the completion of this form does not guarantee a barrier will be installed. Other safety measures such as signage  lighting  and/or changes to roadway geometry may also be implemented to address safety concerns instead of  or in addition to  your request for a barrier.    If you have any questions  please contact the Public Works Department Engineering Division at 617-635-4968 or at pwdengineering@boston.gov.  Again  we appreciate and thank you for your interest in public safety and the welfare of your community.    Barrier Request Form:  https://attachments.cityofboston.gov/?f=14990&fid=28a944f9,Transportation General Request,Transportation - Traffic Division,Administrative & General Requests,Transportation General Request,PWDx_Engineering_Design,PWDx,,,11 Half Moon St  Dorchester  MA  02125,7.0,03,7.0,B2,Roxbury,13.0,Ward 13,1304.0,R3,11 Half Moon St,2125.0,Address,68057.0,42.3168,-71.0716,Constituent Call,"(42.3168, -71.0716)"
546320,101001350679,04/07/2015 08:40:22 AM,,04/09/2015 08:22:51 AM,ONTIME,Closed,Case Closed Case Resolved Dear Constituent     The Boston Public Works Construction Inspection Unit (CIU) Inspector met with the constituent and explained the reason for the construction.    The work is now complete  and the constituent was satisfied with the reasoning.      Sincerely     Mark Cardarelli  Supervisor of Utility Coordination and Compliance  Boston Public Works Department  617-635-4951 Office  617-438-8517 Cell,Transportation General Request,Transportation - Traffic Division,Administrative & General Requests,Transportation General Request,PWDx_Contractor Complaints,PWDx,,,987-997 Bennington St  East Boston  MA  02128,1.0,09,1.0,A7,East Boston,1.0,Ward 1,112.0,C,987-997 Bennington St,2128.0,Address,14966.0,42.3864,-71.0071,Constituent Call,"(42.3864, -71.0071)"
546622,101001351085,04/07/2015 01:17:16 PM,,04/16/2015 08:56:09 AM,ONTIME,Closed,Case Closed Case Resolved Dear Constituent     As you are aware of the Boston Public Works Construction Inspection Unit (CIU) Inspector called you and explained the reasons for the work and why they had to post the way the had to..    The City thanks you for your understanding  and apologizes for the inconvenience.    .Sincerely     Mark Cardarelli  Supervisor of Utility Coordination and Compliance  Boston Public Works Department  617-635-4951 Office  617-438-8517 Cell,Transportation General Request,Transportation - Traffic Division,Administrative & General Requests,Transportation General Request,PWDx_Contractor Complaints,PWDx,,,31 Burbank St  Boston  MA  02115,4.0,10A,8.0,D4,Fenway / Kenmore / Audubon Circle / Longwood,14.0,Ward 4,406.0,A,31 Burbank St,2115.0,Address,199392.0,42.3445,-71.0878,Constituent Call,"(42.3445, -71.0878)"
547742,101001352523,04/09/2015 07:59:56 AM,,04/13/2015 03:13:47 PM,ONTIME,Closed,Case Closed Case Resolved The residents of this street petitioned to have the Permit Parking installed through the mayor's office of neighborhood services.    The residents requested to be added to the program due to the lack of parking availability at their homes.    BTD must implement the program when it has gone through the community process.     If you have any questions  please feel free to contact me.    Kevin Donahue  Director of Community Affairs  Boston Transportation Department  kevin.donahue@boston.gov  617-635-2447,Transportation General Request,Transportation - Traffic Division,Administrative & General Requests,Transportation General Request,BTDT_Administration,BTDT,,,25 Walk Hill St  Jamaica Plain  MA  02130,12.0,02,6.0,E13,Jamaica Plain,10.0,19,1907.0,E,25 Walk Hill St,2130.0,Address,141634.0,42.2946,-71.1159,Constituent Call,"(42.2946, -71.1159)"
548307,101001353332,04/10/2015 08:31:19 AM,,04/10/2015 08:34:21 AM,ONTIME,Closed,Case Closed Case Invalid Opened wrong eform.  See case 1353334.,Transportation General Request,Transportation - Traffic Division,Administrative & General Requests,Transportation General Request,BTDT_Administration,BTDT,,,14-16 Miles St  Roxbury  MA  02119,9.0,10B,6.0,E13,Jamaica Plain,11.0,Ward 11,1104.0,R2,14-16 Miles St,2119.0,Address,95317.0,42.3186,-71.0999,Constituent Call,"(42.3186, -71.0999)"
548413,101001353470,04/10/2015 10:10:39 AM,,04/10/2015 10:14:47 AM,ONTIME,Closed,Case Closed Case Invalid Case opened in error,Transportation General Request,Transportation - Traffic Division,Administrative & General Requests,Transportation General Request,BTDT_Administration,BTDT,,,331-335 Belgrade Ave  Roslindale  MA  02131,9.0,06,5.0,E5,Roslindale,10.0,Ward 20,2008.0,C,331-335 Belgrade Ave,2131.0,Address,13658.0,42.2862,-71.1453,Constituent Call,"(42.2862, -71.1453)"
548515,101001353596,04/10/2015 12:15:00 PM,,05/20/2015 01:16:31 PM,ONTIME,Closed,Case Closed. Closed date : 2015-05-20 13:16:31.293 Case Resolved Work completed 5/20/15.,Transportation General Request,Transportation - Traffic Division,Administrative & General Requests,Transportation General Request,BTDT_Request for Directional or Roadway Changes,BTDT,,,0 Pleasant St  Hyde Park  MA  02136,12.0,08,5.0,E18,Hyde Park,10.0,Ward 18,1816.0,E,0 Pleasant St,2136.0,Address,111102.0,42.2557,-71.1151,Employee Generated,"(42.2557, -71.1151)"
549238,101001354623,04/13/2015 08:27:12 AM,,,ONTIME,Open,,Transportation General Request,Transportation - Traffic Division,Administrative & General Requests,Transportation General Request,INFO01_GenericeFormforOtherServiceRequestTypes,INFO,,,2 Grotto Glen Rd  Jamaica Plain  MA  02130,9.0,10A,8.0,E13,Jamaica Plain,11.0,Ward 10,1008.0,R3,2 Grotto Glen Rd,2130.0,Address,67290.0,42.3254,-71.1082,Constituent Call,"(42.3254, -71.1082)"
549305,101001354743,04/13/2015 09:47:33 AM,,04/14/2015 12:15:22 PM,ONTIME,Closed,Case Closed Case Resolved  THe barricades were removed because they were damaged. THe city is looking in to replacing them with a more solid solution.,Transportation General Request,Transportation - Traffic Division,Administrative & General Requests,Transportation General Request,BTDT_Administration,BTDT,,,INTERSECTION of American Legion Hwy & Clare Ave  Hyde Park  MA,12.0,08,5.0,E18,Hyde Park,10.0,Ward 18,1808.0,,INTERSECTION American Legion Hwy & Clare Ave,,Intersection,384.0,42.2725,-71.119,Constituent Call,"(42.2725, -71.119)"
550268,101001356073,04/14/2015 12:56:00 PM,,05/05/2015 01:22:38 PM,ONTIME,Closed,Case Closed. Closed date : 2015-05-05 13:22:38.697 Case Noted Officer will do daily.,Transportation General Request,Transportation - Traffic Division,Administrative & General Requests,Transportation General Request,BTDT_Parking Enforcement,BTDT,,,16 Becket St  Dorchester  MA  02124,8.0,07,3.0,C11,Dorchester,7.0,Ward 16,1611.0,R2,16 Becket St,2124.0,Address,13050.0,42.2812,-71.0644,Constituent Call,"(42.2812, -71.0644)"
550468,101001356368,04/14/2015 04:32:00 PM,,,ONTIME,Open,,Transportation General Request,Transportation - Traffic Division,Administrative & General Requests,Transportation General Request,INFO01_GenericeFormforOtherServiceRequestTypes,INFO,,,12-28 Lansdowne St  Boston  MA  02215,4.0,10A,8.0,D4,Fenway / Kenmore / Audubon Circle / Longwood,14.0,Ward 5,502.0,C,12-28 Lansdowne St,2215.0,Address,84005.0,42.3466,-71.0956,Constituent Call,"(42.3466, -71.0956)"
550813,101001356832,04/15/2015 09:52:00 AM,,11/10/2015 01:34:41 PM,ONTIME,Closed,Case Closed. Closed date : 2015-11-10 13:34:41.03 Case Resolved The upgrade of the roadway classification from private way to public way requires that the abutting property owners pay a portion of the upgrade costs. Attached is a non-binding petition form; if at least 50% of the affected property owners sign this petition we will (1) conduct cost assessments to determine the dollar amount for each affected property  (2) meet with the residents to further discuss the procedure and options  and (3) hold a public hearing to allow all property owners to vote on whether or not they wish to go through with the process.      Constituent may contact the Public Improvement Commission at PIC@boston.gov with any further questions.,Transportation General Request,Transportation - Traffic Division,Administrative & General Requests,Transportation General Request,PWDx_Engineering_PIC,PWDx,,,4 Hunter St  Roslindale  MA  02131,12.0,02,6.0,E18,Jamaica Plain,10.0,Ward 19,1912.0,R1,4 Hunter St,2131.0,Address,76127.0,42.2882,-71.1178,Constituent Call,"(42.2882, -71.1178)"
551774,101001358167,04/16/2015 01:51:00 PM,,06/23/2015 07:58:18 AM,ONTIME,Closed,Case Closed. Closed date : 2015-06-23 07:58:18.12 Duplicate of Existing Case,Transportation General Request,Transportation - Traffic Division,Administrative & General Requests,Transportation General Request,BTDT_District 04,BTDT,,,INTERSECTION of Ashton St & Woodrow Ave  Dorchester  MA,8.0,07,4.0,B3,Greater Mattapan,9.0,Ward 14,1412.0,,INTERSECTION Ashton St & Woodrow Ave,,Intersection,675.0,42.2859,-71.0898,Constituent Call,"(42.2859, -71.0898)"
552401,101001359086,04/17/2015 02:22:00 PM,,05/06/2015 08:15:05 AM,ONTIME,Closed,Case Closed. Closed date : 2015-05-06 08:15:05.36 Case Noted Livery vehicles are not allowed to park in loading zones. Park at meters and pay them and you will never get a ticket or wait until customer is at curb then pull up.,Transportation General Request,Transportation - Traffic Division,Administrative & General Requests,Transportation General Request,BTDT_Parking Enforcement,BTDT,,,INTERSECTION of Atlantic Ave & Summer St  Boston  MA,4.0,1C,2.0,A1,Downtown / Financial District,4.0,Ward 3,308.0,,INTERSECTION Atlantic Ave & Summer St,,Intersection,732.0,42.3527,-71.0554,Constituent Call,"(42.3527, -71.0554)"
552819,101001359718,04/19/2015 10:47:00 AM,,,ONTIME,Open,,Transportation General Request,Transportation - Traffic Division,Administrative & General Requests,Transportation General Request,INFO01_GenericeFormforOtherServiceRequestTypes,INFO,,,INTERSECTION of Albion St & Highland St  Hyde Park  MA,12.0,08,5.0,E18,Hyde Park,10.0,Ward 18,1816.0,,INTERSECTION Albion St & Highland St,,Intersection,232.0,42.2523,-71.1142,Constituent Call,"(42.2523, -71.1142)"
552877,101001359813,04/19/2015 03:29:16 PM,,04/19/2015 03:31:23 PM,ONTIME,Closed,Case Closed Case Invalid Wrong eform.,Transportation General Request,Transportation - Traffic Division,Administrative & General Requests,Transportation General Request,BTDT_Administration,BTDT,,,INTERSECTION of Back St & James J Storrow Memorial Dr  Boston  MA,3.0,1C,8.0,D4,Back Bay,14.0,Ward 5,505.0,,INTERSECTION Back St & James J Storrow Memorial Dr,,Intersection,872.0,42.3558,-71.0733,Constituent Call,"(42.3558, -71.0733)"
552948,101001359917,04/20/2015 06:50:00 AM,,05/07/2015 09:56:10 AM,ONTIME,Closed,Case Closed. Closed date : 2015-05-07 09:56:10.953 Case Resolved Do not Enter @ One way signs and pole in place on Lambert ave at Dorr st. Visual inspection 5/7/15,Transportation General Request,Transportation - Traffic Division,Administrative & General Requests,Transportation General Request,BTDT_District 03,BTDT,,,INTERSECTION of Dorr St & Lambert Ave  Roxbury  MA,7.0,10B,7.0,B2,Roxbury,13.0,Ward 9,905.0,,INTERSECTION Dorr St & Lambert Ave,,Intersection,4222.0,42.3269,-71.0907,Constituent Call,"(42.3269, -71.0907)"
552978,101001359959,04/20/2015 09:24:00 AM,,05/11/2015 03:04:19 PM,ONTIME,Closed,Case Closed. Closed date : 2015-05-11 15:04:19.977 Case Resolved Harvard st swept this afternoon.  spoke to inspector to sweep according to schedule,Transportation General Request,Transportation - Traffic Division,Administrative & General Requests,Transportation General Request,PWDx_District 1C: Downtown,PWDx,,,INTERSECTION of Harvard St & Tyler St  Boston  MA,4.0,1C,2.0,A1,Downtown / Financial District,4.0,Ward 3,308.0,,INTERSECTION Harvard St & Tyler St,,Intersection,5742.0,42.3495,-71.0613,Constituent Call,"(42.3495, -71.0613)"
553628,101001360848,04/21/2015 01:57:00 PM,,06/30/2015 10:54:34 AM,ONTIME,Closed,Case Closed. Closed date : 2015-06-30 10:54:34.257 Case Noted there is a food truck parked here,Transportation General Request,Transportation - Traffic Division,Administrative & General Requests,Transportation General Request,BTDT_Engineering_New Sign and Pavement Marking Requests,BTDT,,,191-201 Sumner St  East Boston  MA  02128,1.0,09,1.0,A7,East Boston,1.0,Ward 1,103.0,EA,191-201 Sumner St,2128.0,Address,132332.0,42.3689,-71.0401,Constituent Call,"(42.3689, -71.0401)"
555815,101001363903,04/26/2015 09:26:00 AM,,05/11/2015 09:15:54 AM,ONTIME,Closed,Case Closed. Closed date : 2015-05-11 09:15:54.9 Case Resolved Dear Constituent     The Boston Public Works Construction Inspection Unit (CIU) Inspector investigated and determined the following:    The permit is for temporary parking restriction for production vehicles to unload and stage for the Wednesday May 13th Party in the Park at Jamaica Pond.  .  Any questions or concerns you make contact the number listed below.    Sincerely     Mark Cardarelli  Supervisor of Utility Coordination and Compliance  Boston Public Works Department  617-635-4951 Office  617-438-8517 Cell,Transportation General Request,Transportation - Traffic Division,Administrative & General Requests,Transportation General Request,PWDx_Contractor Complaints,PWDx,,,70 Moraine St  Jamaica Plain  MA  02130,9.0,02,6.0,E13,Jamaica Plain,11.0,Ward 19,1903.0,R2,70 Moraine St,2130.0,Address,277360.0,42.3197,-71.1151,Constituent Call,"(42.3197, -71.1151)"
557196,101001365779,04/28/2015 03:35:00 PM,,,ONTIME,Open,,Transportation General Request,Transportation - Traffic Division,Administrative & General Requests,Transportation General Request,ISD_Building (INTERNAL),ISD,,,50 Concord Sq  Roxbury  MA  02118,4.0,1C,7.0,D4,South End,6.0,04,404.0,,50 Concord Sq,2118.0,Address,156605.0,42.3419,-71.0796,Constituent Call,"(42.3419, -71.0796)"
557765,101001366576,04/29/2015 01:21:50 PM,,04/29/2015 01:24:11 PM,ONTIME,Closed,Case Closed Case Invalid case re-allocated to dpw,Transportation General Request,Transportation - Traffic Division,Administrative & General Requests,Transportation General Request,BTDT_Administration,BTDT,,,160-170 N Washington St  Boston  MA  02114,3.0,1B,8.0,A1,Boston,3.0,03,,C,160-170 N Washington St,2114.0,Address,146266.0,42.3674,-71.0592,Constituent Call,"(42.3674, -71.0592)"
557868,101001366748,04/29/2015 04:01:00 PM,,05/05/2015 03:27:54 PM,ONTIME,Closed,Case Closed. Closed date : 2015-05-05 15:27:54.12 Case Resolved 1 vehicle tagged,Transportation General Request,Transportation - Traffic Division,Administrative & General Requests,Transportation General Request,BTDT_Parking Enforcement,BTDT,,,INTERSECTION of Beach St & Lincoln St  Boston  MA,4.0,1C,2.0,A1,Downtown / Financial District,4.0,Ward 3,308.0,,INTERSECTION Beach St & Lincoln St,,Intersection,1061.0,42.3509,-71.0585,Constituent Call,"(42.3509, -71.0585)"
558443,101001367567,04/30/2015 04:41:00 PM,,05/05/2015 03:34:12 PM,ONTIME,Closed,Case Closed. Closed date : 2015-05-05 15:34:12.613 Case Resolved vehicles tagged and street overtimed for 2 hour limit,Transportation General Request,Transportation - Traffic Division,Administrative & General Requests,Transportation General Request,BTDT_Parking Enforcement,BTDT,,,8 Everett St  Jamaica Plain  MA  02130,9.0,02,6.0,E13,Jamaica Plain,11.0,Ward 19,1906.0,R3,8 Everett St,2130.0,Address,55231.0,42.31,-71.1088,Constituent Call,"(42.31, -71.1088)"
559029,101001368417,05/01/2015 06:25:00 PM,,,ONTIME,Open,,Transportation General Request,Transportation - Traffic Division,Administrative & General Requests,Transportation General Request,INFO01_GenericeFormforOtherServiceRequestTypes,INFO,,,INTERSECTION of South St & Walter St  Roslindale  MA,9.0,06,5.0,E5,Roslindale,10.0,Ward 20,2001.0,,INTERSECTION South St & Walter St,,Intersection,8399.0,42.2889,-71.1342,Constituent Call,"(42.2889, -71.1342)"
559123,101001368652,05/02/2015 02:06:00 PM,,05/07/2015 08:31:28 AM,ONTIME,Closed,Case Closed. Closed date : 2015-05-07 08:31:28.943 Case Resolved Dear Constituent     National Grid responding to a gas leak on your street activated an emergency permit.    Emergency work must be performed no matter what time of day or night in the interest of public safety and the protection of private property.    This proved to be a very difficult repair  resulting in National Grid working into the night.     The emergency work has now been completed.    Mark Cardarelli called the constituent relaying above information.    The city apologizes for the inconvenience this necessary work caused.    Sincerely      Mark Cardarelli  Supervisor of Utility Coordination and Compliance  Boston Public Works Department  617-635-4951 Office,Transportation General Request,Transportation - Traffic Division,Administrative & General Requests,Transportation General Request,PWDx_Contractor Complaints,PWDx,,,485-495 Harrison Ave  Roxbury  MA  02118,4.0,1C,2.0,D4,South End,4.0,Ward 3,307.0,CM,485-495 Harrison Ave,2118.0,Address,69845.0,42.3419,-71.0667,Constituent Call,"(42.3419, -71.0667)"
559818,101001369690,05/04/2015 02:13:00 PM,,,ONTIME,Open,,Transportation General Request,Transportation - Traffic Division,Administrative & General Requests,Transportation General Request,BTDT_Pavement Marking_Maintenance,BTDT,,,INTERSECTION of Commonwealth Ave & Harvard Ave  Allston  MA,11.0,04,9.0,D14,Allston / Brighton,14.0,Ward 21,2103.0,,INTERSECTION Commonwealth Ave & Harvard Ave,,Intersection,3370.0,42.3501,-71.1309,Constituent Call,"(42.3501, -71.1309)"
559820,101001369691,05/04/2015 02:14:00 PM,,07/15/2015 03:48:21 PM,ONTIME,Closed,Case Closed. Closed date : 2015-07-15 15:48:21.967 Case Noted Email sent directly to constituent.,Transportation General Request,Transportation - Traffic Division,Administrative & General Requests,Transportation General Request,BTDT_BostonBikes,BTDT,,,INTERSECTION of N Harvard St & Western Ave  Allston  MA,11.0,04,9.0,D14,Allston / Brighton,15.0,Ward 22,2201.0,,INTERSECTION N Harvard St & Western Ave,,Intersection,5767.0,42.3632,-71.1298,Constituent Call,"(42.3632, -71.1298)"
560161,101001370227,05/05/2015 09:21:00 AM,,,ONTIME,Open,,Transportation General Request,Transportation - Traffic Division,Administrative & General Requests,Transportation General Request,INFO01_GenericeFormforOtherServiceRequestTypes,INFO,,,105 Forest Hills St  Jamaica Plain  MA  02130,9.0,02,6.0,E13,Jamaica Plain,11.0,Ward 11,1107.0,CM,105 Forest Hills St,2130.0,Address,59338.0,42.3085,-71.1028,Constituent Call,"(42.3085, -71.1028)"
562176,101001373204,05/08/2015 09:26:00 AM,,05/12/2015 08:13:54 AM,ONTIME,Closed,Case Closed. Closed date : 2015-05-12 08:13:54.127 Case Resolved Dear Constituent     All utility companies and private contractors working in the City of Boston are required to order Police details.     A Police detail was ordered for this job.     The Construction Inspection Unit (CIU) Inspector states that in this particular job the detail was not filled.    The PWD has reached out to the Boston Police about the need to fill the detail requests.     The City apologizes for the inconvenience for this necessary work.     Sincerely      Mark Cardarelli  Supervisor of Utility Coordination and Compliance  Boston Public Works Department  617-635-4951 Office,Transportation General Request,Transportation - Traffic Division,Administrative & General Requests,Transportation General Request,PWDx_Contractor Complaints,PWDx,,,3 Wiggin St  Boston  MA  02113,3.0,1B,1.0,A1,Downtown / Financial District,3.0,Ward 3,302.0,R4,3 Wiggin St,2113.0,Address,149607.0,42.3657,-71.0545,Constituent Call,"(42.3657, -71.0545)"
562353,101001373464,05/08/2015 01:09:00 PM,,05/11/2015 03:57:58 PM,ONTIME,Closed,Case Closed. Closed date : 2015-05-11 15:57:58.967 Case Resolved area clear  will check daley,Transportation General Request,Transportation - Traffic Division,Administrative & General Requests,Transportation General Request,BTDT_Parking Enforcement,BTDT,,,5 Bilodeau Rd  Dorchester  MA  02121,7.0,03,4.0,B2,Roxbury,13.0,Ward 14,1403.0,R2,5 Bilodeau Rd,2121.0,Address,15503.0,42.3072,-71.0819,Constituent Call,"(42.3072, -71.0819)"
563731,101001375574,05/12/2015 11:19:00 AM,,05/14/2015 04:49:24 PM,ONTIME,Closed,Case Closed. Closed date : 2015-05-14 16:49:24.34 Case Invalid The case not have the proper information. I will be putting in another case.,Transportation General Request,Transportation - Traffic Division,Administrative & General Requests,Transportation General Request,INFO_Reallocation From Dept,INFO,,,,,,,,,,,,,,,,,42.3594,-71.0587,Employee Generated,"(0, 0)"
563840,101001375744,05/12/2015 01:23:00 PM,,06/02/2015 07:34:15 AM,ONTIME,Closed,Case Closed. Closed date : 2015-06-02 07:34:15.09 Case Resolved Hello - the Boston Police Telecommunications Division reviewed this matter and advise that several barriers were in need of replacement. They were replaced last Thursday. Thank you for conveying this information so they could take action. Sincerely  Commissioner's Office,Transportation General Request,Transportation - Traffic Division,Administrative & General Requests,Transportation General Request,INFO01_GenericeFormforOtherServiceRequestTypes,INFO,,,INTERSECTION of Fairview St & Mendum St  Roslindale  MA,9.0,06,5.0,E5,Roslindale,10.0,Ward 20,2004.0,,INTERSECTION Fairview St & Mendum St,,Intersection,4776.0,42.291,-71.128,Constituent Call,"(42.291, -71.128)"
563953,101001375907,05/12/2015 03:36:00 PM,,05/14/2015 10:21:00 AM,ONTIME,Closed,Case Closed. Closed date : 2015-05-14 10:21:00.53 Case Noted more information needed.  Such as permit number and plate number of the vehicle in question,Transportation General Request,Transportation - Traffic Division,Administrative & General Requests,Transportation General Request,BTDT_OPC_Phone Bank Service,BTDT,,,INTERSECTION of Saratoga St & Westbrook St  East Boston  MA,1.0,09,1.0,A7,East Boston,1.0,Ward 1,111.0,,INTERSECTION Saratoga St & Westbrook St,,Intersection,8288.0,42.3853,-71.013,Constituent Call,"(42.3853, -71.013)"
564138,101001376168,05/13/2015 07:27:00 AM,,05/13/2015 01:28:41 PM,ONTIME,Closed,Case Closed Case Resolved  The issue has been fixed by BTD operations.,Transportation General Request,Transportation - Traffic Division,Administrative & General Requests,Transportation General Request,BTDT_Administration,BTDT,,,INTERSECTION of Dorchester St & W Eighth St  South Boston  MA,6.0,05,2.0,C6,South Boston / South Boston Waterfront,5.0,Ward 7,705.0,,INTERSECTION Dorchester St & W Eighth St,,Intersection,4203.0,42.3328,-71.051,Constituent Call,"(42.3328, -71.051)"
564175,101001376217,05/13/2015 08:15:00 AM,,,ONTIME,Open,,Transportation General Request,Transportation - Traffic Division,Administrative & General Requests,Transportation General Request,INFO01_GenericeFormforOtherServiceRequestTypes,INFO,,,INTERSECTION of Arborway & Washington St  Jamaica Plain  MA,12.0,02,6.0,E13,Jamaica Plain,11.0,Ward 11,1108.0,,INTERSECTION Arborway & Washington St,,Intersection,514.0,42.3014,-71.1125,Constituent Call,"(42.3014, -71.1125)"
564281,101001376380,05/13/2015 09:33:00 AM,,05/13/2015 01:30:15 PM,ONTIME,Closed,Case Closed Case Resolved  All streets made One Way during the winter storms are currently being converted back.,Transportation General Request,Transportation - Traffic Division,Administrative & General Requests,Transportation General Request,BTDT_Administration,BTDT,,,INTERSECTION of E St & W Second St  South Boston  MA,6.0,05,2.0,C6,South Boston / South Boston Waterfront,5.0,Ward 6,601.0,,INTERSECTION E St & W Second St,,Intersection,4362.0,42.3391,-71.0477,Constituent Call,"(42.3391, -71.0477)"
564476,101001376648,05/13/2015 12:44:00 PM,,05/14/2015 09:43:34 AM,ONTIME,Closed,Case Closed. Closed date : 2015-05-14 09:43:34.577 Case Noted Star Market has a loading dock for deliveries and two large parking lots that can be utilized for vendor parking. The rear lot abutting Park Dr and Peterborough is nowhere near capacity. Because of this  the neighborhood and BTD would not be in favor of taking up resident or metered parking spaces for a loading zone.,Transportation General Request,Transportation - Traffic Division,Administrative & General Requests,Transportation General Request,BTDT_Engineering_New Sign and Pavement Marking Requests,BTDT,,,33 Kilmarnock St  Boston  MA  02215,4.0,10A,8.0,D4,Fenway / Kenmore / Audubon Circle / Longwood,14.0,21,2101.0,C,33 Kilmarnock St,2215.0,Address,157991.0,42.3437,-71.1002,Constituent Call,"(42.3437, -71.1002)"
564663,101001376917,05/13/2015 03:50:00 PM,,05/15/2015 06:59:36 AM,ONTIME,Closed,Case Closed. Closed date : 2015-05-15 06:59:36.533 Case Noted Your request for pavement marking replacement has been inspected by the traffic investigator and has been determined that it is in poor condition. A new Service Request has been created 101001378012 and will be added to an active list for re-painting  weather condition pending.,Transportation General Request,Transportation - Traffic Division,Administrative & General Requests,Transportation General Request,BTDT_District 02,BTDT,,,INTERSECTION of Brewer St & Burroughs St  Jamaica Plain  MA,9.0,02,6.0,E13,Jamaica Plain,11.0,Ward 19,1908.0,,INTERSECTION Brewer St & Burroughs St,,Intersection,1930.0,42.3121,-71.1152,Constituent Call,"(42.3121, -71.1152)"
564687,101001376949,05/13/2015 04:36:00 PM,,05/15/2015 01:05:11 PM,ONTIME,Closed,Case Closed. Closed date : 2015-05-15 13:05:11.187 Case Resolved,Transportation General Request,Transportation - Traffic Division,Administrative & General Requests,Transportation General Request,BTDT_Traffic Signal_Repair,BTDT,,,INTERSECTION of D St & W Seventh St  South Boston  MA,6.0,05,2.0,C6,South Boston / South Boston Waterfront,5.0,Ward 6,602.0,,INTERSECTION D St & W Seventh St,,Intersection,3805.0,42.3362,-71.0539,Constituent Call,"(42.3362, -71.0539)"
564707,101001376973,05/13/2015 05:12:00 PM,,05/15/2015 10:30:19 AM,ONTIME,Closed,Case Closed. Closed date : 2015-05-15 10:30:19.003 Case Resolved All stop signs are posted at W. Fifth St. & E St. nothing missing.,Transportation General Request,Transportation - Traffic Division,Administrative & General Requests,Transportation General Request,BTDT_District 05,BTDT,,https://cityworker.cityofboston.gov:8443/attachments/report/5553be3dd0527f6686ebfaf9/closed_photo/Report.jpg,INTERSECTION of E St & W Fifth St  South Boston  MA,6.0,05,2.0,C6,South Boston / South Boston Waterfront,5.0,Ward 6,603.0,,INTERSECTION E St & W Fifth St,,Intersection,4357.0,42.3365,-71.0508,Constituent Call,"(42.3365, -71.0508)"
564737,101001377023,05/13/2015 06:29:00 PM,,05/14/2015 06:44:25 PM,ONTIME,Closed,Case Closed. Closed date : 2015-05-14 18:44:25.56 Case Resolved officer stated area is clear at this time just one tagged for double parking was a UPS truck,Transportation General Request,Transportation - Traffic Division,Administrative & General Requests,Transportation General Request,BTDT_Parking Enforcement,BTDT,,,226 Commonwealth Ave  Boston  MA  02116,4.0,1C,8.0,D4,Back Bay,14.0,Ward 5,508.0,CM,226 Commonwealth Ave,2116.0,Address,39687.0,42.3505,-71.0817,Constituent Call,"(42.3505, -71.0817)"
564765,101001377066,05/13/2015 08:58:00 PM,,05/15/2015 06:53:55 AM,ONTIME,Closed,Case Closed. Closed date : 2015-05-15 06:53:55.07 Duplicate of Existing Case This is a duplicate of case #377864 currently being processed.,Transportation General Request,Transportation - Traffic Division,Administrative & General Requests,Transportation General Request,BTDT_District 05,BTDT,,,INTERSECTION of Columbia Rd & Marine Rd  South Boston  MA,6.0,05,2.0,C6,South Boston / South Boston Waterfront,5.0,Ward 7,702.0,,INTERSECTION Columbia Rd & Marine Rd,,Intersection,3259.0,42.3306,-71.0398,Constituent Call,"(42.3306, -71.0398)"
564965,101001377358,05/14/2015 09:39:00 AM,,05/14/2015 05:56:45 PM,ONTIME,Closed,Case Closed. Closed date : 2015-05-14 17:56:45.283 Case Noted this is a private way  contact boston police,Transportation General Request,Transportation - Traffic Division,Administrative & General Requests,Transportation General Request,BTDT_Parking Enforcement,BTDT,,,27 Nay St  East Boston  MA  02128,1.0,09,1.0,A7,East Boston,1.0,Ward 1,108.0,I,27 Nay St,2128.0,Address,167991.0,42.3831,-71.038,Constituent Call,"(42.3831, -71.038)"
565235,101001377705,05/14/2015 03:04:00 PM,,05/21/2015 01:43:33 PM,ONTIME,Closed,Case Closed. Closed date : 2015-05-21 13:43:33.43 Case Resolved Work completed 5/21/15.,Transportation General Request,Transportation - Traffic Division,Administrative & General Requests,Transportation General Request,BTDT_Sign Shop_Sign Installation,BTDT,,,198 Strathmore Rd  Brighton  MA  02135,11.0,04,9.0,D14,Brighton,15.0,21,2116.0,E,198 Strathmore Rd,2135.0,Address,131370.0,42.3401,-71.1547,Constituent Call,"(42.3401, -71.1547)"
565709,101001378389,05/15/2015 12:17:00 PM,,05/18/2015 12:07:09 PM,ONTIME,Closed,Case Closed Case Resolved  This section of street in South Boston will remain a one way. BPD notified as well. Residents requested roadway change prior to snow emergency. BTD deemed this section a public safety issue.,Transportation General Request,Transportation - Traffic Division,Administrative & General Requests,Transportation General Request,BTDT_Administration,BTDT,,,INTERSECTION of Dorchester St & W First St  South Boston  MA,6.0,05,2.0,C6,South Boston / South Boston Waterfront,5.0,Ward 6,605.0,,INTERSECTION Dorchester St & W First St,,Intersection,4218.0,42.3373,-71.0433,Constituent Call,"(42.3373, -71.0433)"
565735,101001378438,05/15/2015 01:04:00 PM,05/19/2015 02:56:43 PM,05/19/2015 03:12:08 PM,OVERDUE,Closed,Case Closed. Closed date : 2015-05-19 15:12:08.927 Case Resolved,Transportation General Request,Transportation - Traffic Division,Administrative & General Requests,Transportation General Request,BTDT_OPC_Phone Bank Service,BTDT,,,86 E Brookline St  Roxbury  MA  02118,4.0,1C,2.0,D4,South End,6.0,Ward 8,801.0,R4,86 E Brookline St,2118.0,Address,22189.0,42.3376,-71.0698,Constituent Call,"(42.3376, -71.0698)"
565802,101001378521,05/15/2015 02:29:59 PM,,05/15/2015 02:30:30 PM,ONTIME,Closed,Case Closed. Closed date : 2015-05-15 14:30:30.66 Duplicate of Existing Case 1376755,Transportation General Request,Transportation - Traffic Division,Administrative & General Requests,Transportation General Request,BTDT_Administration,BTDT,,,398 Neponset Ave  Dorchester  MA  02122,8.0,07,3.0,C11,Dorchester,7.0,Ward 16,1610.0,E,398 Neponset Ave,2122.0,Address,100881.0,42.2867,-71.0441,Constituent Call,"(42.2867, -71.0441)"
565836,101001378577,05/15/2015 03:31:50 PM,,05/15/2015 03:32:30 PM,ONTIME,Closed,Case Closed. Closed date : 2015-05-15 15:32:30.21 Case Invalid case opened in error,Transportation General Request,Transportation - Traffic Division,Administrative & General Requests,Transportation General Request,BTDT_Administration,BTDT,,,29 S Russell St  Boston  MA  02114,3.0,1B,1.0,A1,Beacon Hill,3.0,Ward 3,306.0,R4,29 S Russell St,2114.0,Address,119767.0,42.3603,-71.0661,Constituent Call,"(42.3603, -71.0661)"
565877,101001378643,05/15/2015 05:19:00 PM,,05/18/2015 05:34:59 PM,ONTIME,Closed,Case Closed. Closed date : 2015-05-18 17:34:59.783 Case Resolved area clear .will moniter situation,Transportation General Request,Transportation - Traffic Division,Administrative & General Requests,Transportation General Request,BTDT_Parking Enforcement,BTDT,,,INTERSECTION of Atlantic Ave & Summer St  Boston  MA,4.0,1C,2.0,A1,Downtown / Financial District,4.0,Ward 3,308.0,,INTERSECTION Atlantic Ave & Summer St,,Intersection,732.0,42.3527,-71.0554,Constituent Call,"(42.3527, -71.0554)"
566284,101001379209,05/17/2015 04:21:00 PM,,05/18/2015 01:50:24 PM,ONTIME,Closed,Case Closed. Closed date : 2015-05-18 13:50:24.943 Case Resolved spoke with Mr. Mondello,Transportation General Request,Transportation - Traffic Division,Administrative & General Requests,Transportation General Request,BTDT_OPC_Phone Bank Service,BTDT,,,115 Appleton St  Boston  MA  02116,4.0,1C,2.0,D4,South End,6.0,Ward 4,401.0,A,115 Appleton St,2116.0,Address,3862.0,42.3454,-71.0744,Constituent Call,"(42.3454, -71.0744)"
566485,101001379513,05/18/2015 09:40:00 AM,,05/20/2015 12:40:29 PM,ONTIME,Closed,Case Closed. Closed date : 2015-05-20 12:40:29.22 Case Resolved Work completed 5/20/15.,Transportation General Request,Transportation - Traffic Division,Administrative & General Requests,Transportation General Request,BTDT_Sign Shop_Sign Installation,BTDT,,,INTERSECTION of Burnham Pl & E Third St  South Boston  MA,6.0,05,2.0,C6,South Boston / South Boston Waterfront,5.0,Ward 6,605.0,,INTERSECTION Burnham Pl & E Third St,,Intersection,2223.0,42.3364,-71.0407,Constituent Call,"(42.3364, -71.0407)"
567043,101001380356,05/19/2015 09:01:00 AM,,06/02/2015 07:35:19 AM,ONTIME,Closed,Case Closed. Closed date : 2015-06-02 07:35:19.31 Case Noted,Transportation General Request,Transportation - Traffic Division,Administrative & General Requests,Transportation General Request,BTDT_Broken Meter Complaints,BTDT,,,290 Congress St  Boston  MA  02110,6.0,1C,1.0,A1,Downtown / Financial District,3.0,03,306.0,,290 Congress St,2110.0,Address,157186.0,42.353,-71.0525,Constituent Call,"(42.353, -71.0525)"
568698,101001382844,05/21/2015 09:08:00 PM,,06/02/2015 08:18:17 AM,ONTIME,Closed,Case Closed. Closed date : 2015-06-02 08:18:17.85 Case Resolved Signs have been removed last week.,Transportation General Request,Transportation - Traffic Division,Administrative & General Requests,Transportation General Request,BTDT_Permits & Special Events,BTDT,,,INTERSECTION of Northern Ave & Seaport Blvd  Boston  MA,6.0,05,2.0,C6,South Boston / South Boston Waterfront,5.0,Ward 6,601.0,,INTERSECTION Northern Ave & Seaport Blvd,,Intersection,7645.0,42.351,-71.0439,Constituent Call,"(42.351, -71.0439)"
568858,101001383092,05/22/2015 10:01:00 AM,,09/21/2015 12:25:10 PM,ONTIME,Closed,Case Closed. Closed date : 2015-09-21 12:25:10.64 Case Noted Rack request has been added to our queue. Due to the significant number of requests we receive  we may not be able to fulfill this specific request this year.,Transportation General Request,Transportation - Traffic Division,Administrative & General Requests,Transportation General Request,BTDT_BostonBikes,BTDT,,,INTERSECTION of Intervale St & Magnolia St  Dorchester  MA,7.0,03,4.0,B2,Roxbury,13.0,Ward 14,1401.0,,INTERSECTION Intervale St & Magnolia St,,Intersection,6501.0,42.3097,-71.0752,Constituent Call,"(42.3097, -71.0752)"
569463,101001393989,05/24/2015 04:10:00 PM,,06/01/2015 01:13:13 PM,ONTIME,Closed,Case Closed. Closed date : 2015-06-01 13:13:13.44 Case Noted Taxi's are not commercial vehicles and can park on residential streets.,Transportation General Request,Transportation - Traffic Division,Administrative & General Requests,Transportation General Request,BTDT_Parking Enforcement,BTDT,,,86 Lodgehill Rd  Hyde Park  MA  02136,12.0,08,5.0,E18,Hyde Park,10.0,Ward 18,1822.0,R1,86 Lodgehill Rd,2136.0,Address,86937.0,42.268,-71.1271,Constituent Call,"(42.268, -71.1271)"
570027,101001394853,05/26/2015 12:33:00 PM,,06/15/2015 10:52:03 AM,ONTIME,Closed,Case Closed. Closed date : 2015-06-15 10:52:03.863 Case Noted All Street Cleaning signage are for Tuesdays,Transportation General Request,Transportation - Traffic Division,Administrative & General Requests,Transportation General Request,BTDT_District 04,BTDT,,,1-11 Ames St  Dorchester  MA  02124,8.0,07,4.0,B3,Greater Mattapan,9.0,14,1410.0,E,1-11 Ames St,2124.0,Address,161527.0,42.2905,-71.0868,Constituent Call,"(42.2905, -71.0868)"
570397,101001395333,05/26/2015 06:27:00 PM,,06/02/2015 02:05:16 PM,ONTIME,Closed,Case Closed. Closed date : 2015-06-02 14:05:16.89 Case Noted Your request for pavement marking replacement has been inspected by the traffic investigator and has been determined that it is in poor condition. A new Service Request has been created 101001400762 and will be added to an active list for re-painting  weather condition pending.,Transportation General Request,Transportation - Traffic Division,Administrative & General Requests,Transportation General Request,BTDT_District 06,BTDT,,,INTERSECTION of Clarendon St & Columbus Ave  Boston  MA,4.0,1C,2.0,D4,South End,6.0,Ward 5,501.0,,INTERSECTION Clarendon St & Columbus Ave,,Intersection,3075.0,42.3473,-71.0735,Constituent Call,"(42.3473, -71.0735)"
570865,101001395974,05/27/2015 01:07:00 PM,,,ONTIME,Open,,Transportation General Request,Transportation - Traffic Division,Administrative & General Requests,Transportation General Request,INFO01_GenericeFormforOtherServiceRequestTypes,INFO,,,INTERSECTION of Blue Hill Ave & Seaver St  Jamaica Plain  MA,9.0,03,7.0,B2,Greater Mattapan,13.0,Ward 12,1207.0,,INTERSECTION Blue Hill Ave & Seaver St,,Intersection,1562.0,42.3052,-71.0848,Constituent Call,"(42.3052, -71.0848)"
570981,101001396138,05/27/2015 03:21:00 PM,,06/23/2015 08:20:58 AM,ONTIME,Closed,Case Closed. Closed date : 2015-06-23 08:20:58.15 Case Resolved,Transportation General Request,Transportation - Traffic Division,Administrative & General Requests,Transportation General Request,BTDT_Sign Shop_Sign Installation,BTDT,,,INTERSECTION of Empire St & N Harvard St  Allston  MA,11.0,04,9.0,D14,Allston / Brighton,15.0,Ward 22,2201.0,,INTERSECTION Empire St & N Harvard St,,Intersection,4587.0,42.3584,-71.1268,Constituent Call,"(42.3584, -71.1268)"
571352,101001396690,05/28/2015 09:37:00 AM,,06/05/2015 10:41:34 AM,ONTIME,Closed,Case Closed. Closed date : 2015-06-05 10:41:34.873 Case Noted This is a residential area and additional meters would hurt residents' ability to park. Any changes in parking regulations need to be vetted through your Neighborhood Services coordinator for Back Bay. 617-635-3485.,Transportation General Request,Transportation - Traffic Division,Administrative & General Requests,Transportation General Request,BTDT_Engineering_New Sign and Pavement Marking Requests,BTDT,,,482 Beacon St  Boston  MA  02115,4.0,1C,8.0,D4,Back Bay,14.0,Ward 5,509.0,CM,482 Beacon St,2115.0,Address,11646.0,42.3513,-71.0887,Constituent Call,"(42.3513, -71.0887)"
571398,101001396749,05/28/2015 10:07:00 AM,,06/01/2015 02:35:47 PM,ONTIME,Closed,Case Closed. Closed date : 2015-06-01 14:35:47.323 Case Noted Your request for pavement marking replacement has been inspected by the traffic investigator and has been determined that it is in poor condition. A new Service Request has been created 101001399916 and will be added to an active list for re-painting  weather condition pending.,Transportation General Request,Transportation - Traffic Division,Administrative & General Requests,Transportation General Request,BTDT_District 05,BTDT,,,INTERSECTION of W Broadway & E St  South Boston  MA,6.0,05,2.0,C6,South Boston / South Boston Waterfront,5.0,Ward 6,603.0,,INTERSECTION W Broadway & E St,,Intersection,2004.0,42.3378,-71.0493,Constituent Call,"(42.3378, -71.0493)"
572550,101001398407,05/29/2015 04:55:00 PM,,07/08/2015 01:40:17 PM,ONTIME,Closed,Case Closed. Closed date : 2015-07-08 13:40:17.693 Case Invalid This is a Viola Steam issue,Transportation General Request,Transportation - Traffic Division,Administrative & General Requests,Transportation General Request,BTDT_Engineering_Request for Traffic Signal Study or Review,BTDT,,,INTERSECTION of Humboldt Ave & Seaver St  Dorchester  MA,9.0,10B,7.0,B2,Roxbury,13.0,Ward 12,1207.0,,INTERSECTION Humboldt Ave & Seaver St,,Intersection,6398.0,42.31,-71.0921,Constituent Call,"(42.31, -71.0921)"
574598,101001401421,06/03/2015 10:18:00 AM,,06/08/2015 01:57:33 PM,ONTIME,Closed,Case Closed. Closed date : 2015-06-08 13:57:33.497 Case Noted Your request for pavement marking replacement has been inspected by the traffic investigator and has been determined that it is in poor condition. A new Service Request has been created 101001404863 and will be added to an active list for re-painting  weather condition pending.,Transportation General Request,Transportation - Traffic Division,Administrative & General Requests,Transportation General Request,BTDT_District 02,BTDT,,,359 Baker St  West Roxbury  MA  02132,12.0,06,6.0,E5,West Roxbury,12.0,Ward 20,2005.0,R1,359 Baker St,2132.0,Address,7721.0,42.282,-71.1688,Constituent Call,"(42.282, -71.1688)"
575002,101001402005,06/03/2015 07:35:00 PM,,06/29/2015 03:23:39 PM,ONTIME,Closed,Case Closed. Closed date : 2015-06-29 15:23:39.737 Case Resolved ticket dismissed,Transportation General Request,Transportation - Traffic Division,Administrative & General Requests,Transportation General Request,BTDT_OPC_Phone Bank Service,BTDT,,,480 Parker St  Boston  MA  02115,4.0,10A,7.0,D4,Boston,13.0,04,409.0,,480 Parker St,2115.0,Address,347877.0,42.3594,-71.0587,Constituent Call,"(0, 0)"
575397,101001402593,06/04/2015 01:45:00 PM,,06/05/2015 03:34:26 PM,ONTIME,Closed,Case Closed Case Resolved  This street was petitioned and approved by BTD engineers before the emergency reconfiguration.  This street will remain a One Way.,Transportation General Request,Transportation - Traffic Division,Administrative & General Requests,Transportation General Request,BTDT_Administration,BTDT,,,INTERSECTION of Dorchester St & W First St  South Boston  MA,6.0,05,2.0,C6,South Boston / South Boston Waterfront,5.0,Ward 6,605.0,,INTERSECTION Dorchester St & W First St,,Intersection,4218.0,42.3373,-71.0433,Constituent Call,"(42.3373, -71.0433)"
577193,101001405261,06/09/2015 07:23:00 AM,,,ONTIME,Open,,Transportation General Request,Transportation - Traffic Division,Administrative & General Requests,Transportation General Request,INFO01_GenericeFormforOtherServiceRequestTypes,INFO,,,INTERSECTION of Firth Rd & Florence St  Roslindale  MA,12.0,02,5.0,E5,Roslindale,10.0,Ward 19,1913.0,,INTERSECTION Firth Rd & Florence St,,Intersection,4937.0,42.2872,-71.1233,Constituent Call,"(42.2872, -71.1233)"
578501,101001407212,06/11/2015 08:48:00 AM,,07/17/2015 09:37:17 AM,ONTIME,Closed,Case Closed. Closed date : 2015-07-17 09:37:17.297 Case Resolved Dear Constituent         As you are aware of from the phone call from the inspector    The Boston Public Works Construction Inspection Unit (CIU) Inspector removed all signage and parking is fully available    For any questions or concerns  please contact the number listed below    Sincerely     Mark Cardarelli  Supervisor of Utility Coordination and Compliance  Boston Public Works Department  617-635-4951 Office,Transportation General Request,Transportation - Traffic Division,Administrative & General Requests,Transportation General Request,PWDx_Contractor Complaints,PWDx,,,1 Spruce St  Boston  MA  02108,3.0,1B,8.0,A1,Beacon Hill,14.0,Ward 5,503.0,R1,1 Spruce St,2108.0,Address,130060.0,42.3573,-71.0678,Constituent Call,"(42.3573, -71.0678)"
580538,101001410306,06/16/2015 08:44:00 AM,,07/14/2015 01:59:59 PM,ONTIME,Closed,Case Closed Case Noted  The signs were installed as close to the edgestone as they could.  The signs are needed to prevent illegal parking.,Transportation General Request,Transportation - Traffic Division,Administrative & General Requests,Transportation General Request,BTDT_Administration,BTDT,,,23-25 Swallow St  South Boston  MA  02127,6.0,05,2.0,C6,South Boston / South Boston Waterfront,5.0,Ward 6,608.0,R2,23-25 Swallow St,2127.0,Address,133093.0,42.3335,-71.0301,Constituent Call,"(42.3335, -71.0301)"
581610,101001411903,06/17/2015 05:19:00 PM,,07/30/2015 04:20:17 PM,ONTIME,Closed,Case Closed. Closed date : 2015-07-30 16:20:17.793 Case Resolved Pay by Phone had technical problems,Transportation General Request,Transportation - Traffic Division,Administrative & General Requests,Transportation General Request,BTDT_OPC_Phone Bank Service,BTDT,,,1 City Hall Plz  Boston  MA  02108,3.0,1B,1.0,A1,Downtown / Financial District,3.0,03,306.0,E,1 City Hall Plz,2108.0,Address,32856.0,42.3604,-71.0583,Constituent Call,"(42.3604, -71.0583)"
582153,101001412726,06/18/2015 03:21:00 PM,,07/14/2015 02:01:25 PM,ONTIME,Closed,Case Closed Case Noted  We have taken note of this complaint and will try our best to be as informative as possible when it comes to street closings.,Transportation General Request,Transportation - Traffic Division,Administrative & General Requests,Transportation General Request,BTDT_Administration,BTDT,,,1 City Hall Plz  Boston  MA  02108,3.0,1B,1.0,A1,Downtown / Financial District,3.0,03,306.0,E,1 City Hall Plz,2108.0,Address,32856.0,42.3604,-71.0583,Constituent Call,"(42.3604, -71.0583)"
582706,101001413593,06/19/2015 04:04:00 PM,,,ONTIME,Open,,Transportation General Request,Transportation - Traffic Division,Administrative & General Requests,Transportation General Request,HS_Disabilities Architecture,HS_D,,,INTERSECTION of Lexington St & Shelby St  East Boston  MA,1.0,09,1.0,A7,East Boston,1.0,Ward 1,109.0,,INTERSECTION Lexington St & Shelby St,,Intersection,6860.0,42.3812,-71.0282,Constituent Call,"(42.3812, -71.0282)"
583761,101001415106,06/22/2015 05:25:00 PM,,07/14/2015 02:05:17 PM,ONTIME,Closed,Case Closed Case Noted  BPD has the right to move traffic along if they feel it is necessary.  Public Safety is first priority.,Transportation General Request,Transportation - Traffic Division,Administrative & General Requests,Transportation General Request,BTDT_Administration,BTDT,,,INTERSECTION of Washington St & Hyde Park Ave  Jamaica Plain  MA,12.0,02,6.0,E13,Jamaica Plain,11.0,Ward 11,1108.0,,INTERSECTION Washington St & Hyde Park Ave,,Intersection,6010.0,42.3013,-71.1126,Constituent Call,"(42.3013, -71.1126)"
583821,101001415207,06/22/2015 08:06:00 PM,,07/14/2015 02:06:50 PM,ONTIME,Closed,Case Closed Case Noted  Double parking is a major public safety issue for pedestrians  motor vehicles as well as bicyclists.   Public Safety is our first concern.,Transportation General Request,Transportation - Traffic Division,Administrative & General Requests,Transportation General Request,BTDT_Administration,BTDT,,,INTERSECTION of Ball St & Washington St  Roxbury  MA,7.0,10B,7.0,D4,Roxbury,13.0,Ward 8,803.0,,INTERSECTION Ball St & Washington St,,Intersection,932.0,42.3334,-71.0806,Constituent Call,"(42.3334, -71.0806)"
584286,101001415825,06/23/2015 02:07:00 PM,,07/30/2015 04:23:47 PM,ONTIME,Closed,Case Closed. Closed date : 2015-07-30 16:23:47.52 Case Resolved A hearing is scheduled for APPEAL 8/19/15 @ 11AM,Transportation General Request,Transportation - Traffic Division,Administrative & General Requests,Transportation General Request,BTDT_OPC_Phone Bank Service,BTDT,,,60 Smith St  Mission Hill  MA  02120,9.0,10A,8.0,B2,Mission Hill,14.0,10,1002.0,,60 Smith St,2120.0,Address,342526.0,42.3594,-71.0587,Constituent Call,"(0, 0)"
584880,101001416683,06/24/2015 02:23:00 PM,,07/17/2015 09:29:45 AM,ONTIME,Closed,Case Closed. Closed date : 2015-07-17 09:29:45.52 Case Resolved Dear Constituent     The Boston Public Works Construction Inspection Unit (CIU) Inspector states the work obviously has been completed     We apologize for not getting back to you earlier.    We will speak to the contractors to make sure that detour signs are placed properly as directed by the BTD      For any questions or concerns  please contact the number listed below    Sincerely     Mark Cardarelli  Supervisor of Utility Coordination and Compliance  Boston Public Works Department  617-635-4951 Office,Transportation General Request,Transportation - Traffic Division,Administrative & General Requests,Transportation General Request,PWDx_Contractor Complaints,PWDx,,,INTERSECTION of Bremen St & Prescott St  East Boston  MA,1.0,09,1.0,A7,East Boston,1.0,Ward 1,110.0,,INTERSECTION Bremen St & Prescott St,,Intersection,1912.0,42.3778,-71.0286,Constituent Call,"(42.3778, -71.0286)"
584884,101001416688,06/24/2015 02:25:00 PM,,09/03/2015 04:26:20 PM,ONTIME,Closed,Case Closed Case Noted  BTD engineers will investigate signage,Transportation General Request,Transportation - Traffic Division,Administrative & General Requests,Transportation General Request,BTDT_Administration,BTDT,,,60 Charles St S  Boston  MA  02116,4.0,1C,2.0,A1,Downtown / Financial District,6.0,Ward 5,501.0,R4,60 Charles St S,2116.0,Address,29573.0,42.3505,-71.0665,Constituent Call,"(42.3505, -71.0665)"
584885,101001416687,06/24/2015 02:25:00 PM,,01/11/2016 09:42:58 AM,ONTIME,Closed,Case Closed. Closed date : 2016-01-11 09:42:58.307 Case Noted,Transportation General Request,Transportation - Traffic Division,Administrative & General Requests,Transportation General Request,BTDT_Engineering_New Sign and Pavement Marking Requests,BTDT,,,19 Magdala St  Dorchester  MA  02124,8.0,07,3.0,C11,Dorchester,7.0,Ward 16,1611.0,R2,19 Magdala St,2124.0,Address,88193.0,42.2816,-71.0643,Constituent Call,"(42.2816, -71.0643)"
584888,101001416692,06/24/2015 02:29:00 PM,,09/04/2015 05:41:42 AM,ONTIME,Closed,Case Closed. Closed date : 2015-09-04 05:41:42.12 Case Noted This case is 71 days old?,Transportation General Request,Transportation - Traffic Division,Administrative & General Requests,Transportation General Request,BTDT_Parking Enforcement,BTDT,,,245 Summer St  Boston  MA  02111,4.0,1C,2.0,A1,Downtown / Financial District,4.0,Ward 3,308.0,EA,245 Summer St,2111.0,Address,131985.0,42.3514,-71.0539,Constituent Call,"(42.3514, -71.0539)"
584956,101001416784,06/24/2015 04:18:00 PM,,09/03/2015 04:24:28 PM,ONTIME,Closed,Case Closed Case Noted  Aukland street signs were adjusted,Transportation General Request,Transportation - Traffic Division,Administrative & General Requests,Transportation General Request,BTDT_Administration,BTDT,,,130 Auckland St  Dorchester  MA  02125,7.0,03,3.0,C11,Dorchester,8.0,Ward 15,1506.0,EA,130 Auckland St,2125.0,Address,6506.0,42.31,-71.0563,Constituent Call,"(42.31, -71.0563)"
585870,101001418214,06/26/2015 01:12:00 PM,,09/04/2015 07:11:20 AM,ONTIME,Closed,Case Closed Case Noted  Thank you for the call  all towing vendors hired by the city should accept credit cards  I will speak with Robert Towing regarding this issue.,Transportation General Request,Transportation - Traffic Division,Administrative & General Requests,Transportation General Request,PWDx_Administration,PWDx,,,4-20 Goodenough St  Brighton  MA  02135,11.0,04,9.0,D14,Allston / Brighton,15.0,Ward 22,2212.0,I,4-20 Goodenough St,2135.0,Address,165711.0,42.3566,-71.1538,Constituent Call,"(42.3566, -71.1538)"
586559,101001419216,06/29/2015 09:23:15 AM,,06/29/2015 09:24:13 AM,ONTIME,Closed,Case Closed. Closed date : 2015-06-29 09:24:13.607 Case Invalid wrong e form,Transportation General Request,Transportation - Traffic Division,Administrative & General Requests,Transportation General Request,BTDT_Administration,BTDT,,,77-79 Wellsmere Rd  Roslindale  MA  02131,12.0,06,5.0,E5,Roslindale,10.0,Ward 18,1810.0,R2,77-79 Wellsmere Rd,2131.0,Address,147601.0,42.2793,-71.1342,Constituent Call,"(42.2793, -71.1342)"
587087,101001419971,06/29/2015 09:20:00 PM,,09/03/2015 04:21:57 PM,ONTIME,Closed,Case Closed Case Noted  Permit signs must be posted for 48 hours before the posted date; or it can not be enforced,Transportation General Request,Transportation - Traffic Division,Administrative & General Requests,Transportation General Request,BTDT_Administration,BTDT,,,299 Marlborough St  Boston  MA  02116,4.0,1C,8.0,D4,Back Bay,14.0,Ward 5,508.0,CM,299 Marlborough St,2116.0,Address,90906.0,42.3516,-71.0841,Constituent Call,"(42.3516, -71.0841)"
587383,101001420372,06/30/2015 11:04:00 AM,,09/08/2015 11:02:18 AM,ONTIME,Closed,Case Closed. Closed date : 2015-09-08 11:02:18.483 Case Noted,Transportation General Request,Transportation - Traffic Division,Administrative & General Requests,Transportation General Request,BTDT_Broken Meter Complaints,BTDT,,,15 Channel Center St  Boston  MA  02210,6.0,05,2.0,C6,South Boston / South Boston Waterfront,5.0,Ward 6,601.0,RC,15 Channel Center St,2210.0,Address,28851.0,42.3457,-71.0511,Constituent Call,"(42.3457, -71.0511)"
588583,101001422023,07/02/2015 10:00:00 AM,,09/28/2015 03:07:10 PM,ONTIME,Closed,Case Closed. Closed date : 2015-09-28 15:07:10.233 Case Noted Your request for a new sign has been approved by BTD Engineering. A new Service Request has been created 101001599881 and allocated to the BTD Sign Shop for installation.,Transportation General Request,Transportation - Traffic Division,Administrative & General Requests,Transportation General Request,BTDT_Engineering_New Sign and Pavement Marking Requests,BTDT,,,57-59 South St  Jamaica Plain  MA  02130,9.0,02,6.0,E13,Jamaica Plain,11.0,Ward 19,1909.0,C,57-59 South St,2130.0,Address,128854.0,42.3078,-71.1158,Constituent Call,"(42.3078, -71.1158)"
589064,101001422713,07/03/2015 02:00:00 PM,,09/09/2015 08:40:36 AM,ONTIME,Closed,Case Closed. Closed date : 2015-09-09 08:40:36.183 Case Noted handicap space measures exactly twenty feet   not sufficient space for second vehicle,Transportation General Request,Transportation - Traffic Division,Administrative & General Requests,Transportation General Request,BTDT_District 04,BTDT,,,5-7 Fayston St  Dorchester  MA  02121,7.0,03,4.0,B2,Roxbury,13.0,Ward 14,1401.0,R2,5-7 Fayston St,2121.0,Address,57061.0,42.3136,-71.0787,Constituent Call,"(42.3136, -71.0787)"
590309,101001424504,07/07/2015 11:51:00 AM,,09/03/2015 04:10:58 PM,ONTIME,Closed,Case Closed Case Noted  Constituent has been contacted bt BTD planning,Transportation General Request,Transportation - Traffic Division,Administrative & General Requests,Transportation General Request,BTDT_Administration,BTDT,,,INTERSECTION of Atlantic Ave & Summer St  Boston  MA,4.0,1C,2.0,A1,Downtown / Financial District,4.0,Ward 3,308.0,,INTERSECTION Atlantic Ave & Summer St,,Intersection,732.0,42.3527,-71.0554,Constituent Call,"(42.3527, -71.0554)"
590956,101001425369,07/08/2015 12:20:00 PM,,09/04/2015 05:42:40 AM,ONTIME,Closed,Case Closed. Closed date : 2015-09-04 05:42:40.427 Case Noted This case is 51 days old?,Transportation General Request,Transportation - Traffic Division,Administrative & General Requests,Transportation General Request,BTDT_Parking Enforcement,BTDT,,,INTERSECTION of E Fifth St & L St  South Boston  MA,6.0,05,2.0,C6,South Boston / South Boston Waterfront,5.0,Ward 6,606.0,,INTERSECTION E Fifth St & L St,,Intersection,4908.0,42.3339,-71.0353,Constituent Call,"(42.3339, -71.0353)"
591102,101001425586,07/08/2015 03:24:00 PM,,09/04/2015 07:20:24 AM,ONTIME,Closed,Case Closed. Closed date : 2015-09-04 07:20:24.017 Case Noted Case is 57 days old and officers ticket all vehicles in violation they walk up on.,Transportation General Request,Transportation - Traffic Division,Administrative & General Requests,Transportation General Request,BTDT_Parking Enforcement,BTDT,,,825 E Broadway  South Boston  MA  02127,6.0,05,2.0,C6,South Boston / South Boston Waterfront,5.0,Ward 6,608.0,R3,825 E Broadway,2127.0,Address,21232.0,42.3355,-71.0315,Constituent Call,"(42.3355, -71.0315)"
591688,101001426332,07/09/2015 03:38:00 PM,,,ONTIME,Open,,Transportation General Request,Transportation - Traffic Division,Administrative & General Requests,Transportation General Request,BTDT_BostonBikes,BTDT,,,INTERSECTION of Dorchester Ave & Northam Park  Dorchester  MA,8.0,07,3.0,C11,Dorchester,7.0,Ward 16,1606.0,,INTERSECTION Dorchester Ave & Northam Park,,Intersection,4127.0,42.2881,-71.0637,Constituent Call,"(42.2881, -71.0637)"
592425,101001427384,07/11/2015 01:35:00 PM,,09/03/2015 05:47:54 PM,ONTIME,Closed,Case Closed. Closed date : 2015-09-03 17:47:54.617 Case Resolved will inform the officers in that area to patrol it more frequently,Transportation General Request,Transportation - Traffic Division,Administrative & General Requests,Transportation General Request,BTDT_Parking Enforcement,BTDT,,,520 Atlantic Ave  Boston  MA  02110,6.0,1C,1.0,A1,Boston,3.0,03,306.0,,520 Atlantic Ave,2110.0,Address,354395.0,42.3594,-71.0587,Constituent Call,"(0, 0)"
592687,101001427793,07/12/2015 09:25:00 PM,,09/03/2015 04:06:44 PM,ONTIME,Closed,Case Closed Case Noted  Pavement Markings have to be installed at night when traffic is lite.  The City apologizes for the inconvenience.,Transportation General Request,Transportation - Traffic Division,Administrative & General Requests,Transportation General Request,BTDT_Administration,BTDT,,,513 E Broadway  South Boston  MA  02127,6.0,05,2.0,C6,South Boston / South Boston Waterfront,5.0,Ward 6,604.0,R1,513 E Broadway,2127.0,Address,20943.0,42.3353,-71.0439,Constituent Call,"(42.3353, -71.0439)"
592713,101001427839,07/13/2015 06:51:00 AM,,09/04/2015 10:17:12 AM,ONTIME,Closed,Case Closed. Closed date : 2015-09-04 10:17:12.127 Case Resolved Intersection was redesigned to make it safer.,Transportation General Request,Transportation - Traffic Division,Administrative & General Requests,Transportation General Request,BTDT_Engineering_New Sign and Pavement Marking Requests,BTDT,,,141 Ashley St  East Boston  MA  02128,1.0,09,1.0,A7,East Boston,1.0,Ward 1,113.0,R1,141 Ashley St,2128.0,Address,5244.0,42.3894,-71.0103,Constituent Call,"(42.3894, -71.0103)"
592772,101001427914,07/13/2015 08:39:00 AM,,09/15/2015 10:31:18 AM,ONTIME,Closed,Case Closed. Closed date : 2015-09-15 10:31:18.34 Case Noted I left a voicemail with this constituent and will explain things to him when he calls back. This case can be closed.   Best  Amy Mahler South End & Bay Village Neighborhood Coordinator Mayor's Office of Neighborhood Service,Transportation General Request,Transportation - Traffic Division,Administrative & General Requests,Transportation General Request,INFO01_GenericeFormforOtherServiceRequestTypes,INFO,,,INTERSECTION of Rutland St & Shawmut Ave  Roxbury  MA,4.0,1C,2.0,D4,South End,6.0,Ward 9,901.0,,INTERSECTION Rutland St & Shawmut Ave,,Intersection,8230.0,42.3392,-71.0752,Constituent Call,"(42.3392, -71.0752)"
593134,101001428383,07/13/2015 03:21:00 PM,,09/04/2015 10:51:41 AM,ONTIME,Closed,Case Closed. Closed date : 2015-09-04 10:51:41.247 Case Noted Officer will as many passes in area as possible.,Transportation General Request,Transportation - Traffic Division,Administrative & General Requests,Transportation General Request,BTDT_Parking Enforcement,BTDT,,,600-610 Blue Hill Ave  Dorchester  MA  02121,7.0,03,4.0,B2,Greater Mattapan,13.0,Ward 14,1403.0,RC,600-610 Blue Hill Ave,2121.0,Address,162187.0,42.3037,-71.0847,Constituent Call,"(42.3037, -71.0847)"
594473,101001430120,07/15/2015 01:31:00 PM,,,ONTIME,Open,,Transportation General Request,Transportation - Traffic Division,Administrative & General Requests,Transportation General Request,INFO01_GenericeFormforOtherServiceRequestTypes,INFO,,,INTERSECTION of Carleton St & Holyoke St  Boston  MA,4.0,1C,2.0,D4,South End,6.0,Ward 4,403.0,,INTERSECTION Carleton St & Holyoke St,,Intersection,2442.0,42.3452,-71.0785,Constituent Call,"(42.3452, -71.0785)"
594479,101001430126,07/15/2015 01:37:00 PM,,,ONTIME,Open,,Transportation General Request,Transportation - Traffic Division,Administrative & General Requests,Transportation General Request,INFO01_GenericeFormforOtherServiceRequestTypes,INFO,,,245-245A W Canton St  Boston  MA  02116,4.0,1C,2.0,D4,South End,6.0,Ward 4,402.0,CM,245-245A W Canton St,2116.0,Address,171498.0,42.3459,-71.0776,Constituent Call,"(42.3459, -71.0776)"
595038,101001430872,07/16/2015 11:28:00 AM,,09/04/2015 11:00:40 AM,ONTIME,Closed,Case Closed. Closed date : 2015-09-04 11:00:40.84 Case Noted forwarded to proper manager,Transportation General Request,Transportation - Traffic Division,Administrative & General Requests,Transportation General Request,BTDT_OPC_Phone Bank Service,BTDT,,,1 City Hall Plz  Boston  MA  02108,3.0,1B,1.0,A1,Downtown / Financial District,3.0,03,306.0,E,1 City Hall Plz,2108.0,Address,32856.0,42.3604,-71.0583,Constituent Call,"(42.3604, -71.0583)"
596977,101001433468,07/20/2015 04:18:00 PM,,09/10/2015 09:30:20 AM,ONTIME,Closed,Case Closed. Closed date : 2015-09-10 09:30:20.147 Case Resolved     Dear Constituent     The Boston Public Works Construction Inspection Unit (CIU) Inspector states that as of September 9th there are no construction signs or equipment at the intersection of Valley Rd and Dorchester Ave.    For any questions or concerns  please contact the number listed below    Sincerely     Mark Cardarelli  Supervisor of Utility Coordination and Compliance  Boston Public Works Department  617-635-4951 Office,Transportation General Request,Transportation - Traffic Division,Administrative & General Requests,Transportation General Request,PWDx_Contractor Complaints,PWDx,,,37 Valley Rd  Dorchester  MA  02124,8.0,07,3.0,C11,Dorchester,7.0,Ward 17,1704.0,R1,37 Valley Rd,2124.0,Address,139743.0,42.2777,-71.0684,Constituent Call,"(42.2777, -71.0684)"
598228,101001435278,07/23/2015 01:46:00 PM,,09/19/2015 08:28:08 AM,ONTIME,Closed,Case Closed. Closed date : 2015-09-19 08:28:08.09 Case Resolved,Transportation General Request,Transportation - Traffic Division,Administrative & General Requests,Transportation General Request,BTDT_Traffic Signal_Repair,BTDT,,,220 Beacon St  Boston  MA  02116,4.0,1C,8.0,D4,Back Bay,14.0,Ward 5,507.0,A,220 Beacon St,2116.0,Address,10278.0,42.354,-71.0786,Constituent Call,"(42.354, -71.0786)"
598558,101001435750,07/23/2015 11:06:00 PM,,09/03/2015 07:48:20 PM,ONTIME,Closed,Case Closed. Closed date : 2015-09-03 19:48:20.13 Case Resolved vehicle moved,Transportation General Request,Transportation - Traffic Division,Administrative & General Requests,Transportation General Request,BTDT_Parking Enforcement,BTDT,,,INTERSECTION of W Cedar St & Phillips St  Boston  MA,3.0,1B,8.0,A1,Beacon Hill,14.0,Ward 5,511.0,,INTERSECTION W Cedar St & Phillips St,,Intersection,2562.0,42.3603,-71.07,Constituent Call,"(42.3603, -71.07)"
598646,101001435869,07/24/2015 08:30:00 AM,,09/03/2015 03:30:00 PM,ONTIME,Closed,Case Closed Case Noted  Certain vehicles are permitted to be inside downtown crossing.   BPD strictly enforces any other vehicles within the boundaries.,Transportation General Request,Transportation - Traffic Division,Administrative & General Requests,Transportation General Request,BTDT_Administration,BTDT,,,INTERSECTION of Washington St & Summer St  Boston  MA,3.0,1C,2.0,A1,Downtown / Financial District,4.0,Ward 3,308.0,,INTERSECTION Washington St & Summer St,,Intersection,6075.0,42.3555,-71.0605,Constituent Call,"(42.3555, -71.0605)"
598933,101001436244,07/24/2015 01:48:00 PM,,09/04/2015 05:45:23 AM,ONTIME,Closed,Case Closed. Closed date : 2015-09-04 05:45:23.267 Case Noted This case is 41 days old. Officers ticket all vehicles in posted area's for street cleaning.,Transportation General Request,Transportation - Traffic Division,Administrative & General Requests,Transportation General Request,BTDT_Parking Enforcement,BTDT,,,INTERSECTION of Dorchester St & W Eighth St  South Boston  MA,6.0,05,2.0,C6,South Boston / South Boston Waterfront,5.0,Ward 7,705.0,,INTERSECTION Dorchester St & W Eighth St,,Intersection,4203.0,42.3328,-71.051,Constituent Call,"(42.3328, -71.051)"
600491,101001438334,07/28/2015 11:06:00 AM,,,ONTIME,Open,,Transportation General Request,Transportation - Traffic Division,Administrative & General Requests,Transportation General Request,DISB_HP Sign,DISB,,,437-447 D St  Boston  MA  02210,6.0,05,2.0,C6,South Boston / South Boston Waterfront,5.0,Ward 6,601.0,CM,437-447 D St,2210.0,Address,45503.0,42.3452,-71.043,Constituent Call,"(42.3452, -71.043)"
601339,101001439425,07/29/2015 12:55:00 PM,,09/01/2015 10:18:06 PM,ONTIME,Closed,Case Closed. Closed date : 2015-09-01 22:18:06.25 Case Resolved vehicles not at location,Transportation General Request,Transportation - Traffic Division,Administrative & General Requests,Transportation General Request,BTDT_Parking Enforcement,BTDT,,,INTERSECTION of Washington St & Hyde Park Ave  Jamaica Plain  MA,12.0,02,6.0,E13,Jamaica Plain,11.0,Ward 11,1108.0,,INTERSECTION Washington St & Hyde Park Ave,,Intersection,6010.0,42.3013,-71.1126,Constituent Call,"(42.3013, -71.1126)"
602934,101001501594,08/02/2015 01:42:00 AM,,09/19/2015 08:27:52 AM,ONTIME,Closed,Case Closed. Closed date : 2015-09-19 08:27:52.867 Case Resolved,Transportation General Request,Transportation - Traffic Division,Administrative & General Requests,Transportation General Request,BTDT_Traffic Signal_Repair,BTDT,,,INTERSECTION of Cross St & Hanover St  Boston  MA,3.0,1B,1.0,A1,Downtown / Financial District,3.0,Ward 3,303.0,,INTERSECTION Cross St & Hanover St,,Intersection,3689.0,42.3626,-71.0557,Constituent Call,"(42.3626, -71.0557)"
603118,101001501869,08/03/2015 08:09:00 AM,,09/04/2015 11:05:25 AM,ONTIME,Closed,Case Closed. Closed date : 2015-09-04 11:05:25.24 Case Noted case forwarded to manager for further review,Transportation General Request,Transportation - Traffic Division,Administrative & General Requests,Transportation General Request,BTDT_OPC_Phone Bank Service,BTDT,,,INTERSECTION of Atlantic Ave & Kneeland St  Boston  MA,4.0,1C,2.0,A1,Downtown / Financial District,4.0,Ward 3,308.0,,INTERSECTION Atlantic Ave & Kneeland St,,Intersection,727.0,42.3495,-71.0571,Constituent Call,"(42.3495, -71.0571)"
603422,101001502264,08/03/2015 01:01:00 PM,,09/01/2015 04:14:01 PM,ONTIME,Closed,Case Closed. Closed date : 2015-09-01 16:14:01.787 Case Noted The City of Boston apologizes for any inconvenience this may have caused. The Transportation Department does its best in trying to notify the public via website  public announcements and social media of any upcoming road closures.     We realize that these types of inconveniences could impact the public  so we try our hardest to notify the public in a timely manner.    Once again  we apologize for the inconvenience on you.,Transportation General Request,Transportation - Traffic Division,Administrative & General Requests,Transportation General Request,BTDT_Administration,BTDT,,,527 Tremont St  Boston  MA  02116,4.0,1C,2.0,D4,South End,6.0,05,501.0,,527 Tremont St,2116.0,Address,351748.0,42.3594,-71.0587,Constituent Call,"(0, 0)"
604050,101001503139,08/04/2015 01:57:00 PM,,09/21/2015 12:32:23 PM,ONTIME,Closed,Case Closed. Closed date : 2015-09-21 12:32:23.32 Case Noted Rack request has been added to our queue. Due to the significant number of requests we receive  we may not be able to fulfill this specific request this year.,Transportation General Request,Transportation - Traffic Division,Administrative & General Requests,Transportation General Request,BTDT_BostonBikes,BTDT,,,569 Cambridge St  Allston  MA  02134,11.0,04,9.0,D14,Allston / Brighton,15.0,Ward 21,2106.0,RC,569 Cambridge St,2134.0,Address,25161.0,42.3527,-71.1406,Constituent Call,"(42.3527, -71.1406)"
604603,101001503863,08/05/2015 09:31:00 AM,,09/02/2015 10:28:01 AM,ONTIME,Closed,Case Closed. Closed date : 2015-09-02 10:28:01.81 Case Noted Department has a bike officer dedicated to keep area clear.,Transportation General Request,Transportation - Traffic Division,Administrative & General Requests,Transportation General Request,BTDT_Parking Enforcement,BTDT,,,100 Legends Way  Boston  MA  02114,3.0,1B,8.0,A1,Boston,3.0,03,,E,100 Legends Way,2114.0,Address,340814.0,42.3594,-71.0587,Constituent Call,"(0, 0)"
605195,101001504639,08/06/2015 08:00:22 AM,,08/06/2015 08:27:58 AM,ONTIME,Closed,Case Closed. Closed date : 2015-08-06 08:27:58.37 Case Invalid Incorrect form,Transportation General Request,Transportation - Traffic Division,Administrative & General Requests,Transportation General Request,BTDT_Administration,BTDT,,,INTERSECTION of Hyde Park Ave & River St  Hyde Park  MA,12.0,08,5.0,E18,Hyde Park,10.0,Ward 18,1818.0,,INTERSECTION Hyde Park Ave & River St,,Intersection,6461.0,42.2558,-71.1241,Constituent Call,"(42.2558, -71.1241)"
605431,101001504949,08/06/2015 11:52:00 AM,,09/01/2015 04:08:35 PM,ONTIME,Closed,Case Closed Case Noted  Enforcement responded to this complaint,Transportation General Request,Transportation - Traffic Division,Administrative & General Requests,Transportation General Request,BTDT_Administration,BTDT,,,INTERSECTION of Faulkner St & Freeman St  Dorchester  MA,7.0,07,3.0,C11,Dorchester,7.0,Ward 16,1601.0,,INTERSECTION Faulkner St & Freeman St,,Intersection,4829.0,42.2993,-71.0622,Constituent Call,"(42.2993, -71.0622)"
605584,101001505147,08/06/2015 03:14:00 PM,,09/01/2015 10:49:45 PM,ONTIME,Closed,Case Closed. Closed date : 2015-09-01 22:49:45.173 Case Resolved area is patrolled on a regular basis vehicles are moved or cited,Transportation General Request,Transportation - Traffic Division,Administrative & General Requests,Transportation General Request,BTDT_Parking Enforcement,BTDT,,,INTERSECTION of Atlantic Ave & Summer St  Boston  MA,4.0,1C,2.0,A1,Downtown / Financial District,4.0,Ward 3,308.0,,INTERSECTION Atlantic Ave & Summer St,,Intersection,732.0,42.3527,-71.0554,Constituent Call,"(42.3527, -71.0554)"
606014,101001505745,08/07/2015 11:50:00 AM,,,ONTIME,Open,,Transportation General Request,Transportation - Traffic Division,Administrative & General Requests,Transportation General Request,BTDT_Request for Directional or Roadway Changes,BTDT,,,545 Park St  Dorchester  MA  02124,8.0,03,4.0,B3,Dorchester,9.0,Ward 17,1701.0,R1,545 Park St,2124.0,Address,107385.0,42.2951,-71.0752,Constituent Call,"(42.2951, -71.0752)"
606068,101001505816,08/07/2015 12:47:00 PM,,09/03/2015 12:04:08 PM,ONTIME,Closed,"Case Closed. Closed date : 2015-09-03 12:04:08.683 Case Noted There are existing ""no parking/standing"" signs posted for driveway...BTD will not remove ""two hour"" signs.",Transportation General Request,Transportation - Traffic Division,Administrative & General Requests,Transportation General Request,BTDT_Engineering_New Sign and Pavement Marking Requests,BTDT,,,150-152 Boylston St  Jamaica Plain  MA  02130,9.0,02,6.0,E13,Jamaica Plain,11.0,Ward 11,1104.0,R1,150-152 Boylston St,2130.0,Address,18452.0,42.3164,-71.1028,Constituent Call,"(42.3164, -71.1028)"
606241,101001506057,08/07/2015 03:44:00 PM,,09/19/2015 08:27:23 AM,ONTIME,Closed,Case Closed. Closed date : 2015-09-19 08:27:23.1 Case Resolved,Transportation General Request,Transportation - Traffic Division,Administrative & General Requests,Transportation General Request,BTDT_Traffic Signal_Repair,BTDT,,,720 Harrison Ave  Roxbury  MA  02118,4.0,1C,2.0,D4,South End,6.0,Ward 8,802.0,C,720 Harrison Ave,2118.0,Address,69996.0,42.3377,-71.0709,Constituent Call,"(42.3377, -71.0709)"
606514,101001516447,08/08/2015 04:29:00 PM,,09/01/2015 08:06:58 PM,ONTIME,Closed,Case Closed. Closed date : 2015-09-01 20:06:58.207 Case Resolved supervisor responded to this call nothing on the hydrant but one tagged for no stopping.,Transportation General Request,Transportation - Traffic Division,Administrative & General Requests,Transportation General Request,BTDT_Parking Enforcement,BTDT,,,8-16 Garrison St  Boston  MA  02116,4.0,1C,2.0,D4,Back Bay,6.0,Ward 4,402.0,CM,8-16 Garrison St,2116.0,Address,62830.0,42.3462,-71.0796,Constituent Call,"(42.3462, -71.0796)"
607513,101001517864,08/11/2015 08:45:00 AM,,09/01/2015 02:53:48 PM,ONTIME,Closed,Case Closed. Closed date : 2015-09-01 14:53:48.723 Case Noted http://www.cityofboston.gov/news/default.aspx?id=20044    The following link describes Mayor Walsh's public safety initiative.    If you have any questions  please feel free to contact me.    Kevin Donahue  Director of Community Affairs  Boston Transportation Department     One City Hall Square  Rm 721  Boston     617-635-2447 office    kevin.donahue@boston.gov,Transportation General Request,Transportation - Traffic Division,Administrative & General Requests,Transportation General Request,BTDT_Administration,BTDT,,,INTERSECTION of Eighth St & First Ave  Charlestown  MA,3.0,1A,1.0,A15,Charlestown,2.0,Ward 2,202.0,,INTERSECTION Eighth St & First Ave,,Intersection,4440.0,42.3755,-71.0535,Constituent Call,"(42.3755, -71.0535)"
607751,101001518180,08/11/2015 12:46:00 PM,,,ONTIME,Open,,Transportation General Request,Transportation - Traffic Division,Administrative & General Requests,Transportation General Request,INFO01_GenericeFormforOtherServiceRequestTypes,INFO,,,INTERSECTION of Border St & Sumner St  East Boston  MA,1.0,09,1.0,A7,East Boston,1.0,Ward 1,103.0,,INTERSECTION Border St & Sumner St,,Intersection,1644.0,42.3704,-71.0432,Constituent Call,"(42.3704, -71.0432)"
607930,101001518428,08/11/2015 03:23:00 PM,,09/01/2015 02:51:24 PM,ONTIME,Closed,Case Closed Case Noted  The City of Boston does not install traffic mirrors.  Residents have them installed themselves.  BTD will look at the area to see if any improvements can be made with signage.,Transportation General Request,Transportation - Traffic Division,Administrative & General Requests,Transportation General Request,BTDT_Administration,BTDT,,,INTERSECTION of Electric Ave & Parsons St  Brighton  MA,11.0,04,9.0,D14,Allston / Brighton,15.0,Ward 22,2211.0,,INTERSECTION Electric Ave & Parsons St,,Intersection,4484.0,42.357,-71.1573,Constituent Call,"(42.357, -71.1573)"
608170,101001518740,08/11/2015 06:45:00 PM,,10/21/2015 02:31:15 PM,ONTIME,Closed,Case Closed. Closed date : 2015-10-21 14:31:15.893 Case Noted The Boston Transportation Department will consider your request as part of future improvements.,Transportation General Request,Transportation - Traffic Division,Administrative & General Requests,Transportation General Request,BTDT_Engineering_Request for Traffic Signal Study or Review,BTDT,,,INTERSECTION of Clifford St & Warren St  Roxbury  MA,7.0,10B,7.0,B2,Roxbury,13.0,Ward 12,1204.0,,INTERSECTION Clifford St & Warren St,,Intersection,3139.0,42.3208,-71.0816,Constituent Call,"(42.3208, -71.0816)"
608417,101001519044,08/12/2015 08:56:00 AM,,09/19/2015 08:26:13 AM,ONTIME,Closed,Case Closed. Closed date : 2015-09-19 08:26:13.917 Case Resolved,Transportation General Request,Transportation - Traffic Division,Administrative & General Requests,Transportation General Request,BTDT_Traffic Signal_Repair,BTDT,,,INTERSECTION of Federal St & High St  Boston  MA,3.0,1C,1.0,A1,Downtown / Financial District,3.0,Ward 3,306.0,,INTERSECTION Federal St & High St,,Intersection,4852.0,42.3536,-71.0562,Constituent Call,"(42.3536, -71.0562)"
608671,101001519360,08/12/2015 12:01:00 PM,,09/01/2015 02:47:42 PM,ONTIME,Closed,Case Closed Case Noted  The City of Boston does not install traffic mirrors. The residents take it upon themselves to install such devices. BTD's general rule with street sign installation is that they have to be at least 7' from the ground for safety.,Transportation General Request,Transportation - Traffic Division,Administrative & General Requests,Transportation General Request,BTDT_Administration,BTDT,,,INTERSECTION of Forest Hills St & Lourdes Ave  Jamaica Plain  MA,9.0,02,6.0,E13,Jamaica Plain,11.0,Ward 11,1107.0,,INTERSECTION Forest Hills St & Lourdes Ave,,Intersection,4996.0,42.3066,-71.1028,Constituent Call,"(42.3066, -71.1028)"
609575,101001520478,08/13/2015 01:22:00 PM,,09/10/2015 12:54:02 PM,ONTIME,Closed,Case Closed. Closed date : 2015-09-10 12:54:02.823 Case Resolved Work completed 9/10/15.,Transportation General Request,Transportation - Traffic Division,Administrative & General Requests,Transportation General Request,BTDT_Sign Shop_Sign Installation,BTDT,,,271 Fuller St  Dorchester  MA  02124,8.0,07,4.0,B3,Dorchester,9.0,Ward 17,1710.0,R3,271 Fuller St,2124.0,Address,61171.0,42.2806,-71.0785,Constituent Call,"(42.2806, -71.0785)"
610586,101001521748,08/14/2015 05:28:00 PM,,09/28/2015 03:54:19 PM,ONTIME,Closed,Case Closed. Closed date : 2015-09-28 15:54:19.61 Case Noted Your request for a new sign has been approved by BTD Engineering. A new Service Request has been created 101001599971 and allocated to the BTD Sign Shop for installation.,Transportation General Request,Transportation - Traffic Division,Administrative & General Requests,Transportation General Request,BTDT_Engineering_New Sign and Pavement Marking Requests,BTDT,,,INTERSECTION of Bayard St & N Harvard St  Allston  MA,11.0,04,9.0,D14,Allston / Brighton,15.0,Ward 22,2201.0,,INTERSECTION Bayard St & N Harvard St,,Intersection,1043.0,42.3611,-71.1298,Constituent Call,"(42.3611, -71.1298)"
610660,101001521840,08/14/2015 09:24:00 PM,,,ONTIME,Open,,Transportation General Request,Transportation - Traffic Division,Administrative & General Requests,Transportation General Request,BTDT_Engineering_New Sign and Pavement Marking Requests,BTDT,,,INTERSECTION of Harvard Ave & Maple St  Hyde Park  MA,12.0,08,5.0,E18,Hyde Park,10.0,Ward 18,1818.0,,INTERSECTION Harvard Ave & Maple St,,Intersection,5732.0,42.256,-71.1222,Constituent Call,"(42.256, -71.1222)"
611359,101001522791,08/17/2015 10:22:00 AM,,11/05/2015 01:36:47 PM,ONTIME,Closed,Case Closed Case Resolved  The following case has been managed by the Boston Transportation Department. The location has been made safe.,Transportation General Request,Transportation - Traffic Division,Administrative & General Requests,Transportation General Request,BTDT_Administration,BTDT,,,INTERSECTION of Chestnut Hill Ave & Sutherland Rd  Brighton  MA,11.0,04,9.0,D14,Allston / Brighton,15.0,Ward 21,2116.0,,INTERSECTION Chestnut Hill Ave & Sutherland Rd,,Intersection,2963.0,42.3359,-71.1509,Constituent Call,"(42.3359, -71.1509)"
611420,101001522862,08/17/2015 11:17:00 AM,,10/07/2015 01:21:36 PM,ONTIME,Closed,Case Closed. Closed date : 2015-10-07 13:21:36.313 Case Noted The existing sign is huge.,Transportation General Request,Transportation - Traffic Division,Administrative & General Requests,Transportation General Request,BTDT_Engineering_New Sign and Pavement Marking Requests,BTDT,,,INTERSECTION of Massachusetts Ave & Theodore A Glynn St  Roxbury  MA,7.0,1C,7.0,C6,South Boston / South Boston Waterfront,13.0,Ward 8,806.0,,INTERSECTION Massachusetts Ave & Theodore A Glynn St,,Intersection,7147.0,42.3302,-71.0697,Constituent Call,"(42.3302, -71.0697)"
611662,101001523156,08/17/2015 01:18:00 PM,,09/02/2015 10:38:52 AM,ONTIME,Closed,Case Closed. Closed date : 2015-09-02 10:38:52.93 Case Noted One side has street cleaning and officer will overtime other side.,Transportation General Request,Transportation - Traffic Division,Administrative & General Requests,Transportation General Request,BTDT_Parking Enforcement,BTDT,,,INTERSECTION of Braddock Park & Pembroke St  Boston  MA,4.0,1C,2.0,D4,South End,6.0,Ward 4,403.0,,INTERSECTION Braddock Park & Pembroke St,,Intersection,1812.0,42.3437,-71.0779,Constituent Call,"(42.3437, -71.0779)"
613079,101001524973,08/19/2015 09:49:00 AM,,08/19/2015 09:51:55 AM,ONTIME,Closed,Case Closed. Closed date : 2015-08-19 09:51:55.547 Case Invalid made a case for new sign.,Transportation General Request,Transportation - Traffic Division,Administrative & General Requests,Transportation General Request,BTDT_Administration,BTDT,,,212 Old Colony Ave  South Boston  MA  02127,6.0,05,2.0,C6,South Boston / South Boston Waterfront,5.0,Ward 7,705.0,C,212 Old Colony Ave,2127.0,Address,105078.0,42.3328,-71.0536,Constituent Call,"(42.3328, -71.0536)"
613530,101001525581,08/19/2015 04:57:00 PM,,,ONTIME,Open,,Transportation General Request,Transportation - Traffic Division,Administrative & General Requests,Transportation General Request,ISD_Building (INTERNAL),ISD,,,23 Ticknor St  South Boston  MA  02127,6.0,05,2.0,C6,South Boston / South Boston Waterfront,5.0,Ward 7,701.0,CM,23 Ticknor St,2127.0,Address,135972.0,42.3305,-71.0358,Constituent Call,"(42.3305, -71.0358)"
613551,101001525604,08/19/2015 05:28:00 PM,,09/01/2015 01:51:10 PM,ONTIME,Closed,Case Closed Case Noted  The area was inspected and the signage is accurate; displaying pedestrians have the right of way in the crosswalks.,Transportation General Request,Transportation - Traffic Division,Administrative & General Requests,Transportation General Request,BTDT_Administration,BTDT,,,INTERSECTION of Columbia Rd & L St  South Boston  MA,6.0,05,2.0,C6,South Boston / South Boston Waterfront,5.0,Ward 7,701.0,,INTERSECTION Columbia Rd & L St,,Intersection,3263.0,42.3295,-71.0352,Constituent Call,"(42.3295, -71.0352)"
613821,101001525974,08/20/2015 09:10:00 AM,,09/01/2015 11:36:33 AM,ONTIME,Closed,Case Closed. Closed date : 2015-09-01 11:36:33.747 Case Noted This is 12 days old. The gentleman who files the complaints has made it very clear to us about the problem.,Transportation General Request,Transportation - Traffic Division,Administrative & General Requests,Transportation General Request,BTDT_Parking Enforcement,BTDT,,,45 Prince St  Boston  MA  02113,3.0,1B,1.0,A1,Boston,3.0,3,303.0,,45 Prince St,2113.0,Address,342574.0,42.3594,-71.0587,Constituent Call,"(0, 0)"
614370,101001526632,08/20/2015 04:42:00 PM,,11/05/2015 01:36:48 PM,ONTIME,Closed,Case Closed Case Resolved  The following case has been managed by the Boston Transportation Department. The location has been made safe.,Transportation General Request,Transportation - Traffic Division,Administrative & General Requests,Transportation General Request,BTDT_Administration,BTDT,,,2002 Beacon St  Brighton  MA  02135,11.0,04,9.0,D14,Allston / Brighton,15.0,Ward 21,2115.0,CC,2002 Beacon St,2135.0,Address,10067.0,42.3364,-71.1509,Constituent Call,"(42.3364, -71.1509)"
615080,101001527522,08/21/2015 03:33:00 PM,,11/05/2015 01:36:49 PM,ONTIME,Closed,Case Closed Case Resolved  The following case has been managed by the Boston Transportation Department. The location has been made safe.,Transportation General Request,Transportation - Traffic Division,Administrative & General Requests,Transportation General Request,BTDT_Administration,BTDT,,,INTERSECTION of Beacon St & Chestnut Hill Ave  Brighton  MA,11.0,04,9.0,D14,Allston / Brighton,15.0,Ward 21,2116.0,,INTERSECTION Beacon St & Chestnut Hill Ave,,Intersection,1079.0,42.3359,-71.1509,Constituent Call,"(42.3359, -71.1509)"
615576,101001528202,08/23/2015 12:52:00 PM,,09/14/2015 11:16:52 AM,ONTIME,Closed,"Case Closed. Closed date : 2015-09-14 11:16:52.003 Case Noted A recent field visited found no signs that say ""no turn on left""  There are however  signs that read ""No Turn on RED"" these signs are in place due to less than desirable sight lines due to the parking lot driveway and buildings.  These signs will remain in place.",Transportation General Request,Transportation - Traffic Division,Administrative & General Requests,Transportation General Request,BTDT_Engineering_Request for Traffic Signal Study or Review,BTDT,,,INTERSECTION of Washington St & River St  Mattapan  MA,8.0,07,3.0,C11,Dorchester,7.0,Ward 17,1714.0,,INTERSECTION Washington St & River St,,Intersection,6126.0,42.2725,-71.0694,Constituent Call,"(42.2725, -71.0694)"
615578,101001528204,08/23/2015 12:55:00 PM,,09/04/2015 10:31:23 AM,ONTIME,Closed,"Case Closed. Closed date : 2015-09-04 10:31:23.687 Case Noted Since there is an exclusive pedestrian phase (All Walk) at this location the ""NO TURN ON RED"" sign was installed for pedestrian safety.",Transportation General Request,Transportation - Traffic Division,Administrative & General Requests,Transportation General Request,BTDT_Engineering_Request for Traffic Signal Study or Review,BTDT,,,INTERSECTION of Central Ave & River St  Mattapan  MA,8.0,07,3.0,B3,Dorchester,7.0,Ward 17,1714.0,,INTERSECTION Central Ave & River St,,Intersection,2598.0,42.2714,-71.0736,Constituent Call,"(42.2714, -71.0736)"
615760,101001528468,08/24/2015 08:25:00 AM,,09/01/2015 11:24:37 AM,ONTIME,Closed,Case Closed Case Noted  These are seperate permits.  If you have any questions  please feel free to contact BTD @635-4680,Transportation General Request,Transportation - Traffic Division,Administrative & General Requests,Transportation General Request,BTDT_Administration,BTDT,,,INTERSECTION of Charlesgate East & Marlborough St  Boston  MA,4.0,10A,8.0,D4,Fenway / Kenmore / Audubon Circle / Longwood,14.0,Ward 5,509.0,,INTERSECTION Charlesgate East & Marlborough St,,Intersection,2816.0,42.3497,-71.0916,Constituent Call,"(42.3497, -71.0916)"
616178,101001529025,08/24/2015 02:38:00 PM,,09/01/2015 11:05:01 AM,ONTIME,Closed,Case Closed Case Noted  The City of Boston does not paint edge stone on city streets.  If an issue arises that a vehicle is parked  infringing on the driveway; please contact BTD enforcement or Boston Police for assistance,Transportation General Request,Transportation - Traffic Division,Administrative & General Requests,Transportation General Request,BTDT_Administration,BTDT,,,390-402 W First St  South Boston  MA  02127,6.0,05,2.0,C6,South Boston / South Boston Waterfront,5.0,06,604.0,,390-402 W First St,2127.0,Address,344792.0,42.3594,-71.0587,Constituent Call,"(0, 0)"
619086,101001542876,08/28/2015 09:29:00 AM,,10/13/2015 11:58:51 AM,ONTIME,Closed,Case Closed. Closed date : 2015-10-13 11:58:51.637 Case Resolved Seaver St was recently resurfaced by the Boston Public Works Department after coordination with the major utility companies. The location of your case has been repaired and therefore your case is being closed. If you have any further questions or concerns you may direct them to the Construction Management Division of Public Works at 617-635-4950 or contact the BOS:311 Hotline and request that a note be appended to your case.   Sincerely    Kevin Linskey Senior Civil Engineer Boston Public Works Department 617-635-4951 Office,Transportation General Request,Transportation - Traffic Division,Administrative & General Requests,Transportation General Request,PWDx_Roadway Repair_Reconstruction,PWDx,,,INTERSECTION of Blue Hill Ave & Seaver St  Jamaica Plain  MA,9.0,03,7.0,B2,Greater Mattapan,13.0,Ward 12,1207.0,,INTERSECTION Blue Hill Ave & Seaver St,,Intersection,1562.0,42.3052,-71.0848,Constituent Call,"(42.3052, -71.0848)"
619262,101001543098,08/28/2015 11:30:00 AM,,,ONTIME,Open,,Transportation General Request,Transportation - Traffic Division,Administrative & General Requests,Transportation General Request,BTDT_Request for Directional or Roadway Changes,BTDT,,,35 Fay St  Roxbury  MA  02118,4.0,1C,2.0,D4,South End,4.0,Ward 3,307.0,CM,35 Fay St,2118.0,Address,56838.0,42.343,-71.0652,Constituent Call,"(42.343, -71.0652)"
619865,101001543872,08/29/2015 02:19:00 PM,,08/31/2015 04:13:53 PM,ONTIME,Closed,Case Closed Case Resolved  These signs were installed as a 60 day pilot program; BTD will visit the neighborhood before the 60 days is up to discuss any issues in the area.,Transportation General Request,Transportation - Traffic Division,Administrative & General Requests,Transportation General Request,BTDT_Administration,BTDT,,,577 Gallivan Blvd  Dorchester  MA  02124,8.0,07,3.0,C11,Dorchester,7.0,Ward 16,1612.0,R2,577 Gallivan Blvd,2124.0,Address,62361.0,42.283,-71.0521,Constituent Call,"(42.283, -71.0521)"
621195,101001545911,09/01/2015 06:48:00 AM,,09/01/2015 10:30:07 AM,ONTIME,Closed,Case Closed Case Resolved  Meters are only free on city holidays.  The city will take your suggestion under advisement.  Thank you for your suggestion.,Transportation General Request,Transportation - Traffic Division,Administrative & General Requests,Transportation General Request,BTDT_Administration,BTDT,,,97 Hemenway St  Boston  MA  02115,4.0,10A,8.0,D4,Fenway / Kenmore / Audubon Circle / Longwood,14.0,Ward 4,407.0,EA,97 Hemenway St,2115.0,Address,72726.0,42.3435,-71.0903,Constituent Call,"(42.3435, -71.0903)"
621218,101001545941,09/01/2015 07:13:00 AM,,09/03/2015 08:22:18 AM,ONTIME,Closed,Case Closed. Closed date : 2015-09-03 08:22:18.427 Case Resolved Dear Constituent     The Boston Public Works Construction Inspection Unit (CIU) Inspector spoke to National Grid and the plates have been removed.    The City apologizes for the inconvenience.   For any questions or concerns  please contact the number listed below    Sincerely     Mark Cardarelli  Supervisor of Utility Coordination and Compliance  Boston Public Works Department  617-635-4951 Office,Transportation General Request,Transportation - Traffic Division,Administrative & General Requests,Transportation General Request,PWDx_Contractor Complaints,PWDx,,,3555 Washington St  Jamaica Plain  MA  02130,9.0,02,6.0,E13,Jamaica Plain,11.0,Ward 11,1108.0,RC,3555 Washington St,2130.0,Address,331212.0,42.3047,-71.1095,Constituent Call,"(42.3047, -71.1095)"
621546,101001546425,09/01/2015 10:50:00 AM,,09/01/2015 10:57:23 AM,ONTIME,Closed,Case Closed Case Noted  Currently the City of Boston does not use camera technology to enforce traffic violations.  I am forwarding this request on to BPD enforcement.,Transportation General Request,Transportation - Traffic Division,Administrative & General Requests,Transportation General Request,BTDT_Administration,BTDT,,,INTERSECTION of Bowdoin St & Topliff St  Dorchester  MA,7.0,03,4.0,C11,Dorchester,8.0,Ward 15,1502.0,,INTERSECTION Bowdoin St & Topliff St,,Intersection,1732.0,42.3049,-71.0688,Constituent Call,"(42.3049, -71.0688)"
621600,101001546512,09/01/2015 11:31:00 AM,,09/03/2015 07:32:52 AM,ONTIME,Closed,Case Closed. Closed date : 2015-09-03 07:32:52.177 Case Noted no parking sign is on private property the sign is not   BTD property  any vehicle blocking a driveway is  subject to being  towed no signage is required,Transportation General Request,Transportation - Traffic Division,Administrative & General Requests,Transportation General Request,BTDT_District 04,BTDT,,,57 Woodford St  Dorchester  MA  02125,7.0,03,7.0,B2,Roxbury,13.0,Ward 13,1302.0,R3,57 Woodford St,2125.0,Address,151528.0,42.318,-71.0711,Constituent Call,"(42.318, -71.0711)"
623847,101001549554,09/03/2015 03:44:00 PM,,09/03/2015 04:28:48 PM,ONTIME,Closed,Case Closed Case Noted  The bus route has moved to East Broadway.  Please contact the MBTA for further information.,Transportation General Request,Transportation - Traffic Division,Administrative & General Requests,Transportation General Request,BTDT_Administration,BTDT,,,880 E Fourth St  South Boston  MA  02127,6.0,05,2.0,C6,South Boston / South Boston Waterfront,5.0,Ward 6,609.0,A,880 E Fourth St,2127.0,Address,237423.0,42.3351,-71.028,Constituent Call,"(42.3351, -71.028)"
624018,101001569792,09/03/2015 09:27:00 PM,,09/03/2015 09:33:23 PM,ONTIME,Closed,Case Closed. Closed date : 2015-09-03 21:33:23.56 Case Invalid wrong address,Transportation General Request,Transportation - Traffic Division,Administrative & General Requests,Transportation General Request,BTDT_Administration,BTDT,,,83 E Berkeley St  Roxbury  MA  02118,4.0,1C,2.0,D4,South End,4.0,Ward 3,307.0,E,83 E Berkeley St,2118.0,Address,155668.0,42.3439,-71.0662,Constituent Call,"(42.3439, -71.0662)"
624020,101001569796,09/03/2015 09:36:00 PM,,09/10/2015 09:11:11 AM,ONTIME,Closed,Case Closed. Closed date : 2015-09-10 09:11:11.983 Case Noted Berkeley st is posted and swept from Tremont st to Columbus ave every wednesday from noon to 4pm,Transportation General Request,Transportation - Traffic Division,Administrative & General Requests,Transportation General Request,PWDx_District 1C: Downtown,PWDx,,https://cityworker.cityofboston.gov:8443/attachments/report/55e966d6d052a06d3cdcc352/closed_photo/Report.jpg,INTERSECTION of Berkeley St & E Berkeley St  Roxbury  MA,4.0,1C,2.0,D4,South End,4.0,Ward 3,307.0,,INTERSECTION Berkeley St & E Berkeley St,,Intersection,1364.0,42.3453,-71.0698,Constituent Call,"(42.3453, -71.0698)"
624507,101001570516,09/04/2015 03:58:00 PM,,09/09/2015 11:09:50 AM,ONTIME,Closed,Case Closed. Closed date : 2015-09-09 11:09:50.84 Case Noted Signs have been removed.....,Transportation General Request,Transportation - Traffic Division,Administrative & General Requests,Transportation General Request,BTDT_District 06,BTDT,,,35 Bay State Rd  Boston  MA  02215,4.0,10A,8.0,D4,Fenway / Kenmore / Audubon Circle / Longwood,14.0,Ward 5,510.0,CM,35 Bay State Rd,2215.0,Address,9107.0,42.3501,-71.0944,Constituent Call,"(42.3501, -71.0944)"
625364,101001571677,09/07/2015 08:09:00 PM,,09/08/2015 12:16:01 PM,ONTIME,Closed,Case Closed. Closed date : 2015-09-08 12:16:01.023 Case Noted Vehicles not in any violation,Transportation General Request,Transportation - Traffic Division,Administrative & General Requests,Transportation General Request,BTDT_Parking Enforcement,BTDT,,,89 Munroe St  Roxbury  MA  02119,9.0,10B,7.0,B2,Roxbury,13.0,Ward 12,1205.0,R4,89 Munroe St,2119.0,Address,99384.0,42.3189,-71.0884,Constituent Call,"(42.3189, -71.0884)"
626462,101001573283,09/09/2015 09:00:00 AM,,09/16/2015 12:29:50 PM,ONTIME,Closed,Case Closed Case Noted  This registration is not associated with the Transportation Department. Fleet services can not validate the registration number either.,Transportation General Request,Transportation - Traffic Division,Administrative & General Requests,Transportation General Request,BTDT_Administration,BTDT,,,INTERSECTION of Washington St & Melnea Cass Blvd  Roxbury  MA,7.0,10B,7.0,B2,Roxbury,13.0,Ward 8,804.0,,INTERSECTION Washington St & Melnea Cass Blvd,,Intersection,6040.0,42.3329,-71.081,Constituent Call,"(42.3329, -71.081)"
627760,101001575204,09/10/2015 03:09:00 PM,,,ONTIME,Open,,Transportation General Request,Transportation - Traffic Division,Administrative & General Requests,Transportation General Request,INFO01_GenericeFormforOtherServiceRequestTypes,INFO,,,210 Harvard Ave  Allston  MA  02134,11.0,04,9.0,D14,Allston / Brighton,14.0,Ward 21,2103.0,C,210 Harvard Ave,2134.0,Address,70349.0,42.3499,-71.1303,Constituent Call,"(42.3499, -71.1303)"
627793,101001575279,09/10/2015 04:00:00 PM,,12/11/2015 02:25:45 PM,ONTIME,Closed,Case Closed. Closed date : 2015-12-11 14:25:45.27 Case Noted Thanks for contacting the BTD with your concerns about the intersection of Brookline Ave and Longwood Ave.  The pedestrian signal at this location allows twenty one seconds for pedestrians to cross.  For seven seconds the pedestrian indication shows the white walk symbol followed by a countdown of fourteen seconds.  Twenty one seconds is the calculated adequate walk time for this intersection.,Transportation General Request,Transportation - Traffic Division,Administrative & General Requests,Transportation General Request,BTDT_Engineering_Request for Traffic Signal Study or Review,BTDT,,,INTERSECTION of Brookline Ave & Longwood Ave  Boston  MA,4.0,10A,8.0,B2,Fenway / Kenmore / Audubon Circle / Longwood,14.0,Ward 4,410.0,,INTERSECTION Brookline Ave & Longwood Ave,,Intersection,2065.0,42.3389,-71.1073,Constituent Call,"(42.3389, -71.1073)"
628303,101001576048,09/11/2015 01:08:00 PM,,,ONTIME,Open,,Transportation General Request,Transportation - Traffic Division,Administrative & General Requests,Transportation General Request,BTDT_Engineering_Request for Traffic Signal Study or Review,BTDT,,,650 Atlantic Ave  Boston  MA  02110,3.0,1B,1.0,A1,Boston,3.0,03,301.0,C,650 Atlantic Ave,2110.0,Address,157899.0,42.3519,-71.0554,Constituent Call,"(42.3519, -71.0554)"
628789,101001576708,09/12/2015 11:21:00 AM,,09/18/2015 09:31:06 AM,ONTIME,Closed,Case Closed. Closed date : 2015-09-18 09:31:06.423 Case Resolved Dear Constituent     The Boston Public Works Construction Inspection Unit (CIU) Inspector investigated and determined the following:    As of September 17th the work has been completed.    For any questions or concerns  please contact the number listed below    Sincerely     Mark Cardarelli  Supervisor of Utility Coordination and Compliance  Boston Public Works Department  617-635-4951 Office,Transportation General Request,Transportation - Traffic Division,Administrative & General Requests,Transportation General Request,PWDx_Contractor Complaints,PWDx,,,1250 Boylston St  Boston  MA  02215,4.0,10A,8.0,D4,Fenway / Kenmore / Audubon Circle / Longwood,14.0,Ward 5,502.0,C,1250 Boylston St,2215.0,Address,18072.0,42.345,-71.0954,Constituent Call,"(42.345, -71.0954)"
630489,101001579031,09/15/2015 11:56:00 AM,,09/20/2015 11:16:38 AM,ONTIME,Closed,Case Closed. Closed date : 2015-09-20 11:16:38.047 Case Resolved These streets are Private Ways and regulated by the Property Management Company (Channel Center) All requests should be directed to them,Transportation General Request,Transportation - Traffic Division,Administrative & General Requests,Transportation General Request,BTDT_Engineering_New Sign and Pavement Marking Requests,BTDT,,,135 A St  Boston  MA  02210,6.0,05,2.0,C6,South Boston / South Boston Waterfront,5.0,Ward 6,601.0,E,135 A St,2210.0,Address,13.0,42.3488,-71.0495,Constituent Call,"(42.3488, -71.0495)"
630491,101001579035,09/15/2015 11:59:00 AM,,09/20/2015 11:14:37 AM,ONTIME,Closed,Case Closed. Closed date : 2015-09-20 11:14:37.17 Case Resolved This is a Private Way - All signage is under the jurisdiction of the Property Management Agency (Channel Center Property Mgmt),Transportation General Request,Transportation - Traffic Division,Administrative & General Requests,Transportation General Request,BTDT_Engineering_New Sign and Pavement Marking Requests,BTDT,,,INTERSECTION of Medallion Ave & Iron St  Boston  MA,6.0,05,2.0,C6,South Boston / South Boston Waterfront,5.0,Ward 6,601.0,,INTERSECTION Medallion Ave & Iron St,,Intersection,8765.0,42.3446,-71.0516,Constituent Call,"(42.3446, -71.0516)"
631419,101001580398,09/16/2015 01:36:00 PM,,09/24/2015 08:54:54 AM,ONTIME,Closed,Case Closed. Closed date : 2015-09-24 08:54:54.273 Case Resolved Dear Constituent     The Boston Public Works Construction Inspection Unit (CIU) Inspector investigated and determined the following:    As of September 23rd all signs have been removed.    For any questions or concerns  please contact the number listed below    Sincerely     Mark Cardarelli  Supervisor of Utility Coordination and Compliance  Boston Public Works Department  617-635-4951,Transportation General Request,Transportation - Traffic Division,Administrative & General Requests,Transportation General Request,PWDx_Contractor Complaints,PWDx,,,17 Gay Head St  Jamaica Plain  MA  02130,9.0,10A,6.0,E13,Jamaica Plain,11.0,Ward 10,1006.0,R1,17 Gay Head St,2130.0,Address,63149.0,42.3239,-71.1052,Constituent Call,"(42.3239, -71.1052)"
631439,101001580435,09/16/2015 01:58:00 PM,,10/01/2015 09:57:34 AM,ONTIME,Closed,Case Closed. Closed date : 2015-10-01 09:57:34.053 Case Noted Travel markings exist,Transportation General Request,Transportation - Traffic Division,Administrative & General Requests,Transportation General Request,BTDT_Parking Lot_Municipal Parking Lot Complaints,BTDT,,,INTERSECTION of Brighton Ave & Harvard Ave  Allston  MA,11.0,04,9.0,D14,Allston / Brighton,15.0,Ward 21,2105.0,,INTERSECTION Brighton Ave & Harvard Ave,,Intersection,1946.0,42.3529,-71.1321,Constituent Call,"(42.3529, -71.1321)"
631679,101001580778,09/16/2015 06:59:00 PM,,09/17/2015 12:26:14 PM,ONTIME,Closed,Case Closed. Closed date : 2015-09-17 12:26:14.427 Case Noted Resident parking signs do not go into effect until 6pm. City has zero tolerance  policy for double parking.,Transportation General Request,Transportation - Traffic Division,Administrative & General Requests,Transportation General Request,BTDT_Parking Enforcement,BTDT,,,725 E Second St  South Boston  MA  02127,6.0,05,2.0,C6,South Boston / South Boston Waterfront,5.0,Ward 6,607.0,R3,725 E Second St,2127.0,Address,124459.0,42.3372,-71.0339,Constituent Call,"(42.3372, -71.0339)"
632032,101001581297,09/17/2015 11:15:00 AM,,09/17/2015 12:58:27 PM,ONTIME,Closed,Case Closed. Closed date : 2015-09-17 12:58:27.5 Case Resolved Vehicle ticketed and put on tow list.,Transportation General Request,Transportation - Traffic Division,Administrative & General Requests,Transportation General Request,BTDT_Parking Enforcement,BTDT,,,INTERSECTION of Massachusetts Ave & Pompeii St  Roxbury  MA,7.0,1C,7.0,C6,South Boston / South Boston Waterfront,13.0,Ward 8,806.0,,INTERSECTION Massachusetts Ave & Pompeii St,,Intersection,7148.0,42.3301,-71.0696,Constituent Call,"(42.3301, -71.0696)"
632111,101001581404,09/17/2015 12:31:00 PM,,11/20/2015 12:26:30 PM,ONTIME,Closed,Case Closed. Closed date : 2015-11-20 12:26:30.757 Case Noted The no parking signs in question that were installed were simply replacement of missing signs that have been there since the opening of the Boston Police HQ,Transportation General Request,Transportation - Traffic Division,Administrative & General Requests,Transportation General Request,BTDT_District 03,BTDT,,,31 Prentiss St  Mission Hill  MA  02120,9.0,10A,7.0,B2,Mission Hill,13.0,Ward 4,409.0,E,31 Prentiss St,2120.0,Address,173721.0,42.3338,-71.0935,Constituent Call,"(42.3338, -71.0935)"
632319,101001581738,09/17/2015 05:42:00 PM,,,ONTIME,Open,,Transportation General Request,Transportation - Traffic Division,Administrative & General Requests,Transportation General Request,INFO01_GenericeFormforOtherServiceRequestTypes,INFO,,,INTERSECTION of Brimmer St & Mount Vernon St  Boston  MA,3.0,1B,8.0,A1,Beacon Hill,14.0,Ward 5,511.0,,INTERSECTION Brimmer St & Mount Vernon St,,Intersection,1956.0,42.3574,-71.072,Constituent Call,"(42.3574, -71.072)"
632989,101001582719,09/18/2015 05:03:00 PM,,11/20/2015 10:42:53 AM,ONTIME,Closed,Case Closed Case Noted  Mass State House manages passes for parking at the State House,Transportation General Request,Transportation - Traffic Division,Administrative & General Requests,Transportation General Request,BTDT_Administration,BTDT,,,24 Beacon St  Boston  MA  02133,3.0,1B,8.0,A1,Boston,14.0,05,503.0,E,24 Beacon St,2133.0,Address,10388.0,42.3583,-71.0637,Constituent Call,"(42.3583, -71.0637)"
633451,101001583351,09/20/2015 10:57:00 AM,,11/23/2015 07:21:30 AM,ONTIME,Closed,Case Closed. Closed date : 2015-11-23 07:21:30.71 Case Resolved,Transportation General Request,Transportation - Traffic Division,Administrative & General Requests,Transportation General Request,BTDT_Traffic Signal_Knock Downs/Contractor,BTDT,,,40 Alleghany St  Mission Hill  MA  02120,9.0,10A,8.0,B2,Mission Hill,14.0,Ward 10,1005.0,CM,40 Alleghany St,2120.0,Address,2253.0,42.3302,-71.0992,Constituent Call,"(42.3302, -71.0992)"
634136,101001584320,09/21/2015 02:35:00 PM,,,ONTIME,Open,,Transportation General Request,Transportation - Traffic Division,Administrative & General Requests,Transportation General Request,INFO01_GenericeFormforOtherServiceRequestTypes,INFO,,,11 Langdon St  Roxbury  MA  02119,7.0,03,7.0,B2,Roxbury,13.0,Ward 8,805.0,R3,11 Langdon St,2119.0,Address,83917.0,42.324,-71.0728,Constituent Call,"(42.324, -71.0728)"
634288,101001584543,09/21/2015 06:22:00 PM,,12/03/2015 12:44:33 PM,ONTIME,Closed,Case Closed. Closed date : 2015-12-03 12:44:33.793 Case Resolved Work completed 12/3/15.,Transportation General Request,Transportation - Traffic Division,Administrative & General Requests,Transportation General Request,BTDT_Sign Shop_Sign Installation,BTDT,,,35 Banfield Ave  Mattapan  MA  02126,8.0,07,4.0,B3,Greater Mattapan,9.0,Ward 18,1802.0,R1,35 Banfield Ave,2126.0,Address,8110.0,42.2772,-71.087,Constituent Call,"(42.2772, -71.087)"
634495,101001584828,09/22/2015 09:13:00 AM,,11/20/2015 10:50:45 AM,ONTIME,Closed,Case Closed. Closed date : 2015-11-20 10:50:45.657 Case Noted Will have officers monitor location.,Transportation General Request,Transportation - Traffic Division,Administrative & General Requests,Transportation General Request,BTDT_Parking Enforcement,BTDT,,,23-25 Union Ave  Jamaica Plain  MA  02130,9.0,02,6.0,E13,Jamaica Plain,11.0,Ward 11,1107.0,R3,23-25 Union Ave,2130.0,Address,139035.0,42.3092,-71.1066,Constituent Call,"(42.3092, -71.1066)"
634534,101001584884,09/22/2015 09:37:00 AM,,01/12/2016 12:58:26 PM,ONTIME,Closed,Case Closed. Closed date : 2016-01-12 12:58:26.94 Case Noted The State of Massachusetts does not allow motorists to be ticketed through video footage.  If there is an accident then a person involved in the accident can ask for a copy.,Transportation General Request,Transportation - Traffic Division,Administrative & General Requests,Transportation General Request,BTDT_Engineering_Request for Traffic Signal Study or Review,BTDT,,,INTERSECTION of Beacon St & Massachusetts Ave  Boston  MA,4.0,1C,8.0,D4,Back Bay,14.0,Ward 5,509.0,,INTERSECTION Beacon St & Massachusetts Ave,,Intersection,1094.0,42.3508,-71.0895,Constituent Call,"(42.3508, -71.0895)"
634741,101001585157,09/22/2015 11:43:00 AM,,11/20/2015 10:35:43 AM,ONTIME,Closed,Case Closed Case Noted  The crew has been made aware of the issue and has been reminded of their responsibilities.  The City of Boston apologizes for this inconvenience.,Transportation General Request,Transportation - Traffic Division,Administrative & General Requests,Transportation General Request,BTDT_Administration,BTDT,,,2 Marbury Ter  Jamaica Plain  MA  02130,9.0,02,6.0,E13,Jamaica Plain,11.0,Ward 11,1104.0,R3,2 Marbury Ter,2130.0,Address,89504.0,42.3177,-71.102,Constituent Call,"(42.3177, -71.102)"
636031,101001597051,09/24/2015 11:27:00 AM,,,ONTIME,Open,,Transportation General Request,Transportation - Traffic Division,Administrative & General Requests,Transportation General Request,BTDT_Engineering_New Sign and Pavement Marking Requests,BTDT,,,5-5A Howland St  Dorchester  MA  02121,9.0,10B,7.0,B2,Roxbury,13.0,Ward 12,1202.0,R3,5-5A Howland St,2121.0,Address,75780.0,42.3115,-71.0837,Constituent Call,"(42.3115, -71.0837)"
640530,101001603576,10/02/2015 12:29:00 PM,,11/24/2015 08:46:05 AM,ONTIME,Closed,Case Closed. Closed date : 2015-11-24 08:46:05.657 Case Resolved Closed this out with a phone conversation with the constituent and an email with information about the Resident Parking Program.   Best  Amy Mahler Allston & Brighton Neighborhood Coordinator Mayor's Office of Neighborhood Services Boston City Hall  Rm. 805 Boston  MA 02201,Transportation General Request,Transportation - Traffic Division,Administrative & General Requests,Transportation General Request,INFO01_GenericeFormforOtherServiceRequestTypes,INFO,,,INTERSECTION of Waverly St & Western Ave  Brighton  MA,11.0,04,9.0,D14,Allston / Brighton,15.0,Ward 22,2205.0,,INTERSECTION Waverly St & Western Ave,,Intersection,6147.0,42.3624,-71.1406,Constituent Call,"(42.3624, -71.1406)"
641449,101001604865,10/05/2015 10:21:00 AM,,11/23/2015 06:42:14 AM,ONTIME,Closed,Case Closed. Closed date : 2015-11-23 06:42:14.773 Case Resolved No such sigage at location - Field verified,Transportation General Request,Transportation - Traffic Division,Administrative & General Requests,Transportation General Request,BTDT_District 01,BTDT,,,62 Washington St  Brighton  MA  02135,11.0,04,9.0,D14,Allston / Brighton,15.0,Ward 21,2112.0,C,62 Washington St,2135.0,Address,156364.0,42.3433,-71.1424,Constituent Call,"(42.3433, -71.1424)"
642008,101001605686,10/06/2015 08:32:12 AM,,10/06/2015 08:33:44 AM,ONTIME,Closed,Case Closed. Closed date : 2015-10-06 08:33:44.55 Case Invalid Incorrect form,Transportation General Request,Transportation - Traffic Division,Administrative & General Requests,Transportation General Request,BTDT_Administration,BTDT,,,8 Linden St  South Boston  MA  02127,6.0,05,2.0,C6,South Boston / South Boston Waterfront,5.0,Ward 7,703.0,R1,8 Linden St,2127.0,Address,86484.0,42.3343,-71.0451,Constituent Call,"(42.3343, -71.0451)"
642056,101001605765,10/06/2015 09:26:00 AM,,,ONTIME,Open,,Transportation General Request,Transportation - Traffic Division,Administrative & General Requests,Transportation General Request,BTDT_Engineering_New Sign and Pavement Marking Requests,BTDT,,,576 River St  Mattapan  MA  02126,8.0,08,4.0,B3,Greater Mattapan,9.0,Ward 18,1804.0,R4,576 River St,2126.0,Address,169153.0,42.2664,-71.0968,Constituent Call,"(42.2664, -71.0968)"
642129,101001605864,10/06/2015 10:33:00 AM,,,ONTIME,Open,,Transportation General Request,Transportation - Traffic Division,Administrative & General Requests,Transportation General Request,BTDT_Engineering_New Sign and Pavement Marking Requests,BTDT,,,24 New Chardon St  Boston  MA  02114,3.0,1B,1.0,A1,Downtown / Financial District,3.0,03,306.0,E,24 New Chardon St,2114.0,Address,101076.0,42.3628,-71.0618,Constituent Call,"(42.3628, -71.0618)"
642344,101001606209,10/06/2015 02:21:00 PM,,,ONTIME,Open,,Transportation General Request,Transportation - Traffic Division,Administrative & General Requests,Transportation General Request,BTDT_Administration,BTDT,,,750 Atlantic Ave  Boston  MA  02111,4.0,1C,2.0,A1,Downtown / Financial District,4.0,Ward 3,308.0,E,750 Atlantic Ave,2111.0,Address,161712.0,42.3501,-71.0561,Constituent Call,"(42.3501, -71.0561)"
642387,101001606299,10/06/2015 03:16:00 PM,,11/20/2015 10:29:10 AM,ONTIME,Closed,Case Closed Case Noted  The speed limit on all residential streets is 30 mph. There is legislation at the Mass State House that would allow the City of Boston to reduce the speed limit on their streets. Suggest contacting your state rep to show support for this bill. In the meantime  BTD will review the area to see if any improvements can be made as well as alerting BPD of the issue.,Transportation General Request,Transportation - Traffic Division,Administrative & General Requests,Transportation General Request,BTDT_Administration,BTDT,,,166 Hackensack Rd  Chestnut Hill  MA  02467,9.0,06,6.0,E5,West Roxbury,12.0,Ward 20,2006.0,R1,166 Hackensack Rd,2467.0,Address,67971.0,42.2979,-71.1446,Constituent Call,"(42.2979, -71.1446)"
642631,101001606642,10/07/2015 07:00:00 AM,,11/23/2015 07:40:21 AM,ONTIME,Closed,Case Closed. Closed date : 2015-11-23 07:40:21.187 Case Resolved,Transportation General Request,Transportation - Traffic Division,Administrative & General Requests,Transportation General Request,BTDT_Traffic Signal_Repair,BTDT,,,855-861 Commonwealth Ave  Boston  MA  02215,11.0,04,8.0,D14,Boston,14.0,21,2102.0,E,855-861 Commonwealth Ave,2215.0,Address,341949.0,42.3594,-71.0587,Constituent Call,"(0, 0)"
645493,101001611043,10/13/2015 02:44:00 PM,,10/27/2015 09:59:23 AM,ONTIME,Closed,Case Closed. Closed date : 2015-10-27 09:59:23.92 Case Noted there is a driveway here please park there to let people out,Transportation General Request,Transportation - Traffic Division,Administrative & General Requests,Transportation General Request,BTDT_Engineering_New Sign and Pavement Marking Requests,BTDT,,,316 Meridian St  East Boston  MA  02128,1.0,09,1.0,A7,East Boston,1.0,01,106.0,E,316 Meridian St,2128.0,Address,94463.0,42.3775,-71.0396,Constituent Call,"(42.3775, -71.0396)"
645940,101001611643,10/14/2015 09:54:00 AM,,10/20/2015 10:49:28 AM,ONTIME,Closed,Case Closed Case Noted  BTD enforcement was sent to location,Transportation General Request,Transportation - Traffic Division,Administrative & General Requests,Transportation General Request,BTDT_Administration,BTDT,,,14 S Huntington Ave  Mission Hill  MA  02120,9.0,10A,8.0,E13,Mission Hill,11.0,Ward 10,1008.0,RC,14 S Huntington Ave,2120.0,Address,256621.0,42.3317,-71.1117,Constituent Call,"(42.3317, -71.1117)"
646923,101001613068,10/15/2015 02:35:00 PM,,,ONTIME,Open,,Transportation General Request,Transportation - Traffic Division,Administrative & General Requests,Transportation General Request,INFO01_GenericeFormforOtherServiceRequestTypes,INFO,,,21-29 Harrison Avenue Ext  Boston  MA  02111,3.0,1C,2.0,A1,Boston,4.0,03,308.0,C,21-29 Harrison Avenue Ext,2111.0,Address,70174.0,42.3531,-71.0611,Constituent Call,"(42.3531, -71.0611)"
647065,101001613279,10/15/2015 06:26:00 PM,,10/20/2015 10:35:50 AM,ONTIME,Closed,Case Closed Case Noted  This restriction has been discussed at the cedar grove civic meeting. This is a pilot restriction to help improve traffic. Supported by a resident petition  Neighborhood Services and the civic group.,Transportation General Request,Transportation - Traffic Division,Administrative & General Requests,Transportation General Request,BTDT_Administration,BTDT,,,26 Grayson St  Dorchester  MA  02124,8.0,07,3.0,C11,Dorchester,7.0,Ward 16,1612.0,R1,26 Grayson St,2124.0,Address,66137.0,42.2823,-71.0501,Constituent Call,"(42.2823, -71.0501)"
648959,101001615867,10/20/2015 09:48:00 AM,,10/26/2015 10:40:56 AM,ONTIME,Closed,Case Closed. Closed date : 2015-10-26 10:40:56.81 Case Resolved Will be removed within a week or two. Field sheet C-642.,Transportation General Request,Transportation - Traffic Division,Administrative & General Requests,Transportation General Request,BTDT_Engineering_New Sign and Pavement Marking Requests,BTDT,,,110-114 Brookline Ave  Boston  MA  02215,4.0,10A,8.0,D4,Fenway / Kenmore / Audubon Circle / Longwood,14.0,Ward 5,502.0,I,110-114 Brookline Ave,2215.0,Address,22080.0,42.3458,-71.0997,Constituent Call,"(42.3458, -71.0997)"
649022,101001615947,10/20/2015 10:45:00 AM,,11/20/2015 10:26:00 AM,ONTIME,Closed,Case Closed Case Noted  Due to the demand of parking in the City of Boston  these parking spaces are a necessity. BTD engineers will look into this complaint and make sure that public safety is not at risk.,Transportation General Request,Transportation - Traffic Division,Administrative & General Requests,Transportation General Request,BTDT_Administration,BTDT,,,INTERSECTION of E Berkeley St & Washington St  Roxbury  MA,4.0,1C,2.0,D4,South End,4.0,Ward 3,307.0,,INTERSECTION E Berkeley St & Washington St,,Intersection,1368.0,42.3439,-71.0659,Constituent Call,"(42.3439, -71.0659)"
649631,101001616861,10/21/2015 09:57:00 AM,,,ONTIME,Open,,Transportation General Request,Transportation - Traffic Division,Administrative & General Requests,Transportation General Request,BTDT_Administration,BTDT,,,229-231 Bunker Hill St  Charlestown  MA  02129,3.0,1A,1.0,A15,Charlestown,2.0,Ward 2,205.0,C,229-231 Bunker Hill St,2129.0,Address,23383.0,42.3795,-71.0633,Constituent Call,"(42.3795, -71.0633)"
650358,101001617841,10/22/2015 10:38:00 AM,,12/23/2015 09:02:55 AM,ONTIME,Closed,Case Closed. Closed date : 2015-12-23 09:02:55.617 Case Noted The traffic signal was installed for pedestrian safety and will remain in place.,Transportation General Request,Transportation - Traffic Division,Administrative & General Requests,Transportation General Request,BTDT_Engineering_Request for Traffic Signal Study or Review,BTDT,,,INTERSECTION of Washington St & Roslin St  Dorchester  MA,8.0,07,4.0,C11,Dorchester,8.0,Ward 17,1709.0,,INTERSECTION Washington St & Roslin St,,Intersection,6117.0,42.2863,-71.0712,Constituent Call,"(42.2863, -71.0712)"
650750,101001618474,10/22/2015 07:06:00 PM,,,ONTIME,Open,,Transportation General Request,Transportation - Traffic Division,Administrative & General Requests,Transportation General Request,BTDT_Administration,BTDT,,,INTERSECTION of Fairfield St & Marlborough St  Boston  MA,4.0,1C,8.0,D4,Back Bay,14.0,Ward 5,508.0,,INTERSECTION Fairfield St & Marlborough St,,Intersection,4741.0,42.3517,-71.0832,Constituent Call,"(42.3517, -71.0832)"
652135,101001620503,10/26/2015 12:46:00 PM,,01/06/2016 03:00:09 PM,ONTIME,Closed,Case Closed. Closed date : 2016-01-06 15:00:09.787 Case Resolved,Transportation General Request,Transportation - Traffic Division,Administrative & General Requests,Transportation General Request,BTDT_Traffic Signal_Repair,BTDT,,,INTERSECTION of Columbus Ave & Dartmouth St  Boston  MA,4.0,1C,2.0,D4,South End,6.0,Ward 4,401.0,,INTERSECTION Columbus Ave & Dartmouth St,,Intersection,3300.0,42.3458,-71.0752,Constituent Call,"(42.3458, -71.0752)"
652263,101001620702,10/26/2015 03:18:00 PM,,,ONTIME,Open,,Transportation General Request,Transportation - Traffic Division,Administrative & General Requests,Transportation General Request,BTDT_Administration,BTDT,,,230 Bunker Hill St  Charlestown  MA  02129,3.0,1A,1.0,A15,Charlestown,2.0,Ward 2,205.0,R1,230 Bunker Hill St,2129.0,Address,23384.0,42.3792,-71.0635,Constituent Call,"(42.3792, -71.0635)"
652319,101001620794,10/26/2015 04:53:00 PM,,11/20/2015 10:18:10 AM,ONTIME,Closed,Case Closed Case Noted  The City of Boston does not paint curb stone yellow. If you find that vehicles are blocking your driveway  you may call BTD enforcement or the Bston Police for assistance,Transportation General Request,Transportation - Traffic Division,Administrative & General Requests,Transportation General Request,BTDT_Administration,BTDT,,,105 Forest Hills St  Jamaica Plain  MA  02130,9.0,02,6.0,E13,Jamaica Plain,11.0,Ward 11,1107.0,CM,105 Forest Hills St,2130.0,Address,59338.0,42.3085,-71.1028,Constituent Call,"(42.3085, -71.1028)"
652385,101001620883,10/26/2015 08:29:00 PM,,,ONTIME,Open,,Transportation General Request,Transportation - Traffic Division,Administrative & General Requests,Transportation General Request,INFO01_GenericeFormforOtherServiceRequestTypes,INFO,,,INTERSECTION of N Harvard St & Western Ave  Allston  MA,11.0,04,9.0,D14,Allston / Brighton,15.0,Ward 22,2201.0,,INTERSECTION N Harvard St & Western Ave,,Intersection,5767.0,42.3632,-71.1298,Constituent Call,"(42.3632, -71.1298)"
653051,101001621851,10/27/2015 03:59:00 PM,,12/11/2015 10:07:51 AM,ONTIME,Closed,Case Closed. Closed date : 2015-12-11 10:07:51.06 Case Noted The club has a valet permit that they maintain with the City of Boston. Carshare program is a citywide initiative.,Transportation General Request,Transportation - Traffic Division,Administrative & General Requests,Transportation General Request,BTDT_Valet Licensing Permit,BTDT,,,16 Fairfield St  Boston  MA  02116,4.0,1C,8.0,D4,Back Bay,14.0,Ward 5,508.0,CM,16 Fairfield St,2116.0,Address,165149.0,42.3516,-71.0828,Constituent Call,"(42.3516, -71.0828)"
653156,101001621980,10/27/2015 06:13:00 PM,,01/06/2016 04:36:44 PM,ONTIME,Closed,Case Closed. Closed date : 2016-01-06 16:36:44.913 Case Noted referred to ParkBoston for review,Transportation General Request,Transportation - Traffic Division,Administrative & General Requests,Transportation General Request,BTDT_OPC_Phone Bank Service,BTDT,,,99-105 Broad St  Boston  MA  02110,3.0,1C,1.0,A1,Downtown / Financial District,3.0,03,306.0,,99-105 Broad St,2110.0,Address,344323.0,42.3572,-71.0525,Constituent Call,"(42.3572, -71.0525)"
653430,101001622390,10/28/2015 10:16:00 AM,,,ONTIME,Open,,Transportation General Request,Transportation - Traffic Division,Administrative & General Requests,Transportation General Request,INFO01_GenericeFormforOtherServiceRequestTypes,INFO,,,987-997 Bennington St  East Boston  MA  02128,1.0,09,1.0,A7,East Boston,1.0,Ward 1,112.0,C,987-997 Bennington St,2128.0,Address,14966.0,42.3864,-71.0071,Constituent Call,"(42.3864, -71.0071)"
654203,101001623503,10/29/2015 01:35:00 PM,,,ONTIME,Open,,Transportation General Request,Transportation - Traffic Division,Administrative & General Requests,Transportation General Request,BTDT_Engineering_New Sign and Pavement Marking Requests,BTDT,,,INTERSECTION of Massachusetts Ave & Southampton St  Roxbury  MA,7.0,1C,7.0,D4,Roxbury,13.0,Ward 8,803.0,,INTERSECTION Massachusetts Ave & Southampton St,,Intersection,7146.0,42.3326,-71.0723,Constituent Call,"(42.3326, -71.0723)"
654382,101001623762,10/29/2015 07:34:00 PM,,11/05/2015 01:15:41 PM,ONTIME,Closed,Case Closed Case Noted  This is a pilot restriction; they are scheduled for removal,Transportation General Request,Transportation - Traffic Division,Administrative & General Requests,Transportation General Request,BTDT_Administration,BTDT,,,INTERSECTION of Gallivan Blvd & Saint Brendan Rd  Dorchester  MA,8.0,07,3.0,C11,Dorchester,7.0,Ward 16,1612.0,,INTERSECTION Gallivan Blvd & Saint Brendan Rd,,Intersection,5190.0,42.2831,-71.052,Constituent Call,"(42.2831, -71.052)"
654745,101001624328,10/30/2015 01:57:00 PM,,11/19/2015 11:26:38 AM,ONTIME,Closed,Case Closed. Closed date : 2015-11-19 11:26:38.877 Case Resolved Work completed 11/19/15.,Transportation General Request,Transportation - Traffic Division,Administrative & General Requests,Transportation General Request,BTDT_Sign Shop_Sign Installation,BTDT,,,24 Selkirk Rd  Brighton  MA  02135,11.0,04,9.0,D14,Allston / Brighton,15.0,Ward 21,2114.0,R2,24 Selkirk Rd,2135.0,Address,125071.0,42.3394,-71.1482,Constituent Call,"(42.3394, -71.1482)"
655944,101001626026,11/02/2015 03:46:00 PM,,11/05/2015 09:58:05 PM,ONTIME,Closed,Case Closed. Closed date : 2015-11-05 21:58:05.357 Case Resolved several vehicles were tagged at this location that were in violation.,Transportation General Request,Transportation - Traffic Division,Administrative & General Requests,Transportation General Request,BTDT_Parking Enforcement,BTDT,,,33 Kilmarnock St  Boston  MA  02215,4.0,10A,8.0,D4,Fenway / Kenmore / Audubon Circle / Longwood,14.0,21,2101,C,33 Kilmarnock St,2215.0,Address,157991.0,42.3437,-71.1002,Constituent Call,"(42.3437, -71.1002)"
657419,101001628175,11/04/2015 08:05:00 PM,,11/17/2015 01:09:54 PM,ONTIME,Closed,Case Closed. Closed date : 2015-11-17 13:09:54.667 Case Resolved Work completed 11/13/15.,Transportation General Request,Transportation - Traffic Division,Administrative & General Requests,Transportation General Request,BTDT_Sign Shop_Sign Installation,BTDT,,,42 Granite Ave  Dorchester  MA  02124,8.0,07,3.0,C11,Dorchester,7.0,Ward 16,1612,R1,42 Granite Ave,2124.0,Address,65904.0,42.2817,-71.0551,Constituent Call,"(42.2817, -71.0551)"
657455,101001628223,11/04/2015 11:50:00 PM,,11/20/2015 10:54:03 AM,ONTIME,Closed,Case Closed. Closed date : 2015-11-20 10:54:03.27 Case Noted No paper permit signs in the area  cannot verify constituent's question....11/20/2015...10:45a.m.,Transportation General Request,Transportation - Traffic Division,Administrative & General Requests,Transportation General Request,BTDT_District 06,BTDT,,,6 Cordis St  Charlestown  MA  02129,3.0,1A,1.0,A15,Charlestown,2.0,Ward 2,0203,R4,6 Cordis St,2129.0,Address,218809.0,42.3749,-71.0632,Constituent Call,"(42.3749, -71.0632)"
657567,101001628408,11/05/2015 09:07:00 AM,,11/05/2015 12:13:02 PM,ONTIME,Closed,Case Closed Case Noted  The City of Boston does not install these types of pavement markings.,Transportation General Request,Transportation - Traffic Division,Administrative & General Requests,Transportation General Request,BTDT_Administration,BTDT,,,INTERSECTION of E Fourth St & M St  South Boston  MA,6.0,05,2.0,C6,South Boston / South Boston Waterfront,5.0,Ward 6,0608,,INTERSECTION E Fourth St & M St,,Intersection,5049.0,42.3348,-71.0333,Constituent Call,"(42.3348, -71.0333)"
657762,101001628740,11/05/2015 12:51:00 PM,,,ONTIME,Open,,Transportation General Request,Transportation - Traffic Division,Administrative & General Requests,Transportation General Request,BTDT_Engineering_Request for Traffic Signal Study or Review,BTDT,,,329 Centre St  Jamaica Plain  MA  02130,9.0,10A,6.0,E13,Jamaica Plain,11.0,Ward 10,1006,RC,329 Centre St,2130.0,Address,162981.0,42.323,-71.1046,Constituent Call,"(42.323, -71.1046)"
658509,101001629883,11/06/2015 03:18:00 PM,,11/20/2015 10:38:57 AM,ONTIME,Closed,Case Closed. Closed date : 2015-11-20 10:38:57.937 Case Noted I am on Amory St at Porter St and could not locate problem thank you,Transportation General Request,Transportation - Traffic Division,Administrative & General Requests,Transportation General Request,BTDT_District 02,BTDT,,,234 Amory St  Jamaica Plain  MA  02130,9.0,02,6.0,E13,Jamaica Plain,11.0,Ward 11,1106,CM,234 Amory St,2130.0,Address,161542.0,42.3161,-71.1034,Constituent Call,"(42.3161, -71.1034)"
658541,101001629938,11/06/2015 04:12:00 PM,,12/01/2015 11:50:20 AM,ONTIME,Closed,Case Closed. Closed date : 2015-12-01 11:50:20.487 Case Resolved Work completed 12/1/15.,Transportation General Request,Transportation - Traffic Division,Administrative & General Requests,Transportation General Request,BTDT_Sign Shop_Sign Installation,BTDT,,,365 Bremen St  East Boston  MA  02128,1.0,09,1.0,A7,East Boston,1.0,01,0110,,365 Bremen St,2128.0,Address,343343.0,42.3594,-71.0587,Constituent Call,"(0, 0)"
659838,101001631693,11/10/2015 02:11:00 AM,,11/21/2015 08:59:40 AM,ONTIME,Closed,Case Closed. Closed date : 2015-11-21 08:59:40.423 Case Noted Blue Hill Ave street cleaning is enforced twice a week every Tuesday  12:00 AM to 7:00 AM and every Friday 12:00 AM to &:00 AM all year long if the operator was asked to move it was to save them from getting a ticket left voice message on contact number,Transportation General Request,Transportation - Traffic Division,Administrative & General Requests,Transportation General Request,BTDT_Parking Enforcement,BTDT,,,545-549 Blue Hill Ave  Dorchester  MA  02121,9.0,10B,7.0,B2,Roxbury,13.0,Ward 12,1207,A,545-549 Blue Hill Ave,2121.0,Address,162151.0,42.3066,-71.0847,Constituent Call,"(42.3066, -71.0847)"
660477,101001632684,11/10/2015 05:59:00 PM,,12/29/2015 09:24:29 AM,ONTIME,Closed,Case Closed. Closed date : 2015-12-29 09:24:29.55 Case Noted Per investigator. Active construction site. BTD-approved contractor signs have been installed and meters bagged to facilitate construction of adjacent building.,Transportation General Request,Transportation - Traffic Division,Administrative & General Requests,Transportation General Request,BTDT_Engineering_New Sign and Pavement Marking Requests,BTDT,,,INTERSECTION of Congress St & E Service Rd  Boston  MA,6.0,05,2.0,C6,South Boston / South Boston Waterfront,5.0,Ward 6,0601,,INTERSECTION Congress St & E Service Rd,,Intersection,3446.0,42.3488,-71.0459,Constituent Call,"(42.3488, -71.0459)"
662071,101001634879,11/14/2015 11:53:00 AM,,11/23/2015 07:15:26 AM,ONTIME,Closed,Case Closed. Closed date : 2015-11-23 07:15:26.217 Case Resolved,Transportation General Request,Transportation - Traffic Division,Administrative & General Requests,Transportation General Request,BTDT_Traffic Signal_Repair,BTDT,,,INTERSECTION of Essex St & Lincoln St  Boston  MA,4.0,1C,2.0,A1,Downtown / Financial District,4.0,Ward 3,0308,,INTERSECTION Essex St & Lincoln St,,Intersection,4637.0,42.3523,-71.058,Constituent Call,"(42.3523, -71.058)"
664967,101001638954,11/19/2015 03:13:00 PM,,11/20/2015 10:05:34 AM,ONTIME,Closed,Case Closed Case Noted  Adjustments were made to signal timing in the area and BPD was alerted of the issues,Transportation General Request,Transportation - Traffic Division,Administrative & General Requests,Transportation General Request,BTDT_Administration,BTDT,,,INTERSECTION of Albany St & Massachusetts Ave  Roxbury  MA,7.0,1C,7.0,D4,Roxbury,13.0,Ward 8,0803,,INTERSECTION Albany St & Massachusetts Ave,,Intersection,202.0,42.3335,-71.0735,Constituent Call,"(42.3335, -71.0735)"
665344,101001639493,11/20/2015 10:35:00 AM,,,ONTIME,Open,,Transportation General Request,Transportation - Traffic Division,Administrative & General Requests,Transportation General Request,BTDT_Administration,BTDT,,,INTERSECTION of Centre St & Gardner St  Roxbury  MA,7.0,10B,7.0,B2,Roxbury,13.0,Ward 9,0905,,INTERSECTION Centre St & Gardner St,,Intersection,2716.0,42.3294,-71.0939,Constituent Call,"(42.3294, -71.0939)"
666097,101001640607,11/22/2015 04:52:00 PM,,,ONTIME,Open,,Transportation General Request,Transportation - Traffic Division,Administrative & General Requests,Transportation General Request,BTDT_Administration,BTDT,,,334 Meridian St  East Boston  MA  02128,1.0,09,1.0,A7,East Boston,1.0,Ward 1,0106,R3,334 Meridian St,2128.0,Address,94486.0,42.378,-71.0394,Constituent Call,"(42.378, -71.0394)"
666368,101001641037,11/23/2015 11:18:00 AM,,,ONTIME,Open,,Transportation General Request,Transportation - Traffic Division,Administrative & General Requests,Transportation General Request,BTDT_Administration,BTDT,,,INTERSECTION of Lubec St & Porter St  East Boston  MA,1.0,09,1.0,A7,East Boston,1.0,Ward 1,0105,,INTERSECTION Lubec St & Porter St,,Intersection,6955.0,42.3711,-71.0327,Constituent Call,"(42.3711, -71.0327)"
667865,101001643315,11/27/2015 09:06:00 AM,,,ONTIME,Open,,Transportation General Request,Transportation - Traffic Division,Administrative & General Requests,Transportation General Request,BTDT_Administration,BTDT,,,INTERSECTION of Bailey St & Clermont St  Dorchester  MA,8.0,07,4.0,C11,Dorchester,8.0,Ward 17,1711,,INTERSECTION Bailey St & Clermont St,,Intersection,878.0,42.2842,-71.0674,Constituent Call,"(42.2842, -71.0674)"
670229,101001656721,12/02/2015 11:47:00 AM,,,ONTIME,Open,,Transportation General Request,Transportation - Traffic Division,Administrative & General Requests,Transportation General Request,BTDT_Administration,BTDT,,,INTERSECTION of Marlborough St & Massachusetts Ave  Boston  MA,4.0,1C,8.0,D4,Back Bay,14.0,Ward 5,0509,,INTERSECTION Marlborough St & Massachusetts Ave,,Intersection,7105.0,42.35,-71.0891,Constituent Call,"(42.35, -71.0891)"
672530,101001660079,12/07/2015 04:27:00 PM,,,ONTIME,Open,,Transportation General Request,Transportation - Traffic Division,Administrative & General Requests,Transportation General Request,BTDT_Administration,BTDT,,,INTERSECTION of W Concord St & Shawmut Ave  Roxbury  MA,4.0,1C,7.0,D4,South End,6.0,Ward 9,902.0,,INTERSECTION W Concord St & Shawmut Ave,,Intersection,3420.0,42.3387,-71.0759,Constituent Call,"(42.3387, -71.0759)"
675134,101001663909,12/12/2015 04:47:00 PM,,,ONTIME,Open,,Transportation General Request,Transportation - Traffic Division,Administrative & General Requests,Transportation General Request,BTDT_Administration,BTDT,,,INTERSECTION of Columbia Rd & Hamilton St  Dorchester  MA,7.0,03,3.0,C11,Dorchester,8.0,Ward 15,1501.0,,INTERSECTION Columbia Rd & Hamilton St,,Intersection,3225.0,42.3101,-71.0723,Constituent Call,"(42.3101, -71.0723)"
675214,101001664009,12/12/2015 09:59:06 PM,,12/12/2015 09:59:29 PM,ONTIME,Closed,Case Closed. Closed date : 2015-12-12 21:59:29.603 Case Invalid,Transportation General Request,Transportation - Traffic Division,Administrative & General Requests,Transportation General Request,BTDT_Administration,BTDT,,,65 Fairmount Ave  Hyde Park  MA  02136,12.0,08,5.0,E18,Hyde Park,10.0,Ward 18,1818.0,RC,65 Fairmount Ave,2136.0,Address,413480.0,42.3594,-71.0587,Constituent Call,"(0, 0)"
675623,101001664614,12/14/2015 10:49:00 AM,,,ONTIME,Open,,Transportation General Request,Transportation - Traffic Division,Administrative & General Requests,Transportation General Request,BTDT_Administration,BTDT,,,26 Stillman St  Boston  MA  02113,3.0,1B,1.0,A1,Downtown / Financial District,3.0,Ward 3,303.0,CM,26 Stillman St,2113.0,Address,130593.0,42.3637,-71.0568,Constituent Call,"(42.3637, -71.0568)"
676563,101001665908,12/15/2015 02:29:00 PM,,,ONTIME,Open,,Transportation General Request,Transportation - Traffic Division,Administrative & General Requests,Transportation General Request,BTDT_Administration,BTDT,,,3 Hartford Ct  Dorchester  MA  02125,7.0,03,7.0,B2,Roxbury,13.0,Ward 13,1304.0,R1,3 Hartford Ct,2125.0,Address,70193.0,42.3145,-71.0726,Constituent Call,"(42.3145, -71.0726)"
677936,101001678127,12/18/2015 10:16:00 AM,,,ONTIME,Open,,Transportation General Request,Transportation - Traffic Division,Administrative & General Requests,Transportation General Request,BTDT_Administration,BTDT,,,INTERSECTION of Merrimac St & New Chardon St  Boston  MA,3.0,1B,1.0,A1,Downtown / Financial District,3.0,Ward 3,306.0,,INTERSECTION Merrimac St & New Chardon St,,Intersection,7265.0,42.363,-71.0597,Constituent Call,"(42.363, -71.0597)"
678044,101001678322,12/18/2015 01:11:00 PM,,,ONTIME,Open,,Transportation General Request,Transportation - Traffic Division,Administrative & General Requests,Transportation General Request,BTDT_Administration,BTDT,,,329 Bunker Hill St  Charlestown  MA  02129,3.0,1A,1.0,A15,Charlestown,2.0,Ward 2,207.0,RC,329 Bunker Hill St,2129.0,Address,23557.0,42.3813,-71.0671,Constituent Call,"(42.3813, -71.0671)"
678463,101001678864,12/19/2015 06:03:00 PM,,,ONTIME,Open,,Transportation General Request,Transportation - Traffic Division,Administrative & General Requests,Transportation General Request,BTDT_Administration,BTDT,,,INTERSECTION of Charles St S & Stuart St  Boston  MA,4.0,1C,2.0,A1,Downtown / Financial District,6.0,Ward 5,501.0,,INTERSECTION Charles St S & Stuart St,,Intersection,2806.0,42.3509,-71.0669,Constituent Call,"(42.3509, -71.0669)"
679407,101001680379,12/22/2015 11:57:00 AM,,,ONTIME,Open,,Transportation General Request,Transportation - Traffic Division,Administrative & General Requests,Transportation General Request,BTDT_Administration,BTDT,,,INTERSECTION of Cawfield St & Eastman St  Dorchester  MA,7.0,03,7.0,B2,Dorchester,13.0,Ward 7,710.0,,INTERSECTION Cawfield St & Eastman St,,Intersection,2527.0,42.3194,-71.0638,Constituent Call,"(42.3194, -71.0638)"
680050,101001681364,12/23/2015 03:19:25 PM,,12/23/2015 03:20:54 PM,ONTIME,Closed,Case Closed. Closed date : 2015-12-23 15:20:54.767 Case Invalid Incorrect department,Transportation General Request,Transportation - Traffic Division,Administrative & General Requests,Transportation General Request,BTDT_Administration,BTDT,,,328 Newbury St  Boston  MA  02115,4.0,1C,8.0,D4,Back Bay,14.0,Ward 5,509.0,RC,328 Newbury St,2115.0,Address,101549.0,42.3484,-71.0862,Constituent Call,"(42.3484, -71.0862)"
680294,101001681748,12/24/2015 01:14:00 PM,,,ONTIME,Open,,Transportation General Request,Transportation - Traffic Division,Administrative & General Requests,Transportation General Request,BTDT_Administration,BTDT,,,38 Englewood Ave  Brighton  MA  02135,,04,9.0,D14,Allston / Brighton,15.0,Ward 21,2114.0,R3,38 Englewood Ave,2135.0,Address,54048.0,42.3379,-71.1464,Constituent Call,"(42.3379, -71.1464)"
680685,101001682263,12/27/2015 11:32:00 AM,,,ONTIME,Open,,Transportation General Request,Transportation - Traffic Division,Administrative & General Requests,Transportation General Request,BTDT_Administration,BTDT,,,131 E Cottage St  Dorchester  MA  02125,7.0,03,7.0,B2,Dorchester,13.0,Ward 7,710.0,R1,131 E Cottage St,2125.0,Address,43534.0,42.3209,-71.0642,Constituent Call,"(42.3209, -71.0642)"
681630,101001683793,12/29/2015 02:13:00 PM,,,ONTIME,Open,,Transportation General Request,Transportation - Traffic Division,Administrative & General Requests,Transportation General Request,BTDT_Administration,BTDT,,,756 E Fourth St  South Boston  MA  02127,6.0,05,2.0,C6,South Boston / South Boston Waterfront,5.0,Ward 6,607.0,R1,756 E Fourth St,2127.0,Address,59949.0,42.3349,-71.0341,Constituent Call,"(42.3349, -71.0341)"
682162,101001684842,12/30/2015 01:35:00 PM,,,ONTIME,Open,,Transportation General Request,Transportation - Traffic Division,Administrative & General Requests,Transportation General Request,BTDT_Administration,BTDT,,,7-11 Charles St  Boston  MA  02114,3.0,1B,8.0,A1,Beacon Hill,14.0,05,503.0,RC,7-11 Charles St,2114.0,Address,163151.0,42.3565,-71.0693,Constituent Call,"(42.3565, -71.0693)"
