,CASE_ENQUIRY_ID,OPEN_DT,TARGET_DT,CLOSED_DT,OnTime_Status,CASE_STATUS,CLOSURE_REASON,CASE_TITLE,SUBJECT,REASON,TYPE,QUEUE,Department,SubmittedPhoto,ClosedPhoto,Location,fire_district,pwd_district,city_council_district,police_district,neighborhood,neighborhood_services_district,ward,precinct,land_usage,LOCATION_STREET_NAME,LOCATION_ZIPCODE,Property_Type,Property_ID,LATITUDE,LONGITUDE,Source,Geocoded_Location
469574,101001240905,01/02/2015 05:40:16 AM,06/30/2016 05:40:16 AM,01/05/2015 08:59:38 AM,ONTIME,Closed,Case Closed Case Resolved Removed two larg limb from City side walk. Done by Tree Ctew,Tree Maintenance Requests,Parks & Recreation Department,Trees,Tree Maintenance Requests,PARK_Tree Emergencies,PARK,https://cityworker.cityofboston.gov:8443/attachments/report/54a6758bd052065cdb4cccfd/photo/Report.jpg,,680 Beacon St  Boston  MA  02215,4.0,10A,8.0,D4,Fenway / Kenmore / Audubon Circle / Longwood,14.0,Ward 5,510.0,C,680 Beacon St,2215.0,Address,161924.0,42.3487,-71.0984,City Worker App,"(42.3487, -71.0984)"
469597,101001240935,01/02/2015 08:02:30 AM,06/30/2016 08:02:29 AM,01/02/2015 08:06:29 AM,ONTIME,Closed,Case Closed Case Resolved  The tree was pruned by Northern Tree Service  to the City of Boston tree pruning specifications.,Tree Maintenance Requests,Parks & Recreation Department,Trees,Tree Maintenance Requests,PARK_Tree Maintenance Request,PARK,,,341 Tremont St  Boston  MA  02116,4.0,1C,2.0,A1,Back Bay,6.0,Ward 5,501.0,E,341 Tremont St,2116.0,Address,321494.0,42.3487,-71.0672,Employee Generated,"(42.3487, -71.0672)"
469598,101001240937,01/02/2015 08:03:02 AM,06/30/2016 08:03:01 AM,01/02/2015 08:06:29 AM,ONTIME,Closed,Case Closed Case Resolved  The tree was pruned by Northern Tree Service  to the City of Boston tree pruning specifications.,Tree Maintenance Requests,Parks & Recreation Department,Trees,Tree Maintenance Requests,PARK_Tree Maintenance Request,PARK,,,347 Tremont St  Boston  MA  02116,4.0,1C,2.0,A1,Back Bay,6.0,Ward 5,501.0,E,347 Tremont St,2116.0,Address,321506.0,42.3486,-71.0674,Employee Generated,"(42.3486, -71.0674)"
469599,101001240938,01/02/2015 08:03:30 AM,06/30/2016 08:03:29 AM,01/02/2015 08:06:29 AM,ONTIME,Closed,Case Closed Case Resolved  The tree was pruned by Northern Tree Service  to the City of Boston tree pruning specifications.,Tree Maintenance Requests,Parks & Recreation Department,Trees,Tree Maintenance Requests,PARK_Tree Maintenance Request,PARK,,,351 Tremont St  Boston  MA  02116,4.0,1C,2.0,A1,Back Bay,6.0,Ward 5,501.0,E,351 Tremont St,2116.0,Address,321518.0,42.3485,-71.0675,Employee Generated,"(42.3485, -71.0675)"
469612,101001240966,01/02/2015 08:27:16 AM,06/30/2016 08:27:15 AM,01/02/2015 08:27:45 AM,ONTIME,Closed,Case Closed Case Resolved The tree was pruned by Northern Tree Service  to the City of Boston tree pruning specifications.,Tree Maintenance Requests,Parks & Recreation Department,Trees,Tree Maintenance Requests,PARK_Tree Maintenance Request,PARK,,,49 Chestnut St  Boston  MA  02108,3.0,1B,8.0,A1,Beacon Hill,14.0,Ward 5,503.0,R1,49 Chestnut St,2108.0,Address,31431.0,42.3574,-71.0688,Employee Generated,"(42.3574, -71.0688)"
469828,101001241273,01/02/2015 12:17:00 PM,06/30/2016 12:17:15 PM,12/30/2015 01:42:53 PM,ONTIME,Closed,Case Closed. Closed date : 2015-12-30 13:42:53.957 Case Resolved Tree was removed by North-Eastern Tree Service. A new tree request case will be made for this location. If you have any questions please call the Park Line at 617-635-7275.,Tree Maintenance Requests,Parks & Recreation Department,Trees,Tree Maintenance Requests,PARK_Tree Maintenance Request,PARK,,,68 Montclair Ave  Roslindale  MA  02132,9.0,06,6.0,E5,West Roxbury,12.0,Ward 20,2006.0,R1,68 Montclair Ave,2132.0,Address,96527.0,42.2915,-71.1412,Self Service,"(42.2915, -71.1412)"
470708,101001242555,01/05/2015 03:26:18 PM,07/03/2016 03:26:17 PM,01/06/2015 11:03:49 AM,ONTIME,Closed,Case Closed Case Resolved  Removed hanger . Done by Tree Crew.,Tree Maintenance Requests,Parks & Recreation Department,Trees,Tree Maintenance Requests,PARK_Tree Emergencies,PARK,,,INTERSECTION of Grovenor Rd & Pond St  Jamaica Plain  MA,9.0,02,6.0,E13,Jamaica Plain,11.0,Ward 19,1905.0,,INTERSECTION Grovenor Rd & Pond St,,Intersection,5513.0,42.3149,-71.1149,Constituent Call,"(42.3149, -71.1149)"
470899,101001242827,01/06/2015 09:00:52 AM,07/04/2016 09:00:51 AM,07/23/2015 02:02:26 PM,ONTIME,Closed,Case Closed. Closed date : 2015-07-23 14:02:26.08 Case Resolved The tree was pruned by Northern Tree Service  to the City of Boston tree pruning specifications.,Tree Maintenance Requests,Parks & Recreation Department,Trees,Tree Maintenance Requests,PARK_Tree Maintenance Request,PARK,,,741 Beechmont St  Hyde Park  MA  02136,12.0,08,5.0,E18,Hyde Park,10.0,Ward 18,1822.0,R1,741 Beechmont St,2136.0,Address,13426.0,42.2687,-71.127,Employee Generated,"(42.2687, -71.127)"
470901,101001242830,01/06/2015 09:02:26 AM,07/04/2016 09:02:25 AM,07/23/2015 03:02:31 PM,ONTIME,Closed,Case Closed. Closed date : 2015-07-23 15:02:31.937 Case Resolved The tree was pruned by Northern Tree Service  to the City of Boston tree pruning specifications.,Tree Maintenance Requests,Parks & Recreation Department,Trees,Tree Maintenance Requests,PARK_Tree Maintenance Request,PARK,,,46 Joan Rd  Hyde Park  MA  02136,12.0,08,5.0,E18,Hyde Park,10.0,Ward 18,1819.0,R1,46 Joan Rd,2136.0,Address,79819.0,42.2524,-71.1441,Employee Generated,"(42.2524, -71.1441)"
470906,101001242836,01/06/2015 09:04:02 AM,07/04/2016 09:04:01 AM,09/28/2015 07:18:45 AM,ONTIME,Closed,Case Closed. Closed date : 2015-09-28 07:18:45.147 Case Resolved The tree was pruned by Northern Tree Service  to the City of Boston tree pruning specifications.,Tree Maintenance Requests,Parks & Recreation Department,Trees,Tree Maintenance Requests,PARK_Tree Maintenance Request,PARK,,,19 Dodge Rd  Hyde Park  MA  02136,10.0,08,5.0,E-18,Hyde Park,10.0,Ward 18,1819.0,,19 Dodge Rd,2136.0,Address,99531.0,42.3594,-71.0587,Employee Generated,"(0, 0)"
470920,101001242858,01/06/2015 09:18:31 AM,07/04/2016 09:18:20 AM,04/01/2015 09:18:41 AM,ONTIME,Closed,Case Closed Case Resolved The tree was pruned by Northern Tree Service  to the City of Boston tree pruning specifications.,Tree Maintenance Requests,Parks & Recreation Department,Trees,Tree Maintenance Requests,PARK_Tree Maintenance Request,PARK,,,121-127 Main St  Charlestown  MA  02129,3.0,1A,1.0,A15,Charlestown,2.0,Ward 2,201.0,CM,121-127 Main St,2129.0,Address,88408.0,42.3745,-71.0634,Constituent Call,"(42.3745, -71.0634)"
471131,101001243174,01/06/2015 02:30:36 PM,07/04/2016 02:30:35 PM,06/02/2015 09:09:21 AM,ONTIME,Closed,Case Closed. Closed date : 2015-06-02 09:09:21.09 Case Resolved The tree was pruned by Northern Tree Service  to the City of Boston tree pruning specifications.,Tree Maintenance Requests,Parks & Recreation Department,Trees,Tree Maintenance Requests,PARK_Tree Maintenance Request,PARK,,,450 Shawmut Ave  Roxbury  MA  02118,4.0,1C,2.0,D4,South End,6.0,Ward 9,901.0,R1,450 Shawmut Ave,2118.0,Address,126306.0,42.3392,-71.0749,Employee Generated,"(42.3392, -71.0749)"
471213,101001243282,01/06/2015 04:12:09 PM,07/04/2016 04:12:09 PM,01/08/2015 01:32:13 PM,ONTIME,Closed,Case Closed Case Resolved Remove limb from City street .Done by Tree Crew.,Tree Maintenance Requests,Parks & Recreation Department,Trees,Tree Maintenance Requests,PARK_Tree Emergencies,PARK,https://cityworker.cityofboston.gov:8443/attachments/report/54ac4fa5d052065cdb4cf75d/photo/Report.jpg,,34-36 Williams Ave  Hyde Park  MA  02136,12.0,08,5.0,E18,Hyde Park,10.0,Ward 18,1816.0,R1,34-36 Williams Ave,2136.0,Address,149993.0,42.2503,-71.1181,City Worker App,"(42.2503, -71.1181)"
471327,101001243427,01/07/2015 07:43:11 AM,07/05/2016 07:43:11 AM,01/07/2015 09:55:57 AM,ONTIME,Closed,Case Closed Case Noted duplicate of 1243428,Tree Maintenance Requests,Parks & Recreation Department,Trees,Tree Maintenance Requests,PARK_Tree Maintenance Request,PARK,https://cityworker.cityofboston.gov:8443/attachments/report/54ad29ddd052065cdb4cf854/photo/Report.jpg,,22 Codman Hill Ave  Dorchester  MA  02124,8.0,07,3.0,B3,Dorchester,7.0,Ward 17,1704.0,R2,22 Codman Hill Ave,2124.0,Address,34134.0,42.2795,-71.0714,City Worker App,"(42.2795, -71.0714)"
471328,101001243428,01/07/2015 07:43:13 AM,07/05/2016 07:43:13 AM,01/08/2015 07:46:29 AM,ONTIME,Closed,Case Closed Duplicate of Existing Case  Duplicate of case # 1243338,Tree Maintenance Requests,Parks & Recreation Department,Trees,Tree Maintenance Requests,PARK_Tree Emergencies,PARK,https://cityworker.cityofboston.gov:8443/attachments/report/54ad29ded052065cdb4cf864/photo/Report.jpg,,22 Codman Hill Ave  Dorchester  MA  02124,8.0,07,3.0,B3,Dorchester,7.0,Ward 17,1704.0,R2,22 Codman Hill Ave,2124.0,Address,34134.0,42.2795,-71.0714,City Worker App,"(42.2795, -71.0714)"
471458,101001243613,01/07/2015 11:52:10 AM,07/05/2016 11:52:10 AM,07/06/2015 08:41:43 AM,ONTIME,Closed,Case Closed. Closed date : 2015-07-06 08:41:43.95 Case Resolved Tree was removed by North-Eastern Tree Service. A new tree request case will be made for this location. If you have any questions please call the Park Line at 617-635-7275.,Tree Maintenance Requests,Parks & Recreation Department,Trees,Tree Maintenance Requests,PARK_Tree Maintenance Request,PARK,https://cityworker.cityofboston.gov:8443/attachments/report/54ad6437d052065cdb4cfda4/photo/Report.jpg,,1 City Sq  Charlestown  MA  02129,3.0,1A,1.0,A15,Charlestown,2.0,02,201.0,E,1 City Sq,2129.0,Address,340818.0,42.372,-71.0625,City Worker App,"(42.372, -71.0625)"
471459,101001243614,01/07/2015 11:53:03 AM,07/05/2016 11:53:03 AM,07/06/2015 08:41:56 AM,ONTIME,Closed,Case Closed. Closed date : 2015-07-06 08:41:56.717 Case Resolved Tree was removed by North-Eastern Tree Service. A new tree request case will be made for this location. If you have any questions please call the Park Line at 617-635-7275.,Tree Maintenance Requests,Parks & Recreation Department,Trees,Tree Maintenance Requests,PARK_Tree Maintenance Request,PARK,https://cityworker.cityofboston.gov:8443/attachments/report/54ad646ad052065cdb4cfdb4/photo/Report.jpg,,1 City Sq  Charlestown  MA  02129,3.0,1A,1.0,A15,Charlestown,2.0,02,201.0,E,1 City Sq,2129.0,Address,340818.0,42.372,-71.0625,City Worker App,"(42.372, -71.0625)"
471667,101001243937,01/08/2015 08:25:29 AM,07/06/2016 08:25:27 AM,,ONTIME,Open,,Tree Maintenance Requests,Parks & Recreation Department,Trees,Tree Maintenance Requests,PARK_Tree Maintenance Request,PARK,,,867 Washington St  Dorchester  MA  02124,8.0,07,3.0,C11,Dorchester,7.0,Ward 17,1704.0,R3,867 Washington St,2124.0,Address,146206.0,42.2815,-71.0713,Employee Generated,"(42.2815, -71.0713)"
471703,101001243997,01/08/2015 09:30:18 AM,07/06/2016 09:25:03 AM,05/31/2015 09:15:21 AM,ONTIME,Closed,Case Closed. Closed date : 2015-05-31 09:15:21.8 Case Resolved Tree was removed by North-Eastern Tree Service. A new tree request case will be made for this location. If you have any questions please call the Park Line at 617-635-7275.,Tree Maintenance Requests,Parks & Recreation Department,Trees,Tree Maintenance Requests,PARK_Tree Maintenance Request,PARK,,,891-893 Washington St  Dorchester  MA  02124,8.0,07,3.0,C11,Dorchester,7.0,Ward 17,1704.0,R2,891-893 Washington St,2124.0,Address,146215.0,42.2805,-71.0708,Employee Generated,"(42.2805, -71.0708)"
471728,101001244031,01/08/2015 10:06:27 AM,07/06/2016 10:06:26 AM,05/12/2015 08:58:46 AM,ONTIME,Closed,Case Closed. Closed date : 2015-05-12 08:58:46.043 Case Resolved The tree was pruned by Northern Tree Service  to the City of Boston tree pruning specifications.,Tree Maintenance Requests,Parks & Recreation Department,Trees,Tree Maintenance Requests,PARK_Tree Maintenance Request,PARK,,,103 Rutherford Ave  Charlestown  MA  02129,3.0,1A,1.0,A15,Charlestown,2.0,Ward 2,201.0,CM,103 Rutherford Ave,2129.0,Address,169365.0,42.3737,-71.0645,Employee Generated,"(42.3737, -71.0645)"
471729,101001244032,01/08/2015 10:06:58 AM,07/06/2016 10:06:58 AM,05/12/2015 08:59:21 AM,ONTIME,Closed,Case Closed. Closed date : 2015-05-12 08:59:21.88 Case Resolved The tree was pruned by Northern Tree Service  to the City of Boston tree pruning specifications.,Tree Maintenance Requests,Parks & Recreation Department,Trees,Tree Maintenance Requests,PARK_Tree Maintenance Request,PARK,,,110 Rutherford Ave  Charlestown  MA  02129,3.0,1A,1.0,A15,Charlestown,2.0,Ward 2,201.0,E,110 Rutherford Ave,2129.0,Address,174250.0,42.3736,-71.0649,Employee Generated,"(42.3736, -71.0649)"
471730,101001244033,01/08/2015 10:07:30 AM,07/06/2016 10:07:30 AM,05/12/2015 08:59:03 AM,ONTIME,Closed,Case Closed. Closed date : 2015-05-12 08:59:03.73 Case Noted The tree was pruned by Northern Tree Service  to the City of Boston tree pruning specifications.,Tree Maintenance Requests,Parks & Recreation Department,Trees,Tree Maintenance Requests,PARK_Tree Maintenance Request,PARK,,,107 Rutherford Ave  Charlestown  MA  02129,3.0,1A,1.0,A15,Charlestown,2.0,Ward 2,201.0,R3,107 Rutherford Ave,2129.0,Address,119930.0,42.3738,-71.0647,Employee Generated,"(42.3738, -71.0647)"
471731,101001244034,01/08/2015 10:09:40 AM,07/06/2016 10:09:39 AM,05/12/2015 08:59:39 AM,ONTIME,Closed,Case Closed. Closed date : 2015-05-12 08:59:39.673 Case Resolved The tree was pruned by Northern Tree Service  to the City of Boston tree pruning specifications.,Tree Maintenance Requests,Parks & Recreation Department,Trees,Tree Maintenance Requests,PARK_Tree Maintenance Request,PARK,,,114 Rutherford Ave  Charlestown  MA  02129,3.0,1A,1.0,A15,Charlestown,2.0,Ward 2,201.0,E,114 Rutherford Ave,2129.0,Address,174251.0,42.3737,-71.0651,Employee Generated,"(42.3737, -71.0651)"
471733,101001244036,01/08/2015 10:10:15 AM,07/06/2016 10:10:14 AM,05/12/2015 08:59:58 AM,ONTIME,Closed,Case Closed. Closed date : 2015-05-12 08:59:58.117 Case Resolved The tree was pruned by Northern Tree Service  to the City of Boston tree pruning specifications.,Tree Maintenance Requests,Parks & Recreation Department,Trees,Tree Maintenance Requests,PARK_Tree Maintenance Request,PARK,,,114 Rutherford Ave  Charlestown  MA  02129,3.0,1A,1.0,A15,Charlestown,2.0,Ward 2,201.0,E,114 Rutherford Ave,2129.0,Address,174251.0,42.3737,-71.0651,Employee Generated,"(42.3737, -71.0651)"
471735,101001244038,01/08/2015 10:11:22 AM,07/06/2016 10:11:21 AM,04/01/2015 09:26:21 AM,ONTIME,Closed,Case Closed Case Resolved The tree was pruned by Northern Tree Service  to the City of Boston tree pruning specifications.,Tree Maintenance Requests,Parks & Recreation Department,Trees,Tree Maintenance Requests,PARK_Tree Maintenance Request,PARK,,,31 Union St  Charlestown  MA  02129,3.0,1A,1.0,A15,Charlestown,2.0,Ward 2,201.0,CM,31 Union St,2129.0,Address,139326.0,42.374,-71.065,Employee Generated,"(42.374, -71.065)"
471737,101001244040,01/08/2015 10:12:01 AM,07/06/2016 10:11:56 AM,04/01/2015 09:26:37 AM,ONTIME,Closed,Case Closed Case Resolved The tree was pruned by Northern Tree Service  to the City of Boston tree pruning specifications.,Tree Maintenance Requests,Parks & Recreation Department,Trees,Tree Maintenance Requests,PARK_Tree Maintenance Request,PARK,,,31 Union St  Charlestown  MA  02129,3.0,1A,1.0,A15,Charlestown,2.0,Ward 2,201.0,CM,31 Union St,2129.0,Address,139326.0,42.374,-71.065,Employee Generated,"(42.374, -71.065)"
471738,101001244041,01/08/2015 10:12:25 AM,07/06/2016 10:12:24 AM,04/01/2015 09:26:55 AM,ONTIME,Closed,Case Closed Case Resolved The tree was pruned by Northern Tree Service  to the City of Boston tree pruning specifications.,Tree Maintenance Requests,Parks & Recreation Department,Trees,Tree Maintenance Requests,PARK_Tree Maintenance Request,PARK,,,31 Union St  Charlestown  MA  02129,3.0,1A,1.0,A15,Charlestown,2.0,Ward 2,201.0,CM,31 Union St,2129.0,Address,139326.0,42.374,-71.065,Employee Generated,"(42.374, -71.065)"
471740,101001244043,01/08/2015 10:13:17 AM,07/06/2016 10:13:16 AM,04/01/2015 09:42:46 AM,ONTIME,Closed,Case Closed Case Resolved The tree was pruned by Northern Tree Service  to the City of Boston tree pruning specifications.,Tree Maintenance Requests,Parks & Recreation Department,Trees,Tree Maintenance Requests,PARK_Tree Maintenance Request,PARK,,,85 Washington St  Charlestown  MA  02129,3.0,1A,1.0,A15,Charlestown,2.0,Ward 2,201.0,E,85 Washington St,2129.0,Address,171023.0,42.3741,-71.0664,Employee Generated,"(42.3741, -71.0664)"
471744,101001244047,01/08/2015 10:15:29 AM,07/06/2016 10:15:27 AM,04/01/2015 09:43:06 AM,ONTIME,Closed,Case Closed Case Resolved The tree was pruned by Northern Tree Service  to the City of Boston tree pruning specifications.,Tree Maintenance Requests,Parks & Recreation Department,Trees,Tree Maintenance Requests,PARK_Tree Maintenance Request,PARK,,,85 Washington St  Charlestown  MA  02129,3.0,1A,1.0,A15,Charlestown,2.0,Ward 2,201.0,E,85 Washington St,2129.0,Address,171023.0,42.3741,-71.0664,Employee Generated,"(42.3741, -71.0664)"
471746,101001244049,01/08/2015 10:15:50 AM,07/06/2016 10:15:49 AM,04/01/2015 09:43:26 AM,ONTIME,Closed,Case Closed Case Resolved The tree was pruned by Northern Tree Service  to the City of Boston tree pruning specifications.,Tree Maintenance Requests,Parks & Recreation Department,Trees,Tree Maintenance Requests,PARK_Tree Maintenance Request,PARK,,,85 Washington St  Charlestown  MA  02129,3.0,1A,1.0,A15,Charlestown,2.0,Ward 2,201.0,E,85 Washington St,2129.0,Address,171023.0,42.3741,-71.0664,Employee Generated,"(42.3741, -71.0664)"
471747,101001244050,01/08/2015 10:16:22 AM,07/06/2016 10:16:21 AM,04/01/2015 09:43:47 AM,ONTIME,Closed,Case Closed Case Resolved The tree was pruned by Northern Tree Service  to the City of Boston tree pruning specifications.,Tree Maintenance Requests,Parks & Recreation Department,Trees,Tree Maintenance Requests,PARK_Tree Maintenance Request,PARK,,,85 Washington St  Charlestown  MA  02129,3.0,1A,1.0,A15,Charlestown,2.0,Ward 2,201.0,E,85 Washington St,2129.0,Address,171023.0,42.3741,-71.0664,Employee Generated,"(42.3741, -71.0664)"
471748,101001244051,01/08/2015 10:16:47 AM,07/06/2016 10:16:46 AM,04/01/2015 09:44:12 AM,ONTIME,Closed,Case Closed Case Resolved The tree was pruned by Northern Tree Service  to the City of Boston tree pruning specifications.,Tree Maintenance Requests,Parks & Recreation Department,Trees,Tree Maintenance Requests,PARK_Tree Maintenance Request,PARK,,,85 Washington St  Charlestown  MA  02129,3.0,1A,1.0,A15,Charlestown,2.0,Ward 2,201.0,E,85 Washington St,2129.0,Address,171023.0,42.3741,-71.0664,Employee Generated,"(42.3741, -71.0664)"
471750,101001244053,01/08/2015 10:17:08 AM,07/06/2016 10:17:07 AM,04/01/2015 09:44:30 AM,ONTIME,Closed,Case Closed Case Resolved The tree was pruned by Northern Tree Service  to the City of Boston tree pruning specifications.,Tree Maintenance Requests,Parks & Recreation Department,Trees,Tree Maintenance Requests,PARK_Tree Maintenance Request,PARK,,,85 Washington St  Charlestown  MA  02129,3.0,1A,1.0,A15,Charlestown,2.0,Ward 2,201.0,E,85 Washington St,2129.0,Address,171023.0,42.3741,-71.0664,Employee Generated,"(42.3741, -71.0664)"
471751,101001244054,01/08/2015 10:17:41 AM,07/06/2016 10:17:40 AM,04/01/2015 09:44:49 AM,ONTIME,Closed,Case Closed Case Resolved The tree was pruned by Northern Tree Service  to the City of Boston tree pruning specifications.,Tree Maintenance Requests,Parks & Recreation Department,Trees,Tree Maintenance Requests,PARK_Tree Maintenance Request,PARK,,,85 Washington St  Charlestown  MA  02129,3.0,1A,1.0,A15,Charlestown,2.0,Ward 2,201.0,E,85 Washington St,2129.0,Address,171023.0,42.3741,-71.0664,Employee Generated,"(42.3741, -71.0664)"
471775,101001244090,01/08/2015 10:56:26 AM,07/06/2016 10:56:25 AM,04/01/2015 09:45:13 AM,ONTIME,Closed,Case Closed Case Resolved The tree was pruned by Northern Tree Service  to the City of Boston tree pruning specifications.,Tree Maintenance Requests,Parks & Recreation Department,Trees,Tree Maintenance Requests,PARK_Tree Maintenance Request,PARK,,,86 Washington St  Charlestown  MA  02129,3.0,1A,1.0,A15,Charlestown,2.0,Ward 2,201.0,R2,86 Washington St,2129.0,Address,145859.0,42.3739,-71.067,Employee Generated,"(42.3739, -71.067)"
471776,101001244092,01/08/2015 10:57:22 AM,07/06/2016 10:57:20 AM,04/01/2015 09:45:30 AM,ONTIME,Closed,Case Closed Case Resolved The tree was pruned by Northern Tree Service  to the City of Boston tree pruning specifications.,Tree Maintenance Requests,Parks & Recreation Department,Trees,Tree Maintenance Requests,PARK_Tree Maintenance Request,PARK,,,86 Washington St  Charlestown  MA  02129,3.0,1A,1.0,A15,Charlestown,2.0,Ward 2,201.0,R2,86 Washington St,2129.0,Address,145859.0,42.3739,-71.067,Employee Generated,"(42.3739, -71.067)"
471777,101001244093,01/08/2015 10:58:08 AM,07/06/2016 10:58:07 AM,04/01/2015 09:42:28 AM,ONTIME,Closed,Case Closed Case Resolved The tree was pruned by Northern Tree Service  to the City of Boston tree pruning specifications.,Tree Maintenance Requests,Parks & Recreation Department,Trees,Tree Maintenance Requests,PARK_Tree Maintenance Request,PARK,,,84 Washington St  Charlestown  MA  02129,3.0,1A,1.0,A15,Charlestown,2.0,Ward 2,201.0,CM,84 Washington St,2129.0,Address,145856.0,42.3738,-71.0669,Employee Generated,"(42.3738, -71.0669)"
471778,101001244094,01/08/2015 10:58:37 AM,07/06/2016 10:58:36 AM,04/01/2015 09:42:09 AM,ONTIME,Closed,Case Closed Case Resolved The tree was pruned by Northern Tree Service  to the City of Boston tree pruning specifications.,Tree Maintenance Requests,Parks & Recreation Department,Trees,Tree Maintenance Requests,PARK_Tree Maintenance Request,PARK,,,82 Washington St  Charlestown  MA  02129,3.0,1A,1.0,A15,Charlestown,2.0,Ward 2,201.0,R1,82 Washington St,2129.0,Address,145855.0,42.3738,-71.0669,Employee Generated,"(42.3738, -71.0669)"
471779,101001244095,01/08/2015 10:59:07 AM,07/06/2016 10:59:06 AM,04/01/2015 09:41:47 AM,ONTIME,Closed,Case Closed Case Resolved The tree was pruned by Northern Tree Service  to the City of Boston tree pruning specifications.,Tree Maintenance Requests,Parks & Recreation Department,Trees,Tree Maintenance Requests,PARK_Tree Maintenance Request,PARK,,,78 Washington St  Charlestown  MA  02129,3.0,1A,1.0,A15,Charlestown,2.0,Ward 2,201.0,CM,78 Washington St,2129.0,Address,145849.0,42.3737,-71.0667,Employee Generated,"(42.3737, -71.0667)"
471781,101001244097,01/08/2015 10:59:56 AM,07/06/2016 10:59:55 AM,01/08/2015 11:00:53 AM,ONTIME,Closed,Case Closed Case Resolved Tree was pruned by tree crew.,Tree Maintenance Requests,Parks & Recreation Department,Trees,Tree Maintenance Requests,PARK_Tree Maintenance Request,PARK,,,155 K St  South Boston  MA  02127,6.0,05,2.0,C6,South Boston / South Boston Waterfront,5.0,06,605.0,R1,155 K St,2127.0,Address,80451.0,42.3376,-71.0376,Employee Generated,"(42.3376, -71.0376)"
471782,101001244098,01/08/2015 11:00:01 AM,07/06/2016 11:00:00 AM,04/01/2015 09:41:28 AM,ONTIME,Closed,Case Closed Case Resolved The tree was pruned by Northern Tree Service  to the City of Boston tree pruning specifications.,Tree Maintenance Requests,Parks & Recreation Department,Trees,Tree Maintenance Requests,PARK_Tree Maintenance Request,PARK,,,76 Washington St  Charlestown  MA  02129,3.0,1A,1.0,A15,Charlestown,2.0,Ward 2,201.0,CM,76 Washington St,2129.0,Address,145846.0,42.3737,-71.0666,Employee Generated,"(42.3737, -71.0666)"
471877,101001244226,01/08/2015 12:40:50 PM,07/06/2016 12:40:49 PM,04/01/2015 09:41:08 AM,ONTIME,Closed,Case Closed Case Resolved The tree was pruned by Northern Tree Service  to the City of Boston tree pruning specifications.,Tree Maintenance Requests,Parks & Recreation Department,Trees,Tree Maintenance Requests,PARK_Tree Maintenance Request,PARK,,,74 Washington St  Charlestown  MA,,,0.0,,Charlestown,0.0,02,,,74 Washington St,,Address,349233.0,42.3594,-71.0587,Employee Generated,"(0, 0)"
471880,101001244229,01/08/2015 12:41:28 PM,07/06/2016 12:41:28 PM,04/01/2015 09:40:46 AM,ONTIME,Closed,Case Closed Case Resolved The tree was pruned by Northern Tree Service  to the City of Boston tree pruning specifications.,Tree Maintenance Requests,Parks & Recreation Department,Trees,Tree Maintenance Requests,PARK_Tree Maintenance Request,PARK,,,72 Washington St  Charlestown  MA  02129,3.0,1A,1.0,A15,Charlestown,2.0,Ward 2,201.0,R3,72 Washington St,2129.0,Address,145844.0,42.3736,-71.0664,Employee Generated,"(42.3736, -71.0664)"
471881,101001244230,01/08/2015 12:41:54 PM,07/06/2016 12:41:53 PM,04/01/2015 09:40:29 AM,ONTIME,Closed,Case Closed Case Resolved The tree was pruned by Northern Tree Service  to the City of Boston tree pruning specifications.,Tree Maintenance Requests,Parks & Recreation Department,Trees,Tree Maintenance Requests,PARK_Tree Maintenance Request,PARK,,,66 Washington St  Charlestown  MA  02129,3.0,1A,1.0,A15,Charlestown,2.0,Ward 2,201.0,E,66 Washington St,2129.0,Address,332189.0,42.3735,-71.0662,Employee Generated,"(42.3735, -71.0662)"
471885,101001244237,01/08/2015 12:49:11 PM,07/06/2016 12:49:11 PM,04/01/2015 09:39:29 AM,ONTIME,Closed,Case Closed Case Resolved The tree was pruned by Northern Tree Service  to the City of Boston tree pruning specifications.,Tree Maintenance Requests,Parks & Recreation Department,Trees,Tree Maintenance Requests,PARK_Tree Maintenance Request,PARK,,,62 Washington St  Charlestown  MA  02129,3.0,1A,1.0,A15,Charlestown,2.0,Ward 2,201.0,E,62 Washington St,2129.0,Address,332185.0,42.3735,-71.0662,Employee Generated,"(42.3735, -71.0662)"
471886,101001244238,01/08/2015 12:49:31 PM,07/06/2016 12:49:30 PM,04/01/2015 09:39:49 AM,ONTIME,Closed,Case Closed Case Resolved The tree was pruned by Northern Tree Service  to the City of Boston tree pruning specifications.,Tree Maintenance Requests,Parks & Recreation Department,Trees,Tree Maintenance Requests,PARK_Tree Maintenance Request,PARK,,,62 Washington St  Charlestown  MA  02129,3.0,1A,1.0,A15,Charlestown,2.0,Ward 2,201.0,E,62 Washington St,2129.0,Address,332185.0,42.3735,-71.0662,Employee Generated,"(42.3735, -71.0662)"
471887,101001244239,01/08/2015 12:50:11 PM,07/06/2016 12:50:10 PM,04/01/2015 09:38:43 AM,ONTIME,Closed,Case Closed Case Resolved The tree was pruned by Northern Tree Service  to the City of Boston tree pruning specifications.,Tree Maintenance Requests,Parks & Recreation Department,Trees,Tree Maintenance Requests,PARK_Tree Maintenance Request,PARK,,,58 Washington St  Charlestown  MA  02129,3.0,1A,1.0,A15,Charlestown,2.0,Ward 2,201.0,E,58 Washington St,2129.0,Address,332181.0,42.3735,-71.0662,Employee Generated,"(42.3735, -71.0662)"
471903,101001244265,01/08/2015 01:02:37 PM,07/06/2016 01:02:37 PM,09/08/2015 10:57:52 AM,ONTIME,Closed,Case Closed. Closed date : 2015-09-08 10:57:52.647 Case Resolved The new tree was planted by Leahy Landscaping in the Spring of 2015. The tree is under warranty until Spring 2017.,Tree Maintenance Requests,Parks & Recreation Department,Trees,Tree Maintenance Requests,PARK_New Tree Requests,PARK,https://cityworker.cityofboston.gov:8443/attachments/report/54aec637d052065cdb4d0545/photo/Report.jpg,,195 Boston St  Dorchester  MA  02125,6.0,03,2.0,C6,Dorchester,5.0,Ward 7,708.0,E,195 Boston St,2125.0,Address,17127.0,42.3233,-71.0609,City Worker App,"(42.3233, -71.0609)"
471908,101001244270,01/08/2015 01:06:21 PM,07/06/2016 01:06:20 PM,04/01/2015 09:40:07 AM,ONTIME,Closed,Case Closed Case Resolved The tree was pruned by Northern Tree Service  to the City of Boston tree pruning specifications.,Tree Maintenance Requests,Parks & Recreation Department,Trees,Tree Maintenance Requests,PARK_Tree Maintenance Request,PARK,,,63 Washington St  Charlestown  MA  02129,3.0,1A,1.0,A15,Charlestown,2.0,Ward 2,201.0,R1,63 Washington St,2129.0,Address,145842.0,42.3736,-71.0658,Employee Generated,"(42.3736, -71.0658)"
471911,101001244274,01/08/2015 01:09:57 PM,07/06/2016 01:09:56 PM,04/01/2015 09:39:04 AM,ONTIME,Closed,Case Closed Case Resolved The tree was pruned by Northern Tree Service  to the City of Boston tree pruning specifications.,Tree Maintenance Requests,Parks & Recreation Department,Trees,Tree Maintenance Requests,PARK_Tree Maintenance Request,PARK,,,59-59HF Washington St  Charlestown  MA  02129,,,0.0,,Charlestown,0.0,02,,,59-59HF Washington St,2129.0,Address,348190.0,42.3594,-71.0587,Employee Generated,"(0, 0)"
471912,101001244275,01/08/2015 01:11:00 PM,07/06/2016 01:11:00 PM,04/01/2015 09:37:30 AM,ONTIME,Closed,Case Closed Case Resolved The tree was pruned by Northern Tree Service  to the City of Boston tree pruning specifications.,Tree Maintenance Requests,Parks & Recreation Department,Trees,Tree Maintenance Requests,PARK_Tree Maintenance Request,PARK,,,54 Washington St  Charlestown  MA  02129,3.0,1A,1.0,A15,Charlestown,2.0,Ward 2,201.0,E,54 Washington St,2129.0,Address,332177.0,42.3735,-71.0662,Employee Generated,"(42.3735, -71.0662)"
471914,101001244277,01/08/2015 01:11:23 PM,07/06/2016 01:11:22 PM,04/01/2015 09:37:53 AM,ONTIME,Closed,Case Closed Case Resolved The tree was pruned by Northern Tree Service  to the City of Boston tree pruning specifications.,Tree Maintenance Requests,Parks & Recreation Department,Trees,Tree Maintenance Requests,PARK_Tree Maintenance Request,PARK,,,54 Washington St  Charlestown  MA  02129,3.0,1A,1.0,A15,Charlestown,2.0,Ward 2,201.0,E,54 Washington St,2129.0,Address,332177.0,42.3735,-71.0662,Employee Generated,"(42.3735, -71.0662)"
471927,101001244293,01/08/2015 01:24:47 PM,07/06/2016 01:24:46 PM,04/01/2015 09:36:30 AM,ONTIME,Closed,Case Closed Case Resolved,Tree Maintenance Requests,Parks & Recreation Department,Trees,Tree Maintenance Requests,PARK_Tree Maintenance Request,PARK,,,48 Washington St  Charlestown  MA  02129,3.0,1A,1.0,A15,Charlestown,2.0,Ward 2,201.0,R1,48 Washington St,2129.0,Address,145833.0,42.3732,-71.0653,Employee Generated,"(42.3732, -71.0653)"
471928,101001244294,01/08/2015 01:25:23 PM,07/06/2016 01:25:20 PM,04/01/2015 09:35:46 AM,ONTIME,Closed,Case Closed Case Resolved The tree was pruned by Northern Tree Service  to the City of Boston tree pruning specifications.,Tree Maintenance Requests,Parks & Recreation Department,Trees,Tree Maintenance Requests,PARK_Tree Maintenance Request,PARK,,,46 Washington St  Charlestown  MA  02129,3.0,1A,1.0,A15,Charlestown,2.0,Ward 2,201.0,R3,46 Washington St,2129.0,Address,145832.0,42.3731,-71.0653,Employee Generated,"(42.3731, -71.0653)"
471929,101001244295,01/08/2015 01:26:08 PM,07/06/2016 01:26:07 PM,04/01/2015 09:34:38 AM,ONTIME,Closed,Case Closed Case Resolved The tree was pruned by Northern Tree Service  to the City of Boston tree pruning specifications.,Tree Maintenance Requests,Parks & Recreation Department,Trees,Tree Maintenance Requests,PARK_Tree Maintenance Request,PARK,,,35 Washington St  Charlestown  MA  02129,3.0,1A,1.0,A15,Charlestown,2.0,Ward 2,201.0,R3,35 Washington St,2129.0,Address,145814.0,42.3732,-71.0648,Employee Generated,"(42.3732, -71.0648)"
471936,101001244302,01/08/2015 01:32:07 PM,07/06/2016 01:32:06 PM,04/01/2015 09:33:51 AM,ONTIME,Closed,Case Closed Case Resolved The tree was pruned by Northern Tree Service  to the City of Boston tree pruning specifications.,Tree Maintenance Requests,Parks & Recreation Department,Trees,Tree Maintenance Requests,PARK_Tree Maintenance Request,PARK,,,33 Washington St  Charlestown  MA  02129,3.0,1A,1.0,A15,Charlestown,2.0,Ward 2,201.0,CM,33 Washington St,2129.0,Address,145804.0,42.3732,-71.0648,Employee Generated,"(42.3732, -71.0648)"
471938,101001244305,01/08/2015 01:32:44 PM,07/06/2016 01:32:42 PM,04/01/2015 09:34:08 AM,ONTIME,Closed,Case Closed Case Resolved The tree was pruned by Northern Tree Service  to the City of Boston tree pruning specifications.,Tree Maintenance Requests,Parks & Recreation Department,Trees,Tree Maintenance Requests,PARK_Tree Maintenance Request,PARK,,,34 Washington St  Charlestown  MA  02129,3.0,1A,1.0,A15,Charlestown,2.0,Ward 2,201.0,CD,34 Washington St,2129.0,Address,145813.0,42.3729,-71.0648,Employee Generated,"(42.3729, -71.0648)"
471939,101001244306,01/08/2015 01:33:17 PM,07/06/2016 01:33:14 PM,04/01/2015 09:33:17 AM,ONTIME,Closed,Case Closed Case Resolved The tree was pruned by Northern Tree Service  to the City of Boston tree pruning specifications.,Tree Maintenance Requests,Parks & Recreation Department,Trees,Tree Maintenance Requests,PARK_Tree Maintenance Request,PARK,,,31 Washington St  Charlestown  MA  02129,3.0,1A,1.0,A15,Charlestown,2.0,Ward 2,201.0,CM,31 Washington St,2129.0,Address,145797.0,42.3731,-71.0647,Employee Generated,"(42.3731, -71.0647)"
471940,101001244307,01/08/2015 01:33:43 PM,07/06/2016 01:33:42 PM,04/01/2015 09:32:25 AM,ONTIME,Closed,Case Closed Case Resolved The tree was pruned by Northern Tree Service  to the City of Boston tree pruning specifications.,Tree Maintenance Requests,Parks & Recreation Department,Trees,Tree Maintenance Requests,PARK_Tree Maintenance Request,PARK,,,29 Washington St  Charlestown  MA  02129,3.0,1A,1.0,A15,Charlestown,2.0,Ward 2,201.0,R2,29 Washington St,2129.0,Address,145789.0,42.3731,-71.0646,Employee Generated,"(42.3731, -71.0646)"
471941,101001244308,01/08/2015 01:34:09 PM,07/06/2016 01:34:08 PM,04/01/2015 09:33:34 AM,ONTIME,Closed,Case Closed Case Resolved The tree was pruned by Northern Tree Service  to the City of Boston tree pruning specifications.,Tree Maintenance Requests,Parks & Recreation Department,Trees,Tree Maintenance Requests,PARK_Tree Maintenance Request,PARK,,,32 Washington St  Charlestown  MA  02129,3.0,1A,1.0,A15,Charlestown,2.0,Ward 2,201.0,CD,32 Washington St,2129.0,Address,145800.0,42.3729,-71.0647,Employee Generated,"(42.3729, -71.0647)"
471942,101001244309,01/08/2015 01:34:45 PM,07/06/2016 01:34:44 PM,04/01/2015 09:32:04 AM,ONTIME,Closed,Case Closed Case Noted The tree was pruned by Northern Tree Service  to the City of Boston tree pruning specifications.,Tree Maintenance Requests,Parks & Recreation Department,Trees,Tree Maintenance Requests,PARK_Tree Maintenance Request,PARK,,,28 Washington St  Charlestown  MA  02129,3.0,1A,1.0,A15,Charlestown,2.0,Ward 2,201.0,R1,28 Washington St,2129.0,Address,145788.0,42.3728,-71.0645,Employee Generated,"(42.3728, -71.0645)"
471964,101001244340,01/08/2015 02:14:33 PM,07/06/2016 02:14:32 PM,04/01/2015 09:31:42 AM,ONTIME,Closed,Case Closed Case Resolved The tree was pruned by Northern Tree Service  to the City of Boston tree pruning specifications.,Tree Maintenance Requests,Parks & Recreation Department,Trees,Tree Maintenance Requests,PARK_Tree Maintenance Request,PARK,,,27 Washington St  Charlestown  MA  02129,3.0,1A,1.0,A15,Charlestown,2.0,Ward 2,201.0,R1,27 Washington St,2129.0,Address,145787.0,42.3731,-71.0645,Employee Generated,"(42.3731, -71.0645)"
471967,101001244343,01/08/2015 02:15:18 PM,07/06/2016 02:15:17 PM,04/01/2015 09:27:17 AM,ONTIME,Closed,Case Closed Case Resolved The tree was pruned by Northern Tree Service  to the City of Boston tree pruning specifications.,Tree Maintenance Requests,Parks & Recreation Department,Trees,Tree Maintenance Requests,PARK_Tree Maintenance Request,PARK,,,25 Washington St  Charlestown  MA  02129,3.0,1A,1.0,A15,Charlestown,2.0,Ward 2,201.0,R3,25 Washington St,2129.0,Address,145786.0,42.373,-71.0644,Employee Generated,"(42.373, -71.0644)"
471969,101001244345,01/08/2015 02:18:22 PM,07/06/2016 02:18:20 PM,07/06/2015 08:49:38 AM,ONTIME,Closed,Case Closed. Closed date : 2015-07-06 08:49:38.437 Case Resolved Tree was removed by North-Eastern Tree Service. A new tree request case will be made for this location. If you have any questions please call the Park Line at 617-635-7275.,Tree Maintenance Requests,Parks & Recreation Department,Trees,Tree Maintenance Requests,PARK_Tree Maintenance Request,PARK,,,37 Washington St  Charlestown  MA  02129,3.0,1A,1.0,A15,Charlestown,2.0,Ward 2,201.0,R1,37 Washington St,2129.0,Address,145821.0,42.3732,-71.0649,Employee Generated,"(42.3732, -71.0649)"
471971,101001244350,01/08/2015 02:25:13 PM,07/06/2016 02:25:13 PM,04/01/2015 09:25:53 AM,ONTIME,Closed,Case Closed Case Resolved The tree was pruned by Northern Tree Service  to the City of Boston tree pruning specifications.,Tree Maintenance Requests,Parks & Recreation Department,Trees,Tree Maintenance Requests,PARK_Tree Maintenance Request,PARK,,,30 Union St  Charlestown  MA  02129,3.0,1A,1.0,A15,Charlestown,2.0,Ward 2,201.0,R1,30 Union St,2129.0,Address,139325.0,42.3742,-71.065,Employee Generated,"(42.3742, -71.065)"
471972,101001244351,01/08/2015 02:25:40 PM,07/06/2016 02:25:39 PM,04/01/2015 09:23:20 AM,ONTIME,Closed,Case Closed Case Resolved The tree was pruned by Northern Tree Service  to the City of Boston tree pruning specifications.,Tree Maintenance Requests,Parks & Recreation Department,Trees,Tree Maintenance Requests,PARK_Tree Maintenance Request,PARK,,,26 Union St  Charlestown  MA  02129,3.0,1A,1.0,A15,Charlestown,2.0,Ward 2,201.0,E,26 Union St,2129.0,Address,170662.0,42.3743,-71.0648,Employee Generated,"(42.3743, -71.0648)"
471973,101001244352,01/08/2015 02:26:41 PM,07/06/2016 02:26:40 PM,04/01/2015 09:23:38 AM,ONTIME,Closed,Case Closed Case Noted The tree was pruned by Northern Tree Service  to the City of Boston tree pruning specifications.,Tree Maintenance Requests,Parks & Recreation Department,Trees,Tree Maintenance Requests,PARK_Tree Maintenance Request,PARK,,,26 Union St  Charlestown  MA  02129,3.0,1A,1.0,A15,Charlestown,2.0,Ward 2,201.0,E,26 Union St,2129.0,Address,170662.0,42.3743,-71.0648,Employee Generated,"(42.3743, -71.0648)"
471974,101001244353,01/08/2015 02:27:10 PM,07/06/2016 02:27:09 PM,04/01/2015 09:24:37 AM,ONTIME,Closed,Case Closed Case Resolved The tree was pruned by Northern Tree Service  to the City of Boston tree pruning specifications.,Tree Maintenance Requests,Parks & Recreation Department,Trees,Tree Maintenance Requests,PARK_Tree Maintenance Request,PARK,,,29 Union St  Charlestown  MA  02129,3.0,1A,1.0,A15,Charlestown,2.0,Ward 2,201.0,R1,29 Union St,2129.0,Address,139324.0,42.374,-71.0648,Employee Generated,"(42.374, -71.0648)"
471975,101001244354,01/08/2015 02:27:43 PM,07/06/2016 02:27:43 PM,04/01/2015 09:25:00 AM,ONTIME,Closed,Case Closed Case Resolved The tree was pruned by Northern Tree Service  to the City of Boston tree pruning specifications.,Tree Maintenance Requests,Parks & Recreation Department,Trees,Tree Maintenance Requests,PARK_Tree Maintenance Request,PARK,,,29 Union St  Charlestown  MA  02129,3.0,1A,1.0,A15,Charlestown,2.0,Ward 2,201.0,R1,29 Union St,2129.0,Address,139324.0,42.374,-71.0648,Employee Generated,"(42.374, -71.0648)"
471978,101001244357,01/08/2015 02:28:11 PM,07/06/2016 02:28:11 PM,04/01/2015 09:21:30 AM,ONTIME,Closed,Case Closed Case Resolved The tree was pruned by Northern Tree Service  to the City of Boston tree pruning specifications.,Tree Maintenance Requests,Parks & Recreation Department,Trees,Tree Maintenance Requests,PARK_Tree Maintenance Request,PARK,,,23 Union St  Charlestown  MA  02129,3.0,1A,1.0,A15,Charlestown,2.0,Ward 2,201.0,CM,23 Union St,2129.0,Address,139318.0,42.3741,-71.0646,Employee Generated,"(42.3741, -71.0646)"
471979,101001244358,01/08/2015 02:28:41 PM,07/06/2016 02:28:40 PM,04/01/2015 09:21:14 AM,ONTIME,Closed,Case Closed Case Resolved The tree was pruned by Northern Tree Service  to the City of Boston tree pruning specifications.,Tree Maintenance Requests,Parks & Recreation Department,Trees,Tree Maintenance Requests,PARK_Tree Maintenance Request,PARK,,,22 Union St  Charlestown  MA  02129,3.0,1A,1.0,A15,Charlestown,2.0,Ward 2,201.0,R2,22 Union St,2129.0,Address,139316.0,42.3744,-71.0645,Employee Generated,"(42.3744, -71.0645)"
471980,101001244360,01/08/2015 02:31:03 PM,07/06/2016 02:31:03 PM,04/01/2015 09:20:56 AM,ONTIME,Closed,Case Closed Case Resolved The tree was pruned by Northern Tree Service  to the City of Boston tree pruning specifications.,Tree Maintenance Requests,Parks & Recreation Department,Trees,Tree Maintenance Requests,PARK_Tree Maintenance Request,PARK,,,18 Union St  Charlestown  MA  02129,3.0,1A,1.0,A15,Charlestown,2.0,Ward 2,201.0,CM,18 Union St,2129.0,Address,139309.0,42.3745,-71.0644,Employee Generated,"(42.3745, -71.0644)"
471981,101001244361,01/08/2015 02:31:32 PM,07/06/2016 02:31:31 PM,04/01/2015 09:19:13 AM,ONTIME,Closed,Case Closed Case Resolved The tree was pruned by Northern Tree Service  to the City of Boston tree pruning specifications.,Tree Maintenance Requests,Parks & Recreation Department,Trees,Tree Maintenance Requests,PARK_Tree Maintenance Request,PARK,,,124 Main St  Charlestown  MA  02129,3.0,1A,1.0,A15,Charlestown,2.0,Ward 2,201.0,C,124 Main St,2129.0,Address,88412.0,42.3747,-71.064,Employee Generated,"(42.3747, -71.064)"
471982,101001244362,01/08/2015 02:31:57 PM,07/06/2016 02:31:56 PM,04/01/2015 09:18:18 AM,ONTIME,Closed,Case Closed Case Resolved The tree was pruned by Northern Tree Service  to the City of Boston tree pruning specifications.,Tree Maintenance Requests,Parks & Recreation Department,Trees,Tree Maintenance Requests,PARK_Tree Maintenance Request,PARK,,,116 Main St  Charlestown  MA  02129,3.0,1A,1.0,A15,Charlestown,2.0,Ward 2,201.0,CM,116 Main St,2129.0,Address,88400.0,42.3744,-71.0638,Employee Generated,"(42.3744, -71.0638)"
471989,101001244371,01/08/2015 02:38:57 PM,07/06/2016 02:38:57 PM,03/10/2015 09:25:22 AM,ONTIME,Closed,Case Closed Case Noted The Boston Parks Department does not treat wounds on trees. wound treating or painting is no longer an arborculturally accepted practice. the tree will naturally compartmentalize the wound and heal itself over time. If the tree starts to decline in health please inform the parks department st 617-635-7275.,Tree Maintenance Requests,Parks & Recreation Department,Trees,Tree Maintenance Requests,PARK_Tree Maintenance Request,PARK,,,2066 Dorchester Ave  Dorchester  MA  02124,8.0,07,3.0,C11,Dorchester,7.0,Ward 16,1611.0,R3,2066 Dorchester Ave,2124.0,Address,48482.0,42.2802,-71.0656,Constituent Call,"(42.2802, -71.0656)"
472248,101001244751,01/09/2015 10:07:55 AM,07/07/2016 10:07:54 AM,06/17/2015 09:23:43 AM,ONTIME,Closed,Case Closed. Closed date : 2015-06-17 09:23:43.733 Case Resolved The tree was pruned by Northern Tree Service  to the City of Boston tree pruning specifications.,Tree Maintenance Requests,Parks & Recreation Department,Trees,Tree Maintenance Requests,PARK_Tree Maintenance Request,PARK,,,193 W Eighth St  South Boston  MA  02127,6.0,05,2.0,C6,South Boston / South Boston Waterfront,5.0,Ward 7,705.0,R3,193 W Eighth St,2127.0,Address,52545.0,42.3334,-71.052,Constituent Call,"(42.3334, -71.052)"
472249,101001244753,01/09/2015 10:08:42 AM,07/07/2016 10:08:40 AM,01/30/2015 11:59:57 AM,ONTIME,Closed,Case Closed Case Resolved Tree pruned by Northern Tree Serv. to the City of Boston pruning specifications.,Tree Maintenance Requests,Parks & Recreation Department,Trees,Tree Maintenance Requests,PARK_Tree Maintenance Request,PARK,,,995 Dorchester Ave  Dorchester  MA  02125,7.0,03,3.0,C11,Dorchester,7.0,Ward 13,1308.0,R3,995 Dorchester Ave,2125.0,Address,48820.0,42.3169,-71.0569,Employee Generated,"(42.3169, -71.0569)"
472255,101001244759,01/09/2015 10:11:03 AM,07/07/2016 10:11:03 AM,01/09/2015 01:04:17 PM,ONTIME,Closed,Case Closed Case Noted hank you for your comment.  The tree lights are funded and installed by the local businesses.,Tree Maintenance Requests,Parks & Recreation Department,Trees,Tree Maintenance Requests,PARK_Administration,PARK,,,174 Newbury St  Boston  MA  02116,4.0,1C,8.0,D4,Back Bay,14.0,Ward 5,507.0,RC,174 Newbury St,2116.0,Address,101380.0,42.3503,-71.079,Self Service,"(42.3503, -71.079)"
472256,101001244760,01/09/2015 10:11:54 AM,07/07/2016 10:11:52 AM,01/30/2015 12:00:31 PM,ONTIME,Closed,Case Closed Case Resolved Tree pruned by Northern Tree Serv. to the City of Boston pruning specifications.,Tree Maintenance Requests,Parks & Recreation Department,Trees,Tree Maintenance Requests,PARK_Tree Maintenance Request,PARK,,,999 Dorchester Ave  Dorchester  MA  02125,7.0,03,3.0,C11,Dorchester,7.0,Ward 13,1308.0,CM,999 Dorchester Ave,2125.0,Address,164429.0,42.3168,-71.057,Employee Generated,"(42.3168, -71.057)"
472258,101001244762,01/09/2015 10:13:19 AM,07/07/2016 10:13:17 AM,05/06/2015 09:48:14 AM,ONTIME,Closed,Case Closed. Closed date : 2015-05-06 09:48:14.307 Case Resolved The tree was pruned by Northern Tree Service  to the City of Boston tree pruning specifications.,Tree Maintenance Requests,Parks & Recreation Department,Trees,Tree Maintenance Requests,PARK_Tree Maintenance Request,PARK,,,1027-1029 Dorchester Ave  Dorchester  MA  02125,7.0,03,3.0,C11,Dorchester,7.0,Ward 13,1308.0,RC,1027-1029 Dorchester Ave,2125.0,Address,164431.0,42.3156,-71.057,Employee Generated,"(42.3156, -71.057)"
472261,101001244766,01/09/2015 10:16:56 AM,07/07/2016 10:16:55 AM,05/06/2015 09:48:42 AM,ONTIME,Closed,Case Closed. Closed date : 2015-05-06 09:48:42.87 Case Resolved The tree was pruned by Northern Tree Service  to the City of Boston tree pruning specifications.,Tree Maintenance Requests,Parks & Recreation Department,Trees,Tree Maintenance Requests,PARK_Tree Maintenance Request,PARK,,,1037 Dorchester Ave  Dorchester  MA  02125,7.0,03,3.0,C11,Dorchester,7.0,Ward 13,1308.0,CM,1037 Dorchester Ave,2125.0,Address,48169.0,42.3152,-71.0569,Employee Generated,"(42.3152, -71.0569)"
472263,101001244769,01/09/2015 10:18:58 AM,07/07/2016 10:18:57 AM,01/30/2015 11:34:07 AM,ONTIME,Closed,Case Closed Case Resolved Tree pruned by Northern Tree Serv. to the City of Boston pruning specifications.,Tree Maintenance Requests,Parks & Recreation Department,Trees,Tree Maintenance Requests,PARK_Tree Maintenance Request,PARK,,,1175 Dorchester Ave  Dorchester  MA  02125,7.0,03,3.0,C11,Dorchester,8.0,Ward 15,1504.0,C,1175 Dorchester Ave,2125.0,Address,48244.0,42.3106,-71.058,Employee Generated,"(42.3106, -71.058)"
472274,101001244788,01/09/2015 10:41:03 AM,07/07/2016 10:41:02 AM,01/30/2015 11:35:04 AM,ONTIME,Closed,Case Closed Case Resolved Tree pruned by Northern Tree Serv. to the City of Boston pruning specifications.,Tree Maintenance Requests,Parks & Recreation Department,Trees,Tree Maintenance Requests,PARK_Tree Maintenance Request,PARK,,,1411-1413 Dorchester Ave  Dorchester  MA  02122,7.0,03,3.0,C11,Dorchester,8.0,Ward 15,1509.0,RC,1411-1413 Dorchester Ave,2122.0,Address,48310.0,42.303,-71.0597,Employee Generated,"(42.303, -71.0597)"
472280,101001244797,01/09/2015 10:47:58 AM,07/07/2016 10:47:57 AM,01/30/2015 11:34:38 AM,ONTIME,Closed,Case Closed Case Resolved Tree pruned by Northern Tree Serv. to the City of Boston pruning specifications.,Tree Maintenance Requests,Parks & Recreation Department,Trees,Tree Maintenance Requests,PARK_Tree Maintenance Request,PARK,,,1199 Dorchester Ave  Dorchester  MA  02125,7.0,03,3.0,C11,Dorchester,8.0,Ward 15,1504.0,C,1199 Dorchester Ave,2125.0,Address,48258.0,42.3097,-71.0581,Employee Generated,"(42.3097, -71.0581)"
472281,101001244798,01/09/2015 10:50:29 AM,07/07/2016 10:50:28 AM,01/30/2015 11:35:29 AM,ONTIME,Closed,Case Closed Case Resolved Tree pruned by Northern Tree Serv. to the City of Boston pruning specifications.,Tree Maintenance Requests,Parks & Recreation Department,Trees,Tree Maintenance Requests,PARK_Tree Maintenance Request,PARK,,,1411-1413 Dorchester Ave  Dorchester  MA  02122,7.0,03,3.0,C11,Dorchester,8.0,Ward 15,1509.0,RC,1411-1413 Dorchester Ave,2122.0,Address,48310.0,42.303,-71.0597,Employee Generated,"(42.303, -71.0597)"
472285,101001244803,01/09/2015 10:53:10 AM,07/07/2016 10:53:09 AM,01/30/2015 11:35:52 AM,ONTIME,Closed,Case Closed Case Resolved Tree pruned by Northern Tree Serv. to the City of Boston pruning specifications.,Tree Maintenance Requests,Parks & Recreation Department,Trees,Tree Maintenance Requests,PARK_Tree Maintenance Request,PARK,,,1449 Dorchester Ave  Dorchester  MA  02122,7.0,03,3.0,C11,Dorchester,8.0,Ward 15,1508.0,C,1449 Dorchester Ave,2122.0,Address,156312.0,42.3011,-71.0601,Employee Generated,"(42.3011, -71.0601)"
472287,101001244806,01/09/2015 10:54:57 AM,07/07/2016 10:54:56 AM,01/30/2015 11:36:15 AM,ONTIME,Closed,Case Closed Case Resolved Tree pruned by Northern Tree Serv. to the City of Boston pruning specifications.,Tree Maintenance Requests,Parks & Recreation Department,Trees,Tree Maintenance Requests,PARK_Tree Maintenance Request,PARK,,,1459 Dorchester Ave  Dorchester  MA  02122,7.0,03,3.0,C11,Dorchester,8.0,Ward 15,1508.0,C,1459 Dorchester Ave,2122.0,Address,155975.0,42.3009,-71.0601,Employee Generated,"(42.3009, -71.0601)"
472291,101001244811,01/09/2015 10:56:35 AM,07/07/2016 10:56:33 AM,01/09/2015 10:57:39 AM,ONTIME,Closed,Case Closed Case Invalid,Tree Maintenance Requests,Parks & Recreation Department,Trees,Tree Maintenance Requests,PARK_Tree Maintenance Request,PARK,,,,,,,,,,,,,,,,,42.3594,-71.0587,Employee Generated,"(0, 0)"
472297,101001244817,01/09/2015 10:59:36 AM,07/07/2016 10:59:35 AM,01/30/2015 11:36:48 AM,ONTIME,Closed,Case Closed Case Resolved Tree pruned by Northern Tree Serv. to the City of Boston pruning specifications.,Tree Maintenance Requests,Parks & Recreation Department,Trees,Tree Maintenance Requests,PARK_Tree Maintenance Request,PARK,,,1469 Dorchester Ave  Dorchester  MA  02122,7.0,03,3.0,C11,Dorchester,8.0,Ward 15,1508.0,C,1469 Dorchester Ave,2122.0,Address,48328.0,42.3005,-71.0603,Employee Generated,"(42.3005, -71.0603)"
472298,101001244819,01/09/2015 11:00:51 AM,07/07/2016 11:00:50 AM,01/30/2015 11:38:00 AM,ONTIME,Closed,Case Closed Case Resolved Tree pruned by Northern Tree Serv. to the City of Boston pruning specifications.,Tree Maintenance Requests,Parks & Recreation Department,Trees,Tree Maintenance Requests,PARK_Tree Maintenance Request,PARK,,,1623 Dorchester Ave  Dorchester  MA  02124,8.0,07,3.0,C11,Dorchester,8.0,Ward 16,1603.0,R2,1623 Dorchester Ave,2124.0,Address,48367.0,42.2951,-71.062,Employee Generated,"(42.2951, -71.062)"
472299,101001244821,01/09/2015 11:02:02 AM,07/07/2016 11:02:01 AM,01/30/2015 11:38:27 AM,ONTIME,Closed,Case Closed Case Resolved Tree pruned by Northern Tree Serv. to the City of Boston pruning specifications.,Tree Maintenance Requests,Parks & Recreation Department,Trees,Tree Maintenance Requests,PARK_Tree Maintenance Request,PARK,,,1743 Dorchester Ave  Dorchester  MA  02124,8.0,07,3.0,C11,Dorchester,8.0,Ward 16,1603.0,R3,1743 Dorchester Ave,2124.0,Address,48401.0,42.2908,-71.0631,Employee Generated,"(42.2908, -71.0631)"
472303,101001244825,01/09/2015 11:03:21 AM,07/07/2016 11:03:20 AM,01/30/2015 11:39:01 AM,ONTIME,Closed,Case Closed Case Resolved Tree pruned by Northern Tree Serv. to the City of Boston pruning specifications.,Tree Maintenance Requests,Parks & Recreation Department,Trees,Tree Maintenance Requests,PARK_Tree Maintenance Request,PARK,,,1749 Dorchester Ave  Dorchester  MA  02124,8.0,07,3.0,C11,Dorchester,8.0,Ward 16,1603.0,RC,1749 Dorchester Ave,2124.0,Address,48404.0,42.2905,-71.0632,Employee Generated,"(42.2905, -71.0632)"
472309,101001244832,01/09/2015 11:11:38 AM,07/07/2016 11:11:37 AM,01/30/2015 11:39:35 AM,ONTIME,Closed,Case Closed Case Resolved Tree pruned by Northern Tree Serv. to the City of Boston pruning specifications.,Tree Maintenance Requests,Parks & Recreation Department,Trees,Tree Maintenance Requests,PARK_Tree Maintenance Request,PARK,,,1757 Dorchester Ave  Dorchester  MA  02124,8.0,07,3.0,C11,Dorchester,8.0,Ward 16,1603.0,A,1757 Dorchester Ave,2124.0,Address,48406.0,42.2903,-71.0633,Employee Generated,"(42.2903, -71.0633)"
472313,101001244837,01/09/2015 11:15:19 AM,07/07/2016 11:15:18 AM,01/30/2015 11:40:00 AM,ONTIME,Closed,Case Closed Case Resolved Tree pruned by Northern Tree Serv. to the City of Boston pruning specifications.,Tree Maintenance Requests,Parks & Recreation Department,Trees,Tree Maintenance Requests,PARK_Tree Maintenance Request,PARK,,,1949 Dorchester Ave  Dorchester  MA  02124,8.0,07,4.0,C11,Dorchester,8.0,Ward 17,1711.0,R3,1949 Dorchester Ave,2124.0,Address,48453.0,42.2842,-71.065,Employee Generated,"(42.2842, -71.065)"
472316,101001244840,01/09/2015 11:16:32 AM,07/07/2016 11:16:31 AM,01/30/2015 11:40:40 AM,ONTIME,Closed,Case Closed Case Resolved Tree pruned by Northern Tree Serv. to the City of Boston pruning specifications.,Tree Maintenance Requests,Parks & Recreation Department,Trees,Tree Maintenance Requests,PARK_Tree Maintenance Request,PARK,,,1993 Dorchester Ave  Dorchester  MA  02124,8.0,07,3.0,C11,Dorchester,7.0,Ward 17,1704.0,R2,1993 Dorchester Ave,2124.0,Address,48458.0,42.2827,-71.0653,Employee Generated,"(42.2827, -71.0653)"
472319,101001244845,01/09/2015 11:18:21 AM,07/07/2016 11:18:20 AM,01/30/2015 11:41:06 AM,ONTIME,Closed,Case Closed Case Resolved Tree pruned by Northern Tree Serv. to the City of Boston pruning specifications.,Tree Maintenance Requests,Parks & Recreation Department,Trees,Tree Maintenance Requests,PARK_Tree Maintenance Request,PARK,,,2050 Dorchester Ave  Dorchester  MA  02124,8.0,07,3.0,C11,Dorchester,7.0,Ward 16,1611.0,R2,2050 Dorchester Ave,2124.0,Address,48475.0,42.281,-71.0653,Employee Generated,"(42.281, -71.0653)"
472322,101001244848,01/09/2015 11:19:29 AM,07/07/2016 11:19:28 AM,01/30/2015 11:42:42 AM,ONTIME,Closed,Case Closed Case Resolved Tree pruned by Northern Tree Serv. to the City of Boston pruning specifications.,Tree Maintenance Requests,Parks & Recreation Department,Trees,Tree Maintenance Requests,PARK_Tree Maintenance Request,PARK,,,2201 Dorchester Ave  Dorchester  MA  02124,8.0,07,3.0,C11,Dorchester,7.0,Ward 17,1713.0,R3,2201 Dorchester Ave,2124.0,Address,48550.0,42.2754,-71.0674,Employee Generated,"(42.2754, -71.0674)"
472326,101001244853,01/09/2015 11:23:36 AM,07/07/2016 11:23:35 AM,01/30/2015 11:43:02 AM,ONTIME,Closed,Case Closed Case Noted Tree pruned by Northern Tree Serv. to the City of Boston pruning specifications.,Tree Maintenance Requests,Parks & Recreation Department,Trees,Tree Maintenance Requests,PARK_Tree Maintenance Request,PARK,,,2207 Dorchester Ave  Dorchester  MA  02124,8.0,07,3.0,C11,Dorchester,7.0,Ward 17,1713.0,R3,2207 Dorchester Ave,2124.0,Address,48551.0,42.2752,-71.0675,Employee Generated,"(42.2752, -71.0675)"
472327,101001244854,01/09/2015 11:25:33 AM,07/07/2016 11:25:31 AM,01/30/2015 11:43:19 AM,ONTIME,Closed,Case Closed Case Resolved Tree pruned by Northern Tree Serv. to the City of Boston pruning specifications.,Tree Maintenance Requests,Parks & Recreation Department,Trees,Tree Maintenance Requests,PARK_Tree Maintenance Request,PARK,,,2250 Dorchester Ave  Dorchester  MA  02124,8.0,07,3.0,C11,Dorchester,7.0,Ward 17,1713.0,C,2250 Dorchester Ave,2124.0,Address,48557.0,42.2737,-71.0674,Employee Generated,"(42.2737, -71.0674)"
472328,101001244856,01/09/2015 11:28:18 AM,07/07/2016 11:28:17 AM,01/30/2015 11:43:43 AM,ONTIME,Closed,Case Closed Case Resolved Tree pruned by Northern Tree Serv. to the City of Boston pruning specifications.,Tree Maintenance Requests,Parks & Recreation Department,Trees,Tree Maintenance Requests,PARK_Tree Maintenance Request,PARK,,,2251-2253 Dorchester Ave  Dorchester  MA  02124,8.0,07,3.0,C11,Dorchester,7.0,Ward 17,1713.0,C,2251-2253 Dorchester Ave,2124.0,Address,48558.0,42.2735,-71.0679,Employee Generated,"(42.2735, -71.0679)"
472330,101001244860,01/09/2015 11:29:50 AM,07/07/2016 11:29:48 AM,01/30/2015 11:44:00 AM,ONTIME,Closed,Case Closed Case Resolved Tree pruned by Northern Tree Serv. to the City of Boston pruning specifications.,Tree Maintenance Requests,Parks & Recreation Department,Trees,Tree Maintenance Requests,PARK_Tree Maintenance Request,PARK,,,2269 Dorchester Ave  Dorchester  MA  02124,8.0,07,3.0,C11,Dorchester,7.0,Ward 17,1713.0,C,2269 Dorchester Ave,2124.0,Address,48563.0,42.273,-71.068,Employee Generated,"(42.273, -71.068)"
472338,101001244872,01/09/2015 11:34:24 AM,07/07/2016 11:34:23 AM,01/30/2015 11:44:35 AM,ONTIME,Closed,Case Closed Case Resolved Tree pruned by Northern Tree Serv. to the City of Boston pruning specifications.,Tree Maintenance Requests,Parks & Recreation Department,Trees,Tree Maintenance Requests,PARK_Tree Maintenance Request,PARK,,,2271-2275H Dorchester Ave  Dorchester  MA  02124,8.0,07,3.0,C11,Dorchester,7.0,Ward 17,1713.0,C,2271-2275H Dorchester Ave,2124.0,Address,164519.0,42.2728,-71.0682,Employee Generated,"(42.2728, -71.0682)"
472340,101001244875,01/09/2015 11:35:50 AM,07/07/2016 11:35:49 AM,01/30/2015 12:24:45 PM,ONTIME,Closed,Case Closed Case Resolved Tree pruned by Northern Tree Serv. to the City of Boston pruning specifications.,Tree Maintenance Requests,Parks & Recreation Department,Trees,Tree Maintenance Requests,PARK_Tree Maintenance Request,PARK,,,387 Talbot Ave  Dorchester  MA  02124,8.0,07,4.0,C11,Dorchester,8.0,Ward 17,1706.0,A,387 Talbot Ave,2124.0,Address,317747.0,42.2899,-71.0704,Employee Generated,"(42.2899, -71.0704)"
472342,101001244878,01/09/2015 11:37:53 AM,07/07/2016 11:37:52 AM,01/30/2015 12:26:33 PM,ONTIME,Closed,Case Closed Case Resolved Tree pruned by Northern Tree Serv. to the City of Boston pruning specifications.,Tree Maintenance Requests,Parks & Recreation Department,Trees,Tree Maintenance Requests,PARK_Tree Maintenance Request,PARK,,,387 Talbot Ave  Dorchester  MA  02124,8.0,07,4.0,C11,Dorchester,8.0,Ward 17,1706.0,A,387 Talbot Ave,2124.0,Address,317747.0,42.2899,-71.0704,Employee Generated,"(42.2899, -71.0704)"
472345,101001244881,01/09/2015 11:39:51 AM,07/07/2016 11:39:50 AM,01/30/2015 12:27:17 PM,ONTIME,Closed,Case Closed Case Resolved Tree pruned by Northern Tree Serv. to the City of Boston pruning specifications.,Tree Maintenance Requests,Parks & Recreation Department,Trees,Tree Maintenance Requests,PARK_Tree Maintenance Request,PARK,,,387 Talbot Ave  Dorchester  MA  02124,8.0,07,4.0,C11,Dorchester,8.0,Ward 17,1706.0,A,387 Talbot Ave,2124.0,Address,317747.0,42.2899,-71.0704,Employee Generated,"(42.2899, -71.0704)"
472346,101001244882,01/09/2015 11:41:21 AM,07/07/2016 11:41:19 AM,01/30/2015 12:27:35 PM,ONTIME,Closed,Case Closed Case Resolved Tree pruned by Northern Tree Serv. to the City of Boston pruning specifications.,Tree Maintenance Requests,Parks & Recreation Department,Trees,Tree Maintenance Requests,PARK_Tree Maintenance Request,PARK,,,387 Talbot Ave  Dorchester  MA  02124,8.0,07,4.0,C11,Dorchester,8.0,Ward 17,1706.0,A,387 Talbot Ave,2124.0,Address,317747.0,42.2899,-71.0704,Employee Generated,"(42.2899, -71.0704)"
472350,101001244886,01/09/2015 11:43:08 AM,07/07/2016 11:43:07 AM,01/30/2015 12:27:52 PM,ONTIME,Closed,Case Closed Case Resolved Tree pruned by Northern Tree Serv. to the City of Boston pruning specifications.,Tree Maintenance Requests,Parks & Recreation Department,Trees,Tree Maintenance Requests,PARK_Tree Maintenance Request,PARK,,,387 Talbot Ave  Dorchester  MA  02124,8.0,07,4.0,C11,Dorchester,8.0,Ward 17,1706.0,A,387 Talbot Ave,2124.0,Address,317747.0,42.2899,-71.0704,Employee Generated,"(42.2899, -71.0704)"
472352,101001244889,01/09/2015 11:44:35 AM,07/07/2016 11:44:34 AM,01/30/2015 12:28:11 PM,ONTIME,Closed,Case Closed Case Resolved Tree pruned by Northern Tree Serv. to the City of Boston pruning specifications.,Tree Maintenance Requests,Parks & Recreation Department,Trees,Tree Maintenance Requests,PARK_Tree Maintenance Request,PARK,,,387 Talbot Ave  Dorchester  MA  02124,8.0,07,4.0,C11,Dorchester,8.0,Ward 17,1706.0,A,387 Talbot Ave,2124.0,Address,317747.0,42.2899,-71.0704,Employee Generated,"(42.2899, -71.0704)"
472354,101001244892,01/09/2015 11:47:30 AM,07/07/2016 11:47:29 AM,01/30/2015 12:29:28 PM,ONTIME,Closed,Case Closed Case Resolved Tree pruned by Northern Tree Serv. to the City of Boston pruning specifications.,Tree Maintenance Requests,Parks & Recreation Department,Trees,Tree Maintenance Requests,PARK_Tree Maintenance Request,PARK,,,414 Talbot Ave  Dorchester  MA  02124,8.0,07,3.0,C11,Dorchester,8.0,Ward 16,1603.0,R3,414 Talbot Ave,2124.0,Address,133717.0,42.29,-71.0691,Employee Generated,"(42.29, -71.0691)"
472357,101001244897,01/09/2015 11:53:50 AM,07/07/2016 11:53:49 AM,01/09/2015 11:57:49 AM,ONTIME,Closed,Case Closed Case Invalid,Tree Maintenance Requests,Parks & Recreation Department,Trees,Tree Maintenance Requests,PARK_Tree Maintenance Request,PARK,,,436 Dorchester Ave  South Boston  MA  02127,6.0,05,2.0,C6,South Boston / South Boston Waterfront,5.0,Ward 7,705.0,C,436 Dorchester Ave,2127.0,Address,48599.0,42.3336,-71.0568,Employee Generated,"(42.3336, -71.0568)"
472358,101001244899,01/09/2015 11:56:13 AM,07/07/2016 11:56:12 AM,05/06/2015 10:08:15 AM,ONTIME,Closed,Case Closed. Closed date : 2015-05-06 10:08:15.99 Case Noted The tree was pruned by Northern Tree Service  to the City of Boston tree pruning specifications.,Tree Maintenance Requests,Parks & Recreation Department,Trees,Tree Maintenance Requests,PARK_Tree Maintenance Request,PARK,,,438 Talbot Ave  Dorchester  MA  02124,8.0,07,3.0,C11,Dorchester,8.0,Ward 16,1603.0,R2,438 Talbot Ave,2124.0,Address,133722.0,42.2896,-71.0678,Employee Generated,"(42.2896, -71.0678)"
472361,101001244902,01/09/2015 11:58:51 AM,07/07/2016 11:58:50 AM,05/06/2015 10:08:36 AM,ONTIME,Closed,Case Closed. Closed date : 2015-05-06 10:08:36.797 Case Noted The tree was pruned by Northern Tree Service  to the City of Boston tree pruning specifications.,Tree Maintenance Requests,Parks & Recreation Department,Trees,Tree Maintenance Requests,PARK_Tree Maintenance Request,PARK,,,438 Talbot Ave  Dorchester  MA  02124,8.0,07,3.0,C11,Dorchester,8.0,Ward 16,1603.0,R2,438 Talbot Ave,2124.0,Address,133722.0,42.2896,-71.0678,Employee Generated,"(42.2896, -71.0678)"
472363,101001244906,01/09/2015 12:02:49 PM,07/07/2016 12:02:48 PM,01/30/2015 12:30:34 PM,ONTIME,Closed,Case Closed Case Resolved Tree pruned by Northern Tree Serv. to the City of Boston pruning specifications.,Tree Maintenance Requests,Parks & Recreation Department,Trees,Tree Maintenance Requests,PARK_Tree Maintenance Request,PARK,,,450 Talbot Ave  Dorchester  MA  02124,8.0,07,3.0,C11,Dorchester,8.0,Ward 16,1603.0,C,450 Talbot Ave,2124.0,Address,133727.0,42.2894,-71.0672,Employee Generated,"(42.2894, -71.0672)"
472365,101001244908,01/09/2015 12:04:03 PM,07/07/2016 12:04:01 PM,01/30/2015 12:30:57 PM,ONTIME,Closed,Case Closed Case Resolved Tree pruned by Northern Tree Serv. to the City of Boston pruning specifications.,Tree Maintenance Requests,Parks & Recreation Department,Trees,Tree Maintenance Requests,PARK_Tree Maintenance Request,PARK,,,450 Talbot Ave  Dorchester  MA  02124,8.0,07,3.0,C11,Dorchester,8.0,Ward 16,1603.0,C,450 Talbot Ave,2124.0,Address,133727.0,42.2894,-71.0672,Employee Generated,"(42.2894, -71.0672)"
472368,101001244913,01/09/2015 12:06:48 PM,07/07/2016 12:06:47 PM,01/30/2015 12:31:33 PM,ONTIME,Closed,Case Closed Case Resolved Tree pruned by Northern Tree Serv. to the City of Boston pruning specifications.,Tree Maintenance Requests,Parks & Recreation Department,Trees,Tree Maintenance Requests,PARK_Tree Maintenance Request,PARK,,,473 Talbot Ave  Dorchester  MA  02124,8.0,07,4.0,C11,Dorchester,8.0,Ward 17,1709.0,R3,473 Talbot Ave,2124.0,Address,133732.0,42.2886,-71.0665,Employee Generated,"(42.2886, -71.0665)"
472369,101001244914,01/09/2015 12:09:09 PM,07/07/2016 12:09:07 PM,05/06/2015 10:08:57 AM,ONTIME,Closed,Case Closed. Closed date : 2015-05-06 10:08:57.403 Case Resolved The tree was pruned by Northern Tree Service  to the City of Boston tree pruning specifications.,Tree Maintenance Requests,Parks & Recreation Department,Trees,Tree Maintenance Requests,PARK_Tree Maintenance Request,PARK,,,500 Talbot Ave  Dorchester  MA  02124,8.0,07,3.0,C11,Dorchester,8.0,Ward 16,1603.0,E,500 Talbot Ave,2124.0,Address,156094.0,42.2885,-71.0658,Employee Generated,"(42.2885, -71.0658)"
472370,101001244915,01/09/2015 12:10:39 PM,07/07/2016 12:10:38 PM,05/06/2015 10:09:16 AM,ONTIME,Closed,Case Closed. Closed date : 2015-05-06 10:09:16.943 Case Resolved The tree was pruned by Northern Tree Service  to the City of Boston tree pruning specifications.,Tree Maintenance Requests,Parks & Recreation Department,Trees,Tree Maintenance Requests,PARK_Tree Maintenance Request,PARK,,,500 Talbot Ave  Dorchester  MA  02124,8.0,07,3.0,C11,Dorchester,8.0,Ward 16,1603.0,E,500 Talbot Ave,2124.0,Address,156094.0,42.2885,-71.0658,Employee Generated,"(42.2885, -71.0658)"
472380,101001244942,01/09/2015 12:36:11 PM,07/07/2016 12:36:08 PM,01/30/2015 12:31:53 PM,ONTIME,Closed,Case Closed Case Resolved Tree pruned by Northern Tree Serv. to the City of Boston pruning specifications.,Tree Maintenance Requests,Parks & Recreation Department,Trees,Tree Maintenance Requests,PARK_Tree Maintenance Request,PARK,,,497 Talbot Ave  Dorchester  MA  02124,8.0,07,4.0,C11,Dorchester,8.0,Ward 17,1709.0,R3,497 Talbot Ave,2124.0,Address,133738.0,42.2879,-71.0658,Employee Generated,"(42.2879, -71.0658)"
472381,101001244943,01/09/2015 12:37:39 PM,07/07/2016 12:37:38 PM,01/30/2015 12:32:13 PM,ONTIME,Closed,Case Closed Case Resolved Tree pruned by Northern Tree Serv. to the City of Boston pruning specifications.,Tree Maintenance Requests,Parks & Recreation Department,Trees,Tree Maintenance Requests,PARK_Tree Maintenance Request,PARK,,,505-507 Talbot Ave  Dorchester  MA  02124,8.0,07,4.0,C11,Dorchester,8.0,Ward 17,1709.0,R4,505-507 Talbot Ave,2124.0,Address,133748.0,42.2877,-71.0656,Employee Generated,"(42.2877, -71.0656)"
472383,101001244945,01/09/2015 12:38:58 PM,07/07/2016 12:38:56 PM,01/30/2015 12:32:50 PM,ONTIME,Closed,Case Closed Case Resolved Tree pruned by Northern Tree Serv. to the City of Boston pruning specifications.,Tree Maintenance Requests,Parks & Recreation Department,Trees,Tree Maintenance Requests,PARK_Tree Maintenance Request,PARK,,,507 Talbot Ave  Dorchester  MA  02124,8.0,07,4.0,C11,Dorchester,8.0,Ward 17,1709.0,R4,507 Talbot Ave,2124.0,Address,317808.0,42.2877,-71.0656,Employee Generated,"(42.2877, -71.0656)"
472384,101001244946,01/09/2015 12:40:09 PM,07/07/2016 12:40:08 PM,01/30/2015 12:33:15 PM,ONTIME,Closed,Case Closed Case Resolved Tree pruned by Northern Tree Serv. to the City of Boston pruning specifications.,Tree Maintenance Requests,Parks & Recreation Department,Trees,Tree Maintenance Requests,PARK_Tree Maintenance Request,PARK,,,512 Talbot Ave  Dorchester  MA  02124,8.0,07,3.0,C11,Dorchester,8.0,Ward 16,1603.0,R3,512 Talbot Ave,2124.0,Address,133751.0,42.288,-71.0651,Employee Generated,"(42.288, -71.0651)"
472385,101001244947,01/09/2015 12:41:25 PM,07/07/2016 12:41:23 PM,05/06/2015 10:09:33 AM,ONTIME,Closed,Case Closed. Closed date : 2015-05-06 10:09:33.903 Case Resolved The tree was pruned by Northern Tree Service  to the City of Boston tree pruning specifications.,Tree Maintenance Requests,Parks & Recreation Department,Trees,Tree Maintenance Requests,PARK_Tree Maintenance Request,PARK,,,526 Talbot Ave  Dorchester  MA  02124,8.0,07,3.0,C11,Dorchester,8.0,Ward 16,1603.0,R3,526 Talbot Ave,2124.0,Address,133763.0,42.2875,-71.0649,Employee Generated,"(42.2875, -71.0649)"
472386,101001244949,01/09/2015 12:42:33 PM,07/07/2016 12:42:31 PM,05/06/2015 10:09:49 AM,ONTIME,Closed,Case Closed. Closed date : 2015-05-06 10:09:49.63 Case Resolved The tree was pruned by Northern Tree Service  to the City of Boston tree pruning specifications.,Tree Maintenance Requests,Parks & Recreation Department,Trees,Tree Maintenance Requests,PARK_Tree Maintenance Request,PARK,,,538 Talbot Ave  Dorchester  MA  02124,8.0,07,3.0,C11,Dorchester,8.0,Ward 16,1603.0,A,538 Talbot Ave,2124.0,Address,170194.0,42.2873,-71.0648,Employee Generated,"(42.2873, -71.0648)"
472387,101001244950,01/09/2015 12:43:42 PM,07/07/2016 12:43:41 PM,05/06/2015 10:10:10 AM,ONTIME,Closed,Case Closed. Closed date : 2015-05-06 10:10:10.25 Case Resolved The tree was pruned by Northern Tree Service  to the City of Boston tree pruning specifications.,Tree Maintenance Requests,Parks & Recreation Department,Trees,Tree Maintenance Requests,PARK_Tree Maintenance Request,PARK,,,538 Talbot Ave  Dorchester  MA  02124,8.0,07,3.0,C11,Dorchester,8.0,Ward 16,1603.0,A,538 Talbot Ave,2124.0,Address,170194.0,42.2873,-71.0648,Employee Generated,"(42.2873, -71.0648)"
472389,101001244952,01/09/2015 12:45:01 PM,07/07/2016 12:45:00 PM,01/30/2015 12:33:35 PM,ONTIME,Closed,Case Closed Case Resolved Tree pruned by Northern Tree Serv. to the City of Boston pruning specifications.,Tree Maintenance Requests,Parks & Recreation Department,Trees,Tree Maintenance Requests,PARK_Tree Maintenance Request,PARK,,,537 Talbot Ave  Dorchester  MA  02124,8.0,07,4.0,C11,Dorchester,8.0,Ward 17,1709.0,R1,537 Talbot Ave,2124.0,Address,133764.0,42.2867,-71.065,Employee Generated,"(42.2867, -71.065)"
472391,101001244954,01/09/2015 12:46:09 PM,07/07/2016 12:46:08 PM,01/30/2015 12:34:00 PM,ONTIME,Closed,Case Closed Case Resolved Tree pruned by Northern Tree Serv. to the City of Boston pruning specifications.,Tree Maintenance Requests,Parks & Recreation Department,Trees,Tree Maintenance Requests,PARK_Tree Maintenance Request,PARK,,,539 Talbot Ave  Dorchester  MA  02124,8.0,07,4.0,C11,Dorchester,8.0,Ward 17,1709.0,R2,539 Talbot Ave,2124.0,Address,133766.0,42.2866,-71.065,Employee Generated,"(42.2866, -71.065)"
472396,101001244963,01/09/2015 12:53:52 PM,07/07/2016 12:53:51 PM,01/30/2015 12:39:44 PM,ONTIME,Closed,Case Closed Case Resolved Tree pruned by Northern Tree Serv. to the City of Boston pruning specifications.,Tree Maintenance Requests,Parks & Recreation Department,Trees,Tree Maintenance Requests,PARK_Tree Maintenance Request,PARK,,,229 Washington St  Dorchester  MA  02121,7.0,03,4.0,C11,Dorchester,8.0,Ward 14,1402.0,R3,229 Washington St,2121.0,Address,145989.0,42.3018,-71.0775,Employee Generated,"(42.3018, -71.0775)"
472397,101001244970,01/09/2015 12:55:43 PM,07/07/2016 12:55:42 PM,01/09/2015 12:58:24 PM,ONTIME,Closed,Case Closed Case Invalid,Tree Maintenance Requests,Parks & Recreation Department,Trees,Tree Maintenance Requests,PARK_Tree Maintenance Request,PARK,,,235 Talbot Ave  Dorchester  MA  02124,8.0,07,4.0,B3,Dorchester,9.0,Ward 17,1705.0,R3,235 Talbot Ave,2124.0,Address,133681.0,42.2915,-71.0769,Employee Generated,"(42.2915, -71.0769)"
472398,101001244972,01/09/2015 12:57:18 PM,07/07/2016 12:57:16 PM,01/30/2015 12:40:35 PM,ONTIME,Closed,Case Closed Case Resolved Tree pruned by Northern Tree Serv. to the City of Boston pruning specifications.,Tree Maintenance Requests,Parks & Recreation Department,Trees,Tree Maintenance Requests,PARK_Tree Maintenance Request,PARK,,,237 Washington St  Dorchester  MA  02121,7.0,03,4.0,C11,Dorchester,8.0,Ward 14,1402.0,A,237 Washington St,2121.0,Address,145994.0,42.3016,-71.0773,Employee Generated,"(42.3016, -71.0773)"
472401,101001244976,01/09/2015 12:59:07 PM,07/07/2016 12:59:05 PM,01/30/2015 12:40:06 PM,ONTIME,Closed,Case Closed Case Resolved Tree pruned by Northern Tree Serv. to the City of Boston pruning specifications.,Tree Maintenance Requests,Parks & Recreation Department,Trees,Tree Maintenance Requests,PARK_Tree Maintenance Request,PARK,,,235 Washington St  Dorchester  MA  02121,7.0,03,4.0,C11,Dorchester,8.0,Ward 14,1402.0,R3,235 Washington St,2121.0,Address,145993.0,42.3017,-71.0774,Employee Generated,"(42.3017, -71.0774)"
472403,101001244978,01/09/2015 01:00:39 PM,07/07/2016 01:00:36 PM,01/30/2015 12:41:30 PM,ONTIME,Closed,Case Closed Case Resolved Tree pruned by Northern Tree Serv. to the City of Boston pruning specifications.,Tree Maintenance Requests,Parks & Recreation Department,Trees,Tree Maintenance Requests,PARK_Tree Maintenance Request,PARK,,,272 Washington St  Dorchester  MA  02121,7.0,03,4.0,C11,Dorchester,8.0,Ward 14,1404.0,R1,272 Washington St,2121.0,Address,146011.0,42.3012,-71.0762,Employee Generated,"(42.3012, -71.0762)"
472405,101001244980,01/09/2015 01:02:02 PM,07/07/2016 01:02:00 PM,01/30/2015 12:41:48 PM,ONTIME,Closed,Case Closed Case Resolved Tree pruned by Northern Tree Serv. to the City of Boston pruning specifications.,Tree Maintenance Requests,Parks & Recreation Department,Trees,Tree Maintenance Requests,PARK_Tree Maintenance Request,PARK,,,276 Washington St  Dorchester  MA  02121,7.0,03,4.0,C11,Dorchester,8.0,Ward 14,1404.0,R1,276 Washington St,2121.0,Address,146012.0,42.3011,-71.0759,Employee Generated,"(42.3011, -71.0759)"
472410,101001244985,01/09/2015 01:09:19 PM,07/07/2016 01:09:18 PM,01/30/2015 12:43:48 PM,ONTIME,Closed,Case Closed Case Noted Tree pruned by Northern Tree Serv. to the City of Boston pruning specifications.,Tree Maintenance Requests,Parks & Recreation Department,Trees,Tree Maintenance Requests,PARK_Tree Maintenance Request,PARK,,,378 Washington St  Dorchester  MA  02124,7.0,03,4.0,C11,Dorchester,9.0,Ward 17,1701.0,RC,378 Washington St,2124.0,Address,158066.0,42.2986,-71.0729,Employee Generated,"(42.2986, -71.0729)"
472411,101001244986,01/09/2015 01:11:18 PM,07/07/2016 01:11:16 PM,01/30/2015 12:44:33 PM,ONTIME,Closed,Case Closed Case Resolved Tree pruned by Northern Tree Serv. to the City of Boston pruning specifications.,Tree Maintenance Requests,Parks & Recreation Department,Trees,Tree Maintenance Requests,PARK_Tree Maintenance Request,PARK,,,389 Washington St  Dorchester  MA  02124,8.0,03,4.0,C11,Dorchester,9.0,Ward 17,1701.0,R1,389 Washington St,2124.0,Address,146057.0,42.2979,-71.0731,Employee Generated,"(42.2979, -71.0731)"
472413,101001244989,01/09/2015 01:13:54 PM,07/07/2016 01:13:54 PM,01/30/2015 12:44:52 PM,ONTIME,Closed,Case Closed Case Resolved Tree pruned by Northern Tree Serv. to the City of Boston pruning specifications.,Tree Maintenance Requests,Parks & Recreation Department,Trees,Tree Maintenance Requests,PARK_Tree Maintenance Request,PARK,,,394 Washington St  Dorchester  MA  02124,7.0,03,4.0,C11,Dorchester,9.0,Ward 17,1701.0,R2,394 Washington St,2124.0,Address,146058.0,42.2978,-71.0724,Employee Generated,"(42.2978, -71.0724)"
472414,101001244990,01/09/2015 01:17:47 PM,07/07/2016 01:17:46 PM,01/30/2015 12:46:38 PM,ONTIME,Closed,Case Closed Case Resolved Tree pruned by Northern Tree Serv. to the City of Boston pruning specifications.,Tree Maintenance Requests,Parks & Recreation Department,Trees,Tree Maintenance Requests,PARK_Tree Maintenance Request,PARK,,,411-413 Washington St  Dorchester  MA  02124,8.0,03,4.0,C11,Dorchester,9.0,Ward 17,1701.0,E,411-413 Washington St,2124.0,Address,146070.0,42.2972,-71.0727,Employee Generated,"(42.2972, -71.0727)"
472415,101001244992,01/09/2015 01:19:19 PM,07/07/2016 01:19:17 PM,01/30/2015 12:46:58 PM,ONTIME,Closed,Case Closed Case Resolved Tree pruned by Northern Tree Serv. to the City of Boston pruning specifications.,Tree Maintenance Requests,Parks & Recreation Department,Trees,Tree Maintenance Requests,PARK_Tree Maintenance Request,PARK,,,420 Washington St  Dorchester  MA  02124,7.0,03,4.0,C11,Dorchester,9.0,Ward 17,1701.0,E,420 Washington St,2124.0,Address,146073.0,42.2971,-71.0721,Employee Generated,"(42.2971, -71.0721)"
472417,101001244994,01/09/2015 01:20:26 PM,07/07/2016 01:20:25 PM,01/30/2015 12:47:20 PM,ONTIME,Closed,Case Closed Case Resolved Tree pruned by Northern Tree Serv. to the City of Boston pruning specifications.,Tree Maintenance Requests,Parks & Recreation Department,Trees,Tree Maintenance Requests,PARK_Tree Maintenance Request,PARK,,,420 Washington St  Dorchester  MA  02124,7.0,03,4.0,C11,Dorchester,9.0,Ward 17,1701.0,E,420 Washington St,2124.0,Address,146073.0,42.2971,-71.0721,Employee Generated,"(42.2971, -71.0721)"
472420,101001244997,01/09/2015 01:21:45 PM,07/07/2016 01:21:44 PM,01/30/2015 12:47:37 PM,ONTIME,Closed,Case Closed Case Resolved Tree pruned by Northern Tree Serv. to the City of Boston pruning specifications.,Tree Maintenance Requests,Parks & Recreation Department,Trees,Tree Maintenance Requests,PARK_Tree Maintenance Request,PARK,,,424 Washington St  Dorchester  MA  02124,7.0,03,4.0,C11,Dorchester,9.0,Ward 17,1701.0,E,424 Washington St,2124.0,Address,146076.0,42.2969,-71.072,Employee Generated,"(42.2969, -71.072)"
472421,101001244998,01/09/2015 01:22:53 PM,07/07/2016 01:22:52 PM,01/30/2015 12:48:18 PM,ONTIME,Closed,Case Closed Case Resolved Tree pruned by Northern Tree Serv. to the City of Boston pruning specifications.,Tree Maintenance Requests,Parks & Recreation Department,Trees,Tree Maintenance Requests,PARK_Tree Maintenance Request,PARK,,,443-449 Washington St  Dorchester  MA  02124,8.0,03,4.0,C11,Dorchester,9.0,Ward 17,1701.0,C,443-449 Washington St,2124.0,Address,146084.0,42.2961,-71.0724,Employee Generated,"(42.2961, -71.0724)"
472422,101001244999,01/09/2015 01:25:18 PM,07/07/2016 01:25:17 PM,01/30/2015 12:48:54 PM,ONTIME,Closed,Case Closed Case Resolved Tree pruned by Northern Tree Serv. to the City of Boston pruning specifications.,Tree Maintenance Requests,Parks & Recreation Department,Trees,Tree Maintenance Requests,PARK_Tree Maintenance Request,PARK,,,443-449 Washington St  Dorchester  MA  02124,8.0,03,4.0,C11,Dorchester,9.0,Ward 17,1701.0,C,443-449 Washington St,2124.0,Address,146084.0,42.2961,-71.0724,Employee Generated,"(42.2961, -71.0724)"
472423,101001245002,01/09/2015 01:26:36 PM,07/07/2016 01:26:35 PM,01/30/2015 12:49:18 PM,ONTIME,Closed,Case Closed Case Resolved Tree pruned by Northern Tree Serv. to the City of Boston pruning specifications.,Tree Maintenance Requests,Parks & Recreation Department,Trees,Tree Maintenance Requests,PARK_Tree Maintenance Request,PARK,,,443-449 Washington St  Dorchester  MA  02124,8.0,03,4.0,C11,Dorchester,9.0,Ward 17,1701.0,C,443-449 Washington St,2124.0,Address,146084.0,42.2961,-71.0724,Employee Generated,"(42.2961, -71.0724)"
472613,101001245279,01/10/2015 11:09:43 AM,07/08/2016 11:09:43 AM,05/12/2015 08:40:49 AM,ONTIME,Closed,Case Closed. Closed date : 2015-05-12 08:40:49.69 Case Resolved The tree was pruned by Northern Tree Service  to the City of Boston tree pruning specifications.,Tree Maintenance Requests,Parks & Recreation Department,Trees,Tree Maintenance Requests,PARK_Tree Maintenance Request,PARK,,,32 Mead St  Charlestown  MA  02129,3.0,1A,1.0,A15,Charlestown,2.0,Ward 2,206.0,CM,32 Mead St,2129.0,Address,93532.0,42.3803,-71.0684,Self Service,"(42.3803, -71.0684)"
472862,101001245669,01/12/2015 08:30:09 AM,07/10/2016 08:29:57 AM,01/12/2015 08:33:01 AM,ONTIME,Closed,Case Closed Case Invalid  Wrong case type created. Created a sidewalk repair case.,Tree Maintenance Requests,Parks & Recreation Department,Trees,Tree Maintenance Requests,PARK_Tree Maintenance Request,PARK,,,80 Mayfield St  Dorchester  MA  02125,7.0,03,3.0,C11,Dorchester,7.0,Ward 13,1306.0,R3,80 Mayfield St,2125.0,Address,167531.0,42.3169,-71.0608,Constituent Call,"(42.3169, -71.0608)"
472870,101001245680,01/12/2015 08:38:05 AM,07/10/2016 08:38:04 AM,05/12/2015 08:41:59 AM,ONTIME,Closed,Case Closed. Closed date : 2015-05-12 08:41:59.197 Case Resolved The tree was pruned by Northern Tree Service  to the City of Boston tree pruning specifications.,Tree Maintenance Requests,Parks & Recreation Department,Trees,Tree Maintenance Requests,PARK_Tree Maintenance Request,PARK,,,30 Monument Sq  Charlestown  MA  02129,3.0,1A,1.0,A15,Charlestown,2.0,Ward 2,203.0,CM,30 Monument Sq,2129.0,Address,97006.0,42.377,-71.0617,Employee Generated,"(42.377, -71.0617)"
472871,101001245682,01/12/2015 08:38:33 AM,07/10/2016 08:38:32 AM,05/12/2015 08:42:28 AM,ONTIME,Closed,Case Closed. Closed date : 2015-05-12 08:42:28.72 Case Resolved The tree was pruned by Northern Tree Service  to the City of Boston tree pruning specifications.,Tree Maintenance Requests,Parks & Recreation Department,Trees,Tree Maintenance Requests,PARK_Tree Maintenance Request,PARK,,,30 Monument Sq  Charlestown  MA  02129,3.0,1A,1.0,A15,Charlestown,2.0,Ward 2,203.0,CM,30 Monument Sq,2129.0,Address,97006.0,42.377,-71.0617,Employee Generated,"(42.377, -71.0617)"
472874,101001245686,01/12/2015 08:39:13 AM,07/10/2016 08:39:11 AM,05/12/2015 08:42:51 AM,ONTIME,Closed,Case Closed. Closed date : 2015-05-12 08:42:51.55 Case Resolved The tree was pruned by Northern Tree Service  to the City of Boston tree pruning specifications.,Tree Maintenance Requests,Parks & Recreation Department,Trees,Tree Maintenance Requests,PARK_Tree Maintenance Request,PARK,,,30 Monument Sq  Charlestown  MA  02129,3.0,1A,1.0,A15,Charlestown,2.0,Ward 2,203.0,CM,30 Monument Sq,2129.0,Address,97006.0,42.377,-71.0617,Employee Generated,"(42.377, -71.0617)"
472876,101001245689,01/12/2015 08:39:44 AM,07/10/2016 08:39:44 AM,05/12/2015 08:43:08 AM,ONTIME,Closed,Case Closed. Closed date : 2015-05-12 08:43:08.753 Case Resolved The tree was pruned by Northern Tree Service  to the City of Boston tree pruning specifications.,Tree Maintenance Requests,Parks & Recreation Department,Trees,Tree Maintenance Requests,PARK_Tree Maintenance Request,PARK,,,30 Monument Sq  Charlestown  MA  02129,3.0,1A,1.0,A15,Charlestown,2.0,Ward 2,203.0,CM,30 Monument Sq,2129.0,Address,97006.0,42.377,-71.0617,Employee Generated,"(42.377, -71.0617)"
472877,101001245692,01/12/2015 08:40:31 AM,07/10/2016 08:40:30 AM,05/12/2015 08:43:28 AM,ONTIME,Closed,Case Closed. Closed date : 2015-05-12 08:43:28.047 Case Noted The tree was pruned by Northern Tree Service  to the City of Boston tree pruning specifications.,Tree Maintenance Requests,Parks & Recreation Department,Trees,Tree Maintenance Requests,PARK_Tree Maintenance Request,PARK,,,30 Monument Sq  Charlestown  MA  02129,3.0,1A,1.0,A15,Charlestown,2.0,Ward 2,203.0,CM,30 Monument Sq,2129.0,Address,97006.0,42.377,-71.0617,Employee Generated,"(42.377, -71.0617)"
472882,101001245698,01/12/2015 08:41:18 AM,07/10/2016 08:41:17 AM,05/12/2015 08:43:48 AM,ONTIME,Closed,Case Closed. Closed date : 2015-05-12 08:43:48.45 Case Noted The tree was pruned by Northern Tree Service  to the City of Boston tree pruning specifications.,Tree Maintenance Requests,Parks & Recreation Department,Trees,Tree Maintenance Requests,PARK_Tree Maintenance Request,PARK,,,30 Monument Sq  Charlestown  MA  02129,3.0,1A,1.0,A15,Charlestown,2.0,Ward 2,203.0,CM,30 Monument Sq,2129.0,Address,97006.0,42.377,-71.0617,Employee Generated,"(42.377, -71.0617)"
472883,101001245699,01/12/2015 08:41:43 AM,07/10/2016 08:41:42 AM,05/12/2015 08:44:05 AM,ONTIME,Closed,Case Closed. Closed date : 2015-05-12 08:44:05.517 Case Resolved The tree was pruned by Northern Tree Service  to the City of Boston tree pruning specifications.,Tree Maintenance Requests,Parks & Recreation Department,Trees,Tree Maintenance Requests,PARK_Tree Maintenance Request,PARK,,,30 Monument Sq  Charlestown  MA  02129,3.0,1A,1.0,A15,Charlestown,2.0,Ward 2,203.0,CM,30 Monument Sq,2129.0,Address,97006.0,42.377,-71.0617,Employee Generated,"(42.377, -71.0617)"
472888,101001245705,01/12/2015 08:43:46 AM,07/10/2016 08:42:33 AM,05/12/2015 08:44:24 AM,ONTIME,Closed,Case Closed. Closed date : 2015-05-12 08:44:24.717 Case Resolved The tree was pruned by Northern Tree Service  to the City of Boston tree pruning specifications.,Tree Maintenance Requests,Parks & Recreation Department,Trees,Tree Maintenance Requests,PARK_Tree Maintenance Request,PARK,,,30 Monument Sq  Charlestown  MA  02129,3.0,1A,1.0,A15,Charlestown,2.0,Ward 2,203.0,CM,30 Monument Sq,2129.0,Address,97006.0,42.377,-71.0617,Employee Generated,"(42.377, -71.0617)"
472889,101001245707,01/12/2015 08:44:22 AM,07/10/2016 08:44:21 AM,05/12/2015 08:44:41 AM,ONTIME,Closed,Case Closed. Closed date : 2015-05-12 08:44:41.95 Case Resolved The tree was pruned by Northern Tree Service  to the City of Boston tree pruning specifications.,Tree Maintenance Requests,Parks & Recreation Department,Trees,Tree Maintenance Requests,PARK_Tree Maintenance Request,PARK,,,30 Monument Sq  Charlestown  MA  02129,3.0,1A,1.0,A15,Charlestown,2.0,Ward 2,203.0,CM,30 Monument Sq,2129.0,Address,97006.0,42.377,-71.0617,Employee Generated,"(42.377, -71.0617)"
472902,101001245720,01/12/2015 08:52:52 AM,07/10/2016 08:52:51 AM,01/30/2015 12:49:41 PM,ONTIME,Closed,Case Closed Case Resolved Tree pruned by Northern Tree Serv. to the City of Boston pruning specifications.,Tree Maintenance Requests,Parks & Recreation Department,Trees,Tree Maintenance Requests,PARK_Tree Maintenance Request,PARK,,,451 Washington St  Dorchester  MA  02124,8.0,03,4.0,C11,Dorchester,9.0,Ward 17,1701.0,E,451 Washington St,2124.0,Address,146086.0,42.2957,-71.0725,Employee Generated,"(42.2957, -71.0725)"
472904,101001245723,01/12/2015 08:55:22 AM,07/10/2016 08:55:21 AM,01/30/2015 12:50:02 PM,ONTIME,Closed,Case Closed Case Resolved Tree pruned by Northern Tree Serv. to the City of Boston pruning specifications.,Tree Maintenance Requests,Parks & Recreation Department,Trees,Tree Maintenance Requests,PARK_Tree Maintenance Request,PARK,,,451 Washington St  Dorchester  MA  02124,8.0,03,4.0,C11,Dorchester,9.0,Ward 17,1701.0,E,451 Washington St,2124.0,Address,146086.0,42.2957,-71.0725,Employee Generated,"(42.2957, -71.0725)"
472907,101001245726,01/12/2015 08:56:33 AM,07/10/2016 08:56:32 AM,01/30/2015 12:50:22 PM,ONTIME,Closed,Case Closed Case Resolved Tree pruned by Northern Tree Serv. to the City of Boston pruning specifications.,Tree Maintenance Requests,Parks & Recreation Department,Trees,Tree Maintenance Requests,PARK_Tree Maintenance Request,PARK,,,481 Washington St  Dorchester  MA  02124,8.0,07,4.0,C11,Dorchester,9.0,Ward 17,1703.0,C,481 Washington St,2124.0,Address,146093.0,42.2947,-71.0722,Employee Generated,"(42.2947, -71.0722)"
472908,101001245727,01/12/2015 08:57:57 AM,07/10/2016 08:57:54 AM,01/30/2015 12:50:40 PM,ONTIME,Closed,Case Closed Case Resolved Tree pruned by Northern Tree Serv. to the City of Boston pruning specifications.,Tree Maintenance Requests,Parks & Recreation Department,Trees,Tree Maintenance Requests,PARK_Tree Maintenance Request,PARK,,,555 Washington St  Dorchester  MA  02124,8.0,07,4.0,C11,Dorchester,9.0,Ward 17,1703.0,C,555 Washington St,2124.0,Address,332517.0,42.2923,-71.072,Employee Generated,"(42.2923, -71.072)"
472911,101001245730,01/12/2015 08:59:18 AM,07/10/2016 08:59:17 AM,04/01/2015 08:07:11 AM,ONTIME,Closed,Case Closed Case Resolved The tree was pruned by Northern Tree Service  to the City of Boston tree pruning specifications.,Tree Maintenance Requests,Parks & Recreation Department,Trees,Tree Maintenance Requests,PARK_Tree Maintenance Request,PARK,,,259 Bunker Hill St  Charlestown  MA  02129,3.0,1A,1.0,A15,Charlestown,2.0,Ward 2,205.0,CC,259 Bunker Hill St,2129.0,Address,23428.0,42.3799,-71.0643,Employee Generated,"(42.3799, -71.0643)"
472912,101001245732,01/12/2015 08:59:58 AM,07/10/2016 08:59:56 AM,01/30/2015 12:59:39 PM,ONTIME,Closed,Case Closed Case Resolved Tree pruned by Northern Tree Serv. to the City of Boston pruning specifications.,Tree Maintenance Requests,Parks & Recreation Department,Trees,Tree Maintenance Requests,PARK_Tree Maintenance Request,PARK,,,555 Washington St  Dorchester  MA  02124,8.0,07,4.0,C11,Dorchester,9.0,Ward 17,1703.0,C,555 Washington St,2124.0,Address,332517.0,42.2923,-71.072,Employee Generated,"(42.2923, -71.072)"
472913,101001245733,01/12/2015 08:59:58 AM,07/10/2016 08:59:58 AM,04/01/2015 08:06:34 AM,ONTIME,Closed,Case Closed Case Resolved The tree was pruned by Northern Tree Service  to the City of Boston tree pruning specifications.,Tree Maintenance Requests,Parks & Recreation Department,Trees,Tree Maintenance Requests,PARK_Tree Maintenance Request,PARK,,,253 Bunker Hill St  Charlestown  MA  02129,3.0,1A,1.0,A15,Charlestown,2.0,Ward 2,205.0,CD,253 Bunker Hill St,2129.0,Address,23418.0,42.3799,-71.0643,Employee Generated,"(42.3799, -71.0643)"
472916,101001245736,01/12/2015 09:01:30 AM,07/10/2016 09:01:29 AM,01/30/2015 01:01:13 PM,ONTIME,Closed,Case Closed Case Resolved Tree pruned by Northern Tree Serv. to the City of Boston pruning specifications.,Tree Maintenance Requests,Parks & Recreation Department,Trees,Tree Maintenance Requests,PARK_Tree Maintenance Request,PARK,,,670 Washington St  Dorchester  MA  02124,8.0,07,4.0,C11,Dorchester,8.0,Ward 17,1706.0,E,670 Washington St,2124.0,Address,156211.0,42.2884,-71.0708,Employee Generated,"(42.2884, -71.0708)"
472917,101001245738,01/12/2015 09:02:30 AM,07/10/2016 09:02:28 AM,01/30/2015 01:01:30 PM,ONTIME,Closed,Case Closed Case Resolved Tree pruned by Northern Tree Serv. to the City of Boston pruning specifications.,Tree Maintenance Requests,Parks & Recreation Department,Trees,Tree Maintenance Requests,PARK_Tree Maintenance Request,PARK,,,689 Washington St  Dorchester  MA  02124,8.0,07,4.0,C11,Dorchester,9.0,Ward 17,1708.0,R3,689 Washington St,2124.0,Address,146144.0,42.2875,-71.0714,Employee Generated,"(42.2875, -71.0714)"
472919,101001245740,01/12/2015 09:03:33 AM,07/10/2016 09:03:32 AM,01/30/2015 01:01:48 PM,ONTIME,Closed,Case Closed Case Resolved Tree pruned by Northern Tree Serv. to the City of Boston pruning specifications.,Tree Maintenance Requests,Parks & Recreation Department,Trees,Tree Maintenance Requests,PARK_Tree Maintenance Request,PARK,,,691-691H Washington St  Dorchester  MA  02124,8.0,07,4.0,C11,Dorchester,9.0,Ward 17,1708.0,R2,691-691H Washington St,2124.0,Address,146145.0,42.2874,-71.0714,Employee Generated,"(42.2874, -71.0714)"
472921,101001245742,01/12/2015 09:04:44 AM,07/10/2016 09:04:43 AM,01/30/2015 01:02:09 PM,ONTIME,Closed,Case Closed Case Resolved Tree pruned by Northern Tree Serv. to the City of Boston pruning specifications.,Tree Maintenance Requests,Parks & Recreation Department,Trees,Tree Maintenance Requests,PARK_Tree Maintenance Request,PARK,,,699 Washington St  Dorchester  MA  02124,8.0,07,4.0,C11,Dorchester,9.0,Ward 17,1708.0,R3,699 Washington St,2124.0,Address,146149.0,42.2871,-71.0714,Employee Generated,"(42.2871, -71.0714)"
472922,101001245743,01/12/2015 09:06:15 AM,07/10/2016 09:06:14 AM,01/30/2015 01:02:27 PM,ONTIME,Closed,Case Closed Case Resolved Tree pruned by Northern Tree Serv. to the City of Boston pruning specifications.,Tree Maintenance Requests,Parks & Recreation Department,Trees,Tree Maintenance Requests,PARK_Tree Maintenance Request,PARK,,,701 Washington St  Dorchester  MA  02124,8.0,07,4.0,C11,Dorchester,9.0,Ward 17,1708.0,R1,701 Washington St,2124.0,Address,146150.0,42.287,-71.0714,Employee Generated,"(42.287, -71.0714)"
472925,101001245746,01/12/2015 09:08:04 AM,07/10/2016 09:08:03 AM,01/30/2015 01:02:45 PM,ONTIME,Closed,Case Closed Case Resolved Tree pruned by Northern Tree Serv. to the City of Boston pruning specifications.,Tree Maintenance Requests,Parks & Recreation Department,Trees,Tree Maintenance Requests,PARK_Tree Maintenance Request,PARK,,,703 Washington St  Dorchester  MA  02124,8.0,07,4.0,C11,Dorchester,9.0,Ward 17,1708.0,R1,703 Washington St,2124.0,Address,146152.0,42.2869,-71.0714,Employee Generated,"(42.2869, -71.0714)"
472928,101001245749,01/12/2015 09:09:34 AM,07/10/2016 09:09:33 AM,01/30/2015 01:03:44 PM,ONTIME,Closed,Case Closed Case Resolved Tree pruned by Northern Tree Serv. to the City of Boston pruning specifications.,Tree Maintenance Requests,Parks & Recreation Department,Trees,Tree Maintenance Requests,PARK_Tree Maintenance Request,PARK,,,706 Washington St  Dorchester  MA  02124,8.0,07,4.0,C11,Dorchester,8.0,Ward 17,1709.0,RC,706 Washington St,2124.0,Address,171210.0,42.287,-71.0709,Employee Generated,"(42.287, -71.0709)"
472929,101001245751,01/12/2015 09:10:33 AM,07/10/2016 09:10:32 AM,01/30/2015 01:04:04 PM,ONTIME,Closed,Case Closed Case Resolved Tree pruned by Northern Tree Serv. to the City of Boston pruning specifications.,Tree Maintenance Requests,Parks & Recreation Department,Trees,Tree Maintenance Requests,PARK_Tree Maintenance Request,PARK,,,707 Washington St  Dorchester  MA  02124,8.0,07,4.0,C11,Dorchester,9.0,Ward 17,1708.0,R2,707 Washington St,2124.0,Address,146154.0,42.2867,-71.0714,Employee Generated,"(42.2867, -71.0714)"
472932,101001245757,01/12/2015 09:11:44 AM,07/10/2016 09:11:43 AM,01/30/2015 01:04:23 PM,ONTIME,Closed,Case Closed Case Resolved Tree pruned by Northern Tree Serv. to the City of Boston pruning specifications.,Tree Maintenance Requests,Parks & Recreation Department,Trees,Tree Maintenance Requests,PARK_Tree Maintenance Request,PARK,,,709 Washington St  Dorchester  MA  02124,8.0,07,4.0,C11,Dorchester,9.0,Ward 17,1708.0,R2,709 Washington St,2124.0,Address,146155.0,42.2867,-71.0714,Employee Generated,"(42.2867, -71.0714)"
472934,101001245763,01/12/2015 09:14:00 AM,07/10/2016 09:13:59 AM,01/30/2015 01:04:47 PM,ONTIME,Closed,Case Closed Case Resolved Tree pruned by Northern Tree Serv. to the City of Boston pruning specifications.,Tree Maintenance Requests,Parks & Recreation Department,Trees,Tree Maintenance Requests,PARK_Tree Maintenance Request,PARK,,,724 Washington St  Dorchester  MA  02124,8.0,07,4.0,C11,Dorchester,8.0,Ward 17,1709.0,RC,724 Washington St,2124.0,Address,332619.0,42.2866,-71.071,Employee Generated,"(42.2866, -71.071)"
472936,101001245766,01/12/2015 09:15:04 AM,07/10/2016 09:15:03 AM,01/30/2015 01:05:04 PM,ONTIME,Closed,Case Closed Case Resolved Tree pruned by Northern Tree Serv. to the City of Boston pruning specifications.,Tree Maintenance Requests,Parks & Recreation Department,Trees,Tree Maintenance Requests,PARK_Tree Maintenance Request,PARK,,,739 Washington St  Dorchester  MA  02124,8.0,07,4.0,C11,Dorchester,9.0,Ward 17,1708.0,I,739 Washington St,2124.0,Address,171214.0,42.2857,-71.0717,Employee Generated,"(42.2857, -71.0717)"
472937,101001245768,01/12/2015 09:16:31 AM,07/10/2016 09:16:30 AM,01/30/2015 01:05:29 PM,ONTIME,Closed,Case Closed Case Resolved Tree pruned by Northern Tree Serv. to the City of Boston pruning specifications.,Tree Maintenance Requests,Parks & Recreation Department,Trees,Tree Maintenance Requests,PARK_Tree Maintenance Request,PARK,,,742 Washington St  Dorchester  MA  02124,8.0,07,4.0,C11,Dorchester,8.0,Ward 17,1709.0,R3,742 Washington St,2124.0,Address,146166.0,42.2859,-71.0709,Employee Generated,"(42.2859, -71.0709)"
472938,101001245770,01/12/2015 09:17:33 AM,07/10/2016 09:17:32 AM,01/30/2015 01:07:38 PM,ONTIME,Closed,Case Closed Case Resolved Tree pruned by Northern Tree Serv. to the City of Boston pruning specifications.,Tree Maintenance Requests,Parks & Recreation Department,Trees,Tree Maintenance Requests,PARK_Tree Maintenance Request,PARK,,,744 Washington St  Dorchester  MA  02124,8.0,07,4.0,C11,Dorchester,8.0,Ward 17,1709.0,R3,744 Washington St,2124.0,Address,146167.0,42.2858,-71.0709,Employee Generated,"(42.2858, -71.0709)"
472939,101001245771,01/12/2015 09:18:32 AM,07/10/2016 09:18:30 AM,01/30/2015 01:07:57 PM,ONTIME,Closed,Case Closed Case Resolved Tree pruned by Northern Tree Serv. to the City of Boston pruning specifications.,Tree Maintenance Requests,Parks & Recreation Department,Trees,Tree Maintenance Requests,PARK_Tree Maintenance Request,PARK,,,746-746A Washington St  Dorchester  MA  02124,8.0,07,4.0,C11,Dorchester,8.0,Ward 17,1709.0,E,746-746A Washington St,2124.0,Address,146168.0,42.2857,-71.0709,Employee Generated,"(42.2857, -71.0709)"
472941,101001245774,01/12/2015 09:19:44 AM,07/10/2016 09:19:43 AM,01/30/2015 01:08:18 PM,ONTIME,Closed,Case Closed Case Resolved Tree pruned by Northern Tree Serv. to the City of Boston pruning specifications.,Tree Maintenance Requests,Parks & Recreation Department,Trees,Tree Maintenance Requests,PARK_Tree Maintenance Request,PARK,,,751 Washington St  Dorchester  MA  02124,8.0,07,4.0,C11,Dorchester,9.0,Ward 17,1708.0,A,751 Washington St,2124.0,Address,146169.0,42.2852,-71.0715,Employee Generated,"(42.2852, -71.0715)"
472943,101001245777,01/12/2015 09:21:42 AM,07/10/2016 09:21:41 AM,01/30/2015 01:08:35 PM,ONTIME,Closed,Case Closed Case Resolved Tree pruned by Northern Tree Serv. to the City of Boston pruning specifications.,Tree Maintenance Requests,Parks & Recreation Department,Trees,Tree Maintenance Requests,PARK_Tree Maintenance Request,PARK,,,751 Washington St  Dorchester  MA  02124,8.0,07,4.0,C11,Dorchester,9.0,Ward 17,1708.0,A,751 Washington St,2124.0,Address,146169.0,42.2852,-71.0715,Employee Generated,"(42.2852, -71.0715)"
472944,101001245778,01/12/2015 09:22:19 AM,07/10/2016 09:22:18 AM,04/01/2015 09:09:31 AM,ONTIME,Closed,Case Closed Case Resolved The tree was pruned by Northern Tree Service  to the City of Boston tree pruning specifications.,Tree Maintenance Requests,Parks & Recreation Department,Trees,Tree Maintenance Requests,PARK_Tree Maintenance Request,PARK,,,32 First Ave  Charlestown  MA  02129,3.0,1A,1.0,A15,Charlestown,2.0,Ward 2,202.0,E,32 First Ave,2129.0,Address,165263.0,42.3748,-71.055,Employee Generated,"(42.3748, -71.055)"
472945,101001245779,01/12/2015 09:22:43 AM,07/10/2016 09:22:42 AM,04/01/2015 09:09:49 AM,ONTIME,Closed,Case Closed Case Resolved The tree was pruned by Northern Tree Service  to the City of Boston tree pruning specifications.,Tree Maintenance Requests,Parks & Recreation Department,Trees,Tree Maintenance Requests,PARK_Tree Maintenance Request,PARK,,,32 First Ave  Charlestown  MA  02129,3.0,1A,1.0,A15,Charlestown,2.0,Ward 2,202.0,E,32 First Ave,2129.0,Address,165263.0,42.3748,-71.055,Employee Generated,"(42.3748, -71.055)"
472946,101001245780,01/12/2015 09:22:48 AM,07/10/2016 09:22:47 AM,01/30/2015 01:08:54 PM,ONTIME,Closed,Case Closed Case Resolved Tree pruned by Northern Tree Serv. to the City of Boston pruning specifications.,Tree Maintenance Requests,Parks & Recreation Department,Trees,Tree Maintenance Requests,PARK_Tree Maintenance Request,PARK,,,758 Washington St  Dorchester  MA  02124,8.0,07,4.0,C11,Dorchester,8.0,Ward 17,1709.0,RC,758 Washington St,2124.0,Address,332649.0,42.2854,-71.0709,Employee Generated,"(42.2854, -71.0709)"
472948,101001245782,01/12/2015 09:23:14 AM,07/10/2016 09:23:13 AM,04/01/2015 09:10:10 AM,ONTIME,Closed,Case Closed Case Resolved The tree was pruned by Northern Tree Service  to the City of Boston tree pruning specifications.,Tree Maintenance Requests,Parks & Recreation Department,Trees,Tree Maintenance Requests,PARK_Tree Maintenance Request,PARK,,,32 First Ave  Charlestown  MA  02129,3.0,1A,1.0,A15,Charlestown,2.0,Ward 2,202.0,E,32 First Ave,2129.0,Address,165263.0,42.3748,-71.055,Employee Generated,"(42.3748, -71.055)"
472950,101001245785,01/12/2015 09:23:37 AM,07/10/2016 09:23:37 AM,04/01/2015 09:10:31 AM,ONTIME,Closed,Case Closed Case Resolved The tree was pruned by Northern Tree Service  to the City of Boston tree pruning specifications.,Tree Maintenance Requests,Parks & Recreation Department,Trees,Tree Maintenance Requests,PARK_Tree Maintenance Request,PARK,,,32 First Ave  Charlestown  MA  02129,3.0,1A,1.0,A15,Charlestown,2.0,Ward 2,202.0,E,32 First Ave,2129.0,Address,165263.0,42.3748,-71.055,Employee Generated,"(42.3748, -71.055)"
472951,101001245786,01/12/2015 09:23:50 AM,07/10/2016 09:23:49 AM,01/30/2015 01:10:43 PM,ONTIME,Closed,Case Closed Case Resolved Tree pruned by Northern Tree Serv. to the City of Boston pruning specifications.,Tree Maintenance Requests,Parks & Recreation Department,Trees,Tree Maintenance Requests,PARK_Tree Maintenance Request,PARK,,,824 Washington St  Dorchester  MA  02124,8.0,07,4.0,C11,Dorchester,8.0,Ward 17,1711.0,R3,824 Washington St,2124.0,Address,146193.0,42.283,-71.0711,Employee Generated,"(42.283, -71.0711)"
472952,101001245787,01/12/2015 09:24:00 AM,07/10/2016 09:24:00 AM,04/01/2015 09:10:48 AM,ONTIME,Closed,Case Closed Case Resolved The tree was pruned by Northern Tree Service  to the City of Boston tree pruning specifications.,Tree Maintenance Requests,Parks & Recreation Department,Trees,Tree Maintenance Requests,PARK_Tree Maintenance Request,PARK,,,32 First Ave  Charlestown  MA  02129,3.0,1A,1.0,A15,Charlestown,2.0,Ward 2,202.0,E,32 First Ave,2129.0,Address,165263.0,42.3748,-71.055,Employee Generated,"(42.3748, -71.055)"
472954,101001245789,01/12/2015 09:24:25 AM,07/10/2016 09:24:24 AM,04/01/2015 09:11:12 AM,ONTIME,Closed,Case Closed Case Resolved The tree was pruned by Northern Tree Service  to the City of Boston tree pruning specifications.,Tree Maintenance Requests,Parks & Recreation Department,Trees,Tree Maintenance Requests,PARK_Tree Maintenance Request,PARK,,,32 First Ave  Charlestown  MA  02129,3.0,1A,1.0,A15,Charlestown,2.0,Ward 2,202.0,E,32 First Ave,2129.0,Address,165263.0,42.3748,-71.055,Employee Generated,"(42.3748, -71.055)"
472955,101001245790,01/12/2015 09:24:53 AM,07/10/2016 09:24:52 AM,01/30/2015 01:11:02 PM,ONTIME,Closed,Case Closed Case Resolved Tree pruned by Northern Tree Serv. to the City of Boston pruning specifications.,Tree Maintenance Requests,Parks & Recreation Department,Trees,Tree Maintenance Requests,PARK_Tree Maintenance Request,PARK,,,891-893 Washington St  Dorchester  MA  02124,8.0,07,3.0,C11,Dorchester,7.0,Ward 17,1704.0,R2,891-893 Washington St,2124.0,Address,146215.0,42.2805,-71.0708,Employee Generated,"(42.2805, -71.0708)"
