,CASE_ENQUIRY_ID,OPEN_DT,TARGET_DT,CLOSED_DT,OnTime_Status,CASE_STATUS,CLOSURE_REASON,CASE_TITLE,SUBJECT,REASON,TYPE,QUEUE,Department,SubmittedPhoto,ClosedPhoto,Location,fire_district,pwd_district,city_council_district,police_district,neighborhood,neighborhood_services_district,ward,precinct,land_usage,LOCATION_STREET_NAME,LOCATION_ZIPCODE,Property_Type,Property_ID,LATITUDE,LONGITUDE,Source,Geocoded_Location
469475,101001240772,01/01/2015 09:33:25 AM,,04/09/2015 11:46:23 AM,ONTIME,Closed,Case Closed Case Resolved Made safe futher questions call.617-635-3126 TY Dominic,Utility Casting Repair,Public Works Department,Highway Maintenance,Utility Casting Repair,BTDT_Traffic Signal_Repair,BTDT,https://cityworker.cityofboston.gov:8443/attachments/report/54a55ab1d052065cdb4ccb42/photo/Report.jpg,,73 Tremont St  Boston  MA  02108,3.0,1B,1.0,A1,Boston,3.0,03,306.0,,73 Tremont St,2108.0,Address,347781.0,42.3594,-71.0587,City Worker App,"(0, 0)"
470830,101001242733,01/06/2015 06:29:40 AM,,01/08/2015 08:04:53 AM,ONTIME,Closed,Case Closed Case Resolved The Boston Public Works Department Construction Inspection Unit (CIU) has identified the casting cover needing replacement as belonging to Crown Castle.    Crown Castle has been notified to repair the casting as soon as possible.     The location has been entered into the CIU data base that tracks repairs to be made by utility companies or private contractors.    The CIU will monitor the progress of the repair.     Sincerely     Mark Cardarelli  Supervisor of Utility Coordination and Compliance  Boston Public Works Department  617-635-4951 Office,Utility Casting Repair,Public Works Department,Highway Maintenance,Utility Casting Repair,PWDx_Utility Casting Repair,PWDx,https://cityworker.cityofboston.gov:8443/attachments/report/54abc723d052065cdb4ced2a/photo/Report.jpg,,INTERSECTION of Dudley St & Magazine St  Roxbury  MA,7.0,03,7.0,B2,Roxbury,13.0,Ward 8,805.0,,INTERSECTION Dudley St & Magazine St,,Intersection,4278.0,42.3252,-71.0749,City Worker App,"(42.3252, -71.0749)"
487385,101001266327,02/01/2015 05:43:59 AM,,02/26/2015 09:59:07 AM,ONTIME,Closed,Case Closed Case Resolved National Grid has been notified to repair the sunken patch.      The CIU has entered into the database that is tracking eroded castings and sunken patches that  need patching after the snow storms.    The CIU will monitor the progress of the repair.    Sincerely      Mark Cardarelli  Supervisor of Utility Coordination and Compliance  Boston Public Works Department  617-635-4951 Office,Utility Casting Repair,Public Works Department,Highway Maintenance,Utility Casting Repair,PWDx_Utility Casting Repair,PWDx,,,2000 Centre St  West Roxbury  MA  02132,12.0,06,6.0,E5,West Roxbury,12.0,Ward 20,2014.0,C,2000 Centre St,2132.0,Address,27777.0,42.2817,-71.1576,City Worker App,"(42.2817, -71.1576)"
515475,101001306026,02/19/2015 09:19:37 AM,,04/03/2015 11:28:19 AM,ONTIME,Closed,Case Closed Case Resolved REPAIRED FRAME & COVER ON METER BOX 3/30,Utility Casting Repair,Public Works Department,Highway Maintenance,Utility Casting Repair,BWSC_All Cases,BWSC,https://cityworker.cityofboston.gov:8443/attachments/report/54e5f0f5d052841a638fdfdf/photo/Report.jpg,,257 Chelsea St  East Boston  MA  02128,1.0,09,1.0,A7,East Boston,1.0,Ward 1,105.0,R3,257 Chelsea St,2128.0,Address,205999.0,42.3762,-71.0313,City Worker App,"(42.3762, -71.0313)"
515504,101001306071,02/19/2015 09:29:30 AM,,02/23/2015 07:42:30 AM,ONTIME,Closed,Case Closed Case Resolved The Public Works Construction Inspection Unit (CIU) has identified  the defective cast iron structure as belonging to N.Star Electric    N.Star Electric has been notified that they must repair the casting ASAP    The location has been entered into the CIU data base that tracks repairs to be made by utility companies or private contractors.    The CIU will monitor the progress of the repair.    Mark Cardarelli  Supervisor of Utility Coordination and Compliance  Boston Public Works Department  617-635-4951 Office,Utility Casting Repair,Public Works Department,Highway Maintenance,Utility Casting Repair,PWDx_Utility Casting Repair,PWDx,https://cityworker.cityofboston.gov:8443/attachments/report/54e5f347d052841a638fe000/photo/Report.jpg,,77 Horace St  East Boston  MA  02128,1.0,09,1.0,A7,East Boston,1.0,Ward 1,111.0,R2,77 Horace St,2128.0,Address,75346.0,42.3822,-71.0167,City Worker App,"(42.3822, -71.0167)"
519582,101001312101,02/23/2015 11:04:54 AM,,02/26/2015 09:15:50 AM,ONTIME,Closed,Case Closed Case Resolved National Grid has been notified to repair the sunken patch.      The CIU has entered into the database that is tracking eroded castings and sunken patches that  need patching after the snow storms.    The CIU will monitor the progress of the repair.    Sincerely      Mark Cardarelli  Supervisor of Utility Coordination and Compliance  Boston Public Works Department  617-635-4951 Office,Utility Casting Repair,Public Works Department,Highway Maintenance,Utility Casting Repair,PWDx_Utility Casting Repair,PWDx,https://cityworker.cityofboston.gov:8443/attachments/report/54eb4fa4d052841a638ff54a/photo/Report.jpg,,6-4 Columbia Rd  Dorchester  MA  02121,7.0,03,4.0,B2,Greater Mattapan,13.0,Ward 14,1403.0,RC,6-4 Columbia Rd,2121.0,Address,35314.0,42.3037,-71.0846,City Worker App,"(42.3037, -71.0846)"
524963,101001319941,02/28/2015 11:17:42 AM,,03/23/2015 12:49:03 PM,ONTIME,Closed,Case Closed Case Resolved HYDRANT REPAIRED 3/20,Utility Casting Repair,Public Works Department,Highway Maintenance,Utility Casting Repair,BWSC_All Cases,BWSC,https://cityworker.cityofboston.gov:8443/attachments/report/54f1ea22d052841a63902a44/photo/Report.jpg,,INTERSECTION of Congress St & Hanover St  Boston  MA,3.0,1B,1.0,A1,Downtown / Financial District,3.0,Ward 3,306.0,,INTERSECTION Congress St & Hanover St,,Intersection,3428.0,42.3616,-71.0576,City Worker App,"(42.3616, -71.0576)"
529998,101001327683,03/09/2015 10:53:22 AM,,03/10/2015 11:20:30 AM,ONTIME,Closed,Case Closed Case Resolved The Construction Inspection Unit (CIU) Inspector determined this casting as belonging to National Grid.    National Grid has been notified and informed to make the necessary repairs ASAP,Utility Casting Repair,Public Works Department,Highway Maintenance,Utility Casting Repair,PWDx_Utility Casting Repair,PWDx,https://cityworker.cityofboston.gov:8443/attachments/report/54fdb3dfd052dab9f2a8308c/photo/Report.jpg,,135 Grampian Way  Dorchester  MA  02125,7.0,03,3.0,C11,Dorchester,7.0,Ward 13,1310.0,R2,135 Grampian Way,2125.0,Address,65660.0,42.3099,-71.049,City Worker App,"(42.3099, -71.049)"
534199,101001333938,03/16/2015 11:06:18 AM,,03/18/2015 08:04:43 AM,ONTIME,Closed,Case Closed Case Resolved National Grid has been notified to repair the sunken patch within 5 business days.      The CIU has entered into the database that is tracking eroded castings and sunken patches that  need patching after the snow storms.    The CIU will monitor the progress of the repair.    Sincerely      Mark Cardarelli  Supervisor of Utility Coordination and Compliance  Boston Public Works Department  617-635-4951 Office,Utility Casting Repair,Public Works Department,Highway Maintenance,Utility Casting Repair,PWDx_Utility Casting Repair,PWDx,https://cityworker.cityofboston.gov:8443/attachments/report/5506f165d052dab9f2a88e16/photo/Report.jpg,,121 E Cottage St  Dorchester  MA  02125,,,0.0,,Dorchester,0.0,07,,,121 E Cottage St,2125.0,Address,348864.0,42.3594,-71.0587,City Worker App,"(0, 0)"
534821,101001334830,03/17/2015 10:31:14 AM,,03/18/2015 08:30:29 PM,ONTIME,Closed,Case Closed Case Resolved case location 1474 dot ave. replaced. clif,Utility Casting Repair/printed,Public Works Department,Highway Maintenance,Utility Casting Repair,PWDx_Street Light_General Lighting Request,PWDx,https://cityworker.cityofboston.gov:8443/attachments/report/55083aacd052dab9f2a89e30/photo/Report.jpg,,8 Centervale Park  Dorchester  MA  02124,8.0,07,3.0,C11,Dorchester,7.0,Ward 16,1601.0,R1,8 Centervale Park,2124.0,Address,27264.0,42.2965,-71.0637,City Worker App,"(42.2965, -71.0637)"
535839,101001336154,03/18/2015 10:56:39 AM,,03/24/2015 08:21:05 AM,ONTIME,Closed,Case Closed Case Resolved Dear ConDear Constituent       The Construction Inspection Unit (CIU)  Inspector has identified the cut that needs repair as belonging to National Grid.      National Grid has been notified that the repairs must be made ASAP.  The CIU has added the location to its data base that tracks unacceptable utility work.    The CIU will monitor the progress of the work.    Sincerely     Mark Cardarelli  Supervisor of Utility Coordination and Compliance  Boston Public Works Department  617-635-4951 Office,Utility Casting Repair,Public Works Department,Highway Maintenance,Utility Casting Repair,PWDx_Utility Casting Repair,PWDx,https://cityworker.cityofboston.gov:8443/attachments/report/55099223d052dab9f2a8b1d3/photo/Report.jpg,,644 Columbia Rd  Dorchester  MA  02125,7.0,03,7.0,B2,Dorchester,13.0,Ward 7,710.0,R2,644 Columbia Rd,2125.0,Address,35330.0,42.3186,-71.0638,City Worker App,"(42.3186, -71.0638)"
535936,101001336296,03/18/2015 12:40:24 PM,,03/23/2015 08:49:08 AM,ONTIME,Closed,Case Closed Case Resolved The picture and location do not match up.    If this location is still a problem please send this re submit to us.,Utility Casting Repair,Public Works Department,Highway Maintenance,Utility Casting Repair,PWDx_Utility Casting Repair,PWDx,https://cityworker.cityofboston.gov:8443/attachments/report/5509aa77d052dab9f2a8b56c/photo/Report.jpg,,390 Geneva Ave  Dorchester  MA  02122,7.0,03,4.0,C11,Dorchester,8.0,Ward 15,1505.0,R3,390 Geneva Ave,2122.0,Address,63326.0,42.3015,-71.0679,City Worker App,"(42.3015, -71.0679)"
537242,101001338096,03/20/2015 10:05:59 AM,,03/25/2015 02:26:55 PM,ONTIME,Closed,Case Closed Case Resolved This cut belongs to National Grid.    National Grid has been notified to make the necessary repairs.    The CIU will monitor the location.,Utility Casting Repair,Public Works Department,Highway Maintenance,Utility Casting Repair,PWDx_Utility Casting Repair,PWDx,https://cityworker.cityofboston.gov:8443/attachments/report/550c2943d052dab9f2a8da01/photo/Report.jpg,,2 Marden Ave  Dorchester  MA  02124,8.0,07,4.0,B3,Greater Mattapan,9.0,Ward 14,1413.0,CD,2 Marden Ave,2124.0,Address,89640.0,42.2847,-71.0865,City Worker App,"(42.2847, -71.0865)"
537835,101001338858,03/21/2015 09:18:06 AM,,03/21/2015 09:18:07 AM,ONTIME,Closed,Case Closed Case Resolved Marked completed at case creation,Utility Casting Repair,Public Works Department,Highway Maintenance,Utility Casting Repair,PWDx_Utility Casting Repair,PWDx,https://cityworker.cityofboston.gov:8443/attachments/report/550d6f89d052dab9f2a8e579/photo/Report.jpg,,76-80 Dartmouth St  Boston  MA  02116,4.0,1C,2.0,D4,South End,6.0,Ward 4,401.0,RC,76-80 Dartmouth St,2116.0,Address,46539.0,42.3452,-71.075,City Worker App,"(42.3452, -71.075)"
537836,101001338859,03/21/2015 09:18:17 AM,,03/21/2015 09:18:18 AM,ONTIME,Closed,Case Closed Case Resolved Marked completed at case creation,Utility Casting Repair,Public Works Department,Highway Maintenance,Utility Casting Repair,PWDx_Utility Casting Repair,PWDx,https://cityworker.cityofboston.gov:8443/attachments/report/550d6f94d052dab9f2a8e589/photo/Report.jpg,,76-80 Dartmouth St  Boston  MA  02116,4.0,1C,2.0,D4,South End,6.0,Ward 4,401.0,RC,76-80 Dartmouth St,2116.0,Address,46539.0,42.3452,-71.075,City Worker App,"(42.3452, -71.075)"
538466,101001339787,03/23/2015 12:54:00 PM,,05/12/2015 12:54:37 PM,ONTIME,Closed,Case Closed. Closed date : 2015-05-12 12:54:37.973 Case Noted GSA 9788 Union Construction-Not BWSC,Utility Casting Repair,Public Works Department,Highway Maintenance,Utility Casting Repair,BWSC_All Cases,BWSC,https://cityworker.cityofboston.gov:8443/attachments/report/5510454ad052dab9f2a8fa91/photo/Report.jpg,,28 Bicknell St  Dorchester  MA  02121,7.0,03,4.0,B3,Greater Mattapan,8.0,Ward 14,1407.0,R2,28 Bicknell St,2121.0,Address,15309.0,42.2973,-71.0829,City Worker App,"(42.2973, -71.0829)"
539439,101001341090,03/24/2015 05:49:56 PM,,03/26/2015 07:53:55 AM,ONTIME,Closed,Case Closed Case Resolved The Construction Inspection Unit Inspector went to this location on March 25th and the repair had been made.,Utility Casting Repair,Public Works Department,Highway Maintenance,Utility Casting Repair,PWDx_Utility Casting Repair,PWDx,https://cityworker.cityofboston.gov:8443/attachments/report/5511dc0270b47681496ad6b9/photo/Report.jpg,,1191 Boylston St  Boston  MA  02215,4.0,10A,8.0,D4,Fenway / Kenmore / Audubon Circle / Longwood,14.0,Ward 5,502.0,A,1191 Boylston St,2215.0,Address,18067.0,42.3462,-71.0942,City Worker App,"(42.3462, -71.0942)"
539441,101001341092,03/24/2015 05:52:24 PM,,03/26/2015 07:52:59 AM,ONTIME,Closed,Case Closed Case Resolved As of March 25th  this has been patched.,Utility Casting Repair,Public Works Department,Highway Maintenance,Utility Casting Repair,PWDx_Utility Casting Repair,PWDx,https://cityworker.cityofboston.gov:8443/attachments/report/5511dc9570b47681496ad6d4/photo/Report.jpg,,176 Ipswich St  Boston  MA  02215,4.0,10A,8.0,D4,Fenway / Kenmore / Audubon Circle / Longwood,14.0,Ward 5,502.0,E,176 Ipswich St,2215.0,Address,78837.0,42.3465,-71.0946,City Worker App,"(42.3465, -71.0946)"
540057,101001341889,03/25/2015 02:04:15 PM,,03/25/2015 02:20:26 PM,ONTIME,Closed,Case Closed Case Resolved The casting in question belongs to National Grid.    National Grid has been notified to make the necessary repairs.    This location has been added to our casting repair location.    The CIU will monitor the situation.,Utility Casting Repair,Public Works Department,Highway Maintenance,Utility Casting Repair,PWDx_Utility Casting Repair,PWDx,https://cityworker.cityofboston.gov:8443/attachments/report/5512f89e70b47681496af347/photo/Report.jpg,,INTERSECTION of Levant St & Tebroc St  Dorchester  MA,7.0,03,4.0,C11,Dorchester,8.0,Ward 15,1505.0,,INTERSECTION Levant St & Tebroc St,,Intersection,6841.0,42.3033,-71.0699,City Worker App,"(42.3033, -71.0699)"
540059,101001341892,03/25/2015 02:06:06 PM,,03/25/2015 02:20:02 PM,ONTIME,Closed,Case Closed Case Resolved The casting in question belongs to National Grid.    National Grid has been notified to make the necessary repairs.    This location has been added to our casting repair location.    The CIU will monitor the situation.,Utility Casting Repair,Public Works Department,Highway Maintenance,Utility Casting Repair,PWDx_Utility Casting Repair,PWDx,https://cityworker.cityofboston.gov:8443/attachments/report/5512f90c70b47681496af358/photo/Report.jpg,,23 Levant St  Dorchester  MA  02122,7.0,03,4.0,C11,Dorchester,8.0,Ward 15,1505.0,R3,23 Levant St,2122.0,Address,263769.0,42.3033,-71.0692,City Worker App,"(42.3033, -71.0692)"
540589,101001342681,03/26/2015 12:49:20 PM,,03/30/2015 10:49:22 AM,ONTIME,Closed,Case Closed Case Noted CORRECT LOCATION  9 SCOTTFIELD RD M/H DOES NOT BELONG TO BWSC 3/27,Utility Casting Repair,Public Works Department,Highway Maintenance,Utility Casting Repair,BWSC_All Cases,BWSC,https://cityworker.cityofboston.gov:8443/attachments/report/5514388f70b47681496b01b0/photo/Report.jpg,,1368 Commonwealth Ave  Allston  MA  02134,11.0,04,9.0,D14,Allston / Brighton,15.0,Ward 21,2108.0,A,1368 Commonwealth Ave,2134.0,Address,37437.0,42.3478,-71.137,City Worker App,"(42.3478, -71.137)"
540591,101001342683,03/26/2015 12:50:17 PM,,03/26/2015 01:06:31 PM,ONTIME,Closed,Case Closed Case Resolved  Duplicate,Utility Casting Repair,Public Works Department,Highway Maintenance,Utility Casting Repair,PWDx_Utility Casting Repair,PWDx,https://cityworker.cityofboston.gov:8443/attachments/report/551438c570b47681496b01c1/photo/Report.jpg,,1368 Commonwealth Ave  Allston  MA  02134,11.0,04,9.0,D14,Allston / Brighton,15.0,Ward 21,2108.0,A,1368 Commonwealth Ave,2134.0,Address,37437.0,42.3478,-71.137,City Worker App,"(42.3478, -71.137)"
540594,101001342686,03/26/2015 12:51:15 PM,,03/26/2015 01:06:31 PM,ONTIME,Closed,Case Closed Case Resolved  Duplicate,Utility Casting Repair,Public Works Department,Highway Maintenance,Utility Casting Repair,PWDx_Utility Casting Repair,PWDx,https://cityworker.cityofboston.gov:8443/attachments/report/5514390070b47681496b01e6/photo/Report.jpg,,1368 Commonwealth Ave  Allston  MA  02134,11.0,04,9.0,D14,Allston / Brighton,15.0,Ward 21,2108.0,A,1368 Commonwealth Ave,2134.0,Address,37437.0,42.3478,-71.137,City Worker App,"(42.3478, -71.137)"
540602,101001342695,03/26/2015 12:55:56 PM,,03/26/2015 01:11:30 PM,ONTIME,Closed,Case Closed Case Resolved Duplicate of Existing case.    Sent to BWSC to repair.,Utility Casting Repair,Public Works Department,Highway Maintenance,Utility Casting Repair,PWDx_Utility Casting Repair,PWDx,https://cityworker.cityofboston.gov:8443/attachments/report/55143a1b70b47681496b0226/photo/Report.jpg,,1368 Commonwealth Ave  Allston  MA  02134,11.0,04,9.0,D14,Allston / Brighton,15.0,Ward 21,2108.0,A,1368 Commonwealth Ave,2134.0,Address,37437.0,42.3478,-71.137,City Worker App,"(42.3478, -71.137)"
542764,101001345761,03/31/2015 10:58:17 AM,,04/01/2015 09:02:13 AM,ONTIME,Closed,Case Closed Case Resolved National Grid has been notified to repair the sunken casting  within 5 business days.      The CIU has entered into the database that is tracking eroded castings and sunken patches that  need patching after the snow storms.    The CIU will monitor the progress of the repair.    Sincerely      Mark Cardarelli  Supervisor of Utility Coordination and Compliance  Boston Public Works Department  617-635-4951 Office,Utility Casting Repair,Public Works Department,Highway Maintenance,Utility Casting Repair,PWDx_Utility Casting Repair,PWDx,https://cityworker.cityofboston.gov:8443/attachments/report/551ab60370b47681496b38b6/photo/Report.jpg,,435 E Third St  South Boston  MA  02127,6.0,05,2.0,C6,South Boston / South Boston Waterfront,5.0,Ward 6,604.0,R1,435 E Third St,2127.0,Address,134906.0,42.3362,-71.0428,City Worker App,"(42.3362, -71.0428)"
543618,101001346923,04/01/2015 12:47:20 PM,,04/03/2015 08:09:55 AM,ONTIME,Closed,Case Closed Case Resolved BWSC has been notified that they must repair the casting cover immediately.     The CIU will monitor the progress of the repair.    Sincerely     Mark Cardarelli  Supervisor of Utility Coordination and Compliance  Boston Public Works Department  617-635-4951 Office  617-438-8517 Cell,Utility Casting Repair,Public Works Department,Highway Maintenance,Utility Casting Repair,PWDx_Utility Casting Repair,PWDx,https://cityworker.cityofboston.gov:8443/attachments/report/551c211370b47681496b4c66/photo/Report.jpg,,106 Walworth St  Roslindale  MA  02131,12.0,06,5.0,E5,Roslindale,10.0,Ward 20,2002.0,R2,106 Walworth St,2131.0,Address,142578.0,42.2837,-71.1372,City Worker App,"(42.2837, -71.1372)"
552887,101001359833,04/19/2015 04:45:52 PM,,07/30/2015 03:04:27 PM,ONTIME,Closed,Case Closed. Closed date : 2015-07-30 15:04:27.47 Case Resolved Roadway pull box is sinking. HWY Dept came by and put asphalt around it. Will notify supervisor that it needs to be properly brought up to grade.  EP 7-30-15,PRINTED,Public Works Department,Highway Maintenance,Utility Casting Repair,PWDx_Street Light_General Lighting Request,PWDx,https://cityworker.cityofboston.gov:8443/attachments/report/553413fd70b47681496c0eb2/photo/Report.jpg,,INTERSECTION of Shawmut Ave & W Springfield St  Roxbury  MA,4.0,1C,7.0,D4,South End,6.0,Ward 9,902.0,,INTERSECTION Shawmut Ave & W Springfield St,,Intersection,8347.0,42.3378,-71.0773,City Worker App,"(42.3378, -71.0773)"
553253,101001360311,04/21/2015 08:34:03 AM,,04/21/2015 08:34:06 AM,ONTIME,Closed,Case Closed Case Resolved Marked completed at case creation,Utility Casting Repair,Public Works Department,Highway Maintenance,Utility Casting Repair,PWDx_Utility Casting Repair,PWDx,https://cityworker.cityofboston.gov:8443/attachments/report/553643b770b4ba4e84f49dd7/photo/Report.jpg,,193 Manthorne Rd  West Roxbury  MA  02132,9.0,06,6.0,E5,West Roxbury,12.0,Ward 20,2019.0,R1,193 Manthorne Rd,2132.0,Address,89121.0,42.2936,-71.1547,City Worker App,"(42.2936, -71.1547)"
557988,101001366912,04/30/2015 01:22:08 AM,,05/13/2015 08:29:47 AM,ONTIME,Closed,Case Closed. Closed date : 2015-05-13 08:29:47.74 Case Resolved CLEANED CB 5/11,Utility Casting Repair,Public Works Department,Highway Maintenance,Utility Casting Repair,BWSC_All Cases,BWSC,https://cityworker.cityofboston.gov:8443/attachments/report/5541bbfbd0526762dacdfd36/photo/Report.jpg,,53 Exchange Pl  Boston  MA  02109,3.0,1C,1.0,A1,Downtown / Financial District,3.0,Ward 3,306.0,C,53 Exchange Pl,2109.0,Address,232182.0,42.3583,-71.0561,City Worker App,"(42.3583, -71.0561)"
558105,101001367080,04/30/2015 09:41:03 AM,,05/06/2015 12:58:25 PM,ONTIME,Closed,Case Closed. Closed date : 2015-05-06 12:58:25.763 Case Resolved CB REPAIRED 5/4,Utility Casting Repair,Public Works Department,Highway Maintenance,Utility Casting Repair,BWSC_All Cases,BWSC,https://cityworker.cityofboston.gov:8443/attachments/report/554230ecd0526762dace016b/photo/Report.jpg,,INTERSECTION of Canterbury St & Mount Calvary Rd  Roslindale  MA,12.0,02,5.0,E18,Roslindale,10.0,Ward 18,1807.0,,INTERSECTION Canterbury St & Mount Calvary Rd,,Intersection,2414.0,42.2812,-71.1139,City Worker App,"(42.2812, -71.1139)"
560459,101001370617,05/05/2015 01:50:10 PM,,05/07/2015 08:59:26 AM,ONTIME,Closed,Case Closed. Closed date : 2015-05-07 08:59:26.937 Case Resolved Dear Constituent     The Boston Public Works Department Construction Inspection Unit (CIU) has identified the casting needing repair as belonging to Eversource..    Eversource has been notified to repair the casting within 14 days.    The location has been entered into the CIU data base that tracks repairs to be made by utility companies or private contractors.    The CIU will monitor the progress of the repair.    Sincerely     Mark Cardarelli  Supervisor of Utility Coordination and Compliance  Boston Public Works Department  617-635-4951 Office,Utility Casting Repair,Public Works Department,Highway Maintenance,Utility Casting Repair,PWDx_Utility Casting Repair,PWDx,https://cityworker.cityofboston.gov:8443/attachments/report/554902d9d0526762dace2faa/photo/Report.jpg,,660 Saratoga St  East Boston  MA  02128,1.0,09,1.0,A7,East Boston,1.0,Ward 1,111.0,R4,660 Saratoga St,2128.0,Address,122743.0,42.3825,-71.021,City Worker App,"(42.3825, -71.021)"
561804,101001372617,05/07/2015 01:03:19 PM,,05/08/2015 08:22:46 AM,ONTIME,Closed,Case Closed. Closed date : 2015-05-08 08:22:46.253 Case Resolved Dear Constituent      The Boston Public Works Department Construction Inspection Unit (CIU) has identified the casting cover needing replacement as belonging to National Grid.    National Grid has been notified to replace the cover within 7 days.    The location has been entered into the CIU data base that tracks repairs to be made by utility companies or private contractors.    The CIU will monitor the progress of the repair.     Sincerely     Mark Cardarelli  Supervisor of Utility Coordination and Compliance  Boston Public Works Department  617-635-4951 Office,Utility Casting Repair,Public Works Department,Highway Maintenance,Utility Casting Repair,PWDx_Utility Casting Repair,PWDx,https://cityworker.cityofboston.gov:8443/attachments/report/554b9ad5d0526762dace4746/photo/Report.jpg,,83-85 Cresthill Rd  Brighton  MA  02135,11.0,04,9.0,D14,Allston / Brighton,15.0,Ward 22,2211.0,R2,83-85 Cresthill Rd,2135.0,Address,44340.0,42.356,-71.1576,City Worker App,"(42.356, -71.1576)"
566651,101001379750,05/18/2015 12:01:00 PM,,05/21/2015 10:04:27 AM,ONTIME,Closed,Case Closed. Closed date : 2015-05-21 10:04:27.863 Case Resolved Contractor repaired CB 5/18,Utility Casting Repair,Public Works Department,Highway Maintenance,Utility Casting Repair,BWSC_All Cases,BWSC,https://cityworker.cityofboston.gov:8443/attachments/report/555a0cf9d05256bfb76ddd8a/photo/Report.jpg,,272 Faneuil St  Brighton  MA  02135,11.0,04,9.0,D14,Allston / Brighton,15.0,Ward 22,2210.0,R2,272 Faneuil St,2135.0,Address,56200.0,42.3524,-71.1613,City Worker App,"(42.3524, -71.1613)"
568783,101001382975,05/22/2015 08:41:00 AM,,06/09/2015 06:36:08 AM,ONTIME,Closed,Case Closed. Closed date : 2015-06-09 06:36:08.603 Case Noted,Utility Casting Repair,Public Works Department,Highway Maintenance,Utility Casting Repair,PWDx_Highway Construction,PWDx,https://cityworker.cityofboston.gov:8443/attachments/report/555f23f8d05256bfb76e09fc/photo/Report.jpg,,947-949 Dorchester Ave  Dorchester  MA  02125,7.0,03,3.0,C11,Dorchester,7.0,Ward 13,1307.0,RC,947-949 Dorchester Ave,2125.0,Address,48788.0,42.3186,-71.0569,City Worker App,"(42.3186, -71.0569)"
568802,101001383000,05/22/2015 08:55:00 AM,,10/14/2015 01:39:15 PM,ONTIME,Closed,Case Closed. Closed date : 2015-10-14 13:39:15.37 Case Noted A City Engineer has inspected this Street and indicates it meets the criteria for asphalt resurfacing.    The street has been submitted to the utility companies for review and clearance. Pending the clearance process  it will be scheduled for resurfacing within the next two construction seasons.    Any further questions concerning the resurfacing can be directed to the Construction Management Division of Public Works at 617-635-4950.    Sincerely      Kevin Linskey    Senior Civil Engineer    Boston Public Works Department    617-635-4951 Office,Utility Casting Repair,Public Works Department,Highway Maintenance,Utility Casting Repair,PWDx_Roadway Repair,PWDx,https://cityworker.cityofboston.gov:8443/attachments/report/555f2752d05256bfb76e0aa2/photo/Report.jpg,,20-24 Corinth St  Roslindale  MA  02131,12.0,06,5.0,E5,Roslindale,10.0,Ward 20,2002.0,C,20-24 Corinth St,2131.0,Address,42865.0,42.2864,-71.1299,City Worker App,"(42.2864, -71.1299)"
569733,101001394396,05/26/2015 06:55:26 AM,,05/28/2015 08:39:38 AM,ONTIME,Closed,Case Closed. Closed date : 2015-05-28 08:39:38.783 Case Resolved National Grid has been notified to repair the casting within 30 days.    Mark Cardarelli,Utility Casting Repair,Public Works Department,Highway Maintenance,Utility Casting Repair,PWDx_Utility Casting Repair,PWDx,https://cityworker.cityofboston.gov:8443/attachments/report/55645127d05256bfb76e1cb3/photo/Report.jpg,,INTERSECTION of Rand St & Rand Pl  Dorchester  MA,7.0,03,7.0,B2,Roxbury,13.0,Ward 13,1301.0,,INTERSECTION Rand St & Rand Pl,,Intersection,8048.0,42.319,-71.0764,City Worker App,"(42.319, -71.0764)"
570520,101001395486,05/27/2015 07:06:23 AM,,05/30/2015 08:02:42 AM,ONTIME,Closed,Case Closed. Closed date : 2015-05-30 08:02:42.69 Case Resolved The Public Works Construction Inspection Unit (CIU) has identified  the defective cast iron structure as belonging to Eversource Gas.    Eversource Gas has been notified that they must repair the casting within 30 days.    The location has been entered into the CIU data base that tracks repairs to be made by utility companies or private contractors.    The CIU will monitor the progress of the repair.    Mark Cardarelli  Supervisor of Utility Coordination and Compliance  Boston Public Works Department  617-635-4951 Office,Utility Casting Repair,Public Works Department,Highway Maintenance,Utility Casting Repair,PWDx_Utility Casting Repair,PWDx,,,INTERSECTION of Heron St & Washington St  Hyde Park  MA,12.0,06,6.0,E18,West Roxbury,10.0,Ward 20,2003.0,,INTERSECTION Heron St & Washington St,,Intersection,5890.0,42.269,-71.1486,City Worker App,"(42.269, -71.1486)"
578658,101001407437,06/11/2015 10:54:00 AM,,10/13/2015 01:05:11 PM,ONTIME,Closed,Case Closed. Closed date : 2015-10-13 13:05:11.99 Case Resolved Repaired catch basin on 6/25.,Utility Casting Repair,Public Works Department,Highway Maintenance,Utility Casting Repair,BWSC_All Cases,BWSC,https://cityworker.cityofboston.gov:8443/attachments/report/5579a130d052b8577926e74f/photo/Report.jpg,,1029 Commonwealth Ave  Boston  MA  02215,11.0,04,9.0,D14,Allston / Brighton,14.0,Ward 21,2103.0,RC,1029 Commonwealth Ave,2215.0,Address,157604.0,42.3522,-71.1217,City Worker App,"(42.3522, -71.1217)"
584136,101001415618,06/23/2015 10:48:00 AM,,07/21/2015 03:32:39 PM,ONTIME,Closed,Case Closed. Closed date : 2015-07-21 15:32:39.56 Case Resolved CB REPAIRED 7/6,Utility Casting Repair,Public Works Department,Highway Maintenance,Utility Casting Repair,BWSC_All Cases,BWSC,https://cityworker.cityofboston.gov:8443/attachments/report/558971ced0528e43ce387c82/photo/Report.jpg,,82-84 Minden St  Jamaica Plain  MA  02130,9.0,10A,6.0,E13,Jamaica Plain,11.0,Ward 10,1006.0,RC,82-84 Minden St,2130.0,Address,95999.0,42.3249,-71.1046,City Worker App,"(42.3249, -71.1046)"
590151,101001424268,07/07/2015 09:12:51 AM,,07/07/2015 06:12:42 PM,ONTIME,Closed,Case Closed. Closed date : 2015-07-07 18:12:42.08 Case Resolved Dear Constituent     The Public Works Construction Inspection Unit (CIU) has identified  the defective cast iron structure as belonging to National Grid.    National Grid has been notified that they must repair the casting within 1  week.    The location has been entered into the CIU data base that tracks repairs to be made by utility companies or private contractors.    The CIU will monitor the progress of the repair.    If you have any questions or concerns  please don't hesitate on calling me or my staff  at the number listed below.    Sincerely       Mark Cardarelli  Supervisor of Utility Coordination and Compliance  Boston Public Works Department  617-635-4951 Office,Utility Casting Repair,Public Works Department,Highway Maintenance,Utility Casting Repair,PWDx_Utility Casting Repair,PWDx,https://cityworker.cityofboston.gov:8443/attachments/report/559bd072d0528e43ce38f3b5/photo/Report.jpg,,INTERSECTION of Dorchester Ave & Lonsdale St  Dorchester  MA,8.0,07,3.0,C11,Dorchester,7.0,Ward 16,1604.0,,INTERSECTION Dorchester Ave & Lonsdale St,,Intersection,4131.0,42.2899,-71.0631,City Worker App,"(42.2899, -71.0631)"
590813,101001425182,07/08/2015 10:07:10 AM,,07/13/2015 09:58:05 AM,ONTIME,Closed,Case Closed. Closed date : 2015-07-13 09:58:05.647 Case Resolved Dear Constituent     The Public Works Construction Inspection Unit (CIU) has identified  the defective cast iron structure as belonging to National Grid.    National Grid has been notified that they must repair the casting within 2 weeks.    The location has been entered into the CIU data base that tracks repairs to be made by utility companies or private contractors.    The CIU will monitor the progress of the repair.    If you have any questions or concerns  please don't hesitate on calling me or my staff  at the number listed below.       Sincerely      Mark Cardarelli  Supervisor of Utility Coordination and Compliance  Boston Public Works Department  617-635-4951 Office,Utility Casting Repair,Public Works Department,Highway Maintenance,Utility Casting Repair,PWDx_Utility Casting Repair,PWDx,https://cityworker.cityofboston.gov:8443/attachments/report/559d2eaed0528e43ce3902a9/photo/Report.jpg,,INTERSECTION of Dorchester Ave & Lincoln St  Dorchester  MA,7.0,07,3.0,C11,Dorchester,7.0,Ward 16,1601.0,,INTERSECTION Dorchester Ave & Lincoln St,,Intersection,4142.0,42.2998,-71.0603,City Worker App,"(42.2998, -71.0603)"
593606,101001429020,07/14/2015 11:14:00 AM,,,ONTIME,Open,,Utility Casting Repair,Public Works Department,Highway Maintenance,Utility Casting Repair,PWDx_Street Light Outages - Long-Term Repair,PWDx,https://cityworker.cityofboston.gov:8443/attachments/report/55a5278dd052d9589a755b8a/photo/Report.jpg,,21 N Bennet St  Boston  MA  02113,3.0,1B,1.0,A1,Downtown / Financial District,3.0,Ward 3,303.0,CM,21 N Bennet St,2113.0,Address,14348.0,42.3653,-71.054,City Worker App,"(42.3653, -71.054)"
593607,101001429022,07/14/2015 11:15:54 AM,,07/14/2015 11:15:56 AM,ONTIME,Closed,Case Closed. Closed date : 2015-07-14 11:15:56.357 Case Resolved Marked completed at case creation,Utility Casting Repair,Public Works Department,Highway Maintenance,Utility Casting Repair,PWDx_Utility Casting Repair,PWDx,https://cityworker.cityofboston.gov:8443/attachments/report/55a527ddd052d9589a755bb5/photo/Report.jpg,,21 N Bennet St  Boston  MA  02113,3.0,1B,1.0,A1,Downtown / Financial District,3.0,Ward 3,303.0,CM,21 N Bennet St,2113.0,Address,14348.0,42.3653,-71.054,City Worker App,"(42.3653, -71.054)"
593735,101001429179,07/14/2015 12:53:00 PM,,,ONTIME,Open,,Utility Casting Repair,Public Works Department,Highway Maintenance,Utility Casting Repair,INFO01_GenericeFormforOtherServiceRequestTypes,INFO,https://cityworker.cityofboston.gov:8443/attachments/report/55a53e9cd052d9589a755e4a/photo/Report.jpg,,INTERSECTION of N Beacon St & Goodenough St  Brighton  MA,11.0,04,9.0,D14,Allston / Brighton,15.0,Ward 22,2212.0,,INTERSECTION N Beacon St & Goodenough St,,Intersection,1128.0,42.3574,-71.1537,City Worker App,"(42.3574, -71.1537)"
593747,101001429190,07/14/2015 01:01:36 PM,,07/17/2015 09:14:20 AM,ONTIME,Closed,Case Closed. Closed date : 2015-07-17 09:14:20.4 Case Resolved This CRM is a duplicate of 429201    PWD will make sure that the casting gets repaired.    For any questions or concerns  please contact the number listed below    Sincerely          Mark Cardarelli  Supervisor of Utility Coordination and Compliance  Boston Public Works Department  617-635-4951 Office,Utility Casting Repair,Public Works Department,Highway Maintenance,Utility Casting Repair,PWDx_Utility Casting Repair,PWDx,https://cityworker.cityofboston.gov:8443/attachments/report/55a5406ad052d9589a755eb4/photo/Report.jpg,,90 Marginal St  East Boston  MA  02128,1.0,09,1.0,A7,East Boston,1.0,Ward 1,103.0,R3,90 Marginal St,2128.0,Address,89820.0,42.3663,-71.0379,City Worker App,"(42.3663, -71.0379)"
593755,101001429201,07/14/2015 01:08:31 PM,,07/18/2015 07:34:46 AM,ONTIME,Closed,Case Closed. Closed date : 2015-07-18 07:34:46.373 Case Resolved Dear Constituent     The Public Works Construction Inspection Unit (CIU) has identified  the defective cast iron structure as belonging to BWSC.    BWSC has been notified that they must repair the casting within 30 days.    The location has been entered into the CIU data base that tracks repairs to be made by utility companies or private contractors.    The CIU will monitor the progress of the repair.    If you have any questions or concerns  please don't hesitate on calling me or my staff  at the number listed below.      Sincerely      Mark Cardarelli  Supervisor of Utility Coordination and Compliance  Boston Public Works Department  617-635-4951 Office,Utility Casting Repair,Public Works Department,Highway Maintenance,Utility Casting Repair,PWDx_Utility Casting Repair,PWDx,https://cityworker.cityofboston.gov:8443/attachments/report/55a5420ad052d9589a755f0a/photo/Report.jpg,,110 Marginal St  East Boston  MA  02128,1.0,09,1.0,A7,East Boston,1.0,Ward 1,103.0,R3,110 Marginal St,2128.0,Address,89786.0,42.366,-71.037,City Worker App,"(42.366, -71.037)"
595129,101001430998,07/16/2015 12:58:40 PM,,07/17/2015 09:04:32 AM,ONTIME,Closed,Case Closed. Closed date : 2015-07-17 09:04:32.187 Case Resolved       Dear Constituent          The Boston Public Works Construction Inspection Unit (CIU) Inspector investigated and determined the following:     The BWSC casting in question   does not require a cover.    This is a water shut off.    This is a standard good working order shut off valve    Sincerely      Mark Cardarelli  Supervisor of Utility Coordination and Compliance  Boston Public Works Department  617-635-4951 Office,Utility Casting Repair,Public Works Department,Highway Maintenance,Utility Casting Repair,PWDx_Utility Casting Repair,PWDx,https://cityworker.cityofboston.gov:8443/attachments/report/55a7e2bdd052140999151f23/photo/Report.jpg,,15 Landor Rd  Mattapan  MA  02126,8.0,07,4.0,B3,Greater Mattapan,9.0,Ward 14,1405.0,R1,15 Landor Rd,2126.0,Address,83818.0,42.283,-71.0906,City Worker App,"(42.283, -71.0906)"
596876,101001433331,07/20/2015 01:58:00 PM,,09/14/2015 07:57:37 AM,ONTIME,Closed,Case Closed. Closed date : 2015-09-14 07:57:37.647 Case Resolved A City inspector has reported that this roadway has recently been resurfaced.,Utility Casting Repair,Public Works Department,Highway Maintenance,Utility Casting Repair,PWDx_Roadway Repair,PWDx,,,INTERSECTION of Cerdan Ave & Glenburnie Rd  Roslindale  MA,9.0,06,6.0,E5,West Roxbury,12.0,Ward 20,2006.0,,INTERSECTION Cerdan Ave & Glenburnie Rd,,Intersection,2736.0,42.2919,-71.1419,City Worker App,"(42.2919, -71.1419)"
597246,101001433834,07/21/2015 09:18:00 AM,,08/10/2015 10:57:29 AM,ONTIME,Closed,Case Closed. Closed date : 2015-08-10 10:57:29.25 Case Resolved Patch work done on 8/6.,Utility Casting Repair,Public Works Department,Highway Maintenance,Utility Casting Repair,BWSC_All Cases,BWSC,https://cityworker.cityofboston.gov:8443/attachments/report/55ae46b3d052140999154d8d/photo/Report.jpg,,INTERSECTION of Fulton St & Richmond St  Boston  MA,3.0,1B,1.0,A1,Downtown / Financial District,3.0,Ward 3,301.0,,INTERSECTION Fulton St & Richmond St,,Intersection,5147.0,42.3624,-71.0532,City Worker App,"(42.3624, -71.0532)"
597381,101001433994,07/21/2015 10:38:05 AM,,07/25/2015 08:51:27 AM,ONTIME,Closed,Case Closed. Closed date : 2015-07-25 08:51:27.03 Case Resolved Dear Constituent     The Public Works Construction Inspection Unit (CIU) has identified  the defective cast iron structure as belonging to the MBTA    MBTA has been notified that they must repair the casting within 2 weeks.    The location has been entered into the CIU data base that tracks repairs to be made by utility companies or private contractors.    The CIU will monitor the progress of the repair.    If you have any questions or concerns  please don't hesitate on calling me or my staff  at the number listed below.      Sincerely      Mark Cardarelli  Supervisor of Utility Coordination and Compliance  Boston Public Works Department  617-635-4951 Office,Utility Casting Repair,Public Works Department,Highway Maintenance,Utility Casting Repair,PWDx_Utility Casting Repair,PWDx,https://cityworker.cityofboston.gov:8443/attachments/report/55ae5958d05214099915510c/photo/Report.jpg,,INTERSECTION of Albany St & W Fourth St  Roxbury  MA,4.0,1C,2.0,D4,South Boston / South Boston Waterfront,4.0,Ward 3,308.0,,INTERSECTION Albany St & W Fourth St,,Intersection,215.0,42.343,-71.0625,City Worker App,"(42.343, -71.0625)"
602510,101001500995,07/31/2015 02:00:06 PM,,08/12/2015 09:24:45 AM,ONTIME,Closed,Case Closed. Closed date : 2015-08-12 09:24:45.087 Case Resolved Dear Constituent     The Boston Public Works Construction Inspection Unit (CIU) Inspector states that as of Tuesday Aug 11th the cover has been replaced.    For any questions or concerns  please contact the number listed below    Sincerely     Mark Cardarelli  Supervisor of Utility Coordination and Compliance  Boston Public Works Department  617-635-4951 Office,Utility Casting Repair,Public Works Department,Highway Maintenance,Utility Casting Repair,PWDx_Utility Casting Repair,PWDx,https://cityworker.cityofboston.gov:8443/attachments/report/55bbb7cad05214099915c61b/photo/Report.jpg,,27 Wilcock St  Dorchester  MA  02124,8.0,07,4.0,B3,Greater Mattapan,9.0,Ward 14,1411.0,RL,27 Wilcock St,2124.0,Address,149668.0,42.287,-71.0921,City Worker App,"(42.287, -71.0921)"
603809,101001502818,08/04/2015 09:40:27 AM,,08/05/2015 09:05:55 AM,ONTIME,Closed,Case Closed. Closed date : 2015-08-05 09:05:55.643 Case Resolved Dear Constituent     The Public Works Construction Inspection Unit (CIU) has identified  the defective cast iron structure as belonging to Comcast.    Comcast has been notified that they must repair the casting within 2 weeks.    The location has been entered into the CIU data base that tracks repairs to be made by utility companies or private contractors.    The CIU will monitor the progress of the repair.    If you have any questions or concerns  please don't hesitate on calling me or my staff  at the number listed below.      Sincerely      Mark Cardarelli  Supervisor of Utility Coordination and Compliance  Boston Public Works Department  617-635-4951 Office,Utility Casting Repair,Public Works Department,Highway Maintenance,Utility Casting Repair,PWDx_Utility Casting Repair,PWDx,https://cityworker.cityofboston.gov:8443/attachments/report/55c0c0fbd05214099915e327/photo/Report.jpg,,9-13 North Sq  Boston  MA  02113,3.0,1B,1.0,A1,Downtown / Financial District,3.0,Ward 3,303.0,E,9-13 North Sq,2113.0,Address,103521.0,42.3639,-71.0536,City Worker App,"(42.3639, -71.0536)"
603817,101001502827,08/04/2015 09:45:47 AM,,08/05/2015 09:02:31 AM,ONTIME,Closed,Case Closed. Closed date : 2015-08-05 09:02:31.797 Case Resolved Dear Constituent     The Public Works Construction Inspection Unit (CIU) has identified  the defective cast iron structure as belonging to Comcast.    Comcast has been notified that they must repair the casting within 2 weeks.    The location has been entered into the CIU data base that tracks repairs to be made by utility companies or private contractors.    The CIU will monitor the progress of the repair.    If you have any questions or concerns  please don't hesitate on calling me or my staff  at the number listed below.      Sincerely      Mark Cardarelli  Supervisor of Utility Coordination and Compliance  Boston Public Works Department  617-635-4951 Office,Utility Casting Repair,Public Works Department,Highway Maintenance,Utility Casting Repair,PWDx_Utility Casting Repair,PWDx,https://cityworker.cityofboston.gov:8443/attachments/report/55c0c239d05214099915e348/photo/Report.jpg,,60-62 Woodrow Ave  Dorchester  MA  02124,8.0,07,4.0,B3,Greater Mattapan,9.0,Ward 14,1410.0,RL,60-62 Woodrow Ave,2124.0,Address,151906.0,42.2878,-71.0806,City Worker App,"(42.2878, -71.0806)"
603848,101001502867,08/04/2015 10:05:00 AM,,08/13/2015 04:29:01 PM,ONTIME,Closed,Case Closed. Closed date : 2015-08-13 16:29:01.557 Case Resolved CATCH BASIN REPAIRED 8/5/15,Utility Casting Repair,Public Works Department,Highway Maintenance,Utility Casting Repair,BWSC_All Cases,BWSC,https://cityworker.cityofboston.gov:8443/attachments/report/55c0c6d4d05214099915e494/photo/Report.jpg,,INTERSECTION of Morton St & Woodgate St  Dorchester  MA,8.0,07,3.0,B3,Greater Mattapan,7.0,Ward 17,1712.0,,INTERSECTION Morton St & Woodgate St,,Intersection,7417.0,42.2777,-71.0783,City Worker App,"(42.2777, -71.0783)"
603862,101001502884,08/04/2015 10:15:53 AM,,08/06/2015 09:44:23 AM,ONTIME,Closed,Case Closed. Closed date : 2015-08-06 09:44:23.47 Case Resolved The Public Works Construction Inspection Unit (CIU) has identified  the defective cast iron structure as belonging to BWSC.    BWSC has been notified that they must repair the casting within 14 days.    The location has been entered into the CIU data base that tracks repairs to be made by utility companies or private contractors.    The CIU will monitor the progress of the repair.    Mark Cardarelli  Supervisor of Utility Coordination and Compliance  Boston Public Works Department  617-635-4951 Office,Utility Casting Repair,Public Works Department,Highway Maintenance,Utility Casting Repair,PWDx_Utility Casting Repair,PWDx,https://cityworker.cityofboston.gov:8443/attachments/report/55c0c949d05214099915e518/photo/Report.jpg,,105 Water St  Charlestown  MA  02129,3.0,1A,1.0,A15,Charlestown,2.0,02,201.0,E,105 Water St,2129.0,Address,171354.0,42.372,-71.0589,City Worker App,"(42.372, -71.0589)"
604761,101001504080,08/05/2015 11:51:25 AM,,08/06/2015 09:45:08 AM,ONTIME,Closed,Case Closed. Closed date : 2015-08-06 09:45:08.19 Case Resolved The Public Works Construction Inspection Unit (CIU) has identified  the defective cast iron structure as belonging to BWSC.    BWSC has been notified that they must repair the casting within 30 days.    The location has been entered into the CIU data base that tracks repairs to be made by utility companies or private contractors.    The CIU will monitor the progress of the repair.    Mark Cardarelli  Supervisor of Utility Coordination and Compliance  Boston Public Works Department  617-635-4951 Office,Utility Casting Repair,Public Works Department,Highway Maintenance,Utility Casting Repair,PWDx_Utility Casting Repair,PWDx,https://cityworker.cityofboston.gov:8443/attachments/report/55c2312fd05214099915f8f4/photo/Report.jpg,,29 Bunker Hill St  Charlestown  MA  02129,3.0,1A,1.0,A15,Charlestown,2.0,02,202.0,,29 Bunker Hill St,2129.0,Address,350644.0,42.3594,-71.0587,City Worker App,"(0, 0)"
604805,101001504138,08/05/2015 12:44:49 PM,,08/06/2015 09:44:48 AM,ONTIME,Closed,Case Closed. Closed date : 2015-08-06 09:44:48.78 Case Resolved The Public Works Construction Inspection Unit (CIU) has identified  the defective cast iron structure as belonging to BWSC.    BWSC has been notified that they must repair the casting within 7 days.    The location has been entered into the CIU data base that tracks repairs to be made by utility companies or private contractors.    The CIU will monitor the progress of the repair.    Mark Cardarelli  Supervisor of Utility Coordination and Compliance  Boston Public Works Department  617-635-4951 Office,Utility Casting Repair,Public Works Department,Highway Maintenance,Utility Casting Repair,PWDx_Utility Casting Repair,PWDx,https://cityworker.cityofboston.gov:8443/attachments/report/55c23db4d05214099915fa16/photo/Report.jpg,,15 Bunker Hill St  Charlestown  MA  02129,3.0,1A,1.0,A15,Charlestown,2.0,02,202.0,,15 Bunker Hill St,2129.0,Address,340910.0,42.3796,-71.064,City Worker App,"(42.3796, -71.064)"
605413,101001504924,08/06/2015 11:31:56 AM,,08/08/2015 08:03:13 AM,ONTIME,Closed,Case Closed. Closed date : 2015-08-08 08:03:13.597 Case Resolved Dear Constituent     The Public Works Construction Inspection Unit (CIU) has identified  the defective cast iron structure as belonging to Eversource Electric.    Eversource Electric has been notified that they must repair the casting within 30 days.    The location has been entered into the CIU data base that tracks repairs to be made by utility companies or private contractors.    The CIU will monitor the progress of the repair.    Mark Cardarelli  Supervisor of Utility Coordination and Compliance  Boston Public Works Department  617-635-4951 Office,Utility Casting Repair,Public Works Department,Highway Maintenance,Utility Casting Repair,PWDx_Utility Casting Repair,PWDx,https://cityworker.cityofboston.gov:8443/attachments/report/55c37e23d0521409991609a4/photo/Report.jpg,,81 W Cedar St  Boston  MA  02114,3.0,1B,8.0,A1,Beacon Hill,14.0,Ward 5,504.0,RC,81 W Cedar St,2114.0,Address,202803.0,42.3604,-71.0699,City Worker App,"(42.3604, -71.0699)"
605433,101001504955,08/06/2015 11:55:18 AM,,08/10/2015 08:45:15 AM,ONTIME,Closed,Case Closed. Closed date : 2015-08-10 08:45:15.693 Case Resolved Dear Constituent     The Public Works Construction Inspection Unit (CIU) has identified  a series of defective cast iron structures as belonging to Veolia Energy Co.    Veolia Energy Co has been notified that they must repair the castings within 2 weeks.    The locations have been entered into the CIU data base that tracks repairs to be made by utility companies or private contractors.    The CIU will monitor the progress of the repair.    If you have any questions or concerns  please don't hesitate on calling me or my staff  at the number listed below.      Sincerely      Mark Cardarelli  Supervisor of Utility Coordination and Compliance  Boston Public Works Department  617-635-4951 Office,Utility Casting Repair,Public Works Department,Highway Maintenance,Utility Casting Repair,PWDx_Utility Casting Repair,PWDx,https://cityworker.cityofboston.gov:8443/attachments/report/55c3839cd0521409991609fe/photo/Report.jpg,,INTERSECTION of Saint James Ave & Trinity Pl  Boston  MA,4.0,1C,2.0,D4,Back Bay,6.0,Ward 4,402.0,,INTERSECTION Saint James Ave & Trinity Pl,,Intersection,8245.0,42.3496,-71.0759,City Worker App,"(42.3496, -71.0759)"
605528,101001505076,08/06/2015 02:07:53 PM,,08/10/2015 08:36:57 AM,ONTIME,Closed,Case Closed. Closed date : 2015-08-10 08:36:57.953 Case Resolved Dear Constituent     The picture and the location in the CRM were checked out by the inspector.    There is no defective casting at 1553-1561 Washington St.    Please check your records again and  call the hotline up with the new address.    Sincerely     Mark Cardarelli  Supervisor of Utility Coordination and Compliance  Boston Public Works Department  617-635-4951 Office,Utility Casting Repair,Public Works Department,Highway Maintenance,Utility Casting Repair,PWDx_Utility Casting Repair,PWDx,https://cityworker.cityofboston.gov:8443/attachments/report/55c3a278d052140999160dc7/photo/Report.jpg,,1553-1561 Washington St  Roxbury  MA  02118,4.0,1C,2.0,D4,South End,6.0,Ward 9,901.0,A,1553-1561 Washington St,2118.0,Address,171091.0,42.3389,-71.074,City Worker App,"(42.3389, -71.074)"
605788,101001505445,08/07/2015 07:49:00 AM,,01/11/2016 03:29:33 PM,ONTIME,Closed,Case Closed. Closed date : 2016-01-11 15:29:33.123 Case Resolved This location has been inspected and all repairs appear to have been made.    If you have any further questions  or feel that this case was closed in error  please do not hesitate to contact me.    Michael Somers  Senior Civil Engineer  Construction Management Division  Boston Public Works  617-635-3831  Michael.Somers@Boston.gov,Utility Casting Repair,Public Works Department,Highway Maintenance,Utility Casting Repair,PWDx_Highway Construction,PWDx,https://cityworker.cityofboston.gov:8443/attachments/report/55c49b48d052140999161287/photo/Report.jpg,,21 Worcester Sq  Roxbury  MA  02118,4.0,1C,2.0,D4,South End,6.0,Ward 8,802.0,CD,21 Worcester Sq,2118.0,Address,152224.0,42.3364,-71.0748,City Worker App,"(42.3364, -71.0748)"
605790,101001505446,08/07/2015 07:50:00 AM,,,ONTIME,Open,,Utility Casting Repair,Public Works Department,Highway Maintenance,Utility Casting Repair,PWDx_Sidewalk Repair,PWDx,https://cityworker.cityofboston.gov:8443/attachments/report/55c49b87d052140999161299/photo/Report.jpg,,23 Worcester Sq  Roxbury  MA  02118,4.0,1C,2.0,D4,South End,6.0,Ward 8,802.0,R4,23 Worcester Sq,2118.0,Address,152233.0,42.3363,-71.0747,City Worker App,"(42.3363, -71.0747)"
606126,101001505899,08/07/2015 01:58:47 PM,,08/08/2015 07:41:46 AM,ONTIME,Closed,Case Closed. Closed date : 2015-08-08 07:41:46.903 Case Resolved Dear Constituent     The Public Works Construction Inspection Unit (CIU) has identified  the defective cast iron structure as belonging to National Grid.    National Grid has been notified that they must repair the casting within one week.  .    The location has been entered into the CIU data base that tracks repairs to be made by utility companies or private contractors.    The CIU will monitor the progress of the repair.    Mark Cardarelli  Supervisor of Utility Coordination and Compliance  Boston Public Works Department  617-635-4951 Office,Utility Casting Repair,Public Works Department,Highway Maintenance,Utility Casting Repair,PWDx_Utility Casting Repair,PWDx,https://cityworker.cityofboston.gov:8443/attachments/report/55c4f1d6d052140999161941/photo/Report.jpg,,1756 Dorchester Ave  Dorchester  MA  02124,8.0,07,3.0,C11,Dorchester,7.0,Ward 16,1604.0,RC,1756 Dorchester Ave,2124.0,Address,224881.0,42.2901,-71.0629,City Worker App,"(42.2901, -71.0629)"
612134,101001523786,08/18/2015 08:49:00 AM,,08/20/2015 09:45:02 AM,ONTIME,Closed,Case Closed. Closed date : 2015-08-20 09:45:02.477 Case Noted Area under construction,Utility Casting Repair,Public Works Department,Highway Maintenance,Utility Casting Repair,PWDx_District 1C: Downtown,PWDx,https://cityworker.cityofboston.gov:8443/attachments/report/55d329c4d05203ad74b0757b/photo/Report.jpg,,308-310 Hanover St  Boston  MA  02113,3.0,1B,1.0,A1,Downtown / Financial District,3.0,Ward 3,303.0,RC,308-310 Hanover St,2113.0,Address,165980.0,42.3643,-71.0542,City Worker App,"(42.3643, -71.0542)"
614060,101001526280,08/20/2015 12:42:00 PM,,08/26/2015 09:06:53 AM,ONTIME,Closed,Case Closed. Closed date : 2015-08-26 09:06:53.58 Case Noted REPLACED COVER 8/25,Utility Casting Repair,Public Works Department,Highway Maintenance,Utility Casting Repair,BWSC_All Cases,BWSC,https://cityworker.cityofboston.gov:8443/attachments/report/55d60390d05203ad74b0a894/photo/Report.jpg,,547 Beech St  Roslindale  MA  02131,12.0,06,5.0,E18,Roslindale,10.0,Ward 18,1811.0,R1,547 Beech St,2131.0,Address,13267.0,42.2743,-71.1309,City Worker App,"(42.2743, -71.1309)"
619642,101001543589,08/28/2015 10:25:00 PM,,11/03/2015 02:05:09 PM,ONTIME,Closed,Case Closed. Closed date : 2015-11-03 14:05:09.03 Case Resolved Raodway pullbox brought up to grade. EP. 11/3/15.,Utility Casting Repair EP printed 11-3-15. See 1412201,Public Works Department,Highway Maintenance,Utility Casting Repair,PWDx_Street Light_General Lighting Request,PWDx,https://cityworker.cityofboston.gov:8443/attachments/report/55e1181ad052f8c25f1d6495/photo/Report.jpg,https://cityworker.cityofboston.gov:8443/attachments/report/55e1181ad052f8c25f1d6495/closed_photo/Report.jpg,19-27 Corinth St  Roslindale  MA  02131,12.0,06,5.0,E5,Roslindale,10.0,Ward 20,2002.0,C,19-27 Corinth St,2131.0,Address,42863.0,42.2862,-71.1301,City Worker App,"(42.2862, -71.1301)"
623037,101001548448,09/02/2015 06:06:00 PM,,09/09/2015 03:39:47 PM,ONTIME,Closed,Case Closed. Closed date : 2015-09-09 15:39:47.46 Case Noted BWSC crew patched on 9/9/15.,Utility Casting Repair,Public Works Department,Highway Maintenance,Utility Casting Repair,BWSC_All Cases,BWSC,https://cityworker.cityofboston.gov:8443/attachments/report/55e772cbd052f8c25f1deb73/photo/Report.jpg,,88 E Newton St  Roxbury  MA  02118,4.0,1C,2.0,D4,South End,6.0,Ward 8,802.0,E,88 E Newton St,2118.0,Address,155949.0,42.3369,-71.0709,City Worker App,"(42.3369, -71.0709)"
624188,101001570036,09/04/2015 09:37:00 AM,,09/09/2015 03:39:03 PM,ONTIME,Closed,Case Closed. Closed date : 2015-09-09 15:39:03.357 Case Noted BWSC Crew patched on 9/915.,Utility Casting Repair,Public Works Department,Highway Maintenance,Utility Casting Repair,BWSC_All Cases,BWSC,https://cityworker.cityofboston.gov:8443/attachments/report/55e99ed3d052f8c25f1e0ea2/photo/Report.jpg,,627 Commonwealth Ave  Boston  MA  02215,4.0,10A,8.0,D4,Boston,14.0,05,510.0,RC,627 Commonwealth Ave,2215.0,Address,41174.0,42.3498,-71.1016,City Worker App,"(42.3498, -71.1016)"
625874,101001572425,09/08/2015 12:58:00 PM,,09/16/2015 04:40:48 PM,ONTIME,Closed,Case Closed. Closed date : 2015-09-16 16:40:48.123 Case Noted Crew replaced new style cover 9/15,Utility Casting Repair,Public Works Department,Highway Maintenance,Utility Casting Repair,BWSC_All Cases,BWSC,https://cityworker.cityofboston.gov:8443/attachments/report/55ef13d4d052f8c25f1e42d1/photo/Report.jpg,,29 Fottler Rd  Mattapan  MA  02126,8.0,07,5.0,B3,Greater Mattapan,9.0,Ward 18,1803.0,R1,29 Fottler Rd,2126.0,Address,59729.0,42.2785,-71.0959,City Worker App,"(42.2785, -71.0959)"
626352,101001573110,09/09/2015 07:11:00 AM,,09/18/2015 09:50:40 AM,ONTIME,Closed,Case Closed. Closed date : 2015-09-18 09:50:40.177 Case Noted DUG AND REMOVED HYDRANT   SIDEWALK TO BE RE-BRICKED 9/15,Utility Casting Repair,Public Works Department,Highway Maintenance,Utility Casting Repair,BWSC_All Cases,BWSC,https://cityworker.cityofboston.gov:8443/attachments/report/55f013ced052f8c25f1e4e29/photo/Report.jpg,,8 Ashburton Pl  Boston  MA  02108,3.0,1B,1.0,A1,Boston,3.0,03,306.0,E,8 Ashburton Pl,2108.0,Address,341223.0,42.3589,-71.0618,City Worker App,"(42.3589, -71.0618)"
627058,101001574175,09/09/2015 05:45:00 PM,,,ONTIME,Open,,Utility Casting Repair//printed,Public Works Department,Highway Maintenance,Utility Casting Repair,PWDx_Street Light_General Lighting Request,PWDx,https://cityworker.cityofboston.gov:8443/attachments/report/55f0a86bd052f8c25f1e6346/photo/Report.jpg,,179 Hemenway St  Boston  MA  02115,4.0,10A,8.0,D4,Boston,14.0,4,407.0,,179 Hemenway St,2115.0,Address,342446.0,42.3594,-71.0587,City Worker App,"(0, 0)"
627872,101001575389,09/10/2015 06:25:00 PM,,09/16/2015 04:24:18 PM,ONTIME,Closed,Case Closed. Closed date : 2015-09-16 16:24:18.75 Case Noted Crew replaced missing old style cover 9/15,Utility Casting Repair,Public Works Department,Highway Maintenance,Utility Casting Repair,BWSC_All Cases,BWSC,https://cityworker.cityofboston.gov:8443/attachments/report/55f20364d052f8c25f1e7518/photo/Report.jpg,,101 Spencer St  Dorchester  MA  02124,8.0,07,4.0,B3,Dorchester,9.0,Ward 17,1703.0,RL,101 Spencer St,2124.0,Address,129330.0,42.2935,-71.0762,City Worker App,"(42.2935, -71.0762)"
628248,101001575954,09/11/2015 12:00:00 PM,,09/17/2015 08:52:22 AM,ONTIME,Closed,Case Closed. Closed date : 2015-09-17 08:52:22.933 Case Resolved Dear Constituent     The Boston Public Works Construction Inspection Unit (CIU) Inspector investigated and determined the following:      The CIU Inspector went to the location and could not find a tripping hazard.    Please call Bos311 if this is not the case.    For any questions or concerns  please contact the number listed below    Sincerely     Mark Cardarelli  Supervisor of Utility Coordination and Compliance  Boston Public Works Department  617-635-4951 Office,Utility Casting Repair,Public Works Department,Highway Maintenance,Utility Casting Repair,PWDx_Contractor Complaints,PWDx,https://cityworker.cityofboston.gov:8443/attachments/report/55f2fa8cd052f8c25f1e7ee3/photo/Report.jpg,,53 Chickatawbut St  Dorchester  MA  02122,8.0,07,3.0,C11,Dorchester,7.0,Ward 16,1609.0,R1,53 Chickatawbut St,2122.0,Address,32037.0,42.2862,-71.049,City Worker App,"(42.2862, -71.049)"
629325,101001577452,09/14/2015 08:57:00 AM,,09/24/2015 06:28:37 PM,ONTIME,Closed,Case Closed. Closed date : 2015-09-24 18:28:37.747 Case Noted Hi Chief    Just catching up  The sub base at #62 Wrentham St. was checked by myself on 9/17/15. It is a old base which was for a Fire Box that was put on a telephone down the street. (before my time) We will have our contractor who does our digging remove it asap. Its on the list with a few others.   Thanks Mark M.,Utility Casting Repair,Public Works Department,Highway Maintenance,Utility Casting Repair,INFO01_GenericeFormforOtherServiceRequestTypes,INFO,https://cityworker.cityofboston.gov:8443/attachments/report/55f6c434d052f8c25f1e94eb/photo/Report.jpg,,62 Wrentham St  Dorchester  MA  02124,8.0,07,3.0,C11,Dorchester,7.0,Ward 16,1606.0,CM,62 Wrentham St,2124.0,Address,153014.0,42.2885,-71.0603,City Worker App,"(42.2885, -71.0603)"
631333,101001580265,09/16/2015 12:07:00 PM,,,ONTIME,Open,,Utility Casting Repair,Public Works Department,Highway Maintenance,Utility Casting Repair,PWDx_Street Light_General Lighting Request,PWDx,https://cityworker.cityofboston.gov:8443/attachments/report/55f993e0d052f8c25f1ec14d/photo/Report.jpg,,8 Beacon St  Boston  MA  02108,3.0,1B,1.0,A1,Downtown / Financial District,3.0,Ward 3,306.0,C,8 Beacon St,2108.0,Address,184913.0,42.3582,-71.0616,City Worker App,"(42.3582, -71.0616)"
631425,101001580408,09/16/2015 01:40:00 PM,,,ONTIME,Open,,Utility Casting Repair////printed,Public Works Department,Highway Maintenance,Utility Casting Repair,PWDx_Highway Construction,PWDx,https://cityworker.cityofboston.gov:8443/attachments/report/55f9a997d052f8c25f1ec539/photo/Report.jpg,,587 Park St  Dorchester  MA  02124,8.0,03,4.0,B3,Dorchester,9.0,Ward 17,1701.0,RL,587 Park St,2124.0,Address,107399.0,42.2949,-71.0766,City Worker App,"(42.2949, -71.0766)"
634683,101001585078,09/22/2015 10:48:27 AM,,11/02/2015 09:09:28 AM,ONTIME,Closed,Case Closed. Closed date : 2015-11-02 09:09:28.817 Case Resolved Dear Constituent     The Boston Public Works Construction Inspection Unit (CIU) Inspector investigated and determined the following:    This section of surface road is still under the care and custody of the Central Artery.    I contacted both the central artery and Veolia and informed them of Veolias responsibility to replace the damaged bricks.    The  CIU will monitor the progress of the repair.    For any questions or concerns  please contact the number listed below    Sincerely     Mark Cardarelli  Supervisor of Utility Coordination and Compliance  Boston Public Works Department  617-635-4951 Office,Utility Casting Repair,Public Works Department,Highway Maintenance,Utility Casting Repair,PWDx_Utility Casting Repair,PWDx,https://cityworker.cityofboston.gov:8443/attachments/report/56016a43d052f8c25f1f0f0e/photo/Report.jpg,,INTERSECTION of Central St & Surface Rd  Boston  MA,3.0,1C,1.0,A1,Downtown / Financial District,3.0,Ward 3,306.0,,INTERSECTION Central St & Surface Rd,,Intersection,2603.0,42.3589,-71.0523,City Worker App,"(42.3589, -71.0523)"
637070,101001598541,09/26/2015 08:34:33 AM,,09/30/2015 10:22:42 AM,ONTIME,Closed,Case Closed. Closed date : 2015-09-30 10:22:42.877 Case Resolved Replaced jumbo cover 9/29,Utility Casting Repair,Public Works Department,Highway Maintenance,Utility Casting Repair,BWSC_All Cases,BWSC,https://cityworker.cityofboston.gov:8443/attachments/report/560690dad052f4d9a9fe23be/photo/Report.jpg,,INTERSECTION of Brimmer St & Pinckney St  Boston  MA,3.0,1B,8.0,A1,Back Bay,14.0,Ward 5,511.0,,INTERSECTION Brimmer St & Pinckney St,,Intersection,1959.0,42.3588,-71.0717,City Worker App,"(42.3588, -71.0717)"
640462,101001603466,10/02/2015 10:53:00 AM,,10/09/2015 10:40:44 AM,ONTIME,Closed,Case Closed. Closed date : 2015-10-09 10:40:44.707 Case Resolved FOUND SINKHOLE PATCHED ON ARRIVAL 10/8,Utility Casting Repair,Public Works Department,Highway Maintenance,Utility Casting Repair,BWSC_All Cases,BWSC,https://cityworker.cityofboston.gov:8443/attachments/report/560e9a63d052f4d9a9fe7be2/photo/Report.jpg,,INTERSECTION of Commercial St & Jackson Ave  Boston  MA,3.0,1B,1.0,A1,Downtown / Financial District,3.0,Ward 3,302.0,,INTERSECTION Commercial St & Jackson Ave,,Intersection,3312.0,42.368,-71.0548,City Worker App,"(42.368, -71.0548)"
646514,101001612460,10/15/2015 08:17:00 AM,,,ONTIME,Open,,Utility Casting Repair,Public Works Department,Highway Maintenance,Utility Casting Repair,BWSC_All Cases,BWSC,https://cityworker.cityofboston.gov:8443/attachments/report/561f995bd052f4d9a9ff0889/photo/Report.jpg,,28 Melville Ave  Dorchester  MA  02124,8.0,07,4.0,C11,Dorchester,9.0,Ward 17,1703.0,R1,28 Melville Ave,2124.0,Address,94061.0,42.2945,-71.0684,City Worker App,"(42.2945, -71.0684)"
650360,101001617845,10/22/2015 10:40:38 AM,,10/27/2015 10:26:03 AM,ONTIME,Closed,Case Closed. Closed date : 2015-10-27 10:26:03.373 Case Resolved Dear Constituent     The Boston Public Works Construction Inspection Unit (CIU) Inspector investigated and states that as of October 26th  all repairs have been made.      For any questions or concerns  please contact the number listed below    Sincerely     Mark Cardarelli  Supervisor of Utility Coordination and Compliance  Boston Public Works Department  617-635-4951 Office,Utility Casting Repair,Public Works Department,Highway Maintenance,Utility Casting Repair,PWDx_Utility Casting Repair,PWDx,https://cityworker.cityofboston.gov:8443/attachments/report/5628f56ad052f4d9a9ff6935/photo/Report.jpg,,INTERSECTION of Saint Alphonsus St & Tremont St  Mission Hill  MA,9.0,10A,8.0,B2,Mission Hill,14.0,Ward 10,1002.0,,INTERSECTION Saint Alphonsus St & Tremont St,,Intersection,8235.0,42.333,-71.1013,City Worker App,"(42.333, -71.1013)"
650528,101001618146,10/22/2015 02:06:00 PM,,10/22/2015 02:09:43 PM,ONTIME,Closed,Case Closed. Closed date : 2015-10-22 14:09:43.24 Case Resolved Closed  see photo.,Utility Casting Repair,Public Works Department,Highway Maintenance,Utility Casting Repair,PWDx_Highway Construction,PWDx,,,0 Norway St  Boston  MA  02115,4.0,10A,8.0,D4,Fenway / Kenmore / Audubon Circle / Longwood,14.0,Ward 4,406.0,E,0 Norway St,2115.0,Address,103994.0,42.3447,-71.0876,Employee Generated,"(42.3447, -71.0876)"
650535,101001618161,10/22/2015 02:20:00 PM,,10/22/2015 02:22:15 PM,ONTIME,Closed,Case Closed. Closed date : 2015-10-22 14:22:15.017 Case Resolved Closed  see photo.,Utility Casting Repair,Public Works Department,Highway Maintenance,Utility Casting Repair,PWDx_Highway Construction,PWDx,,,312 Shawmut Ave  Roxbury  MA  02118,4.0,1C,2.0,D4,South End,4.0,03,307.0,,312 Shawmut Ave,2118.0,Address,351885.0,42.3594,-71.0587,Employee Generated,"(0, 0)"
656034,101001626137,11/02/2015 06:06:25 PM,,11/03/2015 08:26:56 AM,ONTIME,Closed,Case Closed. Closed date : 2015-11-03 08:26:56.403 Case Resolved Dear Constituent     The pull box will be repaired by November 15th.    Sincerely      Mark Cardarelli  Supervisor of Utility Coordination and Compliance  Construction Inspection Unit (CIU)  Boston Public Works Department  617-635-4951 Office,Utility Casting Repair,Public Works Department,Highway Maintenance,Utility Casting Repair,PWDx_Utility Casting Repair,PWDx,https://cityworker.cityofboston.gov:8443/attachments/report/5637ec6dd052f4d9a9fff26a/photo/Report.jpg,,INTERSECTION of Hesston Ter & Pleasant St  Dorchester  MA,7.0,03,3.0,C11,Dorchester,7.0,Ward 13,1309,,INTERSECTION Hesston Ter & Pleasant St,,Intersection,5892.0,42.3142,-71.0599,City Worker App,"(42.3142, -71.0599)"
662260,101001635104,11/15/2015 06:57:00 AM,,,ONTIME,Open,,Utility Casting Repair,Public Works Department,Highway Maintenance,Utility Casting Repair,PWDx_Highway Construction General,PWDx,https://cityworker.cityofboston.gov:8443/attachments/report/56487330d052f4d9aa008f8b/photo/Report.jpg,,INTERSECTION of Milford St & Tremont St  Boston  MA,4.0,1C,2.0,D4,South End,4.0,Ward 3,0307,,INTERSECTION Milford St & Tremont St,,Intersection,7296.0,42.3445,-71.0706,City Worker App,"(42.3445, -71.0706)"
666220,101001640796,11/23/2015 08:52:00 AM,,,ONTIME,Open,,Utility Casting Repair//printed,Public Works Department,Highway Maintenance,Utility Casting Repair,PWDx_Street Light_General Lighting Request,PWDx,https://cityworker.cityofboston.gov:8443/attachments/report/56531a1bd052851ecec7743d/photo/Report.jpg,,2 Laban Pratt Rd  Dorchester  MA  02122,8.0,07,3.0,C11,Dorchester,7.0,Ward 16,1607,R2,2 Laban Pratt Rd,2122.0,Address,82960.0,42.2912,-71.0513,City Worker App,"(42.2912, -71.0513)"
667590,101001642954,11/25/2015 01:00:37 PM,,11/30/2015 09:24:47 AM,ONTIME,Closed,Case Closed. Closed date : 2015-11-30 09:24:47.387 Case Resolved Dear Constituent     The Public Works Construction Inspection Unit (CIU) has identified  the defective cast iron structure as belonging to National Grid.    National Grid has been notified that they must repair the casting as soon as possible.    The location has been entered into the CIU data base that tracks repairs to be made by utility companies or private contractors.    The CIU will monitor the progress of the repair.    If you have any questions or concerns  please don't hesitate on calling me or my staff  at the number listed below.      Sincerely      Mark Cardarelli  Supervisor of Utility Coordination and Compliance  Boston Public Works Department  617-635-4951 Office,Utility Casting Repair,Public Works Department,Highway Maintenance,Utility Casting Repair,PWDx_Utility Casting Repair,PWDx,https://cityworker.cityofboston.gov:8443/attachments/report/5655f741d052851ecec79b56/photo/Report.jpg,,1205 Hyde Park Ave  Hyde Park  MA  02136,12.0,08,5.0,E18,Hyde Park,10.0,Ward 18,1813,C,1205 Hyde Park Ave,2136.0,Address,257218.0,42.2578,-71.1238,City Worker App,"(42.2578, -71.1238)"
670090,101001656514,12/02/2015 09:18:34 AM,,12/02/2015 02:27:01 PM,ONTIME,Closed,Case Closed. Closed date : 2015-12-02 14:27:01.463 Case Resolved Closed on W/O 101001655704. 12-2-15,Utility Casting Repair,Public Works Department,Highway Maintenance,Utility Casting Repair,PWDx_Utility Casting Repair,PWDx,https://cityworker.cityofboston.gov:8443/attachments/report/565efdb8d052851ecec7e3e3/photo/Report.jpg,,2 Thane St  Dorchester  MA  02124,8.0,03,4.0,B3,Dorchester,9.0,Ward 17,1701,R3,2 Thane St,2124.0,Address,134657.0,42.295,-71.0759,City Worker App,"(42.295, -71.0759)"
670617,101001657341,12/03/2015 09:11:00 AM,,01/06/2016 02:59:52 PM,ONTIME,Closed,Case Closed. Closed date : 2016-01-06 14:59:52.137 Case Resolved,Utility Casting Repair,Public Works Department,Highway Maintenance,Utility Casting Repair,BTDT_Traffic Signal_Repair,BTDT,https://cityworker.cityofboston.gov:8443/attachments/report/56604d73d052851ecec7f4bc/photo/Report.jpg,,305 Shawmut Ave  Roxbury  MA  02118,4.0,1C,2.0,D4,South End,4.0,03,0307,,305 Shawmut Ave,2118.0,Address,343583.0,42.3425,-71.0703,City Worker App,"(42.3425, -71.0703)"
672232,101001659696,12/07/2015 11:12:35 AM,,12/09/2015 02:28:57 PM,ONTIME,Closed,Case Closed. Closed date : 2015-12-09 14:28:57.883 Case Resolved Dear Constituent     The Construction Inspection Unit Inspector contacted Eversource Electric to have the manhole repaired ASAP.    As of December 9th  the manhole has been repaired.      Sincerely     Mark Cardarelli  Supervisor of Utility Coordination and Compliance  Boston Public Works  Tel 617.635.4951,Utility Casting Repair,Public Works Department,Highway Maintenance,Utility Casting Repair,PWDx_Utility Casting Repair,PWDx,https://cityworker.cityofboston.gov:8443/attachments/report/5665aff2d052851ecec821e5/photo/Report.jpg,,INTERSECTION of Waumbeck St & Humboldt Ave  Dorchester  MA,9.0,10B,7.0,B2,Roxbury,13.0,Ward 12,1209.0,,INTERSECTION Waumbeck St & Humboldt Ave,,Intersection,6140.0,42.3146,-71.0883,City Worker App,"(42.3146, -71.0883)"
673115,101001660900,12/08/2015 01:47:42 PM,,12/10/2015 09:21:21 AM,ONTIME,Closed,Case Closed. Closed date : 2015-12-10 09:21:21.083 Case Resolved Dear Constituent     The Boston Public Works Department Construction Inspection Unit (CIU) has identified the unacceptable patch as belonging to National Grid.    National Grid has been notified to make the necessary repairs ASAP.    The CIU has added the location to its data base that tracks unacceptable utility work.    The CIU will monitor the progress of the work.     The City apologizes for the inconvenience for this necessary work.      Sincerely      Mark Cardarelli  Supervisor of Utility Coordination and Compliance  Boston Public Works Department  617-635-4951 Office,Utility Casting Repair,Public Works Department,Highway Maintenance,Utility Casting Repair,PWDx_Utility Casting Repair,PWDx,https://cityworker.cityofboston.gov:8443/attachments/report/566725ccd052851ecec839d4/photo/Report.jpg,,8 Thetford Ave  Dorchester  MA  02124,8.0,07,4.0,B3,Dorchester,9.0,Ward 17,1707.0,R2,8 Thetford Ave,2124.0,Address,318780.0,42.2862,-71.0791,City Worker App,"(42.2862, -71.0791)"
673385,101001661288,12/09/2015 08:05:00 AM,,,ONTIME,Open,,Utility Casting Repair,Public Works Department,Highway Maintenance,Utility Casting Repair,PWDx_Street Light_General Lighting Request,PWDx,https://cityworker.cityofboston.gov:8443/attachments/report/566826fbd052851ecec84001/photo/Report.jpg,,587 Park St  Dorchester  MA  02124,8.0,03,4.0,B3,Dorchester,9.0,Ward 17,1701.0,RL,587 Park St,2124.0,Address,107399.0,42.2949,-71.0766,City Worker App,"(42.2949, -71.0766)"
677008,101001666581,12/16/2015 09:52:00 AM,,12/18/2015 02:35:25 PM,ONTIME,Closed,Case Closed. Closed date : 2015-12-18 14:35:25.72 Case Noted CREW LOWERED SIDEWALK TOP TO GRADE on 12/18,Utility Casting Repair,Public Works Department,Highway Maintenance,Utility Casting Repair,BWSC_All Cases,BWSC,https://cityworker.cityofboston.gov:8443/attachments/report/56717aaad05237c5e70177f7/photo/Report.jpg,,316 Saratoga St  East Boston  MA  02128,1.0,09,1.0,A7,East Boston,1.0,Ward 1,110.0,R3,316 Saratoga St,2128.0,Address,122606.0,42.3786,-71.0314,City Worker App,"(42.3786, -71.0314)"
681085,101001682897,12/28/2015 01:06:49 PM,,12/31/2015 08:05:52 AM,ONTIME,Closed,Case Closed. Closed date : 2015-12-31 08:05:52.55 Case Resolved Dear Constituent     The Public Works Construction Inspection Unit (CIU) has identified  the defective cast iron structure as belonging to National Grid.    National Grid has been notified that they must repair the casting within 2 weeks.    The location has been entered into the CIU data base that tracks repairs to be made by utility companies or private contractors.    The CIU will monitor the progress of the repair.    If you have any questions or concerns  please don't hesitate on calling me or my staff  at the number listed below.      Sincerely      Mark Cardarelli  Supervisor of Utility Coordination and Compliance  Boston Public Works Department  617-635-4951 Office,Utility Casting Repair,Public Works Department,Highway Maintenance,Utility Casting Repair,PWDx_Utility Casting Repair,PWDx,,,INTERSECTION of Chelsea St & Marion St  East Boston  MA,1.0,09,1.0,A7,East Boston,1.0,Ward 1,105.0,,INTERSECTION Chelsea St & Marion St,,Intersection,2873.0,42.3745,-71.0334,City Worker App,"(42.3745, -71.0334)"
682134,101001684782,12/30/2015 12:54:59 PM,,12/31/2015 12:01:20 PM,ONTIME,Closed,Case Closed. Closed date : 2015-12-31 12:01:20.427 Case Resolved Dear Constituent     The Construction Inspection Unit Inspector (CIU) went to this location today and all manhole covers have been repaired.    Mark Cardarelli  Supervisor of Utility Coordination and Compliance  Boston Public Works  Tel 617.635.4951,Utility Casting Repair,Public Works Department,Highway Maintenance,Utility Casting Repair,PWDx_Utility Casting Repair,PWDx,https://cityworker.cityofboston.gov:8443/attachments/report/56841a7270b48cf7b37d5623/photo/Report.jpg,,INTERSECTION of Quincy St & Quincy Ter  Boston  MA,9.0,10B,7.0,B2,Roxbury,13.0,Ward 12,1206.0,,INTERSECTION Quincy St & Quincy Ter,,Intersection,8034.0,42.3148,-71.0793,City Worker App,"(42.3148, -71.0793)"
